{
  "session_id": "session_01f0ee79-e980-4e81-b025-74e56c5b0238",
  "approval_type": "implementation_plan",
  "timestamp": 1751995000,
  "approval_data": {
    "type": "implementation_plan",
    "timestamp": 1751995000.216871,
    "project_overview": "Develop a simple web application for managing a task list, including features for adding, viewing, updating, and deleting tasks. The application will use React for the frontend, FastAPI for the backend, and PostgreSQL for the database. The project will be deployed to a cloud environment with monitoring and logging implemented.",
    "development_phases": [
      {
        "name": "Frontend Phase",
        "description": "Tasks related to frontend phase",
        "deliverables": [
          "Completed FE-001",
          "Completed FE-002",
          "Completed FE-003",
          "Completed FE-004",
          "Completed FE-005",
          "Completed FE-006",
          "Completed UX-001"
        ],
        "estimated_duration_hours": 112.0,
        "work_items": [
          {
            "id": "FE-001",
            "description": "Set up React project with TypeScript.",
            "dependencies": [],
            "estimated_time": "1 day",
            "agent_role": "frontend_developer",
            "acceptance_criteria": [
              "Project is initialized using create-react-app or similar.",
              "TypeScript is configured correctly.",
              "Project builds without errors."
            ],
            "status": "pending",
            "code_files": [
              "package.json",
              "tsconfig.json",
              "src/App.tsx",
              "src/index.tsx"
            ]
          },
          {
            "id": "FE-002",
            "description": "Implement UI for adding a new task.",
            "dependencies": [
              "FE-001",
              "BE-002"
            ],
            "estimated_time": "2 days",
            "agent_role": "frontend_developer",
            "acceptance_criteria": [
              "A form is displayed for entering task description.",
              "User can submit the form.",
              "Form submission sends a POST request to /tasks.",
              "UI updates to reflect the newly created task (without page refresh).",
              "Error messages are displayed for invalid input."
            ],
            "status": "pending",
            "code_files": [
              "src/App.tsx",
              "src/components/TaskForm.tsx"
            ]
          },
          {
            "id": "FE-003",
            "description": "Implement UI for displaying the task list.",
            "dependencies": [
              "FE-001",
              "BE-003"
            ],
            "estimated_time": "2 days",
            "agent_role": "frontend_developer",
            "acceptance_criteria": [
              "Tasks are fetched from /tasks on component mount.",
              "Tasks are displayed in a list format.",
              "Each task displays its description and creation date.",
              "UI updates when new tasks are added (from FE-002).",
              "UI handles empty task list gracefully."
            ],
            "status": "pending",
            "code_files": [
              "src/App.tsx",
              "src/components/TaskList.tsx"
            ]
          },
          {
            "id": "FE-004",
            "description": "Implement UI for updating and deleting tasks.",
            "dependencies": [
              "FE-003",
              "BE-004",
              "BE-005"
            ],
            "estimated_time": "3 days",
            "agent_role": "frontend_developer",
            "acceptance_criteria": [
              "Each task in the list has an 'edit' and 'delete' option.",
              "Clicking 'edit' allows the user to modify the task description and completion status.",
              "Clicking 'delete' removes the task from the list.",
              "UI updates to reflect changes after update/delete operations (without page refresh).",
              "Confirmation dialog before deleting a task."
            ],
            "status": "pending",
            "code_files": [
              "src/App.tsx",
              "src/components/TaskList.tsx",
              "src/components/TaskItem.tsx"
            ]
          },
          {
            "id": "FE-005",
            "description": "Implement integration tests for the frontend and backend.",
            "dependencies": [
              "FE-002",
              "FE-003",
              "FE-004",
              "BE-002",
              "BE-003",
              "BE-004",
              "BE-005"
            ],
            "estimated_time": "3 days",
            "agent_role": "frontend_developer",
            "acceptance_criteria": [
              "Tests verify the interaction between frontend and backend.",
              "Tests cover adding, viewing, updating, and deleting tasks through the UI.",
              "Tests use a testing framework (e.g., Jest, React Testing Library).",
              "Tests mock API calls to avoid dependencies on the live backend.",
              "Tests cover different scenarios and edge cases."
            ],
            "status": "pending",
            "code_files": [
              "src/App.test.tsx"
            ]
          },
          {
            "id": "FE-006",
            "description": "Deploy the frontend to a static hosting service (e.g., Netlify, Vercel).",
            "dependencies": [
              "FE-005"
            ],
            "estimated_time": "1 day",
            "agent_role": "frontend_developer",
            "acceptance_criteria": [
              "Frontend code is built for production.",
              "Frontend is deployed to a static hosting service.",
              "Frontend is accessible via a public URL.",
              "Deployment process is automated (e.g., using CI/CD)."
            ],
            "status": "pending",
            "code_files": [
              "package.json",
              ".gitignore",
              "netlify.toml"
            ]
          },
          {
            "id": "UX-001",
            "description": "Gather user feedback and iterate on the design.",
            "dependencies": [
              "FE-006",
              "BE-008"
            ],
            "estimated_time": "2 days",
            "agent_role": "frontend_developer",
            "acceptance_criteria": [
              "User feedback is collected through surveys, interviews, or other methods.",
              "Feedback is analyzed to identify areas for improvement.",
              "UI/UX improvements are implemented based on the feedback.",
              "Iterative design process is established."
            ],
            "status": "pending",
            "code_files": [
              "src/App.tsx",
              "src/components/TaskList.tsx",
              "src/components/TaskItem.tsx"
            ]
          }
        ]
      },
      {
        "name": "Backend Phase",
        "description": "Tasks related to backend phase",
        "deliverables": [
          "Completed BE-001",
          "Completed BE-002",
          "Completed BE-003",
          "Completed BE-004",
          "Completed BE-005",
          "Completed BE-006",
          "Completed BE-007",
          "Completed BE-008",
          "Completed MON-001",
          "Completed PERF-001"
        ],
        "estimated_duration_hours": 128.0,
        "work_items": [
          {
            "id": "BE-001",
            "description": "Set up FastAPI project.",
            "dependencies": [],
            "estimated_time": "1 day",
            "agent_role": "backend_developer",
            "acceptance_criteria": [
              "FastAPI project is initialized.",
              "Dependencies (FastAPI, Uvicorn, etc.) are installed.",
              "A basic 'Hello World' endpoint is created and accessible."
            ],
            "status": "pending",
            "code_files": [
              "main.py",
              "requirements.txt"
            ]
          },
          {
            "id": "BE-002",
            "description": "Implement API endpoint to create a new task (/tasks - POST).",
            "dependencies": [
              "BE-001",
              "DB-001"
            ],
            "estimated_time": "2 days",
            "agent_role": "backend_developer",
            "acceptance_criteria": [
              "Endpoint accepts a POST request to /tasks.",
              "Endpoint validates the 'description' parameter.",
              "Task data is saved to the database.",
              "Endpoint returns a 201 Created status with the created task data.",
              "Endpoint returns 400 Bad Request for invalid input."
            ],
            "status": "pending",
            "code_files": [
              "main.py",
              "schemas.py"
            ]
          },
          {
            "id": "BE-003",
            "description": "Implement API endpoint to retrieve all tasks (/tasks - GET).",
            "dependencies": [
              "BE-001",
              "DB-001"
            ],
            "estimated_time": "1 day",
            "agent_role": "backend_developer",
            "acceptance_criteria": [
              "Endpoint accepts a GET request to /tasks.",
              "Endpoint retrieves all tasks from the database.",
              "Endpoint returns a 200 OK status with a list of tasks.",
              "Tasks are returned in the correct format."
            ],
            "status": "pending",
            "code_files": [
              "main.py",
              "schemas.py"
            ]
          },
          {
            "id": "BE-004",
            "description": "Implement API endpoint to update a task (/tasks/{task_id} - PUT).",
            "dependencies": [
              "BE-001",
              "DB-001"
            ],
            "estimated_time": "2 days",
            "agent_role": "backend_developer",
            "acceptance_criteria": [
              "Endpoint accepts a PUT request to /tasks/{task_id}.",
              "Endpoint validates the task_id and update parameters (description, completed).",
              "Task data is updated in the database.",
              "Endpoint returns a 200 OK status with the updated task data.",
              "Endpoint returns 404 Not Found if task_id is not found.",
              "Endpoint returns 400 Bad Request for invalid input."
            ],
            "status": "pending",
            "code_files": [
              "main.py",
              "schemas.py"
            ]
          },
          {
            "id": "BE-005",
            "description": "Implement API endpoint to delete a task (/tasks/{task_id} - DELETE).",
            "dependencies": [
              "BE-001",
              "DB-001"
            ],
            "estimated_time": "1 day",
            "agent_role": "backend_developer",
            "acceptance_criteria": [
              "Endpoint accepts a DELETE request to /tasks/{task_id}.",
              "Task is deleted from the database.",
              "Endpoint returns a 204 No Content status on success.",
              "Endpoint returns 404 Not Found if task_id is not found."
            ],
            "status": "pending",
            "code_files": [
              "main.py",
              "schemas.py"
            ]
          },
          {
            "id": "BE-006",
            "description": "Implement unit tests for the backend API.",
            "dependencies": [
              "BE-002",
              "BE-003",
              "BE-004",
              "BE-005"
            ],
            "estimated_time": "2 days",
            "agent_role": "backend_developer",
            "acceptance_criteria": [
              "Tests cover all API endpoints (create, read, update, delete).",
              "Tests verify input validation.",
              "Tests verify database interactions.",
              "Tests cover error handling.",
              "Tests achieve a high code coverage percentage."
            ],
            "status": "pending",
            "code_files": [
              "tests/test_main.py"
            ]
          },
          {
            "id": "BE-007",
            "description": "Implement basic security measures (input validation).",
            "dependencies": [
              "BE-002",
              "BE-004"
            ],
            "estimated_time": "1 day",
            "agent_role": "backend_developer",
            "acceptance_criteria": [
              "Input validation is implemented for all API endpoints that accept user input.",
              "Validation prevents SQL injection and XSS vulnerabilities.",
              "Parameterized queries are used to prevent SQL injection.",
              "Error messages are returned for invalid input."
            ],
            "status": "pending",
            "code_files": [
              "main.py",
              "schemas.py"
            ]
          },
          {
            "id": "BE-008",
            "description": "Deploy the backend to a cloud platform (e.g., AWS, Google Cloud, Azure).",
            "dependencies": [
              "BE-007",
              "DB-001"
            ],
            "estimated_time": "2 days",
            "agent_role": "backend_developer",
            "acceptance_criteria": [
              "Backend code is containerized using Docker.",
              "Backend is deployed to a cloud platform (e.g., using a container orchestration service).",
              "Backend is accessible via a public URL or internal network.",
              "Database is deployed and connected to the backend.",
              "Deployment process is automated (e.g., using CI/CD)."
            ],
            "status": "pending",
            "code_files": [
              "Dockerfile",
              "docker-compose.yml",
              "requirements.txt"
            ]
          },
          {
            "id": "MON-001",
            "description": "Implement monitoring and logging.",
            "dependencies": [
              "BE-008",
              "FE-006"
            ],
            "estimated_time": "2 days",
            "agent_role": "backend_developer",
            "acceptance_criteria": [
              "Logging is implemented in both frontend and backend.",
              "Application logs are collected and stored.",
              "Monitoring tools (e.g., Prometheus, Grafana) are set up.",
              "Alerts are configured for critical events.",
              "Error tracking service (e.g., Sentry) is integrated."
            ],
            "status": "pending",
            "code_files": [
              "main.py",
              "src/App.tsx"
            ]
          },
          {
            "id": "PERF-001",
            "description": "Optimize performance and address any identified issues.",
            "dependencies": [
              "BE-008",
              "FE-006",
              "MON-001"
            ],
            "estimated_time": "2 days",
            "agent_role": "backend_developer",
            "acceptance_criteria": [
              "Performance bottlenecks are identified through monitoring and testing.",
              "Code is optimized to improve performance (e.g., database query optimization, code splitting).",
              "Caching is implemented where appropriate.",
              "Application load times are improved."
            ],
            "status": "pending",
            "code_files": [
              "main.py",
              "src/App.tsx"
            ]
          }
        ]
      },
      {
        "name": "Database Phase",
        "description": "Tasks related to database phase",
        "deliverables": [
          "Completed DB-001",
          "Completed DB-002"
        ],
        "estimated_duration_hours": 16.0,
        "work_items": [
          {
            "id": "DB-001",
            "description": "Design and implement the database schema (PostgreSQL).",
            "dependencies": [],
            "estimated_time": "1 day",
            "agent_role": "database_specialist",
            "acceptance_criteria": [
              "Database schema defined based on the data model.",
              "Tasks table created with id, description, created_at, and completed columns.",
              "Appropriate data types and constraints are applied.",
              "Database connection established."
            ],
            "status": "pending",
            "code_files": [
              "database.py",
              "models.py",
              "alembic.ini",
              "migrations/"
            ]
          },
          {
            "id": "DB-002",
            "description": "Set up database deployment (managed PostgreSQL service).",
            "dependencies": [
              "DB-001",
              "BE-008"
            ],
            "estimated_time": "1 day",
            "agent_role": "database_specialist",
            "acceptance_criteria": [
              "A managed PostgreSQL database service is provisioned (e.g., AWS RDS, Google Cloud SQL).",
              "Database is configured with appropriate security settings.",
              "Database connection details are securely stored and accessible to the backend.",
              "Database is accessible from the deployed backend."
            ],
            "status": "pending",
            "code_files": []
          }
        ]
      }
    ],
    "timeline_estimation": {
      "start_date": "2025-07-08T22:46:39.558919",
      "end_date": "TBD",
      "milestones": []
    },
    "risk_assessment": [],
    "resource_requirements": [
      {
        "role": "Frontend Developer",
        "count": 1,
        "estimated_time_allocation": "100%",
        "phases": [
          "Frontend Phase"
        ],
        "skills_required": []
      },
      {
        "role": "Database Specialist",
        "count": 1,
        "estimated_time_allocation": "100%",
        "phases": [
          "Database Phase"
        ],
        "skills_required": []
      },
      {
        "role": "Backend Developer",
        "count": 1,
        "estimated_time_allocation": "100%",
        "phases": [
          "Backend Phase"
        ],
        "skills_required": []
      }
    ],
    "deliverables": [
      "Completed FE-001",
      "Completed FE-002",
      "Completed FE-003",
      "Completed FE-004",
      "Completed FE-005",
      "Completed FE-006",
      "Completed UX-001",
      "Completed BE-001",
      "Completed BE-002",
      "Completed BE-003",
      "Completed BE-004",
      "Completed BE-005",
      "Completed BE-006",
      "Completed BE-007",
      "Completed BE-008",
      "Completed MON-001",
      "Completed PERF-001",
      "Completed DB-001",
      "Completed DB-002"
    ],
    "dependencies": [],
    "raw_plan": "plan=ImplementationPlan(project_summary={'title': 'Generated Project Plan', 'description': 'Develop a simple web application for managing a task list, including features for adding, viewing, updating, and deleting tasks. The application will use React for the frontend, FastAPI for the backend, and PostgreSQL for the database. The project will be deployed to a cloud environment with monitoring and logging implemented.', 'overall_complexity': 'Medium', 'estimated_duration': 'TBD', 'key_challenges': [], 'success_criteria': []}, phases=[{'name': 'Frontend Phase', 'description': 'Tasks related to frontend phase', 'deliverables': ['Completed FE-001', 'Completed FE-002', 'Completed FE-003', 'Completed FE-004', 'Completed FE-005', 'Completed FE-006', 'Completed UX-001'], 'estimated_duration_hours': 112.0, 'work_items': [{'id': 'FE-001', 'description': 'Set up React project with TypeScript.', 'dependencies': [], 'estimated_time': '1 day', 'agent_role': 'frontend_developer', 'acceptance_criteria': ['Project is initialized using create-react-app or similar.', 'TypeScript is configured correctly.', 'Project builds without errors.'], 'status': 'pending', 'code_files': ['package.json', 'tsconfig.json', 'src/App.tsx', 'src/index.tsx']}, {'id': 'FE-002', 'description': 'Implement UI for adding a new task.', 'dependencies': ['FE-001', 'BE-002'], 'estimated_time': '2 days', 'agent_role': 'frontend_developer', 'acceptance_criteria': ['A form is displayed for entering task description.', 'User can submit the form.', 'Form submission sends a POST request to /tasks.', 'UI updates to reflect the newly created task (without page refresh).', 'Error messages are displayed for invalid input.'], 'status': 'pending', 'code_files': ['src/App.tsx', 'src/components/TaskForm.tsx']}, {'id': 'FE-003', 'description': 'Implement UI for displaying the task list.', 'dependencies': ['FE-001', 'BE-003'], 'estimated_time': '2 days', 'agent_role': 'frontend_developer', 'acceptance_criteria': ['Tasks are fetched from /tasks on component mount.', 'Tasks are displayed in a list format.', 'Each task displays its description and creation date.', 'UI updates when new tasks are added (from FE-002).', 'UI handles empty task list gracefully.'], 'status': 'pending', 'code_files': ['src/App.tsx', 'src/components/TaskList.tsx']}, {'id': 'FE-004', 'description': 'Implement UI for updating and deleting tasks.', 'dependencies': ['FE-003', 'BE-004', 'BE-005'], 'estimated_time': '3 days', 'agent_role': 'frontend_developer', 'acceptance_criteria': [\"Each task in the list has an 'edit' and 'delete' option.\", \"Clicking 'edit' allows the user to modify the task description and completion status.\", \"Clicking 'delete' removes the task from the list.\", 'UI updates to reflect changes after update/delete operations (without page refresh).', 'Confirmation dialog before deleting a task.'], 'status': 'pending', 'code_files': ['src/App.tsx', 'src/components/TaskList.tsx', 'src/components/TaskItem.tsx']}, {'id': 'FE-005', 'description': 'Implement integration tests for the frontend and backend.', 'dependencies': ['FE-002', 'FE-003', 'FE-004', 'BE-002', 'BE-003', 'BE-004', 'BE-005'], 'estimated_time': '3 days', 'agent_role': 'frontend_developer', 'acceptance_criteria': ['Tests verify the interaction between frontend and backend.', 'Tests cover adding, viewing, updating, and deleting tasks through the UI.', 'Tests use a testing framework (e.g., Jest, React Testing Library).', 'Tests mock API calls to avoid dependencies on the live backend.', 'Tests cover different scenarios and edge cases.'], 'status': 'pending', 'code_files': ['src/App.test.tsx']}, {'id': 'FE-006', 'description': 'Deploy the frontend to a static hosting service (e.g., Netlify, Vercel).', 'dependencies': ['FE-005'], 'estimated_time': '1 day', 'agent_role': 'frontend_developer', 'acceptance_criteria': ['Frontend code is built for production.', 'Frontend is deployed to a static hosting service.', 'Frontend is accessible via a public URL.', 'Deployment process is automated (e.g., using CI/CD).'], 'status': 'pending', 'code_files': ['package.json', '.gitignore', 'netlify.toml']}, {'id': 'UX-001', 'description': 'Gather user feedback and iterate on the design.', 'dependencies': ['FE-006', 'BE-008'], 'estimated_time': '2 days', 'agent_role': 'frontend_developer', 'acceptance_criteria': ['User feedback is collected through surveys, interviews, or other methods.', 'Feedback is analyzed to identify areas for improvement.', 'UI/UX improvements are implemented based on the feedback.', 'Iterative design process is established.'], 'status': 'pending', 'code_files': ['src/App.tsx', 'src/components/TaskList.tsx', 'src/components/TaskItem.tsx']}]}, {'name': 'Backend Phase', 'description': 'Tasks related to backend phase', 'deliverables': ['Completed BE-001', 'Completed BE-002', 'Completed BE-003', 'Completed BE-004', 'Completed BE-005', 'Completed BE-006', 'Completed BE-007', 'Completed BE-008', 'Completed MON-001', 'Completed PERF-001'], 'estimated_duration_hours': 128.0, 'work_items': [{'id': 'BE-001', 'description': 'Set up FastAPI project.', 'dependencies': [], 'estimated_time': '1 day', 'agent_role': 'backend_developer', 'acceptance_criteria': ['FastAPI project is initialized.', 'Dependencies (FastAPI, Uvicorn, etc.) are installed.', \"A basic 'Hello World' endpoint is created and accessible.\"], 'status': 'pending', 'code_files': ['main.py', 'requirements.txt']}, {'id': 'BE-002', 'description': 'Implement API endpoint to create a new task (/tasks - POST).', 'dependencies': ['BE-001', 'DB-001'], 'estimated_time': '2 days', 'agent_role': 'backend_developer', 'acceptance_criteria': ['Endpoint accepts a POST request to /tasks.', \"Endpoint validates the 'description' parameter.\", 'Task data is saved to the database.', 'Endpoint returns a 201 Created status with the created task data.', 'Endpoint returns 400 Bad Request for invalid input.'], 'status': 'pending', 'code_files': ['main.py', 'schemas.py']}, {'id': 'BE-003', 'description': 'Implement API endpoint to retrieve all tasks (/tasks - GET).', 'dependencies': ['BE-001', 'DB-001'], 'estimated_time': '1 day', 'agent_role': 'backend_developer', 'acceptance_criteria': ['Endpoint accepts a GET request to /tasks.', 'Endpoint retrieves all tasks from the database.', 'Endpoint returns a 200 OK status with a list of tasks.', 'Tasks are returned in the correct format.'], 'status': 'pending', 'code_files': ['main.py', 'schemas.py']}, {'id': 'BE-004', 'description': 'Implement API endpoint to update a task (/tasks/{task_id} - PUT).', 'dependencies': ['BE-001', 'DB-001'], 'estimated_time': '2 days', 'agent_role': 'backend_developer', 'acceptance_criteria': ['Endpoint accepts a PUT request to /tasks/{task_id}.', 'Endpoint validates the task_id and update parameters (description, completed).', 'Task data is updated in the database.', 'Endpoint returns a 200 OK status with the updated task data.', 'Endpoint returns 404 Not Found if task_id is not found.', 'Endpoint returns 400 Bad Request for invalid input.'], 'status': 'pending', 'code_files': ['main.py', 'schemas.py']}, {'id': 'BE-005', 'description': 'Implement API endpoint to delete a task (/tasks/{task_id} - DELETE).', 'dependencies': ['BE-001', 'DB-001'], 'estimated_time': '1 day', 'agent_role': 'backend_developer', 'acceptance_criteria': ['Endpoint accepts a DELETE request to /tasks/{task_id}.', 'Task is deleted from the database.', 'Endpoint returns a 204 No Content status on success.', 'Endpoint returns 404 Not Found if task_id is not found.'], 'status': 'pending', 'code_files': ['main.py', 'schemas.py']}, {'id': 'BE-006', 'description': 'Implement unit tests for the backend API.', 'dependencies': ['BE-002', 'BE-003', 'BE-004', 'BE-005'], 'estimated_time': '2 days', 'agent_role': 'backend_developer', 'acceptance_criteria': ['Tests cover all API endpoints (create, read, update, delete).', 'Tests verify input validation.', 'Tests verify database interactions.', 'Tests cover error handling.', 'Tests achieve a high code coverage percentage.'], 'status': 'pending', 'code_files': ['tests/test_main.py']}, {'id': 'BE-007', 'description': 'Implement basic security measures (input validation).', 'dependencies': ['BE-002', 'BE-004'], 'estimated_time': '1 day', 'agent_role': 'backend_developer', 'acceptance_criteria': ['Input validation is implemented for all API endpoints that accept user input.', 'Validation prevents SQL injection and XSS vulnerabilities.', 'Parameterized queries are used to prevent SQL injection.', 'Error messages are returned for invalid input.'], 'status': 'pending', 'code_files': ['main.py', 'schemas.py']}, {'id': 'BE-008', 'description': 'Deploy the backend to a cloud platform (e.g., AWS, Google Cloud, Azure).', 'dependencies': ['BE-007', 'DB-001'], 'estimated_time': '2 days', 'agent_role': 'backend_developer', 'acceptance_criteria': ['Backend code is containerized using Docker.', 'Backend is deployed to a cloud platform (e.g., using a container orchestration service).', 'Backend is accessible via a public URL or internal network.', 'Database is deployed and connected to the backend.', 'Deployment process is automated (e.g., using CI/CD).'], 'status': 'pending', 'code_files': ['Dockerfile', 'docker-compose.yml', 'requirements.txt']}, {'id': 'MON-001', 'description': 'Implement monitoring and logging.', 'dependencies': ['BE-008', 'FE-006'], 'estimated_time': '2 days', 'agent_role': 'backend_developer', 'acceptance_criteria': ['Logging is implemented in both frontend and backend.', 'Application logs are collected and stored.', 'Monitoring tools (e.g., Prometheus, Grafana) are set up.', 'Alerts are configured for critical events.', 'Error tracking service (e.g., Sentry) is integrated.'], 'status': 'pending', 'code_files': ['main.py', 'src/App.tsx']}, {'id': 'PERF-001', 'description': 'Optimize performance and address any identified issues.', 'dependencies': ['BE-008', 'FE-006', 'MON-001'], 'estimated_time': '2 days', 'agent_role': 'backend_developer', 'acceptance_criteria': ['Performance bottlenecks are identified through monitoring and testing.', 'Code is optimized to improve performance (e.g., database query optimization, code splitting).', 'Caching is implemented where appropriate.', 'Application load times are improved.'], 'status': 'pending', 'code_files': ['main.py', 'src/App.tsx']}]}, {'name': 'Database Phase', 'description': 'Tasks related to database phase', 'deliverables': ['Completed DB-001', 'Completed DB-002'], 'estimated_duration_hours': 16.0, 'work_items': [{'id': 'DB-001', 'description': 'Design and implement the database schema (PostgreSQL).', 'dependencies': [], 'estimated_time': '1 day', 'agent_role': 'database_specialist', 'acceptance_criteria': ['Database schema defined based on the data model.', 'Tasks table created with id, description, created_at, and completed columns.', 'Appropriate data types and constraints are applied.', 'Database connection established.'], 'status': 'pending', 'code_files': ['database.py', 'models.py', 'alembic.ini', 'migrations/']}, {'id': 'DB-002', 'description': 'Set up database deployment (managed PostgreSQL service).', 'dependencies': ['DB-001', 'BE-008'], 'estimated_time': '1 day', 'agent_role': 'database_specialist', 'acceptance_criteria': ['A managed PostgreSQL database service is provisioned (e.g., AWS RDS, Google Cloud SQL).', 'Database is configured with appropriate security settings.', 'Database connection details are securely stored and accessible to the backend.', 'Database is accessible from the deployed backend.'], 'status': 'pending', 'code_files': []}]}], resource_allocation=[{'role': 'Frontend Developer', 'count': 1, 'estimated_time_allocation': '100%', 'phases': ['Frontend Phase'], 'skills_required': []}, {'role': 'Database Specialist', 'count': 1, 'estimated_time_allocation': '100%', 'phases': ['Database Phase'], 'skills_required': []}, {'role': 'Backend Developer', 'count': 1, 'estimated_time_allocation': '100%', 'phases': ['Backend Phase'], 'skills_required': []}], risks_and_mitigations=[], timeline={'start_date': '2025-07-08T22:46:39.558919', 'end_date': 'TBD', 'milestones': []}, tech_stack={}, metadata={'generated_at': '2025-07-08T22:46:39.558919', 'version': '1.0', 'author': 'Multi-AI Dev System', 'tags': [], 'notes': 'Converted from WorkItemBacklog. Original summary: Develop a simple web application for managing a task list, including features for adding, viewing, updating, and deleting tasks. The application will use React for the frontend, FastAPI for the backend, and PostgreSQL for the database. The project will be deployed to a cloud environment with monitoring and logging implemented.'}) summary='Develop a simple web application for managing a task list, including features for adding, viewing, updating, and deleting tasks. The application will use React for the frontend, FastAPI for the backend, and PostgreSQL for the database. The project will be deployed to a cloud environment with monitoring and logging implemented.' metadata=PlanMetadata(generated_at='2025-07-08T22:46:39.558919', version='1.0', author='Multi-AI Dev System', tags=[], notes='Converted from WorkItemBacklog. Original summary: Develop a simple web application for managing a task list, including features for adding, viewing, updating, and deleting tasks. The application will use React for the frontend, FastAPI for the backend, and PostgreSQL for the database. The project will be deployed to a cloud environment with monitoring and logging implemented.')"
  },
  "workflow_state_snapshot": {
    "requirements_analysis": {
      "project_name": "Hello World Task List",
      "project_summary": "A simple web application to manage a list of tasks.",
      "project_goals": [
        "Allow a user to add a task",
        "Allow a user to see their list of tasks"
      ],
      "target_audience": [
        "Users who want to manage a list of tasks"
      ],
      "business_context": "This project aims to provide a basic task management tool.",
      "requirements": [
        {
          "id": "REQ-001",
          "description": "A user can create a new task with a text description.",
          "category": "functional",
          "priority": 1
        },
        {
          "id": "REQ-002",
          "description": "A user can see a list of all created tasks.",
          "category": "functional",
          "priority": 1
        },
        {
          "id": "REQ-003",
          "description": "The application must load quickly.",
          "category": "non_functional",
          "priority": 2
        },
        {
          "id": "REQ-004",
          "description": "The application must be secure.",
          "category": "non_functional",
          "priority": 2
        }
      ],
      "functional_requirements": [
        "A user can create a new task with a text description.",
        "A user can see a list of all created tasks."
      ],
      "non_functional_requirements": [
        "The application must load quickly.",
        "The application must be secure."
      ],
      "stakeholders": [
        "Users"
      ],
      "success_criteria": [
        "Users can successfully add tasks.",
        "Users can view their task list.",
        "The application loads quickly.",
        "The application is secure."
      ],
      "constraints": [],
      "assumptions": [],
      "risks": [],
      "domain_specific_details": {},
      "quality_assessment": {
        "clarity_score": 9.0,
        "completeness_score": 8.0,
        "consistency_score": 10.0,
        "recommendations": []
      },
      "gap_analysis": {
        "identified_gaps": [],
        "recommendations_for_completion": []
      }
    },
    "tech_stack_recommendation": {
      "frontend_options": [
        {
          "name": "React",
          "language": "TypeScript",
          "reasoning": "Default frontend framework.",
          "key_libraries": [],
          "pros": [],
          "cons": [],
          "selected": false
        }
      ],
      "backend_options": [
        {
          "name": "FastAPI",
          "language": "Python",
          "reasoning": "Default backend framework.",
          "key_libraries": [],
          "pros": [],
          "cons": [],
          "selected": false
        }
      ],
      "database_options": [
        {
          "name": "PostgreSQL",
          "language": null,
          "reasoning": "Default relational database.",
          "key_libraries": [],
          "pros": [],
          "cons": [],
          "selected": false
        }
      ],
      "cloud_options": [],
      "architecture_options": [
        {
          "pattern": "Microservices",
          "scalability_score": 7.0,
          "maintainability_score": 6.0,
          "development_speed_score": 5.0,
          "overall_score": 6.0,
          "reasoning": "Default architecture pattern with moderate complexity and good scalability."
        }
      ],
      "tool_options": [],
      "risks": [],
      "synthesis": {
        "backend": {},
        "frontend": {},
        "database": {},
        "architecture_pattern": "Microservices",
        "deployment_environment": {},
        "key_libraries_tools": [],
        "estimated_complexity": "Medium"
      },
      "selected_stack": null
    },
    "system_design": {
      "architecture": {
        "pattern": "Microservices",
        "justification": "Microservices architecture is chosen for its scalability and maintainability, even for a simple application. This allows for independent scaling of frontend and backend components and easier future feature additions.",
        "key_benefits": [
          "Scalability: Independent scaling of frontend and backend.",
          "Maintainability: Easier to maintain and update individual services.",
          "Flexibility: Allows for different technologies in different services (though not utilized here).",
          "Testability: Easier to test individual services."
        ],
        "potential_drawbacks": [
          "Increased complexity: Introduces more moving parts.",
          "Deployment complexity: Requires managing multiple services.",
          "Communication overhead: Requires inter-service communication."
        ]
      },
      "components": [
        {
          "name": "Frontend",
          "description": "The user interface for interacting with the task list.",
          "category": "frontend",
          "technologies": [
            "React",
            "TypeScript",
            "HTML",
            "CSS"
          ],
          "dependencies": [
            "Backend API"
          ],
          "responsibilities": [
            "Displaying the task list.",
            "Allowing users to add new tasks.",
            "Handling user input.",
            "Making API calls to the backend."
          ],
          "design_patterns": [
            "Component-based architecture"
          ]
        },
        {
          "name": "Backend API",
          "description": "The API that handles task management logic and data storage.",
          "category": "backend",
          "technologies": [
            "FastAPI",
            "Python",
            "PostgreSQL",
            "SQLAlchemy"
          ],
          "dependencies": [
            "PostgreSQL Database"
          ],
          "responsibilities": [
            "Exposing API endpoints for task creation and retrieval.",
            "Validating user input.",
            "Interacting with the database.",
            "Handling authentication and authorization (if implemented)."
          ],
          "design_patterns": [
            "RESTful API",
            "Dependency Injection"
          ]
        },
        {
          "name": "PostgreSQL Database",
          "description": "The database for storing task data.",
          "category": "database",
          "technologies": [
            "PostgreSQL",
            "SQL"
          ],
          "dependencies": [],
          "responsibilities": [
            "Storing task data.",
            "Providing data access to the Backend API."
          ],
          "design_patterns": [
            "Relational Database"
          ]
        }
      ],
      "data_model": {
        "schema_type": "Relational",
        "tables": [
          {
            "name": "tasks",
            "purpose": "Stores information about each task.",
            "fields": [
              {
                "name": "id",
                "type": "UUID",
                "constraints": [
                  "PRIMARY KEY",
                  "UNIQUE"
                ],
                "description": "Unique identifier for the task."
              },
              {
                "name": "description",
                "type": "VARCHAR(255)",
                "constraints": [
                  "NOT NULL"
                ],
                "description": "The text description of the task."
              },
              {
                "name": "created_at",
                "type": "TIMESTAMP",
                "constraints": [
                  "NOT NULL",
                  "DEFAULT CURRENT_TIMESTAMP"
                ],
                "description": "The timestamp when the task was created."
              },
              {
                "name": "completed",
                "type": "BOOLEAN",
                "constraints": [
                  "NOT NULL",
                  "DEFAULT FALSE"
                ],
                "description": "Whether the task is completed or not."
              }
            ],
            "relationships": []
          }
        ],
        "relationships": [],
        "justification": "A relational database is suitable for this application because it provides a structured way to store and retrieve task data. The relationships between tasks are simple, making a relational model efficient."
      },
      "api_endpoints": {
        "style": "REST",
        "base_url": "/api/v1",
        "authentication": "None (for simplicity, but JWT or API Keys would be recommended in a production environment)",
        "endpoints": [
          {
            "method": "POST",
            "path": "/tasks",
            "purpose": "Create a new task.",
            "parameters": [
              {
                "description": "The task description.",
                "type": "string",
                "name": "description"
              }
            ],
            "response": {
              "201": {
                "id": "UUID",
                "description": "string",
                "created_at": "ISO 8601 timestamp",
                "completed": "boolean"
              },
              "400": {
                "detail": "string"
              }
            },
            "authentication_required": false,
            "rate_limiting_applied": false
          },
          {
            "method": "GET",
            "path": "/tasks",
            "purpose": "Get a list of all tasks.",
            "parameters": [],
            "response": {
              "200": [
                {
                  "id": "UUID",
                  "description": "string",
                  "created_at": "ISO 8601 timestamp",
                  "completed": "boolean"
                }
              ]
            },
            "authentication_required": false,
            "rate_limiting_applied": false
          },
          {
            "method": "GET",
            "path": "/tasks/{task_id}",
            "purpose": "Get a specific task by ID.",
            "parameters": [
              {
                "name": "task_id",
                "type": "UUID",
                "description": "The ID of the task to retrieve."
              }
            ],
            "response": {
              "200": {
                "id": "UUID",
                "description": "string",
                "created_at": "ISO 8601 timestamp",
                "completed": "boolean"
              },
              "404": {
                "detail": "string"
              }
            },
            "authentication_required": false,
            "rate_limiting_applied": false
          },
          {
            "method": "PUT",
            "path": "/tasks/{task_id}",
            "purpose": "Update a specific task by ID.",
            "parameters": [
              {
                "name": "task_id",
                "type": "UUID",
                "description": "The ID of the task to update."
              },
              {
                "name": "description",
                "type": "string",
                "description": "The updated description of the task."
              },
              {
                "name": "completed",
                "type": "boolean",
                "description": "The updated completion status of the task."
              }
            ],
            "response": {
              "200": {
                "id": "UUID",
                "description": "string",
                "created_at": "ISO 8601 timestamp",
                "completed": "boolean"
              },
              "404": {
                "detail": "string"
              },
              "400": {
                "detail": "string"
              }
            },
            "authentication_required": false,
            "rate_limiting_applied": false
          },
          {
            "method": "DELETE",
            "path": "/tasks/{task_id}",
            "purpose": "Delete a specific task by ID.",
            "parameters": [
              {
                "name": "task_id",
                "type": "UUID",
                "description": "The ID of the task to delete."
              }
            ],
            "response": {
              "204": null,
              "404": {
                "detail": "string"
              }
            },
            "authentication_required": false,
            "rate_limiting_applied": false
          }
        ],
        "error_handling": "Standard HTTP status codes are used to indicate success or failure. Detailed error messages are returned in the response body for client-side debugging.",
        "rate_limiting_strategy": null
      },
      "security": {
        "authentication_method": "None (for simplicity)",
        "authorization_strategy": "None (for simplicity)",
        "data_encryption": {
          "at_rest": "Data at rest in the PostgreSQL database is not encrypted by default.  Encryption at rest can be implemented using PostgreSQL's encryption features or by encrypting the disk volume.",
          "in_transit": "HTTPS is used to encrypt data in transit between the frontend and backend."
        },
        "security_measures": [
          {
            "category": "Input Validation",
            "implementation": "Validate all user inputs on the backend to prevent injection attacks (e.g., SQL injection, XSS). Use parameterized queries.",
            "mitigation": "SQL Injection, XSS",
            "priority": "High"
          },
          {
            "category": "Authentication",
            "implementation": "Implement authentication (e.g., JWT) in a production environment.",
            "mitigation": "Unauthorized access",
            "priority": "Medium"
          },
          {
            "category": "Authorization",
            "implementation": "Implement authorization to restrict access to resources based on user roles (if applicable).",
            "mitigation": "Unauthorized access",
            "priority": "Medium"
          },
          {
            "category": "HTTPS",
            "implementation": "Enforce HTTPS for all communication between the frontend and backend.",
            "mitigation": "Man-in-the-middle attacks, data interception",
            "priority": "High"
          },
          {
            "category": "Dependency Management",
            "implementation": "Regularly update dependencies to address security vulnerabilities.",
            "mitigation": "Vulnerabilities in third-party libraries",
            "priority": "Medium"
          }
        ],
        "vulnerability_mitigation_strategies": [
          "Input validation",
          "Output encoding",
          "Regular security audits",
          "Dependency management"
        ],
        "compliance_standards": []
      },
      "scalability_and_performance": {
        "frontend_optimization": "Optimize frontend code for fast loading times (code splitting, lazy loading, image optimization).",
        "backend_optimization": "Use asynchronous operations in FastAPI to handle concurrent requests efficiently. Optimize database queries.",
        "database_optimization": "Use appropriate indexes on database tables to speed up query performance.",
        "caching": "Implement caching (e.g., using Redis) to cache frequently accessed data."
      },
      "deployment_strategy": {
        "environment": "Cloud-based (e.g., AWS, Google Cloud, Azure).",
        "frontend_deployment": "Deploy the React frontend to a static hosting service (e.g., Netlify, Vercel, AWS S3).",
        "backend_deployment": "Deploy the FastAPI backend using a containerization technology (e.g., Docker) and a container orchestration platform (e.g., Kubernetes, Docker Compose).",
        "database_deployment": "Use a managed PostgreSQL database service (e.g., AWS RDS, Google Cloud SQL, Azure Database for PostgreSQL)."
      },
      "monitoring_and_logging": {
        "logging": "Implement logging in both the frontend and backend to track application behavior and errors. Use a logging library (e.g., Python's logging module).",
        "monitoring": "Use monitoring tools (e.g., Prometheus, Grafana) to monitor application performance and resource usage. Set up alerts for critical events.",
        "error_tracking": "Integrate an error tracking service (e.g., Sentry) to capture and analyze errors."
      },
      "error_handling_strategy": "Use HTTP status codes to indicate the outcome of API requests. Return detailed error messages in the response body for client-side debugging. Implement centralized error handling in the backend to catch and log exceptions.",
      "development_phases_overview": [
        {
          "name": "Phase 1: Setup and Basic Functionality",
          "description": "Set up the development environment, create the frontend and backend projects, and implement the core functionality: adding and viewing tasks.",
          "priority": "High",
          "dependencies": [],
          "tasks": [
            "Set up React project with TypeScript.",
            "Set up FastAPI project.",
            "Design and implement the database schema.",
            "Implement the API endpoints for creating and retrieving tasks.",
            "Implement the frontend UI for adding and viewing tasks.",
            "Connect the frontend to the backend API."
          ],
          "estimated_duration": "2 weeks"
        },
        {
          "name": "Phase 2: Enhancements and Testing",
          "description": "Implement additional features, such as task updates and deletion, and perform thorough testing.",
          "priority": "Medium",
          "dependencies": [
            "Phase 1: Setup and Basic Functionality"
          ],
          "tasks": [
            "Implement API endpoints for updating and deleting tasks.",
            "Implement the frontend UI for updating and deleting tasks.",
            "Implement unit tests for the backend API.",
            "Implement integration tests for the frontend and backend.",
            "Implement basic security measures (e.g., input validation)."
          ],
          "estimated_duration": "1 week"
        },
        {
          "name": "Phase 3: Deployment and Refinement",
          "description": "Deploy the application to a cloud environment and refine the application based on user feedback and performance testing.",
          "priority": "Medium",
          "dependencies": [
            "Phase 2: Enhancements and Testing"
          ],
          "tasks": [
            "Deploy the frontend to a static hosting service.",
            "Deploy the backend to a cloud platform.",
            "Set up database deployment.",
            "Implement monitoring and logging.",
            "Gather user feedback and iterate on the design.",
            "Optimize performance and address any identified issues."
          ],
          "estimated_duration": "1 week"
        }
      ],
      "key_risks": [
        "Security vulnerabilities: Insufficient security measures could lead to data breaches.",
        "Performance bottlenecks: Inefficient code or database queries could lead to slow loading times.",
        "Scalability issues: The application may not be able to handle a large number of users or tasks.",
        "Deployment challenges: Difficulties in deploying and managing the application in a cloud environment."
      ],
      "design_justification": "The design prioritizes simplicity and maintainability while addressing the core requirements of the project. The microservices architecture allows for future scalability and flexibility. The chosen technologies are well-suited for the task and offer good performance and development experience. The development phases provide a structured approach to building and deploying the application.",
      "data_flow": "1. User interacts with the Frontend (React). 2. User action triggers an API call to the Backend API (FastAPI). 3. Backend API validates the request and interacts with the PostgreSQL database to store or retrieve task data. 4. Backend API returns a response to the Frontend. 5. Frontend updates the UI based on the response."
    },
    "implementation_plan": "plan=ImplementationPlan(project_summary={'title': 'Generated Project Plan', 'description': 'Develop a simple web application for managing a task list, including features for adding, viewing, updating, and deleting tasks. The application will use React for the frontend, FastAPI for the backend, and PostgreSQL for the database. The project will be deployed to a cloud environment with monitoring and logging implemented.', 'overall_complexity': 'Medium', 'estimated_duration': 'TBD', 'key_challenges': [], 'success_criteria': []}, phases=[{'name': 'Frontend Phase', 'description': 'Tasks related to frontend phase', 'deliverables': ['Completed FE-001', 'Completed FE-002', 'Completed FE-003', 'Completed FE-004', 'Completed FE-005', 'Completed FE-006', 'Completed UX-001'], 'estimated_duration_hours': 112.0, 'work_items': [{'id': 'FE-001', 'description': 'Set up React project with TypeScript.', 'dependencies': [], 'estimated_time': '1 day', 'agent_role': 'frontend_developer', 'acceptance_criteria': ['Project is initialized using create-react-app or similar.', 'TypeScript is configured correctly.', 'Project builds without errors.'], 'status': 'pending', 'code_files': ['package.json', 'tsconfig.json', 'src/App.tsx', 'src/index.tsx']}, {'id': 'FE-002', 'description': 'Implement UI for adding a new task.', 'dependencies': ['FE-001', 'BE-002'], 'estimated_time': '2 days', 'agent_role': 'frontend_developer', 'acceptance_criteria': ['A form is displayed for entering task description.', 'User can submit the form.', 'Form submission sends a POST request to /tasks.', 'UI updates to reflect the newly created task (without page refresh).', 'Error messages are displayed for invalid input.'], 'status': 'pending', 'code_files': ['src/App.tsx', 'src/components/TaskForm.tsx']}, {'id': 'FE-003', 'description': 'Implement UI for displaying the task list.', 'dependencies': ['FE-001', 'BE-003'], 'estimated_time': '2 days', 'agent_role': 'frontend_developer', 'acceptance_criteria': ['Tasks are fetched from /tasks on component mount.', 'Tasks are displayed in a list format.', 'Each task displays its description and creation date.', 'UI updates when new tasks are added (from FE-002).', 'UI handles empty task list gracefully.'], 'status': 'pending', 'code_files': ['src/App.tsx', 'src/components/TaskList.tsx']}, {'id': 'FE-004', 'description': 'Implement UI for updating and deleting tasks.', 'dependencies': ['FE-003', 'BE-004', 'BE-005'], 'estimated_time': '3 days', 'agent_role': 'frontend_developer', 'acceptance_criteria': [\"Each task in the list has an 'edit' and 'delete' option.\", \"Clicking 'edit' allows the user to modify the task description and completion status.\", \"Clicking 'delete' removes the task from the list.\", 'UI updates to reflect changes after update/delete operations (without page refresh).', 'Confirmation dialog before deleting a task.'], 'status': 'pending', 'code_files': ['src/App.tsx', 'src/components/TaskList.tsx', 'src/components/TaskItem.tsx']}, {'id': 'FE-005', 'description': 'Implement integration tests for the frontend and backend.', 'dependencies': ['FE-002', 'FE-003', 'FE-004', 'BE-002', 'BE-003', 'BE-004', 'BE-005'], 'estimated_time': '3 days', 'agent_role': 'frontend_developer', 'acceptance_criteria': ['Tests verify the interaction between frontend and backend.', 'Tests cover adding, viewing, updating, and deleting tasks through the UI.', 'Tests use a testing framework (e.g., Jest, React Testing Library).', 'Tests mock API calls to avoid dependencies on the live backend.', 'Tests cover different scenarios and edge cases.'], 'status': 'pending', 'code_files': ['src/App.test.tsx']}, {'id': 'FE-006', 'description': 'Deploy the frontend to a static hosting service (e.g., Netlify, Vercel).', 'dependencies': ['FE-005'], 'estimated_time': '1 day', 'agent_role': 'frontend_developer', 'acceptance_criteria': ['Frontend code is built for production.', 'Frontend is deployed to a static hosting service.', 'Frontend is accessible via a public URL.', 'Deployment process is automated (e.g., using CI/CD).'], 'status': 'pending', 'code_files': ['package.json', '.gitignore', 'netlify.toml']}, {'id': 'UX-001', 'description': 'Gather user feedback and iterate on the design.', 'dependencies': ['FE-006', 'BE-008'], 'estimated_time': '2 days', 'agent_role': 'frontend_developer', 'acceptance_criteria': ['User feedback is collected through surveys, interviews, or other methods.', 'Feedback is analyzed to identify areas for improvement.', 'UI/UX improvements are implemented based on the feedback.', 'Iterative design process is established.'], 'status': 'pending', 'code_files': ['src/App.tsx', 'src/components/TaskList.tsx', 'src/components/TaskItem.tsx']}]}, {'name': 'Backend Phase', 'description': 'Tasks related to backend phase', 'deliverables': ['Completed BE-001', 'Completed BE-002', 'Completed BE-003', 'Completed BE-004', 'Completed BE-005', 'Completed BE-006', 'Completed BE-007', 'Completed BE-008', 'Completed MON-001', 'Completed PERF-001'], 'estimated_duration_hours': 128.0, 'work_items': [{'id': 'BE-001', 'description': 'Set up FastAPI project.', 'dependencies': [], 'estimated_time': '1 day', 'agent_role': 'backend_developer', 'acceptance_criteria': ['FastAPI project is initialized.', 'Dependencies (FastAPI, Uvicorn, etc.) are installed.', \"A basic 'Hello World' endpoint is created and accessible.\"], 'status': 'pending', 'code_files': ['main.py', 'requirements.txt']}, {'id': 'BE-002', 'description': 'Implement API endpoint to create a new task (/tasks - POST).', 'dependencies': ['BE-001', 'DB-001'], 'estimated_time': '2 days', 'agent_role': 'backend_developer', 'acceptance_criteria': ['Endpoint accepts a POST request to /tasks.', \"Endpoint validates the 'description' parameter.\", 'Task data is saved to the database.', 'Endpoint returns a 201 Created status with the created task data.', 'Endpoint returns 400 Bad Request for invalid input.'], 'status': 'pending', 'code_files': ['main.py', 'schemas.py']}, {'id': 'BE-003', 'description': 'Implement API endpoint to retrieve all tasks (/tasks - GET).', 'dependencies': ['BE-001', 'DB-001'], 'estimated_time': '1 day', 'agent_role': 'backend_developer', 'acceptance_criteria': ['Endpoint accepts a GET request to /tasks.', 'Endpoint retrieves all tasks from the database.', 'Endpoint returns a 200 OK status with a list of tasks.', 'Tasks are returned in the correct format.'], 'status': 'pending', 'code_files': ['main.py', 'schemas.py']}, {'id': 'BE-004', 'description': 'Implement API endpoint to update a task (/tasks/{task_id} - PUT).', 'dependencies': ['BE-001', 'DB-001'], 'estimated_time': '2 days', 'agent_role': 'backend_developer', 'acceptance_criteria': ['Endpoint accepts a PUT request to /tasks/{task_id}.', 'Endpoint validates the task_id and update parameters (description, completed).', 'Task data is updated in the database.', 'Endpoint returns a 200 OK status with the updated task data.', 'Endpoint returns 404 Not Found if task_id is not found.', 'Endpoint returns 400 Bad Request for invalid input.'], 'status': 'pending', 'code_files': ['main.py', 'schemas.py']}, {'id': 'BE-005', 'description': 'Implement API endpoint to delete a task (/tasks/{task_id} - DELETE).', 'dependencies': ['BE-001', 'DB-001'], 'estimated_time': '1 day', 'agent_role': 'backend_developer', 'acceptance_criteria': ['Endpoint accepts a DELETE request to /tasks/{task_id}.', 'Task is deleted from the database.', 'Endpoint returns a 204 No Content status on success.', 'Endpoint returns 404 Not Found if task_id is not found.'], 'status': 'pending', 'code_files': ['main.py', 'schemas.py']}, {'id': 'BE-006', 'description': 'Implement unit tests for the backend API.', 'dependencies': ['BE-002', 'BE-003', 'BE-004', 'BE-005'], 'estimated_time': '2 days', 'agent_role': 'backend_developer', 'acceptance_criteria': ['Tests cover all API endpoints (create, read, update, delete).', 'Tests verify input validation.', 'Tests verify database interactions.', 'Tests cover error handling.', 'Tests achieve a high code coverage percentage.'], 'status': 'pending', 'code_files': ['tests/test_main.py']}, {'id': 'BE-007', 'description': 'Implement basic security measures (input validation).', 'dependencies': ['BE-002', 'BE-004'], 'estimated_time': '1 day', 'agent_role': 'backend_developer', 'acceptance_criteria': ['Input validation is implemented for all API endpoints that accept user input.', 'Validation prevents SQL injection and XSS vulnerabilities.', 'Parameterized queries are used to prevent SQL injection.', 'Error messages are returned for invalid input.'], 'status': 'pending', 'code_files': ['main.py', 'schemas.py']}, {'id': 'BE-008', 'description': 'Deploy the backend to a cloud platform (e.g., AWS, Google Cloud, Azure).', 'dependencies': ['BE-007', 'DB-001'], 'estimated_time': '2 days', 'agent_role': 'backend_developer', 'acceptance_criteria': ['Backend code is containerized using Docker.', 'Backend is deployed to a cloud platform (e.g., using a container orchestration service).', 'Backend is accessible via a public URL or internal network.', 'Database is deployed and connected to the backend.', 'Deployment process is automated (e.g., using CI/CD).'], 'status': 'pending', 'code_files': ['Dockerfile', 'docker-compose.yml', 'requirements.txt']}, {'id': 'MON-001', 'description': 'Implement monitoring and logging.', 'dependencies': ['BE-008', 'FE-006'], 'estimated_time': '2 days', 'agent_role': 'backend_developer', 'acceptance_criteria': ['Logging is implemented in both frontend and backend.', 'Application logs are collected and stored.', 'Monitoring tools (e.g., Prometheus, Grafana) are set up.', 'Alerts are configured for critical events.', 'Error tracking service (e.g., Sentry) is integrated.'], 'status': 'pending', 'code_files': ['main.py', 'src/App.tsx']}, {'id': 'PERF-001', 'description': 'Optimize performance and address any identified issues.', 'dependencies': ['BE-008', 'FE-006', 'MON-001'], 'estimated_time': '2 days', 'agent_role': 'backend_developer', 'acceptance_criteria': ['Performance bottlenecks are identified through monitoring and testing.', 'Code is optimized to improve performance (e.g., database query optimization, code splitting).', 'Caching is implemented where appropriate.', 'Application load times are improved.'], 'status': 'pending', 'code_files': ['main.py', 'src/App.tsx']}]}, {'name': 'Database Phase', 'description': 'Tasks related to database phase', 'deliverables': ['Completed DB-001', 'Completed DB-002'], 'estimated_duration_hours': 16.0, 'work_items': [{'id': 'DB-001', 'description': 'Design and implement the database schema (PostgreSQL).', 'dependencies': [], 'estimated_time': '1 day', 'agent_role': 'database_specialist', 'acceptance_criteria': ['Database schema defined based on the data model.', 'Tasks table created with id, description, created_at, and completed columns.', 'Appropriate data types and constraints are applied.', 'Database connection established.'], 'status': 'pending', 'code_files': ['database.py', 'models.py', 'alembic.ini', 'migrations/']}, {'id': 'DB-002', 'description': 'Set up database deployment (managed PostgreSQL service).', 'dependencies': ['DB-001', 'BE-008'], 'estimated_time': '1 day', 'agent_role': 'database_specialist', 'acceptance_criteria': ['A managed PostgreSQL database service is provisioned (e.g., AWS RDS, Google Cloud SQL).', 'Database is configured with appropriate security settings.', 'Database connection details are securely stored and accessible to the backend.', 'Database is accessible from the deployed backend.'], 'status': 'pending', 'code_files': []}]}], resource_allocation=[{'role': 'Frontend Developer', 'count': 1, 'estimated_time_allocation': '100%', 'phases': ['Frontend Phase'], 'skills_required': []}, {'role': 'Database Specialist', 'count': 1, 'estimated_time_allocation': '100%', 'phases': ['Database Phase'], 'skills_required': []}, {'role': 'Backend Developer', 'count': 1, 'estimated_time_allocation': '100%', 'phases': ['Backend Phase'], 'skills_required': []}], risks_and_mitigations=[], timeline={'start_date': '2025-07-08T22:46:39.558919', 'end_date': 'TBD', 'milestones': []}, tech_stack={}, metadata={'generated_at': '2025-07-08T22:46:39.558919', 'version': '1.0', 'author': 'Multi-AI Dev System', 'tags': [], 'notes': 'Converted from WorkItemBacklog. Original summary: Develop a simple web application for managing a task list, including features for adding, viewing, updating, and deleting tasks. The application will use React for the frontend, FastAPI for the backend, and PostgreSQL for the database. The project will be deployed to a cloud environment with monitoring and logging implemented.'}) summary='Develop a simple web application for managing a task list, including features for adding, viewing, updating, and deleting tasks. The application will use React for the frontend, FastAPI for the backend, and PostgreSQL for the database. The project will be deployed to a cloud environment with monitoring and logging implemented.' metadata=PlanMetadata(generated_at='2025-07-08T22:46:39.558919', version='1.0', author='Multi-AI Dev System', tags=[], notes='Converted from WorkItemBacklog. Original summary: Develop a simple web application for managing a task list, including features for adding, viewing, updating, and deleting tasks. The application will use React for the frontend, FastAPI for the backend, and PostgreSQL for the database. The project will be deployed to a cloud environment with monitoring and logging implemented.')"
  }
}