{
  "session_id": "session_a01d397c-f9da-4ee6-943b-1404a74d05fb",
  "approval_type": "implementation_plan",
  "timestamp": 1751966413,
  "approval_data": {
    "type": "implementation_plan",
    "timestamp": 1751966413.9298272,
    "project_overview": "Develop a simple web application for managing a list of tasks, including frontend UI, backend API, and database integration.  The application will allow users to add tasks and view a list of existing tasks.  The project will be deployed to AWS using Docker and a CI/CD pipeline.  Security and performance considerations will be addressed.",
    "development_phases": [
      {
        "name": "Frontend Phase",
        "description": "Tasks related to frontend phase",
        "deliverables": [
          "Completed FE-001",
          "Completed FE-002",
          "Completed FE-003",
          "Completed FE-004",
          "Completed FE-005",
          "Completed FE-006",
          "Completed FE-007",
          "Completed DEPLOY-002",
          "Completed TEST-002",
          "Completed MONITOR-002"
        ],
        "estimated_duration_hours": 46.0,
        "work_items": [
          {
            "id": "FE-001",
            "description": "Set up React project using Create React App.",
            "dependencies": [],
            "estimated_time": "2 hours",
            "agent_role": "frontend_developer",
            "acceptance_criteria": [
              "Project is initialized successfully.",
              "Default React app runs without errors."
            ],
            "status": "pending",
            "code_files": [
              "package.json",
              "src/App.js",
              "src/index.js"
            ]
          },
          {
            "id": "FE-002",
            "description": "Design the basic UI layout (header, task input, task list).",
            "dependencies": [
              "FE-001"
            ],
            "estimated_time": "4 hours",
            "agent_role": "frontend_developer",
            "acceptance_criteria": [
              "UI layout is visually appealing.",
              "Header is present.",
              "Task input form is present.",
              "Task list area is present."
            ],
            "status": "pending",
            "code_files": [
              "src/App.js",
              "src/App.css"
            ]
          },
          {
            "id": "FE-003",
            "description": "Implement the task input form (text field and add button).",
            "dependencies": [
              "FE-002"
            ],
            "estimated_time": "4 hours",
            "agent_role": "frontend_developer",
            "acceptance_criteria": [
              "Text field accepts user input.",
              "Add button is present.",
              "Button click triggers an action (e.g., console.log)."
            ],
            "status": "pending",
            "code_files": [
              "src/App.js",
              "src/App.css"
            ]
          },
          {
            "id": "FE-004",
            "description": "Implement the display of the task list (initially hardcoded).",
            "dependencies": [
              "FE-002"
            ],
            "estimated_time": "4 hours",
            "agent_role": "frontend_developer",
            "acceptance_criteria": [
              "Task list area displays a list of hardcoded tasks.",
              "Each task is displayed correctly."
            ],
            "status": "pending",
            "code_files": [
              "src/App.js",
              "src/App.css"
            ]
          },
          {
            "id": "FE-005",
            "description": "Implement API calls to the backend for adding tasks.",
            "dependencies": [
              "FE-003",
              "BE-005"
            ],
            "estimated_time": "8 hours",
            "agent_role": "frontend_developer",
            "acceptance_criteria": [
              "Frontend makes a POST request to /tasks when the add button is clicked.",
              "Frontend displays the new task in the task list after successful creation.",
              "Error handling for API call failures (e.g., display error message)."
            ],
            "status": "pending",
            "code_files": [
              "src/App.js"
            ]
          },
          {
            "id": "FE-006",
            "description": "Implement API calls to the backend for retrieving tasks.",
            "dependencies": [
              "FE-004",
              "BE-006"
            ],
            "estimated_time": "8 hours",
            "agent_role": "frontend_developer",
            "acceptance_criteria": [
              "Frontend makes a GET request to /tasks on component mount.",
              "Frontend displays the tasks retrieved from the backend.",
              "Error handling for API call failures (e.g., display error message)."
            ],
            "status": "pending",
            "code_files": [
              "src/App.js"
            ]
          },
          {
            "id": "FE-007",
            "description": "Implement basic input validation on the frontend.",
            "dependencies": [
              "FE-003"
            ],
            "estimated_time": "2 hours",
            "agent_role": "frontend_developer",
            "acceptance_criteria": [
              "Input field is validated to ensure it's not empty before submitting.",
              "Error message is displayed if input is invalid."
            ],
            "status": "pending",
            "code_files": [
              "src/App.js"
            ]
          },
          {
            "id": "DEPLOY-002",
            "description": "Create a Dockerfile for the frontend.",
            "dependencies": [
              "FE-006"
            ],
            "estimated_time": "4 hours",
            "agent_role": "frontend_developer",
            "acceptance_criteria": [
              "Dockerfile exists.",
              "Dockerfile builds a Docker image for the frontend application.",
              "Image includes all necessary dependencies."
            ],
            "status": "pending",
            "code_files": [
              "Dockerfile"
            ]
          },
          {
            "id": "TEST-002",
            "description": "Write end-to-end tests for the application.",
            "dependencies": [
              "FE-006",
              "BE-006"
            ],
            "estimated_time": "8 hours",
            "agent_role": "frontend_developer",
            "acceptance_criteria": [
              "Tests cover adding a task.",
              "Tests cover viewing the task list.",
              "Tests verify the correct data is displayed."
            ],
            "status": "pending",
            "code_files": [
              "cypress/*.cy.js"
            ]
          },
          {
            "id": "MONITOR-002",
            "description": "Set up basic logging on the frontend.",
            "dependencies": [
              "FE-006"
            ],
            "estimated_time": "2 hours",
            "agent_role": "frontend_developer",
            "acceptance_criteria": [
              "Frontend logs errors to the console."
            ],
            "status": "pending",
            "code_files": [
              "src/App.js"
            ]
          }
        ]
      },
      {
        "name": "Backend Phase",
        "description": "Tasks related to backend phase",
        "deliverables": [
          "Completed BE-001",
          "Completed BE-002",
          "Completed BE-003",
          "Completed BE-004",
          "Completed BE-005",
          "Completed BE-006",
          "Completed SEC-001",
          "Completed DEPLOY-001",
          "Completed TEST-001",
          "Completed MONITOR-001"
        ],
        "estimated_duration_hours": 50.0,
        "work_items": [
          {
            "id": "BE-001",
            "description": "Set up Node.js and Express project.",
            "dependencies": [],
            "estimated_time": "2 hours",
            "agent_role": "backend_developer",
            "acceptance_criteria": [
              "Project is initialized successfully.",
              "Express server runs without errors."
            ],
            "status": "pending",
            "code_files": [
              "package.json",
              "index.js"
            ]
          },
          {
            "id": "BE-002",
            "description": "Implement the /tasks POST endpoint (stub).",
            "dependencies": [
              "BE-001"
            ],
            "estimated_time": "4 hours",
            "agent_role": "backend_developer",
            "acceptance_criteria": [
              "Endpoint accepts POST requests to /tasks.",
              "Endpoint returns a 201 Created response (stubbed).",
              "Endpoint logs the request body."
            ],
            "status": "pending",
            "code_files": [
              "index.js"
            ]
          },
          {
            "id": "BE-003",
            "description": "Implement the /tasks GET endpoint (stub).",
            "dependencies": [
              "BE-001"
            ],
            "estimated_time": "4 hours",
            "agent_role": "backend_developer",
            "acceptance_criteria": [
              "Endpoint accepts GET requests to /tasks.",
              "Endpoint returns a 200 OK response (stubbed) with a JSON array.",
              "Endpoint logs the request."
            ],
            "status": "pending",
            "code_files": [
              "index.js"
            ]
          },
          {
            "id": "BE-004",
            "description": "Connect the backend to the PostgreSQL database.",
            "dependencies": [
              "BE-001",
              "DB-001",
              "DB-002"
            ],
            "estimated_time": "4 hours",
            "agent_role": "backend_developer",
            "acceptance_criteria": [
              "Backend can connect to the PostgreSQL database.",
              "Connection details are configurable (e.g., environment variables)."
            ],
            "status": "pending",
            "code_files": [
              "index.js"
            ]
          },
          {
            "id": "BE-005",
            "description": "Implement the /tasks POST endpoint to save tasks to the database.",
            "dependencies": [
              "BE-002",
              "BE-004"
            ],
            "estimated_time": "8 hours",
            "agent_role": "backend_developer",
            "acceptance_criteria": [
              "Endpoint saves the task description to the database.",
              "Endpoint returns a 201 Created response with the created task data (including ID).",
              "Input validation is performed (description is not empty).",
              "Error handling for database connection and insertion failures."
            ],
            "status": "pending",
            "code_files": [
              "index.js"
            ]
          },
          {
            "id": "BE-006",
            "description": "Implement the /tasks GET endpoint to retrieve tasks from the database.",
            "dependencies": [
              "BE-003",
              "BE-004"
            ],
            "estimated_time": "8 hours",
            "agent_role": "backend_developer",
            "acceptance_criteria": [
              "Endpoint retrieves all tasks from the database.",
              "Endpoint returns a 200 OK response with a JSON array of tasks.",
              "Error handling for database connection and retrieval failures."
            ],
            "status": "pending",
            "code_files": [
              "index.js"
            ]
          },
          {
            "id": "SEC-001",
            "description": "Implement input validation on the backend.",
            "dependencies": [
              "BE-005"
            ],
            "estimated_time": "4 hours",
            "agent_role": "backend_developer",
            "acceptance_criteria": [
              "Backend validates the task description to prevent empty strings or malicious input.",
              "Returns a 400 Bad Request if validation fails."
            ],
            "status": "pending",
            "code_files": [
              "index.js"
            ]
          },
          {
            "id": "DEPLOY-001",
            "description": "Create a Dockerfile for the backend.",
            "dependencies": [
              "BE-006"
            ],
            "estimated_time": "4 hours",
            "agent_role": "backend_developer",
            "acceptance_criteria": [
              "Dockerfile exists.",
              "Dockerfile builds a Docker image for the backend application.",
              "Image includes all necessary dependencies."
            ],
            "status": "pending",
            "code_files": [
              "Dockerfile"
            ]
          },
          {
            "id": "TEST-001",
            "description": "Write unit tests for the backend API endpoints.",
            "dependencies": [
              "BE-005",
              "BE-006"
            ],
            "estimated_time": "8 hours",
            "agent_role": "backend_developer",
            "acceptance_criteria": [
              "Unit tests cover the /tasks POST endpoint.",
              "Unit tests cover the /tasks GET endpoint.",
              "Tests cover input validation.",
              "Tests cover database interactions."
            ],
            "status": "pending",
            "code_files": [
              "tests/*.test.js"
            ]
          },
          {
            "id": "MONITOR-001",
            "description": "Set up basic logging on the backend.",
            "dependencies": [
              "BE-006"
            ],
            "estimated_time": "4 hours",
            "agent_role": "backend_developer",
            "acceptance_criteria": [
              "Backend logs API requests and errors.",
              "Logs are written to a file or a logging service (e.g., CloudWatch)."
            ],
            "status": "pending",
            "code_files": [
              "index.js"
            ]
          }
        ]
      },
      {
        "name": "Database Phase",
        "description": "Tasks related to database phase",
        "deliverables": [
          "Completed DB-001",
          "Completed DB-002"
        ],
        "estimated_duration_hours": 6.0,
        "work_items": [
          {
            "id": "DB-001",
            "description": "Set up PostgreSQL database locally.",
            "dependencies": [],
            "estimated_time": "4 hours",
            "agent_role": "database_specialist",
            "acceptance_criteria": [
              "PostgreSQL server is running.",
              "Database 'task_list_db' is created.",
              "User with appropriate privileges is created."
            ],
            "status": "pending",
            "code_files": []
          },
          {
            "id": "DB-002",
            "description": "Create the 'tasks' table in PostgreSQL.",
            "dependencies": [
              "DB-001"
            ],
            "estimated_time": "2 hours",
            "agent_role": "database_specialist",
            "acceptance_criteria": [
              "Table 'tasks' exists.",
              "Table has 'id', 'description', 'created_at', and 'updated_at' columns.",
              "'id' is a UUID and primary key.",
              "'created_at' and 'updated_at' have default values."
            ],
            "status": "pending",
            "code_files": []
          }
        ]
      },
      {
        "name": "Devops_Engineer Phase",
        "description": "Tasks related to devops_engineer phase",
        "deliverables": [
          "Completed DEPLOY-003",
          "Completed DEPLOY-004",
          "Completed DEPLOY-005"
        ],
        "estimated_duration_hours": 32.0,
        "work_items": [
          {
            "id": "DEPLOY-003",
            "description": "Set up a CI/CD pipeline (e.g., GitHub Actions) for the backend.",
            "dependencies": [
              "DEPLOY-001"
            ],
            "estimated_time": "8 hours",
            "agent_role": "devops_engineer",
            "acceptance_criteria": [
              "CI/CD pipeline is configured.",
              "Pipeline builds the backend Docker image on each push to the main branch.",
              "Pipeline pushes the image to a container registry (e.g., Docker Hub)."
            ],
            "status": "pending",
            "code_files": [
              ".github/workflows/*.yml"
            ]
          },
          {
            "id": "DEPLOY-004",
            "description": "Set up a CI/CD pipeline (e.g., GitHub Actions) for the frontend.",
            "dependencies": [
              "DEPLOY-002"
            ],
            "estimated_time": "8 hours",
            "agent_role": "devops_engineer",
            "acceptance_criteria": [
              "CI/CD pipeline is configured.",
              "Pipeline builds the frontend Docker image on each push to the main branch.",
              "Pipeline pushes the image to a container registry (e.g., Docker Hub)."
            ],
            "status": "pending",
            "code_files": [
              ".github/workflows/*.yml"
            ]
          },
          {
            "id": "DEPLOY-005",
            "description": "Deploy the backend and frontend to AWS (e.g., using ECS or EC2).",
            "dependencies": [
              "DEPLOY-003",
              "DEPLOY-004"
            ],
            "estimated_time": "16 hours",
            "agent_role": "devops_engineer",
            "acceptance_criteria": [
              "Backend is deployed to AWS.",
              "Frontend is deployed to AWS.",
              "Frontend can communicate with the backend.",
              "Application is accessible via a public URL."
            ],
            "status": "pending",
            "code_files": []
          }
        ]
      }
    ],
    "timeline_estimation": {
      "start_date": "2025-07-08T14:50:12.836975",
      "end_date": "TBD",
      "milestones": []
    },
    "risk_assessment": [],
    "resource_requirements": [
      {
        "role": "Backend Developer",
        "count": 1,
        "estimated_time_allocation": "100%",
        "phases": [
          "Backend Phase"
        ],
        "skills_required": []
      },
      {
        "role": "Frontend Developer",
        "count": 1,
        "estimated_time_allocation": "100%",
        "phases": [
          "Frontend Phase"
        ],
        "skills_required": []
      },
      {
        "role": "Database Specialist",
        "count": 1,
        "estimated_time_allocation": "100%",
        "phases": [
          "Database Phase"
        ],
        "skills_required": []
      },
      {
        "role": "Devops Engineer",
        "count": 1,
        "estimated_time_allocation": "100%",
        "phases": [
          "Devops_Engineer Phase"
        ],
        "skills_required": []
      }
    ],
    "deliverables": [
      "Completed FE-001",
      "Completed FE-002",
      "Completed FE-003",
      "Completed FE-004",
      "Completed FE-005",
      "Completed FE-006",
      "Completed FE-007",
      "Completed DEPLOY-002",
      "Completed TEST-002",
      "Completed MONITOR-002",
      "Completed BE-001",
      "Completed BE-002",
      "Completed BE-003",
      "Completed BE-004",
      "Completed BE-005",
      "Completed BE-006",
      "Completed SEC-001",
      "Completed DEPLOY-001",
      "Completed TEST-001",
      "Completed MONITOR-001",
      "Completed DB-001",
      "Completed DB-002",
      "Completed DEPLOY-003",
      "Completed DEPLOY-004",
      "Completed DEPLOY-005"
    ],
    "dependencies": [],
    "raw_plan": "plan=ImplementationPlan(project_summary={'title': 'Generated Project Plan', 'description': 'Develop a simple web application for managing a list of tasks, including frontend UI, backend API, and database integration.  The application will allow users to add tasks and view a list of existing tasks.  The project will be deployed to AWS using Docker and a CI/CD pipeline.  Security and performance considerations will be addressed.', 'overall_complexity': 'Medium', 'estimated_duration': 'TBD', 'key_challenges': [], 'success_criteria': []}, phases=[{'name': 'Frontend Phase', 'description': 'Tasks related to frontend phase', 'deliverables': ['Completed FE-001', 'Completed FE-002', 'Completed FE-003', 'Completed FE-004', 'Completed FE-005', 'Completed FE-006', 'Completed FE-007', 'Completed DEPLOY-002', 'Completed TEST-002', 'Completed MONITOR-002'], 'estimated_duration_hours': 46.0, 'work_items': [{'id': 'FE-001', 'description': 'Set up React project using Create React App.', 'dependencies': [], 'estimated_time': '2 hours', 'agent_role': 'frontend_developer', 'acceptance_criteria': ['Project is initialized successfully.', 'Default React app runs without errors.'], 'status': 'pending', 'code_files': ['package.json', 'src/App.js', 'src/index.js']}, {'id': 'FE-002', 'description': 'Design the basic UI layout (header, task input, task list).', 'dependencies': ['FE-001'], 'estimated_time': '4 hours', 'agent_role': 'frontend_developer', 'acceptance_criteria': ['UI layout is visually appealing.', 'Header is present.', 'Task input form is present.', 'Task list area is present.'], 'status': 'pending', 'code_files': ['src/App.js', 'src/App.css']}, {'id': 'FE-003', 'description': 'Implement the task input form (text field and add button).', 'dependencies': ['FE-002'], 'estimated_time': '4 hours', 'agent_role': 'frontend_developer', 'acceptance_criteria': ['Text field accepts user input.', 'Add button is present.', 'Button click triggers an action (e.g., console.log).'], 'status': 'pending', 'code_files': ['src/App.js', 'src/App.css']}, {'id': 'FE-004', 'description': 'Implement the display of the task list (initially hardcoded).', 'dependencies': ['FE-002'], 'estimated_time': '4 hours', 'agent_role': 'frontend_developer', 'acceptance_criteria': ['Task list area displays a list of hardcoded tasks.', 'Each task is displayed correctly.'], 'status': 'pending', 'code_files': ['src/App.js', 'src/App.css']}, {'id': 'FE-005', 'description': 'Implement API calls to the backend for adding tasks.', 'dependencies': ['FE-003', 'BE-005'], 'estimated_time': '8 hours', 'agent_role': 'frontend_developer', 'acceptance_criteria': ['Frontend makes a POST request to /tasks when the add button is clicked.', 'Frontend displays the new task in the task list after successful creation.', 'Error handling for API call failures (e.g., display error message).'], 'status': 'pending', 'code_files': ['src/App.js']}, {'id': 'FE-006', 'description': 'Implement API calls to the backend for retrieving tasks.', 'dependencies': ['FE-004', 'BE-006'], 'estimated_time': '8 hours', 'agent_role': 'frontend_developer', 'acceptance_criteria': ['Frontend makes a GET request to /tasks on component mount.', 'Frontend displays the tasks retrieved from the backend.', 'Error handling for API call failures (e.g., display error message).'], 'status': 'pending', 'code_files': ['src/App.js']}, {'id': 'FE-007', 'description': 'Implement basic input validation on the frontend.', 'dependencies': ['FE-003'], 'estimated_time': '2 hours', 'agent_role': 'frontend_developer', 'acceptance_criteria': [\"Input field is validated to ensure it's not empty before submitting.\", 'Error message is displayed if input is invalid.'], 'status': 'pending', 'code_files': ['src/App.js']}, {'id': 'DEPLOY-002', 'description': 'Create a Dockerfile for the frontend.', 'dependencies': ['FE-006'], 'estimated_time': '4 hours', 'agent_role': 'frontend_developer', 'acceptance_criteria': ['Dockerfile exists.', 'Dockerfile builds a Docker image for the frontend application.', 'Image includes all necessary dependencies.'], 'status': 'pending', 'code_files': ['Dockerfile']}, {'id': 'TEST-002', 'description': 'Write end-to-end tests for the application.', 'dependencies': ['FE-006', 'BE-006'], 'estimated_time': '8 hours', 'agent_role': 'frontend_developer', 'acceptance_criteria': ['Tests cover adding a task.', 'Tests cover viewing the task list.', 'Tests verify the correct data is displayed.'], 'status': 'pending', 'code_files': ['cypress/*.cy.js']}, {'id': 'MONITOR-002', 'description': 'Set up basic logging on the frontend.', 'dependencies': ['FE-006'], 'estimated_time': '2 hours', 'agent_role': 'frontend_developer', 'acceptance_criteria': ['Frontend logs errors to the console.'], 'status': 'pending', 'code_files': ['src/App.js']}]}, {'name': 'Backend Phase', 'description': 'Tasks related to backend phase', 'deliverables': ['Completed BE-001', 'Completed BE-002', 'Completed BE-003', 'Completed BE-004', 'Completed BE-005', 'Completed BE-006', 'Completed SEC-001', 'Completed DEPLOY-001', 'Completed TEST-001', 'Completed MONITOR-001'], 'estimated_duration_hours': 50.0, 'work_items': [{'id': 'BE-001', 'description': 'Set up Node.js and Express project.', 'dependencies': [], 'estimated_time': '2 hours', 'agent_role': 'backend_developer', 'acceptance_criteria': ['Project is initialized successfully.', 'Express server runs without errors.'], 'status': 'pending', 'code_files': ['package.json', 'index.js']}, {'id': 'BE-002', 'description': 'Implement the /tasks POST endpoint (stub).', 'dependencies': ['BE-001'], 'estimated_time': '4 hours', 'agent_role': 'backend_developer', 'acceptance_criteria': ['Endpoint accepts POST requests to /tasks.', 'Endpoint returns a 201 Created response (stubbed).', 'Endpoint logs the request body.'], 'status': 'pending', 'code_files': ['index.js']}, {'id': 'BE-003', 'description': 'Implement the /tasks GET endpoint (stub).', 'dependencies': ['BE-001'], 'estimated_time': '4 hours', 'agent_role': 'backend_developer', 'acceptance_criteria': ['Endpoint accepts GET requests to /tasks.', 'Endpoint returns a 200 OK response (stubbed) with a JSON array.', 'Endpoint logs the request.'], 'status': 'pending', 'code_files': ['index.js']}, {'id': 'BE-004', 'description': 'Connect the backend to the PostgreSQL database.', 'dependencies': ['BE-001', 'DB-001', 'DB-002'], 'estimated_time': '4 hours', 'agent_role': 'backend_developer', 'acceptance_criteria': ['Backend can connect to the PostgreSQL database.', 'Connection details are configurable (e.g., environment variables).'], 'status': 'pending', 'code_files': ['index.js']}, {'id': 'BE-005', 'description': 'Implement the /tasks POST endpoint to save tasks to the database.', 'dependencies': ['BE-002', 'BE-004'], 'estimated_time': '8 hours', 'agent_role': 'backend_developer', 'acceptance_criteria': ['Endpoint saves the task description to the database.', 'Endpoint returns a 201 Created response with the created task data (including ID).', 'Input validation is performed (description is not empty).', 'Error handling for database connection and insertion failures.'], 'status': 'pending', 'code_files': ['index.js']}, {'id': 'BE-006', 'description': 'Implement the /tasks GET endpoint to retrieve tasks from the database.', 'dependencies': ['BE-003', 'BE-004'], 'estimated_time': '8 hours', 'agent_role': 'backend_developer', 'acceptance_criteria': ['Endpoint retrieves all tasks from the database.', 'Endpoint returns a 200 OK response with a JSON array of tasks.', 'Error handling for database connection and retrieval failures.'], 'status': 'pending', 'code_files': ['index.js']}, {'id': 'SEC-001', 'description': 'Implement input validation on the backend.', 'dependencies': ['BE-005'], 'estimated_time': '4 hours', 'agent_role': 'backend_developer', 'acceptance_criteria': ['Backend validates the task description to prevent empty strings or malicious input.', 'Returns a 400 Bad Request if validation fails.'], 'status': 'pending', 'code_files': ['index.js']}, {'id': 'DEPLOY-001', 'description': 'Create a Dockerfile for the backend.', 'dependencies': ['BE-006'], 'estimated_time': '4 hours', 'agent_role': 'backend_developer', 'acceptance_criteria': ['Dockerfile exists.', 'Dockerfile builds a Docker image for the backend application.', 'Image includes all necessary dependencies.'], 'status': 'pending', 'code_files': ['Dockerfile']}, {'id': 'TEST-001', 'description': 'Write unit tests for the backend API endpoints.', 'dependencies': ['BE-005', 'BE-006'], 'estimated_time': '8 hours', 'agent_role': 'backend_developer', 'acceptance_criteria': ['Unit tests cover the /tasks POST endpoint.', 'Unit tests cover the /tasks GET endpoint.', 'Tests cover input validation.', 'Tests cover database interactions.'], 'status': 'pending', 'code_files': ['tests/*.test.js']}, {'id': 'MONITOR-001', 'description': 'Set up basic logging on the backend.', 'dependencies': ['BE-006'], 'estimated_time': '4 hours', 'agent_role': 'backend_developer', 'acceptance_criteria': ['Backend logs API requests and errors.', 'Logs are written to a file or a logging service (e.g., CloudWatch).'], 'status': 'pending', 'code_files': ['index.js']}]}, {'name': 'Database Phase', 'description': 'Tasks related to database phase', 'deliverables': ['Completed DB-001', 'Completed DB-002'], 'estimated_duration_hours': 6.0, 'work_items': [{'id': 'DB-001', 'description': 'Set up PostgreSQL database locally.', 'dependencies': [], 'estimated_time': '4 hours', 'agent_role': 'database_specialist', 'acceptance_criteria': ['PostgreSQL server is running.', \"Database 'task_list_db' is created.\", 'User with appropriate privileges is created.'], 'status': 'pending', 'code_files': []}, {'id': 'DB-002', 'description': \"Create the 'tasks' table in PostgreSQL.\", 'dependencies': ['DB-001'], 'estimated_time': '2 hours', 'agent_role': 'database_specialist', 'acceptance_criteria': [\"Table 'tasks' exists.\", \"Table has 'id', 'description', 'created_at', and 'updated_at' columns.\", \"'id' is a UUID and primary key.\", \"'created_at' and 'updated_at' have default values.\"], 'status': 'pending', 'code_files': []}]}, {'name': 'Devops_Engineer Phase', 'description': 'Tasks related to devops_engineer phase', 'deliverables': ['Completed DEPLOY-003', 'Completed DEPLOY-004', 'Completed DEPLOY-005'], 'estimated_duration_hours': 32.0, 'work_items': [{'id': 'DEPLOY-003', 'description': 'Set up a CI/CD pipeline (e.g., GitHub Actions) for the backend.', 'dependencies': ['DEPLOY-001'], 'estimated_time': '8 hours', 'agent_role': 'devops_engineer', 'acceptance_criteria': ['CI/CD pipeline is configured.', 'Pipeline builds the backend Docker image on each push to the main branch.', 'Pipeline pushes the image to a container registry (e.g., Docker Hub).'], 'status': 'pending', 'code_files': ['.github/workflows/*.yml']}, {'id': 'DEPLOY-004', 'description': 'Set up a CI/CD pipeline (e.g., GitHub Actions) for the frontend.', 'dependencies': ['DEPLOY-002'], 'estimated_time': '8 hours', 'agent_role': 'devops_engineer', 'acceptance_criteria': ['CI/CD pipeline is configured.', 'Pipeline builds the frontend Docker image on each push to the main branch.', 'Pipeline pushes the image to a container registry (e.g., Docker Hub).'], 'status': 'pending', 'code_files': ['.github/workflows/*.yml']}, {'id': 'DEPLOY-005', 'description': 'Deploy the backend and frontend to AWS (e.g., using ECS or EC2).', 'dependencies': ['DEPLOY-003', 'DEPLOY-004'], 'estimated_time': '16 hours', 'agent_role': 'devops_engineer', 'acceptance_criteria': ['Backend is deployed to AWS.', 'Frontend is deployed to AWS.', 'Frontend can communicate with the backend.', 'Application is accessible via a public URL.'], 'status': 'pending', 'code_files': []}]}], resource_allocation=[{'role': 'Backend Developer', 'count': 1, 'estimated_time_allocation': '100%', 'phases': ['Backend Phase'], 'skills_required': []}, {'role': 'Frontend Developer', 'count': 1, 'estimated_time_allocation': '100%', 'phases': ['Frontend Phase'], 'skills_required': []}, {'role': 'Database Specialist', 'count': 1, 'estimated_time_allocation': '100%', 'phases': ['Database Phase'], 'skills_required': []}, {'role': 'Devops Engineer', 'count': 1, 'estimated_time_allocation': '100%', 'phases': ['Devops_Engineer Phase'], 'skills_required': []}], risks_and_mitigations=[], timeline={'start_date': '2025-07-08T14:50:12.836975', 'end_date': 'TBD', 'milestones': []}, tech_stack={}, metadata={'generated_at': '2025-07-08T14:50:12.836975', 'version': '1.0', 'author': 'Multi-AI Dev System', 'tags': [], 'notes': 'Converted from WorkItemBacklog. Original summary: Develop a simple web application for managing a list of tasks, including frontend UI, backend API, and database integration.  The application will allow users to add tasks and view a list of existing tasks.  The project will be deployed to AWS using Docker and a CI/CD pipeline.  Security and performance considerations will be addressed.'}) summary='Develop a simple web application for managing a list of tasks, including frontend UI, backend API, and database integration.  The application will allow users to add tasks and view a list of existing tasks.  The project will be deployed to AWS using Docker and a CI/CD pipeline.  Security and performance considerations will be addressed.' metadata=PlanMetadata(generated_at='2025-07-08T14:50:12.836975', version='1.0', author='Multi-AI Dev System', tags=[], notes='Converted from WorkItemBacklog. Original summary: Develop a simple web application for managing a list of tasks, including frontend UI, backend API, and database integration.  The application will allow users to add tasks and view a list of existing tasks.  The project will be deployed to AWS using Docker and a CI/CD pipeline.  Security and performance considerations will be addressed.')"
  },
  "workflow_state_snapshot": {
    "requirements_analysis": {
      "project_name": "Hello World Task List",
      "project_summary": "A simple web application to manage a list of tasks.",
      "project_goals": [
        "Allow a user to add a task",
        "Allow a user to see their list of tasks"
      ],
      "target_audience": [
        "Users who want to manage a list of tasks"
      ],
      "business_context": "This project aims to provide a basic task management tool.",
      "requirements": [
        {
          "id": "REQ-001",
          "description": "A user can create a new task with a text description.",
          "category": "functional",
          "priority": 1
        },
        {
          "id": "REQ-002",
          "description": "A user can see a list of all created tasks.",
          "category": "functional",
          "priority": 1
        },
        {
          "id": "REQ-003",
          "description": "The application must load quickly.",
          "category": "non_functional",
          "priority": 2
        },
        {
          "id": "REQ-004",
          "description": "The application must be secure.",
          "category": "non_functional",
          "priority": 2
        }
      ],
      "functional_requirements": [
        "A user can create a new task with a text description.",
        "A user can see a list of all created tasks."
      ],
      "non_functional_requirements": [
        "The application must load quickly.",
        "The application must be secure."
      ],
      "stakeholders": [
        "Users"
      ],
      "success_criteria": [
        "Users can successfully add tasks.",
        "Users can successfully view their task list.",
        "The application loads quickly.",
        "The application is secure."
      ],
      "constraints": [],
      "assumptions": [],
      "risks": [],
      "domain_specific_details": {},
      "quality_assessment": {
        "clarity_score": 9.0,
        "completeness_score": 8.0,
        "consistency_score": 10.0,
        "recommendations": []
      },
      "gap_analysis": {
        "identified_gaps": [],
        "recommendations_for_completion": []
      }
    },
    "tech_stack_recommendation": {
      "frontend_options": [
        {
          "name": "React",
          "language": "JavaScript",
          "reasoning": "React is a popular and efficient library for building user interfaces. It offers a component-based architecture, making it easy to manage and update the UI. Its virtual DOM and efficient update mechanism contribute to fast loading times, addressing the non-functional requirement for speed. It has a large community and extensive documentation.",
          "key_libraries": [
            "React Router (for navigation)",
            "Axios or Fetch (for API calls)",
            "Material UI or Bootstrap (for UI components)"
          ],
          "pros": [
            "Component-based architecture for maintainability",
            "Virtual DOM for efficient updates",
            "Large community and ecosystem",
            "Fast loading times"
          ],
          "cons": [
            "Requires understanding of JavaScript and JSX",
            "Can have a steeper learning curve initially"
          ],
          "selected": false
        },
        {
          "name": "Vue.js",
          "language": "JavaScript",
          "reasoning": "Vue.js is a progressive framework that's easy to learn and integrate. It's known for its simplicity and clear documentation, making it a good choice for smaller projects. It offers reactivity and a component-based structure, which helps with maintainability and development speed.",
          "key_libraries": [
            "Vue Router (for navigation)",
            "Axios or Fetch (for API calls)",
            "Vuetify or BootstrapVue (for UI components)"
          ],
          "pros": [
            "Easy to learn and use",
            "Good documentation",
            "Component-based architecture",
            "Fast loading times"
          ],
          "cons": [
            "Smaller community compared to React",
            "Ecosystem might not be as extensive as React's"
          ],
          "selected": false
        },
        {
          "name": "HTML, CSS, and JavaScript (Vanilla)",
          "language": "JavaScript",
          "reasoning": "For a simple task list application, using vanilla JavaScript, HTML, and CSS can be a viable option. This approach avoids the overhead of a framework, resulting in potentially faster initial load times and simpler code for a small project. It provides direct control over the UI and is easy to understand.",
          "key_libraries": [],
          "pros": [
            "No framework dependencies",
            "Simple and easy to understand",
            "Potentially faster initial load times"
          ],
          "cons": [
            "More manual DOM manipulation",
            "Can become complex for larger applications",
            "Less structure and organization compared to frameworks"
          ],
          "selected": false
        }
      ],
      "backend_options": [
        {
          "name": "Node.js with Express",
          "language": "JavaScript",
          "reasoning": "Node.js with Express is a good choice for this project due to its speed of development, scalability, and the fact that it uses JavaScript, allowing for code reuse between the frontend and backend. Express provides a simple and flexible framework for building REST APIs.",
          "key_libraries": [
            "Express (web framework)",
            "body-parser (for parsing request bodies)",
            "cors (for handling CORS)",
            "jsonwebtoken (for authentication)"
          ],
          "pros": [
            "Fast development",
            "JavaScript for both frontend and backend",
            "Large community and ecosystem",
            "Scalable"
          ],
          "cons": [
            "Callback hell can be an issue (can be mitigated with async/await)",
            "Requires careful handling of asynchronous operations"
          ],
          "selected": false
        },
        {
          "name": "Python with Flask",
          "language": "Python",
          "reasoning": "Flask is a lightweight and flexible Python web framework. Python's readability and Flask's simplicity make it a good choice for rapid development. It's suitable for small to medium-sized projects and offers good performance.",
          "key_libraries": [
            "Flask (web framework)",
            "Flask-RESTful (for building REST APIs)",
            "SQLAlchemy (for database interaction)",
            "Flask-JWT-Extended (for authentication)"
          ],
          "pros": [
            "Easy to learn and use",
            "Good for rapid development",
            "Large community and ecosystem",
            "Readability of Python"
          ],
          "cons": [
            "Can be slower than Node.js in some cases",
            "Requires knowledge of Python"
          ],
          "selected": false
        },
        {
          "name": "Java with Spring Boot",
          "language": "Java",
          "reasoning": "Spring Boot provides a robust and mature framework for building enterprise-grade applications. While it has a steeper learning curve, it offers excellent features for security, scalability, and maintainability. It's a good choice if the project might grow in the future.",
          "key_libraries": [
            "Spring Boot (web framework)",
            "Spring Data JPA (for database interaction)",
            "Spring Security (for authentication and authorization)",
            "Lombok (for boilerplate code reduction)"
          ],
          "pros": [
            "Robust and mature framework",
            "Excellent features for security and scalability",
            "Large community and ecosystem",
            "Good for enterprise-grade applications"
          ],
          "cons": [
            "Steeper learning curve",
            "More verbose code compared to other options"
          ],
          "selected": false
        }
      ],
      "database_options": [
        {
          "name": "PostgreSQL",
          "language": null,
          "reasoning": "PostgreSQL is a powerful, open-source relational database system. It's reliable, scalable, and supports advanced features. It's a good choice for a task list application as it can handle data integrity and relationships effectively. It offers good performance and security.",
          "key_libraries": [
            "psycopg2 (for Python)",
            "pg (for Node.js)",
            "JDBC driver (for Java)"
          ],
          "pros": [
            "Reliable and scalable",
            "Supports advanced features",
            "Good performance",
            "Strong data integrity"
          ],
          "cons": [
            "Can be more complex to set up and manage than simpler databases"
          ],
          "selected": false
        },
        {
          "name": "MongoDB",
          "language": null,
          "reasoning": "MongoDB is a NoSQL document database that's easy to set up and use. It's a good choice for this project because it offers flexibility in data modeling and is relatively simple to manage. It's suitable for applications where the data structure might evolve over time.",
          "key_libraries": [
            "mongoose (for Node.js)",
            "pymongo (for Python)",
            "MongoDB Java Driver (for Java)"
          ],
          "pros": [
            "Easy to set up and use",
            "Flexible data modeling",
            "Scalable",
            "Good for evolving data structures"
          ],
          "cons": [
            "Can be less performant than relational databases for complex queries",
            "Data integrity might require more manual handling"
          ],
          "selected": false
        },
        {
          "name": "SQLite",
          "language": null,
          "reasoning": "SQLite is a lightweight, file-based database that's easy to set up and use. It's a good choice for small projects and prototyping because it requires no separate server process. It's suitable for applications with a limited amount of data and simple requirements.",
          "key_libraries": [],
          "pros": [
            "Easy to set up and use",
            "No separate server process required",
            "Good for small projects and prototyping"
          ],
          "cons": [
            "Not suitable for large-scale applications",
            "Limited concurrency support"
          ],
          "selected": false
        }
      ],
      "cloud_options": [
        {
          "name": "AWS (Amazon Web Services)",
          "language": null,
          "reasoning": "AWS provides a comprehensive suite of services for deploying and managing web applications. It offers scalability, reliability, and a wide range of options for compute, storage, and databases. It's a good choice for this project because it can easily scale to handle future growth.",
          "key_libraries": [
            "AWS SDK (for interacting with AWS services)"
          ],
          "pros": [
            "Scalable and reliable",
            "Wide range of services",
            "Mature platform",
            "Global infrastructure"
          ],
          "cons": [
            "Can be complex to manage",
            "Cost can be higher than other options"
          ],
          "selected": false
        },
        {
          "name": "Google Cloud Platform (GCP)",
          "language": null,
          "reasoning": "GCP offers a similar set of services to AWS, with a focus on data analytics and machine learning. It's a good choice for this project because it provides a cost-effective and scalable platform for deploying web applications. It has strong support for containerization and serverless computing.",
          "key_libraries": [
            "Google Cloud Client Libraries (for interacting with GCP services)"
          ],
          "pros": [
            "Cost-effective",
            "Scalable",
            "Strong support for containerization and serverless computing",
            "Good for data analytics"
          ],
          "cons": [
            "Can be complex to manage",
            "Smaller market share than AWS"
          ],
          "selected": false
        },
        {
          "name": "Heroku",
          "language": null,
          "reasoning": "Heroku is a platform-as-a-service (PaaS) that simplifies the deployment and management of web applications. It's a good choice for this project because it's easy to use and requires minimal configuration. It provides a streamlined deployment process and handles scaling automatically.",
          "key_libraries": [],
          "pros": [
            "Easy to use",
            "Simplified deployment process",
            "Automatic scaling",
            "Good for small to medium-sized projects"
          ],
          "cons": [
            "Limited customization options",
            "Can be more expensive than other options for large-scale applications"
          ],
          "selected": false
        }
      ],
      "architecture_options": [
        {
          "pattern": "Monolithic Architecture",
          "scalability_score": 5.0,
          "maintainability_score": 6.0,
          "development_speed_score": 8.0,
          "overall_score": 7.0,
          "reasoning": "For a simple task list application, a monolithic architecture is a good starting point. It's easier to develop and deploy initially. All components (frontend, backend, database) reside in a single codebase. While scalability might be limited compared to microservices, it's sufficient for the project's scope. Maintainability is good for a small codebase."
        },
        {
          "pattern": "Microservices Architecture",
          "scalability_score": 8.0,
          "maintainability_score": 7.0,
          "development_speed_score": 5.0,
          "overall_score": 6.0,
          "reasoning": "While microservices offer excellent scalability and maintainability, they might be overkill for a simple task list application. The increased complexity of managing multiple services and inter-service communication can slow down development. However, if the application is expected to grow significantly, this architecture provides a good foundation."
        },
        {
          "pattern": "Serverless Architecture",
          "scalability_score": 9.0,
          "maintainability_score": 7.0,
          "development_speed_score": 6.0,
          "overall_score": 6.5,
          "reasoning": "Serverless architecture can be a good choice for this project, especially if using a PaaS like Heroku or cloud provider's serverless offerings. It offers excellent scalability and reduces operational overhead. However, it can introduce complexities in debugging and monitoring. Development speed can be slower initially due to the need to understand serverless concepts."
        }
      ],
      "tool_options": [
        {
          "name": "Git",
          "language": null,
          "reasoning": "Git is essential for version control, allowing developers to track changes, collaborate effectively, and revert to previous versions if needed. It's a standard tool for software development.",
          "key_libraries": [],
          "pros": [
            "Version control",
            "Collaboration",
            "Branching and merging"
          ],
          "cons": [
            "Requires learning the Git commands"
          ],
          "selected": false
        },
        {
          "name": "Docker",
          "language": null,
          "reasoning": "Docker allows for containerization of the application, which simplifies deployment and ensures consistency across different environments. It helps to isolate dependencies and makes it easier to scale the application.",
          "key_libraries": [],
          "pros": [
            "Containerization",
            "Consistent environments",
            "Simplified deployment"
          ],
          "cons": [
            "Requires learning Docker concepts"
          ],
          "selected": false
        },
        {
          "name": "CI/CD Pipeline (e.g., Jenkins, GitLab CI, GitHub Actions)",
          "language": null,
          "reasoning": "A CI/CD pipeline automates the build, test, and deployment process, which improves development efficiency and reduces the risk of errors. It ensures that code changes are integrated and deployed quickly and reliably.",
          "key_libraries": [],
          "pros": [
            "Automated build, test, and deployment",
            "Improved development efficiency",
            "Reduced risk of errors"
          ],
          "cons": [
            "Requires setting up and configuring the pipeline"
          ],
          "selected": false
        }
      ],
      "risks": [
        {
          "category": "Security",
          "description": "The application could be vulnerable to cross-site scripting (XSS) attacks if user input is not properly sanitized.",
          "severity": "Medium",
          "likelihood": "Medium",
          "mitigation": "Implement input validation and output encoding to prevent XSS attacks. Use a Content Security Policy (CSP)."
        },
        {
          "category": "Performance",
          "description": "The application might experience slow loading times if the database queries are not optimized or if the frontend code is not optimized.",
          "severity": "Medium",
          "likelihood": "Medium",
          "mitigation": "Optimize database queries, use caching, and minify and compress frontend assets."
        },
        {
          "category": "Scalability",
          "description": "The application might not be able to handle a large number of users if the architecture is not designed for scalability.",
          "severity": "Low",
          "likelihood": "Low",
          "mitigation": "Choose a scalable database and cloud platform. Consider using a load balancer if the application grows."
        },
        {
          "category": "Deployment",
          "description": "Deployment issues can arise if the deployment process is not automated or if there are environment-specific configurations.",
          "severity": "Medium",
          "likelihood": "Medium",
          "mitigation": "Automate the deployment process using a CI/CD pipeline and use environment variables for configuration."
        }
      ],
      "synthesis": {
        "backend": {
          "language": "JavaScript",
          "framework": "Node.js with Express",
          "reasoning": "Node.js with Express allows for rapid development and code reuse between the frontend and backend (JavaScript). Express provides a simple and flexible framework for building REST APIs."
        },
        "frontend": {
          "language": "JavaScript",
          "framework": "React",
          "reasoning": "React provides a good balance of development speed, performance, and maintainability for this project. Its component-based architecture makes it easy to manage the UI, and its virtual DOM contributes to fast loading times."
        },
        "database": {
          "type": "PostgreSQL",
          "reasoning": "PostgreSQL is a reliable and scalable relational database that offers good performance and data integrity. It's a good choice for managing the task data."
        },
        "architecture_pattern": "Monolithic Architecture",
        "deployment_environment": {
          "cloud_platform": "AWS",
          "reasoning": "AWS provides a comprehensive suite of services for deploying and managing web applications, offering scalability, reliability, and a wide range of options."
        },
        "key_libraries_tools": [
          {
            "name": "React Router",
            "purpose": "For navigation in the React frontend."
          },
          {
            "name": "Axios",
            "purpose": "For making API calls from the frontend."
          },
          {
            "name": "Express",
            "purpose": "For building the backend API."
          },
          {
            "name": "PostgreSQL",
            "purpose": "For storing task data."
          },
          {
            "name": "Git",
            "purpose": "For version control."
          },
          {
            "name": "Docker",
            "purpose": "For containerization and deployment."
          },
          {
            "name": "CI/CD Pipeline (e.g., GitHub Actions)",
            "purpose": "For automating the build, test, and deployment process."
          }
        ],
        "estimated_complexity": "Low"
      },
      "selected_stack": null
    },
    "system_design": {
      "architecture": {
        "pattern": "Monolithic Architecture",
        "justification": "For a simple task list application, a monolithic architecture is a good starting point. It's easier to develop and deploy initially. All components (frontend, backend, database) reside in a single codebase. While scalability might be limited compared to microservices, it's sufficient for the project's scope. Maintainability is good for a small codebase.",
        "key_benefits": [
          "Faster initial development",
          "Simpler deployment",
          "Easier to manage for a small project"
        ],
        "potential_drawbacks": [
          "Limited scalability compared to microservices",
          "Can become harder to maintain as the application grows"
        ]
      },
      "components": [
        {
          "name": "Frontend",
          "description": "The user interface for the task list application.",
          "category": "frontend",
          "technologies": [
            "React",
            "JavaScript",
            "HTML",
            "CSS"
          ],
          "dependencies": [
            "Backend API"
          ],
          "responsibilities": [
            "Displaying the task list",
            "Allowing users to add new tasks",
            "Handling user interactions",
            "Making API calls to the backend"
          ],
          "design_patterns": [
            "Component-based architecture"
          ]
        },
        {
          "name": "Backend API",
          "description": "The RESTful API that handles requests from the frontend and interacts with the database.",
          "category": "backend",
          "technologies": [
            "Node.js",
            "Express",
            "JavaScript"
          ],
          "dependencies": [
            "PostgreSQL Database"
          ],
          "responsibilities": [
            "Handling API requests",
            "Validating user input",
            "Interacting with the database",
            "Returning data to the frontend"
          ],
          "design_patterns": [
            "RESTful API design"
          ]
        },
        {
          "name": "Database",
          "description": "Stores the task data.",
          "category": "database",
          "technologies": [
            "PostgreSQL"
          ],
          "dependencies": [],
          "responsibilities": [
            "Storing task data",
            "Providing data access to the backend API"
          ],
          "design_patterns": [
            "Relational database design"
          ]
        },
        {
          "name": "Deployment Infrastructure",
          "description": "The infrastructure for deploying and running the application.",
          "category": "infrastructure",
          "technologies": [
            "AWS",
            "Docker",
            "CI/CD Pipeline"
          ],
          "dependencies": [
            "Frontend",
            "Backend API",
            "Database"
          ],
          "responsibilities": [
            "Deploying the application",
            "Managing the application's resources",
            "Automating the build, test, and deployment process"
          ],
          "design_patterns": []
        }
      ],
      "data_model": {
        "schema_type": "Relational",
        "tables": [
          {
            "name": "tasks",
            "purpose": "Stores the tasks created by users.",
            "fields": [
              {
                "name": "id",
                "type": "UUID",
                "constraints": [
                  "PRIMARY KEY",
                  "NOT NULL"
                ],
                "description": "Unique identifier for the task."
              },
              {
                "name": "description",
                "type": "TEXT",
                "constraints": [
                  "NOT NULL"
                ],
                "description": "The text description of the task."
              },
              {
                "name": "created_at",
                "type": "TIMESTAMP",
                "constraints": [
                  "NOT NULL",
                  "DEFAULT CURRENT_TIMESTAMP"
                ],
                "description": "The timestamp when the task was created."
              },
              {
                "name": "updated_at",
                "type": "TIMESTAMP",
                "constraints": [
                  "NOT NULL",
                  "DEFAULT CURRENT_TIMESTAMP"
                ],
                "description": "The timestamp when the task was last updated."
              }
            ],
            "relationships": []
          }
        ],
        "relationships": [],
        "justification": "Relational database provides data integrity and is suitable for storing structured data like tasks."
      },
      "api_endpoints": {
        "style": "REST",
        "base_url": "/api/v1",
        "authentication": "None (for simplicity)",
        "endpoints": [
          {
            "method": "POST",
            "path": "/tasks",
            "purpose": "Create a new task.",
            "parameters": [
              {
                "description": "The description of the task.",
                "type": "string",
                "name": "description"
              }
            ],
            "response": {
              "201": {
                "description": "Task created successfully.",
                "example": {
                  "id": "a1b2c3d4-e5f6-7890-1234-567890abcdef",
                  "description": "Grocery shopping",
                  "created_at": "2024-10-27T10:00:00.000Z",
                  "updated_at": "2024-10-27T10:00:00.000Z"
                }
              },
              "400": {
                "description": "Bad Request - Invalid input."
              }
            },
            "authentication_required": false,
            "rate_limiting_applied": false
          },
          {
            "method": "GET",
            "path": "/tasks",
            "purpose": "Get all tasks.",
            "parameters": [],
            "response": {
              "200": {
                "description": "List of tasks.",
                "example": [
                  {
                    "id": "a1b2c3d4-e5f6-7890-1234-567890abcdef",
                    "description": "Grocery shopping",
                    "created_at": "2024-10-27T10:00:00.000Z",
                    "updated_at": "2024-10-27T10:00:00.000Z"
                  },
                  {
                    "id": "f1e2d3c4-b5a6-9087-4321-fedcba098765",
                    "description": "Book doctor appointment",
                    "created_at": "2024-10-26T14:30:00.000Z",
                    "updated_at": "2024-10-26T14:30:00.000Z"
                  }
                ]
              }
            },
            "authentication_required": false,
            "rate_limiting_applied": false
          }
        ],
        "error_handling": "Standard HTTP status codes and error messages.",
        "rate_limiting_strategy": null
      },
      "security": {
        "authentication_method": "None (for simplicity)",
        "authorization_strategy": "None (for simplicity)",
        "data_encryption": {
          "at_rest": "None (for simplicity)",
          "in_transit": "TLS/SSL"
        },
        "security_measures": [
          {
            "category": "Input Validation",
            "implementation": "Validate all user input on the backend to prevent XSS and SQL injection attacks.",
            "mitigation": "XSS and SQL injection",
            "priority": "High"
          },
          {
            "category": "Output Encoding",
            "implementation": "Encode all output data to prevent XSS attacks.",
            "mitigation": "XSS",
            "priority": "High"
          },
          {
            "category": "HTTPS",
            "implementation": "Enforce HTTPS for all communication.",
            "mitigation": "Man-in-the-middle attacks, data interception",
            "priority": "High"
          }
        ],
        "vulnerability_mitigation_strategies": [
          "Input validation",
          "Output encoding",
          "Using HTTPS",
          "Keeping dependencies up-to-date"
        ],
        "compliance_standards": []
      },
      "scalability_and_performance": {
        "caching": "Implement caching on the frontend and backend to reduce load times.",
        "database_optimization": "Optimize database queries and use indexes.",
        "code_optimization": "Minify and compress frontend assets.",
        "load_balancing": "Consider using a load balancer if the application grows."
      },
      "deployment_strategy": {
        "environment": "AWS",
        "containerization": "Use Docker to containerize the frontend and backend applications.",
        "ci_cd": "Implement a CI/CD pipeline using GitHub Actions or similar to automate the build, test, and deployment process.",
        "database_deployment": "Deploy the PostgreSQL database on AWS (e.g., using RDS)."
      },
      "monitoring_and_logging": {
        "logging": "Implement logging on both the frontend and backend to track errors and user activity.",
        "monitoring": "Use AWS CloudWatch or similar services to monitor the application's performance and health."
      },
      "error_handling_strategy": "Use standard HTTP status codes and return informative error messages. Implement centralized error handling on the backend.",
      "development_phases_overview": [
        {
          "name": "Phase 1: Setup and Frontend Development",
          "description": "Set up the development environment, create the frontend application using React, and implement the UI for adding and viewing tasks.",
          "priority": "High",
          "dependencies": [],
          "tasks": [
            "Set up React project",
            "Design and implement the UI",
            "Implement the task input form",
            "Display the task list"
          ],
          "estimated_duration": "1 week"
        },
        {
          "name": "Phase 2: Backend API Development",
          "description": "Develop the backend API using Node.js and Express to handle requests from the frontend and interact with the database.",
          "priority": "High",
          "dependencies": [
            "Phase 1: Setup and Frontend Development"
          ],
          "tasks": [
            "Set up Node.js and Express project",
            "Implement API endpoints for creating and retrieving tasks",
            "Connect to the PostgreSQL database",
            "Implement input validation"
          ],
          "estimated_duration": "1 week"
        },
        {
          "name": "Phase 3: Database Setup and Integration",
          "description": "Set up the PostgreSQL database and integrate it with the backend API.",
          "priority": "High",
          "dependencies": [
            "Phase 2: Backend API Development"
          ],
          "tasks": [
            "Set up PostgreSQL database",
            "Create the tasks table",
            "Implement database interactions in the backend API"
          ],
          "estimated_duration": "1 week"
        },
        {
          "name": "Phase 4: Frontend-Backend Integration and Testing",
          "description": "Integrate the frontend and backend, test the application, and deploy it.",
          "priority": "High",
          "dependencies": [
            "Phase 1: Setup and Frontend Development",
            "Phase 2: Backend API Development",
            "Phase 3: Database Setup and Integration"
          ],
          "tasks": [
            "Connect the frontend to the backend API",
            "Test the application thoroughly",
            "Deploy the application to AWS"
          ],
          "estimated_duration": "1 week"
        },
        {
          "name": "Phase 5: Deployment and Monitoring",
          "description": "Deploy the application to AWS, set up monitoring and logging.",
          "priority": "Medium",
          "dependencies": [
            "Phase 4: Frontend-Backend Integration and Testing"
          ],
          "tasks": [
            "Deploy the application to AWS using Docker and CI/CD pipeline",
            "Set up monitoring and logging using AWS CloudWatch"
          ],
          "estimated_duration": "1 week"
        }
      ],
      "key_risks": [
        "XSS vulnerabilities if user input is not properly sanitized.",
        "Performance issues if database queries are not optimized.",
        "Deployment issues if the CI/CD pipeline is not configured correctly."
      ],
      "design_justification": "The design prioritizes simplicity and rapid development. The monolithic architecture, React frontend, Node.js/Express backend, and PostgreSQL database are well-suited for the project's scope and requirements. The use of AWS provides a scalable and reliable deployment environment. Security measures are implemented to mitigate common vulnerabilities.",
      "data_flow": "1. User interacts with the React frontend (adds a task). 2. Frontend sends a POST request to the /tasks endpoint of the Node.js/Express backend. 3. Backend validates the input and saves the task to the PostgreSQL database. 4. Backend returns a 201 Created response with the task details. 5. Frontend displays the new task in the task list. 6. User views the task list. 7. Frontend sends a GET request to the /tasks endpoint. 8. Backend retrieves all tasks from the PostgreSQL database. 9. Backend returns a 200 OK response with the list of tasks. 10. Frontend displays the task list."
    },
    "implementation_plan": "plan=ImplementationPlan(project_summary={'title': 'Generated Project Plan', 'description': 'Develop a simple web application for managing a list of tasks, including frontend UI, backend API, and database integration.  The application will allow users to add tasks and view a list of existing tasks.  The project will be deployed to AWS using Docker and a CI/CD pipeline.  Security and performance considerations will be addressed.', 'overall_complexity': 'Medium', 'estimated_duration': 'TBD', 'key_challenges': [], 'success_criteria': []}, phases=[{'name': 'Frontend Phase', 'description': 'Tasks related to frontend phase', 'deliverables': ['Completed FE-001', 'Completed FE-002', 'Completed FE-003', 'Completed FE-004', 'Completed FE-005', 'Completed FE-006', 'Completed FE-007', 'Completed DEPLOY-002', 'Completed TEST-002', 'Completed MONITOR-002'], 'estimated_duration_hours': 46.0, 'work_items': [{'id': 'FE-001', 'description': 'Set up React project using Create React App.', 'dependencies': [], 'estimated_time': '2 hours', 'agent_role': 'frontend_developer', 'acceptance_criteria': ['Project is initialized successfully.', 'Default React app runs without errors.'], 'status': 'pending', 'code_files': ['package.json', 'src/App.js', 'src/index.js']}, {'id': 'FE-002', 'description': 'Design the basic UI layout (header, task input, task list).', 'dependencies': ['FE-001'], 'estimated_time': '4 hours', 'agent_role': 'frontend_developer', 'acceptance_criteria': ['UI layout is visually appealing.', 'Header is present.', 'Task input form is present.', 'Task list area is present.'], 'status': 'pending', 'code_files': ['src/App.js', 'src/App.css']}, {'id': 'FE-003', 'description': 'Implement the task input form (text field and add button).', 'dependencies': ['FE-002'], 'estimated_time': '4 hours', 'agent_role': 'frontend_developer', 'acceptance_criteria': ['Text field accepts user input.', 'Add button is present.', 'Button click triggers an action (e.g., console.log).'], 'status': 'pending', 'code_files': ['src/App.js', 'src/App.css']}, {'id': 'FE-004', 'description': 'Implement the display of the task list (initially hardcoded).', 'dependencies': ['FE-002'], 'estimated_time': '4 hours', 'agent_role': 'frontend_developer', 'acceptance_criteria': ['Task list area displays a list of hardcoded tasks.', 'Each task is displayed correctly.'], 'status': 'pending', 'code_files': ['src/App.js', 'src/App.css']}, {'id': 'FE-005', 'description': 'Implement API calls to the backend for adding tasks.', 'dependencies': ['FE-003', 'BE-005'], 'estimated_time': '8 hours', 'agent_role': 'frontend_developer', 'acceptance_criteria': ['Frontend makes a POST request to /tasks when the add button is clicked.', 'Frontend displays the new task in the task list after successful creation.', 'Error handling for API call failures (e.g., display error message).'], 'status': 'pending', 'code_files': ['src/App.js']}, {'id': 'FE-006', 'description': 'Implement API calls to the backend for retrieving tasks.', 'dependencies': ['FE-004', 'BE-006'], 'estimated_time': '8 hours', 'agent_role': 'frontend_developer', 'acceptance_criteria': ['Frontend makes a GET request to /tasks on component mount.', 'Frontend displays the tasks retrieved from the backend.', 'Error handling for API call failures (e.g., display error message).'], 'status': 'pending', 'code_files': ['src/App.js']}, {'id': 'FE-007', 'description': 'Implement basic input validation on the frontend.', 'dependencies': ['FE-003'], 'estimated_time': '2 hours', 'agent_role': 'frontend_developer', 'acceptance_criteria': [\"Input field is validated to ensure it's not empty before submitting.\", 'Error message is displayed if input is invalid.'], 'status': 'pending', 'code_files': ['src/App.js']}, {'id': 'DEPLOY-002', 'description': 'Create a Dockerfile for the frontend.', 'dependencies': ['FE-006'], 'estimated_time': '4 hours', 'agent_role': 'frontend_developer', 'acceptance_criteria': ['Dockerfile exists.', 'Dockerfile builds a Docker image for the frontend application.', 'Image includes all necessary dependencies.'], 'status': 'pending', 'code_files': ['Dockerfile']}, {'id': 'TEST-002', 'description': 'Write end-to-end tests for the application.', 'dependencies': ['FE-006', 'BE-006'], 'estimated_time': '8 hours', 'agent_role': 'frontend_developer', 'acceptance_criteria': ['Tests cover adding a task.', 'Tests cover viewing the task list.', 'Tests verify the correct data is displayed.'], 'status': 'pending', 'code_files': ['cypress/*.cy.js']}, {'id': 'MONITOR-002', 'description': 'Set up basic logging on the frontend.', 'dependencies': ['FE-006'], 'estimated_time': '2 hours', 'agent_role': 'frontend_developer', 'acceptance_criteria': ['Frontend logs errors to the console.'], 'status': 'pending', 'code_files': ['src/App.js']}]}, {'name': 'Backend Phase', 'description': 'Tasks related to backend phase', 'deliverables': ['Completed BE-001', 'Completed BE-002', 'Completed BE-003', 'Completed BE-004', 'Completed BE-005', 'Completed BE-006', 'Completed SEC-001', 'Completed DEPLOY-001', 'Completed TEST-001', 'Completed MONITOR-001'], 'estimated_duration_hours': 50.0, 'work_items': [{'id': 'BE-001', 'description': 'Set up Node.js and Express project.', 'dependencies': [], 'estimated_time': '2 hours', 'agent_role': 'backend_developer', 'acceptance_criteria': ['Project is initialized successfully.', 'Express server runs without errors.'], 'status': 'pending', 'code_files': ['package.json', 'index.js']}, {'id': 'BE-002', 'description': 'Implement the /tasks POST endpoint (stub).', 'dependencies': ['BE-001'], 'estimated_time': '4 hours', 'agent_role': 'backend_developer', 'acceptance_criteria': ['Endpoint accepts POST requests to /tasks.', 'Endpoint returns a 201 Created response (stubbed).', 'Endpoint logs the request body.'], 'status': 'pending', 'code_files': ['index.js']}, {'id': 'BE-003', 'description': 'Implement the /tasks GET endpoint (stub).', 'dependencies': ['BE-001'], 'estimated_time': '4 hours', 'agent_role': 'backend_developer', 'acceptance_criteria': ['Endpoint accepts GET requests to /tasks.', 'Endpoint returns a 200 OK response (stubbed) with a JSON array.', 'Endpoint logs the request.'], 'status': 'pending', 'code_files': ['index.js']}, {'id': 'BE-004', 'description': 'Connect the backend to the PostgreSQL database.', 'dependencies': ['BE-001', 'DB-001', 'DB-002'], 'estimated_time': '4 hours', 'agent_role': 'backend_developer', 'acceptance_criteria': ['Backend can connect to the PostgreSQL database.', 'Connection details are configurable (e.g., environment variables).'], 'status': 'pending', 'code_files': ['index.js']}, {'id': 'BE-005', 'description': 'Implement the /tasks POST endpoint to save tasks to the database.', 'dependencies': ['BE-002', 'BE-004'], 'estimated_time': '8 hours', 'agent_role': 'backend_developer', 'acceptance_criteria': ['Endpoint saves the task description to the database.', 'Endpoint returns a 201 Created response with the created task data (including ID).', 'Input validation is performed (description is not empty).', 'Error handling for database connection and insertion failures.'], 'status': 'pending', 'code_files': ['index.js']}, {'id': 'BE-006', 'description': 'Implement the /tasks GET endpoint to retrieve tasks from the database.', 'dependencies': ['BE-003', 'BE-004'], 'estimated_time': '8 hours', 'agent_role': 'backend_developer', 'acceptance_criteria': ['Endpoint retrieves all tasks from the database.', 'Endpoint returns a 200 OK response with a JSON array of tasks.', 'Error handling for database connection and retrieval failures.'], 'status': 'pending', 'code_files': ['index.js']}, {'id': 'SEC-001', 'description': 'Implement input validation on the backend.', 'dependencies': ['BE-005'], 'estimated_time': '4 hours', 'agent_role': 'backend_developer', 'acceptance_criteria': ['Backend validates the task description to prevent empty strings or malicious input.', 'Returns a 400 Bad Request if validation fails.'], 'status': 'pending', 'code_files': ['index.js']}, {'id': 'DEPLOY-001', 'description': 'Create a Dockerfile for the backend.', 'dependencies': ['BE-006'], 'estimated_time': '4 hours', 'agent_role': 'backend_developer', 'acceptance_criteria': ['Dockerfile exists.', 'Dockerfile builds a Docker image for the backend application.', 'Image includes all necessary dependencies.'], 'status': 'pending', 'code_files': ['Dockerfile']}, {'id': 'TEST-001', 'description': 'Write unit tests for the backend API endpoints.', 'dependencies': ['BE-005', 'BE-006'], 'estimated_time': '8 hours', 'agent_role': 'backend_developer', 'acceptance_criteria': ['Unit tests cover the /tasks POST endpoint.', 'Unit tests cover the /tasks GET endpoint.', 'Tests cover input validation.', 'Tests cover database interactions.'], 'status': 'pending', 'code_files': ['tests/*.test.js']}, {'id': 'MONITOR-001', 'description': 'Set up basic logging on the backend.', 'dependencies': ['BE-006'], 'estimated_time': '4 hours', 'agent_role': 'backend_developer', 'acceptance_criteria': ['Backend logs API requests and errors.', 'Logs are written to a file or a logging service (e.g., CloudWatch).'], 'status': 'pending', 'code_files': ['index.js']}]}, {'name': 'Database Phase', 'description': 'Tasks related to database phase', 'deliverables': ['Completed DB-001', 'Completed DB-002'], 'estimated_duration_hours': 6.0, 'work_items': [{'id': 'DB-001', 'description': 'Set up PostgreSQL database locally.', 'dependencies': [], 'estimated_time': '4 hours', 'agent_role': 'database_specialist', 'acceptance_criteria': ['PostgreSQL server is running.', \"Database 'task_list_db' is created.\", 'User with appropriate privileges is created.'], 'status': 'pending', 'code_files': []}, {'id': 'DB-002', 'description': \"Create the 'tasks' table in PostgreSQL.\", 'dependencies': ['DB-001'], 'estimated_time': '2 hours', 'agent_role': 'database_specialist', 'acceptance_criteria': [\"Table 'tasks' exists.\", \"Table has 'id', 'description', 'created_at', and 'updated_at' columns.\", \"'id' is a UUID and primary key.\", \"'created_at' and 'updated_at' have default values.\"], 'status': 'pending', 'code_files': []}]}, {'name': 'Devops_Engineer Phase', 'description': 'Tasks related to devops_engineer phase', 'deliverables': ['Completed DEPLOY-003', 'Completed DEPLOY-004', 'Completed DEPLOY-005'], 'estimated_duration_hours': 32.0, 'work_items': [{'id': 'DEPLOY-003', 'description': 'Set up a CI/CD pipeline (e.g., GitHub Actions) for the backend.', 'dependencies': ['DEPLOY-001'], 'estimated_time': '8 hours', 'agent_role': 'devops_engineer', 'acceptance_criteria': ['CI/CD pipeline is configured.', 'Pipeline builds the backend Docker image on each push to the main branch.', 'Pipeline pushes the image to a container registry (e.g., Docker Hub).'], 'status': 'pending', 'code_files': ['.github/workflows/*.yml']}, {'id': 'DEPLOY-004', 'description': 'Set up a CI/CD pipeline (e.g., GitHub Actions) for the frontend.', 'dependencies': ['DEPLOY-002'], 'estimated_time': '8 hours', 'agent_role': 'devops_engineer', 'acceptance_criteria': ['CI/CD pipeline is configured.', 'Pipeline builds the frontend Docker image on each push to the main branch.', 'Pipeline pushes the image to a container registry (e.g., Docker Hub).'], 'status': 'pending', 'code_files': ['.github/workflows/*.yml']}, {'id': 'DEPLOY-005', 'description': 'Deploy the backend and frontend to AWS (e.g., using ECS or EC2).', 'dependencies': ['DEPLOY-003', 'DEPLOY-004'], 'estimated_time': '16 hours', 'agent_role': 'devops_engineer', 'acceptance_criteria': ['Backend is deployed to AWS.', 'Frontend is deployed to AWS.', 'Frontend can communicate with the backend.', 'Application is accessible via a public URL.'], 'status': 'pending', 'code_files': []}]}], resource_allocation=[{'role': 'Backend Developer', 'count': 1, 'estimated_time_allocation': '100%', 'phases': ['Backend Phase'], 'skills_required': []}, {'role': 'Frontend Developer', 'count': 1, 'estimated_time_allocation': '100%', 'phases': ['Frontend Phase'], 'skills_required': []}, {'role': 'Database Specialist', 'count': 1, 'estimated_time_allocation': '100%', 'phases': ['Database Phase'], 'skills_required': []}, {'role': 'Devops Engineer', 'count': 1, 'estimated_time_allocation': '100%', 'phases': ['Devops_Engineer Phase'], 'skills_required': []}], risks_and_mitigations=[], timeline={'start_date': '2025-07-08T14:50:12.836975', 'end_date': 'TBD', 'milestones': []}, tech_stack={}, metadata={'generated_at': '2025-07-08T14:50:12.836975', 'version': '1.0', 'author': 'Multi-AI Dev System', 'tags': [], 'notes': 'Converted from WorkItemBacklog. Original summary: Develop a simple web application for managing a list of tasks, including frontend UI, backend API, and database integration.  The application will allow users to add tasks and view a list of existing tasks.  The project will be deployed to AWS using Docker and a CI/CD pipeline.  Security and performance considerations will be addressed.'}) summary='Develop a simple web application for managing a list of tasks, including frontend UI, backend API, and database integration.  The application will allow users to add tasks and view a list of existing tasks.  The project will be deployed to AWS using Docker and a CI/CD pipeline.  Security and performance considerations will be addressed.' metadata=PlanMetadata(generated_at='2025-07-08T14:50:12.836975', version='1.0', author='Multi-AI Dev System', tags=[], notes='Converted from WorkItemBacklog. Original summary: Develop a simple web application for managing a list of tasks, including frontend UI, backend API, and database integration.  The application will allow users to add tasks and view a list of existing tasks.  The project will be deployed to AWS using Docker and a CI/CD pipeline.  Security and performance considerations will be addressed.')"
  }
}