{
  "session_id": "session_d16e3560-6c41-4768-a619-d80c0144f06a",
  "approval_type": "implementation_plan",
  "timestamp": 1751978013,
  "approval_data": {
    "type": "implementation_plan",
    "timestamp": 1751978013.7602143,
    "project_overview": "Develop a simple web application for managing a list of tasks, including adding, viewing, and updating tasks. The application will use React for the frontend, Node.js and Express.js for the backend, and PostgreSQL for the database. The application will be deployed to AWS using a CI/CD pipeline.",
    "development_phases": [
      {
        "name": "Frontend Phase",
        "description": "Tasks related to frontend phase",
        "deliverables": [
          "Completed FE-001",
          "Completed FE-002",
          "Completed FE-003",
          "Completed FE-004",
          "Completed FE-005",
          "Completed FE-006",
          "Completed FE-007",
          "Completed FE-008",
          "Completed FE-009",
          "Completed FE-010",
          "Completed OP-001"
        ],
        "estimated_duration_hours": 68.0,
        "work_items": [
          {
            "id": "FE-001",
            "description": "Set up React project using Create React App.",
            "dependencies": [],
            "estimated_time": "4 hours",
            "agent_role": "frontend_developer",
            "acceptance_criteria": [
              "Project is initialized successfully.",
              "Default React app runs without errors."
            ],
            "status": "pending",
            "code_files": [
              "package.json",
              "src/App.js",
              "src/index.js"
            ]
          },
          {
            "id": "FE-002",
            "description": "Install and configure a UI component library (e.g., Material UI, Chakra UI).",
            "dependencies": [
              "FE-001"
            ],
            "estimated_time": "4 hours",
            "agent_role": "frontend_developer",
            "acceptance_criteria": [
              "UI library is installed.",
              "A basic UI component (e.g., button, text field) renders correctly."
            ],
            "status": "pending",
            "code_files": [
              "package.json",
              "src/App.js"
            ]
          },
          {
            "id": "FE-003",
            "description": "Design and implement the UI for adding a new task (input field and add button).",
            "dependencies": [
              "FE-002"
            ],
            "estimated_time": "8 hours",
            "agent_role": "frontend_developer",
            "acceptance_criteria": [
              "Input field for task description exists.",
              "Add button exists.",
              "UI elements are styled appropriately."
            ],
            "status": "pending",
            "code_files": [
              "src/App.js",
              "src/components/TaskInput.js"
            ]
          },
          {
            "id": "FE-004",
            "description": "Design and implement the UI for displaying the task list.",
            "dependencies": [
              "FE-002"
            ],
            "estimated_time": "8 hours",
            "agent_role": "frontend_developer",
            "acceptance_criteria": [
              "Task list container exists.",
              "Each task is displayed with its description.",
              "Tasks are styled appropriately."
            ],
            "status": "pending",
            "code_files": [
              "src/App.js",
              "src/components/TaskList.js",
              "src/components/TaskItem.js"
            ]
          },
          {
            "id": "FE-005",
            "description": "Implement basic styling for the frontend.",
            "dependencies": [
              "FE-003",
              "FE-004"
            ],
            "estimated_time": "4 hours",
            "agent_role": "frontend_developer",
            "acceptance_criteria": [
              "UI elements are visually appealing.",
              "Consistent styling is applied throughout the application."
            ],
            "status": "pending",
            "code_files": [
              "src/App.css",
              "src/components/*.css"
            ]
          },
          {
            "id": "FE-006",
            "description": "Implement API calls to the backend for adding tasks.",
            "dependencies": [
              "FE-003",
              "BE-004"
            ],
            "estimated_time": "6 hours",
            "agent_role": "frontend_developer",
            "acceptance_criteria": [
              "Frontend makes a POST request to /tasks when the add button is clicked.",
              "Task description is sent in the request body.",
              "Frontend handles the successful response (201) and updates the UI.",
              "Frontend handles error responses (400)."
            ],
            "status": "pending",
            "code_files": [
              "src/App.js",
              "src/components/TaskInput.js"
            ]
          },
          {
            "id": "FE-007",
            "description": "Implement API calls to the backend for fetching tasks.",
            "dependencies": [
              "FE-004",
              "BE-005"
            ],
            "estimated_time": "6 hours",
            "agent_role": "frontend_developer",
            "acceptance_criteria": [
              "Frontend makes a GET request to /tasks on component mount.",
              "Frontend displays the retrieved tasks in the task list.",
              "Frontend handles error responses."
            ],
            "status": "pending",
            "code_files": [
              "src/App.js",
              "src/components/TaskList.js"
            ]
          },
          {
            "id": "FE-008",
            "description": "Implement API calls to the backend for updating task completion status.",
            "dependencies": [
              "FE-004",
              "BE-006"
            ],
            "estimated_time": "6 hours",
            "agent_role": "frontend_developer",
            "acceptance_criteria": [
              "Frontend makes a PUT request to /tasks/{id} when a task's completion status changes.",
              "Frontend sends the updated 'completed' status in the request body.",
              "Frontend updates the UI based on the response.",
              "Frontend handles error responses."
            ],
            "status": "pending",
            "code_files": [
              "src/App.js",
              "src/components/TaskItem.js"
            ]
          },
          {
            "id": "FE-009",
            "description": "Implement API calls to the backend for deleting tasks.",
            "dependencies": [
              "FE-004",
              "BE-007"
            ],
            "estimated_time": "6 hours",
            "agent_role": "frontend_developer",
            "acceptance_criteria": [
              "Frontend makes a DELETE request to /tasks/{id} when a task is deleted.",
              "Frontend updates the UI based on the response.",
              "Frontend handles error responses."
            ],
            "status": "pending",
            "code_files": [
              "src/App.js",
              "src/components/TaskItem.js"
            ]
          },
          {
            "id": "FE-010",
            "description": "Write unit tests for frontend components (e.g., TaskInput, TaskList).",
            "dependencies": [
              "FE-003",
              "FE-004"
            ],
            "estimated_time": "8 hours",
            "agent_role": "frontend_developer",
            "acceptance_criteria": [
              "Tests cover key functionality of each component.",
              "Tests pass successfully."
            ],
            "status": "pending",
            "code_files": [
              "src/components/*.test.js"
            ]
          },
          {
            "id": "OP-001",
            "description": "Optimize frontend code for performance (e.g., code splitting, lazy loading).",
            "dependencies": [
              "FE-001",
              "FE-002",
              "FE-003",
              "FE-004",
              "FE-005",
              "FE-006",
              "FE-007",
              "FE-008",
              "FE-009"
            ],
            "estimated_time": "8 hours",
            "agent_role": "frontend_developer",
            "acceptance_criteria": [
              "Code splitting is implemented.",
              "Lazy loading of components is implemented.",
              "Frontend performance is improved (e.g., faster loading times)."
            ],
            "status": "pending",
            "code_files": [
              "src/App.js",
              "webpack.config.js"
            ]
          }
        ]
      },
      {
        "name": "Backend Phase",
        "description": "Tasks related to backend phase",
        "deliverables": [
          "Completed BE-001",
          "Completed BE-002",
          "Completed BE-004",
          "Completed BE-005",
          "Completed BE-006",
          "Completed BE-007",
          "Completed BE-008",
          "Completed IT-001",
          "Completed SE-002",
          "Completed MO-001",
          "Completed OP-002",
          "Completed PT-001"
        ],
        "estimated_duration_hours": 86.0,
        "work_items": [
          {
            "id": "BE-001",
            "description": "Set up Node.js and Express.js project.",
            "dependencies": [],
            "estimated_time": "4 hours",
            "agent_role": "backend_developer",
            "acceptance_criteria": [
              "Project is initialized.",
              "Express.js server runs without errors.",
              "Basic route (e.g., /) responds with 'Hello World'."
            ],
            "status": "pending",
            "code_files": [
              "package.json",
              "index.js"
            ]
          },
          {
            "id": "BE-002",
            "description": "Install and configure PostgreSQL and a database connector (e.g., pg, pg-promise).",
            "dependencies": [
              "BE-001"
            ],
            "estimated_time": "4 hours",
            "agent_role": "backend_developer",
            "acceptance_criteria": [
              "PostgreSQL is installed and accessible.",
              "Database connector is installed.",
              "Connection to the database is established successfully."
            ],
            "status": "pending",
            "code_files": [
              "package.json",
              "db.js"
            ]
          },
          {
            "id": "BE-004",
            "description": "Implement the POST /tasks endpoint (create a new task).",
            "dependencies": [
              "BE-001",
              "BE-002",
              "BE-003"
            ],
            "estimated_time": "8 hours",
            "agent_role": "backend_developer",
            "acceptance_criteria": [
              "Endpoint accepts a POST request to /tasks.",
              "Endpoint validates the 'description' parameter.",
              "Endpoint inserts a new task into the database.",
              "Endpoint returns a 201 status code and the created task."
            ],
            "status": "pending",
            "code_files": [
              "index.js",
              "routes/tasks.js"
            ]
          },
          {
            "id": "BE-005",
            "description": "Implement the GET /tasks endpoint (get all tasks).",
            "dependencies": [
              "BE-001",
              "BE-002",
              "BE-003"
            ],
            "estimated_time": "6 hours",
            "agent_role": "backend_developer",
            "acceptance_criteria": [
              "Endpoint accepts a GET request to /tasks.",
              "Endpoint retrieves all tasks from the database.",
              "Endpoint returns a 200 status code and the list of tasks."
            ],
            "status": "pending",
            "code_files": [
              "index.js",
              "routes/tasks.js"
            ]
          },
          {
            "id": "BE-006",
            "description": "Implement the PUT /tasks/{id} endpoint (update a task's completion status).",
            "dependencies": [
              "BE-001",
              "BE-002",
              "BE-003"
            ],
            "estimated_time": "8 hours",
            "agent_role": "backend_developer",
            "acceptance_criteria": [
              "Endpoint accepts a PUT request to /tasks/{id}.",
              "Endpoint validates the 'id' parameter.",
              "Endpoint validates the 'completed' parameter.",
              "Endpoint updates the task's completion status in the database.",
              "Endpoint returns a 200 status code and the updated task.",
              "Endpoint returns a 404 if the task is not found."
            ],
            "status": "pending",
            "code_files": [
              "index.js",
              "routes/tasks.js"
            ]
          },
          {
            "id": "BE-007",
            "description": "Implement the DELETE /tasks/{id} endpoint (delete a task).",
            "dependencies": [
              "BE-001",
              "BE-002",
              "BE-003"
            ],
            "estimated_time": "6 hours",
            "agent_role": "backend_developer",
            "acceptance_criteria": [
              "Endpoint accepts a DELETE request to /tasks/{id}.",
              "Endpoint validates the 'id' parameter.",
              "Endpoint deletes the task from the database.",
              "Endpoint returns a 204 status code.",
              "Endpoint returns a 404 if the task is not found."
            ],
            "status": "pending",
            "code_files": [
              "index.js",
              "routes/tasks.js"
            ]
          },
          {
            "id": "BE-008",
            "description": "Write unit tests for backend API endpoints.",
            "dependencies": [
              "BE-004",
              "BE-005",
              "BE-006",
              "BE-007"
            ],
            "estimated_time": "12 hours",
            "agent_role": "backend_developer",
            "acceptance_criteria": [
              "Tests cover all API endpoints (POST, GET, PUT, DELETE).",
              "Tests verify correct request handling, database interactions, and response codes.",
              "Tests pass successfully."
            ],
            "status": "pending",
            "code_files": [
              "tests/*.test.js"
            ]
          },
          {
            "id": "IT-001",
            "description": "Write integration tests to verify the interaction between frontend and backend.",
            "dependencies": [
              "FE-006",
              "FE-007",
              "FE-008",
              "FE-009",
              "BE-004",
              "BE-005",
              "BE-006",
              "BE-007"
            ],
            "estimated_time": "12 hours",
            "agent_role": "backend_developer",
            "acceptance_criteria": [
              "Tests verify end-to-end functionality (e.g., adding a task, viewing tasks, updating completion status, deleting a task).",
              "Tests cover successful and error scenarios.",
              "Tests pass successfully."
            ],
            "status": "pending",
            "code_files": [
              "tests/integration/*.test.js"
            ]
          },
          {
            "id": "SE-002",
            "description": "Implement input validation on the backend.",
            "dependencies": [
              "BE-004",
              "BE-006"
            ],
            "estimated_time": "6 hours",
            "agent_role": "backend_developer",
            "acceptance_criteria": [
              "Backend validates all user inputs (e.g., task description).",
              "Invalid inputs are rejected with appropriate error messages.",
              "Input validation prevents XSS and SQL injection vulnerabilities."
            ],
            "status": "pending",
            "code_files": [
              "routes/tasks.js"
            ]
          },
          {
            "id": "MO-001",
            "description": "Set up logging for the backend (e.g., using Winston or similar).",
            "dependencies": [
              "BE-001",
              "BE-004",
              "BE-005",
              "BE-006",
              "BE-007"
            ],
            "estimated_time": "4 hours",
            "agent_role": "backend_developer",
            "acceptance_criteria": [
              "Logging is implemented for API requests, errors, and application events.",
              "Logs are written to a file or a logging service (e.g., CloudWatch)."
            ],
            "status": "pending",
            "code_files": [
              "index.js",
              "logger.js"
            ]
          },
          {
            "id": "OP-002",
            "description": "Optimize backend code for performance (e.g., caching, database indexing).",
            "dependencies": [
              "BE-002",
              "BE-004",
              "BE-005",
              "BE-006",
              "BE-007"
            ],
            "estimated_time": "8 hours",
            "agent_role": "backend_developer",
            "acceptance_criteria": [
              "Caching is implemented for frequently accessed data.",
              "Database indexes are created for frequently queried columns.",
              "Backend performance is improved (e.g., faster API response times)."
            ],
            "status": "pending",
            "code_files": [
              "db.js",
              "routes/tasks.js"
            ]
          },
          {
            "id": "PT-001",
            "description": "Conduct performance testing.",
            "dependencies": [
              "OP-001",
              "OP-002"
            ],
            "estimated_time": "8 hours",
            "agent_role": "backend_developer",
            "acceptance_criteria": [
              "Performance tests are conducted (e.g., using JMeter or similar).",
              "Performance metrics are collected and analyzed.",
              "Performance bottlenecks are identified and addressed."
            ],
            "status": "pending",
            "code_files": [
              "performance_tests/*.jmx"
            ]
          }
        ]
      },
      {
        "name": "Database Phase",
        "description": "Tasks related to database phase",
        "deliverables": [
          "Completed BE-003"
        ],
        "estimated_duration_hours": 4.0,
        "work_items": [
          {
            "id": "BE-003",
            "description": "Create the 'tasks' table in PostgreSQL.",
            "dependencies": [
              "BE-002"
            ],
            "estimated_time": "4 hours",
            "agent_role": "database_specialist",
            "acceptance_criteria": [
              "Tasks table exists.",
              "Table has 'id', 'description', 'created_at', and 'completed' columns.",
              "Appropriate data types and constraints are defined."
            ],
            "status": "pending",
            "code_files": [
              "db/schema.sql"
            ]
          }
        ]
      },
      {
        "name": "Devops_Engineer Phase",
        "description": "Tasks related to devops_engineer phase",
        "deliverables": [
          "Completed DE-001",
          "Completed DE-002",
          "Completed DE-003",
          "Completed SE-001",
          "Completed MO-002"
        ],
        "estimated_duration_hours": 26.0,
        "work_items": [
          {
            "id": "DE-001",
            "description": "Create a Dockerfile for the frontend.",
            "dependencies": [
              "FE-001",
              "FE-002",
              "FE-003",
              "FE-004",
              "FE-005",
              "FE-006",
              "FE-007",
              "FE-008",
              "FE-009"
            ],
            "estimated_time": "4 hours",
            "agent_role": "devops_engineer",
            "acceptance_criteria": [
              "Dockerfile exists.",
              "Dockerfile builds a Docker image for the frontend application.",
              "Image includes all necessary dependencies."
            ],
            "status": "pending",
            "code_files": [
              "Dockerfile.frontend"
            ]
          },
          {
            "id": "DE-002",
            "description": "Create a Dockerfile for the backend.",
            "dependencies": [
              "BE-001",
              "BE-002",
              "BE-003",
              "BE-004",
              "BE-005",
              "BE-006",
              "BE-007"
            ],
            "estimated_time": "4 hours",
            "agent_role": "devops_engineer",
            "acceptance_criteria": [
              "Dockerfile exists.",
              "Dockerfile builds a Docker image for the backend application.",
              "Image includes all necessary dependencies."
            ],
            "status": "pending",
            "code_files": [
              "Dockerfile.backend"
            ]
          },
          {
            "id": "DE-003",
            "description": "Set up a CI/CD pipeline (e.g., GitHub Actions) to build, test, and deploy the application.",
            "dependencies": [
              "DE-001",
              "DE-002",
              "IT-001"
            ],
            "estimated_time": "8 hours",
            "agent_role": "devops_engineer",
            "acceptance_criteria": [
              "CI/CD pipeline is configured.",
              "Pipeline builds and tests the frontend and backend.",
              "Pipeline deploys the application to AWS (or chosen cloud provider).",
              "Deployment is automated."
            ],
            "status": "pending",
            "code_files": [
              ".github/workflows/*.yml"
            ]
          },
          {
            "id": "SE-001",
            "description": "Implement HTTPS for secure communication.",
            "dependencies": [
              "DE-003"
            ],
            "estimated_time": "4 hours",
            "agent_role": "devops_engineer",
            "acceptance_criteria": [
              "HTTPS is enabled for the application.",
              "All communication between the frontend and backend is encrypted."
            ],
            "status": "pending",
            "code_files": [
              "nginx.conf",
              "Dockerfile.backend"
            ]
          },
          {
            "id": "MO-002",
            "description": "Set up monitoring for the application (e.g., using AWS CloudWatch).",
            "dependencies": [
              "DE-003",
              "MO-001"
            ],
            "estimated_time": "6 hours",
            "agent_role": "devops_engineer",
            "acceptance_criteria": [
              "Monitoring is configured to track application performance, resource usage, and error rates.",
              "Alerts are set up for critical errors and performance issues."
            ],
            "status": "pending",
            "code_files": [
              "cloudwatch.yml"
            ]
          }
        ]
      }
    ],
    "timeline_estimation": {
      "start_date": "2025-07-08T18:03:33.208791",
      "end_date": "TBD",
      "milestones": []
    },
    "risk_assessment": [],
    "resource_requirements": [
      {
        "role": "Backend Developer",
        "count": 1,
        "estimated_time_allocation": "100%",
        "phases": [
          "Backend Phase"
        ],
        "skills_required": []
      },
      {
        "role": "Database Specialist",
        "count": 1,
        "estimated_time_allocation": "100%",
        "phases": [
          "Database Phase"
        ],
        "skills_required": []
      },
      {
        "role": "Devops Engineer",
        "count": 1,
        "estimated_time_allocation": "100%",
        "phases": [
          "Devops_Engineer Phase"
        ],
        "skills_required": []
      },
      {
        "role": "Frontend Developer",
        "count": 1,
        "estimated_time_allocation": "100%",
        "phases": [
          "Frontend Phase"
        ],
        "skills_required": []
      }
    ],
    "deliverables": [
      "Completed FE-001",
      "Completed FE-002",
      "Completed FE-003",
      "Completed FE-004",
      "Completed FE-005",
      "Completed FE-006",
      "Completed FE-007",
      "Completed FE-008",
      "Completed FE-009",
      "Completed FE-010",
      "Completed OP-001",
      "Completed BE-001",
      "Completed BE-002",
      "Completed BE-004",
      "Completed BE-005",
      "Completed BE-006",
      "Completed BE-007",
      "Completed BE-008",
      "Completed IT-001",
      "Completed SE-002",
      "Completed MO-001",
      "Completed OP-002",
      "Completed PT-001",
      "Completed BE-003",
      "Completed DE-001",
      "Completed DE-002",
      "Completed DE-003",
      "Completed SE-001",
      "Completed MO-002"
    ],
    "dependencies": [],
    "raw_plan": "plan=ImplementationPlan(project_summary={'title': 'Generated Project Plan', 'description': 'Develop a simple web application for managing a list of tasks, including adding, viewing, and updating tasks. The application will use React for the frontend, Node.js and Express.js for the backend, and PostgreSQL for the database. The application will be deployed to AWS using a CI/CD pipeline.', 'overall_complexity': 'Medium', 'estimated_duration': 'TBD', 'key_challenges': [], 'success_criteria': []}, phases=[{'name': 'Frontend Phase', 'description': 'Tasks related to frontend phase', 'deliverables': ['Completed FE-001', 'Completed FE-002', 'Completed FE-003', 'Completed FE-004', 'Completed FE-005', 'Completed FE-006', 'Completed FE-007', 'Completed FE-008', 'Completed FE-009', 'Completed FE-010', 'Completed OP-001'], 'estimated_duration_hours': 68.0, 'work_items': [{'id': 'FE-001', 'description': 'Set up React project using Create React App.', 'dependencies': [], 'estimated_time': '4 hours', 'agent_role': 'frontend_developer', 'acceptance_criteria': ['Project is initialized successfully.', 'Default React app runs without errors.'], 'status': 'pending', 'code_files': ['package.json', 'src/App.js', 'src/index.js']}, {'id': 'FE-002', 'description': 'Install and configure a UI component library (e.g., Material UI, Chakra UI).', 'dependencies': ['FE-001'], 'estimated_time': '4 hours', 'agent_role': 'frontend_developer', 'acceptance_criteria': ['UI library is installed.', 'A basic UI component (e.g., button, text field) renders correctly.'], 'status': 'pending', 'code_files': ['package.json', 'src/App.js']}, {'id': 'FE-003', 'description': 'Design and implement the UI for adding a new task (input field and add button).', 'dependencies': ['FE-002'], 'estimated_time': '8 hours', 'agent_role': 'frontend_developer', 'acceptance_criteria': ['Input field for task description exists.', 'Add button exists.', 'UI elements are styled appropriately.'], 'status': 'pending', 'code_files': ['src/App.js', 'src/components/TaskInput.js']}, {'id': 'FE-004', 'description': 'Design and implement the UI for displaying the task list.', 'dependencies': ['FE-002'], 'estimated_time': '8 hours', 'agent_role': 'frontend_developer', 'acceptance_criteria': ['Task list container exists.', 'Each task is displayed with its description.', 'Tasks are styled appropriately.'], 'status': 'pending', 'code_files': ['src/App.js', 'src/components/TaskList.js', 'src/components/TaskItem.js']}, {'id': 'FE-005', 'description': 'Implement basic styling for the frontend.', 'dependencies': ['FE-003', 'FE-004'], 'estimated_time': '4 hours', 'agent_role': 'frontend_developer', 'acceptance_criteria': ['UI elements are visually appealing.', 'Consistent styling is applied throughout the application.'], 'status': 'pending', 'code_files': ['src/App.css', 'src/components/*.css']}, {'id': 'FE-006', 'description': 'Implement API calls to the backend for adding tasks.', 'dependencies': ['FE-003', 'BE-004'], 'estimated_time': '6 hours', 'agent_role': 'frontend_developer', 'acceptance_criteria': ['Frontend makes a POST request to /tasks when the add button is clicked.', 'Task description is sent in the request body.', 'Frontend handles the successful response (201) and updates the UI.', 'Frontend handles error responses (400).'], 'status': 'pending', 'code_files': ['src/App.js', 'src/components/TaskInput.js']}, {'id': 'FE-007', 'description': 'Implement API calls to the backend for fetching tasks.', 'dependencies': ['FE-004', 'BE-005'], 'estimated_time': '6 hours', 'agent_role': 'frontend_developer', 'acceptance_criteria': ['Frontend makes a GET request to /tasks on component mount.', 'Frontend displays the retrieved tasks in the task list.', 'Frontend handles error responses.'], 'status': 'pending', 'code_files': ['src/App.js', 'src/components/TaskList.js']}, {'id': 'FE-008', 'description': 'Implement API calls to the backend for updating task completion status.', 'dependencies': ['FE-004', 'BE-006'], 'estimated_time': '6 hours', 'agent_role': 'frontend_developer', 'acceptance_criteria': [\"Frontend makes a PUT request to /tasks/{id} when a task's completion status changes.\", \"Frontend sends the updated 'completed' status in the request body.\", 'Frontend updates the UI based on the response.', 'Frontend handles error responses.'], 'status': 'pending', 'code_files': ['src/App.js', 'src/components/TaskItem.js']}, {'id': 'FE-009', 'description': 'Implement API calls to the backend for deleting tasks.', 'dependencies': ['FE-004', 'BE-007'], 'estimated_time': '6 hours', 'agent_role': 'frontend_developer', 'acceptance_criteria': ['Frontend makes a DELETE request to /tasks/{id} when a task is deleted.', 'Frontend updates the UI based on the response.', 'Frontend handles error responses.'], 'status': 'pending', 'code_files': ['src/App.js', 'src/components/TaskItem.js']}, {'id': 'FE-010', 'description': 'Write unit tests for frontend components (e.g., TaskInput, TaskList).', 'dependencies': ['FE-003', 'FE-004'], 'estimated_time': '8 hours', 'agent_role': 'frontend_developer', 'acceptance_criteria': ['Tests cover key functionality of each component.', 'Tests pass successfully.'], 'status': 'pending', 'code_files': ['src/components/*.test.js']}, {'id': 'OP-001', 'description': 'Optimize frontend code for performance (e.g., code splitting, lazy loading).', 'dependencies': ['FE-001', 'FE-002', 'FE-003', 'FE-004', 'FE-005', 'FE-006', 'FE-007', 'FE-008', 'FE-009'], 'estimated_time': '8 hours', 'agent_role': 'frontend_developer', 'acceptance_criteria': ['Code splitting is implemented.', 'Lazy loading of components is implemented.', 'Frontend performance is improved (e.g., faster loading times).'], 'status': 'pending', 'code_files': ['src/App.js', 'webpack.config.js']}]}, {'name': 'Backend Phase', 'description': 'Tasks related to backend phase', 'deliverables': ['Completed BE-001', 'Completed BE-002', 'Completed BE-004', 'Completed BE-005', 'Completed BE-006', 'Completed BE-007', 'Completed BE-008', 'Completed IT-001', 'Completed SE-002', 'Completed MO-001', 'Completed OP-002', 'Completed PT-001'], 'estimated_duration_hours': 86.0, 'work_items': [{'id': 'BE-001', 'description': 'Set up Node.js and Express.js project.', 'dependencies': [], 'estimated_time': '4 hours', 'agent_role': 'backend_developer', 'acceptance_criteria': ['Project is initialized.', 'Express.js server runs without errors.', \"Basic route (e.g., /) responds with 'Hello World'.\"], 'status': 'pending', 'code_files': ['package.json', 'index.js']}, {'id': 'BE-002', 'description': 'Install and configure PostgreSQL and a database connector (e.g., pg, pg-promise).', 'dependencies': ['BE-001'], 'estimated_time': '4 hours', 'agent_role': 'backend_developer', 'acceptance_criteria': ['PostgreSQL is installed and accessible.', 'Database connector is installed.', 'Connection to the database is established successfully.'], 'status': 'pending', 'code_files': ['package.json', 'db.js']}, {'id': 'BE-004', 'description': 'Implement the POST /tasks endpoint (create a new task).', 'dependencies': ['BE-001', 'BE-002', 'BE-003'], 'estimated_time': '8 hours', 'agent_role': 'backend_developer', 'acceptance_criteria': ['Endpoint accepts a POST request to /tasks.', \"Endpoint validates the 'description' parameter.\", 'Endpoint inserts a new task into the database.', 'Endpoint returns a 201 status code and the created task.'], 'status': 'pending', 'code_files': ['index.js', 'routes/tasks.js']}, {'id': 'BE-005', 'description': 'Implement the GET /tasks endpoint (get all tasks).', 'dependencies': ['BE-001', 'BE-002', 'BE-003'], 'estimated_time': '6 hours', 'agent_role': 'backend_developer', 'acceptance_criteria': ['Endpoint accepts a GET request to /tasks.', 'Endpoint retrieves all tasks from the database.', 'Endpoint returns a 200 status code and the list of tasks.'], 'status': 'pending', 'code_files': ['index.js', 'routes/tasks.js']}, {'id': 'BE-006', 'description': \"Implement the PUT /tasks/{id} endpoint (update a task's completion status).\", 'dependencies': ['BE-001', 'BE-002', 'BE-003'], 'estimated_time': '8 hours', 'agent_role': 'backend_developer', 'acceptance_criteria': ['Endpoint accepts a PUT request to /tasks/{id}.', \"Endpoint validates the 'id' parameter.\", \"Endpoint validates the 'completed' parameter.\", \"Endpoint updates the task's completion status in the database.\", 'Endpoint returns a 200 status code and the updated task.', 'Endpoint returns a 404 if the task is not found.'], 'status': 'pending', 'code_files': ['index.js', 'routes/tasks.js']}, {'id': 'BE-007', 'description': 'Implement the DELETE /tasks/{id} endpoint (delete a task).', 'dependencies': ['BE-001', 'BE-002', 'BE-003'], 'estimated_time': '6 hours', 'agent_role': 'backend_developer', 'acceptance_criteria': ['Endpoint accepts a DELETE request to /tasks/{id}.', \"Endpoint validates the 'id' parameter.\", 'Endpoint deletes the task from the database.', 'Endpoint returns a 204 status code.', 'Endpoint returns a 404 if the task is not found.'], 'status': 'pending', 'code_files': ['index.js', 'routes/tasks.js']}, {'id': 'BE-008', 'description': 'Write unit tests for backend API endpoints.', 'dependencies': ['BE-004', 'BE-005', 'BE-006', 'BE-007'], 'estimated_time': '12 hours', 'agent_role': 'backend_developer', 'acceptance_criteria': ['Tests cover all API endpoints (POST, GET, PUT, DELETE).', 'Tests verify correct request handling, database interactions, and response codes.', 'Tests pass successfully.'], 'status': 'pending', 'code_files': ['tests/*.test.js']}, {'id': 'IT-001', 'description': 'Write integration tests to verify the interaction between frontend and backend.', 'dependencies': ['FE-006', 'FE-007', 'FE-008', 'FE-009', 'BE-004', 'BE-005', 'BE-006', 'BE-007'], 'estimated_time': '12 hours', 'agent_role': 'backend_developer', 'acceptance_criteria': ['Tests verify end-to-end functionality (e.g., adding a task, viewing tasks, updating completion status, deleting a task).', 'Tests cover successful and error scenarios.', 'Tests pass successfully.'], 'status': 'pending', 'code_files': ['tests/integration/*.test.js']}, {'id': 'SE-002', 'description': 'Implement input validation on the backend.', 'dependencies': ['BE-004', 'BE-006'], 'estimated_time': '6 hours', 'agent_role': 'backend_developer', 'acceptance_criteria': ['Backend validates all user inputs (e.g., task description).', 'Invalid inputs are rejected with appropriate error messages.', 'Input validation prevents XSS and SQL injection vulnerabilities.'], 'status': 'pending', 'code_files': ['routes/tasks.js']}, {'id': 'MO-001', 'description': 'Set up logging for the backend (e.g., using Winston or similar).', 'dependencies': ['BE-001', 'BE-004', 'BE-005', 'BE-006', 'BE-007'], 'estimated_time': '4 hours', 'agent_role': 'backend_developer', 'acceptance_criteria': ['Logging is implemented for API requests, errors, and application events.', 'Logs are written to a file or a logging service (e.g., CloudWatch).'], 'status': 'pending', 'code_files': ['index.js', 'logger.js']}, {'id': 'OP-002', 'description': 'Optimize backend code for performance (e.g., caching, database indexing).', 'dependencies': ['BE-002', 'BE-004', 'BE-005', 'BE-006', 'BE-007'], 'estimated_time': '8 hours', 'agent_role': 'backend_developer', 'acceptance_criteria': ['Caching is implemented for frequently accessed data.', 'Database indexes are created for frequently queried columns.', 'Backend performance is improved (e.g., faster API response times).'], 'status': 'pending', 'code_files': ['db.js', 'routes/tasks.js']}, {'id': 'PT-001', 'description': 'Conduct performance testing.', 'dependencies': ['OP-001', 'OP-002'], 'estimated_time': '8 hours', 'agent_role': 'backend_developer', 'acceptance_criteria': ['Performance tests are conducted (e.g., using JMeter or similar).', 'Performance metrics are collected and analyzed.', 'Performance bottlenecks are identified and addressed.'], 'status': 'pending', 'code_files': ['performance_tests/*.jmx']}]}, {'name': 'Database Phase', 'description': 'Tasks related to database phase', 'deliverables': ['Completed BE-003'], 'estimated_duration_hours': 4.0, 'work_items': [{'id': 'BE-003', 'description': \"Create the 'tasks' table in PostgreSQL.\", 'dependencies': ['BE-002'], 'estimated_time': '4 hours', 'agent_role': 'database_specialist', 'acceptance_criteria': ['Tasks table exists.', \"Table has 'id', 'description', 'created_at', and 'completed' columns.\", 'Appropriate data types and constraints are defined.'], 'status': 'pending', 'code_files': ['db/schema.sql']}]}, {'name': 'Devops_Engineer Phase', 'description': 'Tasks related to devops_engineer phase', 'deliverables': ['Completed DE-001', 'Completed DE-002', 'Completed DE-003', 'Completed SE-001', 'Completed MO-002'], 'estimated_duration_hours': 26.0, 'work_items': [{'id': 'DE-001', 'description': 'Create a Dockerfile for the frontend.', 'dependencies': ['FE-001', 'FE-002', 'FE-003', 'FE-004', 'FE-005', 'FE-006', 'FE-007', 'FE-008', 'FE-009'], 'estimated_time': '4 hours', 'agent_role': 'devops_engineer', 'acceptance_criteria': ['Dockerfile exists.', 'Dockerfile builds a Docker image for the frontend application.', 'Image includes all necessary dependencies.'], 'status': 'pending', 'code_files': ['Dockerfile.frontend']}, {'id': 'DE-002', 'description': 'Create a Dockerfile for the backend.', 'dependencies': ['BE-001', 'BE-002', 'BE-003', 'BE-004', 'BE-005', 'BE-006', 'BE-007'], 'estimated_time': '4 hours', 'agent_role': 'devops_engineer', 'acceptance_criteria': ['Dockerfile exists.', 'Dockerfile builds a Docker image for the backend application.', 'Image includes all necessary dependencies.'], 'status': 'pending', 'code_files': ['Dockerfile.backend']}, {'id': 'DE-003', 'description': 'Set up a CI/CD pipeline (e.g., GitHub Actions) to build, test, and deploy the application.', 'dependencies': ['DE-001', 'DE-002', 'IT-001'], 'estimated_time': '8 hours', 'agent_role': 'devops_engineer', 'acceptance_criteria': ['CI/CD pipeline is configured.', 'Pipeline builds and tests the frontend and backend.', 'Pipeline deploys the application to AWS (or chosen cloud provider).', 'Deployment is automated.'], 'status': 'pending', 'code_files': ['.github/workflows/*.yml']}, {'id': 'SE-001', 'description': 'Implement HTTPS for secure communication.', 'dependencies': ['DE-003'], 'estimated_time': '4 hours', 'agent_role': 'devops_engineer', 'acceptance_criteria': ['HTTPS is enabled for the application.', 'All communication between the frontend and backend is encrypted.'], 'status': 'pending', 'code_files': ['nginx.conf', 'Dockerfile.backend']}, {'id': 'MO-002', 'description': 'Set up monitoring for the application (e.g., using AWS CloudWatch).', 'dependencies': ['DE-003', 'MO-001'], 'estimated_time': '6 hours', 'agent_role': 'devops_engineer', 'acceptance_criteria': ['Monitoring is configured to track application performance, resource usage, and error rates.', 'Alerts are set up for critical errors and performance issues.'], 'status': 'pending', 'code_files': ['cloudwatch.yml']}]}], resource_allocation=[{'role': 'Backend Developer', 'count': 1, 'estimated_time_allocation': '100%', 'phases': ['Backend Phase'], 'skills_required': []}, {'role': 'Database Specialist', 'count': 1, 'estimated_time_allocation': '100%', 'phases': ['Database Phase'], 'skills_required': []}, {'role': 'Devops Engineer', 'count': 1, 'estimated_time_allocation': '100%', 'phases': ['Devops_Engineer Phase'], 'skills_required': []}, {'role': 'Frontend Developer', 'count': 1, 'estimated_time_allocation': '100%', 'phases': ['Frontend Phase'], 'skills_required': []}], risks_and_mitigations=[], timeline={'start_date': '2025-07-08T18:03:33.208791', 'end_date': 'TBD', 'milestones': []}, tech_stack={}, metadata={'generated_at': '2025-07-08T18:03:33.208791', 'version': '1.0', 'author': 'Multi-AI Dev System', 'tags': [], 'notes': 'Converted from WorkItemBacklog. Original summary: Develop a simple web application for managing a list of tasks, including adding, viewing, and updating tasks. The application will use React for the frontend, Node.js and Express.js for the backend, and PostgreSQL for the database. The application will be deployed to AWS using a CI/CD pipeline.'}) summary='Develop a simple web application for managing a list of tasks, including adding, viewing, and updating tasks. The application will use React for the frontend, Node.js and Express.js for the backend, and PostgreSQL for the database. The application will be deployed to AWS using a CI/CD pipeline.' metadata=PlanMetadata(generated_at='2025-07-08T18:03:33.208791', version='1.0', author='Multi-AI Dev System', tags=[], notes='Converted from WorkItemBacklog. Original summary: Develop a simple web application for managing a list of tasks, including adding, viewing, and updating tasks. The application will use React for the frontend, Node.js and Express.js for the backend, and PostgreSQL for the database. The application will be deployed to AWS using a CI/CD pipeline.')"
  },
  "workflow_state_snapshot": {
    "requirements_analysis": {
      "project_name": "Hello World Task List",
      "project_summary": "A simple web application to manage a list of tasks.",
      "project_goals": [
        "Allow a user to add a task",
        "Allow a user to see their list of tasks"
      ],
      "target_audience": [
        "Users who want to manage a list of tasks"
      ],
      "business_context": "This project provides a basic task management solution.",
      "requirements": [
        {
          "id": "REQ-001",
          "description": "A user can create a new task with a text description.",
          "category": "functional",
          "priority": 1
        },
        {
          "id": "REQ-002",
          "description": "A user can see a list of all created tasks.",
          "category": "functional",
          "priority": 1
        },
        {
          "id": "REQ-003",
          "description": "The application must load quickly.",
          "category": "non_functional",
          "priority": 2
        },
        {
          "id": "REQ-004",
          "description": "The application must be secure.",
          "category": "non_functional",
          "priority": 2
        }
      ],
      "functional_requirements": [
        "A user can create a new task with a text description.",
        "A user can see a list of all created tasks."
      ],
      "non_functional_requirements": [
        "The application must load quickly.",
        "The application must be secure."
      ],
      "stakeholders": [
        "Users"
      ],
      "success_criteria": [
        "Users can successfully add tasks.",
        "Users can successfully view their task list.",
        "The application loads quickly.",
        "The application is secure."
      ],
      "constraints": [],
      "assumptions": [],
      "risks": [],
      "domain_specific_details": {},
      "quality_assessment": {
        "clarity_score": 9.0,
        "completeness_score": 7.0,
        "consistency_score": 10.0,
        "recommendations": [
          "Add more details to the non-functional requirements."
        ]
      },
      "gap_analysis": {
        "identified_gaps": [
          "Missing details on security implementation.",
          "Missing details on performance metrics."
        ],
        "recommendations_for_completion": [
          "Specify security measures (e.g., authentication, authorization).",
          "Define performance targets (e.g., page load time)."
        ]
      }
    },
    "tech_stack_recommendation": {
      "frontend_options": [
        {
          "name": "React",
          "language": "JavaScript",
          "reasoning": "React is a popular and efficient library for building user interfaces. It offers a component-based architecture, making it easy to manage and update the UI. Its virtual DOM and efficient update mechanisms contribute to fast loading times, addressing the non-functional requirement for speed.",
          "key_libraries": [
            "React Router (for navigation)",
            "Axios (for API calls)",
            "Material UI/Chakra UI (for UI components)"
          ],
          "pros": [
            "Large community and extensive documentation.",
            "Component-based architecture promotes code reusability and maintainability.",
            "Virtual DOM for efficient updates.",
            "Excellent performance."
          ],
          "cons": [
            "Requires understanding of JSX.",
            "Can have a steeper learning curve for beginners."
          ],
          "selected": false
        },
        {
          "name": "Vue.js",
          "language": "JavaScript",
          "reasoning": "Vue.js is a progressive framework that's easy to learn and integrate. It's known for its simplicity and excellent documentation, making it a good choice for smaller projects. It also offers good performance and a clear separation of concerns.",
          "key_libraries": [
            "Vue Router (for navigation)",
            "Axios (for API calls)",
            "Vuetify/Element UI (for UI components)"
          ],
          "pros": [
            "Easy to learn and use.",
            "Good performance.",
            "Clear and concise syntax.",
            "Excellent documentation."
          ],
          "cons": [
            "Smaller community compared to React.",
            "Ecosystem might not be as extensive as React's."
          ],
          "selected": false
        },
        {
          "name": "HTML, CSS, JavaScript (Vanilla)",
          "language": "JavaScript",
          "reasoning": "For a simple task list application, using vanilla JavaScript, HTML, and CSS can be a viable option. This approach avoids the overhead of a framework, resulting in potentially faster initial load times and a smaller bundle size. It's also a good choice for learning the fundamentals.",
          "key_libraries": [],
          "pros": [
            "No external dependencies.",
            "Fast initial load times.",
            "Good for learning the basics of web development.",
            "Simple to deploy."
          ],
          "cons": [
            "More manual DOM manipulation.",
            "Can become complex to manage as the application grows.",
            "Requires more manual coding for UI components."
          ],
          "selected": false
        }
      ],
      "backend_options": [
        {
          "name": "Node.js with Express.js",
          "language": "JavaScript",
          "reasoning": "Node.js with Express.js provides a lightweight and efficient backend solution. JavaScript is used on both the frontend and backend, which can streamline development. Express.js simplifies routing and middleware management, making it easy to build a RESTful API. It's also known for its speed and scalability.",
          "key_libraries": [
            "Express.js (web framework)",
            "body-parser (for parsing request bodies)",
            "mongoose/Sequelize (for database interaction)"
          ],
          "pros": [
            "JavaScript on both frontend and backend (full-stack JavaScript).",
            "Large community and extensive documentation.",
            "Fast development with Express.js.",
            "Good performance and scalability."
          ],
          "cons": [
            "Callback hell can be an issue if not managed properly.",
            "Requires careful handling of asynchronous operations."
          ],
          "selected": false
        },
        {
          "name": "Python with Flask",
          "language": "Python",
          "reasoning": "Flask is a microframework that's easy to learn and use. Python is a versatile language with a large community. Flask provides a simple and flexible way to build a RESTful API. It's a good choice for small to medium-sized projects.",
          "key_libraries": [
            "Flask (web framework)",
            "Flask-SQLAlchemy/SQLAlchemy (for database interaction)",
            "Flask-CORS (for handling CORS)"
          ],
          "pros": [
            "Easy to learn and use.",
            "Large community and extensive documentation.",
            "Good for rapid prototyping.",
            "Python's readability."
          ],
          "cons": [
            "Can become complex as the application grows.",
            "Performance might not be as good as Node.js for highly concurrent applications."
          ],
          "selected": false
        },
        {
          "name": "Java with Spring Boot",
          "language": "Java",
          "reasoning": "Spring Boot simplifies the development of Java-based applications. It provides a robust framework for building RESTful APIs. Java's strong typing and mature ecosystem contribute to maintainability and scalability. It's a good choice for enterprise-grade applications, even if this is a simple one.",
          "key_libraries": [
            "Spring Boot (web framework)",
            "Spring Data JPA (for database interaction)",
            "Maven/Gradle (for build automation)"
          ],
          "pros": [
            "Mature ecosystem and large community.",
            "Strong typing and good maintainability.",
            "Excellent for building scalable applications.",
            "Robust framework."
          ],
          "cons": [
            "Steeper learning curve.",
            "Can be more verbose than other options.",
            "Slower development speed compared to Node.js or Python."
          ],
          "selected": false
        }
      ],
      "database_options": [
        {
          "name": "PostgreSQL",
          "language": null,
          "reasoning": "PostgreSQL is a powerful, open-source relational database. It offers excellent data integrity, scalability, and support for complex queries. It's a good choice for applications that require data consistency and reliability.",
          "key_libraries": [
            "psycopg2 (for Python)",
            "pg (for Node.js)",
            "JDBC driver (for Java)"
          ],
          "pros": [
            "ACID compliance.",
            "Excellent data integrity.",
            "Scalability.",
            "Large community and extensive documentation."
          ],
          "cons": [
            "Can be more complex to set up and manage than simpler databases.",
            "Requires more resources than simpler databases."
          ],
          "selected": false
        },
        {
          "name": "MongoDB",
          "language": null,
          "reasoning": "MongoDB is a NoSQL database that's easy to use and offers flexible schema design. It's a good choice for applications that require rapid development and can benefit from a document-oriented data model. It's also known for its scalability.",
          "key_libraries": [
            "Mongoose (for Node.js)",
            "pymongo (for Python)",
            "MongoDB Java Driver (for Java)"
          ],
          "pros": [
            "Flexible schema design.",
            "Easy to scale.",
            "Good for rapid development.",
            "Document-oriented data model."
          ],
          "cons": [
            "Eventual consistency can be an issue.",
            "Not as strong data integrity as relational databases.",
            "Can be more difficult to perform complex joins."
          ],
          "selected": false
        },
        {
          "name": "SQLite",
          "language": null,
          "reasoning": "SQLite is a lightweight, file-based database that's easy to set up and use. It's a good choice for small applications that don't require high scalability or concurrency. It's ideal for local development and simple deployments.",
          "key_libraries": [
            "sqlite3 (built-in for Python)",
            "sqlite3 (for Node.js)",
            "JDBC driver (for Java)"
          ],
          "pros": [
            "Easy to set up and use.",
            "No server required.",
            "Good for local development and simple deployments.",
            "Lightweight."
          ],
          "cons": [
            "Not suitable for high-concurrency applications.",
            "Limited scalability.",
            "Not recommended for production environments with high traffic."
          ],
          "selected": false
        }
      ],
      "cloud_options": [
        {
          "name": "AWS (Amazon Web Services)",
          "language": null,
          "reasoning": "AWS offers a wide range of services, including compute, storage, and databases. It's a good choice for applications that require scalability, reliability, and a comprehensive set of features. It's a mature platform with extensive documentation and a large community.",
          "key_libraries": [
            "AWS SDK (for various languages)"
          ],
          "pros": [
            "Wide range of services.",
            "Scalability and reliability.",
            "Mature platform.",
            "Large community and extensive documentation."
          ],
          "cons": [
            "Can be complex to manage.",
            "Can be expensive if not managed properly.",
            "Steeper learning curve."
          ],
          "selected": false
        },
        {
          "name": "Google Cloud Platform (GCP)",
          "language": null,
          "reasoning": "GCP offers a competitive set of services with a focus on data analytics and machine learning. It's a good choice for applications that require these features. It's also known for its competitive pricing and ease of use.",
          "key_libraries": [
            "Google Cloud Client Libraries (for various languages)"
          ],
          "pros": [
            "Competitive pricing.",
            "Focus on data analytics and machine learning.",
            "Ease of use.",
            "Good performance."
          ],
          "cons": [
            "Smaller community compared to AWS.",
            "Some services might not be as mature as AWS counterparts.",
            "Can be complex to manage."
          ],
          "selected": false
        },
        {
          "name": "Heroku",
          "language": null,
          "reasoning": "Heroku is a Platform-as-a-Service (PaaS) that simplifies deployment and management. It's a good choice for small to medium-sized applications that require ease of deployment and scaling. It abstracts away much of the infrastructure management.",
          "key_libraries": [],
          "pros": [
            "Easy to deploy and manage.",
            "Good for rapid prototyping.",
            "Scalable.",
            "Focus on developer experience."
          ],
          "cons": [
            "Limited control over infrastructure.",
            "Can be more expensive than other options.",
            "Vendor lock-in."
          ],
          "selected": false
        }
      ],
      "architecture_options": [
        {
          "pattern": "Monolithic Architecture",
          "scalability_score": 5.0,
          "maintainability_score": 6.0,
          "development_speed_score": 8.0,
          "overall_score": 7.0,
          "reasoning": "For a simple task list application, a monolithic architecture is a good starting point. It's easy to develop and deploy. While it might not scale as well as other architectures, it's sufficient for the project's scope. It's easier to manage initially."
        },
        {
          "pattern": "Microservices Architecture",
          "scalability_score": 8.0,
          "maintainability_score": 7.0,
          "development_speed_score": 5.0,
          "overall_score": 6.0,
          "reasoning": "Microservices architecture is overkill for this project. While it offers excellent scalability and maintainability, it adds significant complexity to development and deployment. It's not justified for a simple task list application."
        },
        {
          "pattern": "Serverless Architecture",
          "scalability_score": 9.0,
          "maintainability_score": 7.0,
          "development_speed_score": 6.0,
          "overall_score": 7.0,
          "reasoning": "Serverless architecture can be a good option for this project, especially if using a cloud provider like AWS or GCP. It offers excellent scalability and reduces operational overhead. However, it can introduce complexities in debugging and monitoring. It's a good choice if the team has experience with serverless technologies."
        }
      ],
      "tool_options": [
        {
          "name": "Git",
          "language": null,
          "reasoning": "Git is essential for version control and collaboration. It allows developers to track changes, revert to previous versions, and work together on the codebase.",
          "key_libraries": [],
          "pros": [
            "Version control.",
            "Collaboration.",
            "Branching and merging.",
            "Large community and extensive documentation."
          ],
          "cons": [
            "Can have a learning curve for beginners."
          ],
          "selected": false
        },
        {
          "name": "Docker",
          "language": null,
          "reasoning": "Docker is a containerization platform that simplifies deployment and ensures consistency across different environments. It's a good choice for this project to package the application and its dependencies.",
          "key_libraries": [],
          "pros": [
            "Containerization.",
            "Consistent environments.",
            "Simplified deployment.",
            "Scalability."
          ],
          "cons": [
            "Can have a learning curve for beginners.",
            "Requires understanding of containerization concepts."
          ],
          "selected": false
        },
        {
          "name": "CI/CD Pipeline (e.g., Jenkins, GitHub Actions)",
          "language": null,
          "reasoning": "A CI/CD pipeline automates the build, test, and deployment processes. It helps to ensure that the application is deployed quickly and reliably. This is important for the non-functional requirement of quick loading times.",
          "key_libraries": [],
          "pros": [
            "Automated build, test, and deployment.",
            "Faster release cycles.",
            "Improved reliability.",
            "Reduced manual effort."
          ],
          "cons": [
            "Requires initial setup and configuration.",
            "Can be complex to manage."
          ],
          "selected": false
        }
      ],
      "risks": [
        {
          "category": "Security",
          "description": "The application is vulnerable to security threats such as cross-site scripting (XSS) and SQL injection. The BRD does not specify security measures.",
          "severity": "High",
          "likelihood": "Medium",
          "mitigation": "Implement authentication and authorization. Sanitize user inputs. Use HTTPS. Regularly update dependencies. Perform security audits."
        },
        {
          "category": "Performance",
          "description": "The application might not load quickly if not optimized. The BRD mentions quick loading times as a non-functional requirement.",
          "severity": "Medium",
          "likelihood": "Medium",
          "mitigation": "Optimize frontend code (e.g., code splitting, lazy loading). Optimize backend code (e.g., caching, database indexing). Use a CDN. Monitor performance metrics."
        },
        {
          "category": "Scalability",
          "description": "The application might not scale well if the user base grows significantly. The BRD does not specify scalability requirements.",
          "severity": "Low",
          "likelihood": "Low",
          "mitigation": "Choose a scalable architecture (e.g., serverless, microservices). Use a scalable database. Implement caching. Monitor resource usage."
        },
        {
          "category": "Development Speed",
          "description": "The chosen technology stack might impact development speed. Some technologies have a steeper learning curve than others.",
          "severity": "Medium",
          "likelihood": "Medium",
          "mitigation": "Choose technologies that the development team is familiar with. Use frameworks and libraries that promote rapid development. Implement a CI/CD pipeline."
        }
      ],
      "synthesis": {
        "backend": {
          "language": "JavaScript",
          "framework": "Node.js with Express.js",
          "reasoning": "Node.js with Express.js provides a lightweight and efficient backend solution. JavaScript is used on both the frontend and backend, which can streamline development. Express.js simplifies routing and middleware management, making it easy to build a RESTful API. It's also known for its speed and scalability."
        },
        "frontend": {
          "language": "JavaScript",
          "framework": "React",
          "reasoning": "React is a popular and efficient library for building user interfaces. It offers a component-based architecture, making it easy to manage and update the UI. Its virtual DOM and efficient update mechanisms contribute to fast loading times, addressing the non-functional requirement for speed."
        },
        "database": {
          "type": "PostgreSQL",
          "reasoning": "PostgreSQL is a powerful, open-source relational database. It offers excellent data integrity, scalability, and support for complex queries. It's a good choice for applications that require data consistency and reliability."
        },
        "architecture_pattern": "Monolithic Architecture",
        "deployment_environment": {
          "cloud_provider": "AWS (Amazon Web Services)",
          "reasoning": "AWS offers a wide range of services, including compute, storage, and databases. It's a good choice for applications that require scalability, reliability, and a comprehensive set of features. It's a mature platform with extensive documentation and a large community."
        },
        "key_libraries_tools": [
          {
            "name": "React Router",
            "purpose": "For navigation in the React frontend."
          },
          {
            "name": "Axios",
            "purpose": "For making API calls from the frontend."
          },
          {
            "name": "Material UI/Chakra UI",
            "purpose": "For UI component library in the React frontend."
          },
          {
            "name": "Express.js",
            "purpose": "For building the backend API."
          },
          {
            "name": "body-parser",
            "purpose": "For parsing request bodies in the backend."
          },
          {
            "name": "Mongoose",
            "purpose": "For interacting with the database in the backend."
          },
          {
            "name": "Git",
            "purpose": "For version control."
          },
          {
            "name": "Docker",
            "purpose": "For containerization."
          },
          {
            "name": "CI/CD Pipeline (e.g., Jenkins, GitHub Actions)",
            "purpose": "For automating build, test, and deployment."
          }
        ],
        "estimated_complexity": "Medium"
      },
      "selected_stack": null
    },
    "system_design": {
      "architecture": {
        "pattern": "Monolithic Architecture",
        "justification": "For a simple task list application, a monolithic architecture is a good starting point. It's easy to develop and deploy. While it might not scale as well as other architectures, it's sufficient for the project's scope. It's easier to manage initially.",
        "key_benefits": [
          "Faster development speed.",
          "Simpler deployment.",
          "Easier to manage initially."
        ],
        "potential_drawbacks": [
          "Limited scalability.",
          "Can become difficult to maintain as the application grows."
        ]
      },
      "components": [
        {
          "name": "Frontend",
          "description": "The user interface for the task list application.",
          "category": "frontend",
          "technologies": [
            "React",
            "JavaScript",
            "HTML",
            "CSS"
          ],
          "dependencies": [
            "Backend API"
          ],
          "responsibilities": [
            "Displaying the task list.",
            "Allowing users to add new tasks.",
            "Handling user interactions.",
            "Making API calls to the backend."
          ],
          "design_patterns": [
            "Component-based architecture"
          ]
        },
        {
          "name": "Backend API",
          "description": "The RESTful API that handles requests from the frontend and interacts with the database.",
          "category": "backend",
          "technologies": [
            "Node.js",
            "Express.js",
            "JavaScript",
            "PostgreSQL"
          ],
          "dependencies": [
            "Database"
          ],
          "responsibilities": [
            "Handling API requests.",
            "Validating user input.",
            "Interacting with the database.",
            "Returning data to the frontend."
          ],
          "design_patterns": [
            "RESTful API design"
          ]
        },
        {
          "name": "Database",
          "description": "Stores the task data.",
          "category": "database",
          "technologies": [
            "PostgreSQL"
          ],
          "dependencies": [],
          "responsibilities": [
            "Storing task data.",
            "Providing data to the backend API."
          ],
          "design_patterns": [
            "Relational database design"
          ]
        },
        {
          "name": "Deployment Pipeline",
          "description": "Automates the build, test, and deployment process.",
          "category": "DevOps",
          "technologies": [
            "Docker",
            "CI/CD Pipeline (e.g., GitHub Actions)"
          ],
          "dependencies": [
            "Frontend",
            "Backend API"
          ],
          "responsibilities": [
            "Building the application.",
            "Running tests.",
            "Deploying the application to the cloud."
          ],
          "design_patterns": [
            "CI/CD"
          ]
        }
      ],
      "data_model": {
        "schema_type": "Relational",
        "tables": [
          {
            "name": "tasks",
            "purpose": "Stores information about each task.",
            "fields": [
              {
                "name": "id",
                "type": "UUID",
                "constraints": [
                  "PRIMARY KEY",
                  "NOT NULL"
                ],
                "description": "Unique identifier for the task."
              },
              {
                "name": "description",
                "type": "TEXT",
                "constraints": [
                  "NOT NULL"
                ],
                "description": "The text description of the task."
              },
              {
                "name": "created_at",
                "type": "TIMESTAMP",
                "constraints": [
                  "NOT NULL",
                  "DEFAULT CURRENT_TIMESTAMP"
                ],
                "description": "The timestamp when the task was created."
              },
              {
                "name": "completed",
                "type": "BOOLEAN",
                "constraints": [
                  "NOT NULL",
                  "DEFAULT FALSE"
                ],
                "description": "Whether the task is completed or not."
              }
            ],
            "relationships": []
          }
        ],
        "relationships": [],
        "justification": "Relational database provides data integrity and is suitable for storing structured task data."
      },
      "api_endpoints": {
        "style": "REST",
        "base_url": "/api/v1",
        "authentication": "None (for simplicity, but should be JWT or similar in production)",
        "endpoints": [
          {
            "method": "POST",
            "path": "/tasks",
            "purpose": "Create a new task.",
            "parameters": [
              {
                "description": "The description of the task.",
                "type": "string",
                "name": "description"
              }
            ],
            "response": {
              "201": {
                "description": "Task created successfully.",
                "example": {
                  "id": "uuid",
                  "description": "Buy groceries",
                  "created_at": "2024-10-27T10:00:00.000Z",
                  "completed": false
                }
              },
              "400": {
                "description": "Bad Request - Invalid input."
              }
            },
            "authentication_required": false,
            "rate_limiting_applied": false
          },
          {
            "method": "GET",
            "path": "/tasks",
            "purpose": "Get all tasks.",
            "parameters": [],
            "response": {
              "200": {
                "description": "List of tasks.",
                "example": [
                  {
                    "id": "uuid",
                    "description": "Buy groceries",
                    "created_at": "2024-10-27T10:00:00.000Z",
                    "completed": false
                  },
                  {
                    "id": "uuid",
                    "description": "Do laundry",
                    "created_at": "2024-10-27T10:05:00.000Z",
                    "completed": true
                  }
                ]
              }
            },
            "authentication_required": false,
            "rate_limiting_applied": false
          },
          {
            "method": "PUT",
            "path": "/tasks/{id}",
            "purpose": "Update a task (e.g., mark as complete).",
            "parameters": [
              {
                "name": "id",
                "type": "UUID",
                "description": "The ID of the task to update."
              },
              {
                "name": "completed",
                "type": "boolean",
                "description": "Whether the task is completed."
              }
            ],
            "response": {
              "200": {
                "description": "Task updated successfully.",
                "example": {
                  "id": "uuid",
                  "description": "Buy groceries",
                  "created_at": "2024-10-27T10:00:00.000Z",
                  "completed": true
                }
              },
              "400": {
                "description": "Bad Request - Invalid input."
              },
              "404": {
                "description": "Task not found."
              }
            },
            "authentication_required": false,
            "rate_limiting_applied": false
          },
          {
            "method": "DELETE",
            "path": "/tasks/{id}",
            "purpose": "Delete a task.",
            "parameters": [
              {
                "name": "id",
                "type": "UUID",
                "description": "The ID of the task to delete."
              }
            ],
            "response": {
              "204": {
                "description": "Task deleted successfully."
              },
              "404": {
                "description": "Task not found."
              }
            },
            "authentication_required": false,
            "rate_limiting_applied": false
          }
        ],
        "error_handling": "Centralized error handling with appropriate HTTP status codes and error messages.",
        "rate_limiting_strategy": null
      },
      "security": {
        "authentication_method": "None (for simplicity, but JWT or similar is recommended for production)",
        "authorization_strategy": "No authorization required (for simplicity).",
        "data_encryption": {
          "at_rest": "Encryption at rest for sensitive data in the database (e.g., using PostgreSQL encryption features).",
          "in_transit": "HTTPS is enforced for all communication between the frontend and backend."
        },
        "security_measures": [
          {
            "category": "Authentication",
            "implementation": "Implement JWT (JSON Web Tokens) for user authentication in a production environment.",
            "mitigation": "Protects against unauthorized access.",
            "priority": "High"
          },
          {
            "category": "Input Validation",
            "implementation": "Validate all user inputs on both the frontend and backend to prevent XSS and SQL injection attacks.",
            "mitigation": "Prevents XSS and SQL injection attacks.",
            "priority": "High"
          },
          {
            "category": "HTTPS",
            "implementation": "Enforce HTTPS for all communication.",
            "mitigation": "Protects data in transit.",
            "priority": "High"
          },
          {
            "category": "Dependency Management",
            "implementation": "Regularly update dependencies to address security vulnerabilities.",
            "mitigation": "Mitigates vulnerabilities in third-party libraries.",
            "priority": "Medium"
          },
          {
            "category": "CORS",
            "implementation": "Configure CORS (Cross-Origin Resource Sharing) to restrict access to the API from unauthorized origins.",
            "mitigation": "Protects against unauthorized access from other domains.",
            "priority": "Medium"
          }
        ],
        "vulnerability_mitigation_strategies": [
          "Input validation and sanitization.",
          "Use of parameterized queries to prevent SQL injection.",
          "Regular security audits and penetration testing.",
          "Keeping dependencies up-to-date."
        ],
        "compliance_standards": []
      },
      "scalability_and_performance": {
        "frontend_optimization": "Code splitting, lazy loading of components, and image optimization to improve initial load time.",
        "backend_optimization": "Caching frequently accessed data, database indexing, and connection pooling to improve API response times.",
        "cdn_usage": "Use a CDN (Content Delivery Network) to serve static assets (e.g., JavaScript, CSS, images) to reduce latency for users globally.",
        "database_optimization": "Optimize database queries and use appropriate indexes to improve query performance."
      },
      "deployment_strategy": {
        "environment": "AWS (Amazon Web Services)",
        "infrastructure": "Use AWS services such as EC2 for backend, S3 for static assets, and RDS for the database.",
        "deployment_process": "Automated deployment using a CI/CD pipeline (e.g., GitHub Actions) with Docker containers."
      },
      "monitoring_and_logging": {
        "logging_strategy": "Centralized logging using a service like AWS CloudWatch or similar, logging all API requests, errors, and application events.",
        "monitoring_tools": "Implement monitoring using AWS CloudWatch or similar to track application performance, resource usage, and error rates.",
        "alerting": "Set up alerts for critical errors and performance issues."
      },
      "error_handling_strategy": "Centralized error handling with appropriate HTTP status codes and error messages. Log all errors for debugging and monitoring.",
      "development_phases_overview": [
        {
          "name": "Phase 1: Setup and Frontend Development",
          "description": "Setting up the development environment, including the frontend framework (React) and necessary libraries. Developing the user interface for adding and viewing tasks.",
          "priority": "High",
          "dependencies": [],
          "tasks": [
            "Set up React project.",
            "Design and implement the UI for adding tasks.",
            "Design and implement the UI for viewing tasks.",
            "Implement basic styling."
          ],
          "estimated_duration": "1 week"
        },
        {
          "name": "Phase 2: Backend API Development",
          "description": "Developing the backend API using Node.js and Express.js. Implementing the API endpoints for creating, reading, updating, and deleting tasks. Setting up the database connection.",
          "priority": "High",
          "dependencies": [
            "Phase 1: Setup and Frontend Development"
          ],
          "tasks": [
            "Set up Node.js and Express.js project.",
            "Implement API endpoints (POST, GET, PUT, DELETE).",
            "Connect to the PostgreSQL database.",
            "Implement data validation."
          ],
          "estimated_duration": "1 week"
        },
        {
          "name": "Phase 3: Integration and Testing",
          "description": "Integrating the frontend and backend. Implementing API calls from the frontend. Writing unit and integration tests.",
          "priority": "High",
          "dependencies": [
            "Phase 1: Setup and Frontend Development",
            "Phase 2: Backend API Development"
          ],
          "tasks": [
            "Implement API calls from the frontend.",
            "Write unit tests for frontend components.",
            "Write unit tests for backend API endpoints.",
            "Write integration tests."
          ],
          "estimated_duration": "1 week"
        },
        {
          "name": "Phase 4: Deployment and Security",
          "description": "Setting up the deployment pipeline using Docker and a CI/CD tool. Implementing security measures, including HTTPS and input validation.",
          "priority": "High",
          "dependencies": [
            "Phase 3: Integration and Testing"
          ],
          "tasks": [
            "Create Dockerfile for frontend and backend.",
            "Set up CI/CD pipeline (e.g., GitHub Actions).",
            "Deploy the application to AWS.",
            "Implement HTTPS.",
            "Implement input validation."
          ],
          "estimated_duration": "1 week"
        },
        {
          "name": "Phase 5: Monitoring and Optimization",
          "description": "Setting up monitoring and logging. Optimizing the application for performance.",
          "priority": "Medium",
          "dependencies": [
            "Phase 4: Deployment and Security"
          ],
          "tasks": [
            "Set up logging and monitoring.",
            "Optimize frontend code (e.g., code splitting, lazy loading).",
            "Optimize backend code (e.g., caching, database indexing).",
            "Performance testing."
          ],
          "estimated_duration": "1 week"
        }
      ],
      "key_risks": [
        "Security vulnerabilities (XSS, SQL injection).",
        "Performance issues (slow loading times, slow API responses).",
        "Scalability limitations.",
        "Deployment issues."
      ],
      "design_justification": "The design prioritizes simplicity and rapid development while addressing the non-functional requirements of speed and security. The monolithic architecture and chosen technologies allow for a quick initial development cycle. The use of React, Node.js, and PostgreSQL provides a modern and efficient tech stack. The deployment strategy leverages AWS for scalability and reliability. Security measures are included to protect the application from common vulnerabilities.",
      "data_flow": "1. User interacts with the React frontend (e.g., adds a task). 2. Frontend sends a POST request to the backend API (Node.js/Express.js). 3. Backend API validates the request and interacts with the PostgreSQL database to store the task. 4. Backend API returns a success response to the frontend. 5. Frontend displays the updated task list. 6. For retrieving tasks, the frontend sends a GET request to the backend API. 7. Backend API retrieves tasks from the database and returns them to the frontend. 8. Frontend displays the task list."
    },
    "implementation_plan": "plan=ImplementationPlan(project_summary={'title': 'Generated Project Plan', 'description': 'Develop a simple web application for managing a list of tasks, including adding, viewing, and updating tasks. The application will use React for the frontend, Node.js and Express.js for the backend, and PostgreSQL for the database. The application will be deployed to AWS using a CI/CD pipeline.', 'overall_complexity': 'Medium', 'estimated_duration': 'TBD', 'key_challenges': [], 'success_criteria': []}, phases=[{'name': 'Frontend Phase', 'description': 'Tasks related to frontend phase', 'deliverables': ['Completed FE-001', 'Completed FE-002', 'Completed FE-003', 'Completed FE-004', 'Completed FE-005', 'Completed FE-006', 'Completed FE-007', 'Completed FE-008', 'Completed FE-009', 'Completed FE-010', 'Completed OP-001'], 'estimated_duration_hours': 68.0, 'work_items': [{'id': 'FE-001', 'description': 'Set up React project using Create React App.', 'dependencies': [], 'estimated_time': '4 hours', 'agent_role': 'frontend_developer', 'acceptance_criteria': ['Project is initialized successfully.', 'Default React app runs without errors.'], 'status': 'pending', 'code_files': ['package.json', 'src/App.js', 'src/index.js']}, {'id': 'FE-002', 'description': 'Install and configure a UI component library (e.g., Material UI, Chakra UI).', 'dependencies': ['FE-001'], 'estimated_time': '4 hours', 'agent_role': 'frontend_developer', 'acceptance_criteria': ['UI library is installed.', 'A basic UI component (e.g., button, text field) renders correctly.'], 'status': 'pending', 'code_files': ['package.json', 'src/App.js']}, {'id': 'FE-003', 'description': 'Design and implement the UI for adding a new task (input field and add button).', 'dependencies': ['FE-002'], 'estimated_time': '8 hours', 'agent_role': 'frontend_developer', 'acceptance_criteria': ['Input field for task description exists.', 'Add button exists.', 'UI elements are styled appropriately.'], 'status': 'pending', 'code_files': ['src/App.js', 'src/components/TaskInput.js']}, {'id': 'FE-004', 'description': 'Design and implement the UI for displaying the task list.', 'dependencies': ['FE-002'], 'estimated_time': '8 hours', 'agent_role': 'frontend_developer', 'acceptance_criteria': ['Task list container exists.', 'Each task is displayed with its description.', 'Tasks are styled appropriately.'], 'status': 'pending', 'code_files': ['src/App.js', 'src/components/TaskList.js', 'src/components/TaskItem.js']}, {'id': 'FE-005', 'description': 'Implement basic styling for the frontend.', 'dependencies': ['FE-003', 'FE-004'], 'estimated_time': '4 hours', 'agent_role': 'frontend_developer', 'acceptance_criteria': ['UI elements are visually appealing.', 'Consistent styling is applied throughout the application.'], 'status': 'pending', 'code_files': ['src/App.css', 'src/components/*.css']}, {'id': 'FE-006', 'description': 'Implement API calls to the backend for adding tasks.', 'dependencies': ['FE-003', 'BE-004'], 'estimated_time': '6 hours', 'agent_role': 'frontend_developer', 'acceptance_criteria': ['Frontend makes a POST request to /tasks when the add button is clicked.', 'Task description is sent in the request body.', 'Frontend handles the successful response (201) and updates the UI.', 'Frontend handles error responses (400).'], 'status': 'pending', 'code_files': ['src/App.js', 'src/components/TaskInput.js']}, {'id': 'FE-007', 'description': 'Implement API calls to the backend for fetching tasks.', 'dependencies': ['FE-004', 'BE-005'], 'estimated_time': '6 hours', 'agent_role': 'frontend_developer', 'acceptance_criteria': ['Frontend makes a GET request to /tasks on component mount.', 'Frontend displays the retrieved tasks in the task list.', 'Frontend handles error responses.'], 'status': 'pending', 'code_files': ['src/App.js', 'src/components/TaskList.js']}, {'id': 'FE-008', 'description': 'Implement API calls to the backend for updating task completion status.', 'dependencies': ['FE-004', 'BE-006'], 'estimated_time': '6 hours', 'agent_role': 'frontend_developer', 'acceptance_criteria': [\"Frontend makes a PUT request to /tasks/{id} when a task's completion status changes.\", \"Frontend sends the updated 'completed' status in the request body.\", 'Frontend updates the UI based on the response.', 'Frontend handles error responses.'], 'status': 'pending', 'code_files': ['src/App.js', 'src/components/TaskItem.js']}, {'id': 'FE-009', 'description': 'Implement API calls to the backend for deleting tasks.', 'dependencies': ['FE-004', 'BE-007'], 'estimated_time': '6 hours', 'agent_role': 'frontend_developer', 'acceptance_criteria': ['Frontend makes a DELETE request to /tasks/{id} when a task is deleted.', 'Frontend updates the UI based on the response.', 'Frontend handles error responses.'], 'status': 'pending', 'code_files': ['src/App.js', 'src/components/TaskItem.js']}, {'id': 'FE-010', 'description': 'Write unit tests for frontend components (e.g., TaskInput, TaskList).', 'dependencies': ['FE-003', 'FE-004'], 'estimated_time': '8 hours', 'agent_role': 'frontend_developer', 'acceptance_criteria': ['Tests cover key functionality of each component.', 'Tests pass successfully.'], 'status': 'pending', 'code_files': ['src/components/*.test.js']}, {'id': 'OP-001', 'description': 'Optimize frontend code for performance (e.g., code splitting, lazy loading).', 'dependencies': ['FE-001', 'FE-002', 'FE-003', 'FE-004', 'FE-005', 'FE-006', 'FE-007', 'FE-008', 'FE-009'], 'estimated_time': '8 hours', 'agent_role': 'frontend_developer', 'acceptance_criteria': ['Code splitting is implemented.', 'Lazy loading of components is implemented.', 'Frontend performance is improved (e.g., faster loading times).'], 'status': 'pending', 'code_files': ['src/App.js', 'webpack.config.js']}]}, {'name': 'Backend Phase', 'description': 'Tasks related to backend phase', 'deliverables': ['Completed BE-001', 'Completed BE-002', 'Completed BE-004', 'Completed BE-005', 'Completed BE-006', 'Completed BE-007', 'Completed BE-008', 'Completed IT-001', 'Completed SE-002', 'Completed MO-001', 'Completed OP-002', 'Completed PT-001'], 'estimated_duration_hours': 86.0, 'work_items': [{'id': 'BE-001', 'description': 'Set up Node.js and Express.js project.', 'dependencies': [], 'estimated_time': '4 hours', 'agent_role': 'backend_developer', 'acceptance_criteria': ['Project is initialized.', 'Express.js server runs without errors.', \"Basic route (e.g., /) responds with 'Hello World'.\"], 'status': 'pending', 'code_files': ['package.json', 'index.js']}, {'id': 'BE-002', 'description': 'Install and configure PostgreSQL and a database connector (e.g., pg, pg-promise).', 'dependencies': ['BE-001'], 'estimated_time': '4 hours', 'agent_role': 'backend_developer', 'acceptance_criteria': ['PostgreSQL is installed and accessible.', 'Database connector is installed.', 'Connection to the database is established successfully.'], 'status': 'pending', 'code_files': ['package.json', 'db.js']}, {'id': 'BE-004', 'description': 'Implement the POST /tasks endpoint (create a new task).', 'dependencies': ['BE-001', 'BE-002', 'BE-003'], 'estimated_time': '8 hours', 'agent_role': 'backend_developer', 'acceptance_criteria': ['Endpoint accepts a POST request to /tasks.', \"Endpoint validates the 'description' parameter.\", 'Endpoint inserts a new task into the database.', 'Endpoint returns a 201 status code and the created task.'], 'status': 'pending', 'code_files': ['index.js', 'routes/tasks.js']}, {'id': 'BE-005', 'description': 'Implement the GET /tasks endpoint (get all tasks).', 'dependencies': ['BE-001', 'BE-002', 'BE-003'], 'estimated_time': '6 hours', 'agent_role': 'backend_developer', 'acceptance_criteria': ['Endpoint accepts a GET request to /tasks.', 'Endpoint retrieves all tasks from the database.', 'Endpoint returns a 200 status code and the list of tasks.'], 'status': 'pending', 'code_files': ['index.js', 'routes/tasks.js']}, {'id': 'BE-006', 'description': \"Implement the PUT /tasks/{id} endpoint (update a task's completion status).\", 'dependencies': ['BE-001', 'BE-002', 'BE-003'], 'estimated_time': '8 hours', 'agent_role': 'backend_developer', 'acceptance_criteria': ['Endpoint accepts a PUT request to /tasks/{id}.', \"Endpoint validates the 'id' parameter.\", \"Endpoint validates the 'completed' parameter.\", \"Endpoint updates the task's completion status in the database.\", 'Endpoint returns a 200 status code and the updated task.', 'Endpoint returns a 404 if the task is not found.'], 'status': 'pending', 'code_files': ['index.js', 'routes/tasks.js']}, {'id': 'BE-007', 'description': 'Implement the DELETE /tasks/{id} endpoint (delete a task).', 'dependencies': ['BE-001', 'BE-002', 'BE-003'], 'estimated_time': '6 hours', 'agent_role': 'backend_developer', 'acceptance_criteria': ['Endpoint accepts a DELETE request to /tasks/{id}.', \"Endpoint validates the 'id' parameter.\", 'Endpoint deletes the task from the database.', 'Endpoint returns a 204 status code.', 'Endpoint returns a 404 if the task is not found.'], 'status': 'pending', 'code_files': ['index.js', 'routes/tasks.js']}, {'id': 'BE-008', 'description': 'Write unit tests for backend API endpoints.', 'dependencies': ['BE-004', 'BE-005', 'BE-006', 'BE-007'], 'estimated_time': '12 hours', 'agent_role': 'backend_developer', 'acceptance_criteria': ['Tests cover all API endpoints (POST, GET, PUT, DELETE).', 'Tests verify correct request handling, database interactions, and response codes.', 'Tests pass successfully.'], 'status': 'pending', 'code_files': ['tests/*.test.js']}, {'id': 'IT-001', 'description': 'Write integration tests to verify the interaction between frontend and backend.', 'dependencies': ['FE-006', 'FE-007', 'FE-008', 'FE-009', 'BE-004', 'BE-005', 'BE-006', 'BE-007'], 'estimated_time': '12 hours', 'agent_role': 'backend_developer', 'acceptance_criteria': ['Tests verify end-to-end functionality (e.g., adding a task, viewing tasks, updating completion status, deleting a task).', 'Tests cover successful and error scenarios.', 'Tests pass successfully.'], 'status': 'pending', 'code_files': ['tests/integration/*.test.js']}, {'id': 'SE-002', 'description': 'Implement input validation on the backend.', 'dependencies': ['BE-004', 'BE-006'], 'estimated_time': '6 hours', 'agent_role': 'backend_developer', 'acceptance_criteria': ['Backend validates all user inputs (e.g., task description).', 'Invalid inputs are rejected with appropriate error messages.', 'Input validation prevents XSS and SQL injection vulnerabilities.'], 'status': 'pending', 'code_files': ['routes/tasks.js']}, {'id': 'MO-001', 'description': 'Set up logging for the backend (e.g., using Winston or similar).', 'dependencies': ['BE-001', 'BE-004', 'BE-005', 'BE-006', 'BE-007'], 'estimated_time': '4 hours', 'agent_role': 'backend_developer', 'acceptance_criteria': ['Logging is implemented for API requests, errors, and application events.', 'Logs are written to a file or a logging service (e.g., CloudWatch).'], 'status': 'pending', 'code_files': ['index.js', 'logger.js']}, {'id': 'OP-002', 'description': 'Optimize backend code for performance (e.g., caching, database indexing).', 'dependencies': ['BE-002', 'BE-004', 'BE-005', 'BE-006', 'BE-007'], 'estimated_time': '8 hours', 'agent_role': 'backend_developer', 'acceptance_criteria': ['Caching is implemented for frequently accessed data.', 'Database indexes are created for frequently queried columns.', 'Backend performance is improved (e.g., faster API response times).'], 'status': 'pending', 'code_files': ['db.js', 'routes/tasks.js']}, {'id': 'PT-001', 'description': 'Conduct performance testing.', 'dependencies': ['OP-001', 'OP-002'], 'estimated_time': '8 hours', 'agent_role': 'backend_developer', 'acceptance_criteria': ['Performance tests are conducted (e.g., using JMeter or similar).', 'Performance metrics are collected and analyzed.', 'Performance bottlenecks are identified and addressed.'], 'status': 'pending', 'code_files': ['performance_tests/*.jmx']}]}, {'name': 'Database Phase', 'description': 'Tasks related to database phase', 'deliverables': ['Completed BE-003'], 'estimated_duration_hours': 4.0, 'work_items': [{'id': 'BE-003', 'description': \"Create the 'tasks' table in PostgreSQL.\", 'dependencies': ['BE-002'], 'estimated_time': '4 hours', 'agent_role': 'database_specialist', 'acceptance_criteria': ['Tasks table exists.', \"Table has 'id', 'description', 'created_at', and 'completed' columns.\", 'Appropriate data types and constraints are defined.'], 'status': 'pending', 'code_files': ['db/schema.sql']}]}, {'name': 'Devops_Engineer Phase', 'description': 'Tasks related to devops_engineer phase', 'deliverables': ['Completed DE-001', 'Completed DE-002', 'Completed DE-003', 'Completed SE-001', 'Completed MO-002'], 'estimated_duration_hours': 26.0, 'work_items': [{'id': 'DE-001', 'description': 'Create a Dockerfile for the frontend.', 'dependencies': ['FE-001', 'FE-002', 'FE-003', 'FE-004', 'FE-005', 'FE-006', 'FE-007', 'FE-008', 'FE-009'], 'estimated_time': '4 hours', 'agent_role': 'devops_engineer', 'acceptance_criteria': ['Dockerfile exists.', 'Dockerfile builds a Docker image for the frontend application.', 'Image includes all necessary dependencies.'], 'status': 'pending', 'code_files': ['Dockerfile.frontend']}, {'id': 'DE-002', 'description': 'Create a Dockerfile for the backend.', 'dependencies': ['BE-001', 'BE-002', 'BE-003', 'BE-004', 'BE-005', 'BE-006', 'BE-007'], 'estimated_time': '4 hours', 'agent_role': 'devops_engineer', 'acceptance_criteria': ['Dockerfile exists.', 'Dockerfile builds a Docker image for the backend application.', 'Image includes all necessary dependencies.'], 'status': 'pending', 'code_files': ['Dockerfile.backend']}, {'id': 'DE-003', 'description': 'Set up a CI/CD pipeline (e.g., GitHub Actions) to build, test, and deploy the application.', 'dependencies': ['DE-001', 'DE-002', 'IT-001'], 'estimated_time': '8 hours', 'agent_role': 'devops_engineer', 'acceptance_criteria': ['CI/CD pipeline is configured.', 'Pipeline builds and tests the frontend and backend.', 'Pipeline deploys the application to AWS (or chosen cloud provider).', 'Deployment is automated.'], 'status': 'pending', 'code_files': ['.github/workflows/*.yml']}, {'id': 'SE-001', 'description': 'Implement HTTPS for secure communication.', 'dependencies': ['DE-003'], 'estimated_time': '4 hours', 'agent_role': 'devops_engineer', 'acceptance_criteria': ['HTTPS is enabled for the application.', 'All communication between the frontend and backend is encrypted.'], 'status': 'pending', 'code_files': ['nginx.conf', 'Dockerfile.backend']}, {'id': 'MO-002', 'description': 'Set up monitoring for the application (e.g., using AWS CloudWatch).', 'dependencies': ['DE-003', 'MO-001'], 'estimated_time': '6 hours', 'agent_role': 'devops_engineer', 'acceptance_criteria': ['Monitoring is configured to track application performance, resource usage, and error rates.', 'Alerts are set up for critical errors and performance issues.'], 'status': 'pending', 'code_files': ['cloudwatch.yml']}]}], resource_allocation=[{'role': 'Backend Developer', 'count': 1, 'estimated_time_allocation': '100%', 'phases': ['Backend Phase'], 'skills_required': []}, {'role': 'Database Specialist', 'count': 1, 'estimated_time_allocation': '100%', 'phases': ['Database Phase'], 'skills_required': []}, {'role': 'Devops Engineer', 'count': 1, 'estimated_time_allocation': '100%', 'phases': ['Devops_Engineer Phase'], 'skills_required': []}, {'role': 'Frontend Developer', 'count': 1, 'estimated_time_allocation': '100%', 'phases': ['Frontend Phase'], 'skills_required': []}], risks_and_mitigations=[], timeline={'start_date': '2025-07-08T18:03:33.208791', 'end_date': 'TBD', 'milestones': []}, tech_stack={}, metadata={'generated_at': '2025-07-08T18:03:33.208791', 'version': '1.0', 'author': 'Multi-AI Dev System', 'tags': [], 'notes': 'Converted from WorkItemBacklog. Original summary: Develop a simple web application for managing a list of tasks, including adding, viewing, and updating tasks. The application will use React for the frontend, Node.js and Express.js for the backend, and PostgreSQL for the database. The application will be deployed to AWS using a CI/CD pipeline.'}) summary='Develop a simple web application for managing a list of tasks, including adding, viewing, and updating tasks. The application will use React for the frontend, Node.js and Express.js for the backend, and PostgreSQL for the database. The application will be deployed to AWS using a CI/CD pipeline.' metadata=PlanMetadata(generated_at='2025-07-08T18:03:33.208791', version='1.0', author='Multi-AI Dev System', tags=[], notes='Converted from WorkItemBacklog. Original summary: Develop a simple web application for managing a list of tasks, including adding, viewing, and updating tasks. The application will use React for the frontend, Node.js and Express.js for the backend, and PostgreSQL for the database. The application will be deployed to AWS using a CI/CD pipeline.')"
  }
}