{
  "session_id": "session_6c49ead7-608d-4de6-8c26-1d368695f1d7",
  "approval_type": "implementation_plan",
  "timestamp": 1751986335,
  "approval_data": {
    "type": "implementation_plan",
    "timestamp": 1751986335.7259448,
    "project_overview": "Develop a simple web application for managing a list of tasks, including adding and viewing tasks, using React for the frontend, Node.js/Express for the backend, PostgreSQL for the database, and deployed on AWS.",
    "development_phases": [
      {
        "name": "Frontend Phase",
        "description": "Tasks related to frontend phase",
        "deliverables": [
          "Completed FE-001",
          "Completed FE-002",
          "Completed FE-003",
          "Completed FE-004",
          "Completed FE-005",
          "Completed FE-006",
          "Completed FE-007"
        ],
        "estimated_duration_hours": 48.0,
        "work_items": [
          {
            "id": "FE-001",
            "description": "Set up React project using Create React App.",
            "dependencies": [],
            "estimated_time": "4 hours",
            "agent_role": "frontend_developer",
            "acceptance_criteria": [
              "Project is initialized with Create React App.",
              "Project runs without errors.",
              "Basic project structure is in place."
            ],
            "status": "pending",
            "code_files": [
              "package.json",
              "src/App.js",
              "src/index.js"
            ]
          },
          {
            "id": "FE-002",
            "description": "Design and implement the UI for adding tasks (input field and add button).",
            "dependencies": [
              "FE-001"
            ],
            "estimated_time": "8 hours",
            "agent_role": "frontend_developer",
            "acceptance_criteria": [
              "UI includes an input field for task description.",
              "UI includes an 'Add Task' button.",
              "UI elements are styled appropriately.",
              "UI is responsive."
            ],
            "status": "pending",
            "code_files": [
              "src/App.js",
              "src/App.css"
            ]
          },
          {
            "id": "FE-003",
            "description": "Design and implement the UI for viewing tasks (task list).",
            "dependencies": [
              "FE-001"
            ],
            "estimated_time": "8 hours",
            "agent_role": "frontend_developer",
            "acceptance_criteria": [
              "UI displays a list of tasks.",
              "Each task is displayed with its description.",
              "UI is styled appropriately.",
              "UI is responsive."
            ],
            "status": "pending",
            "code_files": [
              "src/App.js",
              "src/App.css"
            ]
          },
          {
            "id": "FE-004",
            "description": "Implement basic styling for the frontend.",
            "dependencies": [
              "FE-002",
              "FE-003"
            ],
            "estimated_time": "4 hours",
            "agent_role": "frontend_developer",
            "acceptance_criteria": [
              "UI elements are visually appealing.",
              "UI is consistent in style.",
              "UI is readable."
            ],
            "status": "pending",
            "code_files": [
              "src/App.css"
            ]
          },
          {
            "id": "FE-005",
            "description": "Connect the frontend to the backend API using Axios.",
            "dependencies": [
              "FE-002",
              "FE-003",
              "BE-002",
              "BE-003"
            ],
            "estimated_time": "8 hours",
            "agent_role": "frontend_developer",
            "acceptance_criteria": [
              "Frontend makes API calls to create tasks.",
              "Frontend makes API calls to retrieve tasks.",
              "Frontend displays tasks retrieved from the API.",
              "Error handling for API calls is implemented."
            ],
            "status": "pending",
            "code_files": [
              "src/App.js"
            ]
          },
          {
            "id": "FE-006",
            "description": "Implement unit tests for frontend components.",
            "dependencies": [
              "FE-001",
              "FE-002",
              "FE-003"
            ],
            "estimated_time": "8 hours",
            "agent_role": "frontend_developer",
            "acceptance_criteria": [
              "Unit tests cover the add task component.",
              "Unit tests cover the task list component.",
              "Tests pass successfully."
            ],
            "status": "pending",
            "code_files": [
              "src/App.test.js"
            ]
          },
          {
            "id": "FE-007",
            "description": "Fix any bugs and issues identified during testing.",
            "dependencies": [
              "FE-005",
              "FE-006",
              "BE-007"
            ],
            "estimated_time": "8 hours",
            "agent_role": "frontend_developer",
            "acceptance_criteria": [
              "All identified bugs are fixed.",
              "Application functions as expected."
            ],
            "status": "pending",
            "code_files": [
              "src/App.js"
            ]
          }
        ]
      },
      {
        "name": "Backend Phase",
        "description": "Tasks related to backend phase",
        "deliverables": [
          "Completed BE-001",
          "Completed BE-002",
          "Completed BE-003",
          "Completed BE-004",
          "Completed BE-005",
          "Completed BE-006",
          "Completed BE-007",
          "Completed BE-008"
        ],
        "estimated_duration_hours": 60.0,
        "work_items": [
          {
            "id": "BE-001",
            "description": "Set up Node.js and Express project.",
            "dependencies": [],
            "estimated_time": "4 hours",
            "agent_role": "backend_developer",
            "acceptance_criteria": [
              "Project is initialized with npm.",
              "Express is installed.",
              "Project runs without errors.",
              "Basic project structure is in place."
            ],
            "status": "pending",
            "code_files": [
              "package.json",
              "index.js"
            ]
          },
          {
            "id": "BE-002",
            "description": "Implement API endpoint for creating tasks (POST /tasks).",
            "dependencies": [
              "BE-001"
            ],
            "estimated_time": "8 hours",
            "agent_role": "backend_developer",
            "acceptance_criteria": [
              "Endpoint accepts POST requests to /tasks.",
              "Endpoint receives a task description in the request body.",
              "Endpoint validates the task description.",
              "Endpoint returns a 201 status code on success.",
              "Endpoint returns a 400 status code on invalid input."
            ],
            "status": "pending",
            "code_files": [
              "index.js"
            ]
          },
          {
            "id": "BE-003",
            "description": "Implement API endpoint for retrieving tasks (GET /tasks).",
            "dependencies": [
              "BE-001"
            ],
            "estimated_time": "8 hours",
            "agent_role": "backend_developer",
            "acceptance_criteria": [
              "Endpoint accepts GET requests to /tasks.",
              "Endpoint retrieves all tasks from the database.",
              "Endpoint returns a 200 status code on success.",
              "Endpoint returns a JSON array of tasks."
            ],
            "status": "pending",
            "code_files": [
              "index.js"
            ]
          },
          {
            "id": "BE-004",
            "description": "Connect the API to the PostgreSQL database.",
            "dependencies": [
              "BE-001",
              "DB-001",
              "DB-002"
            ],
            "estimated_time": "8 hours",
            "agent_role": "backend_developer",
            "acceptance_criteria": [
              "API can connect to the PostgreSQL database.",
              "API can execute SQL queries.",
              "API uses a database connection pool."
            ],
            "status": "pending",
            "code_files": [
              "index.js"
            ]
          },
          {
            "id": "BE-005",
            "description": "Implement database interaction for creating tasks (POST /tasks).",
            "dependencies": [
              "BE-002",
              "BE-004"
            ],
            "estimated_time": "8 hours",
            "agent_role": "backend_developer",
            "acceptance_criteria": [
              "Endpoint inserts a new task into the 'tasks' table.",
              "Endpoint returns the created task with its ID.",
              "Endpoint handles database errors gracefully."
            ],
            "status": "pending",
            "code_files": [
              "index.js"
            ]
          },
          {
            "id": "BE-006",
            "description": "Implement database interaction for retrieving tasks (GET /tasks).",
            "dependencies": [
              "BE-003",
              "BE-004"
            ],
            "estimated_time": "8 hours",
            "agent_role": "backend_developer",
            "acceptance_criteria": [
              "Endpoint retrieves all tasks from the 'tasks' table.",
              "Endpoint returns the tasks in the correct format.",
              "Endpoint handles database errors gracefully."
            ],
            "status": "pending",
            "code_files": [
              "index.js"
            ]
          },
          {
            "id": "BE-007",
            "description": "Implement integration tests for API endpoints.",
            "dependencies": [
              "BE-002",
              "BE-003",
              "BE-005",
              "BE-006"
            ],
            "estimated_time": "8 hours",
            "agent_role": "backend_developer",
            "acceptance_criteria": [
              "Integration tests cover the POST /tasks endpoint.",
              "Integration tests cover the GET /tasks endpoint.",
              "Tests pass successfully."
            ],
            "status": "pending",
            "code_files": []
          },
          {
            "id": "BE-008",
            "description": "Fix any bugs and issues identified during testing.",
            "dependencies": [
              "FE-005",
              "FE-006",
              "BE-007"
            ],
            "estimated_time": "8 hours",
            "agent_role": "backend_developer",
            "acceptance_criteria": [
              "All identified bugs are fixed.",
              "Application functions as expected."
            ],
            "status": "pending",
            "code_files": [
              "index.js"
            ]
          }
        ]
      },
      {
        "name": "Database Phase",
        "description": "Tasks related to database phase",
        "deliverables": [
          "Completed DB-001",
          "Completed DB-002"
        ],
        "estimated_duration_hours": 8.0,
        "work_items": [
          {
            "id": "DB-001",
            "description": "Set up PostgreSQL database.",
            "dependencies": [],
            "estimated_time": "4 hours",
            "agent_role": "database_specialist",
            "acceptance_criteria": [
              "PostgreSQL is installed and running.",
              "A database is created for the application.",
              "Database connection details are configured."
            ],
            "status": "pending",
            "code_files": []
          },
          {
            "id": "DB-002",
            "description": "Create 'tasks' table in PostgreSQL.",
            "dependencies": [
              "DB-001"
            ],
            "estimated_time": "4 hours",
            "agent_role": "database_specialist",
            "acceptance_criteria": [
              "Table 'tasks' exists.",
              "Table has 'id', 'description', and 'created_at' columns.",
              "'id' is a SERIAL PRIMARY KEY.",
              "'description' is TEXT NOT NULL.",
              "'created_at' is TIMESTAMP with DEFAULT CURRENT_TIMESTAMP."
            ],
            "status": "pending",
            "code_files": []
          }
        ]
      },
      {
        "name": "Devops_Engineer Phase",
        "description": "Tasks related to devops_engineer phase",
        "deliverables": [
          "Completed INF-001",
          "Completed INF-002",
          "Completed INF-003",
          "Completed INF-004"
        ],
        "estimated_duration_hours": 36.0,
        "work_items": [
          {
            "id": "INF-001",
            "description": "Containerize the application using Docker.",
            "dependencies": [
              "BE-001",
              "FE-001"
            ],
            "estimated_time": "8 hours",
            "agent_role": "devops_engineer",
            "acceptance_criteria": [
              "Dockerfiles are created for both frontend and backend.",
              "Application can be built and run using Docker Compose.",
              "Frontend and backend containers are running and communicating."
            ],
            "status": "pending",
            "code_files": [
              "Dockerfile",
              "docker-compose.yml"
            ]
          },
          {
            "id": "INF-002",
            "description": "Deploy the application to AWS (e.g., ECS, Elastic Beanstalk).",
            "dependencies": [
              "INF-001"
            ],
            "estimated_time": "16 hours",
            "agent_role": "devops_engineer",
            "acceptance_criteria": [
              "Application is deployed to AWS.",
              "Frontend is accessible via a public URL.",
              "Backend is running and accessible by the frontend.",
              "Database is accessible by the backend."
            ],
            "status": "pending",
            "code_files": []
          },
          {
            "id": "INF-003",
            "description": "Set up monitoring using AWS CloudWatch.",
            "dependencies": [
              "INF-002"
            ],
            "estimated_time": "8 hours",
            "agent_role": "devops_engineer",
            "acceptance_criteria": [
              "CloudWatch is configured to monitor application performance.",
              "Logs are being collected from the frontend and backend.",
              "Alerts are configured for critical errors."
            ],
            "status": "pending",
            "code_files": []
          },
          {
            "id": "INF-004",
            "description": "Set up logging.",
            "dependencies": [
              "INF-002"
            ],
            "estimated_time": "4 hours",
            "agent_role": "devops_engineer",
            "acceptance_criteria": [
              "Logging is implemented in both frontend and backend.",
              "Logs include relevant information (e.g., timestamps, errors).",
              "Logs are stored in a centralized location (e.g., CloudWatch Logs)."
            ],
            "status": "pending",
            "code_files": [
              "index.js",
              "src/App.js"
            ]
          }
        ]
      }
    ],
    "timeline_estimation": {
      "start_date": "2025-07-08T20:22:13.535279",
      "end_date": "TBD",
      "milestones": []
    },
    "risk_assessment": [],
    "resource_requirements": [
      {
        "role": "Backend Developer",
        "count": 1,
        "estimated_time_allocation": "100%",
        "phases": [
          "Backend Phase"
        ],
        "skills_required": []
      },
      {
        "role": "Database Specialist",
        "count": 1,
        "estimated_time_allocation": "100%",
        "phases": [
          "Database Phase"
        ],
        "skills_required": []
      },
      {
        "role": "Devops Engineer",
        "count": 1,
        "estimated_time_allocation": "100%",
        "phases": [
          "Devops_Engineer Phase"
        ],
        "skills_required": []
      },
      {
        "role": "Frontend Developer",
        "count": 1,
        "estimated_time_allocation": "100%",
        "phases": [
          "Frontend Phase"
        ],
        "skills_required": []
      }
    ],
    "deliverables": [
      "Completed FE-001",
      "Completed FE-002",
      "Completed FE-003",
      "Completed FE-004",
      "Completed FE-005",
      "Completed FE-006",
      "Completed FE-007",
      "Completed BE-001",
      "Completed BE-002",
      "Completed BE-003",
      "Completed BE-004",
      "Completed BE-005",
      "Completed BE-006",
      "Completed BE-007",
      "Completed BE-008",
      "Completed DB-001",
      "Completed DB-002",
      "Completed INF-001",
      "Completed INF-002",
      "Completed INF-003",
      "Completed INF-004"
    ],
    "dependencies": [],
    "raw_plan": "plan=ImplementationPlan(project_summary={'title': 'Generated Project Plan', 'description': 'Develop a simple web application for managing a list of tasks, including adding and viewing tasks, using React for the frontend, Node.js/Express for the backend, PostgreSQL for the database, and deployed on AWS.', 'overall_complexity': 'Medium', 'estimated_duration': 'TBD', 'key_challenges': [], 'success_criteria': []}, phases=[{'name': 'Frontend Phase', 'description': 'Tasks related to frontend phase', 'deliverables': ['Completed FE-001', 'Completed FE-002', 'Completed FE-003', 'Completed FE-004', 'Completed FE-005', 'Completed FE-006', 'Completed FE-007'], 'estimated_duration_hours': 48.0, 'work_items': [{'id': 'FE-001', 'description': 'Set up React project using Create React App.', 'dependencies': [], 'estimated_time': '4 hours', 'agent_role': 'frontend_developer', 'acceptance_criteria': ['Project is initialized with Create React App.', 'Project runs without errors.', 'Basic project structure is in place.'], 'status': 'pending', 'code_files': ['package.json', 'src/App.js', 'src/index.js']}, {'id': 'FE-002', 'description': 'Design and implement the UI for adding tasks (input field and add button).', 'dependencies': ['FE-001'], 'estimated_time': '8 hours', 'agent_role': 'frontend_developer', 'acceptance_criteria': ['UI includes an input field for task description.', \"UI includes an 'Add Task' button.\", 'UI elements are styled appropriately.', 'UI is responsive.'], 'status': 'pending', 'code_files': ['src/App.js', 'src/App.css']}, {'id': 'FE-003', 'description': 'Design and implement the UI for viewing tasks (task list).', 'dependencies': ['FE-001'], 'estimated_time': '8 hours', 'agent_role': 'frontend_developer', 'acceptance_criteria': ['UI displays a list of tasks.', 'Each task is displayed with its description.', 'UI is styled appropriately.', 'UI is responsive.'], 'status': 'pending', 'code_files': ['src/App.js', 'src/App.css']}, {'id': 'FE-004', 'description': 'Implement basic styling for the frontend.', 'dependencies': ['FE-002', 'FE-003'], 'estimated_time': '4 hours', 'agent_role': 'frontend_developer', 'acceptance_criteria': ['UI elements are visually appealing.', 'UI is consistent in style.', 'UI is readable.'], 'status': 'pending', 'code_files': ['src/App.css']}, {'id': 'FE-005', 'description': 'Connect the frontend to the backend API using Axios.', 'dependencies': ['FE-002', 'FE-003', 'BE-002', 'BE-003'], 'estimated_time': '8 hours', 'agent_role': 'frontend_developer', 'acceptance_criteria': ['Frontend makes API calls to create tasks.', 'Frontend makes API calls to retrieve tasks.', 'Frontend displays tasks retrieved from the API.', 'Error handling for API calls is implemented.'], 'status': 'pending', 'code_files': ['src/App.js']}, {'id': 'FE-006', 'description': 'Implement unit tests for frontend components.', 'dependencies': ['FE-001', 'FE-002', 'FE-003'], 'estimated_time': '8 hours', 'agent_role': 'frontend_developer', 'acceptance_criteria': ['Unit tests cover the add task component.', 'Unit tests cover the task list component.', 'Tests pass successfully.'], 'status': 'pending', 'code_files': ['src/App.test.js']}, {'id': 'FE-007', 'description': 'Fix any bugs and issues identified during testing.', 'dependencies': ['FE-005', 'FE-006', 'BE-007'], 'estimated_time': '8 hours', 'agent_role': 'frontend_developer', 'acceptance_criteria': ['All identified bugs are fixed.', 'Application functions as expected.'], 'status': 'pending', 'code_files': ['src/App.js']}]}, {'name': 'Backend Phase', 'description': 'Tasks related to backend phase', 'deliverables': ['Completed BE-001', 'Completed BE-002', 'Completed BE-003', 'Completed BE-004', 'Completed BE-005', 'Completed BE-006', 'Completed BE-007', 'Completed BE-008'], 'estimated_duration_hours': 60.0, 'work_items': [{'id': 'BE-001', 'description': 'Set up Node.js and Express project.', 'dependencies': [], 'estimated_time': '4 hours', 'agent_role': 'backend_developer', 'acceptance_criteria': ['Project is initialized with npm.', 'Express is installed.', 'Project runs without errors.', 'Basic project structure is in place.'], 'status': 'pending', 'code_files': ['package.json', 'index.js']}, {'id': 'BE-002', 'description': 'Implement API endpoint for creating tasks (POST /tasks).', 'dependencies': ['BE-001'], 'estimated_time': '8 hours', 'agent_role': 'backend_developer', 'acceptance_criteria': ['Endpoint accepts POST requests to /tasks.', 'Endpoint receives a task description in the request body.', 'Endpoint validates the task description.', 'Endpoint returns a 201 status code on success.', 'Endpoint returns a 400 status code on invalid input.'], 'status': 'pending', 'code_files': ['index.js']}, {'id': 'BE-003', 'description': 'Implement API endpoint for retrieving tasks (GET /tasks).', 'dependencies': ['BE-001'], 'estimated_time': '8 hours', 'agent_role': 'backend_developer', 'acceptance_criteria': ['Endpoint accepts GET requests to /tasks.', 'Endpoint retrieves all tasks from the database.', 'Endpoint returns a 200 status code on success.', 'Endpoint returns a JSON array of tasks.'], 'status': 'pending', 'code_files': ['index.js']}, {'id': 'BE-004', 'description': 'Connect the API to the PostgreSQL database.', 'dependencies': ['BE-001', 'DB-001', 'DB-002'], 'estimated_time': '8 hours', 'agent_role': 'backend_developer', 'acceptance_criteria': ['API can connect to the PostgreSQL database.', 'API can execute SQL queries.', 'API uses a database connection pool.'], 'status': 'pending', 'code_files': ['index.js']}, {'id': 'BE-005', 'description': 'Implement database interaction for creating tasks (POST /tasks).', 'dependencies': ['BE-002', 'BE-004'], 'estimated_time': '8 hours', 'agent_role': 'backend_developer', 'acceptance_criteria': [\"Endpoint inserts a new task into the 'tasks' table.\", 'Endpoint returns the created task with its ID.', 'Endpoint handles database errors gracefully.'], 'status': 'pending', 'code_files': ['index.js']}, {'id': 'BE-006', 'description': 'Implement database interaction for retrieving tasks (GET /tasks).', 'dependencies': ['BE-003', 'BE-004'], 'estimated_time': '8 hours', 'agent_role': 'backend_developer', 'acceptance_criteria': [\"Endpoint retrieves all tasks from the 'tasks' table.\", 'Endpoint returns the tasks in the correct format.', 'Endpoint handles database errors gracefully.'], 'status': 'pending', 'code_files': ['index.js']}, {'id': 'BE-007', 'description': 'Implement integration tests for API endpoints.', 'dependencies': ['BE-002', 'BE-003', 'BE-005', 'BE-006'], 'estimated_time': '8 hours', 'agent_role': 'backend_developer', 'acceptance_criteria': ['Integration tests cover the POST /tasks endpoint.', 'Integration tests cover the GET /tasks endpoint.', 'Tests pass successfully.'], 'status': 'pending', 'code_files': []}, {'id': 'BE-008', 'description': 'Fix any bugs and issues identified during testing.', 'dependencies': ['FE-005', 'FE-006', 'BE-007'], 'estimated_time': '8 hours', 'agent_role': 'backend_developer', 'acceptance_criteria': ['All identified bugs are fixed.', 'Application functions as expected.'], 'status': 'pending', 'code_files': ['index.js']}]}, {'name': 'Database Phase', 'description': 'Tasks related to database phase', 'deliverables': ['Completed DB-001', 'Completed DB-002'], 'estimated_duration_hours': 8.0, 'work_items': [{'id': 'DB-001', 'description': 'Set up PostgreSQL database.', 'dependencies': [], 'estimated_time': '4 hours', 'agent_role': 'database_specialist', 'acceptance_criteria': ['PostgreSQL is installed and running.', 'A database is created for the application.', 'Database connection details are configured.'], 'status': 'pending', 'code_files': []}, {'id': 'DB-002', 'description': \"Create 'tasks' table in PostgreSQL.\", 'dependencies': ['DB-001'], 'estimated_time': '4 hours', 'agent_role': 'database_specialist', 'acceptance_criteria': [\"Table 'tasks' exists.\", \"Table has 'id', 'description', and 'created_at' columns.\", \"'id' is a SERIAL PRIMARY KEY.\", \"'description' is TEXT NOT NULL.\", \"'created_at' is TIMESTAMP with DEFAULT CURRENT_TIMESTAMP.\"], 'status': 'pending', 'code_files': []}]}, {'name': 'Devops_Engineer Phase', 'description': 'Tasks related to devops_engineer phase', 'deliverables': ['Completed INF-001', 'Completed INF-002', 'Completed INF-003', 'Completed INF-004'], 'estimated_duration_hours': 36.0, 'work_items': [{'id': 'INF-001', 'description': 'Containerize the application using Docker.', 'dependencies': ['BE-001', 'FE-001'], 'estimated_time': '8 hours', 'agent_role': 'devops_engineer', 'acceptance_criteria': ['Dockerfiles are created for both frontend and backend.', 'Application can be built and run using Docker Compose.', 'Frontend and backend containers are running and communicating.'], 'status': 'pending', 'code_files': ['Dockerfile', 'docker-compose.yml']}, {'id': 'INF-002', 'description': 'Deploy the application to AWS (e.g., ECS, Elastic Beanstalk).', 'dependencies': ['INF-001'], 'estimated_time': '16 hours', 'agent_role': 'devops_engineer', 'acceptance_criteria': ['Application is deployed to AWS.', 'Frontend is accessible via a public URL.', 'Backend is running and accessible by the frontend.', 'Database is accessible by the backend.'], 'status': 'pending', 'code_files': []}, {'id': 'INF-003', 'description': 'Set up monitoring using AWS CloudWatch.', 'dependencies': ['INF-002'], 'estimated_time': '8 hours', 'agent_role': 'devops_engineer', 'acceptance_criteria': ['CloudWatch is configured to monitor application performance.', 'Logs are being collected from the frontend and backend.', 'Alerts are configured for critical errors.'], 'status': 'pending', 'code_files': []}, {'id': 'INF-004', 'description': 'Set up logging.', 'dependencies': ['INF-002'], 'estimated_time': '4 hours', 'agent_role': 'devops_engineer', 'acceptance_criteria': ['Logging is implemented in both frontend and backend.', 'Logs include relevant information (e.g., timestamps, errors).', 'Logs are stored in a centralized location (e.g., CloudWatch Logs).'], 'status': 'pending', 'code_files': ['index.js', 'src/App.js']}]}], resource_allocation=[{'role': 'Backend Developer', 'count': 1, 'estimated_time_allocation': '100%', 'phases': ['Backend Phase'], 'skills_required': []}, {'role': 'Database Specialist', 'count': 1, 'estimated_time_allocation': '100%', 'phases': ['Database Phase'], 'skills_required': []}, {'role': 'Devops Engineer', 'count': 1, 'estimated_time_allocation': '100%', 'phases': ['Devops_Engineer Phase'], 'skills_required': []}, {'role': 'Frontend Developer', 'count': 1, 'estimated_time_allocation': '100%', 'phases': ['Frontend Phase'], 'skills_required': []}], risks_and_mitigations=[], timeline={'start_date': '2025-07-08T20:22:13.535279', 'end_date': 'TBD', 'milestones': []}, tech_stack={}, metadata={'generated_at': '2025-07-08T20:22:13.535279', 'version': '1.0', 'author': 'Multi-AI Dev System', 'tags': [], 'notes': 'Converted from WorkItemBacklog. Original summary: Develop a simple web application for managing a list of tasks, including adding and viewing tasks, using React for the frontend, Node.js/Express for the backend, PostgreSQL for the database, and deployed on AWS.'}) summary='Develop a simple web application for managing a list of tasks, including adding and viewing tasks, using React for the frontend, Node.js/Express for the backend, PostgreSQL for the database, and deployed on AWS.' metadata=PlanMetadata(generated_at='2025-07-08T20:22:13.535279', version='1.0', author='Multi-AI Dev System', tags=[], notes='Converted from WorkItemBacklog. Original summary: Develop a simple web application for managing a list of tasks, including adding and viewing tasks, using React for the frontend, Node.js/Express for the backend, PostgreSQL for the database, and deployed on AWS.')"
  },
  "workflow_state_snapshot": {
    "requirements_analysis": {
      "project_name": "Hello World Task List",
      "project_summary": "A simple web application to manage a list of tasks.",
      "project_goals": [
        "Allow a user to add a task",
        "Allow a user to see their list of tasks"
      ],
      "target_audience": [
        "Users who want to manage a list of tasks"
      ],
      "business_context": "This project aims to provide a basic task management tool.",
      "requirements": [
        {
          "id": "REQ-001",
          "description": "A user can create a new task with a text description.",
          "category": "functional",
          "priority": 1
        },
        {
          "id": "REQ-002",
          "description": "A user can see a list of all created tasks.",
          "category": "functional",
          "priority": 1
        },
        {
          "id": "REQ-003",
          "description": "The application must load quickly.",
          "category": "non_functional",
          "priority": 2
        },
        {
          "id": "REQ-004",
          "description": "The application must be secure.",
          "category": "non_functional",
          "priority": 2
        }
      ],
      "functional_requirements": [
        "A user can create a new task with a text description.",
        "A user can see a list of all created tasks."
      ],
      "non_functional_requirements": [
        "The application must load quickly.",
        "The application must be secure."
      ],
      "stakeholders": [
        "Users"
      ],
      "success_criteria": [
        "Users can successfully add tasks.",
        "Users can successfully view their task list.",
        "The application loads quickly.",
        "The application is secure."
      ],
      "constraints": [],
      "assumptions": [],
      "risks": [],
      "domain_specific_details": {},
      "quality_assessment": {
        "clarity_score": 9.0,
        "completeness_score": 8.0,
        "consistency_score": 10.0,
        "recommendations": []
      },
      "gap_analysis": {
        "identified_gaps": [],
        "recommendations_for_completion": []
      }
    },
    "tech_stack_recommendation": {
      "frontend_options": [
        {
          "name": "React",
          "language": "JavaScript",
          "reasoning": "React is a popular and efficient library for building user interfaces. It offers a component-based architecture, making it easy to manage and update the UI. Its virtual DOM enhances performance, addressing the requirement for quick loading.",
          "key_libraries": [
            "React Router (for navigation)",
            "Axios (for API calls)",
            "Material UI or Bootstrap (for UI components)"
          ],
          "pros": [
            "Component-based architecture for maintainability",
            "Large community and extensive documentation",
            "Virtual DOM for efficient updates",
            "Fast development speed"
          ],
          "cons": [
            "Requires understanding of JavaScript and JSX",
            "Can have a steeper learning curve for beginners"
          ],
          "selected": false
        },
        {
          "name": "Vue.js",
          "language": "JavaScript",
          "reasoning": "Vue.js is another excellent choice, known for its approachable learning curve and ease of integration. It provides a progressive framework, allowing for incremental adoption. It's also performant, meeting the quick loading requirement.",
          "key_libraries": [
            "Vue Router (for navigation)",
            "Axios (for API calls)",
            "Vuetify or Element UI (for UI components)"
          ],
          "pros": [
            "Easy to learn and use",
            "Good performance",
            "Progressive framework (can be integrated into existing projects)",
            "Detailed documentation"
          ],
          "cons": [
            "Smaller community compared to React",
            "Ecosystem might not be as extensive as React's"
          ],
          "selected": false
        },
        {
          "name": "HTML, CSS, and JavaScript (Vanilla)",
          "language": "JavaScript",
          "reasoning": "For a simple task list application, using vanilla JavaScript, HTML, and CSS can be a viable option. It avoids the overhead of a framework, leading to potentially faster initial load times and simpler code for a small project. This directly addresses the quick loading requirement.",
          "key_libraries": [],
          "pros": [
            "No framework dependencies, reducing complexity",
            "Fast initial load times",
            "Simple to understand for basic functionality"
          ],
          "cons": [
            "Can become complex to manage as the application grows",
            "More manual DOM manipulation required",
            "Less efficient for complex UIs"
          ],
          "selected": false
        }
      ],
      "backend_options": [
        {
          "name": "Node.js with Express",
          "language": "JavaScript",
          "reasoning": "Node.js with Express provides a lightweight and efficient backend solution. JavaScript is used on both the frontend and backend, which can streamline development. Express simplifies routing and middleware management. It's a good choice for a simple application.",
          "key_libraries": [
            "Express (web framework)",
            "body-parser (for parsing request bodies)",
            "cors (for handling CORS)",
            "jsonwebtoken (for authentication)"
          ],
          "pros": [
            "JavaScript on both frontend and backend (full-stack JavaScript)",
            "Large community and extensive documentation",
            "Fast development speed",
            "Good performance for simple applications"
          ],
          "cons": [
            "Can become complex to manage as the application grows",
            "Callback hell can be an issue without proper async/await usage"
          ],
          "selected": false
        },
        {
          "name": "Python with Flask",
          "language": "Python",
          "reasoning": "Flask is a microframework that's easy to learn and use. Python's readability and extensive libraries make it a good choice. It's suitable for small to medium-sized projects.",
          "key_libraries": [
            "Flask (web framework)",
            "Flask-SQLAlchemy (for database interaction)",
            "Flask-CORS (for handling CORS)",
            "PyJWT (for authentication)"
          ],
          "pros": [
            "Easy to learn and use",
            "Python's readability",
            "Large community and extensive documentation",
            "Good for rapid prototyping"
          ],
          "cons": [
            "Can be slower than Node.js for some tasks",
            "Requires understanding of Python"
          ],
          "selected": false
        },
        {
          "name": "Go with Gin",
          "language": "Go",
          "reasoning": "Go is known for its performance and efficiency. Gin is a lightweight web framework that's easy to use. Go's concurrency features can be beneficial for handling requests efficiently.",
          "key_libraries": [
            "Gin (web framework)",
            "GORM (for database interaction)",
            "JWT-go (for authentication)"
          ],
          "pros": [
            "High performance",
            "Efficient resource usage",
            "Good concurrency support",
            "Fast development speed"
          ],
          "cons": [
            "Steeper learning curve than Node.js or Python",
            "Smaller community compared to Node.js or Python"
          ],
          "selected": false
        }
      ],
      "database_options": [
        {
          "name": "PostgreSQL",
          "language": null,
          "reasoning": "PostgreSQL is a robust and reliable relational database. It offers strong data integrity and is suitable for storing structured data. It's a good choice for a simple task list application.",
          "key_libraries": [
            "psycopg2 (for Python)",
            "pg (for Node.js)"
          ],
          "pros": [
            "Reliable and mature",
            "Strong data integrity",
            "Supports complex queries",
            "Good performance"
          ],
          "cons": [
            "Can be more complex to set up and manage than simpler databases"
          ],
          "selected": false
        },
        {
          "name": "MongoDB",
          "language": null,
          "reasoning": "MongoDB is a NoSQL database that's easy to set up and use. It's a good choice for storing unstructured or semi-structured data. It's a good choice for a simple task list application.",
          "key_libraries": [
            "mongoose (for Node.js)",
            "pymongo (for Python)"
          ],
          "pros": [
            "Easy to set up and use",
            "Flexible schema",
            "Good for rapid development"
          ],
          "cons": [
            "Can be less performant than relational databases for complex queries",
            "Data integrity might be less strict"
          ],
          "selected": false
        },
        {
          "name": "SQLite",
          "language": null,
          "reasoning": "SQLite is a lightweight, file-based database that's easy to set up and use. It's a good choice for small applications where a full-fledged database is not needed. It's a good choice for a simple task list application.",
          "key_libraries": [
            "sqlite3 (built-in for Python)",
            "sqlite3 (for Node.js)"
          ],
          "pros": [
            "Easy to set up and use",
            "No server required",
            "Good for small applications"
          ],
          "cons": [
            "Not suitable for high-traffic applications",
            "Limited concurrency support"
          ],
          "selected": false
        }
      ],
      "cloud_options": [
        {
          "name": "AWS (Amazon Web Services)",
          "language": null,
          "reasoning": "AWS offers a wide range of services, including compute, storage, and databases. It's a good choice for deploying web applications. It provides scalability and security.",
          "key_libraries": [
            "AWS SDK (for interacting with AWS services)"
          ],
          "pros": [
            "Scalable and reliable",
            "Wide range of services",
            "Mature platform",
            "Good security features"
          ],
          "cons": [
            "Can be complex to set up and manage",
            "Can be expensive if not managed properly"
          ],
          "selected": false
        },
        {
          "name": "Google Cloud Platform (GCP)",
          "language": null,
          "reasoning": "GCP offers a wide range of services, including compute, storage, and databases. It's a good choice for deploying web applications. It provides scalability and security.",
          "key_libraries": [
            "Google Cloud Client Libraries (for interacting with GCP services)"
          ],
          "pros": [
            "Scalable and reliable",
            "Competitive pricing",
            "Good for data analytics and machine learning",
            "Good security features"
          ],
          "cons": [
            "Can be complex to set up and manage",
            "Can be expensive if not managed properly"
          ],
          "selected": false
        },
        {
          "name": "Heroku",
          "language": null,
          "reasoning": "Heroku is a Platform-as-a-Service (PaaS) that simplifies deployment. It's easy to set up and deploy web applications. It's a good choice for small to medium-sized projects.",
          "key_libraries": [],
          "pros": [
            "Easy to deploy and manage",
            "Good for rapid prototyping",
            "Free tier available",
            "Focus on developer experience"
          ],
          "cons": [
            "Limited customization options",
            "Can be expensive for high-traffic applications",
            "Vendor lock-in"
          ],
          "selected": false
        }
      ],
      "architecture_options": [
        {
          "pattern": "Monolithic Architecture",
          "scalability_score": 4.0,
          "maintainability_score": 6.0,
          "development_speed_score": 8.0,
          "overall_score": 6.0,
          "reasoning": "For a simple task list application, a monolithic architecture is suitable. All components (frontend, backend, database) are deployed as a single unit. This simplifies development and deployment. However, it can become harder to scale and maintain as the application grows."
        },
        {
          "pattern": "Microservices Architecture",
          "scalability_score": 8.0,
          "maintainability_score": 7.0,
          "development_speed_score": 5.0,
          "overall_score": 6.0,
          "reasoning": "While microservices offer excellent scalability and maintainability, they might be overkill for a simple task list application. The added complexity of managing multiple services could slow down development. However, it provides flexibility for future growth."
        },
        {
          "pattern": "Serverless Architecture",
          "scalability_score": 9.0,
          "maintainability_score": 7.0,
          "development_speed_score": 6.0,
          "overall_score": 7.0,
          "reasoning": "Serverless architecture can be a good choice for this project. It allows for automatic scaling and reduces operational overhead. However, it can introduce complexities in debugging and monitoring. It's a good choice if the team is familiar with serverless technologies."
        }
      ],
      "tool_options": [
        {
          "name": "Git",
          "language": null,
          "reasoning": "Essential for version control and collaboration.",
          "key_libraries": [],
          "pros": [],
          "cons": [],
          "selected": false
        },
        {
          "name": "Docker",
          "language": null,
          "reasoning": "Useful for containerizing the application, making it easier to deploy and manage.",
          "key_libraries": [],
          "pros": [],
          "cons": [],
          "selected": false
        },
        {
          "name": "CI/CD Pipeline (e.g., Jenkins, GitLab CI, GitHub Actions)",
          "language": null,
          "reasoning": "Automates the build, test, and deployment process, improving efficiency and reliability.",
          "key_libraries": [],
          "pros": [],
          "cons": [],
          "selected": false
        }
      ],
      "risks": [
        {
          "category": "Security",
          "description": "Vulnerabilities in dependencies could lead to security breaches.  Improper input validation can lead to injection attacks.",
          "severity": "Medium",
          "likelihood": "Medium",
          "mitigation": "Regularly update dependencies. Implement robust input validation and sanitization. Use a security scanner."
        },
        {
          "category": "Performance",
          "description": "Inefficient database queries or poorly optimized code can lead to slow loading times.",
          "severity": "Medium",
          "likelihood": "Medium",
          "mitigation": "Optimize database queries. Implement caching. Profile and optimize code for performance."
        },
        {
          "category": "Scalability",
          "description": "The application may not scale well if the user base grows significantly.",
          "severity": "Low",
          "likelihood": "Low",
          "mitigation": "Design the application with scalability in mind. Consider using a scalable database and cloud infrastructure."
        }
      ],
      "synthesis": {
        "backend": {
          "language": "JavaScript",
          "framework": "Node.js with Express",
          "reasoning": "Node.js with Express provides a lightweight and efficient backend solution. JavaScript is used on both the frontend and backend, which can streamline development. Express simplifies routing and middleware management. It's a good choice for a simple application."
        },
        "frontend": {
          "language": "JavaScript",
          "framework": "React",
          "reasoning": "React is a popular and efficient library for building user interfaces. It offers a component-based architecture, making it easy to manage and update the UI. Its virtual DOM enhances performance, addressing the requirement for quick loading."
        },
        "database": {
          "type": "PostgreSQL",
          "reasoning": "PostgreSQL is a robust and reliable relational database. It offers strong data integrity and is suitable for storing structured data. It's a good choice for a simple task list application."
        },
        "architecture_pattern": "Monolithic Architecture",
        "deployment_environment": {
          "cloud_provider": "AWS (Amazon Web Services)",
          "reasoning": "AWS offers a wide range of services, including compute, storage, and databases. It's a good choice for deploying web applications. It provides scalability and security."
        },
        "key_libraries_tools": [
          {
            "name": "React Router",
            "purpose": "For navigation in the React frontend."
          },
          {
            "name": "Axios",
            "purpose": "For making API calls from the frontend to the backend."
          },
          {
            "name": "Express",
            "purpose": "For building the backend API."
          },
          {
            "name": "PostgreSQL",
            "purpose": "For storing the task data."
          },
          {
            "name": "Git",
            "purpose": "For version control."
          },
          {
            "name": "Docker",
            "purpose": "For containerization."
          },
          {
            "name": "CI/CD Pipeline (e.g., GitHub Actions)",
            "purpose": "For automating the build, test, and deployment process."
          }
        ],
        "estimated_complexity": "Low"
      },
      "selected_stack": null
    },
    "system_design": {
      "architecture": {
        "pattern": "Monolithic Architecture",
        "justification": "For a simple task list application, a monolithic architecture is suitable. All components (frontend, backend, database) are deployed as a single unit. This simplifies development and deployment.",
        "key_benefits": [
          "Simplified development and deployment",
          "Faster initial development speed"
        ],
        "potential_drawbacks": [
          "Can become harder to scale as the application grows",
          "Maintenance can become more complex as the application grows"
        ]
      },
      "components": [
        {
          "name": "Frontend",
          "description": "The user interface for interacting with the task list application.",
          "category": "frontend",
          "technologies": [
            "React",
            "JavaScript",
            "HTML",
            "CSS"
          ],
          "dependencies": [
            "Backend API"
          ],
          "responsibilities": [
            "Displaying the task list",
            "Allowing users to add new tasks",
            "Handling user interactions",
            "Making API calls to the backend"
          ],
          "design_patterns": [
            "Component-based architecture"
          ]
        },
        {
          "name": "Backend API",
          "description": "The API that handles requests from the frontend and interacts with the database.",
          "category": "backend",
          "technologies": [
            "Node.js",
            "Express",
            "JavaScript"
          ],
          "dependencies": [
            "PostgreSQL Database"
          ],
          "responsibilities": [
            "Handling API requests",
            "Validating data",
            "Interacting with the database",
            "Returning data to the frontend"
          ],
          "design_patterns": [
            "RESTful API"
          ]
        },
        {
          "name": "PostgreSQL Database",
          "description": "The database for storing task data.",
          "category": "database",
          "technologies": [
            "PostgreSQL",
            "SQL"
          ],
          "dependencies": [],
          "responsibilities": [
            "Storing task data",
            "Providing data to the backend API"
          ],
          "design_patterns": [
            "Relational Database"
          ]
        },
        {
          "name": "Deployment Infrastructure",
          "description": "Infrastructure for deploying and running the application.",
          "category": "infrastructure",
          "technologies": [
            "AWS",
            "Docker",
            "CI/CD Pipeline (e.g., GitHub Actions)"
          ],
          "dependencies": [
            "Frontend",
            "Backend API",
            "PostgreSQL Database"
          ],
          "responsibilities": [
            "Deploying the application",
            "Managing the application's resources",
            "Automating the build, test, and deployment process"
          ],
          "design_patterns": [
            "Containerization",
            "Infrastructure as Code"
          ]
        }
      ],
      "data_model": {
        "schema_type": "Relational",
        "tables": [
          {
            "name": "tasks",
            "purpose": "Stores the tasks created by users.",
            "fields": [
              {
                "name": "id",
                "type": "SERIAL",
                "constraints": [
                  "PRIMARY KEY"
                ],
                "description": "Unique identifier for the task."
              },
              {
                "name": "description",
                "type": "TEXT",
                "constraints": [
                  "NOT NULL"
                ],
                "description": "The text description of the task."
              },
              {
                "name": "created_at",
                "type": "TIMESTAMP",
                "constraints": [
                  "NOT NULL",
                  "DEFAULT CURRENT_TIMESTAMP"
                ],
                "description": "The timestamp when the task was created."
              }
            ],
            "relationships": []
          }
        ],
        "relationships": []
      },
      "api_endpoints": {
        "style": "REST",
        "base_url": "/api/v1",
        "authentication": "None (for simplicity)",
        "endpoints": [
          {
            "method": "POST",
            "path": "/tasks",
            "purpose": "Create a new task.",
            "parameters": [
              {
                "description": "The task description.",
                "type": "string",
                "name": "description"
              }
            ],
            "response": {
              "201": {
                "message": "Task created successfully.",
                "task": {
                  "id": "integer",
                  "description": "string",
                  "created_at": "datetime"
                }
              },
              "400": {
                "message": "Bad Request - Invalid input."
              }
            },
            "authentication_required": false,
            "rate_limiting_applied": false
          },
          {
            "method": "GET",
            "path": "/tasks",
            "purpose": "Get all tasks.",
            "parameters": [],
            "response": {
              "200": {
                "tasks": [
                  {
                    "id": "integer",
                    "description": "string",
                    "created_at": "datetime"
                  }
                ]
              }
            },
            "authentication_required": false,
            "rate_limiting_applied": false
          }
        ],
        "error_handling": "Centralized error handling middleware to catch and format errors consistently.",
        "rate_limiting_strategy": null
      },
      "security": {
        "authentication_method": "None (for simplicity)",
        "authorization_strategy": "None (for simplicity)",
        "data_encryption": {
          "at_rest": "Not applicable (for simplicity)",
          "in_transit": "HTTPS is enforced for all communication."
        },
        "security_measures": [
          {
            "category": "Input Validation",
            "implementation": "Validate all user inputs on the backend to prevent injection attacks.",
            "mitigation": "SQL Injection, Cross-Site Scripting (XSS)",
            "priority": "High"
          },
          {
            "category": "HTTPS",
            "implementation": "Enforce HTTPS for all communication between the frontend and backend.",
            "mitigation": "Man-in-the-middle attacks",
            "priority": "High"
          },
          {
            "category": "Dependency Management",
            "implementation": "Regularly update dependencies to patch security vulnerabilities.",
            "mitigation": "Vulnerabilities in dependencies",
            "priority": "Medium"
          },
          {
            "category": "Rate Limiting",
            "implementation": "Implement rate limiting on API endpoints to prevent abuse (not implemented in this simple design).",
            "mitigation": "Denial-of-Service (DoS) attacks",
            "priority": "Medium"
          }
        ],
        "vulnerability_mitigation_strategies": [
          "Input validation and sanitization",
          "Use of parameterized queries (to prevent SQL injection)",
          "Regularly update dependencies",
          "Enforce HTTPS"
        ],
        "compliance_standards": []
      },
      "scalability_and_performance": {
        "caching_strategy": "Implement client-side caching for static assets (e.g., JavaScript, CSS).",
        "database_optimization": "Optimize database queries and indexes for performance.",
        "code_optimization": "Profile and optimize code for performance, especially in the backend API."
      },
      "deployment_strategy": {
        "environment": "AWS (Amazon Web Services)",
        "deployment_method": "Containerized deployment using Docker and deployed to AWS Elastic Container Service (ECS) or Elastic Beanstalk.",
        "infrastructure_as_code": "Use infrastructure-as-code tools (e.g., Terraform, AWS CloudFormation) to manage the infrastructure.",
        "ci_cd_pipeline": "Implement a CI/CD pipeline using GitHub Actions or similar to automate the build, test, and deployment process."
      },
      "monitoring_and_logging": {
        "logging_strategy": "Implement logging for both frontend and backend. Use a logging library (e.g., Winston for Node.js) to log important events and errors.",
        "monitoring_tools": "Use monitoring tools (e.g., AWS CloudWatch) to monitor the application's performance and health."
      },
      "error_handling_strategy": "Centralized error handling middleware in the backend API to catch and format errors consistently. Implement try-catch blocks and proper error codes (e.g., 400, 500) in the API.",
      "development_phases_overview": [
        {
          "name": "Phase 1: Setup and Frontend Development",
          "description": "Set up the development environment, including the frontend framework (React). Develop the user interface for adding and viewing tasks.",
          "priority": "High",
          "dependencies": [],
          "tasks": [
            "Set up React project",
            "Design and implement the UI for adding tasks",
            "Design and implement the UI for viewing tasks",
            "Implement basic styling"
          ],
          "estimated_duration": "1 week"
        },
        {
          "name": "Phase 2: Backend API Development",
          "description": "Develop the backend API using Node.js and Express. Implement the API endpoints for creating and retrieving tasks. Set up the PostgreSQL database.",
          "priority": "High",
          "dependencies": [
            "Phase 1: Setup and Frontend Development"
          ],
          "tasks": [
            "Set up Node.js and Express project",
            "Implement API endpoints for creating tasks (POST /tasks)",
            "Implement API endpoints for retrieving tasks (GET /tasks)",
            "Set up PostgreSQL database",
            "Connect the API to the database"
          ],
          "estimated_duration": "1 week"
        },
        {
          "name": "Phase 3: Integration and Testing",
          "description": "Integrate the frontend with the backend API. Implement unit and integration tests. Address any bugs and issues.",
          "priority": "High",
          "dependencies": [
            "Phase 1: Setup and Frontend Development",
            "Phase 2: Backend API Development"
          ],
          "tasks": [
            "Connect the frontend to the backend API using Axios",
            "Implement unit tests for frontend components",
            "Implement integration tests for API endpoints",
            "Fix any bugs and issues"
          ],
          "estimated_duration": "1 week"
        },
        {
          "name": "Phase 4: Deployment and Monitoring",
          "description": "Deploy the application to AWS. Set up monitoring and logging.",
          "priority": "High",
          "dependencies": [
            "Phase 3: Integration and Testing"
          ],
          "tasks": [
            "Containerize the application using Docker",
            "Deploy the application to AWS (e.g., ECS, Elastic Beanstalk)",
            "Set up monitoring using AWS CloudWatch",
            "Set up logging"
          ],
          "estimated_duration": "1 week"
        }
      ],
      "key_risks": [
        "Security vulnerabilities in dependencies.",
        "Performance issues due to inefficient database queries or poorly optimized code.",
        "Scalability limitations if the application grows significantly."
      ],
      "design_justification": "The design prioritizes simplicity and ease of development for a basic task list application. The monolithic architecture, React frontend, Node.js/Express backend, and PostgreSQL database provide a straightforward and efficient solution. The use of AWS for deployment ensures scalability and reliability. The chosen technologies are well-documented and have large communities, which will help with development and maintenance. Security best practices are included to address potential risks.",
      "data_flow": "1.  User interacts with the React frontend to add a task. 2. The frontend sends a POST request to the /tasks endpoint of the Node.js/Express backend. 3. The backend API validates the request data. 4. The backend API inserts the task data into the PostgreSQL database. 5. The backend API returns a success response to the frontend. 6. User requests to view the task list. 7. The frontend sends a GET request to the /tasks endpoint. 8. The backend API retrieves all tasks from the PostgreSQL database. 9. The backend API returns the task data to the frontend. 10. The frontend displays the task list to the user."
    },
    "implementation_plan": "plan=ImplementationPlan(project_summary={'title': 'Generated Project Plan', 'description': 'Develop a simple web application for managing a list of tasks, including adding and viewing tasks, using React for the frontend, Node.js/Express for the backend, PostgreSQL for the database, and deployed on AWS.', 'overall_complexity': 'Medium', 'estimated_duration': 'TBD', 'key_challenges': [], 'success_criteria': []}, phases=[{'name': 'Frontend Phase', 'description': 'Tasks related to frontend phase', 'deliverables': ['Completed FE-001', 'Completed FE-002', 'Completed FE-003', 'Completed FE-004', 'Completed FE-005', 'Completed FE-006', 'Completed FE-007'], 'estimated_duration_hours': 48.0, 'work_items': [{'id': 'FE-001', 'description': 'Set up React project using Create React App.', 'dependencies': [], 'estimated_time': '4 hours', 'agent_role': 'frontend_developer', 'acceptance_criteria': ['Project is initialized with Create React App.', 'Project runs without errors.', 'Basic project structure is in place.'], 'status': 'pending', 'code_files': ['package.json', 'src/App.js', 'src/index.js']}, {'id': 'FE-002', 'description': 'Design and implement the UI for adding tasks (input field and add button).', 'dependencies': ['FE-001'], 'estimated_time': '8 hours', 'agent_role': 'frontend_developer', 'acceptance_criteria': ['UI includes an input field for task description.', \"UI includes an 'Add Task' button.\", 'UI elements are styled appropriately.', 'UI is responsive.'], 'status': 'pending', 'code_files': ['src/App.js', 'src/App.css']}, {'id': 'FE-003', 'description': 'Design and implement the UI for viewing tasks (task list).', 'dependencies': ['FE-001'], 'estimated_time': '8 hours', 'agent_role': 'frontend_developer', 'acceptance_criteria': ['UI displays a list of tasks.', 'Each task is displayed with its description.', 'UI is styled appropriately.', 'UI is responsive.'], 'status': 'pending', 'code_files': ['src/App.js', 'src/App.css']}, {'id': 'FE-004', 'description': 'Implement basic styling for the frontend.', 'dependencies': ['FE-002', 'FE-003'], 'estimated_time': '4 hours', 'agent_role': 'frontend_developer', 'acceptance_criteria': ['UI elements are visually appealing.', 'UI is consistent in style.', 'UI is readable.'], 'status': 'pending', 'code_files': ['src/App.css']}, {'id': 'FE-005', 'description': 'Connect the frontend to the backend API using Axios.', 'dependencies': ['FE-002', 'FE-003', 'BE-002', 'BE-003'], 'estimated_time': '8 hours', 'agent_role': 'frontend_developer', 'acceptance_criteria': ['Frontend makes API calls to create tasks.', 'Frontend makes API calls to retrieve tasks.', 'Frontend displays tasks retrieved from the API.', 'Error handling for API calls is implemented.'], 'status': 'pending', 'code_files': ['src/App.js']}, {'id': 'FE-006', 'description': 'Implement unit tests for frontend components.', 'dependencies': ['FE-001', 'FE-002', 'FE-003'], 'estimated_time': '8 hours', 'agent_role': 'frontend_developer', 'acceptance_criteria': ['Unit tests cover the add task component.', 'Unit tests cover the task list component.', 'Tests pass successfully.'], 'status': 'pending', 'code_files': ['src/App.test.js']}, {'id': 'FE-007', 'description': 'Fix any bugs and issues identified during testing.', 'dependencies': ['FE-005', 'FE-006', 'BE-007'], 'estimated_time': '8 hours', 'agent_role': 'frontend_developer', 'acceptance_criteria': ['All identified bugs are fixed.', 'Application functions as expected.'], 'status': 'pending', 'code_files': ['src/App.js']}]}, {'name': 'Backend Phase', 'description': 'Tasks related to backend phase', 'deliverables': ['Completed BE-001', 'Completed BE-002', 'Completed BE-003', 'Completed BE-004', 'Completed BE-005', 'Completed BE-006', 'Completed BE-007', 'Completed BE-008'], 'estimated_duration_hours': 60.0, 'work_items': [{'id': 'BE-001', 'description': 'Set up Node.js and Express project.', 'dependencies': [], 'estimated_time': '4 hours', 'agent_role': 'backend_developer', 'acceptance_criteria': ['Project is initialized with npm.', 'Express is installed.', 'Project runs without errors.', 'Basic project structure is in place.'], 'status': 'pending', 'code_files': ['package.json', 'index.js']}, {'id': 'BE-002', 'description': 'Implement API endpoint for creating tasks (POST /tasks).', 'dependencies': ['BE-001'], 'estimated_time': '8 hours', 'agent_role': 'backend_developer', 'acceptance_criteria': ['Endpoint accepts POST requests to /tasks.', 'Endpoint receives a task description in the request body.', 'Endpoint validates the task description.', 'Endpoint returns a 201 status code on success.', 'Endpoint returns a 400 status code on invalid input.'], 'status': 'pending', 'code_files': ['index.js']}, {'id': 'BE-003', 'description': 'Implement API endpoint for retrieving tasks (GET /tasks).', 'dependencies': ['BE-001'], 'estimated_time': '8 hours', 'agent_role': 'backend_developer', 'acceptance_criteria': ['Endpoint accepts GET requests to /tasks.', 'Endpoint retrieves all tasks from the database.', 'Endpoint returns a 200 status code on success.', 'Endpoint returns a JSON array of tasks.'], 'status': 'pending', 'code_files': ['index.js']}, {'id': 'BE-004', 'description': 'Connect the API to the PostgreSQL database.', 'dependencies': ['BE-001', 'DB-001', 'DB-002'], 'estimated_time': '8 hours', 'agent_role': 'backend_developer', 'acceptance_criteria': ['API can connect to the PostgreSQL database.', 'API can execute SQL queries.', 'API uses a database connection pool.'], 'status': 'pending', 'code_files': ['index.js']}, {'id': 'BE-005', 'description': 'Implement database interaction for creating tasks (POST /tasks).', 'dependencies': ['BE-002', 'BE-004'], 'estimated_time': '8 hours', 'agent_role': 'backend_developer', 'acceptance_criteria': [\"Endpoint inserts a new task into the 'tasks' table.\", 'Endpoint returns the created task with its ID.', 'Endpoint handles database errors gracefully.'], 'status': 'pending', 'code_files': ['index.js']}, {'id': 'BE-006', 'description': 'Implement database interaction for retrieving tasks (GET /tasks).', 'dependencies': ['BE-003', 'BE-004'], 'estimated_time': '8 hours', 'agent_role': 'backend_developer', 'acceptance_criteria': [\"Endpoint retrieves all tasks from the 'tasks' table.\", 'Endpoint returns the tasks in the correct format.', 'Endpoint handles database errors gracefully.'], 'status': 'pending', 'code_files': ['index.js']}, {'id': 'BE-007', 'description': 'Implement integration tests for API endpoints.', 'dependencies': ['BE-002', 'BE-003', 'BE-005', 'BE-006'], 'estimated_time': '8 hours', 'agent_role': 'backend_developer', 'acceptance_criteria': ['Integration tests cover the POST /tasks endpoint.', 'Integration tests cover the GET /tasks endpoint.', 'Tests pass successfully.'], 'status': 'pending', 'code_files': []}, {'id': 'BE-008', 'description': 'Fix any bugs and issues identified during testing.', 'dependencies': ['FE-005', 'FE-006', 'BE-007'], 'estimated_time': '8 hours', 'agent_role': 'backend_developer', 'acceptance_criteria': ['All identified bugs are fixed.', 'Application functions as expected.'], 'status': 'pending', 'code_files': ['index.js']}]}, {'name': 'Database Phase', 'description': 'Tasks related to database phase', 'deliverables': ['Completed DB-001', 'Completed DB-002'], 'estimated_duration_hours': 8.0, 'work_items': [{'id': 'DB-001', 'description': 'Set up PostgreSQL database.', 'dependencies': [], 'estimated_time': '4 hours', 'agent_role': 'database_specialist', 'acceptance_criteria': ['PostgreSQL is installed and running.', 'A database is created for the application.', 'Database connection details are configured.'], 'status': 'pending', 'code_files': []}, {'id': 'DB-002', 'description': \"Create 'tasks' table in PostgreSQL.\", 'dependencies': ['DB-001'], 'estimated_time': '4 hours', 'agent_role': 'database_specialist', 'acceptance_criteria': [\"Table 'tasks' exists.\", \"Table has 'id', 'description', and 'created_at' columns.\", \"'id' is a SERIAL PRIMARY KEY.\", \"'description' is TEXT NOT NULL.\", \"'created_at' is TIMESTAMP with DEFAULT CURRENT_TIMESTAMP.\"], 'status': 'pending', 'code_files': []}]}, {'name': 'Devops_Engineer Phase', 'description': 'Tasks related to devops_engineer phase', 'deliverables': ['Completed INF-001', 'Completed INF-002', 'Completed INF-003', 'Completed INF-004'], 'estimated_duration_hours': 36.0, 'work_items': [{'id': 'INF-001', 'description': 'Containerize the application using Docker.', 'dependencies': ['BE-001', 'FE-001'], 'estimated_time': '8 hours', 'agent_role': 'devops_engineer', 'acceptance_criteria': ['Dockerfiles are created for both frontend and backend.', 'Application can be built and run using Docker Compose.', 'Frontend and backend containers are running and communicating.'], 'status': 'pending', 'code_files': ['Dockerfile', 'docker-compose.yml']}, {'id': 'INF-002', 'description': 'Deploy the application to AWS (e.g., ECS, Elastic Beanstalk).', 'dependencies': ['INF-001'], 'estimated_time': '16 hours', 'agent_role': 'devops_engineer', 'acceptance_criteria': ['Application is deployed to AWS.', 'Frontend is accessible via a public URL.', 'Backend is running and accessible by the frontend.', 'Database is accessible by the backend.'], 'status': 'pending', 'code_files': []}, {'id': 'INF-003', 'description': 'Set up monitoring using AWS CloudWatch.', 'dependencies': ['INF-002'], 'estimated_time': '8 hours', 'agent_role': 'devops_engineer', 'acceptance_criteria': ['CloudWatch is configured to monitor application performance.', 'Logs are being collected from the frontend and backend.', 'Alerts are configured for critical errors.'], 'status': 'pending', 'code_files': []}, {'id': 'INF-004', 'description': 'Set up logging.', 'dependencies': ['INF-002'], 'estimated_time': '4 hours', 'agent_role': 'devops_engineer', 'acceptance_criteria': ['Logging is implemented in both frontend and backend.', 'Logs include relevant information (e.g., timestamps, errors).', 'Logs are stored in a centralized location (e.g., CloudWatch Logs).'], 'status': 'pending', 'code_files': ['index.js', 'src/App.js']}]}], resource_allocation=[{'role': 'Backend Developer', 'count': 1, 'estimated_time_allocation': '100%', 'phases': ['Backend Phase'], 'skills_required': []}, {'role': 'Database Specialist', 'count': 1, 'estimated_time_allocation': '100%', 'phases': ['Database Phase'], 'skills_required': []}, {'role': 'Devops Engineer', 'count': 1, 'estimated_time_allocation': '100%', 'phases': ['Devops_Engineer Phase'], 'skills_required': []}, {'role': 'Frontend Developer', 'count': 1, 'estimated_time_allocation': '100%', 'phases': ['Frontend Phase'], 'skills_required': []}], risks_and_mitigations=[], timeline={'start_date': '2025-07-08T20:22:13.535279', 'end_date': 'TBD', 'milestones': []}, tech_stack={}, metadata={'generated_at': '2025-07-08T20:22:13.535279', 'version': '1.0', 'author': 'Multi-AI Dev System', 'tags': [], 'notes': 'Converted from WorkItemBacklog. Original summary: Develop a simple web application for managing a list of tasks, including adding and viewing tasks, using React for the frontend, Node.js/Express for the backend, PostgreSQL for the database, and deployed on AWS.'}) summary='Develop a simple web application for managing a list of tasks, including adding and viewing tasks, using React for the frontend, Node.js/Express for the backend, PostgreSQL for the database, and deployed on AWS.' metadata=PlanMetadata(generated_at='2025-07-08T20:22:13.535279', version='1.0', author='Multi-AI Dev System', tags=[], notes='Converted from WorkItemBacklog. Original summary: Develop a simple web application for managing a list of tasks, including adding and viewing tasks, using React for the frontend, Node.js/Express for the backend, PostgreSQL for the database, and deployed on AWS.')"
  }
}