{
  "session_id": "session_ed1e8abc-8e0a-4ea1-92c5-9dddc6a51bed",
  "approval_type": "implementation_plan",
  "timestamp": 1751973462,
  "approval_data": {
    "type": "implementation_plan",
    "timestamp": 1751973462.2393675,
    "project_overview": "Develop a full-stack task list application using React for the frontend, Node.js/Express for the backend, and MongoDB for the database. The application will allow users to add, view, edit, and delete tasks. The application will be deployed to Heroku.",
    "development_phases": [
      {
        "name": "Frontend Phase",
        "description": "Tasks related to frontend phase",
        "deliverables": [
          "Completed FE-001",
          "Completed FE-002",
          "Completed FE-003",
          "Completed FE-004",
          "Completed FE-005",
          "Completed FE-006",
          "Completed FE-007",
          "Completed FE-008",
          "Completed FE-009",
          "Completed FE-010",
          "Completed FE-011",
          "Completed FE-012",
          "Completed TE-002"
        ],
        "estimated_duration_hours": 48.0,
        "work_items": [
          {
            "id": "FE-001",
            "description": "Set up React project using Create React App.",
            "dependencies": [],
            "estimated_time": "2 hours",
            "agent_role": "frontend_developer",
            "acceptance_criteria": [
              "Project initializes successfully.",
              "Default React app runs without errors."
            ],
            "status": "pending",
            "code_files": [
              "package.json",
              "src/App.js",
              "src/index.js"
            ]
          },
          {
            "id": "FE-002",
            "description": "Install Axios for making API requests.",
            "dependencies": [
              "FE-001"
            ],
            "estimated_time": "1 hour",
            "agent_role": "frontend_developer",
            "acceptance_criteria": [
              "Axios is installed as a project dependency.",
              "Import statement for Axios is working."
            ],
            "status": "pending",
            "code_files": [
              "package.json"
            ]
          },
          {
            "id": "FE-003",
            "description": "Create a Task component to display a single task.",
            "dependencies": [
              "FE-001"
            ],
            "estimated_time": "3 hours",
            "agent_role": "frontend_developer",
            "acceptance_criteria": [
              "Task component renders a task description.",
              "Task component accepts a 'description' prop."
            ],
            "status": "pending",
            "code_files": [
              "src/Task.js"
            ]
          },
          {
            "id": "FE-004",
            "description": "Create a TaskList component to display a list of tasks.",
            "dependencies": [
              "FE-003"
            ],
            "estimated_time": "4 hours",
            "agent_role": "frontend_developer",
            "acceptance_criteria": [
              "TaskList component renders a list of Task components.",
              "TaskList component accepts a 'tasks' prop (array of task objects)."
            ],
            "status": "pending",
            "code_files": [
              "src/TaskList.js"
            ]
          },
          {
            "id": "FE-005",
            "description": "Create a TaskForm component to allow users to add new tasks.",
            "dependencies": [
              "FE-001"
            ],
            "estimated_time": "4 hours",
            "agent_role": "frontend_developer",
            "acceptance_criteria": [
              "TaskForm component renders an input field and a submit button.",
              "TaskForm component calls a provided 'onSubmit' function when the form is submitted.",
              "TaskForm component clears the input field after submission."
            ],
            "status": "pending",
            "code_files": [
              "src/TaskForm.js"
            ]
          },
          {
            "id": "FE-006",
            "description": "Implement the UI for the main application layout (using TaskList and TaskForm).",
            "dependencies": [
              "FE-004",
              "FE-005"
            ],
            "estimated_time": "3 hours",
            "agent_role": "frontend_developer",
            "acceptance_criteria": [
              "TaskForm is displayed at the top.",
              "TaskList is displayed below the TaskForm.",
              "Initial task list is empty."
            ],
            "status": "pending",
            "code_files": [
              "src/App.js"
            ]
          },
          {
            "id": "FE-007",
            "description": "Fetch tasks from the backend API and display them in the TaskList.",
            "dependencies": [
              "FE-002",
              "FE-004",
              "BE-005"
            ],
            "estimated_time": "4 hours",
            "agent_role": "frontend_developer",
            "acceptance_criteria": [
              "App makes a GET request to /api/tasks on component mount.",
              "Tasks are fetched and displayed in the TaskList.",
              "Error handling for API request failures is implemented."
            ],
            "status": "pending",
            "code_files": [
              "src/App.js"
            ]
          },
          {
            "id": "FE-008",
            "description": "Implement adding a new task by calling the backend API.",
            "dependencies": [
              "FE-002",
              "FE-005",
              "BE-004"
            ],
            "estimated_time": "4 hours",
            "agent_role": "frontend_developer",
            "acceptance_criteria": [
              "TaskForm calls the /api/tasks POST endpoint when submitted.",
              "New task is added to the task list after successful API call.",
              "Error handling for API request failures is implemented."
            ],
            "status": "pending",
            "code_files": [
              "src/App.js"
            ]
          },
          {
            "id": "FE-009",
            "description": "Implement UI to show task details and allow editing.",
            "dependencies": [
              "FE-003",
              "FE-007",
              "BE-006",
              "BE-007",
              "BE-008"
            ],
            "estimated_time": "6 hours",
            "agent_role": "frontend_developer",
            "acceptance_criteria": [
              "Task component displays a checkbox for completion status.",
              "Task component displays an edit button.",
              "Task component displays a delete button.",
              "Clicking edit button allows editing of the description.",
              "Clicking delete button calls the delete API."
            ],
            "status": "pending",
            "code_files": [
              "src/Task.js"
            ]
          },
          {
            "id": "FE-010",
            "description": "Implement UI to update task completion status.",
            "dependencies": [
              "FE-009",
              "BE-007"
            ],
            "estimated_time": "4 hours",
            "agent_role": "frontend_developer",
            "acceptance_criteria": [
              "Clicking the checkbox updates the task's completion status.",
              "API call is made to update the task.",
              "Task list is refreshed after the update."
            ],
            "status": "pending",
            "code_files": [
              "src/Task.js",
              "src/App.js"
            ]
          },
          {
            "id": "FE-011",
            "description": "Implement UI to delete tasks.",
            "dependencies": [
              "FE-009",
              "BE-008"
            ],
            "estimated_time": "4 hours",
            "agent_role": "frontend_developer",
            "acceptance_criteria": [
              "Clicking the delete button calls the delete API.",
              "Task is removed from the list after successful deletion.",
              "Confirmation dialog before deletion."
            ],
            "status": "pending",
            "code_files": [
              "src/Task.js",
              "src/App.js"
            ]
          },
          {
            "id": "FE-012",
            "description": "Implement basic styling for the application.",
            "dependencies": [
              "FE-001"
            ],
            "estimated_time": "4 hours",
            "agent_role": "frontend_developer",
            "acceptance_criteria": [
              "Application has a consistent and readable style.",
              "Task list and form are visually appealing."
            ],
            "status": "pending",
            "code_files": [
              "src/App.css",
              "src/Task.css"
            ]
          },
          {
            "id": "TE-002",
            "description": "Write unit tests for the frontend components.",
            "dependencies": [
              "FE-001",
              "FE-003",
              "FE-004",
              "FE-005"
            ],
            "estimated_time": "6 hours",
            "agent_role": "frontend_developer",
            "acceptance_criteria": [
              "Tests cover Task, TaskList, and TaskForm components.",
              "Tests verify correct rendering and behavior of components.",
              "Tests verify component interactions (e.g., form submission)."
            ],
            "status": "pending",
            "code_files": [
              "src/Task.test.js",
              "src/TaskList.test.js",
              "src/TaskForm.test.js"
            ]
          }
        ]
      },
      {
        "name": "Backend Phase",
        "description": "Tasks related to backend phase",
        "deliverables": [
          "Completed BE-001",
          "Completed BE-002",
          "Completed BE-003",
          "Completed BE-004",
          "Completed BE-005",
          "Completed BE-006",
          "Completed BE-007",
          "Completed BE-008",
          "Completed BE-009",
          "Completed DE-001",
          "Completed TE-001"
        ],
        "estimated_duration_hours": 37.0,
        "work_items": [
          {
            "id": "BE-001",
            "description": "Initialize a Node.js project and install Express.js, body-parser, and cors.",
            "dependencies": [],
            "estimated_time": "2 hours",
            "agent_role": "backend_developer",
            "acceptance_criteria": [
              "Node.js project initialized.",
              "Express.js, body-parser, and cors are installed as project dependencies.",
              "Basic Express server runs without errors."
            ],
            "status": "pending",
            "code_files": [
              "package.json",
              "index.js"
            ]
          },
          {
            "id": "BE-002",
            "description": "Set up MongoDB connection using Mongoose.",
            "dependencies": [
              "BE-001"
            ],
            "estimated_time": "3 hours",
            "agent_role": "backend_developer",
            "acceptance_criteria": [
              "Mongoose is installed as a project dependency.",
              "MongoDB connection is established successfully.",
              "Connection errors are handled."
            ],
            "status": "pending",
            "code_files": [
              "index.js"
            ]
          },
          {
            "id": "BE-003",
            "description": "Define the Task model in Mongoose.",
            "dependencies": [
              "BE-002"
            ],
            "estimated_time": "2 hours",
            "agent_role": "backend_developer",
            "acceptance_criteria": [
              "Task schema is defined with 'description', 'created_at', and 'completed' fields.",
              "Task model is created using the schema."
            ],
            "status": "pending",
            "code_files": [
              "models/Task.js"
            ]
          },
          {
            "id": "BE-004",
            "description": "Implement the POST /api/tasks endpoint (create a new task).",
            "dependencies": [
              "BE-003"
            ],
            "estimated_time": "4 hours",
            "agent_role": "backend_developer",
            "acceptance_criteria": [
              "Endpoint handles POST requests to /api/tasks.",
              "Endpoint receives a 'description' in the request body.",
              "Endpoint creates a new task in the database.",
              "Endpoint returns the created task with a 201 status code.",
              "Endpoint returns a 400 status code for invalid input."
            ],
            "status": "pending",
            "code_files": [
              "index.js"
            ]
          },
          {
            "id": "BE-005",
            "description": "Implement the GET /api/tasks endpoint (get all tasks).",
            "dependencies": [
              "BE-003"
            ],
            "estimated_time": "3 hours",
            "agent_role": "backend_developer",
            "acceptance_criteria": [
              "Endpoint handles GET requests to /api/tasks.",
              "Endpoint retrieves all tasks from the database.",
              "Endpoint returns the list of tasks with a 200 status code."
            ],
            "status": "pending",
            "code_files": [
              "index.js"
            ]
          },
          {
            "id": "BE-006",
            "description": "Implement the GET /api/tasks/:id endpoint (get a specific task).",
            "dependencies": [
              "BE-003"
            ],
            "estimated_time": "3 hours",
            "agent_role": "backend_developer",
            "acceptance_criteria": [
              "Endpoint handles GET requests to /api/tasks/:id.",
              "Endpoint retrieves a specific task from the database by ID.",
              "Endpoint returns the task with a 200 status code.",
              "Endpoint returns a 404 status code if the task is not found."
            ],
            "status": "pending",
            "code_files": [
              "index.js"
            ]
          },
          {
            "id": "BE-007",
            "description": "Implement the PUT /api/tasks/:id endpoint (update a task).",
            "dependencies": [
              "BE-003"
            ],
            "estimated_time": "4 hours",
            "agent_role": "backend_developer",
            "acceptance_criteria": [
              "Endpoint handles PUT requests to /api/tasks/:id.",
              "Endpoint updates a specific task in the database by ID.",
              "Endpoint returns the updated task with a 200 status code.",
              "Endpoint returns a 404 status code if the task is not found.",
              "Endpoint handles updates to description and completed status."
            ],
            "status": "pending",
            "code_files": [
              "index.js"
            ]
          },
          {
            "id": "BE-008",
            "description": "Implement the DELETE /api/tasks/:id endpoint (delete a task).",
            "dependencies": [
              "BE-003"
            ],
            "estimated_time": "3 hours",
            "agent_role": "backend_developer",
            "acceptance_criteria": [
              "Endpoint handles DELETE requests to /api/tasks/:id.",
              "Endpoint deletes a specific task from the database by ID.",
              "Endpoint returns a 204 status code on success.",
              "Endpoint returns a 404 status code if the task is not found."
            ],
            "status": "pending",
            "code_files": [
              "index.js"
            ]
          },
          {
            "id": "BE-009",
            "description": "Implement input validation on the backend.",
            "dependencies": [
              "BE-004"
            ],
            "estimated_time": "3 hours",
            "agent_role": "backend_developer",
            "acceptance_criteria": [
              "Validate the 'description' field in the POST request.",
              "Return a 400 status code if the description is missing or invalid.",
              "Validate the 'description' and 'completed' fields in the PUT request."
            ],
            "status": "pending",
            "code_files": [
              "index.js"
            ]
          },
          {
            "id": "DE-001",
            "description": "Deploy the application to Heroku.",
            "dependencies": [
              "BE-001",
              "FE-001",
              "BE-005",
              "FE-007",
              "BE-004",
              "FE-008",
              "BE-009",
              "FE-009",
              "FE-010",
              "FE-011",
              "FE-012"
            ],
            "estimated_time": "4 hours",
            "agent_role": "backend_developer",
            "acceptance_criteria": [
              "Application is successfully deployed to Heroku.",
              "Database connection is configured correctly on Heroku.",
              "Application is accessible via a Heroku URL."
            ],
            "status": "pending",
            "code_files": [
              "Procfile"
            ]
          },
          {
            "id": "TE-001",
            "description": "Write unit tests for the backend API endpoints.",
            "dependencies": [
              "BE-001",
              "BE-004",
              "BE-005",
              "BE-006",
              "BE-007",
              "BE-008"
            ],
            "estimated_time": "6 hours",
            "agent_role": "backend_developer",
            "acceptance_criteria": [
              "Tests cover all API endpoints (POST, GET, PUT, DELETE).",
              "Tests verify correct responses (status codes, data).",
              "Tests cover error scenarios (e.g., invalid input, not found)."
            ],
            "status": "pending",
            "code_files": [
              "tests/api.test.js"
            ]
          }
        ]
      }
    ],
    "timeline_estimation": {
      "start_date": "2025-07-08T16:47:41.741487",
      "end_date": "TBD",
      "milestones": []
    },
    "risk_assessment": [],
    "resource_requirements": [
      {
        "role": "Backend Developer",
        "count": 1,
        "estimated_time_allocation": "100%",
        "phases": [
          "Backend Phase"
        ],
        "skills_required": []
      },
      {
        "role": "Frontend Developer",
        "count": 1,
        "estimated_time_allocation": "100%",
        "phases": [
          "Frontend Phase"
        ],
        "skills_required": []
      }
    ],
    "deliverables": [
      "Completed FE-001",
      "Completed FE-002",
      "Completed FE-003",
      "Completed FE-004",
      "Completed FE-005",
      "Completed FE-006",
      "Completed FE-007",
      "Completed FE-008",
      "Completed FE-009",
      "Completed FE-010",
      "Completed FE-011",
      "Completed FE-012",
      "Completed TE-002",
      "Completed BE-001",
      "Completed BE-002",
      "Completed BE-003",
      "Completed BE-004",
      "Completed BE-005",
      "Completed BE-006",
      "Completed BE-007",
      "Completed BE-008",
      "Completed BE-009",
      "Completed DE-001",
      "Completed TE-001"
    ],
    "dependencies": [],
    "raw_plan": "plan=ImplementationPlan(project_summary={'title': 'Generated Project Plan', 'description': 'Develop a full-stack task list application using React for the frontend, Node.js/Express for the backend, and MongoDB for the database. The application will allow users to add, view, edit, and delete tasks. The application will be deployed to Heroku.', 'overall_complexity': 'Medium', 'estimated_duration': 'TBD', 'key_challenges': [], 'success_criteria': []}, phases=[{'name': 'Frontend Phase', 'description': 'Tasks related to frontend phase', 'deliverables': ['Completed FE-001', 'Completed FE-002', 'Completed FE-003', 'Completed FE-004', 'Completed FE-005', 'Completed FE-006', 'Completed FE-007', 'Completed FE-008', 'Completed FE-009', 'Completed FE-010', 'Completed FE-011', 'Completed FE-012', 'Completed TE-002'], 'estimated_duration_hours': 48.0, 'work_items': [{'id': 'FE-001', 'description': 'Set up React project using Create React App.', 'dependencies': [], 'estimated_time': '2 hours', 'agent_role': 'frontend_developer', 'acceptance_criteria': ['Project initializes successfully.', 'Default React app runs without errors.'], 'status': 'pending', 'code_files': ['package.json', 'src/App.js', 'src/index.js']}, {'id': 'FE-002', 'description': 'Install Axios for making API requests.', 'dependencies': ['FE-001'], 'estimated_time': '1 hour', 'agent_role': 'frontend_developer', 'acceptance_criteria': ['Axios is installed as a project dependency.', 'Import statement for Axios is working.'], 'status': 'pending', 'code_files': ['package.json']}, {'id': 'FE-003', 'description': 'Create a Task component to display a single task.', 'dependencies': ['FE-001'], 'estimated_time': '3 hours', 'agent_role': 'frontend_developer', 'acceptance_criteria': ['Task component renders a task description.', \"Task component accepts a 'description' prop.\"], 'status': 'pending', 'code_files': ['src/Task.js']}, {'id': 'FE-004', 'description': 'Create a TaskList component to display a list of tasks.', 'dependencies': ['FE-003'], 'estimated_time': '4 hours', 'agent_role': 'frontend_developer', 'acceptance_criteria': ['TaskList component renders a list of Task components.', \"TaskList component accepts a 'tasks' prop (array of task objects).\"], 'status': 'pending', 'code_files': ['src/TaskList.js']}, {'id': 'FE-005', 'description': 'Create a TaskForm component to allow users to add new tasks.', 'dependencies': ['FE-001'], 'estimated_time': '4 hours', 'agent_role': 'frontend_developer', 'acceptance_criteria': ['TaskForm component renders an input field and a submit button.', \"TaskForm component calls a provided 'onSubmit' function when the form is submitted.\", 'TaskForm component clears the input field after submission.'], 'status': 'pending', 'code_files': ['src/TaskForm.js']}, {'id': 'FE-006', 'description': 'Implement the UI for the main application layout (using TaskList and TaskForm).', 'dependencies': ['FE-004', 'FE-005'], 'estimated_time': '3 hours', 'agent_role': 'frontend_developer', 'acceptance_criteria': ['TaskForm is displayed at the top.', 'TaskList is displayed below the TaskForm.', 'Initial task list is empty.'], 'status': 'pending', 'code_files': ['src/App.js']}, {'id': 'FE-007', 'description': 'Fetch tasks from the backend API and display them in the TaskList.', 'dependencies': ['FE-002', 'FE-004', 'BE-005'], 'estimated_time': '4 hours', 'agent_role': 'frontend_developer', 'acceptance_criteria': ['App makes a GET request to /api/tasks on component mount.', 'Tasks are fetched and displayed in the TaskList.', 'Error handling for API request failures is implemented.'], 'status': 'pending', 'code_files': ['src/App.js']}, {'id': 'FE-008', 'description': 'Implement adding a new task by calling the backend API.', 'dependencies': ['FE-002', 'FE-005', 'BE-004'], 'estimated_time': '4 hours', 'agent_role': 'frontend_developer', 'acceptance_criteria': ['TaskForm calls the /api/tasks POST endpoint when submitted.', 'New task is added to the task list after successful API call.', 'Error handling for API request failures is implemented.'], 'status': 'pending', 'code_files': ['src/App.js']}, {'id': 'FE-009', 'description': 'Implement UI to show task details and allow editing.', 'dependencies': ['FE-003', 'FE-007', 'BE-006', 'BE-007', 'BE-008'], 'estimated_time': '6 hours', 'agent_role': 'frontend_developer', 'acceptance_criteria': ['Task component displays a checkbox for completion status.', 'Task component displays an edit button.', 'Task component displays a delete button.', 'Clicking edit button allows editing of the description.', 'Clicking delete button calls the delete API.'], 'status': 'pending', 'code_files': ['src/Task.js']}, {'id': 'FE-010', 'description': 'Implement UI to update task completion status.', 'dependencies': ['FE-009', 'BE-007'], 'estimated_time': '4 hours', 'agent_role': 'frontend_developer', 'acceptance_criteria': [\"Clicking the checkbox updates the task's completion status.\", 'API call is made to update the task.', 'Task list is refreshed after the update.'], 'status': 'pending', 'code_files': ['src/Task.js', 'src/App.js']}, {'id': 'FE-011', 'description': 'Implement UI to delete tasks.', 'dependencies': ['FE-009', 'BE-008'], 'estimated_time': '4 hours', 'agent_role': 'frontend_developer', 'acceptance_criteria': ['Clicking the delete button calls the delete API.', 'Task is removed from the list after successful deletion.', 'Confirmation dialog before deletion.'], 'status': 'pending', 'code_files': ['src/Task.js', 'src/App.js']}, {'id': 'FE-012', 'description': 'Implement basic styling for the application.', 'dependencies': ['FE-001'], 'estimated_time': '4 hours', 'agent_role': 'frontend_developer', 'acceptance_criteria': ['Application has a consistent and readable style.', 'Task list and form are visually appealing.'], 'status': 'pending', 'code_files': ['src/App.css', 'src/Task.css']}, {'id': 'TE-002', 'description': 'Write unit tests for the frontend components.', 'dependencies': ['FE-001', 'FE-003', 'FE-004', 'FE-005'], 'estimated_time': '6 hours', 'agent_role': 'frontend_developer', 'acceptance_criteria': ['Tests cover Task, TaskList, and TaskForm components.', 'Tests verify correct rendering and behavior of components.', 'Tests verify component interactions (e.g., form submission).'], 'status': 'pending', 'code_files': ['src/Task.test.js', 'src/TaskList.test.js', 'src/TaskForm.test.js']}]}, {'name': 'Backend Phase', 'description': 'Tasks related to backend phase', 'deliverables': ['Completed BE-001', 'Completed BE-002', 'Completed BE-003', 'Completed BE-004', 'Completed BE-005', 'Completed BE-006', 'Completed BE-007', 'Completed BE-008', 'Completed BE-009', 'Completed DE-001', 'Completed TE-001'], 'estimated_duration_hours': 37.0, 'work_items': [{'id': 'BE-001', 'description': 'Initialize a Node.js project and install Express.js, body-parser, and cors.', 'dependencies': [], 'estimated_time': '2 hours', 'agent_role': 'backend_developer', 'acceptance_criteria': ['Node.js project initialized.', 'Express.js, body-parser, and cors are installed as project dependencies.', 'Basic Express server runs without errors.'], 'status': 'pending', 'code_files': ['package.json', 'index.js']}, {'id': 'BE-002', 'description': 'Set up MongoDB connection using Mongoose.', 'dependencies': ['BE-001'], 'estimated_time': '3 hours', 'agent_role': 'backend_developer', 'acceptance_criteria': ['Mongoose is installed as a project dependency.', 'MongoDB connection is established successfully.', 'Connection errors are handled.'], 'status': 'pending', 'code_files': ['index.js']}, {'id': 'BE-003', 'description': 'Define the Task model in Mongoose.', 'dependencies': ['BE-002'], 'estimated_time': '2 hours', 'agent_role': 'backend_developer', 'acceptance_criteria': [\"Task schema is defined with 'description', 'created_at', and 'completed' fields.\", 'Task model is created using the schema.'], 'status': 'pending', 'code_files': ['models/Task.js']}, {'id': 'BE-004', 'description': 'Implement the POST /api/tasks endpoint (create a new task).', 'dependencies': ['BE-003'], 'estimated_time': '4 hours', 'agent_role': 'backend_developer', 'acceptance_criteria': ['Endpoint handles POST requests to /api/tasks.', \"Endpoint receives a 'description' in the request body.\", 'Endpoint creates a new task in the database.', 'Endpoint returns the created task with a 201 status code.', 'Endpoint returns a 400 status code for invalid input.'], 'status': 'pending', 'code_files': ['index.js']}, {'id': 'BE-005', 'description': 'Implement the GET /api/tasks endpoint (get all tasks).', 'dependencies': ['BE-003'], 'estimated_time': '3 hours', 'agent_role': 'backend_developer', 'acceptance_criteria': ['Endpoint handles GET requests to /api/tasks.', 'Endpoint retrieves all tasks from the database.', 'Endpoint returns the list of tasks with a 200 status code.'], 'status': 'pending', 'code_files': ['index.js']}, {'id': 'BE-006', 'description': 'Implement the GET /api/tasks/:id endpoint (get a specific task).', 'dependencies': ['BE-003'], 'estimated_time': '3 hours', 'agent_role': 'backend_developer', 'acceptance_criteria': ['Endpoint handles GET requests to /api/tasks/:id.', 'Endpoint retrieves a specific task from the database by ID.', 'Endpoint returns the task with a 200 status code.', 'Endpoint returns a 404 status code if the task is not found.'], 'status': 'pending', 'code_files': ['index.js']}, {'id': 'BE-007', 'description': 'Implement the PUT /api/tasks/:id endpoint (update a task).', 'dependencies': ['BE-003'], 'estimated_time': '4 hours', 'agent_role': 'backend_developer', 'acceptance_criteria': ['Endpoint handles PUT requests to /api/tasks/:id.', 'Endpoint updates a specific task in the database by ID.', 'Endpoint returns the updated task with a 200 status code.', 'Endpoint returns a 404 status code if the task is not found.', 'Endpoint handles updates to description and completed status.'], 'status': 'pending', 'code_files': ['index.js']}, {'id': 'BE-008', 'description': 'Implement the DELETE /api/tasks/:id endpoint (delete a task).', 'dependencies': ['BE-003'], 'estimated_time': '3 hours', 'agent_role': 'backend_developer', 'acceptance_criteria': ['Endpoint handles DELETE requests to /api/tasks/:id.', 'Endpoint deletes a specific task from the database by ID.', 'Endpoint returns a 204 status code on success.', 'Endpoint returns a 404 status code if the task is not found.'], 'status': 'pending', 'code_files': ['index.js']}, {'id': 'BE-009', 'description': 'Implement input validation on the backend.', 'dependencies': ['BE-004'], 'estimated_time': '3 hours', 'agent_role': 'backend_developer', 'acceptance_criteria': [\"Validate the 'description' field in the POST request.\", 'Return a 400 status code if the description is missing or invalid.', \"Validate the 'description' and 'completed' fields in the PUT request.\"], 'status': 'pending', 'code_files': ['index.js']}, {'id': 'DE-001', 'description': 'Deploy the application to Heroku.', 'dependencies': ['BE-001', 'FE-001', 'BE-005', 'FE-007', 'BE-004', 'FE-008', 'BE-009', 'FE-009', 'FE-010', 'FE-011', 'FE-012'], 'estimated_time': '4 hours', 'agent_role': 'backend_developer', 'acceptance_criteria': ['Application is successfully deployed to Heroku.', 'Database connection is configured correctly on Heroku.', 'Application is accessible via a Heroku URL.'], 'status': 'pending', 'code_files': ['Procfile']}, {'id': 'TE-001', 'description': 'Write unit tests for the backend API endpoints.', 'dependencies': ['BE-001', 'BE-004', 'BE-005', 'BE-006', 'BE-007', 'BE-008'], 'estimated_time': '6 hours', 'agent_role': 'backend_developer', 'acceptance_criteria': ['Tests cover all API endpoints (POST, GET, PUT, DELETE).', 'Tests verify correct responses (status codes, data).', 'Tests cover error scenarios (e.g., invalid input, not found).'], 'status': 'pending', 'code_files': ['tests/api.test.js']}]}], resource_allocation=[{'role': 'Backend Developer', 'count': 1, 'estimated_time_allocation': '100%', 'phases': ['Backend Phase'], 'skills_required': []}, {'role': 'Frontend Developer', 'count': 1, 'estimated_time_allocation': '100%', 'phases': ['Frontend Phase'], 'skills_required': []}], risks_and_mitigations=[], timeline={'start_date': '2025-07-08T16:47:41.741487', 'end_date': 'TBD', 'milestones': []}, tech_stack={}, metadata={'generated_at': '2025-07-08T16:47:41.741487', 'version': '1.0', 'author': 'Multi-AI Dev System', 'tags': [], 'notes': 'Converted from WorkItemBacklog. Original summary: Develop a full-stack task list application using React for the frontend, Node.js/Express for the backend, and MongoDB for the database. The application will allow users to add, view, edit, and delete tasks. The application will be deployed to Heroku.'}) summary='Develop a full-stack task list application using React for the frontend, Node.js/Express for the backend, and MongoDB for the database. The application will allow users to add, view, edit, and delete tasks. The application will be deployed to Heroku.' metadata=PlanMetadata(generated_at='2025-07-08T16:47:41.741487', version='1.0', author='Multi-AI Dev System', tags=[], notes='Converted from WorkItemBacklog. Original summary: Develop a full-stack task list application using React for the frontend, Node.js/Express for the backend, and MongoDB for the database. The application will allow users to add, view, edit, and delete tasks. The application will be deployed to Heroku.')"
  },
  "workflow_state_snapshot": {
    "requirements_analysis": {
      "project_name": "Hello World Task List",
      "project_summary": "A simple web application to manage a list of tasks.",
      "project_goals": [
        "Allow a user to add a task",
        "Allow a user to see their list of tasks"
      ],
      "target_audience": [
        "Users who want to manage a list of tasks"
      ],
      "business_context": "This project aims to provide a basic task management tool.",
      "requirements": [
        {
          "id": "REQ-001",
          "description": "A user can create a new task with a text description.",
          "category": "functional",
          "priority": 1
        },
        {
          "id": "REQ-002",
          "description": "A user can see a list of all created tasks.",
          "category": "functional",
          "priority": 1
        },
        {
          "id": "REQ-003",
          "description": "The application must load quickly.",
          "category": "non_functional",
          "priority": 2
        },
        {
          "id": "REQ-004",
          "description": "The application must be secure.",
          "category": "non_functional",
          "priority": 2
        }
      ],
      "functional_requirements": [
        "A user can create a new task with a text description.",
        "A user can see a list of all created tasks."
      ],
      "non_functional_requirements": [
        "The application must load quickly.",
        "The application must be secure."
      ],
      "stakeholders": [
        "Users"
      ],
      "success_criteria": [
        "Users can successfully add tasks.",
        "Users can view their task list.",
        "The application loads quickly.",
        "The application is secure."
      ],
      "constraints": [],
      "assumptions": [],
      "risks": [],
      "domain_specific_details": {},
      "quality_assessment": {
        "clarity_score": 9.0,
        "completeness_score": 8.0,
        "consistency_score": 10.0,
        "recommendations": []
      },
      "gap_analysis": {
        "identified_gaps": [],
        "recommendations_for_completion": []
      }
    },
    "tech_stack_recommendation": {
      "frontend_options": [
        {
          "name": "React",
          "language": "JavaScript",
          "reasoning": "React is a popular and efficient library for building user interfaces. It offers a component-based architecture, making it easy to manage and update the UI. Its virtual DOM and efficient update mechanisms contribute to fast loading times, satisfying the non-functional requirement for speed. It has a large community and extensive documentation.",
          "key_libraries": [
            "React Router (for navigation)",
            "Axios or Fetch (for API calls)",
            "Material UI or Bootstrap (for UI components)"
          ],
          "pros": [
            "Component-based architecture for maintainability",
            "Large community and extensive documentation",
            "Efficient updates via virtual DOM",
            "Good performance and fast loading times"
          ],
          "cons": [
            "Requires understanding of JSX",
            "Can have a steeper learning curve for beginners"
          ],
          "selected": false
        },
        {
          "name": "Vue.js",
          "language": "JavaScript",
          "reasoning": "Vue.js is a progressive framework that is easy to learn and integrate. It's known for its simplicity and ease of use, making it a good choice for a small project. It also offers good performance and a clear separation of concerns.",
          "key_libraries": [
            "Vue Router (for navigation)",
            "Axios or Fetch (for API calls)",
            "Vuetify or BootstrapVue (for UI components)"
          ],
          "pros": [
            "Easy to learn and use",
            "Good performance",
            "Clear separation of concerns",
            "Progressive framework - can be integrated into existing projects"
          ],
          "cons": [
            "Smaller community compared to React",
            "Ecosystem might not be as extensive as React's"
          ],
          "selected": false
        },
        {
          "name": "HTML, CSS, JavaScript (Vanilla)",
          "language": "JavaScript",
          "reasoning": "For a simple task list application, using vanilla JavaScript, HTML, and CSS can be a viable option. It avoids the overhead of a framework and provides a lightweight solution. This approach is suitable for small projects where simplicity and minimal dependencies are prioritized.",
          "key_libraries": [],
          "pros": [
            "No external dependencies",
            "Simple and lightweight",
            "Good for learning the fundamentals"
          ],
          "cons": [
            "More manual DOM manipulation",
            "Can become complex for larger applications",
            "Less efficient than frameworks for complex UIs"
          ],
          "selected": false
        }
      ],
      "backend_options": [
        {
          "name": "Node.js with Express",
          "language": "JavaScript",
          "reasoning": "Node.js with Express is a good choice for this project due to its speed of development and the ability to use JavaScript on both the front-end and back-end. Express provides a simple and flexible framework for building REST APIs, which is suitable for a task list application. It's also easy to deploy and scale.",
          "key_libraries": [
            "Express.js (web framework)",
            "body-parser (for parsing request bodies)",
            "cors (for handling CORS)",
            "mongoose or Sequelize (for database interaction)"
          ],
          "pros": [
            "Fast development with JavaScript",
            "Large community and extensive documentation",
            "Good performance",
            "Easy to deploy and scale"
          ],
          "cons": [
            "Callback hell can be an issue (can be mitigated with async/await)",
            "Requires careful handling of asynchronous operations"
          ],
          "selected": false
        },
        {
          "name": "Python with Flask",
          "language": "Python",
          "reasoning": "Flask is a lightweight and flexible Python web framework. Python is known for its readability and ease of use. Flask is suitable for small to medium-sized projects and offers a good balance between simplicity and functionality. It's a good choice if you prefer Python for backend development.",
          "key_libraries": [
            "Flask (web framework)",
            "Flask-RESTful (for building REST APIs)",
            "SQLAlchemy (for database interaction)",
            "Flask-CORS (for handling CORS)"
          ],
          "pros": [
            "Easy to learn and use",
            "Good for small to medium-sized projects",
            "Large community and extensive documentation",
            "Python's readability"
          ],
          "cons": [
            "Can be slower than Node.js in some cases",
            "Requires knowledge of Python"
          ],
          "selected": false
        },
        {
          "name": "Java with Spring Boot",
          "language": "Java",
          "reasoning": "Spring Boot provides a robust and feature-rich framework for building enterprise-grade applications. While it might be overkill for a simple task list, it offers scalability and security features. It's a good choice if you have existing Java expertise or anticipate future growth.",
          "key_libraries": [
            "Spring Boot (web framework)",
            "Spring Data JPA (for database interaction)",
            "Spring Security (for security)",
            "Maven or Gradle (for build automation)"
          ],
          "pros": [
            "Robust and feature-rich",
            "Scalable and secure",
            "Large community and extensive documentation"
          ],
          "cons": [
            "Steeper learning curve",
            "More complex setup",
            "Can be overkill for a simple application"
          ],
          "selected": false
        }
      ],
      "database_options": [
        {
          "name": "MongoDB",
          "language": null,
          "reasoning": "MongoDB is a NoSQL database that is easy to set up and use. It's a good choice for this project because it's schema-less, which allows for flexibility in storing task data. It's also scalable and performs well.",
          "key_libraries": [
            "Mongoose (for interacting with MongoDB in Node.js)"
          ],
          "pros": [
            "Easy to set up and use",
            "Schema-less, flexible data storage",
            "Scalable and performs well"
          ],
          "cons": [
            "Can be less performant than relational databases for complex queries",
            "Requires careful data modeling"
          ],
          "selected": false
        },
        {
          "name": "PostgreSQL",
          "language": null,
          "reasoning": "PostgreSQL is a robust and reliable relational database. It offers strong data integrity and is suitable for applications that require structured data. It's a good choice if you need to ensure data consistency and have more complex data relationships in the future.",
          "key_libraries": [
            "pg (for interacting with PostgreSQL in Node.js)",
            "Sequelize (ORM)"
          ],
          "pros": [
            "Robust and reliable",
            "Strong data integrity",
            "Supports complex queries and relationships"
          ],
          "cons": [
            "Can be more complex to set up and manage than NoSQL databases",
            "Requires defining a schema"
          ],
          "selected": false
        },
        {
          "name": "SQLite",
          "language": null,
          "reasoning": "SQLite is a lightweight, file-based database that is easy to set up and use. It's a good choice for small projects or prototypes where simplicity is important. It's suitable for this project because it doesn't require a separate database server.",
          "key_libraries": [
            "sqlite3 (for interacting with SQLite in Node.js)"
          ],
          "pros": [
            "Easy to set up and use",
            "File-based, no server required",
            "Good for small projects and prototypes"
          ],
          "cons": [
            "Not suitable for high-traffic applications",
            "Limited scalability"
          ],
          "selected": false
        }
      ],
      "cloud_options": [
        {
          "name": "AWS (Amazon Web Services)",
          "language": null,
          "reasoning": "AWS offers a wide range of services that can be used to deploy and manage the application. It provides scalability, security, and reliability. Services like EC2, S3, and RDS can be used to host the application, store data, and manage the database. AWS also offers a free tier for some services, which can be beneficial for a small project.",
          "key_libraries": [
            "AWS SDK (for interacting with AWS services)"
          ],
          "pros": [
            "Scalable and reliable",
            "Wide range of services",
            "Good security features",
            "Free tier available"
          ],
          "cons": [
            "Can be complex to set up and manage",
            "Cost can be a concern if not managed properly"
          ],
          "selected": false
        },
        {
          "name": "Google Cloud Platform (GCP)",
          "language": null,
          "reasoning": "GCP is another popular cloud platform that offers similar services to AWS. It provides scalability, security, and reliability. Services like Compute Engine, Cloud Storage, and Cloud SQL can be used to host the application, store data, and manage the database. GCP also offers a free tier for some services.",
          "key_libraries": [
            "Google Cloud Client Libraries (for interacting with GCP services)"
          ],
          "pros": [
            "Scalable and reliable",
            "Competitive pricing",
            "Good integration with other Google services"
          ],
          "cons": [
            "Can be complex to set up and manage",
            "Requires understanding of GCP services"
          ],
          "selected": false
        },
        {
          "name": "Heroku",
          "language": null,
          "reasoning": "Heroku is a Platform-as-a-Service (PaaS) that simplifies the deployment and management of web applications. It's a good choice for this project because it's easy to set up and deploy applications. It handles the infrastructure management, allowing you to focus on the application code. It also offers a free tier for small projects.",
          "key_libraries": [],
          "pros": [
            "Easy to set up and deploy",
            "Handles infrastructure management",
            "Free tier available",
            "Good for small projects and prototypes"
          ],
          "cons": [
            "Limited customization options",
            "Can be more expensive than other cloud platforms for larger applications"
          ],
          "selected": false
        }
      ],
      "architecture_options": [
        {
          "pattern": "Monolithic Architecture",
          "scalability_score": 4.0,
          "maintainability_score": 6.0,
          "development_speed_score": 8.0,
          "overall_score": 6.0,
          "reasoning": "For a simple task list application, a monolithic architecture is a good starting point. It's easier to develop and deploy initially. However, it can become less scalable and maintainable as the application grows. This architecture is suitable for this project due to its simplicity and the small scope of the application."
        },
        {
          "pattern": "Microservices Architecture",
          "scalability_score": 8.0,
          "maintainability_score": 7.0,
          "development_speed_score": 4.0,
          "overall_score": 6.0,
          "reasoning": "While microservices offer better scalability and maintainability, they introduce complexity that might be unnecessary for this small project. The overhead of managing multiple services and their communication could outweigh the benefits. This architecture is not recommended for this project due to its complexity."
        },
        {
          "pattern": "Serverless Architecture",
          "scalability_score": 9.0,
          "maintainability_score": 7.0,
          "development_speed_score": 6.0,
          "overall_score": 7.0,
          "reasoning": "Serverless architecture can be a good choice for this project, especially if using a cloud provider like AWS or GCP. It offers excellent scalability and reduces operational overhead. However, it can introduce complexities in debugging and monitoring. This architecture is a viable option, but might be overkill for the initial scope."
        }
      ],
      "tool_options": [
        {
          "name": "Git",
          "language": null,
          "reasoning": "Git is essential for version control, allowing developers to track changes, collaborate, and revert to previous versions of the code. It's a standard tool for software development and is crucial for managing the codebase.",
          "key_libraries": [],
          "pros": [
            "Version control",
            "Collaboration",
            "Branching and merging"
          ],
          "cons": [
            "Requires learning the Git commands"
          ],
          "selected": false
        },
        {
          "name": "VS Code",
          "language": null,
          "reasoning": "VS Code is a popular and versatile code editor with excellent support for various programming languages and frameworks. It provides features like syntax highlighting, code completion, debugging, and integrated terminal, which can significantly improve developer productivity.",
          "key_libraries": [],
          "pros": [
            "Free and open-source",
            "Extensible with plugins",
            "Good support for various languages"
          ],
          "cons": [
            "Can be resource-intensive"
          ],
          "selected": false
        },
        {
          "name": "Postman",
          "language": null,
          "reasoning": "Postman is a valuable tool for testing APIs. It allows developers to send HTTP requests, inspect responses, and debug API interactions. It's particularly useful for testing the backend API of the task list application.",
          "key_libraries": [],
          "pros": [
            "Easy to test APIs",
            "Supports various HTTP methods",
            "Can save and share API requests"
          ],
          "cons": [
            "Requires learning the Postman interface"
          ],
          "selected": false
        }
      ],
      "risks": [
        {
          "category": "Security",
          "description": "The application could be vulnerable to security threats such as cross-site scripting (XSS) or SQL injection if input validation and sanitization are not implemented correctly.",
          "severity": "High",
          "likelihood": "Medium",
          "mitigation": "Implement proper input validation and sanitization on both the client and server sides. Use parameterized queries to prevent SQL injection. Implement secure authentication and authorization mechanisms."
        },
        {
          "category": "Performance",
          "description": "The application might experience slow loading times if the database queries are not optimized or if the front-end code is not optimized for performance.",
          "severity": "Medium",
          "likelihood": "Medium",
          "mitigation": "Optimize database queries by using indexes and avoiding unnecessary joins. Minimize the size of the front-end assets (e.g., images, JavaScript files). Implement caching mechanisms to reduce the load on the server."
        },
        {
          "category": "Scalability",
          "description": "The application might not be able to handle a large number of users or tasks if the chosen architecture and infrastructure are not scalable.",
          "severity": "Medium",
          "likelihood": "Low",
          "mitigation": "Choose a scalable database solution (e.g., MongoDB, PostgreSQL). Consider using a cloud platform that offers auto-scaling capabilities. Design the application with scalability in mind from the beginning."
        }
      ],
      "synthesis": {
        "backend": {
          "language": "JavaScript",
          "framework": "Node.js with Express",
          "reasoning": "Node.js with Express is a good choice for this project due to its speed of development and the ability to use JavaScript on both the front-end and back-end. Express provides a simple and flexible framework for building REST APIs, which is suitable for a task list application. It's also easy to deploy and scale."
        },
        "frontend": {
          "language": "JavaScript",
          "framework": "React",
          "reasoning": "React is a popular and efficient library for building user interfaces. It offers a component-based architecture, making it easy to manage and update the UI. Its virtual DOM and efficient update mechanisms contribute to fast loading times, satisfying the non-functional requirement for speed. It has a large community and extensive documentation."
        },
        "database": {
          "type": "MongoDB",
          "reasoning": "MongoDB is a NoSQL database that is easy to set up and use. It's a good choice for this project because it's schema-less, which allows for flexibility in storing task data. It's also scalable and performs well."
        },
        "architecture_pattern": "Monolithic Architecture",
        "deployment_environment": {
          "cloud_platform": "Heroku",
          "reasoning": "Heroku is a Platform-as-a-Service (PaaS) that simplifies the deployment and management of web applications. It's a good choice for this project because it's easy to set up and deploy applications. It handles the infrastructure management, allowing you to focus on the application code. It also offers a free tier for small projects."
        },
        "key_libraries_tools": [
          {
            "name": "React Router",
            "purpose": "For navigation in the React frontend"
          },
          {
            "name": "Axios",
            "purpose": "For making API calls from the frontend"
          },
          {
            "name": "Express.js",
            "purpose": "Web framework for the backend"
          },
          {
            "name": "Mongoose",
            "purpose": "For interacting with MongoDB in Node.js"
          },
          {
            "name": "Git",
            "purpose": "Version control"
          },
          {
            "name": "VS Code",
            "purpose": "Code editor"
          },
          {
            "name": "Postman",
            "purpose": "API testing"
          }
        ],
        "estimated_complexity": "Low"
      },
      "selected_stack": null
    },
    "system_design": {
      "architecture": {
        "pattern": "Monolithic Architecture",
        "justification": "For a simple task list application, a monolithic architecture is a good starting point. It's easier to develop and deploy initially. The project's small scope and limited requirements make this a suitable choice.",
        "key_benefits": [
          "Simpler development and deployment",
          "Faster initial development speed",
          "Easier to manage for a small team"
        ],
        "potential_drawbacks": [
          "Less scalable than microservices",
          "Can become harder to maintain as the application grows"
        ]
      },
      "components": [
        {
          "name": "Frontend",
          "description": "The user interface for the task list application.",
          "category": "frontend",
          "technologies": [
            "React",
            "JavaScript",
            "HTML",
            "CSS"
          ],
          "dependencies": [
            "Backend API"
          ],
          "responsibilities": [
            "Displaying the task list",
            "Allowing users to add new tasks",
            "Handling user interactions",
            "Making API calls to the backend"
          ],
          "design_patterns": [
            "Component-based architecture"
          ]
        },
        {
          "name": "Backend API",
          "description": "The RESTful API that handles task data.",
          "category": "backend",
          "technologies": [
            "Node.js",
            "Express.js",
            "JavaScript",
            "MongoDB"
          ],
          "dependencies": [
            "MongoDB"
          ],
          "responsibilities": [
            "Handling API requests",
            "Validating data",
            "Interacting with the database",
            "Returning task data to the frontend"
          ],
          "design_patterns": [
            "MVC (Model-View-Controller)"
          ]
        },
        {
          "name": "Database",
          "description": "Stores the task data.",
          "category": "database",
          "technologies": [
            "MongoDB"
          ],
          "dependencies": [],
          "responsibilities": [
            "Storing task data",
            "Providing data access to the backend API"
          ],
          "design_patterns": []
        }
      ],
      "data_model": {
        "schema_type": "Document-oriented (MongoDB)",
        "tables": [
          {
            "name": "tasks",
            "purpose": "Stores task information.",
            "fields": [
              {
                "name": "_id",
                "type": "ObjectId",
                "constraints": [
                  "PRIMARY KEY"
                ],
                "description": "Unique identifier for the task."
              },
              {
                "name": "description",
                "type": "String",
                "constraints": [
                  "NOT NULL"
                ],
                "description": "The text description of the task."
              },
              {
                "name": "created_at",
                "type": "Date",
                "constraints": [],
                "description": "The date and time the task was created."
              },
              {
                "name": "completed",
                "type": "Boolean",
                "constraints": [],
                "description": "Whether the task is completed or not."
              }
            ],
            "relationships": []
          }
        ],
        "relationships": [],
        "justification": "MongoDB's schema-less nature allows for flexibility in storing task data without rigid schema definitions. This aligns well with the project's simplicity and potential for future expansion."
      },
      "api_endpoints": {
        "style": "REST",
        "base_url": "/api/tasks",
        "authentication": "None (for simplicity, but consider adding in the future)",
        "endpoints": [
          {
            "method": "POST",
            "path": "/",
            "purpose": "Create a new task.",
            "parameters": [
              {
                "description": "The task description.",
                "type": "string",
                "name": "description"
              }
            ],
            "response": {
              "201": {
                "description": "Task created successfully.",
                "example": {
                  "id": "654321abc1234567890fedcba",
                  "description": "Buy groceries",
                  "created_at": "2024-01-01T12:00:00.000Z",
                  "completed": false
                }
              },
              "400": {
                "description": "Bad Request - Invalid input."
              }
            },
            "authentication_required": false,
            "rate_limiting_applied": false
          },
          {
            "method": "GET",
            "path": "/",
            "purpose": "Get all tasks.",
            "parameters": [],
            "response": {
              "200": {
                "description": "List of tasks.",
                "example": [
                  {
                    "id": "654321abc1234567890fedcba",
                    "description": "Buy groceries",
                    "created_at": "2024-01-01T12:00:00.000Z",
                    "completed": false
                  },
                  {
                    "id": "654321abc1234567890fedc123",
                    "description": "Do laundry",
                    "created_at": "2024-01-02T10:00:00.000Z",
                    "completed": true
                  }
                ]
              }
            },
            "authentication_required": false,
            "rate_limiting_applied": false
          },
          {
            "method": "GET",
            "path": "/:id",
            "purpose": "Get a specific task by ID.",
            "parameters": [
              {
                "name": "id",
                "type": "string",
                "description": "The ID of the task."
              }
            ],
            "response": {
              "200": {
                "description": "Task details.",
                "example": {
                  "id": "654321abc1234567890fedcba",
                  "description": "Buy groceries",
                  "created_at": "2024-01-01T12:00:00.000Z",
                  "completed": false
                }
              },
              "404": {
                "description": "Task not found."
              }
            },
            "authentication_required": false,
            "rate_limiting_applied": false
          },
          {
            "method": "PUT",
            "path": "/:id",
            "purpose": "Update a specific task by ID.",
            "parameters": [
              {
                "name": "id",
                "type": "string",
                "description": "The ID of the task."
              },
              {
                "name": "description",
                "type": "string",
                "description": "The updated task description."
              },
              {
                "name": "completed",
                "type": "boolean",
                "description": "The updated completion status."
              }
            ],
            "response": {
              "200": {
                "description": "Task updated successfully.",
                "example": {
                  "id": "654321abc1234567890fedcba",
                  "description": "Buy groceries",
                  "created_at": "2024-01-01T12:00:00.000Z",
                  "completed": true
                }
              },
              "400": {
                "description": "Bad Request - Invalid input."
              },
              "404": {
                "description": "Task not found."
              }
            },
            "authentication_required": false,
            "rate_limiting_applied": false
          },
          {
            "method": "DELETE",
            "path": "/:id",
            "purpose": "Delete a specific task by ID.",
            "parameters": [
              {
                "name": "id",
                "type": "string",
                "description": "The ID of the task."
              }
            ],
            "response": {
              "204": {
                "description": "Task deleted successfully."
              },
              "404": {
                "description": "Task not found."
              }
            },
            "authentication_required": false,
            "rate_limiting_applied": false
          }
        ],
        "error_handling": "Centralized error handling with appropriate HTTP status codes and informative error messages."
      },
      "security": {
        "authentication_method": "None (for initial simplicity)",
        "authorization_strategy": "None (for initial simplicity)",
        "data_encryption": {
          "at_rest": "Not applicable for this simple application.",
          "in_transit": "HTTPS is recommended for all communication between the frontend and backend."
        },
        "security_measures": [
          {
            "category": "Input Validation",
            "implementation": "Validate all user inputs on both the client and server sides to prevent XSS and other injection attacks.",
            "mitigation": "XSS, SQL Injection",
            "priority": "High"
          },
          {
            "category": "HTTPS",
            "implementation": "Enforce HTTPS for all communication.",
            "mitigation": "Man-in-the-middle attacks, data interception",
            "priority": "High"
          },
          {
            "category": "Dependency Management",
            "implementation": "Regularly update dependencies to address known vulnerabilities.",
            "mitigation": "Known vulnerabilities in dependencies",
            "priority": "Medium"
          }
        ],
        "vulnerability_mitigation_strategies": [
          "Input validation and sanitization",
          "Use of parameterized queries (if using a relational database)",
          "Regular dependency updates",
          "HTTPS enforcement"
        ],
        "compliance_standards": []
      },
      "scalability_and_performance": {
        "database_indexing": "Implement indexes on frequently queried fields (e.g., `created_at`, `completed`) to optimize database query performance.",
        "code_splitting": "Implement code splitting in the React frontend to reduce initial load times.",
        "caching": "Consider implementing caching mechanisms (e.g., server-side caching) to reduce the load on the server and improve response times."
      },
      "deployment_strategy": {
        "platform": "Heroku",
        "environment": "Production",
        "steps": [
          "Push the code to a Git repository (e.g., GitHub).",
          "Connect Heroku to the Git repository.",
          "Heroku automatically builds and deploys the application.",
          "Configure environment variables (e.g., database connection string) in Heroku.",
          "Monitor application logs and performance in Heroku."
        ]
      },
      "monitoring_and_logging": {
        "logging": "Implement logging in both the frontend and backend to track application behavior and errors. Use a logging library (e.g., Winston for Node.js) to log relevant information.",
        "error_tracking": "Integrate an error tracking service (e.g., Sentry) to automatically capture and report errors.",
        "performance_monitoring": "Monitor application performance using Heroku's built-in monitoring tools or integrate with a third-party service (e.g., New Relic)."
      },
      "error_handling_strategy": "Implement centralized error handling in both the frontend and backend. Use appropriate HTTP status codes to indicate the type of error. Provide informative error messages to the user and log detailed error information for debugging.",
      "development_phases_overview": [
        {
          "name": "Setup & Environment",
          "description": "Setting up the development environment, including installing necessary tools and dependencies.",
          "priority": "High",
          "dependencies": [],
          "tasks": [
            "Install Node.js and npm",
            "Install VS Code",
            "Initialize Git repository",
            "Set up MongoDB database",
            "Create Heroku account"
          ],
          "estimated_duration": "1 day"
        },
        {
          "name": "Backend Development",
          "description": "Developing the backend API using Node.js and Express.",
          "priority": "High",
          "dependencies": [
            "Setup & Environment"
          ],
          "tasks": [
            "Create Express.js application",
            "Set up MongoDB connection",
            "Define data models (tasks)",
            "Implement API endpoints (CRUD operations)",
            "Implement input validation",
            "Implement error handling"
          ],
          "estimated_duration": "3 days"
        },
        {
          "name": "Frontend Development",
          "description": "Developing the frontend using React.",
          "priority": "High",
          "dependencies": [
            "Setup & Environment",
            "Backend Development"
          ],
          "tasks": [
            "Create React application",
            "Design UI components (task list, task form)",
            "Implement API calls using Axios",
            "Display task list",
            "Implement adding new tasks",
            "Implement error handling"
          ],
          "estimated_duration": "4 days"
        },
        {
          "name": "Testing",
          "description": "Testing the application to ensure it meets the requirements.",
          "priority": "High",
          "dependencies": [
            "Backend Development",
            "Frontend Development"
          ],
          "tasks": [
            "Unit testing (backend and frontend)",
            "Integration testing (API calls)",
            "User acceptance testing"
          ],
          "estimated_duration": "2 days"
        },
        {
          "name": "Deployment & Monitoring",
          "description": "Deploying the application to Heroku and setting up monitoring.",
          "priority": "High",
          "dependencies": [
            "Testing"
          ],
          "tasks": [
            "Deploy to Heroku",
            "Configure environment variables",
            "Set up logging and monitoring",
            "Test deployed application"
          ],
          "estimated_duration": "1 day"
        }
      ],
      "key_risks": [
        "Security vulnerabilities (XSS, SQL injection)",
        "Performance issues (slow loading times, inefficient queries)",
        "Scalability limitations (unable to handle a large number of users)",
        "Data loss (due to database errors or failures)"
      ],
      "design_justification": "The design prioritizes simplicity and ease of development, aligning with the project's goals and the tech stack recommendations. The monolithic architecture, React frontend, Node.js/Express backend, and MongoDB database provide a straightforward and efficient solution for building a basic task list application. The chosen technologies are well-suited for rapid development and deployment, while also providing a foundation for future enhancements.",
      "data_flow": "1.  **User Interaction:** The user interacts with the React frontend, adding tasks through a form or viewing the task list. 2.  **Frontend to Backend:** When a user adds a task, the frontend sends a POST request to the backend API (Express.js). This request includes the task description. 3.  **Backend Processing:** The backend API receives the request, validates the input, and then saves the task data to the MongoDB database. 4.  **Database Interaction:** The backend API interacts with the MongoDB database to store and retrieve task data. 5.  **Backend Response:** After successfully saving the task, the backend API sends a success response (e.g., 201 Created) back to the frontend, including the newly created task's details.  For retrieving tasks, the backend retrieves tasks from the database and sends them to the frontend. 6.  **Frontend Display:** The frontend receives the response from the backend and updates the task list, displaying the new task to the user."
    },
    "implementation_plan": "plan=ImplementationPlan(project_summary={'title': 'Generated Project Plan', 'description': 'Develop a full-stack task list application using React for the frontend, Node.js/Express for the backend, and MongoDB for the database. The application will allow users to add, view, edit, and delete tasks. The application will be deployed to Heroku.', 'overall_complexity': 'Medium', 'estimated_duration': 'TBD', 'key_challenges': [], 'success_criteria': []}, phases=[{'name': 'Frontend Phase', 'description': 'Tasks related to frontend phase', 'deliverables': ['Completed FE-001', 'Completed FE-002', 'Completed FE-003', 'Completed FE-004', 'Completed FE-005', 'Completed FE-006', 'Completed FE-007', 'Completed FE-008', 'Completed FE-009', 'Completed FE-010', 'Completed FE-011', 'Completed FE-012', 'Completed TE-002'], 'estimated_duration_hours': 48.0, 'work_items': [{'id': 'FE-001', 'description': 'Set up React project using Create React App.', 'dependencies': [], 'estimated_time': '2 hours', 'agent_role': 'frontend_developer', 'acceptance_criteria': ['Project initializes successfully.', 'Default React app runs without errors.'], 'status': 'pending', 'code_files': ['package.json', 'src/App.js', 'src/index.js']}, {'id': 'FE-002', 'description': 'Install Axios for making API requests.', 'dependencies': ['FE-001'], 'estimated_time': '1 hour', 'agent_role': 'frontend_developer', 'acceptance_criteria': ['Axios is installed as a project dependency.', 'Import statement for Axios is working.'], 'status': 'pending', 'code_files': ['package.json']}, {'id': 'FE-003', 'description': 'Create a Task component to display a single task.', 'dependencies': ['FE-001'], 'estimated_time': '3 hours', 'agent_role': 'frontend_developer', 'acceptance_criteria': ['Task component renders a task description.', \"Task component accepts a 'description' prop.\"], 'status': 'pending', 'code_files': ['src/Task.js']}, {'id': 'FE-004', 'description': 'Create a TaskList component to display a list of tasks.', 'dependencies': ['FE-003'], 'estimated_time': '4 hours', 'agent_role': 'frontend_developer', 'acceptance_criteria': ['TaskList component renders a list of Task components.', \"TaskList component accepts a 'tasks' prop (array of task objects).\"], 'status': 'pending', 'code_files': ['src/TaskList.js']}, {'id': 'FE-005', 'description': 'Create a TaskForm component to allow users to add new tasks.', 'dependencies': ['FE-001'], 'estimated_time': '4 hours', 'agent_role': 'frontend_developer', 'acceptance_criteria': ['TaskForm component renders an input field and a submit button.', \"TaskForm component calls a provided 'onSubmit' function when the form is submitted.\", 'TaskForm component clears the input field after submission.'], 'status': 'pending', 'code_files': ['src/TaskForm.js']}, {'id': 'FE-006', 'description': 'Implement the UI for the main application layout (using TaskList and TaskForm).', 'dependencies': ['FE-004', 'FE-005'], 'estimated_time': '3 hours', 'agent_role': 'frontend_developer', 'acceptance_criteria': ['TaskForm is displayed at the top.', 'TaskList is displayed below the TaskForm.', 'Initial task list is empty.'], 'status': 'pending', 'code_files': ['src/App.js']}, {'id': 'FE-007', 'description': 'Fetch tasks from the backend API and display them in the TaskList.', 'dependencies': ['FE-002', 'FE-004', 'BE-005'], 'estimated_time': '4 hours', 'agent_role': 'frontend_developer', 'acceptance_criteria': ['App makes a GET request to /api/tasks on component mount.', 'Tasks are fetched and displayed in the TaskList.', 'Error handling for API request failures is implemented.'], 'status': 'pending', 'code_files': ['src/App.js']}, {'id': 'FE-008', 'description': 'Implement adding a new task by calling the backend API.', 'dependencies': ['FE-002', 'FE-005', 'BE-004'], 'estimated_time': '4 hours', 'agent_role': 'frontend_developer', 'acceptance_criteria': ['TaskForm calls the /api/tasks POST endpoint when submitted.', 'New task is added to the task list after successful API call.', 'Error handling for API request failures is implemented.'], 'status': 'pending', 'code_files': ['src/App.js']}, {'id': 'FE-009', 'description': 'Implement UI to show task details and allow editing.', 'dependencies': ['FE-003', 'FE-007', 'BE-006', 'BE-007', 'BE-008'], 'estimated_time': '6 hours', 'agent_role': 'frontend_developer', 'acceptance_criteria': ['Task component displays a checkbox for completion status.', 'Task component displays an edit button.', 'Task component displays a delete button.', 'Clicking edit button allows editing of the description.', 'Clicking delete button calls the delete API.'], 'status': 'pending', 'code_files': ['src/Task.js']}, {'id': 'FE-010', 'description': 'Implement UI to update task completion status.', 'dependencies': ['FE-009', 'BE-007'], 'estimated_time': '4 hours', 'agent_role': 'frontend_developer', 'acceptance_criteria': [\"Clicking the checkbox updates the task's completion status.\", 'API call is made to update the task.', 'Task list is refreshed after the update.'], 'status': 'pending', 'code_files': ['src/Task.js', 'src/App.js']}, {'id': 'FE-011', 'description': 'Implement UI to delete tasks.', 'dependencies': ['FE-009', 'BE-008'], 'estimated_time': '4 hours', 'agent_role': 'frontend_developer', 'acceptance_criteria': ['Clicking the delete button calls the delete API.', 'Task is removed from the list after successful deletion.', 'Confirmation dialog before deletion.'], 'status': 'pending', 'code_files': ['src/Task.js', 'src/App.js']}, {'id': 'FE-012', 'description': 'Implement basic styling for the application.', 'dependencies': ['FE-001'], 'estimated_time': '4 hours', 'agent_role': 'frontend_developer', 'acceptance_criteria': ['Application has a consistent and readable style.', 'Task list and form are visually appealing.'], 'status': 'pending', 'code_files': ['src/App.css', 'src/Task.css']}, {'id': 'TE-002', 'description': 'Write unit tests for the frontend components.', 'dependencies': ['FE-001', 'FE-003', 'FE-004', 'FE-005'], 'estimated_time': '6 hours', 'agent_role': 'frontend_developer', 'acceptance_criteria': ['Tests cover Task, TaskList, and TaskForm components.', 'Tests verify correct rendering and behavior of components.', 'Tests verify component interactions (e.g., form submission).'], 'status': 'pending', 'code_files': ['src/Task.test.js', 'src/TaskList.test.js', 'src/TaskForm.test.js']}]}, {'name': 'Backend Phase', 'description': 'Tasks related to backend phase', 'deliverables': ['Completed BE-001', 'Completed BE-002', 'Completed BE-003', 'Completed BE-004', 'Completed BE-005', 'Completed BE-006', 'Completed BE-007', 'Completed BE-008', 'Completed BE-009', 'Completed DE-001', 'Completed TE-001'], 'estimated_duration_hours': 37.0, 'work_items': [{'id': 'BE-001', 'description': 'Initialize a Node.js project and install Express.js, body-parser, and cors.', 'dependencies': [], 'estimated_time': '2 hours', 'agent_role': 'backend_developer', 'acceptance_criteria': ['Node.js project initialized.', 'Express.js, body-parser, and cors are installed as project dependencies.', 'Basic Express server runs without errors.'], 'status': 'pending', 'code_files': ['package.json', 'index.js']}, {'id': 'BE-002', 'description': 'Set up MongoDB connection using Mongoose.', 'dependencies': ['BE-001'], 'estimated_time': '3 hours', 'agent_role': 'backend_developer', 'acceptance_criteria': ['Mongoose is installed as a project dependency.', 'MongoDB connection is established successfully.', 'Connection errors are handled.'], 'status': 'pending', 'code_files': ['index.js']}, {'id': 'BE-003', 'description': 'Define the Task model in Mongoose.', 'dependencies': ['BE-002'], 'estimated_time': '2 hours', 'agent_role': 'backend_developer', 'acceptance_criteria': [\"Task schema is defined with 'description', 'created_at', and 'completed' fields.\", 'Task model is created using the schema.'], 'status': 'pending', 'code_files': ['models/Task.js']}, {'id': 'BE-004', 'description': 'Implement the POST /api/tasks endpoint (create a new task).', 'dependencies': ['BE-003'], 'estimated_time': '4 hours', 'agent_role': 'backend_developer', 'acceptance_criteria': ['Endpoint handles POST requests to /api/tasks.', \"Endpoint receives a 'description' in the request body.\", 'Endpoint creates a new task in the database.', 'Endpoint returns the created task with a 201 status code.', 'Endpoint returns a 400 status code for invalid input.'], 'status': 'pending', 'code_files': ['index.js']}, {'id': 'BE-005', 'description': 'Implement the GET /api/tasks endpoint (get all tasks).', 'dependencies': ['BE-003'], 'estimated_time': '3 hours', 'agent_role': 'backend_developer', 'acceptance_criteria': ['Endpoint handles GET requests to /api/tasks.', 'Endpoint retrieves all tasks from the database.', 'Endpoint returns the list of tasks with a 200 status code.'], 'status': 'pending', 'code_files': ['index.js']}, {'id': 'BE-006', 'description': 'Implement the GET /api/tasks/:id endpoint (get a specific task).', 'dependencies': ['BE-003'], 'estimated_time': '3 hours', 'agent_role': 'backend_developer', 'acceptance_criteria': ['Endpoint handles GET requests to /api/tasks/:id.', 'Endpoint retrieves a specific task from the database by ID.', 'Endpoint returns the task with a 200 status code.', 'Endpoint returns a 404 status code if the task is not found.'], 'status': 'pending', 'code_files': ['index.js']}, {'id': 'BE-007', 'description': 'Implement the PUT /api/tasks/:id endpoint (update a task).', 'dependencies': ['BE-003'], 'estimated_time': '4 hours', 'agent_role': 'backend_developer', 'acceptance_criteria': ['Endpoint handles PUT requests to /api/tasks/:id.', 'Endpoint updates a specific task in the database by ID.', 'Endpoint returns the updated task with a 200 status code.', 'Endpoint returns a 404 status code if the task is not found.', 'Endpoint handles updates to description and completed status.'], 'status': 'pending', 'code_files': ['index.js']}, {'id': 'BE-008', 'description': 'Implement the DELETE /api/tasks/:id endpoint (delete a task).', 'dependencies': ['BE-003'], 'estimated_time': '3 hours', 'agent_role': 'backend_developer', 'acceptance_criteria': ['Endpoint handles DELETE requests to /api/tasks/:id.', 'Endpoint deletes a specific task from the database by ID.', 'Endpoint returns a 204 status code on success.', 'Endpoint returns a 404 status code if the task is not found.'], 'status': 'pending', 'code_files': ['index.js']}, {'id': 'BE-009', 'description': 'Implement input validation on the backend.', 'dependencies': ['BE-004'], 'estimated_time': '3 hours', 'agent_role': 'backend_developer', 'acceptance_criteria': [\"Validate the 'description' field in the POST request.\", 'Return a 400 status code if the description is missing or invalid.', \"Validate the 'description' and 'completed' fields in the PUT request.\"], 'status': 'pending', 'code_files': ['index.js']}, {'id': 'DE-001', 'description': 'Deploy the application to Heroku.', 'dependencies': ['BE-001', 'FE-001', 'BE-005', 'FE-007', 'BE-004', 'FE-008', 'BE-009', 'FE-009', 'FE-010', 'FE-011', 'FE-012'], 'estimated_time': '4 hours', 'agent_role': 'backend_developer', 'acceptance_criteria': ['Application is successfully deployed to Heroku.', 'Database connection is configured correctly on Heroku.', 'Application is accessible via a Heroku URL.'], 'status': 'pending', 'code_files': ['Procfile']}, {'id': 'TE-001', 'description': 'Write unit tests for the backend API endpoints.', 'dependencies': ['BE-001', 'BE-004', 'BE-005', 'BE-006', 'BE-007', 'BE-008'], 'estimated_time': '6 hours', 'agent_role': 'backend_developer', 'acceptance_criteria': ['Tests cover all API endpoints (POST, GET, PUT, DELETE).', 'Tests verify correct responses (status codes, data).', 'Tests cover error scenarios (e.g., invalid input, not found).'], 'status': 'pending', 'code_files': ['tests/api.test.js']}]}], resource_allocation=[{'role': 'Backend Developer', 'count': 1, 'estimated_time_allocation': '100%', 'phases': ['Backend Phase'], 'skills_required': []}, {'role': 'Frontend Developer', 'count': 1, 'estimated_time_allocation': '100%', 'phases': ['Frontend Phase'], 'skills_required': []}], risks_and_mitigations=[], timeline={'start_date': '2025-07-08T16:47:41.741487', 'end_date': 'TBD', 'milestones': []}, tech_stack={}, metadata={'generated_at': '2025-07-08T16:47:41.741487', 'version': '1.0', 'author': 'Multi-AI Dev System', 'tags': [], 'notes': 'Converted from WorkItemBacklog. Original summary: Develop a full-stack task list application using React for the frontend, Node.js/Express for the backend, and MongoDB for the database. The application will allow users to add, view, edit, and delete tasks. The application will be deployed to Heroku.'}) summary='Develop a full-stack task list application using React for the frontend, Node.js/Express for the backend, and MongoDB for the database. The application will allow users to add, view, edit, and delete tasks. The application will be deployed to Heroku.' metadata=PlanMetadata(generated_at='2025-07-08T16:47:41.741487', version='1.0', author='Multi-AI Dev System', tags=[], notes='Converted from WorkItemBacklog. Original summary: Develop a full-stack task list application using React for the frontend, Node.js/Express for the backend, and MongoDB for the database. The application will allow users to add, view, edit, and delete tasks. The application will be deployed to Heroku.')"
  }
}