{
  "session_id": "session_9744f8cf-5369-4cf9-b9f1-9f1f4fc3f21c",
  "approval_type": "implementation_plan",
  "timestamp": 1751963553,
  "approval_data": {
    "type": "implementation_plan",
    "timestamp": 1751963553.8762424,
    "project_overview": "Develop a simple web application for managing a list of tasks, including adding, viewing, completing, and deleting tasks. The application will use React for the frontend, Node.js with Express for the backend, and PostgreSQL for the database. The application will be deployed on AWS.",
    "development_phases": [
      {
        "name": "Frontend Phase",
        "description": "Tasks related to frontend phase",
        "deliverables": [
          "Completed FE-001",
          "Completed FE-002",
          "Completed FE-003",
          "Completed FE-004",
          "Completed FE-005",
          "Completed FE-006",
          "Completed FE-007",
          "Completed FE-008",
          "Completed FE-009",
          "Completed FE-010",
          "Completed FE-011",
          "Completed FE-012"
        ],
        "estimated_duration_hours": 58.0,
        "work_items": [
          {
            "id": "FE-001",
            "description": "Set up React project with Create React App.",
            "dependencies": [],
            "estimated_time": "4 hours",
            "agent_role": "frontend_developer",
            "acceptance_criteria": [
              "Project initializes successfully.",
              "Default React app runs without errors."
            ],
            "status": "pending",
            "code_files": [
              "package.json",
              "src/App.js",
              "src/index.js"
            ]
          },
          {
            "id": "FE-002",
            "description": "Create basic UI layout with a header and a task list container.",
            "dependencies": [
              "FE-001"
            ],
            "estimated_time": "4 hours",
            "agent_role": "frontend_developer",
            "acceptance_criteria": [
              "Header displays correctly.",
              "Task list container is present.",
              "UI is responsive."
            ],
            "status": "pending",
            "code_files": [
              "src/App.js",
              "src/App.css"
            ]
          },
          {
            "id": "FE-003",
            "description": "Implement a form for adding new tasks (input field and submit button).",
            "dependencies": [
              "FE-002"
            ],
            "estimated_time": "4 hours",
            "agent_role": "frontend_developer",
            "acceptance_criteria": [
              "Form renders correctly.",
              "Input field accepts text.",
              "Submit button is present."
            ],
            "status": "pending",
            "code_files": [
              "src/App.js",
              "src/App.css"
            ]
          },
          {
            "id": "FE-004",
            "description": "Implement state management for the task list (using useState).",
            "dependencies": [
              "FE-003"
            ],
            "estimated_time": "4 hours",
            "agent_role": "frontend_developer",
            "acceptance_criteria": [
              "Tasks are stored in component state.",
              "State updates trigger UI re-renders."
            ],
            "status": "pending",
            "code_files": [
              "src/App.js"
            ]
          },
          {
            "id": "FE-005",
            "description": "Implement the 'add task' functionality (on form submit).",
            "dependencies": [
              "FE-004"
            ],
            "estimated_time": "4 hours",
            "agent_role": "frontend_developer",
            "acceptance_criteria": [
              "New tasks are added to the task list state.",
              "Input field is cleared after submission."
            ],
            "status": "pending",
            "code_files": [
              "src/App.js"
            ]
          },
          {
            "id": "FE-006",
            "description": "Display the task list items.",
            "dependencies": [
              "FE-004"
            ],
            "estimated_time": "4 hours",
            "agent_role": "frontend_developer",
            "acceptance_criteria": [
              "Tasks are displayed in a list.",
              "Each task displays its description."
            ],
            "status": "pending",
            "code_files": [
              "src/App.js",
              "src/App.css"
            ]
          },
          {
            "id": "FE-007",
            "description": "Implement API calls to the backend (GET /tasks).",
            "dependencies": [
              "FE-006",
              "BE-004"
            ],
            "estimated_time": "6 hours",
            "agent_role": "frontend_developer",
            "acceptance_criteria": [
              "Frontend fetches tasks from the backend on component mount.",
              "Tasks are displayed from the API response.",
              "Error handling for API calls is implemented."
            ],
            "status": "pending",
            "code_files": [
              "src/App.js"
            ]
          },
          {
            "id": "FE-008",
            "description": "Implement API calls to the backend (POST /tasks).",
            "dependencies": [
              "FE-005",
              "BE-005"
            ],
            "estimated_time": "6 hours",
            "agent_role": "frontend_developer",
            "acceptance_criteria": [
              "Frontend sends a POST request to create a new task.",
              "Frontend updates the task list after a successful API call.",
              "Error handling for API calls is implemented."
            ],
            "status": "pending",
            "code_files": [
              "src/App.js"
            ]
          },
          {
            "id": "FE-009",
            "description": "Implement basic styling for the task list.",
            "dependencies": [
              "FE-006"
            ],
            "estimated_time": "4 hours",
            "agent_role": "frontend_developer",
            "acceptance_criteria": [
              "Tasks are styled for readability.",
              "UI is visually appealing."
            ],
            "status": "pending",
            "code_files": [
              "src/App.css"
            ]
          },
          {
            "id": "FE-010",
            "description": "Implement task completion functionality (checkbox).",
            "dependencies": [
              "FE-006",
              "BE-006"
            ],
            "estimated_time": "6 hours",
            "agent_role": "frontend_developer",
            "acceptance_criteria": [
              "Each task has a checkbox to mark it as complete.",
              "Clicking the checkbox sends a PUT request to the backend.",
              "Task list updates to reflect the completion status.",
              "Error handling for API calls is implemented."
            ],
            "status": "pending",
            "code_files": [
              "src/App.js"
            ]
          },
          {
            "id": "FE-011",
            "description": "Implement task deletion functionality (button).",
            "dependencies": [
              "FE-006",
              "BE-007"
            ],
            "estimated_time": "4 hours",
            "agent_role": "frontend_developer",
            "acceptance_criteria": [
              "Each task has a delete button.",
              "Clicking the button sends a DELETE request to the backend.",
              "Task list updates to remove the deleted task.",
              "Error handling for API calls is implemented."
            ],
            "status": "pending",
            "code_files": [
              "src/App.js"
            ]
          },
          {
            "id": "FE-012",
            "description": "Implement unit tests for frontend components.",
            "dependencies": [
              "FE-001",
              "FE-002",
              "FE-003",
              "FE-004",
              "FE-005",
              "FE-006",
              "FE-007",
              "FE-008",
              "FE-010",
              "FE-011"
            ],
            "estimated_time": "8 hours",
            "agent_role": "frontend_developer",
            "acceptance_criteria": [
              "Tests cover key functionality of each component.",
              "Tests pass successfully.",
              "Test coverage meets the defined threshold."
            ],
            "status": "pending",
            "code_files": [
              "src/App.test.js"
            ]
          }
        ]
      },
      {
        "name": "Backend Phase",
        "description": "Tasks related to backend phase",
        "deliverables": [
          "Completed BE-001",
          "Completed BE-002",
          "Completed BE-004",
          "Completed BE-005",
          "Completed BE-006",
          "Completed BE-007",
          "Completed BE-008",
          "Completed SEC-001"
        ],
        "estimated_duration_hours": 40.0,
        "work_items": [
          {
            "id": "BE-001",
            "description": "Set up Node.js project with Express.",
            "dependencies": [],
            "estimated_time": "4 hours",
            "agent_role": "backend_developer",
            "acceptance_criteria": [
              "Project initializes successfully.",
              "Express server runs without errors."
            ],
            "status": "pending",
            "code_files": [
              "package.json",
              "index.js"
            ]
          },
          {
            "id": "BE-002",
            "description": "Install and configure necessary dependencies (body-parser, cors).",
            "dependencies": [
              "BE-001"
            ],
            "estimated_time": "2 hours",
            "agent_role": "backend_developer",
            "acceptance_criteria": [
              "Dependencies are installed.",
              "CORS is configured to allow requests from the frontend."
            ],
            "status": "pending",
            "code_files": [
              "package.json",
              "index.js"
            ]
          },
          {
            "id": "BE-004",
            "description": "Implement the GET /tasks endpoint (retrieve all tasks).",
            "dependencies": [
              "BE-002",
              "BE-003"
            ],
            "estimated_time": "6 hours",
            "agent_role": "backend_developer",
            "acceptance_criteria": [
              "Endpoint returns a 200 status code.",
              "Endpoint retrieves all tasks from the database.",
              "Tasks are returned in JSON format."
            ],
            "status": "pending",
            "code_files": [
              "index.js"
            ]
          },
          {
            "id": "BE-005",
            "description": "Implement the POST /tasks endpoint (create a new task).",
            "dependencies": [
              "BE-002",
              "BE-003"
            ],
            "estimated_time": "6 hours",
            "agent_role": "backend_developer",
            "acceptance_criteria": [
              "Endpoint returns a 201 status code on success.",
              "Endpoint saves the new task to the database.",
              "Endpoint returns the created task in JSON format.",
              "Input validation is implemented."
            ],
            "status": "pending",
            "code_files": [
              "index.js"
            ]
          },
          {
            "id": "BE-006",
            "description": "Implement the PUT /tasks/{id} endpoint (mark task as complete).",
            "dependencies": [
              "BE-004",
              "BE-003"
            ],
            "estimated_time": "6 hours",
            "agent_role": "backend_developer",
            "acceptance_criteria": [
              "Endpoint returns a 200 status code on success.",
              "Endpoint updates the 'completed' status in the database.",
              "Endpoint returns the updated task in JSON format.",
              "Input validation is implemented.",
              "Handles task not found (404)."
            ],
            "status": "pending",
            "code_files": [
              "index.js"
            ]
          },
          {
            "id": "BE-007",
            "description": "Implement the DELETE /tasks/{id} endpoint (delete a task).",
            "dependencies": [
              "BE-004",
              "BE-003"
            ],
            "estimated_time": "4 hours",
            "agent_role": "backend_developer",
            "acceptance_criteria": [
              "Endpoint returns a 200 status code on success.",
              "Endpoint deletes the task from the database.",
              "Handles task not found (404)."
            ],
            "status": "pending",
            "code_files": [
              "index.js"
            ]
          },
          {
            "id": "BE-008",
            "description": "Implement unit tests for backend API endpoints.",
            "dependencies": [
              "BE-004",
              "BE-005",
              "BE-006",
              "BE-007"
            ],
            "estimated_time": "8 hours",
            "agent_role": "backend_developer",
            "acceptance_criteria": [
              "Tests cover key functionality of each endpoint.",
              "Tests pass successfully.",
              "Test coverage meets the defined threshold."
            ],
            "status": "pending",
            "code_files": [
              "test/index.test.js"
            ]
          },
          {
            "id": "SEC-001",
            "description": "Implement input validation on the backend.",
            "dependencies": [
              "BE-005"
            ],
            "estimated_time": "4 hours",
            "agent_role": "backend_developer",
            "acceptance_criteria": [
              "Input validation is implemented for all POST and PUT requests.",
              "Invalid input results in a 400 Bad Request response."
            ],
            "status": "pending",
            "code_files": [
              "index.js"
            ]
          }
        ]
      },
      {
        "name": "Database Phase",
        "description": "Tasks related to database phase",
        "deliverables": [
          "Completed BE-003"
        ],
        "estimated_duration_hours": 6.0,
        "work_items": [
          {
            "id": "BE-003",
            "description": "Set up PostgreSQL database and create the 'tasks' table.",
            "dependencies": [],
            "estimated_time": "6 hours",
            "agent_role": "database_specialist",
            "acceptance_criteria": [
              "Database connection is successful.",
              "'tasks' table exists with 'id', 'description', 'created_at', and 'completed' columns.",
              "Database schema matches the data model."
            ],
            "status": "pending",
            "code_files": [
              "db.sql"
            ]
          }
        ]
      },
      {
        "name": "Devops_Engineer Phase",
        "description": "Tasks related to devops_engineer phase",
        "deliverables": [
          "Completed INF-001",
          "Completed INF-002",
          "Completed INF-003",
          "Completed INF-004",
          "Completed SEC-002"
        ],
        "estimated_duration_hours": 40.0,
        "work_items": [
          {
            "id": "INF-001",
            "description": "Set up AWS infrastructure (EC2, RDS, S3).",
            "dependencies": [
              "BE-003",
              "BE-004",
              "BE-005",
              "BE-006",
              "BE-007",
              "FE-007",
              "FE-008",
              "FE-010",
              "FE-011"
            ],
            "estimated_time": "16 hours",
            "agent_role": "devops_engineer",
            "acceptance_criteria": [
              "EC2 instance is running.",
              "RDS database is accessible.",
              "S3 bucket is created.",
              "Security groups are configured correctly."
            ],
            "status": "pending",
            "code_files": [
              "terraform/main.tf"
            ]
          },
          {
            "id": "INF-002",
            "description": "Deploy backend to EC2 instance.",
            "dependencies": [
              "INF-001",
              "BE-004",
              "BE-005",
              "BE-006",
              "BE-007"
            ],
            "estimated_time": "8 hours",
            "agent_role": "devops_engineer",
            "acceptance_criteria": [
              "Backend is running on the EC2 instance.",
              "Backend is accessible via the public IP address.",
              "Database connection is successful."
            ],
            "status": "pending",
            "code_files": [
              "Dockerfile",
              "docker-compose.yml"
            ]
          },
          {
            "id": "INF-003",
            "description": "Deploy frontend to S3 and configure CloudFront.",
            "dependencies": [
              "INF-001",
              "FE-007",
              "FE-008",
              "FE-010",
              "FE-011"
            ],
            "estimated_time": "8 hours",
            "agent_role": "devops_engineer",
            "acceptance_criteria": [
              "Frontend is accessible via the CloudFront distribution.",
              "Frontend makes API calls to the backend.",
              "HTTPS is enabled."
            ],
            "status": "pending",
            "code_files": []
          },
          {
            "id": "INF-004",
            "description": "Implement basic logging and monitoring (CloudWatch).",
            "dependencies": [
              "INF-002",
              "INF-003"
            ],
            "estimated_time": "4 hours",
            "agent_role": "devops_engineer",
            "acceptance_criteria": [
              "Logs are collected from the backend.",
              "Basic metrics are collected (e.g., CPU usage, database connections).",
              "Alerts are configured for critical errors."
            ],
            "status": "pending",
            "code_files": []
          },
          {
            "id": "SEC-002",
            "description": "Implement HTTPS for the frontend.",
            "dependencies": [
              "INF-003"
            ],
            "estimated_time": "4 hours",
            "agent_role": "devops_engineer",
            "acceptance_criteria": [
              "Frontend is served over HTTPS.",
              "SSL/TLS certificate is configured correctly."
            ],
            "status": "pending",
            "code_files": []
          }
        ]
      }
    ],
    "timeline_estimation": {
      "start_date": "2025-07-08T14:02:33.467167",
      "end_date": "TBD",
      "milestones": []
    },
    "risk_assessment": [],
    "resource_requirements": [
      {
        "role": "Backend Developer",
        "count": 1,
        "estimated_time_allocation": "100%",
        "phases": [
          "Backend Phase"
        ],
        "skills_required": []
      },
      {
        "role": "Frontend Developer",
        "count": 1,
        "estimated_time_allocation": "100%",
        "phases": [
          "Frontend Phase"
        ],
        "skills_required": []
      },
      {
        "role": "Database Specialist",
        "count": 1,
        "estimated_time_allocation": "100%",
        "phases": [
          "Database Phase"
        ],
        "skills_required": []
      },
      {
        "role": "Devops Engineer",
        "count": 1,
        "estimated_time_allocation": "100%",
        "phases": [
          "Devops_Engineer Phase"
        ],
        "skills_required": []
      }
    ],
    "deliverables": [
      "Completed FE-001",
      "Completed FE-002",
      "Completed FE-003",
      "Completed FE-004",
      "Completed FE-005",
      "Completed FE-006",
      "Completed FE-007",
      "Completed FE-008",
      "Completed FE-009",
      "Completed FE-010",
      "Completed FE-011",
      "Completed FE-012",
      "Completed BE-001",
      "Completed BE-002",
      "Completed BE-004",
      "Completed BE-005",
      "Completed BE-006",
      "Completed BE-007",
      "Completed BE-008",
      "Completed SEC-001",
      "Completed BE-003",
      "Completed INF-001",
      "Completed INF-002",
      "Completed INF-003",
      "Completed INF-004",
      "Completed SEC-002"
    ],
    "dependencies": [],
    "raw_plan": "plan=ImplementationPlan(project_summary={'title': 'Generated Project Plan', 'description': 'Develop a simple web application for managing a list of tasks, including adding, viewing, completing, and deleting tasks. The application will use React for the frontend, Node.js with Express for the backend, and PostgreSQL for the database. The application will be deployed on AWS.', 'overall_complexity': 'Medium', 'estimated_duration': 'TBD', 'key_challenges': [], 'success_criteria': []}, phases=[{'name': 'Frontend Phase', 'description': 'Tasks related to frontend phase', 'deliverables': ['Completed FE-001', 'Completed FE-002', 'Completed FE-003', 'Completed FE-004', 'Completed FE-005', 'Completed FE-006', 'Completed FE-007', 'Completed FE-008', 'Completed FE-009', 'Completed FE-010', 'Completed FE-011', 'Completed FE-012'], 'estimated_duration_hours': 58.0, 'work_items': [{'id': 'FE-001', 'description': 'Set up React project with Create React App.', 'dependencies': [], 'estimated_time': '4 hours', 'agent_role': 'frontend_developer', 'acceptance_criteria': ['Project initializes successfully.', 'Default React app runs without errors.'], 'status': 'pending', 'code_files': ['package.json', 'src/App.js', 'src/index.js']}, {'id': 'FE-002', 'description': 'Create basic UI layout with a header and a task list container.', 'dependencies': ['FE-001'], 'estimated_time': '4 hours', 'agent_role': 'frontend_developer', 'acceptance_criteria': ['Header displays correctly.', 'Task list container is present.', 'UI is responsive.'], 'status': 'pending', 'code_files': ['src/App.js', 'src/App.css']}, {'id': 'FE-003', 'description': 'Implement a form for adding new tasks (input field and submit button).', 'dependencies': ['FE-002'], 'estimated_time': '4 hours', 'agent_role': 'frontend_developer', 'acceptance_criteria': ['Form renders correctly.', 'Input field accepts text.', 'Submit button is present.'], 'status': 'pending', 'code_files': ['src/App.js', 'src/App.css']}, {'id': 'FE-004', 'description': 'Implement state management for the task list (using useState).', 'dependencies': ['FE-003'], 'estimated_time': '4 hours', 'agent_role': 'frontend_developer', 'acceptance_criteria': ['Tasks are stored in component state.', 'State updates trigger UI re-renders.'], 'status': 'pending', 'code_files': ['src/App.js']}, {'id': 'FE-005', 'description': \"Implement the 'add task' functionality (on form submit).\", 'dependencies': ['FE-004'], 'estimated_time': '4 hours', 'agent_role': 'frontend_developer', 'acceptance_criteria': ['New tasks are added to the task list state.', 'Input field is cleared after submission.'], 'status': 'pending', 'code_files': ['src/App.js']}, {'id': 'FE-006', 'description': 'Display the task list items.', 'dependencies': ['FE-004'], 'estimated_time': '4 hours', 'agent_role': 'frontend_developer', 'acceptance_criteria': ['Tasks are displayed in a list.', 'Each task displays its description.'], 'status': 'pending', 'code_files': ['src/App.js', 'src/App.css']}, {'id': 'FE-007', 'description': 'Implement API calls to the backend (GET /tasks).', 'dependencies': ['FE-006', 'BE-004'], 'estimated_time': '6 hours', 'agent_role': 'frontend_developer', 'acceptance_criteria': ['Frontend fetches tasks from the backend on component mount.', 'Tasks are displayed from the API response.', 'Error handling for API calls is implemented.'], 'status': 'pending', 'code_files': ['src/App.js']}, {'id': 'FE-008', 'description': 'Implement API calls to the backend (POST /tasks).', 'dependencies': ['FE-005', 'BE-005'], 'estimated_time': '6 hours', 'agent_role': 'frontend_developer', 'acceptance_criteria': ['Frontend sends a POST request to create a new task.', 'Frontend updates the task list after a successful API call.', 'Error handling for API calls is implemented.'], 'status': 'pending', 'code_files': ['src/App.js']}, {'id': 'FE-009', 'description': 'Implement basic styling for the task list.', 'dependencies': ['FE-006'], 'estimated_time': '4 hours', 'agent_role': 'frontend_developer', 'acceptance_criteria': ['Tasks are styled for readability.', 'UI is visually appealing.'], 'status': 'pending', 'code_files': ['src/App.css']}, {'id': 'FE-010', 'description': 'Implement task completion functionality (checkbox).', 'dependencies': ['FE-006', 'BE-006'], 'estimated_time': '6 hours', 'agent_role': 'frontend_developer', 'acceptance_criteria': ['Each task has a checkbox to mark it as complete.', 'Clicking the checkbox sends a PUT request to the backend.', 'Task list updates to reflect the completion status.', 'Error handling for API calls is implemented.'], 'status': 'pending', 'code_files': ['src/App.js']}, {'id': 'FE-011', 'description': 'Implement task deletion functionality (button).', 'dependencies': ['FE-006', 'BE-007'], 'estimated_time': '4 hours', 'agent_role': 'frontend_developer', 'acceptance_criteria': ['Each task has a delete button.', 'Clicking the button sends a DELETE request to the backend.', 'Task list updates to remove the deleted task.', 'Error handling for API calls is implemented.'], 'status': 'pending', 'code_files': ['src/App.js']}, {'id': 'FE-012', 'description': 'Implement unit tests for frontend components.', 'dependencies': ['FE-001', 'FE-002', 'FE-003', 'FE-004', 'FE-005', 'FE-006', 'FE-007', 'FE-008', 'FE-010', 'FE-011'], 'estimated_time': '8 hours', 'agent_role': 'frontend_developer', 'acceptance_criteria': ['Tests cover key functionality of each component.', 'Tests pass successfully.', 'Test coverage meets the defined threshold.'], 'status': 'pending', 'code_files': ['src/App.test.js']}]}, {'name': 'Backend Phase', 'description': 'Tasks related to backend phase', 'deliverables': ['Completed BE-001', 'Completed BE-002', 'Completed BE-004', 'Completed BE-005', 'Completed BE-006', 'Completed BE-007', 'Completed BE-008', 'Completed SEC-001'], 'estimated_duration_hours': 40.0, 'work_items': [{'id': 'BE-001', 'description': 'Set up Node.js project with Express.', 'dependencies': [], 'estimated_time': '4 hours', 'agent_role': 'backend_developer', 'acceptance_criteria': ['Project initializes successfully.', 'Express server runs without errors.'], 'status': 'pending', 'code_files': ['package.json', 'index.js']}, {'id': 'BE-002', 'description': 'Install and configure necessary dependencies (body-parser, cors).', 'dependencies': ['BE-001'], 'estimated_time': '2 hours', 'agent_role': 'backend_developer', 'acceptance_criteria': ['Dependencies are installed.', 'CORS is configured to allow requests from the frontend.'], 'status': 'pending', 'code_files': ['package.json', 'index.js']}, {'id': 'BE-004', 'description': 'Implement the GET /tasks endpoint (retrieve all tasks).', 'dependencies': ['BE-002', 'BE-003'], 'estimated_time': '6 hours', 'agent_role': 'backend_developer', 'acceptance_criteria': ['Endpoint returns a 200 status code.', 'Endpoint retrieves all tasks from the database.', 'Tasks are returned in JSON format.'], 'status': 'pending', 'code_files': ['index.js']}, {'id': 'BE-005', 'description': 'Implement the POST /tasks endpoint (create a new task).', 'dependencies': ['BE-002', 'BE-003'], 'estimated_time': '6 hours', 'agent_role': 'backend_developer', 'acceptance_criteria': ['Endpoint returns a 201 status code on success.', 'Endpoint saves the new task to the database.', 'Endpoint returns the created task in JSON format.', 'Input validation is implemented.'], 'status': 'pending', 'code_files': ['index.js']}, {'id': 'BE-006', 'description': 'Implement the PUT /tasks/{id} endpoint (mark task as complete).', 'dependencies': ['BE-004', 'BE-003'], 'estimated_time': '6 hours', 'agent_role': 'backend_developer', 'acceptance_criteria': ['Endpoint returns a 200 status code on success.', \"Endpoint updates the 'completed' status in the database.\", 'Endpoint returns the updated task in JSON format.', 'Input validation is implemented.', 'Handles task not found (404).'], 'status': 'pending', 'code_files': ['index.js']}, {'id': 'BE-007', 'description': 'Implement the DELETE /tasks/{id} endpoint (delete a task).', 'dependencies': ['BE-004', 'BE-003'], 'estimated_time': '4 hours', 'agent_role': 'backend_developer', 'acceptance_criteria': ['Endpoint returns a 200 status code on success.', 'Endpoint deletes the task from the database.', 'Handles task not found (404).'], 'status': 'pending', 'code_files': ['index.js']}, {'id': 'BE-008', 'description': 'Implement unit tests for backend API endpoints.', 'dependencies': ['BE-004', 'BE-005', 'BE-006', 'BE-007'], 'estimated_time': '8 hours', 'agent_role': 'backend_developer', 'acceptance_criteria': ['Tests cover key functionality of each endpoint.', 'Tests pass successfully.', 'Test coverage meets the defined threshold.'], 'status': 'pending', 'code_files': ['test/index.test.js']}, {'id': 'SEC-001', 'description': 'Implement input validation on the backend.', 'dependencies': ['BE-005'], 'estimated_time': '4 hours', 'agent_role': 'backend_developer', 'acceptance_criteria': ['Input validation is implemented for all POST and PUT requests.', 'Invalid input results in a 400 Bad Request response.'], 'status': 'pending', 'code_files': ['index.js']}]}, {'name': 'Database Phase', 'description': 'Tasks related to database phase', 'deliverables': ['Completed BE-003'], 'estimated_duration_hours': 6.0, 'work_items': [{'id': 'BE-003', 'description': \"Set up PostgreSQL database and create the 'tasks' table.\", 'dependencies': [], 'estimated_time': '6 hours', 'agent_role': 'database_specialist', 'acceptance_criteria': ['Database connection is successful.', \"'tasks' table exists with 'id', 'description', 'created_at', and 'completed' columns.\", 'Database schema matches the data model.'], 'status': 'pending', 'code_files': ['db.sql']}]}, {'name': 'Devops_Engineer Phase', 'description': 'Tasks related to devops_engineer phase', 'deliverables': ['Completed INF-001', 'Completed INF-002', 'Completed INF-003', 'Completed INF-004', 'Completed SEC-002'], 'estimated_duration_hours': 40.0, 'work_items': [{'id': 'INF-001', 'description': 'Set up AWS infrastructure (EC2, RDS, S3).', 'dependencies': ['BE-003', 'BE-004', 'BE-005', 'BE-006', 'BE-007', 'FE-007', 'FE-008', 'FE-010', 'FE-011'], 'estimated_time': '16 hours', 'agent_role': 'devops_engineer', 'acceptance_criteria': ['EC2 instance is running.', 'RDS database is accessible.', 'S3 bucket is created.', 'Security groups are configured correctly.'], 'status': 'pending', 'code_files': ['terraform/main.tf']}, {'id': 'INF-002', 'description': 'Deploy backend to EC2 instance.', 'dependencies': ['INF-001', 'BE-004', 'BE-005', 'BE-006', 'BE-007'], 'estimated_time': '8 hours', 'agent_role': 'devops_engineer', 'acceptance_criteria': ['Backend is running on the EC2 instance.', 'Backend is accessible via the public IP address.', 'Database connection is successful.'], 'status': 'pending', 'code_files': ['Dockerfile', 'docker-compose.yml']}, {'id': 'INF-003', 'description': 'Deploy frontend to S3 and configure CloudFront.', 'dependencies': ['INF-001', 'FE-007', 'FE-008', 'FE-010', 'FE-011'], 'estimated_time': '8 hours', 'agent_role': 'devops_engineer', 'acceptance_criteria': ['Frontend is accessible via the CloudFront distribution.', 'Frontend makes API calls to the backend.', 'HTTPS is enabled.'], 'status': 'pending', 'code_files': []}, {'id': 'INF-004', 'description': 'Implement basic logging and monitoring (CloudWatch).', 'dependencies': ['INF-002', 'INF-003'], 'estimated_time': '4 hours', 'agent_role': 'devops_engineer', 'acceptance_criteria': ['Logs are collected from the backend.', 'Basic metrics are collected (e.g., CPU usage, database connections).', 'Alerts are configured for critical errors.'], 'status': 'pending', 'code_files': []}, {'id': 'SEC-002', 'description': 'Implement HTTPS for the frontend.', 'dependencies': ['INF-003'], 'estimated_time': '4 hours', 'agent_role': 'devops_engineer', 'acceptance_criteria': ['Frontend is served over HTTPS.', 'SSL/TLS certificate is configured correctly.'], 'status': 'pending', 'code_files': []}]}], resource_allocation=[{'role': 'Backend Developer', 'count': 1, 'estimated_time_allocation': '100%', 'phases': ['Backend Phase'], 'skills_required': []}, {'role': 'Frontend Developer', 'count': 1, 'estimated_time_allocation': '100%', 'phases': ['Frontend Phase'], 'skills_required': []}, {'role': 'Database Specialist', 'count': 1, 'estimated_time_allocation': '100%', 'phases': ['Database Phase'], 'skills_required': []}, {'role': 'Devops Engineer', 'count': 1, 'estimated_time_allocation': '100%', 'phases': ['Devops_Engineer Phase'], 'skills_required': []}], risks_and_mitigations=[], timeline={'start_date': '2025-07-08T14:02:33.467167', 'end_date': 'TBD', 'milestones': []}, tech_stack={}, metadata={'generated_at': '2025-07-08T14:02:33.467167', 'version': '1.0', 'author': 'Multi-AI Dev System', 'tags': [], 'notes': 'Converted from WorkItemBacklog. Original summary: Develop a simple web application for managing a list of tasks, including adding, viewing, completing, and deleting tasks. The application will use React for the frontend, Node.js with Express for the backend, and PostgreSQL for the database. The application will be deployed on AWS.'}) summary='Develop a simple web application for managing a list of tasks, including adding, viewing, completing, and deleting tasks. The application will use React for the frontend, Node.js with Express for the backend, and PostgreSQL for the database. The application will be deployed on AWS.' metadata=PlanMetadata(generated_at='2025-07-08T14:02:33.467167', version='1.0', author='Multi-AI Dev System', tags=[], notes='Converted from WorkItemBacklog. Original summary: Develop a simple web application for managing a list of tasks, including adding, viewing, completing, and deleting tasks. The application will use React for the frontend, Node.js with Express for the backend, and PostgreSQL for the database. The application will be deployed on AWS.')"
  },
  "workflow_state_snapshot": {
    "requirements_analysis": {
      "project_name": "Hello World Task List",
      "project_summary": "A simple web application to manage a list of tasks.",
      "project_goals": [
        "Allow a user to add a task",
        "Allow a user to see their list of tasks"
      ],
      "target_audience": [
        "Users who want to manage a list of tasks"
      ],
      "business_context": "This project aims to provide a basic task management tool.",
      "requirements": [
        {
          "id": "REQ-001",
          "description": "A user can create a new task with a text description.",
          "category": "functional",
          "priority": 1
        },
        {
          "id": "REQ-002",
          "description": "A user can see a list of all created tasks.",
          "category": "functional",
          "priority": 1
        },
        {
          "id": "REQ-003",
          "description": "The application must load quickly.",
          "category": "non_functional",
          "priority": 2
        },
        {
          "id": "REQ-004",
          "description": "The application must be secure.",
          "category": "non_functional",
          "priority": 2
        }
      ],
      "functional_requirements": [
        "A user can create a new task with a text description.",
        "A user can see a list of all created tasks."
      ],
      "non_functional_requirements": [
        "The application must load quickly.",
        "The application must be secure."
      ],
      "stakeholders": [
        "Users"
      ],
      "success_criteria": [
        "Users can successfully add tasks.",
        "Users can successfully view their task list.",
        "The application loads quickly.",
        "The application is secure."
      ],
      "constraints": [],
      "assumptions": [],
      "risks": [],
      "domain_specific_details": {},
      "quality_assessment": {
        "clarity_score": 9.0,
        "completeness_score": 8.0,
        "consistency_score": 10.0,
        "recommendations": []
      },
      "gap_analysis": {
        "identified_gaps": [],
        "recommendations_for_completion": []
      }
    },
    "tech_stack_recommendation": {
      "frontend_options": [
        {
          "name": "React",
          "language": "JavaScript",
          "reasoning": "React is a popular and efficient library for building user interfaces. It offers a component-based architecture, making it easy to manage and update the UI. Its virtual DOM and efficient update mechanisms contribute to fast loading times, addressing a key non-functional requirement.",
          "key_libraries": [
            "React Router (for navigation)",
            "Axios or Fetch (for API calls)",
            "Material UI or Bootstrap (for UI components)"
          ],
          "pros": [
            "Large community and extensive documentation",
            "Component-based architecture promotes code reusability and maintainability",
            "Virtual DOM for efficient updates",
            "Excellent performance and fast loading times"
          ],
          "cons": [
            "Requires understanding of JSX",
            "Can have a steeper learning curve for beginners",
            "Requires additional libraries for routing and state management (though this is also a pro, as it allows for flexibility)"
          ],
          "selected": false
        },
        {
          "name": "Vue.js",
          "language": "JavaScript",
          "reasoning": "Vue.js is a progressive framework that is easy to learn and integrate. It's known for its simplicity and excellent documentation, making it a good choice for smaller projects. It also offers good performance and a reactive system for UI updates.",
          "key_libraries": [
            "Vue Router (for navigation)",
            "Axios or Fetch (for API calls)",
            "Vuetify or BootstrapVue (for UI components)"
          ],
          "pros": [
            "Easy to learn and use",
            "Excellent documentation",
            "Good performance",
            "Progressive framework: can be integrated into existing projects easily"
          ],
          "cons": [
            "Smaller community compared to React",
            "May require more manual configuration for complex applications"
          ],
          "selected": false
        },
        {
          "name": "HTML, CSS, and JavaScript (Vanilla)",
          "language": "JavaScript",
          "reasoning": "For a simple task list application, using vanilla JavaScript, HTML, and CSS can be a viable option. It avoids the overhead of a framework, resulting in potentially faster initial load times and a smaller bundle size. This approach is suitable given the project's simplicity.",
          "key_libraries": [],
          "pros": [
            "No external dependencies",
            "Fastest initial load times",
            "Simple to understand and debug"
          ],
          "cons": [
            "More manual DOM manipulation",
            "Can become complex to manage for larger applications",
            "Less structure and organization compared to frameworks"
          ],
          "selected": false
        }
      ],
      "backend_options": [
        {
          "name": "Node.js with Express",
          "language": "JavaScript",
          "reasoning": "Node.js with Express provides a lightweight and efficient backend solution. JavaScript is used on both the frontend and backend, which can streamline development. Express simplifies routing and middleware management, making it easy to build a RESTful API.",
          "key_libraries": [
            "Express.js (web framework)",
            "body-parser (for parsing request bodies)",
            "cors (for handling CORS)",
            "bcrypt (for password hashing)"
          ],
          "pros": [
            "JavaScript on both frontend and backend (full-stack JavaScript)",
            "Large community and extensive documentation",
            "Fast development with Express",
            "Good performance with Node.js's non-blocking I/O"
          ],
          "cons": [
            "Callback hell can be an issue (though mitigated by async/await)",
            "Requires careful error handling"
          ],
          "selected": false
        },
        {
          "name": "Python with Flask",
          "language": "Python",
          "reasoning": "Flask is a microframework that is easy to learn and use. Python is a versatile language with a large community. Flask is suitable for building REST APIs and can be easily deployed.",
          "key_libraries": [
            "Flask (web framework)",
            "Flask-SQLAlchemy (for database interaction)",
            "bcrypt (for password hashing)",
            "Flask-CORS (for handling CORS)"
          ],
          "pros": [
            "Easy to learn and use",
            "Large community and extensive documentation",
            "Good for building REST APIs",
            "Python's readability"
          ],
          "cons": [
            "Slightly slower development speed compared to Node.js with Express",
            "Requires knowledge of Python"
          ],
          "selected": false
        },
        {
          "name": "Java with Spring Boot",
          "language": "Java",
          "reasoning": "Spring Boot simplifies the development of Java-based applications. It provides a robust framework for building REST APIs and managing dependencies. Java offers strong performance and scalability.",
          "key_libraries": [
            "Spring Boot (web framework)",
            "Spring Data JPA (for database interaction)",
            "BCryptPasswordEncoder (for password hashing)",
            "Spring Security (for authentication and authorization)"
          ],
          "pros": [
            "Robust and scalable",
            "Large community and extensive documentation",
            "Good performance",
            "Mature ecosystem"
          ],
          "cons": [
            "Steeper learning curve",
            "More verbose code compared to Node.js or Python"
          ],
          "selected": false
        }
      ],
      "database_options": [
        {
          "name": "PostgreSQL",
          "language": null,
          "reasoning": "PostgreSQL is a robust and reliable relational database. It offers strong data integrity and supports complex queries. It's a good choice for this project because it can handle the basic data storage needs and can scale if needed.",
          "key_libraries": [
            "psycopg2 (for Python)",
            "pg (for Node.js)",
            "JDBC driver (for Java)"
          ],
          "pros": [
            "ACID compliant",
            "Strong data integrity",
            "Good performance",
            "Scalable"
          ],
          "cons": [
            "Can be more complex to set up and manage than simpler databases"
          ],
          "selected": false
        },
        {
          "name": "MongoDB",
          "language": null,
          "reasoning": "MongoDB is a NoSQL database that is easy to use and flexible. It's a good choice for this project because it can handle the basic data storage needs and is easy to set up. It's schema-less nature allows for flexibility in the future.",
          "key_libraries": [
            "mongoose (for Node.js)",
            "pymongo (for Python)",
            "MongoDB Java Driver (for Java)"
          ],
          "pros": [
            "Flexible schema",
            "Easy to scale",
            "Good performance for read operations"
          ],
          "cons": [
            "Not ACID compliant by default",
            "Can be more complex to manage data integrity"
          ],
          "selected": false
        },
        {
          "name": "SQLite",
          "language": null,
          "reasoning": "SQLite is a lightweight, file-based database that is easy to set up and use. It's a good choice for this project because it's simple and requires no separate server. It's suitable for small projects with limited data.",
          "key_libraries": [
            "sqlite3 (built-in for Python)",
            "sqlite3 (for Node.js)",
            "JDBC driver (for Java)"
          ],
          "pros": [
            "Easy to set up and use",
            "No separate server required",
            "Good for small projects"
          ],
          "cons": [
            "Not suitable for high-traffic applications",
            "Limited scalability"
          ],
          "selected": false
        }
      ],
      "cloud_options": [
        {
          "name": "AWS (Amazon Web Services)",
          "language": null,
          "reasoning": "AWS offers a wide range of services for deploying and managing web applications. It provides scalability, security, and reliability. Services like EC2, S3, and RDS can be used to host the application, store static assets, and manage the database, respectively.",
          "key_libraries": [
            "AWS SDK (for interacting with AWS services)"
          ],
          "pros": [
            "Highly scalable and reliable",
            "Wide range of services",
            "Mature ecosystem",
            "Good security features"
          ],
          "cons": [
            "Can be complex to manage",
            "Can be expensive depending on usage",
            "Steeper learning curve"
          ],
          "selected": false
        },
        {
          "name": "Google Cloud Platform (GCP)",
          "language": null,
          "reasoning": "GCP provides a comprehensive set of cloud services, including compute, storage, and database options. It's known for its competitive pricing and strong support for containerization with Kubernetes. Services like Compute Engine, Cloud Storage, and Cloud SQL can be used to deploy and manage the application.",
          "key_libraries": [
            "Google Cloud Client Libraries (for interacting with GCP services)"
          ],
          "pros": [
            "Competitive pricing",
            "Strong support for containerization",
            "Good performance",
            "User-friendly interface"
          ],
          "cons": [
            "Can be complex to manage",
            "Requires understanding of GCP services"
          ],
          "selected": false
        },
        {
          "name": "Heroku",
          "language": null,
          "reasoning": "Heroku is a Platform-as-a-Service (PaaS) that simplifies the deployment and management of web applications. It supports various languages and frameworks and provides automatic scaling and deployment features. It's a good choice for this project because it simplifies deployment and management.",
          "key_libraries": [],
          "pros": [
            "Easy to deploy and manage",
            "Supports various languages and frameworks",
            "Automatic scaling",
            "Free tier available"
          ],
          "cons": [
            "Limited customization options",
            "Can be expensive for high-traffic applications",
            "Vendor lock-in"
          ],
          "selected": false
        }
      ],
      "architecture_options": [
        {
          "pattern": "Monolithic Architecture",
          "scalability_score": 5.0,
          "maintainability_score": 7.0,
          "development_speed_score": 9.0,
          "overall_score": 7.0,
          "reasoning": "For a simple task list application, a monolithic architecture is a good choice. It's easy to develop and deploy, and it simplifies the overall architecture. While it may not scale as well as other architectures, it's sufficient for the project's scope. Maintainability is good due to the single codebase."
        },
        {
          "pattern": "Microservices Architecture",
          "scalability_score": 8.0,
          "maintainability_score": 6.0,
          "development_speed_score": 5.0,
          "overall_score": 6.0,
          "reasoning": "Microservices architecture is overkill for this project. While it offers better scalability and maintainability in the long run, it adds complexity to the development and deployment process. The benefits of microservices are not needed for a simple task list application."
        },
        {
          "pattern": "Serverless Architecture",
          "scalability_score": 9.0,
          "maintainability_score": 7.0,
          "development_speed_score": 6.0,
          "overall_score": 7.0,
          "reasoning": "Serverless architecture can be a good option for this project, especially if using a PaaS like Heroku or cloud functions. It offers excellent scalability and reduces operational overhead. However, it can introduce complexities in debugging and monitoring, and might be overkill for the project's simplicity."
        }
      ],
      "tool_options": [
        {
          "name": "Git",
          "language": null,
          "reasoning": "Git is essential for version control and collaboration. It allows developers to track changes, revert to previous versions, and work together on the codebase.",
          "key_libraries": [],
          "pros": [
            "Version control",
            "Collaboration",
            "Branching and merging"
          ],
          "cons": [
            "Requires learning the Git commands"
          ],
          "selected": false
        },
        {
          "name": "VS Code",
          "language": null,
          "reasoning": "VS Code is a popular and versatile code editor. It offers features like syntax highlighting, code completion, debugging, and integration with Git. It supports a wide range of languages and frameworks.",
          "key_libraries": [],
          "pros": [
            "Free and open-source",
            "Extensible with plugins",
            "Good performance",
            "User-friendly interface"
          ],
          "cons": [
            "Can be resource-intensive with many plugins"
          ],
          "selected": false
        },
        {
          "name": "Postman",
          "language": null,
          "reasoning": "Postman is a tool for testing and documenting APIs. It allows developers to send HTTP requests, inspect responses, and create collections of API tests. It's useful for testing the backend API.",
          "key_libraries": [],
          "pros": [
            "Easy to test APIs",
            "Supports various HTTP methods",
            "Can create collections of API tests"
          ],
          "cons": [
            "Requires learning the Postman interface"
          ],
          "selected": false
        }
      ],
      "risks": [
        {
          "category": "Security",
          "description": "Vulnerabilities in dependencies could lead to security breaches. For example, outdated libraries may have known security flaws.",
          "severity": "Medium",
          "likelihood": "Medium",
          "mitigation": "Regularly update dependencies and use a vulnerability scanner to identify and address security issues."
        },
        {
          "category": "Performance",
          "description": "Inefficient database queries or poorly optimized code can lead to slow loading times, impacting user experience.",
          "severity": "Medium",
          "likelihood": "Medium",
          "mitigation": "Optimize database queries, use caching where appropriate, and profile the application to identify performance bottlenecks."
        },
        {
          "category": "Scalability",
          "description": "If the application becomes popular, the chosen database or backend might not scale efficiently to handle the increased load.",
          "severity": "Low",
          "likelihood": "Low",
          "mitigation": "Choose a database and backend that can scale. Consider using a cloud provider that offers auto-scaling features."
        }
      ],
      "synthesis": {
        "backend": {
          "language": "JavaScript",
          "framework": "Node.js with Express",
          "reasoning": "Node.js with Express provides a lightweight and efficient backend solution. JavaScript is used on both the frontend and backend, which can streamline development. Express simplifies routing and middleware management, making it easy to build a RESTful API."
        },
        "frontend": {
          "language": "JavaScript",
          "framework": "React",
          "reasoning": "React is a popular and efficient library for building user interfaces. It offers a component-based architecture, making it easy to manage and update the UI. Its virtual DOM and efficient update mechanisms contribute to fast loading times, addressing a key non-functional requirement."
        },
        "database": {
          "type": "PostgreSQL",
          "reasoning": "PostgreSQL is a robust and reliable relational database. It offers strong data integrity and supports complex queries. It's a good choice for this project because it can handle the basic data storage needs and can scale if needed."
        },
        "architecture_pattern": "Monolithic Architecture",
        "deployment_environment": {
          "cloud_provider": "AWS (Amazon Web Services)",
          "reasoning": "AWS offers a wide range of services for deploying and managing web applications. It provides scalability, security, and reliability. Services like EC2, S3, and RDS can be used to host the application, store static assets, and manage the database, respectively."
        },
        "key_libraries_tools": [
          {
            "name": "Git",
            "purpose": "Version control and collaboration"
          },
          {
            "name": "VS Code",
            "purpose": "Code editor with syntax highlighting, code completion, and debugging"
          },
          {
            "name": "Postman",
            "purpose": "API testing and documentation"
          }
        ],
        "estimated_complexity": "Low"
      },
      "selected_stack": null
    },
    "system_design": {
      "architecture": {
        "pattern": "Monolithic Architecture",
        "justification": "For a simple task list application, a monolithic architecture is a good choice. It's easy to develop and deploy, and it simplifies the overall architecture. While it may not scale as well as other architectures, it's sufficient for the project's scope. Maintainability is good due to the single codebase.",
        "key_benefits": [
          "Simple to develop and deploy",
          "Reduced operational overhead",
          "Single codebase for easier management"
        ],
        "potential_drawbacks": [
          "Limited scalability compared to microservices",
          "Can become difficult to manage as the application grows"
        ]
      },
      "components": [
        {
          "name": "Frontend",
          "description": "Handles user interaction and displays the task list.",
          "category": "frontend",
          "technologies": [
            "React",
            "JavaScript",
            "HTML",
            "CSS"
          ],
          "dependencies": [
            "Backend"
          ],
          "responsibilities": [
            "Displaying the task list",
            "Handling user input (adding tasks)",
            "Making API calls to the backend"
          ],
          "design_patterns": [
            "Component-based architecture"
          ]
        },
        {
          "name": "Backend",
          "description": "Provides an API for managing tasks and interacts with the database.",
          "category": "backend",
          "technologies": [
            "Node.js",
            "Express.js",
            "JavaScript",
            "PostgreSQL"
          ],
          "dependencies": [
            "Database"
          ],
          "responsibilities": [
            "Handling API requests",
            "Validating data",
            "Interacting with the database",
            "Implementing authentication and authorization (if required)"
          ],
          "design_patterns": [
            "RESTful API"
          ]
        },
        {
          "name": "Database",
          "description": "Stores the task data.",
          "category": "database",
          "technologies": [
            "PostgreSQL"
          ],
          "dependencies": [],
          "responsibilities": [
            "Storing task data",
            "Providing data access to the backend"
          ],
          "design_patterns": [
            "Relational database model"
          ]
        },
        {
          "name": "Deployment Infrastructure",
          "description": "Hosts the application and manages its resources.",
          "category": "infrastructure",
          "technologies": [
            "AWS (EC2, RDS, S3)",
            "Docker (optional)"
          ],
          "dependencies": [
            "Frontend",
            "Backend",
            "Database"
          ],
          "responsibilities": [
            "Hosting the frontend and backend",
            "Managing the database",
            "Providing security and scalability"
          ],
          "design_patterns": []
        }
      ],
      "data_model": {
        "schema_type": "Relational",
        "tables": [
          {
            "name": "tasks",
            "purpose": "Stores task information.",
            "fields": [
              {
                "name": "id",
                "type": "SERIAL",
                "constraints": [
                  "PRIMARY KEY"
                ],
                "description": "Unique identifier for the task."
              },
              {
                "name": "description",
                "type": "VARCHAR(255)",
                "constraints": [
                  "NOT NULL"
                ],
                "description": "Text description of the task."
              },
              {
                "name": "created_at",
                "type": "TIMESTAMP",
                "constraints": [
                  "NOT NULL",
                  "DEFAULT CURRENT_TIMESTAMP"
                ],
                "description": "Timestamp when the task was created."
              },
              {
                "name": "completed",
                "type": "BOOLEAN",
                "constraints": [
                  "DEFAULT FALSE"
                ],
                "description": "Indicates whether the task is completed."
              }
            ],
            "relationships": []
          }
        ],
        "relationships": [],
        "justification": "Relational database provides strong data integrity and is suitable for storing structured task data."
      },
      "api_endpoints": {
        "style": "REST",
        "base_url": "/api/v1",
        "authentication": "None (for initial implementation)",
        "endpoints": [
          {
            "method": "POST",
            "path": "/tasks",
            "purpose": "Create a new task.",
            "parameters": [
              {
                "description": "The task description",
                "type": "string",
                "name": "description"
              }
            ],
            "response": {
              "201": {
                "message": "Task created successfully",
                "task": {
                  "id": 1,
                  "description": "Example task",
                  "created_at": "2024-01-01T12:00:00.000Z",
                  "completed": false
                }
              },
              "400": {
                "message": "Bad Request - Invalid input"
              }
            },
            "authentication_required": false,
            "rate_limiting_applied": false
          },
          {
            "method": "GET",
            "path": "/tasks",
            "purpose": "Get all tasks.",
            "parameters": [],
            "response": {
              "200": {
                "tasks": [
                  {
                    "id": 1,
                    "description": "Example task",
                    "created_at": "2024-01-01T12:00:00.000Z",
                    "completed": false
                  }
                ]
              }
            },
            "authentication_required": false,
            "rate_limiting_applied": false
          },
          {
            "method": "PUT",
            "path": "/tasks/{id}",
            "purpose": "Update a task (e.g., mark as complete).",
            "parameters": [
              {
                "name": "id",
                "type": "integer",
                "description": "The ID of the task to update."
              },
              {
                "name": "completed",
                "type": "boolean",
                "description": "Whether the task is completed."
              }
            ],
            "response": {
              "200": {
                "message": "Task updated successfully",
                "task": {
                  "id": 1,
                  "description": "Example task",
                  "created_at": "2024-01-01T12:00:00.000Z",
                  "completed": true
                }
              },
              "400": {
                "message": "Bad Request - Invalid input"
              },
              "404": {
                "message": "Task not found"
              }
            },
            "authentication_required": false,
            "rate_limiting_applied": false
          },
          {
            "method": "DELETE",
            "path": "/tasks/{id}",
            "purpose": "Delete a task.",
            "parameters": [
              {
                "name": "id",
                "type": "integer",
                "description": "The ID of the task to delete."
              }
            ],
            "response": {
              "200": {
                "message": "Task deleted successfully"
              },
              "404": {
                "message": "Task not found"
              }
            },
            "authentication_required": false,
            "rate_limiting_applied": false
          }
        ],
        "error_handling": "Centralized error handling with appropriate HTTP status codes and informative error messages.",
        "rate_limiting_strategy": null
      },
      "security": {
        "authentication_method": "None (initially)",
        "authorization_strategy": "None (initially)",
        "data_encryption": {
          "at_rest": "PostgreSQL encryption at rest (if sensitive data is stored).",
          "in_transit": "HTTPS using SSL/TLS certificates."
        },
        "security_measures": [
          {
            "category": "Input Validation",
            "implementation": "Validate all user inputs on the backend to prevent injection attacks.",
            "mitigation": "SQL Injection, Cross-Site Scripting (XSS)",
            "priority": "High"
          },
          {
            "category": "Data Protection",
            "implementation": "Use HTTPS to encrypt data in transit.",
            "mitigation": "Man-in-the-middle attacks",
            "priority": "High"
          },
          {
            "category": "Dependency Management",
            "implementation": "Regularly update dependencies to patch security vulnerabilities.",
            "mitigation": "Vulnerabilities in dependencies",
            "priority": "Medium"
          },
          {
            "category": "Authentication",
            "implementation": "Implement authentication (e.g., JWT) for future enhancements.",
            "mitigation": "Unauthorized access",
            "priority": "Medium"
          },
          {
            "category": "Authorization",
            "implementation": "Implement authorization (e.g., role-based access control) for future enhancements.",
            "mitigation": "Unauthorized access",
            "priority": "Medium"
          }
        ],
        "vulnerability_mitigation_strategies": [
          "Input validation",
          "Output encoding",
          "Regular dependency updates",
          "Use of HTTPS"
        ],
        "compliance_standards": []
      },
      "scalability_and_performance": {
        "caching": "Implement caching (e.g., using Redis) for frequently accessed data.",
        "database_optimization": "Optimize database queries and use indexes.",
        "code_optimization": "Profile and optimize backend code for performance.",
        "load_balancing": "Consider load balancing if the application grows."
      },
      "deployment_strategy": {
        "environment": "AWS (EC2 for backend, RDS for database, S3 for static assets)",
        "deployment_process": "Automated deployment using CI/CD pipeline (e.g., using AWS CodePipeline or similar).",
        "containerization": "Consider using Docker for containerization to improve portability and consistency."
      },
      "monitoring_and_logging": {
        "logging": "Implement logging for both frontend and backend (e.g., using Winston or similar).",
        "monitoring": "Use monitoring tools (e.g., AWS CloudWatch) to monitor application performance and health.",
        "error_tracking": "Implement error tracking (e.g., using Sentry) to capture and analyze errors."
      },
      "error_handling_strategy": "Centralized error handling with appropriate HTTP status codes and informative error messages.",
      "development_phases_overview": [
        {
          "name": "Phase 1: Setup and Basic Functionality",
          "description": "Set up the development environment, implement the basic task creation and viewing functionality.",
          "priority": "High",
          "dependencies": [],
          "tasks": [
            "Set up React frontend",
            "Set up Node.js/Express backend",
            "Set up PostgreSQL database",
            "Implement API endpoints for creating and retrieving tasks",
            "Implement frontend UI for adding and displaying tasks",
            "Basic error handling"
          ],
          "estimated_duration": "2 weeks"
        },
        {
          "name": "Phase 2: Enhancements and Testing",
          "description": "Implement enhancements like task completion, and implement thorough testing.",
          "priority": "Medium",
          "dependencies": [
            "Phase 1: Setup and Basic Functionality"
          ],
          "tasks": [
            "Implement task completion functionality",
            "Implement unit tests for backend and frontend",
            "Implement integration tests",
            "Implement basic security measures (input validation, HTTPS)"
          ],
          "estimated_duration": "1 week"
        },
        {
          "name": "Phase 3: Deployment and Refinement",
          "description": "Deploy the application to AWS and refine the application based on user feedback.",
          "priority": "Medium",
          "dependencies": [
            "Phase 2: Enhancements and Testing"
          ],
          "tasks": [
            "Deploy the application to AWS (EC2, RDS, S3)",
            "Implement monitoring and logging",
            "Gather user feedback and iterate on the design",
            "Address any performance bottlenecks"
          ],
          "estimated_duration": "1 week"
        },
        {
          "name": "Phase 4: Advanced Features (Future)",
          "description": "Implement advanced features such as user authentication, authorization, and more.",
          "priority": "Low",
          "dependencies": [
            "Phase 3: Deployment and Refinement"
          ],
          "tasks": [
            "Implement user authentication (e.g., JWT)",
            "Implement authorization (e.g., role-based access control)",
            "Implement features like task editing and deletion",
            "Implement caching"
          ],
          "estimated_duration": "Ongoing"
        }
      ],
      "key_risks": [
        "Security vulnerabilities in dependencies.",
        "Performance bottlenecks due to inefficient database queries.",
        "Scalability limitations if the application grows significantly."
      ],
      "design_justification": "The design prioritizes simplicity and ease of development while addressing the core requirements. The monolithic architecture, combined with the chosen technologies, allows for rapid development and deployment. The use of AWS provides a scalable and reliable infrastructure. Security is addressed through best practices and future enhancements.",
      "data_flow": "1.  **User Interaction:** The user interacts with the React frontend, adding tasks through a form. 2.  **Frontend to Backend:** The frontend sends a POST request to the Express backend's `/tasks` endpoint with the task description. 3.  **Backend Processing:** The backend validates the input and interacts with the PostgreSQL database to create a new task record. 4.  **Database Interaction:** The backend uses a database library (e.g., `pg` for Node.js) to execute SQL queries to insert the task data into the `tasks` table. 5.  **Backend Response:** The backend sends a 201 Created response back to the frontend, including the newly created task data. 6.  **Frontend Display:** The frontend receives the response and updates the task list, displaying the new task to the user. 7.  **Retrieval of Tasks:** When the user loads the page or refreshes the task list, the frontend sends a GET request to the `/tasks` endpoint. 8.  **Backend Retrieval:** The backend queries the database for all tasks. 9.  **Backend Response:** The backend sends a 200 OK response with the task data to the frontend. 10. **Frontend Display:** The frontend displays the tasks in a list."
    },
    "implementation_plan": "plan=ImplementationPlan(project_summary={'title': 'Generated Project Plan', 'description': 'Develop a simple web application for managing a list of tasks, including adding, viewing, completing, and deleting tasks. The application will use React for the frontend, Node.js with Express for the backend, and PostgreSQL for the database. The application will be deployed on AWS.', 'overall_complexity': 'Medium', 'estimated_duration': 'TBD', 'key_challenges': [], 'success_criteria': []}, phases=[{'name': 'Frontend Phase', 'description': 'Tasks related to frontend phase', 'deliverables': ['Completed FE-001', 'Completed FE-002', 'Completed FE-003', 'Completed FE-004', 'Completed FE-005', 'Completed FE-006', 'Completed FE-007', 'Completed FE-008', 'Completed FE-009', 'Completed FE-010', 'Completed FE-011', 'Completed FE-012'], 'estimated_duration_hours': 58.0, 'work_items': [{'id': 'FE-001', 'description': 'Set up React project with Create React App.', 'dependencies': [], 'estimated_time': '4 hours', 'agent_role': 'frontend_developer', 'acceptance_criteria': ['Project initializes successfully.', 'Default React app runs without errors.'], 'status': 'pending', 'code_files': ['package.json', 'src/App.js', 'src/index.js']}, {'id': 'FE-002', 'description': 'Create basic UI layout with a header and a task list container.', 'dependencies': ['FE-001'], 'estimated_time': '4 hours', 'agent_role': 'frontend_developer', 'acceptance_criteria': ['Header displays correctly.', 'Task list container is present.', 'UI is responsive.'], 'status': 'pending', 'code_files': ['src/App.js', 'src/App.css']}, {'id': 'FE-003', 'description': 'Implement a form for adding new tasks (input field and submit button).', 'dependencies': ['FE-002'], 'estimated_time': '4 hours', 'agent_role': 'frontend_developer', 'acceptance_criteria': ['Form renders correctly.', 'Input field accepts text.', 'Submit button is present.'], 'status': 'pending', 'code_files': ['src/App.js', 'src/App.css']}, {'id': 'FE-004', 'description': 'Implement state management for the task list (using useState).', 'dependencies': ['FE-003'], 'estimated_time': '4 hours', 'agent_role': 'frontend_developer', 'acceptance_criteria': ['Tasks are stored in component state.', 'State updates trigger UI re-renders.'], 'status': 'pending', 'code_files': ['src/App.js']}, {'id': 'FE-005', 'description': \"Implement the 'add task' functionality (on form submit).\", 'dependencies': ['FE-004'], 'estimated_time': '4 hours', 'agent_role': 'frontend_developer', 'acceptance_criteria': ['New tasks are added to the task list state.', 'Input field is cleared after submission.'], 'status': 'pending', 'code_files': ['src/App.js']}, {'id': 'FE-006', 'description': 'Display the task list items.', 'dependencies': ['FE-004'], 'estimated_time': '4 hours', 'agent_role': 'frontend_developer', 'acceptance_criteria': ['Tasks are displayed in a list.', 'Each task displays its description.'], 'status': 'pending', 'code_files': ['src/App.js', 'src/App.css']}, {'id': 'FE-007', 'description': 'Implement API calls to the backend (GET /tasks).', 'dependencies': ['FE-006', 'BE-004'], 'estimated_time': '6 hours', 'agent_role': 'frontend_developer', 'acceptance_criteria': ['Frontend fetches tasks from the backend on component mount.', 'Tasks are displayed from the API response.', 'Error handling for API calls is implemented.'], 'status': 'pending', 'code_files': ['src/App.js']}, {'id': 'FE-008', 'description': 'Implement API calls to the backend (POST /tasks).', 'dependencies': ['FE-005', 'BE-005'], 'estimated_time': '6 hours', 'agent_role': 'frontend_developer', 'acceptance_criteria': ['Frontend sends a POST request to create a new task.', 'Frontend updates the task list after a successful API call.', 'Error handling for API calls is implemented.'], 'status': 'pending', 'code_files': ['src/App.js']}, {'id': 'FE-009', 'description': 'Implement basic styling for the task list.', 'dependencies': ['FE-006'], 'estimated_time': '4 hours', 'agent_role': 'frontend_developer', 'acceptance_criteria': ['Tasks are styled for readability.', 'UI is visually appealing.'], 'status': 'pending', 'code_files': ['src/App.css']}, {'id': 'FE-010', 'description': 'Implement task completion functionality (checkbox).', 'dependencies': ['FE-006', 'BE-006'], 'estimated_time': '6 hours', 'agent_role': 'frontend_developer', 'acceptance_criteria': ['Each task has a checkbox to mark it as complete.', 'Clicking the checkbox sends a PUT request to the backend.', 'Task list updates to reflect the completion status.', 'Error handling for API calls is implemented.'], 'status': 'pending', 'code_files': ['src/App.js']}, {'id': 'FE-011', 'description': 'Implement task deletion functionality (button).', 'dependencies': ['FE-006', 'BE-007'], 'estimated_time': '4 hours', 'agent_role': 'frontend_developer', 'acceptance_criteria': ['Each task has a delete button.', 'Clicking the button sends a DELETE request to the backend.', 'Task list updates to remove the deleted task.', 'Error handling for API calls is implemented.'], 'status': 'pending', 'code_files': ['src/App.js']}, {'id': 'FE-012', 'description': 'Implement unit tests for frontend components.', 'dependencies': ['FE-001', 'FE-002', 'FE-003', 'FE-004', 'FE-005', 'FE-006', 'FE-007', 'FE-008', 'FE-010', 'FE-011'], 'estimated_time': '8 hours', 'agent_role': 'frontend_developer', 'acceptance_criteria': ['Tests cover key functionality of each component.', 'Tests pass successfully.', 'Test coverage meets the defined threshold.'], 'status': 'pending', 'code_files': ['src/App.test.js']}]}, {'name': 'Backend Phase', 'description': 'Tasks related to backend phase', 'deliverables': ['Completed BE-001', 'Completed BE-002', 'Completed BE-004', 'Completed BE-005', 'Completed BE-006', 'Completed BE-007', 'Completed BE-008', 'Completed SEC-001'], 'estimated_duration_hours': 40.0, 'work_items': [{'id': 'BE-001', 'description': 'Set up Node.js project with Express.', 'dependencies': [], 'estimated_time': '4 hours', 'agent_role': 'backend_developer', 'acceptance_criteria': ['Project initializes successfully.', 'Express server runs without errors.'], 'status': 'pending', 'code_files': ['package.json', 'index.js']}, {'id': 'BE-002', 'description': 'Install and configure necessary dependencies (body-parser, cors).', 'dependencies': ['BE-001'], 'estimated_time': '2 hours', 'agent_role': 'backend_developer', 'acceptance_criteria': ['Dependencies are installed.', 'CORS is configured to allow requests from the frontend.'], 'status': 'pending', 'code_files': ['package.json', 'index.js']}, {'id': 'BE-004', 'description': 'Implement the GET /tasks endpoint (retrieve all tasks).', 'dependencies': ['BE-002', 'BE-003'], 'estimated_time': '6 hours', 'agent_role': 'backend_developer', 'acceptance_criteria': ['Endpoint returns a 200 status code.', 'Endpoint retrieves all tasks from the database.', 'Tasks are returned in JSON format.'], 'status': 'pending', 'code_files': ['index.js']}, {'id': 'BE-005', 'description': 'Implement the POST /tasks endpoint (create a new task).', 'dependencies': ['BE-002', 'BE-003'], 'estimated_time': '6 hours', 'agent_role': 'backend_developer', 'acceptance_criteria': ['Endpoint returns a 201 status code on success.', 'Endpoint saves the new task to the database.', 'Endpoint returns the created task in JSON format.', 'Input validation is implemented.'], 'status': 'pending', 'code_files': ['index.js']}, {'id': 'BE-006', 'description': 'Implement the PUT /tasks/{id} endpoint (mark task as complete).', 'dependencies': ['BE-004', 'BE-003'], 'estimated_time': '6 hours', 'agent_role': 'backend_developer', 'acceptance_criteria': ['Endpoint returns a 200 status code on success.', \"Endpoint updates the 'completed' status in the database.\", 'Endpoint returns the updated task in JSON format.', 'Input validation is implemented.', 'Handles task not found (404).'], 'status': 'pending', 'code_files': ['index.js']}, {'id': 'BE-007', 'description': 'Implement the DELETE /tasks/{id} endpoint (delete a task).', 'dependencies': ['BE-004', 'BE-003'], 'estimated_time': '4 hours', 'agent_role': 'backend_developer', 'acceptance_criteria': ['Endpoint returns a 200 status code on success.', 'Endpoint deletes the task from the database.', 'Handles task not found (404).'], 'status': 'pending', 'code_files': ['index.js']}, {'id': 'BE-008', 'description': 'Implement unit tests for backend API endpoints.', 'dependencies': ['BE-004', 'BE-005', 'BE-006', 'BE-007'], 'estimated_time': '8 hours', 'agent_role': 'backend_developer', 'acceptance_criteria': ['Tests cover key functionality of each endpoint.', 'Tests pass successfully.', 'Test coverage meets the defined threshold.'], 'status': 'pending', 'code_files': ['test/index.test.js']}, {'id': 'SEC-001', 'description': 'Implement input validation on the backend.', 'dependencies': ['BE-005'], 'estimated_time': '4 hours', 'agent_role': 'backend_developer', 'acceptance_criteria': ['Input validation is implemented for all POST and PUT requests.', 'Invalid input results in a 400 Bad Request response.'], 'status': 'pending', 'code_files': ['index.js']}]}, {'name': 'Database Phase', 'description': 'Tasks related to database phase', 'deliverables': ['Completed BE-003'], 'estimated_duration_hours': 6.0, 'work_items': [{'id': 'BE-003', 'description': \"Set up PostgreSQL database and create the 'tasks' table.\", 'dependencies': [], 'estimated_time': '6 hours', 'agent_role': 'database_specialist', 'acceptance_criteria': ['Database connection is successful.', \"'tasks' table exists with 'id', 'description', 'created_at', and 'completed' columns.\", 'Database schema matches the data model.'], 'status': 'pending', 'code_files': ['db.sql']}]}, {'name': 'Devops_Engineer Phase', 'description': 'Tasks related to devops_engineer phase', 'deliverables': ['Completed INF-001', 'Completed INF-002', 'Completed INF-003', 'Completed INF-004', 'Completed SEC-002'], 'estimated_duration_hours': 40.0, 'work_items': [{'id': 'INF-001', 'description': 'Set up AWS infrastructure (EC2, RDS, S3).', 'dependencies': ['BE-003', 'BE-004', 'BE-005', 'BE-006', 'BE-007', 'FE-007', 'FE-008', 'FE-010', 'FE-011'], 'estimated_time': '16 hours', 'agent_role': 'devops_engineer', 'acceptance_criteria': ['EC2 instance is running.', 'RDS database is accessible.', 'S3 bucket is created.', 'Security groups are configured correctly.'], 'status': 'pending', 'code_files': ['terraform/main.tf']}, {'id': 'INF-002', 'description': 'Deploy backend to EC2 instance.', 'dependencies': ['INF-001', 'BE-004', 'BE-005', 'BE-006', 'BE-007'], 'estimated_time': '8 hours', 'agent_role': 'devops_engineer', 'acceptance_criteria': ['Backend is running on the EC2 instance.', 'Backend is accessible via the public IP address.', 'Database connection is successful.'], 'status': 'pending', 'code_files': ['Dockerfile', 'docker-compose.yml']}, {'id': 'INF-003', 'description': 'Deploy frontend to S3 and configure CloudFront.', 'dependencies': ['INF-001', 'FE-007', 'FE-008', 'FE-010', 'FE-011'], 'estimated_time': '8 hours', 'agent_role': 'devops_engineer', 'acceptance_criteria': ['Frontend is accessible via the CloudFront distribution.', 'Frontend makes API calls to the backend.', 'HTTPS is enabled.'], 'status': 'pending', 'code_files': []}, {'id': 'INF-004', 'description': 'Implement basic logging and monitoring (CloudWatch).', 'dependencies': ['INF-002', 'INF-003'], 'estimated_time': '4 hours', 'agent_role': 'devops_engineer', 'acceptance_criteria': ['Logs are collected from the backend.', 'Basic metrics are collected (e.g., CPU usage, database connections).', 'Alerts are configured for critical errors.'], 'status': 'pending', 'code_files': []}, {'id': 'SEC-002', 'description': 'Implement HTTPS for the frontend.', 'dependencies': ['INF-003'], 'estimated_time': '4 hours', 'agent_role': 'devops_engineer', 'acceptance_criteria': ['Frontend is served over HTTPS.', 'SSL/TLS certificate is configured correctly.'], 'status': 'pending', 'code_files': []}]}], resource_allocation=[{'role': 'Backend Developer', 'count': 1, 'estimated_time_allocation': '100%', 'phases': ['Backend Phase'], 'skills_required': []}, {'role': 'Frontend Developer', 'count': 1, 'estimated_time_allocation': '100%', 'phases': ['Frontend Phase'], 'skills_required': []}, {'role': 'Database Specialist', 'count': 1, 'estimated_time_allocation': '100%', 'phases': ['Database Phase'], 'skills_required': []}, {'role': 'Devops Engineer', 'count': 1, 'estimated_time_allocation': '100%', 'phases': ['Devops_Engineer Phase'], 'skills_required': []}], risks_and_mitigations=[], timeline={'start_date': '2025-07-08T14:02:33.467167', 'end_date': 'TBD', 'milestones': []}, tech_stack={}, metadata={'generated_at': '2025-07-08T14:02:33.467167', 'version': '1.0', 'author': 'Multi-AI Dev System', 'tags': [], 'notes': 'Converted from WorkItemBacklog. Original summary: Develop a simple web application for managing a list of tasks, including adding, viewing, completing, and deleting tasks. The application will use React for the frontend, Node.js with Express for the backend, and PostgreSQL for the database. The application will be deployed on AWS.'}) summary='Develop a simple web application for managing a list of tasks, including adding, viewing, completing, and deleting tasks. The application will use React for the frontend, Node.js with Express for the backend, and PostgreSQL for the database. The application will be deployed on AWS.' metadata=PlanMetadata(generated_at='2025-07-08T14:02:33.467167', version='1.0', author='Multi-AI Dev System', tags=[], notes='Converted from WorkItemBacklog. Original summary: Develop a simple web application for managing a list of tasks, including adding, viewing, completing, and deleting tasks. The application will use React for the frontend, Node.js with Express for the backend, and PostgreSQL for the database. The application will be deployed on AWS.')"
  }
}