{
  "session_id": "session_53d931ca-2aaf-43b4-8505-ebfb232dc197",
  "approval_type": "implementation_plan",
  "timestamp": 1751995697,
  "approval_data": {
    "type": "implementation_plan",
    "timestamp": 1751995697.6560147,
    "project_overview": "Develop a simple web application for managing a list of tasks, using React for the frontend, FastAPI for the backend, and PostgreSQL for data storage. The application will allow users to add and view tasks, with future enhancements including user authentication, task editing, and task completion. The project will be deployed to a cloud environment with monitoring and logging implemented.",
    "development_phases": [
      {
        "name": "Frontend Phase",
        "description": "Tasks related to frontend phase",
        "deliverables": [
          "Completed FE-001",
          "Completed FE-002",
          "Completed FE-003",
          "Completed FE-004",
          "Completed FE-005",
          "Completed TEST-002",
          "Completed FE-007",
          "Completed FE-008"
        ],
        "estimated_duration_hours": 96.0,
        "work_items": [
          {
            "id": "FE-001",
            "description": "Set up React project with TypeScript.",
            "dependencies": [],
            "estimated_time": "1 day",
            "agent_role": "frontend_developer",
            "acceptance_criteria": [
              "Project is initialized using Create React App with TypeScript.",
              "Project builds successfully.",
              "Basic project structure is in place."
            ],
            "status": "pending",
            "code_files": [
              "package.json",
              "tsconfig.json",
              "src/App.tsx",
              "src/index.tsx"
            ]
          },
          {
            "id": "FE-002",
            "description": "Develop the frontend UI for adding and viewing tasks.",
            "dependencies": [
              "FE-001"
            ],
            "estimated_time": "2 days",
            "agent_role": "frontend_developer",
            "acceptance_criteria": [
              "UI displays a form to enter a task description.",
              "UI displays a list of tasks.",
              "UI updates the task list after a new task is added.",
              "UI handles empty task list gracefully."
            ],
            "status": "pending",
            "code_files": [
              "src/App.tsx",
              "src/components/TaskForm.tsx",
              "src/components/TaskList.tsx",
              "src/App.css"
            ]
          },
          {
            "id": "FE-003",
            "description": "Connect the frontend to the backend API.",
            "dependencies": [
              "FE-002",
              "BE-002",
              "BE-003"
            ],
            "estimated_time": "1 day",
            "agent_role": "frontend_developer",
            "acceptance_criteria": [
              "Frontend makes POST requests to /tasks to add new tasks.",
              "Frontend makes GET requests to /tasks to retrieve tasks.",
              "Frontend displays tasks retrieved from the API.",
              "Error handling for API calls is implemented."
            ],
            "status": "pending",
            "code_files": [
              "src/App.tsx",
              "src/api/tasks.ts"
            ]
          },
          {
            "id": "FE-004",
            "description": "Improve the UI/UX.",
            "dependencies": [
              "FE-002"
            ],
            "estimated_time": "1 day",
            "agent_role": "frontend_developer",
            "acceptance_criteria": [
              "UI is visually appealing and user-friendly.",
              "UI provides clear feedback to the user (e.g., loading indicators, success messages).",
              "UI is responsive and works well on different screen sizes."
            ],
            "status": "pending",
            "code_files": [
              "src/App.tsx",
              "src/components/TaskForm.tsx",
              "src/components/TaskList.tsx",
              "src/App.css"
            ]
          },
          {
            "id": "FE-005",
            "description": "Implement basic error handling in the frontend.",
            "dependencies": [
              "FE-003"
            ],
            "estimated_time": "1 day",
            "agent_role": "frontend_developer",
            "acceptance_criteria": [
              "Frontend displays error messages to the user when API calls fail.",
              "Frontend handles network errors gracefully.",
              "Frontend provides feedback to the user on API call status."
            ],
            "status": "pending",
            "code_files": [
              "src/App.tsx",
              "src/api/tasks.ts"
            ]
          },
          {
            "id": "TEST-002",
            "description": "Write unit tests for frontend components.",
            "dependencies": [
              "FE-002",
              "FE-003"
            ],
            "estimated_time": "2 days",
            "agent_role": "frontend_developer",
            "acceptance_criteria": [
              "Unit tests are written for the TaskForm component.",
              "Unit tests are written for the TaskList component.",
              "Tests cover various scenarios (user input, API interactions, display logic).",
              "Tests achieve good code coverage."
            ],
            "status": "pending",
            "code_files": [
              "src/components/TaskForm.test.tsx",
              "src/components/TaskList.test.tsx"
            ]
          },
          {
            "id": "FE-007",
            "description": "Implement task editing functionality.",
            "dependencies": [
              "FE-003",
              "BE-002",
              "BE-003"
            ],
            "estimated_time": "2 days",
            "agent_role": "frontend_developer",
            "acceptance_criteria": [
              "User can edit the description of an existing task.",
              "Changes are saved to the database.",
              "Task list is updated after editing."
            ],
            "status": "pending",
            "code_files": [
              "src/App.tsx",
              "src/components/TaskForm.tsx",
              "src/components/TaskList.tsx",
              "src/api/tasks.ts"
            ]
          },
          {
            "id": "FE-008",
            "description": "Implement task completion functionality.",
            "dependencies": [
              "FE-003",
              "BE-002",
              "BE-003"
            ],
            "estimated_time": "2 days",
            "agent_role": "frontend_developer",
            "acceptance_criteria": [
              "User can mark a task as complete.",
              "Task completion status is saved to the database.",
              "Task list is updated to reflect the completion status."
            ],
            "status": "pending",
            "code_files": [
              "src/App.tsx",
              "src/components/TaskList.tsx",
              "src/api/tasks.ts"
            ]
          }
        ]
      },
      {
        "name": "Backend Phase",
        "description": "Tasks related to backend phase",
        "deliverables": [
          "Completed BE-001",
          "Completed BE-002",
          "Completed BE-003",
          "Completed BE-004",
          "Completed BE-005",
          "Completed BE-006",
          "Completed TEST-001",
          "Completed FE-006"
        ],
        "estimated_duration_hours": 96.0,
        "work_items": [
          {
            "id": "BE-001",
            "description": "Set up FastAPI project.",
            "dependencies": [],
            "estimated_time": "1 day",
            "agent_role": "backend_developer",
            "acceptance_criteria": [
              "FastAPI project is initialized.",
              "Dependencies (FastAPI, Uvicorn, etc.) are installed.",
              "A basic 'Hello World' endpoint is created and functional."
            ],
            "status": "pending",
            "code_files": [
              "main.py",
              "requirements.txt"
            ]
          },
          {
            "id": "BE-002",
            "description": "Implement the /tasks POST endpoint.",
            "dependencies": [
              "BE-001",
              "DB-001"
            ],
            "estimated_time": "2 days",
            "agent_role": "backend_developer",
            "acceptance_criteria": [
              "Endpoint accepts a POST request to /tasks.",
              "Endpoint validates the 'description' parameter.",
              "Endpoint saves the task to the database.",
              "Endpoint returns a 201 Created status code on success with the created task data.",
              "Endpoint returns a 400 Bad Request status code on invalid input."
            ],
            "status": "pending",
            "code_files": [
              "main.py",
              "database/crud.py"
            ]
          },
          {
            "id": "BE-003",
            "description": "Implement the /tasks GET endpoint.",
            "dependencies": [
              "BE-001",
              "DB-001"
            ],
            "estimated_time": "1 day",
            "agent_role": "backend_developer",
            "acceptance_criteria": [
              "Endpoint accepts a GET request to /tasks.",
              "Endpoint retrieves all tasks from the database.",
              "Endpoint returns a 200 OK status code with a JSON list of tasks."
            ],
            "status": "pending",
            "code_files": [
              "main.py",
              "database/crud.py"
            ]
          },
          {
            "id": "BE-004",
            "description": "Implement input validation on the backend.",
            "dependencies": [
              "BE-002"
            ],
            "estimated_time": "1 day",
            "agent_role": "backend_developer",
            "acceptance_criteria": [
              "Backend validates the 'description' field to prevent empty strings.",
              "Backend validates the 'description' field to prevent excessively long strings.",
              "Backend returns appropriate error messages for invalid input."
            ],
            "status": "pending",
            "code_files": [
              "main.py",
              "database/schemas.py"
            ]
          },
          {
            "id": "BE-005",
            "description": "Configure HTTPS.",
            "dependencies": [],
            "estimated_time": "1 day",
            "agent_role": "backend_developer",
            "acceptance_criteria": [
              "HTTPS is configured for the backend API (e.g., using a reverse proxy like Nginx or a cloud provider's HTTPS configuration).",
              "All communication between frontend and backend uses HTTPS."
            ],
            "status": "pending",
            "code_files": [
              "Dockerfile",
              "nginx.conf"
            ]
          },
          {
            "id": "BE-006",
            "description": "Implement basic error handling.",
            "dependencies": [
              "BE-002",
              "BE-003"
            ],
            "estimated_time": "1 day",
            "agent_role": "backend_developer",
            "acceptance_criteria": [
              "Backend handles database connection errors.",
              "Backend handles internal server errors and returns appropriate HTTP status codes.",
              "Error responses include informative error messages."
            ],
            "status": "pending",
            "code_files": [
              "main.py"
            ]
          },
          {
            "id": "TEST-001",
            "description": "Write unit tests for backend API endpoints.",
            "dependencies": [
              "BE-002",
              "BE-003"
            ],
            "estimated_time": "2 days",
            "agent_role": "backend_developer",
            "acceptance_criteria": [
              "Unit tests are written for the /tasks POST endpoint.",
              "Unit tests are written for the /tasks GET endpoint.",
              "Tests cover various scenarios (success, failure, edge cases).",
              "Tests achieve good code coverage."
            ],
            "status": "pending",
            "code_files": [
              "tests/test_main.py"
            ]
          },
          {
            "id": "FE-006",
            "description": "Implement user authentication (JWT or API Keys).",
            "dependencies": [
              "DEPLOY-002"
            ],
            "estimated_time": "3 days",
            "agent_role": "backend_developer",
            "acceptance_criteria": [
              "User registration and login functionality is implemented.",
              "JWT or API Key based authentication is implemented.",
              "Protected routes are implemented."
            ],
            "status": "pending",
            "code_files": [
              "main.py",
              "database/models.py",
              "database/schemas.py"
            ]
          }
        ]
      },
      {
        "name": "Database Phase",
        "description": "Tasks related to database phase",
        "deliverables": [
          "Completed DB-001"
        ],
        "estimated_duration_hours": 8.0,
        "work_items": [
          {
            "id": "DB-001",
            "description": "Design and implement the database schema (PostgreSQL).",
            "dependencies": [],
            "estimated_time": "1 day",
            "agent_role": "database_specialist",
            "acceptance_criteria": [
              "PostgreSQL database is set up.",
              "Tasks table is created with id (SERIAL PRIMARY KEY), description (VARCHAR(255) NOT NULL), and created_at (TIMESTAMP DEFAULT CURRENT_TIMESTAMP NOT NULL) columns.",
              "Database connection is established."
            ],
            "status": "pending",
            "code_files": [
              "database/schema.sql",
              "database/models.py"
            ]
          }
        ]
      },
      {
        "name": "Devops_Engineer Phase",
        "description": "Tasks related to devops_engineer phase",
        "deliverables": [
          "Completed DEPLOY-001",
          "Completed DEPLOY-002",
          "Completed DEPLOY-003",
          "Completed MONITOR-001"
        ],
        "estimated_duration_hours": 40.0,
        "work_items": [
          {
            "id": "DEPLOY-001",
            "description": "Deploy the frontend to a static hosting service.",
            "dependencies": [
              "FE-005"
            ],
            "estimated_time": "1 day",
            "agent_role": "devops_engineer",
            "acceptance_criteria": [
              "Frontend is built for production.",
              "Frontend is deployed to a static hosting service (e.g., Netlify, Vercel, AWS S3).",
              "Frontend is accessible via a public URL."
            ],
            "status": "pending",
            "code_files": []
          },
          {
            "id": "DEPLOY-002",
            "description": "Deploy the backend to a cloud platform.",
            "dependencies": [
              "BE-006",
              "DB-001"
            ],
            "estimated_time": "2 days",
            "agent_role": "devops_engineer",
            "acceptance_criteria": [
              "Backend is containerized (e.g., using Docker).",
              "Backend is deployed to a cloud platform (e.g., AWS ECS, Google Cloud Run, Azure Container Instances).",
              "Backend is accessible via a public URL or internal network."
            ],
            "status": "pending",
            "code_files": [
              "Dockerfile"
            ]
          },
          {
            "id": "DEPLOY-003",
            "description": "Set up database deployment.",
            "dependencies": [
              "DB-001"
            ],
            "estimated_time": "1 day",
            "agent_role": "devops_engineer",
            "acceptance_criteria": [
              "PostgreSQL database is deployed to a managed service (e.g., AWS RDS, Google Cloud SQL, Azure Database for PostgreSQL).",
              "Database is accessible from the backend application."
            ],
            "status": "pending",
            "code_files": []
          },
          {
            "id": "MONITOR-001",
            "description": "Configure logging and monitoring.",
            "dependencies": [
              "DEPLOY-002"
            ],
            "estimated_time": "1 day",
            "agent_role": "devops_engineer",
            "acceptance_criteria": [
              "Logging is configured for both frontend and backend (e.g., using a logging aggregation service).",
              "Monitoring is set up to track key metrics (e.g., response times, error rates).",
              "Alerting is configured for critical errors."
            ],
            "status": "pending",
            "code_files": []
          }
        ]
      },
      {
        "name": "Qa_Engineer Phase",
        "description": "Tasks related to qa_engineer phase",
        "deliverables": [
          "Completed TEST-003"
        ],
        "estimated_duration_hours": 8.0,
        "work_items": [
          {
            "id": "TEST-003",
            "description": "Perform initial testing in the deployed environment.",
            "dependencies": [
              "DEPLOY-001",
              "DEPLOY-002",
              "DEPLOY-003"
            ],
            "estimated_time": "1 day",
            "agent_role": "qa_engineer",
            "acceptance_criteria": [
              "The application is tested in the deployed environment.",
              "All core functionalities are working as expected.",
              "Performance and security are verified."
            ],
            "status": "pending",
            "code_files": []
          }
        ]
      }
    ],
    "timeline_estimation": {
      "start_date": "2025-07-08T22:58:16.251486",
      "end_date": "TBD",
      "milestones": []
    },
    "risk_assessment": [],
    "resource_requirements": [
      {
        "role": "Devops Engineer",
        "count": 1,
        "estimated_time_allocation": "100%",
        "phases": [
          "Devops_Engineer Phase"
        ],
        "skills_required": []
      },
      {
        "role": "Frontend Developer",
        "count": 1,
        "estimated_time_allocation": "100%",
        "phases": [
          "Frontend Phase"
        ],
        "skills_required": []
      },
      {
        "role": "Database Specialist",
        "count": 1,
        "estimated_time_allocation": "100%",
        "phases": [
          "Database Phase"
        ],
        "skills_required": []
      },
      {
        "role": "Qa Engineer",
        "count": 1,
        "estimated_time_allocation": "100%",
        "phases": [
          "Qa_Engineer Phase"
        ],
        "skills_required": []
      },
      {
        "role": "Backend Developer",
        "count": 1,
        "estimated_time_allocation": "100%",
        "phases": [
          "Backend Phase"
        ],
        "skills_required": []
      }
    ],
    "deliverables": [
      "Completed FE-001",
      "Completed FE-002",
      "Completed FE-003",
      "Completed FE-004",
      "Completed FE-005",
      "Completed TEST-002",
      "Completed FE-007",
      "Completed FE-008",
      "Completed BE-001",
      "Completed BE-002",
      "Completed BE-003",
      "Completed BE-004",
      "Completed BE-005",
      "Completed BE-006",
      "Completed TEST-001",
      "Completed FE-006",
      "Completed DB-001",
      "Completed DEPLOY-001",
      "Completed DEPLOY-002",
      "Completed DEPLOY-003",
      "Completed MONITOR-001",
      "Completed TEST-003"
    ],
    "dependencies": [],
    "raw_plan": "plan=ImplementationPlan(project_summary={'title': 'Generated Project Plan', 'description': 'Develop a simple web application for managing a list of tasks, using React for the frontend, FastAPI for the backend, and PostgreSQL for data storage. The application will allow users to add and view tasks, with future enhancements including user authentication, task editing, and task completion. The project will be deployed to a cloud environment with monitoring and logging implemented.', 'overall_complexity': 'Medium', 'estimated_duration': 'TBD', 'key_challenges': [], 'success_criteria': []}, phases=[{'name': 'Frontend Phase', 'description': 'Tasks related to frontend phase', 'deliverables': ['Completed FE-001', 'Completed FE-002', 'Completed FE-003', 'Completed FE-004', 'Completed FE-005', 'Completed TEST-002', 'Completed FE-007', 'Completed FE-008'], 'estimated_duration_hours': 96.0, 'work_items': [{'id': 'FE-001', 'description': 'Set up React project with TypeScript.', 'dependencies': [], 'estimated_time': '1 day', 'agent_role': 'frontend_developer', 'acceptance_criteria': ['Project is initialized using Create React App with TypeScript.', 'Project builds successfully.', 'Basic project structure is in place.'], 'status': 'pending', 'code_files': ['package.json', 'tsconfig.json', 'src/App.tsx', 'src/index.tsx']}, {'id': 'FE-002', 'description': 'Develop the frontend UI for adding and viewing tasks.', 'dependencies': ['FE-001'], 'estimated_time': '2 days', 'agent_role': 'frontend_developer', 'acceptance_criteria': ['UI displays a form to enter a task description.', 'UI displays a list of tasks.', 'UI updates the task list after a new task is added.', 'UI handles empty task list gracefully.'], 'status': 'pending', 'code_files': ['src/App.tsx', 'src/components/TaskForm.tsx', 'src/components/TaskList.tsx', 'src/App.css']}, {'id': 'FE-003', 'description': 'Connect the frontend to the backend API.', 'dependencies': ['FE-002', 'BE-002', 'BE-003'], 'estimated_time': '1 day', 'agent_role': 'frontend_developer', 'acceptance_criteria': ['Frontend makes POST requests to /tasks to add new tasks.', 'Frontend makes GET requests to /tasks to retrieve tasks.', 'Frontend displays tasks retrieved from the API.', 'Error handling for API calls is implemented.'], 'status': 'pending', 'code_files': ['src/App.tsx', 'src/api/tasks.ts']}, {'id': 'FE-004', 'description': 'Improve the UI/UX.', 'dependencies': ['FE-002'], 'estimated_time': '1 day', 'agent_role': 'frontend_developer', 'acceptance_criteria': ['UI is visually appealing and user-friendly.', 'UI provides clear feedback to the user (e.g., loading indicators, success messages).', 'UI is responsive and works well on different screen sizes.'], 'status': 'pending', 'code_files': ['src/App.tsx', 'src/components/TaskForm.tsx', 'src/components/TaskList.tsx', 'src/App.css']}, {'id': 'FE-005', 'description': 'Implement basic error handling in the frontend.', 'dependencies': ['FE-003'], 'estimated_time': '1 day', 'agent_role': 'frontend_developer', 'acceptance_criteria': ['Frontend displays error messages to the user when API calls fail.', 'Frontend handles network errors gracefully.', 'Frontend provides feedback to the user on API call status.'], 'status': 'pending', 'code_files': ['src/App.tsx', 'src/api/tasks.ts']}, {'id': 'TEST-002', 'description': 'Write unit tests for frontend components.', 'dependencies': ['FE-002', 'FE-003'], 'estimated_time': '2 days', 'agent_role': 'frontend_developer', 'acceptance_criteria': ['Unit tests are written for the TaskForm component.', 'Unit tests are written for the TaskList component.', 'Tests cover various scenarios (user input, API interactions, display logic).', 'Tests achieve good code coverage.'], 'status': 'pending', 'code_files': ['src/components/TaskForm.test.tsx', 'src/components/TaskList.test.tsx']}, {'id': 'FE-007', 'description': 'Implement task editing functionality.', 'dependencies': ['FE-003', 'BE-002', 'BE-003'], 'estimated_time': '2 days', 'agent_role': 'frontend_developer', 'acceptance_criteria': ['User can edit the description of an existing task.', 'Changes are saved to the database.', 'Task list is updated after editing.'], 'status': 'pending', 'code_files': ['src/App.tsx', 'src/components/TaskForm.tsx', 'src/components/TaskList.tsx', 'src/api/tasks.ts']}, {'id': 'FE-008', 'description': 'Implement task completion functionality.', 'dependencies': ['FE-003', 'BE-002', 'BE-003'], 'estimated_time': '2 days', 'agent_role': 'frontend_developer', 'acceptance_criteria': ['User can mark a task as complete.', 'Task completion status is saved to the database.', 'Task list is updated to reflect the completion status.'], 'status': 'pending', 'code_files': ['src/App.tsx', 'src/components/TaskList.tsx', 'src/api/tasks.ts']}]}, {'name': 'Backend Phase', 'description': 'Tasks related to backend phase', 'deliverables': ['Completed BE-001', 'Completed BE-002', 'Completed BE-003', 'Completed BE-004', 'Completed BE-005', 'Completed BE-006', 'Completed TEST-001', 'Completed FE-006'], 'estimated_duration_hours': 96.0, 'work_items': [{'id': 'BE-001', 'description': 'Set up FastAPI project.', 'dependencies': [], 'estimated_time': '1 day', 'agent_role': 'backend_developer', 'acceptance_criteria': ['FastAPI project is initialized.', 'Dependencies (FastAPI, Uvicorn, etc.) are installed.', \"A basic 'Hello World' endpoint is created and functional.\"], 'status': 'pending', 'code_files': ['main.py', 'requirements.txt']}, {'id': 'BE-002', 'description': 'Implement the /tasks POST endpoint.', 'dependencies': ['BE-001', 'DB-001'], 'estimated_time': '2 days', 'agent_role': 'backend_developer', 'acceptance_criteria': ['Endpoint accepts a POST request to /tasks.', \"Endpoint validates the 'description' parameter.\", 'Endpoint saves the task to the database.', 'Endpoint returns a 201 Created status code on success with the created task data.', 'Endpoint returns a 400 Bad Request status code on invalid input.'], 'status': 'pending', 'code_files': ['main.py', 'database/crud.py']}, {'id': 'BE-003', 'description': 'Implement the /tasks GET endpoint.', 'dependencies': ['BE-001', 'DB-001'], 'estimated_time': '1 day', 'agent_role': 'backend_developer', 'acceptance_criteria': ['Endpoint accepts a GET request to /tasks.', 'Endpoint retrieves all tasks from the database.', 'Endpoint returns a 200 OK status code with a JSON list of tasks.'], 'status': 'pending', 'code_files': ['main.py', 'database/crud.py']}, {'id': 'BE-004', 'description': 'Implement input validation on the backend.', 'dependencies': ['BE-002'], 'estimated_time': '1 day', 'agent_role': 'backend_developer', 'acceptance_criteria': [\"Backend validates the 'description' field to prevent empty strings.\", \"Backend validates the 'description' field to prevent excessively long strings.\", 'Backend returns appropriate error messages for invalid input.'], 'status': 'pending', 'code_files': ['main.py', 'database/schemas.py']}, {'id': 'BE-005', 'description': 'Configure HTTPS.', 'dependencies': [], 'estimated_time': '1 day', 'agent_role': 'backend_developer', 'acceptance_criteria': [\"HTTPS is configured for the backend API (e.g., using a reverse proxy like Nginx or a cloud provider's HTTPS configuration).\", 'All communication between frontend and backend uses HTTPS.'], 'status': 'pending', 'code_files': ['Dockerfile', 'nginx.conf']}, {'id': 'BE-006', 'description': 'Implement basic error handling.', 'dependencies': ['BE-002', 'BE-003'], 'estimated_time': '1 day', 'agent_role': 'backend_developer', 'acceptance_criteria': ['Backend handles database connection errors.', 'Backend handles internal server errors and returns appropriate HTTP status codes.', 'Error responses include informative error messages.'], 'status': 'pending', 'code_files': ['main.py']}, {'id': 'TEST-001', 'description': 'Write unit tests for backend API endpoints.', 'dependencies': ['BE-002', 'BE-003'], 'estimated_time': '2 days', 'agent_role': 'backend_developer', 'acceptance_criteria': ['Unit tests are written for the /tasks POST endpoint.', 'Unit tests are written for the /tasks GET endpoint.', 'Tests cover various scenarios (success, failure, edge cases).', 'Tests achieve good code coverage.'], 'status': 'pending', 'code_files': ['tests/test_main.py']}, {'id': 'FE-006', 'description': 'Implement user authentication (JWT or API Keys).', 'dependencies': ['DEPLOY-002'], 'estimated_time': '3 days', 'agent_role': 'backend_developer', 'acceptance_criteria': ['User registration and login functionality is implemented.', 'JWT or API Key based authentication is implemented.', 'Protected routes are implemented.'], 'status': 'pending', 'code_files': ['main.py', 'database/models.py', 'database/schemas.py']}]}, {'name': 'Database Phase', 'description': 'Tasks related to database phase', 'deliverables': ['Completed DB-001'], 'estimated_duration_hours': 8.0, 'work_items': [{'id': 'DB-001', 'description': 'Design and implement the database schema (PostgreSQL).', 'dependencies': [], 'estimated_time': '1 day', 'agent_role': 'database_specialist', 'acceptance_criteria': ['PostgreSQL database is set up.', 'Tasks table is created with id (SERIAL PRIMARY KEY), description (VARCHAR(255) NOT NULL), and created_at (TIMESTAMP DEFAULT CURRENT_TIMESTAMP NOT NULL) columns.', 'Database connection is established.'], 'status': 'pending', 'code_files': ['database/schema.sql', 'database/models.py']}]}, {'name': 'Devops_Engineer Phase', 'description': 'Tasks related to devops_engineer phase', 'deliverables': ['Completed DEPLOY-001', 'Completed DEPLOY-002', 'Completed DEPLOY-003', 'Completed MONITOR-001'], 'estimated_duration_hours': 40.0, 'work_items': [{'id': 'DEPLOY-001', 'description': 'Deploy the frontend to a static hosting service.', 'dependencies': ['FE-005'], 'estimated_time': '1 day', 'agent_role': 'devops_engineer', 'acceptance_criteria': ['Frontend is built for production.', 'Frontend is deployed to a static hosting service (e.g., Netlify, Vercel, AWS S3).', 'Frontend is accessible via a public URL.'], 'status': 'pending', 'code_files': []}, {'id': 'DEPLOY-002', 'description': 'Deploy the backend to a cloud platform.', 'dependencies': ['BE-006', 'DB-001'], 'estimated_time': '2 days', 'agent_role': 'devops_engineer', 'acceptance_criteria': ['Backend is containerized (e.g., using Docker).', 'Backend is deployed to a cloud platform (e.g., AWS ECS, Google Cloud Run, Azure Container Instances).', 'Backend is accessible via a public URL or internal network.'], 'status': 'pending', 'code_files': ['Dockerfile']}, {'id': 'DEPLOY-003', 'description': 'Set up database deployment.', 'dependencies': ['DB-001'], 'estimated_time': '1 day', 'agent_role': 'devops_engineer', 'acceptance_criteria': ['PostgreSQL database is deployed to a managed service (e.g., AWS RDS, Google Cloud SQL, Azure Database for PostgreSQL).', 'Database is accessible from the backend application.'], 'status': 'pending', 'code_files': []}, {'id': 'MONITOR-001', 'description': 'Configure logging and monitoring.', 'dependencies': ['DEPLOY-002'], 'estimated_time': '1 day', 'agent_role': 'devops_engineer', 'acceptance_criteria': ['Logging is configured for both frontend and backend (e.g., using a logging aggregation service).', 'Monitoring is set up to track key metrics (e.g., response times, error rates).', 'Alerting is configured for critical errors.'], 'status': 'pending', 'code_files': []}]}, {'name': 'Qa_Engineer Phase', 'description': 'Tasks related to qa_engineer phase', 'deliverables': ['Completed TEST-003'], 'estimated_duration_hours': 8.0, 'work_items': [{'id': 'TEST-003', 'description': 'Perform initial testing in the deployed environment.', 'dependencies': ['DEPLOY-001', 'DEPLOY-002', 'DEPLOY-003'], 'estimated_time': '1 day', 'agent_role': 'qa_engineer', 'acceptance_criteria': ['The application is tested in the deployed environment.', 'All core functionalities are working as expected.', 'Performance and security are verified.'], 'status': 'pending', 'code_files': []}]}], resource_allocation=[{'role': 'Devops Engineer', 'count': 1, 'estimated_time_allocation': '100%', 'phases': ['Devops_Engineer Phase'], 'skills_required': []}, {'role': 'Frontend Developer', 'count': 1, 'estimated_time_allocation': '100%', 'phases': ['Frontend Phase'], 'skills_required': []}, {'role': 'Database Specialist', 'count': 1, 'estimated_time_allocation': '100%', 'phases': ['Database Phase'], 'skills_required': []}, {'role': 'Qa Engineer', 'count': 1, 'estimated_time_allocation': '100%', 'phases': ['Qa_Engineer Phase'], 'skills_required': []}, {'role': 'Backend Developer', 'count': 1, 'estimated_time_allocation': '100%', 'phases': ['Backend Phase'], 'skills_required': []}], risks_and_mitigations=[], timeline={'start_date': '2025-07-08T22:58:16.251486', 'end_date': 'TBD', 'milestones': []}, tech_stack={}, metadata={'generated_at': '2025-07-08T22:58:16.251486', 'version': '1.0', 'author': 'Multi-AI Dev System', 'tags': [], 'notes': 'Converted from WorkItemBacklog. Original summary: Develop a simple web application for managing a list of tasks, using React for the frontend, FastAPI for the backend, and PostgreSQL for data storage. The application will allow users to add and view tasks, with future enhancements including user authentication, task editing, and task completion. The project will be deployed to a cloud environment with monitoring and logging implemented.'}) summary='Develop a simple web application for managing a list of tasks, using React for the frontend, FastAPI for the backend, and PostgreSQL for data storage. The application will allow users to add and view tasks, with future enhancements including user authentication, task editing, and task completion. The project will be deployed to a cloud environment with monitoring and logging implemented.' metadata=PlanMetadata(generated_at='2025-07-08T22:58:16.251486', version='1.0', author='Multi-AI Dev System', tags=[], notes='Converted from WorkItemBacklog. Original summary: Develop a simple web application for managing a list of tasks, using React for the frontend, FastAPI for the backend, and PostgreSQL for data storage. The application will allow users to add and view tasks, with future enhancements including user authentication, task editing, and task completion. The project will be deployed to a cloud environment with monitoring and logging implemented.')"
  },
  "workflow_state_snapshot": {
    "requirements_analysis": {
      "project_name": "Hello World Task List",
      "project_summary": "A simple web application to manage a list of tasks.",
      "project_goals": [
        "Allow a user to add a task",
        "Allow a user to see their list of tasks"
      ],
      "target_audience": [
        "Users who want to manage a list of tasks"
      ],
      "business_context": "This project provides a basic task management solution.",
      "requirements": [
        {
          "id": "REQ-001",
          "description": "A user can create a new task with a text description.",
          "category": "functional",
          "priority": 1
        },
        {
          "id": "REQ-002",
          "description": "A user can see a list of all created tasks.",
          "category": "functional",
          "priority": 1
        },
        {
          "id": "REQ-003",
          "description": "The application must load quickly.",
          "category": "non_functional",
          "priority": 2
        },
        {
          "id": "REQ-004",
          "description": "The application must be secure.",
          "category": "non_functional",
          "priority": 2
        }
      ],
      "functional_requirements": [
        "A user can create a new task with a text description.",
        "A user can see a list of all created tasks."
      ],
      "non_functional_requirements": [
        "The application must load quickly.",
        "The application must be secure."
      ],
      "stakeholders": [
        "Users"
      ],
      "success_criteria": [
        "Users can successfully add tasks.",
        "Users can view their task list."
      ],
      "constraints": [],
      "assumptions": [],
      "risks": [],
      "domain_specific_details": {},
      "quality_assessment": {
        "clarity_score": 8.0,
        "completeness_score": 7.0,
        "consistency_score": 9.0,
        "recommendations": [
          "Add more details about security requirements.",
          "Specify what 'quickly' means in terms of loading time."
        ]
      },
      "gap_analysis": {
        "identified_gaps": [
          "Missing details on user authentication.",
          "No information on data storage."
        ],
        "recommendations_for_completion": [
          "Define user authentication methods.",
          "Specify data storage solution."
        ]
      }
    },
    "tech_stack_recommendation": {
      "frontend_options": [
        {
          "name": "React",
          "language": "TypeScript",
          "reasoning": "Default frontend framework.",
          "key_libraries": [],
          "pros": [],
          "cons": [],
          "selected": false
        }
      ],
      "backend_options": [
        {
          "name": "FastAPI",
          "language": "Python",
          "reasoning": "Default backend framework.",
          "key_libraries": [],
          "pros": [],
          "cons": [],
          "selected": false
        }
      ],
      "database_options": [
        {
          "name": "PostgreSQL",
          "language": null,
          "reasoning": "Default relational database.",
          "key_libraries": [],
          "pros": [],
          "cons": [],
          "selected": false
        }
      ],
      "cloud_options": [],
      "architecture_options": [
        {
          "pattern": "Microservices",
          "scalability_score": 7.0,
          "maintainability_score": 6.0,
          "development_speed_score": 5.0,
          "overall_score": 6.0,
          "reasoning": "Default architecture pattern with moderate complexity and good scalability."
        }
      ],
      "tool_options": [],
      "risks": [],
      "synthesis": {
        "backend": {},
        "frontend": {},
        "database": {},
        "architecture_pattern": "Microservices",
        "deployment_environment": {},
        "key_libraries_tools": [],
        "estimated_complexity": "Medium"
      },
      "selected_stack": null
    },
    "system_design": {
      "architecture": {
        "pattern": "Microservices",
        "justification": "Microservices architecture is chosen for its scalability and maintainability, even for a simple application. This allows for independent scaling of frontend and backend components and facilitates future expansion.",
        "key_benefits": [
          "Independent scaling of frontend and backend.",
          "Improved maintainability through modularity.",
          "Flexibility for future feature additions."
        ],
        "potential_drawbacks": [
          "Increased complexity compared to a monolithic architecture.",
          "Requires more sophisticated deployment and management infrastructure."
        ]
      },
      "components": [
        {
          "name": "Frontend",
          "description": "The user interface for interacting with the task list.",
          "category": "frontend",
          "technologies": [
            "React",
            "TypeScript",
            "HTML",
            "CSS"
          ],
          "dependencies": [
            "Backend API"
          ],
          "responsibilities": [
            "Displaying the task list.",
            "Allowing users to add new tasks.",
            "Handling user input and interactions.",
            "Making API calls to the backend."
          ],
          "design_patterns": [
            "Component-based architecture"
          ]
        },
        {
          "name": "Backend API",
          "description": "The RESTful API that handles task management logic and data storage.",
          "category": "backend",
          "technologies": [
            "FastAPI",
            "Python",
            "PostgreSQL",
            "SQLAlchemy"
          ],
          "dependencies": [
            "Database"
          ],
          "responsibilities": [
            "Receiving requests from the frontend.",
            "Validating user input.",
            "Interacting with the database to store and retrieve tasks.",
            "Returning task data to the frontend."
          ],
          "design_patterns": [
            "RESTful API design",
            "Dependency Injection"
          ]
        },
        {
          "name": "Database",
          "description": "Stores the task data.",
          "category": "backend",
          "technologies": [
            "PostgreSQL"
          ],
          "dependencies": [],
          "responsibilities": [
            "Storing task data persistently.",
            "Providing efficient data retrieval and storage."
          ],
          "design_patterns": [
            "Relational Database Design"
          ]
        }
      ],
      "data_model": {
        "schema_type": "Relational",
        "tables": [
          {
            "name": "tasks",
            "purpose": "Stores task information.",
            "fields": [
              {
                "name": "id",
                "type": "SERIAL",
                "constraints": [
                  "PRIMARY KEY"
                ],
                "description": "Unique identifier for the task."
              },
              {
                "name": "description",
                "type": "VARCHAR(255)",
                "constraints": [
                  "NOT NULL"
                ],
                "description": "The text description of the task."
              },
              {
                "name": "created_at",
                "type": "TIMESTAMP",
                "constraints": [
                  "NOT NULL",
                  "DEFAULT CURRENT_TIMESTAMP"
                ],
                "description": "Timestamp of when the task was created."
              }
            ],
            "relationships": []
          }
        ],
        "relationships": [],
        "justification": "A relational database (PostgreSQL) is chosen for its ability to efficiently store and retrieve structured data. The schema is simple, reflecting the straightforward nature of the task list application."
      },
      "api_endpoints": {
        "style": "REST",
        "base_url": "/api/v1",
        "authentication": "None (for initial implementation, consider JWT or API Keys for future enhancements)",
        "endpoints": [
          {
            "method": "POST",
            "path": "/tasks",
            "purpose": "Create a new task.",
            "parameters": [
              {
                "description": "The task description.",
                "type": "string",
                "name": "description"
              }
            ],
            "response": {
              "201": {
                "description": "Task created successfully.",
                "example": {
                  "id": 1,
                  "description": "Buy groceries",
                  "created_at": "2024-10-27T10:00:00Z"
                }
              },
              "400": {
                "description": "Bad Request - Invalid input."
              }
            },
            "authentication_required": false,
            "rate_limiting_applied": false
          },
          {
            "method": "GET",
            "path": "/tasks",
            "purpose": "Get a list of all tasks.",
            "parameters": [],
            "response": {
              "200": {
                "description": "List of tasks.",
                "example": [
                  {
                    "id": 1,
                    "description": "Buy groceries",
                    "created_at": "2024-10-27T10:00:00Z"
                  },
                  {
                    "id": 2,
                    "description": "Do laundry",
                    "created_at": "2024-10-27T10:05:00Z"
                  }
                ]
              }
            },
            "authentication_required": false,
            "rate_limiting_applied": false
          }
        ],
        "error_handling": "Standard HTTP status codes are used to indicate success or failure. Detailed error messages are returned in the response body for debugging.",
        "rate_limiting_strategy": null
      },
      "security": {
        "authentication_method": "None (Initial Implementation)",
        "authorization_strategy": "None (Initial Implementation)",
        "data_encryption": {
          "at_rest": "Data at rest in the database is not encrypted initially. Consider enabling encryption at rest for production.",
          "in_transit": "HTTPS is used to encrypt data in transit."
        },
        "security_measures": [
          {
            "category": "Input Validation",
            "implementation": "Validate all user inputs on the backend to prevent injection attacks.",
            "mitigation": "SQL Injection, Cross-Site Scripting (XSS)",
            "priority": "High"
          },
          {
            "category": "HTTPS",
            "implementation": "Enforce HTTPS for all communication between the frontend and backend.",
            "mitigation": "Man-in-the-middle attacks",
            "priority": "High"
          },
          {
            "category": "Authentication (Future)",
            "implementation": "Implement JWT or API Key based authentication.",
            "mitigation": "Unauthorized access",
            "priority": "Medium"
          },
          {
            "category": "Authorization (Future)",
            "implementation": "Implement role-based access control (RBAC) or similar.",
            "mitigation": "Unauthorized access to resources",
            "priority": "Medium"
          }
        ],
        "vulnerability_mitigation_strategies": [
          "Input validation to prevent SQL injection and XSS.",
          "Use of parameterized queries to prevent SQL injection.",
          "Escaping output to prevent XSS.",
          "Regular security audits and penetration testing."
        ],
        "compliance_standards": []
      },
      "scalability_and_performance": {
        "caching": "Implement caching on the frontend and potentially on the backend (e.g., using Redis) to improve loading times.",
        "database_optimization": "Optimize database queries and indexes for efficient data retrieval.",
        "load_balancing": "Consider using a load balancer if the application experiences high traffic.",
        "code_splitting": "Implement code splitting in the frontend to reduce initial load time."
      },
      "deployment_strategy": {
        "environment": "Cloud-based (e.g., AWS, Google Cloud, Azure)",
        "frontend_deployment": "Deploy the React frontend to a static hosting service (e.g., Netlify, Vercel, AWS S3).",
        "backend_deployment": "Deploy the FastAPI backend as a containerized application (e.g., Docker) to a platform like AWS ECS, Google Cloud Run, or Azure Container Instances.",
        "database_deployment": "Use a managed PostgreSQL service (e.g., AWS RDS, Google Cloud SQL, Azure Database for PostgreSQL)."
      },
      "monitoring_and_logging": {
        "logging": "Implement logging in both the frontend and backend to track application behavior and errors. Use a logging aggregation service (e.g., ELK stack, Splunk, Datadog).",
        "monitoring": "Monitor key metrics such as response times, error rates, and resource utilization. Use a monitoring service (e.g., Prometheus, Grafana, Datadog)."
      },
      "error_handling_strategy": "Use standard HTTP status codes. Return detailed error messages in the response body for debugging. Implement centralized error handling in both frontend and backend.",
      "development_phases_overview": [
        {
          "name": "Phase 1: Setup and Basic Functionality",
          "description": "Set up the development environment, create the frontend and backend projects, and implement the core functionality: adding and viewing tasks.",
          "priority": "High",
          "dependencies": [],
          "tasks": [
            "Set up React project with TypeScript.",
            "Set up FastAPI project.",
            "Design and implement the database schema.",
            "Implement the /tasks POST endpoint.",
            "Implement the /tasks GET endpoint.",
            "Develop the frontend UI for adding and viewing tasks.",
            "Connect the frontend to the backend API."
          ],
          "estimated_duration": "2 weeks"
        },
        {
          "name": "Phase 2: Security and Refinement",
          "description": "Implement security measures, improve the user interface, and address any identified bugs.",
          "priority": "Medium",
          "dependencies": [
            "Phase 1"
          ],
          "tasks": [
            "Implement input validation on the backend.",
            "Configure HTTPS.",
            "Improve the UI/UX.",
            "Implement basic error handling.",
            "Write unit tests and integration tests.",
            "Address any identified bugs."
          ],
          "estimated_duration": "1 week"
        },
        {
          "name": "Phase 3: Deployment and Monitoring",
          "description": "Deploy the application to a cloud environment and set up monitoring and logging.",
          "priority": "Medium",
          "dependencies": [
            "Phase 2"
          ],
          "tasks": [
            "Deploy the frontend to a static hosting service.",
            "Deploy the backend to a cloud platform.",
            "Set up database deployment.",
            "Configure logging and monitoring.",
            "Perform initial testing in the deployed environment."
          ],
          "estimated_duration": "1 week"
        },
        {
          "name": "Phase 4: Future Enhancements",
          "description": "Implement future enhancements such as user authentication, task editing, and task completion.",
          "priority": "Low",
          "dependencies": [
            "Phase 3"
          ],
          "tasks": [
            "Implement user authentication (JWT or API Keys).",
            "Implement task editing functionality.",
            "Implement task completion functionality.",
            "Add features based on user feedback."
          ],
          "estimated_duration": "Ongoing"
        }
      ],
      "key_risks": [
        "Security vulnerabilities (e.g., XSS, SQL injection).",
        "Performance bottlenecks (e.g., slow database queries).",
        "Scalability issues (if the application grows significantly).",
        "Deployment challenges."
      ],
      "design_justification": "The design prioritizes simplicity, maintainability, and scalability. The microservices architecture allows for independent scaling of frontend and backend components. The tech stack is chosen for its ease of use and widespread adoption. The development phases are structured to deliver core functionality quickly and iteratively improve the application.",
      "data_flow": "1. User interacts with the React frontend (e.g., enters a task description). 2. Frontend sends a POST request to the /tasks endpoint of the FastAPI backend. 3. FastAPI backend validates the input. 4. Backend interacts with the PostgreSQL database to store the task. 5. Backend returns a success response (e.g., 201 Created) to the frontend. 6. Frontend displays the newly created task in the task list. 7. When the user views the task list, the frontend sends a GET request to the /tasks endpoint. 8. FastAPI backend retrieves tasks from the database. 9. Backend returns the list of tasks to the frontend. 10. Frontend displays the tasks."
    },
    "implementation_plan": "plan=ImplementationPlan(project_summary={'title': 'Generated Project Plan', 'description': 'Develop a simple web application for managing a list of tasks, using React for the frontend, FastAPI for the backend, and PostgreSQL for data storage. The application will allow users to add and view tasks, with future enhancements including user authentication, task editing, and task completion. The project will be deployed to a cloud environment with monitoring and logging implemented.', 'overall_complexity': 'Medium', 'estimated_duration': 'TBD', 'key_challenges': [], 'success_criteria': []}, phases=[{'name': 'Frontend Phase', 'description': 'Tasks related to frontend phase', 'deliverables': ['Completed FE-001', 'Completed FE-002', 'Completed FE-003', 'Completed FE-004', 'Completed FE-005', 'Completed TEST-002', 'Completed FE-007', 'Completed FE-008'], 'estimated_duration_hours': 96.0, 'work_items': [{'id': 'FE-001', 'description': 'Set up React project with TypeScript.', 'dependencies': [], 'estimated_time': '1 day', 'agent_role': 'frontend_developer', 'acceptance_criteria': ['Project is initialized using Create React App with TypeScript.', 'Project builds successfully.', 'Basic project structure is in place.'], 'status': 'pending', 'code_files': ['package.json', 'tsconfig.json', 'src/App.tsx', 'src/index.tsx']}, {'id': 'FE-002', 'description': 'Develop the frontend UI for adding and viewing tasks.', 'dependencies': ['FE-001'], 'estimated_time': '2 days', 'agent_role': 'frontend_developer', 'acceptance_criteria': ['UI displays a form to enter a task description.', 'UI displays a list of tasks.', 'UI updates the task list after a new task is added.', 'UI handles empty task list gracefully.'], 'status': 'pending', 'code_files': ['src/App.tsx', 'src/components/TaskForm.tsx', 'src/components/TaskList.tsx', 'src/App.css']}, {'id': 'FE-003', 'description': 'Connect the frontend to the backend API.', 'dependencies': ['FE-002', 'BE-002', 'BE-003'], 'estimated_time': '1 day', 'agent_role': 'frontend_developer', 'acceptance_criteria': ['Frontend makes POST requests to /tasks to add new tasks.', 'Frontend makes GET requests to /tasks to retrieve tasks.', 'Frontend displays tasks retrieved from the API.', 'Error handling for API calls is implemented.'], 'status': 'pending', 'code_files': ['src/App.tsx', 'src/api/tasks.ts']}, {'id': 'FE-004', 'description': 'Improve the UI/UX.', 'dependencies': ['FE-002'], 'estimated_time': '1 day', 'agent_role': 'frontend_developer', 'acceptance_criteria': ['UI is visually appealing and user-friendly.', 'UI provides clear feedback to the user (e.g., loading indicators, success messages).', 'UI is responsive and works well on different screen sizes.'], 'status': 'pending', 'code_files': ['src/App.tsx', 'src/components/TaskForm.tsx', 'src/components/TaskList.tsx', 'src/App.css']}, {'id': 'FE-005', 'description': 'Implement basic error handling in the frontend.', 'dependencies': ['FE-003'], 'estimated_time': '1 day', 'agent_role': 'frontend_developer', 'acceptance_criteria': ['Frontend displays error messages to the user when API calls fail.', 'Frontend handles network errors gracefully.', 'Frontend provides feedback to the user on API call status.'], 'status': 'pending', 'code_files': ['src/App.tsx', 'src/api/tasks.ts']}, {'id': 'TEST-002', 'description': 'Write unit tests for frontend components.', 'dependencies': ['FE-002', 'FE-003'], 'estimated_time': '2 days', 'agent_role': 'frontend_developer', 'acceptance_criteria': ['Unit tests are written for the TaskForm component.', 'Unit tests are written for the TaskList component.', 'Tests cover various scenarios (user input, API interactions, display logic).', 'Tests achieve good code coverage.'], 'status': 'pending', 'code_files': ['src/components/TaskForm.test.tsx', 'src/components/TaskList.test.tsx']}, {'id': 'FE-007', 'description': 'Implement task editing functionality.', 'dependencies': ['FE-003', 'BE-002', 'BE-003'], 'estimated_time': '2 days', 'agent_role': 'frontend_developer', 'acceptance_criteria': ['User can edit the description of an existing task.', 'Changes are saved to the database.', 'Task list is updated after editing.'], 'status': 'pending', 'code_files': ['src/App.tsx', 'src/components/TaskForm.tsx', 'src/components/TaskList.tsx', 'src/api/tasks.ts']}, {'id': 'FE-008', 'description': 'Implement task completion functionality.', 'dependencies': ['FE-003', 'BE-002', 'BE-003'], 'estimated_time': '2 days', 'agent_role': 'frontend_developer', 'acceptance_criteria': ['User can mark a task as complete.', 'Task completion status is saved to the database.', 'Task list is updated to reflect the completion status.'], 'status': 'pending', 'code_files': ['src/App.tsx', 'src/components/TaskList.tsx', 'src/api/tasks.ts']}]}, {'name': 'Backend Phase', 'description': 'Tasks related to backend phase', 'deliverables': ['Completed BE-001', 'Completed BE-002', 'Completed BE-003', 'Completed BE-004', 'Completed BE-005', 'Completed BE-006', 'Completed TEST-001', 'Completed FE-006'], 'estimated_duration_hours': 96.0, 'work_items': [{'id': 'BE-001', 'description': 'Set up FastAPI project.', 'dependencies': [], 'estimated_time': '1 day', 'agent_role': 'backend_developer', 'acceptance_criteria': ['FastAPI project is initialized.', 'Dependencies (FastAPI, Uvicorn, etc.) are installed.', \"A basic 'Hello World' endpoint is created and functional.\"], 'status': 'pending', 'code_files': ['main.py', 'requirements.txt']}, {'id': 'BE-002', 'description': 'Implement the /tasks POST endpoint.', 'dependencies': ['BE-001', 'DB-001'], 'estimated_time': '2 days', 'agent_role': 'backend_developer', 'acceptance_criteria': ['Endpoint accepts a POST request to /tasks.', \"Endpoint validates the 'description' parameter.\", 'Endpoint saves the task to the database.', 'Endpoint returns a 201 Created status code on success with the created task data.', 'Endpoint returns a 400 Bad Request status code on invalid input.'], 'status': 'pending', 'code_files': ['main.py', 'database/crud.py']}, {'id': 'BE-003', 'description': 'Implement the /tasks GET endpoint.', 'dependencies': ['BE-001', 'DB-001'], 'estimated_time': '1 day', 'agent_role': 'backend_developer', 'acceptance_criteria': ['Endpoint accepts a GET request to /tasks.', 'Endpoint retrieves all tasks from the database.', 'Endpoint returns a 200 OK status code with a JSON list of tasks.'], 'status': 'pending', 'code_files': ['main.py', 'database/crud.py']}, {'id': 'BE-004', 'description': 'Implement input validation on the backend.', 'dependencies': ['BE-002'], 'estimated_time': '1 day', 'agent_role': 'backend_developer', 'acceptance_criteria': [\"Backend validates the 'description' field to prevent empty strings.\", \"Backend validates the 'description' field to prevent excessively long strings.\", 'Backend returns appropriate error messages for invalid input.'], 'status': 'pending', 'code_files': ['main.py', 'database/schemas.py']}, {'id': 'BE-005', 'description': 'Configure HTTPS.', 'dependencies': [], 'estimated_time': '1 day', 'agent_role': 'backend_developer', 'acceptance_criteria': [\"HTTPS is configured for the backend API (e.g., using a reverse proxy like Nginx or a cloud provider's HTTPS configuration).\", 'All communication between frontend and backend uses HTTPS.'], 'status': 'pending', 'code_files': ['Dockerfile', 'nginx.conf']}, {'id': 'BE-006', 'description': 'Implement basic error handling.', 'dependencies': ['BE-002', 'BE-003'], 'estimated_time': '1 day', 'agent_role': 'backend_developer', 'acceptance_criteria': ['Backend handles database connection errors.', 'Backend handles internal server errors and returns appropriate HTTP status codes.', 'Error responses include informative error messages.'], 'status': 'pending', 'code_files': ['main.py']}, {'id': 'TEST-001', 'description': 'Write unit tests for backend API endpoints.', 'dependencies': ['BE-002', 'BE-003'], 'estimated_time': '2 days', 'agent_role': 'backend_developer', 'acceptance_criteria': ['Unit tests are written for the /tasks POST endpoint.', 'Unit tests are written for the /tasks GET endpoint.', 'Tests cover various scenarios (success, failure, edge cases).', 'Tests achieve good code coverage.'], 'status': 'pending', 'code_files': ['tests/test_main.py']}, {'id': 'FE-006', 'description': 'Implement user authentication (JWT or API Keys).', 'dependencies': ['DEPLOY-002'], 'estimated_time': '3 days', 'agent_role': 'backend_developer', 'acceptance_criteria': ['User registration and login functionality is implemented.', 'JWT or API Key based authentication is implemented.', 'Protected routes are implemented.'], 'status': 'pending', 'code_files': ['main.py', 'database/models.py', 'database/schemas.py']}]}, {'name': 'Database Phase', 'description': 'Tasks related to database phase', 'deliverables': ['Completed DB-001'], 'estimated_duration_hours': 8.0, 'work_items': [{'id': 'DB-001', 'description': 'Design and implement the database schema (PostgreSQL).', 'dependencies': [], 'estimated_time': '1 day', 'agent_role': 'database_specialist', 'acceptance_criteria': ['PostgreSQL database is set up.', 'Tasks table is created with id (SERIAL PRIMARY KEY), description (VARCHAR(255) NOT NULL), and created_at (TIMESTAMP DEFAULT CURRENT_TIMESTAMP NOT NULL) columns.', 'Database connection is established.'], 'status': 'pending', 'code_files': ['database/schema.sql', 'database/models.py']}]}, {'name': 'Devops_Engineer Phase', 'description': 'Tasks related to devops_engineer phase', 'deliverables': ['Completed DEPLOY-001', 'Completed DEPLOY-002', 'Completed DEPLOY-003', 'Completed MONITOR-001'], 'estimated_duration_hours': 40.0, 'work_items': [{'id': 'DEPLOY-001', 'description': 'Deploy the frontend to a static hosting service.', 'dependencies': ['FE-005'], 'estimated_time': '1 day', 'agent_role': 'devops_engineer', 'acceptance_criteria': ['Frontend is built for production.', 'Frontend is deployed to a static hosting service (e.g., Netlify, Vercel, AWS S3).', 'Frontend is accessible via a public URL.'], 'status': 'pending', 'code_files': []}, {'id': 'DEPLOY-002', 'description': 'Deploy the backend to a cloud platform.', 'dependencies': ['BE-006', 'DB-001'], 'estimated_time': '2 days', 'agent_role': 'devops_engineer', 'acceptance_criteria': ['Backend is containerized (e.g., using Docker).', 'Backend is deployed to a cloud platform (e.g., AWS ECS, Google Cloud Run, Azure Container Instances).', 'Backend is accessible via a public URL or internal network.'], 'status': 'pending', 'code_files': ['Dockerfile']}, {'id': 'DEPLOY-003', 'description': 'Set up database deployment.', 'dependencies': ['DB-001'], 'estimated_time': '1 day', 'agent_role': 'devops_engineer', 'acceptance_criteria': ['PostgreSQL database is deployed to a managed service (e.g., AWS RDS, Google Cloud SQL, Azure Database for PostgreSQL).', 'Database is accessible from the backend application.'], 'status': 'pending', 'code_files': []}, {'id': 'MONITOR-001', 'description': 'Configure logging and monitoring.', 'dependencies': ['DEPLOY-002'], 'estimated_time': '1 day', 'agent_role': 'devops_engineer', 'acceptance_criteria': ['Logging is configured for both frontend and backend (e.g., using a logging aggregation service).', 'Monitoring is set up to track key metrics (e.g., response times, error rates).', 'Alerting is configured for critical errors.'], 'status': 'pending', 'code_files': []}]}, {'name': 'Qa_Engineer Phase', 'description': 'Tasks related to qa_engineer phase', 'deliverables': ['Completed TEST-003'], 'estimated_duration_hours': 8.0, 'work_items': [{'id': 'TEST-003', 'description': 'Perform initial testing in the deployed environment.', 'dependencies': ['DEPLOY-001', 'DEPLOY-002', 'DEPLOY-003'], 'estimated_time': '1 day', 'agent_role': 'qa_engineer', 'acceptance_criteria': ['The application is tested in the deployed environment.', 'All core functionalities are working as expected.', 'Performance and security are verified.'], 'status': 'pending', 'code_files': []}]}], resource_allocation=[{'role': 'Devops Engineer', 'count': 1, 'estimated_time_allocation': '100%', 'phases': ['Devops_Engineer Phase'], 'skills_required': []}, {'role': 'Frontend Developer', 'count': 1, 'estimated_time_allocation': '100%', 'phases': ['Frontend Phase'], 'skills_required': []}, {'role': 'Database Specialist', 'count': 1, 'estimated_time_allocation': '100%', 'phases': ['Database Phase'], 'skills_required': []}, {'role': 'Qa Engineer', 'count': 1, 'estimated_time_allocation': '100%', 'phases': ['Qa_Engineer Phase'], 'skills_required': []}, {'role': 'Backend Developer', 'count': 1, 'estimated_time_allocation': '100%', 'phases': ['Backend Phase'], 'skills_required': []}], risks_and_mitigations=[], timeline={'start_date': '2025-07-08T22:58:16.251486', 'end_date': 'TBD', 'milestones': []}, tech_stack={}, metadata={'generated_at': '2025-07-08T22:58:16.251486', 'version': '1.0', 'author': 'Multi-AI Dev System', 'tags': [], 'notes': 'Converted from WorkItemBacklog. Original summary: Develop a simple web application for managing a list of tasks, using React for the frontend, FastAPI for the backend, and PostgreSQL for data storage. The application will allow users to add and view tasks, with future enhancements including user authentication, task editing, and task completion. The project will be deployed to a cloud environment with monitoring and logging implemented.'}) summary='Develop a simple web application for managing a list of tasks, using React for the frontend, FastAPI for the backend, and PostgreSQL for data storage. The application will allow users to add and view tasks, with future enhancements including user authentication, task editing, and task completion. The project will be deployed to a cloud environment with monitoring and logging implemented.' metadata=PlanMetadata(generated_at='2025-07-08T22:58:16.251486', version='1.0', author='Multi-AI Dev System', tags=[], notes='Converted from WorkItemBacklog. Original summary: Develop a simple web application for managing a list of tasks, using React for the frontend, FastAPI for the backend, and PostgreSQL for data storage. The application will allow users to add and view tasks, with future enhancements including user authentication, task editing, and task completion. The project will be deployed to a cloud environment with monitoring and logging implemented.')"
  }
}