{
  "session_id": "session_fe00343a-1094-4d91-96c7-8cf04b9d67ff",
  "approval_type": "implementation_plan",
  "timestamp": 1751975556,
  "approval_data": {
    "type": "implementation_plan",
    "timestamp": 1751975556.983386,
    "project_overview": "Develop a simple web application for managing a list of tasks, including adding, viewing, updating, and deleting tasks. The application will use React for the frontend, Node.js/Express for the backend, and PostgreSQL for the database. The application will be deployed to AWS.",
    "development_phases": [
      {
        "name": "Frontend Phase",
        "description": "Tasks related to frontend phase",
        "deliverables": [
          "Completed FE-001",
          "Completed FE-002",
          "Completed FE-003",
          "Completed FE-004",
          "Completed FE-005",
          "Completed FE-006",
          "Completed FE-007",
          "Completed FE-008",
          "Completed TEST-005"
        ],
        "estimated_duration_hours": 40.0,
        "work_items": [
          {
            "id": "FE-001",
            "description": "Set up React project using Create React App.",
            "dependencies": [],
            "estimated_time": "2 hours",
            "agent_role": "frontend_developer",
            "acceptance_criteria": [
              "Project is initialized successfully.",
              "Default React app runs without errors."
            ],
            "status": "pending",
            "code_files": [
              "package.json",
              "src/App.js",
              "src/index.js"
            ]
          },
          {
            "id": "FE-002",
            "description": "Design and implement the UI for adding tasks (input field and add button).",
            "dependencies": [
              "FE-001"
            ],
            "estimated_time": "4 hours",
            "agent_role": "frontend_developer",
            "acceptance_criteria": [
              "UI elements for task input and add button are present.",
              "UI elements are styled appropriately."
            ],
            "status": "pending",
            "code_files": [
              "src/App.js",
              "src/App.css"
            ]
          },
          {
            "id": "FE-003",
            "description": "Design and implement the UI for viewing tasks (task list).",
            "dependencies": [
              "FE-001"
            ],
            "estimated_time": "4 hours",
            "agent_role": "frontend_developer",
            "acceptance_criteria": [
              "Task list container is present.",
              "Tasks are displayed in a list format (e.g., unordered list)."
            ],
            "status": "pending",
            "code_files": [
              "src/App.js",
              "src/App.css"
            ]
          },
          {
            "id": "FE-004",
            "description": "Implement basic styling for the UI.",
            "dependencies": [
              "FE-002",
              "FE-003"
            ],
            "estimated_time": "4 hours",
            "agent_role": "frontend_developer",
            "acceptance_criteria": [
              "UI elements are visually appealing.",
              "Layout is responsive."
            ],
            "status": "pending",
            "code_files": [
              "src/App.css"
            ]
          },
          {
            "id": "FE-005",
            "description": "Implement API calls in the frontend to add tasks.",
            "dependencies": [
              "FE-002",
              "BE-002"
            ],
            "estimated_time": "6 hours",
            "agent_role": "frontend_developer",
            "acceptance_criteria": [
              "Frontend makes a POST request to /tasks when the add button is clicked.",
              "New tasks are successfully added to the backend."
            ],
            "status": "pending",
            "code_files": [
              "src/App.js"
            ]
          },
          {
            "id": "FE-006",
            "description": "Implement API calls in the frontend to fetch tasks.",
            "dependencies": [
              "FE-003",
              "BE-003"
            ],
            "estimated_time": "6 hours",
            "agent_role": "frontend_developer",
            "acceptance_criteria": [
              "Frontend makes a GET request to /tasks on component mount.",
              "Tasks are displayed in the task list."
            ],
            "status": "pending",
            "code_files": [
              "src/App.js"
            ]
          },
          {
            "id": "FE-007",
            "description": "Implement API calls in the frontend to update task completion status.",
            "dependencies": [
              "FE-003",
              "BE-004"
            ],
            "estimated_time": "6 hours",
            "agent_role": "frontend_developer",
            "acceptance_criteria": [
              "Frontend makes a PUT request to /tasks/{id} when a task is marked as complete/incomplete.",
              "Task completion status is updated in the backend and reflected in the UI."
            ],
            "status": "pending",
            "code_files": [
              "src/App.js"
            ]
          },
          {
            "id": "FE-008",
            "description": "Implement API calls in the frontend to delete tasks.",
            "dependencies": [
              "FE-003",
              "BE-005"
            ],
            "estimated_time": "4 hours",
            "agent_role": "frontend_developer",
            "acceptance_criteria": [
              "Frontend makes a DELETE request to /tasks/{id} when a task is deleted.",
              "Task is removed from the UI."
            ],
            "status": "pending",
            "code_files": [
              "src/App.js"
            ]
          },
          {
            "id": "TEST-005",
            "description": "End-to-end testing: Add a task, view it, mark it complete, and delete it.",
            "dependencies": [
              "FE-005",
              "FE-006",
              "FE-007",
              "FE-008",
              "TEST-001",
              "TEST-002",
              "TEST-003",
              "TEST-004"
            ],
            "estimated_time": "4 hours",
            "agent_role": "frontend_developer",
            "acceptance_criteria": [
              "Task is successfully added through the UI.",
              "Task is displayed in the task list.",
              "Task completion status can be toggled.",
              "Task can be deleted from the UI."
            ],
            "status": "pending",
            "code_files": [
              "src/App.js"
            ]
          }
        ]
      },
      {
        "name": "Backend Phase",
        "description": "Tasks related to backend phase",
        "deliverables": [
          "Completed BE-001",
          "Completed BE-002",
          "Completed BE-003",
          "Completed BE-004",
          "Completed BE-005",
          "Completed BE-006",
          "Completed BE-007",
          "Completed BE-008",
          "Completed BE-009",
          "Completed BE-010",
          "Completed TEST-001",
          "Completed TEST-002",
          "Completed TEST-003",
          "Completed TEST-004"
        ],
        "estimated_duration_hours": 56.0,
        "work_items": [
          {
            "id": "BE-001",
            "description": "Set up Node.js and Express.js project.",
            "dependencies": [],
            "estimated_time": "2 hours",
            "agent_role": "backend_developer",
            "acceptance_criteria": [
              "Project is initialized successfully.",
              "Express server runs without errors."
            ],
            "status": "pending",
            "code_files": [
              "package.json",
              "index.js"
            ]
          },
          {
            "id": "BE-002",
            "description": "Implement the POST /tasks endpoint (create a new task).",
            "dependencies": [
              "BE-001"
            ],
            "estimated_time": "6 hours",
            "agent_role": "backend_developer",
            "acceptance_criteria": [
              "Endpoint accepts POST requests to /tasks.",
              "Endpoint parses the request body for the task description.",
              "Endpoint returns a 201 status code on success.",
              "Endpoint returns a 400 status code on invalid input."
            ],
            "status": "pending",
            "code_files": [
              "index.js"
            ]
          },
          {
            "id": "BE-003",
            "description": "Implement the GET /tasks endpoint (get all tasks).",
            "dependencies": [
              "BE-001"
            ],
            "estimated_time": "4 hours",
            "agent_role": "backend_developer",
            "acceptance_criteria": [
              "Endpoint accepts GET requests to /tasks.",
              "Endpoint returns a 200 status code on success.",
              "Endpoint returns a JSON array of tasks."
            ],
            "status": "pending",
            "code_files": [
              "index.js"
            ]
          },
          {
            "id": "BE-004",
            "description": "Implement the PUT /tasks/{id} endpoint (update a task).",
            "dependencies": [
              "BE-001"
            ],
            "estimated_time": "6 hours",
            "agent_role": "backend_developer",
            "acceptance_criteria": [
              "Endpoint accepts PUT requests to /tasks/{id}.",
              "Endpoint parses the request body for the 'completed' status.",
              "Endpoint returns a 200 status code on success.",
              "Endpoint returns a 400 status code on invalid input.",
              "Endpoint returns a 404 status code if the task is not found."
            ],
            "status": "pending",
            "code_files": [
              "index.js"
            ]
          },
          {
            "id": "BE-005",
            "description": "Implement the DELETE /tasks/{id} endpoint (delete a task).",
            "dependencies": [
              "BE-001"
            ],
            "estimated_time": "4 hours",
            "agent_role": "backend_developer",
            "acceptance_criteria": [
              "Endpoint accepts DELETE requests to /tasks/{id}.",
              "Endpoint returns a 200 status code on success.",
              "Endpoint returns a 404 status code if the task is not found."
            ],
            "status": "pending",
            "code_files": [
              "index.js"
            ]
          },
          {
            "id": "BE-006",
            "description": "Connect the backend API to the PostgreSQL database.",
            "dependencies": [
              "BE-001",
              "DB-002"
            ],
            "estimated_time": "6 hours",
            "agent_role": "backend_developer",
            "acceptance_criteria": [
              "Backend API can connect to the PostgreSQL database.",
              "Database connection is established without errors."
            ],
            "status": "pending",
            "code_files": [
              "index.js"
            ]
          },
          {
            "id": "BE-007",
            "description": "Implement database interactions for the POST /tasks endpoint.",
            "dependencies": [
              "BE-002",
              "BE-006"
            ],
            "estimated_time": "6 hours",
            "agent_role": "backend_developer",
            "acceptance_criteria": [
              "New tasks are saved to the database.",
              "Endpoint returns the newly created task with its ID."
            ],
            "status": "pending",
            "code_files": [
              "index.js"
            ]
          },
          {
            "id": "BE-008",
            "description": "Implement database interactions for the GET /tasks endpoint.",
            "dependencies": [
              "BE-003",
              "BE-006"
            ],
            "estimated_time": "4 hours",
            "agent_role": "backend_developer",
            "acceptance_criteria": [
              "All tasks are retrieved from the database.",
              "Endpoint returns the list of tasks."
            ],
            "status": "pending",
            "code_files": [
              "index.js"
            ]
          },
          {
            "id": "BE-009",
            "description": "Implement database interactions for the PUT /tasks/{id} endpoint.",
            "dependencies": [
              "BE-004",
              "BE-006"
            ],
            "estimated_time": "6 hours",
            "agent_role": "backend_developer",
            "acceptance_criteria": [
              "Task completion status is updated in the database.",
              "Endpoint returns the updated task."
            ],
            "status": "pending",
            "code_files": [
              "index.js"
            ]
          },
          {
            "id": "BE-010",
            "description": "Implement database interactions for the DELETE /tasks/{id} endpoint.",
            "dependencies": [
              "BE-005",
              "BE-006"
            ],
            "estimated_time": "4 hours",
            "agent_role": "backend_developer",
            "acceptance_criteria": [
              "Task is deleted from the database.",
              "Endpoint returns a success message."
            ],
            "status": "pending",
            "code_files": [
              "index.js"
            ]
          },
          {
            "id": "TEST-001",
            "description": "Test the POST /tasks endpoint.",
            "dependencies": [
              "BE-002",
              "BE-007"
            ],
            "estimated_time": "2 hours",
            "agent_role": "backend_developer",
            "acceptance_criteria": [
              "Endpoint returns 201 status code on successful task creation.",
              "Endpoint returns 400 status code on invalid input.",
              "Task is saved to the database."
            ],
            "status": "pending",
            "code_files": [
              "index.js"
            ]
          },
          {
            "id": "TEST-002",
            "description": "Test the GET /tasks endpoint.",
            "dependencies": [
              "BE-003",
              "BE-008"
            ],
            "estimated_time": "2 hours",
            "agent_role": "backend_developer",
            "acceptance_criteria": [
              "Endpoint returns 200 status code.",
              "Endpoint returns a list of tasks from the database."
            ],
            "status": "pending",
            "code_files": [
              "index.js"
            ]
          },
          {
            "id": "TEST-003",
            "description": "Test the PUT /tasks/{id} endpoint.",
            "dependencies": [
              "BE-004",
              "BE-009"
            ],
            "estimated_time": "2 hours",
            "agent_role": "backend_developer",
            "acceptance_criteria": [
              "Endpoint returns 200 status code on successful update.",
              "Endpoint returns 400 status code on invalid input.",
              "Endpoint returns 404 status code if task not found.",
              "Task completion status is updated in the database."
            ],
            "status": "pending",
            "code_files": [
              "index.js"
            ]
          },
          {
            "id": "TEST-004",
            "description": "Test the DELETE /tasks/{id} endpoint.",
            "dependencies": [
              "BE-005",
              "BE-010"
            ],
            "estimated_time": "2 hours",
            "agent_role": "backend_developer",
            "acceptance_criteria": [
              "Endpoint returns 200 status code on successful deletion.",
              "Endpoint returns 404 status code if task not found.",
              "Task is deleted from the database."
            ],
            "status": "pending",
            "code_files": [
              "index.js"
            ]
          }
        ]
      },
      {
        "name": "Database Phase",
        "description": "Tasks related to database phase",
        "deliverables": [
          "Completed DB-001",
          "Completed DB-002"
        ],
        "estimated_duration_hours": 6.0,
        "work_items": [
          {
            "id": "DB-001",
            "description": "Set up PostgreSQL database in AWS RDS.",
            "dependencies": [],
            "estimated_time": "4 hours",
            "agent_role": "database_specialist",
            "acceptance_criteria": [
              "PostgreSQL database instance is created in AWS RDS.",
              "Database is accessible."
            ],
            "status": "pending",
            "code_files": []
          },
          {
            "id": "DB-002",
            "description": "Create the 'tasks' table in PostgreSQL.",
            "dependencies": [
              "DB-001"
            ],
            "estimated_time": "2 hours",
            "agent_role": "database_specialist",
            "acceptance_criteria": [
              "Tasks table exists with the correct schema (id, description, created_at, completed).",
              "Appropriate data types and constraints are applied."
            ],
            "status": "pending",
            "code_files": []
          }
        ]
      },
      {
        "name": "Devops_Engineer Phase",
        "description": "Tasks related to devops_engineer phase",
        "deliverables": [
          "Completed DEPLOY-001",
          "Completed DEPLOY-002",
          "Completed DEPLOY-003",
          "Completed DEPLOY-004"
        ],
        "estimated_duration_hours": 22.0,
        "work_items": [
          {
            "id": "DEPLOY-001",
            "description": "Set up AWS infrastructure (EC2, RDS, Route 53).",
            "dependencies": [
              "DB-001"
            ],
            "estimated_time": "8 hours",
            "agent_role": "devops_engineer",
            "acceptance_criteria": [
              "EC2 instance is created and configured.",
              "RDS instance is accessible.",
              "Route 53 is configured for DNS."
            ],
            "status": "pending",
            "code_files": []
          },
          {
            "id": "DEPLOY-002",
            "description": "Deploy the frontend to EC2 (or a service like AWS Amplify).",
            "dependencies": [
              "FE-001",
              "DEPLOY-001"
            ],
            "estimated_time": "4 hours",
            "agent_role": "devops_engineer",
            "acceptance_criteria": [
              "Frontend application is deployed to EC2 (or Amplify).",
              "Frontend is accessible via a public URL."
            ],
            "status": "pending",
            "code_files": []
          },
          {
            "id": "DEPLOY-003",
            "description": "Deploy the backend to EC2.",
            "dependencies": [
              "BE-001",
              "DEPLOY-001",
              "BE-006"
            ],
            "estimated_time": "6 hours",
            "agent_role": "devops_engineer",
            "acceptance_criteria": [
              "Backend application is deployed to EC2.",
              "Backend API is accessible via a public URL.",
              "Backend connects to the database."
            ],
            "status": "pending",
            "code_files": [
              "index.js"
            ]
          },
          {
            "id": "DEPLOY-004",
            "description": "Configure monitoring and logging with CloudWatch and Sentry.",
            "dependencies": [
              "DEPLOY-003"
            ],
            "estimated_time": "4 hours",
            "agent_role": "devops_engineer",
            "acceptance_criteria": [
              "CloudWatch is configured to monitor server resources and application logs.",
              "Sentry (or similar) is configured to capture and report errors."
            ],
            "status": "pending",
            "code_files": []
          }
        ]
      }
    ],
    "timeline_estimation": {
      "start_date": "2025-07-08T17:22:35.877228",
      "end_date": "TBD",
      "milestones": []
    },
    "risk_assessment": [],
    "resource_requirements": [
      {
        "role": "Frontend Developer",
        "count": 1,
        "estimated_time_allocation": "100%",
        "phases": [
          "Frontend Phase"
        ],
        "skills_required": []
      },
      {
        "role": "Database Specialist",
        "count": 1,
        "estimated_time_allocation": "100%",
        "phases": [
          "Database Phase"
        ],
        "skills_required": []
      },
      {
        "role": "Backend Developer",
        "count": 1,
        "estimated_time_allocation": "100%",
        "phases": [
          "Backend Phase"
        ],
        "skills_required": []
      },
      {
        "role": "Devops Engineer",
        "count": 1,
        "estimated_time_allocation": "100%",
        "phases": [
          "Devops_Engineer Phase"
        ],
        "skills_required": []
      }
    ],
    "deliverables": [
      "Completed FE-001",
      "Completed FE-002",
      "Completed FE-003",
      "Completed FE-004",
      "Completed FE-005",
      "Completed FE-006",
      "Completed FE-007",
      "Completed FE-008",
      "Completed TEST-005",
      "Completed BE-001",
      "Completed BE-002",
      "Completed BE-003",
      "Completed BE-004",
      "Completed BE-005",
      "Completed BE-006",
      "Completed BE-007",
      "Completed BE-008",
      "Completed BE-009",
      "Completed BE-010",
      "Completed TEST-001",
      "Completed TEST-002",
      "Completed TEST-003",
      "Completed TEST-004",
      "Completed DB-001",
      "Completed DB-002",
      "Completed DEPLOY-001",
      "Completed DEPLOY-002",
      "Completed DEPLOY-003",
      "Completed DEPLOY-004"
    ],
    "dependencies": [],
    "raw_plan": "plan=ImplementationPlan(project_summary={'title': 'Generated Project Plan', 'description': 'Develop a simple web application for managing a list of tasks, including adding, viewing, updating, and deleting tasks. The application will use React for the frontend, Node.js/Express for the backend, and PostgreSQL for the database. The application will be deployed to AWS.', 'overall_complexity': 'Medium', 'estimated_duration': 'TBD', 'key_challenges': [], 'success_criteria': []}, phases=[{'name': 'Frontend Phase', 'description': 'Tasks related to frontend phase', 'deliverables': ['Completed FE-001', 'Completed FE-002', 'Completed FE-003', 'Completed FE-004', 'Completed FE-005', 'Completed FE-006', 'Completed FE-007', 'Completed FE-008', 'Completed TEST-005'], 'estimated_duration_hours': 40.0, 'work_items': [{'id': 'FE-001', 'description': 'Set up React project using Create React App.', 'dependencies': [], 'estimated_time': '2 hours', 'agent_role': 'frontend_developer', 'acceptance_criteria': ['Project is initialized successfully.', 'Default React app runs without errors.'], 'status': 'pending', 'code_files': ['package.json', 'src/App.js', 'src/index.js']}, {'id': 'FE-002', 'description': 'Design and implement the UI for adding tasks (input field and add button).', 'dependencies': ['FE-001'], 'estimated_time': '4 hours', 'agent_role': 'frontend_developer', 'acceptance_criteria': ['UI elements for task input and add button are present.', 'UI elements are styled appropriately.'], 'status': 'pending', 'code_files': ['src/App.js', 'src/App.css']}, {'id': 'FE-003', 'description': 'Design and implement the UI for viewing tasks (task list).', 'dependencies': ['FE-001'], 'estimated_time': '4 hours', 'agent_role': 'frontend_developer', 'acceptance_criteria': ['Task list container is present.', 'Tasks are displayed in a list format (e.g., unordered list).'], 'status': 'pending', 'code_files': ['src/App.js', 'src/App.css']}, {'id': 'FE-004', 'description': 'Implement basic styling for the UI.', 'dependencies': ['FE-002', 'FE-003'], 'estimated_time': '4 hours', 'agent_role': 'frontend_developer', 'acceptance_criteria': ['UI elements are visually appealing.', 'Layout is responsive.'], 'status': 'pending', 'code_files': ['src/App.css']}, {'id': 'FE-005', 'description': 'Implement API calls in the frontend to add tasks.', 'dependencies': ['FE-002', 'BE-002'], 'estimated_time': '6 hours', 'agent_role': 'frontend_developer', 'acceptance_criteria': ['Frontend makes a POST request to /tasks when the add button is clicked.', 'New tasks are successfully added to the backend.'], 'status': 'pending', 'code_files': ['src/App.js']}, {'id': 'FE-006', 'description': 'Implement API calls in the frontend to fetch tasks.', 'dependencies': ['FE-003', 'BE-003'], 'estimated_time': '6 hours', 'agent_role': 'frontend_developer', 'acceptance_criteria': ['Frontend makes a GET request to /tasks on component mount.', 'Tasks are displayed in the task list.'], 'status': 'pending', 'code_files': ['src/App.js']}, {'id': 'FE-007', 'description': 'Implement API calls in the frontend to update task completion status.', 'dependencies': ['FE-003', 'BE-004'], 'estimated_time': '6 hours', 'agent_role': 'frontend_developer', 'acceptance_criteria': ['Frontend makes a PUT request to /tasks/{id} when a task is marked as complete/incomplete.', 'Task completion status is updated in the backend and reflected in the UI.'], 'status': 'pending', 'code_files': ['src/App.js']}, {'id': 'FE-008', 'description': 'Implement API calls in the frontend to delete tasks.', 'dependencies': ['FE-003', 'BE-005'], 'estimated_time': '4 hours', 'agent_role': 'frontend_developer', 'acceptance_criteria': ['Frontend makes a DELETE request to /tasks/{id} when a task is deleted.', 'Task is removed from the UI.'], 'status': 'pending', 'code_files': ['src/App.js']}, {'id': 'TEST-005', 'description': 'End-to-end testing: Add a task, view it, mark it complete, and delete it.', 'dependencies': ['FE-005', 'FE-006', 'FE-007', 'FE-008', 'TEST-001', 'TEST-002', 'TEST-003', 'TEST-004'], 'estimated_time': '4 hours', 'agent_role': 'frontend_developer', 'acceptance_criteria': ['Task is successfully added through the UI.', 'Task is displayed in the task list.', 'Task completion status can be toggled.', 'Task can be deleted from the UI.'], 'status': 'pending', 'code_files': ['src/App.js']}]}, {'name': 'Backend Phase', 'description': 'Tasks related to backend phase', 'deliverables': ['Completed BE-001', 'Completed BE-002', 'Completed BE-003', 'Completed BE-004', 'Completed BE-005', 'Completed BE-006', 'Completed BE-007', 'Completed BE-008', 'Completed BE-009', 'Completed BE-010', 'Completed TEST-001', 'Completed TEST-002', 'Completed TEST-003', 'Completed TEST-004'], 'estimated_duration_hours': 56.0, 'work_items': [{'id': 'BE-001', 'description': 'Set up Node.js and Express.js project.', 'dependencies': [], 'estimated_time': '2 hours', 'agent_role': 'backend_developer', 'acceptance_criteria': ['Project is initialized successfully.', 'Express server runs without errors.'], 'status': 'pending', 'code_files': ['package.json', 'index.js']}, {'id': 'BE-002', 'description': 'Implement the POST /tasks endpoint (create a new task).', 'dependencies': ['BE-001'], 'estimated_time': '6 hours', 'agent_role': 'backend_developer', 'acceptance_criteria': ['Endpoint accepts POST requests to /tasks.', 'Endpoint parses the request body for the task description.', 'Endpoint returns a 201 status code on success.', 'Endpoint returns a 400 status code on invalid input.'], 'status': 'pending', 'code_files': ['index.js']}, {'id': 'BE-003', 'description': 'Implement the GET /tasks endpoint (get all tasks).', 'dependencies': ['BE-001'], 'estimated_time': '4 hours', 'agent_role': 'backend_developer', 'acceptance_criteria': ['Endpoint accepts GET requests to /tasks.', 'Endpoint returns a 200 status code on success.', 'Endpoint returns a JSON array of tasks.'], 'status': 'pending', 'code_files': ['index.js']}, {'id': 'BE-004', 'description': 'Implement the PUT /tasks/{id} endpoint (update a task).', 'dependencies': ['BE-001'], 'estimated_time': '6 hours', 'agent_role': 'backend_developer', 'acceptance_criteria': ['Endpoint accepts PUT requests to /tasks/{id}.', \"Endpoint parses the request body for the 'completed' status.\", 'Endpoint returns a 200 status code on success.', 'Endpoint returns a 400 status code on invalid input.', 'Endpoint returns a 404 status code if the task is not found.'], 'status': 'pending', 'code_files': ['index.js']}, {'id': 'BE-005', 'description': 'Implement the DELETE /tasks/{id} endpoint (delete a task).', 'dependencies': ['BE-001'], 'estimated_time': '4 hours', 'agent_role': 'backend_developer', 'acceptance_criteria': ['Endpoint accepts DELETE requests to /tasks/{id}.', 'Endpoint returns a 200 status code on success.', 'Endpoint returns a 404 status code if the task is not found.'], 'status': 'pending', 'code_files': ['index.js']}, {'id': 'BE-006', 'description': 'Connect the backend API to the PostgreSQL database.', 'dependencies': ['BE-001', 'DB-002'], 'estimated_time': '6 hours', 'agent_role': 'backend_developer', 'acceptance_criteria': ['Backend API can connect to the PostgreSQL database.', 'Database connection is established without errors.'], 'status': 'pending', 'code_files': ['index.js']}, {'id': 'BE-007', 'description': 'Implement database interactions for the POST /tasks endpoint.', 'dependencies': ['BE-002', 'BE-006'], 'estimated_time': '6 hours', 'agent_role': 'backend_developer', 'acceptance_criteria': ['New tasks are saved to the database.', 'Endpoint returns the newly created task with its ID.'], 'status': 'pending', 'code_files': ['index.js']}, {'id': 'BE-008', 'description': 'Implement database interactions for the GET /tasks endpoint.', 'dependencies': ['BE-003', 'BE-006'], 'estimated_time': '4 hours', 'agent_role': 'backend_developer', 'acceptance_criteria': ['All tasks are retrieved from the database.', 'Endpoint returns the list of tasks.'], 'status': 'pending', 'code_files': ['index.js']}, {'id': 'BE-009', 'description': 'Implement database interactions for the PUT /tasks/{id} endpoint.', 'dependencies': ['BE-004', 'BE-006'], 'estimated_time': '6 hours', 'agent_role': 'backend_developer', 'acceptance_criteria': ['Task completion status is updated in the database.', 'Endpoint returns the updated task.'], 'status': 'pending', 'code_files': ['index.js']}, {'id': 'BE-010', 'description': 'Implement database interactions for the DELETE /tasks/{id} endpoint.', 'dependencies': ['BE-005', 'BE-006'], 'estimated_time': '4 hours', 'agent_role': 'backend_developer', 'acceptance_criteria': ['Task is deleted from the database.', 'Endpoint returns a success message.'], 'status': 'pending', 'code_files': ['index.js']}, {'id': 'TEST-001', 'description': 'Test the POST /tasks endpoint.', 'dependencies': ['BE-002', 'BE-007'], 'estimated_time': '2 hours', 'agent_role': 'backend_developer', 'acceptance_criteria': ['Endpoint returns 201 status code on successful task creation.', 'Endpoint returns 400 status code on invalid input.', 'Task is saved to the database.'], 'status': 'pending', 'code_files': ['index.js']}, {'id': 'TEST-002', 'description': 'Test the GET /tasks endpoint.', 'dependencies': ['BE-003', 'BE-008'], 'estimated_time': '2 hours', 'agent_role': 'backend_developer', 'acceptance_criteria': ['Endpoint returns 200 status code.', 'Endpoint returns a list of tasks from the database.'], 'status': 'pending', 'code_files': ['index.js']}, {'id': 'TEST-003', 'description': 'Test the PUT /tasks/{id} endpoint.', 'dependencies': ['BE-004', 'BE-009'], 'estimated_time': '2 hours', 'agent_role': 'backend_developer', 'acceptance_criteria': ['Endpoint returns 200 status code on successful update.', 'Endpoint returns 400 status code on invalid input.', 'Endpoint returns 404 status code if task not found.', 'Task completion status is updated in the database.'], 'status': 'pending', 'code_files': ['index.js']}, {'id': 'TEST-004', 'description': 'Test the DELETE /tasks/{id} endpoint.', 'dependencies': ['BE-005', 'BE-010'], 'estimated_time': '2 hours', 'agent_role': 'backend_developer', 'acceptance_criteria': ['Endpoint returns 200 status code on successful deletion.', 'Endpoint returns 404 status code if task not found.', 'Task is deleted from the database.'], 'status': 'pending', 'code_files': ['index.js']}]}, {'name': 'Database Phase', 'description': 'Tasks related to database phase', 'deliverables': ['Completed DB-001', 'Completed DB-002'], 'estimated_duration_hours': 6.0, 'work_items': [{'id': 'DB-001', 'description': 'Set up PostgreSQL database in AWS RDS.', 'dependencies': [], 'estimated_time': '4 hours', 'agent_role': 'database_specialist', 'acceptance_criteria': ['PostgreSQL database instance is created in AWS RDS.', 'Database is accessible.'], 'status': 'pending', 'code_files': []}, {'id': 'DB-002', 'description': \"Create the 'tasks' table in PostgreSQL.\", 'dependencies': ['DB-001'], 'estimated_time': '2 hours', 'agent_role': 'database_specialist', 'acceptance_criteria': ['Tasks table exists with the correct schema (id, description, created_at, completed).', 'Appropriate data types and constraints are applied.'], 'status': 'pending', 'code_files': []}]}, {'name': 'Devops_Engineer Phase', 'description': 'Tasks related to devops_engineer phase', 'deliverables': ['Completed DEPLOY-001', 'Completed DEPLOY-002', 'Completed DEPLOY-003', 'Completed DEPLOY-004'], 'estimated_duration_hours': 22.0, 'work_items': [{'id': 'DEPLOY-001', 'description': 'Set up AWS infrastructure (EC2, RDS, Route 53).', 'dependencies': ['DB-001'], 'estimated_time': '8 hours', 'agent_role': 'devops_engineer', 'acceptance_criteria': ['EC2 instance is created and configured.', 'RDS instance is accessible.', 'Route 53 is configured for DNS.'], 'status': 'pending', 'code_files': []}, {'id': 'DEPLOY-002', 'description': 'Deploy the frontend to EC2 (or a service like AWS Amplify).', 'dependencies': ['FE-001', 'DEPLOY-001'], 'estimated_time': '4 hours', 'agent_role': 'devops_engineer', 'acceptance_criteria': ['Frontend application is deployed to EC2 (or Amplify).', 'Frontend is accessible via a public URL.'], 'status': 'pending', 'code_files': []}, {'id': 'DEPLOY-003', 'description': 'Deploy the backend to EC2.', 'dependencies': ['BE-001', 'DEPLOY-001', 'BE-006'], 'estimated_time': '6 hours', 'agent_role': 'devops_engineer', 'acceptance_criteria': ['Backend application is deployed to EC2.', 'Backend API is accessible via a public URL.', 'Backend connects to the database.'], 'status': 'pending', 'code_files': ['index.js']}, {'id': 'DEPLOY-004', 'description': 'Configure monitoring and logging with CloudWatch and Sentry.', 'dependencies': ['DEPLOY-003'], 'estimated_time': '4 hours', 'agent_role': 'devops_engineer', 'acceptance_criteria': ['CloudWatch is configured to monitor server resources and application logs.', 'Sentry (or similar) is configured to capture and report errors.'], 'status': 'pending', 'code_files': []}]}], resource_allocation=[{'role': 'Frontend Developer', 'count': 1, 'estimated_time_allocation': '100%', 'phases': ['Frontend Phase'], 'skills_required': []}, {'role': 'Database Specialist', 'count': 1, 'estimated_time_allocation': '100%', 'phases': ['Database Phase'], 'skills_required': []}, {'role': 'Backend Developer', 'count': 1, 'estimated_time_allocation': '100%', 'phases': ['Backend Phase'], 'skills_required': []}, {'role': 'Devops Engineer', 'count': 1, 'estimated_time_allocation': '100%', 'phases': ['Devops_Engineer Phase'], 'skills_required': []}], risks_and_mitigations=[], timeline={'start_date': '2025-07-08T17:22:35.877228', 'end_date': 'TBD', 'milestones': []}, tech_stack={}, metadata={'generated_at': '2025-07-08T17:22:35.877228', 'version': '1.0', 'author': 'Multi-AI Dev System', 'tags': [], 'notes': 'Converted from WorkItemBacklog. Original summary: Develop a simple web application for managing a list of tasks, including adding, viewing, updating, and deleting tasks. The application will use React for the frontend, Node.js/Express for the backend, and PostgreSQL for the database. The application will be deployed to AWS.'}) summary='Develop a simple web application for managing a list of tasks, including adding, viewing, updating, and deleting tasks. The application will use React for the frontend, Node.js/Express for the backend, and PostgreSQL for the database. The application will be deployed to AWS.' metadata=PlanMetadata(generated_at='2025-07-08T17:22:35.877228', version='1.0', author='Multi-AI Dev System', tags=[], notes='Converted from WorkItemBacklog. Original summary: Develop a simple web application for managing a list of tasks, including adding, viewing, updating, and deleting tasks. The application will use React for the frontend, Node.js/Express for the backend, and PostgreSQL for the database. The application will be deployed to AWS.')"
  },
  "workflow_state_snapshot": {
    "requirements_analysis": {
      "project_name": "Hello World Task List",
      "project_summary": "A simple web application to manage a list of tasks.",
      "project_goals": [
        "Allow a user to add a task",
        "Allow a user to see their list of tasks"
      ],
      "target_audience": [
        "Users who want to manage a list of tasks"
      ],
      "business_context": "This project provides a basic task management solution.",
      "requirements": [
        {
          "id": "REQ-001",
          "description": "A user can create a new task with a text description.",
          "category": "functional",
          "priority": 1
        },
        {
          "id": "REQ-002",
          "description": "A user can see a list of all created tasks.",
          "category": "functional",
          "priority": 1
        },
        {
          "id": "REQ-003",
          "description": "The application must load quickly.",
          "category": "non_functional",
          "priority": 2
        },
        {
          "id": "REQ-004",
          "description": "The application must be secure.",
          "category": "non_functional",
          "priority": 2
        }
      ],
      "functional_requirements": [
        "A user can create a new task with a text description.",
        "A user can see a list of all created tasks."
      ],
      "non_functional_requirements": [
        "The application must load quickly.",
        "The application must be secure."
      ],
      "stakeholders": [
        "Users"
      ],
      "success_criteria": [
        "Users can successfully add tasks.",
        "Users can successfully view their task list.",
        "The application loads quickly.",
        "The application is secure."
      ],
      "constraints": [],
      "assumptions": [],
      "risks": [],
      "domain_specific_details": {},
      "quality_assessment": {
        "clarity_score": 9.0,
        "completeness_score": 8.0,
        "consistency_score": 10.0,
        "recommendations": []
      },
      "gap_analysis": {
        "identified_gaps": [],
        "recommendations_for_completion": []
      }
    },
    "tech_stack_recommendation": {
      "frontend_options": [
        {
          "name": "React",
          "language": "JavaScript",
          "reasoning": "React is a popular and efficient JavaScript library for building user interfaces. It offers a component-based architecture, making it easy to manage and update the UI. Its virtual DOM and efficient update mechanisms contribute to fast loading times, addressing the non-functional requirement for speed.",
          "key_libraries": [
            "React Router (for navigation)",
            "Axios or Fetch (for API calls)",
            "Material UI or Bootstrap (for UI components)"
          ],
          "pros": [
            "Large community and extensive documentation.",
            "Component-based architecture promotes code reusability and maintainability.",
            "Virtual DOM for efficient updates and improved performance.",
            "Many readily available UI component libraries."
          ],
          "cons": [
            "Requires understanding of JavaScript and JSX.",
            "Can have a steeper learning curve for beginners.",
            "Requires additional libraries for routing and state management (though these are readily available)."
          ],
          "selected": false
        },
        {
          "name": "Vue.js",
          "language": "JavaScript",
          "reasoning": "Vue.js is a progressive framework that's easy to learn and integrate. It offers a good balance between simplicity and power, making it suitable for this project's scope. It also has a good performance profile, meeting the speed requirement.",
          "key_libraries": [
            "Vue Router (for navigation)",
            "Axios or Fetch (for API calls)",
            "Vuetify or BootstrapVue (for UI components)"
          ],
          "pros": [
            "Easy to learn and use.",
            "Good performance.",
            "Well-documented.",
            "Progressive framework - can be integrated into existing projects."
          ],
          "cons": [
            "Smaller community compared to React.",
            "Ecosystem is not as mature as React's."
          ],
          "selected": false
        },
        {
          "name": "HTML, CSS, JavaScript (Vanilla)",
          "language": "JavaScript",
          "reasoning": "For a simple task list application, using vanilla JavaScript, HTML, and CSS can be a viable option. It avoids the overhead of a framework, resulting in potentially faster initial load times and simpler code, which aligns with the speed requirement. This approach is suitable given the limited scope of the project.",
          "key_libraries": [],
          "pros": [
            "No external dependencies.",
            "Fast initial load times.",
            "Simple to understand and debug.",
            "Full control over the code."
          ],
          "cons": [
            "More manual work for UI updates and DOM manipulation.",
            "Can become complex to manage for larger applications.",
            "Requires more manual effort for componentization."
          ],
          "selected": false
        }
      ],
      "backend_options": [
        {
          "name": "Node.js with Express",
          "language": "JavaScript",
          "reasoning": "Node.js with Express provides a lightweight and efficient backend solution. JavaScript is used on both the frontend and backend, which can streamline development. Express simplifies routing and middleware management, making it easy to build a RESTful API for the task list application. This is a good choice for rapid development.",
          "key_libraries": [
            "Express.js (web framework)",
            "body-parser (for parsing request bodies)",
            "cors (for handling CORS)",
            "bcrypt (for password hashing)"
          ],
          "pros": [
            "JavaScript on both frontend and backend (full-stack JavaScript).",
            "Large community and extensive documentation.",
            "Fast development with Express.",
            "Good performance with Node.js's non-blocking I/O."
          ],
          "cons": [
            "Can be challenging to scale for very large applications.",
            "Requires careful handling of asynchronous operations."
          ],
          "selected": false
        },
        {
          "name": "Python with Flask",
          "language": "Python",
          "reasoning": "Flask is a microframework that is easy to learn and use. Python is a versatile language with a large community and many libraries. Flask allows for rapid development of REST APIs, suitable for this project's needs.",
          "key_libraries": [
            "Flask (web framework)",
            "Flask-RESTful (for building REST APIs)",
            "SQLAlchemy (for database interaction)",
            "bcrypt (for password hashing)"
          ],
          "pros": [
            "Easy to learn and use.",
            "Large community and extensive documentation.",
            "Good for rapid prototyping.",
            "Python's readability."
          ],
          "cons": [
            "Can require more boilerplate code compared to Node.js/Express.",
            "Performance might be slightly slower than Node.js for some tasks."
          ],
          "selected": false
        },
        {
          "name": "Java with Spring Boot",
          "language": "Java",
          "reasoning": "Spring Boot provides a robust and scalable backend solution. Java is a mature language with excellent performance characteristics. Spring Boot simplifies the development of RESTful APIs. This is a good choice if scalability and enterprise-grade features are desired.",
          "key_libraries": [
            "Spring Boot (web framework)",
            "Spring Data JPA (for database interaction)",
            "Spring Security (for security)",
            "Maven or Gradle (for build automation)"
          ],
          "pros": [
            "Robust and scalable.",
            "Mature ecosystem and large community.",
            "Excellent performance.",
            "Good for enterprise-level applications."
          ],
          "cons": [
            "Steeper learning curve.",
            "More complex setup compared to Node.js/Express or Flask.",
            "Can be slower to develop initially."
          ],
          "selected": false
        }
      ],
      "database_options": [
        {
          "name": "PostgreSQL",
          "language": null,
          "reasoning": "PostgreSQL is a robust and reliable relational database. It offers excellent data integrity, security features, and scalability. It's a good choice for this project because it can handle the data requirements and offers good performance.",
          "key_libraries": [
            "psycopg2 (for Python)",
            "pg (for Node.js)",
            "JDBC driver (for Java)"
          ],
          "pros": [
            "ACID-compliant, ensuring data integrity.",
            "Excellent security features.",
            "Scalable and performant.",
            "Large community and extensive documentation."
          ],
          "cons": [
            "Can be more complex to set up and manage than simpler databases.",
            "Requires more resources than simpler databases."
          ],
          "selected": false
        },
        {
          "name": "MongoDB",
          "language": null,
          "reasoning": "MongoDB is a NoSQL database that is easy to set up and use. It's a good choice for this project because it can handle the data requirements and offers good performance. It is schema-less, which can be beneficial for rapid development.",
          "key_libraries": [
            "Mongoose (for Node.js)",
            "pymongo (for Python)",
            "MongoDB Java Driver (for Java)"
          ],
          "pros": [
            "Flexible schema.",
            "Easy to scale horizontally.",
            "Good performance for read-heavy workloads.",
            "Easy to set up and use."
          ],
          "cons": [
            "Data consistency can be more challenging to manage than with relational databases.",
            "Not as mature as relational databases."
          ],
          "selected": false
        },
        {
          "name": "SQLite",
          "language": null,
          "reasoning": "SQLite is a lightweight, file-based database. It's a good choice for small projects and prototyping because it requires no separate server process and is easy to set up. It's suitable for this project's scope.",
          "key_libraries": [
            "sqlite3 (built-in for Python)",
            "sqlite3 (for Node.js)",
            "JDBC driver (for Java)"
          ],
          "pros": [
            "Simple to set up and use.",
            "No server process required.",
            "Good for prototyping and small projects.",
            "File-based, easy to deploy."
          ],
          "cons": [
            "Not suitable for high-traffic or large-scale applications.",
            "Limited concurrency support."
          ],
          "selected": false
        }
      ],
      "cloud_options": [
        {
          "name": "AWS (Amazon Web Services)",
          "language": null,
          "reasoning": "AWS provides a comprehensive suite of services for hosting and deploying web applications. It offers scalability, security, and a wide range of options for compute, storage, and databases. AWS is a good choice for this project because it can handle the scalability and security requirements.",
          "key_libraries": [
            "AWS SDK (for various languages)",
            "CloudFormation (for infrastructure as code)",
            "Serverless Framework (for serverless deployments)"
          ],
          "pros": [
            "Highly scalable and reliable.",
            "Wide range of services.",
            "Mature ecosystem and large community.",
            "Good security features."
          ],
          "cons": [
            "Can be complex to manage.",
            "Can be expensive if not managed carefully.",
            "Steeper learning curve."
          ],
          "selected": false
        },
        {
          "name": "Google Cloud Platform (GCP)",
          "language": null,
          "reasoning": "GCP offers a similar set of services to AWS, with a focus on data analytics and machine learning. It's a good choice for this project because it can handle the scalability and security requirements. GCP is known for its competitive pricing.",
          "key_libraries": [
            "Google Cloud SDK (for various languages)",
            "Terraform (for infrastructure as code)",
            "Cloud Functions (for serverless deployments)"
          ],
          "pros": [
            "Competitive pricing.",
            "Strong in data analytics and machine learning.",
            "Scalable and reliable.",
            "Good security features."
          ],
          "cons": [
            "Can be complex to manage.",
            "Steeper learning curve.",
            "Ecosystem is not as mature as AWS."
          ],
          "selected": false
        },
        {
          "name": "Heroku",
          "language": null,
          "reasoning": "Heroku is a Platform-as-a-Service (PaaS) that simplifies the deployment and management of web applications. It's a good choice for this project because it offers a simple and easy-to-use deployment process. It's ideal for small projects and rapid prototyping.",
          "key_libraries": [
            "Heroku CLI"
          ],
          "pros": [
            "Easy to deploy and manage.",
            "Simple and intuitive interface.",
            "Good for small projects and rapid prototyping.",
            "Automated scaling."
          ],
          "cons": [
            "Limited control over infrastructure.",
            "Can be more expensive than other options for larger applications.",
            "Vendor lock-in."
          ],
          "selected": false
        }
      ],
      "architecture_options": [
        {
          "pattern": "Monolithic Architecture",
          "scalability_score": 5.0,
          "maintainability_score": 6.0,
          "development_speed_score": 9.0,
          "overall_score": 7.0,
          "reasoning": "For a simple task list application, a monolithic architecture is suitable. All components (frontend, backend, database) reside within a single codebase. This simplifies development and deployment, leading to faster development speed. However, scalability is limited compared to microservices, and maintainability can decrease as the application grows. The project's limited scope makes this a good starting point."
        },
        {
          "pattern": "Microservices Architecture",
          "scalability_score": 8.0,
          "maintainability_score": 7.0,
          "development_speed_score": 6.0,
          "overall_score": 7.0,
          "reasoning": "While more complex, a microservices architecture offers better scalability and maintainability in the long run. Each service (e.g., task management, user authentication) can be developed, deployed, and scaled independently. However, this approach increases development complexity and requires more infrastructure management. It's likely overkill for this small project, but could be considered if future growth is anticipated."
        },
        {
          "pattern": "Serverless Architecture",
          "scalability_score": 9.0,
          "maintainability_score": 7.0,
          "development_speed_score": 7.0,
          "overall_score": 7.0,
          "reasoning": "Serverless architecture leverages cloud provider services (e.g., AWS Lambda, Google Cloud Functions) to execute code without managing servers. This can significantly reduce operational overhead and improve scalability. Development speed can be good, but debugging and monitoring can be more complex. This is a good option if the backend logic is relatively simple and the project aims for cost efficiency and scalability."
        }
      ],
      "tool_options": [
        {
          "name": "Git",
          "language": null,
          "reasoning": "Git is essential for version control, allowing developers to track changes, collaborate effectively, and revert to previous versions if needed. It's a standard tool for software development.",
          "key_libraries": [],
          "pros": [],
          "cons": [],
          "selected": false
        },
        {
          "name": "VS Code",
          "language": null,
          "reasoning": "VS Code is a popular and versatile code editor with excellent support for various languages and frameworks. It offers features like code completion, debugging, and integrated terminal, which improve developer productivity.",
          "key_libraries": [],
          "pros": [],
          "cons": [],
          "selected": false
        },
        {
          "name": "Postman",
          "language": null,
          "reasoning": "Postman is a tool for testing and documenting APIs. It allows developers to send requests to the backend and inspect the responses, which is crucial for API development and debugging.",
          "key_libraries": [],
          "pros": [],
          "cons": [],
          "selected": false
        }
      ],
      "risks": [
        {
          "category": "Security",
          "description": "Vulnerabilities in dependencies or the application code could lead to security breaches, such as data theft or unauthorized access. This is a risk because the application handles user data.",
          "severity": "High",
          "likelihood": "Medium",
          "mitigation": "Implement secure coding practices, regularly update dependencies, use security scanners, and implement authentication and authorization mechanisms."
        },
        {
          "category": "Performance",
          "description": "Slow loading times or poor responsiveness could negatively impact user experience. This is a risk because the application must load quickly.",
          "severity": "Medium",
          "likelihood": "Medium",
          "mitigation": "Optimize code for performance, use caching, minimize HTTP requests, and use a Content Delivery Network (CDN)."
        },
        {
          "category": "Scalability",
          "description": "The application might not be able to handle a large number of users or tasks if the architecture is not designed for scalability. This is a risk if the application gains popularity.",
          "severity": "Low",
          "likelihood": "Low",
          "mitigation": "Choose scalable technologies (e.g., cloud-based services), design the architecture with scalability in mind, and monitor performance."
        },
        {
          "category": "Development Complexity",
          "description": "Choosing a complex technology stack or architecture could increase development time and effort. This is a risk if the team is not familiar with the chosen technologies.",
          "severity": "Medium",
          "likelihood": "Medium",
          "mitigation": "Choose technologies that the team is familiar with, or provide training. Start with a simple architecture and scale up if needed."
        }
      ],
      "synthesis": {
        "backend": {
          "language": "JavaScript",
          "framework": "Node.js with Express",
          "reasoning": "Node.js with Express provides a lightweight and efficient backend solution. JavaScript is used on both the frontend and backend, which can streamline development. Express simplifies routing and middleware management, making it easy to build a RESTful API for the task list application. This is a good choice for rapid development."
        },
        "frontend": {
          "language": "JavaScript",
          "framework": "React",
          "reasoning": "React is a popular and efficient JavaScript library for building user interfaces. It offers a component-based architecture, making it easy to manage and update the UI. Its virtual DOM and efficient update mechanisms contribute to fast loading times, addressing the non-functional requirement for speed."
        },
        "database": {
          "type": "PostgreSQL",
          "reasoning": "PostgreSQL is a robust and reliable relational database. It offers excellent data integrity, security features, and scalability. It's a good choice for this project because it can handle the data requirements and offers good performance."
        },
        "architecture_pattern": "Monolithic Architecture",
        "deployment_environment": {
          "cloud_provider": "AWS",
          "reasoning": "AWS provides a comprehensive suite of services for hosting and deploying web applications. It offers scalability, security, and a wide range of options for compute, storage, and databases. AWS is a good choice for this project because it can handle the scalability and security requirements."
        },
        "key_libraries_tools": [
          {
            "name": "React Router",
            "purpose": "For navigation in the React frontend."
          },
          {
            "name": "Axios",
            "purpose": "For making API calls from the frontend."
          },
          {
            "name": "Express.js",
            "purpose": "For building the backend API."
          },
          {
            "name": "PostgreSQL",
            "purpose": "For storing the task data."
          },
          {
            "name": "Git",
            "purpose": "For version control."
          },
          {
            "name": "VS Code",
            "purpose": "For code editing and development."
          },
          {
            "name": "Postman",
            "purpose": "For API testing."
          }
        ],
        "estimated_complexity": "Low"
      },
      "selected_stack": null
    },
    "system_design": {
      "architecture": {
        "pattern": "Monolithic Architecture",
        "justification": "The project's scope is limited to a simple task list application. A monolithic architecture simplifies development and deployment, leading to faster development speed. It is appropriate for the project's size and requirements.",
        "key_benefits": [
          "Faster development speed.",
          "Simplified deployment.",
          "Easier to manage for a small team."
        ],
        "potential_drawbacks": [
          "Limited scalability compared to microservices.",
          "Maintainability can decrease as the application grows."
        ]
      },
      "components": [
        {
          "name": "Frontend",
          "description": "The user interface for the task list application.",
          "category": "frontend",
          "technologies": [
            "React",
            "JavaScript",
            "HTML",
            "CSS"
          ],
          "dependencies": [
            "Backend API"
          ],
          "responsibilities": [
            "Displaying the task list.",
            "Allowing users to add new tasks.",
            "Handling user interactions.",
            "Making API calls to the backend."
          ],
          "design_patterns": [
            "Component-based architecture"
          ]
        },
        {
          "name": "Backend API",
          "description": "The RESTful API that handles task management logic and data storage.",
          "category": "backend",
          "technologies": [
            "Node.js",
            "Express.js",
            "JavaScript",
            "PostgreSQL"
          ],
          "dependencies": [
            "Database"
          ],
          "responsibilities": [
            "Handling API requests.",
            "Validating data.",
            "Interacting with the database.",
            "Implementing business logic."
          ],
          "design_patterns": [
            "RESTful API design"
          ]
        },
        {
          "name": "Database",
          "description": "The database for storing task data.",
          "category": "backend",
          "technologies": [
            "PostgreSQL"
          ],
          "dependencies": [],
          "responsibilities": [
            "Storing task data.",
            "Providing data access to the Backend API."
          ],
          "design_patterns": [
            "Relational database design"
          ]
        },
        {
          "name": "Deployment Infrastructure",
          "description": "Infrastructure for hosting and deploying the application.",
          "category": "infrastructure",
          "technologies": [
            "AWS",
            "EC2 (or equivalent)",
            "RDS (PostgreSQL)",
            "Load Balancer (optional)",
            "Route 53 (DNS)"
          ],
          "dependencies": [
            "Frontend",
            "Backend API",
            "Database"
          ],
          "responsibilities": [
            "Hosting the frontend application.",
            "Hosting the backend API.",
            "Managing the database.",
            "Ensuring application availability and scalability."
          ],
          "design_patterns": [
            "Cloud-based deployment"
          ]
        }
      ],
      "data_model": {
        "schema_type": "Relational",
        "tables": [
          {
            "name": "tasks",
            "purpose": "Stores information about tasks.",
            "fields": [
              {
                "name": "id",
                "type": "SERIAL",
                "constraints": [
                  "PRIMARY KEY"
                ],
                "description": "Unique identifier for the task."
              },
              {
                "name": "description",
                "type": "TEXT",
                "constraints": [
                  "NOT NULL"
                ],
                "description": "The task description."
              },
              {
                "name": "created_at",
                "type": "TIMESTAMP",
                "constraints": [
                  "NOT NULL",
                  "DEFAULT CURRENT_TIMESTAMP"
                ],
                "description": "Timestamp when the task was created."
              },
              {
                "name": "completed",
                "type": "BOOLEAN",
                "constraints": [
                  "NOT NULL",
                  "DEFAULT FALSE"
                ],
                "description": "Indicates if the task is completed."
              }
            ],
            "relationships": []
          }
        ],
        "relationships": [],
        "justification": "Relational databases provide strong data integrity and are well-suited for structured data like task lists. PostgreSQL offers excellent performance and features for this purpose."
      },
      "api_endpoints": {
        "style": "REST",
        "base_url": "/api/v1",
        "authentication": "None (for simplicity)",
        "endpoints": [
          {
            "method": "POST",
            "path": "/tasks",
            "purpose": "Create a new task.",
            "parameters": [
              {
                "description": "The task description.",
                "type": "string",
                "name": "description"
              }
            ],
            "response": {
              "201": {
                "message": "Task created successfully.",
                "task": {
                  "id": 1,
                  "description": "Example task",
                  "created_at": "2024-10-27T10:00:00.000Z",
                  "completed": false
                }
              },
              "400": {
                "message": "Bad Request - Invalid input."
              }
            },
            "authentication_required": false,
            "rate_limiting_applied": false
          },
          {
            "method": "GET",
            "path": "/tasks",
            "purpose": "Get a list of all tasks.",
            "parameters": [],
            "response": {
              "200": {
                "tasks": [
                  {
                    "id": 1,
                    "description": "Example task",
                    "created_at": "2024-10-27T10:00:00.000Z",
                    "completed": false
                  }
                ]
              }
            },
            "authentication_required": false,
            "rate_limiting_applied": false
          },
          {
            "method": "PUT",
            "path": "/tasks/{id}",
            "purpose": "Update a task (e.g., mark as complete).",
            "parameters": [
              {
                "name": "id",
                "type": "integer",
                "description": "The ID of the task to update."
              },
              {
                "name": "completed",
                "type": "boolean",
                "description": "Whether the task is completed."
              }
            ],
            "response": {
              "200": {
                "message": "Task updated successfully.",
                "task": {
                  "id": 1,
                  "description": "Example task",
                  "created_at": "2024-10-27T10:00:00.000Z",
                  "completed": true
                }
              },
              "400": {
                "message": "Bad Request - Invalid input."
              },
              "404": {
                "message": "Task not found."
              }
            },
            "authentication_required": false,
            "rate_limiting_applied": false
          },
          {
            "method": "DELETE",
            "path": "/tasks/{id}",
            "purpose": "Delete a task.",
            "parameters": [
              {
                "name": "id",
                "type": "integer",
                "description": "The ID of the task to delete."
              }
            ],
            "response": {
              "200": {
                "message": "Task deleted successfully."
              },
              "404": {
                "message": "Task not found."
              }
            },
            "authentication_required": false,
            "rate_limiting_applied": false
          }
        ],
        "error_handling": "Standard HTTP status codes and informative error messages in JSON format.",
        "rate_limiting_strategy": null
      },
      "security": {
        "authentication_method": "None (for simplicity)",
        "authorization_strategy": "None (for simplicity)",
        "data_encryption": {
          "at_rest": "Not applicable (for simplicity).",
          "in_transit": "HTTPS is used to encrypt data in transit."
        },
        "security_measures": [
          {
            "category": "Input Validation",
            "implementation": "Validate all user inputs on the backend to prevent injection attacks.",
            "mitigation": "SQL Injection, Cross-Site Scripting (XSS)",
            "priority": "High"
          },
          {
            "category": "HTTPS",
            "implementation": "Enforce HTTPS for all communication between the frontend and backend.",
            "mitigation": "Man-in-the-middle attacks, data interception",
            "priority": "High"
          },
          {
            "category": "Dependency Management",
            "implementation": "Regularly update dependencies to patch security vulnerabilities.",
            "mitigation": "Known vulnerabilities in dependencies",
            "priority": "Medium"
          },
          {
            "category": "Authentication",
            "implementation": "Implement authentication (e.g., JWT) if user accounts are added in the future.",
            "mitigation": "Unauthorized access",
            "priority": "Medium"
          },
          {
            "category": "Authorization",
            "implementation": "Implement authorization (e.g., RBAC) if user roles are added in the future.",
            "mitigation": "Unauthorized access",
            "priority": "Medium"
          }
        ],
        "vulnerability_mitigation_strategies": [
          "Input validation",
          "Output encoding",
          "Regular dependency updates",
          "Use of HTTPS"
        ],
        "compliance_standards": []
      },
      "scalability_and_performance": {
        "frontend_optimization": "Use React's virtual DOM and efficient update mechanisms. Optimize images and other assets. Implement code splitting and lazy loading.",
        "backend_optimization": "Use efficient database queries. Implement caching (e.g., Redis) if needed. Optimize API endpoints for performance.",
        "database_optimization": "Use appropriate indexes. Optimize database queries.",
        "deployment_considerations": "Use a Content Delivery Network (CDN) for static assets. Consider horizontal scaling of the backend if needed."
      },
      "deployment_strategy": {
        "environment": "AWS (EC2, RDS, Route 53)",
        "frontend_deployment": "Deploy the React frontend to an EC2 instance (or a service like AWS Amplify).",
        "backend_deployment": "Deploy the Node.js backend to an EC2 instance. Use a process manager like PM2 to keep the application running.",
        "database_deployment": "Use AWS RDS for PostgreSQL.",
        "dns_configuration": "Use Route 53 for DNS management.",
        "load_balancing": "Consider using a load balancer (e.g., AWS Elastic Load Balancing) if high availability is required."
      },
      "monitoring_and_logging": {
        "logging": "Use a logging library (e.g., Winston) in the backend to log application events and errors. Log client-side errors using a service like Sentry.",
        "monitoring": "Use AWS CloudWatch for monitoring server resources (CPU, memory, disk I/O), application metrics, and logs. Set up alerts for critical events.",
        "error_tracking": "Implement error tracking using a service like Sentry or Rollbar to capture and analyze errors."
      },
      "error_handling_strategy": "Use standard HTTP status codes. Return informative error messages in JSON format. Implement centralized error handling in both frontend and backend.",
      "development_phases_overview": [
        {
          "name": "Phase 1: Setup & Frontend Development",
          "description": "Set up the development environment, create the React frontend, and implement the UI for adding and viewing tasks.",
          "priority": "High",
          "dependencies": [],
          "tasks": [
            "Set up React project.",
            "Design and implement the UI for adding tasks.",
            "Design and implement the UI for viewing tasks.",
            "Implement basic styling."
          ],
          "estimated_duration": "1 week"
        },
        {
          "name": "Phase 2: Backend API Development",
          "description": "Develop the Node.js backend API to handle task creation, retrieval, update, and deletion.",
          "priority": "High",
          "dependencies": [
            "Phase 1: Setup & Frontend Development"
          ],
          "tasks": [
            "Set up Node.js and Express.js project.",
            "Design and implement API endpoints (POST /tasks, GET /tasks, PUT /tasks/{id}, DELETE /tasks/{id}).",
            "Implement data validation.",
            "Connect to the PostgreSQL database."
          ],
          "estimated_duration": "1 week"
        },
        {
          "name": "Phase 3: Database Setup & Integration",
          "description": "Set up the PostgreSQL database and integrate it with the backend API.",
          "priority": "High",
          "dependencies": [
            "Phase 2: Backend API Development"
          ],
          "tasks": [
            "Set up PostgreSQL database in AWS RDS.",
            "Create the 'tasks' table.",
            "Implement database interactions in the backend API (CRUD operations)."
          ],
          "estimated_duration": "1 week"
        },
        {
          "name": "Phase 4: Frontend-Backend Integration & Testing",
          "description": "Integrate the frontend with the backend API and perform thorough testing.",
          "priority": "High",
          "dependencies": [
            "Phase 1: Setup & Frontend Development",
            "Phase 2: Backend API Development",
            "Phase 3: Database Setup & Integration"
          ],
          "tasks": [
            "Implement API calls in the frontend using Axios or Fetch.",
            "Test all API endpoints.",
            "Test the entire application end-to-end.",
            "Fix any bugs."
          ],
          "estimated_duration": "1 week"
        },
        {
          "name": "Phase 5: Deployment & Monitoring",
          "description": "Deploy the application to AWS and set up monitoring and logging.",
          "priority": "High",
          "dependencies": [
            "Phase 4: Frontend-Backend Integration & Testing"
          ],
          "tasks": [
            "Set up AWS infrastructure (EC2, RDS, Route 53).",
            "Deploy the frontend to EC2 (or a service like AWS Amplify).",
            "Deploy the backend to EC2.",
            "Configure monitoring and logging with CloudWatch and Sentry."
          ],
          "estimated_duration": "1 week"
        }
      ],
      "key_risks": [
        "Security vulnerabilities (e.g., XSS, SQL injection).",
        "Performance issues (slow loading times).",
        "Scalability limitations.",
        "Deployment issues."
      ],
      "design_justification": "The design prioritizes simplicity and rapid development, given the project's scope. The monolithic architecture, React frontend, Node.js/Express backend, and PostgreSQL database provide a good balance of features, performance, and ease of development. AWS is chosen for deployment due to its scalability and comprehensive services.",
      "data_flow": "1. User interacts with the React frontend (e.g., adds a task). 2. Frontend sends a POST request to the backend API (/tasks). 3. Backend API receives the request, validates the data, and interacts with the PostgreSQL database to store the task. 4. Backend API returns a success response to the frontend. 5. Frontend updates the UI to display the new task. 6. When the user views the task list, the frontend sends a GET request to the backend API (/tasks). 7. Backend API retrieves tasks from the PostgreSQL database. 8. Backend API returns the task list to the frontend. 9. Frontend displays the task list to the user."
    },
    "implementation_plan": "plan=ImplementationPlan(project_summary={'title': 'Generated Project Plan', 'description': 'Develop a simple web application for managing a list of tasks, including adding, viewing, updating, and deleting tasks. The application will use React for the frontend, Node.js/Express for the backend, and PostgreSQL for the database. The application will be deployed to AWS.', 'overall_complexity': 'Medium', 'estimated_duration': 'TBD', 'key_challenges': [], 'success_criteria': []}, phases=[{'name': 'Frontend Phase', 'description': 'Tasks related to frontend phase', 'deliverables': ['Completed FE-001', 'Completed FE-002', 'Completed FE-003', 'Completed FE-004', 'Completed FE-005', 'Completed FE-006', 'Completed FE-007', 'Completed FE-008', 'Completed TEST-005'], 'estimated_duration_hours': 40.0, 'work_items': [{'id': 'FE-001', 'description': 'Set up React project using Create React App.', 'dependencies': [], 'estimated_time': '2 hours', 'agent_role': 'frontend_developer', 'acceptance_criteria': ['Project is initialized successfully.', 'Default React app runs without errors.'], 'status': 'pending', 'code_files': ['package.json', 'src/App.js', 'src/index.js']}, {'id': 'FE-002', 'description': 'Design and implement the UI for adding tasks (input field and add button).', 'dependencies': ['FE-001'], 'estimated_time': '4 hours', 'agent_role': 'frontend_developer', 'acceptance_criteria': ['UI elements for task input and add button are present.', 'UI elements are styled appropriately.'], 'status': 'pending', 'code_files': ['src/App.js', 'src/App.css']}, {'id': 'FE-003', 'description': 'Design and implement the UI for viewing tasks (task list).', 'dependencies': ['FE-001'], 'estimated_time': '4 hours', 'agent_role': 'frontend_developer', 'acceptance_criteria': ['Task list container is present.', 'Tasks are displayed in a list format (e.g., unordered list).'], 'status': 'pending', 'code_files': ['src/App.js', 'src/App.css']}, {'id': 'FE-004', 'description': 'Implement basic styling for the UI.', 'dependencies': ['FE-002', 'FE-003'], 'estimated_time': '4 hours', 'agent_role': 'frontend_developer', 'acceptance_criteria': ['UI elements are visually appealing.', 'Layout is responsive.'], 'status': 'pending', 'code_files': ['src/App.css']}, {'id': 'FE-005', 'description': 'Implement API calls in the frontend to add tasks.', 'dependencies': ['FE-002', 'BE-002'], 'estimated_time': '6 hours', 'agent_role': 'frontend_developer', 'acceptance_criteria': ['Frontend makes a POST request to /tasks when the add button is clicked.', 'New tasks are successfully added to the backend.'], 'status': 'pending', 'code_files': ['src/App.js']}, {'id': 'FE-006', 'description': 'Implement API calls in the frontend to fetch tasks.', 'dependencies': ['FE-003', 'BE-003'], 'estimated_time': '6 hours', 'agent_role': 'frontend_developer', 'acceptance_criteria': ['Frontend makes a GET request to /tasks on component mount.', 'Tasks are displayed in the task list.'], 'status': 'pending', 'code_files': ['src/App.js']}, {'id': 'FE-007', 'description': 'Implement API calls in the frontend to update task completion status.', 'dependencies': ['FE-003', 'BE-004'], 'estimated_time': '6 hours', 'agent_role': 'frontend_developer', 'acceptance_criteria': ['Frontend makes a PUT request to /tasks/{id} when a task is marked as complete/incomplete.', 'Task completion status is updated in the backend and reflected in the UI.'], 'status': 'pending', 'code_files': ['src/App.js']}, {'id': 'FE-008', 'description': 'Implement API calls in the frontend to delete tasks.', 'dependencies': ['FE-003', 'BE-005'], 'estimated_time': '4 hours', 'agent_role': 'frontend_developer', 'acceptance_criteria': ['Frontend makes a DELETE request to /tasks/{id} when a task is deleted.', 'Task is removed from the UI.'], 'status': 'pending', 'code_files': ['src/App.js']}, {'id': 'TEST-005', 'description': 'End-to-end testing: Add a task, view it, mark it complete, and delete it.', 'dependencies': ['FE-005', 'FE-006', 'FE-007', 'FE-008', 'TEST-001', 'TEST-002', 'TEST-003', 'TEST-004'], 'estimated_time': '4 hours', 'agent_role': 'frontend_developer', 'acceptance_criteria': ['Task is successfully added through the UI.', 'Task is displayed in the task list.', 'Task completion status can be toggled.', 'Task can be deleted from the UI.'], 'status': 'pending', 'code_files': ['src/App.js']}]}, {'name': 'Backend Phase', 'description': 'Tasks related to backend phase', 'deliverables': ['Completed BE-001', 'Completed BE-002', 'Completed BE-003', 'Completed BE-004', 'Completed BE-005', 'Completed BE-006', 'Completed BE-007', 'Completed BE-008', 'Completed BE-009', 'Completed BE-010', 'Completed TEST-001', 'Completed TEST-002', 'Completed TEST-003', 'Completed TEST-004'], 'estimated_duration_hours': 56.0, 'work_items': [{'id': 'BE-001', 'description': 'Set up Node.js and Express.js project.', 'dependencies': [], 'estimated_time': '2 hours', 'agent_role': 'backend_developer', 'acceptance_criteria': ['Project is initialized successfully.', 'Express server runs without errors.'], 'status': 'pending', 'code_files': ['package.json', 'index.js']}, {'id': 'BE-002', 'description': 'Implement the POST /tasks endpoint (create a new task).', 'dependencies': ['BE-001'], 'estimated_time': '6 hours', 'agent_role': 'backend_developer', 'acceptance_criteria': ['Endpoint accepts POST requests to /tasks.', 'Endpoint parses the request body for the task description.', 'Endpoint returns a 201 status code on success.', 'Endpoint returns a 400 status code on invalid input.'], 'status': 'pending', 'code_files': ['index.js']}, {'id': 'BE-003', 'description': 'Implement the GET /tasks endpoint (get all tasks).', 'dependencies': ['BE-001'], 'estimated_time': '4 hours', 'agent_role': 'backend_developer', 'acceptance_criteria': ['Endpoint accepts GET requests to /tasks.', 'Endpoint returns a 200 status code on success.', 'Endpoint returns a JSON array of tasks.'], 'status': 'pending', 'code_files': ['index.js']}, {'id': 'BE-004', 'description': 'Implement the PUT /tasks/{id} endpoint (update a task).', 'dependencies': ['BE-001'], 'estimated_time': '6 hours', 'agent_role': 'backend_developer', 'acceptance_criteria': ['Endpoint accepts PUT requests to /tasks/{id}.', \"Endpoint parses the request body for the 'completed' status.\", 'Endpoint returns a 200 status code on success.', 'Endpoint returns a 400 status code on invalid input.', 'Endpoint returns a 404 status code if the task is not found.'], 'status': 'pending', 'code_files': ['index.js']}, {'id': 'BE-005', 'description': 'Implement the DELETE /tasks/{id} endpoint (delete a task).', 'dependencies': ['BE-001'], 'estimated_time': '4 hours', 'agent_role': 'backend_developer', 'acceptance_criteria': ['Endpoint accepts DELETE requests to /tasks/{id}.', 'Endpoint returns a 200 status code on success.', 'Endpoint returns a 404 status code if the task is not found.'], 'status': 'pending', 'code_files': ['index.js']}, {'id': 'BE-006', 'description': 'Connect the backend API to the PostgreSQL database.', 'dependencies': ['BE-001', 'DB-002'], 'estimated_time': '6 hours', 'agent_role': 'backend_developer', 'acceptance_criteria': ['Backend API can connect to the PostgreSQL database.', 'Database connection is established without errors.'], 'status': 'pending', 'code_files': ['index.js']}, {'id': 'BE-007', 'description': 'Implement database interactions for the POST /tasks endpoint.', 'dependencies': ['BE-002', 'BE-006'], 'estimated_time': '6 hours', 'agent_role': 'backend_developer', 'acceptance_criteria': ['New tasks are saved to the database.', 'Endpoint returns the newly created task with its ID.'], 'status': 'pending', 'code_files': ['index.js']}, {'id': 'BE-008', 'description': 'Implement database interactions for the GET /tasks endpoint.', 'dependencies': ['BE-003', 'BE-006'], 'estimated_time': '4 hours', 'agent_role': 'backend_developer', 'acceptance_criteria': ['All tasks are retrieved from the database.', 'Endpoint returns the list of tasks.'], 'status': 'pending', 'code_files': ['index.js']}, {'id': 'BE-009', 'description': 'Implement database interactions for the PUT /tasks/{id} endpoint.', 'dependencies': ['BE-004', 'BE-006'], 'estimated_time': '6 hours', 'agent_role': 'backend_developer', 'acceptance_criteria': ['Task completion status is updated in the database.', 'Endpoint returns the updated task.'], 'status': 'pending', 'code_files': ['index.js']}, {'id': 'BE-010', 'description': 'Implement database interactions for the DELETE /tasks/{id} endpoint.', 'dependencies': ['BE-005', 'BE-006'], 'estimated_time': '4 hours', 'agent_role': 'backend_developer', 'acceptance_criteria': ['Task is deleted from the database.', 'Endpoint returns a success message.'], 'status': 'pending', 'code_files': ['index.js']}, {'id': 'TEST-001', 'description': 'Test the POST /tasks endpoint.', 'dependencies': ['BE-002', 'BE-007'], 'estimated_time': '2 hours', 'agent_role': 'backend_developer', 'acceptance_criteria': ['Endpoint returns 201 status code on successful task creation.', 'Endpoint returns 400 status code on invalid input.', 'Task is saved to the database.'], 'status': 'pending', 'code_files': ['index.js']}, {'id': 'TEST-002', 'description': 'Test the GET /tasks endpoint.', 'dependencies': ['BE-003', 'BE-008'], 'estimated_time': '2 hours', 'agent_role': 'backend_developer', 'acceptance_criteria': ['Endpoint returns 200 status code.', 'Endpoint returns a list of tasks from the database.'], 'status': 'pending', 'code_files': ['index.js']}, {'id': 'TEST-003', 'description': 'Test the PUT /tasks/{id} endpoint.', 'dependencies': ['BE-004', 'BE-009'], 'estimated_time': '2 hours', 'agent_role': 'backend_developer', 'acceptance_criteria': ['Endpoint returns 200 status code on successful update.', 'Endpoint returns 400 status code on invalid input.', 'Endpoint returns 404 status code if task not found.', 'Task completion status is updated in the database.'], 'status': 'pending', 'code_files': ['index.js']}, {'id': 'TEST-004', 'description': 'Test the DELETE /tasks/{id} endpoint.', 'dependencies': ['BE-005', 'BE-010'], 'estimated_time': '2 hours', 'agent_role': 'backend_developer', 'acceptance_criteria': ['Endpoint returns 200 status code on successful deletion.', 'Endpoint returns 404 status code if task not found.', 'Task is deleted from the database.'], 'status': 'pending', 'code_files': ['index.js']}]}, {'name': 'Database Phase', 'description': 'Tasks related to database phase', 'deliverables': ['Completed DB-001', 'Completed DB-002'], 'estimated_duration_hours': 6.0, 'work_items': [{'id': 'DB-001', 'description': 'Set up PostgreSQL database in AWS RDS.', 'dependencies': [], 'estimated_time': '4 hours', 'agent_role': 'database_specialist', 'acceptance_criteria': ['PostgreSQL database instance is created in AWS RDS.', 'Database is accessible.'], 'status': 'pending', 'code_files': []}, {'id': 'DB-002', 'description': \"Create the 'tasks' table in PostgreSQL.\", 'dependencies': ['DB-001'], 'estimated_time': '2 hours', 'agent_role': 'database_specialist', 'acceptance_criteria': ['Tasks table exists with the correct schema (id, description, created_at, completed).', 'Appropriate data types and constraints are applied.'], 'status': 'pending', 'code_files': []}]}, {'name': 'Devops_Engineer Phase', 'description': 'Tasks related to devops_engineer phase', 'deliverables': ['Completed DEPLOY-001', 'Completed DEPLOY-002', 'Completed DEPLOY-003', 'Completed DEPLOY-004'], 'estimated_duration_hours': 22.0, 'work_items': [{'id': 'DEPLOY-001', 'description': 'Set up AWS infrastructure (EC2, RDS, Route 53).', 'dependencies': ['DB-001'], 'estimated_time': '8 hours', 'agent_role': 'devops_engineer', 'acceptance_criteria': ['EC2 instance is created and configured.', 'RDS instance is accessible.', 'Route 53 is configured for DNS.'], 'status': 'pending', 'code_files': []}, {'id': 'DEPLOY-002', 'description': 'Deploy the frontend to EC2 (or a service like AWS Amplify).', 'dependencies': ['FE-001', 'DEPLOY-001'], 'estimated_time': '4 hours', 'agent_role': 'devops_engineer', 'acceptance_criteria': ['Frontend application is deployed to EC2 (or Amplify).', 'Frontend is accessible via a public URL.'], 'status': 'pending', 'code_files': []}, {'id': 'DEPLOY-003', 'description': 'Deploy the backend to EC2.', 'dependencies': ['BE-001', 'DEPLOY-001', 'BE-006'], 'estimated_time': '6 hours', 'agent_role': 'devops_engineer', 'acceptance_criteria': ['Backend application is deployed to EC2.', 'Backend API is accessible via a public URL.', 'Backend connects to the database.'], 'status': 'pending', 'code_files': ['index.js']}, {'id': 'DEPLOY-004', 'description': 'Configure monitoring and logging with CloudWatch and Sentry.', 'dependencies': ['DEPLOY-003'], 'estimated_time': '4 hours', 'agent_role': 'devops_engineer', 'acceptance_criteria': ['CloudWatch is configured to monitor server resources and application logs.', 'Sentry (or similar) is configured to capture and report errors.'], 'status': 'pending', 'code_files': []}]}], resource_allocation=[{'role': 'Frontend Developer', 'count': 1, 'estimated_time_allocation': '100%', 'phases': ['Frontend Phase'], 'skills_required': []}, {'role': 'Database Specialist', 'count': 1, 'estimated_time_allocation': '100%', 'phases': ['Database Phase'], 'skills_required': []}, {'role': 'Backend Developer', 'count': 1, 'estimated_time_allocation': '100%', 'phases': ['Backend Phase'], 'skills_required': []}, {'role': 'Devops Engineer', 'count': 1, 'estimated_time_allocation': '100%', 'phases': ['Devops_Engineer Phase'], 'skills_required': []}], risks_and_mitigations=[], timeline={'start_date': '2025-07-08T17:22:35.877228', 'end_date': 'TBD', 'milestones': []}, tech_stack={}, metadata={'generated_at': '2025-07-08T17:22:35.877228', 'version': '1.0', 'author': 'Multi-AI Dev System', 'tags': [], 'notes': 'Converted from WorkItemBacklog. Original summary: Develop a simple web application for managing a list of tasks, including adding, viewing, updating, and deleting tasks. The application will use React for the frontend, Node.js/Express for the backend, and PostgreSQL for the database. The application will be deployed to AWS.'}) summary='Develop a simple web application for managing a list of tasks, including adding, viewing, updating, and deleting tasks. The application will use React for the frontend, Node.js/Express for the backend, and PostgreSQL for the database. The application will be deployed to AWS.' metadata=PlanMetadata(generated_at='2025-07-08T17:22:35.877228', version='1.0', author='Multi-AI Dev System', tags=[], notes='Converted from WorkItemBacklog. Original summary: Develop a simple web application for managing a list of tasks, including adding, viewing, updating, and deleting tasks. The application will use React for the frontend, Node.js/Express for the backend, and PostgreSQL for the database. The application will be deployed to AWS.')"
  }
}