{
  "session_id": "session_8a72113f-70de-499e-8a89-3a7e16f0df13",
  "approval_type": "implementation_plan",
  "timestamp": 1751976575,
  "approval_data": {
    "type": "implementation_plan",
    "timestamp": 1751976575.6128438,
    "project_overview": "Develop a simple web application for managing a list of tasks, including adding, viewing, updating, and deleting tasks. The application will use React for the frontend, Node.js with Express for the backend, and PostgreSQL for the database. The application will be deployed to AWS.",
    "development_phases": [
      {
        "name": "Frontend Phase",
        "description": "Tasks related to frontend phase",
        "deliverables": [
          "Completed FE-001",
          "Completed FE-002",
          "Completed FE-003",
          "Completed FE-004",
          "Completed FE-005",
          "Completed FE-006",
          "Completed FE-007",
          "Completed FE-008",
          "Completed FE-009",
          "Completed FE-010",
          "Completed FE-013"
        ],
        "estimated_duration_hours": 54.0,
        "work_items": [
          {
            "id": "FE-001",
            "description": "Set up React project using Create React App.",
            "dependencies": [],
            "estimated_time": "4 hours",
            "agent_role": "frontend_developer",
            "acceptance_criteria": [
              "Project initializes successfully.",
              "Default React app runs without errors."
            ],
            "status": "pending",
            "code_files": [
              "package.json",
              "src/App.js",
              "src/index.js"
            ]
          },
          {
            "id": "FE-002",
            "description": "Install necessary frontend dependencies (Axios, UI library).",
            "dependencies": [
              "FE-001"
            ],
            "estimated_time": "2 hours",
            "agent_role": "frontend_developer",
            "acceptance_criteria": [
              "Axios installed and available.",
              "UI library (e.g., Material UI, Chakra UI) installed and available."
            ],
            "status": "pending",
            "code_files": [
              "package.json"
            ]
          },
          {
            "id": "FE-003",
            "description": "Create a TaskInput component with a text input and add button.",
            "dependencies": [
              "FE-002"
            ],
            "estimated_time": "4 hours",
            "agent_role": "frontend_developer",
            "acceptance_criteria": [
              "Component renders correctly.",
              "Input field accepts text.",
              "Button is displayed."
            ],
            "status": "pending",
            "code_files": [
              "src/components/TaskInput.js"
            ]
          },
          {
            "id": "FE-004",
            "description": "Create a TaskList component to display tasks.",
            "dependencies": [
              "FE-002"
            ],
            "estimated_time": "4 hours",
            "agent_role": "frontend_developer",
            "acceptance_criteria": [
              "Component renders correctly.",
              "Displays a list of tasks (initially empty)."
            ],
            "status": "pending",
            "code_files": [
              "src/components/TaskList.js"
            ]
          },
          {
            "id": "FE-005",
            "description": "Implement basic styling for TaskInput and TaskList components.",
            "dependencies": [
              "FE-003",
              "FE-004"
            ],
            "estimated_time": "4 hours",
            "agent_role": "frontend_developer",
            "acceptance_criteria": [
              "Components are visually appealing.",
              "Layout is clear and readable."
            ],
            "status": "pending",
            "code_files": [
              "src/components/TaskInput.css",
              "src/components/TaskList.css"
            ]
          },
          {
            "id": "FE-006",
            "description": "Implement functionality to send a POST request to create a task.",
            "dependencies": [
              "FE-003",
              "BE-004"
            ],
            "estimated_time": "6 hours",
            "agent_role": "frontend_developer",
            "acceptance_criteria": [
              "Task description is submitted to the backend.",
              "Backend API is called correctly.",
              "UI updates to reflect the new task (without page refresh)."
            ],
            "status": "pending",
            "code_files": [
              "src/components/TaskInput.js",
              "src/App.js"
            ]
          },
          {
            "id": "FE-007",
            "description": "Implement functionality to fetch and display tasks from the backend.",
            "dependencies": [
              "FE-004",
              "BE-005"
            ],
            "estimated_time": "6 hours",
            "agent_role": "frontend_developer",
            "acceptance_criteria": [
              "Frontend fetches tasks from the backend on component mount.",
              "Tasks are displayed in the TaskList component.",
              "Error handling for API calls is implemented."
            ],
            "status": "pending",
            "code_files": [
              "src/components/TaskList.js",
              "src/App.js"
            ]
          },
          {
            "id": "FE-008",
            "description": "Implement functionality to update task completion status.",
            "dependencies": [
              "FE-004",
              "BE-006"
            ],
            "estimated_time": "6 hours",
            "agent_role": "frontend_developer",
            "acceptance_criteria": [
              "User can mark a task as complete/incomplete.",
              "Frontend sends a PUT request to update the task.",
              "UI updates to reflect the change (without page refresh)."
            ],
            "status": "pending",
            "code_files": [
              "src/components/TaskList.js"
            ]
          },
          {
            "id": "FE-009",
            "description": "Implement functionality to delete a task.",
            "dependencies": [
              "FE-004",
              "BE-007"
            ],
            "estimated_time": "6 hours",
            "agent_role": "frontend_developer",
            "acceptance_criteria": [
              "User can delete a task.",
              "Frontend sends a DELETE request.",
              "UI updates to reflect the change (without page refresh)."
            ],
            "status": "pending",
            "code_files": [
              "src/components/TaskList.js"
            ]
          },
          {
            "id": "FE-010",
            "description": "Add basic error handling and user feedback in the frontend.",
            "dependencies": [
              "FE-006",
              "FE-007",
              "FE-008",
              "FE-009"
            ],
            "estimated_time": "4 hours",
            "agent_role": "frontend_developer",
            "acceptance_criteria": [
              "Error messages are displayed to the user for API failures.",
              "Loading indicators are shown during API calls.",
              "Success messages are displayed for successful operations."
            ],
            "status": "pending",
            "code_files": [
              "src/App.js",
              "src/components/TaskInput.js",
              "src/components/TaskList.js"
            ]
          },
          {
            "id": "FE-013",
            "description": "Implement unit tests for frontend components.",
            "dependencies": [
              "FE-003",
              "FE-004"
            ],
            "estimated_time": "8 hours",
            "agent_role": "frontend_developer",
            "acceptance_criteria": [
              "Unit tests are written for TaskInput and TaskList components.",
              "Tests cover various scenarios (e.g., rendering, input validation, API calls).",
              "Tests pass."
            ],
            "status": "pending",
            "code_files": [
              "src/components/TaskInput.test.js",
              "src/components/TaskList.test.js"
            ]
          }
        ]
      },
      {
        "name": "Backend Phase",
        "description": "Tasks related to backend phase",
        "deliverables": [
          "Completed BE-001",
          "Completed BE-002",
          "Completed BE-004",
          "Completed BE-005",
          "Completed BE-006",
          "Completed BE-007",
          "Completed BE-008",
          "Completed FE-011",
          "Completed BE-011",
          "Completed BE-012"
        ],
        "estimated_duration_hours": 62.0,
        "work_items": [
          {
            "id": "BE-001",
            "description": "Set up Node.js project with Express.",
            "dependencies": [],
            "estimated_time": "4 hours",
            "agent_role": "backend_developer",
            "acceptance_criteria": [
              "Project initializes successfully.",
              "Express server runs without errors.",
              "Basic route (e.g., '/') responds with 'Hello World'."
            ],
            "status": "pending",
            "code_files": [
              "package.json",
              "index.js"
            ]
          },
          {
            "id": "BE-002",
            "description": "Install necessary backend dependencies (body-parser, cors, pg).",
            "dependencies": [
              "BE-001"
            ],
            "estimated_time": "2 hours",
            "agent_role": "backend_developer",
            "acceptance_criteria": [
              "body-parser installed and available.",
              "cors installed and available.",
              "pg (PostgreSQL driver) installed and available."
            ],
            "status": "pending",
            "code_files": [
              "package.json"
            ]
          },
          {
            "id": "BE-004",
            "description": "Implement API endpoint to create a new task (/api/v1/tasks - POST).",
            "dependencies": [
              "BE-002",
              "BE-003"
            ],
            "estimated_time": "8 hours",
            "agent_role": "backend_developer",
            "acceptance_criteria": [
              "Endpoint accepts POST requests to /api/v1/tasks.",
              "Endpoint validates the 'description' parameter.",
              "Task is saved to the database.",
              "Endpoint returns 201 Created with the new task data."
            ],
            "status": "pending",
            "code_files": [
              "index.js"
            ]
          },
          {
            "id": "BE-005",
            "description": "Implement API endpoint to get all tasks (/api/v1/tasks - GET).",
            "dependencies": [
              "BE-002",
              "BE-003"
            ],
            "estimated_time": "6 hours",
            "agent_role": "backend_developer",
            "acceptance_criteria": [
              "Endpoint accepts GET requests to /api/v1/tasks.",
              "Endpoint retrieves all tasks from the database.",
              "Endpoint returns 200 OK with a list of tasks."
            ],
            "status": "pending",
            "code_files": [
              "index.js"
            ]
          },
          {
            "id": "BE-006",
            "description": "Implement API endpoint to update a task (/api/v1/tasks/:id - PUT).",
            "dependencies": [
              "BE-002",
              "BE-003"
            ],
            "estimated_time": "8 hours",
            "agent_role": "backend_developer",
            "acceptance_criteria": [
              "Endpoint accepts PUT requests to /api/v1/tasks/:id.",
              "Endpoint validates the task ID and 'completed' parameter.",
              "Task is updated in the database.",
              "Endpoint returns 200 OK with the updated task data or 404 if not found."
            ],
            "status": "pending",
            "code_files": [
              "index.js"
            ]
          },
          {
            "id": "BE-007",
            "description": "Implement API endpoint to delete a task (/api/v1/tasks/:id - DELETE).",
            "dependencies": [
              "BE-002",
              "BE-003"
            ],
            "estimated_time": "6 hours",
            "agent_role": "backend_developer",
            "acceptance_criteria": [
              "Endpoint accepts DELETE requests to /api/v1/tasks/:id.",
              "Endpoint validates the task ID.",
              "Task is deleted from the database.",
              "Endpoint returns 204 No Content or 404 if not found."
            ],
            "status": "pending",
            "code_files": [
              "index.js"
            ]
          },
          {
            "id": "BE-008",
            "description": "Implement input validation on the backend.",
            "dependencies": [
              "BE-004",
              "BE-006"
            ],
            "estimated_time": "4 hours",
            "agent_role": "backend_developer",
            "acceptance_criteria": [
              "Input validation for task description (e.g., not empty).",
              "Input validation for task ID (UUID format).",
              "Returns 400 Bad Request for invalid input."
            ],
            "status": "pending",
            "code_files": [
              "index.js"
            ]
          },
          {
            "id": "FE-011",
            "description": "Implement HTTPS for the application.",
            "dependencies": [
              "FE-001",
              "BE-001"
            ],
            "estimated_time": "8 hours",
            "agent_role": "backend_developer",
            "acceptance_criteria": [
              "Application is served over HTTPS.",
              "SSL certificate is configured correctly."
            ],
            "status": "pending",
            "code_files": [
              "index.js"
            ]
          },
          {
            "id": "BE-011",
            "description": "Implement logging for backend.",
            "dependencies": [
              "BE-001"
            ],
            "estimated_time": "4 hours",
            "agent_role": "backend_developer",
            "acceptance_criteria": [
              "Logging library (e.g., Winston) is installed.",
              "Important events and errors are logged."
            ],
            "status": "pending",
            "code_files": [
              "index.js"
            ]
          },
          {
            "id": "BE-012",
            "description": "Implement unit tests for backend API endpoints.",
            "dependencies": [
              "BE-004",
              "BE-005",
              "BE-006",
              "BE-007"
            ],
            "estimated_time": "12 hours",
            "agent_role": "backend_developer",
            "acceptance_criteria": [
              "Unit tests are written for all API endpoints.",
              "Tests cover various scenarios (e.g., successful requests, error handling, input validation).",
              "Tests pass."
            ],
            "status": "pending",
            "code_files": [
              "tests/api.test.js"
            ]
          }
        ]
      },
      {
        "name": "Database Phase",
        "description": "Tasks related to database phase",
        "deliverables": [
          "Completed BE-003"
        ],
        "estimated_duration_hours": 4.0,
        "work_items": [
          {
            "id": "BE-003",
            "description": "Set up PostgreSQL database and create 'tasks' table.",
            "dependencies": [],
            "estimated_time": "4 hours",
            "agent_role": "database_specialist",
            "acceptance_criteria": [
              "Database connection established.",
              "'tasks' table created with 'id', 'description', 'created_at', and 'completed' columns.",
              "UUID extension enabled."
            ],
            "status": "pending",
            "code_files": [
              "db/schema.sql"
            ]
          }
        ]
      },
      {
        "name": "Devops_Engineer Phase",
        "description": "Tasks related to devops_engineer phase",
        "deliverables": [
          "Completed FE-012",
          "Completed BE-009",
          "Completed BE-010"
        ],
        "estimated_duration_hours": 20.0,
        "work_items": [
          {
            "id": "FE-012",
            "description": "Deploy frontend to S3 and serve via CloudFront.",
            "dependencies": [
              "FE-011"
            ],
            "estimated_time": "8 hours",
            "agent_role": "devops_engineer",
            "acceptance_criteria": [
              "Frontend is deployed to S3.",
              "CloudFront distribution is configured.",
              "Application is accessible via CloudFront URL."
            ],
            "status": "pending",
            "code_files": []
          },
          {
            "id": "BE-009",
            "description": "Deploy backend to EC2.",
            "dependencies": [
              "BE-001",
              "BE-003",
              "BE-008"
            ],
            "estimated_time": "8 hours",
            "agent_role": "devops_engineer",
            "acceptance_criteria": [
              "Backend is deployed to EC2.",
              "Backend is running and accessible.",
              "Database connection is configured correctly."
            ],
            "status": "pending",
            "code_files": []
          },
          {
            "id": "BE-010",
            "description": "Deploy database to RDS.",
            "dependencies": [
              "BE-003"
            ],
            "estimated_time": "4 hours",
            "agent_role": "devops_engineer",
            "acceptance_criteria": [
              "Database is deployed to RDS.",
              "Database is running and accessible."
            ],
            "status": "pending",
            "code_files": []
          }
        ]
      }
    ],
    "timeline_estimation": {
      "start_date": "2025-07-08T17:39:34.457333",
      "end_date": "TBD",
      "milestones": []
    },
    "risk_assessment": [],
    "resource_requirements": [
      {
        "role": "Devops Engineer",
        "count": 1,
        "estimated_time_allocation": "100%",
        "phases": [
          "Devops_Engineer Phase"
        ],
        "skills_required": []
      },
      {
        "role": "Frontend Developer",
        "count": 1,
        "estimated_time_allocation": "100%",
        "phases": [
          "Frontend Phase"
        ],
        "skills_required": []
      },
      {
        "role": "Database Specialist",
        "count": 1,
        "estimated_time_allocation": "100%",
        "phases": [
          "Database Phase"
        ],
        "skills_required": []
      },
      {
        "role": "Backend Developer",
        "count": 1,
        "estimated_time_allocation": "100%",
        "phases": [
          "Backend Phase"
        ],
        "skills_required": []
      }
    ],
    "deliverables": [
      "Completed FE-001",
      "Completed FE-002",
      "Completed FE-003",
      "Completed FE-004",
      "Completed FE-005",
      "Completed FE-006",
      "Completed FE-007",
      "Completed FE-008",
      "Completed FE-009",
      "Completed FE-010",
      "Completed FE-013",
      "Completed BE-001",
      "Completed BE-002",
      "Completed BE-004",
      "Completed BE-005",
      "Completed BE-006",
      "Completed BE-007",
      "Completed BE-008",
      "Completed FE-011",
      "Completed BE-011",
      "Completed BE-012",
      "Completed BE-003",
      "Completed FE-012",
      "Completed BE-009",
      "Completed BE-010"
    ],
    "dependencies": [],
    "raw_plan": "plan=ImplementationPlan(project_summary={'title': 'Generated Project Plan', 'description': 'Develop a simple web application for managing a list of tasks, including adding, viewing, updating, and deleting tasks. The application will use React for the frontend, Node.js with Express for the backend, and PostgreSQL for the database. The application will be deployed to AWS.', 'overall_complexity': 'Medium', 'estimated_duration': 'TBD', 'key_challenges': [], 'success_criteria': []}, phases=[{'name': 'Frontend Phase', 'description': 'Tasks related to frontend phase', 'deliverables': ['Completed FE-001', 'Completed FE-002', 'Completed FE-003', 'Completed FE-004', 'Completed FE-005', 'Completed FE-006', 'Completed FE-007', 'Completed FE-008', 'Completed FE-009', 'Completed FE-010', 'Completed FE-013'], 'estimated_duration_hours': 54.0, 'work_items': [{'id': 'FE-001', 'description': 'Set up React project using Create React App.', 'dependencies': [], 'estimated_time': '4 hours', 'agent_role': 'frontend_developer', 'acceptance_criteria': ['Project initializes successfully.', 'Default React app runs without errors.'], 'status': 'pending', 'code_files': ['package.json', 'src/App.js', 'src/index.js']}, {'id': 'FE-002', 'description': 'Install necessary frontend dependencies (Axios, UI library).', 'dependencies': ['FE-001'], 'estimated_time': '2 hours', 'agent_role': 'frontend_developer', 'acceptance_criteria': ['Axios installed and available.', 'UI library (e.g., Material UI, Chakra UI) installed and available.'], 'status': 'pending', 'code_files': ['package.json']}, {'id': 'FE-003', 'description': 'Create a TaskInput component with a text input and add button.', 'dependencies': ['FE-002'], 'estimated_time': '4 hours', 'agent_role': 'frontend_developer', 'acceptance_criteria': ['Component renders correctly.', 'Input field accepts text.', 'Button is displayed.'], 'status': 'pending', 'code_files': ['src/components/TaskInput.js']}, {'id': 'FE-004', 'description': 'Create a TaskList component to display tasks.', 'dependencies': ['FE-002'], 'estimated_time': '4 hours', 'agent_role': 'frontend_developer', 'acceptance_criteria': ['Component renders correctly.', 'Displays a list of tasks (initially empty).'], 'status': 'pending', 'code_files': ['src/components/TaskList.js']}, {'id': 'FE-005', 'description': 'Implement basic styling for TaskInput and TaskList components.', 'dependencies': ['FE-003', 'FE-004'], 'estimated_time': '4 hours', 'agent_role': 'frontend_developer', 'acceptance_criteria': ['Components are visually appealing.', 'Layout is clear and readable.'], 'status': 'pending', 'code_files': ['src/components/TaskInput.css', 'src/components/TaskList.css']}, {'id': 'FE-006', 'description': 'Implement functionality to send a POST request to create a task.', 'dependencies': ['FE-003', 'BE-004'], 'estimated_time': '6 hours', 'agent_role': 'frontend_developer', 'acceptance_criteria': ['Task description is submitted to the backend.', 'Backend API is called correctly.', 'UI updates to reflect the new task (without page refresh).'], 'status': 'pending', 'code_files': ['src/components/TaskInput.js', 'src/App.js']}, {'id': 'FE-007', 'description': 'Implement functionality to fetch and display tasks from the backend.', 'dependencies': ['FE-004', 'BE-005'], 'estimated_time': '6 hours', 'agent_role': 'frontend_developer', 'acceptance_criteria': ['Frontend fetches tasks from the backend on component mount.', 'Tasks are displayed in the TaskList component.', 'Error handling for API calls is implemented.'], 'status': 'pending', 'code_files': ['src/components/TaskList.js', 'src/App.js']}, {'id': 'FE-008', 'description': 'Implement functionality to update task completion status.', 'dependencies': ['FE-004', 'BE-006'], 'estimated_time': '6 hours', 'agent_role': 'frontend_developer', 'acceptance_criteria': ['User can mark a task as complete/incomplete.', 'Frontend sends a PUT request to update the task.', 'UI updates to reflect the change (without page refresh).'], 'status': 'pending', 'code_files': ['src/components/TaskList.js']}, {'id': 'FE-009', 'description': 'Implement functionality to delete a task.', 'dependencies': ['FE-004', 'BE-007'], 'estimated_time': '6 hours', 'agent_role': 'frontend_developer', 'acceptance_criteria': ['User can delete a task.', 'Frontend sends a DELETE request.', 'UI updates to reflect the change (without page refresh).'], 'status': 'pending', 'code_files': ['src/components/TaskList.js']}, {'id': 'FE-010', 'description': 'Add basic error handling and user feedback in the frontend.', 'dependencies': ['FE-006', 'FE-007', 'FE-008', 'FE-009'], 'estimated_time': '4 hours', 'agent_role': 'frontend_developer', 'acceptance_criteria': ['Error messages are displayed to the user for API failures.', 'Loading indicators are shown during API calls.', 'Success messages are displayed for successful operations.'], 'status': 'pending', 'code_files': ['src/App.js', 'src/components/TaskInput.js', 'src/components/TaskList.js']}, {'id': 'FE-013', 'description': 'Implement unit tests for frontend components.', 'dependencies': ['FE-003', 'FE-004'], 'estimated_time': '8 hours', 'agent_role': 'frontend_developer', 'acceptance_criteria': ['Unit tests are written for TaskInput and TaskList components.', 'Tests cover various scenarios (e.g., rendering, input validation, API calls).', 'Tests pass.'], 'status': 'pending', 'code_files': ['src/components/TaskInput.test.js', 'src/components/TaskList.test.js']}]}, {'name': 'Backend Phase', 'description': 'Tasks related to backend phase', 'deliverables': ['Completed BE-001', 'Completed BE-002', 'Completed BE-004', 'Completed BE-005', 'Completed BE-006', 'Completed BE-007', 'Completed BE-008', 'Completed FE-011', 'Completed BE-011', 'Completed BE-012'], 'estimated_duration_hours': 62.0, 'work_items': [{'id': 'BE-001', 'description': 'Set up Node.js project with Express.', 'dependencies': [], 'estimated_time': '4 hours', 'agent_role': 'backend_developer', 'acceptance_criteria': ['Project initializes successfully.', 'Express server runs without errors.', \"Basic route (e.g., '/') responds with 'Hello World'.\"], 'status': 'pending', 'code_files': ['package.json', 'index.js']}, {'id': 'BE-002', 'description': 'Install necessary backend dependencies (body-parser, cors, pg).', 'dependencies': ['BE-001'], 'estimated_time': '2 hours', 'agent_role': 'backend_developer', 'acceptance_criteria': ['body-parser installed and available.', 'cors installed and available.', 'pg (PostgreSQL driver) installed and available.'], 'status': 'pending', 'code_files': ['package.json']}, {'id': 'BE-004', 'description': 'Implement API endpoint to create a new task (/api/v1/tasks - POST).', 'dependencies': ['BE-002', 'BE-003'], 'estimated_time': '8 hours', 'agent_role': 'backend_developer', 'acceptance_criteria': ['Endpoint accepts POST requests to /api/v1/tasks.', \"Endpoint validates the 'description' parameter.\", 'Task is saved to the database.', 'Endpoint returns 201 Created with the new task data.'], 'status': 'pending', 'code_files': ['index.js']}, {'id': 'BE-005', 'description': 'Implement API endpoint to get all tasks (/api/v1/tasks - GET).', 'dependencies': ['BE-002', 'BE-003'], 'estimated_time': '6 hours', 'agent_role': 'backend_developer', 'acceptance_criteria': ['Endpoint accepts GET requests to /api/v1/tasks.', 'Endpoint retrieves all tasks from the database.', 'Endpoint returns 200 OK with a list of tasks.'], 'status': 'pending', 'code_files': ['index.js']}, {'id': 'BE-006', 'description': 'Implement API endpoint to update a task (/api/v1/tasks/:id - PUT).', 'dependencies': ['BE-002', 'BE-003'], 'estimated_time': '8 hours', 'agent_role': 'backend_developer', 'acceptance_criteria': ['Endpoint accepts PUT requests to /api/v1/tasks/:id.', \"Endpoint validates the task ID and 'completed' parameter.\", 'Task is updated in the database.', 'Endpoint returns 200 OK with the updated task data or 404 if not found.'], 'status': 'pending', 'code_files': ['index.js']}, {'id': 'BE-007', 'description': 'Implement API endpoint to delete a task (/api/v1/tasks/:id - DELETE).', 'dependencies': ['BE-002', 'BE-003'], 'estimated_time': '6 hours', 'agent_role': 'backend_developer', 'acceptance_criteria': ['Endpoint accepts DELETE requests to /api/v1/tasks/:id.', 'Endpoint validates the task ID.', 'Task is deleted from the database.', 'Endpoint returns 204 No Content or 404 if not found.'], 'status': 'pending', 'code_files': ['index.js']}, {'id': 'BE-008', 'description': 'Implement input validation on the backend.', 'dependencies': ['BE-004', 'BE-006'], 'estimated_time': '4 hours', 'agent_role': 'backend_developer', 'acceptance_criteria': ['Input validation for task description (e.g., not empty).', 'Input validation for task ID (UUID format).', 'Returns 400 Bad Request for invalid input.'], 'status': 'pending', 'code_files': ['index.js']}, {'id': 'FE-011', 'description': 'Implement HTTPS for the application.', 'dependencies': ['FE-001', 'BE-001'], 'estimated_time': '8 hours', 'agent_role': 'backend_developer', 'acceptance_criteria': ['Application is served over HTTPS.', 'SSL certificate is configured correctly.'], 'status': 'pending', 'code_files': ['index.js']}, {'id': 'BE-011', 'description': 'Implement logging for backend.', 'dependencies': ['BE-001'], 'estimated_time': '4 hours', 'agent_role': 'backend_developer', 'acceptance_criteria': ['Logging library (e.g., Winston) is installed.', 'Important events and errors are logged.'], 'status': 'pending', 'code_files': ['index.js']}, {'id': 'BE-012', 'description': 'Implement unit tests for backend API endpoints.', 'dependencies': ['BE-004', 'BE-005', 'BE-006', 'BE-007'], 'estimated_time': '12 hours', 'agent_role': 'backend_developer', 'acceptance_criteria': ['Unit tests are written for all API endpoints.', 'Tests cover various scenarios (e.g., successful requests, error handling, input validation).', 'Tests pass.'], 'status': 'pending', 'code_files': ['tests/api.test.js']}]}, {'name': 'Database Phase', 'description': 'Tasks related to database phase', 'deliverables': ['Completed BE-003'], 'estimated_duration_hours': 4.0, 'work_items': [{'id': 'BE-003', 'description': \"Set up PostgreSQL database and create 'tasks' table.\", 'dependencies': [], 'estimated_time': '4 hours', 'agent_role': 'database_specialist', 'acceptance_criteria': ['Database connection established.', \"'tasks' table created with 'id', 'description', 'created_at', and 'completed' columns.\", 'UUID extension enabled.'], 'status': 'pending', 'code_files': ['db/schema.sql']}]}, {'name': 'Devops_Engineer Phase', 'description': 'Tasks related to devops_engineer phase', 'deliverables': ['Completed FE-012', 'Completed BE-009', 'Completed BE-010'], 'estimated_duration_hours': 20.0, 'work_items': [{'id': 'FE-012', 'description': 'Deploy frontend to S3 and serve via CloudFront.', 'dependencies': ['FE-011'], 'estimated_time': '8 hours', 'agent_role': 'devops_engineer', 'acceptance_criteria': ['Frontend is deployed to S3.', 'CloudFront distribution is configured.', 'Application is accessible via CloudFront URL.'], 'status': 'pending', 'code_files': []}, {'id': 'BE-009', 'description': 'Deploy backend to EC2.', 'dependencies': ['BE-001', 'BE-003', 'BE-008'], 'estimated_time': '8 hours', 'agent_role': 'devops_engineer', 'acceptance_criteria': ['Backend is deployed to EC2.', 'Backend is running and accessible.', 'Database connection is configured correctly.'], 'status': 'pending', 'code_files': []}, {'id': 'BE-010', 'description': 'Deploy database to RDS.', 'dependencies': ['BE-003'], 'estimated_time': '4 hours', 'agent_role': 'devops_engineer', 'acceptance_criteria': ['Database is deployed to RDS.', 'Database is running and accessible.'], 'status': 'pending', 'code_files': []}]}], resource_allocation=[{'role': 'Devops Engineer', 'count': 1, 'estimated_time_allocation': '100%', 'phases': ['Devops_Engineer Phase'], 'skills_required': []}, {'role': 'Frontend Developer', 'count': 1, 'estimated_time_allocation': '100%', 'phases': ['Frontend Phase'], 'skills_required': []}, {'role': 'Database Specialist', 'count': 1, 'estimated_time_allocation': '100%', 'phases': ['Database Phase'], 'skills_required': []}, {'role': 'Backend Developer', 'count': 1, 'estimated_time_allocation': '100%', 'phases': ['Backend Phase'], 'skills_required': []}], risks_and_mitigations=[], timeline={'start_date': '2025-07-08T17:39:34.457333', 'end_date': 'TBD', 'milestones': []}, tech_stack={}, metadata={'generated_at': '2025-07-08T17:39:34.457333', 'version': '1.0', 'author': 'Multi-AI Dev System', 'tags': [], 'notes': 'Converted from WorkItemBacklog. Original summary: Develop a simple web application for managing a list of tasks, including adding, viewing, updating, and deleting tasks. The application will use React for the frontend, Node.js with Express for the backend, and PostgreSQL for the database. The application will be deployed to AWS.'}) summary='Develop a simple web application for managing a list of tasks, including adding, viewing, updating, and deleting tasks. The application will use React for the frontend, Node.js with Express for the backend, and PostgreSQL for the database. The application will be deployed to AWS.' metadata=PlanMetadata(generated_at='2025-07-08T17:39:34.457333', version='1.0', author='Multi-AI Dev System', tags=[], notes='Converted from WorkItemBacklog. Original summary: Develop a simple web application for managing a list of tasks, including adding, viewing, updating, and deleting tasks. The application will use React for the frontend, Node.js with Express for the backend, and PostgreSQL for the database. The application will be deployed to AWS.')"
  },
  "workflow_state_snapshot": {
    "requirements_analysis": {
      "project_name": "Hello World Task List",
      "project_summary": "A simple web application to manage a list of tasks.",
      "project_goals": [
        "Allow a user to add a task",
        "Allow a user to see their list of tasks"
      ],
      "target_audience": [
        "Users who want to manage a list of tasks"
      ],
      "business_context": "This project aims to provide a basic task management tool.",
      "requirements": [
        {
          "id": "REQ-001",
          "description": "A user can create a new task with a text description.",
          "category": "functional",
          "priority": 1
        },
        {
          "id": "REQ-002",
          "description": "A user can see a list of all created tasks.",
          "category": "functional",
          "priority": 1
        },
        {
          "id": "REQ-003",
          "description": "The application must load quickly.",
          "category": "non_functional",
          "priority": 2
        },
        {
          "id": "REQ-004",
          "description": "The application must be secure.",
          "category": "non_functional",
          "priority": 2
        }
      ],
      "functional_requirements": [
        "A user can create a new task with a text description.",
        "A user can see a list of all created tasks."
      ],
      "non_functional_requirements": [
        "The application must load quickly.",
        "The application must be secure."
      ],
      "stakeholders": [
        "Users"
      ],
      "success_criteria": [
        "Users can successfully add tasks.",
        "Users can successfully view their task list.",
        "The application loads quickly.",
        "The application is secure."
      ],
      "constraints": [],
      "assumptions": [],
      "risks": [],
      "domain_specific_details": {},
      "quality_assessment": {
        "clarity_score": 9.0,
        "completeness_score": 8.0,
        "consistency_score": 10.0,
        "recommendations": []
      },
      "gap_analysis": {
        "identified_gaps": [],
        "recommendations_for_completion": []
      }
    },
    "tech_stack_recommendation": {
      "frontend_options": [
        {
          "name": "React",
          "language": "JavaScript",
          "reasoning": "React is a popular and efficient JavaScript library for building user interfaces. It offers a component-based architecture, making it easy to manage and update the UI. Its virtual DOM and efficient update mechanisms contribute to fast loading times, which aligns with the non-functional requirement.",
          "key_libraries": [
            "React Router (for navigation)",
            "Axios (for API calls)",
            "Material UI/Chakra UI (for UI components)"
          ],
          "pros": [
            "Large community and extensive documentation.",
            "Component-based architecture promotes reusability and maintainability.",
            "Virtual DOM for efficient updates.",
            "Excellent performance."
          ],
          "cons": [
            "Requires understanding of JSX.",
            "Can have a steeper learning curve for beginners."
          ],
          "selected": false
        },
        {
          "name": "Vue.js",
          "language": "JavaScript",
          "reasoning": "Vue.js is a progressive framework that's easy to learn and integrate. It offers a good balance between simplicity and power, making it suitable for this project's scope. Its reactivity system and component-based approach contribute to fast loading times.",
          "key_libraries": [
            "Vue Router (for navigation)",
            "Axios (for API calls)",
            "Vuetify/BootstrapVue (for UI components)"
          ],
          "pros": [
            "Easy to learn and use.",
            "Excellent documentation.",
            "Progressive framework: can be integrated into existing projects.",
            "Good performance."
          ],
          "cons": [
            "Smaller community compared to React.",
            "Ecosystem might not be as extensive as React's."
          ],
          "selected": false
        },
        {
          "name": "HTML, CSS, JavaScript (Vanilla)",
          "language": "JavaScript",
          "reasoning": "For a simple task list application, using vanilla JavaScript, HTML, and CSS can be a viable option. It avoids the overhead of a framework, leading to potentially faster initial load times and a smaller bundle size. This approach is suitable given the project's limited scope.",
          "key_libraries": [],
          "pros": [
            "No external dependencies.",
            "Fast initial load times.",
            "Simple to understand and debug."
          ],
          "cons": [
            "More manual DOM manipulation.",
            "Can become complex for larger applications.",
            "Requires more manual effort for UI component creation."
          ],
          "selected": false
        }
      ],
      "backend_options": [
        {
          "name": "Node.js with Express",
          "language": "JavaScript",
          "reasoning": "Node.js with Express provides a lightweight and efficient backend solution. JavaScript is used on both the frontend and backend, enabling code reuse and simplifying development. Express offers a flexible framework for building REST APIs, which is suitable for this project.",
          "key_libraries": [
            "Express (web framework)",
            "body-parser (for parsing request bodies)",
            "cors (for handling CORS)",
            "bcrypt (for password hashing)"
          ],
          "pros": [
            "JavaScript on both frontend and backend (full-stack JavaScript).",
            "Large community and extensive documentation.",
            "Fast development with Express.",
            "Good performance with Node.js's non-blocking I/O."
          ],
          "cons": [
            "Callback hell can be an issue (can be mitigated with async/await).",
            "Requires careful handling of asynchronous operations."
          ],
          "selected": false
        },
        {
          "name": "Python with Flask",
          "language": "Python",
          "reasoning": "Flask is a microframework that's easy to learn and use. Python's readability and extensive libraries make it a good choice for backend development. Flask provides a simple way to build REST APIs.",
          "key_libraries": [
            "Flask (web framework)",
            "Flask-SQLAlchemy (for database interaction)",
            "bcrypt (for password hashing)",
            "Flask-CORS (for handling CORS)"
          ],
          "pros": [
            "Python's readability and ease of use.",
            "Large community and extensive libraries.",
            "Flask's simplicity and flexibility.",
            "Good for rapid prototyping."
          ],
          "cons": [
            "Slightly slower performance compared to Node.js.",
            "Requires knowledge of Python."
          ],
          "selected": false
        },
        {
          "name": "Java with Spring Boot",
          "language": "Java",
          "reasoning": "Spring Boot provides a robust and scalable backend solution. Java's strong typing and mature ecosystem make it suitable for building reliable applications. Spring Boot simplifies the development of REST APIs.",
          "key_libraries": [
            "Spring Boot (web framework)",
            "Spring Data JPA (for database interaction)",
            "BCryptPasswordEncoder (for password hashing)",
            "Spring Security (for authentication and authorization)"
          ],
          "pros": [
            "Mature ecosystem and large community.",
            "Strong typing and robust error handling.",
            "Scalability and performance.",
            "Excellent for enterprise-level applications."
          ],
          "cons": [
            "Steeper learning curve.",
            "More verbose code compared to other options.",
            "Slower development speed compared to Node.js or Python."
          ],
          "selected": false
        }
      ],
      "database_options": [
        {
          "name": "PostgreSQL",
          "language": null,
          "reasoning": "PostgreSQL is a robust and reliable relational database. It offers excellent data integrity, scalability, and security features, which are important for any application. It's a good choice for storing task data.",
          "key_libraries": [
            "psycopg2 (for Python)",
            "pg (for Node.js)",
            "JDBC driver (for Java)"
          ],
          "pros": [
            "ACID-compliant.",
            "Excellent data integrity and security.",
            "Scalable.",
            "Large community and extensive documentation."
          ],
          "cons": [
            "Can be more complex to set up and manage than simpler databases.",
            "Requires more resources than simpler databases."
          ],
          "selected": false
        },
        {
          "name": "MongoDB",
          "language": null,
          "reasoning": "MongoDB is a NoSQL database that's easy to use and offers flexible schema design. It's a good choice for this project because it can handle the simple data structure of tasks efficiently. Its document-oriented nature aligns well with the project's needs.",
          "key_libraries": [
            "mongoose (for Node.js)",
            "pymongo (for Python)",
            "MongoDB Java Driver (for Java)"
          ],
          "pros": [
            "Flexible schema.",
            "Easy to scale.",
            "Good performance for read/write operations.",
            "Easy to set up and use."
          ],
          "cons": [
            "Data consistency can be more challenging to manage.",
            "Not ideal for complex relationships."
          ],
          "selected": false
        },
        {
          "name": "SQLite",
          "language": null,
          "reasoning": "SQLite is a lightweight, file-based database that's easy to set up and use. It's suitable for small projects and prototyping. It's a good choice for this project because it doesn't require a separate database server.",
          "key_libraries": [
            "sqlite3 (for Python)",
            "sqlite3 (for Node.js)",
            "SQLite JDBC driver (for Java)"
          ],
          "pros": [
            "Easy to set up and use.",
            "No separate database server required.",
            "Good for prototyping and small projects."
          ],
          "cons": [
            "Not suitable for high-traffic applications.",
            "Limited scalability.",
            "Not ideal for concurrent write operations."
          ],
          "selected": false
        }
      ],
      "cloud_options": [
        {
          "name": "AWS (Amazon Web Services)",
          "language": null,
          "reasoning": "AWS provides a comprehensive suite of services for deploying and managing web applications. It offers scalability, security, and a wide range of options for hosting the frontend, backend, and database. AWS is a good choice for this project because it can handle the project's needs.",
          "key_libraries": [
            "AWS SDK (for interacting with AWS services)"
          ],
          "pros": [
            "Scalability and reliability.",
            "Wide range of services.",
            "Mature ecosystem and large community.",
            "Good security features."
          ],
          "cons": [
            "Can be complex to set up and manage.",
            "Can be expensive if not managed properly.",
            "Steeper learning curve."
          ],
          "selected": false
        },
        {
          "name": "Google Cloud Platform (GCP)",
          "language": null,
          "reasoning": "GCP offers a similar set of services to AWS, with a focus on data analytics and machine learning. It's a good choice for this project because it can handle the project's needs. GCP is known for its competitive pricing and ease of use.",
          "key_libraries": [
            "Google Cloud Client Libraries (for interacting with GCP services)"
          ],
          "pros": [
            "Competitive pricing.",
            "Strong in data analytics and machine learning.",
            "User-friendly interface.",
            "Good scalability and reliability."
          ],
          "cons": [
            "Can be complex to set up and manage.",
            "Smaller community compared to AWS.",
            "Service offerings might be less mature than AWS in some areas."
          ],
          "selected": false
        },
        {
          "name": "Heroku",
          "language": null,
          "reasoning": "Heroku is a Platform-as-a-Service (PaaS) that simplifies the deployment and management of web applications. It's a good choice for this project because it's easy to use and provides a streamlined deployment process. Heroku is a good option for small projects.",
          "key_libraries": [],
          "pros": [
            "Easy to deploy and manage.",
            "Simplified deployment process.",
            "Good for small projects and prototyping.",
            "Free tier available."
          ],
          "cons": [
            "Limited scalability compared to other options.",
            "Can be expensive for larger applications.",
            "Less control over infrastructure."
          ],
          "selected": false
        }
      ],
      "architecture_options": [
        {
          "pattern": "Monolithic Architecture",
          "scalability_score": 5.0,
          "maintainability_score": 6.0,
          "development_speed_score": 8.0,
          "overall_score": 7.0,
          "reasoning": "For a simple task list application, a monolithic architecture is a good choice. It's easy to develop and deploy, and it's suitable for the project's scope. The entire application, including the frontend, backend, and database, will be deployed as a single unit. This approach is ideal for rapid development and simple deployments. Scalability is limited, but sufficient for the project's needs. Maintainability is good for a small application."
        },
        {
          "pattern": "Microservices Architecture (Simplified)",
          "scalability_score": 7.0,
          "maintainability_score": 7.0,
          "development_speed_score": 6.0,
          "overall_score": 6.5,
          "reasoning": "While overkill for the current scope, a simplified microservices architecture could be considered. The backend could be split into two services: one for task management and another for user authentication (if user accounts are added later). This approach offers better scalability and maintainability in the long run, but adds complexity to the initial development phase. Development speed is slightly slower due to the distributed nature of the system."
        }
      ],
      "tool_options": [
        {
          "name": "Git",
          "language": null,
          "reasoning": "Git is a version control system that's essential for managing code changes and collaborating with others. It's a good choice for this project because it allows for tracking changes, reverting to previous versions, and collaborating with other developers.",
          "key_libraries": [],
          "pros": [
            "Version control.",
            "Collaboration.",
            "Branching and merging.",
            "Large community and extensive documentation."
          ],
          "cons": [
            "Can have a learning curve for beginners."
          ],
          "selected": false
        },
        {
          "name": "VS Code",
          "language": null,
          "reasoning": "VS Code is a popular and versatile code editor. It offers features like syntax highlighting, code completion, and debugging, which can significantly improve developer productivity. It's a good choice for this project because it supports a wide range of languages and frameworks.",
          "key_libraries": [],
          "pros": [
            "Free and open-source.",
            "Extensible with plugins.",
            "Good performance.",
            "Large community and extensive documentation."
          ],
          "cons": [
            "Can be resource-intensive with many plugins."
          ],
          "selected": false
        },
        {
          "name": "Postman",
          "language": null,
          "reasoning": "Postman is a tool for testing and debugging APIs. It allows developers to send HTTP requests and inspect the responses, which is essential for backend development. It's a good choice for this project because it simplifies API testing.",
          "key_libraries": [],
          "pros": [
            "Easy to use.",
            "Supports various HTTP methods.",
            "Allows for saving and organizing API requests.",
            "Good for testing and debugging APIs."
          ],
          "cons": [
            "Can be overwhelming for beginners.",
            "Requires a Postman account."
          ],
          "selected": false
        }
      ],
      "risks": [
        {
          "category": "Security",
          "description": "The application could be vulnerable to security threats such as cross-site scripting (XSS) and SQL injection if input validation and output encoding are not implemented correctly.",
          "severity": "Medium",
          "likelihood": "Medium",
          "mitigation": "Implement proper input validation and output encoding to prevent XSS and SQL injection attacks. Use parameterized queries to prevent SQL injection. Implement authentication and authorization."
        },
        {
          "category": "Performance",
          "description": "The application might experience slow loading times if the frontend is not optimized or if the database queries are inefficient.",
          "severity": "Medium",
          "likelihood": "Medium",
          "mitigation": "Optimize the frontend code by minifying JavaScript and CSS files. Use lazy loading for images and other resources. Optimize database queries by adding indexes and using efficient query patterns. Implement caching."
        },
        {
          "category": "Scalability",
          "description": "The application might not be able to handle a large number of users or tasks if the database and backend are not designed for scalability.",
          "severity": "Low",
          "likelihood": "Low",
          "mitigation": "Choose a database that can scale. Design the backend to be stateless and scalable. Consider using a load balancer to distribute traffic across multiple servers."
        }
      ],
      "synthesis": {
        "backend": {
          "language": "JavaScript",
          "framework": "Node.js with Express",
          "reasoning": "Node.js with Express is selected for its speed of development, full-stack JavaScript capabilities, and suitability for building REST APIs. It aligns well with the frontend choice."
        },
        "frontend": {
          "language": "JavaScript",
          "framework": "React",
          "reasoning": "React is chosen for its component-based architecture, performance, and large community support. It allows for efficient UI updates and a good developer experience."
        },
        "database": {
          "type": "PostgreSQL",
          "reasoning": "PostgreSQL is chosen for its reliability, data integrity, and scalability. It's a good choice for storing task data and can handle future growth."
        },
        "architecture_pattern": "Monolithic Architecture",
        "deployment_environment": {
          "cloud_platform": "AWS",
          "reasoning": "AWS provides a comprehensive suite of services for deploying and managing web applications, offering scalability, security, and a wide range of options for hosting the frontend, backend, and database."
        },
        "key_libraries_tools": [
          {
            "name": "React Router",
            "purpose": "For handling navigation in the React frontend."
          },
          {
            "name": "Axios",
            "purpose": "For making API calls from the frontend."
          },
          {
            "name": "Express",
            "purpose": "For building the backend REST API."
          },
          {
            "name": "Postman",
            "purpose": "For testing and debugging the API."
          },
          {
            "name": "Git",
            "purpose": "For version control and collaboration."
          },
          {
            "name": "VS Code",
            "purpose": "For code editing and development."
          }
        ],
        "estimated_complexity": "Low"
      },
      "selected_stack": null
    },
    "system_design": {
      "architecture": {
        "pattern": "Monolithic Architecture",
        "justification": "The monolithic architecture is chosen because it is well-suited for the project's scope and complexity. It simplifies development, deployment, and maintenance for a small application like a task list. It allows for rapid development and deployment.",
        "key_benefits": [
          "Simplified development and deployment.",
          "Faster initial development speed.",
          "Easier to manage for a small team."
        ],
        "potential_drawbacks": [
          "Limited scalability compared to microservices.",
          "Can become difficult to maintain as the application grows."
        ]
      },
      "components": [
        {
          "name": "Frontend",
          "description": "The user interface for the task list application.",
          "category": "frontend",
          "technologies": [
            "React",
            "JavaScript",
            "HTML",
            "CSS"
          ],
          "dependencies": [
            "Backend API"
          ],
          "responsibilities": [
            "Displaying the task list.",
            "Allowing users to add new tasks.",
            "Handling user interactions.",
            "Making API calls to the backend."
          ],
          "design_patterns": [
            "Component-based architecture"
          ]
        },
        {
          "name": "Backend API",
          "description": "The REST API that handles requests from the frontend and interacts with the database.",
          "category": "backend",
          "technologies": [
            "Node.js",
            "Express",
            "JavaScript"
          ],
          "dependencies": [
            "PostgreSQL Database"
          ],
          "responsibilities": [
            "Handling API requests.",
            "Validating data.",
            "Interacting with the database.",
            "Returning data to the frontend."
          ],
          "design_patterns": [
            "RESTful API"
          ]
        },
        {
          "name": "Database",
          "description": "The database that stores the task data.",
          "category": "database",
          "technologies": [
            "PostgreSQL"
          ],
          "dependencies": [],
          "responsibilities": [
            "Storing task data.",
            "Providing data to the backend API.",
            "Ensuring data integrity."
          ],
          "design_patterns": []
        },
        {
          "name": "Deployment Infrastructure",
          "description": "The infrastructure used to deploy and host the application.",
          "category": "infrastructure",
          "technologies": [
            "AWS (EC2, RDS, S3, etc.)",
            "Docker (Optional)"
          ],
          "dependencies": [
            "Frontend",
            "Backend API",
            "Database"
          ],
          "responsibilities": [
            "Hosting the frontend application.",
            "Hosting the backend API.",
            "Managing the database.",
            "Ensuring the application is accessible."
          ],
          "design_patterns": []
        }
      ],
      "data_model": {
        "schema_type": "Relational",
        "tables": [
          {
            "name": "tasks",
            "purpose": "Stores information about each task.",
            "fields": [
              {
                "name": "id",
                "type": "UUID",
                "constraints": [
                  "PRIMARY KEY",
                  "NOT NULL"
                ],
                "description": "Unique identifier for the task."
              },
              {
                "name": "description",
                "type": "TEXT",
                "constraints": [
                  "NOT NULL"
                ],
                "description": "The text description of the task."
              },
              {
                "name": "created_at",
                "type": "TIMESTAMP",
                "constraints": [
                  "NOT NULL",
                  "DEFAULT CURRENT_TIMESTAMP"
                ],
                "description": "The timestamp when the task was created."
              },
              {
                "name": "completed",
                "type": "BOOLEAN",
                "constraints": [
                  "NOT NULL",
                  "DEFAULT FALSE"
                ],
                "description": "Indicates whether the task is completed."
              }
            ],
            "relationships": []
          }
        ],
        "relationships": [],
        "justification": "A relational database (PostgreSQL) is chosen because it provides strong data integrity, supports complex queries, and is well-suited for storing structured data like task lists. The schema is straightforward and easy to understand."
      },
      "api_endpoints": {
        "style": "REST",
        "base_url": "/api/v1",
        "authentication": "None (for initial implementation)",
        "endpoints": [
          {
            "method": "POST",
            "path": "/tasks",
            "purpose": "Create a new task.",
            "parameters": [
              {
                "description": "The task description.",
                "type": "string",
                "name": "description"
              }
            ],
            "response": {
              "201": {
                "description": "Task created successfully.",
                "example": {
                  "id": "uuid",
                  "description": "Buy groceries",
                  "created_at": "2024-10-27T10:00:00.000Z",
                  "completed": false
                }
              },
              "400": {
                "description": "Bad Request - Invalid input."
              }
            },
            "authentication_required": false,
            "rate_limiting_applied": false
          },
          {
            "method": "GET",
            "path": "/tasks",
            "purpose": "Get all tasks.",
            "parameters": [],
            "response": {
              "200": {
                "description": "List of tasks.",
                "example": [
                  {
                    "id": "uuid",
                    "description": "Buy groceries",
                    "created_at": "2024-10-27T10:00:00.000Z",
                    "completed": false
                  },
                  {
                    "id": "uuid",
                    "description": "Do laundry",
                    "created_at": "2024-10-27T10:05:00.000Z",
                    "completed": true
                  }
                ]
              }
            },
            "authentication_required": false,
            "rate_limiting_applied": false
          },
          {
            "method": "PUT",
            "path": "/tasks/{id}",
            "purpose": "Update a task (e.g., mark as complete).",
            "parameters": [
              {
                "name": "id",
                "type": "UUID",
                "description": "The ID of the task to update."
              },
              {
                "name": "completed",
                "type": "boolean",
                "description": "Whether the task is completed."
              }
            ],
            "response": {
              "200": {
                "description": "Task updated successfully.",
                "example": {
                  "id": "uuid",
                  "description": "Buy groceries",
                  "created_at": "2024-10-27T10:00:00.000Z",
                  "completed": true
                }
              },
              "400": {
                "description": "Bad Request - Invalid input."
              },
              "404": {
                "description": "Not Found - Task not found."
              }
            },
            "authentication_required": false,
            "rate_limiting_applied": false
          },
          {
            "method": "DELETE",
            "path": "/tasks/{id}",
            "purpose": "Delete a task.",
            "parameters": [
              {
                "name": "id",
                "type": "UUID",
                "description": "The ID of the task to delete."
              }
            ],
            "response": {
              "204": {
                "description": "Task deleted successfully."
              },
              "404": {
                "description": "Not Found - Task not found."
              }
            },
            "authentication_required": false,
            "rate_limiting_applied": false
          }
        ],
        "error_handling": "Standard HTTP status codes and informative error messages in JSON format.",
        "rate_limiting_strategy": null
      },
      "security": {
        "authentication_method": "None (for initial implementation)",
        "authorization_strategy": "None (for initial implementation)",
        "data_encryption": {
          "at_rest": "Not applicable for this simple application.",
          "in_transit": "HTTPS is used to encrypt data in transit."
        },
        "security_measures": [
          {
            "category": "Input Validation",
            "implementation": "Validate all user inputs on the backend to prevent XSS and SQL injection attacks. Use parameterized queries to prevent SQL injection.",
            "mitigation": "XSS, SQL Injection",
            "priority": "High"
          },
          {
            "category": "HTTPS",
            "implementation": "Enforce HTTPS for all communication between the frontend and backend.",
            "mitigation": "Data in transit interception",
            "priority": "High"
          },
          {
            "category": "Authentication",
            "implementation": "Implement authentication (e.g., JWT) if user accounts are added in the future.",
            "mitigation": "Unauthorized access",
            "priority": "Medium"
          },
          {
            "category": "Authorization",
            "implementation": "Implement authorization (e.g., RBAC) if user accounts are added in the future.",
            "mitigation": "Unauthorized access",
            "priority": "Medium"
          }
        ],
        "vulnerability_mitigation_strategies": [
          "Input validation and sanitization.",
          "Output encoding.",
          "Use of parameterized queries.",
          "Regular security audits."
        ],
        "compliance_standards": []
      },
      "scalability_and_performance": {
        "frontend_optimization": "Minify JavaScript and CSS files. Use lazy loading for images and other resources.",
        "backend_optimization": "Optimize database queries. Use caching where appropriate.",
        "database_optimization": "Add indexes to database columns used in queries."
      },
      "deployment_strategy": {
        "environment": "AWS (EC2, RDS, S3, etc.)",
        "frontend_deployment": "Deploy the React frontend to S3 and serve it via CloudFront for fast content delivery.",
        "backend_deployment": "Deploy the Node.js backend to EC2 instances. Use a load balancer to distribute traffic.",
        "database_deployment": "Deploy the PostgreSQL database to RDS.",
        "continuous_integration_and_deployment": "Implement CI/CD pipeline using tools like AWS CodePipeline or similar."
      },
      "monitoring_and_logging": {
        "logging": "Implement logging using a library like Winston (Node.js) or similar. Log important events and errors.",
        "monitoring": "Use AWS CloudWatch for monitoring application performance and resource utilization. Set up alerts for critical events."
      },
      "error_handling_strategy": "Use standard HTTP status codes. Return informative error messages in JSON format. Implement centralized error handling in both frontend and backend.",
      "development_phases_overview": [
        {
          "name": "Phase 1: Setup and Basic Functionality",
          "description": "Set up the development environment, create the frontend and backend projects, and implement the core functionality: adding and viewing tasks.",
          "priority": "High",
          "dependencies": [],
          "tasks": [
            "Set up React frontend.",
            "Set up Node.js backend with Express.",
            "Set up PostgreSQL database.",
            "Implement API endpoints for creating and retrieving tasks.",
            "Implement frontend components for adding and displaying tasks.",
            "Connect frontend to backend."
          ],
          "estimated_duration": "1 week"
        },
        {
          "name": "Phase 2: Enhancements and Testing",
          "description": "Implement additional features, such as marking tasks as complete, deleting tasks, and adding basic styling. Thoroughly test the application.",
          "priority": "High",
          "dependencies": [
            "Phase 1: Setup and Basic Functionality"
          ],
          "tasks": [
            "Implement API endpoints for updating and deleting tasks.",
            "Implement frontend components for updating and deleting tasks.",
            "Add basic styling to the frontend.",
            "Write unit and integration tests.",
            "Address any identified bugs."
          ],
          "estimated_duration": "1 week"
        },
        {
          "name": "Phase 3: Deployment and Refinement",
          "description": "Deploy the application to AWS, configure monitoring and logging, and refine the application based on user feedback.",
          "priority": "High",
          "dependencies": [
            "Phase 2: Enhancements and Testing"
          ],
          "tasks": [
            "Deploy frontend to S3 and CloudFront.",
            "Deploy backend to EC2.",
            "Deploy database to RDS.",
            "Configure monitoring and logging.",
            "Gather user feedback and make necessary adjustments.",
            "Implement HTTPS."
          ],
          "estimated_duration": "1 week"
        }
      ],
      "key_risks": [
        "Security vulnerabilities (XSS, SQL injection).",
        "Performance issues (slow loading times).",
        "Scalability limitations (if the application grows)."
      ],
      "design_justification": "The design prioritizes simplicity, speed of development, and security. The monolithic architecture, React frontend, Node.js backend, and PostgreSQL database are well-suited for the project's scope. AWS is chosen for deployment due to its scalability and comprehensive services. The design incorporates security best practices and addresses potential performance issues.",
      "data_flow": "1. User interacts with the React frontend (e.g., enters a task description). 2. Frontend sends a POST request to the Node.js backend API (e.g., /api/v1/tasks). 3. Backend API validates the input. 4. Backend API interacts with the PostgreSQL database to store the task. 5. Backend API returns a success response (e.g., 201 Created) with the task data to the frontend. 6. Frontend updates the UI to display the new task. 7. For retrieving tasks, the frontend sends a GET request to the backend API (e.g., /api/v1/tasks). 8. Backend API retrieves tasks from the database. 9. Backend API returns the task data to the frontend. 10. Frontend displays the list of tasks."
    },
    "implementation_plan": "plan=ImplementationPlan(project_summary={'title': 'Generated Project Plan', 'description': 'Develop a simple web application for managing a list of tasks, including adding, viewing, updating, and deleting tasks. The application will use React for the frontend, Node.js with Express for the backend, and PostgreSQL for the database. The application will be deployed to AWS.', 'overall_complexity': 'Medium', 'estimated_duration': 'TBD', 'key_challenges': [], 'success_criteria': []}, phases=[{'name': 'Frontend Phase', 'description': 'Tasks related to frontend phase', 'deliverables': ['Completed FE-001', 'Completed FE-002', 'Completed FE-003', 'Completed FE-004', 'Completed FE-005', 'Completed FE-006', 'Completed FE-007', 'Completed FE-008', 'Completed FE-009', 'Completed FE-010', 'Completed FE-013'], 'estimated_duration_hours': 54.0, 'work_items': [{'id': 'FE-001', 'description': 'Set up React project using Create React App.', 'dependencies': [], 'estimated_time': '4 hours', 'agent_role': 'frontend_developer', 'acceptance_criteria': ['Project initializes successfully.', 'Default React app runs without errors.'], 'status': 'pending', 'code_files': ['package.json', 'src/App.js', 'src/index.js']}, {'id': 'FE-002', 'description': 'Install necessary frontend dependencies (Axios, UI library).', 'dependencies': ['FE-001'], 'estimated_time': '2 hours', 'agent_role': 'frontend_developer', 'acceptance_criteria': ['Axios installed and available.', 'UI library (e.g., Material UI, Chakra UI) installed and available.'], 'status': 'pending', 'code_files': ['package.json']}, {'id': 'FE-003', 'description': 'Create a TaskInput component with a text input and add button.', 'dependencies': ['FE-002'], 'estimated_time': '4 hours', 'agent_role': 'frontend_developer', 'acceptance_criteria': ['Component renders correctly.', 'Input field accepts text.', 'Button is displayed.'], 'status': 'pending', 'code_files': ['src/components/TaskInput.js']}, {'id': 'FE-004', 'description': 'Create a TaskList component to display tasks.', 'dependencies': ['FE-002'], 'estimated_time': '4 hours', 'agent_role': 'frontend_developer', 'acceptance_criteria': ['Component renders correctly.', 'Displays a list of tasks (initially empty).'], 'status': 'pending', 'code_files': ['src/components/TaskList.js']}, {'id': 'FE-005', 'description': 'Implement basic styling for TaskInput and TaskList components.', 'dependencies': ['FE-003', 'FE-004'], 'estimated_time': '4 hours', 'agent_role': 'frontend_developer', 'acceptance_criteria': ['Components are visually appealing.', 'Layout is clear and readable.'], 'status': 'pending', 'code_files': ['src/components/TaskInput.css', 'src/components/TaskList.css']}, {'id': 'FE-006', 'description': 'Implement functionality to send a POST request to create a task.', 'dependencies': ['FE-003', 'BE-004'], 'estimated_time': '6 hours', 'agent_role': 'frontend_developer', 'acceptance_criteria': ['Task description is submitted to the backend.', 'Backend API is called correctly.', 'UI updates to reflect the new task (without page refresh).'], 'status': 'pending', 'code_files': ['src/components/TaskInput.js', 'src/App.js']}, {'id': 'FE-007', 'description': 'Implement functionality to fetch and display tasks from the backend.', 'dependencies': ['FE-004', 'BE-005'], 'estimated_time': '6 hours', 'agent_role': 'frontend_developer', 'acceptance_criteria': ['Frontend fetches tasks from the backend on component mount.', 'Tasks are displayed in the TaskList component.', 'Error handling for API calls is implemented.'], 'status': 'pending', 'code_files': ['src/components/TaskList.js', 'src/App.js']}, {'id': 'FE-008', 'description': 'Implement functionality to update task completion status.', 'dependencies': ['FE-004', 'BE-006'], 'estimated_time': '6 hours', 'agent_role': 'frontend_developer', 'acceptance_criteria': ['User can mark a task as complete/incomplete.', 'Frontend sends a PUT request to update the task.', 'UI updates to reflect the change (without page refresh).'], 'status': 'pending', 'code_files': ['src/components/TaskList.js']}, {'id': 'FE-009', 'description': 'Implement functionality to delete a task.', 'dependencies': ['FE-004', 'BE-007'], 'estimated_time': '6 hours', 'agent_role': 'frontend_developer', 'acceptance_criteria': ['User can delete a task.', 'Frontend sends a DELETE request.', 'UI updates to reflect the change (without page refresh).'], 'status': 'pending', 'code_files': ['src/components/TaskList.js']}, {'id': 'FE-010', 'description': 'Add basic error handling and user feedback in the frontend.', 'dependencies': ['FE-006', 'FE-007', 'FE-008', 'FE-009'], 'estimated_time': '4 hours', 'agent_role': 'frontend_developer', 'acceptance_criteria': ['Error messages are displayed to the user for API failures.', 'Loading indicators are shown during API calls.', 'Success messages are displayed for successful operations.'], 'status': 'pending', 'code_files': ['src/App.js', 'src/components/TaskInput.js', 'src/components/TaskList.js']}, {'id': 'FE-013', 'description': 'Implement unit tests for frontend components.', 'dependencies': ['FE-003', 'FE-004'], 'estimated_time': '8 hours', 'agent_role': 'frontend_developer', 'acceptance_criteria': ['Unit tests are written for TaskInput and TaskList components.', 'Tests cover various scenarios (e.g., rendering, input validation, API calls).', 'Tests pass.'], 'status': 'pending', 'code_files': ['src/components/TaskInput.test.js', 'src/components/TaskList.test.js']}]}, {'name': 'Backend Phase', 'description': 'Tasks related to backend phase', 'deliverables': ['Completed BE-001', 'Completed BE-002', 'Completed BE-004', 'Completed BE-005', 'Completed BE-006', 'Completed BE-007', 'Completed BE-008', 'Completed FE-011', 'Completed BE-011', 'Completed BE-012'], 'estimated_duration_hours': 62.0, 'work_items': [{'id': 'BE-001', 'description': 'Set up Node.js project with Express.', 'dependencies': [], 'estimated_time': '4 hours', 'agent_role': 'backend_developer', 'acceptance_criteria': ['Project initializes successfully.', 'Express server runs without errors.', \"Basic route (e.g., '/') responds with 'Hello World'.\"], 'status': 'pending', 'code_files': ['package.json', 'index.js']}, {'id': 'BE-002', 'description': 'Install necessary backend dependencies (body-parser, cors, pg).', 'dependencies': ['BE-001'], 'estimated_time': '2 hours', 'agent_role': 'backend_developer', 'acceptance_criteria': ['body-parser installed and available.', 'cors installed and available.', 'pg (PostgreSQL driver) installed and available.'], 'status': 'pending', 'code_files': ['package.json']}, {'id': 'BE-004', 'description': 'Implement API endpoint to create a new task (/api/v1/tasks - POST).', 'dependencies': ['BE-002', 'BE-003'], 'estimated_time': '8 hours', 'agent_role': 'backend_developer', 'acceptance_criteria': ['Endpoint accepts POST requests to /api/v1/tasks.', \"Endpoint validates the 'description' parameter.\", 'Task is saved to the database.', 'Endpoint returns 201 Created with the new task data.'], 'status': 'pending', 'code_files': ['index.js']}, {'id': 'BE-005', 'description': 'Implement API endpoint to get all tasks (/api/v1/tasks - GET).', 'dependencies': ['BE-002', 'BE-003'], 'estimated_time': '6 hours', 'agent_role': 'backend_developer', 'acceptance_criteria': ['Endpoint accepts GET requests to /api/v1/tasks.', 'Endpoint retrieves all tasks from the database.', 'Endpoint returns 200 OK with a list of tasks.'], 'status': 'pending', 'code_files': ['index.js']}, {'id': 'BE-006', 'description': 'Implement API endpoint to update a task (/api/v1/tasks/:id - PUT).', 'dependencies': ['BE-002', 'BE-003'], 'estimated_time': '8 hours', 'agent_role': 'backend_developer', 'acceptance_criteria': ['Endpoint accepts PUT requests to /api/v1/tasks/:id.', \"Endpoint validates the task ID and 'completed' parameter.\", 'Task is updated in the database.', 'Endpoint returns 200 OK with the updated task data or 404 if not found.'], 'status': 'pending', 'code_files': ['index.js']}, {'id': 'BE-007', 'description': 'Implement API endpoint to delete a task (/api/v1/tasks/:id - DELETE).', 'dependencies': ['BE-002', 'BE-003'], 'estimated_time': '6 hours', 'agent_role': 'backend_developer', 'acceptance_criteria': ['Endpoint accepts DELETE requests to /api/v1/tasks/:id.', 'Endpoint validates the task ID.', 'Task is deleted from the database.', 'Endpoint returns 204 No Content or 404 if not found.'], 'status': 'pending', 'code_files': ['index.js']}, {'id': 'BE-008', 'description': 'Implement input validation on the backend.', 'dependencies': ['BE-004', 'BE-006'], 'estimated_time': '4 hours', 'agent_role': 'backend_developer', 'acceptance_criteria': ['Input validation for task description (e.g., not empty).', 'Input validation for task ID (UUID format).', 'Returns 400 Bad Request for invalid input.'], 'status': 'pending', 'code_files': ['index.js']}, {'id': 'FE-011', 'description': 'Implement HTTPS for the application.', 'dependencies': ['FE-001', 'BE-001'], 'estimated_time': '8 hours', 'agent_role': 'backend_developer', 'acceptance_criteria': ['Application is served over HTTPS.', 'SSL certificate is configured correctly.'], 'status': 'pending', 'code_files': ['index.js']}, {'id': 'BE-011', 'description': 'Implement logging for backend.', 'dependencies': ['BE-001'], 'estimated_time': '4 hours', 'agent_role': 'backend_developer', 'acceptance_criteria': ['Logging library (e.g., Winston) is installed.', 'Important events and errors are logged.'], 'status': 'pending', 'code_files': ['index.js']}, {'id': 'BE-012', 'description': 'Implement unit tests for backend API endpoints.', 'dependencies': ['BE-004', 'BE-005', 'BE-006', 'BE-007'], 'estimated_time': '12 hours', 'agent_role': 'backend_developer', 'acceptance_criteria': ['Unit tests are written for all API endpoints.', 'Tests cover various scenarios (e.g., successful requests, error handling, input validation).', 'Tests pass.'], 'status': 'pending', 'code_files': ['tests/api.test.js']}]}, {'name': 'Database Phase', 'description': 'Tasks related to database phase', 'deliverables': ['Completed BE-003'], 'estimated_duration_hours': 4.0, 'work_items': [{'id': 'BE-003', 'description': \"Set up PostgreSQL database and create 'tasks' table.\", 'dependencies': [], 'estimated_time': '4 hours', 'agent_role': 'database_specialist', 'acceptance_criteria': ['Database connection established.', \"'tasks' table created with 'id', 'description', 'created_at', and 'completed' columns.\", 'UUID extension enabled.'], 'status': 'pending', 'code_files': ['db/schema.sql']}]}, {'name': 'Devops_Engineer Phase', 'description': 'Tasks related to devops_engineer phase', 'deliverables': ['Completed FE-012', 'Completed BE-009', 'Completed BE-010'], 'estimated_duration_hours': 20.0, 'work_items': [{'id': 'FE-012', 'description': 'Deploy frontend to S3 and serve via CloudFront.', 'dependencies': ['FE-011'], 'estimated_time': '8 hours', 'agent_role': 'devops_engineer', 'acceptance_criteria': ['Frontend is deployed to S3.', 'CloudFront distribution is configured.', 'Application is accessible via CloudFront URL.'], 'status': 'pending', 'code_files': []}, {'id': 'BE-009', 'description': 'Deploy backend to EC2.', 'dependencies': ['BE-001', 'BE-003', 'BE-008'], 'estimated_time': '8 hours', 'agent_role': 'devops_engineer', 'acceptance_criteria': ['Backend is deployed to EC2.', 'Backend is running and accessible.', 'Database connection is configured correctly.'], 'status': 'pending', 'code_files': []}, {'id': 'BE-010', 'description': 'Deploy database to RDS.', 'dependencies': ['BE-003'], 'estimated_time': '4 hours', 'agent_role': 'devops_engineer', 'acceptance_criteria': ['Database is deployed to RDS.', 'Database is running and accessible.'], 'status': 'pending', 'code_files': []}]}], resource_allocation=[{'role': 'Devops Engineer', 'count': 1, 'estimated_time_allocation': '100%', 'phases': ['Devops_Engineer Phase'], 'skills_required': []}, {'role': 'Frontend Developer', 'count': 1, 'estimated_time_allocation': '100%', 'phases': ['Frontend Phase'], 'skills_required': []}, {'role': 'Database Specialist', 'count': 1, 'estimated_time_allocation': '100%', 'phases': ['Database Phase'], 'skills_required': []}, {'role': 'Backend Developer', 'count': 1, 'estimated_time_allocation': '100%', 'phases': ['Backend Phase'], 'skills_required': []}], risks_and_mitigations=[], timeline={'start_date': '2025-07-08T17:39:34.457333', 'end_date': 'TBD', 'milestones': []}, tech_stack={}, metadata={'generated_at': '2025-07-08T17:39:34.457333', 'version': '1.0', 'author': 'Multi-AI Dev System', 'tags': [], 'notes': 'Converted from WorkItemBacklog. Original summary: Develop a simple web application for managing a list of tasks, including adding, viewing, updating, and deleting tasks. The application will use React for the frontend, Node.js with Express for the backend, and PostgreSQL for the database. The application will be deployed to AWS.'}) summary='Develop a simple web application for managing a list of tasks, including adding, viewing, updating, and deleting tasks. The application will use React for the frontend, Node.js with Express for the backend, and PostgreSQL for the database. The application will be deployed to AWS.' metadata=PlanMetadata(generated_at='2025-07-08T17:39:34.457333', version='1.0', author='Multi-AI Dev System', tags=[], notes='Converted from WorkItemBacklog. Original summary: Develop a simple web application for managing a list of tasks, including adding, viewing, updating, and deleting tasks. The application will use React for the frontend, Node.js with Express for the backend, and PostgreSQL for the database. The application will be deployed to AWS.')"
  }
}