{
  "session_id": "session_0f5d0c3f-9fe8-4a59-83de-01f50758e384",
  "approval_type": "implementation_plan",
  "timestamp": 1752032882,
  "approval_data": {
    "type": "implementation_plan",
    "timestamp": 1752032882.1705406,
    "project_overview": "Develop a simple web application to manage a list of tasks, allowing users to add and view tasks. The application will use React for the frontend, Node.js with Express for the backend, and PostgreSQL for the database. It will be deployed on AWS using EC2, RDS, S3, and CloudFront, with a CI/CD pipeline for automated deployments.",
    "development_phases": [
      {
        "name": "Frontend Phase",
        "description": "Tasks related to frontend phase",
        "deliverables": [
          "Completed FE-001",
          "Completed FE-002",
          "Completed FE-003",
          "Completed FE-004",
          "Completed FE-005",
          "Completed FE-006",
          "Completed PT-002"
        ],
        "estimated_duration_hours": 40.0,
        "work_items": [
          {
            "id": "FE-001",
            "description": "Set up React project using Create React App.",
            "dependencies": [],
            "estimated_time": "4 hours",
            "agent_role": "frontend_developer",
            "acceptance_criteria": [
              "Project is initialized successfully.",
              "Default React app runs without errors."
            ],
            "status": "pending",
            "code_files": [
              "package.json",
              "src/App.js",
              "src/index.js"
            ]
          },
          {
            "id": "FE-002",
            "description": "Design the UI for adding a task (input field and button).",
            "dependencies": [
              "FE-001"
            ],
            "estimated_time": "4 hours",
            "agent_role": "frontend_developer",
            "acceptance_criteria": [
              "UI elements for task input are present.",
              "Button is visually clear."
            ],
            "status": "pending",
            "code_files": [
              "src/App.js",
              "src/App.css"
            ]
          },
          {
            "id": "FE-003",
            "description": "Implement the task input form (handle input changes).",
            "dependencies": [
              "FE-002"
            ],
            "estimated_time": "4 hours",
            "agent_role": "frontend_developer",
            "acceptance_criteria": [
              "Input field captures user input.",
              "State updates correctly on input change."
            ],
            "status": "pending",
            "code_files": [
              "src/App.js"
            ]
          },
          {
            "id": "FE-004",
            "description": "Implement the 'Add Task' button functionality (call API).",
            "dependencies": [
              "FE-003",
              "BE-002"
            ],
            "estimated_time": "8 hours",
            "agent_role": "frontend_developer",
            "acceptance_criteria": [
              "Button click triggers API call.",
              "API call sends task description.",
              "Error handling for API call implemented."
            ],
            "status": "pending",
            "code_files": [
              "src/App.js"
            ]
          },
          {
            "id": "FE-005",
            "description": "Design the UI for displaying the task list.",
            "dependencies": [
              "FE-001"
            ],
            "estimated_time": "4 hours",
            "agent_role": "frontend_developer",
            "acceptance_criteria": [
              "Task list container is present.",
              "Each task is displayed in a clear format."
            ],
            "status": "pending",
            "code_files": [
              "src/App.js",
              "src/App.css"
            ]
          },
          {
            "id": "FE-006",
            "description": "Fetch tasks from the backend API and display them.",
            "dependencies": [
              "FE-005",
              "BE-003"
            ],
            "estimated_time": "8 hours",
            "agent_role": "frontend_developer",
            "acceptance_criteria": [
              "API call to fetch tasks is made on component mount.",
              "Tasks are displayed in the task list.",
              "Error handling for API call implemented."
            ],
            "status": "pending",
            "code_files": [
              "src/App.js"
            ]
          },
          {
            "id": "PT-002",
            "description": "Write integration tests for the frontend and backend.",
            "dependencies": [
              "FE-006",
              "BE-003"
            ],
            "estimated_time": "8 hours",
            "agent_role": "frontend_developer",
            "acceptance_criteria": [
              "Tests verify the interaction between frontend and backend.",
              "Tests cover adding and retrieving tasks.",
              "Tests pass."
            ],
            "status": "pending",
            "code_files": [
              "tests/integration.test.js"
            ]
          }
        ]
      },
      {
        "name": "Backend Phase",
        "description": "Tasks related to backend phase",
        "deliverables": [
          "Completed BE-001",
          "Completed BE-002",
          "Completed BE-003",
          "Completed SC-001",
          "Completed PT-001",
          "Completed MN-001"
        ],
        "estimated_duration_hours": 36.0,
        "work_items": [
          {
            "id": "BE-001",
            "description": "Set up Node.js and Express project.",
            "dependencies": [],
            "estimated_time": "4 hours",
            "agent_role": "backend_developer",
            "acceptance_criteria": [
              "Project is initialized successfully.",
              "Express server runs without errors."
            ],
            "status": "pending",
            "code_files": [
              "package.json",
              "index.js"
            ]
          },
          {
            "id": "BE-002",
            "description": "Implement the /tasks POST endpoint (create task).",
            "dependencies": [
              "BE-001",
              "DB-001"
            ],
            "estimated_time": "8 hours",
            "agent_role": "backend_developer",
            "acceptance_criteria": [
              "Endpoint accepts POST requests to /tasks.",
              "Endpoint validates input.",
              "Endpoint saves task to the database.",
              "Endpoint returns 201 status on success.",
              "Endpoint returns 400 status on validation error."
            ],
            "status": "pending",
            "code_files": [
              "index.js"
            ]
          },
          {
            "id": "BE-003",
            "description": "Implement the /tasks GET endpoint (get all tasks).",
            "dependencies": [
              "BE-001",
              "DB-001"
            ],
            "estimated_time": "8 hours",
            "agent_role": "backend_developer",
            "acceptance_criteria": [
              "Endpoint accepts GET requests to /tasks.",
              "Endpoint retrieves all tasks from the database.",
              "Endpoint returns 200 status on success.",
              "Endpoint returns tasks in JSON format."
            ],
            "status": "pending",
            "code_files": [
              "index.js"
            ]
          },
          {
            "id": "SC-001",
            "description": "Implement input validation on the backend.",
            "dependencies": [
              "BE-002"
            ],
            "estimated_time": "4 hours",
            "agent_role": "backend_developer",
            "acceptance_criteria": [
              "Input validation for task description implemented.",
              "Invalid input results in 400 Bad Request."
            ],
            "status": "pending",
            "code_files": [
              "index.js"
            ]
          },
          {
            "id": "PT-001",
            "description": "Write unit tests for the backend API endpoints.",
            "dependencies": [
              "BE-002",
              "BE-003"
            ],
            "estimated_time": "8 hours",
            "agent_role": "backend_developer",
            "acceptance_criteria": [
              "Unit tests cover the /tasks POST endpoint.",
              "Unit tests cover the /tasks GET endpoint.",
              "Tests pass."
            ],
            "status": "pending",
            "code_files": [
              "tests/api.test.js"
            ]
          },
          {
            "id": "MN-001",
            "description": "Implement logging in the backend API.",
            "dependencies": [
              "BE-003"
            ],
            "estimated_time": "4 hours",
            "agent_role": "backend_developer",
            "acceptance_criteria": [
              "Logging library (e.g., Winston) is integrated.",
              "API requests and errors are logged."
            ],
            "status": "pending",
            "code_files": [
              "index.js"
            ]
          }
        ]
      },
      {
        "name": "Database Phase",
        "description": "Tasks related to database phase",
        "deliverables": [
          "Completed DB-001",
          "Completed DB-002"
        ],
        "estimated_duration_hours": 16.0,
        "work_items": [
          {
            "id": "DB-001",
            "description": "Set up PostgreSQL database and create 'tasks' table.",
            "dependencies": [],
            "estimated_time": "8 hours",
            "agent_role": "database_specialist",
            "acceptance_criteria": [
              "PostgreSQL database is running.",
              "'tasks' table exists with 'id', 'description', and 'created_at' columns.",
              "Database connection details are configured."
            ],
            "status": "pending",
            "code_files": [
              "db_setup.sql"
            ]
          },
          {
            "id": "DB-002",
            "description": "Implement database queries for creating and retrieving tasks.",
            "dependencies": [
              "DB-001"
            ],
            "estimated_time": "8 hours",
            "agent_role": "database_specialist",
            "acceptance_criteria": [
              "Queries for inserting and selecting tasks are implemented.",
              "Queries are parameterized to prevent SQL injection."
            ],
            "status": "pending",
            "code_files": [
              "db_queries.js"
            ]
          }
        ]
      },
      {
        "name": "Devops_Engineer Phase",
        "description": "Tasks related to devops_engineer phase",
        "deliverables": [
          "Completed CI-001",
          "Completed DE-001",
          "Completed DE-002",
          "Completed DE-003",
          "Completed SC-002",
          "Completed MN-002"
        ],
        "estimated_duration_hours": 32.0,
        "work_items": [
          {
            "id": "CI-001",
            "description": "Set up a CI/CD pipeline using GitHub Actions.",
            "dependencies": [
              "FE-006",
              "BE-003"
            ],
            "estimated_time": "8 hours",
            "agent_role": "devops_engineer",
            "acceptance_criteria": [
              "Pipeline builds the frontend.",
              "Pipeline builds the backend.",
              "Pipeline runs unit tests.",
              "Pipeline deploys to AWS (S3 and EC2)."
            ],
            "status": "pending",
            "code_files": [
              ".github/workflows/deploy.yml"
            ]
          },
          {
            "id": "DE-001",
            "description": "Deploy frontend to S3 and configure CloudFront.",
            "dependencies": [
              "FE-006"
            ],
            "estimated_time": "4 hours",
            "agent_role": "devops_engineer",
            "acceptance_criteria": [
              "Frontend is deployed to S3.",
              "CloudFront distribution is created.",
              "Application is accessible via CloudFront URL."
            ],
            "status": "pending",
            "code_files": []
          },
          {
            "id": "DE-002",
            "description": "Deploy backend to EC2.",
            "dependencies": [
              "BE-003",
              "DB-002"
            ],
            "estimated_time": "8 hours",
            "agent_role": "devops_engineer",
            "acceptance_criteria": [
              "Backend is deployed to EC2 instance.",
              "Backend is running and accessible.",
              "Database connection is configured."
            ],
            "status": "pending",
            "code_files": []
          },
          {
            "id": "DE-003",
            "description": "Deploy PostgreSQL to RDS.",
            "dependencies": [
              "DB-002"
            ],
            "estimated_time": "4 hours",
            "agent_role": "devops_engineer",
            "acceptance_criteria": [
              "PostgreSQL database is deployed to RDS.",
              "Database is accessible from EC2 instance."
            ],
            "status": "pending",
            "code_files": []
          },
          {
            "id": "SC-002",
            "description": "Implement HTTPS for communication.",
            "dependencies": [
              "DE-002"
            ],
            "estimated_time": "4 hours",
            "agent_role": "devops_engineer",
            "acceptance_criteria": [
              "HTTPS is enabled for the EC2 instance.",
              "Frontend communicates with the backend over HTTPS."
            ],
            "status": "pending",
            "code_files": []
          },
          {
            "id": "MN-002",
            "description": "Set up monitoring with AWS CloudWatch.",
            "dependencies": [
              "DE-002"
            ],
            "estimated_time": "4 hours",
            "agent_role": "devops_engineer",
            "acceptance_criteria": [
              "CloudWatch is configured for the EC2 instance.",
              "CPU and memory usage are monitored."
            ],
            "status": "pending",
            "code_files": []
          }
        ]
      }
    ],
    "timeline_estimation": {
      "start_date": "2025-07-09T09:18:00.734028",
      "end_date": "TBD",
      "milestones": []
    },
    "risk_assessment": [],
    "resource_requirements": [
      {
        "role": "Frontend Developer",
        "count": 1,
        "estimated_time_allocation": "100%",
        "phases": [
          "Frontend Phase"
        ],
        "skills_required": []
      },
      {
        "role": "Database Specialist",
        "count": 1,
        "estimated_time_allocation": "100%",
        "phases": [
          "Database Phase"
        ],
        "skills_required": []
      },
      {
        "role": "Backend Developer",
        "count": 1,
        "estimated_time_allocation": "100%",
        "phases": [
          "Backend Phase"
        ],
        "skills_required": []
      },
      {
        "role": "Devops Engineer",
        "count": 1,
        "estimated_time_allocation": "100%",
        "phases": [
          "Devops_Engineer Phase"
        ],
        "skills_required": []
      }
    ],
    "deliverables": [
      "Completed FE-001",
      "Completed FE-002",
      "Completed FE-003",
      "Completed FE-004",
      "Completed FE-005",
      "Completed FE-006",
      "Completed PT-002",
      "Completed BE-001",
      "Completed BE-002",
      "Completed BE-003",
      "Completed SC-001",
      "Completed PT-001",
      "Completed MN-001",
      "Completed DB-001",
      "Completed DB-002",
      "Completed CI-001",
      "Completed DE-001",
      "Completed DE-002",
      "Completed DE-003",
      "Completed SC-002",
      "Completed MN-002"
    ],
    "dependencies": [],
    "raw_plan": "plan=ImplementationPlan(project_summary={'title': 'Generated Project Plan', 'description': 'Develop a simple web application to manage a list of tasks, allowing users to add and view tasks. The application will use React for the frontend, Node.js with Express for the backend, and PostgreSQL for the database. It will be deployed on AWS using EC2, RDS, S3, and CloudFront, with a CI/CD pipeline for automated deployments.', 'overall_complexity': 'Medium', 'estimated_duration': 'TBD', 'key_challenges': [], 'success_criteria': []}, phases=[{'name': 'Frontend Phase', 'description': 'Tasks related to frontend phase', 'deliverables': ['Completed FE-001', 'Completed FE-002', 'Completed FE-003', 'Completed FE-004', 'Completed FE-005', 'Completed FE-006', 'Completed PT-002'], 'estimated_duration_hours': 40.0, 'work_items': [{'id': 'FE-001', 'description': 'Set up React project using Create React App.', 'dependencies': [], 'estimated_time': '4 hours', 'agent_role': 'frontend_developer', 'acceptance_criteria': ['Project is initialized successfully.', 'Default React app runs without errors.'], 'status': 'pending', 'code_files': ['package.json', 'src/App.js', 'src/index.js']}, {'id': 'FE-002', 'description': 'Design the UI for adding a task (input field and button).', 'dependencies': ['FE-001'], 'estimated_time': '4 hours', 'agent_role': 'frontend_developer', 'acceptance_criteria': ['UI elements for task input are present.', 'Button is visually clear.'], 'status': 'pending', 'code_files': ['src/App.js', 'src/App.css']}, {'id': 'FE-003', 'description': 'Implement the task input form (handle input changes).', 'dependencies': ['FE-002'], 'estimated_time': '4 hours', 'agent_role': 'frontend_developer', 'acceptance_criteria': ['Input field captures user input.', 'State updates correctly on input change.'], 'status': 'pending', 'code_files': ['src/App.js']}, {'id': 'FE-004', 'description': \"Implement the 'Add Task' button functionality (call API).\", 'dependencies': ['FE-003', 'BE-002'], 'estimated_time': '8 hours', 'agent_role': 'frontend_developer', 'acceptance_criteria': ['Button click triggers API call.', 'API call sends task description.', 'Error handling for API call implemented.'], 'status': 'pending', 'code_files': ['src/App.js']}, {'id': 'FE-005', 'description': 'Design the UI for displaying the task list.', 'dependencies': ['FE-001'], 'estimated_time': '4 hours', 'agent_role': 'frontend_developer', 'acceptance_criteria': ['Task list container is present.', 'Each task is displayed in a clear format.'], 'status': 'pending', 'code_files': ['src/App.js', 'src/App.css']}, {'id': 'FE-006', 'description': 'Fetch tasks from the backend API and display them.', 'dependencies': ['FE-005', 'BE-003'], 'estimated_time': '8 hours', 'agent_role': 'frontend_developer', 'acceptance_criteria': ['API call to fetch tasks is made on component mount.', 'Tasks are displayed in the task list.', 'Error handling for API call implemented.'], 'status': 'pending', 'code_files': ['src/App.js']}, {'id': 'PT-002', 'description': 'Write integration tests for the frontend and backend.', 'dependencies': ['FE-006', 'BE-003'], 'estimated_time': '8 hours', 'agent_role': 'frontend_developer', 'acceptance_criteria': ['Tests verify the interaction between frontend and backend.', 'Tests cover adding and retrieving tasks.', 'Tests pass.'], 'status': 'pending', 'code_files': ['tests/integration.test.js']}]}, {'name': 'Backend Phase', 'description': 'Tasks related to backend phase', 'deliverables': ['Completed BE-001', 'Completed BE-002', 'Completed BE-003', 'Completed SC-001', 'Completed PT-001', 'Completed MN-001'], 'estimated_duration_hours': 36.0, 'work_items': [{'id': 'BE-001', 'description': 'Set up Node.js and Express project.', 'dependencies': [], 'estimated_time': '4 hours', 'agent_role': 'backend_developer', 'acceptance_criteria': ['Project is initialized successfully.', 'Express server runs without errors.'], 'status': 'pending', 'code_files': ['package.json', 'index.js']}, {'id': 'BE-002', 'description': 'Implement the /tasks POST endpoint (create task).', 'dependencies': ['BE-001', 'DB-001'], 'estimated_time': '8 hours', 'agent_role': 'backend_developer', 'acceptance_criteria': ['Endpoint accepts POST requests to /tasks.', 'Endpoint validates input.', 'Endpoint saves task to the database.', 'Endpoint returns 201 status on success.', 'Endpoint returns 400 status on validation error.'], 'status': 'pending', 'code_files': ['index.js']}, {'id': 'BE-003', 'description': 'Implement the /tasks GET endpoint (get all tasks).', 'dependencies': ['BE-001', 'DB-001'], 'estimated_time': '8 hours', 'agent_role': 'backend_developer', 'acceptance_criteria': ['Endpoint accepts GET requests to /tasks.', 'Endpoint retrieves all tasks from the database.', 'Endpoint returns 200 status on success.', 'Endpoint returns tasks in JSON format.'], 'status': 'pending', 'code_files': ['index.js']}, {'id': 'SC-001', 'description': 'Implement input validation on the backend.', 'dependencies': ['BE-002'], 'estimated_time': '4 hours', 'agent_role': 'backend_developer', 'acceptance_criteria': ['Input validation for task description implemented.', 'Invalid input results in 400 Bad Request.'], 'status': 'pending', 'code_files': ['index.js']}, {'id': 'PT-001', 'description': 'Write unit tests for the backend API endpoints.', 'dependencies': ['BE-002', 'BE-003'], 'estimated_time': '8 hours', 'agent_role': 'backend_developer', 'acceptance_criteria': ['Unit tests cover the /tasks POST endpoint.', 'Unit tests cover the /tasks GET endpoint.', 'Tests pass.'], 'status': 'pending', 'code_files': ['tests/api.test.js']}, {'id': 'MN-001', 'description': 'Implement logging in the backend API.', 'dependencies': ['BE-003'], 'estimated_time': '4 hours', 'agent_role': 'backend_developer', 'acceptance_criteria': ['Logging library (e.g., Winston) is integrated.', 'API requests and errors are logged.'], 'status': 'pending', 'code_files': ['index.js']}]}, {'name': 'Database Phase', 'description': 'Tasks related to database phase', 'deliverables': ['Completed DB-001', 'Completed DB-002'], 'estimated_duration_hours': 16.0, 'work_items': [{'id': 'DB-001', 'description': \"Set up PostgreSQL database and create 'tasks' table.\", 'dependencies': [], 'estimated_time': '8 hours', 'agent_role': 'database_specialist', 'acceptance_criteria': ['PostgreSQL database is running.', \"'tasks' table exists with 'id', 'description', and 'created_at' columns.\", 'Database connection details are configured.'], 'status': 'pending', 'code_files': ['db_setup.sql']}, {'id': 'DB-002', 'description': 'Implement database queries for creating and retrieving tasks.', 'dependencies': ['DB-001'], 'estimated_time': '8 hours', 'agent_role': 'database_specialist', 'acceptance_criteria': ['Queries for inserting and selecting tasks are implemented.', 'Queries are parameterized to prevent SQL injection.'], 'status': 'pending', 'code_files': ['db_queries.js']}]}, {'name': 'Devops_Engineer Phase', 'description': 'Tasks related to devops_engineer phase', 'deliverables': ['Completed CI-001', 'Completed DE-001', 'Completed DE-002', 'Completed DE-003', 'Completed SC-002', 'Completed MN-002'], 'estimated_duration_hours': 32.0, 'work_items': [{'id': 'CI-001', 'description': 'Set up a CI/CD pipeline using GitHub Actions.', 'dependencies': ['FE-006', 'BE-003'], 'estimated_time': '8 hours', 'agent_role': 'devops_engineer', 'acceptance_criteria': ['Pipeline builds the frontend.', 'Pipeline builds the backend.', 'Pipeline runs unit tests.', 'Pipeline deploys to AWS (S3 and EC2).'], 'status': 'pending', 'code_files': ['.github/workflows/deploy.yml']}, {'id': 'DE-001', 'description': 'Deploy frontend to S3 and configure CloudFront.', 'dependencies': ['FE-006'], 'estimated_time': '4 hours', 'agent_role': 'devops_engineer', 'acceptance_criteria': ['Frontend is deployed to S3.', 'CloudFront distribution is created.', 'Application is accessible via CloudFront URL.'], 'status': 'pending', 'code_files': []}, {'id': 'DE-002', 'description': 'Deploy backend to EC2.', 'dependencies': ['BE-003', 'DB-002'], 'estimated_time': '8 hours', 'agent_role': 'devops_engineer', 'acceptance_criteria': ['Backend is deployed to EC2 instance.', 'Backend is running and accessible.', 'Database connection is configured.'], 'status': 'pending', 'code_files': []}, {'id': 'DE-003', 'description': 'Deploy PostgreSQL to RDS.', 'dependencies': ['DB-002'], 'estimated_time': '4 hours', 'agent_role': 'devops_engineer', 'acceptance_criteria': ['PostgreSQL database is deployed to RDS.', 'Database is accessible from EC2 instance.'], 'status': 'pending', 'code_files': []}, {'id': 'SC-002', 'description': 'Implement HTTPS for communication.', 'dependencies': ['DE-002'], 'estimated_time': '4 hours', 'agent_role': 'devops_engineer', 'acceptance_criteria': ['HTTPS is enabled for the EC2 instance.', 'Frontend communicates with the backend over HTTPS.'], 'status': 'pending', 'code_files': []}, {'id': 'MN-002', 'description': 'Set up monitoring with AWS CloudWatch.', 'dependencies': ['DE-002'], 'estimated_time': '4 hours', 'agent_role': 'devops_engineer', 'acceptance_criteria': ['CloudWatch is configured for the EC2 instance.', 'CPU and memory usage are monitored.'], 'status': 'pending', 'code_files': []}]}], resource_allocation=[{'role': 'Frontend Developer', 'count': 1, 'estimated_time_allocation': '100%', 'phases': ['Frontend Phase'], 'skills_required': []}, {'role': 'Database Specialist', 'count': 1, 'estimated_time_allocation': '100%', 'phases': ['Database Phase'], 'skills_required': []}, {'role': 'Backend Developer', 'count': 1, 'estimated_time_allocation': '100%', 'phases': ['Backend Phase'], 'skills_required': []}, {'role': 'Devops Engineer', 'count': 1, 'estimated_time_allocation': '100%', 'phases': ['Devops_Engineer Phase'], 'skills_required': []}], risks_and_mitigations=[], timeline={'start_date': '2025-07-09T09:18:00.734028', 'end_date': 'TBD', 'milestones': []}, tech_stack={}, metadata={'generated_at': '2025-07-09T09:18:00.734028', 'version': '1.0', 'author': 'Multi-AI Dev System', 'tags': [], 'notes': 'Converted from WorkItemBacklog. Original summary: Develop a simple web application to manage a list of tasks, allowing users to add and view tasks. The application will use React for the frontend, Node.js with Express for the backend, and PostgreSQL for the database. It will be deployed on AWS using EC2, RDS, S3, and CloudFront, with a CI/CD pipeline for automated deployments.'}) summary='Develop a simple web application to manage a list of tasks, allowing users to add and view tasks. The application will use React for the frontend, Node.js with Express for the backend, and PostgreSQL for the database. It will be deployed on AWS using EC2, RDS, S3, and CloudFront, with a CI/CD pipeline for automated deployments.' metadata=PlanMetadata(generated_at='2025-07-09T09:18:00.734028', version='1.0', author='Multi-AI Dev System', tags=[], notes='Converted from WorkItemBacklog. Original summary: Develop a simple web application to manage a list of tasks, allowing users to add and view tasks. The application will use React for the frontend, Node.js with Express for the backend, and PostgreSQL for the database. It will be deployed on AWS using EC2, RDS, S3, and CloudFront, with a CI/CD pipeline for automated deployments.')"
  },
  "workflow_state_snapshot": {
    "requirements_analysis": {
      "project_name": "Hello World Task List",
      "project_summary": "A simple web application to manage a list of tasks.",
      "project_goals": [
        "Allow a user to add a task",
        "Allow a user to see their list of tasks"
      ],
      "target_audience": [
        "Users who want to manage a list of tasks"
      ],
      "business_context": "This project provides a basic task management solution.",
      "requirements": [
        {
          "id": "REQ-001",
          "description": "A user can create a new task with a text description.",
          "category": "functional",
          "priority": 1
        },
        {
          "id": "REQ-002",
          "description": "A user can see a list of all created tasks.",
          "category": "functional",
          "priority": 1
        },
        {
          "id": "REQ-003",
          "description": "The application must load quickly.",
          "category": "non_functional",
          "priority": 2
        },
        {
          "id": "REQ-004",
          "description": "The application must be secure.",
          "category": "non_functional",
          "priority": 2
        }
      ],
      "functional_requirements": [
        "A user can create a new task with a text description.",
        "A user can see a list of all created tasks."
      ],
      "non_functional_requirements": [
        "The application must load quickly.",
        "The application must be secure."
      ],
      "stakeholders": [
        "Users"
      ],
      "success_criteria": [
        "Users can successfully add tasks.",
        "Users can successfully view their task list.",
        "The application loads quickly.",
        "The application is secure."
      ],
      "constraints": [],
      "assumptions": [],
      "risks": [],
      "domain_specific_details": {},
      "quality_assessment": {
        "clarity_score": 9.0,
        "completeness_score": 8.0,
        "consistency_score": 10.0,
        "recommendations": []
      },
      "gap_analysis": {
        "identified_gaps": [],
        "recommendations_for_completion": []
      }
    },
    "tech_stack_recommendation": {
      "frontend_options": [
        {
          "name": "React",
          "language": "JavaScript",
          "reasoning": "React is a popular and efficient JavaScript library for building user interfaces. It offers a component-based architecture, making it easy to manage and update the UI. Its virtual DOM and efficient update mechanisms contribute to fast loading times, addressing the non-functional requirement for speed.",
          "key_libraries": [
            "React Router (for navigation)",
            "Axios or Fetch (for API calls)",
            "Material UI or Bootstrap (for UI components)"
          ],
          "pros": [
            "Large community and extensive documentation",
            "Component-based architecture for reusability and maintainability",
            "Efficient updates via virtual DOM",
            "Wide range of available UI component libraries"
          ],
          "cons": [
            "Requires understanding of JavaScript and JSX",
            "Can have a steeper learning curve for beginners",
            "Requires additional libraries for routing and state management"
          ],
          "selected": false
        },
        {
          "name": "Vue.js",
          "language": "JavaScript",
          "reasoning": "Vue.js is a progressive framework that's easy to learn and integrate. It's known for its simplicity and clear documentation, making it suitable for this project's scope. It provides a reactive data binding system that simplifies UI updates and contributes to fast loading.",
          "key_libraries": [
            "Vue Router (for navigation)",
            "Axios or Fetch (for API calls)",
            "Vuetify or Element UI (for UI components)"
          ],
          "pros": [
            "Easy to learn and use",
            "Clear and concise documentation",
            "Reactive data binding for efficient UI updates",
            "Good performance and small bundle size"
          ],
          "cons": [
            "Smaller community compared to React",
            "Ecosystem might not be as extensive as React's"
          ],
          "selected": false
        },
        {
          "name": "HTML/CSS/JavaScript (Vanilla)",
          "language": "JavaScript",
          "reasoning": "For a simple task list application, using vanilla JavaScript, HTML, and CSS can be a viable option. It avoids the overhead of a framework, leading to potentially faster initial load times and a smaller bundle size. This approach is suitable given the project's simplicity.",
          "key_libraries": [],
          "pros": [
            "No external dependencies",
            "Fastest initial load times",
            "Complete control over the code",
            "Good for learning the fundamentals"
          ],
          "cons": [
            "More manual work for UI updates and DOM manipulation",
            "Can become complex for larger applications",
            "Requires more code to achieve the same functionality as frameworks"
          ],
          "selected": false
        }
      ],
      "backend_options": [
        {
          "name": "Node.js with Express",
          "language": "JavaScript",
          "reasoning": "Node.js with Express is a popular choice for building backend APIs. It's lightweight, efficient, and uses JavaScript, allowing for full-stack development with a single language. Express simplifies routing and middleware management, making it suitable for this project's needs.",
          "key_libraries": [
            "body-parser (for parsing request bodies)",
            "cors (for handling CORS)",
            "bcrypt (for password hashing)",
            "jsonwebtoken (for authentication)"
          ],
          "pros": [
            "JavaScript for both frontend and backend (full-stack)",
            "Large community and extensive documentation",
            "Fast development with Express framework",
            "Good performance with non-blocking I/O"
          ],
          "cons": [
            "Callback hell can be an issue (can be mitigated with async/await)",
            "Requires careful handling of asynchronous operations"
          ],
          "selected": false
        },
        {
          "name": "Python with Flask",
          "language": "Python",
          "reasoning": "Flask is a microframework that's easy to learn and use. Python's readability and Flask's simplicity make it a good choice for this project. It's a good option if the team is familiar with Python.",
          "key_libraries": [
            "Flask-SQLAlchemy (for database interaction)",
            "Flask-Cors (for handling CORS)",
            "bcrypt (for password hashing)",
            "PyJWT (for authentication)"
          ],
          "pros": [
            "Easy to learn and use",
            "Large community and extensive documentation",
            "Good for rapid prototyping",
            "Python's readability"
          ],
          "cons": [
            "Can be slower than Node.js for some tasks",
            "Requires understanding of Python"
          ],
          "selected": false
        },
        {
          "name": "Go with Gin",
          "language": "Go",
          "reasoning": "Go is known for its performance and efficiency. Gin is a lightweight web framework for Go that provides a fast and efficient way to build APIs. This is a good choice if performance is a key concern, and the team is comfortable with Go.",
          "key_libraries": [
            "gorm (for database interaction)",
            "go-cors (for handling CORS)",
            "bcrypt (for password hashing)",
            "jwt-go (for authentication)"
          ],
          "pros": [
            "High performance and efficiency",
            "Fast compilation and execution",
            "Good for concurrent applications",
            "Strongly typed language"
          ],
          "cons": [
            "Steeper learning curve than Node.js or Python",
            "Smaller community compared to Node.js or Python"
          ],
          "selected": false
        }
      ],
      "database_options": [
        {
          "name": "PostgreSQL",
          "language": null,
          "reasoning": "PostgreSQL is a robust, open-source relational database. It offers strong data integrity, security features, and is well-suited for storing structured data like task lists. Its reliability and scalability make it a good choice for this project.",
          "key_libraries": [],
          "pros": [],
          "cons": [],
          "selected": false
        },
        {
          "name": "MongoDB",
          "language": null,
          "reasoning": "MongoDB is a NoSQL database that's easy to set up and use. It's a good choice for this project because it's schema-less, which simplifies data modeling for a simple task list. It offers good performance and scalability.",
          "key_libraries": [],
          "pros": [],
          "cons": [],
          "selected": false
        },
        {
          "name": "SQLite",
          "language": null,
          "reasoning": "SQLite is a lightweight, file-based database. It's easy to set up and requires no separate server process. It's a good choice for small projects and prototyping, as it simplifies deployment and reduces overhead.",
          "key_libraries": [],
          "pros": [],
          "cons": [],
          "selected": false
        }
      ],
      "cloud_options": [
        {
          "name": "AWS (Amazon Web Services)",
          "language": null,
          "reasoning": "AWS offers a wide range of services, including compute (EC2, Lambda), storage (S3), and databases (RDS, DynamoDB). It provides scalability, security, and a comprehensive ecosystem for deploying and managing web applications. It's a good choice for its flexibility and features.",
          "key_libraries": [],
          "pros": [],
          "cons": [],
          "selected": false
        },
        {
          "name": "Google Cloud Platform (GCP)",
          "language": null,
          "reasoning": "GCP provides similar services to AWS, including compute (Compute Engine, Cloud Functions), storage (Cloud Storage), and databases (Cloud SQL, Cloud Datastore). It's known for its competitive pricing and strong support for containerization and serverless technologies.",
          "key_libraries": [],
          "pros": [],
          "cons": [],
          "selected": false
        },
        {
          "name": "Heroku",
          "language": null,
          "reasoning": "Heroku is a Platform-as-a-Service (PaaS) that simplifies deployment and management. It supports various languages and frameworks and provides a streamlined experience for deploying web applications. It's a good choice for its ease of use and quick deployment.",
          "key_libraries": [],
          "pros": [],
          "cons": [],
          "selected": false
        }
      ],
      "architecture_options": [
        {
          "pattern": "Monolithic Architecture",
          "scalability_score": 5.0,
          "maintainability_score": 6.0,
          "development_speed_score": 8.0,
          "overall_score": 7.0,
          "reasoning": "For a simple task list application, a monolithic architecture is suitable. All components (frontend, backend, database) are deployed as a single unit. This simplifies development, deployment, and management. While it may not scale as well as microservices, it's sufficient for this project's scope."
        },
        {
          "pattern": "Microservices Architecture",
          "scalability_score": 8.0,
          "maintainability_score": 7.0,
          "development_speed_score": 5.0,
          "overall_score": 6.0,
          "reasoning": "While microservices offer better scalability and maintainability, they introduce complexity that is unnecessary for this small project. The overhead of managing multiple services and their communication outweighs the benefits."
        },
        {
          "pattern": "Serverless Architecture",
          "scalability_score": 9.0,
          "maintainability_score": 7.0,
          "development_speed_score": 6.0,
          "overall_score": 7.0,
          "reasoning": "Serverless architecture can be considered, especially if using a cloud provider like AWS or GCP. This approach can improve scalability and reduce operational overhead. However, it might introduce complexity in terms of debugging and monitoring, which could be a trade-off for a simple application."
        }
      ],
      "tool_options": [
        {
          "name": "Git",
          "language": null,
          "reasoning": "Version control for code management and collaboration.",
          "key_libraries": [],
          "pros": [],
          "cons": [],
          "selected": false
        },
        {
          "name": "npm/yarn/pnpm",
          "language": null,
          "reasoning": "Package manager for JavaScript dependencies.",
          "key_libraries": [],
          "pros": [],
          "cons": [],
          "selected": false
        },
        {
          "name": "Docker",
          "language": null,
          "reasoning": "Containerization for consistent development and deployment environments.",
          "key_libraries": [],
          "pros": [],
          "cons": [],
          "selected": false
        },
        {
          "name": "CI/CD Pipeline (e.g., GitHub Actions, GitLab CI)",
          "language": null,
          "reasoning": "Automated build, test, and deployment processes.",
          "key_libraries": [],
          "pros": [],
          "cons": [],
          "selected": false
        },
        {
          "name": "Postman/Insomnia",
          "language": null,
          "reasoning": "API testing and debugging.",
          "key_libraries": [],
          "pros": [],
          "cons": [],
          "selected": false
        },
        {
          "name": "VS Code/IntelliJ IDEA",
          "language": null,
          "reasoning": "Integrated development environment (IDE) for coding and debugging.",
          "key_libraries": [],
          "pros": [],
          "cons": [],
          "selected": false
        }
      ],
      "risks": [
        {
          "category": "Security",
          "description": "Vulnerabilities in dependencies or custom code could lead to security breaches.",
          "severity": "Medium",
          "likelihood": "Medium",
          "mitigation": "Regularly update dependencies, implement secure coding practices, and conduct security audits."
        },
        {
          "category": "Performance",
          "description": "Inefficient code or database queries could lead to slow loading times.",
          "severity": "Medium",
          "likelihood": "Medium",
          "mitigation": "Optimize code, use database indexing, and implement caching strategies."
        },
        {
          "category": "Scalability",
          "description": "The application may not scale well if the user base grows significantly.",
          "severity": "Low",
          "likelihood": "Low",
          "mitigation": "Design the application with scalability in mind, and consider using cloud services that can scale automatically."
        }
      ],
      "synthesis": {
        "backend": {
          "name": "Node.js with Express",
          "language": "JavaScript",
          "reasoning": "Node.js with Express provides a fast and efficient backend development experience. Using JavaScript for both frontend and backend simplifies development and allows for full-stack development with a single language. Express simplifies routing and middleware management."
        },
        "frontend": {
          "name": "React",
          "language": "JavaScript",
          "reasoning": "React offers a good balance of ease of use, performance, and a large community. It allows for building a modern and responsive user interface, which is important for a good user experience. The component-based architecture promotes code reusability and maintainability."
        },
        "database": {
          "name": "PostgreSQL",
          "reasoning": "PostgreSQL is a robust and reliable relational database. It provides strong data integrity and security features, which are important for storing and managing user data. It's also scalable and well-suited for this project's needs."
        },
        "architecture_pattern": "Monolithic Architecture",
        "deployment_environment": {
          "cloud": "AWS (Amazon Web Services)",
          "reasoning": "AWS provides a comprehensive set of services for deploying and managing web applications, including compute, storage, and databases. It offers scalability, security, and a wide range of features that are suitable for this project."
        },
        "key_libraries_tools": [
          {
            "name": "Git",
            "purpose": "Version control for code management and collaboration."
          },
          {
            "name": "npm",
            "purpose": "Package manager for JavaScript dependencies."
          },
          {
            "name": "Docker",
            "purpose": "Containerization for consistent development and deployment environments."
          },
          {
            "name": "CI/CD Pipeline (e.g., GitHub Actions)",
            "purpose": "Automated build, test, and deployment processes."
          }
        ],
        "estimated_complexity": "Low"
      },
      "selected_stack": null
    },
    "system_design": {
      "architecture": {
        "pattern": "Monolithic Architecture",
        "justification": "For a simple task list application, a monolithic architecture is suitable. All components (frontend, backend, database) are deployed as a single unit. This simplifies development, deployment, and management. While it may not scale as well as microservices, it's sufficient for this project's scope.",
        "key_benefits": [
          "Simplified development and deployment",
          "Easier to manage and maintain for a small project",
          "Faster development cycles"
        ],
        "potential_drawbacks": [
          "Limited scalability compared to microservices",
          "Can become difficult to manage as the application grows"
        ]
      },
      "components": [
        {
          "name": "Frontend",
          "description": "The user interface for the task list application.",
          "category": "frontend",
          "technologies": [
            "React",
            "JavaScript",
            "HTML",
            "CSS"
          ],
          "dependencies": [
            "Backend API"
          ],
          "responsibilities": [
            "Displaying the task list",
            "Allowing users to add new tasks",
            "Handling user interactions",
            "Making API calls to the backend"
          ],
          "design_patterns": [
            "Component-based architecture"
          ]
        },
        {
          "name": "Backend API",
          "description": "The RESTful API that handles requests from the frontend and interacts with the database.",
          "category": "backend",
          "technologies": [
            "Node.js",
            "Express",
            "JavaScript"
          ],
          "dependencies": [
            "PostgreSQL database"
          ],
          "responsibilities": [
            "Handling API requests",
            "Validating user input",
            "Interacting with the database",
            "Returning data to the frontend"
          ],
          "design_patterns": [
            "RESTful API design"
          ]
        },
        {
          "name": "Database",
          "description": "Stores the task data.",
          "category": "database",
          "technologies": [
            "PostgreSQL"
          ],
          "dependencies": [],
          "responsibilities": [
            "Storing task data",
            "Providing data access to the backend API"
          ],
          "design_patterns": []
        },
        {
          "name": "Deployment Infrastructure",
          "description": "Infrastructure for deploying and running the application.",
          "category": "infrastructure",
          "technologies": [
            "AWS (EC2, RDS, S3)",
            "Docker"
          ],
          "dependencies": [
            "Frontend",
            "Backend API",
            "Database"
          ],
          "responsibilities": [
            "Hosting the frontend application",
            "Running the backend API",
            "Managing the database",
            "Providing scalability and security"
          ],
          "design_patterns": []
        }
      ],
      "data_model": {
        "schema_type": "Relational",
        "tables": [
          {
            "name": "tasks",
            "purpose": "Stores task information.",
            "fields": [
              {
                "name": "id",
                "type": "SERIAL",
                "constraints": [
                  "PRIMARY KEY"
                ],
                "description": "Unique identifier for the task."
              },
              {
                "name": "description",
                "type": "TEXT",
                "constraints": [
                  "NOT NULL"
                ],
                "description": "The text description of the task."
              },
              {
                "name": "created_at",
                "type": "TIMESTAMP",
                "constraints": [
                  "NOT NULL",
                  "DEFAULT CURRENT_TIMESTAMP"
                ],
                "description": "The timestamp when the task was created."
              }
            ],
            "relationships": []
          }
        ],
        "relationships": [],
        "justification": "Relational database provides strong data integrity and is well-suited for storing structured data like task lists."
      },
      "api_endpoints": {
        "style": "REST",
        "base_url": "/api/v1",
        "authentication": "None",
        "endpoints": [
          {
            "method": "POST",
            "path": "/tasks",
            "purpose": "Create a new task.",
            "parameters": [
              {
                "description": "The task description.",
                "type": "string",
                "name": "description"
              }
            ],
            "response": {
              "201": {
                "description": "Task created successfully.",
                "example": {
                  "id": 1,
                  "description": "Grocery shopping",
                  "created_at": "2024-01-01T12:00:00.000Z"
                }
              },
              "400": {
                "description": "Bad Request - Invalid input."
              }
            },
            "authentication_required": false,
            "rate_limiting_applied": false
          },
          {
            "method": "GET",
            "path": "/tasks",
            "purpose": "Get all tasks.",
            "parameters": [],
            "response": {
              "200": {
                "description": "List of tasks.",
                "example": [
                  {
                    "id": 1,
                    "description": "Grocery shopping",
                    "created_at": "2024-01-01T12:00:00.000Z"
                  },
                  {
                    "id": 2,
                    "description": "Pay bills",
                    "created_at": "2024-01-01T13:00:00.000Z"
                  }
                ]
              }
            },
            "authentication_required": false,
            "rate_limiting_applied": false
          }
        ],
        "error_handling": "Standard HTTP status codes and informative error messages in JSON format.",
        "rate_limiting_strategy": null
      },
      "security": {
        "authentication_method": "None",
        "authorization_strategy": "None",
        "data_encryption": {
          "in_transit": "TLS/SSL",
          "at_rest": "Not applicable for this simple application"
        },
        "security_measures": [
          {
            "category": "Input Validation",
            "implementation": "Validate all user inputs on the backend to prevent injection attacks.",
            "mitigation": "SQL Injection, Cross-Site Scripting (XSS)",
            "priority": "High"
          },
          {
            "category": "Dependency Management",
            "implementation": "Regularly update dependencies to patch security vulnerabilities.",
            "mitigation": "Vulnerabilities in third-party libraries",
            "priority": "High"
          },
          {
            "category": "HTTPS",
            "implementation": "Enforce HTTPS for all communication between the frontend and backend.",
            "mitigation": "Man-in-the-middle attacks",
            "priority": "High"
          }
        ],
        "vulnerability_mitigation_strategies": [
          "Input validation",
          "Regular dependency updates",
          "Use of HTTPS",
          "Secure coding practices"
        ],
        "compliance_standards": []
      },
      "scalability_and_performance": {
        "caching": "Implement client-side caching for static assets (HTML, CSS, JavaScript).",
        "database_indexing": "Use database indexing on the 'created_at' field for faster query performance.",
        "code_optimization": "Optimize code for efficient execution and minimal resource usage.",
        "cdn": "Consider using a CDN for serving static assets if the application grows."
      },
      "deployment_strategy": {
        "environment": "AWS (EC2, RDS, S3)",
        "frontend_deployment": "Deploy the React frontend to an S3 bucket and serve it via CloudFront for fast content delivery.",
        "backend_deployment": "Deploy the Node.js backend API to an EC2 instance, using Docker for containerization.",
        "database_deployment": "Deploy the PostgreSQL database to an RDS instance.",
        "ci_cd": "Implement a CI/CD pipeline using GitHub Actions to automate builds, tests, and deployments."
      },
      "monitoring_and_logging": {
        "logging": "Implement logging in the backend API to track errors, warnings, and informational messages. Use a logging library like Winston or Morgan.",
        "monitoring": "Monitor the application's performance and health using AWS CloudWatch. Monitor CPU usage, memory usage, and database performance.",
        "error_tracking": "Integrate an error tracking service like Sentry to capture and analyze errors."
      },
      "error_handling_strategy": "Use standard HTTP status codes to indicate the outcome of API requests. Return informative error messages in JSON format to the frontend. Implement centralized error handling in the backend to catch and log errors.",
      "development_phases_overview": [
        {
          "name": "Phase 1: Setup and Frontend Development",
          "description": "Set up the development environment, create the React frontend, and implement the UI for adding and viewing tasks.",
          "priority": "High",
          "dependencies": [],
          "tasks": [
            "Set up React project",
            "Design and implement the UI",
            "Implement the task input form",
            "Display the task list"
          ],
          "estimated_duration": "1 week"
        },
        {
          "name": "Phase 2: Backend API Development",
          "description": "Develop the Node.js backend API, including the API endpoints for creating and retrieving tasks, and database integration.",
          "priority": "High",
          "dependencies": [
            "Phase 1: Setup and Frontend Development"
          ],
          "tasks": [
            "Set up Node.js and Express project",
            "Implement API endpoints",
            "Connect to the PostgreSQL database",
            "Implement data validation"
          ],
          "estimated_duration": "1 week"
        },
        {
          "name": "Phase 3: Integration and Testing",
          "description": "Integrate the frontend and backend, and perform thorough testing to ensure the application functions correctly.",
          "priority": "High",
          "dependencies": [
            "Phase 1: Setup and Frontend Development",
            "Phase 2: Backend API Development"
          ],
          "tasks": [
            "Connect the frontend to the backend API",
            "Implement error handling",
            "Perform unit tests",
            "Perform integration tests"
          ],
          "estimated_duration": "1 week"
        },
        {
          "name": "Phase 4: Deployment and Monitoring",
          "description": "Deploy the application to AWS, set up monitoring and logging, and ensure the application is running smoothly.",
          "priority": "High",
          "dependencies": [
            "Phase 3: Integration and Testing"
          ],
          "tasks": [
            "Set up AWS infrastructure",
            "Deploy the frontend to S3 and CloudFront",
            "Deploy the backend to EC2",
            "Deploy the database to RDS",
            "Set up monitoring and logging"
          ],
          "estimated_duration": "1 week"
        }
      ],
      "key_risks": [
        "Security vulnerabilities in dependencies or custom code.",
        "Performance issues due to inefficient code or database queries.",
        "Scalability limitations if the user base grows significantly."
      ],
      "design_justification": "The design prioritizes simplicity, ease of development, and maintainability. The monolithic architecture is suitable for the project's scope. The chosen technologies (React, Node.js, PostgreSQL, AWS) are well-established and provide a good balance of features, performance, and community support. The design incorporates security best practices and addresses potential performance and scalability concerns.",
      "data_flow": "1. User interacts with the React frontend, adding a task. 2. Frontend sends a POST request to the Node.js backend API's /tasks endpoint with the task description. 3. Backend API validates the input. 4. Backend API interacts with the PostgreSQL database to store the task. 5. Database stores the task. 6. Backend API returns a 201 Created response with the task details. 7. Frontend receives the response and updates the task list. 8. User views the task list. 9. Frontend sends a GET request to the backend API's /tasks endpoint. 10. Backend API retrieves tasks from the PostgreSQL database. 11. Backend API returns a 200 OK response with the list of tasks. 12. Frontend displays the task list."
    },
    "implementation_plan": "plan=ImplementationPlan(project_summary={'title': 'Generated Project Plan', 'description': 'Develop a simple web application to manage a list of tasks, allowing users to add and view tasks. The application will use React for the frontend, Node.js with Express for the backend, and PostgreSQL for the database. It will be deployed on AWS using EC2, RDS, S3, and CloudFront, with a CI/CD pipeline for automated deployments.', 'overall_complexity': 'Medium', 'estimated_duration': 'TBD', 'key_challenges': [], 'success_criteria': []}, phases=[{'name': 'Frontend Phase', 'description': 'Tasks related to frontend phase', 'deliverables': ['Completed FE-001', 'Completed FE-002', 'Completed FE-003', 'Completed FE-004', 'Completed FE-005', 'Completed FE-006', 'Completed PT-002'], 'estimated_duration_hours': 40.0, 'work_items': [{'id': 'FE-001', 'description': 'Set up React project using Create React App.', 'dependencies': [], 'estimated_time': '4 hours', 'agent_role': 'frontend_developer', 'acceptance_criteria': ['Project is initialized successfully.', 'Default React app runs without errors.'], 'status': 'pending', 'code_files': ['package.json', 'src/App.js', 'src/index.js']}, {'id': 'FE-002', 'description': 'Design the UI for adding a task (input field and button).', 'dependencies': ['FE-001'], 'estimated_time': '4 hours', 'agent_role': 'frontend_developer', 'acceptance_criteria': ['UI elements for task input are present.', 'Button is visually clear.'], 'status': 'pending', 'code_files': ['src/App.js', 'src/App.css']}, {'id': 'FE-003', 'description': 'Implement the task input form (handle input changes).', 'dependencies': ['FE-002'], 'estimated_time': '4 hours', 'agent_role': 'frontend_developer', 'acceptance_criteria': ['Input field captures user input.', 'State updates correctly on input change.'], 'status': 'pending', 'code_files': ['src/App.js']}, {'id': 'FE-004', 'description': \"Implement the 'Add Task' button functionality (call API).\", 'dependencies': ['FE-003', 'BE-002'], 'estimated_time': '8 hours', 'agent_role': 'frontend_developer', 'acceptance_criteria': ['Button click triggers API call.', 'API call sends task description.', 'Error handling for API call implemented.'], 'status': 'pending', 'code_files': ['src/App.js']}, {'id': 'FE-005', 'description': 'Design the UI for displaying the task list.', 'dependencies': ['FE-001'], 'estimated_time': '4 hours', 'agent_role': 'frontend_developer', 'acceptance_criteria': ['Task list container is present.', 'Each task is displayed in a clear format.'], 'status': 'pending', 'code_files': ['src/App.js', 'src/App.css']}, {'id': 'FE-006', 'description': 'Fetch tasks from the backend API and display them.', 'dependencies': ['FE-005', 'BE-003'], 'estimated_time': '8 hours', 'agent_role': 'frontend_developer', 'acceptance_criteria': ['API call to fetch tasks is made on component mount.', 'Tasks are displayed in the task list.', 'Error handling for API call implemented.'], 'status': 'pending', 'code_files': ['src/App.js']}, {'id': 'PT-002', 'description': 'Write integration tests for the frontend and backend.', 'dependencies': ['FE-006', 'BE-003'], 'estimated_time': '8 hours', 'agent_role': 'frontend_developer', 'acceptance_criteria': ['Tests verify the interaction between frontend and backend.', 'Tests cover adding and retrieving tasks.', 'Tests pass.'], 'status': 'pending', 'code_files': ['tests/integration.test.js']}]}, {'name': 'Backend Phase', 'description': 'Tasks related to backend phase', 'deliverables': ['Completed BE-001', 'Completed BE-002', 'Completed BE-003', 'Completed SC-001', 'Completed PT-001', 'Completed MN-001'], 'estimated_duration_hours': 36.0, 'work_items': [{'id': 'BE-001', 'description': 'Set up Node.js and Express project.', 'dependencies': [], 'estimated_time': '4 hours', 'agent_role': 'backend_developer', 'acceptance_criteria': ['Project is initialized successfully.', 'Express server runs without errors.'], 'status': 'pending', 'code_files': ['package.json', 'index.js']}, {'id': 'BE-002', 'description': 'Implement the /tasks POST endpoint (create task).', 'dependencies': ['BE-001', 'DB-001'], 'estimated_time': '8 hours', 'agent_role': 'backend_developer', 'acceptance_criteria': ['Endpoint accepts POST requests to /tasks.', 'Endpoint validates input.', 'Endpoint saves task to the database.', 'Endpoint returns 201 status on success.', 'Endpoint returns 400 status on validation error.'], 'status': 'pending', 'code_files': ['index.js']}, {'id': 'BE-003', 'description': 'Implement the /tasks GET endpoint (get all tasks).', 'dependencies': ['BE-001', 'DB-001'], 'estimated_time': '8 hours', 'agent_role': 'backend_developer', 'acceptance_criteria': ['Endpoint accepts GET requests to /tasks.', 'Endpoint retrieves all tasks from the database.', 'Endpoint returns 200 status on success.', 'Endpoint returns tasks in JSON format.'], 'status': 'pending', 'code_files': ['index.js']}, {'id': 'SC-001', 'description': 'Implement input validation on the backend.', 'dependencies': ['BE-002'], 'estimated_time': '4 hours', 'agent_role': 'backend_developer', 'acceptance_criteria': ['Input validation for task description implemented.', 'Invalid input results in 400 Bad Request.'], 'status': 'pending', 'code_files': ['index.js']}, {'id': 'PT-001', 'description': 'Write unit tests for the backend API endpoints.', 'dependencies': ['BE-002', 'BE-003'], 'estimated_time': '8 hours', 'agent_role': 'backend_developer', 'acceptance_criteria': ['Unit tests cover the /tasks POST endpoint.', 'Unit tests cover the /tasks GET endpoint.', 'Tests pass.'], 'status': 'pending', 'code_files': ['tests/api.test.js']}, {'id': 'MN-001', 'description': 'Implement logging in the backend API.', 'dependencies': ['BE-003'], 'estimated_time': '4 hours', 'agent_role': 'backend_developer', 'acceptance_criteria': ['Logging library (e.g., Winston) is integrated.', 'API requests and errors are logged.'], 'status': 'pending', 'code_files': ['index.js']}]}, {'name': 'Database Phase', 'description': 'Tasks related to database phase', 'deliverables': ['Completed DB-001', 'Completed DB-002'], 'estimated_duration_hours': 16.0, 'work_items': [{'id': 'DB-001', 'description': \"Set up PostgreSQL database and create 'tasks' table.\", 'dependencies': [], 'estimated_time': '8 hours', 'agent_role': 'database_specialist', 'acceptance_criteria': ['PostgreSQL database is running.', \"'tasks' table exists with 'id', 'description', and 'created_at' columns.\", 'Database connection details are configured.'], 'status': 'pending', 'code_files': ['db_setup.sql']}, {'id': 'DB-002', 'description': 'Implement database queries for creating and retrieving tasks.', 'dependencies': ['DB-001'], 'estimated_time': '8 hours', 'agent_role': 'database_specialist', 'acceptance_criteria': ['Queries for inserting and selecting tasks are implemented.', 'Queries are parameterized to prevent SQL injection.'], 'status': 'pending', 'code_files': ['db_queries.js']}]}, {'name': 'Devops_Engineer Phase', 'description': 'Tasks related to devops_engineer phase', 'deliverables': ['Completed CI-001', 'Completed DE-001', 'Completed DE-002', 'Completed DE-003', 'Completed SC-002', 'Completed MN-002'], 'estimated_duration_hours': 32.0, 'work_items': [{'id': 'CI-001', 'description': 'Set up a CI/CD pipeline using GitHub Actions.', 'dependencies': ['FE-006', 'BE-003'], 'estimated_time': '8 hours', 'agent_role': 'devops_engineer', 'acceptance_criteria': ['Pipeline builds the frontend.', 'Pipeline builds the backend.', 'Pipeline runs unit tests.', 'Pipeline deploys to AWS (S3 and EC2).'], 'status': 'pending', 'code_files': ['.github/workflows/deploy.yml']}, {'id': 'DE-001', 'description': 'Deploy frontend to S3 and configure CloudFront.', 'dependencies': ['FE-006'], 'estimated_time': '4 hours', 'agent_role': 'devops_engineer', 'acceptance_criteria': ['Frontend is deployed to S3.', 'CloudFront distribution is created.', 'Application is accessible via CloudFront URL.'], 'status': 'pending', 'code_files': []}, {'id': 'DE-002', 'description': 'Deploy backend to EC2.', 'dependencies': ['BE-003', 'DB-002'], 'estimated_time': '8 hours', 'agent_role': 'devops_engineer', 'acceptance_criteria': ['Backend is deployed to EC2 instance.', 'Backend is running and accessible.', 'Database connection is configured.'], 'status': 'pending', 'code_files': []}, {'id': 'DE-003', 'description': 'Deploy PostgreSQL to RDS.', 'dependencies': ['DB-002'], 'estimated_time': '4 hours', 'agent_role': 'devops_engineer', 'acceptance_criteria': ['PostgreSQL database is deployed to RDS.', 'Database is accessible from EC2 instance.'], 'status': 'pending', 'code_files': []}, {'id': 'SC-002', 'description': 'Implement HTTPS for communication.', 'dependencies': ['DE-002'], 'estimated_time': '4 hours', 'agent_role': 'devops_engineer', 'acceptance_criteria': ['HTTPS is enabled for the EC2 instance.', 'Frontend communicates with the backend over HTTPS.'], 'status': 'pending', 'code_files': []}, {'id': 'MN-002', 'description': 'Set up monitoring with AWS CloudWatch.', 'dependencies': ['DE-002'], 'estimated_time': '4 hours', 'agent_role': 'devops_engineer', 'acceptance_criteria': ['CloudWatch is configured for the EC2 instance.', 'CPU and memory usage are monitored.'], 'status': 'pending', 'code_files': []}]}], resource_allocation=[{'role': 'Frontend Developer', 'count': 1, 'estimated_time_allocation': '100%', 'phases': ['Frontend Phase'], 'skills_required': []}, {'role': 'Database Specialist', 'count': 1, 'estimated_time_allocation': '100%', 'phases': ['Database Phase'], 'skills_required': []}, {'role': 'Backend Developer', 'count': 1, 'estimated_time_allocation': '100%', 'phases': ['Backend Phase'], 'skills_required': []}, {'role': 'Devops Engineer', 'count': 1, 'estimated_time_allocation': '100%', 'phases': ['Devops_Engineer Phase'], 'skills_required': []}], risks_and_mitigations=[], timeline={'start_date': '2025-07-09T09:18:00.734028', 'end_date': 'TBD', 'milestones': []}, tech_stack={}, metadata={'generated_at': '2025-07-09T09:18:00.734028', 'version': '1.0', 'author': 'Multi-AI Dev System', 'tags': [], 'notes': 'Converted from WorkItemBacklog. Original summary: Develop a simple web application to manage a list of tasks, allowing users to add and view tasks. The application will use React for the frontend, Node.js with Express for the backend, and PostgreSQL for the database. It will be deployed on AWS using EC2, RDS, S3, and CloudFront, with a CI/CD pipeline for automated deployments.'}) summary='Develop a simple web application to manage a list of tasks, allowing users to add and view tasks. The application will use React for the frontend, Node.js with Express for the backend, and PostgreSQL for the database. It will be deployed on AWS using EC2, RDS, S3, and CloudFront, with a CI/CD pipeline for automated deployments.' metadata=PlanMetadata(generated_at='2025-07-09T09:18:00.734028', version='1.0', author='Multi-AI Dev System', tags=[], notes='Converted from WorkItemBacklog. Original summary: Develop a simple web application to manage a list of tasks, allowing users to add and view tasks. The application will use React for the frontend, Node.js with Express for the backend, and PostgreSQL for the database. It will be deployed on AWS using EC2, RDS, S3, and CloudFront, with a CI/CD pipeline for automated deployments.')"
  }
}