{
  "session_id": "session_0773b2db-5cc2-485e-af05-e37abea2c2b1",
  "approval_type": "implementation_plan",
  "timestamp": 1751964726,
  "approval_data": {
    "type": "implementation_plan",
    "timestamp": 1751964726.8728735,
    "project_overview": "Develop a simple web application for managing a list of tasks, including adding and viewing tasks. The application will use React for the frontend, Node.js/Express for the backend, and PostgreSQL for the database. The application will be deployed to Heroku.",
    "development_phases": [
      {
        "name": "Frontend Phase",
        "description": "Tasks related to frontend phase",
        "deliverables": [
          "Completed FE-001",
          "Completed FE-002",
          "Completed FE-003",
          "Completed FE-004",
          "Completed FE-005",
          "Completed FE-006",
          "Completed FE-007",
          "Completed FE-008",
          "Completed FE-009",
          "Completed TEST-001",
          "Completed DEPLOY-003"
        ],
        "estimated_duration_hours": 50.0,
        "work_items": [
          {
            "id": "FE-001",
            "description": "Set up React project with Create React App.",
            "dependencies": [],
            "estimated_time": "2 hours",
            "agent_role": "frontend_developer",
            "acceptance_criteria": [
              "Project is initialized using Create React App.",
              "Project builds without errors.",
              "Default 'Hello World' page is displayed."
            ],
            "status": "pending",
            "code_files": [
              "package.json",
              "src/App.js",
              "src/index.js",
              "public/index.html"
            ]
          },
          {
            "id": "FE-002",
            "description": "Create a basic task input form (text field and add button).",
            "dependencies": [
              "FE-001"
            ],
            "estimated_time": "4 hours",
            "agent_role": "frontend_developer",
            "acceptance_criteria": [
              "Form with a text input field exists.",
              "Add button exists.",
              "Input field accepts text input."
            ],
            "status": "pending",
            "code_files": [
              "src/App.js"
            ]
          },
          {
            "id": "FE-003",
            "description": "Create a component to display the task list.",
            "dependencies": [
              "FE-001"
            ],
            "estimated_time": "4 hours",
            "agent_role": "frontend_developer",
            "acceptance_criteria": [
              "Task list component renders.",
              "Component accepts an array of tasks as props.",
              "Each task is displayed in a list item."
            ],
            "status": "pending",
            "code_files": [
              "src/App.js",
              "src/TaskList.js"
            ]
          },
          {
            "id": "FE-004",
            "description": "Implement state management for tasks (using useState).",
            "dependencies": [
              "FE-002",
              "FE-003"
            ],
            "estimated_time": "4 hours",
            "agent_role": "frontend_developer",
            "acceptance_criteria": [
              "Tasks are stored in component state.",
              "Tasks are updated when a new task is added.",
              "Task list component re-renders when tasks change."
            ],
            "status": "pending",
            "code_files": [
              "src/App.js"
            ]
          },
          {
            "id": "FE-005",
            "description": "Implement the 'add task' functionality (on button click).",
            "dependencies": [
              "FE-002",
              "FE-004"
            ],
            "estimated_time": "4 hours",
            "agent_role": "frontend_developer",
            "acceptance_criteria": [
              "When the add button is clicked, a new task is added to the task list.",
              "The new task's description is taken from the input field.",
              "The input field is cleared after adding a task."
            ],
            "status": "pending",
            "code_files": [
              "src/App.js"
            ]
          },
          {
            "id": "FE-006",
            "description": "Implement API calls to the backend (POST /tasks).",
            "dependencies": [
              "FE-005",
              "BE-004"
            ],
            "estimated_time": "6 hours",
            "agent_role": "frontend_developer",
            "acceptance_criteria": [
              "Frontend makes a POST request to /api/v1/tasks when the add button is clicked.",
              "Request body includes the task description.",
              "Frontend handles the 201 Created response (adds the new task to the list).",
              "Frontend handles 400 Bad Request responses (displays error messages)."
            ],
            "status": "pending",
            "code_files": [
              "src/App.js"
            ]
          },
          {
            "id": "FE-007",
            "description": "Implement API calls to the backend (GET /tasks).",
            "dependencies": [
              "FE-003",
              "BE-005"
            ],
            "estimated_time": "6 hours",
            "agent_role": "frontend_developer",
            "acceptance_criteria": [
              "Frontend makes a GET request to /api/v1/tasks when the component mounts.",
              "Frontend displays the tasks retrieved from the API.",
              "Frontend handles errors gracefully."
            ],
            "status": "pending",
            "code_files": [
              "src/App.js"
            ]
          },
          {
            "id": "FE-008",
            "description": "Add basic styling to the task list and form.",
            "dependencies": [
              "FE-002",
              "FE-003",
              "FE-007"
            ],
            "estimated_time": "4 hours",
            "agent_role": "frontend_developer",
            "acceptance_criteria": [
              "Task list is styled to be readable.",
              "Form is styled to be visually appealing.",
              "Styling is consistent across the application."
            ],
            "status": "pending",
            "code_files": [
              "src/App.css",
              "src/TaskList.css"
            ]
          },
          {
            "id": "FE-009",
            "description": "Implement error handling on the frontend.",
            "dependencies": [
              "FE-006",
              "FE-007"
            ],
            "estimated_time": "4 hours",
            "agent_role": "frontend_developer",
            "acceptance_criteria": [
              "Frontend displays error messages from the backend.",
              "Frontend handles network errors gracefully.",
              "Error messages are user-friendly."
            ],
            "status": "pending",
            "code_files": [
              "src/App.js"
            ]
          },
          {
            "id": "TEST-001",
            "description": "Write unit tests for the frontend components.",
            "dependencies": [
              "FE-003",
              "FE-004",
              "FE-005",
              "FE-006",
              "FE-007"
            ],
            "estimated_time": "8 hours",
            "agent_role": "frontend_developer",
            "acceptance_criteria": [
              "Unit tests cover the TaskList component.",
              "Unit tests cover the App component's state management.",
              "Unit tests cover the API call implementations.",
              "Tests use a testing framework (e.g., Jest).",
              "Tests pass."
            ],
            "status": "pending",
            "code_files": [
              "src/App.test.js",
              "src/TaskList.test.js"
            ]
          },
          {
            "id": "DEPLOY-003",
            "description": "Deploy the frontend to Heroku.",
            "dependencies": [
              "FE-001",
              "FE-006",
              "FE-007",
              "DEPLOY-001",
              "DEPLOY-002"
            ],
            "estimated_time": "4 hours",
            "agent_role": "frontend_developer",
            "acceptance_criteria": [
              "Frontend code is deployed to Heroku.",
              "Frontend is configured to call the backend API on Heroku.",
              "Frontend is accessible via a Heroku URL."
            ],
            "status": "pending",
            "code_files": [
              "package.json"
            ]
          }
        ]
      },
      {
        "name": "Backend Phase",
        "description": "Tasks related to backend phase",
        "deliverables": [
          "Completed BE-001",
          "Completed BE-002",
          "Completed BE-004",
          "Completed BE-005",
          "Completed BE-006",
          "Completed BE-007",
          "Completed TEST-002",
          "Completed DEPLOY-001",
          "Completed DEPLOY-002",
          "Completed DEPLOY-004"
        ],
        "estimated_duration_hours": 46.0,
        "work_items": [
          {
            "id": "BE-001",
            "description": "Set up Node.js/Express project.",
            "dependencies": [],
            "estimated_time": "2 hours",
            "agent_role": "backend_developer",
            "acceptance_criteria": [
              "Project is initialized with npm.",
              "Express is installed as a dependency.",
              "Basic server setup with a route that responds with 'Hello World'."
            ],
            "status": "pending",
            "code_files": [
              "package.json",
              "index.js"
            ]
          },
          {
            "id": "BE-002",
            "description": "Install and configure PostgreSQL and a client library (pg).",
            "dependencies": [
              "BE-001"
            ],
            "estimated_time": "4 hours",
            "agent_role": "backend_developer",
            "acceptance_criteria": [
              "PostgreSQL is installed and running (locally or remotely).",
              "pg library is installed.",
              "Connection to the database is established successfully."
            ],
            "status": "pending",
            "code_files": [
              "package.json",
              "index.js"
            ]
          },
          {
            "id": "BE-004",
            "description": "Implement the POST /tasks endpoint (create a task).",
            "dependencies": [
              "BE-001",
              "BE-002",
              "BE-003"
            ],
            "estimated_time": "8 hours",
            "agent_role": "backend_developer",
            "acceptance_criteria": [
              "Endpoint handles POST requests to /tasks.",
              "Endpoint receives a 'description' in the request body.",
              "Endpoint validates the 'description' (required).",
              "Endpoint inserts the task into the database.",
              "Endpoint returns a 201 Created status with the created task (including id and created_at).",
              "Endpoint returns a 400 Bad Request if the description is missing."
            ],
            "status": "pending",
            "code_files": [
              "index.js"
            ]
          },
          {
            "id": "BE-005",
            "description": "Implement the GET /tasks endpoint (get all tasks).",
            "dependencies": [
              "BE-001",
              "BE-002",
              "BE-003"
            ],
            "estimated_time": "6 hours",
            "agent_role": "backend_developer",
            "acceptance_criteria": [
              "Endpoint handles GET requests to /tasks.",
              "Endpoint retrieves all tasks from the database.",
              "Endpoint returns a 200 OK status with a JSON array of tasks.",
              "Tasks include id, description, and created_at."
            ],
            "status": "pending",
            "code_files": [
              "index.js"
            ]
          },
          {
            "id": "BE-006",
            "description": "Implement input validation on the backend.",
            "dependencies": [
              "BE-004"
            ],
            "estimated_time": "4 hours",
            "agent_role": "backend_developer",
            "acceptance_criteria": [
              "Backend validates the 'description' field (required).",
              "Backend returns a 400 Bad Request with an error message if validation fails.",
              "Validation prevents empty task descriptions."
            ],
            "status": "pending",
            "code_files": [
              "index.js"
            ]
          },
          {
            "id": "BE-007",
            "description": "Implement error handling on the backend.",
            "dependencies": [
              "BE-004",
              "BE-005"
            ],
            "estimated_time": "4 hours",
            "agent_role": "backend_developer",
            "acceptance_criteria": [
              "Backend handles database connection errors.",
              "Backend handles query execution errors.",
              "Backend returns appropriate HTTP status codes for errors (e.g., 500 Internal Server Error).",
              "Error responses include informative error messages."
            ],
            "status": "pending",
            "code_files": [
              "index.js"
            ]
          },
          {
            "id": "TEST-002",
            "description": "Write integration tests for the backend API endpoints.",
            "dependencies": [
              "BE-004",
              "BE-005"
            ],
            "estimated_time": "8 hours",
            "agent_role": "backend_developer",
            "acceptance_criteria": [
              "Integration tests for the POST /tasks endpoint.",
              "Integration tests for the GET /tasks endpoint.",
              "Tests use a testing framework (e.g., Jest, Supertest).",
              "Tests cover success and failure scenarios.",
              "Tests pass."
            ],
            "status": "pending",
            "code_files": [
              "test/api.test.js"
            ]
          },
          {
            "id": "DEPLOY-001",
            "description": "Set up Heroku for deployment.",
            "dependencies": [
              "BE-001",
              "FE-001"
            ],
            "estimated_time": "4 hours",
            "agent_role": "backend_developer",
            "acceptance_criteria": [
              "Heroku account is created.",
              "Heroku CLI is installed.",
              "Heroku app is created.",
              "PostgreSQL add-on is provisioned on Heroku."
            ],
            "status": "pending",
            "code_files": [
              "Procfile"
            ]
          },
          {
            "id": "DEPLOY-002",
            "description": "Deploy the backend to Heroku.",
            "dependencies": [
              "BE-001",
              "BE-002",
              "BE-003",
              "BE-004",
              "BE-005",
              "DEPLOY-001"
            ],
            "estimated_time": "4 hours",
            "agent_role": "backend_developer",
            "acceptance_criteria": [
              "Backend code is deployed to Heroku.",
              "Database connection is configured on Heroku.",
              "Backend API is accessible via a Heroku URL."
            ],
            "status": "pending",
            "code_files": [
              "Procfile"
            ]
          },
          {
            "id": "DEPLOY-004",
            "description": "Configure environment variables for database connection.",
            "dependencies": [
              "DEPLOY-002"
            ],
            "estimated_time": "2 hours",
            "agent_role": "backend_developer",
            "acceptance_criteria": [
              "Database connection details are not hardcoded.",
              "Database connection details are read from environment variables on Heroku.",
              "Application connects to the database successfully on Heroku."
            ],
            "status": "pending",
            "code_files": [
              "index.js"
            ]
          }
        ]
      },
      {
        "name": "Database Phase",
        "description": "Tasks related to database phase",
        "deliverables": [
          "Completed BE-003"
        ],
        "estimated_duration_hours": 4.0,
        "work_items": [
          {
            "id": "BE-003",
            "description": "Create the 'tasks' table in PostgreSQL.",
            "dependencies": [
              "BE-002"
            ],
            "estimated_time": "4 hours",
            "agent_role": "database_specialist",
            "acceptance_criteria": [
              "Table named 'tasks' exists.",
              "Table has 'id' (SERIAL PRIMARY KEY), 'description' (VARCHAR), and 'created_at' (TIMESTAMP) columns.",
              "Table schema is correct."
            ],
            "status": "pending",
            "code_files": [
              "db/schema.sql"
            ]
          }
        ]
      }
    ],
    "timeline_estimation": {
      "start_date": "2025-07-08T14:22:05.376975",
      "end_date": "TBD",
      "milestones": []
    },
    "risk_assessment": [],
    "resource_requirements": [
      {
        "role": "Backend Developer",
        "count": 1,
        "estimated_time_allocation": "100%",
        "phases": [
          "Backend Phase"
        ],
        "skills_required": []
      },
      {
        "role": "Frontend Developer",
        "count": 1,
        "estimated_time_allocation": "100%",
        "phases": [
          "Frontend Phase"
        ],
        "skills_required": []
      },
      {
        "role": "Database Specialist",
        "count": 1,
        "estimated_time_allocation": "100%",
        "phases": [
          "Database Phase"
        ],
        "skills_required": []
      }
    ],
    "deliverables": [
      "Completed FE-001",
      "Completed FE-002",
      "Completed FE-003",
      "Completed FE-004",
      "Completed FE-005",
      "Completed FE-006",
      "Completed FE-007",
      "Completed FE-008",
      "Completed FE-009",
      "Completed TEST-001",
      "Completed DEPLOY-003",
      "Completed BE-001",
      "Completed BE-002",
      "Completed BE-004",
      "Completed BE-005",
      "Completed BE-006",
      "Completed BE-007",
      "Completed TEST-002",
      "Completed DEPLOY-001",
      "Completed DEPLOY-002",
      "Completed DEPLOY-004",
      "Completed BE-003"
    ],
    "dependencies": [],
    "raw_plan": "plan=ImplementationPlan(project_summary={'title': 'Generated Project Plan', 'description': 'Develop a simple web application for managing a list of tasks, including adding and viewing tasks. The application will use React for the frontend, Node.js/Express for the backend, and PostgreSQL for the database. The application will be deployed to Heroku.', 'overall_complexity': 'Medium', 'estimated_duration': 'TBD', 'key_challenges': [], 'success_criteria': []}, phases=[{'name': 'Frontend Phase', 'description': 'Tasks related to frontend phase', 'deliverables': ['Completed FE-001', 'Completed FE-002', 'Completed FE-003', 'Completed FE-004', 'Completed FE-005', 'Completed FE-006', 'Completed FE-007', 'Completed FE-008', 'Completed FE-009', 'Completed TEST-001', 'Completed DEPLOY-003'], 'estimated_duration_hours': 50.0, 'work_items': [{'id': 'FE-001', 'description': 'Set up React project with Create React App.', 'dependencies': [], 'estimated_time': '2 hours', 'agent_role': 'frontend_developer', 'acceptance_criteria': ['Project is initialized using Create React App.', 'Project builds without errors.', \"Default 'Hello World' page is displayed.\"], 'status': 'pending', 'code_files': ['package.json', 'src/App.js', 'src/index.js', 'public/index.html']}, {'id': 'FE-002', 'description': 'Create a basic task input form (text field and add button).', 'dependencies': ['FE-001'], 'estimated_time': '4 hours', 'agent_role': 'frontend_developer', 'acceptance_criteria': ['Form with a text input field exists.', 'Add button exists.', 'Input field accepts text input.'], 'status': 'pending', 'code_files': ['src/App.js']}, {'id': 'FE-003', 'description': 'Create a component to display the task list.', 'dependencies': ['FE-001'], 'estimated_time': '4 hours', 'agent_role': 'frontend_developer', 'acceptance_criteria': ['Task list component renders.', 'Component accepts an array of tasks as props.', 'Each task is displayed in a list item.'], 'status': 'pending', 'code_files': ['src/App.js', 'src/TaskList.js']}, {'id': 'FE-004', 'description': 'Implement state management for tasks (using useState).', 'dependencies': ['FE-002', 'FE-003'], 'estimated_time': '4 hours', 'agent_role': 'frontend_developer', 'acceptance_criteria': ['Tasks are stored in component state.', 'Tasks are updated when a new task is added.', 'Task list component re-renders when tasks change.'], 'status': 'pending', 'code_files': ['src/App.js']}, {'id': 'FE-005', 'description': \"Implement the 'add task' functionality (on button click).\", 'dependencies': ['FE-002', 'FE-004'], 'estimated_time': '4 hours', 'agent_role': 'frontend_developer', 'acceptance_criteria': ['When the add button is clicked, a new task is added to the task list.', \"The new task's description is taken from the input field.\", 'The input field is cleared after adding a task.'], 'status': 'pending', 'code_files': ['src/App.js']}, {'id': 'FE-006', 'description': 'Implement API calls to the backend (POST /tasks).', 'dependencies': ['FE-005', 'BE-004'], 'estimated_time': '6 hours', 'agent_role': 'frontend_developer', 'acceptance_criteria': ['Frontend makes a POST request to /api/v1/tasks when the add button is clicked.', 'Request body includes the task description.', 'Frontend handles the 201 Created response (adds the new task to the list).', 'Frontend handles 400 Bad Request responses (displays error messages).'], 'status': 'pending', 'code_files': ['src/App.js']}, {'id': 'FE-007', 'description': 'Implement API calls to the backend (GET /tasks).', 'dependencies': ['FE-003', 'BE-005'], 'estimated_time': '6 hours', 'agent_role': 'frontend_developer', 'acceptance_criteria': ['Frontend makes a GET request to /api/v1/tasks when the component mounts.', 'Frontend displays the tasks retrieved from the API.', 'Frontend handles errors gracefully.'], 'status': 'pending', 'code_files': ['src/App.js']}, {'id': 'FE-008', 'description': 'Add basic styling to the task list and form.', 'dependencies': ['FE-002', 'FE-003', 'FE-007'], 'estimated_time': '4 hours', 'agent_role': 'frontend_developer', 'acceptance_criteria': ['Task list is styled to be readable.', 'Form is styled to be visually appealing.', 'Styling is consistent across the application.'], 'status': 'pending', 'code_files': ['src/App.css', 'src/TaskList.css']}, {'id': 'FE-009', 'description': 'Implement error handling on the frontend.', 'dependencies': ['FE-006', 'FE-007'], 'estimated_time': '4 hours', 'agent_role': 'frontend_developer', 'acceptance_criteria': ['Frontend displays error messages from the backend.', 'Frontend handles network errors gracefully.', 'Error messages are user-friendly.'], 'status': 'pending', 'code_files': ['src/App.js']}, {'id': 'TEST-001', 'description': 'Write unit tests for the frontend components.', 'dependencies': ['FE-003', 'FE-004', 'FE-005', 'FE-006', 'FE-007'], 'estimated_time': '8 hours', 'agent_role': 'frontend_developer', 'acceptance_criteria': ['Unit tests cover the TaskList component.', \"Unit tests cover the App component's state management.\", 'Unit tests cover the API call implementations.', 'Tests use a testing framework (e.g., Jest).', 'Tests pass.'], 'status': 'pending', 'code_files': ['src/App.test.js', 'src/TaskList.test.js']}, {'id': 'DEPLOY-003', 'description': 'Deploy the frontend to Heroku.', 'dependencies': ['FE-001', 'FE-006', 'FE-007', 'DEPLOY-001', 'DEPLOY-002'], 'estimated_time': '4 hours', 'agent_role': 'frontend_developer', 'acceptance_criteria': ['Frontend code is deployed to Heroku.', 'Frontend is configured to call the backend API on Heroku.', 'Frontend is accessible via a Heroku URL.'], 'status': 'pending', 'code_files': ['package.json']}]}, {'name': 'Backend Phase', 'description': 'Tasks related to backend phase', 'deliverables': ['Completed BE-001', 'Completed BE-002', 'Completed BE-004', 'Completed BE-005', 'Completed BE-006', 'Completed BE-007', 'Completed TEST-002', 'Completed DEPLOY-001', 'Completed DEPLOY-002', 'Completed DEPLOY-004'], 'estimated_duration_hours': 46.0, 'work_items': [{'id': 'BE-001', 'description': 'Set up Node.js/Express project.', 'dependencies': [], 'estimated_time': '2 hours', 'agent_role': 'backend_developer', 'acceptance_criteria': ['Project is initialized with npm.', 'Express is installed as a dependency.', \"Basic server setup with a route that responds with 'Hello World'.\"], 'status': 'pending', 'code_files': ['package.json', 'index.js']}, {'id': 'BE-002', 'description': 'Install and configure PostgreSQL and a client library (pg).', 'dependencies': ['BE-001'], 'estimated_time': '4 hours', 'agent_role': 'backend_developer', 'acceptance_criteria': ['PostgreSQL is installed and running (locally or remotely).', 'pg library is installed.', 'Connection to the database is established successfully.'], 'status': 'pending', 'code_files': ['package.json', 'index.js']}, {'id': 'BE-004', 'description': 'Implement the POST /tasks endpoint (create a task).', 'dependencies': ['BE-001', 'BE-002', 'BE-003'], 'estimated_time': '8 hours', 'agent_role': 'backend_developer', 'acceptance_criteria': ['Endpoint handles POST requests to /tasks.', \"Endpoint receives a 'description' in the request body.\", \"Endpoint validates the 'description' (required).\", 'Endpoint inserts the task into the database.', 'Endpoint returns a 201 Created status with the created task (including id and created_at).', 'Endpoint returns a 400 Bad Request if the description is missing.'], 'status': 'pending', 'code_files': ['index.js']}, {'id': 'BE-005', 'description': 'Implement the GET /tasks endpoint (get all tasks).', 'dependencies': ['BE-001', 'BE-002', 'BE-003'], 'estimated_time': '6 hours', 'agent_role': 'backend_developer', 'acceptance_criteria': ['Endpoint handles GET requests to /tasks.', 'Endpoint retrieves all tasks from the database.', 'Endpoint returns a 200 OK status with a JSON array of tasks.', 'Tasks include id, description, and created_at.'], 'status': 'pending', 'code_files': ['index.js']}, {'id': 'BE-006', 'description': 'Implement input validation on the backend.', 'dependencies': ['BE-004'], 'estimated_time': '4 hours', 'agent_role': 'backend_developer', 'acceptance_criteria': [\"Backend validates the 'description' field (required).\", 'Backend returns a 400 Bad Request with an error message if validation fails.', 'Validation prevents empty task descriptions.'], 'status': 'pending', 'code_files': ['index.js']}, {'id': 'BE-007', 'description': 'Implement error handling on the backend.', 'dependencies': ['BE-004', 'BE-005'], 'estimated_time': '4 hours', 'agent_role': 'backend_developer', 'acceptance_criteria': ['Backend handles database connection errors.', 'Backend handles query execution errors.', 'Backend returns appropriate HTTP status codes for errors (e.g., 500 Internal Server Error).', 'Error responses include informative error messages.'], 'status': 'pending', 'code_files': ['index.js']}, {'id': 'TEST-002', 'description': 'Write integration tests for the backend API endpoints.', 'dependencies': ['BE-004', 'BE-005'], 'estimated_time': '8 hours', 'agent_role': 'backend_developer', 'acceptance_criteria': ['Integration tests for the POST /tasks endpoint.', 'Integration tests for the GET /tasks endpoint.', 'Tests use a testing framework (e.g., Jest, Supertest).', 'Tests cover success and failure scenarios.', 'Tests pass.'], 'status': 'pending', 'code_files': ['test/api.test.js']}, {'id': 'DEPLOY-001', 'description': 'Set up Heroku for deployment.', 'dependencies': ['BE-001', 'FE-001'], 'estimated_time': '4 hours', 'agent_role': 'backend_developer', 'acceptance_criteria': ['Heroku account is created.', 'Heroku CLI is installed.', 'Heroku app is created.', 'PostgreSQL add-on is provisioned on Heroku.'], 'status': 'pending', 'code_files': ['Procfile']}, {'id': 'DEPLOY-002', 'description': 'Deploy the backend to Heroku.', 'dependencies': ['BE-001', 'BE-002', 'BE-003', 'BE-004', 'BE-005', 'DEPLOY-001'], 'estimated_time': '4 hours', 'agent_role': 'backend_developer', 'acceptance_criteria': ['Backend code is deployed to Heroku.', 'Database connection is configured on Heroku.', 'Backend API is accessible via a Heroku URL.'], 'status': 'pending', 'code_files': ['Procfile']}, {'id': 'DEPLOY-004', 'description': 'Configure environment variables for database connection.', 'dependencies': ['DEPLOY-002'], 'estimated_time': '2 hours', 'agent_role': 'backend_developer', 'acceptance_criteria': ['Database connection details are not hardcoded.', 'Database connection details are read from environment variables on Heroku.', 'Application connects to the database successfully on Heroku.'], 'status': 'pending', 'code_files': ['index.js']}]}, {'name': 'Database Phase', 'description': 'Tasks related to database phase', 'deliverables': ['Completed BE-003'], 'estimated_duration_hours': 4.0, 'work_items': [{'id': 'BE-003', 'description': \"Create the 'tasks' table in PostgreSQL.\", 'dependencies': ['BE-002'], 'estimated_time': '4 hours', 'agent_role': 'database_specialist', 'acceptance_criteria': [\"Table named 'tasks' exists.\", \"Table has 'id' (SERIAL PRIMARY KEY), 'description' (VARCHAR), and 'created_at' (TIMESTAMP) columns.\", 'Table schema is correct.'], 'status': 'pending', 'code_files': ['db/schema.sql']}]}], resource_allocation=[{'role': 'Backend Developer', 'count': 1, 'estimated_time_allocation': '100%', 'phases': ['Backend Phase'], 'skills_required': []}, {'role': 'Frontend Developer', 'count': 1, 'estimated_time_allocation': '100%', 'phases': ['Frontend Phase'], 'skills_required': []}, {'role': 'Database Specialist', 'count': 1, 'estimated_time_allocation': '100%', 'phases': ['Database Phase'], 'skills_required': []}], risks_and_mitigations=[], timeline={'start_date': '2025-07-08T14:22:05.376975', 'end_date': 'TBD', 'milestones': []}, tech_stack={}, metadata={'generated_at': '2025-07-08T14:22:05.376975', 'version': '1.0', 'author': 'Multi-AI Dev System', 'tags': [], 'notes': 'Converted from WorkItemBacklog. Original summary: Develop a simple web application for managing a list of tasks, including adding and viewing tasks. The application will use React for the frontend, Node.js/Express for the backend, and PostgreSQL for the database. The application will be deployed to Heroku.'}) summary='Develop a simple web application for managing a list of tasks, including adding and viewing tasks. The application will use React for the frontend, Node.js/Express for the backend, and PostgreSQL for the database. The application will be deployed to Heroku.' metadata=PlanMetadata(generated_at='2025-07-08T14:22:05.376975', version='1.0', author='Multi-AI Dev System', tags=[], notes='Converted from WorkItemBacklog. Original summary: Develop a simple web application for managing a list of tasks, including adding and viewing tasks. The application will use React for the frontend, Node.js/Express for the backend, and PostgreSQL for the database. The application will be deployed to Heroku.')"
  },
  "workflow_state_snapshot": {
    "requirements_analysis": {
      "project_name": "Hello World Task List",
      "project_summary": "A simple web application to manage a list of tasks.",
      "project_goals": [
        "Allow a user to add a task",
        "Allow a user to see their list of tasks"
      ],
      "target_audience": [
        "Users who want to manage a list of tasks"
      ],
      "business_context": "This project aims to provide a basic task management tool.",
      "requirements": [
        {
          "id": "REQ-001",
          "description": "A user can create a new task with a text description.",
          "category": "functional",
          "priority": 1
        },
        {
          "id": "REQ-002",
          "description": "A user can see a list of all created tasks.",
          "category": "functional",
          "priority": 1
        },
        {
          "id": "REQ-003",
          "description": "The application must load quickly.",
          "category": "non_functional",
          "priority": 2
        },
        {
          "id": "REQ-004",
          "description": "The application must be secure.",
          "category": "non_functional",
          "priority": 2
        }
      ],
      "functional_requirements": [
        "A user can create a new task with a text description.",
        "A user can see a list of all created tasks."
      ],
      "non_functional_requirements": [
        "The application must load quickly.",
        "The application must be secure."
      ],
      "stakeholders": [
        "Users"
      ],
      "success_criteria": [
        "Users can successfully add tasks.",
        "Users can view their task list."
      ],
      "constraints": [],
      "assumptions": [],
      "risks": [],
      "domain_specific_details": {},
      "quality_assessment": {
        "clarity_score": 8.0,
        "completeness_score": 7.0,
        "consistency_score": 9.0,
        "recommendations": [
          "Add more detailed non-functional requirements (e.g., specific performance metrics, security measures)."
        ]
      },
      "gap_analysis": {
        "identified_gaps": [
          "Lack of detailed requirements for user interface, data storage, and security implementation."
        ],
        "recommendations_for_completion": [
          "Expand the BRD with detailed specifications for the user interface, data storage, and security protocols."
        ]
      }
    },
    "tech_stack_recommendation": {
      "frontend_options": [
        {
          "name": "React",
          "language": "JavaScript",
          "reasoning": "React is a popular and efficient JavaScript library for building user interfaces. It offers a component-based architecture, making it easy to manage and update the UI. Its virtual DOM and efficient update mechanisms contribute to fast loading times, addressing the non-functional requirement for speed.",
          "key_libraries": [
            "React Router (for navigation)",
            "Axios or Fetch (for API calls)",
            "Material UI or Bootstrap (for UI components)"
          ],
          "pros": [
            "Large community and extensive documentation.",
            "Component-based architecture promotes code reusability and maintainability.",
            "Virtual DOM for efficient updates and improved performance.",
            "Wide range of available UI component libraries."
          ],
          "cons": [
            "Requires understanding of JavaScript and JSX.",
            "Can have a steeper learning curve for beginners.",
            "Requires additional libraries for routing and state management (although these are readily available)."
          ],
          "selected": false
        },
        {
          "name": "Vue.js",
          "language": "JavaScript",
          "reasoning": "Vue.js is a progressive framework that is easy to learn and integrate. It offers a good balance between simplicity and functionality, making it suitable for this project's scope. It also has good performance characteristics.",
          "key_libraries": [
            "Vue Router (for navigation)",
            "Axios or Fetch (for API calls)",
            "Vuetify or BootstrapVue (for UI components)"
          ],
          "pros": [
            "Easy to learn and use.",
            "Progressive framework, allowing for gradual adoption.",
            "Good performance and small bundle size.",
            "Excellent documentation."
          ],
          "cons": [
            "Smaller community compared to React.",
            "Ecosystem might not be as extensive as React's."
          ],
          "selected": false
        },
        {
          "name": "HTML, CSS, JavaScript (Vanilla)",
          "language": "JavaScript",
          "reasoning": "For a simple task list application, using vanilla JavaScript, HTML, and CSS can be a viable option. This approach minimizes dependencies and provides a lightweight solution, which can contribute to fast loading times. It's suitable for projects with limited UI complexity.",
          "key_libraries": [],
          "pros": [
            "No external dependencies.",
            "Simple to understand and implement.",
            "Good for small projects with limited UI complexity.",
            "Fast loading times due to minimal dependencies."
          ],
          "cons": [
            "More manual work for UI component management.",
            "Can become complex to maintain as the application grows.",
            "Requires more manual DOM manipulation."
          ],
          "selected": false
        }
      ],
      "backend_options": [
        {
          "name": "Node.js with Express",
          "language": "JavaScript",
          "reasoning": "Node.js with Express provides a lightweight and efficient backend solution. JavaScript is used on both the frontend and backend, which simplifies development. Express offers a flexible framework for building RESTful APIs, which is suitable for this project.",
          "key_libraries": [
            "Express (for routing and middleware)",
            "body-parser (for parsing request bodies)",
            "cors (for handling Cross-Origin Resource Sharing)"
          ],
          "pros": [
            "JavaScript on both frontend and backend (full-stack JavaScript).",
            "Large community and extensive documentation.",
            "Fast development due to the use of JavaScript.",
            "Express is a lightweight and flexible framework."
          ],
          "cons": [
            "Can be challenging to scale for very large applications.",
            "Requires careful handling of asynchronous operations (callbacks, promises, async/await)."
          ],
          "selected": false
        },
        {
          "name": "Python with Flask",
          "language": "Python",
          "reasoning": "Flask is a microframework that is easy to learn and use. Python is a versatile language with a large community and many libraries. Flask is a good choice for building REST APIs.",
          "key_libraries": [
            "Flask (for routing and handling requests)",
            "Flask-CORS (for handling CORS)",
            "SQLAlchemy (for database interaction)"
          ],
          "pros": [
            "Easy to learn and use.",
            "Large community and extensive documentation.",
            "Python is a versatile language.",
            "Flask is a lightweight and flexible framework."
          ],
          "cons": [
            "Requires knowledge of Python.",
            "Can be challenging to scale for very large applications."
          ],
          "selected": false
        },
        {
          "name": "Java with Spring Boot",
          "language": "Java",
          "reasoning": "Spring Boot provides a robust and scalable backend solution. Java is a mature language with a large ecosystem. Spring Boot simplifies the development of REST APIs.",
          "key_libraries": [
            "Spring Boot (for building REST APIs)",
            "Spring Data JPA (for database interaction)",
            "Maven or Gradle (for dependency management)"
          ],
          "pros": [
            "Robust and scalable.",
            "Large community and extensive documentation.",
            "Mature language with a large ecosystem.",
            "Spring Boot simplifies development."
          ],
          "cons": [
            "Steeper learning curve.",
            "More verbose than other options."
          ],
          "selected": false
        }
      ],
      "database_options": [
        {
          "name": "PostgreSQL",
          "language": null,
          "reasoning": "PostgreSQL is a robust and reliable relational database. It offers strong data integrity and is well-suited for storing structured data. It's a good choice for this project because it provides a solid foundation for data storage and retrieval.",
          "key_libraries": [
            "psycopg2 (for Python)",
            "pg (for Node.js)"
          ],
          "pros": [
            "ACID-compliant, ensuring data integrity.",
            "Supports complex queries and transactions.",
            "Mature and well-documented.",
            "Scalable and reliable."
          ],
          "cons": [
            "Can be more complex to set up and manage than simpler databases.",
            "Requires more resources than simpler databases."
          ],
          "selected": false
        },
        {
          "name": "MongoDB",
          "language": null,
          "reasoning": "MongoDB is a NoSQL database that is easy to use and scale. It is a good choice for this project because it is easy to set up and use. It is also a good choice for storing unstructured data.",
          "key_libraries": [
            "mongoose (for Node.js)",
            "pymongo (for Python)"
          ],
          "pros": [
            "Flexible schema design.",
            "Easy to scale horizontally.",
            "Good performance for read-heavy workloads.",
            "Easy to set up and use."
          ],
          "cons": [
            "Data consistency can be more challenging to manage.",
            "Not ideal for complex transactions."
          ],
          "selected": false
        },
        {
          "name": "SQLite",
          "language": null,
          "reasoning": "SQLite is a lightweight, file-based database. It's easy to set up and requires no separate server process, making it suitable for small projects or local development. It's a good choice for this project because it is simple and easy to use.",
          "key_libraries": [
            "sqlite3 (built-in for Python)",
            "sqlite3 (for Node.js)"
          ],
          "pros": [
            "Simple to set up and use.",
            "No separate server process required.",
            "Good for small projects and local development.",
            "File-based, making it easy to deploy."
          ],
          "cons": [
            "Not suitable for high-traffic or large-scale applications.",
            "Limited concurrency support."
          ],
          "selected": false
        }
      ],
      "cloud_options": [
        {
          "name": "AWS (Amazon Web Services)",
          "language": null,
          "reasoning": "AWS offers a wide range of services, including compute, storage, and database services. It provides a scalable and reliable platform for deploying the application. It's a good choice for this project because it offers a wide range of services and is scalable.",
          "key_libraries": [
            "AWS SDK (for interacting with AWS services)"
          ],
          "pros": [
            "Highly scalable and reliable.",
            "Wide range of services available.",
            "Mature platform with extensive documentation.",
            "Global infrastructure."
          ],
          "cons": [
            "Can be complex to manage.",
            "Cost can be higher than other options.",
            "Steeper learning curve."
          ],
          "selected": false
        },
        {
          "name": "Google Cloud Platform (GCP)",
          "language": null,
          "reasoning": "GCP provides a comprehensive set of cloud services, including compute, storage, and database services. It offers a scalable and reliable platform for deploying the application. It's a good choice for this project because it offers a wide range of services and is scalable.",
          "key_libraries": [
            "Google Cloud Client Libraries (for interacting with GCP services)"
          ],
          "pros": [
            "Competitive pricing.",
            "Strong in data analytics and machine learning.",
            "Scalable and reliable.",
            "Global infrastructure."
          ],
          "cons": [
            "Can be complex to manage.",
            "Steeper learning curve."
          ],
          "selected": false
        },
        {
          "name": "Heroku",
          "language": null,
          "reasoning": "Heroku is a Platform-as-a-Service (PaaS) that simplifies deployment and management. It's a good choice for this project because it is easy to use and deploy. It abstracts away much of the infrastructure management, making it ideal for small projects.",
          "key_libraries": [],
          "pros": [
            "Easy to deploy and manage.",
            "Focuses on developer experience.",
            "Good for small to medium-sized applications.",
            "Supports multiple languages and frameworks."
          ],
          "cons": [
            "Limited customization options.",
            "Can become expensive as the application grows.",
            "Vendor lock-in."
          ],
          "selected": false
        }
      ],
      "architecture_options": [
        {
          "pattern": "Monolithic Architecture",
          "scalability_score": 4.0,
          "maintainability_score": 6.0,
          "development_speed_score": 8.0,
          "overall_score": 6.0,
          "reasoning": "For a simple task list application, a monolithic architecture is a suitable starting point. All components (frontend, backend, database) reside within a single codebase. This approach simplifies development and deployment, leading to faster initial development. However, as the application grows, it can become harder to scale and maintain."
        },
        {
          "pattern": "Microservices Architecture",
          "scalability_score": 8.0,
          "maintainability_score": 7.0,
          "development_speed_score": 5.0,
          "overall_score": 6.0,
          "reasoning": "While microservices offer excellent scalability and maintainability, they introduce complexity that might be unnecessary for this small project. Implementing microservices requires more upfront design and infrastructure setup. This architecture is better suited for larger, more complex applications that require independent scaling of different components."
        },
        {
          "pattern": "Serverless Architecture",
          "scalability_score": 9.0,
          "maintainability_score": 7.0,
          "development_speed_score": 6.0,
          "overall_score": 7.0,
          "reasoning": "Serverless architecture can be a good option for this project, especially if using a cloud provider like AWS or GCP. It allows for automatic scaling and reduces operational overhead. However, it can introduce complexities in debugging and monitoring, and might not be the most cost-effective solution for low-traffic applications."
        }
      ],
      "tool_options": [
        {
          "name": "Git",
          "language": null,
          "reasoning": "Git is essential for version control, allowing developers to track changes, collaborate effectively, and revert to previous versions if needed. It's a standard tool for software development.",
          "key_libraries": [],
          "pros": [],
          "cons": [],
          "selected": false
        },
        {
          "name": "Docker",
          "language": null,
          "reasoning": "Docker can be used to containerize the application, making it easier to deploy and manage across different environments. It ensures consistency and simplifies the deployment process.",
          "key_libraries": [],
          "pros": [],
          "cons": [],
          "selected": false
        },
        {
          "name": "CI/CD Pipeline (e.g., Jenkins, GitLab CI, GitHub Actions)",
          "language": null,
          "reasoning": "A CI/CD pipeline automates the build, test, and deployment processes. This improves development efficiency, reduces the risk of errors, and enables faster releases.",
          "key_libraries": [],
          "pros": [],
          "cons": [],
          "selected": false
        }
      ],
      "risks": [
        {
          "category": "Security",
          "description": "Vulnerabilities in the application code or dependencies could lead to data breaches or unauthorized access. This is especially relevant given the requirement for security.",
          "severity": "Medium",
          "likelihood": "Medium",
          "mitigation": "Implement secure coding practices, regularly update dependencies, and use security testing tools (e.g., OWASP ZAP, Snyk)."
        },
        {
          "category": "Performance",
          "description": "Slow loading times or poor performance can negatively impact user experience, especially if the application is not optimized.",
          "severity": "Medium",
          "likelihood": "Medium",
          "mitigation": "Optimize code for performance, use caching mechanisms, and monitor application performance regularly. Consider using a CDN for static assets."
        },
        {
          "category": "Scalability",
          "description": "If the application becomes popular, the chosen architecture and infrastructure might not be able to handle the increased load.",
          "severity": "Low",
          "likelihood": "Low",
          "mitigation": "Design the application with scalability in mind from the start. Choose scalable technologies (e.g., cloud-based services) and monitor resource usage. Consider a database that can scale."
        },
        {
          "category": "Data Storage",
          "description": "Data loss or corruption could occur due to database failures or improper data handling.",
          "severity": "Medium",
          "likelihood": "Low",
          "mitigation": "Implement regular backups of the database. Use appropriate data validation and sanitization techniques. Choose a database with built-in data redundancy and replication features."
        }
      ],
      "synthesis": {
        "backend": {
          "language": "JavaScript",
          "framework": "Node.js with Express",
          "reasoning": "Node.js with Express provides a lightweight and efficient backend solution. JavaScript is used on both the frontend and backend, which simplifies development. Express offers a flexible framework for building RESTful APIs, which is suitable for this project."
        },
        "frontend": {
          "language": "JavaScript",
          "framework": "React",
          "reasoning": "React is a popular and efficient JavaScript library for building user interfaces. It offers a component-based architecture, making it easy to manage and update the UI. Its virtual DOM and efficient update mechanisms contribute to fast loading times, addressing the non-functional requirement for speed."
        },
        "database": {
          "type": "PostgreSQL",
          "reasoning": "PostgreSQL is a robust and reliable relational database. It offers strong data integrity and is well-suited for storing structured data. It's a good choice for this project because it provides a solid foundation for data storage and retrieval."
        },
        "architecture_pattern": "Monolithic Architecture",
        "deployment_environment": {
          "cloud_provider": "Heroku",
          "reasoning": "Heroku is a Platform-as-a-Service (PaaS) that simplifies deployment and management. It's a good choice for this project because it is easy to use and deploy. It abstracts away much of the infrastructure management, making it ideal for small projects."
        },
        "key_libraries_tools": [
          {
            "name": "React Router",
            "purpose": "For navigation in the React frontend."
          },
          {
            "name": "Axios",
            "purpose": "For making API calls from the frontend."
          },
          {
            "name": "Express",
            "purpose": "For routing and handling requests in the backend."
          },
          {
            "name": "PostgreSQL client library (e.g., pg for Node.js)",
            "purpose": "For interacting with the PostgreSQL database."
          },
          {
            "name": "Git",
            "purpose": "For version control."
          },
          {
            "name": "Docker",
            "purpose": "For containerization and deployment."
          }
        ],
        "estimated_complexity": "Low"
      },
      "selected_stack": null
    },
    "system_design": {
      "architecture": {
        "pattern": "Monolithic Architecture",
        "justification": "For a simple task list application, a monolithic architecture is a suitable starting point. All components (frontend, backend, database) reside within a single codebase. This approach simplifies development and deployment, leading to faster initial development.",
        "key_benefits": [
          "Faster initial development.",
          "Simplified deployment.",
          "Easier to manage for small projects."
        ],
        "potential_drawbacks": [
          "Can become harder to scale as the application grows.",
          "Tight coupling between components can make changes more difficult."
        ]
      },
      "components": [
        {
          "name": "Frontend",
          "description": "The user interface for the task list application.",
          "category": "frontend",
          "technologies": [
            "React",
            "JavaScript",
            "HTML",
            "CSS"
          ],
          "dependencies": [
            "Backend API"
          ],
          "responsibilities": [
            "Displaying the task list.",
            "Allowing users to add new tasks.",
            "Handling user interactions.",
            "Making API calls to the backend."
          ],
          "design_patterns": [
            "Component-based architecture"
          ]
        },
        {
          "name": "Backend API",
          "description": "The RESTful API that handles requests from the frontend and interacts with the database.",
          "category": "backend",
          "technologies": [
            "Node.js",
            "Express",
            "JavaScript"
          ],
          "dependencies": [
            "PostgreSQL Database"
          ],
          "responsibilities": [
            "Handling API requests.",
            "Validating data.",
            "Interacting with the database.",
            "Returning data to the frontend."
          ],
          "design_patterns": [
            "RESTful API design"
          ]
        },
        {
          "name": "Database",
          "description": "Stores the task data.",
          "category": "database",
          "technologies": [
            "PostgreSQL",
            "SQL"
          ],
          "dependencies": [],
          "responsibilities": [
            "Storing task data.",
            "Retrieving task data.",
            "Ensuring data integrity."
          ],
          "design_patterns": [
            "Relational database design"
          ]
        },
        {
          "name": "Deployment Environment",
          "description": "The environment where the application is deployed.",
          "category": "deployment",
          "technologies": [
            "Heroku",
            "Docker"
          ],
          "dependencies": [
            "Frontend",
            "Backend API",
            "Database"
          ],
          "responsibilities": [
            "Hosting the application.",
            "Managing the application's resources.",
            "Ensuring the application is accessible."
          ],
          "design_patterns": []
        }
      ],
      "data_model": {
        "schema_type": "Relational",
        "tables": [
          {
            "name": "tasks",
            "purpose": "Stores information about each task.",
            "fields": [
              {
                "name": "id",
                "type": "SERIAL",
                "constraints": [
                  "PRIMARY KEY"
                ],
                "description": "Unique identifier for the task."
              },
              {
                "name": "description",
                "type": "VARCHAR(255)",
                "constraints": [
                  "NOT NULL"
                ],
                "description": "The text description of the task."
              },
              {
                "name": "created_at",
                "type": "TIMESTAMP",
                "constraints": [
                  "NOT NULL",
                  "DEFAULT CURRENT_TIMESTAMP"
                ],
                "description": "The timestamp when the task was created."
              }
            ],
            "relationships": []
          }
        ],
        "relationships": [],
        "justification": "Relational databases provide strong data integrity and are well-suited for storing structured data like task lists."
      },
      "api_endpoints": {
        "style": "REST",
        "base_url": "/api/v1",
        "authentication": "None (for simplicity)",
        "endpoints": [
          {
            "method": "POST",
            "path": "/tasks",
            "purpose": "Create a new task.",
            "parameters": [
              {
                "description": "The task description.",
                "type": "string",
                "name": "description"
              }
            ],
            "response": {
              "201": {
                "message": "Task created successfully",
                "task": {
                  "id": 1,
                  "description": "Example task",
                  "created_at": "2024-01-01T00:00:00.000Z"
                }
              },
              "400": {
                "message": "Bad Request",
                "errors": [
                  "Description is required"
                ]
              }
            },
            "authentication_required": false,
            "rate_limiting_applied": false
          },
          {
            "method": "GET",
            "path": "/tasks",
            "purpose": "Get all tasks.",
            "parameters": [],
            "response": {
              "200": {
                "tasks": [
                  {
                    "id": 1,
                    "description": "Example task",
                    "created_at": "2024-01-01T00:00:00.000Z"
                  }
                ]
              }
            },
            "authentication_required": false,
            "rate_limiting_applied": false
          }
        ],
        "error_handling": "Standard HTTP status codes and JSON responses with error messages.",
        "rate_limiting_strategy": null
      },
      "security": {
        "authentication_method": "None (for simplicity)",
        "authorization_strategy": "None (for simplicity)",
        "data_encryption": {
          "at_rest": "None (for simplicity)",
          "in_transit": "HTTPS (implemented by Heroku)"
        },
        "security_measures": [
          {
            "category": "Input Validation",
            "implementation": "Validate all user inputs on the backend to prevent injection attacks.",
            "mitigation": "SQL Injection, Cross-Site Scripting (XSS)",
            "priority": "High"
          },
          {
            "category": "Dependency Management",
            "implementation": "Regularly update dependencies to patch security vulnerabilities.",
            "mitigation": "Known vulnerabilities in dependencies",
            "priority": "Medium"
          },
          {
            "category": "HTTPS",
            "implementation": "Enforce HTTPS for all communication.",
            "mitigation": "Man-in-the-middle attacks",
            "priority": "High"
          }
        ],
        "vulnerability_mitigation_strategies": [
          "Input validation and sanitization.",
          "Regular dependency updates.",
          "Use of HTTPS.",
          "Preventing Cross-Site Scripting (XSS) attacks by properly escaping output."
        ],
        "compliance_standards": []
      },
      "scalability_and_performance": {
        "caching": "Implement client-side caching for static assets (e.g., JavaScript, CSS).",
        "database_optimization": "Optimize database queries and indexes for performance.",
        "cdn": "Consider using a Content Delivery Network (CDN) for static assets if the application grows."
      },
      "deployment_strategy": {
        "platform": "Heroku",
        "process": "Use Heroku's CLI or web interface to deploy the application.  Dockerize the application for consistent deployments.",
        "environment": "Production and development environments."
      },
      "monitoring_and_logging": {
        "logging": "Implement logging for both frontend and backend to track errors and application behavior. Use a logging library (e.g., Winston for Node.js).",
        "monitoring": "Use Heroku's built-in monitoring tools or integrate with a third-party service (e.g., New Relic, Datadog) for application performance monitoring."
      },
      "error_handling_strategy": "Centralized error handling with informative error messages and appropriate HTTP status codes.",
      "development_phases_overview": [
        {
          "name": "Phase 1: Setup and Basic Functionality",
          "description": "Set up the development environment, create the basic frontend and backend structure, and implement the core functionality of adding and viewing tasks.",
          "priority": "High",
          "dependencies": [],
          "tasks": [
            "Set up React frontend.",
            "Set up Node.js/Express backend.",
            "Set up PostgreSQL database.",
            "Implement API endpoints for creating and retrieving tasks.",
            "Implement basic UI for adding and viewing tasks.",
            "Implement database schema."
          ],
          "estimated_duration": "1 week"
        },
        {
          "name": "Phase 2: Enhancements and Testing",
          "description": "Add enhancements like input validation, error handling, and implement testing.",
          "priority": "Medium",
          "dependencies": [
            "Phase 1"
          ],
          "tasks": [
            "Implement input validation on the backend.",
            "Implement error handling and display error messages on the frontend.",
            "Write unit tests and integration tests.",
            "Implement basic styling."
          ],
          "estimated_duration": "1 week"
        },
        {
          "name": "Phase 3: Deployment and Refinement",
          "description": "Deploy the application to Heroku and refine the application based on feedback.",
          "priority": "Medium",
          "dependencies": [
            "Phase 2"
          ],
          "tasks": [
            "Deploy the application to Heroku.",
            "Test the application in the production environment.",
            "Gather user feedback.",
            "Refine the application based on feedback."
          ],
          "estimated_duration": "1 week"
        }
      ],
      "key_risks": [
        "Security vulnerabilities in the application code or dependencies.",
        "Performance issues due to inefficient code or database queries.",
        "Data loss or corruption due to database failures.",
        "Scalability limitations if the application becomes popular."
      ],
      "design_justification": "The design prioritizes simplicity and ease of development, aligning with the project's goals. The monolithic architecture, combined with the chosen technologies, allows for rapid development and deployment. The use of Heroku simplifies the deployment process. Security measures are implemented to address potential vulnerabilities. The design is suitable for the initial scope of the project, with considerations for future scalability.",
      "data_flow": "1.  **User Interaction:** The user interacts with the React frontend, entering task descriptions and viewing the task list.\n2.  **Frontend to Backend:** When the user adds a task, the frontend sends a POST request to the `/api/v1/tasks` endpoint of the backend API, including the task description.\n3.  **Backend Processing:** The backend API receives the request, validates the input, and interacts with the PostgreSQL database to store the new task.\n4.  **Database Interaction:** The backend API uses SQL queries to insert the task data into the `tasks` table.\n5.  **Backend Response:** The backend API sends a 201 Created response back to the frontend, including the newly created task's details (id, description, created_at).\n6.  **Frontend Update:** The frontend receives the response and updates the task list to display the new task.\n7.  **Retrieving Tasks:** When the user views the task list, the frontend sends a GET request to the `/api/v1/tasks` endpoint.\n8.  **Backend Retrieval:** The backend API retrieves all tasks from the PostgreSQL database.\n9.  **Backend Response:** The backend API sends a 200 OK response back to the frontend, including the list of tasks.\n10. **Frontend Display:** The frontend displays the retrieved tasks to the user."
    },
    "implementation_plan": "plan=ImplementationPlan(project_summary={'title': 'Generated Project Plan', 'description': 'Develop a simple web application for managing a list of tasks, including adding and viewing tasks. The application will use React for the frontend, Node.js/Express for the backend, and PostgreSQL for the database. The application will be deployed to Heroku.', 'overall_complexity': 'Medium', 'estimated_duration': 'TBD', 'key_challenges': [], 'success_criteria': []}, phases=[{'name': 'Frontend Phase', 'description': 'Tasks related to frontend phase', 'deliverables': ['Completed FE-001', 'Completed FE-002', 'Completed FE-003', 'Completed FE-004', 'Completed FE-005', 'Completed FE-006', 'Completed FE-007', 'Completed FE-008', 'Completed FE-009', 'Completed TEST-001', 'Completed DEPLOY-003'], 'estimated_duration_hours': 50.0, 'work_items': [{'id': 'FE-001', 'description': 'Set up React project with Create React App.', 'dependencies': [], 'estimated_time': '2 hours', 'agent_role': 'frontend_developer', 'acceptance_criteria': ['Project is initialized using Create React App.', 'Project builds without errors.', \"Default 'Hello World' page is displayed.\"], 'status': 'pending', 'code_files': ['package.json', 'src/App.js', 'src/index.js', 'public/index.html']}, {'id': 'FE-002', 'description': 'Create a basic task input form (text field and add button).', 'dependencies': ['FE-001'], 'estimated_time': '4 hours', 'agent_role': 'frontend_developer', 'acceptance_criteria': ['Form with a text input field exists.', 'Add button exists.', 'Input field accepts text input.'], 'status': 'pending', 'code_files': ['src/App.js']}, {'id': 'FE-003', 'description': 'Create a component to display the task list.', 'dependencies': ['FE-001'], 'estimated_time': '4 hours', 'agent_role': 'frontend_developer', 'acceptance_criteria': ['Task list component renders.', 'Component accepts an array of tasks as props.', 'Each task is displayed in a list item.'], 'status': 'pending', 'code_files': ['src/App.js', 'src/TaskList.js']}, {'id': 'FE-004', 'description': 'Implement state management for tasks (using useState).', 'dependencies': ['FE-002', 'FE-003'], 'estimated_time': '4 hours', 'agent_role': 'frontend_developer', 'acceptance_criteria': ['Tasks are stored in component state.', 'Tasks are updated when a new task is added.', 'Task list component re-renders when tasks change.'], 'status': 'pending', 'code_files': ['src/App.js']}, {'id': 'FE-005', 'description': \"Implement the 'add task' functionality (on button click).\", 'dependencies': ['FE-002', 'FE-004'], 'estimated_time': '4 hours', 'agent_role': 'frontend_developer', 'acceptance_criteria': ['When the add button is clicked, a new task is added to the task list.', \"The new task's description is taken from the input field.\", 'The input field is cleared after adding a task.'], 'status': 'pending', 'code_files': ['src/App.js']}, {'id': 'FE-006', 'description': 'Implement API calls to the backend (POST /tasks).', 'dependencies': ['FE-005', 'BE-004'], 'estimated_time': '6 hours', 'agent_role': 'frontend_developer', 'acceptance_criteria': ['Frontend makes a POST request to /api/v1/tasks when the add button is clicked.', 'Request body includes the task description.', 'Frontend handles the 201 Created response (adds the new task to the list).', 'Frontend handles 400 Bad Request responses (displays error messages).'], 'status': 'pending', 'code_files': ['src/App.js']}, {'id': 'FE-007', 'description': 'Implement API calls to the backend (GET /tasks).', 'dependencies': ['FE-003', 'BE-005'], 'estimated_time': '6 hours', 'agent_role': 'frontend_developer', 'acceptance_criteria': ['Frontend makes a GET request to /api/v1/tasks when the component mounts.', 'Frontend displays the tasks retrieved from the API.', 'Frontend handles errors gracefully.'], 'status': 'pending', 'code_files': ['src/App.js']}, {'id': 'FE-008', 'description': 'Add basic styling to the task list and form.', 'dependencies': ['FE-002', 'FE-003', 'FE-007'], 'estimated_time': '4 hours', 'agent_role': 'frontend_developer', 'acceptance_criteria': ['Task list is styled to be readable.', 'Form is styled to be visually appealing.', 'Styling is consistent across the application.'], 'status': 'pending', 'code_files': ['src/App.css', 'src/TaskList.css']}, {'id': 'FE-009', 'description': 'Implement error handling on the frontend.', 'dependencies': ['FE-006', 'FE-007'], 'estimated_time': '4 hours', 'agent_role': 'frontend_developer', 'acceptance_criteria': ['Frontend displays error messages from the backend.', 'Frontend handles network errors gracefully.', 'Error messages are user-friendly.'], 'status': 'pending', 'code_files': ['src/App.js']}, {'id': 'TEST-001', 'description': 'Write unit tests for the frontend components.', 'dependencies': ['FE-003', 'FE-004', 'FE-005', 'FE-006', 'FE-007'], 'estimated_time': '8 hours', 'agent_role': 'frontend_developer', 'acceptance_criteria': ['Unit tests cover the TaskList component.', \"Unit tests cover the App component's state management.\", 'Unit tests cover the API call implementations.', 'Tests use a testing framework (e.g., Jest).', 'Tests pass.'], 'status': 'pending', 'code_files': ['src/App.test.js', 'src/TaskList.test.js']}, {'id': 'DEPLOY-003', 'description': 'Deploy the frontend to Heroku.', 'dependencies': ['FE-001', 'FE-006', 'FE-007', 'DEPLOY-001', 'DEPLOY-002'], 'estimated_time': '4 hours', 'agent_role': 'frontend_developer', 'acceptance_criteria': ['Frontend code is deployed to Heroku.', 'Frontend is configured to call the backend API on Heroku.', 'Frontend is accessible via a Heroku URL.'], 'status': 'pending', 'code_files': ['package.json']}]}, {'name': 'Backend Phase', 'description': 'Tasks related to backend phase', 'deliverables': ['Completed BE-001', 'Completed BE-002', 'Completed BE-004', 'Completed BE-005', 'Completed BE-006', 'Completed BE-007', 'Completed TEST-002', 'Completed DEPLOY-001', 'Completed DEPLOY-002', 'Completed DEPLOY-004'], 'estimated_duration_hours': 46.0, 'work_items': [{'id': 'BE-001', 'description': 'Set up Node.js/Express project.', 'dependencies': [], 'estimated_time': '2 hours', 'agent_role': 'backend_developer', 'acceptance_criteria': ['Project is initialized with npm.', 'Express is installed as a dependency.', \"Basic server setup with a route that responds with 'Hello World'.\"], 'status': 'pending', 'code_files': ['package.json', 'index.js']}, {'id': 'BE-002', 'description': 'Install and configure PostgreSQL and a client library (pg).', 'dependencies': ['BE-001'], 'estimated_time': '4 hours', 'agent_role': 'backend_developer', 'acceptance_criteria': ['PostgreSQL is installed and running (locally or remotely).', 'pg library is installed.', 'Connection to the database is established successfully.'], 'status': 'pending', 'code_files': ['package.json', 'index.js']}, {'id': 'BE-004', 'description': 'Implement the POST /tasks endpoint (create a task).', 'dependencies': ['BE-001', 'BE-002', 'BE-003'], 'estimated_time': '8 hours', 'agent_role': 'backend_developer', 'acceptance_criteria': ['Endpoint handles POST requests to /tasks.', \"Endpoint receives a 'description' in the request body.\", \"Endpoint validates the 'description' (required).\", 'Endpoint inserts the task into the database.', 'Endpoint returns a 201 Created status with the created task (including id and created_at).', 'Endpoint returns a 400 Bad Request if the description is missing.'], 'status': 'pending', 'code_files': ['index.js']}, {'id': 'BE-005', 'description': 'Implement the GET /tasks endpoint (get all tasks).', 'dependencies': ['BE-001', 'BE-002', 'BE-003'], 'estimated_time': '6 hours', 'agent_role': 'backend_developer', 'acceptance_criteria': ['Endpoint handles GET requests to /tasks.', 'Endpoint retrieves all tasks from the database.', 'Endpoint returns a 200 OK status with a JSON array of tasks.', 'Tasks include id, description, and created_at.'], 'status': 'pending', 'code_files': ['index.js']}, {'id': 'BE-006', 'description': 'Implement input validation on the backend.', 'dependencies': ['BE-004'], 'estimated_time': '4 hours', 'agent_role': 'backend_developer', 'acceptance_criteria': [\"Backend validates the 'description' field (required).\", 'Backend returns a 400 Bad Request with an error message if validation fails.', 'Validation prevents empty task descriptions.'], 'status': 'pending', 'code_files': ['index.js']}, {'id': 'BE-007', 'description': 'Implement error handling on the backend.', 'dependencies': ['BE-004', 'BE-005'], 'estimated_time': '4 hours', 'agent_role': 'backend_developer', 'acceptance_criteria': ['Backend handles database connection errors.', 'Backend handles query execution errors.', 'Backend returns appropriate HTTP status codes for errors (e.g., 500 Internal Server Error).', 'Error responses include informative error messages.'], 'status': 'pending', 'code_files': ['index.js']}, {'id': 'TEST-002', 'description': 'Write integration tests for the backend API endpoints.', 'dependencies': ['BE-004', 'BE-005'], 'estimated_time': '8 hours', 'agent_role': 'backend_developer', 'acceptance_criteria': ['Integration tests for the POST /tasks endpoint.', 'Integration tests for the GET /tasks endpoint.', 'Tests use a testing framework (e.g., Jest, Supertest).', 'Tests cover success and failure scenarios.', 'Tests pass.'], 'status': 'pending', 'code_files': ['test/api.test.js']}, {'id': 'DEPLOY-001', 'description': 'Set up Heroku for deployment.', 'dependencies': ['BE-001', 'FE-001'], 'estimated_time': '4 hours', 'agent_role': 'backend_developer', 'acceptance_criteria': ['Heroku account is created.', 'Heroku CLI is installed.', 'Heroku app is created.', 'PostgreSQL add-on is provisioned on Heroku.'], 'status': 'pending', 'code_files': ['Procfile']}, {'id': 'DEPLOY-002', 'description': 'Deploy the backend to Heroku.', 'dependencies': ['BE-001', 'BE-002', 'BE-003', 'BE-004', 'BE-005', 'DEPLOY-001'], 'estimated_time': '4 hours', 'agent_role': 'backend_developer', 'acceptance_criteria': ['Backend code is deployed to Heroku.', 'Database connection is configured on Heroku.', 'Backend API is accessible via a Heroku URL.'], 'status': 'pending', 'code_files': ['Procfile']}, {'id': 'DEPLOY-004', 'description': 'Configure environment variables for database connection.', 'dependencies': ['DEPLOY-002'], 'estimated_time': '2 hours', 'agent_role': 'backend_developer', 'acceptance_criteria': ['Database connection details are not hardcoded.', 'Database connection details are read from environment variables on Heroku.', 'Application connects to the database successfully on Heroku.'], 'status': 'pending', 'code_files': ['index.js']}]}, {'name': 'Database Phase', 'description': 'Tasks related to database phase', 'deliverables': ['Completed BE-003'], 'estimated_duration_hours': 4.0, 'work_items': [{'id': 'BE-003', 'description': \"Create the 'tasks' table in PostgreSQL.\", 'dependencies': ['BE-002'], 'estimated_time': '4 hours', 'agent_role': 'database_specialist', 'acceptance_criteria': [\"Table named 'tasks' exists.\", \"Table has 'id' (SERIAL PRIMARY KEY), 'description' (VARCHAR), and 'created_at' (TIMESTAMP) columns.\", 'Table schema is correct.'], 'status': 'pending', 'code_files': ['db/schema.sql']}]}], resource_allocation=[{'role': 'Backend Developer', 'count': 1, 'estimated_time_allocation': '100%', 'phases': ['Backend Phase'], 'skills_required': []}, {'role': 'Frontend Developer', 'count': 1, 'estimated_time_allocation': '100%', 'phases': ['Frontend Phase'], 'skills_required': []}, {'role': 'Database Specialist', 'count': 1, 'estimated_time_allocation': '100%', 'phases': ['Database Phase'], 'skills_required': []}], risks_and_mitigations=[], timeline={'start_date': '2025-07-08T14:22:05.376975', 'end_date': 'TBD', 'milestones': []}, tech_stack={}, metadata={'generated_at': '2025-07-08T14:22:05.376975', 'version': '1.0', 'author': 'Multi-AI Dev System', 'tags': [], 'notes': 'Converted from WorkItemBacklog. Original summary: Develop a simple web application for managing a list of tasks, including adding and viewing tasks. The application will use React for the frontend, Node.js/Express for the backend, and PostgreSQL for the database. The application will be deployed to Heroku.'}) summary='Develop a simple web application for managing a list of tasks, including adding and viewing tasks. The application will use React for the frontend, Node.js/Express for the backend, and PostgreSQL for the database. The application will be deployed to Heroku.' metadata=PlanMetadata(generated_at='2025-07-08T14:22:05.376975', version='1.0', author='Multi-AI Dev System', tags=[], notes='Converted from WorkItemBacklog. Original summary: Develop a simple web application for managing a list of tasks, including adding and viewing tasks. The application will use React for the frontend, Node.js/Express for the backend, and PostgreSQL for the database. The application will be deployed to Heroku.')"
  }
}