{
  "session_id": "session_76300b4b-e11c-4d65-b2f8-e60d238bbea6",
  "approval_type": "implementation_plan",
  "timestamp": 1751967095,
  "approval_data": {
    "type": "implementation_plan",
    "timestamp": 1751967095.8587148,
    "project_overview": "Develop a simple web application for managing a task list, including frontend UI, backend API, and database. The application allows users to add and view tasks. The project will be deployed to AWS using a monolithic architecture.",
    "development_phases": [
      {
        "name": "Frontend Phase",
        "description": "Tasks related to frontend phase",
        "deliverables": [
          "Completed FE-001",
          "Completed FE-002",
          "Completed FE-003",
          "Completed FE-004",
          "Completed FE-005",
          "Completed FE-006",
          "Completed FE-007",
          "Completed UT-001"
        ],
        "estimated_duration_hours": 48.0,
        "work_items": [
          {
            "id": "FE-001",
            "description": "Set up React project using Create React App.",
            "dependencies": [],
            "estimated_time": "4 hours",
            "agent_role": "frontend_developer",
            "acceptance_criteria": [
              "Project is initialized successfully.",
              "Default React app runs without errors."
            ],
            "status": "pending",
            "code_files": [
              "package.json",
              "src/App.js",
              "src/index.js"
            ]
          },
          {
            "id": "FE-002",
            "description": "Install React Router for navigation.",
            "dependencies": [
              "FE-001"
            ],
            "estimated_time": "2 hours",
            "agent_role": "frontend_developer",
            "acceptance_criteria": [
              "React Router is installed.",
              "Basic routing is configured (e.g., home page)."
            ],
            "status": "pending",
            "code_files": [
              "package.json",
              "src/App.js"
            ]
          },
          {
            "id": "FE-003",
            "description": "Install Axios for making API calls.",
            "dependencies": [
              "FE-001"
            ],
            "estimated_time": "2 hours",
            "agent_role": "frontend_developer",
            "acceptance_criteria": [
              "Axios is installed.",
              "A sample API call can be made (e.g., to a dummy API)."
            ],
            "status": "pending",
            "code_files": [
              "package.json",
              "src/App.js"
            ]
          },
          {
            "id": "FE-004",
            "description": "Design and implement the UI for adding a task (form).",
            "dependencies": [
              "FE-001"
            ],
            "estimated_time": "8 hours",
            "agent_role": "frontend_developer",
            "acceptance_criteria": [
              "UI form for entering task description exists.",
              "Form fields are styled appropriately.",
              "Submit button is present."
            ],
            "status": "pending",
            "code_files": [
              "src/App.js",
              "src/components/AddTaskForm.js",
              "src/App.css"
            ]
          },
          {
            "id": "FE-005",
            "description": "Design and implement the UI for displaying the task list.",
            "dependencies": [
              "FE-001"
            ],
            "estimated_time": "8 hours",
            "agent_role": "frontend_developer",
            "acceptance_criteria": [
              "Task list container exists.",
              "Tasks are displayed in a list format (e.g., unordered list).",
              "Each task displays its description."
            ],
            "status": "pending",
            "code_files": [
              "src/App.js",
              "src/components/TaskList.js",
              "src/App.css"
            ]
          },
          {
            "id": "FE-006",
            "description": "Implement the functionality to add a new task (frontend).",
            "dependencies": [
              "FE-003",
              "FE-004",
              "BE-004"
            ],
            "estimated_time": "8 hours",
            "agent_role": "frontend_developer",
            "acceptance_criteria": [
              "User can enter a task description in the form.",
              "On form submission, an API call is made to the backend to create a task.",
              "The task list is updated to reflect the new task after a successful API call.",
              "Error messages are displayed if the API call fails."
            ],
            "status": "pending",
            "code_files": [
              "src/App.js",
              "src/components/AddTaskForm.js"
            ]
          },
          {
            "id": "FE-007",
            "description": "Implement the functionality to fetch and display the task list (frontend).",
            "dependencies": [
              "FE-003",
              "FE-005",
              "BE-005"
            ],
            "estimated_time": "8 hours",
            "agent_role": "frontend_developer",
            "acceptance_criteria": [
              "On component mount, an API call is made to the backend to fetch the task list.",
              "The task list is displayed correctly.",
              "Error messages are displayed if the API call fails."
            ],
            "status": "pending",
            "code_files": [
              "src/App.js",
              "src/components/TaskList.js"
            ]
          },
          {
            "id": "UT-001",
            "description": "Write unit tests for the frontend components.",
            "dependencies": [
              "FE-001",
              "FE-004",
              "FE-005"
            ],
            "estimated_time": "8 hours",
            "agent_role": "frontend_developer",
            "acceptance_criteria": [
              "Tests are written for the AddTaskForm component.",
              "Tests are written for the TaskList component.",
              "Tests cover component rendering and basic functionality.",
              "Tests pass."
            ],
            "status": "pending",
            "code_files": [
              "src/components/AddTaskForm.test.js",
              "src/components/TaskList.test.js"
            ]
          }
        ]
      },
      {
        "name": "Backend Phase",
        "description": "Tasks related to backend phase",
        "deliverables": [
          "Completed BE-001",
          "Completed BE-002",
          "Completed BE-004",
          "Completed BE-005",
          "Completed IT-001",
          "Completed UT-002",
          "Completed SC-001"
        ],
        "estimated_duration_hours": 42.0,
        "work_items": [
          {
            "id": "BE-001",
            "description": "Set up Node.js and Express project.",
            "dependencies": [],
            "estimated_time": "4 hours",
            "agent_role": "backend_developer",
            "acceptance_criteria": [
              "Project is initialized successfully.",
              "Express server runs without errors.",
              "Basic route (e.g., '/') responds with 'Hello World'."
            ],
            "status": "pending",
            "code_files": [
              "package.json",
              "index.js"
            ]
          },
          {
            "id": "BE-002",
            "description": "Install necessary packages (body-parser, cors).",
            "dependencies": [
              "BE-001"
            ],
            "estimated_time": "2 hours",
            "agent_role": "backend_developer",
            "acceptance_criteria": [
              "body-parser and cors are installed.",
              "CORS is configured to allow requests from the frontend (e.g., localhost:3000)."
            ],
            "status": "pending",
            "code_files": [
              "package.json",
              "index.js"
            ]
          },
          {
            "id": "BE-004",
            "description": "Implement API endpoint to create a new task (/api/v1/tasks).",
            "dependencies": [
              "BE-002",
              "BE-003"
            ],
            "estimated_time": "8 hours",
            "agent_role": "backend_developer",
            "acceptance_criteria": [
              "Endpoint accepts POST requests to /api/v1/tasks.",
              "Endpoint validates the 'description' parameter.",
              "Endpoint inserts the task into the database.",
              "Endpoint returns a 201 Created status with the created task (including id and created_at) on success.",
              "Endpoint returns a 400 Bad Request status with an error message on validation failure."
            ],
            "status": "pending",
            "code_files": [
              "index.js",
              "db/queries.js"
            ]
          },
          {
            "id": "BE-005",
            "description": "Implement API endpoint to get all tasks (/api/v1/tasks).",
            "dependencies": [
              "BE-002",
              "BE-003"
            ],
            "estimated_time": "8 hours",
            "agent_role": "backend_developer",
            "acceptance_criteria": [
              "Endpoint accepts GET requests to /api/v1/tasks.",
              "Endpoint retrieves all tasks from the database.",
              "Endpoint returns a 200 OK status with a JSON array of tasks.",
              "Endpoint handles database errors and returns a 500 Internal Server Error status."
            ],
            "status": "pending",
            "code_files": [
              "index.js",
              "db/queries.js"
            ]
          },
          {
            "id": "IT-001",
            "description": "Connect frontend to backend API (integration testing).",
            "dependencies": [
              "FE-006",
              "FE-007",
              "BE-004",
              "BE-005"
            ],
            "estimated_time": "8 hours",
            "agent_role": "backend_developer",
            "acceptance_criteria": [
              "Frontend successfully calls the /api/v1/tasks endpoint to create a task.",
              "Frontend successfully calls the /api/v1/tasks endpoint to retrieve tasks.",
              "Data is correctly passed between frontend and backend.",
              "Error handling is implemented on both frontend and backend."
            ],
            "status": "pending",
            "code_files": [
              "src/App.js",
              "index.js"
            ]
          },
          {
            "id": "UT-002",
            "description": "Write unit tests for the backend API endpoints.",
            "dependencies": [
              "BE-004",
              "BE-005"
            ],
            "estimated_time": "8 hours",
            "agent_role": "backend_developer",
            "acceptance_criteria": [
              "Tests are written for the /api/v1/tasks POST endpoint.",
              "Tests are written for the /api/v1/tasks GET endpoint.",
              "Tests cover request validation, database interactions, and response codes.",
              "Tests pass."
            ],
            "status": "pending",
            "code_files": [
              "tests/api.test.js"
            ]
          },
          {
            "id": "SC-001",
            "description": "Implement input validation on the backend.",
            "dependencies": [
              "BE-004"
            ],
            "estimated_time": "4 hours",
            "agent_role": "backend_developer",
            "acceptance_criteria": [
              "Input validation is implemented for the task description.",
              "Invalid input results in a 400 Bad Request response.",
              "Parameterized queries are used to prevent SQL injection."
            ],
            "status": "pending",
            "code_files": [
              "index.js",
              "db/queries.js"
            ]
          }
        ]
      },
      {
        "name": "Database Phase",
        "description": "Tasks related to database phase",
        "deliverables": [
          "Completed BE-003"
        ],
        "estimated_duration_hours": 4.0,
        "work_items": [
          {
            "id": "BE-003",
            "description": "Set up PostgreSQL database and create the 'tasks' table.",
            "dependencies": [],
            "estimated_time": "4 hours",
            "agent_role": "database_specialist",
            "acceptance_criteria": [
              "PostgreSQL database is installed and running.",
              "Database named 'task_list_db' is created.",
              "Table 'tasks' is created with columns: id (UUID, PRIMARY KEY), description (TEXT), created_at (TIMESTAMP)."
            ],
            "status": "pending",
            "code_files": [
              "db/schema.sql"
            ]
          }
        ]
      },
      {
        "name": "Devops_Engineer Phase",
        "description": "Tasks related to devops_engineer phase",
        "deliverables": [
          "Completed DP-001",
          "Completed DP-002",
          "Completed DP-003",
          "Completed MN-001",
          "Completed SC-002"
        ],
        "estimated_duration_hours": 28.0,
        "work_items": [
          {
            "id": "DP-001",
            "description": "Deploy frontend to AWS S3 and configure CloudFront.",
            "dependencies": [
              "IT-001"
            ],
            "estimated_time": "8 hours",
            "agent_role": "devops_engineer",
            "acceptance_criteria": [
              "Frontend code is built and deployed to an S3 bucket.",
              "CloudFront distribution is created and configured to serve the frontend.",
              "The application is accessible via the CloudFront URL.",
              "HTTPS is enabled."
            ],
            "status": "pending",
            "code_files": []
          },
          {
            "id": "DP-002",
            "description": "Deploy backend to AWS EC2.",
            "dependencies": [
              "IT-001",
              "BE-003"
            ],
            "estimated_time": "8 hours",
            "agent_role": "devops_engineer",
            "acceptance_criteria": [
              "EC2 instance is created and configured.",
              "Node.js and necessary dependencies are installed on the EC2 instance.",
              "Backend code is deployed to the EC2 instance.",
              "The backend API is running and accessible.",
              "HTTPS is enabled."
            ],
            "status": "pending",
            "code_files": []
          },
          {
            "id": "DP-003",
            "description": "Deploy PostgreSQL database to AWS RDS.",
            "dependencies": [
              "BE-003"
            ],
            "estimated_time": "4 hours",
            "agent_role": "devops_engineer",
            "acceptance_criteria": [
              "RDS instance is created and configured.",
              "PostgreSQL database is created on the RDS instance.",
              "Database connection details are configured in the backend application.",
              "Database is accessible from the EC2 instance."
            ],
            "status": "pending",
            "code_files": []
          },
          {
            "id": "MN-001",
            "description": "Set up basic monitoring with AWS CloudWatch.",
            "dependencies": [
              "DP-001",
              "DP-002",
              "DP-003"
            ],
            "estimated_time": "4 hours",
            "agent_role": "devops_engineer",
            "acceptance_criteria": [
              "CloudWatch is configured to monitor EC2 instance CPU utilization, memory usage, and network traffic.",
              "CloudWatch is configured to monitor RDS instance CPU utilization, memory usage, and database connections.",
              "Basic logging is implemented in the backend application and logs are sent to CloudWatch Logs."
            ],
            "status": "pending",
            "code_files": [
              "index.js"
            ]
          },
          {
            "id": "SC-002",
            "description": "Enforce HTTPS for all communication.",
            "dependencies": [
              "DP-001",
              "DP-002"
            ],
            "estimated_time": "4 hours",
            "agent_role": "devops_engineer",
            "acceptance_criteria": [
              "HTTPS is enforced for the CloudFront distribution.",
              "HTTPS is configured for the EC2 instance (e.g., using Let's Encrypt)."
            ],
            "status": "pending",
            "code_files": []
          }
        ]
      }
    ],
    "timeline_estimation": {
      "start_date": "2025-07-08T15:01:34.974756",
      "end_date": "TBD",
      "milestones": []
    },
    "risk_assessment": [],
    "resource_requirements": [
      {
        "role": "Backend Developer",
        "count": 1,
        "estimated_time_allocation": "100%",
        "phases": [
          "Backend Phase"
        ],
        "skills_required": []
      },
      {
        "role": "Devops Engineer",
        "count": 1,
        "estimated_time_allocation": "100%",
        "phases": [
          "Devops_Engineer Phase"
        ],
        "skills_required": []
      },
      {
        "role": "Database Specialist",
        "count": 1,
        "estimated_time_allocation": "100%",
        "phases": [
          "Database Phase"
        ],
        "skills_required": []
      },
      {
        "role": "Frontend Developer",
        "count": 1,
        "estimated_time_allocation": "100%",
        "phases": [
          "Frontend Phase"
        ],
        "skills_required": []
      }
    ],
    "deliverables": [
      "Completed FE-001",
      "Completed FE-002",
      "Completed FE-003",
      "Completed FE-004",
      "Completed FE-005",
      "Completed FE-006",
      "Completed FE-007",
      "Completed UT-001",
      "Completed BE-001",
      "Completed BE-002",
      "Completed BE-004",
      "Completed BE-005",
      "Completed IT-001",
      "Completed UT-002",
      "Completed SC-001",
      "Completed BE-003",
      "Completed DP-001",
      "Completed DP-002",
      "Completed DP-003",
      "Completed MN-001",
      "Completed SC-002"
    ],
    "dependencies": [],
    "raw_plan": "plan=ImplementationPlan(project_summary={'title': 'Generated Project Plan', 'description': 'Develop a simple web application for managing a task list, including frontend UI, backend API, and database. The application allows users to add and view tasks. The project will be deployed to AWS using a monolithic architecture.', 'overall_complexity': 'Medium', 'estimated_duration': 'TBD', 'key_challenges': [], 'success_criteria': []}, phases=[{'name': 'Frontend Phase', 'description': 'Tasks related to frontend phase', 'deliverables': ['Completed FE-001', 'Completed FE-002', 'Completed FE-003', 'Completed FE-004', 'Completed FE-005', 'Completed FE-006', 'Completed FE-007', 'Completed UT-001'], 'estimated_duration_hours': 48.0, 'work_items': [{'id': 'FE-001', 'description': 'Set up React project using Create React App.', 'dependencies': [], 'estimated_time': '4 hours', 'agent_role': 'frontend_developer', 'acceptance_criteria': ['Project is initialized successfully.', 'Default React app runs without errors.'], 'status': 'pending', 'code_files': ['package.json', 'src/App.js', 'src/index.js']}, {'id': 'FE-002', 'description': 'Install React Router for navigation.', 'dependencies': ['FE-001'], 'estimated_time': '2 hours', 'agent_role': 'frontend_developer', 'acceptance_criteria': ['React Router is installed.', 'Basic routing is configured (e.g., home page).'], 'status': 'pending', 'code_files': ['package.json', 'src/App.js']}, {'id': 'FE-003', 'description': 'Install Axios for making API calls.', 'dependencies': ['FE-001'], 'estimated_time': '2 hours', 'agent_role': 'frontend_developer', 'acceptance_criteria': ['Axios is installed.', 'A sample API call can be made (e.g., to a dummy API).'], 'status': 'pending', 'code_files': ['package.json', 'src/App.js']}, {'id': 'FE-004', 'description': 'Design and implement the UI for adding a task (form).', 'dependencies': ['FE-001'], 'estimated_time': '8 hours', 'agent_role': 'frontend_developer', 'acceptance_criteria': ['UI form for entering task description exists.', 'Form fields are styled appropriately.', 'Submit button is present.'], 'status': 'pending', 'code_files': ['src/App.js', 'src/components/AddTaskForm.js', 'src/App.css']}, {'id': 'FE-005', 'description': 'Design and implement the UI for displaying the task list.', 'dependencies': ['FE-001'], 'estimated_time': '8 hours', 'agent_role': 'frontend_developer', 'acceptance_criteria': ['Task list container exists.', 'Tasks are displayed in a list format (e.g., unordered list).', 'Each task displays its description.'], 'status': 'pending', 'code_files': ['src/App.js', 'src/components/TaskList.js', 'src/App.css']}, {'id': 'FE-006', 'description': 'Implement the functionality to add a new task (frontend).', 'dependencies': ['FE-003', 'FE-004', 'BE-004'], 'estimated_time': '8 hours', 'agent_role': 'frontend_developer', 'acceptance_criteria': ['User can enter a task description in the form.', 'On form submission, an API call is made to the backend to create a task.', 'The task list is updated to reflect the new task after a successful API call.', 'Error messages are displayed if the API call fails.'], 'status': 'pending', 'code_files': ['src/App.js', 'src/components/AddTaskForm.js']}, {'id': 'FE-007', 'description': 'Implement the functionality to fetch and display the task list (frontend).', 'dependencies': ['FE-003', 'FE-005', 'BE-005'], 'estimated_time': '8 hours', 'agent_role': 'frontend_developer', 'acceptance_criteria': ['On component mount, an API call is made to the backend to fetch the task list.', 'The task list is displayed correctly.', 'Error messages are displayed if the API call fails.'], 'status': 'pending', 'code_files': ['src/App.js', 'src/components/TaskList.js']}, {'id': 'UT-001', 'description': 'Write unit tests for the frontend components.', 'dependencies': ['FE-001', 'FE-004', 'FE-005'], 'estimated_time': '8 hours', 'agent_role': 'frontend_developer', 'acceptance_criteria': ['Tests are written for the AddTaskForm component.', 'Tests are written for the TaskList component.', 'Tests cover component rendering and basic functionality.', 'Tests pass.'], 'status': 'pending', 'code_files': ['src/components/AddTaskForm.test.js', 'src/components/TaskList.test.js']}]}, {'name': 'Backend Phase', 'description': 'Tasks related to backend phase', 'deliverables': ['Completed BE-001', 'Completed BE-002', 'Completed BE-004', 'Completed BE-005', 'Completed IT-001', 'Completed UT-002', 'Completed SC-001'], 'estimated_duration_hours': 42.0, 'work_items': [{'id': 'BE-001', 'description': 'Set up Node.js and Express project.', 'dependencies': [], 'estimated_time': '4 hours', 'agent_role': 'backend_developer', 'acceptance_criteria': ['Project is initialized successfully.', 'Express server runs without errors.', \"Basic route (e.g., '/') responds with 'Hello World'.\"], 'status': 'pending', 'code_files': ['package.json', 'index.js']}, {'id': 'BE-002', 'description': 'Install necessary packages (body-parser, cors).', 'dependencies': ['BE-001'], 'estimated_time': '2 hours', 'agent_role': 'backend_developer', 'acceptance_criteria': ['body-parser and cors are installed.', 'CORS is configured to allow requests from the frontend (e.g., localhost:3000).'], 'status': 'pending', 'code_files': ['package.json', 'index.js']}, {'id': 'BE-004', 'description': 'Implement API endpoint to create a new task (/api/v1/tasks).', 'dependencies': ['BE-002', 'BE-003'], 'estimated_time': '8 hours', 'agent_role': 'backend_developer', 'acceptance_criteria': ['Endpoint accepts POST requests to /api/v1/tasks.', \"Endpoint validates the 'description' parameter.\", 'Endpoint inserts the task into the database.', 'Endpoint returns a 201 Created status with the created task (including id and created_at) on success.', 'Endpoint returns a 400 Bad Request status with an error message on validation failure.'], 'status': 'pending', 'code_files': ['index.js', 'db/queries.js']}, {'id': 'BE-005', 'description': 'Implement API endpoint to get all tasks (/api/v1/tasks).', 'dependencies': ['BE-002', 'BE-003'], 'estimated_time': '8 hours', 'agent_role': 'backend_developer', 'acceptance_criteria': ['Endpoint accepts GET requests to /api/v1/tasks.', 'Endpoint retrieves all tasks from the database.', 'Endpoint returns a 200 OK status with a JSON array of tasks.', 'Endpoint handles database errors and returns a 500 Internal Server Error status.'], 'status': 'pending', 'code_files': ['index.js', 'db/queries.js']}, {'id': 'IT-001', 'description': 'Connect frontend to backend API (integration testing).', 'dependencies': ['FE-006', 'FE-007', 'BE-004', 'BE-005'], 'estimated_time': '8 hours', 'agent_role': 'backend_developer', 'acceptance_criteria': ['Frontend successfully calls the /api/v1/tasks endpoint to create a task.', 'Frontend successfully calls the /api/v1/tasks endpoint to retrieve tasks.', 'Data is correctly passed between frontend and backend.', 'Error handling is implemented on both frontend and backend.'], 'status': 'pending', 'code_files': ['src/App.js', 'index.js']}, {'id': 'UT-002', 'description': 'Write unit tests for the backend API endpoints.', 'dependencies': ['BE-004', 'BE-005'], 'estimated_time': '8 hours', 'agent_role': 'backend_developer', 'acceptance_criteria': ['Tests are written for the /api/v1/tasks POST endpoint.', 'Tests are written for the /api/v1/tasks GET endpoint.', 'Tests cover request validation, database interactions, and response codes.', 'Tests pass.'], 'status': 'pending', 'code_files': ['tests/api.test.js']}, {'id': 'SC-001', 'description': 'Implement input validation on the backend.', 'dependencies': ['BE-004'], 'estimated_time': '4 hours', 'agent_role': 'backend_developer', 'acceptance_criteria': ['Input validation is implemented for the task description.', 'Invalid input results in a 400 Bad Request response.', 'Parameterized queries are used to prevent SQL injection.'], 'status': 'pending', 'code_files': ['index.js', 'db/queries.js']}]}, {'name': 'Database Phase', 'description': 'Tasks related to database phase', 'deliverables': ['Completed BE-003'], 'estimated_duration_hours': 4.0, 'work_items': [{'id': 'BE-003', 'description': \"Set up PostgreSQL database and create the 'tasks' table.\", 'dependencies': [], 'estimated_time': '4 hours', 'agent_role': 'database_specialist', 'acceptance_criteria': ['PostgreSQL database is installed and running.', \"Database named 'task_list_db' is created.\", \"Table 'tasks' is created with columns: id (UUID, PRIMARY KEY), description (TEXT), created_at (TIMESTAMP).\"], 'status': 'pending', 'code_files': ['db/schema.sql']}]}, {'name': 'Devops_Engineer Phase', 'description': 'Tasks related to devops_engineer phase', 'deliverables': ['Completed DP-001', 'Completed DP-002', 'Completed DP-003', 'Completed MN-001', 'Completed SC-002'], 'estimated_duration_hours': 28.0, 'work_items': [{'id': 'DP-001', 'description': 'Deploy frontend to AWS S3 and configure CloudFront.', 'dependencies': ['IT-001'], 'estimated_time': '8 hours', 'agent_role': 'devops_engineer', 'acceptance_criteria': ['Frontend code is built and deployed to an S3 bucket.', 'CloudFront distribution is created and configured to serve the frontend.', 'The application is accessible via the CloudFront URL.', 'HTTPS is enabled.'], 'status': 'pending', 'code_files': []}, {'id': 'DP-002', 'description': 'Deploy backend to AWS EC2.', 'dependencies': ['IT-001', 'BE-003'], 'estimated_time': '8 hours', 'agent_role': 'devops_engineer', 'acceptance_criteria': ['EC2 instance is created and configured.', 'Node.js and necessary dependencies are installed on the EC2 instance.', 'Backend code is deployed to the EC2 instance.', 'The backend API is running and accessible.', 'HTTPS is enabled.'], 'status': 'pending', 'code_files': []}, {'id': 'DP-003', 'description': 'Deploy PostgreSQL database to AWS RDS.', 'dependencies': ['BE-003'], 'estimated_time': '4 hours', 'agent_role': 'devops_engineer', 'acceptance_criteria': ['RDS instance is created and configured.', 'PostgreSQL database is created on the RDS instance.', 'Database connection details are configured in the backend application.', 'Database is accessible from the EC2 instance.'], 'status': 'pending', 'code_files': []}, {'id': 'MN-001', 'description': 'Set up basic monitoring with AWS CloudWatch.', 'dependencies': ['DP-001', 'DP-002', 'DP-003'], 'estimated_time': '4 hours', 'agent_role': 'devops_engineer', 'acceptance_criteria': ['CloudWatch is configured to monitor EC2 instance CPU utilization, memory usage, and network traffic.', 'CloudWatch is configured to monitor RDS instance CPU utilization, memory usage, and database connections.', 'Basic logging is implemented in the backend application and logs are sent to CloudWatch Logs.'], 'status': 'pending', 'code_files': ['index.js']}, {'id': 'SC-002', 'description': 'Enforce HTTPS for all communication.', 'dependencies': ['DP-001', 'DP-002'], 'estimated_time': '4 hours', 'agent_role': 'devops_engineer', 'acceptance_criteria': ['HTTPS is enforced for the CloudFront distribution.', \"HTTPS is configured for the EC2 instance (e.g., using Let's Encrypt).\"], 'status': 'pending', 'code_files': []}]}], resource_allocation=[{'role': 'Backend Developer', 'count': 1, 'estimated_time_allocation': '100%', 'phases': ['Backend Phase'], 'skills_required': []}, {'role': 'Devops Engineer', 'count': 1, 'estimated_time_allocation': '100%', 'phases': ['Devops_Engineer Phase'], 'skills_required': []}, {'role': 'Database Specialist', 'count': 1, 'estimated_time_allocation': '100%', 'phases': ['Database Phase'], 'skills_required': []}, {'role': 'Frontend Developer', 'count': 1, 'estimated_time_allocation': '100%', 'phases': ['Frontend Phase'], 'skills_required': []}], risks_and_mitigations=[], timeline={'start_date': '2025-07-08T15:01:34.974756', 'end_date': 'TBD', 'milestones': []}, tech_stack={}, metadata={'generated_at': '2025-07-08T15:01:34.974756', 'version': '1.0', 'author': 'Multi-AI Dev System', 'tags': [], 'notes': 'Converted from WorkItemBacklog. Original summary: Develop a simple web application for managing a task list, including frontend UI, backend API, and database. The application allows users to add and view tasks. The project will be deployed to AWS using a monolithic architecture.'}) summary='Develop a simple web application for managing a task list, including frontend UI, backend API, and database. The application allows users to add and view tasks. The project will be deployed to AWS using a monolithic architecture.' metadata=PlanMetadata(generated_at='2025-07-08T15:01:34.974756', version='1.0', author='Multi-AI Dev System', tags=[], notes='Converted from WorkItemBacklog. Original summary: Develop a simple web application for managing a task list, including frontend UI, backend API, and database. The application allows users to add and view tasks. The project will be deployed to AWS using a monolithic architecture.')"
  },
  "workflow_state_snapshot": {
    "requirements_analysis": {
      "project_name": "Hello World Task List",
      "project_summary": "A simple web application to manage a list of tasks.",
      "project_goals": [
        "Allow a user to add a task",
        "Allow a user to see their list of tasks"
      ],
      "target_audience": [
        "Users who want to manage a list of tasks"
      ],
      "business_context": "This project aims to provide a basic task management tool.",
      "requirements": [
        {
          "id": "REQ-001",
          "description": "A user can create a new task with a text description.",
          "category": "functional",
          "priority": 1
        },
        {
          "id": "REQ-002",
          "description": "A user can see a list of all created tasks.",
          "category": "functional",
          "priority": 1
        },
        {
          "id": "REQ-003",
          "description": "The application must load quickly.",
          "category": "non_functional",
          "priority": 2
        },
        {
          "id": "REQ-004",
          "description": "The application must be secure.",
          "category": "non_functional",
          "priority": 2
        }
      ],
      "functional_requirements": [
        "A user can create a new task with a text description.",
        "A user can see a list of all created tasks."
      ],
      "non_functional_requirements": [
        "The application must load quickly.",
        "The application must be secure."
      ],
      "stakeholders": [
        "Users"
      ],
      "success_criteria": [
        "Users can add tasks.",
        "Users can view their task list.",
        "The application loads quickly.",
        "The application is secure."
      ],
      "constraints": [],
      "assumptions": [],
      "risks": [],
      "domain_specific_details": {},
      "quality_assessment": {
        "clarity_score": 9.0,
        "completeness_score": 7.0,
        "consistency_score": 9.0,
        "recommendations": [
          "Add more detailed non-functional requirements."
        ]
      },
      "gap_analysis": {
        "identified_gaps": [
          "Missing details on security implementation.",
          "Missing details on performance metrics."
        ],
        "recommendations_for_completion": [
          "Define security measures.",
          "Specify performance targets (e.g., load time)."
        ]
      }
    },
    "tech_stack_recommendation": {
      "frontend_options": [
        {
          "name": "React",
          "language": "JavaScript",
          "reasoning": "React is a popular and efficient library for building user interfaces. It offers a component-based architecture, making it easy to manage and update the UI. Its virtual DOM and efficient update mechanisms contribute to fast loading times, addressing the non-functional requirement for speed.",
          "key_libraries": [
            "React Router (for navigation)",
            "Axios (for API calls)",
            "Material UI or Bootstrap (for UI components)"
          ],
          "pros": [
            "Component-based architecture for maintainability.",
            "Large community and extensive documentation.",
            "Efficient updates via virtual DOM.",
            "Good performance."
          ],
          "cons": [
            "Requires understanding of JSX.",
            "Can have a steeper learning curve for beginners."
          ],
          "selected": false
        },
        {
          "name": "Vue.js",
          "language": "JavaScript",
          "reasoning": "Vue.js is a progressive framework that's easy to learn and integrate. It's known for its simplicity and excellent documentation, making it a good choice for smaller projects. It offers a reactive component system, which is suitable for building dynamic UIs.",
          "key_libraries": [
            "Vue Router (for navigation)",
            "Axios (for API calls)",
            "Vuetify or Element UI (for UI components)"
          ],
          "pros": [
            "Easy to learn and use.",
            "Excellent documentation.",
            "Good performance.",
            "Progressive framework - can be integrated into existing projects."
          ],
          "cons": [
            "Smaller community compared to React.",
            "May require more manual configuration for complex applications."
          ],
          "selected": false
        },
        {
          "name": "HTML, CSS, JavaScript (Vanilla)",
          "language": "JavaScript",
          "reasoning": "For a simple task list application, using vanilla JavaScript, HTML, and CSS can be a viable option. This approach minimizes dependencies and offers complete control over the code. It's suitable for projects where simplicity and a small codebase are prioritized.",
          "key_libraries": [],
          "pros": [
            "No external dependencies.",
            "Complete control over the code.",
            "Simple to understand for beginners."
          ],
          "cons": [
            "More manual work for UI updates.",
            "Can become complex for larger applications.",
            "Less efficient than frameworks for complex interactions."
          ],
          "selected": false
        }
      ],
      "backend_options": [
        {
          "name": "Node.js with Express",
          "language": "JavaScript",
          "reasoning": "Node.js with Express provides a lightweight and efficient backend solution. JavaScript is used on both the front and back end, which can streamline development. Express simplifies routing and middleware management, making it suitable for building REST APIs.",
          "key_libraries": [
            "Express (web framework)",
            "body-parser (for parsing request bodies)",
            "cors (for handling CORS)",
            "bcrypt (for password hashing)"
          ],
          "pros": [
            "JavaScript on both front and back end (full-stack JavaScript).",
            "Large community and extensive documentation.",
            "Fast development with Express.",
            "Good performance with non-blocking I/O."
          ],
          "cons": [
            "Callback hell can be an issue (solved with async/await).",
            "Requires careful handling of security vulnerabilities."
          ],
          "selected": false
        },
        {
          "name": "Python with Flask",
          "language": "Python",
          "reasoning": "Flask is a microframework that's easy to learn and use. Python is a versatile language with a large community. Flask provides a simple and flexible way to build REST APIs. It's a good choice if you prefer Python for backend development.",
          "key_libraries": [
            "Flask (web framework)",
            "Flask-CORS (for handling CORS)",
            "bcrypt (for password hashing)",
            "SQLAlchemy (for database interaction)"
          ],
          "pros": [
            "Easy to learn and use.",
            "Large community and extensive documentation.",
            "Python's readability.",
            "Good for rapid prototyping."
          ],
          "cons": [
            "Can be slower than Node.js for some tasks.",
            "Requires more manual configuration compared to Django (a more full-featured Python framework)."
          ],
          "selected": false
        },
        {
          "name": "Java with Spring Boot",
          "language": "Java",
          "reasoning": "Spring Boot simplifies the development of Java-based applications. It provides a robust framework for building REST APIs and managing dependencies. Java's strong typing and performance make it suitable for larger projects, although it might be overkill for this simple application.",
          "key_libraries": [
            "Spring Boot (web framework)",
            "Spring Data JPA (for database interaction)",
            "Spring Security (for security)"
          ],
          "pros": [
            "Robust and scalable.",
            "Strong typing and good performance.",
            "Large community and extensive documentation.",
            "Excellent for enterprise-level applications."
          ],
          "cons": [
            "Steeper learning curve.",
            "More verbose than other options.",
            "Can be overkill for a simple application."
          ],
          "selected": false
        }
      ],
      "database_options": [
        {
          "name": "PostgreSQL",
          "language": null,
          "reasoning": "PostgreSQL is a powerful, open-source relational database. It offers strong data integrity, support for complex queries, and good performance. It's a reliable choice for storing task data.",
          "key_libraries": [
            "psycopg2 (for Python)",
            "pg (for Node.js)"
          ],
          "pros": [
            "ACID-compliant.",
            "Supports complex queries.",
            "Good performance.",
            "Large community and extensive documentation."
          ],
          "cons": [
            "Can be more complex to set up and manage than simpler databases."
          ],
          "selected": false
        },
        {
          "name": "MongoDB",
          "language": null,
          "reasoning": "MongoDB is a NoSQL database that's easy to scale and use. It's a good choice for projects where flexibility and rapid development are important. It's suitable for storing task data in a flexible schema.",
          "key_libraries": [
            "mongoose (for Node.js)",
            "pymongo (for Python)"
          ],
          "pros": [
            "Flexible schema.",
            "Easy to scale.",
            "Good for rapid development.",
            "Good performance for read operations."
          ],
          "cons": [
            "Not ACID-compliant by default (can be configured).",
            "Can be less performant for complex queries."
          ],
          "selected": false
        },
        {
          "name": "SQLite",
          "language": null,
          "reasoning": "SQLite is a lightweight, file-based database. It's easy to set up and use, making it suitable for small projects or prototyping. It's a good choice if you don't need a separate database server.",
          "key_libraries": [],
          "pros": [
            "Easy to set up and use.",
            "File-based (no separate server required).",
            "Good for small projects and prototyping."
          ],
          "cons": [
            "Not suitable for high-traffic applications.",
            "Limited scalability."
          ],
          "selected": false
        }
      ],
      "cloud_options": [
        {
          "name": "AWS (Amazon Web Services)",
          "language": null,
          "reasoning": "AWS provides a wide range of services for deploying and managing web applications. It offers scalability, reliability, and a global infrastructure. Services like EC2, S3, and RDS can be used for hosting the application, storing static assets, and managing the database, respectively.",
          "key_libraries": [
            "AWS SDK (for interacting with AWS services)"
          ],
          "pros": [
            "Scalable and reliable infrastructure.",
            "Wide range of services.",
            "Global presence.",
            "Mature ecosystem."
          ],
          "cons": [
            "Can be complex to manage.",
            "Cost can be high if not managed properly.",
            "Steeper learning curve."
          ],
          "selected": false
        },
        {
          "name": "Google Cloud Platform (GCP)",
          "language": null,
          "reasoning": "GCP offers a similar set of services to AWS, with a focus on data analytics and machine learning. It provides scalable infrastructure and a user-friendly interface. Services like Compute Engine, Cloud Storage, and Cloud SQL can be used for hosting, storage, and database management.",
          "key_libraries": [
            "Google Cloud Client Libraries (for interacting with GCP services)"
          ],
          "pros": [
            "Scalable and reliable infrastructure.",
            "Strong in data analytics and machine learning.",
            "User-friendly interface.",
            "Competitive pricing."
          ],
          "cons": [
            "Can be complex to manage.",
            "Cost can be high if not managed properly.",
            "Steeper learning curve."
          ],
          "selected": false
        },
        {
          "name": "Heroku",
          "language": null,
          "reasoning": "Heroku is a Platform-as-a-Service (PaaS) that simplifies the deployment and management of web applications. It provides a streamlined workflow for deploying code and managing dependencies. It's a good choice for small projects where ease of deployment is a priority.",
          "key_libraries": [],
          "pros": [
            "Easy to deploy and manage.",
            "Simplified workflow.",
            "Good for small projects.",
            "Free tier available."
          ],
          "cons": [
            "Limited customization options.",
            "Can become expensive as the application grows.",
            "Less control over infrastructure."
          ],
          "selected": false
        }
      ],
      "architecture_options": [
        {
          "pattern": "Monolithic Architecture",
          "scalability_score": 5.0,
          "maintainability_score": 6.0,
          "development_speed_score": 8.0,
          "overall_score": 7.0,
          "reasoning": "For a simple task list application, a monolithic architecture is a suitable choice. It involves building the entire application as a single unit. This approach simplifies development and deployment, making it faster to get the application up and running. However, as the application grows, it can become harder to maintain and scale. The scores reflect the simplicity of the project."
        },
        {
          "pattern": "Microservices Architecture",
          "scalability_score": 8.0,
          "maintainability_score": 7.0,
          "development_speed_score": 5.0,
          "overall_score": 6.0,
          "reasoning": "While microservices offer excellent scalability and maintainability, they introduce complexity that might be unnecessary for this small project. The development speed is slower due to the distributed nature of the architecture. The scores reflect the potential for future growth, but the current project's simplicity makes this less ideal."
        },
        {
          "pattern": "Serverless Architecture",
          "scalability_score": 9.0,
          "maintainability_score": 7.0,
          "development_speed_score": 6.0,
          "overall_score": 7.0,
          "reasoning": "Serverless architecture can be a good option for this project, especially if using a cloud provider like AWS or GCP. It allows for automatic scaling and reduces the operational overhead. However, it can introduce complexity in debugging and monitoring. The scores reflect the benefits of scalability and maintainability, but the development speed is slightly slower due to the need to learn and configure serverless functions."
        }
      ],
      "tool_options": [
        {
          "name": "Git",
          "language": null,
          "reasoning": "Git is a version control system that's essential for managing code changes and collaborating with others. It allows developers to track changes, revert to previous versions, and merge code from different branches.",
          "key_libraries": [],
          "pros": [
            "Version control.",
            "Collaboration.",
            "Branching and merging.",
            "Widely used."
          ],
          "cons": [
            "Requires learning the Git commands."
          ],
          "selected": false
        },
        {
          "name": "VS Code",
          "language": null,
          "reasoning": "VS Code is a popular and versatile code editor. It offers features like syntax highlighting, code completion, debugging, and integration with Git. It supports a wide range of programming languages and frameworks.",
          "key_libraries": [],
          "pros": [
            "Free and open-source.",
            "Extensible with extensions.",
            "Good performance.",
            "Large community."
          ],
          "cons": [
            "Can be resource-intensive with many extensions."
          ],
          "selected": false
        },
        {
          "name": "Postman",
          "language": null,
          "reasoning": "Postman is a tool for testing and documenting APIs. It allows developers to send HTTP requests, inspect responses, and create collections of API tests. It's useful for testing the backend API.",
          "key_libraries": [],
          "pros": [
            "Easy to use.",
            "API testing.",
            "Documentation.",
            "Collaboration."
          ],
          "cons": [
            "Can be limited in advanced testing scenarios."
          ],
          "selected": false
        }
      ],
      "risks": [
        {
          "category": "Security",
          "description": "The application is vulnerable to security threats such as cross-site scripting (XSS) and SQL injection. Without proper input validation and output encoding, malicious users could inject harmful scripts or SQL commands.",
          "severity": "High",
          "likelihood": "Medium",
          "mitigation": "Implement robust input validation and output encoding to prevent XSS and SQL injection attacks. Use parameterized queries to prevent SQL injection. Implement authentication and authorization mechanisms."
        },
        {
          "category": "Performance",
          "description": "The application may suffer from slow loading times if the database queries are not optimized or if the frontend code is not efficient. This can lead to a poor user experience.",
          "severity": "Medium",
          "likelihood": "Medium",
          "mitigation": "Optimize database queries by adding indexes and using efficient query patterns. Minimize the size of the frontend code by using code minification and bundling. Implement caching mechanisms to reduce the load on the server."
        },
        {
          "category": "Scalability",
          "description": "The application may not be able to handle a large number of users or tasks if the infrastructure is not designed to scale. This can lead to performance degradation and downtime.",
          "severity": "Medium",
          "likelihood": "Low",
          "mitigation": "Choose a database and hosting platform that can scale. Design the application to be horizontally scalable by using stateless components. Implement load balancing to distribute traffic across multiple servers."
        }
      ],
      "synthesis": {
        "backend": {
          "language": "JavaScript",
          "framework": "Node.js with Express",
          "reasoning": "Node.js with Express provides a lightweight and efficient backend solution. JavaScript is used on both the front and back end, which can streamline development. Express simplifies routing and middleware management, making it suitable for building REST APIs."
        },
        "frontend": {
          "language": "JavaScript",
          "framework": "React",
          "reasoning": "React provides a component-based architecture, making it easy to manage and update the UI. Its virtual DOM and efficient update mechanisms contribute to fast loading times, addressing the non-functional requirement for speed."
        },
        "database": {
          "type": "PostgreSQL",
          "reasoning": "PostgreSQL is a powerful, open-source relational database. It offers strong data integrity, support for complex queries, and good performance. It's a reliable choice for storing task data."
        },
        "architecture_pattern": "Monolithic Architecture",
        "deployment_environment": {
          "cloud_platform": "AWS",
          "reasoning": "AWS provides a wide range of services for deploying and managing web applications. It offers scalability, reliability, and a global infrastructure. Services like EC2, S3, and RDS can be used for hosting the application, storing static assets, and managing the database, respectively."
        },
        "key_libraries_tools": [
          {
            "name": "React Router",
            "purpose": "For navigation in the React frontend."
          },
          {
            "name": "Axios",
            "purpose": "For making API calls from the frontend."
          },
          {
            "name": "Express",
            "purpose": "For building the backend API."
          },
          {
            "name": "Postman",
            "purpose": "For testing the API."
          },
          {
            "name": "Git",
            "purpose": "For version control."
          }
        ],
        "estimated_complexity": "Low"
      },
      "selected_stack": null
    },
    "system_design": {
      "architecture": {
        "pattern": "Monolithic Architecture",
        "justification": "For a simple task list application, a monolithic architecture is a suitable choice. It involves building the entire application as a single unit. This approach simplifies development and deployment, making it faster to get the application up and running.",
        "key_benefits": [
          "Faster development and deployment.",
          "Simpler architecture.",
          "Easier to manage for a small team."
        ],
        "potential_drawbacks": [
          "Can become harder to maintain as the application grows.",
          "Limited scalability compared to microservices.",
          "A single point of failure."
        ]
      },
      "components": [
        {
          "name": "Frontend",
          "description": "The user interface of the task list application.",
          "category": "frontend",
          "technologies": [
            "React",
            "JavaScript",
            "HTML",
            "CSS"
          ],
          "dependencies": [
            "Backend API"
          ],
          "responsibilities": [
            "Displaying the task list.",
            "Allowing users to add new tasks.",
            "Handling user interactions.",
            "Making API calls to the backend."
          ],
          "design_patterns": [
            "Component-based architecture"
          ]
        },
        {
          "name": "Backend API",
          "description": "The backend service that handles task management.",
          "category": "backend",
          "technologies": [
            "Node.js",
            "Express",
            "JavaScript",
            "PostgreSQL"
          ],
          "dependencies": [
            "Database"
          ],
          "responsibilities": [
            "Handling API requests from the frontend.",
            "Storing and retrieving task data from the database.",
            "Implementing business logic.",
            "Providing authentication and authorization (if required)."
          ],
          "design_patterns": [
            "RESTful API"
          ]
        },
        {
          "name": "Database",
          "description": "The database for storing task data.",
          "category": "backend",
          "technologies": [
            "PostgreSQL"
          ],
          "dependencies": [],
          "responsibilities": [
            "Storing task data.",
            "Providing data access to the backend API."
          ],
          "design_patterns": []
        },
        {
          "name": "Deployment Infrastructure",
          "description": "Infrastructure for hosting and running the application.",
          "category": "infrastructure",
          "technologies": [
            "AWS (EC2, RDS, S3)",
            "Docker (optional)"
          ],
          "dependencies": [
            "Frontend",
            "Backend API",
            "Database"
          ],
          "responsibilities": [
            "Hosting the frontend application.",
            "Hosting the backend API.",
            "Managing the database.",
            "Providing scalability and reliability."
          ],
          "design_patterns": []
        }
      ],
      "data_model": {
        "schema_type": "Relational",
        "tables": [
          {
            "name": "tasks",
            "purpose": "Stores information about tasks.",
            "fields": [
              {
                "name": "id",
                "type": "UUID",
                "constraints": [
                  "PRIMARY KEY",
                  "NOT NULL"
                ],
                "description": "Unique identifier for the task."
              },
              {
                "name": "description",
                "type": "TEXT",
                "constraints": [
                  "NOT NULL"
                ],
                "description": "The text description of the task."
              },
              {
                "name": "created_at",
                "type": "TIMESTAMP",
                "constraints": [
                  "NOT NULL",
                  "DEFAULT CURRENT_TIMESTAMP"
                ],
                "description": "The timestamp when the task was created."
              }
            ],
            "relationships": []
          }
        ],
        "relationships": [],
        "justification": "Relational database provides data integrity and is suitable for storing structured task data."
      },
      "api_endpoints": {
        "style": "REST",
        "base_url": "/api/v1",
        "authentication": "None (for simplicity, can be added later)",
        "endpoints": [
          {
            "method": "POST",
            "path": "/tasks",
            "purpose": "Create a new task.",
            "parameters": [
              {
                "description": "The task description.",
                "type": "string",
                "name": "description"
              }
            ],
            "response": {
              "201": {
                "message": "Task created successfully.",
                "task": {
                  "id": "UUID",
                  "description": "string",
                  "created_at": "timestamp"
                }
              },
              "400": {
                "message": "Bad Request - Invalid input."
              }
            },
            "authentication_required": false,
            "rate_limiting_applied": false
          },
          {
            "method": "GET",
            "path": "/tasks",
            "purpose": "Get all tasks.",
            "parameters": [],
            "response": {
              "200": {
                "tasks": [
                  {
                    "id": "UUID",
                    "description": "string",
                    "created_at": "timestamp"
                  }
                ]
              }
            },
            "authentication_required": false,
            "rate_limiting_applied": false
          }
        ],
        "error_handling": "Standard HTTP status codes and JSON responses.",
        "rate_limiting_strategy": null
      },
      "security": {
        "authentication_method": "None (for simplicity, can be added later)",
        "authorization_strategy": "None (for simplicity, can be added later)",
        "data_encryption": {
          "at_rest": "Not applicable (for simplicity, can be added later).",
          "in_transit": "HTTPS (SSL/TLS) is used to encrypt data in transit."
        },
        "security_measures": [
          {
            "category": "Input Validation",
            "implementation": "Validate all user inputs on the server-side to prevent XSS and SQL injection attacks. Sanitize inputs before storing them in the database.",
            "mitigation": "XSS, SQL Injection",
            "priority": "High"
          },
          {
            "category": "Output Encoding",
            "implementation": "Encode all output data to prevent XSS attacks. Use appropriate encoding functions based on the context (e.g., HTML encoding).",
            "mitigation": "XSS",
            "priority": "High"
          },
          {
            "category": "HTTPS",
            "implementation": "Enforce HTTPS for all communication between the client and the server.",
            "mitigation": "Man-in-the-middle attacks, data interception",
            "priority": "High"
          },
          {
            "category": "Dependencies",
            "implementation": "Regularly update all dependencies (frontend and backend) to the latest versions to patch security vulnerabilities.",
            "mitigation": "Known vulnerabilities in dependencies",
            "priority": "Medium"
          }
        ],
        "vulnerability_mitigation_strategies": [
          "Input validation",
          "Output encoding",
          "Using parameterized queries",
          "Regular dependency updates"
        ],
        "compliance_standards": []
      },
      "scalability_and_performance": {
        "caching": "Implement caching mechanisms (e.g., browser caching, server-side caching) to reduce server load and improve response times.",
        "database_optimization": "Optimize database queries by adding indexes and using efficient query patterns.",
        "code_minification": "Minimize the size of the frontend code by using code minification and bundling.",
        "cdn": "Use a Content Delivery Network (CDN) to serve static assets (e.g., images, CSS, JavaScript) from servers closer to the users."
      },
      "deployment_strategy": {
        "environment": "AWS (EC2, RDS, S3)",
        "frontend_deployment": "Deploy the React frontend to S3 and serve it via CloudFront (CDN).",
        "backend_deployment": "Deploy the Node.js backend to an EC2 instance.",
        "database_deployment": "Deploy the PostgreSQL database to RDS.",
        "containerization": "Consider using Docker for containerizing the backend application for easier deployment and consistency (optional)."
      },
      "monitoring_and_logging": {
        "logging": "Implement logging for both frontend and backend applications to track errors, performance, and user activity. Use a logging library (e.g., Winston for Node.js).",
        "monitoring": "Monitor the application's performance and health using tools like CloudWatch (AWS). Monitor metrics such as response times, error rates, and server resource utilization.",
        "error_tracking": "Implement error tracking to capture and analyze errors in real-time (e.g., Sentry)."
      },
      "error_handling_strategy": "Use standard HTTP status codes (e.g., 400, 500) and provide informative error messages in JSON format. Implement centralized error handling in both frontend and backend.",
      "development_phases_overview": [
        {
          "name": "Phase 1: Setup and Frontend Development",
          "description": "Setting up the development environment, building the React frontend, and designing the UI.",
          "priority": "High",
          "dependencies": [],
          "tasks": [
            "Set up React project.",
            "Design and implement the UI (add task form, task list).",
            "Implement navigation using React Router.",
            "Implement API calls using Axios."
          ],
          "estimated_duration": "1 week"
        },
        {
          "name": "Phase 2: Backend API Development",
          "description": "Developing the Node.js backend API, including database integration.",
          "priority": "High",
          "dependencies": [
            "Phase 1"
          ],
          "tasks": [
            "Set up Node.js and Express project.",
            "Design and implement API endpoints (create task, get tasks).",
            "Set up PostgreSQL database.",
            "Implement database interactions using a suitable library (e.g., pg).",
            "Implement input validation."
          ],
          "estimated_duration": "1 week"
        },
        {
          "name": "Phase 3: Integration and Testing",
          "description": "Integrating the frontend and backend, testing the application, and preparing for deployment.",
          "priority": "High",
          "dependencies": [
            "Phase 1",
            "Phase 2"
          ],
          "tasks": [
            "Connect the frontend to the backend API.",
            "Test the application thoroughly (unit tests, integration tests).",
            "Implement error handling.",
            "Prepare for deployment (configure AWS services)."
          ],
          "estimated_duration": "1 week"
        },
        {
          "name": "Phase 4: Deployment and Monitoring",
          "description": "Deploying the application to AWS and setting up monitoring.",
          "priority": "High",
          "dependencies": [
            "Phase 3"
          ],
          "tasks": [
            "Deploy the frontend to S3 and CloudFront.",
            "Deploy the backend to EC2.",
            "Deploy the database to RDS.",
            "Set up monitoring and logging using CloudWatch."
          ],
          "estimated_duration": "1 week"
        }
      ],
      "key_risks": [
        "Security vulnerabilities (XSS, SQL injection).",
        "Performance issues (slow loading times).",
        "Scalability limitations.",
        "Deployment issues."
      ],
      "design_justification": "The design prioritizes simplicity and rapid development. The monolithic architecture, React frontend, Node.js backend, and PostgreSQL database are well-suited for a small task list application. The use of AWS provides a scalable and reliable deployment environment. Security measures are included to address potential vulnerabilities. The development phases are structured to ensure a smooth and efficient development process.",
      "data_flow": "1. User interacts with the React frontend (e.g., adds a task). 2. Frontend sends a POST request to the backend API (/api/v1/tasks). 3. Backend API receives the request, validates the input, and saves the task data to the PostgreSQL database. 4. Backend API returns a success response to the frontend. 5. Frontend updates the UI to display the new task. 6. When the user views the task list, the frontend sends a GET request to the backend API (/api/v1/tasks). 7. Backend API retrieves task data from the PostgreSQL database. 8. Backend API returns the task data to the frontend. 9. Frontend displays the task list."
    },
    "implementation_plan": "plan=ImplementationPlan(project_summary={'title': 'Generated Project Plan', 'description': 'Develop a simple web application for managing a task list, including frontend UI, backend API, and database. The application allows users to add and view tasks. The project will be deployed to AWS using a monolithic architecture.', 'overall_complexity': 'Medium', 'estimated_duration': 'TBD', 'key_challenges': [], 'success_criteria': []}, phases=[{'name': 'Frontend Phase', 'description': 'Tasks related to frontend phase', 'deliverables': ['Completed FE-001', 'Completed FE-002', 'Completed FE-003', 'Completed FE-004', 'Completed FE-005', 'Completed FE-006', 'Completed FE-007', 'Completed UT-001'], 'estimated_duration_hours': 48.0, 'work_items': [{'id': 'FE-001', 'description': 'Set up React project using Create React App.', 'dependencies': [], 'estimated_time': '4 hours', 'agent_role': 'frontend_developer', 'acceptance_criteria': ['Project is initialized successfully.', 'Default React app runs without errors.'], 'status': 'pending', 'code_files': ['package.json', 'src/App.js', 'src/index.js']}, {'id': 'FE-002', 'description': 'Install React Router for navigation.', 'dependencies': ['FE-001'], 'estimated_time': '2 hours', 'agent_role': 'frontend_developer', 'acceptance_criteria': ['React Router is installed.', 'Basic routing is configured (e.g., home page).'], 'status': 'pending', 'code_files': ['package.json', 'src/App.js']}, {'id': 'FE-003', 'description': 'Install Axios for making API calls.', 'dependencies': ['FE-001'], 'estimated_time': '2 hours', 'agent_role': 'frontend_developer', 'acceptance_criteria': ['Axios is installed.', 'A sample API call can be made (e.g., to a dummy API).'], 'status': 'pending', 'code_files': ['package.json', 'src/App.js']}, {'id': 'FE-004', 'description': 'Design and implement the UI for adding a task (form).', 'dependencies': ['FE-001'], 'estimated_time': '8 hours', 'agent_role': 'frontend_developer', 'acceptance_criteria': ['UI form for entering task description exists.', 'Form fields are styled appropriately.', 'Submit button is present.'], 'status': 'pending', 'code_files': ['src/App.js', 'src/components/AddTaskForm.js', 'src/App.css']}, {'id': 'FE-005', 'description': 'Design and implement the UI for displaying the task list.', 'dependencies': ['FE-001'], 'estimated_time': '8 hours', 'agent_role': 'frontend_developer', 'acceptance_criteria': ['Task list container exists.', 'Tasks are displayed in a list format (e.g., unordered list).', 'Each task displays its description.'], 'status': 'pending', 'code_files': ['src/App.js', 'src/components/TaskList.js', 'src/App.css']}, {'id': 'FE-006', 'description': 'Implement the functionality to add a new task (frontend).', 'dependencies': ['FE-003', 'FE-004', 'BE-004'], 'estimated_time': '8 hours', 'agent_role': 'frontend_developer', 'acceptance_criteria': ['User can enter a task description in the form.', 'On form submission, an API call is made to the backend to create a task.', 'The task list is updated to reflect the new task after a successful API call.', 'Error messages are displayed if the API call fails.'], 'status': 'pending', 'code_files': ['src/App.js', 'src/components/AddTaskForm.js']}, {'id': 'FE-007', 'description': 'Implement the functionality to fetch and display the task list (frontend).', 'dependencies': ['FE-003', 'FE-005', 'BE-005'], 'estimated_time': '8 hours', 'agent_role': 'frontend_developer', 'acceptance_criteria': ['On component mount, an API call is made to the backend to fetch the task list.', 'The task list is displayed correctly.', 'Error messages are displayed if the API call fails.'], 'status': 'pending', 'code_files': ['src/App.js', 'src/components/TaskList.js']}, {'id': 'UT-001', 'description': 'Write unit tests for the frontend components.', 'dependencies': ['FE-001', 'FE-004', 'FE-005'], 'estimated_time': '8 hours', 'agent_role': 'frontend_developer', 'acceptance_criteria': ['Tests are written for the AddTaskForm component.', 'Tests are written for the TaskList component.', 'Tests cover component rendering and basic functionality.', 'Tests pass.'], 'status': 'pending', 'code_files': ['src/components/AddTaskForm.test.js', 'src/components/TaskList.test.js']}]}, {'name': 'Backend Phase', 'description': 'Tasks related to backend phase', 'deliverables': ['Completed BE-001', 'Completed BE-002', 'Completed BE-004', 'Completed BE-005', 'Completed IT-001', 'Completed UT-002', 'Completed SC-001'], 'estimated_duration_hours': 42.0, 'work_items': [{'id': 'BE-001', 'description': 'Set up Node.js and Express project.', 'dependencies': [], 'estimated_time': '4 hours', 'agent_role': 'backend_developer', 'acceptance_criteria': ['Project is initialized successfully.', 'Express server runs without errors.', \"Basic route (e.g., '/') responds with 'Hello World'.\"], 'status': 'pending', 'code_files': ['package.json', 'index.js']}, {'id': 'BE-002', 'description': 'Install necessary packages (body-parser, cors).', 'dependencies': ['BE-001'], 'estimated_time': '2 hours', 'agent_role': 'backend_developer', 'acceptance_criteria': ['body-parser and cors are installed.', 'CORS is configured to allow requests from the frontend (e.g., localhost:3000).'], 'status': 'pending', 'code_files': ['package.json', 'index.js']}, {'id': 'BE-004', 'description': 'Implement API endpoint to create a new task (/api/v1/tasks).', 'dependencies': ['BE-002', 'BE-003'], 'estimated_time': '8 hours', 'agent_role': 'backend_developer', 'acceptance_criteria': ['Endpoint accepts POST requests to /api/v1/tasks.', \"Endpoint validates the 'description' parameter.\", 'Endpoint inserts the task into the database.', 'Endpoint returns a 201 Created status with the created task (including id and created_at) on success.', 'Endpoint returns a 400 Bad Request status with an error message on validation failure.'], 'status': 'pending', 'code_files': ['index.js', 'db/queries.js']}, {'id': 'BE-005', 'description': 'Implement API endpoint to get all tasks (/api/v1/tasks).', 'dependencies': ['BE-002', 'BE-003'], 'estimated_time': '8 hours', 'agent_role': 'backend_developer', 'acceptance_criteria': ['Endpoint accepts GET requests to /api/v1/tasks.', 'Endpoint retrieves all tasks from the database.', 'Endpoint returns a 200 OK status with a JSON array of tasks.', 'Endpoint handles database errors and returns a 500 Internal Server Error status.'], 'status': 'pending', 'code_files': ['index.js', 'db/queries.js']}, {'id': 'IT-001', 'description': 'Connect frontend to backend API (integration testing).', 'dependencies': ['FE-006', 'FE-007', 'BE-004', 'BE-005'], 'estimated_time': '8 hours', 'agent_role': 'backend_developer', 'acceptance_criteria': ['Frontend successfully calls the /api/v1/tasks endpoint to create a task.', 'Frontend successfully calls the /api/v1/tasks endpoint to retrieve tasks.', 'Data is correctly passed between frontend and backend.', 'Error handling is implemented on both frontend and backend.'], 'status': 'pending', 'code_files': ['src/App.js', 'index.js']}, {'id': 'UT-002', 'description': 'Write unit tests for the backend API endpoints.', 'dependencies': ['BE-004', 'BE-005'], 'estimated_time': '8 hours', 'agent_role': 'backend_developer', 'acceptance_criteria': ['Tests are written for the /api/v1/tasks POST endpoint.', 'Tests are written for the /api/v1/tasks GET endpoint.', 'Tests cover request validation, database interactions, and response codes.', 'Tests pass.'], 'status': 'pending', 'code_files': ['tests/api.test.js']}, {'id': 'SC-001', 'description': 'Implement input validation on the backend.', 'dependencies': ['BE-004'], 'estimated_time': '4 hours', 'agent_role': 'backend_developer', 'acceptance_criteria': ['Input validation is implemented for the task description.', 'Invalid input results in a 400 Bad Request response.', 'Parameterized queries are used to prevent SQL injection.'], 'status': 'pending', 'code_files': ['index.js', 'db/queries.js']}]}, {'name': 'Database Phase', 'description': 'Tasks related to database phase', 'deliverables': ['Completed BE-003'], 'estimated_duration_hours': 4.0, 'work_items': [{'id': 'BE-003', 'description': \"Set up PostgreSQL database and create the 'tasks' table.\", 'dependencies': [], 'estimated_time': '4 hours', 'agent_role': 'database_specialist', 'acceptance_criteria': ['PostgreSQL database is installed and running.', \"Database named 'task_list_db' is created.\", \"Table 'tasks' is created with columns: id (UUID, PRIMARY KEY), description (TEXT), created_at (TIMESTAMP).\"], 'status': 'pending', 'code_files': ['db/schema.sql']}]}, {'name': 'Devops_Engineer Phase', 'description': 'Tasks related to devops_engineer phase', 'deliverables': ['Completed DP-001', 'Completed DP-002', 'Completed DP-003', 'Completed MN-001', 'Completed SC-002'], 'estimated_duration_hours': 28.0, 'work_items': [{'id': 'DP-001', 'description': 'Deploy frontend to AWS S3 and configure CloudFront.', 'dependencies': ['IT-001'], 'estimated_time': '8 hours', 'agent_role': 'devops_engineer', 'acceptance_criteria': ['Frontend code is built and deployed to an S3 bucket.', 'CloudFront distribution is created and configured to serve the frontend.', 'The application is accessible via the CloudFront URL.', 'HTTPS is enabled.'], 'status': 'pending', 'code_files': []}, {'id': 'DP-002', 'description': 'Deploy backend to AWS EC2.', 'dependencies': ['IT-001', 'BE-003'], 'estimated_time': '8 hours', 'agent_role': 'devops_engineer', 'acceptance_criteria': ['EC2 instance is created and configured.', 'Node.js and necessary dependencies are installed on the EC2 instance.', 'Backend code is deployed to the EC2 instance.', 'The backend API is running and accessible.', 'HTTPS is enabled.'], 'status': 'pending', 'code_files': []}, {'id': 'DP-003', 'description': 'Deploy PostgreSQL database to AWS RDS.', 'dependencies': ['BE-003'], 'estimated_time': '4 hours', 'agent_role': 'devops_engineer', 'acceptance_criteria': ['RDS instance is created and configured.', 'PostgreSQL database is created on the RDS instance.', 'Database connection details are configured in the backend application.', 'Database is accessible from the EC2 instance.'], 'status': 'pending', 'code_files': []}, {'id': 'MN-001', 'description': 'Set up basic monitoring with AWS CloudWatch.', 'dependencies': ['DP-001', 'DP-002', 'DP-003'], 'estimated_time': '4 hours', 'agent_role': 'devops_engineer', 'acceptance_criteria': ['CloudWatch is configured to monitor EC2 instance CPU utilization, memory usage, and network traffic.', 'CloudWatch is configured to monitor RDS instance CPU utilization, memory usage, and database connections.', 'Basic logging is implemented in the backend application and logs are sent to CloudWatch Logs.'], 'status': 'pending', 'code_files': ['index.js']}, {'id': 'SC-002', 'description': 'Enforce HTTPS for all communication.', 'dependencies': ['DP-001', 'DP-002'], 'estimated_time': '4 hours', 'agent_role': 'devops_engineer', 'acceptance_criteria': ['HTTPS is enforced for the CloudFront distribution.', \"HTTPS is configured for the EC2 instance (e.g., using Let's Encrypt).\"], 'status': 'pending', 'code_files': []}]}], resource_allocation=[{'role': 'Backend Developer', 'count': 1, 'estimated_time_allocation': '100%', 'phases': ['Backend Phase'], 'skills_required': []}, {'role': 'Devops Engineer', 'count': 1, 'estimated_time_allocation': '100%', 'phases': ['Devops_Engineer Phase'], 'skills_required': []}, {'role': 'Database Specialist', 'count': 1, 'estimated_time_allocation': '100%', 'phases': ['Database Phase'], 'skills_required': []}, {'role': 'Frontend Developer', 'count': 1, 'estimated_time_allocation': '100%', 'phases': ['Frontend Phase'], 'skills_required': []}], risks_and_mitigations=[], timeline={'start_date': '2025-07-08T15:01:34.974756', 'end_date': 'TBD', 'milestones': []}, tech_stack={}, metadata={'generated_at': '2025-07-08T15:01:34.974756', 'version': '1.0', 'author': 'Multi-AI Dev System', 'tags': [], 'notes': 'Converted from WorkItemBacklog. Original summary: Develop a simple web application for managing a task list, including frontend UI, backend API, and database. The application allows users to add and view tasks. The project will be deployed to AWS using a monolithic architecture.'}) summary='Develop a simple web application for managing a task list, including frontend UI, backend API, and database. The application allows users to add and view tasks. The project will be deployed to AWS using a monolithic architecture.' metadata=PlanMetadata(generated_at='2025-07-08T15:01:34.974756', version='1.0', author='Multi-AI Dev System', tags=[], notes='Converted from WorkItemBacklog. Original summary: Develop a simple web application for managing a task list, including frontend UI, backend API, and database. The application allows users to add and view tasks. The project will be deployed to AWS using a monolithic architecture.')"
  }
}