{
  "session_id": "session_1c2e982c-9e94-4f91-8924-4f80f480c986",
  "approval_type": "implementation_plan",
  "timestamp": 1751965891,
  "approval_data": {
    "type": "implementation_plan",
    "timestamp": 1751965891.658081,
    "project_overview": "Develop a simple web application for managing a list of tasks, including adding and viewing tasks. The application will use React for the frontend, Node.js with Express for the backend, and PostgreSQL for the database. The application will be deployed to AWS.",
    "development_phases": [
      {
        "name": "Frontend Phase",
        "description": "Tasks related to frontend phase",
        "deliverables": [
          "Completed FE-001",
          "Completed FE-002",
          "Completed FE-003",
          "Completed FE-004",
          "Completed FE-005",
          "Completed FE-006",
          "Completed TEST-003"
        ],
        "estimated_duration_hours": 56.0,
        "work_items": [
          {
            "id": "FE-001",
            "description": "Set up React project using Create React App.",
            "dependencies": [],
            "estimated_time": "4 hours",
            "agent_role": "frontend_developer",
            "acceptance_criteria": [
              "Project is initialized successfully.",
              "Default React app runs without errors."
            ],
            "status": "pending",
            "code_files": [
              "package.json",
              "src/App.js",
              "src/index.js"
            ]
          },
          {
            "id": "FE-002",
            "description": "Design and implement the UI for adding tasks (input field and add button).",
            "dependencies": [
              "FE-001"
            ],
            "estimated_time": "8 hours",
            "agent_role": "frontend_developer",
            "acceptance_criteria": [
              "UI elements for task input and adding are present.",
              "UI elements are styled appropriately.",
              "UI is responsive."
            ],
            "status": "pending",
            "code_files": [
              "src/App.js",
              "src/App.css"
            ]
          },
          {
            "id": "FE-003",
            "description": "Design and implement the UI for viewing tasks (task list).",
            "dependencies": [
              "FE-001"
            ],
            "estimated_time": "8 hours",
            "agent_role": "frontend_developer",
            "acceptance_criteria": [
              "Task list area is present.",
              "Task items are displayed correctly (placeholder).",
              "UI is styled appropriately.",
              "UI is responsive."
            ],
            "status": "pending",
            "code_files": [
              "src/App.js",
              "src/App.css"
            ]
          },
          {
            "id": "FE-004",
            "description": "Implement basic styling for the frontend components.",
            "dependencies": [
              "FE-002",
              "FE-003"
            ],
            "estimated_time": "4 hours",
            "agent_role": "frontend_developer",
            "acceptance_criteria": [
              "UI elements are visually appealing.",
              "Consistent styling is applied across the application.",
              "Styling does not break responsiveness."
            ],
            "status": "pending",
            "code_files": [
              "src/App.css"
            ]
          },
          {
            "id": "FE-005",
            "description": "Connect frontend to backend API (POST /api/v1/tasks).",
            "dependencies": [
              "FE-002",
              "BE-002",
              "BE-005"
            ],
            "estimated_time": "8 hours",
            "agent_role": "frontend_developer",
            "acceptance_criteria": [
              "Frontend sends a POST request to /api/v1/tasks when the add button is clicked.",
              "Frontend sends the task description in the request body.",
              "Frontend handles the API response (success and error).",
              "Frontend displays success/error messages to the user."
            ],
            "status": "pending",
            "code_files": [
              "src/App.js"
            ]
          },
          {
            "id": "FE-006",
            "description": "Connect frontend to backend API (GET /api/v1/tasks).",
            "dependencies": [
              "FE-003",
              "BE-003",
              "BE-006"
            ],
            "estimated_time": "8 hours",
            "agent_role": "frontend_developer",
            "acceptance_criteria": [
              "Frontend sends a GET request to /api/v1/tasks on page load.",
              "Frontend displays the retrieved tasks in the task list.",
              "Frontend handles the API response (success and error).",
              "Frontend updates the task list after a new task is added."
            ],
            "status": "pending",
            "code_files": [
              "src/App.js"
            ]
          },
          {
            "id": "TEST-003",
            "description": "End-to-end tests for the application.",
            "dependencies": [
              "FE-005",
              "FE-006"
            ],
            "estimated_time": "16 hours",
            "agent_role": "frontend_developer",
            "acceptance_criteria": [
              "Tests verify the entire workflow: adding a task, viewing the task list.",
              "Tests cover successful and error scenarios.",
              "Tests are automated."
            ],
            "status": "pending",
            "code_files": [
              "cypress/integration/app.spec.js"
            ]
          }
        ]
      },
      {
        "name": "Backend Phase",
        "description": "Tasks related to backend phase",
        "deliverables": [
          "Completed BE-001",
          "Completed BE-002",
          "Completed BE-003",
          "Completed BE-004",
          "Completed BE-005",
          "Completed BE-006",
          "Completed TEST-001",
          "Completed TEST-002"
        ],
        "estimated_duration_hours": 52.0,
        "work_items": [
          {
            "id": "BE-001",
            "description": "Set up Node.js and Express project.",
            "dependencies": [],
            "estimated_time": "4 hours",
            "agent_role": "backend_developer",
            "acceptance_criteria": [
              "Project is initialized successfully.",
              "Express server runs without errors.",
              "Basic route (e.g., '/') responds with 'Hello World'."
            ],
            "status": "pending",
            "code_files": [
              "package.json",
              "index.js"
            ]
          },
          {
            "id": "BE-002",
            "description": "Implement API endpoint for creating tasks (POST /api/v1/tasks).",
            "dependencies": [
              "BE-001"
            ],
            "estimated_time": "8 hours",
            "agent_role": "backend_developer",
            "acceptance_criteria": [
              "Endpoint accepts POST requests to /api/v1/tasks.",
              "Endpoint receives a 'description' parameter in the request body.",
              "Endpoint validates the 'description' parameter (e.g., not empty).",
              "Endpoint returns a 201 Created status code on success.",
              "Endpoint returns a 400 Bad Request status code on validation failure."
            ],
            "status": "pending",
            "code_files": [
              "index.js"
            ]
          },
          {
            "id": "BE-003",
            "description": "Implement API endpoint for retrieving tasks (GET /api/v1/tasks).",
            "dependencies": [
              "BE-001"
            ],
            "estimated_time": "4 hours",
            "agent_role": "backend_developer",
            "acceptance_criteria": [
              "Endpoint accepts GET requests to /api/v1/tasks.",
              "Endpoint returns a 200 OK status code.",
              "Endpoint returns an empty array of tasks initially."
            ],
            "status": "pending",
            "code_files": [
              "index.js"
            ]
          },
          {
            "id": "BE-004",
            "description": "Connect backend API to PostgreSQL database.",
            "dependencies": [
              "BE-001",
              "DB-001",
              "DB-002"
            ],
            "estimated_time": "8 hours",
            "agent_role": "backend_developer",
            "acceptance_criteria": [
              "Backend can connect to the PostgreSQL database.",
              "Database connection is established without errors."
            ],
            "status": "pending",
            "code_files": [
              "index.js"
            ]
          },
          {
            "id": "BE-005",
            "description": "Implement database interaction for creating tasks (POST /api/v1/tasks).",
            "dependencies": [
              "BE-002",
              "BE-004"
            ],
            "estimated_time": "8 hours",
            "agent_role": "backend_developer",
            "acceptance_criteria": [
              "Task description is saved to the database.",
              "Endpoint returns the created task (including id and created_at) in the response.",
              "Database interaction does not throw errors."
            ],
            "status": "pending",
            "code_files": [
              "index.js"
            ]
          },
          {
            "id": "BE-006",
            "description": "Implement database interaction for retrieving tasks (GET /api/v1/tasks).",
            "dependencies": [
              "BE-003",
              "BE-004"
            ],
            "estimated_time": "8 hours",
            "agent_role": "backend_developer",
            "acceptance_criteria": [
              "Endpoint retrieves all tasks from the database.",
              "Endpoint returns the tasks in the response.",
              "Database interaction does not throw errors."
            ],
            "status": "pending",
            "code_files": [
              "index.js"
            ]
          },
          {
            "id": "TEST-001",
            "description": "Unit tests for backend API (POST /api/v1/tasks).",
            "dependencies": [
              "BE-002",
              "BE-005"
            ],
            "estimated_time": "8 hours",
            "agent_role": "backend_developer",
            "acceptance_criteria": [
              "Tests cover successful task creation.",
              "Tests cover validation failures.",
              "Tests cover database interaction."
            ],
            "status": "pending",
            "code_files": [
              "tests/api.test.js"
            ]
          },
          {
            "id": "TEST-002",
            "description": "Unit tests for backend API (GET /api/v1/tasks).",
            "dependencies": [
              "BE-003",
              "BE-006"
            ],
            "estimated_time": "4 hours",
            "agent_role": "backend_developer",
            "acceptance_criteria": [
              "Tests verify the retrieval of tasks from the database.",
              "Tests verify the correct response format."
            ],
            "status": "pending",
            "code_files": [
              "tests/api.test.js"
            ]
          }
        ]
      },
      {
        "name": "Database Phase",
        "description": "Tasks related to database phase",
        "deliverables": [
          "Completed DB-001",
          "Completed DB-002"
        ],
        "estimated_duration_hours": 8.0,
        "work_items": [
          {
            "id": "DB-001",
            "description": "Set up PostgreSQL database.",
            "dependencies": [],
            "estimated_time": "4 hours",
            "agent_role": "database_specialist",
            "acceptance_criteria": [
              "PostgreSQL database is installed and running.",
              "Database named 'task_list' is created.",
              "User with appropriate permissions is created."
            ],
            "status": "pending",
            "code_files": []
          },
          {
            "id": "DB-002",
            "description": "Create 'tasks' table in PostgreSQL.",
            "dependencies": [
              "DB-001"
            ],
            "estimated_time": "4 hours",
            "agent_role": "database_specialist",
            "acceptance_criteria": [
              "Table 'tasks' exists.",
              "Table has 'id' (SERIAL PRIMARY KEY), 'description' (TEXT NOT NULL), and 'created_at' (TIMESTAMP DEFAULT CURRENT_TIMESTAMP) columns."
            ],
            "status": "pending",
            "code_files": []
          }
        ]
      },
      {
        "name": "Devops_Engineer Phase",
        "description": "Tasks related to devops_engineer phase",
        "deliverables": [
          "Completed DEPLOY-001",
          "Completed DEPLOY-002",
          "Completed DEPLOY-003",
          "Completed DEPLOY-004"
        ],
        "estimated_duration_hours": 36.0,
        "work_items": [
          {
            "id": "DEPLOY-001",
            "description": "Set up AWS infrastructure (EC2, RDS, S3, CloudFront).",
            "dependencies": [
              "BE-006",
              "FE-006",
              "DB-002"
            ],
            "estimated_time": "16 hours",
            "agent_role": "devops_engineer",
            "acceptance_criteria": [
              "EC2 instance is created and configured for the backend.",
              "RDS instance is created and configured for the database.",
              "S3 bucket is created and configured for the frontend.",
              "CloudFront distribution is created and configured to serve the frontend."
            ],
            "status": "pending",
            "code_files": []
          },
          {
            "id": "DEPLOY-002",
            "description": "Deploy the frontend to S3 and CloudFront.",
            "dependencies": [
              "FE-006",
              "DEPLOY-001"
            ],
            "estimated_time": "4 hours",
            "agent_role": "devops_engineer",
            "acceptance_criteria": [
              "Frontend code is deployed to the S3 bucket.",
              "CloudFront distribution serves the frontend from the S3 bucket.",
              "Application is accessible via the CloudFront URL."
            ],
            "status": "pending",
            "code_files": []
          },
          {
            "id": "DEPLOY-003",
            "description": "Deploy the backend to EC2.",
            "dependencies": [
              "BE-006",
              "DEPLOY-001"
            ],
            "estimated_time": "8 hours",
            "agent_role": "devops_engineer",
            "acceptance_criteria": [
              "Backend code is deployed to the EC2 instance.",
              "Backend API is running and accessible.",
              "Backend connects to the RDS database."
            ],
            "status": "pending",
            "code_files": []
          },
          {
            "id": "DEPLOY-004",
            "description": "Configure monitoring and logging.",
            "dependencies": [
              "DEPLOY-001",
              "DEPLOY-002",
              "DEPLOY-003"
            ],
            "estimated_time": "8 hours",
            "agent_role": "devops_engineer",
            "acceptance_criteria": [
              "Logging is configured for both frontend and backend (e.g., using CloudWatch).",
              "Basic monitoring is set up (e.g., CPU usage, database connection).",
              "Alerts are configured for critical events."
            ],
            "status": "pending",
            "code_files": []
          }
        ]
      }
    ],
    "timeline_estimation": {
      "start_date": "2025-07-08T14:41:30.742754",
      "end_date": "TBD",
      "milestones": []
    },
    "risk_assessment": [],
    "resource_requirements": [
      {
        "role": "Backend Developer",
        "count": 1,
        "estimated_time_allocation": "100%",
        "phases": [
          "Backend Phase"
        ],
        "skills_required": []
      },
      {
        "role": "Database Specialist",
        "count": 1,
        "estimated_time_allocation": "100%",
        "phases": [
          "Database Phase"
        ],
        "skills_required": []
      },
      {
        "role": "Frontend Developer",
        "count": 1,
        "estimated_time_allocation": "100%",
        "phases": [
          "Frontend Phase"
        ],
        "skills_required": []
      },
      {
        "role": "Devops Engineer",
        "count": 1,
        "estimated_time_allocation": "100%",
        "phases": [
          "Devops_Engineer Phase"
        ],
        "skills_required": []
      }
    ],
    "deliverables": [
      "Completed FE-001",
      "Completed FE-002",
      "Completed FE-003",
      "Completed FE-004",
      "Completed FE-005",
      "Completed FE-006",
      "Completed TEST-003",
      "Completed BE-001",
      "Completed BE-002",
      "Completed BE-003",
      "Completed BE-004",
      "Completed BE-005",
      "Completed BE-006",
      "Completed TEST-001",
      "Completed TEST-002",
      "Completed DB-001",
      "Completed DB-002",
      "Completed DEPLOY-001",
      "Completed DEPLOY-002",
      "Completed DEPLOY-003",
      "Completed DEPLOY-004"
    ],
    "dependencies": [],
    "raw_plan": "plan=ImplementationPlan(project_summary={'title': 'Generated Project Plan', 'description': 'Develop a simple web application for managing a list of tasks, including adding and viewing tasks. The application will use React for the frontend, Node.js with Express for the backend, and PostgreSQL for the database. The application will be deployed to AWS.', 'overall_complexity': 'Medium', 'estimated_duration': 'TBD', 'key_challenges': [], 'success_criteria': []}, phases=[{'name': 'Frontend Phase', 'description': 'Tasks related to frontend phase', 'deliverables': ['Completed FE-001', 'Completed FE-002', 'Completed FE-003', 'Completed FE-004', 'Completed FE-005', 'Completed FE-006', 'Completed TEST-003'], 'estimated_duration_hours': 56.0, 'work_items': [{'id': 'FE-001', 'description': 'Set up React project using Create React App.', 'dependencies': [], 'estimated_time': '4 hours', 'agent_role': 'frontend_developer', 'acceptance_criteria': ['Project is initialized successfully.', 'Default React app runs without errors.'], 'status': 'pending', 'code_files': ['package.json', 'src/App.js', 'src/index.js']}, {'id': 'FE-002', 'description': 'Design and implement the UI for adding tasks (input field and add button).', 'dependencies': ['FE-001'], 'estimated_time': '8 hours', 'agent_role': 'frontend_developer', 'acceptance_criteria': ['UI elements for task input and adding are present.', 'UI elements are styled appropriately.', 'UI is responsive.'], 'status': 'pending', 'code_files': ['src/App.js', 'src/App.css']}, {'id': 'FE-003', 'description': 'Design and implement the UI for viewing tasks (task list).', 'dependencies': ['FE-001'], 'estimated_time': '8 hours', 'agent_role': 'frontend_developer', 'acceptance_criteria': ['Task list area is present.', 'Task items are displayed correctly (placeholder).', 'UI is styled appropriately.', 'UI is responsive.'], 'status': 'pending', 'code_files': ['src/App.js', 'src/App.css']}, {'id': 'FE-004', 'description': 'Implement basic styling for the frontend components.', 'dependencies': ['FE-002', 'FE-003'], 'estimated_time': '4 hours', 'agent_role': 'frontend_developer', 'acceptance_criteria': ['UI elements are visually appealing.', 'Consistent styling is applied across the application.', 'Styling does not break responsiveness.'], 'status': 'pending', 'code_files': ['src/App.css']}, {'id': 'FE-005', 'description': 'Connect frontend to backend API (POST /api/v1/tasks).', 'dependencies': ['FE-002', 'BE-002', 'BE-005'], 'estimated_time': '8 hours', 'agent_role': 'frontend_developer', 'acceptance_criteria': ['Frontend sends a POST request to /api/v1/tasks when the add button is clicked.', 'Frontend sends the task description in the request body.', 'Frontend handles the API response (success and error).', 'Frontend displays success/error messages to the user.'], 'status': 'pending', 'code_files': ['src/App.js']}, {'id': 'FE-006', 'description': 'Connect frontend to backend API (GET /api/v1/tasks).', 'dependencies': ['FE-003', 'BE-003', 'BE-006'], 'estimated_time': '8 hours', 'agent_role': 'frontend_developer', 'acceptance_criteria': ['Frontend sends a GET request to /api/v1/tasks on page load.', 'Frontend displays the retrieved tasks in the task list.', 'Frontend handles the API response (success and error).', 'Frontend updates the task list after a new task is added.'], 'status': 'pending', 'code_files': ['src/App.js']}, {'id': 'TEST-003', 'description': 'End-to-end tests for the application.', 'dependencies': ['FE-005', 'FE-006'], 'estimated_time': '16 hours', 'agent_role': 'frontend_developer', 'acceptance_criteria': ['Tests verify the entire workflow: adding a task, viewing the task list.', 'Tests cover successful and error scenarios.', 'Tests are automated.'], 'status': 'pending', 'code_files': ['cypress/integration/app.spec.js']}]}, {'name': 'Backend Phase', 'description': 'Tasks related to backend phase', 'deliverables': ['Completed BE-001', 'Completed BE-002', 'Completed BE-003', 'Completed BE-004', 'Completed BE-005', 'Completed BE-006', 'Completed TEST-001', 'Completed TEST-002'], 'estimated_duration_hours': 52.0, 'work_items': [{'id': 'BE-001', 'description': 'Set up Node.js and Express project.', 'dependencies': [], 'estimated_time': '4 hours', 'agent_role': 'backend_developer', 'acceptance_criteria': ['Project is initialized successfully.', 'Express server runs without errors.', \"Basic route (e.g., '/') responds with 'Hello World'.\"], 'status': 'pending', 'code_files': ['package.json', 'index.js']}, {'id': 'BE-002', 'description': 'Implement API endpoint for creating tasks (POST /api/v1/tasks).', 'dependencies': ['BE-001'], 'estimated_time': '8 hours', 'agent_role': 'backend_developer', 'acceptance_criteria': ['Endpoint accepts POST requests to /api/v1/tasks.', \"Endpoint receives a 'description' parameter in the request body.\", \"Endpoint validates the 'description' parameter (e.g., not empty).\", 'Endpoint returns a 201 Created status code on success.', 'Endpoint returns a 400 Bad Request status code on validation failure.'], 'status': 'pending', 'code_files': ['index.js']}, {'id': 'BE-003', 'description': 'Implement API endpoint for retrieving tasks (GET /api/v1/tasks).', 'dependencies': ['BE-001'], 'estimated_time': '4 hours', 'agent_role': 'backend_developer', 'acceptance_criteria': ['Endpoint accepts GET requests to /api/v1/tasks.', 'Endpoint returns a 200 OK status code.', 'Endpoint returns an empty array of tasks initially.'], 'status': 'pending', 'code_files': ['index.js']}, {'id': 'BE-004', 'description': 'Connect backend API to PostgreSQL database.', 'dependencies': ['BE-001', 'DB-001', 'DB-002'], 'estimated_time': '8 hours', 'agent_role': 'backend_developer', 'acceptance_criteria': ['Backend can connect to the PostgreSQL database.', 'Database connection is established without errors.'], 'status': 'pending', 'code_files': ['index.js']}, {'id': 'BE-005', 'description': 'Implement database interaction for creating tasks (POST /api/v1/tasks).', 'dependencies': ['BE-002', 'BE-004'], 'estimated_time': '8 hours', 'agent_role': 'backend_developer', 'acceptance_criteria': ['Task description is saved to the database.', 'Endpoint returns the created task (including id and created_at) in the response.', 'Database interaction does not throw errors.'], 'status': 'pending', 'code_files': ['index.js']}, {'id': 'BE-006', 'description': 'Implement database interaction for retrieving tasks (GET /api/v1/tasks).', 'dependencies': ['BE-003', 'BE-004'], 'estimated_time': '8 hours', 'agent_role': 'backend_developer', 'acceptance_criteria': ['Endpoint retrieves all tasks from the database.', 'Endpoint returns the tasks in the response.', 'Database interaction does not throw errors.'], 'status': 'pending', 'code_files': ['index.js']}, {'id': 'TEST-001', 'description': 'Unit tests for backend API (POST /api/v1/tasks).', 'dependencies': ['BE-002', 'BE-005'], 'estimated_time': '8 hours', 'agent_role': 'backend_developer', 'acceptance_criteria': ['Tests cover successful task creation.', 'Tests cover validation failures.', 'Tests cover database interaction.'], 'status': 'pending', 'code_files': ['tests/api.test.js']}, {'id': 'TEST-002', 'description': 'Unit tests for backend API (GET /api/v1/tasks).', 'dependencies': ['BE-003', 'BE-006'], 'estimated_time': '4 hours', 'agent_role': 'backend_developer', 'acceptance_criteria': ['Tests verify the retrieval of tasks from the database.', 'Tests verify the correct response format.'], 'status': 'pending', 'code_files': ['tests/api.test.js']}]}, {'name': 'Database Phase', 'description': 'Tasks related to database phase', 'deliverables': ['Completed DB-001', 'Completed DB-002'], 'estimated_duration_hours': 8.0, 'work_items': [{'id': 'DB-001', 'description': 'Set up PostgreSQL database.', 'dependencies': [], 'estimated_time': '4 hours', 'agent_role': 'database_specialist', 'acceptance_criteria': ['PostgreSQL database is installed and running.', \"Database named 'task_list' is created.\", 'User with appropriate permissions is created.'], 'status': 'pending', 'code_files': []}, {'id': 'DB-002', 'description': \"Create 'tasks' table in PostgreSQL.\", 'dependencies': ['DB-001'], 'estimated_time': '4 hours', 'agent_role': 'database_specialist', 'acceptance_criteria': [\"Table 'tasks' exists.\", \"Table has 'id' (SERIAL PRIMARY KEY), 'description' (TEXT NOT NULL), and 'created_at' (TIMESTAMP DEFAULT CURRENT_TIMESTAMP) columns.\"], 'status': 'pending', 'code_files': []}]}, {'name': 'Devops_Engineer Phase', 'description': 'Tasks related to devops_engineer phase', 'deliverables': ['Completed DEPLOY-001', 'Completed DEPLOY-002', 'Completed DEPLOY-003', 'Completed DEPLOY-004'], 'estimated_duration_hours': 36.0, 'work_items': [{'id': 'DEPLOY-001', 'description': 'Set up AWS infrastructure (EC2, RDS, S3, CloudFront).', 'dependencies': ['BE-006', 'FE-006', 'DB-002'], 'estimated_time': '16 hours', 'agent_role': 'devops_engineer', 'acceptance_criteria': ['EC2 instance is created and configured for the backend.', 'RDS instance is created and configured for the database.', 'S3 bucket is created and configured for the frontend.', 'CloudFront distribution is created and configured to serve the frontend.'], 'status': 'pending', 'code_files': []}, {'id': 'DEPLOY-002', 'description': 'Deploy the frontend to S3 and CloudFront.', 'dependencies': ['FE-006', 'DEPLOY-001'], 'estimated_time': '4 hours', 'agent_role': 'devops_engineer', 'acceptance_criteria': ['Frontend code is deployed to the S3 bucket.', 'CloudFront distribution serves the frontend from the S3 bucket.', 'Application is accessible via the CloudFront URL.'], 'status': 'pending', 'code_files': []}, {'id': 'DEPLOY-003', 'description': 'Deploy the backend to EC2.', 'dependencies': ['BE-006', 'DEPLOY-001'], 'estimated_time': '8 hours', 'agent_role': 'devops_engineer', 'acceptance_criteria': ['Backend code is deployed to the EC2 instance.', 'Backend API is running and accessible.', 'Backend connects to the RDS database.'], 'status': 'pending', 'code_files': []}, {'id': 'DEPLOY-004', 'description': 'Configure monitoring and logging.', 'dependencies': ['DEPLOY-001', 'DEPLOY-002', 'DEPLOY-003'], 'estimated_time': '8 hours', 'agent_role': 'devops_engineer', 'acceptance_criteria': ['Logging is configured for both frontend and backend (e.g., using CloudWatch).', 'Basic monitoring is set up (e.g., CPU usage, database connection).', 'Alerts are configured for critical events.'], 'status': 'pending', 'code_files': []}]}], resource_allocation=[{'role': 'Backend Developer', 'count': 1, 'estimated_time_allocation': '100%', 'phases': ['Backend Phase'], 'skills_required': []}, {'role': 'Database Specialist', 'count': 1, 'estimated_time_allocation': '100%', 'phases': ['Database Phase'], 'skills_required': []}, {'role': 'Frontend Developer', 'count': 1, 'estimated_time_allocation': '100%', 'phases': ['Frontend Phase'], 'skills_required': []}, {'role': 'Devops Engineer', 'count': 1, 'estimated_time_allocation': '100%', 'phases': ['Devops_Engineer Phase'], 'skills_required': []}], risks_and_mitigations=[], timeline={'start_date': '2025-07-08T14:41:30.742754', 'end_date': 'TBD', 'milestones': []}, tech_stack={}, metadata={'generated_at': '2025-07-08T14:41:30.742754', 'version': '1.0', 'author': 'Multi-AI Dev System', 'tags': [], 'notes': 'Converted from WorkItemBacklog. Original summary: Develop a simple web application for managing a list of tasks, including adding and viewing tasks. The application will use React for the frontend, Node.js with Express for the backend, and PostgreSQL for the database. The application will be deployed to AWS.'}) summary='Develop a simple web application for managing a list of tasks, including adding and viewing tasks. The application will use React for the frontend, Node.js with Express for the backend, and PostgreSQL for the database. The application will be deployed to AWS.' metadata=PlanMetadata(generated_at='2025-07-08T14:41:30.742754', version='1.0', author='Multi-AI Dev System', tags=[], notes='Converted from WorkItemBacklog. Original summary: Develop a simple web application for managing a list of tasks, including adding and viewing tasks. The application will use React for the frontend, Node.js with Express for the backend, and PostgreSQL for the database. The application will be deployed to AWS.')"
  },
  "workflow_state_snapshot": {
    "requirements_analysis": {
      "project_name": "Hello World Task List",
      "project_summary": "A simple web application to manage a list of tasks.",
      "project_goals": [
        "Allow a user to add a task",
        "Allow a user to see their list of tasks"
      ],
      "target_audience": [
        "Users who want to manage a list of tasks"
      ],
      "business_context": "This project aims to provide a basic task management tool.",
      "requirements": [
        {
          "id": "REQ-001",
          "description": "A user can create a new task with a text description.",
          "category": "functional",
          "priority": 1
        },
        {
          "id": "REQ-002",
          "description": "A user can see a list of all created tasks.",
          "category": "functional",
          "priority": 1
        },
        {
          "id": "REQ-003",
          "description": "The application must load quickly.",
          "category": "non_functional",
          "priority": 2
        },
        {
          "id": "REQ-004",
          "description": "The application must be secure.",
          "category": "non_functional",
          "priority": 2
        }
      ],
      "functional_requirements": [
        "A user can create a new task with a text description.",
        "A user can see a list of all created tasks."
      ],
      "non_functional_requirements": [
        "The application must load quickly.",
        "The application must be secure."
      ],
      "stakeholders": [
        "Users"
      ],
      "success_criteria": [
        "Users can successfully add tasks.",
        "Users can successfully view their task list.",
        "The application loads quickly.",
        "The application is secure."
      ],
      "constraints": [],
      "assumptions": [],
      "risks": [],
      "domain_specific_details": {},
      "quality_assessment": {
        "clarity_score": 9.0,
        "completeness_score": 8.0,
        "consistency_score": 10.0,
        "recommendations": []
      },
      "gap_analysis": {
        "identified_gaps": [],
        "recommendations_for_completion": []
      }
    },
    "tech_stack_recommendation": {
      "frontend_options": [
        {
          "name": "React",
          "language": "JavaScript",
          "reasoning": "React is a popular and efficient JavaScript library for building user interfaces. It offers a component-based architecture, making it easy to manage and update the UI. Its virtual DOM and efficient update mechanisms contribute to fast loading times, addressing the non-functional requirement for speed. It has a large community and extensive documentation.",
          "key_libraries": [
            "React Router (for navigation)",
            "Axios or Fetch (for API calls)",
            "Material UI or Bootstrap (for UI components)"
          ],
          "pros": [
            "Component-based architecture for maintainability",
            "Large community and extensive documentation",
            "Virtual DOM for efficient updates",
            "Fast loading times"
          ],
          "cons": [
            "Requires understanding of JavaScript and JSX",
            "Can have a steeper learning curve for beginners"
          ],
          "selected": false
        },
        {
          "name": "Vue.js",
          "language": "JavaScript",
          "reasoning": "Vue.js is a progressive framework that's easy to learn and integrate. It's known for its simplicity and flexibility, making it suitable for small to medium-sized projects. It offers a good balance between performance and ease of use, addressing the need for a fast-loading application.",
          "key_libraries": [
            "Vue Router (for navigation)",
            "Axios or Fetch (for API calls)",
            "Vuetify or Element UI (for UI components)"
          ],
          "pros": [
            "Easy to learn and integrate",
            "Good performance",
            "Flexible and adaptable"
          ],
          "cons": [
            "Smaller community compared to React",
            "May require more manual configuration for complex applications"
          ],
          "selected": false
        },
        {
          "name": "HTML, CSS, JavaScript (Vanilla)",
          "language": "JavaScript",
          "reasoning": "For a simple task list application, using vanilla JavaScript, HTML, and CSS can be a viable option. This approach avoids the overhead of a framework, resulting in potentially faster initial load times and a smaller bundle size. It's a good choice for projects where simplicity and minimal dependencies are prioritized.",
          "key_libraries": [],
          "pros": [
            "No external dependencies",
            "Fast initial load times",
            "Simple to understand and debug"
          ],
          "cons": [
            "More manual DOM manipulation",
            "Can become complex for larger applications",
            "Less structure compared to frameworks"
          ],
          "selected": false
        }
      ],
      "backend_options": [
        {
          "name": "Node.js with Express",
          "language": "JavaScript",
          "reasoning": "Node.js with Express is a popular choice for building backend APIs. It's lightweight, fast, and uses JavaScript, allowing for full-stack development with a single language. Express provides a robust framework for handling routing, middleware, and API interactions. This combination is well-suited for a simple task list application.",
          "key_libraries": [
            "Express (web framework)",
            "body-parser (for parsing request bodies)",
            "cors (for handling CORS)",
            "bcrypt (for password hashing)"
          ],
          "pros": [
            "JavaScript for full-stack development",
            "Large community and extensive documentation",
            "Fast and efficient",
            "Easy to deploy"
          ],
          "cons": [
            "Callback hell can be an issue (can be mitigated with async/await)",
            "Requires careful handling of security"
          ],
          "selected": false
        },
        {
          "name": "Python with Flask",
          "language": "Python",
          "reasoning": "Flask is a micro web framework in Python, known for its simplicity and flexibility. Python is a versatile language, and Flask allows for rapid development of APIs. It's a good choice if you prefer Python for backend development. It's suitable for small to medium-sized projects.",
          "key_libraries": [
            "Flask (web framework)",
            "Flask-CORS (for handling CORS)",
            "bcrypt (for password hashing)",
            "SQLAlchemy (for database interaction)"
          ],
          "pros": [
            "Easy to learn and use",
            "Large community and extensive documentation",
            "Good for rapid prototyping",
            "Python's versatility"
          ],
          "cons": [
            "Can be slower than Node.js for some tasks",
            "Requires more setup for larger projects"
          ],
          "selected": false
        },
        {
          "name": "Java with Spring Boot",
          "language": "Java",
          "reasoning": "Spring Boot simplifies the development of Java-based applications. It provides a robust framework for building RESTful APIs and offers features like dependency injection, security, and database integration. While it has a steeper learning curve, it offers scalability and enterprise-grade features.",
          "key_libraries": [
            "Spring Boot (framework)",
            "Spring Web (for building REST APIs)",
            "Spring Security (for security)",
            "Hibernate/JPA (for database interaction)"
          ],
          "pros": [
            "Robust and scalable",
            "Mature ecosystem and large community",
            "Excellent security features"
          ],
          "cons": [
            "Steeper learning curve",
            "More verbose than other options",
            "Can be slower development speed"
          ],
          "selected": false
        }
      ],
      "database_options": [
        {
          "name": "PostgreSQL",
          "language": null,
          "reasoning": "PostgreSQL is a powerful, open-source relational database known for its reliability, data integrity, and support for complex queries. It's a good choice for a task list application because it can handle data efficiently and securely. It's a good general-purpose database.",
          "key_libraries": [
            "psycopg2 (for Python)",
            "pg (for Node.js)"
          ],
          "pros": [
            "Reliable and robust",
            "Supports complex queries",
            "Good data integrity",
            "Open source"
          ],
          "cons": [
            "Can be more complex to set up and manage than simpler databases"
          ],
          "selected": false
        },
        {
          "name": "MongoDB",
          "language": null,
          "reasoning": "MongoDB is a NoSQL document database that's easy to scale and flexible. It's a good choice for applications where the data structure may evolve over time. It's a good option for rapid development and can be easier to set up than relational databases.",
          "key_libraries": [
            "mongoose (for Node.js)",
            "pymongo (for Python)"
          ],
          "pros": [
            "Flexible schema",
            "Easy to scale",
            "Good for rapid development"
          ],
          "cons": [
            "Less strict data integrity",
            "Can be more complex to query than relational databases"
          ],
          "selected": false
        },
        {
          "name": "SQLite",
          "language": null,
          "reasoning": "SQLite is a lightweight, file-based database that's easy to set up and use. It's a good choice for small applications or prototypes where a full-fledged database is not needed. It's suitable for local development and can be easily deployed.",
          "key_libraries": [],
          "pros": [
            "Easy to set up and use",
            "File-based, no server required",
            "Good for local development and testing"
          ],
          "cons": [
            "Not suitable for high-traffic applications",
            "Limited scalability"
          ],
          "selected": false
        }
      ],
      "cloud_options": [
        {
          "name": "AWS (Amazon Web Services)",
          "language": null,
          "reasoning": "AWS provides a comprehensive suite of services for building and deploying web applications. It offers a wide range of services, including compute (EC2, Lambda), storage (S3), database (RDS, DynamoDB), and more. It's a good choice for scalability, reliability, and security. It has a large community and extensive documentation.",
          "key_libraries": [
            "AWS SDK (for various languages)"
          ],
          "pros": [
            "Highly scalable and reliable",
            "Wide range of services",
            "Mature ecosystem",
            "Good security features"
          ],
          "cons": [
            "Can be complex to manage",
            "Cost can be higher than other options",
            "Steeper learning curve"
          ],
          "selected": false
        },
        {
          "name": "Google Cloud Platform (GCP)",
          "language": null,
          "reasoning": "GCP offers a similar set of services to AWS, with a focus on data analytics and machine learning. It's a good choice for applications that require these features. It's known for its competitive pricing and user-friendly interface.",
          "key_libraries": [
            "Google Cloud Client Libraries (for various languages)"
          ],
          "pros": [
            "Competitive pricing",
            "User-friendly interface",
            "Strong in data analytics and machine learning"
          ],
          "cons": [
            "Smaller market share than AWS",
            "Can be complex to manage"
          ],
          "selected": false
        },
        {
          "name": "Heroku",
          "language": null,
          "reasoning": "Heroku is a Platform-as-a-Service (PaaS) that simplifies the deployment and management of web applications. It's a good choice for small to medium-sized projects where ease of deployment is a priority. It handles the infrastructure and scaling, allowing developers to focus on code.",
          "key_libraries": [],
          "pros": [
            "Easy to deploy and manage",
            "Handles infrastructure and scaling",
            "Good for rapid prototyping"
          ],
          "cons": [
            "Limited customization options",
            "Can be more expensive than other options",
            "Vendor lock-in"
          ],
          "selected": false
        }
      ],
      "architecture_options": [
        {
          "pattern": "Monolithic Architecture",
          "scalability_score": 5.0,
          "maintainability_score": 6.0,
          "development_speed_score": 8.0,
          "overall_score": 7.0,
          "reasoning": "For a simple task list application, a monolithic architecture is a good starting point. It's easier to develop and deploy initially. All components (frontend, backend, database) are bundled together. While not as scalable as microservices, it's sufficient for the project's scope. Maintainability is good for a small project, and development speed is high due to the simplicity."
        },
        {
          "pattern": "Microservices Architecture",
          "scalability_score": 8.0,
          "maintainability_score": 7.0,
          "development_speed_score": 5.0,
          "overall_score": 6.0,
          "reasoning": "Microservices architecture involves breaking down the application into smaller, independent services. While this offers better scalability and maintainability in the long run, it adds complexity to development and deployment. For a simple task list, the benefits may not outweigh the added overhead. Development speed is lower due to the distributed nature of the system."
        },
        {
          "pattern": "Serverless Architecture",
          "scalability_score": 9.0,
          "maintainability_score": 7.0,
          "development_speed_score": 6.0,
          "overall_score": 7.0,
          "reasoning": "Serverless architecture uses cloud services like AWS Lambda or Google Cloud Functions to execute code without managing servers. This can offer excellent scalability and cost efficiency. However, it can introduce complexities in debugging and monitoring. Development speed is moderate, as you need to design your application to fit the serverless model."
        }
      ],
      "tool_options": [
        {
          "name": "Git",
          "language": null,
          "reasoning": "Git is a distributed version control system that is essential for managing code changes, collaborating with others, and tracking the history of the project.",
          "key_libraries": [],
          "pros": [
            "Version control",
            "Collaboration",
            "Tracking changes"
          ],
          "cons": [
            "Learning curve"
          ],
          "selected": false
        },
        {
          "name": "VS Code",
          "language": null,
          "reasoning": "VS Code is a popular, free, and open-source code editor with excellent support for various programming languages, debugging, and extensions. It enhances developer productivity.",
          "key_libraries": [],
          "pros": [
            "Free and open-source",
            "Extensible",
            "Good language support"
          ],
          "cons": [
            "Can be resource-intensive with many extensions"
          ],
          "selected": false
        },
        {
          "name": "Postman",
          "language": null,
          "reasoning": "Postman is a tool for testing and documenting APIs. It allows developers to send HTTP requests, inspect responses, and organize API calls.",
          "key_libraries": [],
          "pros": [
            "API testing",
            "API documentation",
            "Collaboration"
          ],
          "cons": [
            "Can be complex for beginners"
          ],
          "selected": false
        }
      ],
      "risks": [
        {
          "category": "Security",
          "description": "The application could be vulnerable to cross-site scripting (XSS) attacks if user input is not properly sanitized.",
          "severity": "Medium",
          "likelihood": "Medium",
          "mitigation": "Implement input validation and output encoding to prevent XSS attacks. Use a Content Security Policy (CSP)."
        },
        {
          "category": "Performance",
          "description": "The application may experience slow loading times if the database queries are not optimized or if the frontend code is not efficient.",
          "severity": "Medium",
          "likelihood": "Medium",
          "mitigation": "Optimize database queries, use efficient frontend code, and consider caching strategies."
        },
        {
          "category": "Scalability",
          "description": "The application may not scale well if the chosen database or backend architecture cannot handle a large number of users or tasks.",
          "severity": "Low",
          "likelihood": "Low",
          "mitigation": "Choose a scalable database (e.g., PostgreSQL, MongoDB) and consider a scalable backend architecture (e.g., microservices) if the application grows."
        }
      ],
      "synthesis": {
        "backend": {
          "language": "JavaScript",
          "framework": "Node.js with Express",
          "reasoning": "Node.js with Express is a good choice for building the backend API. It uses JavaScript, allowing for full-stack development with a single language. Express provides a robust framework for handling routing, middleware, and API interactions."
        },
        "frontend": {
          "language": "JavaScript",
          "framework": "React",
          "reasoning": "React provides a good balance of ease of use, performance, and a large community for building the user interface. It allows for a component-based architecture, making it easier to manage the UI and update it efficiently. This addresses the need for a fast-loading application."
        },
        "database": {
          "type": "PostgreSQL",
          "reasoning": "PostgreSQL is a reliable and robust relational database that can handle data efficiently and securely. It's a good general-purpose database and suitable for the project's needs."
        },
        "architecture_pattern": "Monolithic Architecture",
        "deployment_environment": {
          "cloud_platform": "AWS",
          "reasoning": "AWS provides a comprehensive suite of services for building and deploying web applications, offering scalability, reliability, and security. It has a large community and extensive documentation."
        },
        "key_libraries_tools": [
          {
            "name": "React Router",
            "purpose": "For navigation in the React frontend."
          },
          {
            "name": "Axios",
            "purpose": "For making API calls from the frontend."
          },
          {
            "name": "Express",
            "purpose": "For building the backend API."
          },
          {
            "name": "PostgreSQL",
            "purpose": "For database interaction."
          },
          {
            "name": "Git",
            "purpose": "For version control."
          },
          {
            "name": "VS Code",
            "purpose": "For code editing and development."
          }
        ],
        "estimated_complexity": "Low"
      },
      "selected_stack": null
    },
    "system_design": {
      "architecture": {
        "pattern": "Monolithic Architecture",
        "justification": "For a simple task list application, a monolithic architecture is a good starting point. It's easier to develop and deploy initially. All components (frontend, backend, database) are bundled together. While not as scalable as microservices, it's sufficient for the project's scope. Maintainability is good for a small project, and development speed is high due to the simplicity.",
        "key_benefits": [
          "Faster development and deployment",
          "Simpler architecture",
          "Easier to manage for a small project"
        ],
        "potential_drawbacks": [
          "Limited scalability compared to microservices",
          "Can become harder to maintain as the application grows"
        ]
      },
      "components": [
        {
          "name": "Frontend",
          "description": "The user interface for the task list application.",
          "category": "frontend",
          "technologies": [
            "React",
            "JavaScript",
            "HTML",
            "CSS"
          ],
          "dependencies": [
            "Backend API"
          ],
          "responsibilities": [
            "Displaying the task list",
            "Allowing users to add new tasks",
            "Handling user interactions",
            "Making API calls to the backend"
          ],
          "design_patterns": [
            "Component-based architecture"
          ]
        },
        {
          "name": "Backend API",
          "description": "The backend API that handles requests from the frontend and interacts with the database.",
          "category": "backend",
          "technologies": [
            "Node.js",
            "Express",
            "JavaScript"
          ],
          "dependencies": [
            "PostgreSQL Database"
          ],
          "responsibilities": [
            "Handling API requests",
            "Validating user input",
            "Interacting with the database",
            "Returning data to the frontend"
          ],
          "design_patterns": [
            "RESTful API"
          ]
        },
        {
          "name": "Database",
          "description": "Stores the task data.",
          "category": "database",
          "technologies": [
            "PostgreSQL"
          ],
          "dependencies": [],
          "responsibilities": [
            "Storing task data",
            "Providing data to the backend API"
          ],
          "design_patterns": []
        },
        {
          "name": "Deployment Infrastructure",
          "description": "The infrastructure used to host and run the application.",
          "category": "infrastructure",
          "technologies": [
            "AWS (EC2, RDS, S3, etc.)",
            "Docker (Optional)"
          ],
          "dependencies": [
            "Frontend",
            "Backend API",
            "Database"
          ],
          "responsibilities": [
            "Hosting the frontend application",
            "Hosting the backend API",
            "Managing the database",
            "Ensuring the application is accessible and scalable"
          ],
          "design_patterns": []
        }
      ],
      "data_model": {
        "schema_type": "Relational",
        "tables": [
          {
            "name": "tasks",
            "purpose": "Stores the tasks created by users.",
            "fields": [
              {
                "name": "id",
                "type": "SERIAL",
                "constraints": [
                  "PRIMARY KEY"
                ],
                "description": "Unique identifier for the task."
              },
              {
                "name": "description",
                "type": "TEXT",
                "constraints": [
                  "NOT NULL"
                ],
                "description": "The text description of the task."
              },
              {
                "name": "created_at",
                "type": "TIMESTAMP",
                "constraints": [
                  "NOT NULL",
                  "DEFAULT CURRENT_TIMESTAMP"
                ],
                "description": "The timestamp when the task was created."
              }
            ],
            "relationships": []
          }
        ],
        "relationships": [],
        "justification": "Relational database provides data integrity and efficient querying for the task list application."
      },
      "api_endpoints": {
        "style": "REST",
        "base_url": "/api/v1",
        "authentication": "None (for simplicity, could be JWT or API Key in a real-world scenario)",
        "endpoints": [
          {
            "method": "POST",
            "path": "/tasks",
            "purpose": "Create a new task.",
            "parameters": [
              {
                "description": "The task description",
                "type": "string",
                "name": "description"
              }
            ],
            "response": {
              "201": {
                "message": "Task created successfully",
                "task": {
                  "id": 1,
                  "description": "Sample task",
                  "created_at": "2024-01-01T12:00:00.000Z"
                }
              },
              "400": {
                "message": "Bad Request - Invalid input"
              }
            },
            "authentication_required": false,
            "rate_limiting_applied": false
          },
          {
            "method": "GET",
            "path": "/tasks",
            "purpose": "Get all tasks.",
            "parameters": [],
            "response": {
              "200": {
                "tasks": [
                  {
                    "id": 1,
                    "description": "Sample task",
                    "created_at": "2024-01-01T12:00:00.000Z"
                  }
                ]
              }
            },
            "authentication_required": false,
            "rate_limiting_applied": false
          }
        ],
        "error_handling": "Standard HTTP status codes and informative error messages.",
        "rate_limiting_strategy": null
      },
      "security": {
        "authentication_method": "None (for simplicity)",
        "authorization_strategy": "None (for simplicity)",
        "data_encryption": {
          "in_transit": "TLS/SSL",
          "at_rest": "Not applicable (for simplicity, but consider database encryption in a real-world scenario)"
        },
        "security_measures": [
          {
            "category": "Input Validation",
            "implementation": "Validate all user inputs on the backend to prevent injection attacks.",
            "mitigation": "SQL Injection, Cross-Site Scripting (XSS)",
            "priority": "High"
          },
          {
            "category": "Output Encoding",
            "implementation": "Encode output data to prevent XSS attacks.",
            "mitigation": "Cross-Site Scripting (XSS)",
            "priority": "High"
          },
          {
            "category": "HTTPS",
            "implementation": "Enforce HTTPS for all communication.",
            "mitigation": "Man-in-the-middle attacks",
            "priority": "High"
          },
          {
            "category": "Dependencies",
            "implementation": "Regularly update dependencies to patch security vulnerabilities.",
            "mitigation": "Known vulnerabilities in dependencies",
            "priority": "Medium"
          }
        ],
        "vulnerability_mitigation_strategies": [
          "Input validation",
          "Output encoding",
          "Regular dependency updates",
          "Use of HTTPS"
        ],
        "compliance_standards": []
      },
      "scalability_and_performance": {
        "frontend_optimization": "Use React's virtual DOM and efficient update mechanisms. Minimize the size of the JavaScript bundle by code splitting and lazy loading.",
        "backend_optimization": "Optimize database queries. Use caching if needed. Implement connection pooling.",
        "database_optimization": "Use indexes on frequently queried columns. Optimize database schema for performance."
      },
      "deployment_strategy": {
        "environment": "AWS (EC2, RDS, S3)",
        "frontend_deployment": "Deploy the React frontend to S3 and serve it via CloudFront for fast content delivery.",
        "backend_deployment": "Deploy the Node.js backend to EC2 instances. Use a load balancer for high availability.",
        "database_deployment": "Deploy the PostgreSQL database to RDS.",
        "CI_CD": "Implement a CI/CD pipeline using tools like AWS CodePipeline or similar to automate builds, tests, and deployments."
      },
      "monitoring_and_logging": {
        "logging": "Implement logging in both the frontend and backend to track errors and user activity. Use a logging service like AWS CloudWatch or similar.",
        "monitoring": "Monitor the application's performance and health using AWS CloudWatch or similar. Set up alerts for critical events."
      },
      "error_handling_strategy": "Use standard HTTP status codes. Provide informative error messages to the user. Log all errors on the server-side for debugging.",
      "development_phases_overview": [
        {
          "name": "Phase 1: Setup and Frontend Development",
          "description": "Set up the development environment, create the React frontend, and implement the UI for adding and viewing tasks.",
          "priority": "High",
          "dependencies": [],
          "tasks": [
            "Set up React project",
            "Design and implement the UI for adding tasks",
            "Design and implement the UI for viewing tasks",
            "Implement basic styling"
          ],
          "estimated_duration": "1 week"
        },
        {
          "name": "Phase 2: Backend API Development",
          "description": "Develop the Node.js backend API to handle requests from the frontend and interact with the database.",
          "priority": "High",
          "dependencies": [
            "Phase 1: Setup and Frontend Development"
          ],
          "tasks": [
            "Set up Node.js and Express project",
            "Implement API endpoints for creating and retrieving tasks",
            "Connect to the PostgreSQL database",
            "Implement input validation"
          ],
          "estimated_duration": "1 week"
        },
        {
          "name": "Phase 3: Database Setup and Integration",
          "description": "Set up the PostgreSQL database and integrate it with the backend API.",
          "priority": "High",
          "dependencies": [
            "Phase 2: Backend API Development"
          ],
          "tasks": [
            "Set up PostgreSQL database",
            "Create the 'tasks' table",
            "Implement database interaction in the backend API"
          ],
          "estimated_duration": "2 days"
        },
        {
          "name": "Phase 4: Frontend-Backend Integration and Testing",
          "description": "Integrate the frontend with the backend API and perform testing.",
          "priority": "High",
          "dependencies": [
            "Phase 1: Setup and Frontend Development",
            "Phase 2: Backend API Development",
            "Phase 3: Database Setup and Integration"
          ],
          "tasks": [
            "Connect the frontend to the backend API",
            "Test the application thoroughly",
            "Fix any bugs"
          ],
          "estimated_duration": "1 week"
        },
        {
          "name": "Phase 5: Deployment and Monitoring",
          "description": "Deploy the application to AWS and set up monitoring.",
          "priority": "Medium",
          "dependencies": [
            "Phase 4: Frontend-Backend Integration and Testing"
          ],
          "tasks": [
            "Set up AWS infrastructure (EC2, RDS, S3, etc.)",
            "Deploy the frontend to S3 and CloudFront",
            "Deploy the backend to EC2",
            "Set up database on RDS",
            "Configure monitoring and logging"
          ],
          "estimated_duration": "1 week"
        }
      ],
      "key_risks": [
        "XSS vulnerabilities due to improper input sanitization.",
        "Performance bottlenecks due to inefficient database queries.",
        "Security vulnerabilities in dependencies."
      ],
      "design_justification": "The design prioritizes simplicity and ease of development for a small project. The monolithic architecture, React frontend, Node.js backend, and PostgreSQL database provide a good balance of functionality and maintainability. AWS is chosen for deployment due to its scalability and reliability.",
      "data_flow": "1. User interacts with the React frontend (e.g., adds a task). 2. Frontend sends a POST request to the backend API (/api/v1/tasks). 3. Backend API receives the request, validates the input, and interacts with the PostgreSQL database to store the task. 4. Backend API returns a success response (e.g., 201 Created) to the frontend. 5. Frontend displays the updated task list by sending a GET request to /api/v1/tasks. 6. Backend API retrieves tasks from the database and returns them to the frontend. 7. Frontend displays the tasks."
    },
    "implementation_plan": "plan=ImplementationPlan(project_summary={'title': 'Generated Project Plan', 'description': 'Develop a simple web application for managing a list of tasks, including adding and viewing tasks. The application will use React for the frontend, Node.js with Express for the backend, and PostgreSQL for the database. The application will be deployed to AWS.', 'overall_complexity': 'Medium', 'estimated_duration': 'TBD', 'key_challenges': [], 'success_criteria': []}, phases=[{'name': 'Frontend Phase', 'description': 'Tasks related to frontend phase', 'deliverables': ['Completed FE-001', 'Completed FE-002', 'Completed FE-003', 'Completed FE-004', 'Completed FE-005', 'Completed FE-006', 'Completed TEST-003'], 'estimated_duration_hours': 56.0, 'work_items': [{'id': 'FE-001', 'description': 'Set up React project using Create React App.', 'dependencies': [], 'estimated_time': '4 hours', 'agent_role': 'frontend_developer', 'acceptance_criteria': ['Project is initialized successfully.', 'Default React app runs without errors.'], 'status': 'pending', 'code_files': ['package.json', 'src/App.js', 'src/index.js']}, {'id': 'FE-002', 'description': 'Design and implement the UI for adding tasks (input field and add button).', 'dependencies': ['FE-001'], 'estimated_time': '8 hours', 'agent_role': 'frontend_developer', 'acceptance_criteria': ['UI elements for task input and adding are present.', 'UI elements are styled appropriately.', 'UI is responsive.'], 'status': 'pending', 'code_files': ['src/App.js', 'src/App.css']}, {'id': 'FE-003', 'description': 'Design and implement the UI for viewing tasks (task list).', 'dependencies': ['FE-001'], 'estimated_time': '8 hours', 'agent_role': 'frontend_developer', 'acceptance_criteria': ['Task list area is present.', 'Task items are displayed correctly (placeholder).', 'UI is styled appropriately.', 'UI is responsive.'], 'status': 'pending', 'code_files': ['src/App.js', 'src/App.css']}, {'id': 'FE-004', 'description': 'Implement basic styling for the frontend components.', 'dependencies': ['FE-002', 'FE-003'], 'estimated_time': '4 hours', 'agent_role': 'frontend_developer', 'acceptance_criteria': ['UI elements are visually appealing.', 'Consistent styling is applied across the application.', 'Styling does not break responsiveness.'], 'status': 'pending', 'code_files': ['src/App.css']}, {'id': 'FE-005', 'description': 'Connect frontend to backend API (POST /api/v1/tasks).', 'dependencies': ['FE-002', 'BE-002', 'BE-005'], 'estimated_time': '8 hours', 'agent_role': 'frontend_developer', 'acceptance_criteria': ['Frontend sends a POST request to /api/v1/tasks when the add button is clicked.', 'Frontend sends the task description in the request body.', 'Frontend handles the API response (success and error).', 'Frontend displays success/error messages to the user.'], 'status': 'pending', 'code_files': ['src/App.js']}, {'id': 'FE-006', 'description': 'Connect frontend to backend API (GET /api/v1/tasks).', 'dependencies': ['FE-003', 'BE-003', 'BE-006'], 'estimated_time': '8 hours', 'agent_role': 'frontend_developer', 'acceptance_criteria': ['Frontend sends a GET request to /api/v1/tasks on page load.', 'Frontend displays the retrieved tasks in the task list.', 'Frontend handles the API response (success and error).', 'Frontend updates the task list after a new task is added.'], 'status': 'pending', 'code_files': ['src/App.js']}, {'id': 'TEST-003', 'description': 'End-to-end tests for the application.', 'dependencies': ['FE-005', 'FE-006'], 'estimated_time': '16 hours', 'agent_role': 'frontend_developer', 'acceptance_criteria': ['Tests verify the entire workflow: adding a task, viewing the task list.', 'Tests cover successful and error scenarios.', 'Tests are automated.'], 'status': 'pending', 'code_files': ['cypress/integration/app.spec.js']}]}, {'name': 'Backend Phase', 'description': 'Tasks related to backend phase', 'deliverables': ['Completed BE-001', 'Completed BE-002', 'Completed BE-003', 'Completed BE-004', 'Completed BE-005', 'Completed BE-006', 'Completed TEST-001', 'Completed TEST-002'], 'estimated_duration_hours': 52.0, 'work_items': [{'id': 'BE-001', 'description': 'Set up Node.js and Express project.', 'dependencies': [], 'estimated_time': '4 hours', 'agent_role': 'backend_developer', 'acceptance_criteria': ['Project is initialized successfully.', 'Express server runs without errors.', \"Basic route (e.g., '/') responds with 'Hello World'.\"], 'status': 'pending', 'code_files': ['package.json', 'index.js']}, {'id': 'BE-002', 'description': 'Implement API endpoint for creating tasks (POST /api/v1/tasks).', 'dependencies': ['BE-001'], 'estimated_time': '8 hours', 'agent_role': 'backend_developer', 'acceptance_criteria': ['Endpoint accepts POST requests to /api/v1/tasks.', \"Endpoint receives a 'description' parameter in the request body.\", \"Endpoint validates the 'description' parameter (e.g., not empty).\", 'Endpoint returns a 201 Created status code on success.', 'Endpoint returns a 400 Bad Request status code on validation failure.'], 'status': 'pending', 'code_files': ['index.js']}, {'id': 'BE-003', 'description': 'Implement API endpoint for retrieving tasks (GET /api/v1/tasks).', 'dependencies': ['BE-001'], 'estimated_time': '4 hours', 'agent_role': 'backend_developer', 'acceptance_criteria': ['Endpoint accepts GET requests to /api/v1/tasks.', 'Endpoint returns a 200 OK status code.', 'Endpoint returns an empty array of tasks initially.'], 'status': 'pending', 'code_files': ['index.js']}, {'id': 'BE-004', 'description': 'Connect backend API to PostgreSQL database.', 'dependencies': ['BE-001', 'DB-001', 'DB-002'], 'estimated_time': '8 hours', 'agent_role': 'backend_developer', 'acceptance_criteria': ['Backend can connect to the PostgreSQL database.', 'Database connection is established without errors.'], 'status': 'pending', 'code_files': ['index.js']}, {'id': 'BE-005', 'description': 'Implement database interaction for creating tasks (POST /api/v1/tasks).', 'dependencies': ['BE-002', 'BE-004'], 'estimated_time': '8 hours', 'agent_role': 'backend_developer', 'acceptance_criteria': ['Task description is saved to the database.', 'Endpoint returns the created task (including id and created_at) in the response.', 'Database interaction does not throw errors.'], 'status': 'pending', 'code_files': ['index.js']}, {'id': 'BE-006', 'description': 'Implement database interaction for retrieving tasks (GET /api/v1/tasks).', 'dependencies': ['BE-003', 'BE-004'], 'estimated_time': '8 hours', 'agent_role': 'backend_developer', 'acceptance_criteria': ['Endpoint retrieves all tasks from the database.', 'Endpoint returns the tasks in the response.', 'Database interaction does not throw errors.'], 'status': 'pending', 'code_files': ['index.js']}, {'id': 'TEST-001', 'description': 'Unit tests for backend API (POST /api/v1/tasks).', 'dependencies': ['BE-002', 'BE-005'], 'estimated_time': '8 hours', 'agent_role': 'backend_developer', 'acceptance_criteria': ['Tests cover successful task creation.', 'Tests cover validation failures.', 'Tests cover database interaction.'], 'status': 'pending', 'code_files': ['tests/api.test.js']}, {'id': 'TEST-002', 'description': 'Unit tests for backend API (GET /api/v1/tasks).', 'dependencies': ['BE-003', 'BE-006'], 'estimated_time': '4 hours', 'agent_role': 'backend_developer', 'acceptance_criteria': ['Tests verify the retrieval of tasks from the database.', 'Tests verify the correct response format.'], 'status': 'pending', 'code_files': ['tests/api.test.js']}]}, {'name': 'Database Phase', 'description': 'Tasks related to database phase', 'deliverables': ['Completed DB-001', 'Completed DB-002'], 'estimated_duration_hours': 8.0, 'work_items': [{'id': 'DB-001', 'description': 'Set up PostgreSQL database.', 'dependencies': [], 'estimated_time': '4 hours', 'agent_role': 'database_specialist', 'acceptance_criteria': ['PostgreSQL database is installed and running.', \"Database named 'task_list' is created.\", 'User with appropriate permissions is created.'], 'status': 'pending', 'code_files': []}, {'id': 'DB-002', 'description': \"Create 'tasks' table in PostgreSQL.\", 'dependencies': ['DB-001'], 'estimated_time': '4 hours', 'agent_role': 'database_specialist', 'acceptance_criteria': [\"Table 'tasks' exists.\", \"Table has 'id' (SERIAL PRIMARY KEY), 'description' (TEXT NOT NULL), and 'created_at' (TIMESTAMP DEFAULT CURRENT_TIMESTAMP) columns.\"], 'status': 'pending', 'code_files': []}]}, {'name': 'Devops_Engineer Phase', 'description': 'Tasks related to devops_engineer phase', 'deliverables': ['Completed DEPLOY-001', 'Completed DEPLOY-002', 'Completed DEPLOY-003', 'Completed DEPLOY-004'], 'estimated_duration_hours': 36.0, 'work_items': [{'id': 'DEPLOY-001', 'description': 'Set up AWS infrastructure (EC2, RDS, S3, CloudFront).', 'dependencies': ['BE-006', 'FE-006', 'DB-002'], 'estimated_time': '16 hours', 'agent_role': 'devops_engineer', 'acceptance_criteria': ['EC2 instance is created and configured for the backend.', 'RDS instance is created and configured for the database.', 'S3 bucket is created and configured for the frontend.', 'CloudFront distribution is created and configured to serve the frontend.'], 'status': 'pending', 'code_files': []}, {'id': 'DEPLOY-002', 'description': 'Deploy the frontend to S3 and CloudFront.', 'dependencies': ['FE-006', 'DEPLOY-001'], 'estimated_time': '4 hours', 'agent_role': 'devops_engineer', 'acceptance_criteria': ['Frontend code is deployed to the S3 bucket.', 'CloudFront distribution serves the frontend from the S3 bucket.', 'Application is accessible via the CloudFront URL.'], 'status': 'pending', 'code_files': []}, {'id': 'DEPLOY-003', 'description': 'Deploy the backend to EC2.', 'dependencies': ['BE-006', 'DEPLOY-001'], 'estimated_time': '8 hours', 'agent_role': 'devops_engineer', 'acceptance_criteria': ['Backend code is deployed to the EC2 instance.', 'Backend API is running and accessible.', 'Backend connects to the RDS database.'], 'status': 'pending', 'code_files': []}, {'id': 'DEPLOY-004', 'description': 'Configure monitoring and logging.', 'dependencies': ['DEPLOY-001', 'DEPLOY-002', 'DEPLOY-003'], 'estimated_time': '8 hours', 'agent_role': 'devops_engineer', 'acceptance_criteria': ['Logging is configured for both frontend and backend (e.g., using CloudWatch).', 'Basic monitoring is set up (e.g., CPU usage, database connection).', 'Alerts are configured for critical events.'], 'status': 'pending', 'code_files': []}]}], resource_allocation=[{'role': 'Backend Developer', 'count': 1, 'estimated_time_allocation': '100%', 'phases': ['Backend Phase'], 'skills_required': []}, {'role': 'Database Specialist', 'count': 1, 'estimated_time_allocation': '100%', 'phases': ['Database Phase'], 'skills_required': []}, {'role': 'Frontend Developer', 'count': 1, 'estimated_time_allocation': '100%', 'phases': ['Frontend Phase'], 'skills_required': []}, {'role': 'Devops Engineer', 'count': 1, 'estimated_time_allocation': '100%', 'phases': ['Devops_Engineer Phase'], 'skills_required': []}], risks_and_mitigations=[], timeline={'start_date': '2025-07-08T14:41:30.742754', 'end_date': 'TBD', 'milestones': []}, tech_stack={}, metadata={'generated_at': '2025-07-08T14:41:30.742754', 'version': '1.0', 'author': 'Multi-AI Dev System', 'tags': [], 'notes': 'Converted from WorkItemBacklog. Original summary: Develop a simple web application for managing a list of tasks, including adding and viewing tasks. The application will use React for the frontend, Node.js with Express for the backend, and PostgreSQL for the database. The application will be deployed to AWS.'}) summary='Develop a simple web application for managing a list of tasks, including adding and viewing tasks. The application will use React for the frontend, Node.js with Express for the backend, and PostgreSQL for the database. The application will be deployed to AWS.' metadata=PlanMetadata(generated_at='2025-07-08T14:41:30.742754', version='1.0', author='Multi-AI Dev System', tags=[], notes='Converted from WorkItemBacklog. Original summary: Develop a simple web application for managing a list of tasks, including adding and viewing tasks. The application will use React for the frontend, Node.js with Express for the backend, and PostgreSQL for the database. The application will be deployed to AWS.')"
  }
}