{
  "session_id": "session_2bc01797-a5e6-43ee-b472-02d7f76f9453",
  "approval_type": "implementation_plan",
  "timestamp": 1751970199,
  "approval_data": {
    "type": "implementation_plan",
    "timestamp": 1751970199.3382273,
    "project_overview": "Develop a simple web application for managing a list of tasks, including adding and viewing tasks, using React for the frontend, Node.js/Express for the backend, and PostgreSQL for the database. The application will be deployed to Heroku.",
    "development_phases": [
      {
        "name": "Backend Phase",
        "description": "Tasks related to backend phase",
        "deliverables": [
          "Completed BE-001",
          "Completed BE-003",
          "Completed BE-004",
          "Completed BE-005",
          "Completed SE-001"
        ],
        "estimated_duration_hours": 32.0,
        "work_items": [
          {
            "id": "BE-001",
            "description": "Set up Node.js project and install dependencies (Express, pg, body-parser, cors).",
            "dependencies": [],
            "estimated_time": "1 day",
            "agent_role": "backend_developer",
            "acceptance_criteria": [
              "Node.js project initialized.",
              "Express.js installed.",
              "pg (PostgreSQL client) installed.",
              "body-parser installed.",
              "cors installed."
            ],
            "status": "pending",
            "code_files": [
              "package.json"
            ]
          },
          {
            "id": "BE-003",
            "description": "Implement API endpoint to create a new task (POST /api/v1/tasks).",
            "dependencies": [
              "BE-001",
              "BE-002"
            ],
            "estimated_time": "1 day",
            "agent_role": "backend_developer",
            "acceptance_criteria": [
              "Endpoint responds to POST /api/v1/tasks.",
              "Endpoint parses the 'description' from the request body.",
              "Endpoint validates the 'description' (e.g., not empty).",
              "Endpoint inserts the task into the database.",
              "Endpoint returns a 201 Created status with the new task's details (id, description, created_at) in JSON format.",
              "Handles errors and returns appropriate HTTP status codes (e.g., 400 for bad request)."
            ],
            "status": "pending",
            "code_files": [
              "src/app.js",
              "src/routes/tasks.js",
              "src/controllers/tasks.js"
            ]
          },
          {
            "id": "BE-004",
            "description": "Implement API endpoint to get all tasks (GET /api/v1/tasks).",
            "dependencies": [
              "BE-001",
              "BE-002"
            ],
            "estimated_time": "1 day",
            "agent_role": "backend_developer",
            "acceptance_criteria": [
              "Endpoint responds to GET /api/v1/tasks.",
              "Endpoint retrieves all tasks from the database.",
              "Endpoint returns a 200 OK status with a JSON array of tasks (id, description, created_at).",
              "Handles errors and returns appropriate HTTP status codes."
            ],
            "status": "pending",
            "code_files": [
              "src/app.js",
              "src/routes/tasks.js",
              "src/controllers/tasks.js"
            ]
          },
          {
            "id": "BE-005",
            "description": "Implement error handling and logging in the backend.",
            "dependencies": [
              "BE-001",
              "BE-003",
              "BE-004"
            ],
            "estimated_time": "0.5 day",
            "agent_role": "backend_developer",
            "acceptance_criteria": [
              "Implement centralized error handling.",
              "Use appropriate HTTP status codes for different error scenarios.",
              "Implement logging for application events and errors (e.g., using Winston).",
              "Log relevant information for debugging."
            ],
            "status": "pending",
            "code_files": [
              "src/app.js",
              "src/utils/logger.js"
            ]
          },
          {
            "id": "SE-001",
            "description": "Implement input validation on the backend.",
            "dependencies": [
              "BE-003"
            ],
            "estimated_time": "0.5 day",
            "agent_role": "backend_developer",
            "acceptance_criteria": [
              "Validate the 'description' field in the POST /api/v1/tasks request.",
              "Reject requests with empty or invalid descriptions.",
              "Return a 400 Bad Request error with an informative message for invalid input."
            ],
            "status": "pending",
            "code_files": [
              "src/controllers/tasks.js"
            ]
          }
        ]
      },
      {
        "name": "Database Phase",
        "description": "Tasks related to database phase",
        "deliverables": [
          "Completed BE-002"
        ],
        "estimated_duration_hours": 8.0,
        "work_items": [
          {
            "id": "BE-002",
            "description": "Create PostgreSQL database and schema (tasks table with id, description, created_at).",
            "dependencies": [
              "BE-001"
            ],
            "estimated_time": "1 day",
            "agent_role": "database_specialist",
            "acceptance_criteria": [
              "PostgreSQL database created.",
              "tasks table created with id (SERIAL PRIMARY KEY), description (TEXT NOT NULL), created_at (TIMESTAMP DEFAULT CURRENT_TIMESTAMP NOT NULL)."
            ],
            "status": "pending",
            "code_files": [
              "database/schema.sql"
            ]
          }
        ]
      },
      {
        "name": "Frontend Phase",
        "description": "Tasks related to frontend phase",
        "deliverables": [
          "Completed FE-001",
          "Completed FE-002",
          "Completed FE-003",
          "Completed FE-004",
          "Completed FE-005",
          "Completed FE-006"
        ],
        "estimated_duration_hours": 44.0,
        "work_items": [
          {
            "id": "FE-001",
            "description": "Set up React project and install dependencies (react, react-dom, react-router-dom, axios).",
            "dependencies": [],
            "estimated_time": "1 day",
            "agent_role": "frontend_developer",
            "acceptance_criteria": [
              "React project initialized (e.g., using Create React App).",
              "React, react-dom, react-router-dom, and axios installed.",
              "Basic React app running."
            ],
            "status": "pending",
            "code_files": [
              "package.json",
              "src/App.js"
            ]
          },
          {
            "id": "FE-002",
            "description": "Create UI for adding a new task (input field and add button).",
            "dependencies": [
              "FE-001"
            ],
            "estimated_time": "1 day",
            "agent_role": "frontend_developer",
            "acceptance_criteria": [
              "UI displays an input field for task description.",
              "UI displays an 'Add Task' button.",
              "Input field allows user to enter text.",
              "Button is functional (e.g., calls a function when clicked)."
            ],
            "status": "pending",
            "code_files": [
              "src/components/TaskForm.js",
              "src/App.js",
              "src/App.css"
            ]
          },
          {
            "id": "FE-003",
            "description": "Create UI for displaying the task list.",
            "dependencies": [
              "FE-001"
            ],
            "estimated_time": "1 day",
            "agent_role": "frontend_developer",
            "acceptance_criteria": [
              "UI displays a list of tasks.",
              "Each task displays its description.",
              "Tasks are displayed in a readable format."
            ],
            "status": "pending",
            "code_files": [
              "src/components/TaskList.js",
              "src/App.js",
              "src/App.css"
            ]
          },
          {
            "id": "FE-004",
            "description": "Implement API calls to the backend to create a task (POST /api/v1/tasks).",
            "dependencies": [
              "FE-002",
              "BE-003"
            ],
            "estimated_time": "1 day",
            "agent_role": "frontend_developer",
            "acceptance_criteria": [
              "When the 'Add Task' button is clicked, an API call is made to POST /api/v1/tasks.",
              "The request body includes the task description from the input field.",
              "Handles the API response (success and error).",
              "On success, the task list is updated (e.g., by fetching the updated list)."
            ],
            "status": "pending",
            "code_files": [
              "src/components/TaskForm.js",
              "src/App.js"
            ]
          },
          {
            "id": "FE-005",
            "description": "Implement API calls to the backend to retrieve tasks (GET /api/v1/tasks).",
            "dependencies": [
              "FE-003",
              "BE-004"
            ],
            "estimated_time": "1 day",
            "agent_role": "frontend_developer",
            "acceptance_criteria": [
              "On component mount (e.g., App component), an API call is made to GET /api/v1/tasks.",
              "Handles the API response (success and error).",
              "The task list is updated with the retrieved tasks."
            ],
            "status": "pending",
            "code_files": [
              "src/App.js",
              "src/components/TaskList.js"
            ]
          },
          {
            "id": "FE-006",
            "description": "Implement basic styling for the frontend.",
            "dependencies": [
              "FE-002",
              "FE-003"
            ],
            "estimated_time": "0.5 day",
            "agent_role": "frontend_developer",
            "acceptance_criteria": [
              "The UI is visually appealing.",
              "The UI is responsive (works on different screen sizes).",
              "Use CSS or a CSS framework (e.g., Bootstrap, Material UI) for styling."
            ],
            "status": "pending",
            "code_files": [
              "src/App.css",
              "src/components/TaskForm.css",
              "src/components/TaskList.css"
            ]
          }
        ]
      },
      {
        "name": "Devops_Engineer Phase",
        "description": "Tasks related to devops_engineer phase",
        "deliverables": [
          "Completed DE-001",
          "Completed DE-002",
          "Completed SE-002"
        ],
        "estimated_duration_hours": 20.0,
        "work_items": [
          {
            "id": "DE-001",
            "description": "Deploy backend to Heroku.",
            "dependencies": [
              "BE-001",
              "BE-002",
              "BE-003",
              "BE-004",
              "BE-005"
            ],
            "estimated_time": "1 day",
            "agent_role": "devops_engineer",
            "acceptance_criteria": [
              "Heroku account created.",
              "Heroku CLI installed and configured.",
              "Backend code deployed to Heroku.",
              "PostgreSQL database provisioned on Heroku.",
              "Database connection string configured in Heroku environment variables.",
              "Backend API accessible via Heroku URL."
            ],
            "status": "pending",
            "code_files": [
              "Procfile"
            ]
          },
          {
            "id": "DE-002",
            "description": "Deploy frontend to Heroku.",
            "dependencies": [
              "FE-001",
              "FE-002",
              "FE-003",
              "FE-004",
              "FE-005",
              "FE-006"
            ],
            "estimated_time": "1 day",
            "agent_role": "devops_engineer",
            "acceptance_criteria": [
              "Frontend code deployed to Heroku (e.g., using a buildpack).",
              "Frontend accessible via Heroku URL.",
              "Frontend correctly calls the backend API (using the Heroku backend URL)."
            ],
            "status": "pending",
            "code_files": []
          },
          {
            "id": "SE-002",
            "description": "Configure HTTPS on Heroku.",
            "dependencies": [
              "DE-001",
              "DE-002"
            ],
            "estimated_time": "0.5 day",
            "agent_role": "devops_engineer",
            "acceptance_criteria": [
              "Heroku automatically provides HTTPS for deployed applications.",
              "Verify that the application is served over HTTPS."
            ],
            "status": "pending",
            "code_files": []
          }
        ]
      },
      {
        "name": "Qa_Engineer Phase",
        "description": "Tasks related to qa_engineer phase",
        "deliverables": [
          "Completed TE-001"
        ],
        "estimated_duration_hours": 8.0,
        "work_items": [
          {
            "id": "TE-001",
            "description": "Perform end-to-end testing.",
            "dependencies": [
              "DE-001",
              "DE-002"
            ],
            "estimated_time": "1 day",
            "agent_role": "qa_engineer",
            "acceptance_criteria": [
              "Verify that a user can add a task.",
              "Verify that a user can see the added task in the list.",
              "Verify that the application loads quickly.",
              "Verify that the application is secure (e.g., by testing for basic vulnerabilities)."
            ],
            "status": "pending",
            "code_files": []
          }
        ]
      }
    ],
    "timeline_estimation": {
      "start_date": "2025-07-08T15:53:18.775538",
      "end_date": "TBD",
      "milestones": []
    },
    "risk_assessment": [],
    "resource_requirements": [
      {
        "role": "Database Specialist",
        "count": 1,
        "estimated_time_allocation": "100%",
        "phases": [
          "Database Phase"
        ],
        "skills_required": []
      },
      {
        "role": "Backend Developer",
        "count": 1,
        "estimated_time_allocation": "100%",
        "phases": [
          "Backend Phase"
        ],
        "skills_required": []
      },
      {
        "role": "Qa Engineer",
        "count": 1,
        "estimated_time_allocation": "100%",
        "phases": [
          "Qa_Engineer Phase"
        ],
        "skills_required": []
      },
      {
        "role": "Devops Engineer",
        "count": 1,
        "estimated_time_allocation": "100%",
        "phases": [
          "Devops_Engineer Phase"
        ],
        "skills_required": []
      },
      {
        "role": "Frontend Developer",
        "count": 1,
        "estimated_time_allocation": "100%",
        "phases": [
          "Frontend Phase"
        ],
        "skills_required": []
      }
    ],
    "deliverables": [
      "Completed BE-001",
      "Completed BE-003",
      "Completed BE-004",
      "Completed BE-005",
      "Completed SE-001",
      "Completed BE-002",
      "Completed FE-001",
      "Completed FE-002",
      "Completed FE-003",
      "Completed FE-004",
      "Completed FE-005",
      "Completed FE-006",
      "Completed DE-001",
      "Completed DE-002",
      "Completed SE-002",
      "Completed TE-001"
    ],
    "dependencies": [],
    "raw_plan": "plan=ImplementationPlan(project_summary={'title': 'Generated Project Plan', 'description': 'Develop a simple web application for managing a list of tasks, including adding and viewing tasks, using React for the frontend, Node.js/Express for the backend, and PostgreSQL for the database. The application will be deployed to Heroku.', 'overall_complexity': 'Medium', 'estimated_duration': 'TBD', 'key_challenges': [], 'success_criteria': []}, phases=[{'name': 'Backend Phase', 'description': 'Tasks related to backend phase', 'deliverables': ['Completed BE-001', 'Completed BE-003', 'Completed BE-004', 'Completed BE-005', 'Completed SE-001'], 'estimated_duration_hours': 32.0, 'work_items': [{'id': 'BE-001', 'description': 'Set up Node.js project and install dependencies (Express, pg, body-parser, cors).', 'dependencies': [], 'estimated_time': '1 day', 'agent_role': 'backend_developer', 'acceptance_criteria': ['Node.js project initialized.', 'Express.js installed.', 'pg (PostgreSQL client) installed.', 'body-parser installed.', 'cors installed.'], 'status': 'pending', 'code_files': ['package.json']}, {'id': 'BE-003', 'description': 'Implement API endpoint to create a new task (POST /api/v1/tasks).', 'dependencies': ['BE-001', 'BE-002'], 'estimated_time': '1 day', 'agent_role': 'backend_developer', 'acceptance_criteria': ['Endpoint responds to POST /api/v1/tasks.', \"Endpoint parses the 'description' from the request body.\", \"Endpoint validates the 'description' (e.g., not empty).\", 'Endpoint inserts the task into the database.', \"Endpoint returns a 201 Created status with the new task's details (id, description, created_at) in JSON format.\", 'Handles errors and returns appropriate HTTP status codes (e.g., 400 for bad request).'], 'status': 'pending', 'code_files': ['src/app.js', 'src/routes/tasks.js', 'src/controllers/tasks.js']}, {'id': 'BE-004', 'description': 'Implement API endpoint to get all tasks (GET /api/v1/tasks).', 'dependencies': ['BE-001', 'BE-002'], 'estimated_time': '1 day', 'agent_role': 'backend_developer', 'acceptance_criteria': ['Endpoint responds to GET /api/v1/tasks.', 'Endpoint retrieves all tasks from the database.', 'Endpoint returns a 200 OK status with a JSON array of tasks (id, description, created_at).', 'Handles errors and returns appropriate HTTP status codes.'], 'status': 'pending', 'code_files': ['src/app.js', 'src/routes/tasks.js', 'src/controllers/tasks.js']}, {'id': 'BE-005', 'description': 'Implement error handling and logging in the backend.', 'dependencies': ['BE-001', 'BE-003', 'BE-004'], 'estimated_time': '0.5 day', 'agent_role': 'backend_developer', 'acceptance_criteria': ['Implement centralized error handling.', 'Use appropriate HTTP status codes for different error scenarios.', 'Implement logging for application events and errors (e.g., using Winston).', 'Log relevant information for debugging.'], 'status': 'pending', 'code_files': ['src/app.js', 'src/utils/logger.js']}, {'id': 'SE-001', 'description': 'Implement input validation on the backend.', 'dependencies': ['BE-003'], 'estimated_time': '0.5 day', 'agent_role': 'backend_developer', 'acceptance_criteria': [\"Validate the 'description' field in the POST /api/v1/tasks request.\", 'Reject requests with empty or invalid descriptions.', 'Return a 400 Bad Request error with an informative message for invalid input.'], 'status': 'pending', 'code_files': ['src/controllers/tasks.js']}]}, {'name': 'Database Phase', 'description': 'Tasks related to database phase', 'deliverables': ['Completed BE-002'], 'estimated_duration_hours': 8.0, 'work_items': [{'id': 'BE-002', 'description': 'Create PostgreSQL database and schema (tasks table with id, description, created_at).', 'dependencies': ['BE-001'], 'estimated_time': '1 day', 'agent_role': 'database_specialist', 'acceptance_criteria': ['PostgreSQL database created.', 'tasks table created with id (SERIAL PRIMARY KEY), description (TEXT NOT NULL), created_at (TIMESTAMP DEFAULT CURRENT_TIMESTAMP NOT NULL).'], 'status': 'pending', 'code_files': ['database/schema.sql']}]}, {'name': 'Frontend Phase', 'description': 'Tasks related to frontend phase', 'deliverables': ['Completed FE-001', 'Completed FE-002', 'Completed FE-003', 'Completed FE-004', 'Completed FE-005', 'Completed FE-006'], 'estimated_duration_hours': 44.0, 'work_items': [{'id': 'FE-001', 'description': 'Set up React project and install dependencies (react, react-dom, react-router-dom, axios).', 'dependencies': [], 'estimated_time': '1 day', 'agent_role': 'frontend_developer', 'acceptance_criteria': ['React project initialized (e.g., using Create React App).', 'React, react-dom, react-router-dom, and axios installed.', 'Basic React app running.'], 'status': 'pending', 'code_files': ['package.json', 'src/App.js']}, {'id': 'FE-002', 'description': 'Create UI for adding a new task (input field and add button).', 'dependencies': ['FE-001'], 'estimated_time': '1 day', 'agent_role': 'frontend_developer', 'acceptance_criteria': ['UI displays an input field for task description.', \"UI displays an 'Add Task' button.\", 'Input field allows user to enter text.', 'Button is functional (e.g., calls a function when clicked).'], 'status': 'pending', 'code_files': ['src/components/TaskForm.js', 'src/App.js', 'src/App.css']}, {'id': 'FE-003', 'description': 'Create UI for displaying the task list.', 'dependencies': ['FE-001'], 'estimated_time': '1 day', 'agent_role': 'frontend_developer', 'acceptance_criteria': ['UI displays a list of tasks.', 'Each task displays its description.', 'Tasks are displayed in a readable format.'], 'status': 'pending', 'code_files': ['src/components/TaskList.js', 'src/App.js', 'src/App.css']}, {'id': 'FE-004', 'description': 'Implement API calls to the backend to create a task (POST /api/v1/tasks).', 'dependencies': ['FE-002', 'BE-003'], 'estimated_time': '1 day', 'agent_role': 'frontend_developer', 'acceptance_criteria': [\"When the 'Add Task' button is clicked, an API call is made to POST /api/v1/tasks.\", 'The request body includes the task description from the input field.', 'Handles the API response (success and error).', 'On success, the task list is updated (e.g., by fetching the updated list).'], 'status': 'pending', 'code_files': ['src/components/TaskForm.js', 'src/App.js']}, {'id': 'FE-005', 'description': 'Implement API calls to the backend to retrieve tasks (GET /api/v1/tasks).', 'dependencies': ['FE-003', 'BE-004'], 'estimated_time': '1 day', 'agent_role': 'frontend_developer', 'acceptance_criteria': ['On component mount (e.g., App component), an API call is made to GET /api/v1/tasks.', 'Handles the API response (success and error).', 'The task list is updated with the retrieved tasks.'], 'status': 'pending', 'code_files': ['src/App.js', 'src/components/TaskList.js']}, {'id': 'FE-006', 'description': 'Implement basic styling for the frontend.', 'dependencies': ['FE-002', 'FE-003'], 'estimated_time': '0.5 day', 'agent_role': 'frontend_developer', 'acceptance_criteria': ['The UI is visually appealing.', 'The UI is responsive (works on different screen sizes).', 'Use CSS or a CSS framework (e.g., Bootstrap, Material UI) for styling.'], 'status': 'pending', 'code_files': ['src/App.css', 'src/components/TaskForm.css', 'src/components/TaskList.css']}]}, {'name': 'Devops_Engineer Phase', 'description': 'Tasks related to devops_engineer phase', 'deliverables': ['Completed DE-001', 'Completed DE-002', 'Completed SE-002'], 'estimated_duration_hours': 20.0, 'work_items': [{'id': 'DE-001', 'description': 'Deploy backend to Heroku.', 'dependencies': ['BE-001', 'BE-002', 'BE-003', 'BE-004', 'BE-005'], 'estimated_time': '1 day', 'agent_role': 'devops_engineer', 'acceptance_criteria': ['Heroku account created.', 'Heroku CLI installed and configured.', 'Backend code deployed to Heroku.', 'PostgreSQL database provisioned on Heroku.', 'Database connection string configured in Heroku environment variables.', 'Backend API accessible via Heroku URL.'], 'status': 'pending', 'code_files': ['Procfile']}, {'id': 'DE-002', 'description': 'Deploy frontend to Heroku.', 'dependencies': ['FE-001', 'FE-002', 'FE-003', 'FE-004', 'FE-005', 'FE-006'], 'estimated_time': '1 day', 'agent_role': 'devops_engineer', 'acceptance_criteria': ['Frontend code deployed to Heroku (e.g., using a buildpack).', 'Frontend accessible via Heroku URL.', 'Frontend correctly calls the backend API (using the Heroku backend URL).'], 'status': 'pending', 'code_files': []}, {'id': 'SE-002', 'description': 'Configure HTTPS on Heroku.', 'dependencies': ['DE-001', 'DE-002'], 'estimated_time': '0.5 day', 'agent_role': 'devops_engineer', 'acceptance_criteria': ['Heroku automatically provides HTTPS for deployed applications.', 'Verify that the application is served over HTTPS.'], 'status': 'pending', 'code_files': []}]}, {'name': 'Qa_Engineer Phase', 'description': 'Tasks related to qa_engineer phase', 'deliverables': ['Completed TE-001'], 'estimated_duration_hours': 8.0, 'work_items': [{'id': 'TE-001', 'description': 'Perform end-to-end testing.', 'dependencies': ['DE-001', 'DE-002'], 'estimated_time': '1 day', 'agent_role': 'qa_engineer', 'acceptance_criteria': ['Verify that a user can add a task.', 'Verify that a user can see the added task in the list.', 'Verify that the application loads quickly.', 'Verify that the application is secure (e.g., by testing for basic vulnerabilities).'], 'status': 'pending', 'code_files': []}]}], resource_allocation=[{'role': 'Database Specialist', 'count': 1, 'estimated_time_allocation': '100%', 'phases': ['Database Phase'], 'skills_required': []}, {'role': 'Backend Developer', 'count': 1, 'estimated_time_allocation': '100%', 'phases': ['Backend Phase'], 'skills_required': []}, {'role': 'Qa Engineer', 'count': 1, 'estimated_time_allocation': '100%', 'phases': ['Qa_Engineer Phase'], 'skills_required': []}, {'role': 'Devops Engineer', 'count': 1, 'estimated_time_allocation': '100%', 'phases': ['Devops_Engineer Phase'], 'skills_required': []}, {'role': 'Frontend Developer', 'count': 1, 'estimated_time_allocation': '100%', 'phases': ['Frontend Phase'], 'skills_required': []}], risks_and_mitigations=[], timeline={'start_date': '2025-07-08T15:53:18.775538', 'end_date': 'TBD', 'milestones': []}, tech_stack={}, metadata={'generated_at': '2025-07-08T15:53:18.775538', 'version': '1.0', 'author': 'Multi-AI Dev System', 'tags': [], 'notes': 'Converted from WorkItemBacklog. Original summary: Develop a simple web application for managing a list of tasks, including adding and viewing tasks, using React for the frontend, Node.js/Express for the backend, and PostgreSQL for the database. The application will be deployed to Heroku.'}) summary='Develop a simple web application for managing a list of tasks, including adding and viewing tasks, using React for the frontend, Node.js/Express for the backend, and PostgreSQL for the database. The application will be deployed to Heroku.' metadata=PlanMetadata(generated_at='2025-07-08T15:53:18.775538', version='1.0', author='Multi-AI Dev System', tags=[], notes='Converted from WorkItemBacklog. Original summary: Develop a simple web application for managing a list of tasks, including adding and viewing tasks, using React for the frontend, Node.js/Express for the backend, and PostgreSQL for the database. The application will be deployed to Heroku.')"
  },
  "workflow_state_snapshot": {
    "requirements_analysis": {
      "project_name": "Hello World Task List",
      "project_summary": "A simple web application to manage a list of tasks.",
      "project_goals": [
        "Allow a user to add a task",
        "Allow a user to see their list of tasks"
      ],
      "target_audience": [
        "Users who want to manage a list of tasks"
      ],
      "business_context": "This project aims to provide a basic task management tool.",
      "requirements": [
        {
          "id": "REQ-001",
          "description": "A user can create a new task with a text description.",
          "category": "functional",
          "priority": 1
        },
        {
          "id": "REQ-002",
          "description": "A user can see a list of all created tasks.",
          "category": "functional",
          "priority": 1
        },
        {
          "id": "REQ-003",
          "description": "The application must load quickly.",
          "category": "non_functional",
          "priority": 2
        },
        {
          "id": "REQ-004",
          "description": "The application must be secure.",
          "category": "non_functional",
          "priority": 2
        }
      ],
      "functional_requirements": [
        "A user can create a new task with a text description.",
        "A user can see a list of all created tasks."
      ],
      "non_functional_requirements": [
        "The application must load quickly.",
        "The application must be secure."
      ],
      "stakeholders": [
        "Users"
      ],
      "success_criteria": [
        "Users can successfully add tasks.",
        "Users can successfully view their task list.",
        "The application loads quickly.",
        "The application is secure."
      ],
      "constraints": [],
      "assumptions": [],
      "risks": [],
      "domain_specific_details": {},
      "quality_assessment": {
        "clarity_score": 9.0,
        "completeness_score": 8.0,
        "consistency_score": 10.0,
        "recommendations": []
      },
      "gap_analysis": {
        "identified_gaps": [],
        "recommendations_for_completion": []
      }
    },
    "tech_stack_recommendation": {
      "frontend_options": [
        {
          "name": "React",
          "language": "JavaScript",
          "reasoning": "React is a popular and efficient library for building user interfaces. It offers a component-based architecture, making it easy to manage and update the UI. Its virtual DOM and efficient update mechanisms contribute to fast loading times, satisfying the non-functional requirement for speed.",
          "key_libraries": [
            "React Router (for navigation)",
            "Axios or Fetch (for API calls)",
            "Material UI or Bootstrap (for UI components)"
          ],
          "pros": [
            "Large community and extensive documentation.",
            "Component-based architecture promotes code reusability and maintainability.",
            "Virtual DOM for efficient updates.",
            "Excellent performance."
          ],
          "cons": [
            "Requires understanding of JSX.",
            "Can have a steeper learning curve for beginners.",
            "Requires additional libraries for routing and state management (though this is also a pro, as it allows for flexibility)."
          ],
          "selected": false
        },
        {
          "name": "Vue.js",
          "language": "JavaScript",
          "reasoning": "Vue.js is a progressive framework that is easy to learn and integrate. It's known for its simplicity and excellent documentation. It's a good choice for smaller projects and offers good performance.",
          "key_libraries": [
            "Vue Router (for navigation)",
            "Axios or Fetch (for API calls)",
            "Vuetify or BootstrapVue (for UI components)"
          ],
          "pros": [
            "Easy to learn and use.",
            "Excellent documentation.",
            "Good performance.",
            "Progressive framework - can be integrated into existing projects easily."
          ],
          "cons": [
            "Smaller community compared to React.",
            "May require more manual configuration for complex applications."
          ],
          "selected": false
        },
        {
          "name": "HTML, CSS, JavaScript (Vanilla)",
          "language": "JavaScript",
          "reasoning": "For a simple task list application, using vanilla JavaScript, HTML, and CSS can be a viable option. This approach avoids the overhead of a framework and simplifies the project, making it easier to understand and maintain for a small team or individual. It also provides a solid foundation for understanding web development fundamentals.",
          "key_libraries": [],
          "pros": [
            "No external dependencies.",
            "Simple and easy to understand for beginners.",
            "Fast initial setup."
          ],
          "cons": [
            "More manual DOM manipulation.",
            "Can become complex to manage for larger applications.",
            "Less efficient for complex UI updates."
          ],
          "selected": false
        }
      ],
      "backend_options": [
        {
          "name": "Node.js with Express",
          "language": "JavaScript",
          "reasoning": "Node.js with Express provides a lightweight and efficient backend solution. JavaScript is used on both the frontend and backend, which can streamline development. Express simplifies routing and middleware management, making it suitable for building RESTful APIs.",
          "key_libraries": [
            "Express.js (web framework)",
            "body-parser (for parsing request bodies)",
            "cors (for handling CORS)",
            "mongoose or Sequelize (for database interaction)"
          ],
          "pros": [
            "JavaScript on both frontend and backend (full-stack JavaScript).",
            "Large community and extensive documentation.",
            "Fast development with npm packages.",
            "Good performance with asynchronous operations."
          ],
          "cons": [
            "Callback hell can be an issue (mitigated by async/await).",
            "Requires careful error handling."
          ],
          "selected": false
        },
        {
          "name": "Python with Flask",
          "language": "Python",
          "reasoning": "Flask is a microframework that is easy to learn and use. Python is a versatile language with a large community and many libraries. Flask is a good choice for smaller projects and offers good performance.",
          "key_libraries": [
            "Flask (web framework)",
            "Flask-RESTful (for building REST APIs)",
            "SQLAlchemy or Flask-SQLAlchemy (for database interaction)"
          ],
          "pros": [
            "Easy to learn and use.",
            "Large community and extensive documentation.",
            "Good performance.",
            "Python's readability."
          ],
          "cons": [
            "Requires knowledge of Python.",
            "May require more manual configuration for complex applications."
          ],
          "selected": false
        },
        {
          "name": "Java with Spring Boot",
          "language": "Java",
          "reasoning": "Spring Boot simplifies the development of Java-based web applications. It provides a robust framework with features like dependency injection, security, and data access. Java's strong typing and mature ecosystem contribute to maintainability and scalability.",
          "key_libraries": [
            "Spring Boot (web framework)",
            "Spring Data JPA (for database interaction)",
            "Spring Security (for security)"
          ],
          "pros": [
            "Mature and robust framework.",
            "Strong typing and excellent tooling.",
            "Good for enterprise-level applications.",
            "Excellent security features."
          ],
          "cons": [
            "Steeper learning curve.",
            "More verbose code.",
            "Can be slower to develop initially."
          ],
          "selected": false
        }
      ],
      "database_options": [
        {
          "name": "PostgreSQL",
          "language": null,
          "reasoning": "PostgreSQL is a powerful, open-source relational database known for its reliability, data integrity, and extensibility. It's a good choice for this project because it can handle the data storage needs effectively and securely.",
          "key_libraries": [
            "psycopg2 (for Python)",
            "pg (for Node.js)"
          ],
          "pros": [
            "Reliable and robust.",
            "Supports complex queries and transactions.",
            "Good performance.",
            "Strong data integrity."
          ],
          "cons": [
            "Can be more complex to set up and manage than simpler databases.",
            "Requires more resources than simpler databases."
          ],
          "selected": false
        },
        {
          "name": "MongoDB",
          "language": null,
          "reasoning": "MongoDB is a NoSQL database that is easy to use and scale. It's a good choice for this project because it can handle the data storage needs effectively and securely.",
          "key_libraries": [
            "mongoose (for Node.js)",
            "pymongo (for Python)"
          ],
          "pros": [
            "Flexible schema.",
            "Easy to scale.",
            "Good performance for read operations."
          ],
          "cons": [
            "Can be more complex to manage than simpler databases.",
            "Data consistency can be an issue."
          ],
          "selected": false
        },
        {
          "name": "SQLite",
          "language": null,
          "reasoning": "SQLite is a lightweight, file-based database that is easy to set up and use. It's a good choice for this project because it is simple and requires no separate server process. It's ideal for small applications with limited data.",
          "key_libraries": [
            "sqlite3 (built-in for Python)",
            "sqlite3 (for Node.js)"
          ],
          "pros": [
            "Simple to set up and use.",
            "No separate server process required.",
            "Good for small applications."
          ],
          "cons": [
            "Not suitable for high-traffic applications.",
            "Limited scalability."
          ],
          "selected": false
        }
      ],
      "cloud_options": [
        {
          "name": "AWS (Amazon Web Services)",
          "language": null,
          "reasoning": "AWS offers a wide range of services that can be used to deploy and manage the application. It provides scalability, security, and reliability. Services like EC2, S3, and RDS can be used to host the frontend, store static assets, and manage the database, respectively.",
          "key_libraries": [
            "AWS SDK (for interacting with AWS services)"
          ],
          "pros": [
            "Highly scalable and reliable.",
            "Wide range of services.",
            "Mature ecosystem.",
            "Good security features."
          ],
          "cons": [
            "Can be complex to manage.",
            "Can be expensive if not managed properly.",
            "Steeper learning curve."
          ],
          "selected": false
        },
        {
          "name": "Google Cloud Platform (GCP)",
          "language": null,
          "reasoning": "GCP provides a comprehensive set of cloud services, including compute, storage, and database options. It offers competitive pricing and strong performance. Services like Compute Engine, Cloud Storage, and Cloud SQL can be used to deploy and manage the application.",
          "key_libraries": [
            "Google Cloud Client Libraries (for interacting with GCP services)"
          ],
          "pros": [
            "Competitive pricing.",
            "Strong performance.",
            "Good for data analytics.",
            "User-friendly interface."
          ],
          "cons": [
            "Can be complex to manage.",
            "Requires understanding of GCP services."
          ],
          "selected": false
        },
        {
          "name": "Heroku",
          "language": null,
          "reasoning": "Heroku is a Platform-as-a-Service (PaaS) that simplifies the deployment and management of web applications. It's a good choice for this project because it's easy to set up and use, and it handles the infrastructure management. It is a good option for rapid prototyping and small projects.",
          "key_libraries": [],
          "pros": [
            "Easy to deploy and manage.",
            "Handles infrastructure management.",
            "Good for rapid prototyping.",
            "Free tier available."
          ],
          "cons": [
            "Limited customization options.",
            "Can be expensive for large applications.",
            "Vendor lock-in."
          ],
          "selected": false
        }
      ],
      "architecture_options": [
        {
          "pattern": "Monolithic Architecture",
          "scalability_score": 4.0,
          "maintainability_score": 6.0,
          "development_speed_score": 8.0,
          "overall_score": 6.0,
          "reasoning": "For a simple task list application, a monolithic architecture is a good starting point. It's easier to develop and deploy initially. However, as the application grows, it can become harder to scale and maintain. The scores reflect the simplicity of the project and the potential for future growth."
        },
        {
          "pattern": "Microservices Architecture",
          "scalability_score": 8.0,
          "maintainability_score": 7.0,
          "development_speed_score": 4.0,
          "overall_score": 6.0,
          "reasoning": "While microservices offer excellent scalability and maintainability, they introduce complexity that might be unnecessary for this simple application. The development speed is lower due to the distributed nature of the architecture. The scores reflect the trade-offs between scalability and development effort."
        },
        {
          "pattern": "Serverless Architecture",
          "scalability_score": 9.0,
          "maintainability_score": 7.0,
          "development_speed_score": 6.0,
          "overall_score": 7.0,
          "reasoning": "Serverless architecture can be a good fit for this project, especially if using a cloud provider like AWS or GCP. It offers excellent scalability and reduces operational overhead. Development speed is moderate due to the need to learn serverless concepts. The scores reflect the benefits of scalability and reduced operational overhead."
        }
      ],
      "tool_options": [
        {
          "name": "Git",
          "language": null,
          "reasoning": "Essential for version control and collaboration.",
          "key_libraries": [],
          "pros": [
            "Version control.",
            "Collaboration.",
            "Branching and merging."
          ],
          "cons": [
            "Learning curve."
          ],
          "selected": false
        },
        {
          "name": "Docker",
          "language": null,
          "reasoning": "For containerization and consistent environment across different machines.",
          "key_libraries": [],
          "pros": [
            "Consistent environment.",
            "Easy deployment.",
            "Isolation."
          ],
          "cons": [
            "Learning curve.",
            "Overhead for simple projects."
          ],
          "selected": false
        },
        {
          "name": "CI/CD Pipeline (e.g., Jenkins, GitHub Actions)",
          "language": null,
          "reasoning": "Automates the build, test, and deployment process.",
          "key_libraries": [],
          "pros": [
            "Automated builds and tests.",
            "Faster deployments.",
            "Improved code quality."
          ],
          "cons": [
            "Setup complexity.",
            "Requires understanding of CI/CD concepts."
          ],
          "selected": false
        }
      ],
      "risks": [
        {
          "category": "Security",
          "description": "Vulnerabilities in dependencies could lead to security breaches. This is especially true if using older or unmaintained libraries.",
          "severity": "Medium",
          "likelihood": "Medium",
          "mitigation": "Regularly update dependencies and use security scanners to identify and address vulnerabilities. Implement secure coding practices."
        },
        {
          "category": "Scalability",
          "description": "The application may not scale well if the database or backend is not designed to handle increased load.",
          "severity": "Medium",
          "likelihood": "Low",
          "mitigation": "Choose a database and architecture that can scale. Implement caching and load balancing if needed. Monitor performance and scale resources as required."
        },
        {
          "category": "Performance",
          "description": "Slow loading times or inefficient queries could degrade user experience.",
          "severity": "Medium",
          "likelihood": "Medium",
          "mitigation": "Optimize database queries. Implement caching. Use a content delivery network (CDN) for static assets. Minimize the size of assets."
        },
        {
          "category": "Complexity",
          "description": "Choosing overly complex technologies or architecture patterns could slow down development and increase maintenance costs.",
          "severity": "Low",
          "likelihood": "Medium",
          "mitigation": "Start with a simple architecture and technology stack. Avoid over-engineering. Refactor and optimize as needed."
        }
      ],
      "synthesis": {
        "backend": {
          "language": "JavaScript",
          "framework": "Node.js with Express",
          "reasoning": "Node.js with Express provides a lightweight and efficient backend solution. JavaScript is used on both the frontend and backend, which can streamline development. Express simplifies routing and middleware management, making it suitable for building RESTful APIs."
        },
        "frontend": {
          "language": "JavaScript",
          "framework": "React",
          "reasoning": "React is a popular and efficient library for building user interfaces. It offers a component-based architecture, making it easy to manage and update the UI. Its virtual DOM and efficient update mechanisms contribute to fast loading times, satisfying the non-functional requirement for speed."
        },
        "database": {
          "type": "PostgreSQL",
          "reasoning": "PostgreSQL is a powerful, open-source relational database known for its reliability, data integrity, and extensibility. It's a good choice for this project because it can handle the data storage needs effectively and securely."
        },
        "architecture_pattern": "Monolithic Architecture",
        "deployment_environment": {
          "cloud_provider": "Heroku",
          "reasoning": "Heroku is a Platform-as-a-Service (PaaS) that simplifies the deployment and management of web applications. It's a good choice for this project because it's easy to set up and use, and it handles the infrastructure management. It is a good option for rapid prototyping and small projects."
        },
        "key_libraries_tools": [
          {
            "name": "React Router",
            "purpose": "For navigation in the React frontend."
          },
          {
            "name": "Axios",
            "purpose": "For making API calls from the frontend."
          },
          {
            "name": "Express.js",
            "purpose": "For building the backend API."
          },
          {
            "name": "body-parser",
            "purpose": "For parsing request bodies in Express."
          },
          {
            "name": "PostgreSQL",
            "purpose": "For storing the task data."
          },
          {
            "name": "Git",
            "purpose": "For version control."
          }
        ],
        "estimated_complexity": "Low"
      },
      "selected_stack": null
    },
    "system_design": {
      "architecture": {
        "pattern": "Monolithic Architecture",
        "justification": "For a simple task list application, a monolithic architecture is a good starting point. It's easier to develop and deploy initially. The project's limited scope and the team's focus on rapid development make this the most suitable choice.",
        "key_benefits": [
          "Faster development and deployment.",
          "Simplified codebase.",
          "Easier to manage for a small team."
        ],
        "potential_drawbacks": [
          "Scalability limitations as the application grows.",
          "Tightly coupled components can make it harder to maintain."
        ]
      },
      "components": [
        {
          "name": "Frontend",
          "description": "The user interface for interacting with the task list application.",
          "category": "frontend",
          "technologies": [
            "React",
            "JavaScript",
            "HTML",
            "CSS"
          ],
          "dependencies": [
            "Backend API"
          ],
          "responsibilities": [
            "Displaying the task list.",
            "Allowing users to add new tasks.",
            "Handling user interactions.",
            "Making API calls to the backend."
          ],
          "design_patterns": [
            "Component-based architecture"
          ]
        },
        {
          "name": "Backend API",
          "description": "Provides the API endpoints for the frontend to interact with the task data.",
          "category": "backend",
          "technologies": [
            "Node.js",
            "Express.js",
            "JavaScript"
          ],
          "dependencies": [
            "Database"
          ],
          "responsibilities": [
            "Handling API requests.",
            "Validating data.",
            "Interacting with the database.",
            "Returning data to the frontend."
          ],
          "design_patterns": [
            "RESTful API"
          ]
        },
        {
          "name": "Database",
          "description": "Stores the task data.",
          "category": "backend",
          "technologies": [
            "PostgreSQL"
          ],
          "dependencies": [],
          "responsibilities": [
            "Storing task data.",
            "Providing data access to the backend API."
          ],
          "design_patterns": []
        },
        {
          "name": "Deployment Environment",
          "description": "The environment where the application is deployed.",
          "category": "infrastructure",
          "technologies": [
            "Heroku"
          ],
          "dependencies": [
            "Frontend",
            "Backend API",
            "Database"
          ],
          "responsibilities": [
            "Hosting the frontend.",
            "Hosting the backend API.",
            "Managing the database.",
            "Providing a secure and scalable environment."
          ],
          "design_patterns": []
        }
      ],
      "data_model": {
        "schema_type": "Relational",
        "tables": [
          {
            "name": "tasks",
            "purpose": "Stores the tasks created by users.",
            "fields": [
              {
                "name": "id",
                "type": "SERIAL",
                "constraints": [
                  "PRIMARY KEY"
                ],
                "description": "Unique identifier for the task."
              },
              {
                "name": "description",
                "type": "TEXT",
                "constraints": [
                  "NOT NULL"
                ],
                "description": "The text description of the task."
              },
              {
                "name": "created_at",
                "type": "TIMESTAMP",
                "constraints": [
                  "NOT NULL",
                  "DEFAULT CURRENT_TIMESTAMP"
                ],
                "description": "The timestamp when the task was created."
              }
            ],
            "relationships": []
          }
        ],
        "relationships": [],
        "justification": "Relational database provides data integrity and structure, suitable for storing and retrieving task data efficiently."
      },
      "api_endpoints": {
        "style": "REST",
        "base_url": "/api/v1",
        "authentication": "None (for simplicity)",
        "endpoints": [
          {
            "method": "POST",
            "path": "/tasks",
            "purpose": "Create a new task.",
            "parameters": [
              {
                "description": "The task description",
                "type": "string",
                "name": "description"
              }
            ],
            "response": {
              "201": {
                "description": "Task created successfully.",
                "example": {
                  "id": 1,
                  "description": "Grocery shopping",
                  "created_at": "2024-01-01T12:00:00.000Z"
                }
              },
              "400": {
                "description": "Bad Request - Invalid input."
              }
            },
            "authentication_required": false,
            "rate_limiting_applied": false
          },
          {
            "method": "GET",
            "path": "/tasks",
            "purpose": "Get all tasks.",
            "parameters": [],
            "response": {
              "200": {
                "description": "List of tasks.",
                "example": [
                  {
                    "id": 1,
                    "description": "Grocery shopping",
                    "created_at": "2024-01-01T12:00:00.000Z"
                  },
                  {
                    "id": 2,
                    "description": "Pay bills",
                    "created_at": "2024-01-02T10:00:00.000Z"
                  }
                ]
              }
            },
            "authentication_required": false,
            "rate_limiting_applied": false
          }
        ],
        "error_handling": "Standard HTTP status codes and informative error messages.",
        "rate_limiting_strategy": null
      },
      "security": {
        "authentication_method": "None (for simplicity)",
        "authorization_strategy": "None (for simplicity)",
        "data_encryption": {
          "in_transit": "HTTPS (provided by Heroku)",
          "at_rest": "Not applicable (for simplicity)"
        },
        "security_measures": [
          {
            "category": "Input Validation",
            "implementation": "Validate all user inputs on the backend to prevent injection attacks.",
            "mitigation": "SQL Injection, Cross-Site Scripting (XSS)",
            "priority": "High"
          },
          {
            "category": "Dependency Management",
            "implementation": "Regularly update dependencies to address known vulnerabilities.",
            "mitigation": "Vulnerabilities in dependencies",
            "priority": "Medium"
          },
          {
            "category": "HTTPS",
            "implementation": "Enforce HTTPS for all communication.",
            "mitigation": "Man-in-the-middle attacks",
            "priority": "High"
          }
        ],
        "vulnerability_mitigation_strategies": [
          "Input validation",
          "Regular dependency updates",
          "Use of HTTPS",
          "Sanitize output"
        ],
        "compliance_standards": []
      },
      "scalability_and_performance": {
        "caching": "Implement client-side caching for static assets.",
        "database_optimization": "Optimize database queries and indexes.",
        "cdn": "Use a CDN for static assets if needed."
      },
      "deployment_strategy": {
        "environment": "Heroku",
        "steps": [
          "Create a Heroku application.",
          "Configure the application to use PostgreSQL.",
          "Deploy the backend code.",
          "Deploy the frontend code (e.g., using a buildpack).",
          "Configure environment variables (e.g., database connection string)."
        ]
      },
      "monitoring_and_logging": {
        "logging": "Use a logging library (e.g., Winston for Node.js) to log application events and errors.",
        "monitoring": "Use Heroku's built-in monitoring tools or integrate with a third-party service (e.g., New Relic)."
      },
      "error_handling_strategy": "Centralized error handling with informative error messages and appropriate HTTP status codes.",
      "development_phases_overview": [
        {
          "name": "Phase 1: Setup and Backend Development",
          "description": "Setting up the project, creating the backend API with Node.js and Express, and connecting to the PostgreSQL database.",
          "priority": "High",
          "dependencies": [],
          "tasks": [
            "Set up the Node.js project.",
            "Install necessary dependencies (Express, pg, body-parser, etc.).",
            "Create the PostgreSQL database and schema.",
            "Implement API endpoints for creating and retrieving tasks.",
            "Test the API endpoints."
          ],
          "estimated_duration": "1 week"
        },
        {
          "name": "Phase 2: Frontend Development",
          "description": "Developing the frontend with React, including the UI for adding and viewing tasks, and integrating with the backend API.",
          "priority": "High",
          "dependencies": [
            "Phase 1: Setup and Backend Development"
          ],
          "tasks": [
            "Set up the React project.",
            "Install necessary dependencies (React Router, Axios, etc.).",
            "Design and implement the UI for adding tasks.",
            "Design and implement the UI for viewing tasks.",
            "Implement API calls to the backend.",
            "Test the frontend."
          ],
          "estimated_duration": "1 week"
        },
        {
          "name": "Phase 3: Deployment and Testing",
          "description": "Deploying the application to Heroku and performing thorough testing.",
          "priority": "High",
          "dependencies": [
            "Phase 1: Setup and Backend Development",
            "Phase 2: Frontend Development"
          ],
          "tasks": [
            "Deploy the backend to Heroku.",
            "Deploy the frontend to Heroku.",
            "Configure environment variables.",
            "Perform end-to-end testing.",
            "Address any bugs or issues."
          ],
          "estimated_duration": "1 week"
        }
      ],
      "key_risks": [
        "Security vulnerabilities in dependencies.",
        "Performance bottlenecks in the database or backend.",
        "Scalability limitations if the application grows."
      ],
      "design_justification": "The design prioritizes simplicity and rapid development, aligning with the project's goals. The monolithic architecture, combined with the chosen technologies, allows for a quick setup and deployment. The use of Heroku simplifies infrastructure management, allowing the team to focus on building the core features. Security measures are implemented to protect against common web vulnerabilities.",
      "data_flow": "1. User interacts with the React frontend to add a task. 2. Frontend sends a POST request to the /api/v1/tasks endpoint of the Node.js/Express backend. 3. Backend validates the request data. 4. Backend interacts with the PostgreSQL database to store the task. 5. Backend returns a 201 Created response with the new task's details. 6. User interacts with the React frontend to view the task list. 7. Frontend sends a GET request to the /api/v1/tasks endpoint. 8. Backend retrieves all tasks from the PostgreSQL database. 9. Backend returns a 200 OK response with the list of tasks in JSON format. 10. Frontend displays the task list."
    },
    "implementation_plan": "plan=ImplementationPlan(project_summary={'title': 'Generated Project Plan', 'description': 'Develop a simple web application for managing a list of tasks, including adding and viewing tasks, using React for the frontend, Node.js/Express for the backend, and PostgreSQL for the database. The application will be deployed to Heroku.', 'overall_complexity': 'Medium', 'estimated_duration': 'TBD', 'key_challenges': [], 'success_criteria': []}, phases=[{'name': 'Backend Phase', 'description': 'Tasks related to backend phase', 'deliverables': ['Completed BE-001', 'Completed BE-003', 'Completed BE-004', 'Completed BE-005', 'Completed SE-001'], 'estimated_duration_hours': 32.0, 'work_items': [{'id': 'BE-001', 'description': 'Set up Node.js project and install dependencies (Express, pg, body-parser, cors).', 'dependencies': [], 'estimated_time': '1 day', 'agent_role': 'backend_developer', 'acceptance_criteria': ['Node.js project initialized.', 'Express.js installed.', 'pg (PostgreSQL client) installed.', 'body-parser installed.', 'cors installed.'], 'status': 'pending', 'code_files': ['package.json']}, {'id': 'BE-003', 'description': 'Implement API endpoint to create a new task (POST /api/v1/tasks).', 'dependencies': ['BE-001', 'BE-002'], 'estimated_time': '1 day', 'agent_role': 'backend_developer', 'acceptance_criteria': ['Endpoint responds to POST /api/v1/tasks.', \"Endpoint parses the 'description' from the request body.\", \"Endpoint validates the 'description' (e.g., not empty).\", 'Endpoint inserts the task into the database.', \"Endpoint returns a 201 Created status with the new task's details (id, description, created_at) in JSON format.\", 'Handles errors and returns appropriate HTTP status codes (e.g., 400 for bad request).'], 'status': 'pending', 'code_files': ['src/app.js', 'src/routes/tasks.js', 'src/controllers/tasks.js']}, {'id': 'BE-004', 'description': 'Implement API endpoint to get all tasks (GET /api/v1/tasks).', 'dependencies': ['BE-001', 'BE-002'], 'estimated_time': '1 day', 'agent_role': 'backend_developer', 'acceptance_criteria': ['Endpoint responds to GET /api/v1/tasks.', 'Endpoint retrieves all tasks from the database.', 'Endpoint returns a 200 OK status with a JSON array of tasks (id, description, created_at).', 'Handles errors and returns appropriate HTTP status codes.'], 'status': 'pending', 'code_files': ['src/app.js', 'src/routes/tasks.js', 'src/controllers/tasks.js']}, {'id': 'BE-005', 'description': 'Implement error handling and logging in the backend.', 'dependencies': ['BE-001', 'BE-003', 'BE-004'], 'estimated_time': '0.5 day', 'agent_role': 'backend_developer', 'acceptance_criteria': ['Implement centralized error handling.', 'Use appropriate HTTP status codes for different error scenarios.', 'Implement logging for application events and errors (e.g., using Winston).', 'Log relevant information for debugging.'], 'status': 'pending', 'code_files': ['src/app.js', 'src/utils/logger.js']}, {'id': 'SE-001', 'description': 'Implement input validation on the backend.', 'dependencies': ['BE-003'], 'estimated_time': '0.5 day', 'agent_role': 'backend_developer', 'acceptance_criteria': [\"Validate the 'description' field in the POST /api/v1/tasks request.\", 'Reject requests with empty or invalid descriptions.', 'Return a 400 Bad Request error with an informative message for invalid input.'], 'status': 'pending', 'code_files': ['src/controllers/tasks.js']}]}, {'name': 'Database Phase', 'description': 'Tasks related to database phase', 'deliverables': ['Completed BE-002'], 'estimated_duration_hours': 8.0, 'work_items': [{'id': 'BE-002', 'description': 'Create PostgreSQL database and schema (tasks table with id, description, created_at).', 'dependencies': ['BE-001'], 'estimated_time': '1 day', 'agent_role': 'database_specialist', 'acceptance_criteria': ['PostgreSQL database created.', 'tasks table created with id (SERIAL PRIMARY KEY), description (TEXT NOT NULL), created_at (TIMESTAMP DEFAULT CURRENT_TIMESTAMP NOT NULL).'], 'status': 'pending', 'code_files': ['database/schema.sql']}]}, {'name': 'Frontend Phase', 'description': 'Tasks related to frontend phase', 'deliverables': ['Completed FE-001', 'Completed FE-002', 'Completed FE-003', 'Completed FE-004', 'Completed FE-005', 'Completed FE-006'], 'estimated_duration_hours': 44.0, 'work_items': [{'id': 'FE-001', 'description': 'Set up React project and install dependencies (react, react-dom, react-router-dom, axios).', 'dependencies': [], 'estimated_time': '1 day', 'agent_role': 'frontend_developer', 'acceptance_criteria': ['React project initialized (e.g., using Create React App).', 'React, react-dom, react-router-dom, and axios installed.', 'Basic React app running.'], 'status': 'pending', 'code_files': ['package.json', 'src/App.js']}, {'id': 'FE-002', 'description': 'Create UI for adding a new task (input field and add button).', 'dependencies': ['FE-001'], 'estimated_time': '1 day', 'agent_role': 'frontend_developer', 'acceptance_criteria': ['UI displays an input field for task description.', \"UI displays an 'Add Task' button.\", 'Input field allows user to enter text.', 'Button is functional (e.g., calls a function when clicked).'], 'status': 'pending', 'code_files': ['src/components/TaskForm.js', 'src/App.js', 'src/App.css']}, {'id': 'FE-003', 'description': 'Create UI for displaying the task list.', 'dependencies': ['FE-001'], 'estimated_time': '1 day', 'agent_role': 'frontend_developer', 'acceptance_criteria': ['UI displays a list of tasks.', 'Each task displays its description.', 'Tasks are displayed in a readable format.'], 'status': 'pending', 'code_files': ['src/components/TaskList.js', 'src/App.js', 'src/App.css']}, {'id': 'FE-004', 'description': 'Implement API calls to the backend to create a task (POST /api/v1/tasks).', 'dependencies': ['FE-002', 'BE-003'], 'estimated_time': '1 day', 'agent_role': 'frontend_developer', 'acceptance_criteria': [\"When the 'Add Task' button is clicked, an API call is made to POST /api/v1/tasks.\", 'The request body includes the task description from the input field.', 'Handles the API response (success and error).', 'On success, the task list is updated (e.g., by fetching the updated list).'], 'status': 'pending', 'code_files': ['src/components/TaskForm.js', 'src/App.js']}, {'id': 'FE-005', 'description': 'Implement API calls to the backend to retrieve tasks (GET /api/v1/tasks).', 'dependencies': ['FE-003', 'BE-004'], 'estimated_time': '1 day', 'agent_role': 'frontend_developer', 'acceptance_criteria': ['On component mount (e.g., App component), an API call is made to GET /api/v1/tasks.', 'Handles the API response (success and error).', 'The task list is updated with the retrieved tasks.'], 'status': 'pending', 'code_files': ['src/App.js', 'src/components/TaskList.js']}, {'id': 'FE-006', 'description': 'Implement basic styling for the frontend.', 'dependencies': ['FE-002', 'FE-003'], 'estimated_time': '0.5 day', 'agent_role': 'frontend_developer', 'acceptance_criteria': ['The UI is visually appealing.', 'The UI is responsive (works on different screen sizes).', 'Use CSS or a CSS framework (e.g., Bootstrap, Material UI) for styling.'], 'status': 'pending', 'code_files': ['src/App.css', 'src/components/TaskForm.css', 'src/components/TaskList.css']}]}, {'name': 'Devops_Engineer Phase', 'description': 'Tasks related to devops_engineer phase', 'deliverables': ['Completed DE-001', 'Completed DE-002', 'Completed SE-002'], 'estimated_duration_hours': 20.0, 'work_items': [{'id': 'DE-001', 'description': 'Deploy backend to Heroku.', 'dependencies': ['BE-001', 'BE-002', 'BE-003', 'BE-004', 'BE-005'], 'estimated_time': '1 day', 'agent_role': 'devops_engineer', 'acceptance_criteria': ['Heroku account created.', 'Heroku CLI installed and configured.', 'Backend code deployed to Heroku.', 'PostgreSQL database provisioned on Heroku.', 'Database connection string configured in Heroku environment variables.', 'Backend API accessible via Heroku URL.'], 'status': 'pending', 'code_files': ['Procfile']}, {'id': 'DE-002', 'description': 'Deploy frontend to Heroku.', 'dependencies': ['FE-001', 'FE-002', 'FE-003', 'FE-004', 'FE-005', 'FE-006'], 'estimated_time': '1 day', 'agent_role': 'devops_engineer', 'acceptance_criteria': ['Frontend code deployed to Heroku (e.g., using a buildpack).', 'Frontend accessible via Heroku URL.', 'Frontend correctly calls the backend API (using the Heroku backend URL).'], 'status': 'pending', 'code_files': []}, {'id': 'SE-002', 'description': 'Configure HTTPS on Heroku.', 'dependencies': ['DE-001', 'DE-002'], 'estimated_time': '0.5 day', 'agent_role': 'devops_engineer', 'acceptance_criteria': ['Heroku automatically provides HTTPS for deployed applications.', 'Verify that the application is served over HTTPS.'], 'status': 'pending', 'code_files': []}]}, {'name': 'Qa_Engineer Phase', 'description': 'Tasks related to qa_engineer phase', 'deliverables': ['Completed TE-001'], 'estimated_duration_hours': 8.0, 'work_items': [{'id': 'TE-001', 'description': 'Perform end-to-end testing.', 'dependencies': ['DE-001', 'DE-002'], 'estimated_time': '1 day', 'agent_role': 'qa_engineer', 'acceptance_criteria': ['Verify that a user can add a task.', 'Verify that a user can see the added task in the list.', 'Verify that the application loads quickly.', 'Verify that the application is secure (e.g., by testing for basic vulnerabilities).'], 'status': 'pending', 'code_files': []}]}], resource_allocation=[{'role': 'Database Specialist', 'count': 1, 'estimated_time_allocation': '100%', 'phases': ['Database Phase'], 'skills_required': []}, {'role': 'Backend Developer', 'count': 1, 'estimated_time_allocation': '100%', 'phases': ['Backend Phase'], 'skills_required': []}, {'role': 'Qa Engineer', 'count': 1, 'estimated_time_allocation': '100%', 'phases': ['Qa_Engineer Phase'], 'skills_required': []}, {'role': 'Devops Engineer', 'count': 1, 'estimated_time_allocation': '100%', 'phases': ['Devops_Engineer Phase'], 'skills_required': []}, {'role': 'Frontend Developer', 'count': 1, 'estimated_time_allocation': '100%', 'phases': ['Frontend Phase'], 'skills_required': []}], risks_and_mitigations=[], timeline={'start_date': '2025-07-08T15:53:18.775538', 'end_date': 'TBD', 'milestones': []}, tech_stack={}, metadata={'generated_at': '2025-07-08T15:53:18.775538', 'version': '1.0', 'author': 'Multi-AI Dev System', 'tags': [], 'notes': 'Converted from WorkItemBacklog. Original summary: Develop a simple web application for managing a list of tasks, including adding and viewing tasks, using React for the frontend, Node.js/Express for the backend, and PostgreSQL for the database. The application will be deployed to Heroku.'}) summary='Develop a simple web application for managing a list of tasks, including adding and viewing tasks, using React for the frontend, Node.js/Express for the backend, and PostgreSQL for the database. The application will be deployed to Heroku.' metadata=PlanMetadata(generated_at='2025-07-08T15:53:18.775538', version='1.0', author='Multi-AI Dev System', tags=[], notes='Converted from WorkItemBacklog. Original summary: Develop a simple web application for managing a list of tasks, including adding and viewing tasks, using React for the frontend, Node.js/Express for the backend, and PostgreSQL for the database. The application will be deployed to Heroku.')"
  }
}