{
  "session_id": "session_257bce7f-198c-4b36-b43b-47ada516ef65",
  "approval_type": "implementation_plan",
  "timestamp": 1751996538,
  "approval_data": {
    "type": "implementation_plan",
    "timestamp": 1751996538.4306695,
    "project_overview": "Develop a simple web application for managing a list of tasks, including adding and viewing tasks. The application will use React for the frontend, Node.js and Express for the backend, and MongoDB for data storage. The application will be deployed to AWS.",
    "development_phases": [
      {
        "name": "Frontend Phase",
        "description": "Tasks related to frontend phase",
        "deliverables": [
          "Completed FE-001",
          "Completed FE-002",
          "Completed FE-003",
          "Completed FE-004",
          "Completed FE-005",
          "Completed FE-006",
          "Completed TEST-001"
        ],
        "estimated_duration_hours": 40.0,
        "work_items": [
          {
            "id": "FE-001",
            "description": "Set up React project with necessary dependencies (e.g., create-react-app, or Vite).",
            "dependencies": [],
            "estimated_time": "4 hours",
            "agent_role": "frontend_developer",
            "acceptance_criteria": [
              "Project initializes successfully.",
              "Basic project structure is in place.",
              "Required dependencies are installed."
            ],
            "status": "pending",
            "code_files": [
              "package.json",
              "src/App.js",
              "src/index.js"
            ]
          },
          {
            "id": "FE-002",
            "description": "Design and implement the UI for adding a new task (input field and add button).",
            "dependencies": [
              "FE-001"
            ],
            "estimated_time": "6 hours",
            "agent_role": "frontend_developer",
            "acceptance_criteria": [
              "UI elements for task input and adding are present.",
              "UI elements are styled appropriately.",
              "UI is responsive."
            ],
            "status": "pending",
            "code_files": [
              "src/App.js",
              "src/App.css"
            ]
          },
          {
            "id": "FE-003",
            "description": "Design and implement the UI for displaying the list of tasks.",
            "dependencies": [
              "FE-001"
            ],
            "estimated_time": "6 hours",
            "agent_role": "frontend_developer",
            "acceptance_criteria": [
              "UI displays a list of tasks.",
              "Each task is displayed clearly.",
              "UI is responsive."
            ],
            "status": "pending",
            "code_files": [
              "src/App.js",
              "src/App.css"
            ]
          },
          {
            "id": "FE-004",
            "description": "Implement basic styling for the frontend (using CSS or a UI library).",
            "dependencies": [
              "FE-002",
              "FE-003"
            ],
            "estimated_time": "4 hours",
            "agent_role": "frontend_developer",
            "acceptance_criteria": [
              "UI elements are styled consistently.",
              "UI is visually appealing.",
              "UI is readable."
            ],
            "status": "pending",
            "code_files": [
              "src/App.css"
            ]
          },
          {
            "id": "FE-005",
            "description": "Implement API calls to the backend for creating tasks.",
            "dependencies": [
              "FE-002",
              "BE-004"
            ],
            "estimated_time": "6 hours",
            "agent_role": "frontend_developer",
            "acceptance_criteria": [
              "Frontend makes a POST request to /api/tasks when the add button is clicked.",
              "Frontend sends the task description in the request body.",
              "Frontend handles the API response (success and error).",
              "Frontend updates the UI after successful task creation."
            ],
            "status": "pending",
            "code_files": [
              "src/App.js"
            ]
          },
          {
            "id": "FE-006",
            "description": "Implement API calls to the backend for retrieving tasks.",
            "dependencies": [
              "FE-003",
              "BE-005"
            ],
            "estimated_time": "6 hours",
            "agent_role": "frontend_developer",
            "acceptance_criteria": [
              "Frontend makes a GET request to /api/tasks on component mount.",
              "Frontend displays the retrieved tasks in the list.",
              "Frontend handles the API response (success and error).",
              "Frontend updates the UI with the retrieved tasks."
            ],
            "status": "pending",
            "code_files": [
              "src/App.js"
            ]
          },
          {
            "id": "TEST-001",
            "description": "Write unit tests for frontend components (e.g., App.js).",
            "dependencies": [
              "FE-001",
              "FE-002",
              "FE-003",
              "FE-005",
              "FE-006"
            ],
            "estimated_time": "8 hours",
            "agent_role": "frontend_developer",
            "acceptance_criteria": [
              "Tests cover the main functionalities of the frontend components.",
              "Tests use a testing framework (e.g., Jest).",
              "Tests pass successfully.",
              "Test coverage is adequate."
            ],
            "status": "pending",
            "code_files": [
              "src/App.test.js"
            ]
          }
        ]
      },
      {
        "name": "Backend Phase",
        "description": "Tasks related to backend phase",
        "deliverables": [
          "Completed BE-001",
          "Completed BE-002",
          "Completed BE-003",
          "Completed BE-004",
          "Completed BE-005",
          "Completed TEST-002"
        ],
        "estimated_duration_hours": 34.0,
        "work_items": [
          {
            "id": "BE-001",
            "description": "Set up Node.js and Express project.",
            "dependencies": [],
            "estimated_time": "4 hours",
            "agent_role": "backend_developer",
            "acceptance_criteria": [
              "Project initializes successfully.",
              "Basic project structure is in place.",
              "Express.js is installed and running.",
              "Project can serve a 'Hello World' response."
            ],
            "status": "pending",
            "code_files": [
              "package.json",
              "index.js"
            ]
          },
          {
            "id": "BE-002",
            "description": "Install and configure MongoDB and Mongoose.",
            "dependencies": [
              "BE-001"
            ],
            "estimated_time": "4 hours",
            "agent_role": "backend_developer",
            "acceptance_criteria": [
              "MongoDB is installed and running.",
              "Mongoose is installed.",
              "Connection to MongoDB is established."
            ],
            "status": "pending",
            "code_files": [
              "index.js",
              "models/task.js"
            ]
          },
          {
            "id": "BE-003",
            "description": "Create a Task model with 'description' and 'created_at' fields.",
            "dependencies": [
              "BE-002"
            ],
            "estimated_time": "4 hours",
            "agent_role": "backend_developer",
            "acceptance_criteria": [
              "Task model is defined in Mongoose.",
              "Model includes 'description' (String, required) and 'created_at' (Date, default now) fields.",
              "Model is correctly exported."
            ],
            "status": "pending",
            "code_files": [
              "models/task.js"
            ]
          },
          {
            "id": "BE-004",
            "description": "Implement API endpoint to create a new task (POST /api/tasks).",
            "dependencies": [
              "BE-003"
            ],
            "estimated_time": "8 hours",
            "agent_role": "backend_developer",
            "acceptance_criteria": [
              "Endpoint handles POST requests to /api/tasks.",
              "Endpoint receives 'description' in the request body.",
              "Endpoint validates the 'description' field.",
              "Endpoint saves the task to the database.",
              "Endpoint returns a 201 status code on success with the created task.",
              "Endpoint returns appropriate error codes and messages on failure."
            ],
            "status": "pending",
            "code_files": [
              "index.js"
            ]
          },
          {
            "id": "BE-005",
            "description": "Implement API endpoint to retrieve all tasks (GET /api/tasks).",
            "dependencies": [
              "BE-003"
            ],
            "estimated_time": "6 hours",
            "agent_role": "backend_developer",
            "acceptance_criteria": [
              "Endpoint handles GET requests to /api/tasks.",
              "Endpoint retrieves all tasks from the database.",
              "Endpoint returns a 200 status code on success with the list of tasks.",
              "Endpoint returns appropriate error codes and messages on failure."
            ],
            "status": "pending",
            "code_files": [
              "index.js"
            ]
          },
          {
            "id": "TEST-002",
            "description": "Write unit tests for backend API endpoints.",
            "dependencies": [
              "BE-004",
              "BE-005"
            ],
            "estimated_time": "8 hours",
            "agent_role": "backend_developer",
            "acceptance_criteria": [
              "Tests cover the API endpoints (POST /api/tasks, GET /api/tasks).",
              "Tests use a testing framework (e.g., Jest, Mocha).",
              "Tests mock database interactions.",
              "Tests pass successfully.",
              "Test coverage is adequate."
            ],
            "status": "pending",
            "code_files": [
              "tests/api.test.js"
            ]
          }
        ]
      },
      {
        "name": "Devops_Engineer Phase",
        "description": "Tasks related to devops_engineer phase",
        "deliverables": [
          "Completed DEPLOY-001",
          "Completed DEPLOY-002",
          "Completed MONITOR-001"
        ],
        "estimated_duration_hours": 20.0,
        "work_items": [
          {
            "id": "DEPLOY-001",
            "description": "Deploy frontend to S3 and configure CloudFront.",
            "dependencies": [
              "FE-001",
              "FE-002",
              "FE-003",
              "FE-004",
              "FE-005",
              "FE-006",
              "TEST-001"
            ],
            "estimated_time": "8 hours",
            "agent_role": "devops_engineer",
            "acceptance_criteria": [
              "Frontend code is built and deployed to S3.",
              "CloudFront distribution is configured to serve the frontend.",
              "Frontend is accessible via the CloudFront URL.",
              "HTTPS is enabled."
            ],
            "status": "pending",
            "code_files": []
          },
          {
            "id": "DEPLOY-002",
            "description": "Deploy backend to EC2.",
            "dependencies": [
              "BE-001",
              "BE-002",
              "BE-003",
              "BE-004",
              "BE-005",
              "TEST-002"
            ],
            "estimated_time": "8 hours",
            "agent_role": "devops_engineer",
            "acceptance_criteria": [
              "Backend code is deployed to an EC2 instance.",
              "Backend is running and accessible.",
              "Database connection is established.",
              "HTTPS is enabled (e.g., using a load balancer and SSL certificate)."
            ],
            "status": "pending",
            "code_files": []
          },
          {
            "id": "MONITOR-001",
            "description": "Configure basic monitoring and logging (e.g., AWS CloudWatch).",
            "dependencies": [
              "DEPLOY-002"
            ],
            "estimated_time": "4 hours",
            "agent_role": "devops_engineer",
            "acceptance_criteria": [
              "Backend logs are sent to CloudWatch.",
              "Basic metrics (e.g., CPU usage, memory usage) are monitored.",
              "Alerts are configured for critical errors."
            ],
            "status": "pending",
            "code_files": []
          }
        ]
      }
    ],
    "timeline_estimation": {
      "start_date": "2025-07-08T23:12:17.510879",
      "end_date": "TBD",
      "milestones": []
    },
    "risk_assessment": [],
    "resource_requirements": [
      {
        "role": "Backend Developer",
        "count": 1,
        "estimated_time_allocation": "100%",
        "phases": [
          "Backend Phase"
        ],
        "skills_required": []
      },
      {
        "role": "Frontend Developer",
        "count": 1,
        "estimated_time_allocation": "100%",
        "phases": [
          "Frontend Phase"
        ],
        "skills_required": []
      },
      {
        "role": "Devops Engineer",
        "count": 1,
        "estimated_time_allocation": "100%",
        "phases": [
          "Devops_Engineer Phase"
        ],
        "skills_required": []
      }
    ],
    "deliverables": [
      "Completed FE-001",
      "Completed FE-002",
      "Completed FE-003",
      "Completed FE-004",
      "Completed FE-005",
      "Completed FE-006",
      "Completed TEST-001",
      "Completed BE-001",
      "Completed BE-002",
      "Completed BE-003",
      "Completed BE-004",
      "Completed BE-005",
      "Completed TEST-002",
      "Completed DEPLOY-001",
      "Completed DEPLOY-002",
      "Completed MONITOR-001"
    ],
    "dependencies": [],
    "raw_plan": "plan=ImplementationPlan(project_summary={'title': 'Generated Project Plan', 'description': 'Develop a simple web application for managing a list of tasks, including adding and viewing tasks. The application will use React for the frontend, Node.js and Express for the backend, and MongoDB for data storage. The application will be deployed to AWS.', 'overall_complexity': 'Medium', 'estimated_duration': 'TBD', 'key_challenges': [], 'success_criteria': []}, phases=[{'name': 'Frontend Phase', 'description': 'Tasks related to frontend phase', 'deliverables': ['Completed FE-001', 'Completed FE-002', 'Completed FE-003', 'Completed FE-004', 'Completed FE-005', 'Completed FE-006', 'Completed TEST-001'], 'estimated_duration_hours': 40.0, 'work_items': [{'id': 'FE-001', 'description': 'Set up React project with necessary dependencies (e.g., create-react-app, or Vite).', 'dependencies': [], 'estimated_time': '4 hours', 'agent_role': 'frontend_developer', 'acceptance_criteria': ['Project initializes successfully.', 'Basic project structure is in place.', 'Required dependencies are installed.'], 'status': 'pending', 'code_files': ['package.json', 'src/App.js', 'src/index.js']}, {'id': 'FE-002', 'description': 'Design and implement the UI for adding a new task (input field and add button).', 'dependencies': ['FE-001'], 'estimated_time': '6 hours', 'agent_role': 'frontend_developer', 'acceptance_criteria': ['UI elements for task input and adding are present.', 'UI elements are styled appropriately.', 'UI is responsive.'], 'status': 'pending', 'code_files': ['src/App.js', 'src/App.css']}, {'id': 'FE-003', 'description': 'Design and implement the UI for displaying the list of tasks.', 'dependencies': ['FE-001'], 'estimated_time': '6 hours', 'agent_role': 'frontend_developer', 'acceptance_criteria': ['UI displays a list of tasks.', 'Each task is displayed clearly.', 'UI is responsive.'], 'status': 'pending', 'code_files': ['src/App.js', 'src/App.css']}, {'id': 'FE-004', 'description': 'Implement basic styling for the frontend (using CSS or a UI library).', 'dependencies': ['FE-002', 'FE-003'], 'estimated_time': '4 hours', 'agent_role': 'frontend_developer', 'acceptance_criteria': ['UI elements are styled consistently.', 'UI is visually appealing.', 'UI is readable.'], 'status': 'pending', 'code_files': ['src/App.css']}, {'id': 'FE-005', 'description': 'Implement API calls to the backend for creating tasks.', 'dependencies': ['FE-002', 'BE-004'], 'estimated_time': '6 hours', 'agent_role': 'frontend_developer', 'acceptance_criteria': ['Frontend makes a POST request to /api/tasks when the add button is clicked.', 'Frontend sends the task description in the request body.', 'Frontend handles the API response (success and error).', 'Frontend updates the UI after successful task creation.'], 'status': 'pending', 'code_files': ['src/App.js']}, {'id': 'FE-006', 'description': 'Implement API calls to the backend for retrieving tasks.', 'dependencies': ['FE-003', 'BE-005'], 'estimated_time': '6 hours', 'agent_role': 'frontend_developer', 'acceptance_criteria': ['Frontend makes a GET request to /api/tasks on component mount.', 'Frontend displays the retrieved tasks in the list.', 'Frontend handles the API response (success and error).', 'Frontend updates the UI with the retrieved tasks.'], 'status': 'pending', 'code_files': ['src/App.js']}, {'id': 'TEST-001', 'description': 'Write unit tests for frontend components (e.g., App.js).', 'dependencies': ['FE-001', 'FE-002', 'FE-003', 'FE-005', 'FE-006'], 'estimated_time': '8 hours', 'agent_role': 'frontend_developer', 'acceptance_criteria': ['Tests cover the main functionalities of the frontend components.', 'Tests use a testing framework (e.g., Jest).', 'Tests pass successfully.', 'Test coverage is adequate.'], 'status': 'pending', 'code_files': ['src/App.test.js']}]}, {'name': 'Backend Phase', 'description': 'Tasks related to backend phase', 'deliverables': ['Completed BE-001', 'Completed BE-002', 'Completed BE-003', 'Completed BE-004', 'Completed BE-005', 'Completed TEST-002'], 'estimated_duration_hours': 34.0, 'work_items': [{'id': 'BE-001', 'description': 'Set up Node.js and Express project.', 'dependencies': [], 'estimated_time': '4 hours', 'agent_role': 'backend_developer', 'acceptance_criteria': ['Project initializes successfully.', 'Basic project structure is in place.', 'Express.js is installed and running.', \"Project can serve a 'Hello World' response.\"], 'status': 'pending', 'code_files': ['package.json', 'index.js']}, {'id': 'BE-002', 'description': 'Install and configure MongoDB and Mongoose.', 'dependencies': ['BE-001'], 'estimated_time': '4 hours', 'agent_role': 'backend_developer', 'acceptance_criteria': ['MongoDB is installed and running.', 'Mongoose is installed.', 'Connection to MongoDB is established.'], 'status': 'pending', 'code_files': ['index.js', 'models/task.js']}, {'id': 'BE-003', 'description': \"Create a Task model with 'description' and 'created_at' fields.\", 'dependencies': ['BE-002'], 'estimated_time': '4 hours', 'agent_role': 'backend_developer', 'acceptance_criteria': ['Task model is defined in Mongoose.', \"Model includes 'description' (String, required) and 'created_at' (Date, default now) fields.\", 'Model is correctly exported.'], 'status': 'pending', 'code_files': ['models/task.js']}, {'id': 'BE-004', 'description': 'Implement API endpoint to create a new task (POST /api/tasks).', 'dependencies': ['BE-003'], 'estimated_time': '8 hours', 'agent_role': 'backend_developer', 'acceptance_criteria': ['Endpoint handles POST requests to /api/tasks.', \"Endpoint receives 'description' in the request body.\", \"Endpoint validates the 'description' field.\", 'Endpoint saves the task to the database.', 'Endpoint returns a 201 status code on success with the created task.', 'Endpoint returns appropriate error codes and messages on failure.'], 'status': 'pending', 'code_files': ['index.js']}, {'id': 'BE-005', 'description': 'Implement API endpoint to retrieve all tasks (GET /api/tasks).', 'dependencies': ['BE-003'], 'estimated_time': '6 hours', 'agent_role': 'backend_developer', 'acceptance_criteria': ['Endpoint handles GET requests to /api/tasks.', 'Endpoint retrieves all tasks from the database.', 'Endpoint returns a 200 status code on success with the list of tasks.', 'Endpoint returns appropriate error codes and messages on failure.'], 'status': 'pending', 'code_files': ['index.js']}, {'id': 'TEST-002', 'description': 'Write unit tests for backend API endpoints.', 'dependencies': ['BE-004', 'BE-005'], 'estimated_time': '8 hours', 'agent_role': 'backend_developer', 'acceptance_criteria': ['Tests cover the API endpoints (POST /api/tasks, GET /api/tasks).', 'Tests use a testing framework (e.g., Jest, Mocha).', 'Tests mock database interactions.', 'Tests pass successfully.', 'Test coverage is adequate.'], 'status': 'pending', 'code_files': ['tests/api.test.js']}]}, {'name': 'Devops_Engineer Phase', 'description': 'Tasks related to devops_engineer phase', 'deliverables': ['Completed DEPLOY-001', 'Completed DEPLOY-002', 'Completed MONITOR-001'], 'estimated_duration_hours': 20.0, 'work_items': [{'id': 'DEPLOY-001', 'description': 'Deploy frontend to S3 and configure CloudFront.', 'dependencies': ['FE-001', 'FE-002', 'FE-003', 'FE-004', 'FE-005', 'FE-006', 'TEST-001'], 'estimated_time': '8 hours', 'agent_role': 'devops_engineer', 'acceptance_criteria': ['Frontend code is built and deployed to S3.', 'CloudFront distribution is configured to serve the frontend.', 'Frontend is accessible via the CloudFront URL.', 'HTTPS is enabled.'], 'status': 'pending', 'code_files': []}, {'id': 'DEPLOY-002', 'description': 'Deploy backend to EC2.', 'dependencies': ['BE-001', 'BE-002', 'BE-003', 'BE-004', 'BE-005', 'TEST-002'], 'estimated_time': '8 hours', 'agent_role': 'devops_engineer', 'acceptance_criteria': ['Backend code is deployed to an EC2 instance.', 'Backend is running and accessible.', 'Database connection is established.', 'HTTPS is enabled (e.g., using a load balancer and SSL certificate).'], 'status': 'pending', 'code_files': []}, {'id': 'MONITOR-001', 'description': 'Configure basic monitoring and logging (e.g., AWS CloudWatch).', 'dependencies': ['DEPLOY-002'], 'estimated_time': '4 hours', 'agent_role': 'devops_engineer', 'acceptance_criteria': ['Backend logs are sent to CloudWatch.', 'Basic metrics (e.g., CPU usage, memory usage) are monitored.', 'Alerts are configured for critical errors.'], 'status': 'pending', 'code_files': []}]}], resource_allocation=[{'role': 'Backend Developer', 'count': 1, 'estimated_time_allocation': '100%', 'phases': ['Backend Phase'], 'skills_required': []}, {'role': 'Frontend Developer', 'count': 1, 'estimated_time_allocation': '100%', 'phases': ['Frontend Phase'], 'skills_required': []}, {'role': 'Devops Engineer', 'count': 1, 'estimated_time_allocation': '100%', 'phases': ['Devops_Engineer Phase'], 'skills_required': []}], risks_and_mitigations=[], timeline={'start_date': '2025-07-08T23:12:17.510879', 'end_date': 'TBD', 'milestones': []}, tech_stack={}, metadata={'generated_at': '2025-07-08T23:12:17.510879', 'version': '1.0', 'author': 'Multi-AI Dev System', 'tags': [], 'notes': 'Converted from WorkItemBacklog. Original summary: Develop a simple web application for managing a list of tasks, including adding and viewing tasks. The application will use React for the frontend, Node.js and Express for the backend, and MongoDB for data storage. The application will be deployed to AWS.'}) summary='Develop a simple web application for managing a list of tasks, including adding and viewing tasks. The application will use React for the frontend, Node.js and Express for the backend, and MongoDB for data storage. The application will be deployed to AWS.' metadata=PlanMetadata(generated_at='2025-07-08T23:12:17.510879', version='1.0', author='Multi-AI Dev System', tags=[], notes='Converted from WorkItemBacklog. Original summary: Develop a simple web application for managing a list of tasks, including adding and viewing tasks. The application will use React for the frontend, Node.js and Express for the backend, and MongoDB for data storage. The application will be deployed to AWS.')"
  },
  "workflow_state_snapshot": {
    "requirements_analysis": {
      "project_name": "Hello World Task List",
      "project_summary": "A simple web application to manage a list of tasks.",
      "project_goals": [
        "Allow a user to add a task",
        "Allow a user to see their list of tasks"
      ],
      "target_audience": [
        "Users who want to manage a list of tasks"
      ],
      "business_context": "This project aims to provide a basic task management tool.",
      "requirements": [
        {
          "id": "REQ-001",
          "description": "A user can create a new task with a text description.",
          "category": "functional",
          "priority": 1
        },
        {
          "id": "REQ-002",
          "description": "A user can see a list of all created tasks.",
          "category": "functional",
          "priority": 1
        },
        {
          "id": "REQ-003",
          "description": "The application must load quickly.",
          "category": "non_functional",
          "priority": 2
        },
        {
          "id": "REQ-004",
          "description": "The application must be secure.",
          "category": "non_functional",
          "priority": 2
        }
      ],
      "functional_requirements": [
        "A user can create a new task with a text description.",
        "A user can see a list of all created tasks."
      ],
      "non_functional_requirements": [
        "The application must load quickly.",
        "The application must be secure."
      ],
      "stakeholders": [
        "Users"
      ],
      "success_criteria": [
        "Users can successfully add tasks.",
        "Users can successfully view their task list.",
        "The application loads quickly.",
        "The application is secure."
      ],
      "constraints": [],
      "assumptions": [],
      "risks": [],
      "domain_specific_details": {},
      "quality_assessment": {
        "clarity_score": 9.0,
        "completeness_score": 8.0,
        "consistency_score": 10.0,
        "recommendations": []
      },
      "gap_analysis": {
        "identified_gaps": [],
        "recommendations_for_completion": []
      }
    },
    "tech_stack_recommendation": {
      "frontend_options": [
        {
          "name": "React",
          "language": "JavaScript",
          "reasoning": "React is a popular and efficient library for building user interfaces. It offers a component-based architecture, making it easy to manage and update the UI. Its virtual DOM and efficient update mechanisms contribute to fast loading times, addressing the non-functional requirement for speed.",
          "key_libraries": [
            "React Router (for navigation)",
            "Axios (for API calls)",
            "Material UI/Ant Design (for UI components)"
          ],
          "pros": [
            "Large community and extensive documentation",
            "Component-based architecture for reusability",
            "Virtual DOM for efficient updates",
            "Good performance and SEO capabilities"
          ],
          "cons": [
            "Requires understanding of JSX",
            "Can have a steeper learning curve for beginners"
          ],
          "selected": false
        },
        {
          "name": "Vue.js",
          "language": "JavaScript",
          "reasoning": "Vue.js is a progressive framework that's easy to learn and integrate. It provides a clear separation of concerns and is known for its simplicity and ease of use. Vue.js is well-suited for building single-page applications and offers good performance, meeting the need for quick loading.",
          "key_libraries": [
            "Vue Router (for navigation)",
            "Axios (for API calls)",
            "Vuetify/Element UI (for UI components)"
          ],
          "pros": [
            "Easy to learn and use",
            "Excellent documentation",
            "Progressive framework, allowing gradual adoption",
            "Good performance"
          ],
          "cons": [
            "Smaller community compared to React",
            "Ecosystem might not be as extensive as React's"
          ],
          "selected": false
        },
        {
          "name": "Angular",
          "language": "TypeScript",
          "reasoning": "Angular is a comprehensive framework for building complex web applications. It offers a robust structure, including features like dependency injection and two-way data binding. While it has a steeper learning curve, it provides a structured approach that can lead to maintainable and scalable applications. TypeScript enhances code quality and maintainability.",
          "key_libraries": [
            "@angular/router (for navigation)",
            "@angular/common/http (for API calls)",
            "Angular Material/Ngx-Bootstrap (for UI components)"
          ],
          "pros": [
            "Comprehensive framework with a strong structure",
            "TypeScript for improved code quality and maintainability",
            "Two-way data binding",
            "Large community and extensive documentation"
          ],
          "cons": [
            "Steeper learning curve",
            "Can be more verbose than other frameworks"
          ],
          "selected": false
        }
      ],
      "backend_options": [
        {
          "name": "Node.js with Express",
          "language": "JavaScript",
          "reasoning": "Node.js with Express provides a lightweight and efficient backend solution. JavaScript is used on both the frontend and backend, which can streamline development. Express offers a flexible framework for building RESTful APIs, making it suitable for handling task data and user interactions.",
          "key_libraries": [
            "Express.js (web framework)",
            "Mongoose (for MongoDB interaction)",
            "Passport.js (for authentication)"
          ],
          "pros": [
            "JavaScript on both frontend and backend (full-stack JavaScript)",
            "Large community and extensive documentation",
            "Fast development with npm packages",
            "Good performance with asynchronous operations"
          ],
          "cons": [
            "Callback hell can be an issue (mitigated by async/await)",
            "Requires careful handling of asynchronous operations"
          ],
          "selected": false
        },
        {
          "name": "Python with Django",
          "language": "Python",
          "reasoning": "Django is a high-level Python web framework that promotes rapid development and clean, pragmatic design. It includes built-in features like an ORM, templating engine, and security features, which can help meet the security requirements. Python's readability and Django's structure contribute to maintainability.",
          "key_libraries": [
            "Django REST framework (for API creation)",
            "psycopg2 (for PostgreSQL interaction)",
            "django-allauth (for authentication)"
          ],
          "pros": [
            "Rapid development with Django's features",
            "Built-in security features",
            "ORM for database interaction",
            "Large community and extensive documentation"
          ],
          "cons": [
            "Can be slower than Node.js in some cases",
            "Can be more complex for simple projects"
          ],
          "selected": false
        },
        {
          "name": "Java with Spring Boot",
          "language": "Java",
          "reasoning": "Spring Boot simplifies the development of Java-based web applications. It provides a robust framework with features for dependency injection, security, and data access. Java's strong typing and Spring Boot's structure contribute to building scalable and maintainable applications.",
          "key_libraries": [
            "Spring Web (for building web applications)",
            "Spring Data JPA (for database interaction)",
            "Spring Security (for authentication and authorization)"
          ],
          "pros": [
            "Robust and scalable framework",
            "Strong typing and object-oriented programming",
            "Large community and extensive documentation",
            "Excellent security features"
          ],
          "cons": [
            "Steeper learning curve",
            "Can be more verbose than other frameworks"
          ],
          "selected": false
        }
      ],
      "database_options": [
        {
          "name": "MongoDB",
          "language": null,
          "reasoning": "MongoDB is a NoSQL database that offers flexibility and scalability. Its document-oriented structure is well-suited for storing task data. It's easy to set up and use, making it a good choice for a simple task management application.",
          "key_libraries": [
            "Mongoose (for Node.js)",
            "pymongo (for Python)"
          ],
          "pros": [
            "Flexible schema",
            "Scalable and performant",
            "Easy to set up and use",
            "Good for handling unstructured data"
          ],
          "cons": [
            "Not as strong in ACID transactions as relational databases",
            "Can be more complex to query than relational databases"
          ],
          "selected": false
        },
        {
          "name": "PostgreSQL",
          "language": null,
          "reasoning": "PostgreSQL is a powerful and reliable relational database. It offers strong data integrity and supports complex queries. Its ACID properties ensure data consistency, addressing the security requirement. PostgreSQL is a good choice for applications that require data integrity and consistency.",
          "key_libraries": [
            "psycopg2 (for Python)",
            "pg (for Node.js)"
          ],
          "pros": [
            "Strong data integrity and consistency",
            "Supports complex queries",
            "ACID properties",
            "Large community and extensive documentation"
          ],
          "cons": [
            "Can be more complex to set up and manage than NoSQL databases",
            "Requires more upfront schema design"
          ],
          "selected": false
        },
        {
          "name": "MySQL",
          "language": null,
          "reasoning": "MySQL is a widely used relational database known for its ease of use and performance. It's a good choice for smaller projects and offers good performance. It's a reliable and well-documented database.",
          "key_libraries": [
            "mysql2 (for Node.js)",
            "mysql.connector (for Python)"
          ],
          "pros": [
            "Easy to use and set up",
            "Good performance",
            "Widely used and well-documented",
            "Large community support"
          ],
          "cons": [
            "Can have limitations in handling very large datasets compared to PostgreSQL",
            "Less advanced features compared to PostgreSQL"
          ],
          "selected": false
        }
      ],
      "cloud_options": [
        {
          "name": "AWS",
          "language": null,
          "reasoning": "AWS provides a comprehensive suite of services for building and deploying web applications. Services like EC2, S3, and RDS offer flexibility and scalability. AWS's security features and global infrastructure can help meet the security and performance requirements.",
          "key_libraries": [
            "AWS SDK (for interacting with AWS services)",
            "Terraform/CloudFormation (for infrastructure as code)"
          ],
          "pros": [
            "Wide range of services",
            "Scalable and reliable infrastructure",
            "Strong security features",
            "Global presence"
          ],
          "cons": [
            "Can be complex to manage",
            "Can be expensive if not managed properly"
          ],
          "selected": false
        },
        {
          "name": "Google Cloud Platform (GCP)",
          "language": null,
          "reasoning": "GCP offers a competitive set of services with a focus on data analytics and machine learning. Services like Compute Engine, Cloud Storage, and Cloud SQL provide a robust platform for deploying web applications. GCP's competitive pricing and strong performance make it a good choice.",
          "key_libraries": [
            "Google Cloud SDK (for interacting with GCP services)",
            "Terraform/Cloud Deployment Manager (for infrastructure as code)"
          ],
          "pros": [
            "Competitive pricing",
            "Strong performance",
            "Focus on data analytics and machine learning",
            "Global presence"
          ],
          "cons": [
            "Can be complex to manage",
            "Less mature in some areas compared to AWS"
          ],
          "selected": false
        },
        {
          "name": "Microsoft Azure",
          "language": null,
          "reasoning": "Azure provides a comprehensive cloud platform with strong integration with Microsoft technologies. Services like Virtual Machines, Blob Storage, and Azure SQL Database offer a robust platform for deploying web applications. Azure's integration with .NET and Windows Server makes it a good choice for projects using these technologies.",
          "key_libraries": [
            "Azure SDK (for interacting with Azure services)",
            "Terraform/Azure Resource Manager (for infrastructure as code)"
          ],
          "pros": [
            "Strong integration with Microsoft technologies",
            "Good for Windows-based applications",
            "Scalable and reliable infrastructure",
            "Global presence"
          ],
          "cons": [
            "Can be complex to manage",
            "Pricing can be complex"
          ],
          "selected": false
        }
      ],
      "architecture_options": [
        {
          "pattern": "Monolithic Architecture",
          "scalability_score": 4.0,
          "maintainability_score": 6.0,
          "development_speed_score": 8.0,
          "overall_score": 6.0,
          "reasoning": "For a simple task list application, a monolithic architecture is a good starting point. It allows for rapid development and deployment. However, as the application grows, it can become harder to scale and maintain."
        },
        {
          "pattern": "Microservices Architecture",
          "scalability_score": 9.0,
          "maintainability_score": 7.0,
          "development_speed_score": 5.0,
          "overall_score": 7.0,
          "reasoning": "While overkill for a simple task list, microservices offer excellent scalability and maintainability. Each service can be developed, deployed, and scaled independently. This architecture is more complex to set up and manage, but it provides flexibility for future growth."
        },
        {
          "pattern": "Serverless Architecture",
          "scalability_score": 10.0,
          "maintainability_score": 7.0,
          "development_speed_score": 6.0,
          "overall_score": 7.0,
          "reasoning": "Serverless architecture can be a good choice for this project. It allows for automatic scaling and reduces operational overhead. However, it can introduce complexities in debugging and monitoring. It is a good option for quick deployment and scalability."
        }
      ],
      "tool_options": [
        {
          "name": "Git",
          "language": null,
          "reasoning": "Version control for the codebase.",
          "key_libraries": [],
          "pros": [],
          "cons": [],
          "selected": false
        },
        {
          "name": "VS Code",
          "language": null,
          "reasoning": "Code editor with excellent support for various languages and frameworks.",
          "key_libraries": [],
          "pros": [],
          "cons": [],
          "selected": false
        },
        {
          "name": "Docker",
          "language": null,
          "reasoning": "Containerization for consistent development and deployment environments.",
          "key_libraries": [],
          "pros": [],
          "cons": [],
          "selected": false
        },
        {
          "name": "CI/CD Pipeline (e.g., Jenkins, GitLab CI, GitHub Actions)",
          "language": null,
          "reasoning": "Automated build, test, and deployment processes.",
          "key_libraries": [],
          "pros": [],
          "cons": [],
          "selected": false
        },
        {
          "name": "Postman/Insomnia",
          "language": null,
          "reasoning": "API testing and debugging.",
          "key_libraries": [],
          "pros": [],
          "cons": [],
          "selected": false
        },
        {
          "name": "Webpack/Parcel/Vite",
          "language": null,
          "reasoning": "Module bundler for frontend assets.",
          "key_libraries": [],
          "pros": [],
          "cons": [],
          "selected": false
        }
      ],
      "risks": [
        {
          "category": "Security",
          "description": "Vulnerabilities in dependencies or the framework itself could lead to security breaches.",
          "severity": "Medium",
          "likelihood": "Medium",
          "mitigation": "Regularly update dependencies, use security best practices, and conduct security audits."
        },
        {
          "category": "Performance",
          "description": "Inefficient code or database queries could lead to slow loading times.",
          "severity": "Medium",
          "likelihood": "Medium",
          "mitigation": "Optimize code, use caching, and optimize database queries."
        },
        {
          "category": "Scalability",
          "description": "The application may not scale well if the chosen architecture and technologies are not suitable for future growth.",
          "severity": "Low",
          "likelihood": "Low",
          "mitigation": "Choose scalable technologies and architecture patterns, and plan for future growth."
        },
        {
          "category": "Development Speed",
          "description": "Choosing a complex framework or architecture can slow down development.",
          "severity": "Medium",
          "likelihood": "Medium",
          "mitigation": "Choose a framework and architecture that aligns with the project's complexity and team's experience."
        }
      ],
      "synthesis": null,
      "selected_stack": null
    },
    "system_design": {
      "architecture": {
        "pattern": "Monolithic Architecture",
        "justification": "For a simple task list application, a monolithic architecture is a good starting point. It allows for rapid development and deployment. The project's goals and requirements can be met efficiently with this approach. The application's scope is small, making a monolithic architecture suitable.",
        "key_benefits": [
          "Faster development and deployment",
          "Simpler to manage for a small application",
          "Easier to test and debug"
        ],
        "potential_drawbacks": [
          "Less scalable than microservices",
          "Can become harder to maintain as the application grows"
        ]
      },
      "components": [
        {
          "name": "Frontend",
          "description": "Handles user interface and interactions.",
          "category": "frontend",
          "technologies": [
            "React",
            "JavaScript",
            "HTML",
            "CSS"
          ],
          "dependencies": [
            "Backend"
          ],
          "responsibilities": [
            "Displaying task list",
            "Handling user input (adding tasks)",
            "Making API calls to the backend",
            "User interface rendering"
          ],
          "design_patterns": [
            "Component-based architecture"
          ]
        },
        {
          "name": "Backend",
          "description": "Handles API requests, data storage, and business logic.",
          "category": "backend",
          "technologies": [
            "Node.js",
            "Express.js",
            "MongoDB",
            "JavaScript"
          ],
          "dependencies": [
            "Database"
          ],
          "responsibilities": [
            "Exposing RESTful APIs",
            "Handling task creation and retrieval",
            "Data validation",
            "Interacting with the database"
          ],
          "design_patterns": [
            "MVC (Model-View-Controller)"
          ]
        },
        {
          "name": "Database",
          "description": "Stores task data.",
          "category": "database",
          "technologies": [
            "MongoDB"
          ],
          "dependencies": [],
          "responsibilities": [
            "Storing task data",
            "Providing data access to the backend"
          ],
          "design_patterns": []
        }
      ],
      "data_model": {
        "schema_type": "Document",
        "tables": [
          {
            "name": "tasks",
            "purpose": "Stores task information.",
            "fields": [
              {
                "name": "id",
                "type": "String",
                "constraints": [
                  "PRIMARY KEY"
                ],
                "description": "Unique identifier for the task."
              },
              {
                "name": "description",
                "type": "String",
                "constraints": [
                  "NOT NULL"
                ],
                "description": "Text description of the task."
              },
              {
                "name": "created_at",
                "type": "Date",
                "constraints": [],
                "description": "Timestamp of task creation."
              }
            ],
            "relationships": []
          }
        ],
        "relationships": [],
        "justification": "MongoDB's document-oriented schema is well-suited for storing task data. It provides flexibility and scalability, making it easy to add new fields in the future. The schema is simple and aligns with the project's requirements."
      },
      "api_endpoints": {
        "style": "REST",
        "base_url": "/api/tasks",
        "authentication": "None",
        "endpoints": [
          {
            "method": "POST",
            "path": "/",
            "purpose": "Create a new task.",
            "parameters": [
              {
                "description": "Task description",
                "type": "string",
                "name": "description"
              }
            ],
            "response": {
              "status": 201,
              "description": "Task created successfully",
              "example": {
                "id": "unique_task_id",
                "description": "Buy groceries",
                "created_at": "2024-01-01T12:00:00.000Z"
              }
            },
            "authentication_required": false,
            "rate_limiting_applied": false
          },
          {
            "method": "GET",
            "path": "/",
            "purpose": "Get all tasks.",
            "parameters": [],
            "response": {
              "status": 200,
              "description": "List of tasks",
              "example": [
                {
                  "id": "unique_task_id",
                  "description": "Buy groceries",
                  "created_at": "2024-01-01T12:00:00.000Z"
                },
                {
                  "id": "another_task_id",
                  "description": "Walk the dog",
                  "created_at": "2024-01-01T13:00:00.000Z"
                }
              ]
            },
            "authentication_required": false,
            "rate_limiting_applied": false
          }
        ],
        "error_handling": "Standard HTTP status codes and informative error messages.",
        "rate_limiting_strategy": null
      },
      "security": {
        "authentication_method": "None",
        "authorization_strategy": "None",
        "data_encryption": {
          "at_rest": "None",
          "in_transit": "HTTPS (TLS/SSL)"
        },
        "security_measures": [
          {
            "category": "Input Validation",
            "implementation": "Validate all user inputs on the backend to prevent injection attacks.",
            "mitigation": "SQL Injection, Cross-Site Scripting (XSS)",
            "priority": "High"
          },
          {
            "category": "HTTPS",
            "implementation": "Enforce HTTPS for all communication between the frontend and backend.",
            "mitigation": "Man-in-the-middle attacks, data interception",
            "priority": "High"
          },
          {
            "category": "Dependency Management",
            "implementation": "Regularly update dependencies to patch security vulnerabilities.",
            "mitigation": "Known vulnerabilities in dependencies",
            "priority": "Medium"
          }
        ],
        "vulnerability_mitigation_strategies": [
          "Input validation",
          "Output encoding",
          "Regular dependency updates",
          "Use of HTTPS"
        ],
        "compliance_standards": []
      },
      "scalability_and_performance": {
        "caching": "Implement client-side caching for static assets and consider server-side caching for API responses.",
        "code_optimization": "Optimize code for performance, including efficient database queries and minimizing unnecessary computations.",
        "database_optimization": "Ensure proper indexing of database fields to improve query performance."
      },
      "deployment_strategy": {
        "platform": "AWS (EC2 for backend, S3 for frontend)",
        "environment": "Production and Development environments",
        "process": "Use a CI/CD pipeline for automated deployments.  Frontend will be deployed to S3 and served via CloudFront. Backend will be deployed to EC2 instances."
      },
      "monitoring_and_logging": {
        "logging": "Implement logging for both frontend and backend applications to track errors and user activity.",
        "monitoring": "Use monitoring tools to track application performance and identify potential issues.  Consider using AWS CloudWatch."
      },
      "error_handling_strategy": "Implement a centralized error handling mechanism to catch and handle errors gracefully. Return informative error messages to the client and log errors on the server.",
      "development_phases_overview": [
        {
          "name": "Phase 1: Setup and Frontend Development",
          "description": "Set up the development environment, including the frontend framework (React), and develop the user interface for adding and viewing tasks.",
          "priority": "High",
          "dependencies": [],
          "tasks": [
            "Set up React project",
            "Design and implement the UI for adding tasks",
            "Design and implement the UI for viewing tasks",
            "Implement basic styling"
          ],
          "estimated_duration": "1 week"
        },
        {
          "name": "Phase 2: Backend Development and API Integration",
          "description": "Develop the backend API using Node.js and Express. Implement the API endpoints for creating and retrieving tasks. Integrate the frontend with the backend API.",
          "priority": "High",
          "dependencies": [
            "Phase 1: Setup and Frontend Development"
          ],
          "tasks": [
            "Set up Node.js and Express project",
            "Implement API endpoints for creating and retrieving tasks",
            "Connect to MongoDB database",
            "Implement data validation",
            "Integrate frontend with backend API"
          ],
          "estimated_duration": "1 week"
        },
        {
          "name": "Phase 3: Testing and Deployment",
          "description": "Test the application thoroughly, including unit tests and integration tests. Deploy the application to a cloud platform (AWS).",
          "priority": "High",
          "dependencies": [
            "Phase 2: Backend Development and API Integration"
          ],
          "tasks": [
            "Write unit tests for frontend and backend components",
            "Perform integration tests",
            "Deploy frontend to S3 and CloudFront",
            "Deploy backend to EC2",
            "Configure monitoring and logging"
          ],
          "estimated_duration": "1 week"
        }
      ],
      "key_risks": [
        "Security vulnerabilities in dependencies.",
        "Performance bottlenecks due to inefficient code or database queries.",
        "Scalability limitations if the application grows beyond its initial scope."
      ],
      "design_justification": "The design prioritizes simplicity and rapid development. The monolithic architecture, React frontend, Node.js backend, and MongoDB database were chosen to minimize complexity and allow for quick iteration. The focus is on delivering a functional task management application with a good user experience. Security best practices are integrated to protect user data.",
      "data_flow": "1. User interacts with the React frontend (e.g., enters a task description). 2. Frontend sends a POST request to the backend API (Express.js). 3. Backend API validates the input. 4. Backend API saves the task data to the MongoDB database. 5. Backend API returns a success response to the frontend. 6. Frontend displays the newly created task in the task list. 7. When the user views the task list, the frontend sends a GET request to the backend API. 8. Backend API retrieves all tasks from the MongoDB database. 9. Backend API returns the task data to the frontend. 10. Frontend displays the task list."
    },
    "implementation_plan": "plan=ImplementationPlan(project_summary={'title': 'Generated Project Plan', 'description': 'Develop a simple web application for managing a list of tasks, including adding and viewing tasks. The application will use React for the frontend, Node.js and Express for the backend, and MongoDB for data storage. The application will be deployed to AWS.', 'overall_complexity': 'Medium', 'estimated_duration': 'TBD', 'key_challenges': [], 'success_criteria': []}, phases=[{'name': 'Frontend Phase', 'description': 'Tasks related to frontend phase', 'deliverables': ['Completed FE-001', 'Completed FE-002', 'Completed FE-003', 'Completed FE-004', 'Completed FE-005', 'Completed FE-006', 'Completed TEST-001'], 'estimated_duration_hours': 40.0, 'work_items': [{'id': 'FE-001', 'description': 'Set up React project with necessary dependencies (e.g., create-react-app, or Vite).', 'dependencies': [], 'estimated_time': '4 hours', 'agent_role': 'frontend_developer', 'acceptance_criteria': ['Project initializes successfully.', 'Basic project structure is in place.', 'Required dependencies are installed.'], 'status': 'pending', 'code_files': ['package.json', 'src/App.js', 'src/index.js']}, {'id': 'FE-002', 'description': 'Design and implement the UI for adding a new task (input field and add button).', 'dependencies': ['FE-001'], 'estimated_time': '6 hours', 'agent_role': 'frontend_developer', 'acceptance_criteria': ['UI elements for task input and adding are present.', 'UI elements are styled appropriately.', 'UI is responsive.'], 'status': 'pending', 'code_files': ['src/App.js', 'src/App.css']}, {'id': 'FE-003', 'description': 'Design and implement the UI for displaying the list of tasks.', 'dependencies': ['FE-001'], 'estimated_time': '6 hours', 'agent_role': 'frontend_developer', 'acceptance_criteria': ['UI displays a list of tasks.', 'Each task is displayed clearly.', 'UI is responsive.'], 'status': 'pending', 'code_files': ['src/App.js', 'src/App.css']}, {'id': 'FE-004', 'description': 'Implement basic styling for the frontend (using CSS or a UI library).', 'dependencies': ['FE-002', 'FE-003'], 'estimated_time': '4 hours', 'agent_role': 'frontend_developer', 'acceptance_criteria': ['UI elements are styled consistently.', 'UI is visually appealing.', 'UI is readable.'], 'status': 'pending', 'code_files': ['src/App.css']}, {'id': 'FE-005', 'description': 'Implement API calls to the backend for creating tasks.', 'dependencies': ['FE-002', 'BE-004'], 'estimated_time': '6 hours', 'agent_role': 'frontend_developer', 'acceptance_criteria': ['Frontend makes a POST request to /api/tasks when the add button is clicked.', 'Frontend sends the task description in the request body.', 'Frontend handles the API response (success and error).', 'Frontend updates the UI after successful task creation.'], 'status': 'pending', 'code_files': ['src/App.js']}, {'id': 'FE-006', 'description': 'Implement API calls to the backend for retrieving tasks.', 'dependencies': ['FE-003', 'BE-005'], 'estimated_time': '6 hours', 'agent_role': 'frontend_developer', 'acceptance_criteria': ['Frontend makes a GET request to /api/tasks on component mount.', 'Frontend displays the retrieved tasks in the list.', 'Frontend handles the API response (success and error).', 'Frontend updates the UI with the retrieved tasks.'], 'status': 'pending', 'code_files': ['src/App.js']}, {'id': 'TEST-001', 'description': 'Write unit tests for frontend components (e.g., App.js).', 'dependencies': ['FE-001', 'FE-002', 'FE-003', 'FE-005', 'FE-006'], 'estimated_time': '8 hours', 'agent_role': 'frontend_developer', 'acceptance_criteria': ['Tests cover the main functionalities of the frontend components.', 'Tests use a testing framework (e.g., Jest).', 'Tests pass successfully.', 'Test coverage is adequate.'], 'status': 'pending', 'code_files': ['src/App.test.js']}]}, {'name': 'Backend Phase', 'description': 'Tasks related to backend phase', 'deliverables': ['Completed BE-001', 'Completed BE-002', 'Completed BE-003', 'Completed BE-004', 'Completed BE-005', 'Completed TEST-002'], 'estimated_duration_hours': 34.0, 'work_items': [{'id': 'BE-001', 'description': 'Set up Node.js and Express project.', 'dependencies': [], 'estimated_time': '4 hours', 'agent_role': 'backend_developer', 'acceptance_criteria': ['Project initializes successfully.', 'Basic project structure is in place.', 'Express.js is installed and running.', \"Project can serve a 'Hello World' response.\"], 'status': 'pending', 'code_files': ['package.json', 'index.js']}, {'id': 'BE-002', 'description': 'Install and configure MongoDB and Mongoose.', 'dependencies': ['BE-001'], 'estimated_time': '4 hours', 'agent_role': 'backend_developer', 'acceptance_criteria': ['MongoDB is installed and running.', 'Mongoose is installed.', 'Connection to MongoDB is established.'], 'status': 'pending', 'code_files': ['index.js', 'models/task.js']}, {'id': 'BE-003', 'description': \"Create a Task model with 'description' and 'created_at' fields.\", 'dependencies': ['BE-002'], 'estimated_time': '4 hours', 'agent_role': 'backend_developer', 'acceptance_criteria': ['Task model is defined in Mongoose.', \"Model includes 'description' (String, required) and 'created_at' (Date, default now) fields.\", 'Model is correctly exported.'], 'status': 'pending', 'code_files': ['models/task.js']}, {'id': 'BE-004', 'description': 'Implement API endpoint to create a new task (POST /api/tasks).', 'dependencies': ['BE-003'], 'estimated_time': '8 hours', 'agent_role': 'backend_developer', 'acceptance_criteria': ['Endpoint handles POST requests to /api/tasks.', \"Endpoint receives 'description' in the request body.\", \"Endpoint validates the 'description' field.\", 'Endpoint saves the task to the database.', 'Endpoint returns a 201 status code on success with the created task.', 'Endpoint returns appropriate error codes and messages on failure.'], 'status': 'pending', 'code_files': ['index.js']}, {'id': 'BE-005', 'description': 'Implement API endpoint to retrieve all tasks (GET /api/tasks).', 'dependencies': ['BE-003'], 'estimated_time': '6 hours', 'agent_role': 'backend_developer', 'acceptance_criteria': ['Endpoint handles GET requests to /api/tasks.', 'Endpoint retrieves all tasks from the database.', 'Endpoint returns a 200 status code on success with the list of tasks.', 'Endpoint returns appropriate error codes and messages on failure.'], 'status': 'pending', 'code_files': ['index.js']}, {'id': 'TEST-002', 'description': 'Write unit tests for backend API endpoints.', 'dependencies': ['BE-004', 'BE-005'], 'estimated_time': '8 hours', 'agent_role': 'backend_developer', 'acceptance_criteria': ['Tests cover the API endpoints (POST /api/tasks, GET /api/tasks).', 'Tests use a testing framework (e.g., Jest, Mocha).', 'Tests mock database interactions.', 'Tests pass successfully.', 'Test coverage is adequate.'], 'status': 'pending', 'code_files': ['tests/api.test.js']}]}, {'name': 'Devops_Engineer Phase', 'description': 'Tasks related to devops_engineer phase', 'deliverables': ['Completed DEPLOY-001', 'Completed DEPLOY-002', 'Completed MONITOR-001'], 'estimated_duration_hours': 20.0, 'work_items': [{'id': 'DEPLOY-001', 'description': 'Deploy frontend to S3 and configure CloudFront.', 'dependencies': ['FE-001', 'FE-002', 'FE-003', 'FE-004', 'FE-005', 'FE-006', 'TEST-001'], 'estimated_time': '8 hours', 'agent_role': 'devops_engineer', 'acceptance_criteria': ['Frontend code is built and deployed to S3.', 'CloudFront distribution is configured to serve the frontend.', 'Frontend is accessible via the CloudFront URL.', 'HTTPS is enabled.'], 'status': 'pending', 'code_files': []}, {'id': 'DEPLOY-002', 'description': 'Deploy backend to EC2.', 'dependencies': ['BE-001', 'BE-002', 'BE-003', 'BE-004', 'BE-005', 'TEST-002'], 'estimated_time': '8 hours', 'agent_role': 'devops_engineer', 'acceptance_criteria': ['Backend code is deployed to an EC2 instance.', 'Backend is running and accessible.', 'Database connection is established.', 'HTTPS is enabled (e.g., using a load balancer and SSL certificate).'], 'status': 'pending', 'code_files': []}, {'id': 'MONITOR-001', 'description': 'Configure basic monitoring and logging (e.g., AWS CloudWatch).', 'dependencies': ['DEPLOY-002'], 'estimated_time': '4 hours', 'agent_role': 'devops_engineer', 'acceptance_criteria': ['Backend logs are sent to CloudWatch.', 'Basic metrics (e.g., CPU usage, memory usage) are monitored.', 'Alerts are configured for critical errors.'], 'status': 'pending', 'code_files': []}]}], resource_allocation=[{'role': 'Backend Developer', 'count': 1, 'estimated_time_allocation': '100%', 'phases': ['Backend Phase'], 'skills_required': []}, {'role': 'Frontend Developer', 'count': 1, 'estimated_time_allocation': '100%', 'phases': ['Frontend Phase'], 'skills_required': []}, {'role': 'Devops Engineer', 'count': 1, 'estimated_time_allocation': '100%', 'phases': ['Devops_Engineer Phase'], 'skills_required': []}], risks_and_mitigations=[], timeline={'start_date': '2025-07-08T23:12:17.510879', 'end_date': 'TBD', 'milestones': []}, tech_stack={}, metadata={'generated_at': '2025-07-08T23:12:17.510879', 'version': '1.0', 'author': 'Multi-AI Dev System', 'tags': [], 'notes': 'Converted from WorkItemBacklog. Original summary: Develop a simple web application for managing a list of tasks, including adding and viewing tasks. The application will use React for the frontend, Node.js and Express for the backend, and MongoDB for data storage. The application will be deployed to AWS.'}) summary='Develop a simple web application for managing a list of tasks, including adding and viewing tasks. The application will use React for the frontend, Node.js and Express for the backend, and MongoDB for data storage. The application will be deployed to AWS.' metadata=PlanMetadata(generated_at='2025-07-08T23:12:17.510879', version='1.0', author='Multi-AI Dev System', tags=[], notes='Converted from WorkItemBacklog. Original summary: Develop a simple web application for managing a list of tasks, including adding and viewing tasks. The application will use React for the frontend, Node.js and Express for the backend, and MongoDB for data storage. The application will be deployed to AWS.')"
  }
}