{
  "session_id": "session_d776178d-74bc-4359-b4a3-03cffe71a5ef",
  "approval_type": "implementation_plan",
  "timestamp": 1752034584,
  "approval_data": {
    "type": "implementation_plan",
    "timestamp": 1752034584.373605,
    "project_overview": "Develop a simple web application using React for the frontend, Node.js/Express.js for the backend, and SQLite for the database. The application will allow users to add and view a list of tasks. The application will be deployed to Heroku.",
    "development_phases": [
      {
        "name": "Frontend Phase",
        "description": "Tasks related to frontend phase",
        "deliverables": [
          "Completed FE-001",
          "Completed FE-002",
          "Completed FE-003",
          "Completed FE-004",
          "Completed FE-005",
          "Completed FE-006",
          "Completed TEST-003"
        ],
        "estimated_duration_hours": 38.0,
        "work_items": [
          {
            "id": "FE-001",
            "description": "Set up React project using Create React App.",
            "dependencies": [],
            "estimated_time": "4 hours",
            "agent_role": "frontend_developer",
            "acceptance_criteria": [
              "Project is initialized successfully.",
              "Default React app runs without errors."
            ],
            "status": "pending",
            "code_files": [
              "package.json",
              "src/App.js",
              "src/index.js"
            ]
          },
          {
            "id": "FE-002",
            "description": "Design and implement the UI for adding a new task (input field and add button).",
            "dependencies": [
              "FE-001"
            ],
            "estimated_time": "6 hours",
            "agent_role": "frontend_developer",
            "acceptance_criteria": [
              "UI elements for adding a task are present.",
              "Input field accepts text input.",
              "Add button is functional (though not yet connected to backend)."
            ],
            "status": "pending",
            "code_files": [
              "src/App.js",
              "src/App.css"
            ]
          },
          {
            "id": "FE-003",
            "description": "Design and implement the UI for displaying the task list (initially, a placeholder).",
            "dependencies": [
              "FE-001"
            ],
            "estimated_time": "4 hours",
            "agent_role": "frontend_developer",
            "acceptance_criteria": [
              "Task list area is present in the UI.",
              "Placeholder text or UI element indicates where tasks will be displayed."
            ],
            "status": "pending",
            "code_files": [
              "src/App.js",
              "src/App.css"
            ]
          },
          {
            "id": "FE-004",
            "description": "Implement basic styling for the UI (input field, button, task list).",
            "dependencies": [
              "FE-002",
              "FE-003"
            ],
            "estimated_time": "4 hours",
            "agent_role": "frontend_developer",
            "acceptance_criteria": [
              "UI elements are visually appealing.",
              "Layout is clear and easy to understand.",
              "Styling is consistent."
            ],
            "status": "pending",
            "code_files": [
              "src/App.css"
            ]
          },
          {
            "id": "FE-005",
            "description": "Connect the frontend to the backend API (add task functionality).",
            "dependencies": [
              "FE-002",
              "BE-002",
              "BE-004"
            ],
            "estimated_time": "8 hours",
            "agent_role": "frontend_developer",
            "acceptance_criteria": [
              "Frontend makes a POST request to /api/tasks when the 'Add' button is clicked.",
              "Frontend sends the task description in the request body.",
              "Frontend handles the API response (success and error).",
              "Frontend updates the UI to reflect the new task (e.g., clears the input field)."
            ],
            "status": "pending",
            "code_files": [
              "src/App.js"
            ]
          },
          {
            "id": "FE-006",
            "description": "Connect the frontend to the backend API (display task list).",
            "dependencies": [
              "FE-003",
              "BE-003",
              "BE-005"
            ],
            "estimated_time": "8 hours",
            "agent_role": "frontend_developer",
            "acceptance_criteria": [
              "Frontend makes a GET request to /api/tasks on component mount (or refresh).",
              "Frontend displays the retrieved tasks in the task list area.",
              "Frontend handles the API response (success and error)."
            ],
            "status": "pending",
            "code_files": [
              "src/App.js"
            ]
          },
          {
            "id": "TEST-003",
            "description": "Perform manual testing of the frontend and backend integration.",
            "dependencies": [
              "FE-005",
              "FE-006",
              "BE-004",
              "BE-005"
            ],
            "estimated_time": "4 hours",
            "agent_role": "frontend_developer",
            "acceptance_criteria": [
              "Tasks can be added successfully.",
              "Tasks are displayed correctly in the list.",
              "Error messages are displayed appropriately.",
              "UI behaves as expected."
            ],
            "status": "pending",
            "code_files": []
          }
        ]
      },
      {
        "name": "Backend Phase",
        "description": "Tasks related to backend phase",
        "deliverables": [
          "Completed BE-001",
          "Completed BE-002",
          "Completed BE-003",
          "Completed BE-004",
          "Completed BE-005",
          "Completed TEST-001",
          "Completed TEST-002",
          "Completed DEPLOY-001",
          "Completed DEPLOY-002",
          "Completed MONITOR-001"
        ],
        "estimated_duration_hours": 54.0,
        "work_items": [
          {
            "id": "BE-001",
            "description": "Set up Node.js and Express.js project.",
            "dependencies": [],
            "estimated_time": "4 hours",
            "agent_role": "backend_developer",
            "acceptance_criteria": [
              "Project is initialized successfully.",
              "Express.js server runs without errors.",
              "Basic route (e.g., '/') responds with 'Hello World'."
            ],
            "status": "pending",
            "code_files": [
              "package.json",
              "index.js"
            ]
          },
          {
            "id": "BE-002",
            "description": "Create API endpoint for adding a new task (POST /api/tasks).",
            "dependencies": [
              "BE-001"
            ],
            "estimated_time": "8 hours",
            "agent_role": "backend_developer",
            "acceptance_criteria": [
              "Endpoint accepts POST requests to /api/tasks.",
              "Endpoint receives 'description' parameter in the request body.",
              "Endpoint validates the 'description' parameter (required).",
              "Endpoint returns 201 Created on success with the new task's ID.",
              "Endpoint returns 400 Bad Request on validation failure."
            ],
            "status": "pending",
            "code_files": [
              "index.js"
            ]
          },
          {
            "id": "BE-003",
            "description": "Create API endpoint for retrieving all tasks (GET /api/tasks).",
            "dependencies": [
              "BE-001"
            ],
            "estimated_time": "6 hours",
            "agent_role": "backend_developer",
            "acceptance_criteria": [
              "Endpoint accepts GET requests to /api/tasks.",
              "Endpoint retrieves all tasks from the database (initially, an empty array).",
              "Endpoint returns 200 OK with a JSON array of tasks."
            ],
            "status": "pending",
            "code_files": [
              "index.js"
            ]
          },
          {
            "id": "BE-004",
            "description": "Connect the backend API to the SQLite database (for adding tasks).",
            "dependencies": [
              "BE-002",
              "DB-001"
            ],
            "estimated_time": "8 hours",
            "agent_role": "backend_developer",
            "acceptance_criteria": [
              "Tasks are successfully saved to the SQLite database when added via the API.",
              "API returns the correct task ID after saving."
            ],
            "status": "pending",
            "code_files": [
              "index.js",
              "db.js"
            ]
          },
          {
            "id": "BE-005",
            "description": "Connect the backend API to the SQLite database (for retrieving tasks).",
            "dependencies": [
              "BE-003",
              "DB-001"
            ],
            "estimated_time": "6 hours",
            "agent_role": "backend_developer",
            "acceptance_criteria": [
              "API retrieves all tasks from the SQLite database.",
              "API returns the correct list of tasks."
            ],
            "status": "pending",
            "code_files": [
              "index.js",
              "db.js"
            ]
          },
          {
            "id": "TEST-001",
            "description": "Write unit tests for the backend API (add task endpoint).",
            "dependencies": [
              "BE-002",
              "BE-004"
            ],
            "estimated_time": "6 hours",
            "agent_role": "backend_developer",
            "acceptance_criteria": [
              "Tests cover successful task creation.",
              "Tests cover validation errors (missing description).",
              "Tests use a testing framework (e.g., Jest).",
              "Tests mock database interactions."
            ],
            "status": "pending",
            "code_files": [
              "tests/api.test.js"
            ]
          },
          {
            "id": "TEST-002",
            "description": "Write unit tests for the backend API (get tasks endpoint).",
            "dependencies": [
              "BE-003",
              "BE-005"
            ],
            "estimated_time": "4 hours",
            "agent_role": "backend_developer",
            "acceptance_criteria": [
              "Tests cover successful task retrieval.",
              "Tests cover the case where no tasks exist.",
              "Tests use a testing framework (e.g., Jest).",
              "Tests mock database interactions."
            ],
            "status": "pending",
            "code_files": [
              "tests/api.test.js"
            ]
          },
          {
            "id": "DEPLOY-001",
            "description": "Deploy the application to Heroku.",
            "dependencies": [
              "FE-006",
              "BE-005",
              "TEST-003"
            ],
            "estimated_time": "8 hours",
            "agent_role": "backend_developer",
            "acceptance_criteria": [
              "Heroku application is created.",
              "Frontend and backend code are deployed to Heroku.",
              "SQLite database is configured on Heroku (using a plugin).",
              "Application is accessible via a Heroku URL.",
              "Environment variables (if any) are configured correctly."
            ],
            "status": "pending",
            "code_files": []
          },
          {
            "id": "DEPLOY-002",
            "description": "Configure Heroku for database and environment variables.",
            "dependencies": [
              "DEPLOY-001"
            ],
            "estimated_time": "2 hours",
            "agent_role": "backend_developer",
            "acceptance_criteria": [
              "Heroku application is connected to a database.",
              "Any necessary environment variables are set (e.g., database connection string)."
            ],
            "status": "pending",
            "code_files": []
          },
          {
            "id": "MONITOR-001",
            "description": "Set up basic monitoring on Heroku.",
            "dependencies": [
              "DEPLOY-001"
            ],
            "estimated_time": "2 hours",
            "agent_role": "backend_developer",
            "acceptance_criteria": [
              "Heroku's built-in monitoring tools are enabled.",
              "Application logs are accessible.",
              "Basic performance metrics are visible."
            ],
            "status": "pending",
            "code_files": []
          }
        ]
      },
      {
        "name": "Database Phase",
        "description": "Tasks related to database phase",
        "deliverables": [
          "Completed DB-001"
        ],
        "estimated_duration_hours": 6.0,
        "work_items": [
          {
            "id": "DB-001",
            "description": "Set up SQLite database and create 'tasks' table.",
            "dependencies": [],
            "estimated_time": "6 hours",
            "agent_role": "database_specialist",
            "acceptance_criteria": [
              "SQLite database file is created.",
              "'tasks' table exists with 'id' (INTEGER PRIMARY KEY AUTOINCREMENT) and 'description' (TEXT NOT NULL) columns."
            ],
            "status": "pending",
            "code_files": [
              "database.sqlite",
              "db.js"
            ]
          }
        ]
      }
    ],
    "timeline_estimation": {
      "start_date": "2025-07-09T09:46:23.753236",
      "end_date": "TBD",
      "milestones": []
    },
    "risk_assessment": [],
    "resource_requirements": [
      {
        "role": "Frontend Developer",
        "count": 1,
        "estimated_time_allocation": "100%",
        "phases": [
          "Frontend Phase"
        ],
        "skills_required": []
      },
      {
        "role": "Backend Developer",
        "count": 1,
        "estimated_time_allocation": "100%",
        "phases": [
          "Backend Phase"
        ],
        "skills_required": []
      },
      {
        "role": "Database Specialist",
        "count": 1,
        "estimated_time_allocation": "100%",
        "phases": [
          "Database Phase"
        ],
        "skills_required": []
      }
    ],
    "deliverables": [
      "Completed FE-001",
      "Completed FE-002",
      "Completed FE-003",
      "Completed FE-004",
      "Completed FE-005",
      "Completed FE-006",
      "Completed TEST-003",
      "Completed BE-001",
      "Completed BE-002",
      "Completed BE-003",
      "Completed BE-004",
      "Completed BE-005",
      "Completed TEST-001",
      "Completed TEST-002",
      "Completed DEPLOY-001",
      "Completed DEPLOY-002",
      "Completed MONITOR-001",
      "Completed DB-001"
    ],
    "dependencies": [],
    "raw_plan": "plan=ImplementationPlan(project_summary={'title': 'Generated Project Plan', 'description': 'Develop a simple web application using React for the frontend, Node.js/Express.js for the backend, and SQLite for the database. The application will allow users to add and view a list of tasks. The application will be deployed to Heroku.', 'overall_complexity': 'Medium', 'estimated_duration': 'TBD', 'key_challenges': [], 'success_criteria': []}, phases=[{'name': 'Frontend Phase', 'description': 'Tasks related to frontend phase', 'deliverables': ['Completed FE-001', 'Completed FE-002', 'Completed FE-003', 'Completed FE-004', 'Completed FE-005', 'Completed FE-006', 'Completed TEST-003'], 'estimated_duration_hours': 38.0, 'work_items': [{'id': 'FE-001', 'description': 'Set up React project using Create React App.', 'dependencies': [], 'estimated_time': '4 hours', 'agent_role': 'frontend_developer', 'acceptance_criteria': ['Project is initialized successfully.', 'Default React app runs without errors.'], 'status': 'pending', 'code_files': ['package.json', 'src/App.js', 'src/index.js']}, {'id': 'FE-002', 'description': 'Design and implement the UI for adding a new task (input field and add button).', 'dependencies': ['FE-001'], 'estimated_time': '6 hours', 'agent_role': 'frontend_developer', 'acceptance_criteria': ['UI elements for adding a task are present.', 'Input field accepts text input.', 'Add button is functional (though not yet connected to backend).'], 'status': 'pending', 'code_files': ['src/App.js', 'src/App.css']}, {'id': 'FE-003', 'description': 'Design and implement the UI for displaying the task list (initially, a placeholder).', 'dependencies': ['FE-001'], 'estimated_time': '4 hours', 'agent_role': 'frontend_developer', 'acceptance_criteria': ['Task list area is present in the UI.', 'Placeholder text or UI element indicates where tasks will be displayed.'], 'status': 'pending', 'code_files': ['src/App.js', 'src/App.css']}, {'id': 'FE-004', 'description': 'Implement basic styling for the UI (input field, button, task list).', 'dependencies': ['FE-002', 'FE-003'], 'estimated_time': '4 hours', 'agent_role': 'frontend_developer', 'acceptance_criteria': ['UI elements are visually appealing.', 'Layout is clear and easy to understand.', 'Styling is consistent.'], 'status': 'pending', 'code_files': ['src/App.css']}, {'id': 'FE-005', 'description': 'Connect the frontend to the backend API (add task functionality).', 'dependencies': ['FE-002', 'BE-002', 'BE-004'], 'estimated_time': '8 hours', 'agent_role': 'frontend_developer', 'acceptance_criteria': [\"Frontend makes a POST request to /api/tasks when the 'Add' button is clicked.\", 'Frontend sends the task description in the request body.', 'Frontend handles the API response (success and error).', 'Frontend updates the UI to reflect the new task (e.g., clears the input field).'], 'status': 'pending', 'code_files': ['src/App.js']}, {'id': 'FE-006', 'description': 'Connect the frontend to the backend API (display task list).', 'dependencies': ['FE-003', 'BE-003', 'BE-005'], 'estimated_time': '8 hours', 'agent_role': 'frontend_developer', 'acceptance_criteria': ['Frontend makes a GET request to /api/tasks on component mount (or refresh).', 'Frontend displays the retrieved tasks in the task list area.', 'Frontend handles the API response (success and error).'], 'status': 'pending', 'code_files': ['src/App.js']}, {'id': 'TEST-003', 'description': 'Perform manual testing of the frontend and backend integration.', 'dependencies': ['FE-005', 'FE-006', 'BE-004', 'BE-005'], 'estimated_time': '4 hours', 'agent_role': 'frontend_developer', 'acceptance_criteria': ['Tasks can be added successfully.', 'Tasks are displayed correctly in the list.', 'Error messages are displayed appropriately.', 'UI behaves as expected.'], 'status': 'pending', 'code_files': []}]}, {'name': 'Backend Phase', 'description': 'Tasks related to backend phase', 'deliverables': ['Completed BE-001', 'Completed BE-002', 'Completed BE-003', 'Completed BE-004', 'Completed BE-005', 'Completed TEST-001', 'Completed TEST-002', 'Completed DEPLOY-001', 'Completed DEPLOY-002', 'Completed MONITOR-001'], 'estimated_duration_hours': 54.0, 'work_items': [{'id': 'BE-001', 'description': 'Set up Node.js and Express.js project.', 'dependencies': [], 'estimated_time': '4 hours', 'agent_role': 'backend_developer', 'acceptance_criteria': ['Project is initialized successfully.', 'Express.js server runs without errors.', \"Basic route (e.g., '/') responds with 'Hello World'.\"], 'status': 'pending', 'code_files': ['package.json', 'index.js']}, {'id': 'BE-002', 'description': 'Create API endpoint for adding a new task (POST /api/tasks).', 'dependencies': ['BE-001'], 'estimated_time': '8 hours', 'agent_role': 'backend_developer', 'acceptance_criteria': ['Endpoint accepts POST requests to /api/tasks.', \"Endpoint receives 'description' parameter in the request body.\", \"Endpoint validates the 'description' parameter (required).\", \"Endpoint returns 201 Created on success with the new task's ID.\", 'Endpoint returns 400 Bad Request on validation failure.'], 'status': 'pending', 'code_files': ['index.js']}, {'id': 'BE-003', 'description': 'Create API endpoint for retrieving all tasks (GET /api/tasks).', 'dependencies': ['BE-001'], 'estimated_time': '6 hours', 'agent_role': 'backend_developer', 'acceptance_criteria': ['Endpoint accepts GET requests to /api/tasks.', 'Endpoint retrieves all tasks from the database (initially, an empty array).', 'Endpoint returns 200 OK with a JSON array of tasks.'], 'status': 'pending', 'code_files': ['index.js']}, {'id': 'BE-004', 'description': 'Connect the backend API to the SQLite database (for adding tasks).', 'dependencies': ['BE-002', 'DB-001'], 'estimated_time': '8 hours', 'agent_role': 'backend_developer', 'acceptance_criteria': ['Tasks are successfully saved to the SQLite database when added via the API.', 'API returns the correct task ID after saving.'], 'status': 'pending', 'code_files': ['index.js', 'db.js']}, {'id': 'BE-005', 'description': 'Connect the backend API to the SQLite database (for retrieving tasks).', 'dependencies': ['BE-003', 'DB-001'], 'estimated_time': '6 hours', 'agent_role': 'backend_developer', 'acceptance_criteria': ['API retrieves all tasks from the SQLite database.', 'API returns the correct list of tasks.'], 'status': 'pending', 'code_files': ['index.js', 'db.js']}, {'id': 'TEST-001', 'description': 'Write unit tests for the backend API (add task endpoint).', 'dependencies': ['BE-002', 'BE-004'], 'estimated_time': '6 hours', 'agent_role': 'backend_developer', 'acceptance_criteria': ['Tests cover successful task creation.', 'Tests cover validation errors (missing description).', 'Tests use a testing framework (e.g., Jest).', 'Tests mock database interactions.'], 'status': 'pending', 'code_files': ['tests/api.test.js']}, {'id': 'TEST-002', 'description': 'Write unit tests for the backend API (get tasks endpoint).', 'dependencies': ['BE-003', 'BE-005'], 'estimated_time': '4 hours', 'agent_role': 'backend_developer', 'acceptance_criteria': ['Tests cover successful task retrieval.', 'Tests cover the case where no tasks exist.', 'Tests use a testing framework (e.g., Jest).', 'Tests mock database interactions.'], 'status': 'pending', 'code_files': ['tests/api.test.js']}, {'id': 'DEPLOY-001', 'description': 'Deploy the application to Heroku.', 'dependencies': ['FE-006', 'BE-005', 'TEST-003'], 'estimated_time': '8 hours', 'agent_role': 'backend_developer', 'acceptance_criteria': ['Heroku application is created.', 'Frontend and backend code are deployed to Heroku.', 'SQLite database is configured on Heroku (using a plugin).', 'Application is accessible via a Heroku URL.', 'Environment variables (if any) are configured correctly.'], 'status': 'pending', 'code_files': []}, {'id': 'DEPLOY-002', 'description': 'Configure Heroku for database and environment variables.', 'dependencies': ['DEPLOY-001'], 'estimated_time': '2 hours', 'agent_role': 'backend_developer', 'acceptance_criteria': ['Heroku application is connected to a database.', 'Any necessary environment variables are set (e.g., database connection string).'], 'status': 'pending', 'code_files': []}, {'id': 'MONITOR-001', 'description': 'Set up basic monitoring on Heroku.', 'dependencies': ['DEPLOY-001'], 'estimated_time': '2 hours', 'agent_role': 'backend_developer', 'acceptance_criteria': [\"Heroku's built-in monitoring tools are enabled.\", 'Application logs are accessible.', 'Basic performance metrics are visible.'], 'status': 'pending', 'code_files': []}]}, {'name': 'Database Phase', 'description': 'Tasks related to database phase', 'deliverables': ['Completed DB-001'], 'estimated_duration_hours': 6.0, 'work_items': [{'id': 'DB-001', 'description': \"Set up SQLite database and create 'tasks' table.\", 'dependencies': [], 'estimated_time': '6 hours', 'agent_role': 'database_specialist', 'acceptance_criteria': ['SQLite database file is created.', \"'tasks' table exists with 'id' (INTEGER PRIMARY KEY AUTOINCREMENT) and 'description' (TEXT NOT NULL) columns.\"], 'status': 'pending', 'code_files': ['database.sqlite', 'db.js']}]}], resource_allocation=[{'role': 'Frontend Developer', 'count': 1, 'estimated_time_allocation': '100%', 'phases': ['Frontend Phase'], 'skills_required': []}, {'role': 'Backend Developer', 'count': 1, 'estimated_time_allocation': '100%', 'phases': ['Backend Phase'], 'skills_required': []}, {'role': 'Database Specialist', 'count': 1, 'estimated_time_allocation': '100%', 'phases': ['Database Phase'], 'skills_required': []}], risks_and_mitigations=[], timeline={'start_date': '2025-07-09T09:46:23.753236', 'end_date': 'TBD', 'milestones': []}, tech_stack={}, metadata={'generated_at': '2025-07-09T09:46:23.753236', 'version': '1.0', 'author': 'Multi-AI Dev System', 'tags': [], 'notes': 'Converted from WorkItemBacklog. Original summary: Develop a simple web application using React for the frontend, Node.js/Express.js for the backend, and SQLite for the database. The application will allow users to add and view a list of tasks. The application will be deployed to Heroku.'}) summary='Develop a simple web application using React for the frontend, Node.js/Express.js for the backend, and SQLite for the database. The application will allow users to add and view a list of tasks. The application will be deployed to Heroku.' metadata=PlanMetadata(generated_at='2025-07-09T09:46:23.753236', version='1.0', author='Multi-AI Dev System', tags=[], notes='Converted from WorkItemBacklog. Original summary: Develop a simple web application using React for the frontend, Node.js/Express.js for the backend, and SQLite for the database. The application will allow users to add and view a list of tasks. The application will be deployed to Heroku.')"
  },
  "workflow_state_snapshot": {
    "requirements_analysis": {
      "project_name": "Hello World Task List",
      "project_summary": "A simple web application to manage a list of tasks.",
      "project_goals": [
        "Allow a user to add a task",
        "Allow a user to see their list of tasks"
      ],
      "target_audience": [
        "Users who want to manage a list of tasks"
      ],
      "business_context": "This project aims to provide a basic task management tool.",
      "requirements": [
        {
          "id": "REQ-001",
          "description": "A user can create a new task with a text description.",
          "category": "functional",
          "priority": 1
        },
        {
          "id": "REQ-002",
          "description": "A user can see a list of all created tasks.",
          "category": "functional",
          "priority": 1
        },
        {
          "id": "REQ-003",
          "description": "The application must load quickly.",
          "category": "non_functional",
          "priority": 2
        },
        {
          "id": "REQ-004",
          "description": "The application must be secure.",
          "category": "non_functional",
          "priority": 2
        }
      ],
      "functional_requirements": [
        "A user can create a new task with a text description.",
        "A user can see a list of all created tasks."
      ],
      "non_functional_requirements": [
        "The application must load quickly.",
        "The application must be secure."
      ],
      "stakeholders": [
        "Users"
      ],
      "success_criteria": [
        "Users can successfully add tasks.",
        "Users can successfully view their task list.",
        "The application loads quickly.",
        "The application is secure."
      ],
      "constraints": [],
      "assumptions": [],
      "risks": [],
      "domain_specific_details": {},
      "quality_assessment": {
        "clarity_score": 9.0,
        "completeness_score": 8.0,
        "consistency_score": 10.0,
        "recommendations": []
      },
      "gap_analysis": {
        "identified_gaps": [],
        "recommendations_for_completion": []
      }
    },
    "tech_stack_recommendation": {
      "frontend_options": [
        {
          "name": "React",
          "language": "JavaScript",
          "reasoning": "React is a popular and efficient library for building user interfaces. It offers a component-based architecture, making it easy to manage and update the task list. Its virtual DOM improves performance, addressing the 'load quickly' requirement.",
          "key_libraries": [
            "React Router (for navigation)",
            "Axios (for API calls)"
          ],
          "pros": [
            "Large community and extensive documentation.",
            "Component-based architecture for reusability.",
            "Virtual DOM for efficient updates.",
            "Good performance."
          ],
          "cons": [
            "Requires understanding of JSX.",
            "Can have a steeper learning curve for beginners."
          ],
          "selected": false
        },
        {
          "name": "Vue.js",
          "language": "JavaScript",
          "reasoning": "Vue.js is a progressive framework that's easy to learn and integrate. It's well-suited for single-page applications like this task list. Its reactivity system makes it simple to update the UI when tasks are added or modified.",
          "key_libraries": [
            "Vue Router (for navigation)",
            "Axios (for API calls)",
            "Vuex (for state management - optional for this simple app)"
          ],
          "pros": [
            "Easy to learn and use.",
            "Excellent documentation.",
            "Progressive framework - can be integrated incrementally.",
            "Good performance."
          ],
          "cons": [
            "Smaller community compared to React.",
            "May require more manual configuration for complex applications."
          ],
          "selected": false
        },
        {
          "name": "Svelte",
          "language": "JavaScript",
          "reasoning": "Svelte is a component framework that compiles your code to highly optimized vanilla JavaScript at build time. This results in fast performance and a small bundle size, directly addressing the 'load quickly' requirement. It's also known for its ease of use.",
          "key_libraries": [
            "Svelte Router (for navigation)",
            "Axios (for API calls)"
          ],
          "pros": [
            "Excellent performance due to compile-time optimization.",
            "Simple and intuitive syntax.",
            "Small bundle size.",
            "Easy to learn."
          ],
          "cons": [
            "Smaller community compared to React and Vue.",
            "Ecosystem is still developing."
          ],
          "selected": false
        }
      ],
      "backend_options": [
        {
          "name": "Node.js with Express.js",
          "language": "JavaScript",
          "reasoning": "Node.js with Express.js provides a lightweight and efficient backend for handling API requests. JavaScript is used on both the frontend and backend, which simplifies development. Express.js simplifies routing and middleware management.",
          "key_libraries": [
            "Express.js (web framework)",
            "body-parser (for parsing request bodies)",
            "bcrypt (for password hashing - if user authentication is added later)"
          ],
          "pros": [
            "JavaScript on both frontend and backend (full-stack JavaScript).",
            "Large community and extensive documentation.",
            "Fast development with Express.js.",
            "Good performance with non-blocking I/O."
          ],
          "cons": [
            "Callback hell can be an issue (can be mitigated with async/await).",
            "Requires careful handling of security vulnerabilities."
          ],
          "selected": false
        },
        {
          "name": "Python with Flask",
          "language": "Python",
          "reasoning": "Flask is a microframework that's easy to learn and use. Python is a versatile language. Flask is suitable for small to medium-sized projects. It offers flexibility and control over the application.",
          "key_libraries": [
            "Flask (web framework)",
            "Flask-SQLAlchemy (for database interaction)",
            "bcrypt (for password hashing - if user authentication is added later)"
          ],
          "pros": [
            "Easy to learn and use.",
            "Large community and extensive documentation.",
            "Good for rapid prototyping.",
            "Python's readability."
          ],
          "cons": [
            "Can become complex as the application grows.",
            "Performance might be a concern for very high-traffic applications."
          ],
          "selected": false
        },
        {
          "name": "Go with Gin",
          "language": "Go",
          "reasoning": "Go is known for its performance and efficiency. Gin is a lightweight web framework for Go. This combination is suitable for building a fast and scalable backend. Go's concurrency features can handle multiple requests efficiently.",
          "key_libraries": [
            "Gin (web framework)",
            "GORM (for database interaction)",
            "bcrypt (for password hashing - if user authentication is added later)"
          ],
          "pros": [
            "Excellent performance.",
            "Efficient resource usage.",
            "Concurrency support.",
            "Fast compilation."
          ],
          "cons": [
            "Steeper learning curve than Python or Node.js.",
            "Smaller community compared to Python and Node.js."
          ],
          "selected": false
        }
      ],
      "database_options": [
        {
          "name": "PostgreSQL",
          "language": null,
          "reasoning": "PostgreSQL is a robust and reliable relational database. It offers strong data integrity and supports complex queries. It's a good choice for storing and managing task data securely.",
          "key_libraries": [
            "psycopg2 (for Python)",
            "pg (for Node.js)"
          ],
          "pros": [
            "ACID properties for data integrity.",
            "Supports complex queries.",
            "Mature and stable.",
            "Good performance."
          ],
          "cons": [
            "Can be more complex to set up and manage than simpler databases.",
            "Requires more resources than simpler databases."
          ],
          "selected": false
        },
        {
          "name": "MongoDB",
          "language": null,
          "reasoning": "MongoDB is a NoSQL database that's easy to use and flexible. It's suitable for storing unstructured data, which can be useful if the task descriptions become more complex in the future. It offers good scalability.",
          "key_libraries": [
            "mongoose (for Node.js)",
            "pymongo (for Python)"
          ],
          "pros": [
            "Flexible schema.",
            "Easy to scale.",
            "Good performance for read/write operations.",
            "Easy to get started."
          ],
          "cons": [
            "Data consistency can be more challenging to manage.",
            "Not as strong data integrity as relational databases."
          ],
          "selected": false
        },
        {
          "name": "SQLite",
          "language": null,
          "reasoning": "SQLite is a lightweight, file-based database that's easy to set up and use. It's suitable for small projects and prototyping. It requires no separate server process, simplifying deployment.",
          "key_libraries": [
            "sqlite3 (built-in for Python)",
            "sqlite3 (for Node.js)"
          ],
          "pros": [
            "Easy to set up and use.",
            "No server process required.",
            "Good for small projects.",
            "Simple to deploy."
          ],
          "cons": [
            "Not suitable for high-traffic applications.",
            "Limited scalability.",
            "Less robust than other databases."
          ],
          "selected": false
        }
      ],
      "cloud_options": [
        {
          "name": "AWS",
          "language": null,
          "reasoning": "AWS offers a wide range of services for deploying and managing web applications. It provides scalability, security, and reliability. Services like EC2, S3, and RDS can be used to host the frontend, store static assets, and manage the database, respectively.",
          "key_libraries": [
            "AWS SDK (for interacting with AWS services)"
          ],
          "pros": [
            "Highly scalable and reliable.",
            "Wide range of services.",
            "Mature ecosystem.",
            "Good security features."
          ],
          "cons": [
            "Can be complex to manage.",
            "Can be expensive if not configured correctly.",
            "Steeper learning curve."
          ],
          "selected": false
        },
        {
          "name": "Google Cloud Platform (GCP)",
          "language": null,
          "reasoning": "GCP provides a comprehensive set of cloud services, including compute, storage, and database options. It's known for its competitive pricing and strong support for containerization (e.g., using Kubernetes).",
          "key_libraries": [
            "Google Cloud SDK (for interacting with GCP services)"
          ],
          "pros": [
            "Competitive pricing.",
            "Strong support for containerization.",
            "Good performance.",
            "User-friendly interface."
          ],
          "cons": [
            "Can be complex to manage.",
            "Requires understanding of GCP services.",
            "Vendor lock-in."
          ],
          "selected": false
        },
        {
          "name": "Heroku",
          "language": null,
          "reasoning": "Heroku is a Platform-as-a-Service (PaaS) that simplifies deployment and management. It's easy to use and ideal for small to medium-sized projects. It handles the infrastructure, allowing developers to focus on code.",
          "key_libraries": [],
          "pros": [
            "Easy to deploy and manage.",
            "Focus on code, not infrastructure.",
            "Good for rapid prototyping.",
            "Free tier available."
          ],
          "cons": [
            "Limited customization options.",
            "Can become expensive as the application grows.",
            "Vendor lock-in."
          ],
          "selected": false
        }
      ],
      "architecture_options": [
        {
          "pattern": "Monolithic Architecture",
          "scalability_score": 4.0,
          "maintainability_score": 6.0,
          "development_speed_score": 8.0,
          "overall_score": 6.0,
          "reasoning": "A monolithic architecture is suitable for this small project. All components (frontend, backend, database) are deployed as a single unit. This simplifies development and deployment. Scalability is limited, but sufficient for the project's scope."
        },
        {
          "pattern": "Microservices Architecture",
          "scalability_score": 8.0,
          "maintainability_score": 7.0,
          "development_speed_score": 5.0,
          "overall_score": 6.0,
          "reasoning": "While overkill for this project, a microservices architecture could be considered if the application is expected to grow significantly. Each service (e.g., task management, user authentication) would be deployed independently. This increases scalability and maintainability but adds complexity."
        },
        {
          "pattern": "Serverless Architecture",
          "scalability_score": 9.0,
          "maintainability_score": 7.0,
          "development_speed_score": 6.0,
          "overall_score": 7.0,
          "reasoning": "A serverless architecture uses cloud services (e.g., AWS Lambda, Google Cloud Functions) to execute code without managing servers. This can reduce operational overhead and improve scalability. It's a good option if the application's traffic is unpredictable. However, it can introduce complexities in debugging and testing."
        }
      ],
      "tool_options": [
        {
          "name": "Git",
          "language": null,
          "reasoning": "Version control for the codebase.",
          "key_libraries": [],
          "pros": [],
          "cons": [],
          "selected": false
        },
        {
          "name": "VS Code",
          "language": null,
          "reasoning": "Code editor with extensions for various languages and frameworks.",
          "key_libraries": [],
          "pros": [],
          "cons": [],
          "selected": false
        },
        {
          "name": "npm/yarn/pnpm",
          "language": null,
          "reasoning": "Package manager for JavaScript dependencies.",
          "key_libraries": [],
          "pros": [],
          "cons": [],
          "selected": false
        },
        {
          "name": "Postman/Insomnia",
          "language": null,
          "reasoning": "API testing and debugging.",
          "key_libraries": [],
          "pros": [],
          "cons": [],
          "selected": false
        },
        {
          "name": "Docker",
          "language": null,
          "reasoning": "Containerization for consistent development and deployment environments (optional).",
          "key_libraries": [],
          "pros": [],
          "cons": [],
          "selected": false
        },
        {
          "name": "CI/CD Pipeline (e.g., GitHub Actions, GitLab CI)",
          "language": null,
          "reasoning": "Automated build, test, and deployment.",
          "key_libraries": [],
          "pros": [],
          "cons": [],
          "selected": false
        }
      ],
      "risks": [
        {
          "category": "Security",
          "description": "Vulnerabilities in dependencies could lead to security breaches.",
          "severity": "Medium",
          "likelihood": "Medium",
          "mitigation": "Regularly update dependencies and use security scanners."
        },
        {
          "category": "Performance",
          "description": "Inefficient code or database queries could lead to slow loading times.",
          "severity": "Medium",
          "likelihood": "Medium",
          "mitigation": "Optimize code, use database indexing, and monitor performance."
        },
        {
          "category": "Scalability",
          "description": "The application may not scale well if the user base grows significantly.",
          "severity": "Low",
          "likelihood": "Low",
          "mitigation": "Design the application with scalability in mind (e.g., using a database that can scale)."
        }
      ],
      "synthesis": {
        "backend": {
          "name": "Node.js with Express.js",
          "language": "JavaScript",
          "reasoning": "Node.js with Express.js allows for full-stack JavaScript development, simplifying the development process. It's efficient and well-suited for handling API requests."
        },
        "frontend": {
          "name": "React",
          "language": "JavaScript",
          "reasoning": "React provides a good balance of performance, ease of use, and a large community. It's well-suited for building interactive user interfaces for this task list application."
        },
        "database": {
          "name": "SQLite",
          "reasoning": "SQLite is a simple, file-based database that's easy to set up and deploy. It's suitable for this small project and requires no separate server process."
        },
        "architecture_pattern": "Monolithic Architecture",
        "deployment_environment": {
          "cloud_platform": "Heroku",
          "reasoning": "Heroku simplifies deployment and management, allowing the developer to focus on code. It's a good choice for small projects and offers a free tier."
        },
        "key_libraries_tools": [
          {
            "name": "React Router",
            "purpose": "For navigation in the React frontend."
          },
          {
            "name": "Express.js",
            "purpose": "For building the backend API."
          },
          {
            "name": "Git",
            "purpose": "Version control for the codebase."
          },
          {
            "name": "VS Code",
            "purpose": "Code editor with extensions for various languages and frameworks."
          }
        ],
        "estimated_complexity": "Low"
      },
      "selected_stack": null
    },
    "system_design": {
      "architecture": {
        "pattern": "Monolithic Architecture",
        "justification": "The project is small in scope and complexity. A monolithic architecture simplifies development, deployment, and maintenance compared to microservices. It's sufficient for the current requirements and anticipated growth.",
        "key_benefits": [
          "Simplified development and deployment.",
          "Reduced operational overhead.",
          "Faster initial development speed."
        ],
        "potential_drawbacks": [
          "Limited scalability compared to microservices.",
          "Tightly coupled components can make changes more difficult as the application grows."
        ]
      },
      "components": [
        {
          "name": "Frontend",
          "description": "The user interface for interacting with the task list.",
          "category": "frontend",
          "technologies": [
            "React",
            "JavaScript",
            "HTML",
            "CSS"
          ],
          "dependencies": [
            "Backend API"
          ],
          "responsibilities": [
            "Displaying the task list.",
            "Allowing users to add new tasks.",
            "Handling user interactions.",
            "Making API calls to the backend."
          ],
          "design_patterns": [
            "Component-based architecture"
          ]
        },
        {
          "name": "Backend API",
          "description": "Provides an API for the frontend to interact with the task data.",
          "category": "backend",
          "technologies": [
            "Node.js",
            "Express.js",
            "JavaScript"
          ],
          "dependencies": [
            "SQLite Database"
          ],
          "responsibilities": [
            "Handling API requests from the frontend.",
            "Validating data.",
            "Interacting with the database.",
            "Returning data to the frontend."
          ],
          "design_patterns": [
            "RESTful API"
          ]
        },
        {
          "name": "SQLite Database",
          "description": "Stores the task data.",
          "category": "database",
          "technologies": [
            "SQLite"
          ],
          "dependencies": [],
          "responsibilities": [
            "Storing task data.",
            "Providing data access to the backend API."
          ],
          "design_patterns": []
        },
        {
          "name": "Deployment Environment",
          "description": "The environment where the application is deployed.",
          "category": "deployment",
          "technologies": [
            "Heroku"
          ],
          "dependencies": [
            "Frontend",
            "Backend API",
            "SQLite Database"
          ],
          "responsibilities": [
            "Hosting the frontend.",
            "Hosting the backend API.",
            "Managing the database.",
            "Providing a URL for accessing the application."
          ],
          "design_patterns": []
        }
      ],
      "data_model": {
        "schema_type": "Relational",
        "tables": [
          {
            "name": "tasks",
            "purpose": "Stores information about each task.",
            "fields": [
              {
                "name": "id",
                "type": "INTEGER",
                "constraints": [
                  "PRIMARY KEY",
                  "AUTOINCREMENT"
                ],
                "description": "Unique identifier for the task."
              },
              {
                "name": "description",
                "type": "TEXT",
                "constraints": [
                  "NOT NULL"
                ],
                "description": "The text description of the task."
              }
            ],
            "relationships": []
          }
        ],
        "relationships": [],
        "justification": "A relational schema is suitable for this application because it provides a structured way to store and retrieve task data. SQLite is a good choice for a small project, and a relational schema allows for easy querying and data integrity."
      },
      "api_endpoints": {
        "style": "REST",
        "base_url": "/api/tasks",
        "authentication": "None",
        "endpoints": [
          {
            "method": "POST",
            "path": "/",
            "purpose": "Create a new task.",
            "parameters": [
              {
                "description": "The task description.",
                "type": "string",
                "name": "description"
              }
            ],
            "response": {
              "201": {
                "message": "Task created successfully.",
                "task": {
                  "id": 1,
                  "description": "Example task"
                }
              },
              "400": {
                "message": "Bad Request",
                "errors": [
                  "Description is required."
                ]
              }
            },
            "authentication_required": false,
            "rate_limiting_applied": false
          },
          {
            "method": "GET",
            "path": "/",
            "purpose": "Get all tasks.",
            "parameters": [],
            "response": {
              "200": {
                "tasks": [
                  {
                    "id": 1,
                    "description": "Example task"
                  }
                ]
              }
            },
            "authentication_required": false,
            "rate_limiting_applied": false
          }
        ],
        "error_handling": "Standard HTTP status codes and JSON responses for errors.",
        "rate_limiting_strategy": null
      },
      "security": {
        "authentication_method": "None",
        "authorization_strategy": "None",
        "data_encryption": {},
        "security_measures": [
          {
            "category": "Input Validation",
            "implementation": "Validate all user inputs on the backend to prevent injection attacks.",
            "mitigation": "SQL Injection, Cross-Site Scripting (XSS)",
            "priority": "High"
          },
          {
            "category": "Dependency Management",
            "implementation": "Regularly update dependencies to patch security vulnerabilities.",
            "mitigation": "Vulnerabilities in dependencies",
            "priority": "Medium"
          },
          {
            "category": "HTTPS",
            "implementation": "Enforce HTTPS for all communication.",
            "mitigation": "Man-in-the-middle attacks",
            "priority": "High"
          }
        ],
        "vulnerability_mitigation_strategies": [
          "Input validation",
          "Regular dependency updates",
          "Use of HTTPS"
        ],
        "compliance_standards": []
      },
      "scalability_and_performance": {
        "caching_strategy": "No caching is needed for this small application.",
        "database_optimization": "Use indexes on the 'id' field for faster lookups.",
        "code_optimization": "Write efficient code and avoid unnecessary computations."
      },
      "deployment_strategy": {
        "platform": "Heroku",
        "steps": [
          "Create a Heroku application.",
          "Connect the application to a Git repository.",
          "Configure the application to use a SQLite database (Heroku provides a plugin).",
          "Deploy the frontend and backend code.",
          "Configure environment variables (if needed)."
        ],
        "environment": "Production"
      },
      "monitoring_and_logging": {
        "logging": "Use a logging library (e.g., Winston for Node.js) to log important events and errors.",
        "monitoring": "Monitor application performance and errors using Heroku's built-in monitoring tools."
      },
      "error_handling_strategy": "Use standard HTTP status codes (e.g., 200 OK, 201 Created, 400 Bad Request, 500 Internal Server Error). Return JSON responses with error messages and details to the frontend.",
      "development_phases_overview": [
        {
          "name": "Phase 1: Setup and Frontend Development",
          "description": "Set up the development environment, create the React frontend, and implement the UI for adding and viewing tasks.",
          "priority": "High",
          "dependencies": [],
          "tasks": [
            "Set up React project.",
            "Design and implement the UI for adding tasks.",
            "Design and implement the UI for displaying tasks.",
            "Implement basic styling."
          ],
          "estimated_duration": "1 week"
        },
        {
          "name": "Phase 2: Backend API Development",
          "description": "Develop the Node.js backend API to handle task creation and retrieval.",
          "priority": "High",
          "dependencies": [
            "Phase 1: Setup and Frontend Development"
          ],
          "tasks": [
            "Set up Node.js and Express.js project.",
            "Create API endpoints for adding and retrieving tasks.",
            "Implement data validation.",
            "Connect to the SQLite database."
          ],
          "estimated_duration": "1 week"
        },
        {
          "name": "Phase 3: Integration and Testing",
          "description": "Integrate the frontend and backend, and perform testing.",
          "priority": "High",
          "dependencies": [
            "Phase 1: Setup and Frontend Development",
            "Phase 2: Backend API Development"
          ],
          "tasks": [
            "Connect the frontend to the backend API.",
            "Test the application thoroughly.",
            "Address any bugs or issues."
          ],
          "estimated_duration": "1 week"
        },
        {
          "name": "Phase 4: Deployment and Monitoring",
          "description": "Deploy the application to Heroku and set up monitoring.",
          "priority": "Medium",
          "dependencies": [
            "Phase 3: Integration and Testing"
          ],
          "tasks": [
            "Deploy the application to Heroku.",
            "Configure Heroku for database and environment variables.",
            "Set up basic monitoring."
          ],
          "estimated_duration": "2 days"
        }
      ],
      "key_risks": [
        "Security vulnerabilities in dependencies.",
        "Performance issues due to inefficient code or database queries.",
        "Scalability limitations if the application grows significantly."
      ],
      "design_justification": "The design prioritizes simplicity and ease of development, given the project's scope. The monolithic architecture, combined with the chosen technologies (React, Node.js/Express.js, SQLite, and Heroku), provides a straightforward and efficient solution for building and deploying the task list application. The focus on security best practices and performance optimization ensures a robust and user-friendly experience.",
      "data_flow": "1. User interacts with the React frontend to add a task. 2. Frontend sends a POST request to the backend API's /api/tasks endpoint with the task description. 3. Backend API validates the input. 4. Backend API interacts with the SQLite database to store the task. 5. Backend API returns a 201 Created response with the new task's ID to the frontend. 6. User requests the task list. 7. Frontend sends a GET request to the backend API's /api/tasks endpoint. 8. Backend API retrieves all tasks from the SQLite database. 9. Backend API returns a 200 OK response with the list of tasks to the frontend. 10. Frontend displays the task list to the user."
    },
    "implementation_plan": "plan=ImplementationPlan(project_summary={'title': 'Generated Project Plan', 'description': 'Develop a simple web application using React for the frontend, Node.js/Express.js for the backend, and SQLite for the database. The application will allow users to add and view a list of tasks. The application will be deployed to Heroku.', 'overall_complexity': 'Medium', 'estimated_duration': 'TBD', 'key_challenges': [], 'success_criteria': []}, phases=[{'name': 'Frontend Phase', 'description': 'Tasks related to frontend phase', 'deliverables': ['Completed FE-001', 'Completed FE-002', 'Completed FE-003', 'Completed FE-004', 'Completed FE-005', 'Completed FE-006', 'Completed TEST-003'], 'estimated_duration_hours': 38.0, 'work_items': [{'id': 'FE-001', 'description': 'Set up React project using Create React App.', 'dependencies': [], 'estimated_time': '4 hours', 'agent_role': 'frontend_developer', 'acceptance_criteria': ['Project is initialized successfully.', 'Default React app runs without errors.'], 'status': 'pending', 'code_files': ['package.json', 'src/App.js', 'src/index.js']}, {'id': 'FE-002', 'description': 'Design and implement the UI for adding a new task (input field and add button).', 'dependencies': ['FE-001'], 'estimated_time': '6 hours', 'agent_role': 'frontend_developer', 'acceptance_criteria': ['UI elements for adding a task are present.', 'Input field accepts text input.', 'Add button is functional (though not yet connected to backend).'], 'status': 'pending', 'code_files': ['src/App.js', 'src/App.css']}, {'id': 'FE-003', 'description': 'Design and implement the UI for displaying the task list (initially, a placeholder).', 'dependencies': ['FE-001'], 'estimated_time': '4 hours', 'agent_role': 'frontend_developer', 'acceptance_criteria': ['Task list area is present in the UI.', 'Placeholder text or UI element indicates where tasks will be displayed.'], 'status': 'pending', 'code_files': ['src/App.js', 'src/App.css']}, {'id': 'FE-004', 'description': 'Implement basic styling for the UI (input field, button, task list).', 'dependencies': ['FE-002', 'FE-003'], 'estimated_time': '4 hours', 'agent_role': 'frontend_developer', 'acceptance_criteria': ['UI elements are visually appealing.', 'Layout is clear and easy to understand.', 'Styling is consistent.'], 'status': 'pending', 'code_files': ['src/App.css']}, {'id': 'FE-005', 'description': 'Connect the frontend to the backend API (add task functionality).', 'dependencies': ['FE-002', 'BE-002', 'BE-004'], 'estimated_time': '8 hours', 'agent_role': 'frontend_developer', 'acceptance_criteria': [\"Frontend makes a POST request to /api/tasks when the 'Add' button is clicked.\", 'Frontend sends the task description in the request body.', 'Frontend handles the API response (success and error).', 'Frontend updates the UI to reflect the new task (e.g., clears the input field).'], 'status': 'pending', 'code_files': ['src/App.js']}, {'id': 'FE-006', 'description': 'Connect the frontend to the backend API (display task list).', 'dependencies': ['FE-003', 'BE-003', 'BE-005'], 'estimated_time': '8 hours', 'agent_role': 'frontend_developer', 'acceptance_criteria': ['Frontend makes a GET request to /api/tasks on component mount (or refresh).', 'Frontend displays the retrieved tasks in the task list area.', 'Frontend handles the API response (success and error).'], 'status': 'pending', 'code_files': ['src/App.js']}, {'id': 'TEST-003', 'description': 'Perform manual testing of the frontend and backend integration.', 'dependencies': ['FE-005', 'FE-006', 'BE-004', 'BE-005'], 'estimated_time': '4 hours', 'agent_role': 'frontend_developer', 'acceptance_criteria': ['Tasks can be added successfully.', 'Tasks are displayed correctly in the list.', 'Error messages are displayed appropriately.', 'UI behaves as expected.'], 'status': 'pending', 'code_files': []}]}, {'name': 'Backend Phase', 'description': 'Tasks related to backend phase', 'deliverables': ['Completed BE-001', 'Completed BE-002', 'Completed BE-003', 'Completed BE-004', 'Completed BE-005', 'Completed TEST-001', 'Completed TEST-002', 'Completed DEPLOY-001', 'Completed DEPLOY-002', 'Completed MONITOR-001'], 'estimated_duration_hours': 54.0, 'work_items': [{'id': 'BE-001', 'description': 'Set up Node.js and Express.js project.', 'dependencies': [], 'estimated_time': '4 hours', 'agent_role': 'backend_developer', 'acceptance_criteria': ['Project is initialized successfully.', 'Express.js server runs without errors.', \"Basic route (e.g., '/') responds with 'Hello World'.\"], 'status': 'pending', 'code_files': ['package.json', 'index.js']}, {'id': 'BE-002', 'description': 'Create API endpoint for adding a new task (POST /api/tasks).', 'dependencies': ['BE-001'], 'estimated_time': '8 hours', 'agent_role': 'backend_developer', 'acceptance_criteria': ['Endpoint accepts POST requests to /api/tasks.', \"Endpoint receives 'description' parameter in the request body.\", \"Endpoint validates the 'description' parameter (required).\", \"Endpoint returns 201 Created on success with the new task's ID.\", 'Endpoint returns 400 Bad Request on validation failure.'], 'status': 'pending', 'code_files': ['index.js']}, {'id': 'BE-003', 'description': 'Create API endpoint for retrieving all tasks (GET /api/tasks).', 'dependencies': ['BE-001'], 'estimated_time': '6 hours', 'agent_role': 'backend_developer', 'acceptance_criteria': ['Endpoint accepts GET requests to /api/tasks.', 'Endpoint retrieves all tasks from the database (initially, an empty array).', 'Endpoint returns 200 OK with a JSON array of tasks.'], 'status': 'pending', 'code_files': ['index.js']}, {'id': 'BE-004', 'description': 'Connect the backend API to the SQLite database (for adding tasks).', 'dependencies': ['BE-002', 'DB-001'], 'estimated_time': '8 hours', 'agent_role': 'backend_developer', 'acceptance_criteria': ['Tasks are successfully saved to the SQLite database when added via the API.', 'API returns the correct task ID after saving.'], 'status': 'pending', 'code_files': ['index.js', 'db.js']}, {'id': 'BE-005', 'description': 'Connect the backend API to the SQLite database (for retrieving tasks).', 'dependencies': ['BE-003', 'DB-001'], 'estimated_time': '6 hours', 'agent_role': 'backend_developer', 'acceptance_criteria': ['API retrieves all tasks from the SQLite database.', 'API returns the correct list of tasks.'], 'status': 'pending', 'code_files': ['index.js', 'db.js']}, {'id': 'TEST-001', 'description': 'Write unit tests for the backend API (add task endpoint).', 'dependencies': ['BE-002', 'BE-004'], 'estimated_time': '6 hours', 'agent_role': 'backend_developer', 'acceptance_criteria': ['Tests cover successful task creation.', 'Tests cover validation errors (missing description).', 'Tests use a testing framework (e.g., Jest).', 'Tests mock database interactions.'], 'status': 'pending', 'code_files': ['tests/api.test.js']}, {'id': 'TEST-002', 'description': 'Write unit tests for the backend API (get tasks endpoint).', 'dependencies': ['BE-003', 'BE-005'], 'estimated_time': '4 hours', 'agent_role': 'backend_developer', 'acceptance_criteria': ['Tests cover successful task retrieval.', 'Tests cover the case where no tasks exist.', 'Tests use a testing framework (e.g., Jest).', 'Tests mock database interactions.'], 'status': 'pending', 'code_files': ['tests/api.test.js']}, {'id': 'DEPLOY-001', 'description': 'Deploy the application to Heroku.', 'dependencies': ['FE-006', 'BE-005', 'TEST-003'], 'estimated_time': '8 hours', 'agent_role': 'backend_developer', 'acceptance_criteria': ['Heroku application is created.', 'Frontend and backend code are deployed to Heroku.', 'SQLite database is configured on Heroku (using a plugin).', 'Application is accessible via a Heroku URL.', 'Environment variables (if any) are configured correctly.'], 'status': 'pending', 'code_files': []}, {'id': 'DEPLOY-002', 'description': 'Configure Heroku for database and environment variables.', 'dependencies': ['DEPLOY-001'], 'estimated_time': '2 hours', 'agent_role': 'backend_developer', 'acceptance_criteria': ['Heroku application is connected to a database.', 'Any necessary environment variables are set (e.g., database connection string).'], 'status': 'pending', 'code_files': []}, {'id': 'MONITOR-001', 'description': 'Set up basic monitoring on Heroku.', 'dependencies': ['DEPLOY-001'], 'estimated_time': '2 hours', 'agent_role': 'backend_developer', 'acceptance_criteria': [\"Heroku's built-in monitoring tools are enabled.\", 'Application logs are accessible.', 'Basic performance metrics are visible.'], 'status': 'pending', 'code_files': []}]}, {'name': 'Database Phase', 'description': 'Tasks related to database phase', 'deliverables': ['Completed DB-001'], 'estimated_duration_hours': 6.0, 'work_items': [{'id': 'DB-001', 'description': \"Set up SQLite database and create 'tasks' table.\", 'dependencies': [], 'estimated_time': '6 hours', 'agent_role': 'database_specialist', 'acceptance_criteria': ['SQLite database file is created.', \"'tasks' table exists with 'id' (INTEGER PRIMARY KEY AUTOINCREMENT) and 'description' (TEXT NOT NULL) columns.\"], 'status': 'pending', 'code_files': ['database.sqlite', 'db.js']}]}], resource_allocation=[{'role': 'Frontend Developer', 'count': 1, 'estimated_time_allocation': '100%', 'phases': ['Frontend Phase'], 'skills_required': []}, {'role': 'Backend Developer', 'count': 1, 'estimated_time_allocation': '100%', 'phases': ['Backend Phase'], 'skills_required': []}, {'role': 'Database Specialist', 'count': 1, 'estimated_time_allocation': '100%', 'phases': ['Database Phase'], 'skills_required': []}], risks_and_mitigations=[], timeline={'start_date': '2025-07-09T09:46:23.753236', 'end_date': 'TBD', 'milestones': []}, tech_stack={}, metadata={'generated_at': '2025-07-09T09:46:23.753236', 'version': '1.0', 'author': 'Multi-AI Dev System', 'tags': [], 'notes': 'Converted from WorkItemBacklog. Original summary: Develop a simple web application using React for the frontend, Node.js/Express.js for the backend, and SQLite for the database. The application will allow users to add and view a list of tasks. The application will be deployed to Heroku.'}) summary='Develop a simple web application using React for the frontend, Node.js/Express.js for the backend, and SQLite for the database. The application will allow users to add and view a list of tasks. The application will be deployed to Heroku.' metadata=PlanMetadata(generated_at='2025-07-09T09:46:23.753236', version='1.0', author='Multi-AI Dev System', tags=[], notes='Converted from WorkItemBacklog. Original summary: Develop a simple web application using React for the frontend, Node.js/Express.js for the backend, and SQLite for the database. The application will allow users to add and view a list of tasks. The application will be deployed to Heroku.')"
  }
}