{
  "session_id": "session_0e7c103c-77dc-44d0-9b55-53e5053fccea",
  "approval_type": "implementation_plan",
  "timestamp": 1751987514,
  "approval_data": {
    "type": "implementation_plan",
    "timestamp": 1751987514.297554,
    "project_overview": "Develop a simple web application for managing tasks, including frontend UI, backend API, and database integration, deployed on AWS using a serverless architecture.",
    "development_phases": [
      {
        "name": "Frontend Phase",
        "description": "Tasks related to frontend phase",
        "deliverables": [
          "Completed FE-001",
          "Completed FE-002",
          "Completed FE-003",
          "Completed FE-004",
          "Completed FE-005",
          "Completed FE-006",
          "Completed FE-007"
        ],
        "estimated_duration_hours": 28.0,
        "work_items": [
          {
            "id": "FE-001",
            "description": "Set up React project using Create React App.",
            "dependencies": [],
            "estimated_time": "2 hours",
            "agent_role": "frontend_developer",
            "acceptance_criteria": [
              "Project is initialized with Create React App.",
              "Project builds successfully.",
              "Basic project structure is in place."
            ],
            "status": "pending",
            "code_files": [
              "package.json",
              "src/App.js",
              "src/index.js"
            ]
          },
          {
            "id": "FE-002",
            "description": "Design and implement the basic UI layout (header, main content area).",
            "dependencies": [
              "FE-001"
            ],
            "estimated_time": "4 hours",
            "agent_role": "frontend_developer",
            "acceptance_criteria": [
              "Header with application title is displayed.",
              "Main content area is present.",
              "UI layout is responsive."
            ],
            "status": "pending",
            "code_files": [
              "src/App.js",
              "src/App.css"
            ]
          },
          {
            "id": "FE-003",
            "description": "Implement the task input form (text input and add button).",
            "dependencies": [
              "FE-002"
            ],
            "estimated_time": "4 hours",
            "agent_role": "frontend_developer",
            "acceptance_criteria": [
              "Text input field for task description is present.",
              "Add button is present.",
              "Form is styled appropriately."
            ],
            "status": "pending",
            "code_files": [
              "src/App.js",
              "src/App.css"
            ]
          },
          {
            "id": "FE-004",
            "description": "Implement the display of the task list (initially, hardcoded data).",
            "dependencies": [
              "FE-002"
            ],
            "estimated_time": "4 hours",
            "agent_role": "frontend_developer",
            "acceptance_criteria": [
              "Task list is displayed below the input form.",
              "Hardcoded task data is rendered correctly.",
              "Each task displays its description."
            ],
            "status": "pending",
            "code_files": [
              "src/App.js",
              "src/App.css"
            ]
          },
          {
            "id": "FE-005",
            "description": "Implement API calls to the backend (POST /tasks).",
            "dependencies": [
              "FE-003",
              "BE-002"
            ],
            "estimated_time": "6 hours",
            "agent_role": "frontend_developer",
            "acceptance_criteria": [
              "Frontend makes a POST request to /api/v1/tasks when the form is submitted.",
              "Frontend sends the task description in the request body.",
              "Frontend handles the API response (success and error).",
              "Frontend displays a success message on successful task creation."
            ],
            "status": "pending",
            "code_files": [
              "src/App.js"
            ]
          },
          {
            "id": "FE-006",
            "description": "Implement API calls to the backend (GET /tasks).",
            "dependencies": [
              "FE-004",
              "BE-003"
            ],
            "estimated_time": "6 hours",
            "agent_role": "frontend_developer",
            "acceptance_criteria": [
              "Frontend makes a GET request to /api/v1/tasks on component mount.",
              "Frontend handles the API response (success and error).",
              "Frontend displays the retrieved tasks in the task list.",
              "Frontend updates the task list after a new task is added."
            ],
            "status": "pending",
            "code_files": [
              "src/App.js"
            ]
          },
          {
            "id": "FE-007",
            "description": "Implement basic error handling in the frontend.",
            "dependencies": [
              "FE-005",
              "FE-006"
            ],
            "estimated_time": "2 hours",
            "agent_role": "frontend_developer",
            "acceptance_criteria": [
              "Error messages are displayed to the user if API calls fail.",
              "Error messages are clear and informative."
            ],
            "status": "pending",
            "code_files": [
              "src/App.js"
            ]
          }
        ]
      },
      {
        "name": "Backend Phase",
        "description": "Tasks related to backend phase",
        "deliverables": [
          "Completed BE-001",
          "Completed BE-002",
          "Completed BE-003",
          "Completed BE-004",
          "Completed BE-005",
          "Completed BE-006",
          "Completed TE-001",
          "Completed SC-001",
          "Completed SC-003"
        ],
        "estimated_duration_hours": 42.0,
        "work_items": [
          {
            "id": "BE-001",
            "description": "Set up Node.js and Express project.",
            "dependencies": [],
            "estimated_time": "2 hours",
            "agent_role": "backend_developer",
            "acceptance_criteria": [
              "Project directory is created.",
              "package.json is initialized.",
              "Express is installed.",
              "Basic server setup (listening on a port)."
            ],
            "status": "pending",
            "code_files": [
              "package.json",
              "index.js"
            ]
          },
          {
            "id": "BE-002",
            "description": "Implement API endpoint for creating a task (/api/v1/tasks - POST).",
            "dependencies": [
              "BE-001"
            ],
            "estimated_time": "6 hours",
            "agent_role": "backend_developer",
            "acceptance_criteria": [
              "Endpoint handles POST requests to /api/v1/tasks.",
              "Endpoint receives task description in the request body.",
              "Endpoint validates the task description (not empty).",
              "Endpoint returns a 201 status code on success.",
              "Endpoint returns the created task (id, description, created_at) in the response."
            ],
            "status": "pending",
            "code_files": [
              "index.js"
            ]
          },
          {
            "id": "BE-003",
            "description": "Implement API endpoint for retrieving all tasks (/api/v1/tasks - GET).",
            "dependencies": [
              "BE-001"
            ],
            "estimated_time": "4 hours",
            "agent_role": "backend_developer",
            "acceptance_criteria": [
              "Endpoint handles GET requests to /api/v1/tasks.",
              "Endpoint retrieves all tasks from the database (initially, an in-memory array).",
              "Endpoint returns a 200 status code on success.",
              "Endpoint returns the list of tasks in the response."
            ],
            "status": "pending",
            "code_files": [
              "index.js"
            ]
          },
          {
            "id": "BE-004",
            "description": "Connect Node.js backend to PostgreSQL database.",
            "dependencies": [
              "BE-001",
              "DB-001"
            ],
            "estimated_time": "6 hours",
            "agent_role": "backend_developer",
            "acceptance_criteria": [
              "Database connection is established.",
              "Database connection details are configured securely (e.g., environment variables).",
              "Database connection is tested successfully."
            ],
            "status": "pending",
            "code_files": [
              "index.js"
            ]
          },
          {
            "id": "BE-005",
            "description": "Modify the POST /api/v1/tasks endpoint to store tasks in the database.",
            "dependencies": [
              "BE-002",
              "BE-004"
            ],
            "estimated_time": "6 hours",
            "agent_role": "backend_developer",
            "acceptance_criteria": [
              "Task data is inserted into the 'tasks' table.",
              "Endpoint handles database errors gracefully.",
              "Endpoint returns the created task with the generated ID."
            ],
            "status": "pending",
            "code_files": [
              "index.js"
            ]
          },
          {
            "id": "BE-006",
            "description": "Modify the GET /api/v1/tasks endpoint to retrieve tasks from the database.",
            "dependencies": [
              "BE-003",
              "BE-004"
            ],
            "estimated_time": "4 hours",
            "agent_role": "backend_developer",
            "acceptance_criteria": [
              "Endpoint retrieves tasks from the 'tasks' table.",
              "Endpoint handles database errors gracefully.",
              "Endpoint returns the list of tasks retrieved from the database."
            ],
            "status": "pending",
            "code_files": [
              "index.js"
            ]
          },
          {
            "id": "TE-001",
            "description": "Write unit tests for the backend API endpoints.",
            "dependencies": [
              "BE-006"
            ],
            "estimated_time": "8 hours",
            "agent_role": "backend_developer",
            "acceptance_criteria": [
              "Unit tests cover the POST /tasks endpoint (success and error cases).",
              "Unit tests cover the GET /tasks endpoint (success and error cases).",
              "Tests use a testing framework (e.g., Jest).",
              "Tests mock database interactions."
            ],
            "status": "pending",
            "code_files": [
              "tests/"
            ]
          },
          {
            "id": "SC-001",
            "description": "Implement input validation on the backend to prevent XSS and SQL injection.",
            "dependencies": [
              "BE-005"
            ],
            "estimated_time": "4 hours",
            "agent_role": "backend_developer",
            "acceptance_criteria": [
              "Input validation is implemented for the task description.",
              "Invalid input is rejected with an appropriate error message.",
              "Input is sanitized to prevent XSS attacks."
            ],
            "status": "pending",
            "code_files": [
              "index.js"
            ]
          },
          {
            "id": "SC-003",
            "description": "Implement output encoding to prevent XSS attacks.",
            "dependencies": [
              "BE-006"
            ],
            "estimated_time": "2 hours",
            "agent_role": "backend_developer",
            "acceptance_criteria": [
              "Output data is encoded before being sent to the frontend.",
              "XSS vulnerabilities are mitigated."
            ],
            "status": "pending",
            "code_files": [
              "index.js"
            ]
          }
        ]
      },
      {
        "name": "Database Phase",
        "description": "Tasks related to database phase",
        "deliverables": [
          "Completed DB-001",
          "Completed DB-002"
        ],
        "estimated_duration_hours": 6.0,
        "work_items": [
          {
            "id": "DB-001",
            "description": "Set up PostgreSQL database on AWS RDS.",
            "dependencies": [],
            "estimated_time": "4 hours",
            "agent_role": "database_specialist",
            "acceptance_criteria": [
              "PostgreSQL database instance is created on AWS RDS.",
              "Database is accessible.",
              "Security group is configured to allow access."
            ],
            "status": "pending",
            "code_files": []
          },
          {
            "id": "DB-002",
            "description": "Create 'tasks' table in PostgreSQL database.",
            "dependencies": [
              "DB-001"
            ],
            "estimated_time": "2 hours",
            "agent_role": "database_specialist",
            "acceptance_criteria": [
              "Tasks table is created.",
              "Table has 'id', 'description', and 'created_at' columns.",
              "ID is UUID and primary key.",
              "Description is TEXT.",
              "created_at is TIMESTAMP with DEFAULT CURRENT_TIMESTAMP."
            ],
            "status": "pending",
            "code_files": []
          }
        ]
      },
      {
        "name": "Devops_Engineer Phase",
        "description": "Tasks related to devops_engineer phase",
        "deliverables": [
          "Completed DE-001",
          "Completed DE-002",
          "Completed SC-002"
        ],
        "estimated_duration_hours": 16.0,
        "work_items": [
          {
            "id": "DE-001",
            "description": "Deploy frontend to AWS S3 and configure CloudFront.",
            "dependencies": [
              "FE-006"
            ],
            "estimated_time": "6 hours",
            "agent_role": "devops_engineer",
            "acceptance_criteria": [
              "Frontend code is built and deployed to S3.",
              "CloudFront distribution is created and configured.",
              "Frontend is accessible via the CloudFront URL.",
              "HTTPS is enabled for CloudFront."
            ],
            "status": "pending",
            "code_files": []
          },
          {
            "id": "DE-002",
            "description": "Deploy backend (Node.js with Express) as AWS Lambda functions with API Gateway.",
            "dependencies": [
              "BE-006"
            ],
            "estimated_time": "8 hours",
            "agent_role": "devops_engineer",
            "acceptance_criteria": [
              "Lambda functions are created for both API endpoints (POST /tasks and GET /tasks).",
              "API Gateway is configured to route requests to the Lambda functions.",
              "API Gateway is configured with HTTPS.",
              "API Gateway is configured with CORS.",
              "Backend API is accessible via the API Gateway URL."
            ],
            "status": "pending",
            "code_files": []
          },
          {
            "id": "SC-002",
            "description": "Implement HTTPS for all API communication.",
            "dependencies": [
              "DE-002"
            ],
            "estimated_time": "2 hours",
            "agent_role": "devops_engineer",
            "acceptance_criteria": [
              "HTTPS is enabled for the API Gateway.",
              "All API requests are redirected to HTTPS."
            ],
            "status": "pending",
            "code_files": []
          }
        ]
      },
      {
        "name": "Qa_Engineer Phase",
        "description": "Tasks related to qa_engineer phase",
        "deliverables": [
          "Completed TE-002"
        ],
        "estimated_duration_hours": 4.0,
        "work_items": [
          {
            "id": "TE-002",
            "description": "Perform end-to-end testing of the application.",
            "dependencies": [
              "DE-001",
              "DE-002",
              "FE-007"
            ],
            "estimated_time": "4 hours",
            "agent_role": "qa_engineer",
            "acceptance_criteria": [
              "User can successfully add a task.",
              "User can successfully view the task list.",
              "Error handling is working correctly.",
              "Application is tested on different browsers."
            ],
            "status": "pending",
            "code_files": []
          }
        ]
      }
    ],
    "timeline_estimation": {
      "start_date": "2025-07-08T20:41:51.846961",
      "end_date": "TBD",
      "milestones": []
    },
    "risk_assessment": [],
    "resource_requirements": [
      {
        "role": "Backend Developer",
        "count": 1,
        "estimated_time_allocation": "100%",
        "phases": [
          "Backend Phase"
        ],
        "skills_required": []
      },
      {
        "role": "Devops Engineer",
        "count": 1,
        "estimated_time_allocation": "100%",
        "phases": [
          "Devops_Engineer Phase"
        ],
        "skills_required": []
      },
      {
        "role": "Database Specialist",
        "count": 1,
        "estimated_time_allocation": "100%",
        "phases": [
          "Database Phase"
        ],
        "skills_required": []
      },
      {
        "role": "Frontend Developer",
        "count": 1,
        "estimated_time_allocation": "100%",
        "phases": [
          "Frontend Phase"
        ],
        "skills_required": []
      },
      {
        "role": "Qa Engineer",
        "count": 1,
        "estimated_time_allocation": "100%",
        "phases": [
          "Qa_Engineer Phase"
        ],
        "skills_required": []
      }
    ],
    "deliverables": [
      "Completed FE-001",
      "Completed FE-002",
      "Completed FE-003",
      "Completed FE-004",
      "Completed FE-005",
      "Completed FE-006",
      "Completed FE-007",
      "Completed BE-001",
      "Completed BE-002",
      "Completed BE-003",
      "Completed BE-004",
      "Completed BE-005",
      "Completed BE-006",
      "Completed TE-001",
      "Completed SC-001",
      "Completed SC-003",
      "Completed DB-001",
      "Completed DB-002",
      "Completed DE-001",
      "Completed DE-002",
      "Completed SC-002",
      "Completed TE-002"
    ],
    "dependencies": [],
    "raw_plan": "plan=ImplementationPlan(project_summary={'title': 'Generated Project Plan', 'description': 'Develop a simple web application for managing tasks, including frontend UI, backend API, and database integration, deployed on AWS using a serverless architecture.', 'overall_complexity': 'Medium', 'estimated_duration': 'TBD', 'key_challenges': [], 'success_criteria': []}, phases=[{'name': 'Frontend Phase', 'description': 'Tasks related to frontend phase', 'deliverables': ['Completed FE-001', 'Completed FE-002', 'Completed FE-003', 'Completed FE-004', 'Completed FE-005', 'Completed FE-006', 'Completed FE-007'], 'estimated_duration_hours': 28.0, 'work_items': [{'id': 'FE-001', 'description': 'Set up React project using Create React App.', 'dependencies': [], 'estimated_time': '2 hours', 'agent_role': 'frontend_developer', 'acceptance_criteria': ['Project is initialized with Create React App.', 'Project builds successfully.', 'Basic project structure is in place.'], 'status': 'pending', 'code_files': ['package.json', 'src/App.js', 'src/index.js']}, {'id': 'FE-002', 'description': 'Design and implement the basic UI layout (header, main content area).', 'dependencies': ['FE-001'], 'estimated_time': '4 hours', 'agent_role': 'frontend_developer', 'acceptance_criteria': ['Header with application title is displayed.', 'Main content area is present.', 'UI layout is responsive.'], 'status': 'pending', 'code_files': ['src/App.js', 'src/App.css']}, {'id': 'FE-003', 'description': 'Implement the task input form (text input and add button).', 'dependencies': ['FE-002'], 'estimated_time': '4 hours', 'agent_role': 'frontend_developer', 'acceptance_criteria': ['Text input field for task description is present.', 'Add button is present.', 'Form is styled appropriately.'], 'status': 'pending', 'code_files': ['src/App.js', 'src/App.css']}, {'id': 'FE-004', 'description': 'Implement the display of the task list (initially, hardcoded data).', 'dependencies': ['FE-002'], 'estimated_time': '4 hours', 'agent_role': 'frontend_developer', 'acceptance_criteria': ['Task list is displayed below the input form.', 'Hardcoded task data is rendered correctly.', 'Each task displays its description.'], 'status': 'pending', 'code_files': ['src/App.js', 'src/App.css']}, {'id': 'FE-005', 'description': 'Implement API calls to the backend (POST /tasks).', 'dependencies': ['FE-003', 'BE-002'], 'estimated_time': '6 hours', 'agent_role': 'frontend_developer', 'acceptance_criteria': ['Frontend makes a POST request to /api/v1/tasks when the form is submitted.', 'Frontend sends the task description in the request body.', 'Frontend handles the API response (success and error).', 'Frontend displays a success message on successful task creation.'], 'status': 'pending', 'code_files': ['src/App.js']}, {'id': 'FE-006', 'description': 'Implement API calls to the backend (GET /tasks).', 'dependencies': ['FE-004', 'BE-003'], 'estimated_time': '6 hours', 'agent_role': 'frontend_developer', 'acceptance_criteria': ['Frontend makes a GET request to /api/v1/tasks on component mount.', 'Frontend handles the API response (success and error).', 'Frontend displays the retrieved tasks in the task list.', 'Frontend updates the task list after a new task is added.'], 'status': 'pending', 'code_files': ['src/App.js']}, {'id': 'FE-007', 'description': 'Implement basic error handling in the frontend.', 'dependencies': ['FE-005', 'FE-006'], 'estimated_time': '2 hours', 'agent_role': 'frontend_developer', 'acceptance_criteria': ['Error messages are displayed to the user if API calls fail.', 'Error messages are clear and informative.'], 'status': 'pending', 'code_files': ['src/App.js']}]}, {'name': 'Backend Phase', 'description': 'Tasks related to backend phase', 'deliverables': ['Completed BE-001', 'Completed BE-002', 'Completed BE-003', 'Completed BE-004', 'Completed BE-005', 'Completed BE-006', 'Completed TE-001', 'Completed SC-001', 'Completed SC-003'], 'estimated_duration_hours': 42.0, 'work_items': [{'id': 'BE-001', 'description': 'Set up Node.js and Express project.', 'dependencies': [], 'estimated_time': '2 hours', 'agent_role': 'backend_developer', 'acceptance_criteria': ['Project directory is created.', 'package.json is initialized.', 'Express is installed.', 'Basic server setup (listening on a port).'], 'status': 'pending', 'code_files': ['package.json', 'index.js']}, {'id': 'BE-002', 'description': 'Implement API endpoint for creating a task (/api/v1/tasks - POST).', 'dependencies': ['BE-001'], 'estimated_time': '6 hours', 'agent_role': 'backend_developer', 'acceptance_criteria': ['Endpoint handles POST requests to /api/v1/tasks.', 'Endpoint receives task description in the request body.', 'Endpoint validates the task description (not empty).', 'Endpoint returns a 201 status code on success.', 'Endpoint returns the created task (id, description, created_at) in the response.'], 'status': 'pending', 'code_files': ['index.js']}, {'id': 'BE-003', 'description': 'Implement API endpoint for retrieving all tasks (/api/v1/tasks - GET).', 'dependencies': ['BE-001'], 'estimated_time': '4 hours', 'agent_role': 'backend_developer', 'acceptance_criteria': ['Endpoint handles GET requests to /api/v1/tasks.', 'Endpoint retrieves all tasks from the database (initially, an in-memory array).', 'Endpoint returns a 200 status code on success.', 'Endpoint returns the list of tasks in the response.'], 'status': 'pending', 'code_files': ['index.js']}, {'id': 'BE-004', 'description': 'Connect Node.js backend to PostgreSQL database.', 'dependencies': ['BE-001', 'DB-001'], 'estimated_time': '6 hours', 'agent_role': 'backend_developer', 'acceptance_criteria': ['Database connection is established.', 'Database connection details are configured securely (e.g., environment variables).', 'Database connection is tested successfully.'], 'status': 'pending', 'code_files': ['index.js']}, {'id': 'BE-005', 'description': 'Modify the POST /api/v1/tasks endpoint to store tasks in the database.', 'dependencies': ['BE-002', 'BE-004'], 'estimated_time': '6 hours', 'agent_role': 'backend_developer', 'acceptance_criteria': [\"Task data is inserted into the 'tasks' table.\", 'Endpoint handles database errors gracefully.', 'Endpoint returns the created task with the generated ID.'], 'status': 'pending', 'code_files': ['index.js']}, {'id': 'BE-006', 'description': 'Modify the GET /api/v1/tasks endpoint to retrieve tasks from the database.', 'dependencies': ['BE-003', 'BE-004'], 'estimated_time': '4 hours', 'agent_role': 'backend_developer', 'acceptance_criteria': [\"Endpoint retrieves tasks from the 'tasks' table.\", 'Endpoint handles database errors gracefully.', 'Endpoint returns the list of tasks retrieved from the database.'], 'status': 'pending', 'code_files': ['index.js']}, {'id': 'TE-001', 'description': 'Write unit tests for the backend API endpoints.', 'dependencies': ['BE-006'], 'estimated_time': '8 hours', 'agent_role': 'backend_developer', 'acceptance_criteria': ['Unit tests cover the POST /tasks endpoint (success and error cases).', 'Unit tests cover the GET /tasks endpoint (success and error cases).', 'Tests use a testing framework (e.g., Jest).', 'Tests mock database interactions.'], 'status': 'pending', 'code_files': ['tests/']}, {'id': 'SC-001', 'description': 'Implement input validation on the backend to prevent XSS and SQL injection.', 'dependencies': ['BE-005'], 'estimated_time': '4 hours', 'agent_role': 'backend_developer', 'acceptance_criteria': ['Input validation is implemented for the task description.', 'Invalid input is rejected with an appropriate error message.', 'Input is sanitized to prevent XSS attacks.'], 'status': 'pending', 'code_files': ['index.js']}, {'id': 'SC-003', 'description': 'Implement output encoding to prevent XSS attacks.', 'dependencies': ['BE-006'], 'estimated_time': '2 hours', 'agent_role': 'backend_developer', 'acceptance_criteria': ['Output data is encoded before being sent to the frontend.', 'XSS vulnerabilities are mitigated.'], 'status': 'pending', 'code_files': ['index.js']}]}, {'name': 'Database Phase', 'description': 'Tasks related to database phase', 'deliverables': ['Completed DB-001', 'Completed DB-002'], 'estimated_duration_hours': 6.0, 'work_items': [{'id': 'DB-001', 'description': 'Set up PostgreSQL database on AWS RDS.', 'dependencies': [], 'estimated_time': '4 hours', 'agent_role': 'database_specialist', 'acceptance_criteria': ['PostgreSQL database instance is created on AWS RDS.', 'Database is accessible.', 'Security group is configured to allow access.'], 'status': 'pending', 'code_files': []}, {'id': 'DB-002', 'description': \"Create 'tasks' table in PostgreSQL database.\", 'dependencies': ['DB-001'], 'estimated_time': '2 hours', 'agent_role': 'database_specialist', 'acceptance_criteria': ['Tasks table is created.', \"Table has 'id', 'description', and 'created_at' columns.\", 'ID is UUID and primary key.', 'Description is TEXT.', 'created_at is TIMESTAMP with DEFAULT CURRENT_TIMESTAMP.'], 'status': 'pending', 'code_files': []}]}, {'name': 'Devops_Engineer Phase', 'description': 'Tasks related to devops_engineer phase', 'deliverables': ['Completed DE-001', 'Completed DE-002', 'Completed SC-002'], 'estimated_duration_hours': 16.0, 'work_items': [{'id': 'DE-001', 'description': 'Deploy frontend to AWS S3 and configure CloudFront.', 'dependencies': ['FE-006'], 'estimated_time': '6 hours', 'agent_role': 'devops_engineer', 'acceptance_criteria': ['Frontend code is built and deployed to S3.', 'CloudFront distribution is created and configured.', 'Frontend is accessible via the CloudFront URL.', 'HTTPS is enabled for CloudFront.'], 'status': 'pending', 'code_files': []}, {'id': 'DE-002', 'description': 'Deploy backend (Node.js with Express) as AWS Lambda functions with API Gateway.', 'dependencies': ['BE-006'], 'estimated_time': '8 hours', 'agent_role': 'devops_engineer', 'acceptance_criteria': ['Lambda functions are created for both API endpoints (POST /tasks and GET /tasks).', 'API Gateway is configured to route requests to the Lambda functions.', 'API Gateway is configured with HTTPS.', 'API Gateway is configured with CORS.', 'Backend API is accessible via the API Gateway URL.'], 'status': 'pending', 'code_files': []}, {'id': 'SC-002', 'description': 'Implement HTTPS for all API communication.', 'dependencies': ['DE-002'], 'estimated_time': '2 hours', 'agent_role': 'devops_engineer', 'acceptance_criteria': ['HTTPS is enabled for the API Gateway.', 'All API requests are redirected to HTTPS.'], 'status': 'pending', 'code_files': []}]}, {'name': 'Qa_Engineer Phase', 'description': 'Tasks related to qa_engineer phase', 'deliverables': ['Completed TE-002'], 'estimated_duration_hours': 4.0, 'work_items': [{'id': 'TE-002', 'description': 'Perform end-to-end testing of the application.', 'dependencies': ['DE-001', 'DE-002', 'FE-007'], 'estimated_time': '4 hours', 'agent_role': 'qa_engineer', 'acceptance_criteria': ['User can successfully add a task.', 'User can successfully view the task list.', 'Error handling is working correctly.', 'Application is tested on different browsers.'], 'status': 'pending', 'code_files': []}]}], resource_allocation=[{'role': 'Backend Developer', 'count': 1, 'estimated_time_allocation': '100%', 'phases': ['Backend Phase'], 'skills_required': []}, {'role': 'Devops Engineer', 'count': 1, 'estimated_time_allocation': '100%', 'phases': ['Devops_Engineer Phase'], 'skills_required': []}, {'role': 'Database Specialist', 'count': 1, 'estimated_time_allocation': '100%', 'phases': ['Database Phase'], 'skills_required': []}, {'role': 'Frontend Developer', 'count': 1, 'estimated_time_allocation': '100%', 'phases': ['Frontend Phase'], 'skills_required': []}, {'role': 'Qa Engineer', 'count': 1, 'estimated_time_allocation': '100%', 'phases': ['Qa_Engineer Phase'], 'skills_required': []}], risks_and_mitigations=[], timeline={'start_date': '2025-07-08T20:41:51.846961', 'end_date': 'TBD', 'milestones': []}, tech_stack={}, metadata={'generated_at': '2025-07-08T20:41:51.846961', 'version': '1.0', 'author': 'Multi-AI Dev System', 'tags': [], 'notes': 'Converted from WorkItemBacklog. Original summary: Develop a simple web application for managing tasks, including frontend UI, backend API, and database integration, deployed on AWS using a serverless architecture.'}) summary='Develop a simple web application for managing tasks, including frontend UI, backend API, and database integration, deployed on AWS using a serverless architecture.' metadata=PlanMetadata(generated_at='2025-07-08T20:41:51.846961', version='1.0', author='Multi-AI Dev System', tags=[], notes='Converted from WorkItemBacklog. Original summary: Develop a simple web application for managing tasks, including frontend UI, backend API, and database integration, deployed on AWS using a serverless architecture.')"
  },
  "workflow_state_snapshot": {
    "requirements_analysis": {
      "project_name": "Hello World Task List",
      "project_summary": "A simple web application to manage a list of tasks.",
      "project_goals": [
        "Allow a user to add a task",
        "Allow a user to see their list of tasks"
      ],
      "target_audience": [
        "Users who want to manage a list of tasks"
      ],
      "business_context": "This project aims to provide a basic task management tool.",
      "requirements": [
        {
          "id": "REQ-001",
          "description": "A user can create a new task with a text description.",
          "category": "functional",
          "priority": 1
        },
        {
          "id": "REQ-002",
          "description": "A user can see a list of all created tasks.",
          "category": "functional",
          "priority": 1
        },
        {
          "id": "REQ-003",
          "description": "The application must load quickly.",
          "category": "non_functional",
          "priority": 2
        },
        {
          "id": "REQ-004",
          "description": "The application must be secure.",
          "category": "non_functional",
          "priority": 2
        }
      ],
      "functional_requirements": [
        "A user can create a new task with a text description.",
        "A user can see a list of all created tasks."
      ],
      "non_functional_requirements": [
        "The application must load quickly.",
        "The application must be secure."
      ],
      "stakeholders": [
        "Users"
      ],
      "success_criteria": [
        "Users can successfully add tasks.",
        "Users can view their task list."
      ],
      "constraints": [],
      "assumptions": [],
      "risks": [],
      "domain_specific_details": {},
      "quality_assessment": {
        "clarity_score": 9.0,
        "completeness_score": 7.0,
        "consistency_score": 10.0,
        "recommendations": [
          "Add more detailed non-functional requirements."
        ]
      },
      "gap_analysis": {
        "identified_gaps": [
          "Missing details on security implementation.",
          "Missing details on performance metrics."
        ],
        "recommendations_for_completion": [
          "Define security measures.",
          "Specify performance targets (e.g., load time)."
        ]
      }
    },
    "tech_stack_recommendation": {
      "frontend_options": [
        {
          "name": "React",
          "language": "JavaScript",
          "reasoning": "React is a popular and efficient library for building user interfaces. It offers a component-based architecture, making it easy to manage and update the UI. Its virtual DOM and efficient update mechanisms contribute to fast loading times, addressing the non-functional requirement for speed. It has a large community and extensive documentation, which aids in development.",
          "key_libraries": [
            "React Router (for navigation)",
            "Axios or Fetch (for API calls)",
            "Material UI or Bootstrap (for UI components)"
          ],
          "pros": [
            "Component-based architecture for maintainability",
            "Large community and extensive documentation",
            "Efficient updates via virtual DOM",
            "Good performance"
          ],
          "cons": [
            "Requires understanding of JSX",
            "Can have a steeper learning curve initially"
          ],
          "selected": false
        },
        {
          "name": "Vue.js",
          "language": "JavaScript",
          "reasoning": "Vue.js is a progressive framework that is easy to learn and integrate. It's well-suited for building single-page applications and offers a good balance between performance and ease of use. Its template-based approach can be more accessible for developers new to frontend frameworks.",
          "key_libraries": [
            "Vue Router (for navigation)",
            "Axios or Fetch (for API calls)",
            "Vuetify or Element UI (for UI components)"
          ],
          "pros": [
            "Easy to learn and integrate",
            "Good performance",
            "Clear and concise syntax",
            "Excellent documentation"
          ],
          "cons": [
            "Smaller community compared to React",
            "Ecosystem might not be as extensive as React's"
          ],
          "selected": false
        },
        {
          "name": "HTML, CSS, JavaScript (Vanilla)",
          "language": "JavaScript",
          "reasoning": "For a simple task list application, using vanilla JavaScript, HTML, and CSS can be a viable option. This approach avoids the overhead of a framework, resulting in potentially faster initial load times and a smaller bundle size. It's suitable for projects where complexity is low and the focus is on simplicity.",
          "key_libraries": [],
          "pros": [
            "No framework dependencies",
            "Potentially faster initial load times",
            "Smaller bundle size",
            "Simple to understand for basic applications"
          ],
          "cons": [
            "More manual DOM manipulation",
            "Can become complex to manage as the application grows",
            "Less structure and organization compared to frameworks"
          ],
          "selected": false
        }
      ],
      "backend_options": [
        {
          "name": "Node.js with Express",
          "language": "JavaScript",
          "reasoning": "Node.js with Express provides a lightweight and efficient backend solution. JavaScript is used on both the frontend and backend, which can streamline development. Express offers a simple and flexible framework for building REST APIs, making it easy to handle task data.",
          "key_libraries": [
            "Express (for routing and middleware)",
            "body-parser (for parsing request bodies)",
            "cors (for handling CORS)",
            "mongoose or Sequelize (for database interaction)"
          ],
          "pros": [
            "JavaScript on both frontend and backend (full-stack JavaScript)",
            "Large community and extensive documentation",
            "Fast development with Express",
            "Good performance with asynchronous operations"
          ],
          "cons": [
            "Callback hell can be an issue (mitigated by async/await)",
            "Requires careful handling of asynchronous operations"
          ],
          "selected": false
        },
        {
          "name": "Python with Flask",
          "language": "Python",
          "reasoning": "Flask is a microframework that is easy to learn and use. Python's readability and extensive libraries make it a good choice for backend development. It's suitable for small to medium-sized projects and offers good performance.",
          "key_libraries": [
            "Flask (for routing and web framework)",
            "Flask-SQLAlchemy or SQLAlchemy (for database interaction)",
            "Flask-CORS (for handling CORS)"
          ],
          "pros": [
            "Easy to learn and use",
            "Good readability with Python",
            "Large community and extensive libraries",
            "Good performance"
          ],
          "cons": [
            "Can be slower than Node.js in some cases",
            "Requires understanding of Python"
          ],
          "selected": false
        },
        {
          "name": "Java with Spring Boot",
          "language": "Java",
          "reasoning": "Spring Boot provides a robust and scalable backend solution. Java's strong typing and mature ecosystem make it suitable for enterprise-grade applications. Spring Boot simplifies the development process and offers excellent support for various features.",
          "key_libraries": [
            "Spring Boot (for rapid application development)",
            "Spring Web (for building REST APIs)",
            "Spring Data JPA (for database interaction)",
            "Maven or Gradle (for build automation)"
          ],
          "pros": [
            "Robust and scalable",
            "Mature ecosystem and extensive libraries",
            "Good performance",
            "Excellent support for various features"
          ],
          "cons": [
            "Steeper learning curve",
            "More verbose code compared to other options"
          ],
          "selected": false
        }
      ],
      "database_options": [
        {
          "name": "PostgreSQL",
          "language": null,
          "reasoning": "PostgreSQL is a powerful, open-source relational database. It's reliable, scalable, and supports complex queries. It's a good choice for storing task data and can handle future growth.",
          "key_libraries": [
            "psycopg2 (for Python)",
            "pg (for Node.js)",
            "JDBC driver (for Java)"
          ],
          "pros": [
            "Reliable and scalable",
            "Supports complex queries",
            "Open-source and well-documented",
            "Good performance"
          ],
          "cons": [
            "Can be more complex to set up and manage than simpler databases"
          ],
          "selected": false
        },
        {
          "name": "MongoDB",
          "language": null,
          "reasoning": "MongoDB is a NoSQL database that is easy to use and flexible. It's well-suited for storing unstructured data, which can be useful for task descriptions. Its schema-less nature allows for easy modification of data structures.",
          "key_libraries": [
            "Mongoose (for Node.js)",
            "pymongo (for Python)",
            "MongoDB Java Driver (for Java)"
          ],
          "pros": [
            "Easy to use and flexible",
            "Schema-less design",
            "Good for unstructured data",
            "Scalable"
          ],
          "cons": [
            "Can be less performant than relational databases for complex queries",
            "Data consistency can be more challenging to manage"
          ],
          "selected": false
        },
        {
          "name": "SQLite",
          "language": null,
          "reasoning": "SQLite is a lightweight, file-based database. It's easy to set up and requires no separate server process. It's suitable for small applications with limited data and is a good choice for this project's simplicity.",
          "key_libraries": [
            "sqlite3 (for Python)",
            "sqlite3 (for Node.js)",
            "SQLite JDBC driver (for Java)"
          ],
          "pros": [
            "Easy to set up and use",
            "No separate server process required",
            "Good for small applications",
            "File-based storage"
          ],
          "cons": [
            "Not suitable for large-scale applications",
            "Limited concurrency support"
          ],
          "selected": false
        }
      ],
      "cloud_options": [
        {
          "name": "AWS (Amazon Web Services)",
          "language": null,
          "reasoning": "AWS offers a wide range of services, including compute, storage, and databases. It's a mature platform with excellent scalability and reliability. It's a good choice for deploying the application and managing its infrastructure.",
          "key_libraries": [
            "AWS SDK (for interacting with AWS services)",
            "Serverless Framework (for deploying serverless applications)"
          ],
          "pros": [
            "Wide range of services",
            "Excellent scalability and reliability",
            "Mature platform",
            "Large community and extensive documentation"
          ],
          "cons": [
            "Can be complex to manage",
            "Cost can be higher than other options"
          ],
          "selected": false
        },
        {
          "name": "Google Cloud Platform (GCP)",
          "language": null,
          "reasoning": "GCP provides a comprehensive set of cloud services with a focus on data analytics and machine learning. It's a good alternative to AWS and offers competitive pricing and performance.",
          "key_libraries": [
            "Google Cloud Client Libraries (for interacting with GCP services)",
            "Cloud Functions (for serverless functions)"
          ],
          "pros": [
            "Competitive pricing and performance",
            "Strong focus on data analytics and machine learning",
            "Good scalability and reliability",
            "User-friendly interface"
          ],
          "cons": [
            "Smaller community compared to AWS",
            "Service offerings may be less mature than AWS in some areas"
          ],
          "selected": false
        },
        {
          "name": "Heroku",
          "language": null,
          "reasoning": "Heroku is a platform-as-a-service (PaaS) that simplifies application deployment. It's easy to use and offers a streamlined deployment process. It's a good choice for small to medium-sized projects where ease of deployment is a priority.",
          "key_libraries": [],
          "pros": [
            "Easy to use and deploy",
            "Streamlined deployment process",
            "Good for small to medium-sized projects",
            "Automatic scaling"
          ],
          "cons": [
            "Limited customization options",
            "Can be more expensive than other options",
            "Vendor lock-in"
          ],
          "selected": false
        }
      ],
      "architecture_options": [
        {
          "pattern": "Monolithic Architecture",
          "scalability_score": 4.0,
          "maintainability_score": 6.0,
          "development_speed_score": 8.0,
          "overall_score": 6.0,
          "reasoning": "A monolithic architecture is suitable for this simple application. All components (frontend, backend, database) are deployed as a single unit. This approach is easy to develop and deploy, making it ideal for a small project. However, it can become difficult to scale and maintain as the application grows."
        },
        {
          "pattern": "Microservices Architecture",
          "scalability_score": 8.0,
          "maintainability_score": 7.0,
          "development_speed_score": 5.0,
          "overall_score": 6.0,
          "reasoning": "While microservices offer excellent scalability and maintainability, they might be overkill for this simple application. Implementing microservices introduces complexity in terms of deployment, communication, and management. It's a good choice if the application is expected to grow significantly in the future."
        },
        {
          "pattern": "Serverless Architecture",
          "scalability_score": 9.0,
          "maintainability_score": 7.0,
          "development_speed_score": 7.0,
          "overall_score": 7.6,
          "reasoning": "Serverless architecture, using services like AWS Lambda or Google Cloud Functions, can be a good fit. It offers excellent scalability and reduces operational overhead. The backend logic can be implemented as functions triggered by API requests. This approach can be cost-effective and allows for rapid development. It aligns well with the project's goal of quick loading times and can be easily scaled as needed."
        }
      ],
      "tool_options": [
        {
          "name": "Git",
          "language": null,
          "reasoning": "Git is essential for version control and collaboration. It allows developers to track changes, revert to previous versions, and work together on the codebase.",
          "key_libraries": [],
          "pros": [
            "Version control",
            "Collaboration",
            "Branching and merging"
          ],
          "cons": [
            "Requires learning the Git commands"
          ],
          "selected": false
        },
        {
          "name": "VS Code",
          "language": null,
          "reasoning": "VS Code is a popular and versatile code editor. It offers excellent support for various languages and frameworks, along with features like debugging, code completion, and extensions.",
          "key_libraries": [],
          "pros": [
            "Code editing",
            "Debugging",
            "Extensions",
            "Code completion"
          ],
          "cons": [
            "Can be resource-intensive"
          ],
          "selected": false
        },
        {
          "name": "Postman",
          "language": null,
          "reasoning": "Postman is a useful tool for testing APIs. It allows developers to send requests, inspect responses, and debug API interactions.",
          "key_libraries": [],
          "pros": [
            "API testing",
            "Request and response inspection",
            "Debugging"
          ],
          "cons": [
            "Requires learning the Postman interface"
          ],
          "selected": false
        }
      ],
      "risks": [
        {
          "category": "Security",
          "description": "The application is vulnerable to cross-site scripting (XSS) attacks if user input is not properly sanitized. This could allow malicious scripts to be injected into the application.",
          "severity": "High",
          "likelihood": "Medium",
          "mitigation": "Implement input validation and output encoding to prevent XSS attacks. Use a Content Security Policy (CSP) to restrict the sources from which the browser can load resources."
        },
        {
          "category": "Performance",
          "description": "The application's performance may degrade if the database queries are not optimized or if the frontend code is not optimized for speed. This could lead to slow loading times and a poor user experience.",
          "severity": "Medium",
          "likelihood": "Medium",
          "mitigation": "Optimize database queries by adding indexes and using efficient query patterns. Minimize the size of the frontend bundle by using code splitting and lazy loading. Implement caching strategies where appropriate."
        },
        {
          "category": "Scalability",
          "description": "The application may not scale well if the chosen database or backend technology cannot handle a large number of users or tasks. This could lead to performance bottlenecks and downtime.",
          "severity": "Medium",
          "likelihood": "Low",
          "mitigation": "Choose a database and backend technology that can scale to meet future demands. Consider using a cloud-based database service that offers automatic scaling. Implement load balancing and caching to distribute the load."
        }
      ],
      "synthesis": {
        "backend": {
          "language": "JavaScript",
          "framework": "Node.js with Express",
          "reasoning": "Node.js with Express provides a lightweight and efficient backend solution. JavaScript is used on both the frontend and backend, which can streamline development. Express offers a simple and flexible framework for building REST APIs, making it easy to handle task data."
        },
        "frontend": {
          "language": "JavaScript",
          "framework": "React",
          "reasoning": "React is a popular and efficient library for building user interfaces. It offers a component-based architecture, making it easy to manage and update the UI. Its virtual DOM and efficient update mechanisms contribute to fast loading times, addressing the non-functional requirement for speed. It has a large community and extensive documentation, which aids in development."
        },
        "database": {
          "type": "PostgreSQL",
          "reasoning": "PostgreSQL is a powerful, open-source relational database. It's reliable, scalable, and supports complex queries. It's a good choice for storing task data and can handle future growth."
        },
        "architecture_pattern": "Serverless Architecture",
        "deployment_environment": {
          "cloud_provider": "AWS",
          "reasoning": "AWS offers a wide range of services, including compute, storage, and databases. It's a mature platform with excellent scalability and reliability. It's a good choice for deploying the application and managing its infrastructure."
        },
        "key_libraries_tools": [
          {
            "name": "React Router",
            "purpose": "For navigation in the React frontend."
          },
          {
            "name": "Axios",
            "purpose": "For making API calls from the frontend."
          },
          {
            "name": "Express",
            "purpose": "For routing and middleware in the Node.js backend."
          },
          {
            "name": "PostgreSQL",
            "purpose": "For database interaction."
          },
          {
            "name": "AWS SDK",
            "purpose": "For interacting with AWS services."
          },
          {
            "name": "Git",
            "purpose": "For version control."
          },
          {
            "name": "VS Code",
            "purpose": "For code editing and debugging."
          },
          {
            "name": "Postman",
            "purpose": "For API testing."
          }
        ],
        "estimated_complexity": "Low"
      },
      "selected_stack": null
    },
    "system_design": {
      "architecture": {
        "pattern": "Serverless Architecture",
        "justification": "Serverless architecture is chosen for its scalability, cost-effectiveness, and ease of deployment for this simple task management application. It aligns well with the project's goals of quick loading times and can be easily scaled as needed. The backend logic will be implemented as functions triggered by API requests.",
        "key_benefits": [
          "Scalability: Automatically scales based on demand.",
          "Cost-effectiveness: Pay-per-use model.",
          "Reduced operational overhead: No server management required.",
          "Fast deployment and iteration."
        ],
        "potential_drawbacks": [
          "Vendor lock-in: Dependence on AWS services.",
          "Debugging can be more complex.",
          "Cold starts can impact performance (though less of an issue for a simple app)."
        ]
      },
      "components": [
        {
          "name": "Frontend",
          "description": "The user interface for interacting with the task list application.",
          "category": "frontend",
          "technologies": [
            "React",
            "JavaScript",
            "HTML",
            "CSS"
          ],
          "dependencies": [
            "Backend API"
          ],
          "responsibilities": [
            "Displaying the task list.",
            "Allowing users to add new tasks.",
            "Handling user interactions.",
            "Making API calls to the backend."
          ],
          "design_patterns": [
            "Component-based architecture"
          ]
        },
        {
          "name": "Backend API",
          "description": "The API that handles requests from the frontend and interacts with the database.",
          "category": "backend",
          "technologies": [
            "Node.js",
            "Express",
            "JavaScript"
          ],
          "dependencies": [
            "Database"
          ],
          "responsibilities": [
            "Handling API requests (GET, POST).",
            "Validating data.",
            "Interacting with the database to store and retrieve tasks.",
            "Returning responses to the frontend."
          ],
          "design_patterns": [
            "RESTful API"
          ]
        },
        {
          "name": "Database",
          "description": "Stores the task data.",
          "category": "backend",
          "technologies": [
            "PostgreSQL"
          ],
          "dependencies": [],
          "responsibilities": [
            "Storing task data.",
            "Providing efficient data retrieval.",
            "Ensuring data integrity."
          ],
          "design_patterns": [
            "Relational Database"
          ]
        },
        {
          "name": "API Gateway (AWS API Gateway)",
          "description": "Manages API requests and routes them to the appropriate backend functions.",
          "category": "backend",
          "technologies": [
            "AWS API Gateway"
          ],
          "dependencies": [
            "Backend API (AWS Lambda functions)"
          ],
          "responsibilities": [
            "Routing API requests.",
            "Authentication and authorization.",
            "Rate limiting.",
            "Monitoring and logging."
          ],
          "design_patterns": [
            "API Gateway Pattern"
          ]
        },
        {
          "name": "Task Creation Lambda Function",
          "description": "AWS Lambda function to handle task creation.",
          "category": "backend",
          "technologies": [
            "Node.js",
            "Express",
            "JavaScript",
            "AWS Lambda"
          ],
          "dependencies": [
            "Database"
          ],
          "responsibilities": [
            "Receiving task creation requests from the API Gateway.",
            "Validating task data.",
            "Storing the task in the database.",
            "Returning a success response."
          ],
          "design_patterns": [
            "Serverless Function"
          ]
        },
        {
          "name": "Task Retrieval Lambda Function",
          "description": "AWS Lambda function to handle task retrieval.",
          "category": "backend",
          "technologies": [
            "Node.js",
            "Express",
            "JavaScript",
            "AWS Lambda"
          ],
          "dependencies": [
            "Database"
          ],
          "responsibilities": [
            "Receiving task retrieval requests from the API Gateway.",
            "Retrieving tasks from the database.",
            "Returning the task list in the response."
          ],
          "design_patterns": [
            "Serverless Function"
          ]
        }
      ],
      "data_model": {
        "schema_type": "Relational",
        "tables": [
          {
            "name": "tasks",
            "purpose": "Stores information about tasks.",
            "fields": [
              {
                "name": "id",
                "type": "UUID",
                "constraints": [
                  "PRIMARY KEY",
                  "NOT NULL"
                ],
                "description": "Unique identifier for the task."
              },
              {
                "name": "description",
                "type": "TEXT",
                "constraints": [
                  "NOT NULL"
                ],
                "description": "The text description of the task."
              },
              {
                "name": "created_at",
                "type": "TIMESTAMP",
                "constraints": [
                  "NOT NULL",
                  "DEFAULT CURRENT_TIMESTAMP"
                ],
                "description": "The timestamp when the task was created."
              }
            ],
            "relationships": []
          }
        ],
        "relationships": [],
        "justification": "Relational database is chosen for its data integrity and ability to handle future data complexity."
      },
      "api_endpoints": {
        "style": "REST",
        "base_url": "/api/v1",
        "authentication": "None (for simplicity, consider API keys or JWT for production)",
        "endpoints": [
          {
            "method": "POST",
            "path": "/tasks",
            "purpose": "Create a new task.",
            "parameters": [
              {
                "description": "The task description.",
                "type": "string",
                "name": "description"
              }
            ],
            "response": {
              "status": 201,
              "body": {
                "id": "UUID",
                "description": "string",
                "created_at": "ISO 8601 timestamp"
              }
            },
            "authentication_required": false,
            "rate_limiting_applied": false
          },
          {
            "method": "GET",
            "path": "/tasks",
            "purpose": "Get all tasks.",
            "parameters": [],
            "response": {
              "status": 200,
              "body": [
                {
                  "id": "UUID",
                  "description": "string",
                  "created_at": "ISO 8601 timestamp"
                }
              ]
            },
            "authentication_required": false,
            "rate_limiting_applied": false
          }
        ],
        "error_handling": "Standard HTTP status codes and JSON responses with error messages.",
        "rate_limiting_strategy": null
      },
      "security": {
        "authentication_method": "None (for simplicity)",
        "authorization_strategy": "None (for simplicity)",
        "data_encryption": {
          "at_rest": "Not applicable for this simple application.",
          "in_transit": "HTTPS is enforced for all API communication."
        },
        "security_measures": [
          {
            "category": "Input Validation",
            "implementation": "Validate all user inputs on the backend to prevent XSS and SQL injection attacks.",
            "mitigation": "XSS and SQL Injection",
            "priority": "High"
          },
          {
            "category": "Output Encoding",
            "implementation": "Encode all output data to prevent XSS attacks.",
            "mitigation": "XSS",
            "priority": "High"
          },
          {
            "category": "HTTPS",
            "implementation": "Enforce HTTPS for all API communication.",
            "mitigation": "Data in transit security",
            "priority": "High"
          },
          {
            "category": "Dependency Management",
            "implementation": "Regularly update dependencies to patch security vulnerabilities.",
            "mitigation": "Vulnerability patching",
            "priority": "Medium"
          }
        ],
        "vulnerability_mitigation_strategies": [
          "Input validation",
          "Output encoding",
          "Regular dependency updates",
          "Use of HTTPS"
        ],
        "compliance_standards": []
      },
      "scalability_and_performance": {
        "caching_strategy": "Consider caching the task list on the frontend to reduce API calls.",
        "database_optimization": "Use indexes on the 'tasks' table for faster query performance.",
        "code_splitting": "Implement code splitting in the React frontend to reduce initial load time.",
        "lazy_loading": "Lazy load images and components to improve initial render performance."
      },
      "deployment_strategy": {
        "environment": "AWS",
        "frontend_deployment": "Deploy the React frontend to AWS S3 with CloudFront for content delivery.",
        "backend_deployment": "Deploy the Node.js backend as AWS Lambda functions, triggered by API Gateway.",
        "database_deployment": "Use AWS RDS for PostgreSQL.",
        "infrastructure_as_code": "Use AWS CloudFormation or Terraform for infrastructure provisioning."
      },
      "monitoring_and_logging": {
        "logging": "Implement logging in both the frontend and backend using tools like CloudWatch.",
        "metrics": "Monitor API performance, database performance, and frontend performance using CloudWatch.",
        "error_tracking": "Use a service like Sentry to track and manage errors."
      },
      "error_handling_strategy": "Use standard HTTP status codes and return JSON responses with informative error messages. Implement centralized error handling in both frontend and backend.",
      "development_phases_overview": [
        {
          "name": "Phase 1: Setup and Frontend Development",
          "description": "Set up the development environment, create the React frontend, and implement the UI for adding and viewing tasks.",
          "priority": "High",
          "dependencies": [],
          "tasks": [
            "Set up React project.",
            "Design and implement the UI.",
            "Implement the task input form.",
            "Display the task list."
          ],
          "estimated_duration": "1 week"
        },
        {
          "name": "Phase 2: Backend API Development",
          "description": "Develop the Node.js backend API, including the API endpoints for creating and retrieving tasks.",
          "priority": "High",
          "dependencies": [
            "Phase 1: Setup and Frontend Development"
          ],
          "tasks": [
            "Set up Node.js and Express project.",
            "Implement API endpoints for creating and retrieving tasks.",
            "Connect to the PostgreSQL database.",
            "Implement input validation."
          ],
          "estimated_duration": "1 week"
        },
        {
          "name": "Phase 3: Database and API Integration",
          "description": "Integrate the frontend with the backend API and database.",
          "priority": "High",
          "dependencies": [
            "Phase 1: Setup and Frontend Development",
            "Phase 2: Backend API Development"
          ],
          "tasks": [
            "Implement API calls in the frontend.",
            "Test the API integration.",
            "Handle API responses and errors."
          ],
          "estimated_duration": "1 week"
        },
        {
          "name": "Phase 4: Deployment and Testing",
          "description": "Deploy the application to AWS and perform thorough testing.",
          "priority": "High",
          "dependencies": [
            "Phase 3: Database and API Integration"
          ],
          "tasks": [
            "Deploy the frontend to S3 and CloudFront.",
            "Deploy the backend as Lambda functions with API Gateway.",
            "Deploy the PostgreSQL database to RDS.",
            "Perform end-to-end testing.",
            "Implement monitoring and logging."
          ],
          "estimated_duration": "1 week"
        }
      ],
      "key_risks": [
        "Security vulnerabilities (XSS, SQL injection).",
        "Performance bottlenecks (slow database queries, inefficient frontend code).",
        "Scalability limitations (database, API).",
        "Deployment issues."
      ],
      "design_justification": "The chosen design leverages a serverless architecture for scalability and cost-effectiveness. React is used for a modern and efficient frontend, while Node.js with Express provides a lightweight and flexible backend. PostgreSQL is selected for its reliability and data integrity. AWS services are used for deployment and infrastructure management. This design prioritizes simplicity, maintainability, and scalability for the task management application.",
      "data_flow": "1. User interacts with the React frontend (add/view tasks). 2. Frontend makes API calls to the AWS API Gateway. 3. API Gateway routes requests to the appropriate Lambda functions (Task Creation or Task Retrieval). 4. Lambda functions interact with the PostgreSQL database to store or retrieve task data. 5. Lambda functions return responses to the API Gateway. 6. API Gateway returns responses to the frontend. 7. Frontend updates the UI based on the API responses."
    },
    "implementation_plan": "plan=ImplementationPlan(project_summary={'title': 'Generated Project Plan', 'description': 'Develop a simple web application for managing tasks, including frontend UI, backend API, and database integration, deployed on AWS using a serverless architecture.', 'overall_complexity': 'Medium', 'estimated_duration': 'TBD', 'key_challenges': [], 'success_criteria': []}, phases=[{'name': 'Frontend Phase', 'description': 'Tasks related to frontend phase', 'deliverables': ['Completed FE-001', 'Completed FE-002', 'Completed FE-003', 'Completed FE-004', 'Completed FE-005', 'Completed FE-006', 'Completed FE-007'], 'estimated_duration_hours': 28.0, 'work_items': [{'id': 'FE-001', 'description': 'Set up React project using Create React App.', 'dependencies': [], 'estimated_time': '2 hours', 'agent_role': 'frontend_developer', 'acceptance_criteria': ['Project is initialized with Create React App.', 'Project builds successfully.', 'Basic project structure is in place.'], 'status': 'pending', 'code_files': ['package.json', 'src/App.js', 'src/index.js']}, {'id': 'FE-002', 'description': 'Design and implement the basic UI layout (header, main content area).', 'dependencies': ['FE-001'], 'estimated_time': '4 hours', 'agent_role': 'frontend_developer', 'acceptance_criteria': ['Header with application title is displayed.', 'Main content area is present.', 'UI layout is responsive.'], 'status': 'pending', 'code_files': ['src/App.js', 'src/App.css']}, {'id': 'FE-003', 'description': 'Implement the task input form (text input and add button).', 'dependencies': ['FE-002'], 'estimated_time': '4 hours', 'agent_role': 'frontend_developer', 'acceptance_criteria': ['Text input field for task description is present.', 'Add button is present.', 'Form is styled appropriately.'], 'status': 'pending', 'code_files': ['src/App.js', 'src/App.css']}, {'id': 'FE-004', 'description': 'Implement the display of the task list (initially, hardcoded data).', 'dependencies': ['FE-002'], 'estimated_time': '4 hours', 'agent_role': 'frontend_developer', 'acceptance_criteria': ['Task list is displayed below the input form.', 'Hardcoded task data is rendered correctly.', 'Each task displays its description.'], 'status': 'pending', 'code_files': ['src/App.js', 'src/App.css']}, {'id': 'FE-005', 'description': 'Implement API calls to the backend (POST /tasks).', 'dependencies': ['FE-003', 'BE-002'], 'estimated_time': '6 hours', 'agent_role': 'frontend_developer', 'acceptance_criteria': ['Frontend makes a POST request to /api/v1/tasks when the form is submitted.', 'Frontend sends the task description in the request body.', 'Frontend handles the API response (success and error).', 'Frontend displays a success message on successful task creation.'], 'status': 'pending', 'code_files': ['src/App.js']}, {'id': 'FE-006', 'description': 'Implement API calls to the backend (GET /tasks).', 'dependencies': ['FE-004', 'BE-003'], 'estimated_time': '6 hours', 'agent_role': 'frontend_developer', 'acceptance_criteria': ['Frontend makes a GET request to /api/v1/tasks on component mount.', 'Frontend handles the API response (success and error).', 'Frontend displays the retrieved tasks in the task list.', 'Frontend updates the task list after a new task is added.'], 'status': 'pending', 'code_files': ['src/App.js']}, {'id': 'FE-007', 'description': 'Implement basic error handling in the frontend.', 'dependencies': ['FE-005', 'FE-006'], 'estimated_time': '2 hours', 'agent_role': 'frontend_developer', 'acceptance_criteria': ['Error messages are displayed to the user if API calls fail.', 'Error messages are clear and informative.'], 'status': 'pending', 'code_files': ['src/App.js']}]}, {'name': 'Backend Phase', 'description': 'Tasks related to backend phase', 'deliverables': ['Completed BE-001', 'Completed BE-002', 'Completed BE-003', 'Completed BE-004', 'Completed BE-005', 'Completed BE-006', 'Completed TE-001', 'Completed SC-001', 'Completed SC-003'], 'estimated_duration_hours': 42.0, 'work_items': [{'id': 'BE-001', 'description': 'Set up Node.js and Express project.', 'dependencies': [], 'estimated_time': '2 hours', 'agent_role': 'backend_developer', 'acceptance_criteria': ['Project directory is created.', 'package.json is initialized.', 'Express is installed.', 'Basic server setup (listening on a port).'], 'status': 'pending', 'code_files': ['package.json', 'index.js']}, {'id': 'BE-002', 'description': 'Implement API endpoint for creating a task (/api/v1/tasks - POST).', 'dependencies': ['BE-001'], 'estimated_time': '6 hours', 'agent_role': 'backend_developer', 'acceptance_criteria': ['Endpoint handles POST requests to /api/v1/tasks.', 'Endpoint receives task description in the request body.', 'Endpoint validates the task description (not empty).', 'Endpoint returns a 201 status code on success.', 'Endpoint returns the created task (id, description, created_at) in the response.'], 'status': 'pending', 'code_files': ['index.js']}, {'id': 'BE-003', 'description': 'Implement API endpoint for retrieving all tasks (/api/v1/tasks - GET).', 'dependencies': ['BE-001'], 'estimated_time': '4 hours', 'agent_role': 'backend_developer', 'acceptance_criteria': ['Endpoint handles GET requests to /api/v1/tasks.', 'Endpoint retrieves all tasks from the database (initially, an in-memory array).', 'Endpoint returns a 200 status code on success.', 'Endpoint returns the list of tasks in the response.'], 'status': 'pending', 'code_files': ['index.js']}, {'id': 'BE-004', 'description': 'Connect Node.js backend to PostgreSQL database.', 'dependencies': ['BE-001', 'DB-001'], 'estimated_time': '6 hours', 'agent_role': 'backend_developer', 'acceptance_criteria': ['Database connection is established.', 'Database connection details are configured securely (e.g., environment variables).', 'Database connection is tested successfully.'], 'status': 'pending', 'code_files': ['index.js']}, {'id': 'BE-005', 'description': 'Modify the POST /api/v1/tasks endpoint to store tasks in the database.', 'dependencies': ['BE-002', 'BE-004'], 'estimated_time': '6 hours', 'agent_role': 'backend_developer', 'acceptance_criteria': [\"Task data is inserted into the 'tasks' table.\", 'Endpoint handles database errors gracefully.', 'Endpoint returns the created task with the generated ID.'], 'status': 'pending', 'code_files': ['index.js']}, {'id': 'BE-006', 'description': 'Modify the GET /api/v1/tasks endpoint to retrieve tasks from the database.', 'dependencies': ['BE-003', 'BE-004'], 'estimated_time': '4 hours', 'agent_role': 'backend_developer', 'acceptance_criteria': [\"Endpoint retrieves tasks from the 'tasks' table.\", 'Endpoint handles database errors gracefully.', 'Endpoint returns the list of tasks retrieved from the database.'], 'status': 'pending', 'code_files': ['index.js']}, {'id': 'TE-001', 'description': 'Write unit tests for the backend API endpoints.', 'dependencies': ['BE-006'], 'estimated_time': '8 hours', 'agent_role': 'backend_developer', 'acceptance_criteria': ['Unit tests cover the POST /tasks endpoint (success and error cases).', 'Unit tests cover the GET /tasks endpoint (success and error cases).', 'Tests use a testing framework (e.g., Jest).', 'Tests mock database interactions.'], 'status': 'pending', 'code_files': ['tests/']}, {'id': 'SC-001', 'description': 'Implement input validation on the backend to prevent XSS and SQL injection.', 'dependencies': ['BE-005'], 'estimated_time': '4 hours', 'agent_role': 'backend_developer', 'acceptance_criteria': ['Input validation is implemented for the task description.', 'Invalid input is rejected with an appropriate error message.', 'Input is sanitized to prevent XSS attacks.'], 'status': 'pending', 'code_files': ['index.js']}, {'id': 'SC-003', 'description': 'Implement output encoding to prevent XSS attacks.', 'dependencies': ['BE-006'], 'estimated_time': '2 hours', 'agent_role': 'backend_developer', 'acceptance_criteria': ['Output data is encoded before being sent to the frontend.', 'XSS vulnerabilities are mitigated.'], 'status': 'pending', 'code_files': ['index.js']}]}, {'name': 'Database Phase', 'description': 'Tasks related to database phase', 'deliverables': ['Completed DB-001', 'Completed DB-002'], 'estimated_duration_hours': 6.0, 'work_items': [{'id': 'DB-001', 'description': 'Set up PostgreSQL database on AWS RDS.', 'dependencies': [], 'estimated_time': '4 hours', 'agent_role': 'database_specialist', 'acceptance_criteria': ['PostgreSQL database instance is created on AWS RDS.', 'Database is accessible.', 'Security group is configured to allow access.'], 'status': 'pending', 'code_files': []}, {'id': 'DB-002', 'description': \"Create 'tasks' table in PostgreSQL database.\", 'dependencies': ['DB-001'], 'estimated_time': '2 hours', 'agent_role': 'database_specialist', 'acceptance_criteria': ['Tasks table is created.', \"Table has 'id', 'description', and 'created_at' columns.\", 'ID is UUID and primary key.', 'Description is TEXT.', 'created_at is TIMESTAMP with DEFAULT CURRENT_TIMESTAMP.'], 'status': 'pending', 'code_files': []}]}, {'name': 'Devops_Engineer Phase', 'description': 'Tasks related to devops_engineer phase', 'deliverables': ['Completed DE-001', 'Completed DE-002', 'Completed SC-002'], 'estimated_duration_hours': 16.0, 'work_items': [{'id': 'DE-001', 'description': 'Deploy frontend to AWS S3 and configure CloudFront.', 'dependencies': ['FE-006'], 'estimated_time': '6 hours', 'agent_role': 'devops_engineer', 'acceptance_criteria': ['Frontend code is built and deployed to S3.', 'CloudFront distribution is created and configured.', 'Frontend is accessible via the CloudFront URL.', 'HTTPS is enabled for CloudFront.'], 'status': 'pending', 'code_files': []}, {'id': 'DE-002', 'description': 'Deploy backend (Node.js with Express) as AWS Lambda functions with API Gateway.', 'dependencies': ['BE-006'], 'estimated_time': '8 hours', 'agent_role': 'devops_engineer', 'acceptance_criteria': ['Lambda functions are created for both API endpoints (POST /tasks and GET /tasks).', 'API Gateway is configured to route requests to the Lambda functions.', 'API Gateway is configured with HTTPS.', 'API Gateway is configured with CORS.', 'Backend API is accessible via the API Gateway URL.'], 'status': 'pending', 'code_files': []}, {'id': 'SC-002', 'description': 'Implement HTTPS for all API communication.', 'dependencies': ['DE-002'], 'estimated_time': '2 hours', 'agent_role': 'devops_engineer', 'acceptance_criteria': ['HTTPS is enabled for the API Gateway.', 'All API requests are redirected to HTTPS.'], 'status': 'pending', 'code_files': []}]}, {'name': 'Qa_Engineer Phase', 'description': 'Tasks related to qa_engineer phase', 'deliverables': ['Completed TE-002'], 'estimated_duration_hours': 4.0, 'work_items': [{'id': 'TE-002', 'description': 'Perform end-to-end testing of the application.', 'dependencies': ['DE-001', 'DE-002', 'FE-007'], 'estimated_time': '4 hours', 'agent_role': 'qa_engineer', 'acceptance_criteria': ['User can successfully add a task.', 'User can successfully view the task list.', 'Error handling is working correctly.', 'Application is tested on different browsers.'], 'status': 'pending', 'code_files': []}]}], resource_allocation=[{'role': 'Backend Developer', 'count': 1, 'estimated_time_allocation': '100%', 'phases': ['Backend Phase'], 'skills_required': []}, {'role': 'Devops Engineer', 'count': 1, 'estimated_time_allocation': '100%', 'phases': ['Devops_Engineer Phase'], 'skills_required': []}, {'role': 'Database Specialist', 'count': 1, 'estimated_time_allocation': '100%', 'phases': ['Database Phase'], 'skills_required': []}, {'role': 'Frontend Developer', 'count': 1, 'estimated_time_allocation': '100%', 'phases': ['Frontend Phase'], 'skills_required': []}, {'role': 'Qa Engineer', 'count': 1, 'estimated_time_allocation': '100%', 'phases': ['Qa_Engineer Phase'], 'skills_required': []}], risks_and_mitigations=[], timeline={'start_date': '2025-07-08T20:41:51.846961', 'end_date': 'TBD', 'milestones': []}, tech_stack={}, metadata={'generated_at': '2025-07-08T20:41:51.846961', 'version': '1.0', 'author': 'Multi-AI Dev System', 'tags': [], 'notes': 'Converted from WorkItemBacklog. Original summary: Develop a simple web application for managing tasks, including frontend UI, backend API, and database integration, deployed on AWS using a serverless architecture.'}) summary='Develop a simple web application for managing tasks, including frontend UI, backend API, and database integration, deployed on AWS using a serverless architecture.' metadata=PlanMetadata(generated_at='2025-07-08T20:41:51.846961', version='1.0', author='Multi-AI Dev System', tags=[], notes='Converted from WorkItemBacklog. Original summary: Develop a simple web application for managing tasks, including frontend UI, backend API, and database integration, deployed on AWS using a serverless architecture.')"
  }
}