{
  "session_id": "session_d0a70b42-7774-4324-ac34-f386d7389ddc",
  "approval_type": "implementation_plan",
  "timestamp": 1751964034,
  "approval_data": {
    "type": "implementation_plan",
    "timestamp": 1751964034.988562,
    "project_overview": "Develop a simple task list web application using React for the frontend, Node.js with Express for the backend, and PostgreSQL for the database. The application will allow users to add and view tasks. The application will be deployed to AWS (or Heroku) with HTTPS enabled.",
    "development_phases": [
      {
        "name": "Frontend Phase",
        "description": "Tasks related to frontend phase",
        "deliverables": [
          "Completed FE-001",
          "Completed FE-002",
          "Completed FE-003",
          "Completed FE-004",
          "Completed FE-005",
          "Completed FE-006",
          "Completed FE-007",
          "Completed FE-008",
          "Completed IT-005"
        ],
        "estimated_duration_hours": 24.0,
        "work_items": [
          {
            "id": "FE-001",
            "description": "Set up React project using Create React App.",
            "dependencies": [],
            "estimated_time": "4 hours",
            "agent_role": "frontend_developer",
            "acceptance_criteria": [
              "Project initializes successfully.",
              "Default React app runs without errors."
            ],
            "status": "pending",
            "code_files": [
              "package.json",
              "src/App.js",
              "src/index.js"
            ]
          },
          {
            "id": "FE-002",
            "description": "Install Axios for API calls.",
            "dependencies": [
              "FE-001"
            ],
            "estimated_time": "1 hour",
            "agent_role": "frontend_developer",
            "acceptance_criteria": [
              "Axios is installed as a project dependency.",
              "Can import Axios in a React component."
            ],
            "status": "pending",
            "code_files": [
              "package.json"
            ]
          },
          {
            "id": "FE-003",
            "description": "Create a basic task input form (text field and add button).",
            "dependencies": [
              "FE-001"
            ],
            "estimated_time": "3 hours",
            "agent_role": "frontend_developer",
            "acceptance_criteria": [
              "Form renders correctly.",
              "Text field accepts user input.",
              "Add button is present."
            ],
            "status": "pending",
            "code_files": [
              "src/App.js",
              "src/App.css"
            ]
          },
          {
            "id": "FE-004",
            "description": "Implement state to store the task description from the input field.",
            "dependencies": [
              "FE-003"
            ],
            "estimated_time": "2 hours",
            "agent_role": "frontend_developer",
            "acceptance_criteria": [
              "Task description is stored in component state.",
              "Input field updates state on change."
            ],
            "status": "pending",
            "code_files": [
              "src/App.js"
            ]
          },
          {
            "id": "FE-005",
            "description": "Create a function to handle adding a new task (API call to backend).",
            "dependencies": [
              "FE-002",
              "FE-004"
            ],
            "estimated_time": "4 hours",
            "agent_role": "frontend_developer",
            "acceptance_criteria": [
              "API call is made to /tasks on button click.",
              "Task description is sent in the request body.",
              "Error handling for API call is implemented (e.g., display error message)."
            ],
            "status": "pending",
            "code_files": [
              "src/App.js"
            ]
          },
          {
            "id": "FE-006",
            "description": "Display the list of tasks fetched from the backend.",
            "dependencies": [
              "FE-005"
            ],
            "estimated_time": "4 hours",
            "agent_role": "frontend_developer",
            "acceptance_criteria": [
              "Tasks are fetched from /tasks on component mount.",
              "Tasks are displayed in a list format.",
              "Tasks are displayed correctly (description, created_at, completed)."
            ],
            "status": "pending",
            "code_files": [
              "src/App.js"
            ]
          },
          {
            "id": "FE-007",
            "description": "Implement a loading indicator while fetching tasks.",
            "dependencies": [
              "FE-006"
            ],
            "estimated_time": "2 hours",
            "agent_role": "frontend_developer",
            "acceptance_criteria": [
              "Loading indicator displays while fetching tasks.",
              "Loading indicator hides after tasks are fetched."
            ],
            "status": "pending",
            "code_files": [
              "src/App.js",
              "src/App.css"
            ]
          },
          {
            "id": "FE-008",
            "description": "Implement basic styling for the task list and form.",
            "dependencies": [
              "FE-003",
              "FE-006"
            ],
            "estimated_time": "3 hours",
            "agent_role": "frontend_developer",
            "acceptance_criteria": [
              "UI is visually appealing.",
              "Tasks are clearly displayed.",
              "Form is styled."
            ],
            "status": "pending",
            "code_files": [
              "src/App.css",
              "src/App.js"
            ]
          },
          {
            "id": "IT-005",
            "description": "Test the frontend's interaction with the backend (add task, view tasks).",
            "dependencies": [
              "FE-001",
              "FE-002",
              "FE-003",
              "FE-004",
              "FE-005",
              "FE-006",
              "BE-004",
              "BE-005"
            ],
            "estimated_time": "2 hours",
            "agent_role": "frontend_developer",
            "acceptance_criteria": [
              "User can add a task via the form.",
              "New task appears in the task list.",
              "Task list displays correctly.",
              "Error messages are displayed correctly (if any)."
            ],
            "status": "pending",
            "code_files": []
          }
        ]
      },
      {
        "name": "Backend Phase",
        "description": "Tasks related to backend phase",
        "deliverables": [
          "Completed BE-001",
          "Completed BE-002",
          "Completed BE-004",
          "Completed BE-005",
          "Completed BE-006",
          "Completed BE-007",
          "Completed BE-008",
          "Completed IT-001",
          "Completed IT-002",
          "Completed IT-003",
          "Completed IT-004"
        ],
        "estimated_duration_hours": 21.0,
        "work_items": [
          {
            "id": "BE-001",
            "description": "Set up Node.js project and install Express.",
            "dependencies": [],
            "estimated_time": "3 hours",
            "agent_role": "backend_developer",
            "acceptance_criteria": [
              "Project initializes successfully.",
              "Express is installed as a project dependency.",
              "Basic Express server runs without errors."
            ],
            "status": "pending",
            "code_files": [
              "package.json",
              "index.js"
            ]
          },
          {
            "id": "BE-002",
            "description": "Install and configure PostgreSQL client (e.g., pg or node-postgres).",
            "dependencies": [
              "BE-001"
            ],
            "estimated_time": "2 hours",
            "agent_role": "backend_developer",
            "acceptance_criteria": [
              "PostgreSQL client is installed as a project dependency.",
              "Can connect to the PostgreSQL database."
            ],
            "status": "pending",
            "code_files": [
              "package.json",
              "index.js"
            ]
          },
          {
            "id": "BE-004",
            "description": "Implement the POST /tasks endpoint (create a new task).",
            "dependencies": [
              "BE-002",
              "BE-003"
            ],
            "estimated_time": "4 hours",
            "agent_role": "backend_developer",
            "acceptance_criteria": [
              "Endpoint handles POST requests to /tasks.",
              "Task description is extracted from the request body.",
              "Task is inserted into the database.",
              "Returns 201 Created with the new task's data in the response body.",
              "Input validation is implemented (description is required)."
            ],
            "status": "pending",
            "code_files": [
              "index.js"
            ]
          },
          {
            "id": "BE-005",
            "description": "Implement the GET /tasks endpoint (get all tasks).",
            "dependencies": [
              "BE-002",
              "BE-003"
            ],
            "estimated_time": "3 hours",
            "agent_role": "backend_developer",
            "acceptance_criteria": [
              "Endpoint handles GET requests to /tasks.",
              "Retrieves all tasks from the database.",
              "Returns 200 OK with the task list in the response body.",
              "Tasks are returned in the correct format."
            ],
            "status": "pending",
            "code_files": [
              "index.js"
            ]
          },
          {
            "id": "BE-006",
            "description": "Implement the PUT /tasks/{id} endpoint (update a task).",
            "dependencies": [
              "BE-002",
              "BE-003"
            ],
            "estimated_time": "4 hours",
            "agent_role": "backend_developer",
            "acceptance_criteria": [
              "Endpoint handles PUT requests to /tasks/{id}.",
              "Task ID is extracted from the URL parameters.",
              "Task is updated in the database (e.g., mark as complete).",
              "Returns 200 OK with the updated task data in the response body.",
              "Handles task not found (404)."
            ],
            "status": "pending",
            "code_files": [
              "index.js"
            ]
          },
          {
            "id": "BE-007",
            "description": "Implement the DELETE /tasks/{id} endpoint (delete a task).",
            "dependencies": [
              "BE-002",
              "BE-003"
            ],
            "estimated_time": "3 hours",
            "agent_role": "backend_developer",
            "acceptance_criteria": [
              "Endpoint handles DELETE requests to /tasks/{id}.",
              "Task ID is extracted from the URL parameters.",
              "Task is deleted from the database.",
              "Returns 204 No Content on success.",
              "Handles task not found (404)."
            ],
            "status": "pending",
            "code_files": [
              "index.js"
            ]
          },
          {
            "id": "BE-008",
            "description": "Implement basic error handling for API endpoints.",
            "dependencies": [
              "BE-004",
              "BE-005",
              "BE-006",
              "BE-007"
            ],
            "estimated_time": "2 hours",
            "agent_role": "backend_developer",
            "acceptance_criteria": [
              "Handles database connection errors.",
              "Handles input validation errors.",
              "Returns appropriate HTTP status codes for errors (e.g., 400, 404, 500).",
              "Returns error messages in JSON format."
            ],
            "status": "pending",
            "code_files": [
              "index.js"
            ]
          },
          {
            "id": "IT-001",
            "description": "Test the POST /tasks endpoint using Postman.",
            "dependencies": [
              "BE-004"
            ],
            "estimated_time": "1 hour",
            "agent_role": "backend_developer",
            "acceptance_criteria": [
              "Endpoint returns 201 Created on successful task creation.",
              "Endpoint returns the correct task data in the response body.",
              "Endpoint handles invalid input correctly (e.g., missing description).",
              "Endpoint handles database errors correctly."
            ],
            "status": "pending",
            "code_files": []
          },
          {
            "id": "IT-002",
            "description": "Test the GET /tasks endpoint using Postman.",
            "dependencies": [
              "BE-005",
              "IT-001"
            ],
            "estimated_time": "1 hour",
            "agent_role": "backend_developer",
            "acceptance_criteria": [
              "Endpoint returns 200 OK.",
              "Endpoint returns the correct list of tasks.",
              "Endpoint handles database errors correctly."
            ],
            "status": "pending",
            "code_files": []
          },
          {
            "id": "IT-003",
            "description": "Test the PUT /tasks/{id} endpoint using Postman.",
            "dependencies": [
              "BE-006",
              "IT-001",
              "IT-002"
            ],
            "estimated_time": "1 hour",
            "agent_role": "backend_developer",
            "acceptance_criteria": [
              "Endpoint returns 200 OK on successful update.",
              "Endpoint returns the updated task data.",
              "Endpoint handles task not found (404).",
              "Endpoint handles invalid input correctly.",
              "Endpoint handles database errors correctly."
            ],
            "status": "pending",
            "code_files": []
          },
          {
            "id": "IT-004",
            "description": "Test the DELETE /tasks/{id} endpoint using Postman.",
            "dependencies": [
              "BE-007",
              "IT-001",
              "IT-002",
              "IT-003"
            ],
            "estimated_time": "1 hour",
            "agent_role": "backend_developer",
            "acceptance_criteria": [
              "Endpoint returns 204 No Content on successful deletion.",
              "Endpoint handles task not found (404).",
              "Endpoint handles database errors correctly."
            ],
            "status": "pending",
            "code_files": []
          }
        ]
      },
      {
        "name": "Database Phase",
        "description": "Tasks related to database phase",
        "deliverables": [
          "Completed BE-003"
        ],
        "estimated_duration_hours": 2.0,
        "work_items": [
          {
            "id": "BE-003",
            "description": "Create a PostgreSQL database and 'tasks' table.",
            "dependencies": [],
            "estimated_time": "2 hours",
            "agent_role": "database_specialist",
            "acceptance_criteria": [
              "Database is created.",
              "'tasks' table exists with 'id', 'description', 'created_at', and 'completed' columns.",
              "id is SERIAL and PRIMARY KEY.",
              "description is TEXT NOT NULL.",
              "created_at is TIMESTAMP DEFAULT CURRENT_TIMESTAMP NOT NULL.",
              "completed is BOOLEAN DEFAULT FALSE NOT NULL."
            ],
            "status": "pending",
            "code_files": []
          }
        ]
      },
      {
        "name": "Devops_Engineer Phase",
        "description": "Tasks related to devops_engineer phase",
        "deliverables": [
          "Completed DP-001",
          "Completed DP-002",
          "Completed DP-003"
        ],
        "estimated_duration_hours": 9.0,
        "work_items": [
          {
            "id": "DP-001",
            "description": "Deploy backend to AWS EC2 (or Heroku).",
            "dependencies": [
              "BE-001",
              "BE-002",
              "BE-003",
              "BE-004",
              "BE-005",
              "BE-006",
              "BE-007",
              "BE-008"
            ],
            "estimated_time": "4 hours",
            "agent_role": "devops_engineer",
            "acceptance_criteria": [
              "Backend API is accessible via a public URL.",
              "Database is configured correctly.",
              "API endpoints function as expected."
            ],
            "status": "pending",
            "code_files": []
          },
          {
            "id": "DP-002",
            "description": "Deploy frontend to AWS S3 (or Netlify/Vercel).",
            "dependencies": [
              "FE-001",
              "FE-002",
              "FE-003",
              "FE-004",
              "FE-005",
              "FE-006",
              "FE-007",
              "FE-008"
            ],
            "estimated_time": "3 hours",
            "agent_role": "devops_engineer",
            "acceptance_criteria": [
              "Frontend is accessible via a public URL.",
              "Frontend correctly calls the backend API.",
              "Application functions as expected."
            ],
            "status": "pending",
            "code_files": []
          },
          {
            "id": "DP-003",
            "description": "Configure HTTPS for the deployed application.",
            "dependencies": [
              "DP-001",
              "DP-002"
            ],
            "estimated_time": "2 hours",
            "agent_role": "devops_engineer",
            "acceptance_criteria": [
              "Application is served over HTTPS.",
              "SSL certificate is valid."
            ],
            "status": "pending",
            "code_files": []
          }
        ]
      }
    ],
    "timeline_estimation": {
      "start_date": "2025-07-08T14:10:33.454634",
      "end_date": "TBD",
      "milestones": []
    },
    "risk_assessment": [],
    "resource_requirements": [
      {
        "role": "Database Specialist",
        "count": 1,
        "estimated_time_allocation": "100%",
        "phases": [
          "Database Phase"
        ],
        "skills_required": []
      },
      {
        "role": "Backend Developer",
        "count": 1,
        "estimated_time_allocation": "100%",
        "phases": [
          "Backend Phase"
        ],
        "skills_required": []
      },
      {
        "role": "Frontend Developer",
        "count": 1,
        "estimated_time_allocation": "100%",
        "phases": [
          "Frontend Phase"
        ],
        "skills_required": []
      },
      {
        "role": "Devops Engineer",
        "count": 1,
        "estimated_time_allocation": "100%",
        "phases": [
          "Devops_Engineer Phase"
        ],
        "skills_required": []
      }
    ],
    "deliverables": [
      "Completed FE-001",
      "Completed FE-002",
      "Completed FE-003",
      "Completed FE-004",
      "Completed FE-005",
      "Completed FE-006",
      "Completed FE-007",
      "Completed FE-008",
      "Completed IT-005",
      "Completed BE-001",
      "Completed BE-002",
      "Completed BE-004",
      "Completed BE-005",
      "Completed BE-006",
      "Completed BE-007",
      "Completed BE-008",
      "Completed IT-001",
      "Completed IT-002",
      "Completed IT-003",
      "Completed IT-004",
      "Completed BE-003",
      "Completed DP-001",
      "Completed DP-002",
      "Completed DP-003"
    ],
    "dependencies": [],
    "raw_plan": "plan=ImplementationPlan(project_summary={'title': 'Generated Project Plan', 'description': 'Develop a simple task list web application using React for the frontend, Node.js with Express for the backend, and PostgreSQL for the database. The application will allow users to add and view tasks. The application will be deployed to AWS (or Heroku) with HTTPS enabled.', 'overall_complexity': 'Medium', 'estimated_duration': 'TBD', 'key_challenges': [], 'success_criteria': []}, phases=[{'name': 'Frontend Phase', 'description': 'Tasks related to frontend phase', 'deliverables': ['Completed FE-001', 'Completed FE-002', 'Completed FE-003', 'Completed FE-004', 'Completed FE-005', 'Completed FE-006', 'Completed FE-007', 'Completed FE-008', 'Completed IT-005'], 'estimated_duration_hours': 24.0, 'work_items': [{'id': 'FE-001', 'description': 'Set up React project using Create React App.', 'dependencies': [], 'estimated_time': '4 hours', 'agent_role': 'frontend_developer', 'acceptance_criteria': ['Project initializes successfully.', 'Default React app runs without errors.'], 'status': 'pending', 'code_files': ['package.json', 'src/App.js', 'src/index.js']}, {'id': 'FE-002', 'description': 'Install Axios for API calls.', 'dependencies': ['FE-001'], 'estimated_time': '1 hour', 'agent_role': 'frontend_developer', 'acceptance_criteria': ['Axios is installed as a project dependency.', 'Can import Axios in a React component.'], 'status': 'pending', 'code_files': ['package.json']}, {'id': 'FE-003', 'description': 'Create a basic task input form (text field and add button).', 'dependencies': ['FE-001'], 'estimated_time': '3 hours', 'agent_role': 'frontend_developer', 'acceptance_criteria': ['Form renders correctly.', 'Text field accepts user input.', 'Add button is present.'], 'status': 'pending', 'code_files': ['src/App.js', 'src/App.css']}, {'id': 'FE-004', 'description': 'Implement state to store the task description from the input field.', 'dependencies': ['FE-003'], 'estimated_time': '2 hours', 'agent_role': 'frontend_developer', 'acceptance_criteria': ['Task description is stored in component state.', 'Input field updates state on change.'], 'status': 'pending', 'code_files': ['src/App.js']}, {'id': 'FE-005', 'description': 'Create a function to handle adding a new task (API call to backend).', 'dependencies': ['FE-002', 'FE-004'], 'estimated_time': '4 hours', 'agent_role': 'frontend_developer', 'acceptance_criteria': ['API call is made to /tasks on button click.', 'Task description is sent in the request body.', 'Error handling for API call is implemented (e.g., display error message).'], 'status': 'pending', 'code_files': ['src/App.js']}, {'id': 'FE-006', 'description': 'Display the list of tasks fetched from the backend.', 'dependencies': ['FE-005'], 'estimated_time': '4 hours', 'agent_role': 'frontend_developer', 'acceptance_criteria': ['Tasks are fetched from /tasks on component mount.', 'Tasks are displayed in a list format.', 'Tasks are displayed correctly (description, created_at, completed).'], 'status': 'pending', 'code_files': ['src/App.js']}, {'id': 'FE-007', 'description': 'Implement a loading indicator while fetching tasks.', 'dependencies': ['FE-006'], 'estimated_time': '2 hours', 'agent_role': 'frontend_developer', 'acceptance_criteria': ['Loading indicator displays while fetching tasks.', 'Loading indicator hides after tasks are fetched.'], 'status': 'pending', 'code_files': ['src/App.js', 'src/App.css']}, {'id': 'FE-008', 'description': 'Implement basic styling for the task list and form.', 'dependencies': ['FE-003', 'FE-006'], 'estimated_time': '3 hours', 'agent_role': 'frontend_developer', 'acceptance_criteria': ['UI is visually appealing.', 'Tasks are clearly displayed.', 'Form is styled.'], 'status': 'pending', 'code_files': ['src/App.css', 'src/App.js']}, {'id': 'IT-005', 'description': \"Test the frontend's interaction with the backend (add task, view tasks).\", 'dependencies': ['FE-001', 'FE-002', 'FE-003', 'FE-004', 'FE-005', 'FE-006', 'BE-004', 'BE-005'], 'estimated_time': '2 hours', 'agent_role': 'frontend_developer', 'acceptance_criteria': ['User can add a task via the form.', 'New task appears in the task list.', 'Task list displays correctly.', 'Error messages are displayed correctly (if any).'], 'status': 'pending', 'code_files': []}]}, {'name': 'Backend Phase', 'description': 'Tasks related to backend phase', 'deliverables': ['Completed BE-001', 'Completed BE-002', 'Completed BE-004', 'Completed BE-005', 'Completed BE-006', 'Completed BE-007', 'Completed BE-008', 'Completed IT-001', 'Completed IT-002', 'Completed IT-003', 'Completed IT-004'], 'estimated_duration_hours': 21.0, 'work_items': [{'id': 'BE-001', 'description': 'Set up Node.js project and install Express.', 'dependencies': [], 'estimated_time': '3 hours', 'agent_role': 'backend_developer', 'acceptance_criteria': ['Project initializes successfully.', 'Express is installed as a project dependency.', 'Basic Express server runs without errors.'], 'status': 'pending', 'code_files': ['package.json', 'index.js']}, {'id': 'BE-002', 'description': 'Install and configure PostgreSQL client (e.g., pg or node-postgres).', 'dependencies': ['BE-001'], 'estimated_time': '2 hours', 'agent_role': 'backend_developer', 'acceptance_criteria': ['PostgreSQL client is installed as a project dependency.', 'Can connect to the PostgreSQL database.'], 'status': 'pending', 'code_files': ['package.json', 'index.js']}, {'id': 'BE-004', 'description': 'Implement the POST /tasks endpoint (create a new task).', 'dependencies': ['BE-002', 'BE-003'], 'estimated_time': '4 hours', 'agent_role': 'backend_developer', 'acceptance_criteria': ['Endpoint handles POST requests to /tasks.', 'Task description is extracted from the request body.', 'Task is inserted into the database.', \"Returns 201 Created with the new task's data in the response body.\", 'Input validation is implemented (description is required).'], 'status': 'pending', 'code_files': ['index.js']}, {'id': 'BE-005', 'description': 'Implement the GET /tasks endpoint (get all tasks).', 'dependencies': ['BE-002', 'BE-003'], 'estimated_time': '3 hours', 'agent_role': 'backend_developer', 'acceptance_criteria': ['Endpoint handles GET requests to /tasks.', 'Retrieves all tasks from the database.', 'Returns 200 OK with the task list in the response body.', 'Tasks are returned in the correct format.'], 'status': 'pending', 'code_files': ['index.js']}, {'id': 'BE-006', 'description': 'Implement the PUT /tasks/{id} endpoint (update a task).', 'dependencies': ['BE-002', 'BE-003'], 'estimated_time': '4 hours', 'agent_role': 'backend_developer', 'acceptance_criteria': ['Endpoint handles PUT requests to /tasks/{id}.', 'Task ID is extracted from the URL parameters.', 'Task is updated in the database (e.g., mark as complete).', 'Returns 200 OK with the updated task data in the response body.', 'Handles task not found (404).'], 'status': 'pending', 'code_files': ['index.js']}, {'id': 'BE-007', 'description': 'Implement the DELETE /tasks/{id} endpoint (delete a task).', 'dependencies': ['BE-002', 'BE-003'], 'estimated_time': '3 hours', 'agent_role': 'backend_developer', 'acceptance_criteria': ['Endpoint handles DELETE requests to /tasks/{id}.', 'Task ID is extracted from the URL parameters.', 'Task is deleted from the database.', 'Returns 204 No Content on success.', 'Handles task not found (404).'], 'status': 'pending', 'code_files': ['index.js']}, {'id': 'BE-008', 'description': 'Implement basic error handling for API endpoints.', 'dependencies': ['BE-004', 'BE-005', 'BE-006', 'BE-007'], 'estimated_time': '2 hours', 'agent_role': 'backend_developer', 'acceptance_criteria': ['Handles database connection errors.', 'Handles input validation errors.', 'Returns appropriate HTTP status codes for errors (e.g., 400, 404, 500).', 'Returns error messages in JSON format.'], 'status': 'pending', 'code_files': ['index.js']}, {'id': 'IT-001', 'description': 'Test the POST /tasks endpoint using Postman.', 'dependencies': ['BE-004'], 'estimated_time': '1 hour', 'agent_role': 'backend_developer', 'acceptance_criteria': ['Endpoint returns 201 Created on successful task creation.', 'Endpoint returns the correct task data in the response body.', 'Endpoint handles invalid input correctly (e.g., missing description).', 'Endpoint handles database errors correctly.'], 'status': 'pending', 'code_files': []}, {'id': 'IT-002', 'description': 'Test the GET /tasks endpoint using Postman.', 'dependencies': ['BE-005', 'IT-001'], 'estimated_time': '1 hour', 'agent_role': 'backend_developer', 'acceptance_criteria': ['Endpoint returns 200 OK.', 'Endpoint returns the correct list of tasks.', 'Endpoint handles database errors correctly.'], 'status': 'pending', 'code_files': []}, {'id': 'IT-003', 'description': 'Test the PUT /tasks/{id} endpoint using Postman.', 'dependencies': ['BE-006', 'IT-001', 'IT-002'], 'estimated_time': '1 hour', 'agent_role': 'backend_developer', 'acceptance_criteria': ['Endpoint returns 200 OK on successful update.', 'Endpoint returns the updated task data.', 'Endpoint handles task not found (404).', 'Endpoint handles invalid input correctly.', 'Endpoint handles database errors correctly.'], 'status': 'pending', 'code_files': []}, {'id': 'IT-004', 'description': 'Test the DELETE /tasks/{id} endpoint using Postman.', 'dependencies': ['BE-007', 'IT-001', 'IT-002', 'IT-003'], 'estimated_time': '1 hour', 'agent_role': 'backend_developer', 'acceptance_criteria': ['Endpoint returns 204 No Content on successful deletion.', 'Endpoint handles task not found (404).', 'Endpoint handles database errors correctly.'], 'status': 'pending', 'code_files': []}]}, {'name': 'Database Phase', 'description': 'Tasks related to database phase', 'deliverables': ['Completed BE-003'], 'estimated_duration_hours': 2.0, 'work_items': [{'id': 'BE-003', 'description': \"Create a PostgreSQL database and 'tasks' table.\", 'dependencies': [], 'estimated_time': '2 hours', 'agent_role': 'database_specialist', 'acceptance_criteria': ['Database is created.', \"'tasks' table exists with 'id', 'description', 'created_at', and 'completed' columns.\", 'id is SERIAL and PRIMARY KEY.', 'description is TEXT NOT NULL.', 'created_at is TIMESTAMP DEFAULT CURRENT_TIMESTAMP NOT NULL.', 'completed is BOOLEAN DEFAULT FALSE NOT NULL.'], 'status': 'pending', 'code_files': []}]}, {'name': 'Devops_Engineer Phase', 'description': 'Tasks related to devops_engineer phase', 'deliverables': ['Completed DP-001', 'Completed DP-002', 'Completed DP-003'], 'estimated_duration_hours': 9.0, 'work_items': [{'id': 'DP-001', 'description': 'Deploy backend to AWS EC2 (or Heroku).', 'dependencies': ['BE-001', 'BE-002', 'BE-003', 'BE-004', 'BE-005', 'BE-006', 'BE-007', 'BE-008'], 'estimated_time': '4 hours', 'agent_role': 'devops_engineer', 'acceptance_criteria': ['Backend API is accessible via a public URL.', 'Database is configured correctly.', 'API endpoints function as expected.'], 'status': 'pending', 'code_files': []}, {'id': 'DP-002', 'description': 'Deploy frontend to AWS S3 (or Netlify/Vercel).', 'dependencies': ['FE-001', 'FE-002', 'FE-003', 'FE-004', 'FE-005', 'FE-006', 'FE-007', 'FE-008'], 'estimated_time': '3 hours', 'agent_role': 'devops_engineer', 'acceptance_criteria': ['Frontend is accessible via a public URL.', 'Frontend correctly calls the backend API.', 'Application functions as expected.'], 'status': 'pending', 'code_files': []}, {'id': 'DP-003', 'description': 'Configure HTTPS for the deployed application.', 'dependencies': ['DP-001', 'DP-002'], 'estimated_time': '2 hours', 'agent_role': 'devops_engineer', 'acceptance_criteria': ['Application is served over HTTPS.', 'SSL certificate is valid.'], 'status': 'pending', 'code_files': []}]}], resource_allocation=[{'role': 'Database Specialist', 'count': 1, 'estimated_time_allocation': '100%', 'phases': ['Database Phase'], 'skills_required': []}, {'role': 'Backend Developer', 'count': 1, 'estimated_time_allocation': '100%', 'phases': ['Backend Phase'], 'skills_required': []}, {'role': 'Frontend Developer', 'count': 1, 'estimated_time_allocation': '100%', 'phases': ['Frontend Phase'], 'skills_required': []}, {'role': 'Devops Engineer', 'count': 1, 'estimated_time_allocation': '100%', 'phases': ['Devops_Engineer Phase'], 'skills_required': []}], risks_and_mitigations=[], timeline={'start_date': '2025-07-08T14:10:33.454634', 'end_date': 'TBD', 'milestones': []}, tech_stack={}, metadata={'generated_at': '2025-07-08T14:10:33.454634', 'version': '1.0', 'author': 'Multi-AI Dev System', 'tags': [], 'notes': 'Converted from WorkItemBacklog. Original summary: Develop a simple task list web application using React for the frontend, Node.js with Express for the backend, and PostgreSQL for the database. The application will allow users to add and view tasks. The application will be deployed to AWS (or Heroku) with HTTPS enabled.'}) summary='Develop a simple task list web application using React for the frontend, Node.js with Express for the backend, and PostgreSQL for the database. The application will allow users to add and view tasks. The application will be deployed to AWS (or Heroku) with HTTPS enabled.' metadata=PlanMetadata(generated_at='2025-07-08T14:10:33.454634', version='1.0', author='Multi-AI Dev System', tags=[], notes='Converted from WorkItemBacklog. Original summary: Develop a simple task list web application using React for the frontend, Node.js with Express for the backend, and PostgreSQL for the database. The application will allow users to add and view tasks. The application will be deployed to AWS (or Heroku) with HTTPS enabled.')"
  },
  "workflow_state_snapshot": {
    "requirements_analysis": {
      "project_name": "Hello World Task List",
      "project_summary": "A simple web application to manage a list of tasks.",
      "project_goals": [
        "Allow a user to add a task",
        "Allow a user to see their list of tasks"
      ],
      "target_audience": [
        "Users who want to manage a list of tasks"
      ],
      "business_context": "This project aims to provide a basic task management tool.",
      "requirements": [
        {
          "id": "REQ-001",
          "description": "A user can create a new task with a text description.",
          "category": "functional",
          "priority": 1
        },
        {
          "id": "REQ-002",
          "description": "A user can see a list of all created tasks.",
          "category": "functional",
          "priority": 1
        },
        {
          "id": "REQ-003",
          "description": "The application must load quickly.",
          "category": "non_functional",
          "priority": 2
        },
        {
          "id": "REQ-004",
          "description": "The application must be secure.",
          "category": "non_functional",
          "priority": 2
        }
      ],
      "functional_requirements": [
        "A user can create a new task with a text description.",
        "A user can see a list of all created tasks."
      ],
      "non_functional_requirements": [
        "The application must load quickly.",
        "The application must be secure."
      ],
      "stakeholders": [
        "Users"
      ],
      "success_criteria": [
        "Users can successfully add tasks.",
        "Users can successfully view their task list.",
        "The application loads quickly.",
        "The application is secure."
      ],
      "constraints": [],
      "assumptions": [],
      "risks": [],
      "domain_specific_details": {},
      "quality_assessment": {
        "clarity_score": 9.0,
        "completeness_score": 8.0,
        "consistency_score": 10.0,
        "recommendations": []
      },
      "gap_analysis": {
        "identified_gaps": [],
        "recommendations_for_completion": []
      }
    },
    "tech_stack_recommendation": {
      "frontend_options": [
        {
          "name": "React",
          "language": "JavaScript",
          "reasoning": "React is a popular and efficient JavaScript library for building user interfaces. It offers a component-based architecture, making it easy to manage and update the UI. Its virtual DOM and efficient update mechanisms contribute to fast loading times, addressing the non-functional requirement for speed.",
          "key_libraries": [
            "React Router (for navigation)",
            "Axios (for API calls)",
            "Material UI or Bootstrap (for styling)"
          ],
          "pros": [
            "Large community and extensive documentation.",
            "Component-based architecture promotes code reusability and maintainability.",
            "Virtual DOM for efficient updates and improved performance.",
            "Wide range of available libraries and tools."
          ],
          "cons": [
            "Requires understanding of JavaScript and JSX.",
            "Can have a steeper learning curve for beginners.",
            "Requires additional libraries for routing and state management (though this is also a pro, as it allows for flexibility)."
          ],
          "selected": false
        },
        {
          "name": "Vue.js",
          "language": "JavaScript",
          "reasoning": "Vue.js is a progressive JavaScript framework that's easy to learn and integrate. It's known for its simplicity and flexibility, making it suitable for building single-page applications. It offers a good balance between ease of use and performance.",
          "key_libraries": [
            "Vue Router (for navigation)",
            "Axios (for API calls)",
            "Vuetify or BootstrapVue (for styling)"
          ],
          "pros": [
            "Easy to learn and use.",
            "Excellent documentation.",
            "Good performance.",
            "Flexible and adaptable."
          ],
          "cons": [
            "Smaller community compared to React.",
            "Ecosystem might not be as extensive as React's."
          ],
          "selected": false
        },
        {
          "name": "HTML, CSS, JavaScript (Vanilla)",
          "language": "JavaScript",
          "reasoning": "For a simple task list application, using vanilla JavaScript, HTML, and CSS can be a viable option. It avoids the overhead of a framework, resulting in potentially faster initial load times and a smaller bundle size. This approach is suitable for small projects where simplicity and direct control are prioritized.",
          "key_libraries": [],
          "pros": [
            "No external dependencies.",
            "Fast initial load times.",
            "Full control over the code.",
            "Simple to understand for beginners."
          ],
          "cons": [
            "More manual work for UI updates and DOM manipulation.",
            "Can become complex to manage as the application grows.",
            "Less structure compared to frameworks."
          ],
          "selected": false
        }
      ],
      "backend_options": [
        {
          "name": "Node.js with Express",
          "language": "JavaScript",
          "reasoning": "Node.js with Express provides a lightweight and efficient backend solution. JavaScript is used on both the frontend and backend, which can streamline development. Express simplifies routing and middleware management, making it easy to build RESTful APIs. This is a good choice for a simple application.",
          "key_libraries": [
            "Express.js (web framework)",
            "body-parser (for parsing request bodies)",
            "cors (for handling CORS)",
            "bcrypt (for password hashing)"
          ],
          "pros": [
            "JavaScript on both frontend and backend (full-stack JavaScript).",
            "Large community and extensive documentation.",
            "Fast development with Express.",
            "Good performance with Node.js's non-blocking I/O."
          ],
          "cons": [
            "Can be challenging to scale for very large applications.",
            "Requires careful handling of asynchronous operations."
          ],
          "selected": false
        },
        {
          "name": "Python with Flask",
          "language": "Python",
          "reasoning": "Flask is a micro web framework in Python, known for its simplicity and flexibility. Python's readability and Flask's ease of use make it a good choice for rapid development. It provides a solid foundation for building REST APIs.",
          "key_libraries": [
            "Flask (web framework)",
            "Flask-SQLAlchemy (for database interaction)",
            "bcrypt (for password hashing)",
            "Flask-CORS (for handling CORS)"
          ],
          "pros": [
            "Easy to learn and use.",
            "Large community and extensive documentation.",
            "Good performance.",
            "Python's readability."
          ],
          "cons": [
            "Can be slower than Node.js.",
            "Requires understanding of Python."
          ],
          "selected": false
        },
        {
          "name": "Java with Spring Boot",
          "language": "Java",
          "reasoning": "Spring Boot simplifies the development of Java-based applications. It provides a robust framework for building REST APIs and managing dependencies. Java's strong typing and performance make it suitable for larger projects, although it might be overkill for this simple application.",
          "key_libraries": [
            "Spring Boot (web framework)",
            "Spring Data JPA (for database interaction)",
            "BCryptPasswordEncoder (for password hashing)",
            "Spring Security (for security)"
          ],
          "pros": [
            "Robust and scalable.",
            "Large community and extensive documentation.",
            "Good performance.",
            "Strong typing."
          ],
          "cons": [
            "Steeper learning curve.",
            "More verbose than other options.",
            "Can be overkill for a simple application."
          ],
          "selected": false
        }
      ],
      "database_options": [
        {
          "name": "PostgreSQL",
          "language": null,
          "reasoning": "PostgreSQL is a powerful, open-source relational database system. It offers strong data integrity, support for complex queries, and is suitable for a wide range of applications. It's a reliable choice for storing task data.",
          "key_libraries": [
            "psycopg2 (for Python)",
            "pg (for Node.js)",
            "JDBC driver (for Java)"
          ],
          "pros": [
            "Reliable and robust.",
            "Supports complex queries.",
            "Strong data integrity.",
            "Open source."
          ],
          "cons": [
            "Can be more complex to set up and manage than simpler databases.",
            "Requires more resources than simpler databases."
          ],
          "selected": false
        },
        {
          "name": "MongoDB",
          "language": null,
          "reasoning": "MongoDB is a NoSQL document database that is flexible and easy to use. It's a good choice for applications where the data structure is not strictly defined. Its schema-less nature allows for easy adaptation to changing requirements.",
          "key_libraries": [
            "Mongoose (for Node.js)",
            "pymongo (for Python)",
            "Spring Data MongoDB (for Java)"
          ],
          "pros": [
            "Flexible schema.",
            "Easy to scale.",
            "Good performance for read/write operations.",
            "Easy to set up."
          ],
          "cons": [
            "Data consistency can be more challenging to manage.",
            "Not as suitable for complex relationships as relational databases."
          ],
          "selected": false
        },
        {
          "name": "SQLite",
          "language": null,
          "reasoning": "SQLite is a lightweight, file-based database that is easy to set up and use. It's a good choice for small applications or prototypes where a full-fledged database is not needed. It's suitable for this simple task list application.",
          "key_libraries": [
            "sqlite3 (built-in for Python)",
            "sqlite3 (for Node.js)",
            "JDBC driver (for Java)"
          ],
          "pros": [
            "Easy to set up and use.",
            "No server required.",
            "Good for small applications.",
            "File-based."
          ],
          "cons": [
            "Not suitable for high-traffic applications.",
            "Limited scalability.",
            "Not ideal for concurrent access."
          ],
          "selected": false
        }
      ],
      "cloud_options": [
        {
          "name": "AWS (Amazon Web Services)",
          "language": null,
          "reasoning": "AWS provides a comprehensive suite of services for deploying and managing web applications. It offers scalability, reliability, and a wide range of options for compute, storage, and databases. AWS is a good choice for a production environment.",
          "key_libraries": [
            "AWS SDK (for interacting with AWS services)"
          ],
          "pros": [
            "Highly scalable and reliable.",
            "Wide range of services.",
            "Mature platform.",
            "Global infrastructure."
          ],
          "cons": [
            "Can be complex to manage.",
            "Can be expensive depending on usage.",
            "Steeper learning curve."
          ],
          "selected": false
        },
        {
          "name": "Google Cloud Platform (GCP)",
          "language": null,
          "reasoning": "GCP offers a similar set of services to AWS, with a focus on data analytics and machine learning. It's a good choice for applications that require these capabilities. GCP is a strong contender for cloud deployment.",
          "key_libraries": [
            "Google Cloud Client Libraries (for interacting with GCP services)"
          ],
          "pros": [
            "Strong in data analytics and machine learning.",
            "Competitive pricing.",
            "Global infrastructure.",
            "User-friendly interface."
          ],
          "cons": [
            "Can be complex to manage.",
            "Can be expensive depending on usage.",
            "Steeper learning curve."
          ],
          "selected": false
        },
        {
          "name": "Heroku",
          "language": null,
          "reasoning": "Heroku is a Platform-as-a-Service (PaaS) that simplifies the deployment and management of web applications. It's a good choice for small to medium-sized applications where ease of deployment is a priority. It abstracts away much of the infrastructure management.",
          "key_libraries": [],
          "pros": [
            "Easy to deploy and manage.",
            "Focus on developer experience.",
            "Good for small to medium-sized applications.",
            "Automated scaling."
          ],
          "cons": [
            "Limited control over infrastructure.",
            "Can be more expensive than other options.",
            "Vendor lock-in."
          ],
          "selected": false
        }
      ],
      "architecture_options": [
        {
          "pattern": "Monolithic Architecture",
          "scalability_score": 5.0,
          "maintainability_score": 6.0,
          "development_speed_score": 8.0,
          "overall_score": 7.0,
          "reasoning": "For a simple task list application, a monolithic architecture is a good starting point. It's easier to develop and deploy initially. All components (frontend, backend, database) are bundled into a single unit. While it can become harder to scale and maintain as the application grows, it's suitable for the project's scope."
        },
        {
          "pattern": "Microservices Architecture",
          "scalability_score": 8.0,
          "maintainability_score": 7.0,
          "development_speed_score": 4.0,
          "overall_score": 6.0,
          "reasoning": "Microservices architecture involves breaking down the application into smaller, independent services. While this architecture offers better scalability and maintainability, it introduces more complexity in terms of development, deployment, and management. It's likely overkill for this simple application."
        },
        {
          "pattern": "Serverless Architecture",
          "scalability_score": 9.0,
          "maintainability_score": 7.0,
          "development_speed_score": 6.0,
          "overall_score": 7.0,
          "reasoning": "Serverless architecture involves using cloud services (e.g., AWS Lambda, Google Cloud Functions) to execute code without managing servers. This can lead to excellent scalability and cost efficiency. However, it can introduce complexities in debugging and monitoring. It's a viable option, but might be more complex to set up initially than a monolithic approach."
        }
      ],
      "tool_options": [
        {
          "name": "Git",
          "language": null,
          "reasoning": "Git is a distributed version control system that is essential for managing code changes, collaborating with others, and tracking the history of the project. It's a standard tool for software development.",
          "key_libraries": [],
          "pros": [
            "Version control.",
            "Collaboration.",
            "Branching and merging.",
            "Tracking changes."
          ],
          "cons": [
            "Learning curve for beginners.",
            "Can be complex for advanced usage."
          ],
          "selected": false
        },
        {
          "name": "VS Code",
          "language": null,
          "reasoning": "VS Code is a popular and versatile code editor with excellent support for various programming languages and frameworks. It offers features like code completion, debugging, and integrated terminal, making it a great choice for development.",
          "key_libraries": [],
          "pros": [
            "Free and open-source.",
            "Extensible with plugins.",
            "Good support for various languages.",
            "Integrated terminal and debugger."
          ],
          "cons": [
            "Can be resource-intensive with many extensions.",
            "Requires some configuration."
          ],
          "selected": false
        },
        {
          "name": "Postman",
          "language": null,
          "reasoning": "Postman is a popular tool for testing APIs. It allows developers to send HTTP requests, inspect responses, and organize API calls. It's useful for testing the backend API.",
          "key_libraries": [],
          "pros": [
            "Easy to use for testing APIs.",
            "Organize API calls.",
            "Inspect responses.",
            "Collaboration features."
          ],
          "cons": [
            "Can be limited for complex testing scenarios.",
            "Requires a Postman account for collaboration."
          ],
          "selected": false
        }
      ],
      "risks": [
        {
          "category": "Security",
          "description": "Vulnerabilities in the application's code or dependencies could lead to security breaches, such as data theft or unauthorized access. This is a risk for all web applications.",
          "severity": "High",
          "likelihood": "Medium",
          "mitigation": "Implement secure coding practices, regularly update dependencies, use secure authentication and authorization mechanisms, and conduct security audits."
        },
        {
          "category": "Performance",
          "description": "Slow loading times or poor performance can lead to a negative user experience. This is especially important given the requirement for quick loading.",
          "severity": "Medium",
          "likelihood": "Medium",
          "mitigation": "Optimize code for performance, use caching, minimize HTTP requests, and use a content delivery network (CDN)."
        },
        {
          "category": "Scalability",
          "description": "The application may not be able to handle an increase in users or data volume, leading to performance degradation or downtime. This is less of a concern for a simple application, but still a consideration.",
          "severity": "Low",
          "likelihood": "Low",
          "mitigation": "Design the application with scalability in mind, use a scalable database, and consider using a cloud platform that offers auto-scaling."
        }
      ],
      "synthesis": {
        "backend": {
          "language": "JavaScript",
          "framework": "Node.js with Express",
          "reasoning": "Node.js with Express offers a lightweight and efficient backend solution. The use of JavaScript on both the frontend and backend simplifies development and deployment."
        },
        "frontend": {
          "language": "JavaScript",
          "framework": "React",
          "reasoning": "React provides a good balance of ease of use, performance, and a large community. It's well-suited for building interactive user interfaces and meets the requirements for a fast-loading application."
        },
        "database": {
          "type": "PostgreSQL",
          "reasoning": "PostgreSQL provides a reliable and robust database solution with strong data integrity, suitable for storing task data."
        },
        "architecture_pattern": "Monolithic Architecture",
        "deployment_environment": {
          "cloud_provider": "AWS",
          "reasoning": "AWS provides a comprehensive suite of services for deploying and managing web applications, offering scalability, reliability, and a wide range of options."
        },
        "key_libraries_tools": [
          {
            "name": "React Router",
            "purpose": "For navigation in the React frontend."
          },
          {
            "name": "Axios",
            "purpose": "For making API calls from the frontend."
          },
          {
            "name": "Express.js",
            "purpose": "For building the backend API."
          },
          {
            "name": "Postman",
            "purpose": "For testing the API."
          },
          {
            "name": "Git",
            "purpose": "For version control."
          },
          {
            "name": "VS Code",
            "purpose": "For code editing."
          }
        ],
        "estimated_complexity": "Low"
      },
      "selected_stack": null
    },
    "system_design": {
      "architecture": {
        "pattern": "Monolithic Architecture",
        "justification": "For a simple task list application, a monolithic architecture is a good starting point. It's easier to develop and deploy initially. All components (frontend, backend, database) are bundled into a single unit. While it can become harder to scale and maintain as the application grows, it's suitable for the project's scope.",
        "key_benefits": [
          "Faster initial development.",
          "Simpler deployment.",
          "Easier to manage for a small application."
        ],
        "potential_drawbacks": [
          "Can become harder to scale as the application grows.",
          "Tight coupling between components.",
          "Difficult to adopt new technologies in parts of the application."
        ]
      },
      "components": [
        {
          "name": "Frontend",
          "description": "The user interface for interacting with the task list.",
          "category": "frontend",
          "technologies": [
            "React",
            "JavaScript",
            "HTML",
            "CSS"
          ],
          "dependencies": [
            "Backend API"
          ],
          "responsibilities": [
            "Displaying the task list.",
            "Allowing users to add new tasks.",
            "Handling user interactions.",
            "Making API calls to the backend."
          ],
          "design_patterns": [
            "Component-based architecture"
          ]
        },
        {
          "name": "Backend API",
          "description": "Provides an API for the frontend to interact with the task data.",
          "category": "backend",
          "technologies": [
            "Node.js",
            "Express.js",
            "JavaScript"
          ],
          "dependencies": [
            "Database"
          ],
          "responsibilities": [
            "Handling API requests.",
            "Validating data.",
            "Interacting with the database.",
            "Returning data to the frontend."
          ],
          "design_patterns": [
            "RESTful API"
          ]
        },
        {
          "name": "Database",
          "description": "Stores the task data.",
          "category": "backend",
          "technologies": [
            "PostgreSQL"
          ],
          "dependencies": [],
          "responsibilities": [
            "Storing task data.",
            "Providing data access to the backend API."
          ],
          "design_patterns": [
            "Relational Database"
          ]
        },
        {
          "name": "Deployment Infrastructure",
          "description": "Infrastructure for hosting and running the application.",
          "category": "infrastructure",
          "technologies": [
            "AWS (EC2, RDS, S3, etc.)",
            "Docker (optional)"
          ],
          "dependencies": [
            "Frontend",
            "Backend API",
            "Database"
          ],
          "responsibilities": [
            "Hosting the frontend application.",
            "Running the backend API.",
            "Managing the database.",
            "Ensuring the application is accessible."
          ],
          "design_patterns": [
            "Cloud-based deployment"
          ]
        }
      ],
      "data_model": {
        "schema_type": "Relational",
        "tables": [
          {
            "name": "tasks",
            "purpose": "Stores information about each task.",
            "fields": [
              {
                "name": "id",
                "type": "SERIAL",
                "constraints": [
                  "PRIMARY KEY"
                ],
                "description": "Unique identifier for the task."
              },
              {
                "name": "description",
                "type": "TEXT",
                "constraints": [
                  "NOT NULL"
                ],
                "description": "The text description of the task."
              },
              {
                "name": "created_at",
                "type": "TIMESTAMP",
                "constraints": [
                  "NOT NULL",
                  "DEFAULT CURRENT_TIMESTAMP"
                ],
                "description": "The timestamp when the task was created."
              },
              {
                "name": "completed",
                "type": "BOOLEAN",
                "constraints": [
                  "NOT NULL",
                  "DEFAULT FALSE"
                ],
                "description": "Indicates whether the task is completed."
              }
            ],
            "relationships": []
          }
        ],
        "relationships": [],
        "justification": "Relational database provides strong data integrity and is suitable for storing structured task data."
      },
      "api_endpoints": {
        "style": "REST",
        "base_url": "/api/v1",
        "authentication": "None (for simplicity, no authentication is required for this basic application)",
        "endpoints": [
          {
            "method": "POST",
            "path": "/tasks",
            "purpose": "Create a new task.",
            "parameters": [
              {
                "description": "The task description",
                "type": "string",
                "name": "description"
              }
            ],
            "response": {
              "status": 201,
              "body": {
                "id": 1,
                "description": "Buy groceries",
                "created_at": "2024-10-27T10:00:00.000Z",
                "completed": false
              }
            },
            "authentication_required": false,
            "rate_limiting_applied": false
          },
          {
            "method": "GET",
            "path": "/tasks",
            "purpose": "Get all tasks.",
            "parameters": [],
            "response": {
              "status": 200,
              "body": [
                {
                  "id": 1,
                  "description": "Buy groceries",
                  "created_at": "2024-10-27T10:00:00.000Z",
                  "completed": false
                },
                {
                  "id": 2,
                  "description": "Do laundry",
                  "created_at": "2024-10-27T10:05:00.000Z",
                  "completed": true
                }
              ]
            },
            "authentication_required": false,
            "rate_limiting_applied": false
          },
          {
            "method": "PUT",
            "path": "/tasks/{id}",
            "purpose": "Update a task (e.g., mark as complete).",
            "parameters": [
              {
                "name": "id",
                "type": "integer",
                "description": "The ID of the task to update."
              },
              {
                "name": "completed",
                "type": "boolean",
                "description": "Whether the task is completed"
              }
            ],
            "response": {
              "status": 200,
              "body": {
                "id": 1,
                "description": "Buy groceries",
                "created_at": "2024-10-27T10:00:00.000Z",
                "completed": true
              }
            },
            "authentication_required": false,
            "rate_limiting_applied": false
          },
          {
            "method": "DELETE",
            "path": "/tasks/{id}",
            "purpose": "Delete a task.",
            "parameters": [
              {
                "name": "id",
                "type": "integer",
                "description": "The ID of the task to delete."
              }
            ],
            "response": {
              "status": 204,
              "body": null
            },
            "authentication_required": false,
            "rate_limiting_applied": false
          }
        ],
        "error_handling": "Standard HTTP status codes and JSON responses for errors.",
        "rate_limiting_strategy": null
      },
      "security": {
        "authentication_method": "None (for simplicity)",
        "authorization_strategy": "None (for simplicity)",
        "data_encryption": {
          "at_rest": "Not applicable (for simplicity, no sensitive data is stored)",
          "in_transit": "HTTPS (SSL/TLS) is recommended for production environments to encrypt data in transit."
        },
        "security_measures": [
          {
            "category": "Input Validation",
            "implementation": "Validate all user inputs on the backend to prevent injection attacks (e.g., SQL injection, cross-site scripting).",
            "mitigation": "Prevents injection attacks.",
            "priority": "High"
          },
          {
            "category": "Dependency Management",
            "implementation": "Regularly update dependencies to the latest versions to patch security vulnerabilities.",
            "mitigation": "Addresses vulnerabilities in third-party libraries.",
            "priority": "High"
          },
          {
            "category": "HTTPS",
            "implementation": "Enforce HTTPS for all communication between the frontend and backend.",
            "mitigation": "Encrypts data in transit, preventing eavesdropping and man-in-the-middle attacks.",
            "priority": "High"
          },
          {
            "category": "Authentication (Future)",
            "implementation": "Implement authentication (e.g., JWT, OAuth) if user accounts are added in the future.",
            "mitigation": "Protects user accounts and data.",
            "priority": "Medium"
          },
          {
            "category": "Authorization (Future)",
            "implementation": "Implement authorization (e.g., RBAC) if different user roles are added in the future.",
            "mitigation": "Controls access to resources based on user roles.",
            "priority": "Medium"
          }
        ],
        "vulnerability_mitigation_strategies": [
          "Input validation",
          "Regular dependency updates",
          "Use of HTTPS",
          "Secure coding practices"
        ],
        "compliance_standards": []
      },
      "scalability_and_performance": {
        "frontend_optimization": "Optimize React components for performance (e.g., memoization, code splitting).",
        "backend_optimization": "Use efficient database queries and caching.",
        "caching": "Implement caching mechanisms (e.g., server-side caching) to reduce database load.",
        "cdn": "Use a CDN to serve static assets (e.g., JavaScript, CSS, images) to improve loading times."
      },
      "deployment_strategy": {
        "environment": "AWS (EC2, RDS, S3, etc.) or Heroku",
        "frontend_deployment": "Deploy the React frontend to a service like AWS S3 or Netlify/Vercel.",
        "backend_deployment": "Deploy the Node.js backend to a service like AWS EC2, Heroku, or AWS Elastic Beanstalk.",
        "database_deployment": "Deploy the PostgreSQL database to AWS RDS or Heroku Postgres.",
        "ci_cd": "Implement a CI/CD pipeline for automated builds and deployments (e.g., using GitHub Actions or AWS CodePipeline)."
      },
      "monitoring_and_logging": {
        "logging": "Implement logging for both frontend and backend (e.g., using Winston or similar libraries).",
        "monitoring": "Monitor application performance and errors using tools like AWS CloudWatch or similar services.",
        "error_tracking": "Use an error tracking service (e.g., Sentry) to capture and analyze errors."
      },
      "error_handling_strategy": "Use standard HTTP status codes and return informative error messages in JSON format. Implement centralized error handling in both frontend and backend.",
      "development_phases_overview": [
        {
          "name": "Setup & Environment",
          "description": "Setting up the development environment, including installing necessary tools and dependencies.",
          "priority": "High",
          "dependencies": [],
          "tasks": [
            "Install Node.js and npm.",
            "Install PostgreSQL.",
            "Set up a code editor (VS Code).",
            "Initialize a Git repository."
          ],
          "estimated_duration": "1 day"
        },
        {
          "name": "Backend Development",
          "description": "Developing the backend API using Node.js and Express.",
          "priority": "High",
          "dependencies": [
            "Setup & Environment"
          ],
          "tasks": [
            "Create the Express.js application.",
            "Define API endpoints (POST /tasks, GET /tasks, PUT /tasks/{id}, DELETE /tasks/{id}).",
            "Implement database interactions using a PostgreSQL client (e.g., pg or node-postgres).",
            "Implement data validation.",
            "Implement error handling."
          ],
          "estimated_duration": "3 days"
        },
        {
          "name": "Database Setup",
          "description": "Setting up the PostgreSQL database and defining the schema.",
          "priority": "High",
          "dependencies": [
            "Backend Development"
          ],
          "tasks": [
            "Create the database.",
            "Define the 'tasks' table.",
            "Create necessary indexes."
          ],
          "estimated_duration": "1 day"
        },
        {
          "name": "Frontend Development",
          "description": "Developing the frontend using React.",
          "priority": "High",
          "dependencies": [
            "Backend Development"
          ],
          "tasks": [
            "Set up a React application (using Create React App or similar).",
            "Design the UI for adding and displaying tasks.",
            "Implement API calls to the backend using Axios.",
            "Handle user input and display task data."
          ],
          "estimated_duration": "4 days"
        },
        {
          "name": "Testing",
          "description": "Testing the application to ensure it meets the requirements.",
          "priority": "High",
          "dependencies": [
            "Frontend Development",
            "Backend Development"
          ],
          "tasks": [
            "Write unit tests for backend API endpoints.",
            "Write unit tests for React components.",
            "Perform integration tests to verify the interaction between frontend and backend.",
            "Perform manual testing to ensure the application functions correctly."
          ],
          "estimated_duration": "2 days"
        },
        {
          "name": "Deployment",
          "description": "Deploying the application to a cloud platform (e.g., AWS, Heroku).",
          "priority": "High",
          "dependencies": [
            "Testing"
          ],
          "tasks": [
            "Set up the deployment environment.",
            "Configure the database.",
            "Deploy the backend API.",
            "Deploy the frontend application.",
            "Configure DNS and SSL (if applicable)."
          ],
          "estimated_duration": "2 days"
        },
        {
          "name": "Monitoring & Maintenance",
          "description": "Monitoring the application and performing maintenance tasks.",
          "priority": "Medium",
          "dependencies": [
            "Deployment"
          ],
          "tasks": [
            "Set up monitoring and logging.",
            "Monitor application performance and errors.",
            "Apply security updates.",
            "Perform regular backups."
          ],
          "estimated_duration": "Ongoing"
        }
      ],
      "key_risks": [
        "Security vulnerabilities (e.g., XSS, SQL injection).",
        "Performance issues (e.g., slow loading times).",
        "Scalability limitations.",
        "Deployment issues."
      ],
      "design_justification": "The design prioritizes simplicity and ease of development, while still addressing the non-functional requirements for speed and security. The monolithic architecture, combined with the chosen technologies, allows for rapid development and deployment. The use of a relational database ensures data integrity. The security measures are implemented to protect the application from common vulnerabilities. The deployment strategy provides a scalable and reliable environment for the application.",
      "data_flow": "1. User interacts with the React frontend (e.g., adds a task). 2. Frontend sends a POST request to the backend API (/tasks). 3. Backend API receives the request, validates the data, and interacts with the PostgreSQL database to store the task. 4. Database stores the task data. 5. Backend API returns a success response (e.g., 201 Created) to the frontend. 6. Frontend updates the UI to display the new task. 7. When the user requests the task list, the frontend sends a GET request to the backend API (/tasks). 8. Backend API retrieves the tasks from the PostgreSQL database. 9. Backend API returns the task data to the frontend. 10. Frontend displays the task list."
    },
    "implementation_plan": "plan=ImplementationPlan(project_summary={'title': 'Generated Project Plan', 'description': 'Develop a simple task list web application using React for the frontend, Node.js with Express for the backend, and PostgreSQL for the database. The application will allow users to add and view tasks. The application will be deployed to AWS (or Heroku) with HTTPS enabled.', 'overall_complexity': 'Medium', 'estimated_duration': 'TBD', 'key_challenges': [], 'success_criteria': []}, phases=[{'name': 'Frontend Phase', 'description': 'Tasks related to frontend phase', 'deliverables': ['Completed FE-001', 'Completed FE-002', 'Completed FE-003', 'Completed FE-004', 'Completed FE-005', 'Completed FE-006', 'Completed FE-007', 'Completed FE-008', 'Completed IT-005'], 'estimated_duration_hours': 24.0, 'work_items': [{'id': 'FE-001', 'description': 'Set up React project using Create React App.', 'dependencies': [], 'estimated_time': '4 hours', 'agent_role': 'frontend_developer', 'acceptance_criteria': ['Project initializes successfully.', 'Default React app runs without errors.'], 'status': 'pending', 'code_files': ['package.json', 'src/App.js', 'src/index.js']}, {'id': 'FE-002', 'description': 'Install Axios for API calls.', 'dependencies': ['FE-001'], 'estimated_time': '1 hour', 'agent_role': 'frontend_developer', 'acceptance_criteria': ['Axios is installed as a project dependency.', 'Can import Axios in a React component.'], 'status': 'pending', 'code_files': ['package.json']}, {'id': 'FE-003', 'description': 'Create a basic task input form (text field and add button).', 'dependencies': ['FE-001'], 'estimated_time': '3 hours', 'agent_role': 'frontend_developer', 'acceptance_criteria': ['Form renders correctly.', 'Text field accepts user input.', 'Add button is present.'], 'status': 'pending', 'code_files': ['src/App.js', 'src/App.css']}, {'id': 'FE-004', 'description': 'Implement state to store the task description from the input field.', 'dependencies': ['FE-003'], 'estimated_time': '2 hours', 'agent_role': 'frontend_developer', 'acceptance_criteria': ['Task description is stored in component state.', 'Input field updates state on change.'], 'status': 'pending', 'code_files': ['src/App.js']}, {'id': 'FE-005', 'description': 'Create a function to handle adding a new task (API call to backend).', 'dependencies': ['FE-002', 'FE-004'], 'estimated_time': '4 hours', 'agent_role': 'frontend_developer', 'acceptance_criteria': ['API call is made to /tasks on button click.', 'Task description is sent in the request body.', 'Error handling for API call is implemented (e.g., display error message).'], 'status': 'pending', 'code_files': ['src/App.js']}, {'id': 'FE-006', 'description': 'Display the list of tasks fetched from the backend.', 'dependencies': ['FE-005'], 'estimated_time': '4 hours', 'agent_role': 'frontend_developer', 'acceptance_criteria': ['Tasks are fetched from /tasks on component mount.', 'Tasks are displayed in a list format.', 'Tasks are displayed correctly (description, created_at, completed).'], 'status': 'pending', 'code_files': ['src/App.js']}, {'id': 'FE-007', 'description': 'Implement a loading indicator while fetching tasks.', 'dependencies': ['FE-006'], 'estimated_time': '2 hours', 'agent_role': 'frontend_developer', 'acceptance_criteria': ['Loading indicator displays while fetching tasks.', 'Loading indicator hides after tasks are fetched.'], 'status': 'pending', 'code_files': ['src/App.js', 'src/App.css']}, {'id': 'FE-008', 'description': 'Implement basic styling for the task list and form.', 'dependencies': ['FE-003', 'FE-006'], 'estimated_time': '3 hours', 'agent_role': 'frontend_developer', 'acceptance_criteria': ['UI is visually appealing.', 'Tasks are clearly displayed.', 'Form is styled.'], 'status': 'pending', 'code_files': ['src/App.css', 'src/App.js']}, {'id': 'IT-005', 'description': \"Test the frontend's interaction with the backend (add task, view tasks).\", 'dependencies': ['FE-001', 'FE-002', 'FE-003', 'FE-004', 'FE-005', 'FE-006', 'BE-004', 'BE-005'], 'estimated_time': '2 hours', 'agent_role': 'frontend_developer', 'acceptance_criteria': ['User can add a task via the form.', 'New task appears in the task list.', 'Task list displays correctly.', 'Error messages are displayed correctly (if any).'], 'status': 'pending', 'code_files': []}]}, {'name': 'Backend Phase', 'description': 'Tasks related to backend phase', 'deliverables': ['Completed BE-001', 'Completed BE-002', 'Completed BE-004', 'Completed BE-005', 'Completed BE-006', 'Completed BE-007', 'Completed BE-008', 'Completed IT-001', 'Completed IT-002', 'Completed IT-003', 'Completed IT-004'], 'estimated_duration_hours': 21.0, 'work_items': [{'id': 'BE-001', 'description': 'Set up Node.js project and install Express.', 'dependencies': [], 'estimated_time': '3 hours', 'agent_role': 'backend_developer', 'acceptance_criteria': ['Project initializes successfully.', 'Express is installed as a project dependency.', 'Basic Express server runs without errors.'], 'status': 'pending', 'code_files': ['package.json', 'index.js']}, {'id': 'BE-002', 'description': 'Install and configure PostgreSQL client (e.g., pg or node-postgres).', 'dependencies': ['BE-001'], 'estimated_time': '2 hours', 'agent_role': 'backend_developer', 'acceptance_criteria': ['PostgreSQL client is installed as a project dependency.', 'Can connect to the PostgreSQL database.'], 'status': 'pending', 'code_files': ['package.json', 'index.js']}, {'id': 'BE-004', 'description': 'Implement the POST /tasks endpoint (create a new task).', 'dependencies': ['BE-002', 'BE-003'], 'estimated_time': '4 hours', 'agent_role': 'backend_developer', 'acceptance_criteria': ['Endpoint handles POST requests to /tasks.', 'Task description is extracted from the request body.', 'Task is inserted into the database.', \"Returns 201 Created with the new task's data in the response body.\", 'Input validation is implemented (description is required).'], 'status': 'pending', 'code_files': ['index.js']}, {'id': 'BE-005', 'description': 'Implement the GET /tasks endpoint (get all tasks).', 'dependencies': ['BE-002', 'BE-003'], 'estimated_time': '3 hours', 'agent_role': 'backend_developer', 'acceptance_criteria': ['Endpoint handles GET requests to /tasks.', 'Retrieves all tasks from the database.', 'Returns 200 OK with the task list in the response body.', 'Tasks are returned in the correct format.'], 'status': 'pending', 'code_files': ['index.js']}, {'id': 'BE-006', 'description': 'Implement the PUT /tasks/{id} endpoint (update a task).', 'dependencies': ['BE-002', 'BE-003'], 'estimated_time': '4 hours', 'agent_role': 'backend_developer', 'acceptance_criteria': ['Endpoint handles PUT requests to /tasks/{id}.', 'Task ID is extracted from the URL parameters.', 'Task is updated in the database (e.g., mark as complete).', 'Returns 200 OK with the updated task data in the response body.', 'Handles task not found (404).'], 'status': 'pending', 'code_files': ['index.js']}, {'id': 'BE-007', 'description': 'Implement the DELETE /tasks/{id} endpoint (delete a task).', 'dependencies': ['BE-002', 'BE-003'], 'estimated_time': '3 hours', 'agent_role': 'backend_developer', 'acceptance_criteria': ['Endpoint handles DELETE requests to /tasks/{id}.', 'Task ID is extracted from the URL parameters.', 'Task is deleted from the database.', 'Returns 204 No Content on success.', 'Handles task not found (404).'], 'status': 'pending', 'code_files': ['index.js']}, {'id': 'BE-008', 'description': 'Implement basic error handling for API endpoints.', 'dependencies': ['BE-004', 'BE-005', 'BE-006', 'BE-007'], 'estimated_time': '2 hours', 'agent_role': 'backend_developer', 'acceptance_criteria': ['Handles database connection errors.', 'Handles input validation errors.', 'Returns appropriate HTTP status codes for errors (e.g., 400, 404, 500).', 'Returns error messages in JSON format.'], 'status': 'pending', 'code_files': ['index.js']}, {'id': 'IT-001', 'description': 'Test the POST /tasks endpoint using Postman.', 'dependencies': ['BE-004'], 'estimated_time': '1 hour', 'agent_role': 'backend_developer', 'acceptance_criteria': ['Endpoint returns 201 Created on successful task creation.', 'Endpoint returns the correct task data in the response body.', 'Endpoint handles invalid input correctly (e.g., missing description).', 'Endpoint handles database errors correctly.'], 'status': 'pending', 'code_files': []}, {'id': 'IT-002', 'description': 'Test the GET /tasks endpoint using Postman.', 'dependencies': ['BE-005', 'IT-001'], 'estimated_time': '1 hour', 'agent_role': 'backend_developer', 'acceptance_criteria': ['Endpoint returns 200 OK.', 'Endpoint returns the correct list of tasks.', 'Endpoint handles database errors correctly.'], 'status': 'pending', 'code_files': []}, {'id': 'IT-003', 'description': 'Test the PUT /tasks/{id} endpoint using Postman.', 'dependencies': ['BE-006', 'IT-001', 'IT-002'], 'estimated_time': '1 hour', 'agent_role': 'backend_developer', 'acceptance_criteria': ['Endpoint returns 200 OK on successful update.', 'Endpoint returns the updated task data.', 'Endpoint handles task not found (404).', 'Endpoint handles invalid input correctly.', 'Endpoint handles database errors correctly.'], 'status': 'pending', 'code_files': []}, {'id': 'IT-004', 'description': 'Test the DELETE /tasks/{id} endpoint using Postman.', 'dependencies': ['BE-007', 'IT-001', 'IT-002', 'IT-003'], 'estimated_time': '1 hour', 'agent_role': 'backend_developer', 'acceptance_criteria': ['Endpoint returns 204 No Content on successful deletion.', 'Endpoint handles task not found (404).', 'Endpoint handles database errors correctly.'], 'status': 'pending', 'code_files': []}]}, {'name': 'Database Phase', 'description': 'Tasks related to database phase', 'deliverables': ['Completed BE-003'], 'estimated_duration_hours': 2.0, 'work_items': [{'id': 'BE-003', 'description': \"Create a PostgreSQL database and 'tasks' table.\", 'dependencies': [], 'estimated_time': '2 hours', 'agent_role': 'database_specialist', 'acceptance_criteria': ['Database is created.', \"'tasks' table exists with 'id', 'description', 'created_at', and 'completed' columns.\", 'id is SERIAL and PRIMARY KEY.', 'description is TEXT NOT NULL.', 'created_at is TIMESTAMP DEFAULT CURRENT_TIMESTAMP NOT NULL.', 'completed is BOOLEAN DEFAULT FALSE NOT NULL.'], 'status': 'pending', 'code_files': []}]}, {'name': 'Devops_Engineer Phase', 'description': 'Tasks related to devops_engineer phase', 'deliverables': ['Completed DP-001', 'Completed DP-002', 'Completed DP-003'], 'estimated_duration_hours': 9.0, 'work_items': [{'id': 'DP-001', 'description': 'Deploy backend to AWS EC2 (or Heroku).', 'dependencies': ['BE-001', 'BE-002', 'BE-003', 'BE-004', 'BE-005', 'BE-006', 'BE-007', 'BE-008'], 'estimated_time': '4 hours', 'agent_role': 'devops_engineer', 'acceptance_criteria': ['Backend API is accessible via a public URL.', 'Database is configured correctly.', 'API endpoints function as expected.'], 'status': 'pending', 'code_files': []}, {'id': 'DP-002', 'description': 'Deploy frontend to AWS S3 (or Netlify/Vercel).', 'dependencies': ['FE-001', 'FE-002', 'FE-003', 'FE-004', 'FE-005', 'FE-006', 'FE-007', 'FE-008'], 'estimated_time': '3 hours', 'agent_role': 'devops_engineer', 'acceptance_criteria': ['Frontend is accessible via a public URL.', 'Frontend correctly calls the backend API.', 'Application functions as expected.'], 'status': 'pending', 'code_files': []}, {'id': 'DP-003', 'description': 'Configure HTTPS for the deployed application.', 'dependencies': ['DP-001', 'DP-002'], 'estimated_time': '2 hours', 'agent_role': 'devops_engineer', 'acceptance_criteria': ['Application is served over HTTPS.', 'SSL certificate is valid.'], 'status': 'pending', 'code_files': []}]}], resource_allocation=[{'role': 'Database Specialist', 'count': 1, 'estimated_time_allocation': '100%', 'phases': ['Database Phase'], 'skills_required': []}, {'role': 'Backend Developer', 'count': 1, 'estimated_time_allocation': '100%', 'phases': ['Backend Phase'], 'skills_required': []}, {'role': 'Frontend Developer', 'count': 1, 'estimated_time_allocation': '100%', 'phases': ['Frontend Phase'], 'skills_required': []}, {'role': 'Devops Engineer', 'count': 1, 'estimated_time_allocation': '100%', 'phases': ['Devops_Engineer Phase'], 'skills_required': []}], risks_and_mitigations=[], timeline={'start_date': '2025-07-08T14:10:33.454634', 'end_date': 'TBD', 'milestones': []}, tech_stack={}, metadata={'generated_at': '2025-07-08T14:10:33.454634', 'version': '1.0', 'author': 'Multi-AI Dev System', 'tags': [], 'notes': 'Converted from WorkItemBacklog. Original summary: Develop a simple task list web application using React for the frontend, Node.js with Express for the backend, and PostgreSQL for the database. The application will allow users to add and view tasks. The application will be deployed to AWS (or Heroku) with HTTPS enabled.'}) summary='Develop a simple task list web application using React for the frontend, Node.js with Express for the backend, and PostgreSQL for the database. The application will allow users to add and view tasks. The application will be deployed to AWS (or Heroku) with HTTPS enabled.' metadata=PlanMetadata(generated_at='2025-07-08T14:10:33.454634', version='1.0', author='Multi-AI Dev System', tags=[], notes='Converted from WorkItemBacklog. Original summary: Develop a simple task list web application using React for the frontend, Node.js with Express for the backend, and PostgreSQL for the database. The application will allow users to add and view tasks. The application will be deployed to AWS (or Heroku) with HTTPS enabled.')"
  }
}