{
  "session_id": "session_02162939-ea6a-4bc4-b8e0-0a1d685e7320",
  "approval_type": "implementation_plan",
  "timestamp": 1752029743,
  "approval_data": {
    "type": "implementation_plan",
    "timestamp": 1752029742.998237,
    "project_overview": "Develop a simple web application for managing a list of tasks, allowing users to add and view tasks. The application will use React for the frontend, Node.js/Express for the backend, and PostgreSQL for data storage. It will be deployed on Heroku.",
    "development_phases": [
      {
        "name": "Frontend Phase",
        "description": "Tasks related to frontend phase",
        "deliverables": [
          "Completed FE-001",
          "Completed FE-002",
          "Completed FE-003",
          "Completed FE-004",
          "Completed FE-005",
          "Completed FE-006",
          "Completed FE-007",
          "Completed TEST-001",
          "Completed FE-008"
        ],
        "estimated_duration_hours": 48.0,
        "work_items": [
          {
            "id": "FE-001",
            "description": "Set up React project using Create React App.",
            "dependencies": [],
            "estimated_time": "4 hours",
            "agent_role": "frontend_developer",
            "acceptance_criteria": [
              "Project is initialized successfully.",
              "Default React app runs without errors."
            ],
            "status": "pending",
            "code_files": [
              "package.json",
              "src/App.js",
              "src/index.js"
            ]
          },
          {
            "id": "FE-002",
            "description": "Design and implement the basic UI layout (header, main content area).",
            "dependencies": [
              "FE-001"
            ],
            "estimated_time": "4 hours",
            "agent_role": "frontend_developer",
            "acceptance_criteria": [
              "UI layout is responsive.",
              "Header and main content area are displayed."
            ],
            "status": "pending",
            "code_files": [
              "src/App.js",
              "src/App.css"
            ]
          },
          {
            "id": "FE-003",
            "description": "Implement the task input form (text input and add button).",
            "dependencies": [
              "FE-002"
            ],
            "estimated_time": "4 hours",
            "agent_role": "frontend_developer",
            "acceptance_criteria": [
              "Form is displayed correctly.",
              "Input field accepts text.",
              "Add button is present."
            ],
            "status": "pending",
            "code_files": [
              "src/App.js",
              "src/App.css"
            ]
          },
          {
            "id": "FE-004",
            "description": "Implement the display of the task list (initially, hardcoded data).",
            "dependencies": [
              "FE-002"
            ],
            "estimated_time": "4 hours",
            "agent_role": "frontend_developer",
            "acceptance_criteria": [
              "Task list is displayed.",
              "Hardcoded task data is rendered correctly."
            ],
            "status": "pending",
            "code_files": [
              "src/App.js",
              "src/App.css"
            ]
          },
          {
            "id": "FE-005",
            "description": "Connect frontend to backend API for adding tasks.",
            "dependencies": [
              "FE-003",
              "BE-002",
              "BE-005"
            ],
            "estimated_time": "8 hours",
            "agent_role": "frontend_developer",
            "acceptance_criteria": [
              "Frontend sends POST requests to /api/tasks.",
              "Tasks are successfully added to the database via the frontend."
            ],
            "status": "pending",
            "code_files": [
              "src/App.js"
            ]
          },
          {
            "id": "FE-006",
            "description": "Connect frontend to backend API for retrieving tasks.",
            "dependencies": [
              "FE-004",
              "BE-003",
              "BE-006"
            ],
            "estimated_time": "8 hours",
            "agent_role": "frontend_developer",
            "acceptance_criteria": [
              "Frontend fetches tasks from /api/tasks.",
              "Task list is dynamically updated with data from the backend."
            ],
            "status": "pending",
            "code_files": [
              "src/App.js"
            ]
          },
          {
            "id": "FE-007",
            "description": "Implement basic input validation on the frontend.",
            "dependencies": [
              "FE-005"
            ],
            "estimated_time": "4 hours",
            "agent_role": "frontend_developer",
            "acceptance_criteria": [
              "Empty task descriptions are not submitted.",
              "Error messages are displayed to the user."
            ],
            "status": "pending",
            "code_files": [
              "src/App.js"
            ]
          },
          {
            "id": "TEST-001",
            "description": "Write unit tests for frontend components.",
            "dependencies": [
              "FE-001",
              "FE-002",
              "FE-003",
              "FE-004",
              "FE-005",
              "FE-006",
              "FE-007"
            ],
            "estimated_time": "8 hours",
            "agent_role": "frontend_developer",
            "acceptance_criteria": [
              "Unit tests cover key frontend components.",
              "Tests pass successfully."
            ],
            "status": "pending",
            "code_files": [
              "src/**/*.test.js"
            ]
          },
          {
            "id": "FE-008",
            "description": "Implement basic styling for improved UI.",
            "dependencies": [
              "FE-002",
              "FE-003",
              "FE-004",
              "FE-006"
            ],
            "estimated_time": "4 hours",
            "agent_role": "frontend_developer",
            "acceptance_criteria": [
              "UI is visually appealing.",
              "Styling is consistent."
            ],
            "status": "pending",
            "code_files": [
              "src/App.css"
            ]
          }
        ]
      },
      {
        "name": "Backend Phase",
        "description": "Tasks related to backend phase",
        "deliverables": [
          "Completed BE-001",
          "Completed BE-002",
          "Completed BE-003",
          "Completed BE-004",
          "Completed BE-005",
          "Completed BE-006",
          "Completed BE-007",
          "Completed TEST-002",
          "Completed DEPLOY-001",
          "Completed DEPLOY-002"
        ],
        "estimated_duration_hours": 64.0,
        "work_items": [
          {
            "id": "BE-001",
            "description": "Set up Node.js/Express project.",
            "dependencies": [],
            "estimated_time": "4 hours",
            "agent_role": "backend_developer",
            "acceptance_criteria": [
              "Project is initialized successfully.",
              "Express server runs without errors."
            ],
            "status": "pending",
            "code_files": [
              "package.json",
              "index.js"
            ]
          },
          {
            "id": "BE-002",
            "description": "Create API endpoint for adding a task (POST /api/tasks).",
            "dependencies": [
              "BE-001"
            ],
            "estimated_time": "8 hours",
            "agent_role": "backend_developer",
            "acceptance_criteria": [
              "Endpoint accepts POST requests to /api/tasks.",
              "Endpoint parses the request body.",
              "Endpoint returns a 201 status code on success.",
              "Endpoint returns a 400 status code on invalid input."
            ],
            "status": "pending",
            "code_files": [
              "index.js"
            ]
          },
          {
            "id": "BE-003",
            "description": "Create API endpoint for retrieving all tasks (GET /api/tasks).",
            "dependencies": [
              "BE-001"
            ],
            "estimated_time": "4 hours",
            "agent_role": "backend_developer",
            "acceptance_criteria": [
              "Endpoint accepts GET requests to /api/tasks.",
              "Endpoint returns a 200 status code.",
              "Endpoint returns an array of tasks."
            ],
            "status": "pending",
            "code_files": [
              "index.js"
            ]
          },
          {
            "id": "BE-004",
            "description": "Connect backend to PostgreSQL database.",
            "dependencies": [
              "BE-001",
              "DB-001",
              "DB-002"
            ],
            "estimated_time": "8 hours",
            "agent_role": "backend_developer",
            "acceptance_criteria": [
              "Backend can connect to the PostgreSQL database.",
              "Database connection is established without errors."
            ],
            "status": "pending",
            "code_files": [
              "index.js"
            ]
          },
          {
            "id": "BE-005",
            "description": "Implement data persistence for task creation (POST /api/tasks).",
            "dependencies": [
              "BE-002",
              "BE-004"
            ],
            "estimated_time": "8 hours",
            "agent_role": "backend_developer",
            "acceptance_criteria": [
              "Tasks are saved to the database when created.",
              "Endpoint returns the created task with its ID."
            ],
            "status": "pending",
            "code_files": [
              "index.js"
            ]
          },
          {
            "id": "BE-006",
            "description": "Implement data retrieval for task list (GET /api/tasks).",
            "dependencies": [
              "BE-003",
              "BE-004"
            ],
            "estimated_time": "8 hours",
            "agent_role": "backend_developer",
            "acceptance_criteria": [
              "Endpoint retrieves all tasks from the database.",
              "Endpoint returns the tasks in the response."
            ],
            "status": "pending",
            "code_files": [
              "index.js"
            ]
          },
          {
            "id": "BE-007",
            "description": "Implement input validation on the backend.",
            "dependencies": [
              "BE-005"
            ],
            "estimated_time": "4 hours",
            "agent_role": "backend_developer",
            "acceptance_criteria": [
              "Backend validates task description.",
              "Invalid input returns a 400 status code."
            ],
            "status": "pending",
            "code_files": [
              "index.js"
            ]
          },
          {
            "id": "TEST-002",
            "description": "Write unit tests for backend API endpoints.",
            "dependencies": [
              "BE-002",
              "BE-003",
              "BE-005",
              "BE-006",
              "BE-007"
            ],
            "estimated_time": "8 hours",
            "agent_role": "backend_developer",
            "acceptance_criteria": [
              "Unit tests cover API endpoints.",
              "Tests pass successfully."
            ],
            "status": "pending",
            "code_files": [
              "tests/**/*.test.js"
            ]
          },
          {
            "id": "DEPLOY-001",
            "description": "Deploy the application to Heroku.",
            "dependencies": [
              "FE-006",
              "BE-006",
              "DB-002"
            ],
            "estimated_time": "4 hours",
            "agent_role": "backend_developer",
            "acceptance_criteria": [
              "Application is successfully deployed to Heroku.",
              "Frontend and backend are accessible via Heroku URLs.",
              "Database connection is working."
            ],
            "status": "pending",
            "code_files": []
          },
          {
            "id": "DEPLOY-002",
            "description": "Configure CI/CD pipeline for automated deployments.",
            "dependencies": [
              "DEPLOY-001"
            ],
            "estimated_time": "8 hours",
            "agent_role": "backend_developer",
            "acceptance_criteria": [
              "Code pushed to the repository triggers an automated build and deployment.",
              "Deployment is successful."
            ],
            "status": "pending",
            "code_files": [
              ".github/workflows/*.yml"
            ]
          }
        ]
      },
      {
        "name": "Database Phase",
        "description": "Tasks related to database phase",
        "deliverables": [
          "Completed DB-001",
          "Completed DB-002"
        ],
        "estimated_duration_hours": 8.0,
        "work_items": [
          {
            "id": "DB-001",
            "description": "Set up PostgreSQL database on Heroku.",
            "dependencies": [],
            "estimated_time": "4 hours",
            "agent_role": "database_specialist",
            "acceptance_criteria": [
              "PostgreSQL database is provisioned on Heroku.",
              "Database connection string is available."
            ],
            "status": "pending",
            "code_files": []
          },
          {
            "id": "DB-002",
            "description": "Create 'tasks' table in PostgreSQL.",
            "dependencies": [
              "DB-001"
            ],
            "estimated_time": "4 hours",
            "agent_role": "database_specialist",
            "acceptance_criteria": [
              "Tasks table exists.",
              "Table has 'id', 'description', and 'created_at' columns.",
              "id is SERIAL PRIMARY KEY.",
              "description is TEXT NOT NULL.",
              "created_at is TIMESTAMP DEFAULT CURRENT_TIMESTAMP."
            ],
            "status": "pending",
            "code_files": []
          }
        ]
      }
    ],
    "timeline_estimation": {
      "start_date": "2025-07-09T08:25:40.408342",
      "end_date": "TBD",
      "milestones": []
    },
    "risk_assessment": [],
    "resource_requirements": [
      {
        "role": "Database Specialist",
        "count": 1,
        "estimated_time_allocation": "100%",
        "phases": [
          "Database Phase"
        ],
        "skills_required": []
      },
      {
        "role": "Backend Developer",
        "count": 1,
        "estimated_time_allocation": "100%",
        "phases": [
          "Backend Phase"
        ],
        "skills_required": []
      },
      {
        "role": "Frontend Developer",
        "count": 1,
        "estimated_time_allocation": "100%",
        "phases": [
          "Frontend Phase"
        ],
        "skills_required": []
      }
    ],
    "deliverables": [
      "Completed FE-001",
      "Completed FE-002",
      "Completed FE-003",
      "Completed FE-004",
      "Completed FE-005",
      "Completed FE-006",
      "Completed FE-007",
      "Completed TEST-001",
      "Completed FE-008",
      "Completed BE-001",
      "Completed BE-002",
      "Completed BE-003",
      "Completed BE-004",
      "Completed BE-005",
      "Completed BE-006",
      "Completed BE-007",
      "Completed TEST-002",
      "Completed DEPLOY-001",
      "Completed DEPLOY-002",
      "Completed DB-001",
      "Completed DB-002"
    ],
    "dependencies": [],
    "raw_plan": "plan=ImplementationPlan(project_summary={'title': 'Generated Project Plan', 'description': 'Develop a simple web application for managing a list of tasks, allowing users to add and view tasks. The application will use React for the frontend, Node.js/Express for the backend, and PostgreSQL for data storage. It will be deployed on Heroku.', 'overall_complexity': 'Medium', 'estimated_duration': 'TBD', 'key_challenges': [], 'success_criteria': []}, phases=[{'name': 'Frontend Phase', 'description': 'Tasks related to frontend phase', 'deliverables': ['Completed FE-001', 'Completed FE-002', 'Completed FE-003', 'Completed FE-004', 'Completed FE-005', 'Completed FE-006', 'Completed FE-007', 'Completed TEST-001', 'Completed FE-008'], 'estimated_duration_hours': 48.0, 'work_items': [{'id': 'FE-001', 'description': 'Set up React project using Create React App.', 'dependencies': [], 'estimated_time': '4 hours', 'agent_role': 'frontend_developer', 'acceptance_criteria': ['Project is initialized successfully.', 'Default React app runs without errors.'], 'status': 'pending', 'code_files': ['package.json', 'src/App.js', 'src/index.js']}, {'id': 'FE-002', 'description': 'Design and implement the basic UI layout (header, main content area).', 'dependencies': ['FE-001'], 'estimated_time': '4 hours', 'agent_role': 'frontend_developer', 'acceptance_criteria': ['UI layout is responsive.', 'Header and main content area are displayed.'], 'status': 'pending', 'code_files': ['src/App.js', 'src/App.css']}, {'id': 'FE-003', 'description': 'Implement the task input form (text input and add button).', 'dependencies': ['FE-002'], 'estimated_time': '4 hours', 'agent_role': 'frontend_developer', 'acceptance_criteria': ['Form is displayed correctly.', 'Input field accepts text.', 'Add button is present.'], 'status': 'pending', 'code_files': ['src/App.js', 'src/App.css']}, {'id': 'FE-004', 'description': 'Implement the display of the task list (initially, hardcoded data).', 'dependencies': ['FE-002'], 'estimated_time': '4 hours', 'agent_role': 'frontend_developer', 'acceptance_criteria': ['Task list is displayed.', 'Hardcoded task data is rendered correctly.'], 'status': 'pending', 'code_files': ['src/App.js', 'src/App.css']}, {'id': 'FE-005', 'description': 'Connect frontend to backend API for adding tasks.', 'dependencies': ['FE-003', 'BE-002', 'BE-005'], 'estimated_time': '8 hours', 'agent_role': 'frontend_developer', 'acceptance_criteria': ['Frontend sends POST requests to /api/tasks.', 'Tasks are successfully added to the database via the frontend.'], 'status': 'pending', 'code_files': ['src/App.js']}, {'id': 'FE-006', 'description': 'Connect frontend to backend API for retrieving tasks.', 'dependencies': ['FE-004', 'BE-003', 'BE-006'], 'estimated_time': '8 hours', 'agent_role': 'frontend_developer', 'acceptance_criteria': ['Frontend fetches tasks from /api/tasks.', 'Task list is dynamically updated with data from the backend.'], 'status': 'pending', 'code_files': ['src/App.js']}, {'id': 'FE-007', 'description': 'Implement basic input validation on the frontend.', 'dependencies': ['FE-005'], 'estimated_time': '4 hours', 'agent_role': 'frontend_developer', 'acceptance_criteria': ['Empty task descriptions are not submitted.', 'Error messages are displayed to the user.'], 'status': 'pending', 'code_files': ['src/App.js']}, {'id': 'TEST-001', 'description': 'Write unit tests for frontend components.', 'dependencies': ['FE-001', 'FE-002', 'FE-003', 'FE-004', 'FE-005', 'FE-006', 'FE-007'], 'estimated_time': '8 hours', 'agent_role': 'frontend_developer', 'acceptance_criteria': ['Unit tests cover key frontend components.', 'Tests pass successfully.'], 'status': 'pending', 'code_files': ['src/**/*.test.js']}, {'id': 'FE-008', 'description': 'Implement basic styling for improved UI.', 'dependencies': ['FE-002', 'FE-003', 'FE-004', 'FE-006'], 'estimated_time': '4 hours', 'agent_role': 'frontend_developer', 'acceptance_criteria': ['UI is visually appealing.', 'Styling is consistent.'], 'status': 'pending', 'code_files': ['src/App.css']}]}, {'name': 'Backend Phase', 'description': 'Tasks related to backend phase', 'deliverables': ['Completed BE-001', 'Completed BE-002', 'Completed BE-003', 'Completed BE-004', 'Completed BE-005', 'Completed BE-006', 'Completed BE-007', 'Completed TEST-002', 'Completed DEPLOY-001', 'Completed DEPLOY-002'], 'estimated_duration_hours': 64.0, 'work_items': [{'id': 'BE-001', 'description': 'Set up Node.js/Express project.', 'dependencies': [], 'estimated_time': '4 hours', 'agent_role': 'backend_developer', 'acceptance_criteria': ['Project is initialized successfully.', 'Express server runs without errors.'], 'status': 'pending', 'code_files': ['package.json', 'index.js']}, {'id': 'BE-002', 'description': 'Create API endpoint for adding a task (POST /api/tasks).', 'dependencies': ['BE-001'], 'estimated_time': '8 hours', 'agent_role': 'backend_developer', 'acceptance_criteria': ['Endpoint accepts POST requests to /api/tasks.', 'Endpoint parses the request body.', 'Endpoint returns a 201 status code on success.', 'Endpoint returns a 400 status code on invalid input.'], 'status': 'pending', 'code_files': ['index.js']}, {'id': 'BE-003', 'description': 'Create API endpoint for retrieving all tasks (GET /api/tasks).', 'dependencies': ['BE-001'], 'estimated_time': '4 hours', 'agent_role': 'backend_developer', 'acceptance_criteria': ['Endpoint accepts GET requests to /api/tasks.', 'Endpoint returns a 200 status code.', 'Endpoint returns an array of tasks.'], 'status': 'pending', 'code_files': ['index.js']}, {'id': 'BE-004', 'description': 'Connect backend to PostgreSQL database.', 'dependencies': ['BE-001', 'DB-001', 'DB-002'], 'estimated_time': '8 hours', 'agent_role': 'backend_developer', 'acceptance_criteria': ['Backend can connect to the PostgreSQL database.', 'Database connection is established without errors.'], 'status': 'pending', 'code_files': ['index.js']}, {'id': 'BE-005', 'description': 'Implement data persistence for task creation (POST /api/tasks).', 'dependencies': ['BE-002', 'BE-004'], 'estimated_time': '8 hours', 'agent_role': 'backend_developer', 'acceptance_criteria': ['Tasks are saved to the database when created.', 'Endpoint returns the created task with its ID.'], 'status': 'pending', 'code_files': ['index.js']}, {'id': 'BE-006', 'description': 'Implement data retrieval for task list (GET /api/tasks).', 'dependencies': ['BE-003', 'BE-004'], 'estimated_time': '8 hours', 'agent_role': 'backend_developer', 'acceptance_criteria': ['Endpoint retrieves all tasks from the database.', 'Endpoint returns the tasks in the response.'], 'status': 'pending', 'code_files': ['index.js']}, {'id': 'BE-007', 'description': 'Implement input validation on the backend.', 'dependencies': ['BE-005'], 'estimated_time': '4 hours', 'agent_role': 'backend_developer', 'acceptance_criteria': ['Backend validates task description.', 'Invalid input returns a 400 status code.'], 'status': 'pending', 'code_files': ['index.js']}, {'id': 'TEST-002', 'description': 'Write unit tests for backend API endpoints.', 'dependencies': ['BE-002', 'BE-003', 'BE-005', 'BE-006', 'BE-007'], 'estimated_time': '8 hours', 'agent_role': 'backend_developer', 'acceptance_criteria': ['Unit tests cover API endpoints.', 'Tests pass successfully.'], 'status': 'pending', 'code_files': ['tests/**/*.test.js']}, {'id': 'DEPLOY-001', 'description': 'Deploy the application to Heroku.', 'dependencies': ['FE-006', 'BE-006', 'DB-002'], 'estimated_time': '4 hours', 'agent_role': 'backend_developer', 'acceptance_criteria': ['Application is successfully deployed to Heroku.', 'Frontend and backend are accessible via Heroku URLs.', 'Database connection is working.'], 'status': 'pending', 'code_files': []}, {'id': 'DEPLOY-002', 'description': 'Configure CI/CD pipeline for automated deployments.', 'dependencies': ['DEPLOY-001'], 'estimated_time': '8 hours', 'agent_role': 'backend_developer', 'acceptance_criteria': ['Code pushed to the repository triggers an automated build and deployment.', 'Deployment is successful.'], 'status': 'pending', 'code_files': ['.github/workflows/*.yml']}]}, {'name': 'Database Phase', 'description': 'Tasks related to database phase', 'deliverables': ['Completed DB-001', 'Completed DB-002'], 'estimated_duration_hours': 8.0, 'work_items': [{'id': 'DB-001', 'description': 'Set up PostgreSQL database on Heroku.', 'dependencies': [], 'estimated_time': '4 hours', 'agent_role': 'database_specialist', 'acceptance_criteria': ['PostgreSQL database is provisioned on Heroku.', 'Database connection string is available.'], 'status': 'pending', 'code_files': []}, {'id': 'DB-002', 'description': \"Create 'tasks' table in PostgreSQL.\", 'dependencies': ['DB-001'], 'estimated_time': '4 hours', 'agent_role': 'database_specialist', 'acceptance_criteria': ['Tasks table exists.', \"Table has 'id', 'description', and 'created_at' columns.\", 'id is SERIAL PRIMARY KEY.', 'description is TEXT NOT NULL.', 'created_at is TIMESTAMP DEFAULT CURRENT_TIMESTAMP.'], 'status': 'pending', 'code_files': []}]}], resource_allocation=[{'role': 'Database Specialist', 'count': 1, 'estimated_time_allocation': '100%', 'phases': ['Database Phase'], 'skills_required': []}, {'role': 'Backend Developer', 'count': 1, 'estimated_time_allocation': '100%', 'phases': ['Backend Phase'], 'skills_required': []}, {'role': 'Frontend Developer', 'count': 1, 'estimated_time_allocation': '100%', 'phases': ['Frontend Phase'], 'skills_required': []}], risks_and_mitigations=[], timeline={'start_date': '2025-07-09T08:25:40.408342', 'end_date': 'TBD', 'milestones': []}, tech_stack={}, metadata={'generated_at': '2025-07-09T08:25:40.408342', 'version': '1.0', 'author': 'Multi-AI Dev System', 'tags': [], 'notes': 'Converted from WorkItemBacklog. Original summary: Develop a simple web application for managing a list of tasks, allowing users to add and view tasks. The application will use React for the frontend, Node.js/Express for the backend, and PostgreSQL for data storage. It will be deployed on Heroku.'}) summary='Develop a simple web application for managing a list of tasks, allowing users to add and view tasks. The application will use React for the frontend, Node.js/Express for the backend, and PostgreSQL for data storage. It will be deployed on Heroku.' metadata=PlanMetadata(generated_at='2025-07-09T08:25:40.408342', version='1.0', author='Multi-AI Dev System', tags=[], notes='Converted from WorkItemBacklog. Original summary: Develop a simple web application for managing a list of tasks, allowing users to add and view tasks. The application will use React for the frontend, Node.js/Express for the backend, and PostgreSQL for data storage. It will be deployed on Heroku.')"
  },
  "workflow_state_snapshot": {
    "requirements_analysis": {
      "project_name": "Hello World Task List",
      "project_summary": "A simple web application to manage a list of tasks.",
      "project_goals": [
        "Allow a user to add a task",
        "Allow a user to see their list of tasks"
      ],
      "target_audience": [
        "Users who want to manage a list of tasks"
      ],
      "business_context": "This project aims to provide a basic task management tool.",
      "requirements": [
        {
          "id": "REQ-001",
          "description": "A user can create a new task with a text description.",
          "category": "functional",
          "priority": 1
        },
        {
          "id": "REQ-002",
          "description": "A user can see a list of all created tasks.",
          "category": "functional",
          "priority": 1
        },
        {
          "id": "REQ-003",
          "description": "The application must load quickly.",
          "category": "non_functional",
          "priority": 2
        },
        {
          "id": "REQ-004",
          "description": "The application must be secure.",
          "category": "non_functional",
          "priority": 2
        }
      ],
      "functional_requirements": [
        "A user can create a new task with a text description.",
        "A user can see a list of all created tasks."
      ],
      "non_functional_requirements": [
        "The application must load quickly.",
        "The application must be secure."
      ],
      "stakeholders": [
        "Users"
      ],
      "success_criteria": [
        "Users can successfully add tasks.",
        "Users can view their task list."
      ],
      "constraints": [],
      "assumptions": [],
      "risks": [],
      "domain_specific_details": {},
      "quality_assessment": {
        "clarity_score": 8.0,
        "completeness_score": 7.0,
        "consistency_score": 9.0,
        "recommendations": [
          "Add more details to the non-functional requirements, such as specific performance metrics and security measures."
        ]
      },
      "gap_analysis": {
        "identified_gaps": [
          "No details on user authentication or authorization.",
          "No details on data storage."
        ],
        "recommendations_for_completion": [
          "Define user authentication and authorization requirements.",
          "Specify the data storage mechanism."
        ]
      }
    },
    "tech_stack_recommendation": {
      "frontend_options": [
        {
          "name": "React",
          "language": "JavaScript",
          "reasoning": "React is a popular and efficient JavaScript library for building user interfaces. It offers a component-based architecture, making it easy to manage and update the UI. Its virtual DOM and efficient update mechanisms contribute to fast loading times, addressing the non-functional requirement for speed.",
          "key_libraries": [
            "React Router (for navigation)",
            "Axios (for API calls)",
            "Material UI/Ant Design (for UI components)"
          ],
          "pros": [
            "Large community and extensive documentation.",
            "Component-based architecture promotes code reusability and maintainability.",
            "Virtual DOM for efficient updates.",
            "Excellent performance."
          ],
          "cons": [
            "Requires understanding of JSX.",
            "Can have a steeper learning curve for beginners."
          ],
          "selected": false
        },
        {
          "name": "Vue.js",
          "language": "JavaScript",
          "reasoning": "Vue.js is a progressive framework that's easy to learn and integrate. It's known for its simplicity and flexibility, making it suitable for small to medium-sized projects. Vue's reactivity system and efficient rendering contribute to fast loading times.",
          "key_libraries": [
            "Vue Router (for navigation)",
            "Axios (for API calls)",
            "Vuetify/Element UI (for UI components)"
          ],
          "pros": [
            "Easy to learn and use.",
            "Excellent documentation.",
            "Progressive framework: can be integrated into existing projects.",
            "Good performance."
          ],
          "cons": [
            "Smaller community compared to React.",
            "Ecosystem is not as mature as React's."
          ],
          "selected": false
        },
        {
          "name": "HTML/CSS/JavaScript (Vanilla)",
          "language": "JavaScript",
          "reasoning": "Using plain HTML, CSS, and JavaScript provides the most basic and lightweight frontend. This approach minimizes dependencies and can lead to faster initial load times, which is crucial for the 'load quickly' requirement. It's suitable for a simple application like a task list.",
          "key_libraries": [
            "None (minimal dependencies)"
          ],
          "pros": [
            "No external dependencies.",
            "Fastest initial load times.",
            "Full control over the code."
          ],
          "cons": [
            "More manual coding required.",
            "Can become complex for larger applications.",
            "Less structured than frameworks."
          ],
          "selected": false
        }
      ],
      "backend_options": [
        {
          "name": "Node.js with Express",
          "language": "JavaScript",
          "reasoning": "Node.js with Express is a popular choice for building backend APIs. It's lightweight, fast, and uses JavaScript, allowing for full-stack development with a single language. Express provides a robust framework for handling routing, middleware, and API requests, making it suitable for creating a simple API to manage tasks.",
          "key_libraries": [
            "Express.js (web framework)",
            "body-parser (for parsing request bodies)",
            "cors (for handling CORS)"
          ],
          "pros": [
            "JavaScript on both frontend and backend (full-stack JavaScript).",
            "Large community and extensive documentation.",
            "Fast development speed.",
            "Good performance with non-blocking I/O."
          ],
          "cons": [
            "Callback hell can be an issue.",
            "Requires careful error handling."
          ],
          "selected": false
        },
        {
          "name": "Python with Flask",
          "language": "Python",
          "reasoning": "Flask is a micro web framework in Python, known for its simplicity and flexibility. Python is a versatile language with a large community and many libraries. Flask is well-suited for building REST APIs, and its lightweight nature aligns with the project's simplicity.",
          "key_libraries": [
            "Flask (web framework)",
            "Flask-RESTful (for building REST APIs)",
            "SQLAlchemy (for database interaction)"
          ],
          "pros": [
            "Easy to learn and use.",
            "Large community and extensive documentation.",
            "Python's readability.",
            "Good for rapid prototyping."
          ],
          "cons": [
            "Can be slower than Node.js for I/O-bound tasks.",
            "Requires more manual configuration compared to Django."
          ],
          "selected": false
        },
        {
          "name": "Java with Spring Boot",
          "language": "Java",
          "reasoning": "Spring Boot simplifies the development of Java-based web applications. It provides a robust framework for building REST APIs and managing dependencies. Java's strong typing and performance are beneficial for larger projects, although it might be overkill for this simple task list.",
          "key_libraries": [
            "Spring Boot (web framework)",
            "Spring Data JPA (for database interaction)",
            "Maven/Gradle (for dependency management)"
          ],
          "pros": [
            "Mature ecosystem and large community.",
            "Strong typing and performance.",
            "Robust framework for enterprise applications.",
            "Good for scalability."
          ],
          "cons": [
            "Steeper learning curve.",
            "More verbose than other options."
          ],
          "selected": false
        }
      ],
      "database_options": [
        {
          "name": "PostgreSQL",
          "language": null,
          "reasoning": "PostgreSQL is a powerful, open-source relational database known for its reliability, data integrity, and support for complex queries. It's a good choice for this project because it can handle the data storage requirements efficiently and securely. It's a robust option that can scale if needed.",
          "key_libraries": [
            "psycopg2 (for Python)",
            "pg (for Node.js)"
          ],
          "pros": [
            "ACID-compliant.",
            "Supports complex queries.",
            "Excellent performance and reliability.",
            "Scalable."
          ],
          "cons": [
            "Can be more complex to set up and manage than simpler databases."
          ],
          "selected": false
        },
        {
          "name": "MongoDB",
          "language": null,
          "reasoning": "MongoDB is a NoSQL document database that offers flexibility and ease of use. It's a good choice for this project because it can store task data in a flexible, schema-less format. Its ease of use and scalability make it suitable for this simple application.",
          "key_libraries": [
            "Mongoose (for Node.js)",
            "pymongo (for Python)"
          ],
          "pros": [
            "Flexible schema.",
            "Easy to scale.",
            "Good performance for read/write operations.",
            "Suitable for agile development."
          ],
          "cons": [
            "Data consistency can be more challenging to manage.",
            "Not ideal for complex relationships."
          ],
          "selected": false
        },
        {
          "name": "SQLite",
          "language": null,
          "reasoning": "SQLite is a lightweight, file-based database that's easy to set up and use. It's a good choice for this project because it requires no separate server process and is suitable for small applications. It's ideal for a simple task list application where data volume is expected to be low.",
          "key_libraries": [
            "sqlite3 (built-in for Python)",
            "sqlite3 (for Node.js)"
          ],
          "pros": [
            "Easy to set up and use.",
            "No server process required.",
            "Good for small applications.",
            "File-based storage."
          ],
          "cons": [
            "Not suitable for high-traffic applications.",
            "Limited scalability."
          ],
          "selected": false
        }
      ],
      "cloud_options": [
        {
          "name": "AWS",
          "language": null,
          "reasoning": "Amazon Web Services (AWS) provides a comprehensive suite of cloud services, including compute, storage, and databases. It's a good choice for this project because it offers scalability, reliability, and a wide range of services that can be used to deploy and manage the application. AWS has a global infrastructure and a large community.",
          "key_libraries": [
            "AWS SDKs (for various languages)",
            "Terraform/CloudFormation (for infrastructure as code)"
          ],
          "pros": [
            "Wide range of services.",
            "Scalability and reliability.",
            "Large community and extensive documentation.",
            "Global infrastructure."
          ],
          "cons": [
            "Can be complex to manage.",
            "Cost can be high if not managed carefully."
          ],
          "selected": false
        },
        {
          "name": "Google Cloud Platform (GCP)",
          "language": null,
          "reasoning": "Google Cloud Platform (GCP) offers a strong set of cloud services with a focus on data analytics and machine learning. It's a good choice for this project because it provides scalable compute and storage options. GCP's competitive pricing and user-friendly interface make it a viable option.",
          "key_libraries": [
            "Google Cloud SDK",
            "Terraform/Cloud Deployment Manager (for infrastructure as code)"
          ],
          "pros": [
            "Competitive pricing.",
            "Strong in data analytics and machine learning.",
            "User-friendly interface.",
            "Scalability and reliability."
          ],
          "cons": [
            "Smaller market share than AWS.",
            "Some services may not be as mature as AWS equivalents."
          ],
          "selected": false
        },
        {
          "name": "Heroku",
          "language": null,
          "reasoning": "Heroku is a Platform-as-a-Service (PaaS) that simplifies the deployment and management of web applications. It's a good choice for this project because it offers a streamlined deployment process, automatic scaling, and easy integration with databases. Heroku is ideal for small to medium-sized projects.",
          "key_libraries": [
            "Heroku CLI"
          ],
          "pros": [
            "Easy deployment and management.",
            "Automatic scaling.",
            "Simplified database integration.",
            "Focus on developer experience."
          ],
          "cons": [
            "Limited customization options.",
            "Can be more expensive than other options for large-scale applications.",
            "Vendor lock-in."
          ],
          "selected": false
        }
      ],
      "architecture_options": [
        {
          "pattern": "Monolithic Architecture",
          "scalability_score": 4.0,
          "maintainability_score": 6.0,
          "development_speed_score": 8.0,
          "overall_score": 6.0,
          "reasoning": "A monolithic architecture is suitable for this small project. It involves building the entire application as a single unit. This approach simplifies development and deployment, leading to faster initial development. However, scalability and maintainability can become challenges as the application grows."
        },
        {
          "pattern": "Microservices Architecture",
          "scalability_score": 8.0,
          "maintainability_score": 7.0,
          "development_speed_score": 5.0,
          "overall_score": 6.0,
          "reasoning": "Microservices architecture involves breaking down the application into smaller, independent services. While this approach offers excellent scalability and maintainability, it introduces complexity in development and deployment. It's likely overkill for this simple task list application."
        },
        {
          "pattern": "Serverless Architecture",
          "scalability_score": 9.0,
          "maintainability_score": 7.0,
          "development_speed_score": 6.0,
          "overall_score": 7.0,
          "reasoning": "Serverless architecture involves building the application using serverless functions (e.g., AWS Lambda, Google Cloud Functions). This approach offers excellent scalability and reduces operational overhead. It can be a good choice for this project if the backend logic is relatively simple. However, it can introduce complexities in debugging and monitoring."
        }
      ],
      "tool_options": [
        {
          "name": "Git",
          "language": null,
          "reasoning": "Version control for the codebase.",
          "key_libraries": [],
          "pros": [],
          "cons": [],
          "selected": false
        },
        {
          "name": "VS Code",
          "language": null,
          "reasoning": "Code editor with extensions for various languages and frameworks.",
          "key_libraries": [],
          "pros": [],
          "cons": [],
          "selected": false
        },
        {
          "name": "Postman",
          "language": null,
          "reasoning": "API testing and development.",
          "key_libraries": [],
          "pros": [],
          "cons": [],
          "selected": false
        },
        {
          "name": "Docker",
          "language": null,
          "reasoning": "Containerization for consistent development and deployment environments.",
          "key_libraries": [],
          "pros": [],
          "cons": [],
          "selected": false
        },
        {
          "name": "CI/CD Pipeline (e.g., GitHub Actions, GitLab CI)",
          "language": null,
          "reasoning": "Automated build, test, and deployment.",
          "key_libraries": [],
          "pros": [],
          "cons": [],
          "selected": false
        }
      ],
      "risks": [
        {
          "category": "Security",
          "description": "Insufficient input validation can lead to security vulnerabilities such as cross-site scripting (XSS) and SQL injection.",
          "severity": "High",
          "likelihood": "Medium",
          "mitigation": "Implement robust input validation and sanitization on both the client and server sides. Use parameterized queries to prevent SQL injection. Consider using a web application firewall (WAF)."
        },
        {
          "category": "Performance",
          "description": "Inefficient database queries or frontend rendering can lead to slow loading times.",
          "severity": "Medium",
          "likelihood": "Medium",
          "mitigation": "Optimize database queries by using indexes and avoiding unnecessary joins. Implement lazy loading and code splitting on the frontend. Use a content delivery network (CDN) to cache static assets."
        },
        {
          "category": "Scalability",
          "description": "The application may not scale well if the database or backend is not designed to handle increased traffic.",
          "severity": "Low",
          "likelihood": "Low",
          "mitigation": "Choose a database that can scale (e.g., PostgreSQL, MongoDB). Implement caching mechanisms to reduce database load. Consider using a load balancer to distribute traffic across multiple servers."
        }
      ],
      "synthesis": {
        "backend": {
          "name": "Node.js with Express",
          "language": "JavaScript",
          "reasoning": "Node.js with Express is selected for its speed of development and full-stack JavaScript capabilities. It allows for a single language across the entire stack, simplifying development and deployment. Express provides a robust framework for handling routing and API requests."
        },
        "frontend": {
          "name": "React",
          "language": "JavaScript",
          "reasoning": "React is chosen for its component-based architecture, which promotes code reusability and maintainability. Its virtual DOM and efficient update mechanisms contribute to fast loading times, addressing the non-functional requirement for speed. It's a popular choice with a large community and extensive documentation."
        },
        "database": {
          "name": "PostgreSQL",
          "reasoning": "PostgreSQL is chosen for its reliability, data integrity, and support for complex queries. It's a good choice for this project because it can handle the data storage requirements efficiently and securely. It's a robust option that can scale if needed."
        },
        "architecture_pattern": "Monolithic Architecture",
        "deployment_environment": {
          "cloud": "Heroku",
          "reasoning": "Heroku is selected for its ease of deployment and management, which is ideal for a small project. It offers automatic scaling and simplified database integration, streamlining the deployment process."
        },
        "key_libraries_tools": [
          {
            "name": "Git",
            "purpose": "Version control for the codebase."
          },
          {
            "name": "VS Code",
            "purpose": "Code editor with extensions for various languages and frameworks."
          },
          {
            "name": "Postman",
            "purpose": "API testing and development."
          }
        ],
        "estimated_complexity": "Low"
      },
      "selected_stack": null
    },
    "system_design": {
      "architecture": {
        "pattern": "Monolithic Architecture",
        "justification": "The project is small and simple. A monolithic architecture simplifies development and deployment without the added complexity of microservices.",
        "key_benefits": [
          "Faster initial development.",
          "Simplified deployment.",
          "Easier to manage for a small team."
        ],
        "potential_drawbacks": [
          "Limited scalability compared to microservices.",
          "Can become harder to maintain as the application grows."
        ]
      },
      "components": [
        {
          "name": "Frontend",
          "description": "Handles user interaction and displays the task list.",
          "category": "frontend",
          "technologies": [
            "React",
            "JavaScript",
            "HTML",
            "CSS"
          ],
          "dependencies": [
            "Backend API"
          ],
          "responsibilities": [
            "Displaying the task list.",
            "Allowing users to add new tasks.",
            "Handling user input.",
            "Making API calls to the backend."
          ],
          "design_patterns": [
            "Component-based architecture"
          ]
        },
        {
          "name": "Backend API",
          "description": "Provides an API for managing tasks.",
          "category": "backend",
          "technologies": [
            "Node.js",
            "Express.js",
            "JavaScript",
            "PostgreSQL"
          ],
          "dependencies": [
            "Database"
          ],
          "responsibilities": [
            "Handling API requests.",
            "Validating user input.",
            "Interacting with the database.",
            "Returning data to the frontend."
          ],
          "design_patterns": [
            "RESTful API"
          ]
        },
        {
          "name": "Database",
          "description": "Stores the task data.",
          "category": "backend",
          "technologies": [
            "PostgreSQL"
          ],
          "dependencies": [],
          "responsibilities": [
            "Storing task data.",
            "Providing data to the backend API."
          ],
          "design_patterns": []
        },
        {
          "name": "Deployment Environment",
          "description": "The environment where the application is deployed.",
          "category": "infrastructure",
          "technologies": [
            "Heroku"
          ],
          "dependencies": [
            "Frontend",
            "Backend API",
            "Database"
          ],
          "responsibilities": [
            "Hosting the frontend.",
            "Hosting the backend API.",
            "Managing the database.",
            "Providing scaling and deployment services."
          ],
          "design_patterns": []
        }
      ],
      "data_model": {
        "schema_type": "Relational",
        "tables": [
          {
            "name": "tasks",
            "purpose": "Stores task information.",
            "fields": [
              {
                "name": "id",
                "type": "SERIAL",
                "constraints": [
                  "PRIMARY KEY"
                ],
                "description": "Unique identifier for the task."
              },
              {
                "name": "description",
                "type": "TEXT",
                "constraints": [
                  "NOT NULL"
                ],
                "description": "The task description."
              },
              {
                "name": "created_at",
                "type": "TIMESTAMP",
                "constraints": [
                  "NOT NULL",
                  "DEFAULT CURRENT_TIMESTAMP"
                ],
                "description": "Timestamp of when the task was created."
              }
            ],
            "relationships": []
          }
        ],
        "relationships": [],
        "justification": "Relational database (PostgreSQL) is chosen for its data integrity, support for complex queries, and scalability. It's a good fit for storing structured task data."
      },
      "api_endpoints": {
        "style": "REST",
        "base_url": "/api/tasks",
        "authentication": "None (for simplicity)",
        "endpoints": [
          {
            "method": "POST",
            "path": "/",
            "purpose": "Create a new task.",
            "parameters": [
              {
                "description": "The task description.",
                "type": "string",
                "name": "description"
              }
            ],
            "response": {
              "201": {
                "message": "Task created successfully.",
                "task": {
                  "id": 1,
                  "description": "Example task",
                  "created_at": "2024-01-01T12:00:00.000Z"
                }
              },
              "400": {
                "message": "Bad Request - Invalid input."
              }
            },
            "authentication_required": false,
            "rate_limiting_applied": false
          },
          {
            "method": "GET",
            "path": "/",
            "purpose": "Get all tasks.",
            "parameters": [],
            "response": {
              "200": {
                "tasks": [
                  {
                    "id": 1,
                    "description": "Example task",
                    "created_at": "2024-01-01T12:00:00.000Z"
                  }
                ]
              }
            },
            "authentication_required": false,
            "rate_limiting_applied": false
          }
        ],
        "error_handling": "Standard HTTP status codes and informative error messages.",
        "rate_limiting_strategy": null
      },
      "security": {
        "authentication_method": "None (for simplicity)",
        "authorization_strategy": "None (for simplicity)",
        "data_encryption": {
          "in_transit": "TLS/SSL",
          "at_rest": "Not applicable (for simplicity)"
        },
        "security_measures": [
          {
            "category": "Input Validation",
            "implementation": "Validate all user inputs on both the client and server sides to prevent XSS and SQL injection attacks. Use parameterized queries.",
            "mitigation": "XSS, SQL Injection",
            "priority": "High"
          },
          {
            "category": "HTTPS",
            "implementation": "Enforce HTTPS for all communication.",
            "mitigation": "Man-in-the-middle attacks",
            "priority": "High"
          },
          {
            "category": "Dependency Management",
            "implementation": "Regularly update dependencies to patch security vulnerabilities.",
            "mitigation": "Known vulnerabilities in dependencies",
            "priority": "Medium"
          }
        ],
        "vulnerability_mitigation_strategies": [
          "Input validation and sanitization.",
          "Use of parameterized queries.",
          "Regular dependency updates.",
          "Enforce HTTPS."
        ],
        "compliance_standards": []
      },
      "scalability_and_performance": {
        "frontend_optimization": "Use React's virtual DOM and efficient update mechanisms. Implement code splitting and lazy loading.",
        "backend_optimization": "Optimize database queries. Use caching if needed.",
        "database_optimization": "Use indexes on frequently queried columns."
      },
      "deployment_strategy": {
        "platform": "Heroku",
        "steps": [
          "Push the code to a Git repository.",
          "Heroku automatically builds and deploys the application.",
          "Heroku manages the database and scaling."
        ],
        "environment": "Production environment on Heroku."
      },
      "monitoring_and_logging": {
        "logging": "Use a logging library (e.g., Winston for Node.js) to log application events and errors.",
        "monitoring": "Use Heroku's built-in monitoring tools or integrate with a third-party service (e.g., New Relic) for performance monitoring."
      },
      "error_handling_strategy": "Use standard HTTP status codes. Provide informative error messages to the user. Log all errors on the server-side.",
      "development_phases_overview": [
        {
          "name": "Phase 1: Setup and Frontend Development",
          "description": "Set up the development environment, create the React frontend, and implement the UI for adding and viewing tasks.",
          "priority": "High",
          "dependencies": [],
          "tasks": [
            "Set up React project.",
            "Design and implement the UI.",
            "Implement the task input form.",
            "Display the task list."
          ],
          "estimated_duration": "1 week"
        },
        {
          "name": "Phase 2: Backend API Development",
          "description": "Develop the Node.js/Express backend API to handle task creation and retrieval.",
          "priority": "High",
          "dependencies": [
            "Phase 1: Setup and Frontend Development"
          ],
          "tasks": [
            "Set up Node.js/Express project.",
            "Create API endpoints for adding and retrieving tasks.",
            "Connect to the PostgreSQL database.",
            "Implement data validation."
          ],
          "estimated_duration": "1 week"
        },
        {
          "name": "Phase 3: Database Integration and Testing",
          "description": "Integrate the frontend and backend, connect to the database, and perform thorough testing.",
          "priority": "High",
          "dependencies": [
            "Phase 1: Setup and Frontend Development",
            "Phase 2: Backend API Development"
          ],
          "tasks": [
            "Connect the frontend to the backend API.",
            "Implement data persistence using PostgreSQL.",
            "Write unit and integration tests.",
            "Test the application thoroughly."
          ],
          "estimated_duration": "1 week"
        },
        {
          "name": "Phase 4: Deployment and Refinement",
          "description": "Deploy the application to Heroku and refine the application based on user feedback.",
          "priority": "Medium",
          "dependencies": [
            "Phase 3: Database Integration and Testing"
          ],
          "tasks": [
            "Deploy the application to Heroku.",
            "Monitor the application.",
            "Gather user feedback.",
            "Implement any necessary refinements."
          ],
          "estimated_duration": "1 week"
        }
      ],
      "key_risks": [
        "Insufficient input validation leading to security vulnerabilities.",
        "Slow loading times due to inefficient frontend or database queries.",
        "Database performance issues if not properly optimized."
      ],
      "design_justification": "The design prioritizes simplicity and speed of development. The monolithic architecture, along with the chosen tech stack (React, Node.js/Express, PostgreSQL, Heroku), allows for rapid prototyping and deployment. The focus is on delivering a functional task list application quickly, while addressing key non-functional requirements like security and performance.",
      "data_flow": "1. User interacts with the React frontend to add a task. 2. Frontend sends a POST request to the backend API (Node.js/Express). 3. Backend API validates the input and saves the task to the PostgreSQL database. 4. Frontend requests all tasks from the backend API via a GET request. 5. Backend API retrieves tasks from the PostgreSQL database. 6. Backend API returns the tasks to the frontend. 7. Frontend displays the tasks to the user."
    },
    "implementation_plan": "plan=ImplementationPlan(project_summary={'title': 'Generated Project Plan', 'description': 'Develop a simple web application for managing a list of tasks, allowing users to add and view tasks. The application will use React for the frontend, Node.js/Express for the backend, and PostgreSQL for data storage. It will be deployed on Heroku.', 'overall_complexity': 'Medium', 'estimated_duration': 'TBD', 'key_challenges': [], 'success_criteria': []}, phases=[{'name': 'Frontend Phase', 'description': 'Tasks related to frontend phase', 'deliverables': ['Completed FE-001', 'Completed FE-002', 'Completed FE-003', 'Completed FE-004', 'Completed FE-005', 'Completed FE-006', 'Completed FE-007', 'Completed TEST-001', 'Completed FE-008'], 'estimated_duration_hours': 48.0, 'work_items': [{'id': 'FE-001', 'description': 'Set up React project using Create React App.', 'dependencies': [], 'estimated_time': '4 hours', 'agent_role': 'frontend_developer', 'acceptance_criteria': ['Project is initialized successfully.', 'Default React app runs without errors.'], 'status': 'pending', 'code_files': ['package.json', 'src/App.js', 'src/index.js']}, {'id': 'FE-002', 'description': 'Design and implement the basic UI layout (header, main content area).', 'dependencies': ['FE-001'], 'estimated_time': '4 hours', 'agent_role': 'frontend_developer', 'acceptance_criteria': ['UI layout is responsive.', 'Header and main content area are displayed.'], 'status': 'pending', 'code_files': ['src/App.js', 'src/App.css']}, {'id': 'FE-003', 'description': 'Implement the task input form (text input and add button).', 'dependencies': ['FE-002'], 'estimated_time': '4 hours', 'agent_role': 'frontend_developer', 'acceptance_criteria': ['Form is displayed correctly.', 'Input field accepts text.', 'Add button is present.'], 'status': 'pending', 'code_files': ['src/App.js', 'src/App.css']}, {'id': 'FE-004', 'description': 'Implement the display of the task list (initially, hardcoded data).', 'dependencies': ['FE-002'], 'estimated_time': '4 hours', 'agent_role': 'frontend_developer', 'acceptance_criteria': ['Task list is displayed.', 'Hardcoded task data is rendered correctly.'], 'status': 'pending', 'code_files': ['src/App.js', 'src/App.css']}, {'id': 'FE-005', 'description': 'Connect frontend to backend API for adding tasks.', 'dependencies': ['FE-003', 'BE-002', 'BE-005'], 'estimated_time': '8 hours', 'agent_role': 'frontend_developer', 'acceptance_criteria': ['Frontend sends POST requests to /api/tasks.', 'Tasks are successfully added to the database via the frontend.'], 'status': 'pending', 'code_files': ['src/App.js']}, {'id': 'FE-006', 'description': 'Connect frontend to backend API for retrieving tasks.', 'dependencies': ['FE-004', 'BE-003', 'BE-006'], 'estimated_time': '8 hours', 'agent_role': 'frontend_developer', 'acceptance_criteria': ['Frontend fetches tasks from /api/tasks.', 'Task list is dynamically updated with data from the backend.'], 'status': 'pending', 'code_files': ['src/App.js']}, {'id': 'FE-007', 'description': 'Implement basic input validation on the frontend.', 'dependencies': ['FE-005'], 'estimated_time': '4 hours', 'agent_role': 'frontend_developer', 'acceptance_criteria': ['Empty task descriptions are not submitted.', 'Error messages are displayed to the user.'], 'status': 'pending', 'code_files': ['src/App.js']}, {'id': 'TEST-001', 'description': 'Write unit tests for frontend components.', 'dependencies': ['FE-001', 'FE-002', 'FE-003', 'FE-004', 'FE-005', 'FE-006', 'FE-007'], 'estimated_time': '8 hours', 'agent_role': 'frontend_developer', 'acceptance_criteria': ['Unit tests cover key frontend components.', 'Tests pass successfully.'], 'status': 'pending', 'code_files': ['src/**/*.test.js']}, {'id': 'FE-008', 'description': 'Implement basic styling for improved UI.', 'dependencies': ['FE-002', 'FE-003', 'FE-004', 'FE-006'], 'estimated_time': '4 hours', 'agent_role': 'frontend_developer', 'acceptance_criteria': ['UI is visually appealing.', 'Styling is consistent.'], 'status': 'pending', 'code_files': ['src/App.css']}]}, {'name': 'Backend Phase', 'description': 'Tasks related to backend phase', 'deliverables': ['Completed BE-001', 'Completed BE-002', 'Completed BE-003', 'Completed BE-004', 'Completed BE-005', 'Completed BE-006', 'Completed BE-007', 'Completed TEST-002', 'Completed DEPLOY-001', 'Completed DEPLOY-002'], 'estimated_duration_hours': 64.0, 'work_items': [{'id': 'BE-001', 'description': 'Set up Node.js/Express project.', 'dependencies': [], 'estimated_time': '4 hours', 'agent_role': 'backend_developer', 'acceptance_criteria': ['Project is initialized successfully.', 'Express server runs without errors.'], 'status': 'pending', 'code_files': ['package.json', 'index.js']}, {'id': 'BE-002', 'description': 'Create API endpoint for adding a task (POST /api/tasks).', 'dependencies': ['BE-001'], 'estimated_time': '8 hours', 'agent_role': 'backend_developer', 'acceptance_criteria': ['Endpoint accepts POST requests to /api/tasks.', 'Endpoint parses the request body.', 'Endpoint returns a 201 status code on success.', 'Endpoint returns a 400 status code on invalid input.'], 'status': 'pending', 'code_files': ['index.js']}, {'id': 'BE-003', 'description': 'Create API endpoint for retrieving all tasks (GET /api/tasks).', 'dependencies': ['BE-001'], 'estimated_time': '4 hours', 'agent_role': 'backend_developer', 'acceptance_criteria': ['Endpoint accepts GET requests to /api/tasks.', 'Endpoint returns a 200 status code.', 'Endpoint returns an array of tasks.'], 'status': 'pending', 'code_files': ['index.js']}, {'id': 'BE-004', 'description': 'Connect backend to PostgreSQL database.', 'dependencies': ['BE-001', 'DB-001', 'DB-002'], 'estimated_time': '8 hours', 'agent_role': 'backend_developer', 'acceptance_criteria': ['Backend can connect to the PostgreSQL database.', 'Database connection is established without errors.'], 'status': 'pending', 'code_files': ['index.js']}, {'id': 'BE-005', 'description': 'Implement data persistence for task creation (POST /api/tasks).', 'dependencies': ['BE-002', 'BE-004'], 'estimated_time': '8 hours', 'agent_role': 'backend_developer', 'acceptance_criteria': ['Tasks are saved to the database when created.', 'Endpoint returns the created task with its ID.'], 'status': 'pending', 'code_files': ['index.js']}, {'id': 'BE-006', 'description': 'Implement data retrieval for task list (GET /api/tasks).', 'dependencies': ['BE-003', 'BE-004'], 'estimated_time': '8 hours', 'agent_role': 'backend_developer', 'acceptance_criteria': ['Endpoint retrieves all tasks from the database.', 'Endpoint returns the tasks in the response.'], 'status': 'pending', 'code_files': ['index.js']}, {'id': 'BE-007', 'description': 'Implement input validation on the backend.', 'dependencies': ['BE-005'], 'estimated_time': '4 hours', 'agent_role': 'backend_developer', 'acceptance_criteria': ['Backend validates task description.', 'Invalid input returns a 400 status code.'], 'status': 'pending', 'code_files': ['index.js']}, {'id': 'TEST-002', 'description': 'Write unit tests for backend API endpoints.', 'dependencies': ['BE-002', 'BE-003', 'BE-005', 'BE-006', 'BE-007'], 'estimated_time': '8 hours', 'agent_role': 'backend_developer', 'acceptance_criteria': ['Unit tests cover API endpoints.', 'Tests pass successfully.'], 'status': 'pending', 'code_files': ['tests/**/*.test.js']}, {'id': 'DEPLOY-001', 'description': 'Deploy the application to Heroku.', 'dependencies': ['FE-006', 'BE-006', 'DB-002'], 'estimated_time': '4 hours', 'agent_role': 'backend_developer', 'acceptance_criteria': ['Application is successfully deployed to Heroku.', 'Frontend and backend are accessible via Heroku URLs.', 'Database connection is working.'], 'status': 'pending', 'code_files': []}, {'id': 'DEPLOY-002', 'description': 'Configure CI/CD pipeline for automated deployments.', 'dependencies': ['DEPLOY-001'], 'estimated_time': '8 hours', 'agent_role': 'backend_developer', 'acceptance_criteria': ['Code pushed to the repository triggers an automated build and deployment.', 'Deployment is successful.'], 'status': 'pending', 'code_files': ['.github/workflows/*.yml']}]}, {'name': 'Database Phase', 'description': 'Tasks related to database phase', 'deliverables': ['Completed DB-001', 'Completed DB-002'], 'estimated_duration_hours': 8.0, 'work_items': [{'id': 'DB-001', 'description': 'Set up PostgreSQL database on Heroku.', 'dependencies': [], 'estimated_time': '4 hours', 'agent_role': 'database_specialist', 'acceptance_criteria': ['PostgreSQL database is provisioned on Heroku.', 'Database connection string is available.'], 'status': 'pending', 'code_files': []}, {'id': 'DB-002', 'description': \"Create 'tasks' table in PostgreSQL.\", 'dependencies': ['DB-001'], 'estimated_time': '4 hours', 'agent_role': 'database_specialist', 'acceptance_criteria': ['Tasks table exists.', \"Table has 'id', 'description', and 'created_at' columns.\", 'id is SERIAL PRIMARY KEY.', 'description is TEXT NOT NULL.', 'created_at is TIMESTAMP DEFAULT CURRENT_TIMESTAMP.'], 'status': 'pending', 'code_files': []}]}], resource_allocation=[{'role': 'Database Specialist', 'count': 1, 'estimated_time_allocation': '100%', 'phases': ['Database Phase'], 'skills_required': []}, {'role': 'Backend Developer', 'count': 1, 'estimated_time_allocation': '100%', 'phases': ['Backend Phase'], 'skills_required': []}, {'role': 'Frontend Developer', 'count': 1, 'estimated_time_allocation': '100%', 'phases': ['Frontend Phase'], 'skills_required': []}], risks_and_mitigations=[], timeline={'start_date': '2025-07-09T08:25:40.408342', 'end_date': 'TBD', 'milestones': []}, tech_stack={}, metadata={'generated_at': '2025-07-09T08:25:40.408342', 'version': '1.0', 'author': 'Multi-AI Dev System', 'tags': [], 'notes': 'Converted from WorkItemBacklog. Original summary: Develop a simple web application for managing a list of tasks, allowing users to add and view tasks. The application will use React for the frontend, Node.js/Express for the backend, and PostgreSQL for data storage. It will be deployed on Heroku.'}) summary='Develop a simple web application for managing a list of tasks, allowing users to add and view tasks. The application will use React for the frontend, Node.js/Express for the backend, and PostgreSQL for data storage. It will be deployed on Heroku.' metadata=PlanMetadata(generated_at='2025-07-09T08:25:40.408342', version='1.0', author='Multi-AI Dev System', tags=[], notes='Converted from WorkItemBacklog. Original summary: Develop a simple web application for managing a list of tasks, allowing users to add and view tasks. The application will use React for the frontend, Node.js/Express for the backend, and PostgreSQL for data storage. It will be deployed on Heroku.')"
  }
}