{
  "session_id": "session_67acb109-d89f-4753-8d24-2e12591a9450",
  "approval_type": "tech_stack_recommendation",
  "timestamp": 1751900430,
  "approval_data": {
    "type": "tech_stack",
    "timestamp": 1751900430.7488592,
    "raw_recommendation": {
      "frontend_options": [
        {
          "name": "React",
          "language": "JavaScript",
          "reasoning": "React is a popular and efficient library for building user interfaces. It offers a component-based architecture, making it easy to manage and update the UI. Its virtual DOM improves performance, which is crucial for quick loading times (REQ-003).",
          "key_libraries": [
            "React Router (for navigation)",
            "Axios (for API calls)",
            "Material UI/Ant Design (for UI components)"
          ],
          "pros": [
            "Large community and extensive documentation.",
            "Component-based architecture promotes code reusability and maintainability.",
            "Virtual DOM for efficient updates.",
            "Excellent performance."
          ],
          "cons": [
            "Requires understanding of JavaScript and JSX.",
            "Can have a steeper learning curve for beginners."
          ],
          "selected": false
        },
        {
          "name": "Vue.js",
          "language": "JavaScript",
          "reasoning": "Vue.js is a progressive framework that's easy to learn and integrate. It's known for its simplicity and excellent documentation, making it suitable for this small project. It also offers good performance and a clear separation of concerns.",
          "key_libraries": [
            "Vue Router (for navigation)",
            "Axios (for API calls)",
            "Vuetify/Element UI (for UI components)"
          ],
          "pros": [
            "Easy to learn and use.",
            "Good performance.",
            "Clear and concise syntax.",
            "Excellent documentation."
          ],
          "cons": [
            "Smaller community compared to React.",
            "Ecosystem might not be as extensive as React's."
          ],
          "selected": false
        },
        {
          "name": "HTML, CSS, JavaScript (Vanilla)",
          "language": "JavaScript",
          "reasoning": "For a simple task list, using vanilla JavaScript, HTML, and CSS can be a viable option. It avoids the overhead of a framework, resulting in potentially faster initial load times. This approach is suitable for small projects where complexity is low.",
          "key_libraries": [],
          "pros": [
            "No external dependencies.",
            "Fastest initial load times.",
            "Simple to understand and debug."
          ],
          "cons": [
            "More manual DOM manipulation.",
            "Can become complex to manage as the application grows.",
            "Less structure compared to frameworks."
          ],
          "selected": false
        }
      ],
      "backend_options": [
        {
          "name": "Node.js with Express",
          "language": "JavaScript",
          "reasoning": "Node.js with Express provides a lightweight and efficient backend solution. JavaScript is used on both the frontend and backend, which simplifies development. Express makes it easy to create RESTful APIs, which is suitable for this project.",
          "key_libraries": [
            "Express (web framework)",
            "body-parser (for parsing request bodies)",
            "cors (for handling CORS)",
            "jsonwebtoken (for authentication)"
          ],
          "pros": [
            "JavaScript on both frontend and backend (full-stack JavaScript).",
            "Large community and extensive documentation.",
            "Fast development with Express.",
            "Good performance with Node.js's non-blocking I/O."
          ],
          "cons": [
            "Callback hell can be an issue if not managed properly.",
            "Requires knowledge of JavaScript and Node.js."
          ],
          "selected": false
        },
        {
          "name": "Python with Flask",
          "language": "Python",
          "reasoning": "Flask is a lightweight Python web framework that's easy to learn and use. Python is a versatile language, and Flask is well-suited for building REST APIs. This option provides a good balance between simplicity and functionality.",
          "key_libraries": [
            "Flask (web framework)",
            "Flask-RESTful (for building REST APIs)",
            "Flask-CORS (for handling CORS)",
            "PyJWT (for authentication)"
          ],
          "pros": [
            "Easy to learn and use.",
            "Python's readability.",
            "Good for building REST APIs.",
            "Large community and extensive documentation."
          ],
          "cons": [
            "Requires knowledge of Python.",
            "Can be slightly slower than Node.js for some tasks."
          ],
          "selected": false
        },
        {
          "name": "Java with Spring Boot",
          "language": "Java",
          "reasoning": "Spring Boot provides a robust and scalable backend solution. Java is a mature language with a large ecosystem. Spring Boot simplifies the development process and offers features like dependency injection and security.",
          "key_libraries": [
            "Spring Boot (web framework)",
            "Spring Data JPA (for database interaction)",
            "Spring Security (for authentication and authorization)",
            "Jackson (for JSON serialization/deserialization)"
          ],
          "pros": [
            "Robust and scalable.",
            "Large community and extensive documentation.",
            "Mature ecosystem.",
            "Good for enterprise-level applications."
          ],
          "cons": [
            "Steeper learning curve.",
            "More verbose than other options.",
            "Can be slower development speed."
          ],
          "selected": false
        }
      ],
      "database_options": [
        {
          "name": "PostgreSQL",
          "language": null,
          "reasoning": "PostgreSQL is a robust and reliable relational database. It offers strong data integrity and supports complex queries. It's a good choice for this project because it can handle the data requirements and provides good security.",
          "key_libraries": [],
          "pros": [
            "Reliable and mature.",
            "Supports complex queries.",
            "Strong data integrity.",
            "Good security features."
          ],
          "cons": [
            "Can be more complex to set up and manage than simpler databases.",
            "Requires knowledge of SQL."
          ],
          "selected": false
        },
        {
          "name": "MongoDB",
          "language": null,
          "reasoning": "MongoDB is a NoSQL database that's easy to set up and use. It's a good choice for this project because it can handle the data requirements and provides good performance. It's schema-less, which can be advantageous for rapid development.",
          "key_libraries": [],
          "pros": [
            "Easy to set up and use.",
            "Schema-less design allows for flexibility.",
            "Good performance.",
            "Scalable."
          ],
          "cons": [
            "Data consistency can be more challenging to manage.",
            "Query language can be less intuitive than SQL."
          ],
          "selected": false
        },
        {
          "name": "SQLite",
          "language": null,
          "reasoning": "SQLite is a lightweight, file-based database that's easy to integrate. It's suitable for small projects and prototyping. It requires no separate server process, making deployment simple.",
          "key_libraries": [],
          "pros": [
            "Simple to set up and use.",
            "No separate server process required.",
            "Good for small projects and prototyping."
          ],
          "cons": [
            "Not suitable for high-traffic applications.",
            "Limited scalability.",
            "Less robust than other options."
          ],
          "selected": false
        }
      ],
      "cloud_options": [
        {
          "name": "AWS (Amazon Web Services)",
          "language": null,
          "reasoning": "AWS offers a wide range of services, including hosting, databases, and serverless functions. It's a good choice for this project because it provides scalability, security, and reliability. Services like EC2, RDS, and S3 can be used.",
          "key_libraries": [],
          "pros": [
            "Scalable and reliable.",
            "Wide range of services.",
            "Mature platform.",
            "Good security features."
          ],
          "cons": [
            "Can be complex to manage.",
            "Can be expensive if not managed properly.",
            "Steeper learning curve."
          ],
          "selected": false
        },
        {
          "name": "Google Cloud Platform (GCP)",
          "language": null,
          "reasoning": "GCP offers a similar set of services to AWS, including hosting, databases, and serverless functions. It's a good choice for this project because it provides scalability, security, and reliability. Services like Compute Engine, Cloud SQL, and Cloud Storage can be used.",
          "key_libraries": [],
          "pros": [
            "Scalable and reliable.",
            "Competitive pricing.",
            "Good integration with Google services.",
            "Good security features."
          ],
          "cons": [
            "Can be complex to manage.",
            "Steeper learning curve.",
            "Less mature than AWS."
          ],
          "selected": false
        },
        {
          "name": "Heroku",
          "language": null,
          "reasoning": "Heroku is a Platform-as-a-Service (PaaS) that simplifies deployment and management. It's a good choice for this project because it's easy to use and provides a simple deployment process. It abstracts away much of the infrastructure management.",
          "key_libraries": [],
          "pros": [
            "Easy to deploy and manage.",
            "Simple deployment process.",
            "Good for small projects.",
            "Focus on developer experience."
          ],
          "cons": [
            "Limited customization options.",
            "Can be more expensive than other options.",
            "Less control over infrastructure."
          ],
          "selected": false
        }
      ],
      "architecture_options": [
        {
          "pattern": "Monolithic Architecture",
          "scalability_score": 5.0,
          "maintainability_score": 6.0,
          "development_speed_score": 8.0,
          "overall_score": 7.0,
          "reasoning": "For a simple task list application, a monolithic architecture is a good starting point. It's easy to develop and deploy. All components are within a single codebase. While it may become harder to scale later, it's suitable for the initial requirements."
        },
        {
          "pattern": "Microservices Architecture",
          "scalability_score": 8.0,
          "maintainability_score": 7.0,
          "development_speed_score": 5.0,
          "overall_score": 6.0,
          "reasoning": "While microservices offer excellent scalability and maintainability, they introduce complexity that's likely unnecessary for this small project. The overhead of managing multiple services and their communication outweighs the benefits at this stage."
        },
        {
          "pattern": "Serverless Architecture",
          "scalability_score": 9.0,
          "maintainability_score": 7.0,
          "development_speed_score": 6.0,
          "overall_score": 6.5,
          "reasoning": "Serverless architecture can be a good option for scalability and cost-effectiveness. However, it can add complexity in terms of debugging and monitoring. It may be overkill for this simple application."
        }
      ],
      "tool_options": [
        {
          "name": "Git",
          "language": null,
          "reasoning": "Git is essential for version control and collaboration. It allows developers to track changes, revert to previous versions, and work together on the codebase.",
          "key_libraries": [],
          "pros": [],
          "cons": [],
          "selected": false
        },
        {
          "name": "VS Code",
          "language": null,
          "reasoning": "VS Code is a popular and versatile code editor with excellent support for various languages and frameworks. It provides features like code completion, debugging, and integrated terminal.",
          "key_libraries": [],
          "pros": [],
          "cons": [],
          "selected": false
        },
        {
          "name": "Postman",
          "language": null,
          "reasoning": "Postman is a useful tool for testing APIs. It allows developers to send requests, inspect responses, and debug API interactions.",
          "key_libraries": [],
          "pros": [],
          "cons": [],
          "selected": false
        }
      ],
      "risks": [
        {
          "category": "Security",
          "description": "The application must be secured to prevent unauthorized access and data breaches. This includes protecting user data and preventing cross-site scripting (XSS) and other vulnerabilities. (REQ-004)",
          "severity": "High",
          "likelihood": "Medium",
          "mitigation": "Implement proper authentication and authorization mechanisms. Sanitize all user inputs to prevent XSS attacks. Use HTTPS to encrypt all communication. Regularly update dependencies to patch security vulnerabilities."
        },
        {
          "category": "Performance",
          "description": "The application must load quickly to provide a good user experience. Slow loading times can lead to user frustration and abandonment. (REQ-003)",
          "severity": "Medium",
          "likelihood": "Medium",
          "mitigation": "Optimize images and other assets. Minimize the use of external libraries. Use caching techniques. Optimize database queries. Consider using a Content Delivery Network (CDN)."
        },
        {
          "category": "Scalability",
          "description": "As the application grows, it may need to handle more users and data. The chosen architecture and infrastructure should be able to scale to accommodate this growth.",
          "severity": "Low",
          "likelihood": "Low",
          "mitigation": "Choose a database and cloud platform that can scale. Design the application with scalability in mind. Consider using a load balancer if the application becomes popular."
        },
        {
          "category": "Development Speed",
          "description": "The project should be completed within a reasonable timeframe. Delays can lead to increased costs and missed opportunities.",
          "severity": "Medium",
          "likelihood": "Medium",
          "mitigation": "Choose technologies that are familiar to the development team. Use a framework that promotes rapid development. Implement a well-defined development process. Use a project management tool to track progress."
        }
      ],
      "synthesis": {
        "backend": {
          "language": "JavaScript",
          "framework": "Node.js with Express",
          "reasoning": "Node.js with Express is a good choice for this project because it allows for rapid development and uses JavaScript, which can be used on both the frontend and backend. This simplifies development and reduces the need to switch between languages."
        },
        "frontend": {
          "language": "JavaScript",
          "framework": "React",
          "reasoning": "React is a popular and efficient library for building user interfaces. It offers a component-based architecture, making it easy to manage and update the UI. Its virtual DOM improves performance, which is crucial for quick loading times (REQ-003)."
        },
        "database": {
          "type": "PostgreSQL",
          "reasoning": "PostgreSQL is a robust and reliable relational database. It offers strong data integrity and supports complex queries. It's a good choice for this project because it can handle the data requirements and provides good security."
        },
        "architecture_pattern": "Monolithic Architecture",
        "deployment_environment": {
          "cloud_platform": "AWS",
          "reasoning": "AWS offers a wide range of services, including hosting, databases, and serverless functions. It's a good choice for this project because it provides scalability, security, and reliability."
        },
        "key_libraries_tools": [
          {
            "name": "React Router",
            "purpose": "For navigation in the React frontend."
          },
          {
            "name": "Axios",
            "purpose": "For making API calls from the frontend."
          },
          {
            "name": "Express",
            "purpose": "For building the backend API."
          },
          {
            "name": "Postman",
            "purpose": "For testing the API."
          },
          {
            "name": "Git",
            "purpose": "For version control."
          },
          {
            "name": "VS Code",
            "purpose": "For code editing and development."
          }
        ],
        "estimated_complexity": "Low"
      },
      "selected_stack": null
    },
    "frontend_options": [
      {
        "name": "React",
        "language": "JavaScript",
        "reasoning": "React is a popular and efficient library for building user interfaces. It offers a component-based architecture, making it easy to manage and update the UI. Its virtual DOM improves performance, which is crucial for quick loading times (REQ-003).",
        "key_libraries": [
          "React Router (for navigation)",
          "Axios (for API calls)",
          "Material UI/Ant Design (for UI components)"
        ],
        "pros": [
          "Large community and extensive documentation.",
          "Component-based architecture promotes code reusability and maintainability.",
          "Virtual DOM for efficient updates.",
          "Excellent performance."
        ],
        "cons": [
          "Requires understanding of JavaScript and JSX.",
          "Can have a steeper learning curve for beginners."
        ],
        "selected": true
      },
      {
        "name": "Vue.js",
        "language": "JavaScript",
        "reasoning": "Vue.js is a progressive framework that's easy to learn and integrate. It's known for its simplicity and excellent documentation, making it suitable for this small project. It also offers good performance and a clear separation of concerns.",
        "key_libraries": [
          "Vue Router (for navigation)",
          "Axios (for API calls)",
          "Vuetify/Element UI (for UI components)"
        ],
        "pros": [
          "Easy to learn and use.",
          "Good performance.",
          "Clear and concise syntax.",
          "Excellent documentation."
        ],
        "cons": [
          "Smaller community compared to React.",
          "Ecosystem might not be as extensive as React's."
        ],
        "selected": false
      },
      {
        "name": "HTML, CSS, JavaScript (Vanilla)",
        "language": "JavaScript",
        "reasoning": "For a simple task list, using vanilla JavaScript, HTML, and CSS can be a viable option. It avoids the overhead of a framework, resulting in potentially faster initial load times. This approach is suitable for small projects where complexity is low.",
        "key_libraries": [],
        "pros": [
          "No external dependencies.",
          "Fastest initial load times.",
          "Simple to understand and debug."
        ],
        "cons": [
          "More manual DOM manipulation.",
          "Can become complex to manage as the application grows.",
          "Less structure compared to frameworks."
        ],
        "selected": false
      }
    ],
    "backend_options": [
      {
        "name": "Node.js with Express",
        "language": "JavaScript",
        "reasoning": "Node.js with Express provides a lightweight and efficient backend solution. JavaScript is used on both the frontend and backend, which simplifies development. Express makes it easy to create RESTful APIs, which is suitable for this project.",
        "key_libraries": [
          "Express (web framework)",
          "body-parser (for parsing request bodies)",
          "cors (for handling CORS)",
          "jsonwebtoken (for authentication)"
        ],
        "pros": [
          "JavaScript on both frontend and backend (full-stack JavaScript).",
          "Large community and extensive documentation.",
          "Fast development with Express.",
          "Good performance with Node.js's non-blocking I/O."
        ],
        "cons": [
          "Callback hell can be an issue if not managed properly.",
          "Requires knowledge of JavaScript and Node.js."
        ],
        "selected": true
      },
      {
        "name": "Python with Flask",
        "language": "Python",
        "reasoning": "Flask is a lightweight Python web framework that's easy to learn and use. Python is a versatile language, and Flask is well-suited for building REST APIs. This option provides a good balance between simplicity and functionality.",
        "key_libraries": [
          "Flask (web framework)",
          "Flask-RESTful (for building REST APIs)",
          "Flask-CORS (for handling CORS)",
          "PyJWT (for authentication)"
        ],
        "pros": [
          "Easy to learn and use.",
          "Python's readability.",
          "Good for building REST APIs.",
          "Large community and extensive documentation."
        ],
        "cons": [
          "Requires knowledge of Python.",
          "Can be slightly slower than Node.js for some tasks."
        ],
        "selected": false
      },
      {
        "name": "Java with Spring Boot",
        "language": "Java",
        "reasoning": "Spring Boot provides a robust and scalable backend solution. Java is a mature language with a large ecosystem. Spring Boot simplifies the development process and offers features like dependency injection and security.",
        "key_libraries": [
          "Spring Boot (web framework)",
          "Spring Data JPA (for database interaction)",
          "Spring Security (for authentication and authorization)",
          "Jackson (for JSON serialization/deserialization)"
        ],
        "pros": [
          "Robust and scalable.",
          "Large community and extensive documentation.",
          "Mature ecosystem.",
          "Good for enterprise-level applications."
        ],
        "cons": [
          "Steeper learning curve.",
          "More verbose than other options.",
          "Can be slower development speed."
        ],
        "selected": false
      }
    ],
    "database_options": [
      {
        "name": "PostgreSQL",
        "language": null,
        "reasoning": "PostgreSQL is a robust and reliable relational database. It offers strong data integrity and supports complex queries. It's a good choice for this project because it can handle the data requirements and provides good security.",
        "key_libraries": [],
        "pros": [
          "Reliable and mature.",
          "Supports complex queries.",
          "Strong data integrity.",
          "Good security features."
        ],
        "cons": [
          "Can be more complex to set up and manage than simpler databases.",
          "Requires knowledge of SQL."
        ],
        "selected": true
      },
      {
        "name": "MongoDB",
        "language": null,
        "reasoning": "MongoDB is a NoSQL database that's easy to set up and use. It's a good choice for this project because it can handle the data requirements and provides good performance. It's schema-less, which can be advantageous for rapid development.",
        "key_libraries": [],
        "pros": [
          "Easy to set up and use.",
          "Schema-less design allows for flexibility.",
          "Good performance.",
          "Scalable."
        ],
        "cons": [
          "Data consistency can be more challenging to manage.",
          "Query language can be less intuitive than SQL."
        ],
        "selected": false
      },
      {
        "name": "SQLite",
        "language": null,
        "reasoning": "SQLite is a lightweight, file-based database that's easy to integrate. It's suitable for small projects and prototyping. It requires no separate server process, making deployment simple.",
        "key_libraries": [],
        "pros": [
          "Simple to set up and use.",
          "No separate server process required.",
          "Good for small projects and prototyping."
        ],
        "cons": [
          "Not suitable for high-traffic applications.",
          "Limited scalability.",
          "Less robust than other options."
        ],
        "selected": false
      }
    ],
    "cloud_options": [
      {
        "name": "AWS (Amazon Web Services)",
        "language": null,
        "reasoning": "AWS offers a wide range of services, including hosting, databases, and serverless functions. It's a good choice for this project because it provides scalability, security, and reliability. Services like EC2, RDS, and S3 can be used.",
        "key_libraries": [],
        "pros": [
          "Scalable and reliable.",
          "Wide range of services.",
          "Mature platform.",
          "Good security features."
        ],
        "cons": [
          "Can be complex to manage.",
          "Can be expensive if not managed properly.",
          "Steeper learning curve."
        ],
        "selected": true
      },
      {
        "name": "Google Cloud Platform (GCP)",
        "language": null,
        "reasoning": "GCP offers a similar set of services to AWS, including hosting, databases, and serverless functions. It's a good choice for this project because it provides scalability, security, and reliability. Services like Compute Engine, Cloud SQL, and Cloud Storage can be used.",
        "key_libraries": [],
        "pros": [
          "Scalable and reliable.",
          "Competitive pricing.",
          "Good integration with Google services.",
          "Good security features."
        ],
        "cons": [
          "Can be complex to manage.",
          "Steeper learning curve.",
          "Less mature than AWS."
        ],
        "selected": false
      },
      {
        "name": "Heroku",
        "language": null,
        "reasoning": "Heroku is a Platform-as-a-Service (PaaS) that simplifies deployment and management. It's a good choice for this project because it's easy to use and provides a simple deployment process. It abstracts away much of the infrastructure management.",
        "key_libraries": [],
        "pros": [
          "Easy to deploy and manage.",
          "Simple deployment process.",
          "Good for small projects.",
          "Focus on developer experience."
        ],
        "cons": [
          "Limited customization options.",
          "Can be more expensive than other options.",
          "Less control over infrastructure."
        ],
        "selected": false
      }
    ],
    "architecture_options": [
      {
        "pattern": "Monolithic Architecture",
        "scalability_score": 5.0,
        "maintainability_score": 6.0,
        "development_speed_score": 8.0,
        "overall_score": 7.0,
        "reasoning": "For a simple task list application, a monolithic architecture is a good starting point. It's easy to develop and deploy. All components are within a single codebase. While it may become harder to scale later, it's suitable for the initial requirements.",
        "selected": true
      },
      {
        "pattern": "Microservices Architecture",
        "scalability_score": 8.0,
        "maintainability_score": 7.0,
        "development_speed_score": 5.0,
        "overall_score": 6.0,
        "reasoning": "While microservices offer excellent scalability and maintainability, they introduce complexity that's likely unnecessary for this small project. The overhead of managing multiple services and their communication outweighs the benefits at this stage.",
        "selected": false
      },
      {
        "pattern": "Serverless Architecture",
        "scalability_score": 9.0,
        "maintainability_score": 7.0,
        "development_speed_score": 6.0,
        "overall_score": 6.5,
        "reasoning": "Serverless architecture can be a good option for scalability and cost-effectiveness. However, it can add complexity in terms of debugging and monitoring. It may be overkill for this simple application.",
        "selected": false
      }
    ],
    "tool_options": [
      {
        "name": "Git",
        "language": null,
        "reasoning": "Git is essential for version control and collaboration. It allows developers to track changes, revert to previous versions, and work together on the codebase.",
        "key_libraries": [],
        "pros": [],
        "cons": [],
        "selected": true
      },
      {
        "name": "VS Code",
        "language": null,
        "reasoning": "VS Code is a popular and versatile code editor with excellent support for various languages and frameworks. It provides features like code completion, debugging, and integrated terminal.",
        "key_libraries": [],
        "pros": [],
        "cons": [],
        "selected": false
      },
      {
        "name": "Postman",
        "language": null,
        "reasoning": "Postman is a useful tool for testing APIs. It allows developers to send requests, inspect responses, and debug API interactions.",
        "key_libraries": [],
        "pros": [],
        "cons": [],
        "selected": false
      }
    ],
    "risks": [
      {
        "category": "Security",
        "description": "The application must be secured to prevent unauthorized access and data breaches. This includes protecting user data and preventing cross-site scripting (XSS) and other vulnerabilities. (REQ-004)",
        "severity": "High",
        "likelihood": "Medium",
        "mitigation": "Implement proper authentication and authorization mechanisms. Sanitize all user inputs to prevent XSS attacks. Use HTTPS to encrypt all communication. Regularly update dependencies to patch security vulnerabilities."
      },
      {
        "category": "Performance",
        "description": "The application must load quickly to provide a good user experience. Slow loading times can lead to user frustration and abandonment. (REQ-003)",
        "severity": "Medium",
        "likelihood": "Medium",
        "mitigation": "Optimize images and other assets. Minimize the use of external libraries. Use caching techniques. Optimize database queries. Consider using a Content Delivery Network (CDN)."
      },
      {
        "category": "Scalability",
        "description": "As the application grows, it may need to handle more users and data. The chosen architecture and infrastructure should be able to scale to accommodate this growth.",
        "severity": "Low",
        "likelihood": "Low",
        "mitigation": "Choose a database and cloud platform that can scale. Design the application with scalability in mind. Consider using a load balancer if the application becomes popular."
      },
      {
        "category": "Development Speed",
        "description": "The project should be completed within a reasonable timeframe. Delays can lead to increased costs and missed opportunities.",
        "severity": "Medium",
        "likelihood": "Medium",
        "mitigation": "Choose technologies that are familiar to the development team. Use a framework that promotes rapid development. Implement a well-defined development process. Use a project management tool to track progress."
      }
    ],
    "synthesis": {
      "backend": {
        "language": "JavaScript",
        "framework": "Node.js with Express",
        "reasoning": "Node.js with Express is a good choice for this project because it allows for rapid development and uses JavaScript, which can be used on both the frontend and backend. This simplifies development and reduces the need to switch between languages."
      },
      "frontend": {
        "language": "JavaScript",
        "framework": "React",
        "reasoning": "React is a popular and efficient library for building user interfaces. It offers a component-based architecture, making it easy to manage and update the UI. Its virtual DOM improves performance, which is crucial for quick loading times (REQ-003)."
      },
      "database": {
        "type": "PostgreSQL",
        "reasoning": "PostgreSQL is a robust and reliable relational database. It offers strong data integrity and supports complex queries. It's a good choice for this project because it can handle the data requirements and provides good security."
      },
      "architecture_pattern": "Monolithic Architecture",
      "deployment_environment": {
        "cloud_platform": "AWS",
        "reasoning": "AWS offers a wide range of services, including hosting, databases, and serverless functions. It's a good choice for this project because it provides scalability, security, and reliability."
      },
      "key_libraries_tools": [
        {
          "name": "React Router",
          "purpose": "For navigation in the React frontend."
        },
        {
          "name": "Axios",
          "purpose": "For making API calls from the frontend."
        },
        {
          "name": "Express",
          "purpose": "For building the backend API."
        },
        {
          "name": "Postman",
          "purpose": "For testing the API."
        },
        {
          "name": "Git",
          "purpose": "For version control."
        },
        {
          "name": "VS Code",
          "purpose": "For code editing and development."
        }
      ],
      "estimated_complexity": "Low"
    },
    "selected_stack": {}
  },
  "workflow_state_snapshot": {
    "requirements_analysis": {
      "project_name": "Hello World Task List",
      "project_summary": "A simple web application to manage a list of tasks.",
      "project_goals": [
        "Allow a user to add a task",
        "Allow a user to see their list of tasks"
      ],
      "target_audience": [
        "Users who want to manage a list of tasks"
      ],
      "business_context": "This project aims to provide a basic task management tool.",
      "requirements": [
        {
          "id": "REQ-001",
          "description": "A user can create a new task with a text description.",
          "category": "functional",
          "priority": 1
        },
        {
          "id": "REQ-002",
          "description": "A user can see a list of all created tasks.",
          "category": "functional",
          "priority": 1
        },
        {
          "id": "REQ-003",
          "description": "The application must load quickly.",
          "category": "non_functional",
          "priority": 2
        },
        {
          "id": "REQ-004",
          "description": "The application must be secure.",
          "category": "non_functional",
          "priority": 2
        }
      ],
      "functional_requirements": [
        "A user can create a new task with a text description.",
        "A user can see a list of all created tasks."
      ],
      "non_functional_requirements": [
        "The application must load quickly.",
        "The application must be secure."
      ],
      "stakeholders": [
        "Users"
      ],
      "success_criteria": [
        "Users can successfully add tasks.",
        "Users can successfully view their task list.",
        "The application loads quickly.",
        "The application is secure."
      ],
      "constraints": [],
      "assumptions": [],
      "risks": [],
      "domain_specific_details": {},
      "quality_assessment": {
        "clarity_score": 9.0,
        "completeness_score": 8.0,
        "consistency_score": 10.0,
        "recommendations": []
      },
      "gap_analysis": {
        "identified_gaps": [],
        "recommendations_for_completion": []
      }
    },
    "tech_stack_recommendation": {
      "tech_stack_result": "frontend_options=[TechStackComponent(name='React', language='JavaScript', reasoning='React is a popular and efficient library for building user interfaces. It offers a component-based architecture, making it easy to manage and update the UI. Its virtual DOM improves performance, which is crucial for quick loading times (REQ-003).', key_libraries=['React Router (for navigation)', 'Axios (for API calls)', 'Material UI/Ant Design (for UI components)'], pros=['Large community and extensive documentation.', 'Component-based architecture promotes code reusability and maintainability.', 'Virtual DOM for efficient updates.', 'Excellent performance.'], cons=['Requires understanding of JavaScript and JSX.', 'Can have a steeper learning curve for beginners.'], selected=False), TechStackComponent(name='Vue.js', language='JavaScript', reasoning=\"Vue.js is a progressive framework that's easy to learn and integrate. It's known for its simplicity and excellent documentation, making it suitable for this small project. It also offers good performance and a clear separation of concerns.\", key_libraries=['Vue Router (for navigation)', 'Axios (for API calls)', 'Vuetify/Element UI (for UI components)'], pros=['Easy to learn and use.', 'Good performance.', 'Clear and concise syntax.', 'Excellent documentation.'], cons=['Smaller community compared to React.', \"Ecosystem might not be as extensive as React's.\"], selected=False), TechStackComponent(name='HTML, CSS, JavaScript (Vanilla)', language='JavaScript', reasoning='For a simple task list, using vanilla JavaScript, HTML, and CSS can be a viable option. It avoids the overhead of a framework, resulting in potentially faster initial load times. This approach is suitable for small projects where complexity is low.', key_libraries=[], pros=['No external dependencies.', 'Fastest initial load times.', 'Simple to understand and debug.'], cons=['More manual DOM manipulation.', 'Can become complex to manage as the application grows.', 'Less structure compared to frameworks.'], selected=False)] backend_options=[TechStackComponent(name='Node.js with Express', language='JavaScript', reasoning='Node.js with Express provides a lightweight and efficient backend solution. JavaScript is used on both the frontend and backend, which simplifies development. Express makes it easy to create RESTful APIs, which is suitable for this project.', key_libraries=['Express (web framework)', 'body-parser (for parsing request bodies)', 'cors (for handling CORS)', 'jsonwebtoken (for authentication)'], pros=['JavaScript on both frontend and backend (full-stack JavaScript).', 'Large community and extensive documentation.', 'Fast development with Express.', \"Good performance with Node.js's non-blocking I/O.\"], cons=['Callback hell can be an issue if not managed properly.', 'Requires knowledge of JavaScript and Node.js.'], selected=False), TechStackComponent(name='Python with Flask', language='Python', reasoning=\"Flask is a lightweight Python web framework that's easy to learn and use. Python is a versatile language, and Flask is well-suited for building REST APIs. This option provides a good balance between simplicity and functionality.\", key_libraries=['Flask (web framework)', 'Flask-RESTful (for building REST APIs)', 'Flask-CORS (for handling CORS)', 'PyJWT (for authentication)'], pros=['Easy to learn and use.', \"Python's readability.\", 'Good for building REST APIs.', 'Large community and extensive documentation.'], cons=['Requires knowledge of Python.', 'Can be slightly slower than Node.js for some tasks.'], selected=False), TechStackComponent(name='Java with Spring Boot', language='Java', reasoning='Spring Boot provides a robust and scalable backend solution. Java is a mature language with a large ecosystem. Spring Boot simplifies the development process and offers features like dependency injection and security.', key_libraries=['Spring Boot (web framework)', 'Spring Data JPA (for database interaction)', 'Spring Security (for authentication and authorization)', 'Jackson (for JSON serialization/deserialization)'], pros=['Robust and scalable.', 'Large community and extensive documentation.', 'Mature ecosystem.', 'Good for enterprise-level applications.'], cons=['Steeper learning curve.', 'More verbose than other options.', 'Can be slower development speed.'], selected=False)] database_options=[TechStackComponent(name='PostgreSQL', language=None, reasoning=\"PostgreSQL is a robust and reliable relational database. It offers strong data integrity and supports complex queries. It's a good choice for this project because it can handle the data requirements and provides good security.\", key_libraries=[], pros=['Reliable and mature.', 'Supports complex queries.', 'Strong data integrity.', 'Good security features.'], cons=['Can be more complex to set up and manage than simpler databases.', 'Requires knowledge of SQL.'], selected=False), TechStackComponent(name='MongoDB', language=None, reasoning=\"MongoDB is a NoSQL database that's easy to set up and use. It's a good choice for this project because it can handle the data requirements and provides good performance. It's schema-less, which can be advantageous for rapid development.\", key_libraries=[], pros=['Easy to set up and use.', 'Schema-less design allows for flexibility.', 'Good performance.', 'Scalable.'], cons=['Data consistency can be more challenging to manage.', 'Query language can be less intuitive than SQL.'], selected=False), TechStackComponent(name='SQLite', language=None, reasoning=\"SQLite is a lightweight, file-based database that's easy to integrate. It's suitable for small projects and prototyping. It requires no separate server process, making deployment simple.\", key_libraries=[], pros=['Simple to set up and use.', 'No separate server process required.', 'Good for small projects and prototyping.'], cons=['Not suitable for high-traffic applications.', 'Limited scalability.', 'Less robust than other options.'], selected=False)] cloud_options=[TechStackComponent(name='AWS (Amazon Web Services)', language=None, reasoning=\"AWS offers a wide range of services, including hosting, databases, and serverless functions. It's a good choice for this project because it provides scalability, security, and reliability. Services like EC2, RDS, and S3 can be used.\", key_libraries=[], pros=['Scalable and reliable.', 'Wide range of services.', 'Mature platform.', 'Good security features.'], cons=['Can be complex to manage.', 'Can be expensive if not managed properly.', 'Steeper learning curve.'], selected=False), TechStackComponent(name='Google Cloud Platform (GCP)', language=None, reasoning=\"GCP offers a similar set of services to AWS, including hosting, databases, and serverless functions. It's a good choice for this project because it provides scalability, security, and reliability. Services like Compute Engine, Cloud SQL, and Cloud Storage can be used.\", key_libraries=[], pros=['Scalable and reliable.', 'Competitive pricing.', 'Good integration with Google services.', 'Good security features.'], cons=['Can be complex to manage.', 'Steeper learning curve.', 'Less mature than AWS.'], selected=False), TechStackComponent(name='Heroku', language=None, reasoning=\"Heroku is a Platform-as-a-Service (PaaS) that simplifies deployment and management. It's a good choice for this project because it's easy to use and provides a simple deployment process. It abstracts away much of the infrastructure management.\", key_libraries=[], pros=['Easy to deploy and manage.', 'Simple deployment process.', 'Good for small projects.', 'Focus on developer experience.'], cons=['Limited customization options.', 'Can be more expensive than other options.', 'Less control over infrastructure.'], selected=False)] architecture_options=[ArchitecturePatternOption(pattern='Monolithic Architecture', scalability_score=5.0, maintainability_score=6.0, development_speed_score=8.0, overall_score=7.0, reasoning=\"For a simple task list application, a monolithic architecture is a good starting point. It's easy to develop and deploy. All components are within a single codebase. While it may become harder to scale later, it's suitable for the initial requirements.\"), ArchitecturePatternOption(pattern='Microservices Architecture', scalability_score=8.0, maintainability_score=7.0, development_speed_score=5.0, overall_score=6.0, reasoning=\"While microservices offer excellent scalability and maintainability, they introduce complexity that's likely unnecessary for this small project. The overhead of managing multiple services and their communication outweighs the benefits at this stage.\"), ArchitecturePatternOption(pattern='Serverless Architecture', scalability_score=9.0, maintainability_score=7.0, development_speed_score=6.0, overall_score=6.5, reasoning='Serverless architecture can be a good option for scalability and cost-effectiveness. However, it can add complexity in terms of debugging and monitoring. It may be overkill for this simple application.')] tool_options=[TechStackComponent(name='Git', language=None, reasoning='Git is essential for version control and collaboration. It allows developers to track changes, revert to previous versions, and work together on the codebase.', key_libraries=[], pros=[], cons=[], selected=False), TechStackComponent(name='VS Code', language=None, reasoning='VS Code is a popular and versatile code editor with excellent support for various languages and frameworks. It provides features like code completion, debugging, and integrated terminal.', key_libraries=[], pros=[], cons=[], selected=False), TechStackComponent(name='Postman', language=None, reasoning='Postman is a useful tool for testing APIs. It allows developers to send requests, inspect responses, and debug API interactions.', key_libraries=[], pros=[], cons=[], selected=False)] risks=[TechRisk(category='Security', description='The application must be secured to prevent unauthorized access and data breaches. This includes protecting user data and preventing cross-site scripting (XSS) and other vulnerabilities. (REQ-004)', severity='High', likelihood='Medium', mitigation='Implement proper authentication and authorization mechanisms. Sanitize all user inputs to prevent XSS attacks. Use HTTPS to encrypt all communication. Regularly update dependencies to patch security vulnerabilities.'), TechRisk(category='Performance', description='The application must load quickly to provide a good user experience. Slow loading times can lead to user frustration and abandonment. (REQ-003)', severity='Medium', likelihood='Medium', mitigation='Optimize images and other assets. Minimize the use of external libraries. Use caching techniques. Optimize database queries. Consider using a Content Delivery Network (CDN).'), TechRisk(category='Scalability', description='As the application grows, it may need to handle more users and data. The chosen architecture and infrastructure should be able to scale to accommodate this growth.', severity='Low', likelihood='Low', mitigation='Choose a database and cloud platform that can scale. Design the application with scalability in mind. Consider using a load balancer if the application becomes popular.'), TechRisk(category='Development Speed', description='The project should be completed within a reasonable timeframe. Delays can lead to increased costs and missed opportunities.', severity='Medium', likelihood='Medium', mitigation='Choose technologies that are familiar to the development team. Use a framework that promotes rapid development. Implement a well-defined development process. Use a project management tool to track progress.')] synthesis=TechStackSynthesisOutput(backend={'language': 'JavaScript', 'framework': 'Node.js with Express', 'reasoning': 'Node.js with Express is a good choice for this project because it allows for rapid development and uses JavaScript, which can be used on both the frontend and backend. This simplifies development and reduces the need to switch between languages.'}, frontend={'language': 'JavaScript', 'framework': 'React', 'reasoning': 'React is a popular and efficient library for building user interfaces. It offers a component-based architecture, making it easy to manage and update the UI. Its virtual DOM improves performance, which is crucial for quick loading times (REQ-003).'}, database={'type': 'PostgreSQL', 'reasoning': \"PostgreSQL is a robust and reliable relational database. It offers strong data integrity and supports complex queries. It's a good choice for this project because it can handle the data requirements and provides good security.\"}, architecture_pattern='Monolithic Architecture', deployment_environment={'cloud_platform': 'AWS', 'reasoning': \"AWS offers a wide range of services, including hosting, databases, and serverless functions. It's a good choice for this project because it provides scalability, security, and reliability.\"}, key_libraries_tools=[LibraryTool(name='React Router', purpose='For navigation in the React frontend.'), LibraryTool(name='Axios', purpose='For making API calls from the frontend.'), LibraryTool(name='Express', purpose='For building the backend API.'), LibraryTool(name='Postman', purpose='For testing the API.'), LibraryTool(name='Git', purpose='For version control.'), LibraryTool(name='VS Code', purpose='For code editing and development.')], estimated_complexity='Low') selected_stack=None"
    }
  }
}