{
  "session_id": "session_ce49504a-4a35-463a-9e23-07b0ea30d8f8",
  "approval_type": "implementation_plan",
  "timestamp": 1751986865,
  "approval_data": {
    "type": "implementation_plan",
    "timestamp": 1751986865.024729,
    "project_overview": "Develop a simple web application for managing a list of tasks, including frontend UI, backend API, and database integration, deployed on AWS.",
    "development_phases": [
      {
        "name": "Frontend Phase",
        "description": "Tasks related to frontend phase",
        "deliverables": [
          "Completed FE-001",
          "Completed FE-002",
          "Completed FE-003",
          "Completed FE-004",
          "Completed FE-005",
          "Completed FE-006",
          "Completed FE-007",
          "Completed FE-008",
          "Completed TEST-002"
        ],
        "estimated_duration_hours": 42.0,
        "work_items": [
          {
            "id": "FE-001",
            "description": "Set up React project using Create React App.",
            "dependencies": [],
            "estimated_time": "2 hours",
            "agent_role": "frontend_developer",
            "acceptance_criteria": [
              "Project is initialized successfully.",
              "Default React app runs without errors."
            ],
            "status": "pending",
            "code_files": [
              "package.json",
              "src/App.js",
              "src/index.js"
            ]
          },
          {
            "id": "FE-002",
            "description": "Design and implement the UI for adding a new task (input field and add button).",
            "dependencies": [
              "FE-001"
            ],
            "estimated_time": "4 hours",
            "agent_role": "frontend_developer",
            "acceptance_criteria": [
              "UI elements for task input and add button are present.",
              "UI elements are styled appropriately."
            ],
            "status": "pending",
            "code_files": [
              "src/App.js",
              "src/App.css"
            ]
          },
          {
            "id": "FE-003",
            "description": "Design and implement the UI for displaying the task list (using a list or table).",
            "dependencies": [
              "FE-001"
            ],
            "estimated_time": "4 hours",
            "agent_role": "frontend_developer",
            "acceptance_criteria": [
              "Task list UI element is present.",
              "Task list UI element is styled appropriately."
            ],
            "status": "pending",
            "code_files": [
              "src/App.js",
              "src/App.css"
            ]
          },
          {
            "id": "FE-004",
            "description": "Implement basic styling for the UI elements (using CSS).",
            "dependencies": [
              "FE-002",
              "FE-003"
            ],
            "estimated_time": "4 hours",
            "agent_role": "frontend_developer",
            "acceptance_criteria": [
              "UI elements are visually appealing.",
              "UI elements are responsive."
            ],
            "status": "pending",
            "code_files": [
              "src/App.css"
            ]
          },
          {
            "id": "FE-005",
            "description": "Implement API calls to create a new task (FE-002).",
            "dependencies": [
              "FE-002",
              "BE-002",
              "BE-007"
            ],
            "estimated_time": "6 hours",
            "agent_role": "frontend_developer",
            "acceptance_criteria": [
              "User input is sent to the backend API.",
              "Frontend displays a success message upon successful task creation.",
              "Frontend handles API errors gracefully."
            ],
            "status": "pending",
            "code_files": [
              "src/App.js"
            ]
          },
          {
            "id": "FE-006",
            "description": "Implement API calls to retrieve and display the task list (FE-003).",
            "dependencies": [
              "FE-003",
              "BE-003",
              "BE-008"
            ],
            "estimated_time": "6 hours",
            "agent_role": "frontend_developer",
            "acceptance_criteria": [
              "Tasks are retrieved from the backend API.",
              "Tasks are displayed correctly in the task list.",
              "Frontend handles API errors gracefully."
            ],
            "status": "pending",
            "code_files": [
              "src/App.js"
            ]
          },
          {
            "id": "FE-007",
            "description": "Implement API calls to update a task (e.g., mark as complete).",
            "dependencies": [
              "FE-003",
              "BE-004",
              "BE-009"
            ],
            "estimated_time": "6 hours",
            "agent_role": "frontend_developer",
            "acceptance_criteria": [
              "Tasks can be marked as complete.",
              "Frontend updates the task list after the update.",
              "Frontend handles API errors gracefully."
            ],
            "status": "pending",
            "code_files": [
              "src/App.js"
            ]
          },
          {
            "id": "FE-008",
            "description": "Implement API calls to delete a task.",
            "dependencies": [
              "FE-003",
              "BE-005",
              "BE-010"
            ],
            "estimated_time": "4 hours",
            "agent_role": "frontend_developer",
            "acceptance_criteria": [
              "Tasks can be deleted.",
              "Frontend updates the task list after deletion.",
              "Frontend handles API errors gracefully."
            ],
            "status": "pending",
            "code_files": [
              "src/App.js"
            ]
          },
          {
            "id": "TEST-002",
            "description": "Write unit tests for the frontend components (FE-002, FE-003).",
            "dependencies": [
              "FE-002",
              "FE-003"
            ],
            "estimated_time": "6 hours",
            "agent_role": "frontend_developer",
            "acceptance_criteria": [
              "Tests cover the UI components.",
              "Tests cover user interactions.",
              "Tests achieve a high code coverage."
            ],
            "status": "pending",
            "code_files": [
              "src/App.test.js"
            ]
          }
        ]
      },
      {
        "name": "Backend Phase",
        "description": "Tasks related to backend phase",
        "deliverables": [
          "Completed BE-001",
          "Completed BE-002",
          "Completed BE-003",
          "Completed BE-004",
          "Completed BE-005",
          "Completed BE-006",
          "Completed BE-007",
          "Completed BE-008",
          "Completed BE-009",
          "Completed BE-010",
          "Completed TEST-001"
        ],
        "estimated_duration_hours": 48.0,
        "work_items": [
          {
            "id": "BE-001",
            "description": "Set up Node.js and Express project.",
            "dependencies": [],
            "estimated_time": "2 hours",
            "agent_role": "backend_developer",
            "acceptance_criteria": [
              "Project is initialized successfully.",
              "Express server runs without errors."
            ],
            "status": "pending",
            "code_files": [
              "package.json",
              "index.js"
            ]
          },
          {
            "id": "BE-002",
            "description": "Create API endpoint for creating a new task (/api/v1/tasks - POST).",
            "dependencies": [
              "BE-001"
            ],
            "estimated_time": "4 hours",
            "agent_role": "backend_developer",
            "acceptance_criteria": [
              "Endpoint accepts POST requests.",
              "Endpoint validates input data (description).",
              "Endpoint returns appropriate HTTP status codes (201, 400)."
            ],
            "status": "pending",
            "code_files": [
              "index.js"
            ]
          },
          {
            "id": "BE-003",
            "description": "Create API endpoint for retrieving all tasks (/api/v1/tasks - GET).",
            "dependencies": [
              "BE-001"
            ],
            "estimated_time": "3 hours",
            "agent_role": "backend_developer",
            "acceptance_criteria": [
              "Endpoint accepts GET requests.",
              "Endpoint returns a list of tasks in JSON format.",
              "Endpoint returns appropriate HTTP status code (200)."
            ],
            "status": "pending",
            "code_files": [
              "index.js"
            ]
          },
          {
            "id": "BE-004",
            "description": "Create API endpoint for updating a task (/api/v1/tasks/:id - PUT).",
            "dependencies": [
              "BE-001"
            ],
            "estimated_time": "4 hours",
            "agent_role": "backend_developer",
            "acceptance_criteria": [
              "Endpoint accepts PUT requests.",
              "Endpoint validates input data (completed).",
              "Endpoint returns appropriate HTTP status codes (200, 400, 404)."
            ],
            "status": "pending",
            "code_files": [
              "index.js"
            ]
          },
          {
            "id": "BE-005",
            "description": "Create API endpoint for deleting a task (/api/v1/tasks/:id - DELETE).",
            "dependencies": [
              "BE-001"
            ],
            "estimated_time": "3 hours",
            "agent_role": "backend_developer",
            "acceptance_criteria": [
              "Endpoint accepts DELETE requests.",
              "Endpoint returns appropriate HTTP status codes (200, 404)."
            ],
            "status": "pending",
            "code_files": [
              "index.js"
            ]
          },
          {
            "id": "BE-006",
            "description": "Connect the backend API to the PostgreSQL database.",
            "dependencies": [
              "BE-001",
              "DB-001",
              "DB-002"
            ],
            "estimated_time": "4 hours",
            "agent_role": "backend_developer",
            "acceptance_criteria": [
              "Backend can successfully connect to the database.",
              "Database connection details are configured securely (e.g., environment variables)."
            ],
            "status": "pending",
            "code_files": [
              "index.js"
            ]
          },
          {
            "id": "BE-007",
            "description": "Implement database interactions for creating a new task (BE-002).",
            "dependencies": [
              "BE-002",
              "BE-006"
            ],
            "estimated_time": "6 hours",
            "agent_role": "backend_developer",
            "acceptance_criteria": [
              "New tasks are successfully saved to the database.",
              "Endpoint returns the newly created task with its ID.",
              "Error handling for database insertion failures is implemented."
            ],
            "status": "pending",
            "code_files": [
              "index.js"
            ]
          },
          {
            "id": "BE-008",
            "description": "Implement database interactions for retrieving all tasks (BE-003).",
            "dependencies": [
              "BE-003",
              "BE-006"
            ],
            "estimated_time": "4 hours",
            "agent_role": "backend_developer",
            "acceptance_criteria": [
              "All tasks are successfully retrieved from the database.",
              "Endpoint returns the tasks in the correct format.",
              "Error handling for database retrieval failures is implemented."
            ],
            "status": "pending",
            "code_files": [
              "index.js"
            ]
          },
          {
            "id": "BE-009",
            "description": "Implement database interactions for updating a task (BE-004).",
            "dependencies": [
              "BE-004",
              "BE-006"
            ],
            "estimated_time": "6 hours",
            "agent_role": "backend_developer",
            "acceptance_criteria": [
              "Tasks are successfully updated in the database.",
              "Endpoint returns the updated task.",
              "Error handling for database update failures and task not found is implemented."
            ],
            "status": "pending",
            "code_files": [
              "index.js"
            ]
          },
          {
            "id": "BE-010",
            "description": "Implement database interactions for deleting a task (BE-005).",
            "dependencies": [
              "BE-005",
              "BE-006"
            ],
            "estimated_time": "4 hours",
            "agent_role": "backend_developer",
            "acceptance_criteria": [
              "Tasks are successfully deleted from the database.",
              "Endpoint returns a success message.",
              "Error handling for database deletion failures and task not found is implemented."
            ],
            "status": "pending",
            "code_files": [
              "index.js"
            ]
          },
          {
            "id": "TEST-001",
            "description": "Write unit tests for the backend API endpoints (BE-002, BE-003, BE-004, BE-005).",
            "dependencies": [
              "BE-002",
              "BE-003",
              "BE-004",
              "BE-005"
            ],
            "estimated_time": "8 hours",
            "agent_role": "backend_developer",
            "acceptance_criteria": [
              "Tests cover all API endpoints.",
              "Tests cover positive and negative test cases.",
              "Tests achieve a high code coverage."
            ],
            "status": "pending",
            "code_files": [
              "tests/index.test.js"
            ]
          }
        ]
      },
      {
        "name": "Database Phase",
        "description": "Tasks related to database phase",
        "deliverables": [
          "Completed DB-001",
          "Completed DB-002"
        ],
        "estimated_duration_hours": 6.0,
        "work_items": [
          {
            "id": "DB-001",
            "description": "Set up PostgreSQL database.",
            "dependencies": [],
            "estimated_time": "4 hours",
            "agent_role": "database_specialist",
            "acceptance_criteria": [
              "PostgreSQL database is installed and running.",
              "Database is accessible via a client (e.g., psql, pgAdmin)."
            ],
            "status": "pending",
            "code_files": []
          },
          {
            "id": "DB-002",
            "description": "Create the 'tasks' table in the PostgreSQL database.",
            "dependencies": [
              "DB-001"
            ],
            "estimated_time": "2 hours",
            "agent_role": "database_specialist",
            "acceptance_criteria": [
              "Tasks table exists with the correct schema (id, description, created_at, completed).",
              "Primary key constraint is set on the 'id' column.",
              "'created_at' column has a default value of CURRENT_TIMESTAMP."
            ],
            "status": "pending",
            "code_files": []
          }
        ]
      },
      {
        "name": "Devops_Engineer Phase",
        "description": "Tasks related to devops_engineer phase",
        "deliverables": [
          "Completed DEPLOY-001",
          "Completed DEPLOY-002",
          "Completed DEPLOY-003",
          "Completed DEPLOY-004",
          "Completed DEPLOY-005"
        ],
        "estimated_duration_hours": 32.0,
        "work_items": [
          {
            "id": "DEPLOY-001",
            "description": "Set up AWS infrastructure (EC2, S3, RDS).",
            "dependencies": [
              "DB-001"
            ],
            "estimated_time": "8 hours",
            "agent_role": "devops_engineer",
            "acceptance_criteria": [
              "EC2 instance is created and running.",
              "S3 bucket is created.",
              "RDS instance is created and accessible."
            ],
            "status": "pending",
            "code_files": []
          },
          {
            "id": "DEPLOY-002",
            "description": "Deploy the React frontend to S3 and configure CloudFront.",
            "dependencies": [
              "FE-001",
              "FE-005",
              "FE-006",
              "FE-007",
              "FE-008",
              "DEPLOY-001"
            ],
            "estimated_time": "6 hours",
            "agent_role": "devops_engineer",
            "acceptance_criteria": [
              "Frontend is deployed to S3.",
              "CloudFront distribution is configured.",
              "Frontend is accessible via a public URL."
            ],
            "status": "pending",
            "code_files": []
          },
          {
            "id": "DEPLOY-003",
            "description": "Deploy the Node.js backend to EC2.",
            "dependencies": [
              "BE-001",
              "BE-002",
              "BE-003",
              "BE-004",
              "BE-005",
              "BE-006",
              "BE-007",
              "BE-008",
              "BE-009",
              "BE-010",
              "DEPLOY-001"
            ],
            "estimated_time": "8 hours",
            "agent_role": "devops_engineer",
            "acceptance_criteria": [
              "Backend is deployed to EC2.",
              "Backend is running and accessible.",
              "Backend is configured to connect to the RDS database."
            ],
            "status": "pending",
            "code_files": []
          },
          {
            "id": "DEPLOY-004",
            "description": "Configure database on RDS.",
            "dependencies": [
              "DB-001",
              "DEPLOY-001",
              "BE-006"
            ],
            "estimated_time": "4 hours",
            "agent_role": "devops_engineer",
            "acceptance_criteria": [
              "Database is accessible from the EC2 instance.",
              "Database is configured with appropriate security settings."
            ],
            "status": "pending",
            "code_files": []
          },
          {
            "id": "DEPLOY-005",
            "description": "Set up monitoring and logging using CloudWatch.",
            "dependencies": [
              "DEPLOY-001",
              "DEPLOY-003"
            ],
            "estimated_time": "6 hours",
            "agent_role": "devops_engineer",
            "acceptance_criteria": [
              "CloudWatch is configured to monitor application performance.",
              "Logs are being collected from the frontend and backend.",
              "Alerts are set up for critical issues."
            ],
            "status": "pending",
            "code_files": []
          }
        ]
      }
    ],
    "timeline_estimation": {
      "start_date": "2025-07-08T20:31:02.764931",
      "end_date": "TBD",
      "milestones": []
    },
    "risk_assessment": [],
    "resource_requirements": [
      {
        "role": "Devops Engineer",
        "count": 1,
        "estimated_time_allocation": "100%",
        "phases": [
          "Devops_Engineer Phase"
        ],
        "skills_required": []
      },
      {
        "role": "Frontend Developer",
        "count": 1,
        "estimated_time_allocation": "100%",
        "phases": [
          "Frontend Phase"
        ],
        "skills_required": []
      },
      {
        "role": "Database Specialist",
        "count": 1,
        "estimated_time_allocation": "100%",
        "phases": [
          "Database Phase"
        ],
        "skills_required": []
      },
      {
        "role": "Backend Developer",
        "count": 1,
        "estimated_time_allocation": "100%",
        "phases": [
          "Backend Phase"
        ],
        "skills_required": []
      }
    ],
    "deliverables": [
      "Completed FE-001",
      "Completed FE-002",
      "Completed FE-003",
      "Completed FE-004",
      "Completed FE-005",
      "Completed FE-006",
      "Completed FE-007",
      "Completed FE-008",
      "Completed TEST-002",
      "Completed BE-001",
      "Completed BE-002",
      "Completed BE-003",
      "Completed BE-004",
      "Completed BE-005",
      "Completed BE-006",
      "Completed BE-007",
      "Completed BE-008",
      "Completed BE-009",
      "Completed BE-010",
      "Completed TEST-001",
      "Completed DB-001",
      "Completed DB-002",
      "Completed DEPLOY-001",
      "Completed DEPLOY-002",
      "Completed DEPLOY-003",
      "Completed DEPLOY-004",
      "Completed DEPLOY-005"
    ],
    "dependencies": [],
    "raw_plan": "plan=ImplementationPlan(project_summary={'title': 'Generated Project Plan', 'description': 'Develop a simple web application for managing a list of tasks, including frontend UI, backend API, and database integration, deployed on AWS.', 'overall_complexity': 'Medium', 'estimated_duration': 'TBD', 'key_challenges': [], 'success_criteria': []}, phases=[{'name': 'Frontend Phase', 'description': 'Tasks related to frontend phase', 'deliverables': ['Completed FE-001', 'Completed FE-002', 'Completed FE-003', 'Completed FE-004', 'Completed FE-005', 'Completed FE-006', 'Completed FE-007', 'Completed FE-008', 'Completed TEST-002'], 'estimated_duration_hours': 42.0, 'work_items': [{'id': 'FE-001', 'description': 'Set up React project using Create React App.', 'dependencies': [], 'estimated_time': '2 hours', 'agent_role': 'frontend_developer', 'acceptance_criteria': ['Project is initialized successfully.', 'Default React app runs without errors.'], 'status': 'pending', 'code_files': ['package.json', 'src/App.js', 'src/index.js']}, {'id': 'FE-002', 'description': 'Design and implement the UI for adding a new task (input field and add button).', 'dependencies': ['FE-001'], 'estimated_time': '4 hours', 'agent_role': 'frontend_developer', 'acceptance_criteria': ['UI elements for task input and add button are present.', 'UI elements are styled appropriately.'], 'status': 'pending', 'code_files': ['src/App.js', 'src/App.css']}, {'id': 'FE-003', 'description': 'Design and implement the UI for displaying the task list (using a list or table).', 'dependencies': ['FE-001'], 'estimated_time': '4 hours', 'agent_role': 'frontend_developer', 'acceptance_criteria': ['Task list UI element is present.', 'Task list UI element is styled appropriately.'], 'status': 'pending', 'code_files': ['src/App.js', 'src/App.css']}, {'id': 'FE-004', 'description': 'Implement basic styling for the UI elements (using CSS).', 'dependencies': ['FE-002', 'FE-003'], 'estimated_time': '4 hours', 'agent_role': 'frontend_developer', 'acceptance_criteria': ['UI elements are visually appealing.', 'UI elements are responsive.'], 'status': 'pending', 'code_files': ['src/App.css']}, {'id': 'FE-005', 'description': 'Implement API calls to create a new task (FE-002).', 'dependencies': ['FE-002', 'BE-002', 'BE-007'], 'estimated_time': '6 hours', 'agent_role': 'frontend_developer', 'acceptance_criteria': ['User input is sent to the backend API.', 'Frontend displays a success message upon successful task creation.', 'Frontend handles API errors gracefully.'], 'status': 'pending', 'code_files': ['src/App.js']}, {'id': 'FE-006', 'description': 'Implement API calls to retrieve and display the task list (FE-003).', 'dependencies': ['FE-003', 'BE-003', 'BE-008'], 'estimated_time': '6 hours', 'agent_role': 'frontend_developer', 'acceptance_criteria': ['Tasks are retrieved from the backend API.', 'Tasks are displayed correctly in the task list.', 'Frontend handles API errors gracefully.'], 'status': 'pending', 'code_files': ['src/App.js']}, {'id': 'FE-007', 'description': 'Implement API calls to update a task (e.g., mark as complete).', 'dependencies': ['FE-003', 'BE-004', 'BE-009'], 'estimated_time': '6 hours', 'agent_role': 'frontend_developer', 'acceptance_criteria': ['Tasks can be marked as complete.', 'Frontend updates the task list after the update.', 'Frontend handles API errors gracefully.'], 'status': 'pending', 'code_files': ['src/App.js']}, {'id': 'FE-008', 'description': 'Implement API calls to delete a task.', 'dependencies': ['FE-003', 'BE-005', 'BE-010'], 'estimated_time': '4 hours', 'agent_role': 'frontend_developer', 'acceptance_criteria': ['Tasks can be deleted.', 'Frontend updates the task list after deletion.', 'Frontend handles API errors gracefully.'], 'status': 'pending', 'code_files': ['src/App.js']}, {'id': 'TEST-002', 'description': 'Write unit tests for the frontend components (FE-002, FE-003).', 'dependencies': ['FE-002', 'FE-003'], 'estimated_time': '6 hours', 'agent_role': 'frontend_developer', 'acceptance_criteria': ['Tests cover the UI components.', 'Tests cover user interactions.', 'Tests achieve a high code coverage.'], 'status': 'pending', 'code_files': ['src/App.test.js']}]}, {'name': 'Backend Phase', 'description': 'Tasks related to backend phase', 'deliverables': ['Completed BE-001', 'Completed BE-002', 'Completed BE-003', 'Completed BE-004', 'Completed BE-005', 'Completed BE-006', 'Completed BE-007', 'Completed BE-008', 'Completed BE-009', 'Completed BE-010', 'Completed TEST-001'], 'estimated_duration_hours': 48.0, 'work_items': [{'id': 'BE-001', 'description': 'Set up Node.js and Express project.', 'dependencies': [], 'estimated_time': '2 hours', 'agent_role': 'backend_developer', 'acceptance_criteria': ['Project is initialized successfully.', 'Express server runs without errors.'], 'status': 'pending', 'code_files': ['package.json', 'index.js']}, {'id': 'BE-002', 'description': 'Create API endpoint for creating a new task (/api/v1/tasks - POST).', 'dependencies': ['BE-001'], 'estimated_time': '4 hours', 'agent_role': 'backend_developer', 'acceptance_criteria': ['Endpoint accepts POST requests.', 'Endpoint validates input data (description).', 'Endpoint returns appropriate HTTP status codes (201, 400).'], 'status': 'pending', 'code_files': ['index.js']}, {'id': 'BE-003', 'description': 'Create API endpoint for retrieving all tasks (/api/v1/tasks - GET).', 'dependencies': ['BE-001'], 'estimated_time': '3 hours', 'agent_role': 'backend_developer', 'acceptance_criteria': ['Endpoint accepts GET requests.', 'Endpoint returns a list of tasks in JSON format.', 'Endpoint returns appropriate HTTP status code (200).'], 'status': 'pending', 'code_files': ['index.js']}, {'id': 'BE-004', 'description': 'Create API endpoint for updating a task (/api/v1/tasks/:id - PUT).', 'dependencies': ['BE-001'], 'estimated_time': '4 hours', 'agent_role': 'backend_developer', 'acceptance_criteria': ['Endpoint accepts PUT requests.', 'Endpoint validates input data (completed).', 'Endpoint returns appropriate HTTP status codes (200, 400, 404).'], 'status': 'pending', 'code_files': ['index.js']}, {'id': 'BE-005', 'description': 'Create API endpoint for deleting a task (/api/v1/tasks/:id - DELETE).', 'dependencies': ['BE-001'], 'estimated_time': '3 hours', 'agent_role': 'backend_developer', 'acceptance_criteria': ['Endpoint accepts DELETE requests.', 'Endpoint returns appropriate HTTP status codes (200, 404).'], 'status': 'pending', 'code_files': ['index.js']}, {'id': 'BE-006', 'description': 'Connect the backend API to the PostgreSQL database.', 'dependencies': ['BE-001', 'DB-001', 'DB-002'], 'estimated_time': '4 hours', 'agent_role': 'backend_developer', 'acceptance_criteria': ['Backend can successfully connect to the database.', 'Database connection details are configured securely (e.g., environment variables).'], 'status': 'pending', 'code_files': ['index.js']}, {'id': 'BE-007', 'description': 'Implement database interactions for creating a new task (BE-002).', 'dependencies': ['BE-002', 'BE-006'], 'estimated_time': '6 hours', 'agent_role': 'backend_developer', 'acceptance_criteria': ['New tasks are successfully saved to the database.', 'Endpoint returns the newly created task with its ID.', 'Error handling for database insertion failures is implemented.'], 'status': 'pending', 'code_files': ['index.js']}, {'id': 'BE-008', 'description': 'Implement database interactions for retrieving all tasks (BE-003).', 'dependencies': ['BE-003', 'BE-006'], 'estimated_time': '4 hours', 'agent_role': 'backend_developer', 'acceptance_criteria': ['All tasks are successfully retrieved from the database.', 'Endpoint returns the tasks in the correct format.', 'Error handling for database retrieval failures is implemented.'], 'status': 'pending', 'code_files': ['index.js']}, {'id': 'BE-009', 'description': 'Implement database interactions for updating a task (BE-004).', 'dependencies': ['BE-004', 'BE-006'], 'estimated_time': '6 hours', 'agent_role': 'backend_developer', 'acceptance_criteria': ['Tasks are successfully updated in the database.', 'Endpoint returns the updated task.', 'Error handling for database update failures and task not found is implemented.'], 'status': 'pending', 'code_files': ['index.js']}, {'id': 'BE-010', 'description': 'Implement database interactions for deleting a task (BE-005).', 'dependencies': ['BE-005', 'BE-006'], 'estimated_time': '4 hours', 'agent_role': 'backend_developer', 'acceptance_criteria': ['Tasks are successfully deleted from the database.', 'Endpoint returns a success message.', 'Error handling for database deletion failures and task not found is implemented.'], 'status': 'pending', 'code_files': ['index.js']}, {'id': 'TEST-001', 'description': 'Write unit tests for the backend API endpoints (BE-002, BE-003, BE-004, BE-005).', 'dependencies': ['BE-002', 'BE-003', 'BE-004', 'BE-005'], 'estimated_time': '8 hours', 'agent_role': 'backend_developer', 'acceptance_criteria': ['Tests cover all API endpoints.', 'Tests cover positive and negative test cases.', 'Tests achieve a high code coverage.'], 'status': 'pending', 'code_files': ['tests/index.test.js']}]}, {'name': 'Database Phase', 'description': 'Tasks related to database phase', 'deliverables': ['Completed DB-001', 'Completed DB-002'], 'estimated_duration_hours': 6.0, 'work_items': [{'id': 'DB-001', 'description': 'Set up PostgreSQL database.', 'dependencies': [], 'estimated_time': '4 hours', 'agent_role': 'database_specialist', 'acceptance_criteria': ['PostgreSQL database is installed and running.', 'Database is accessible via a client (e.g., psql, pgAdmin).'], 'status': 'pending', 'code_files': []}, {'id': 'DB-002', 'description': \"Create the 'tasks' table in the PostgreSQL database.\", 'dependencies': ['DB-001'], 'estimated_time': '2 hours', 'agent_role': 'database_specialist', 'acceptance_criteria': ['Tasks table exists with the correct schema (id, description, created_at, completed).', \"Primary key constraint is set on the 'id' column.\", \"'created_at' column has a default value of CURRENT_TIMESTAMP.\"], 'status': 'pending', 'code_files': []}]}, {'name': 'Devops_Engineer Phase', 'description': 'Tasks related to devops_engineer phase', 'deliverables': ['Completed DEPLOY-001', 'Completed DEPLOY-002', 'Completed DEPLOY-003', 'Completed DEPLOY-004', 'Completed DEPLOY-005'], 'estimated_duration_hours': 32.0, 'work_items': [{'id': 'DEPLOY-001', 'description': 'Set up AWS infrastructure (EC2, S3, RDS).', 'dependencies': ['DB-001'], 'estimated_time': '8 hours', 'agent_role': 'devops_engineer', 'acceptance_criteria': ['EC2 instance is created and running.', 'S3 bucket is created.', 'RDS instance is created and accessible.'], 'status': 'pending', 'code_files': []}, {'id': 'DEPLOY-002', 'description': 'Deploy the React frontend to S3 and configure CloudFront.', 'dependencies': ['FE-001', 'FE-005', 'FE-006', 'FE-007', 'FE-008', 'DEPLOY-001'], 'estimated_time': '6 hours', 'agent_role': 'devops_engineer', 'acceptance_criteria': ['Frontend is deployed to S3.', 'CloudFront distribution is configured.', 'Frontend is accessible via a public URL.'], 'status': 'pending', 'code_files': []}, {'id': 'DEPLOY-003', 'description': 'Deploy the Node.js backend to EC2.', 'dependencies': ['BE-001', 'BE-002', 'BE-003', 'BE-004', 'BE-005', 'BE-006', 'BE-007', 'BE-008', 'BE-009', 'BE-010', 'DEPLOY-001'], 'estimated_time': '8 hours', 'agent_role': 'devops_engineer', 'acceptance_criteria': ['Backend is deployed to EC2.', 'Backend is running and accessible.', 'Backend is configured to connect to the RDS database.'], 'status': 'pending', 'code_files': []}, {'id': 'DEPLOY-004', 'description': 'Configure database on RDS.', 'dependencies': ['DB-001', 'DEPLOY-001', 'BE-006'], 'estimated_time': '4 hours', 'agent_role': 'devops_engineer', 'acceptance_criteria': ['Database is accessible from the EC2 instance.', 'Database is configured with appropriate security settings.'], 'status': 'pending', 'code_files': []}, {'id': 'DEPLOY-005', 'description': 'Set up monitoring and logging using CloudWatch.', 'dependencies': ['DEPLOY-001', 'DEPLOY-003'], 'estimated_time': '6 hours', 'agent_role': 'devops_engineer', 'acceptance_criteria': ['CloudWatch is configured to monitor application performance.', 'Logs are being collected from the frontend and backend.', 'Alerts are set up for critical issues.'], 'status': 'pending', 'code_files': []}]}], resource_allocation=[{'role': 'Devops Engineer', 'count': 1, 'estimated_time_allocation': '100%', 'phases': ['Devops_Engineer Phase'], 'skills_required': []}, {'role': 'Frontend Developer', 'count': 1, 'estimated_time_allocation': '100%', 'phases': ['Frontend Phase'], 'skills_required': []}, {'role': 'Database Specialist', 'count': 1, 'estimated_time_allocation': '100%', 'phases': ['Database Phase'], 'skills_required': []}, {'role': 'Backend Developer', 'count': 1, 'estimated_time_allocation': '100%', 'phases': ['Backend Phase'], 'skills_required': []}], risks_and_mitigations=[], timeline={'start_date': '2025-07-08T20:31:02.764931', 'end_date': 'TBD', 'milestones': []}, tech_stack={}, metadata={'generated_at': '2025-07-08T20:31:02.764931', 'version': '1.0', 'author': 'Multi-AI Dev System', 'tags': [], 'notes': 'Converted from WorkItemBacklog. Original summary: Develop a simple web application for managing a list of tasks, including frontend UI, backend API, and database integration, deployed on AWS.'}) summary='Develop a simple web application for managing a list of tasks, including frontend UI, backend API, and database integration, deployed on AWS.' metadata=PlanMetadata(generated_at='2025-07-08T20:31:02.764931', version='1.0', author='Multi-AI Dev System', tags=[], notes='Converted from WorkItemBacklog. Original summary: Develop a simple web application for managing a list of tasks, including frontend UI, backend API, and database integration, deployed on AWS.')"
  },
  "workflow_state_snapshot": {
    "requirements_analysis": {
      "project_name": "Hello World Task List",
      "project_summary": "A simple web application to manage a list of tasks.",
      "project_goals": [
        "Allow a user to add a task",
        "Allow a user to see their list of tasks"
      ],
      "target_audience": [
        "Users who want to manage a list of tasks"
      ],
      "business_context": "This project aims to provide a basic task management tool.",
      "requirements": [
        {
          "id": "REQ-001",
          "description": "A user can create a new task with a text description.",
          "category": "functional",
          "priority": 1
        },
        {
          "id": "REQ-002",
          "description": "A user can see a list of all created tasks.",
          "category": "functional",
          "priority": 1
        },
        {
          "id": "REQ-003",
          "description": "The application must load quickly.",
          "category": "non_functional",
          "priority": 2
        },
        {
          "id": "REQ-004",
          "description": "The application must be secure.",
          "category": "non_functional",
          "priority": 2
        }
      ],
      "functional_requirements": [
        "A user can create a new task with a text description.",
        "A user can see a list of all created tasks."
      ],
      "non_functional_requirements": [
        "The application must load quickly.",
        "The application must be secure."
      ],
      "stakeholders": [
        "Users"
      ],
      "success_criteria": [
        "Users can successfully add tasks.",
        "Users can successfully view their task list.",
        "The application loads quickly.",
        "The application is secure."
      ],
      "constraints": [],
      "assumptions": [],
      "risks": [],
      "domain_specific_details": {},
      "quality_assessment": {
        "clarity_score": 9.0,
        "completeness_score": 8.0,
        "consistency_score": 10.0,
        "recommendations": []
      },
      "gap_analysis": {
        "identified_gaps": [],
        "recommendations_for_completion": []
      }
    },
    "tech_stack_recommendation": {
      "frontend_options": [
        {
          "name": "React",
          "language": "JavaScript",
          "reasoning": "React is a popular and efficient library for building user interfaces. It offers a component-based architecture, making it easy to manage and update the UI. Its virtual DOM and efficient update mechanisms contribute to fast loading times, fulfilling the non-functional requirement for speed. It has a large community and a wealth of available resources.",
          "key_libraries": [
            "React Router (for navigation)",
            "Axios or Fetch (for API calls)",
            "Material UI or Bootstrap (for UI components)"
          ],
          "pros": [
            "Component-based architecture for reusability and maintainability.",
            "Virtual DOM for efficient updates.",
            "Large community and extensive documentation.",
            "Fast loading times due to efficient rendering."
          ],
          "cons": [
            "Requires understanding of JSX.",
            "Can have a steeper learning curve initially.",
            "Requires additional libraries for routing and state management (though this is also a pro, as it allows for flexibility)."
          ],
          "selected": false
        },
        {
          "name": "Vue.js",
          "language": "JavaScript",
          "reasoning": "Vue.js is a progressive framework that's easy to learn and integrate. It offers a good balance between simplicity and power, making it suitable for this project's scope. It also has a good performance profile, meeting the speed requirement.",
          "key_libraries": [
            "Vue Router (for navigation)",
            "Axios or Fetch (for API calls)",
            "Vuetify or BootstrapVue (for UI components)"
          ],
          "pros": [
            "Easy to learn and integrate.",
            "Good performance.",
            "Well-structured and clear documentation.",
            "Progressive framework - can be adopted incrementally."
          ],
          "cons": [
            "Smaller community than React.",
            "Ecosystem might not be as extensive as React's."
          ],
          "selected": false
        },
        {
          "name": "HTML, CSS, JavaScript (Vanilla)",
          "language": "JavaScript",
          "reasoning": "For a simple task list application, using vanilla JavaScript, HTML, and CSS can be a viable option. This approach minimizes dependencies and offers maximum control over the application's behavior. It's suitable for small projects where simplicity and a lightweight footprint are prioritized.",
          "key_libraries": [],
          "pros": [
            "No external dependencies.",
            "Maximum control over the code.",
            "Simple to understand and debug."
          ],
          "cons": [
            "More manual work for UI components and state management.",
            "Can become complex for larger applications.",
            "May require more code to achieve the same functionality as with a framework."
          ],
          "selected": false
        }
      ],
      "backend_options": [
        {
          "name": "Node.js with Express",
          "language": "JavaScript",
          "reasoning": "Node.js with Express is a good choice for a simple backend. It allows for rapid development using JavaScript, which can be shared with the frontend if React or Vue.js is chosen. Express provides a lightweight framework for building REST APIs.",
          "key_libraries": [
            "Express (for routing and middleware)",
            "body-parser (for parsing request bodies)",
            "cors (for handling CORS)",
            "bcrypt (for password hashing)"
          ],
          "pros": [
            "Uses JavaScript, allowing for code reuse between frontend and backend.",
            "Large community and extensive documentation.",
            "Fast development with Express.",
            "Good performance with asynchronous operations."
          ],
          "cons": [
            "Callback hell can be an issue (though mitigated by async/await).",
            "Requires careful handling of security.",
            "Can be less performant than compiled languages for CPU-intensive tasks."
          ],
          "selected": false
        },
        {
          "name": "Python with Flask",
          "language": "Python",
          "reasoning": "Python with Flask is a lightweight and easy-to-learn framework. Python's readability and Flask's simplicity make it suitable for this project. It offers good performance and a wide range of libraries.",
          "key_libraries": [
            "Flask (for routing and web framework)",
            "Flask-SQLAlchemy (for database interaction)",
            "bcrypt (for password hashing)",
            "Flask-CORS (for handling CORS)"
          ],
          "pros": [
            "Easy to learn and use.",
            "Large community and extensive documentation.",
            "Good performance.",
            "Python's readability enhances maintainability."
          ],
          "cons": [
            "Slightly slower development compared to Node.js.",
            "Requires knowledge of Python.",
            "May require more configuration than Node.js for certain tasks."
          ],
          "selected": false
        },
        {
          "name": "Java with Spring Boot",
          "language": "Java",
          "reasoning": "Spring Boot provides a robust and scalable backend solution. While it has a steeper learning curve, it offers excellent features for building REST APIs and managing dependencies. It's a good choice if scalability and enterprise-level features are desired.",
          "key_libraries": [
            "Spring Boot (for rapid application development)",
            "Spring Web (for building REST APIs)",
            "Spring Data JPA (for database interaction)",
            "BCryptPasswordEncoder (for password hashing)"
          ],
          "pros": [
            "Robust and scalable.",
            "Mature ecosystem and extensive documentation.",
            "Excellent for enterprise-level applications.",
            "Strong security features."
          ],
          "cons": [
            "Steeper learning curve.",
            "More verbose code.",
            "Slower development compared to Node.js or Python."
          ],
          "selected": false
        }
      ],
      "database_options": [
        {
          "name": "PostgreSQL",
          "language": null,
          "reasoning": "PostgreSQL is a robust, open-source relational database that offers excellent performance, reliability, and data integrity. It's well-suited for this project due to its ability to handle structured data and its support for ACID transactions, ensuring data consistency and security.",
          "key_libraries": [
            "psycopg2 (for Python)",
            "pg (for Node.js)",
            "JDBC driver (for Java)"
          ],
          "pros": [
            "Strong data integrity and consistency.",
            "Excellent performance.",
            "Supports complex queries.",
            "Mature and well-documented."
          ],
          "cons": [
            "Can be more complex to set up and manage than simpler databases.",
            "Requires more resources than simpler databases."
          ],
          "selected": false
        },
        {
          "name": "MongoDB",
          "language": null,
          "reasoning": "MongoDB is a NoSQL database that offers flexibility and scalability. It's suitable for this project because of its ease of use and its ability to handle unstructured or semi-structured data. It's a good choice if the data model is expected to evolve.",
          "key_libraries": [
            "Mongoose (for Node.js)",
            "pymongo (for Python)",
            "MongoDB Java Driver (for Java)"
          ],
          "pros": [
            "Flexible schema.",
            "Easy to scale.",
            "Good performance for read operations.",
            "Suitable for agile development."
          ],
          "cons": [
            "Data consistency can be more challenging to manage.",
            "Can be less performant for complex queries.",
            "Requires careful consideration of data modeling."
          ],
          "selected": false
        },
        {
          "name": "SQLite",
          "language": null,
          "reasoning": "SQLite is a lightweight, file-based database that's easy to set up and use. It's suitable for small projects or prototypes where simplicity is a priority. It doesn't require a separate server process, making deployment easier.",
          "key_libraries": [
            "sqlite3 (built-in for Python)",
            "sqlite3 (for Node.js)",
            "SQLite JDBC driver (for Java)"
          ],
          "pros": [
            "Easy to set up and use.",
            "No server process required.",
            "Suitable for small projects.",
            "Good for prototyping."
          ],
          "cons": [
            "Not suitable for high-traffic applications.",
            "Limited scalability.",
            "Can have performance issues with large datasets."
          ],
          "selected": false
        }
      ],
      "cloud_options": [
        {
          "name": "AWS",
          "language": null,
          "reasoning": "AWS offers a comprehensive suite of services for deploying and managing web applications. It provides scalability, reliability, and security features. Services like EC2, S3, RDS, and Lambda can be used to build and deploy the application.",
          "key_libraries": [
            "AWS SDK (for interacting with AWS services)",
            "Terraform or CloudFormation (for infrastructure as code)"
          ],
          "pros": [
            "Highly scalable and reliable.",
            "Wide range of services.",
            "Mature ecosystem and extensive documentation.",
            "Strong security features."
          ],
          "cons": [
            "Can be complex to manage.",
            "Can be expensive if not managed carefully.",
            "Steeper learning curve."
          ],
          "selected": false
        },
        {
          "name": "Google Cloud Platform (GCP)",
          "language": null,
          "reasoning": "GCP offers a similar set of services to AWS, with a focus on data analytics and machine learning. It provides scalability, reliability, and security features. Services like Compute Engine, Cloud Storage, Cloud SQL, and Cloud Functions can be used.",
          "key_libraries": [
            "Google Cloud Client Libraries (for interacting with GCP services)",
            "Terraform or Google Cloud Deployment Manager (for infrastructure as code)"
          ],
          "pros": [
            "Strong in data analytics and machine learning.",
            "Competitive pricing.",
            "Good performance.",
            "User-friendly interface."
          ],
          "cons": [
            "Can be complex to manage.",
            "Can be expensive if not managed carefully.",
            "Steeper learning curve."
          ],
          "selected": false
        },
        {
          "name": "Heroku",
          "language": null,
          "reasoning": "Heroku is a Platform-as-a-Service (PaaS) that simplifies deployment and management. It's a good choice for this project because it offers easy deployment, automatic scaling, and built-in support for various languages and databases. It's ideal for small to medium-sized applications where ease of deployment is a priority.",
          "key_libraries": [
            "Heroku CLI (for deploying and managing applications)"
          ],
          "pros": [
            "Easy to deploy and manage.",
            "Automatic scaling.",
            "Built-in support for various languages and databases.",
            "Focus on developer experience."
          ],
          "cons": [
            "Limited customization options.",
            "Can be more expensive than other cloud providers.",
            "Vendor lock-in."
          ],
          "selected": false
        }
      ],
      "architecture_options": [
        {
          "pattern": "Monolithic Architecture",
          "scalability_score": 5.0,
          "maintainability_score": 6.0,
          "development_speed_score": 8.0,
          "overall_score": 7.0,
          "reasoning": "For a simple task list application, a monolithic architecture is a good starting point. It's easier to develop and deploy initially. All components (frontend, backend, database) reside within a single application. This approach is suitable for smaller projects where scalability is not a primary concern. Maintainability is good for the project's size."
        },
        {
          "pattern": "Microservices Architecture",
          "scalability_score": 8.0,
          "maintainability_score": 7.0,
          "development_speed_score": 5.0,
          "overall_score": 6.0,
          "reasoning": "While microservices offer excellent scalability and maintainability, they introduce complexity that may be unnecessary for this project. This architecture would involve breaking down the application into smaller, independent services. This is overkill for the current scope, but would be a good choice if the application were to grow significantly in the future."
        },
        {
          "pattern": "Serverless Architecture",
          "scalability_score": 9.0,
          "maintainability_score": 7.0,
          "development_speed_score": 6.0,
          "overall_score": 6.5,
          "reasoning": "Serverless architecture can be a good option for this project, especially if the backend is simple. It allows for automatic scaling and reduces operational overhead. However, it can introduce complexities in debugging and monitoring. This architecture would involve using services like AWS Lambda or Google Cloud Functions for the backend logic."
        }
      ],
      "tool_options": [
        {
          "name": "Git",
          "language": null,
          "reasoning": "Git is essential for version control, allowing developers to track changes, collaborate effectively, and revert to previous versions if needed. It's a standard tool for software development.",
          "key_libraries": [],
          "pros": [],
          "cons": [],
          "selected": false
        },
        {
          "name": "VS Code",
          "language": null,
          "reasoning": "VS Code is a popular and versatile code editor with excellent support for various languages and frameworks. It offers features like code completion, debugging, and integrated terminal, which enhance developer productivity.",
          "key_libraries": [],
          "pros": [],
          "cons": [],
          "selected": false
        },
        {
          "name": "Postman",
          "language": null,
          "reasoning": "Postman is a useful tool for testing APIs. It allows developers to send requests to the backend and inspect the responses, making it easier to debug and validate API functionality.",
          "key_libraries": [],
          "pros": [],
          "cons": [],
          "selected": false
        }
      ],
      "risks": [
        {
          "category": "Security",
          "description": "Vulnerabilities in dependencies or the application code could lead to security breaches, such as cross-site scripting (XSS) or SQL injection.",
          "severity": "High",
          "likelihood": "Medium",
          "mitigation": "Regularly update dependencies, implement input validation and output encoding, use parameterized queries, and conduct security audits."
        },
        {
          "category": "Performance",
          "description": "Slow loading times or poor performance could negatively impact user experience, especially if the application grows.",
          "severity": "Medium",
          "likelihood": "Medium",
          "mitigation": "Optimize database queries, use caching mechanisms, minify and compress assets, and monitor application performance."
        },
        {
          "category": "Scalability",
          "description": "The application may not scale well if the user base grows significantly.",
          "severity": "Medium",
          "likelihood": "Low",
          "mitigation": "Design the application with scalability in mind, use a scalable database, and consider using a cloud platform that offers auto-scaling."
        }
      ],
      "synthesis": {
        "backend": {
          "language": "JavaScript",
          "framework": "Node.js with Express",
          "reasoning": "Node.js with Express allows for rapid development using JavaScript, which can be shared with the frontend if React is chosen. Express provides a lightweight framework for building REST APIs."
        },
        "frontend": {
          "language": "JavaScript",
          "framework": "React",
          "reasoning": "React provides a good balance of ease of use, performance, and community support for building the user interface. It allows for efficient updates and a component-based architecture, which is suitable for the project's requirements."
        },
        "database": {
          "type": "PostgreSQL",
          "reasoning": "PostgreSQL is a robust, open-source relational database that offers excellent performance, reliability, and data integrity. It's well-suited for this project due to its ability to handle structured data and its support for ACID transactions, ensuring data consistency and security."
        },
        "architecture_pattern": "Monolithic Architecture",
        "deployment_environment": {
          "cloud_provider": "AWS",
          "reasoning": "AWS offers a comprehensive suite of services for deploying and managing web applications, providing scalability, reliability, and security features. Services like EC2, S3, RDS, and Lambda can be used to build and deploy the application."
        },
        "key_libraries_tools": [
          {
            "name": "React Router",
            "purpose": "For navigation in the React frontend."
          },
          {
            "name": "Axios",
            "purpose": "For making API calls from the frontend."
          },
          {
            "name": "Express",
            "purpose": "For building the backend API."
          },
          {
            "name": "Postman",
            "purpose": "For API testing and debugging."
          },
          {
            "name": "Git",
            "purpose": "For version control."
          },
          {
            "name": "VS Code",
            "purpose": "For code editing and development."
          }
        ],
        "estimated_complexity": "Low"
      },
      "selected_stack": null
    },
    "system_design": {
      "architecture": {
        "pattern": "Monolithic Architecture",
        "justification": "For a simple task list application, a monolithic architecture is a good starting point. It's easier to develop and deploy initially. All components (frontend, backend, database) reside within a single application. This approach is suitable for smaller projects where scalability is not a primary concern. Maintainability is good for the project's size.",
        "key_benefits": [
          "Faster initial development.",
          "Simpler deployment.",
          "Easier to manage for a small team."
        ],
        "potential_drawbacks": [
          "Limited scalability compared to microservices.",
          "Can become difficult to maintain as the application grows.",
          "Deployment of the entire application is required for even small changes."
        ]
      },
      "components": [
        {
          "name": "Frontend",
          "description": "The user interface for interacting with the task list application.",
          "category": "frontend",
          "technologies": [
            "React",
            "JavaScript",
            "HTML",
            "CSS"
          ],
          "dependencies": [
            "Backend API"
          ],
          "responsibilities": [
            "Displaying the task list.",
            "Allowing users to add new tasks.",
            "Handling user interactions.",
            "Making API calls to the backend."
          ],
          "design_patterns": [
            "Component-based architecture"
          ]
        },
        {
          "name": "Backend API",
          "description": "Provides an API for the frontend to interact with the task data.",
          "category": "backend",
          "technologies": [
            "Node.js",
            "Express",
            "JavaScript"
          ],
          "dependencies": [
            "Database"
          ],
          "responsibilities": [
            "Handling API requests.",
            "Validating data.",
            "Interacting with the database.",
            "Returning data to the frontend."
          ],
          "design_patterns": [
            "RESTful API"
          ]
        },
        {
          "name": "Database",
          "description": "Stores the task data.",
          "category": "backend",
          "technologies": [
            "PostgreSQL"
          ],
          "dependencies": [],
          "responsibilities": [
            "Storing task data.",
            "Providing data access to the backend API."
          ],
          "design_patterns": [
            "Relational Database"
          ]
        },
        {
          "name": "Deployment Infrastructure",
          "description": "The infrastructure used to host and run the application.",
          "category": "infrastructure",
          "technologies": [
            "AWS",
            "EC2",
            "S3",
            "RDS"
          ],
          "dependencies": [
            "Frontend",
            "Backend API",
            "Database"
          ],
          "responsibilities": [
            "Hosting the frontend application.",
            "Running the backend API.",
            "Managing the database.",
            "Ensuring the application is accessible and scalable."
          ],
          "design_patterns": [
            "Cloud Infrastructure"
          ]
        }
      ],
      "data_model": {
        "schema_type": "Relational",
        "tables": [
          {
            "name": "tasks",
            "purpose": "Stores task information.",
            "fields": [
              {
                "name": "id",
                "type": "UUID",
                "constraints": [
                  "PRIMARY KEY",
                  "NOT NULL"
                ],
                "description": "Unique identifier for the task."
              },
              {
                "name": "description",
                "type": "TEXT",
                "constraints": [
                  "NOT NULL"
                ],
                "description": "The text description of the task."
              },
              {
                "name": "created_at",
                "type": "TIMESTAMP",
                "constraints": [
                  "NOT NULL",
                  "DEFAULT CURRENT_TIMESTAMP"
                ],
                "description": "The timestamp when the task was created."
              },
              {
                "name": "completed",
                "type": "BOOLEAN",
                "constraints": [
                  "NOT NULL",
                  "DEFAULT FALSE"
                ],
                "description": "Indicates whether the task is completed."
              }
            ],
            "relationships": []
          }
        ],
        "relationships": [],
        "justification": "Relational database provides data integrity and structure, suitable for storing and querying task data."
      },
      "api_endpoints": {
        "style": "REST",
        "base_url": "/api/v1",
        "authentication": "None (for simplicity, but should be implemented in a real-world scenario)",
        "endpoints": [
          {
            "method": "POST",
            "path": "/tasks",
            "purpose": "Create a new task.",
            "parameters": [
              {
                "description": "The task description.",
                "type": "string",
                "name": "description"
              }
            ],
            "response": {
              "201": {
                "message": "Task created successfully.",
                "task": {
                  "id": "UUID",
                  "description": "string",
                  "created_at": "timestamp",
                  "completed": "boolean"
                }
              },
              "400": {
                "message": "Bad Request - Invalid input."
              }
            },
            "authentication_required": false,
            "rate_limiting_applied": false
          },
          {
            "method": "GET",
            "path": "/tasks",
            "purpose": "Get all tasks.",
            "parameters": [],
            "response": {
              "200": {
                "tasks": [
                  {
                    "id": "UUID",
                    "description": "string",
                    "created_at": "timestamp",
                    "completed": "boolean"
                  }
                ]
              }
            },
            "authentication_required": false,
            "rate_limiting_applied": false
          },
          {
            "method": "PUT",
            "path": "/tasks/{id}",
            "purpose": "Update a task (e.g., mark as complete).",
            "parameters": [
              {
                "name": "id",
                "type": "UUID",
                "description": "The ID of the task to update."
              },
              {
                "name": "completed",
                "type": "boolean",
                "description": "Whether the task is completed."
              }
            ],
            "response": {
              "200": {
                "message": "Task updated successfully.",
                "task": {
                  "id": "UUID",
                  "description": "string",
                  "created_at": "timestamp",
                  "completed": "boolean"
                }
              },
              "400": {
                "message": "Bad Request - Invalid input."
              },
              "404": {
                "message": "Task not found."
              }
            },
            "authentication_required": false,
            "rate_limiting_applied": false
          },
          {
            "method": "DELETE",
            "path": "/tasks/{id}",
            "purpose": "Delete a task.",
            "parameters": [
              {
                "name": "id",
                "type": "UUID",
                "description": "The ID of the task to delete."
              }
            ],
            "response": {
              "200": {
                "message": "Task deleted successfully."
              },
              "404": {
                "message": "Task not found."
              }
            },
            "authentication_required": false,
            "rate_limiting_applied": false
          }
        ],
        "error_handling": "Standard HTTP status codes and informative error messages in JSON format.",
        "rate_limiting_strategy": null
      },
      "security": {
        "authentication_method": "None (for simplicity)",
        "authorization_strategy": "None (for simplicity)",
        "data_encryption": {
          "at_rest": "Not applicable (for simplicity)",
          "in_transit": "HTTPS using SSL/TLS certificates."
        },
        "security_measures": [
          {
            "category": "Input Validation",
            "implementation": "Validate all user inputs on the backend to prevent injection attacks.",
            "mitigation": "SQL Injection, Cross-Site Scripting (XSS)",
            "priority": "High"
          },
          {
            "category": "Data Protection",
            "implementation": "Use HTTPS for all communication between the frontend and backend.",
            "mitigation": "Man-in-the-middle attacks",
            "priority": "High"
          },
          {
            "category": "Dependency Management",
            "implementation": "Regularly update dependencies to patch security vulnerabilities.",
            "mitigation": "Known vulnerabilities in dependencies",
            "priority": "High"
          }
        ],
        "vulnerability_mitigation_strategies": [
          "Input validation and sanitization.",
          "Output encoding.",
          "Regular dependency updates.",
          "Use of HTTPS."
        ],
        "compliance_standards": []
      },
      "scalability_and_performance": {
        "caching": "Implement caching mechanisms (e.g., using Redis) to cache frequently accessed data.",
        "database_optimization": "Optimize database queries and use indexes to improve performance.",
        "code_optimization": "Minify and compress frontend assets (JavaScript, CSS) to reduce loading times.",
        "load_balancing": "Consider load balancing if the application grows to handle increased traffic."
      },
      "deployment_strategy": {
        "environment": "AWS (EC2, S3, RDS)",
        "frontend_deployment": "Deploy the React frontend to an S3 bucket and serve it via CloudFront for fast content delivery.",
        "backend_deployment": "Deploy the Node.js backend to an EC2 instance.",
        "database_deployment": "Deploy the PostgreSQL database to an RDS instance.",
        "continuous_integration_continuous_deployment": "Implement CI/CD pipelines using tools like AWS CodePipeline or similar to automate the build, test, and deployment processes."
      },
      "monitoring_and_logging": {
        "logging": "Implement logging for both frontend and backend applications using tools like Winston (Node.js) or similar. Log important events, errors, and performance metrics.",
        "monitoring": "Use AWS CloudWatch or similar tools to monitor application performance, resource utilization, and error rates. Set up alerts for critical issues.",
        "error_tracking": "Integrate an error tracking service like Sentry to capture and analyze errors in real-time."
      },
      "error_handling_strategy": "Use standard HTTP status codes (e.g., 400, 404, 500) and return informative error messages in JSON format. Implement global error handling middleware in the backend to catch and handle unhandled exceptions.",
      "development_phases_overview": [
        {
          "name": "Phase 1: Setup and Frontend Development",
          "description": "Set up the development environment, create the React frontend, and implement the UI for adding and viewing tasks.",
          "priority": "High",
          "dependencies": [],
          "tasks": [
            "Set up React project.",
            "Design and implement the UI for adding tasks.",
            "Design and implement the UI for displaying tasks.",
            "Implement basic styling."
          ],
          "estimated_duration": "1 week"
        },
        {
          "name": "Phase 2: Backend API Development",
          "description": "Develop the Node.js backend API to handle task creation, retrieval, updating, and deletion.",
          "priority": "High",
          "dependencies": [
            "Phase 1: Setup and Frontend Development"
          ],
          "tasks": [
            "Set up Node.js and Express project.",
            "Design and implement API endpoints for tasks (CRUD operations).",
            "Implement data validation.",
            "Connect to the PostgreSQL database."
          ],
          "estimated_duration": "1 week"
        },
        {
          "name": "Phase 3: Database Setup and Integration",
          "description": "Set up the PostgreSQL database and integrate it with the backend API.",
          "priority": "High",
          "dependencies": [
            "Phase 2: Backend API Development"
          ],
          "tasks": [
            "Set up PostgreSQL database.",
            "Create the tasks table.",
            "Implement database interactions in the backend API.",
            "Test database connectivity and functionality."
          ],
          "estimated_duration": "1 week"
        },
        {
          "name": "Phase 4: Frontend-Backend Integration and Testing",
          "description": "Integrate the frontend with the backend API and perform thorough testing.",
          "priority": "High",
          "dependencies": [
            "Phase 1: Setup and Frontend Development",
            "Phase 2: Backend API Development",
            "Phase 3: Database Setup and Integration"
          ],
          "tasks": [
            "Implement API calls in the frontend using Axios.",
            "Test the application thoroughly (unit, integration, and end-to-end tests).",
            "Fix any bugs and address any issues."
          ],
          "estimated_duration": "1 week"
        },
        {
          "name": "Phase 5: Deployment and Monitoring",
          "description": "Deploy the application to AWS and set up monitoring and logging.",
          "priority": "Medium",
          "dependencies": [
            "Phase 4: Frontend-Backend Integration and Testing"
          ],
          "tasks": [
            "Set up AWS infrastructure (EC2, S3, RDS).",
            "Deploy the frontend to S3 and CloudFront.",
            "Deploy the backend to EC2.",
            "Configure database on RDS.",
            "Set up monitoring and logging using CloudWatch."
          ],
          "estimated_duration": "1 week"
        },
        {
          "name": "Phase 6: Refinement and Iteration",
          "description": "Refine the application based on user feedback and iterate on new features.",
          "priority": "Medium",
          "dependencies": [
            "Phase 5: Deployment and Monitoring"
          ],
          "tasks": [
            "Gather user feedback.",
            "Implement new features based on feedback.",
            "Optimize performance.",
            "Address any remaining bugs."
          ],
          "estimated_duration": "Ongoing"
        }
      ],
      "key_risks": [
        "Security vulnerabilities (XSS, SQL injection).",
        "Performance bottlenecks (slow loading times).",
        "Scalability limitations if the application grows.",
        "Deployment issues."
      ],
      "design_justification": "The design prioritizes simplicity and ease of development while meeting the project requirements. The monolithic architecture, React frontend, Node.js backend, and PostgreSQL database provide a solid foundation for a basic task list application. AWS provides a scalable and reliable deployment environment. The chosen technologies are well-suited for the project's scope and the team's familiarity.",
      "data_flow": "1. User interacts with the React frontend (e.g., adds a task). 2. Frontend makes an API call to the Node.js backend. 3. Backend API receives the request, validates the data, and interacts with the PostgreSQL database to store the task. 4. Database stores the task data. 5. Backend API sends a success response back to the frontend. 6. Frontend updates the UI to display the new task. 7. When the user views the task list, the frontend makes a GET request to the backend. 8. Backend retrieves tasks from the database and sends them to the frontend. 9. Frontend displays the tasks."
    },
    "implementation_plan": "plan=ImplementationPlan(project_summary={'title': 'Generated Project Plan', 'description': 'Develop a simple web application for managing a list of tasks, including frontend UI, backend API, and database integration, deployed on AWS.', 'overall_complexity': 'Medium', 'estimated_duration': 'TBD', 'key_challenges': [], 'success_criteria': []}, phases=[{'name': 'Frontend Phase', 'description': 'Tasks related to frontend phase', 'deliverables': ['Completed FE-001', 'Completed FE-002', 'Completed FE-003', 'Completed FE-004', 'Completed FE-005', 'Completed FE-006', 'Completed FE-007', 'Completed FE-008', 'Completed TEST-002'], 'estimated_duration_hours': 42.0, 'work_items': [{'id': 'FE-001', 'description': 'Set up React project using Create React App.', 'dependencies': [], 'estimated_time': '2 hours', 'agent_role': 'frontend_developer', 'acceptance_criteria': ['Project is initialized successfully.', 'Default React app runs without errors.'], 'status': 'pending', 'code_files': ['package.json', 'src/App.js', 'src/index.js']}, {'id': 'FE-002', 'description': 'Design and implement the UI for adding a new task (input field and add button).', 'dependencies': ['FE-001'], 'estimated_time': '4 hours', 'agent_role': 'frontend_developer', 'acceptance_criteria': ['UI elements for task input and add button are present.', 'UI elements are styled appropriately.'], 'status': 'pending', 'code_files': ['src/App.js', 'src/App.css']}, {'id': 'FE-003', 'description': 'Design and implement the UI for displaying the task list (using a list or table).', 'dependencies': ['FE-001'], 'estimated_time': '4 hours', 'agent_role': 'frontend_developer', 'acceptance_criteria': ['Task list UI element is present.', 'Task list UI element is styled appropriately.'], 'status': 'pending', 'code_files': ['src/App.js', 'src/App.css']}, {'id': 'FE-004', 'description': 'Implement basic styling for the UI elements (using CSS).', 'dependencies': ['FE-002', 'FE-003'], 'estimated_time': '4 hours', 'agent_role': 'frontend_developer', 'acceptance_criteria': ['UI elements are visually appealing.', 'UI elements are responsive.'], 'status': 'pending', 'code_files': ['src/App.css']}, {'id': 'FE-005', 'description': 'Implement API calls to create a new task (FE-002).', 'dependencies': ['FE-002', 'BE-002', 'BE-007'], 'estimated_time': '6 hours', 'agent_role': 'frontend_developer', 'acceptance_criteria': ['User input is sent to the backend API.', 'Frontend displays a success message upon successful task creation.', 'Frontend handles API errors gracefully.'], 'status': 'pending', 'code_files': ['src/App.js']}, {'id': 'FE-006', 'description': 'Implement API calls to retrieve and display the task list (FE-003).', 'dependencies': ['FE-003', 'BE-003', 'BE-008'], 'estimated_time': '6 hours', 'agent_role': 'frontend_developer', 'acceptance_criteria': ['Tasks are retrieved from the backend API.', 'Tasks are displayed correctly in the task list.', 'Frontend handles API errors gracefully.'], 'status': 'pending', 'code_files': ['src/App.js']}, {'id': 'FE-007', 'description': 'Implement API calls to update a task (e.g., mark as complete).', 'dependencies': ['FE-003', 'BE-004', 'BE-009'], 'estimated_time': '6 hours', 'agent_role': 'frontend_developer', 'acceptance_criteria': ['Tasks can be marked as complete.', 'Frontend updates the task list after the update.', 'Frontend handles API errors gracefully.'], 'status': 'pending', 'code_files': ['src/App.js']}, {'id': 'FE-008', 'description': 'Implement API calls to delete a task.', 'dependencies': ['FE-003', 'BE-005', 'BE-010'], 'estimated_time': '4 hours', 'agent_role': 'frontend_developer', 'acceptance_criteria': ['Tasks can be deleted.', 'Frontend updates the task list after deletion.', 'Frontend handles API errors gracefully.'], 'status': 'pending', 'code_files': ['src/App.js']}, {'id': 'TEST-002', 'description': 'Write unit tests for the frontend components (FE-002, FE-003).', 'dependencies': ['FE-002', 'FE-003'], 'estimated_time': '6 hours', 'agent_role': 'frontend_developer', 'acceptance_criteria': ['Tests cover the UI components.', 'Tests cover user interactions.', 'Tests achieve a high code coverage.'], 'status': 'pending', 'code_files': ['src/App.test.js']}]}, {'name': 'Backend Phase', 'description': 'Tasks related to backend phase', 'deliverables': ['Completed BE-001', 'Completed BE-002', 'Completed BE-003', 'Completed BE-004', 'Completed BE-005', 'Completed BE-006', 'Completed BE-007', 'Completed BE-008', 'Completed BE-009', 'Completed BE-010', 'Completed TEST-001'], 'estimated_duration_hours': 48.0, 'work_items': [{'id': 'BE-001', 'description': 'Set up Node.js and Express project.', 'dependencies': [], 'estimated_time': '2 hours', 'agent_role': 'backend_developer', 'acceptance_criteria': ['Project is initialized successfully.', 'Express server runs without errors.'], 'status': 'pending', 'code_files': ['package.json', 'index.js']}, {'id': 'BE-002', 'description': 'Create API endpoint for creating a new task (/api/v1/tasks - POST).', 'dependencies': ['BE-001'], 'estimated_time': '4 hours', 'agent_role': 'backend_developer', 'acceptance_criteria': ['Endpoint accepts POST requests.', 'Endpoint validates input data (description).', 'Endpoint returns appropriate HTTP status codes (201, 400).'], 'status': 'pending', 'code_files': ['index.js']}, {'id': 'BE-003', 'description': 'Create API endpoint for retrieving all tasks (/api/v1/tasks - GET).', 'dependencies': ['BE-001'], 'estimated_time': '3 hours', 'agent_role': 'backend_developer', 'acceptance_criteria': ['Endpoint accepts GET requests.', 'Endpoint returns a list of tasks in JSON format.', 'Endpoint returns appropriate HTTP status code (200).'], 'status': 'pending', 'code_files': ['index.js']}, {'id': 'BE-004', 'description': 'Create API endpoint for updating a task (/api/v1/tasks/:id - PUT).', 'dependencies': ['BE-001'], 'estimated_time': '4 hours', 'agent_role': 'backend_developer', 'acceptance_criteria': ['Endpoint accepts PUT requests.', 'Endpoint validates input data (completed).', 'Endpoint returns appropriate HTTP status codes (200, 400, 404).'], 'status': 'pending', 'code_files': ['index.js']}, {'id': 'BE-005', 'description': 'Create API endpoint for deleting a task (/api/v1/tasks/:id - DELETE).', 'dependencies': ['BE-001'], 'estimated_time': '3 hours', 'agent_role': 'backend_developer', 'acceptance_criteria': ['Endpoint accepts DELETE requests.', 'Endpoint returns appropriate HTTP status codes (200, 404).'], 'status': 'pending', 'code_files': ['index.js']}, {'id': 'BE-006', 'description': 'Connect the backend API to the PostgreSQL database.', 'dependencies': ['BE-001', 'DB-001', 'DB-002'], 'estimated_time': '4 hours', 'agent_role': 'backend_developer', 'acceptance_criteria': ['Backend can successfully connect to the database.', 'Database connection details are configured securely (e.g., environment variables).'], 'status': 'pending', 'code_files': ['index.js']}, {'id': 'BE-007', 'description': 'Implement database interactions for creating a new task (BE-002).', 'dependencies': ['BE-002', 'BE-006'], 'estimated_time': '6 hours', 'agent_role': 'backend_developer', 'acceptance_criteria': ['New tasks are successfully saved to the database.', 'Endpoint returns the newly created task with its ID.', 'Error handling for database insertion failures is implemented.'], 'status': 'pending', 'code_files': ['index.js']}, {'id': 'BE-008', 'description': 'Implement database interactions for retrieving all tasks (BE-003).', 'dependencies': ['BE-003', 'BE-006'], 'estimated_time': '4 hours', 'agent_role': 'backend_developer', 'acceptance_criteria': ['All tasks are successfully retrieved from the database.', 'Endpoint returns the tasks in the correct format.', 'Error handling for database retrieval failures is implemented.'], 'status': 'pending', 'code_files': ['index.js']}, {'id': 'BE-009', 'description': 'Implement database interactions for updating a task (BE-004).', 'dependencies': ['BE-004', 'BE-006'], 'estimated_time': '6 hours', 'agent_role': 'backend_developer', 'acceptance_criteria': ['Tasks are successfully updated in the database.', 'Endpoint returns the updated task.', 'Error handling for database update failures and task not found is implemented.'], 'status': 'pending', 'code_files': ['index.js']}, {'id': 'BE-010', 'description': 'Implement database interactions for deleting a task (BE-005).', 'dependencies': ['BE-005', 'BE-006'], 'estimated_time': '4 hours', 'agent_role': 'backend_developer', 'acceptance_criteria': ['Tasks are successfully deleted from the database.', 'Endpoint returns a success message.', 'Error handling for database deletion failures and task not found is implemented.'], 'status': 'pending', 'code_files': ['index.js']}, {'id': 'TEST-001', 'description': 'Write unit tests for the backend API endpoints (BE-002, BE-003, BE-004, BE-005).', 'dependencies': ['BE-002', 'BE-003', 'BE-004', 'BE-005'], 'estimated_time': '8 hours', 'agent_role': 'backend_developer', 'acceptance_criteria': ['Tests cover all API endpoints.', 'Tests cover positive and negative test cases.', 'Tests achieve a high code coverage.'], 'status': 'pending', 'code_files': ['tests/index.test.js']}]}, {'name': 'Database Phase', 'description': 'Tasks related to database phase', 'deliverables': ['Completed DB-001', 'Completed DB-002'], 'estimated_duration_hours': 6.0, 'work_items': [{'id': 'DB-001', 'description': 'Set up PostgreSQL database.', 'dependencies': [], 'estimated_time': '4 hours', 'agent_role': 'database_specialist', 'acceptance_criteria': ['PostgreSQL database is installed and running.', 'Database is accessible via a client (e.g., psql, pgAdmin).'], 'status': 'pending', 'code_files': []}, {'id': 'DB-002', 'description': \"Create the 'tasks' table in the PostgreSQL database.\", 'dependencies': ['DB-001'], 'estimated_time': '2 hours', 'agent_role': 'database_specialist', 'acceptance_criteria': ['Tasks table exists with the correct schema (id, description, created_at, completed).', \"Primary key constraint is set on the 'id' column.\", \"'created_at' column has a default value of CURRENT_TIMESTAMP.\"], 'status': 'pending', 'code_files': []}]}, {'name': 'Devops_Engineer Phase', 'description': 'Tasks related to devops_engineer phase', 'deliverables': ['Completed DEPLOY-001', 'Completed DEPLOY-002', 'Completed DEPLOY-003', 'Completed DEPLOY-004', 'Completed DEPLOY-005'], 'estimated_duration_hours': 32.0, 'work_items': [{'id': 'DEPLOY-001', 'description': 'Set up AWS infrastructure (EC2, S3, RDS).', 'dependencies': ['DB-001'], 'estimated_time': '8 hours', 'agent_role': 'devops_engineer', 'acceptance_criteria': ['EC2 instance is created and running.', 'S3 bucket is created.', 'RDS instance is created and accessible.'], 'status': 'pending', 'code_files': []}, {'id': 'DEPLOY-002', 'description': 'Deploy the React frontend to S3 and configure CloudFront.', 'dependencies': ['FE-001', 'FE-005', 'FE-006', 'FE-007', 'FE-008', 'DEPLOY-001'], 'estimated_time': '6 hours', 'agent_role': 'devops_engineer', 'acceptance_criteria': ['Frontend is deployed to S3.', 'CloudFront distribution is configured.', 'Frontend is accessible via a public URL.'], 'status': 'pending', 'code_files': []}, {'id': 'DEPLOY-003', 'description': 'Deploy the Node.js backend to EC2.', 'dependencies': ['BE-001', 'BE-002', 'BE-003', 'BE-004', 'BE-005', 'BE-006', 'BE-007', 'BE-008', 'BE-009', 'BE-010', 'DEPLOY-001'], 'estimated_time': '8 hours', 'agent_role': 'devops_engineer', 'acceptance_criteria': ['Backend is deployed to EC2.', 'Backend is running and accessible.', 'Backend is configured to connect to the RDS database.'], 'status': 'pending', 'code_files': []}, {'id': 'DEPLOY-004', 'description': 'Configure database on RDS.', 'dependencies': ['DB-001', 'DEPLOY-001', 'BE-006'], 'estimated_time': '4 hours', 'agent_role': 'devops_engineer', 'acceptance_criteria': ['Database is accessible from the EC2 instance.', 'Database is configured with appropriate security settings.'], 'status': 'pending', 'code_files': []}, {'id': 'DEPLOY-005', 'description': 'Set up monitoring and logging using CloudWatch.', 'dependencies': ['DEPLOY-001', 'DEPLOY-003'], 'estimated_time': '6 hours', 'agent_role': 'devops_engineer', 'acceptance_criteria': ['CloudWatch is configured to monitor application performance.', 'Logs are being collected from the frontend and backend.', 'Alerts are set up for critical issues.'], 'status': 'pending', 'code_files': []}]}], resource_allocation=[{'role': 'Devops Engineer', 'count': 1, 'estimated_time_allocation': '100%', 'phases': ['Devops_Engineer Phase'], 'skills_required': []}, {'role': 'Frontend Developer', 'count': 1, 'estimated_time_allocation': '100%', 'phases': ['Frontend Phase'], 'skills_required': []}, {'role': 'Database Specialist', 'count': 1, 'estimated_time_allocation': '100%', 'phases': ['Database Phase'], 'skills_required': []}, {'role': 'Backend Developer', 'count': 1, 'estimated_time_allocation': '100%', 'phases': ['Backend Phase'], 'skills_required': []}], risks_and_mitigations=[], timeline={'start_date': '2025-07-08T20:31:02.764931', 'end_date': 'TBD', 'milestones': []}, tech_stack={}, metadata={'generated_at': '2025-07-08T20:31:02.764931', 'version': '1.0', 'author': 'Multi-AI Dev System', 'tags': [], 'notes': 'Converted from WorkItemBacklog. Original summary: Develop a simple web application for managing a list of tasks, including frontend UI, backend API, and database integration, deployed on AWS.'}) summary='Develop a simple web application for managing a list of tasks, including frontend UI, backend API, and database integration, deployed on AWS.' metadata=PlanMetadata(generated_at='2025-07-08T20:31:02.764931', version='1.0', author='Multi-AI Dev System', tags=[], notes='Converted from WorkItemBacklog. Original summary: Develop a simple web application for managing a list of tasks, including frontend UI, backend API, and database integration, deployed on AWS.')"
  }
}