{
  "session_id": "session_f5ac14a7-58a1-4a13-8252-7979621f2abe",
  "approval_type": "implementation_plan",
  "timestamp": 1752033771,
  "approval_data": {
    "type": "implementation_plan",
    "timestamp": 1752033771.9200156,
    "project_overview": "Develop a simple web application for managing a list of tasks using React, Node.js, PostgreSQL, and AWS. The application will allow users to add and view tasks. The project will be deployed using Docker and a CI/CD pipeline for automated builds and deployments. Monitoring and logging will be implemented to ensure application health and performance.",
    "development_phases": [
      {
        "name": "Frontend Phase",
        "description": "Tasks related to frontend phase",
        "deliverables": [
          "Completed FE-001",
          "Completed FE-002",
          "Completed FE-003",
          "Completed FE-004",
          "Completed FE-005",
          "Completed FE-006",
          "Completed TE-001",
          "Completed TE-003",
          "Completed MO-003"
        ],
        "estimated_duration_hours": 46.0,
        "work_items": [
          {
            "id": "FE-001",
            "description": "Set up React project using Create React App.",
            "dependencies": [],
            "estimated_time": "4 hours",
            "agent_role": "frontend_developer",
            "acceptance_criteria": [
              "Project is initialized successfully.",
              "Default React app runs without errors."
            ],
            "status": "pending",
            "code_files": [
              "package.json",
              "src/App.js",
              "src/index.js"
            ]
          },
          {
            "id": "FE-002",
            "description": "Install and configure Axios for API calls.",
            "dependencies": [
              "FE-001"
            ],
            "estimated_time": "2 hours",
            "agent_role": "frontend_developer",
            "acceptance_criteria": [
              "Axios is installed.",
              "Axios is imported and configured in the React app."
            ],
            "status": "pending",
            "code_files": [
              "package.json",
              "src/App.js"
            ]
          },
          {
            "id": "FE-003",
            "description": "Create a component for the task input form (TaskInput).",
            "dependencies": [
              "FE-001"
            ],
            "estimated_time": "4 hours",
            "agent_role": "frontend_developer",
            "acceptance_criteria": [
              "TaskInput component renders correctly.",
              "Input field for task description exists.",
              "Add task button exists."
            ],
            "status": "pending",
            "code_files": [
              "src/components/TaskInput.js",
              "src/App.js"
            ]
          },
          {
            "id": "FE-004",
            "description": "Create a component for displaying the task list (TaskList).",
            "dependencies": [
              "FE-001"
            ],
            "estimated_time": "4 hours",
            "agent_role": "frontend_developer",
            "acceptance_criteria": [
              "TaskList component renders correctly.",
              "Task items are displayed (initially with dummy data).",
              "Each task item displays the task description."
            ],
            "status": "pending",
            "code_files": [
              "src/components/TaskList.js",
              "src/App.js"
            ]
          },
          {
            "id": "FE-005",
            "description": "Implement the functionality to add a new task via the API.",
            "dependencies": [
              "FE-002",
              "FE-003"
            ],
            "estimated_time": "6 hours",
            "agent_role": "frontend_developer",
            "acceptance_criteria": [
              "Task description is retrieved from the input field.",
              "Axios POST request is made to the /tasks endpoint.",
              "Task list is updated after successful API call.",
              "Error messages are displayed if the API call fails."
            ],
            "status": "pending",
            "code_files": [
              "src/components/TaskInput.js",
              "src/App.js"
            ]
          },
          {
            "id": "FE-006",
            "description": "Implement the functionality to fetch and display the task list from the API.",
            "dependencies": [
              "FE-002",
              "FE-004"
            ],
            "estimated_time": "6 hours",
            "agent_role": "frontend_developer",
            "acceptance_criteria": [
              "Axios GET request is made to the /tasks endpoint on component mount.",
              "Task list is displayed correctly from the API response.",
              "Loading state is displayed while fetching data.",
              "Error messages are displayed if the API call fails."
            ],
            "status": "pending",
            "code_files": [
              "src/components/TaskList.js",
              "src/App.js"
            ]
          },
          {
            "id": "TE-001",
            "description": "Write unit tests for the frontend components.",
            "dependencies": [
              "FE-001",
              "FE-003",
              "FE-004"
            ],
            "estimated_time": "8 hours",
            "agent_role": "frontend_developer",
            "acceptance_criteria": [
              "Unit tests are written for TaskInput component.",
              "Unit tests are written for TaskList component.",
              "Tests cover component rendering and basic functionality.",
              "Tests pass."
            ],
            "status": "pending",
            "code_files": [
              "src/components/TaskInput.test.js",
              "src/components/TaskList.test.js"
            ]
          },
          {
            "id": "TE-003",
            "description": "Write integration tests for the frontend and backend interaction.",
            "dependencies": [
              "FE-006",
              "BE-005"
            ],
            "estimated_time": "8 hours",
            "agent_role": "frontend_developer",
            "acceptance_criteria": [
              "Integration tests are written to verify the communication between frontend and backend.",
              "Tests cover adding a task and retrieving the task list.",
              "Tests pass."
            ],
            "status": "pending",
            "code_files": [
              "integration_tests/app.test.js"
            ]
          },
          {
            "id": "MO-003",
            "description": "Integrate error tracking (e.g., Sentry).",
            "dependencies": [
              "BE-001",
              "FE-001"
            ],
            "estimated_time": "4 hours",
            "agent_role": "frontend_developer",
            "acceptance_criteria": [
              "Sentry is integrated into the frontend and backend.",
              "Errors are automatically reported to Sentry.",
              "Error reports include stack traces and relevant context."
            ],
            "status": "pending",
            "code_files": [
              "src/App.js",
              "index.js"
            ]
          }
        ]
      },
      {
        "name": "Backend Phase",
        "description": "Tasks related to backend phase",
        "deliverables": [
          "Completed BE-001",
          "Completed BE-002",
          "Completed BE-004",
          "Completed BE-005",
          "Completed BE-006",
          "Completed TE-002",
          "Completed MO-002"
        ],
        "estimated_duration_hours": 30.0,
        "work_items": [
          {
            "id": "BE-001",
            "description": "Set up Node.js and Express project.",
            "dependencies": [],
            "estimated_time": "4 hours",
            "agent_role": "backend_developer",
            "acceptance_criteria": [
              "Project is initialized successfully.",
              "Express server runs without errors.",
              "Basic route (e.g., '/') responds with 'Hello World'."
            ],
            "status": "pending",
            "code_files": [
              "package.json",
              "index.js"
            ]
          },
          {
            "id": "BE-002",
            "description": "Install and configure PostgreSQL client library (e.g., pg).",
            "dependencies": [
              "BE-001"
            ],
            "estimated_time": "2 hours",
            "agent_role": "backend_developer",
            "acceptance_criteria": [
              "PostgreSQL client library is installed.",
              "Connection to the database is established successfully."
            ],
            "status": "pending",
            "code_files": [
              "package.json",
              "index.js"
            ]
          },
          {
            "id": "BE-004",
            "description": "Implement the /tasks POST endpoint (create task).",
            "dependencies": [
              "BE-002",
              "BE-003"
            ],
            "estimated_time": "6 hours",
            "agent_role": "backend_developer",
            "acceptance_criteria": [
              "Endpoint handles POST requests to /tasks.",
              "Endpoint receives a description in the request body.",
              "Task is inserted into the database.",
              "Endpoint returns 201 Created with the created task.",
              "Endpoint returns 400 Bad Request if description is missing."
            ],
            "status": "pending",
            "code_files": [
              "index.js"
            ]
          },
          {
            "id": "BE-005",
            "description": "Implement the /tasks GET endpoint (get tasks).",
            "dependencies": [
              "BE-002",
              "BE-003"
            ],
            "estimated_time": "4 hours",
            "agent_role": "backend_developer",
            "acceptance_criteria": [
              "Endpoint handles GET requests to /tasks.",
              "Endpoint retrieves all tasks from the database.",
              "Endpoint returns 200 OK with the list of tasks."
            ],
            "status": "pending",
            "code_files": [
              "index.js"
            ]
          },
          {
            "id": "BE-006",
            "description": "Implement input validation for the /tasks POST endpoint.",
            "dependencies": [
              "BE-004"
            ],
            "estimated_time": "2 hours",
            "agent_role": "backend_developer",
            "acceptance_criteria": [
              "Input validation checks for the presence of the description field.",
              "Returns a 400 Bad Request with an error message if the description is missing."
            ],
            "status": "pending",
            "code_files": [
              "index.js"
            ]
          },
          {
            "id": "TE-002",
            "description": "Write unit tests for the backend API endpoints.",
            "dependencies": [
              "BE-004",
              "BE-005"
            ],
            "estimated_time": "8 hours",
            "agent_role": "backend_developer",
            "acceptance_criteria": [
              "Unit tests are written for the /tasks POST endpoint.",
              "Unit tests are written for the /tasks GET endpoint.",
              "Tests cover request validation, database interaction, and response codes.",
              "Tests pass."
            ],
            "status": "pending",
            "code_files": [
              "tests/index.test.js"
            ]
          },
          {
            "id": "MO-002",
            "description": "Implement logging using Winston (or similar) in the backend.",
            "dependencies": [
              "BE-001"
            ],
            "estimated_time": "4 hours",
            "agent_role": "backend_developer",
            "acceptance_criteria": [
              "Winston is installed and configured.",
              "Application logs are written to the console and/or a file.",
              "Logs include timestamps, log levels, and relevant information."
            ],
            "status": "pending",
            "code_files": [
              "index.js"
            ]
          }
        ]
      },
      {
        "name": "Database Phase",
        "description": "Tasks related to database phase",
        "deliverables": [
          "Completed BE-003"
        ],
        "estimated_duration_hours": 4.0,
        "work_items": [
          {
            "id": "BE-003",
            "description": "Create the database schema (tasks table).",
            "dependencies": [
              "BE-002"
            ],
            "estimated_time": "4 hours",
            "agent_role": "database_specialist",
            "acceptance_criteria": [
              "Tasks table exists.",
              "Tasks table has id, description, and created_at columns.",
              "id is a SERIAL primary key.",
              "description is TEXT NOT NULL.",
              "created_at is TIMESTAMP with DEFAULT CURRENT_TIMESTAMP."
            ],
            "status": "pending",
            "code_files": [
              "db/schema.sql"
            ]
          }
        ]
      },
      {
        "name": "Devops_Engineer Phase",
        "description": "Tasks related to devops_engineer phase",
        "deliverables": [
          "Completed DE-001",
          "Completed DE-002",
          "Completed DE-003",
          "Completed DE-004",
          "Completed DE-005",
          "Completed MO-001"
        ],
        "estimated_duration_hours": 44.0,
        "work_items": [
          {
            "id": "DE-001",
            "description": "Create a Dockerfile for the frontend.",
            "dependencies": [
              "FE-006"
            ],
            "estimated_time": "4 hours",
            "agent_role": "devops_engineer",
            "acceptance_criteria": [
              "Dockerfile exists for the frontend.",
              "Dockerfile builds the React application.",
              "Dockerfile serves the built application on port 3000."
            ],
            "status": "pending",
            "code_files": [
              "Dockerfile.frontend"
            ]
          },
          {
            "id": "DE-002",
            "description": "Create a Dockerfile for the backend.",
            "dependencies": [
              "BE-005"
            ],
            "estimated_time": "4 hours",
            "agent_role": "devops_engineer",
            "acceptance_criteria": [
              "Dockerfile exists for the backend.",
              "Dockerfile builds the Node.js application.",
              "Dockerfile exposes port 3001."
            ],
            "status": "pending",
            "code_files": [
              "Dockerfile.backend"
            ]
          },
          {
            "id": "DE-003",
            "description": "Set up a CI/CD pipeline (e.g., GitHub Actions) for the frontend.",
            "dependencies": [
              "DE-001"
            ],
            "estimated_time": "8 hours",
            "agent_role": "devops_engineer",
            "acceptance_criteria": [
              "CI/CD pipeline is configured.",
              "Pipeline builds the frontend Docker image on push.",
              "Pipeline pushes the image to a container registry (e.g., Docker Hub)."
            ],
            "status": "pending",
            "code_files": [
              ".github/workflows/frontend-ci.yml"
            ]
          },
          {
            "id": "DE-004",
            "description": "Set up a CI/CD pipeline (e.g., GitHub Actions) for the backend.",
            "dependencies": [
              "DE-002"
            ],
            "estimated_time": "8 hours",
            "agent_role": "devops_engineer",
            "acceptance_criteria": [
              "CI/CD pipeline is configured.",
              "Pipeline builds the backend Docker image on push.",
              "Pipeline pushes the image to a container registry (e.g., Docker Hub)."
            ],
            "status": "pending",
            "code_files": [
              ".github/workflows/backend-ci.yml"
            ]
          },
          {
            "id": "DE-005",
            "description": "Deploy the frontend and backend to AWS (e.g., using Elastic Beanstalk or ECS).",
            "dependencies": [
              "DE-003",
              "DE-004"
            ],
            "estimated_time": "16 hours",
            "agent_role": "devops_engineer",
            "acceptance_criteria": [
              "Frontend is deployed to AWS.",
              "Backend is deployed to AWS.",
              "Frontend can successfully call the backend API.",
              "Application is accessible via a public URL."
            ],
            "status": "pending",
            "code_files": []
          },
          {
            "id": "MO-001",
            "description": "Set up AWS CloudWatch for monitoring.",
            "dependencies": [
              "DE-005"
            ],
            "estimated_time": "4 hours",
            "agent_role": "devops_engineer",
            "acceptance_criteria": [
              "CloudWatch is configured to monitor application performance.",
              "Metrics are collected for CPU usage, memory usage, and API response times.",
              "Alerts are set up for critical events."
            ],
            "status": "pending",
            "code_files": []
          }
        ]
      }
    ],
    "timeline_estimation": {
      "start_date": "2025-07-09T09:32:51.129861",
      "end_date": "TBD",
      "milestones": []
    },
    "risk_assessment": [],
    "resource_requirements": [
      {
        "role": "Frontend Developer",
        "count": 1,
        "estimated_time_allocation": "100%",
        "phases": [
          "Frontend Phase"
        ],
        "skills_required": []
      },
      {
        "role": "Devops Engineer",
        "count": 1,
        "estimated_time_allocation": "100%",
        "phases": [
          "Devops_Engineer Phase"
        ],
        "skills_required": []
      },
      {
        "role": "Database Specialist",
        "count": 1,
        "estimated_time_allocation": "100%",
        "phases": [
          "Database Phase"
        ],
        "skills_required": []
      },
      {
        "role": "Backend Developer",
        "count": 1,
        "estimated_time_allocation": "100%",
        "phases": [
          "Backend Phase"
        ],
        "skills_required": []
      }
    ],
    "deliverables": [
      "Completed FE-001",
      "Completed FE-002",
      "Completed FE-003",
      "Completed FE-004",
      "Completed FE-005",
      "Completed FE-006",
      "Completed TE-001",
      "Completed TE-003",
      "Completed MO-003",
      "Completed BE-001",
      "Completed BE-002",
      "Completed BE-004",
      "Completed BE-005",
      "Completed BE-006",
      "Completed TE-002",
      "Completed MO-002",
      "Completed BE-003",
      "Completed DE-001",
      "Completed DE-002",
      "Completed DE-003",
      "Completed DE-004",
      "Completed DE-005",
      "Completed MO-001"
    ],
    "dependencies": [],
    "raw_plan": "plan=ImplementationPlan(project_summary={'title': 'Generated Project Plan', 'description': 'Develop a simple web application for managing a list of tasks using React, Node.js, PostgreSQL, and AWS. The application will allow users to add and view tasks. The project will be deployed using Docker and a CI/CD pipeline for automated builds and deployments. Monitoring and logging will be implemented to ensure application health and performance.', 'overall_complexity': 'Medium', 'estimated_duration': 'TBD', 'key_challenges': [], 'success_criteria': []}, phases=[{'name': 'Frontend Phase', 'description': 'Tasks related to frontend phase', 'deliverables': ['Completed FE-001', 'Completed FE-002', 'Completed FE-003', 'Completed FE-004', 'Completed FE-005', 'Completed FE-006', 'Completed TE-001', 'Completed TE-003', 'Completed MO-003'], 'estimated_duration_hours': 46.0, 'work_items': [{'id': 'FE-001', 'description': 'Set up React project using Create React App.', 'dependencies': [], 'estimated_time': '4 hours', 'agent_role': 'frontend_developer', 'acceptance_criteria': ['Project is initialized successfully.', 'Default React app runs without errors.'], 'status': 'pending', 'code_files': ['package.json', 'src/App.js', 'src/index.js']}, {'id': 'FE-002', 'description': 'Install and configure Axios for API calls.', 'dependencies': ['FE-001'], 'estimated_time': '2 hours', 'agent_role': 'frontend_developer', 'acceptance_criteria': ['Axios is installed.', 'Axios is imported and configured in the React app.'], 'status': 'pending', 'code_files': ['package.json', 'src/App.js']}, {'id': 'FE-003', 'description': 'Create a component for the task input form (TaskInput).', 'dependencies': ['FE-001'], 'estimated_time': '4 hours', 'agent_role': 'frontend_developer', 'acceptance_criteria': ['TaskInput component renders correctly.', 'Input field for task description exists.', 'Add task button exists.'], 'status': 'pending', 'code_files': ['src/components/TaskInput.js', 'src/App.js']}, {'id': 'FE-004', 'description': 'Create a component for displaying the task list (TaskList).', 'dependencies': ['FE-001'], 'estimated_time': '4 hours', 'agent_role': 'frontend_developer', 'acceptance_criteria': ['TaskList component renders correctly.', 'Task items are displayed (initially with dummy data).', 'Each task item displays the task description.'], 'status': 'pending', 'code_files': ['src/components/TaskList.js', 'src/App.js']}, {'id': 'FE-005', 'description': 'Implement the functionality to add a new task via the API.', 'dependencies': ['FE-002', 'FE-003'], 'estimated_time': '6 hours', 'agent_role': 'frontend_developer', 'acceptance_criteria': ['Task description is retrieved from the input field.', 'Axios POST request is made to the /tasks endpoint.', 'Task list is updated after successful API call.', 'Error messages are displayed if the API call fails.'], 'status': 'pending', 'code_files': ['src/components/TaskInput.js', 'src/App.js']}, {'id': 'FE-006', 'description': 'Implement the functionality to fetch and display the task list from the API.', 'dependencies': ['FE-002', 'FE-004'], 'estimated_time': '6 hours', 'agent_role': 'frontend_developer', 'acceptance_criteria': ['Axios GET request is made to the /tasks endpoint on component mount.', 'Task list is displayed correctly from the API response.', 'Loading state is displayed while fetching data.', 'Error messages are displayed if the API call fails.'], 'status': 'pending', 'code_files': ['src/components/TaskList.js', 'src/App.js']}, {'id': 'TE-001', 'description': 'Write unit tests for the frontend components.', 'dependencies': ['FE-001', 'FE-003', 'FE-004'], 'estimated_time': '8 hours', 'agent_role': 'frontend_developer', 'acceptance_criteria': ['Unit tests are written for TaskInput component.', 'Unit tests are written for TaskList component.', 'Tests cover component rendering and basic functionality.', 'Tests pass.'], 'status': 'pending', 'code_files': ['src/components/TaskInput.test.js', 'src/components/TaskList.test.js']}, {'id': 'TE-003', 'description': 'Write integration tests for the frontend and backend interaction.', 'dependencies': ['FE-006', 'BE-005'], 'estimated_time': '8 hours', 'agent_role': 'frontend_developer', 'acceptance_criteria': ['Integration tests are written to verify the communication between frontend and backend.', 'Tests cover adding a task and retrieving the task list.', 'Tests pass.'], 'status': 'pending', 'code_files': ['integration_tests/app.test.js']}, {'id': 'MO-003', 'description': 'Integrate error tracking (e.g., Sentry).', 'dependencies': ['BE-001', 'FE-001'], 'estimated_time': '4 hours', 'agent_role': 'frontend_developer', 'acceptance_criteria': ['Sentry is integrated into the frontend and backend.', 'Errors are automatically reported to Sentry.', 'Error reports include stack traces and relevant context.'], 'status': 'pending', 'code_files': ['src/App.js', 'index.js']}]}, {'name': 'Backend Phase', 'description': 'Tasks related to backend phase', 'deliverables': ['Completed BE-001', 'Completed BE-002', 'Completed BE-004', 'Completed BE-005', 'Completed BE-006', 'Completed TE-002', 'Completed MO-002'], 'estimated_duration_hours': 30.0, 'work_items': [{'id': 'BE-001', 'description': 'Set up Node.js and Express project.', 'dependencies': [], 'estimated_time': '4 hours', 'agent_role': 'backend_developer', 'acceptance_criteria': ['Project is initialized successfully.', 'Express server runs without errors.', \"Basic route (e.g., '/') responds with 'Hello World'.\"], 'status': 'pending', 'code_files': ['package.json', 'index.js']}, {'id': 'BE-002', 'description': 'Install and configure PostgreSQL client library (e.g., pg).', 'dependencies': ['BE-001'], 'estimated_time': '2 hours', 'agent_role': 'backend_developer', 'acceptance_criteria': ['PostgreSQL client library is installed.', 'Connection to the database is established successfully.'], 'status': 'pending', 'code_files': ['package.json', 'index.js']}, {'id': 'BE-004', 'description': 'Implement the /tasks POST endpoint (create task).', 'dependencies': ['BE-002', 'BE-003'], 'estimated_time': '6 hours', 'agent_role': 'backend_developer', 'acceptance_criteria': ['Endpoint handles POST requests to /tasks.', 'Endpoint receives a description in the request body.', 'Task is inserted into the database.', 'Endpoint returns 201 Created with the created task.', 'Endpoint returns 400 Bad Request if description is missing.'], 'status': 'pending', 'code_files': ['index.js']}, {'id': 'BE-005', 'description': 'Implement the /tasks GET endpoint (get tasks).', 'dependencies': ['BE-002', 'BE-003'], 'estimated_time': '4 hours', 'agent_role': 'backend_developer', 'acceptance_criteria': ['Endpoint handles GET requests to /tasks.', 'Endpoint retrieves all tasks from the database.', 'Endpoint returns 200 OK with the list of tasks.'], 'status': 'pending', 'code_files': ['index.js']}, {'id': 'BE-006', 'description': 'Implement input validation for the /tasks POST endpoint.', 'dependencies': ['BE-004'], 'estimated_time': '2 hours', 'agent_role': 'backend_developer', 'acceptance_criteria': ['Input validation checks for the presence of the description field.', 'Returns a 400 Bad Request with an error message if the description is missing.'], 'status': 'pending', 'code_files': ['index.js']}, {'id': 'TE-002', 'description': 'Write unit tests for the backend API endpoints.', 'dependencies': ['BE-004', 'BE-005'], 'estimated_time': '8 hours', 'agent_role': 'backend_developer', 'acceptance_criteria': ['Unit tests are written for the /tasks POST endpoint.', 'Unit tests are written for the /tasks GET endpoint.', 'Tests cover request validation, database interaction, and response codes.', 'Tests pass.'], 'status': 'pending', 'code_files': ['tests/index.test.js']}, {'id': 'MO-002', 'description': 'Implement logging using Winston (or similar) in the backend.', 'dependencies': ['BE-001'], 'estimated_time': '4 hours', 'agent_role': 'backend_developer', 'acceptance_criteria': ['Winston is installed and configured.', 'Application logs are written to the console and/or a file.', 'Logs include timestamps, log levels, and relevant information.'], 'status': 'pending', 'code_files': ['index.js']}]}, {'name': 'Database Phase', 'description': 'Tasks related to database phase', 'deliverables': ['Completed BE-003'], 'estimated_duration_hours': 4.0, 'work_items': [{'id': 'BE-003', 'description': 'Create the database schema (tasks table).', 'dependencies': ['BE-002'], 'estimated_time': '4 hours', 'agent_role': 'database_specialist', 'acceptance_criteria': ['Tasks table exists.', 'Tasks table has id, description, and created_at columns.', 'id is a SERIAL primary key.', 'description is TEXT NOT NULL.', 'created_at is TIMESTAMP with DEFAULT CURRENT_TIMESTAMP.'], 'status': 'pending', 'code_files': ['db/schema.sql']}]}, {'name': 'Devops_Engineer Phase', 'description': 'Tasks related to devops_engineer phase', 'deliverables': ['Completed DE-001', 'Completed DE-002', 'Completed DE-003', 'Completed DE-004', 'Completed DE-005', 'Completed MO-001'], 'estimated_duration_hours': 44.0, 'work_items': [{'id': 'DE-001', 'description': 'Create a Dockerfile for the frontend.', 'dependencies': ['FE-006'], 'estimated_time': '4 hours', 'agent_role': 'devops_engineer', 'acceptance_criteria': ['Dockerfile exists for the frontend.', 'Dockerfile builds the React application.', 'Dockerfile serves the built application on port 3000.'], 'status': 'pending', 'code_files': ['Dockerfile.frontend']}, {'id': 'DE-002', 'description': 'Create a Dockerfile for the backend.', 'dependencies': ['BE-005'], 'estimated_time': '4 hours', 'agent_role': 'devops_engineer', 'acceptance_criteria': ['Dockerfile exists for the backend.', 'Dockerfile builds the Node.js application.', 'Dockerfile exposes port 3001.'], 'status': 'pending', 'code_files': ['Dockerfile.backend']}, {'id': 'DE-003', 'description': 'Set up a CI/CD pipeline (e.g., GitHub Actions) for the frontend.', 'dependencies': ['DE-001'], 'estimated_time': '8 hours', 'agent_role': 'devops_engineer', 'acceptance_criteria': ['CI/CD pipeline is configured.', 'Pipeline builds the frontend Docker image on push.', 'Pipeline pushes the image to a container registry (e.g., Docker Hub).'], 'status': 'pending', 'code_files': ['.github/workflows/frontend-ci.yml']}, {'id': 'DE-004', 'description': 'Set up a CI/CD pipeline (e.g., GitHub Actions) for the backend.', 'dependencies': ['DE-002'], 'estimated_time': '8 hours', 'agent_role': 'devops_engineer', 'acceptance_criteria': ['CI/CD pipeline is configured.', 'Pipeline builds the backend Docker image on push.', 'Pipeline pushes the image to a container registry (e.g., Docker Hub).'], 'status': 'pending', 'code_files': ['.github/workflows/backend-ci.yml']}, {'id': 'DE-005', 'description': 'Deploy the frontend and backend to AWS (e.g., using Elastic Beanstalk or ECS).', 'dependencies': ['DE-003', 'DE-004'], 'estimated_time': '16 hours', 'agent_role': 'devops_engineer', 'acceptance_criteria': ['Frontend is deployed to AWS.', 'Backend is deployed to AWS.', 'Frontend can successfully call the backend API.', 'Application is accessible via a public URL.'], 'status': 'pending', 'code_files': []}, {'id': 'MO-001', 'description': 'Set up AWS CloudWatch for monitoring.', 'dependencies': ['DE-005'], 'estimated_time': '4 hours', 'agent_role': 'devops_engineer', 'acceptance_criteria': ['CloudWatch is configured to monitor application performance.', 'Metrics are collected for CPU usage, memory usage, and API response times.', 'Alerts are set up for critical events.'], 'status': 'pending', 'code_files': []}]}], resource_allocation=[{'role': 'Frontend Developer', 'count': 1, 'estimated_time_allocation': '100%', 'phases': ['Frontend Phase'], 'skills_required': []}, {'role': 'Devops Engineer', 'count': 1, 'estimated_time_allocation': '100%', 'phases': ['Devops_Engineer Phase'], 'skills_required': []}, {'role': 'Database Specialist', 'count': 1, 'estimated_time_allocation': '100%', 'phases': ['Database Phase'], 'skills_required': []}, {'role': 'Backend Developer', 'count': 1, 'estimated_time_allocation': '100%', 'phases': ['Backend Phase'], 'skills_required': []}], risks_and_mitigations=[], timeline={'start_date': '2025-07-09T09:32:51.129861', 'end_date': 'TBD', 'milestones': []}, tech_stack={}, metadata={'generated_at': '2025-07-09T09:32:51.129861', 'version': '1.0', 'author': 'Multi-AI Dev System', 'tags': [], 'notes': 'Converted from WorkItemBacklog. Original summary: Develop a simple web application for managing a list of tasks using React, Node.js, PostgreSQL, and AWS. The application will allow users to add and view tasks. The project will be deployed using Docker and a CI/CD pipeline for automated builds and deployments. Monitoring and logging will be implemented to ensure application health and performance.'}) summary='Develop a simple web application for managing a list of tasks using React, Node.js, PostgreSQL, and AWS. The application will allow users to add and view tasks. The project will be deployed using Docker and a CI/CD pipeline for automated builds and deployments. Monitoring and logging will be implemented to ensure application health and performance.' metadata=PlanMetadata(generated_at='2025-07-09T09:32:51.129861', version='1.0', author='Multi-AI Dev System', tags=[], notes='Converted from WorkItemBacklog. Original summary: Develop a simple web application for managing a list of tasks using React, Node.js, PostgreSQL, and AWS. The application will allow users to add and view tasks. The project will be deployed using Docker and a CI/CD pipeline for automated builds and deployments. Monitoring and logging will be implemented to ensure application health and performance.')"
  },
  "workflow_state_snapshot": {
    "requirements_analysis": {
      "project_name": "Hello World Task List",
      "project_summary": "A simple web application to manage a list of tasks.",
      "project_goals": [
        "Allow a user to add a task",
        "Allow a user to see their list of tasks"
      ],
      "target_audience": [
        "Users who want to manage a list of tasks"
      ],
      "business_context": "This project aims to provide a basic task management tool.",
      "requirements": [
        {
          "id": "REQ-001",
          "description": "A user can create a new task with a text description.",
          "category": "functional",
          "priority": 1
        },
        {
          "id": "REQ-002",
          "description": "A user can see a list of all created tasks.",
          "category": "functional",
          "priority": 1
        },
        {
          "id": "REQ-003",
          "description": "The application must load quickly.",
          "category": "non_functional",
          "priority": 2
        },
        {
          "id": "REQ-004",
          "description": "The application must be secure.",
          "category": "non_functional",
          "priority": 2
        }
      ],
      "functional_requirements": [
        "A user can create a new task with a text description.",
        "A user can see a list of all created tasks."
      ],
      "non_functional_requirements": [
        "The application must load quickly.",
        "The application must be secure."
      ],
      "stakeholders": [
        "Users"
      ],
      "success_criteria": [
        "Users can successfully add tasks.",
        "Users can successfully view their task list.",
        "The application loads quickly.",
        "The application is secure."
      ],
      "constraints": [],
      "assumptions": [],
      "risks": [],
      "domain_specific_details": {},
      "quality_assessment": {
        "clarity_score": 9.0,
        "completeness_score": 8.0,
        "consistency_score": 10.0,
        "recommendations": []
      },
      "gap_analysis": {
        "identified_gaps": [],
        "recommendations_for_completion": []
      }
    },
    "tech_stack_recommendation": {
      "frontend_options": [
        {
          "name": "React",
          "language": "JavaScript",
          "reasoning": "React is a popular and efficient JavaScript library for building user interfaces. It offers a component-based architecture, making it easy to manage and update the UI. Its virtual DOM improves performance, addressing the requirement for quick loading.",
          "key_libraries": [
            "React Router (for navigation)",
            "Axios (for API calls)",
            "Material UI/Chakra UI (for UI components)"
          ],
          "pros": [
            "Large community and extensive documentation",
            "Component-based architecture for reusability",
            "Virtual DOM for efficient updates",
            "Good performance"
          ],
          "cons": [
            "Requires understanding of JavaScript and JSX",
            "Can have a steeper learning curve for beginners"
          ],
          "selected": false
        },
        {
          "name": "Vue.js",
          "language": "JavaScript",
          "reasoning": "Vue.js is a progressive framework that's easy to learn and integrate. It's known for its simplicity and clear documentation, making it suitable for this project's scope. It also offers good performance and a reactive data binding system.",
          "key_libraries": [
            "Vue Router (for navigation)",
            "Axios (for API calls)",
            "Vuetify/BootstrapVue (for UI components)"
          ],
          "pros": [
            "Easy to learn and use",
            "Good performance",
            "Clear documentation",
            "Progressive framework (can be integrated into existing projects)"
          ],
          "cons": [
            "Smaller community compared to React",
            "Ecosystem might not be as extensive as React's"
          ],
          "selected": false
        },
        {
          "name": "Svelte",
          "language": "JavaScript",
          "reasoning": "Svelte is a component framework that compiles your code to highly optimized vanilla JavaScript at build time. This results in excellent performance and a small bundle size, directly addressing the need for quick loading. It's also known for its concise syntax.",
          "key_libraries": [
            "SvelteKit (for routing and server-side rendering)",
            "Axios/Fetch (for API calls)",
            "Svelte Material UI/Flowbite-Svelte (for UI components)"
          ],
          "pros": [
            "Excellent performance (no virtual DOM)",
            "Small bundle size",
            "Concise and easy-to-read syntax",
            "Fast development"
          ],
          "cons": [
            "Smaller community compared to React and Vue",
            "Ecosystem is still developing"
          ],
          "selected": false
        }
      ],
      "backend_options": [
        {
          "name": "Node.js with Express",
          "language": "JavaScript",
          "reasoning": "Node.js with Express provides a lightweight and efficient backend solution. JavaScript is used on both the frontend and backend, which can streamline development. Express simplifies routing and middleware management, making it suitable for a simple API.",
          "key_libraries": [
            "Express.js (web framework)",
            "body-parser (for parsing request bodies)",
            "cors (for handling CORS)",
            "jsonwebtoken (for authentication)"
          ],
          "pros": [
            "JavaScript on both frontend and backend (full-stack JavaScript)",
            "Large community and extensive documentation",
            "Fast development with Express",
            "Good performance with asynchronous operations"
          ],
          "cons": [
            "Callback hell can be an issue (can be mitigated with async/await)",
            "Requires careful handling of asynchronous operations"
          ],
          "selected": false
        },
        {
          "name": "Python with Flask",
          "language": "Python",
          "reasoning": "Flask is a microframework that's easy to learn and use. Python's readability and extensive libraries make it a good choice for backend development. It's suitable for building a simple API.",
          "key_libraries": [
            "Flask (web framework)",
            "Flask-RESTful (for building REST APIs)",
            "SQLAlchemy (for database interaction)",
            "Flask-JWT-Extended (for authentication)"
          ],
          "pros": [
            "Easy to learn and use",
            "Large community and extensive documentation",
            "Python's readability",
            "Good for rapid prototyping"
          ],
          "cons": [
            "Can be slower than Node.js in some cases",
            "Requires understanding of Python"
          ],
          "selected": false
        },
        {
          "name": "Go with Gin",
          "language": "Go",
          "reasoning": "Go is known for its performance and concurrency features. Gin is a lightweight web framework that's easy to use. Go's efficiency can help meet the requirement for quick loading.",
          "key_libraries": [
            "Gin (web framework)",
            "GORM (for database interaction)",
            "JWT-go (for authentication)"
          ],
          "pros": [
            "High performance",
            "Excellent concurrency support",
            "Fast execution",
            "Statically typed, catching errors early"
          ],
          "cons": [
            "Steeper learning curve than Node.js or Python",
            "Smaller community compared to Node.js and Python"
          ],
          "selected": false
        }
      ],
      "database_options": [
        {
          "name": "PostgreSQL",
          "language": null,
          "reasoning": "PostgreSQL is a robust and reliable relational database. It offers strong data integrity and is suitable for storing structured data. It's a good choice for this project because of its reliability and support for complex queries if needed in the future.",
          "key_libraries": [
            "psycopg2 (for Python)",
            "pg (for Node.js)",
            "pq (for Go)"
          ],
          "pros": [
            "ACID compliance (ensures data integrity)",
            "Supports complex queries",
            "Large community and extensive documentation",
            "Scalable"
          ],
          "cons": [
            "Can be more complex to set up and manage than simpler databases",
            "Requires more resources than simpler databases"
          ],
          "selected": false
        },
        {
          "name": "MongoDB",
          "language": null,
          "reasoning": "MongoDB is a NoSQL database that's easy to use and flexible. It's suitable for storing unstructured or semi-structured data. Its schema-less nature allows for easy modification of the data structure.",
          "key_libraries": [
            "mongoose (for Node.js)",
            "pymongo (for Python)",
            "go.mongodb.org/mongo-driver (for Go)"
          ],
          "pros": [
            "Flexible schema",
            "Easy to scale",
            "Good performance for read/write operations",
            "Easy to set up and use"
          ],
          "cons": [
            "Data consistency can be more challenging to manage",
            "Not ideal for complex relationships"
          ],
          "selected": false
        },
        {
          "name": "SQLite",
          "language": null,
          "reasoning": "SQLite is a lightweight, file-based database that's easy to set up and use. It's suitable for small projects and prototyping. It requires no separate server process, making deployment simple.",
          "key_libraries": [
            "sqlite3 (built-in for Python and Go)",
            "sqlite3 (for Node.js)"
          ],
          "pros": [
            "Easy to set up and use",
            "No server process required",
            "Suitable for small projects",
            "Good for prototyping"
          ],
          "cons": [
            "Not suitable for high-traffic applications",
            "Limited scalability"
          ],
          "selected": false
        }
      ],
      "cloud_options": [
        {
          "name": "AWS",
          "language": null,
          "reasoning": "AWS offers a wide range of services, including compute, storage, and databases. It's a mature platform with extensive documentation and a large community. It provides scalability and security features.",
          "key_libraries": [
            "AWS SDKs for various languages"
          ],
          "pros": [
            "Wide range of services",
            "Scalability and reliability",
            "Mature platform with extensive documentation",
            "Strong security features"
          ],
          "cons": [
            "Can be complex to manage",
            "Can be expensive depending on usage"
          ],
          "selected": false
        },
        {
          "name": "Google Cloud Platform (GCP)",
          "language": null,
          "reasoning": "GCP offers competitive pricing and a strong focus on data analytics and machine learning. It provides a range of services similar to AWS, with a focus on open-source technologies.",
          "key_libraries": [
            "Google Cloud Client Libraries for various languages"
          ],
          "pros": [
            "Competitive pricing",
            "Strong focus on data analytics and machine learning",
            "Good performance",
            "User-friendly interface"
          ],
          "cons": [
            "Can be complex to manage",
            "Less mature than AWS in some areas"
          ],
          "selected": false
        },
        {
          "name": "DigitalOcean",
          "language": null,
          "reasoning": "DigitalOcean is a simpler and more affordable cloud platform, ideal for small projects and startups. It offers easy-to-use virtual machines (Droplets) and managed services.",
          "key_libraries": [
            "DigitalOcean API client libraries"
          ],
          "pros": [
            "Easy to use",
            "Affordable",
            "Good for small projects and startups",
            "Simple interface"
          ],
          "cons": [
            "Fewer services compared to AWS and GCP",
            "Limited scalability options"
          ],
          "selected": false
        }
      ],
      "architecture_options": [
        {
          "pattern": "Monolithic Architecture",
          "scalability_score": 4.0,
          "maintainability_score": 6.0,
          "development_speed_score": 8.0,
          "overall_score": 6.0,
          "reasoning": "A monolithic architecture is suitable for this small project. It allows for rapid development and deployment. However, as the application grows, it can become harder to scale and maintain."
        },
        {
          "pattern": "Microservices Architecture",
          "scalability_score": 8.0,
          "maintainability_score": 7.0,
          "development_speed_score": 4.0,
          "overall_score": 6.0,
          "reasoning": "While microservices offer excellent scalability and maintainability, they introduce complexity that might be unnecessary for this small project. The development speed will be slower initially."
        },
        {
          "pattern": "Serverless Architecture",
          "scalability_score": 9.0,
          "maintainability_score": 7.0,
          "development_speed_score": 6.0,
          "overall_score": 7.0,
          "reasoning": "Serverless architecture can be a good choice for this project, as it offers scalability and reduces operational overhead. However, it can introduce complexities in debugging and monitoring, and might be overkill for the current scope."
        }
      ],
      "tool_options": [
        {
          "name": "VS Code",
          "language": null,
          "reasoning": "Code editor with extensive features and extensions for various languages and frameworks.",
          "key_libraries": [],
          "pros": [],
          "cons": [],
          "selected": false
        },
        {
          "name": "Git",
          "language": null,
          "reasoning": "Version control system for tracking changes to the codebase.",
          "key_libraries": [],
          "pros": [],
          "cons": [],
          "selected": false
        },
        {
          "name": "Docker",
          "language": null,
          "reasoning": "Containerization platform for packaging and deploying the application.",
          "key_libraries": [],
          "pros": [],
          "cons": [],
          "selected": false
        },
        {
          "name": "CI/CD Pipeline (e.g., GitHub Actions, GitLab CI)",
          "language": null,
          "reasoning": "Automated build, test, and deployment process.",
          "key_libraries": [],
          "pros": [],
          "cons": [],
          "selected": false
        },
        {
          "name": "Postman",
          "language": null,
          "reasoning": "API testing and development tool.",
          "key_libraries": [],
          "pros": [],
          "cons": [],
          "selected": false
        },
        {
          "name": "Webpack/Parcel/Vite",
          "language": null,
          "reasoning": "Module bundler for optimizing frontend assets.",
          "key_libraries": [],
          "pros": [],
          "cons": [],
          "selected": false
        }
      ],
      "risks": [
        {
          "category": "Security",
          "description": "Vulnerabilities in dependencies could lead to security breaches.",
          "severity": "Medium",
          "likelihood": "Medium",
          "mitigation": "Regularly update dependencies and use security scanners."
        },
        {
          "category": "Performance",
          "description": "Inefficient code or database queries could lead to slow loading times.",
          "severity": "Medium",
          "likelihood": "Medium",
          "mitigation": "Optimize code, use caching, and monitor performance."
        },
        {
          "category": "Scalability",
          "description": "The application might not scale well if the user base grows significantly.",
          "severity": "Low",
          "likelihood": "Low",
          "mitigation": "Design the application with scalability in mind, and consider using a scalable database and cloud platform."
        }
      ],
      "synthesis": {
        "backend": {
          "name": "Node.js with Express",
          "language": "JavaScript",
          "reasoning": "Node.js with Express provides a lightweight and efficient backend solution. JavaScript is used on both the frontend and backend, which can streamline development. Express simplifies routing and middleware management, making it suitable for a simple API."
        },
        "frontend": {
          "name": "React",
          "language": "JavaScript",
          "reasoning": "React is a popular and efficient JavaScript library for building user interfaces. It offers a component-based architecture, making it easy to manage and update the UI. Its virtual DOM improves performance, addressing the requirement for quick loading."
        },
        "database": {
          "name": "PostgreSQL",
          "reasoning": "PostgreSQL is a robust and reliable relational database. It offers strong data integrity and is suitable for storing structured data. It's a good choice for this project because of its reliability and support for complex queries if needed in the future."
        },
        "architecture_pattern": "Monolithic Architecture",
        "deployment_environment": {
          "cloud": "AWS",
          "reasoning": "AWS offers a wide range of services, including compute, storage, and databases. It's a mature platform with extensive documentation and a large community. It provides scalability and security features."
        },
        "key_libraries_tools": [
          {
            "name": "React Router (for navigation)",
            "purpose": "Handles navigation within the React application."
          },
          {
            "name": "Axios (for API calls)",
            "purpose": "Makes HTTP requests to the backend API."
          },
          {
            "name": "Express.js (web framework)",
            "purpose": "Handles routing and middleware on the backend."
          },
          {
            "name": "PostgreSQL client library (e.g., pg)",
            "purpose": "Connects to the PostgreSQL database."
          },
          {
            "name": "Docker",
            "purpose": "Containerization for deployment."
          },
          {
            "name": "CI/CD Pipeline (e.g., GitHub Actions)",
            "purpose": "Automated build, test, and deployment process."
          }
        ],
        "estimated_complexity": "Low"
      },
      "selected_stack": null
    },
    "system_design": {
      "architecture": {
        "pattern": "Monolithic Architecture",
        "justification": "The monolithic architecture is suitable for this small project due to its simplicity and ease of development. It allows for rapid development and deployment. The project's scope is limited, so the complexity of a microservices architecture is not warranted. The monolithic approach will be easier to manage and maintain for the current requirements.",
        "key_benefits": [
          "Faster development and deployment",
          "Simplified deployment process",
          "Easier to manage for a small project",
          "Reduced operational overhead"
        ],
        "potential_drawbacks": [
          "Limited scalability compared to microservices",
          "Can become difficult to maintain as the application grows",
          "A single point of failure"
        ]
      },
      "components": [
        {
          "name": "Frontend",
          "description": "The user interface for the task list application.",
          "category": "frontend",
          "technologies": [
            "React",
            "JavaScript",
            "HTML",
            "CSS"
          ],
          "dependencies": [
            "Backend API"
          ],
          "responsibilities": [
            "Displaying the task list",
            "Allowing users to add new tasks",
            "Handling user interactions",
            "Making API calls to the backend"
          ],
          "design_patterns": [
            "Component-based architecture"
          ]
        },
        {
          "name": "Backend API",
          "description": "The RESTful API that handles task management logic and data storage.",
          "category": "backend",
          "technologies": [
            "Node.js",
            "Express.js",
            "JavaScript",
            "PostgreSQL"
          ],
          "dependencies": [
            "Database"
          ],
          "responsibilities": [
            "Handling API requests",
            "Validating user input",
            "Interacting with the database",
            "Returning data to the frontend"
          ],
          "design_patterns": [
            "MVC (Model-View-Controller)"
          ]
        },
        {
          "name": "Database",
          "description": "Stores the task data.",
          "category": "backend",
          "technologies": [
            "PostgreSQL"
          ],
          "dependencies": [],
          "responsibilities": [
            "Storing task data",
            "Providing data access to the backend API"
          ],
          "design_patterns": [
            "Relational Database"
          ]
        },
        {
          "name": "Deployment Infrastructure",
          "description": "The infrastructure for deploying and running the application.",
          "category": "infrastructure",
          "technologies": [
            "AWS",
            "Docker",
            "CI/CD Pipeline (e.g., GitHub Actions)"
          ],
          "dependencies": [
            "Frontend",
            "Backend API",
            "Database"
          ],
          "responsibilities": [
            "Deploying the frontend and backend applications",
            "Managing the database",
            "Automating the build, test, and deployment process"
          ],
          "design_patterns": [
            "Containerization",
            "Infrastructure as Code (IaC)"
          ]
        }
      ],
      "data_model": {
        "schema_type": "Relational",
        "tables": [
          {
            "name": "tasks",
            "purpose": "Stores information about each task.",
            "fields": [
              {
                "name": "id",
                "type": "SERIAL",
                "constraints": [
                  "PRIMARY KEY"
                ],
                "description": "Unique identifier for the task."
              },
              {
                "name": "description",
                "type": "TEXT",
                "constraints": [
                  "NOT NULL"
                ],
                "description": "The text description of the task."
              },
              {
                "name": "created_at",
                "type": "TIMESTAMP",
                "constraints": [
                  "NOT NULL",
                  "DEFAULT CURRENT_TIMESTAMP"
                ],
                "description": "The timestamp when the task was created."
              }
            ],
            "relationships": []
          }
        ],
        "relationships": [],
        "justification": "A relational database (PostgreSQL) is chosen for its data integrity, support for complex queries (if needed in the future), and scalability. The data model is simple, but a relational database provides a solid foundation for future expansion."
      },
      "api_endpoints": {
        "style": "REST",
        "base_url": "/api/v1",
        "authentication": "None",
        "endpoints": [
          {
            "method": "POST",
            "path": "/tasks",
            "purpose": "Create a new task.",
            "parameters": [
              {
                "description": "The task description.",
                "type": "string",
                "name": "description"
              }
            ],
            "response": {
              "201": {
                "message": "Task created successfully",
                "task": {
                  "id": 1,
                  "description": "Example task",
                  "created_at": "2024-01-01T00:00:00.000Z"
                }
              },
              "400": {
                "message": "Bad Request",
                "errors": [
                  "Description is required"
                ]
              }
            },
            "authentication_required": false,
            "rate_limiting_applied": false
          },
          {
            "method": "GET",
            "path": "/tasks",
            "purpose": "Get a list of all tasks.",
            "parameters": [],
            "response": {
              "200": {
                "tasks": [
                  {
                    "id": 1,
                    "description": "Example task",
                    "created_at": "2024-01-01T00:00:00.000Z"
                  }
                ]
              }
            },
            "authentication_required": false,
            "rate_limiting_applied": false
          }
        ],
        "error_handling": "Standard HTTP status codes and JSON responses with error messages.",
        "rate_limiting_strategy": null
      },
      "security": {
        "authentication_method": "None",
        "authorization_strategy": "None",
        "data_encryption": {
          "at_rest": "Not applicable for this simple application.",
          "in_transit": "HTTPS is used to encrypt data in transit."
        },
        "security_measures": [
          {
            "category": "Input Validation",
            "implementation": "Validate all user inputs on the backend to prevent injection attacks.",
            "mitigation": "SQL Injection, Cross-Site Scripting (XSS)",
            "priority": "High"
          },
          {
            "category": "HTTPS",
            "implementation": "Enforce HTTPS for all communication between the frontend and backend.",
            "mitigation": "Man-in-the-middle attacks",
            "priority": "High"
          },
          {
            "category": "Dependency Management",
            "implementation": "Regularly update dependencies to patch security vulnerabilities.",
            "mitigation": "Vulnerabilities in dependencies",
            "priority": "Medium"
          },
          {
            "category": "Error Handling",
            "implementation": "Avoid exposing sensitive information in error messages.",
            "mitigation": "Information disclosure",
            "priority": "Medium"
          }
        ],
        "vulnerability_mitigation_strategies": [
          "Input validation",
          "Output encoding",
          "Regular dependency updates",
          "Use of HTTPS"
        ],
        "compliance_standards": []
      },
      "scalability_and_performance": {
        "caching": "Implement client-side caching for static assets (e.g., JavaScript, CSS) to improve loading times.",
        "database_optimization": "Optimize database queries and use indexes to improve query performance.",
        "code_optimization": "Write efficient code and avoid unnecessary computations.",
        "load_balancing": "Not required for the initial scope, but consider load balancing if the application grows."
      },
      "deployment_strategy": {
        "environment": "AWS (e.g., Elastic Beanstalk, ECS, or EC2 with Docker)",
        "process": "Use Docker containers for both frontend and backend. Deploy the containers to AWS. Utilize a CI/CD pipeline (e.g., GitHub Actions) to automate the build, test, and deployment process.",
        "database_setup": "Use AWS RDS for PostgreSQL. Configure the database connection details in the backend application."
      },
      "monitoring_and_logging": {
        "logging": "Implement logging in both the frontend and backend to track application behavior and errors. Use a logging library (e.g., Winston for Node.js).",
        "monitoring": "Use AWS CloudWatch for monitoring application performance and resource utilization. Set up alerts for critical events.",
        "error_tracking": "Integrate an error tracking service (e.g., Sentry) to capture and analyze errors."
      },
      "error_handling_strategy": "Use standard HTTP status codes to indicate the success or failure of API requests. Return JSON responses with error messages and details. Implement centralized error handling in the backend to catch and log errors.",
      "development_phases_overview": [
        {
          "name": "Phase 1: Setup and Backend Development",
          "description": "Set up the development environment, create the backend API (Node.js with Express), and connect to the PostgreSQL database. Implement the /tasks endpoints.",
          "priority": "High",
          "dependencies": [],
          "tasks": [
            "Set up Node.js and Express project",
            "Install PostgreSQL client library (e.g., pg)",
            "Create database schema",
            "Implement /tasks POST endpoint (create task)",
            "Implement /tasks GET endpoint (get tasks)",
            "Implement input validation"
          ],
          "estimated_duration": "1 week"
        },
        {
          "name": "Phase 2: Frontend Development",
          "description": "Develop the frontend application using React. Implement the UI for adding and viewing tasks. Integrate the frontend with the backend API.",
          "priority": "High",
          "dependencies": [
            "Phase 1: Setup and Backend Development"
          ],
          "tasks": [
            "Set up React project",
            "Design and implement the UI for adding tasks",
            "Design and implement the UI for viewing tasks",
            "Implement API calls using Axios",
            "Handle user input and display task list"
          ],
          "estimated_duration": "1 week"
        },
        {
          "name": "Phase 3: Testing and Deployment",
          "description": "Test the application, set up the deployment infrastructure (AWS, Docker, CI/CD), and deploy the application.",
          "priority": "High",
          "dependencies": [
            "Phase 1: Setup and Backend Development",
            "Phase 2: Frontend Development"
          ],
          "tasks": [
            "Write unit tests for backend and frontend",
            "Write integration tests",
            "Create Dockerfiles for frontend and backend",
            "Set up CI/CD pipeline (e.g., GitHub Actions)",
            "Deploy the application to AWS"
          ],
          "estimated_duration": "1 week"
        },
        {
          "name": "Phase 4: Monitoring and Refinement",
          "description": "Set up monitoring and logging. Refine the application based on user feedback and performance metrics.",
          "priority": "Medium",
          "dependencies": [
            "Phase 3: Testing and Deployment"
          ],
          "tasks": [
            "Set up AWS CloudWatch for monitoring",
            "Implement logging using Winston (or similar)",
            "Integrate error tracking (e.g., Sentry)",
            "Gather user feedback and address issues",
            "Optimize performance based on monitoring data"
          ],
          "estimated_duration": "Ongoing"
        }
      ],
      "key_risks": [
        "Security vulnerabilities in dependencies",
        "Performance issues due to inefficient code or database queries",
        "Scalability limitations if the application grows significantly"
      ],
      "design_justification": "The design prioritizes simplicity, ease of development, and quick deployment. The monolithic architecture, combined with React, Node.js, and PostgreSQL, provides a solid foundation for a simple task management application. The use of AWS and a CI/CD pipeline ensures a reliable and automated deployment process. The security measures and monitoring strategies address the non-functional requirements.",
      "data_flow": "1. User interacts with the React frontend (e.g., adds a task). 2. Frontend sends a POST request to the backend API (/tasks). 3. Backend API validates the request, interacts with the PostgreSQL database to store the task. 4. Backend API returns a success response to the frontend. 5. Frontend displays the updated task list by fetching data from the /tasks GET endpoint. 6. Frontend sends a GET request to the backend API (/tasks). 7. Backend API retrieves tasks from the PostgreSQL database. 8. Backend API returns the task list to the frontend. 9. Frontend displays the task list to the user."
    },
    "implementation_plan": "plan=ImplementationPlan(project_summary={'title': 'Generated Project Plan', 'description': 'Develop a simple web application for managing a list of tasks using React, Node.js, PostgreSQL, and AWS. The application will allow users to add and view tasks. The project will be deployed using Docker and a CI/CD pipeline for automated builds and deployments. Monitoring and logging will be implemented to ensure application health and performance.', 'overall_complexity': 'Medium', 'estimated_duration': 'TBD', 'key_challenges': [], 'success_criteria': []}, phases=[{'name': 'Frontend Phase', 'description': 'Tasks related to frontend phase', 'deliverables': ['Completed FE-001', 'Completed FE-002', 'Completed FE-003', 'Completed FE-004', 'Completed FE-005', 'Completed FE-006', 'Completed TE-001', 'Completed TE-003', 'Completed MO-003'], 'estimated_duration_hours': 46.0, 'work_items': [{'id': 'FE-001', 'description': 'Set up React project using Create React App.', 'dependencies': [], 'estimated_time': '4 hours', 'agent_role': 'frontend_developer', 'acceptance_criteria': ['Project is initialized successfully.', 'Default React app runs without errors.'], 'status': 'pending', 'code_files': ['package.json', 'src/App.js', 'src/index.js']}, {'id': 'FE-002', 'description': 'Install and configure Axios for API calls.', 'dependencies': ['FE-001'], 'estimated_time': '2 hours', 'agent_role': 'frontend_developer', 'acceptance_criteria': ['Axios is installed.', 'Axios is imported and configured in the React app.'], 'status': 'pending', 'code_files': ['package.json', 'src/App.js']}, {'id': 'FE-003', 'description': 'Create a component for the task input form (TaskInput).', 'dependencies': ['FE-001'], 'estimated_time': '4 hours', 'agent_role': 'frontend_developer', 'acceptance_criteria': ['TaskInput component renders correctly.', 'Input field for task description exists.', 'Add task button exists.'], 'status': 'pending', 'code_files': ['src/components/TaskInput.js', 'src/App.js']}, {'id': 'FE-004', 'description': 'Create a component for displaying the task list (TaskList).', 'dependencies': ['FE-001'], 'estimated_time': '4 hours', 'agent_role': 'frontend_developer', 'acceptance_criteria': ['TaskList component renders correctly.', 'Task items are displayed (initially with dummy data).', 'Each task item displays the task description.'], 'status': 'pending', 'code_files': ['src/components/TaskList.js', 'src/App.js']}, {'id': 'FE-005', 'description': 'Implement the functionality to add a new task via the API.', 'dependencies': ['FE-002', 'FE-003'], 'estimated_time': '6 hours', 'agent_role': 'frontend_developer', 'acceptance_criteria': ['Task description is retrieved from the input field.', 'Axios POST request is made to the /tasks endpoint.', 'Task list is updated after successful API call.', 'Error messages are displayed if the API call fails.'], 'status': 'pending', 'code_files': ['src/components/TaskInput.js', 'src/App.js']}, {'id': 'FE-006', 'description': 'Implement the functionality to fetch and display the task list from the API.', 'dependencies': ['FE-002', 'FE-004'], 'estimated_time': '6 hours', 'agent_role': 'frontend_developer', 'acceptance_criteria': ['Axios GET request is made to the /tasks endpoint on component mount.', 'Task list is displayed correctly from the API response.', 'Loading state is displayed while fetching data.', 'Error messages are displayed if the API call fails.'], 'status': 'pending', 'code_files': ['src/components/TaskList.js', 'src/App.js']}, {'id': 'TE-001', 'description': 'Write unit tests for the frontend components.', 'dependencies': ['FE-001', 'FE-003', 'FE-004'], 'estimated_time': '8 hours', 'agent_role': 'frontend_developer', 'acceptance_criteria': ['Unit tests are written for TaskInput component.', 'Unit tests are written for TaskList component.', 'Tests cover component rendering and basic functionality.', 'Tests pass.'], 'status': 'pending', 'code_files': ['src/components/TaskInput.test.js', 'src/components/TaskList.test.js']}, {'id': 'TE-003', 'description': 'Write integration tests for the frontend and backend interaction.', 'dependencies': ['FE-006', 'BE-005'], 'estimated_time': '8 hours', 'agent_role': 'frontend_developer', 'acceptance_criteria': ['Integration tests are written to verify the communication between frontend and backend.', 'Tests cover adding a task and retrieving the task list.', 'Tests pass.'], 'status': 'pending', 'code_files': ['integration_tests/app.test.js']}, {'id': 'MO-003', 'description': 'Integrate error tracking (e.g., Sentry).', 'dependencies': ['BE-001', 'FE-001'], 'estimated_time': '4 hours', 'agent_role': 'frontend_developer', 'acceptance_criteria': ['Sentry is integrated into the frontend and backend.', 'Errors are automatically reported to Sentry.', 'Error reports include stack traces and relevant context.'], 'status': 'pending', 'code_files': ['src/App.js', 'index.js']}]}, {'name': 'Backend Phase', 'description': 'Tasks related to backend phase', 'deliverables': ['Completed BE-001', 'Completed BE-002', 'Completed BE-004', 'Completed BE-005', 'Completed BE-006', 'Completed TE-002', 'Completed MO-002'], 'estimated_duration_hours': 30.0, 'work_items': [{'id': 'BE-001', 'description': 'Set up Node.js and Express project.', 'dependencies': [], 'estimated_time': '4 hours', 'agent_role': 'backend_developer', 'acceptance_criteria': ['Project is initialized successfully.', 'Express server runs without errors.', \"Basic route (e.g., '/') responds with 'Hello World'.\"], 'status': 'pending', 'code_files': ['package.json', 'index.js']}, {'id': 'BE-002', 'description': 'Install and configure PostgreSQL client library (e.g., pg).', 'dependencies': ['BE-001'], 'estimated_time': '2 hours', 'agent_role': 'backend_developer', 'acceptance_criteria': ['PostgreSQL client library is installed.', 'Connection to the database is established successfully.'], 'status': 'pending', 'code_files': ['package.json', 'index.js']}, {'id': 'BE-004', 'description': 'Implement the /tasks POST endpoint (create task).', 'dependencies': ['BE-002', 'BE-003'], 'estimated_time': '6 hours', 'agent_role': 'backend_developer', 'acceptance_criteria': ['Endpoint handles POST requests to /tasks.', 'Endpoint receives a description in the request body.', 'Task is inserted into the database.', 'Endpoint returns 201 Created with the created task.', 'Endpoint returns 400 Bad Request if description is missing.'], 'status': 'pending', 'code_files': ['index.js']}, {'id': 'BE-005', 'description': 'Implement the /tasks GET endpoint (get tasks).', 'dependencies': ['BE-002', 'BE-003'], 'estimated_time': '4 hours', 'agent_role': 'backend_developer', 'acceptance_criteria': ['Endpoint handles GET requests to /tasks.', 'Endpoint retrieves all tasks from the database.', 'Endpoint returns 200 OK with the list of tasks.'], 'status': 'pending', 'code_files': ['index.js']}, {'id': 'BE-006', 'description': 'Implement input validation for the /tasks POST endpoint.', 'dependencies': ['BE-004'], 'estimated_time': '2 hours', 'agent_role': 'backend_developer', 'acceptance_criteria': ['Input validation checks for the presence of the description field.', 'Returns a 400 Bad Request with an error message if the description is missing.'], 'status': 'pending', 'code_files': ['index.js']}, {'id': 'TE-002', 'description': 'Write unit tests for the backend API endpoints.', 'dependencies': ['BE-004', 'BE-005'], 'estimated_time': '8 hours', 'agent_role': 'backend_developer', 'acceptance_criteria': ['Unit tests are written for the /tasks POST endpoint.', 'Unit tests are written for the /tasks GET endpoint.', 'Tests cover request validation, database interaction, and response codes.', 'Tests pass.'], 'status': 'pending', 'code_files': ['tests/index.test.js']}, {'id': 'MO-002', 'description': 'Implement logging using Winston (or similar) in the backend.', 'dependencies': ['BE-001'], 'estimated_time': '4 hours', 'agent_role': 'backend_developer', 'acceptance_criteria': ['Winston is installed and configured.', 'Application logs are written to the console and/or a file.', 'Logs include timestamps, log levels, and relevant information.'], 'status': 'pending', 'code_files': ['index.js']}]}, {'name': 'Database Phase', 'description': 'Tasks related to database phase', 'deliverables': ['Completed BE-003'], 'estimated_duration_hours': 4.0, 'work_items': [{'id': 'BE-003', 'description': 'Create the database schema (tasks table).', 'dependencies': ['BE-002'], 'estimated_time': '4 hours', 'agent_role': 'database_specialist', 'acceptance_criteria': ['Tasks table exists.', 'Tasks table has id, description, and created_at columns.', 'id is a SERIAL primary key.', 'description is TEXT NOT NULL.', 'created_at is TIMESTAMP with DEFAULT CURRENT_TIMESTAMP.'], 'status': 'pending', 'code_files': ['db/schema.sql']}]}, {'name': 'Devops_Engineer Phase', 'description': 'Tasks related to devops_engineer phase', 'deliverables': ['Completed DE-001', 'Completed DE-002', 'Completed DE-003', 'Completed DE-004', 'Completed DE-005', 'Completed MO-001'], 'estimated_duration_hours': 44.0, 'work_items': [{'id': 'DE-001', 'description': 'Create a Dockerfile for the frontend.', 'dependencies': ['FE-006'], 'estimated_time': '4 hours', 'agent_role': 'devops_engineer', 'acceptance_criteria': ['Dockerfile exists for the frontend.', 'Dockerfile builds the React application.', 'Dockerfile serves the built application on port 3000.'], 'status': 'pending', 'code_files': ['Dockerfile.frontend']}, {'id': 'DE-002', 'description': 'Create a Dockerfile for the backend.', 'dependencies': ['BE-005'], 'estimated_time': '4 hours', 'agent_role': 'devops_engineer', 'acceptance_criteria': ['Dockerfile exists for the backend.', 'Dockerfile builds the Node.js application.', 'Dockerfile exposes port 3001.'], 'status': 'pending', 'code_files': ['Dockerfile.backend']}, {'id': 'DE-003', 'description': 'Set up a CI/CD pipeline (e.g., GitHub Actions) for the frontend.', 'dependencies': ['DE-001'], 'estimated_time': '8 hours', 'agent_role': 'devops_engineer', 'acceptance_criteria': ['CI/CD pipeline is configured.', 'Pipeline builds the frontend Docker image on push.', 'Pipeline pushes the image to a container registry (e.g., Docker Hub).'], 'status': 'pending', 'code_files': ['.github/workflows/frontend-ci.yml']}, {'id': 'DE-004', 'description': 'Set up a CI/CD pipeline (e.g., GitHub Actions) for the backend.', 'dependencies': ['DE-002'], 'estimated_time': '8 hours', 'agent_role': 'devops_engineer', 'acceptance_criteria': ['CI/CD pipeline is configured.', 'Pipeline builds the backend Docker image on push.', 'Pipeline pushes the image to a container registry (e.g., Docker Hub).'], 'status': 'pending', 'code_files': ['.github/workflows/backend-ci.yml']}, {'id': 'DE-005', 'description': 'Deploy the frontend and backend to AWS (e.g., using Elastic Beanstalk or ECS).', 'dependencies': ['DE-003', 'DE-004'], 'estimated_time': '16 hours', 'agent_role': 'devops_engineer', 'acceptance_criteria': ['Frontend is deployed to AWS.', 'Backend is deployed to AWS.', 'Frontend can successfully call the backend API.', 'Application is accessible via a public URL.'], 'status': 'pending', 'code_files': []}, {'id': 'MO-001', 'description': 'Set up AWS CloudWatch for monitoring.', 'dependencies': ['DE-005'], 'estimated_time': '4 hours', 'agent_role': 'devops_engineer', 'acceptance_criteria': ['CloudWatch is configured to monitor application performance.', 'Metrics are collected for CPU usage, memory usage, and API response times.', 'Alerts are set up for critical events.'], 'status': 'pending', 'code_files': []}]}], resource_allocation=[{'role': 'Frontend Developer', 'count': 1, 'estimated_time_allocation': '100%', 'phases': ['Frontend Phase'], 'skills_required': []}, {'role': 'Devops Engineer', 'count': 1, 'estimated_time_allocation': '100%', 'phases': ['Devops_Engineer Phase'], 'skills_required': []}, {'role': 'Database Specialist', 'count': 1, 'estimated_time_allocation': '100%', 'phases': ['Database Phase'], 'skills_required': []}, {'role': 'Backend Developer', 'count': 1, 'estimated_time_allocation': '100%', 'phases': ['Backend Phase'], 'skills_required': []}], risks_and_mitigations=[], timeline={'start_date': '2025-07-09T09:32:51.129861', 'end_date': 'TBD', 'milestones': []}, tech_stack={}, metadata={'generated_at': '2025-07-09T09:32:51.129861', 'version': '1.0', 'author': 'Multi-AI Dev System', 'tags': [], 'notes': 'Converted from WorkItemBacklog. Original summary: Develop a simple web application for managing a list of tasks using React, Node.js, PostgreSQL, and AWS. The application will allow users to add and view tasks. The project will be deployed using Docker and a CI/CD pipeline for automated builds and deployments. Monitoring and logging will be implemented to ensure application health and performance.'}) summary='Develop a simple web application for managing a list of tasks using React, Node.js, PostgreSQL, and AWS. The application will allow users to add and view tasks. The project will be deployed using Docker and a CI/CD pipeline for automated builds and deployments. Monitoring and logging will be implemented to ensure application health and performance.' metadata=PlanMetadata(generated_at='2025-07-09T09:32:51.129861', version='1.0', author='Multi-AI Dev System', tags=[], notes='Converted from WorkItemBacklog. Original summary: Develop a simple web application for managing a list of tasks using React, Node.js, PostgreSQL, and AWS. The application will allow users to add and view tasks. The project will be deployed using Docker and a CI/CD pipeline for automated builds and deployments. Monitoring and logging will be implemented to ensure application health and performance.')"
  }
}