{
  "session_id": "session_1827e2ad-8938-4be8-8a52-9968a3ad1827",
  "approval_type": "implementation_plan",
  "timestamp": 1751994186,
  "approval_data": {
    "type": "implementation_plan",
    "timestamp": 1751994186.8837729,
    "project_overview": "Develop a simple web application for managing a list of tasks, including frontend and backend components, database integration, and basic security measures.",
    "development_phases": [
      {
        "name": "Frontend Phase",
        "description": "Tasks related to frontend phase",
        "deliverables": [
          "Completed FE-001",
          "Completed FE-002",
          "Completed FE-003",
          "Completed FE-004",
          "Completed FE-005",
          "Completed FE-006",
          "Completed FE-007",
          "Completed FE-008"
        ],
        "estimated_duration_hours": 44.0,
        "work_items": [
          {
            "id": "FE-001",
            "description": "Set up React project with TypeScript.",
            "dependencies": [],
            "estimated_time": "4 hours",
            "agent_role": "frontend_developer",
            "acceptance_criteria": [
              "React project is initialized using TypeScript.",
              "Project structure is clean and organized.",
              "Build process is configured correctly."
            ],
            "status": "pending",
            "code_files": [
              "package.json",
              "tsconfig.json",
              "src/App.tsx",
              "src/index.tsx"
            ]
          },
          {
            "id": "FE-002",
            "description": "Create basic UI for adding a task.",
            "dependencies": [
              "FE-001"
            ],
            "estimated_time": "4 hours",
            "agent_role": "frontend_developer",
            "acceptance_criteria": [
              "UI includes a text input field for task description.",
              "UI includes a button to submit the task.",
              "UI is visually appealing and user-friendly."
            ],
            "status": "pending",
            "code_files": [
              "src/App.tsx",
              "src/components/TaskForm.tsx"
            ]
          },
          {
            "id": "FE-003",
            "description": "Create basic UI for displaying the task list.",
            "dependencies": [
              "FE-001"
            ],
            "estimated_time": "4 hours",
            "agent_role": "frontend_developer",
            "acceptance_criteria": [
              "UI displays a list of tasks.",
              "Each task displays its description.",
              "UI handles empty task list gracefully."
            ],
            "status": "pending",
            "code_files": [
              "src/App.tsx",
              "src/components/TaskList.tsx"
            ]
          },
          {
            "id": "FE-004",
            "description": "Implement API calls to the backend for adding tasks.",
            "dependencies": [
              "FE-002",
              "BE-003"
            ],
            "estimated_time": "6 hours",
            "agent_role": "frontend_developer",
            "acceptance_criteria": [
              "Frontend makes a POST request to /api/v1/tasks when the form is submitted.",
              "Frontend sends the task description in the request body.",
              "Frontend handles the success response (201) and updates the task list.",
              "Frontend handles the error response (400) and displays an error message."
            ],
            "status": "pending",
            "code_files": [
              "src/App.tsx",
              "src/components/TaskForm.tsx",
              "src/api.ts"
            ]
          },
          {
            "id": "FE-005",
            "description": "Implement API calls to the backend for fetching tasks.",
            "dependencies": [
              "FE-003",
              "BE-004"
            ],
            "estimated_time": "6 hours",
            "agent_role": "frontend_developer",
            "acceptance_criteria": [
              "Frontend makes a GET request to /api/v1/tasks when the component mounts.",
              "Frontend displays the retrieved tasks in the task list.",
              "Frontend handles potential errors during the API call."
            ],
            "status": "pending",
            "code_files": [
              "src/App.tsx",
              "src/api.ts"
            ]
          },
          {
            "id": "FE-006",
            "description": "Implement basic input validation on the frontend.",
            "dependencies": [
              "FE-002"
            ],
            "estimated_time": "4 hours",
            "agent_role": "frontend_developer",
            "acceptance_criteria": [
              "Input field is validated to ensure it's not empty.",
              "Error messages are displayed to the user if input is invalid.",
              "Form submission is prevented if input is invalid."
            ],
            "status": "pending",
            "code_files": [
              "src/components/TaskForm.tsx"
            ]
          },
          {
            "id": "FE-007",
            "description": "Write unit tests for frontend components.",
            "dependencies": [
              "FE-001",
              "FE-002",
              "FE-003",
              "FE-004",
              "FE-005",
              "FE-006"
            ],
            "estimated_time": "8 hours",
            "agent_role": "frontend_developer",
            "acceptance_criteria": [
              "Unit tests cover the TaskForm component.",
              "Unit tests cover the TaskList component.",
              "Unit tests cover API call functions.",
              "Tests use a testing framework (e.g., Jest, React Testing Library).",
              "Tests achieve a reasonable level of code coverage."
            ],
            "status": "pending",
            "code_files": [
              "src/components/TaskForm.test.tsx",
              "src/components/TaskList.test.tsx",
              "src/api.test.ts"
            ]
          },
          {
            "id": "FE-008",
            "description": "Improve the UI/UX.",
            "dependencies": [
              "FE-002",
              "FE-003",
              "FE-004",
              "FE-005"
            ],
            "estimated_time": "8 hours",
            "agent_role": "frontend_developer",
            "acceptance_criteria": [
              "UI is visually appealing and user-friendly.",
              "UI provides clear feedback to the user (e.g., loading indicators, success messages).",
              "UI is responsive and works well on different screen sizes.",
              "Consider adding visual cues for task completion (future)."
            ],
            "status": "pending",
            "code_files": [
              "src/App.tsx",
              "src/components/TaskForm.tsx",
              "src/components/TaskList.tsx",
              "src/styles.css"
            ]
          }
        ]
      },
      {
        "name": "Backend Phase",
        "description": "Tasks related to backend phase",
        "deliverables": [
          "Completed BE-001",
          "Completed BE-003",
          "Completed BE-004",
          "Completed BE-005",
          "Completed BE-006",
          "Completed BE-007",
          "Completed SC-002"
        ],
        "estimated_duration_hours": 42.0,
        "work_items": [
          {
            "id": "BE-001",
            "description": "Set up FastAPI project.",
            "dependencies": [],
            "estimated_time": "4 hours",
            "agent_role": "backend_developer",
            "acceptance_criteria": [
              "FastAPI project is initialized.",
              "Project structure is clean and organized.",
              "Dependencies (e.g., FastAPI, Uvicorn) are installed.",
              "A basic 'Hello World' endpoint is working."
            ],
            "status": "pending",
            "code_files": [
              "main.py",
              "requirements.txt"
            ]
          },
          {
            "id": "BE-003",
            "description": "Implement the /tasks POST endpoint.",
            "dependencies": [
              "BE-001",
              "BE-002"
            ],
            "estimated_time": "8 hours",
            "agent_role": "backend_developer",
            "acceptance_criteria": [
              "Endpoint accepts a POST request to /tasks.",
              "Endpoint validates the 'description' parameter.",
              "Endpoint saves the task to the database.",
              "Endpoint returns a 201 Created status code on success with the task details (id, description, created_at).",
              "Endpoint returns a 400 Bad Request status code on invalid input."
            ],
            "status": "pending",
            "code_files": [
              "main.py",
              "schemas.py"
            ]
          },
          {
            "id": "BE-004",
            "description": "Implement the /tasks GET endpoint.",
            "dependencies": [
              "BE-001",
              "BE-002"
            ],
            "estimated_time": "6 hours",
            "agent_role": "backend_developer",
            "acceptance_criteria": [
              "Endpoint accepts a GET request to /tasks.",
              "Endpoint retrieves all tasks from the database.",
              "Endpoint returns a 200 OK status code with a JSON array of tasks.",
              "Tasks are returned in the correct format (id, description, created_at)."
            ],
            "status": "pending",
            "code_files": [
              "main.py"
            ]
          },
          {
            "id": "BE-005",
            "description": "Implement input validation on the backend.",
            "dependencies": [
              "BE-003"
            ],
            "estimated_time": "4 hours",
            "agent_role": "backend_developer",
            "acceptance_criteria": [
              "Backend validates the 'description' parameter to ensure it's not empty and meets any other defined criteria (e.g., length).",
              "Returns a 400 Bad Request with an informative error message if validation fails."
            ],
            "status": "pending",
            "code_files": [
              "schemas.py",
              "main.py"
            ]
          },
          {
            "id": "BE-006",
            "description": "Write unit tests for backend API endpoints.",
            "dependencies": [
              "BE-001",
              "BE-003",
              "BE-004",
              "BE-005"
            ],
            "estimated_time": "8 hours",
            "agent_role": "backend_developer",
            "acceptance_criteria": [
              "Unit tests cover the /tasks POST endpoint.",
              "Unit tests cover the /tasks GET endpoint.",
              "Tests use a testing framework (e.g., pytest).",
              "Tests mock database interactions.",
              "Tests achieve a reasonable level of code coverage."
            ],
            "status": "pending",
            "code_files": [
              "tests/test_main.py"
            ]
          },
          {
            "id": "BE-007",
            "description": "Write integration tests for API endpoints.",
            "dependencies": [
              "BE-001",
              "BE-003",
              "BE-004",
              "BE-005",
              "BE-006"
            ],
            "estimated_time": "8 hours",
            "agent_role": "backend_developer",
            "acceptance_criteria": [
              "Integration tests test the /tasks POST endpoint.",
              "Integration tests test the /tasks GET endpoint.",
              "Tests use a testing framework (e.g., pytest).",
              "Tests interact with the database.",
              "Tests verify the correct responses and data."
            ],
            "status": "pending",
            "code_files": [
              "tests/integration_tests.py"
            ]
          },
          {
            "id": "SC-002",
            "description": "Implement basic security measures (input validation, output encoding).",
            "dependencies": [
              "BE-005"
            ],
            "estimated_time": "4 hours",
            "agent_role": "backend_developer",
            "acceptance_criteria": [
              "Input validation is implemented on the backend.",
              "Output encoding is implemented to prevent XSS vulnerabilities.",
              "Parameterized queries are used to prevent SQL injection."
            ],
            "status": "pending",
            "code_files": [
              "main.py",
              "schemas.py"
            ]
          }
        ]
      },
      {
        "name": "Database Phase",
        "description": "Tasks related to database phase",
        "deliverables": [
          "Completed BE-002"
        ],
        "estimated_duration_hours": 4.0,
        "work_items": [
          {
            "id": "BE-002",
            "description": "Design and implement the database schema (tasks table).",
            "dependencies": [
              "BE-001"
            ],
            "estimated_time": "4 hours",
            "agent_role": "database_specialist",
            "acceptance_criteria": [
              "Database connection is established.",
              "Tasks table is created with id (UUID, PRIMARY KEY, DEFAULT gen_random_uuid()), description (VARCHAR(255), NOT NULL), and created_at (TIMESTAMP, NOT NULL, DEFAULT CURRENT_TIMESTAMP) columns.",
              "ORM (e.g., SQLAlchemy) is configured (if used)."
            ],
            "status": "pending",
            "code_files": [
              "models.py",
              "database.py"
            ]
          }
        ]
      },
      {
        "name": "Devops_Engineer Phase",
        "description": "Tasks related to devops_engineer phase",
        "deliverables": [
          "Completed DE-001",
          "Completed DE-002",
          "Completed SC-001"
        ],
        "estimated_duration_hours": 16.0,
        "work_items": [
          {
            "id": "DE-001",
            "description": "Deploy the frontend to a static site hosting service (e.g., Netlify, Vercel).",
            "dependencies": [
              "FE-007",
              "FE-008"
            ],
            "estimated_time": "4 hours",
            "agent_role": "devops_engineer",
            "acceptance_criteria": [
              "Frontend is deployed to a static site hosting service.",
              "Frontend is accessible via a public URL.",
              "Deployment process is automated (e.g., using a CI/CD pipeline)."
            ],
            "status": "pending",
            "code_files": []
          },
          {
            "id": "DE-002",
            "description": "Deploy the backend to a cloud platform (e.g., AWS, Google Cloud, Azure).",
            "dependencies": [
              "BE-006",
              "BE-007"
            ],
            "estimated_time": "8 hours",
            "agent_role": "devops_engineer",
            "acceptance_criteria": [
              "Backend API is deployed to a cloud platform.",
              "Backend API is accessible via a public URL.",
              "Database is deployed and accessible by the backend.",
              "Deployment process is automated (e.g., using a CI/CD pipeline)."
            ],
            "status": "pending",
            "code_files": []
          },
          {
            "id": "SC-001",
            "description": "Configure HTTPS for the frontend and backend.",
            "dependencies": [
              "DE-001",
              "DE-002"
            ],
            "estimated_time": "4 hours",
            "agent_role": "devops_engineer",
            "acceptance_criteria": [
              "HTTPS is enabled for the frontend.",
              "HTTPS is enabled for the backend API.",
              "SSL certificates are properly configured."
            ],
            "status": "pending",
            "code_files": []
          }
        ]
      }
    ],
    "timeline_estimation": {
      "start_date": "2025-07-08T22:33:05.871776",
      "end_date": "TBD",
      "milestones": []
    },
    "risk_assessment": [],
    "resource_requirements": [
      {
        "role": "Frontend Developer",
        "count": 1,
        "estimated_time_allocation": "100%",
        "phases": [
          "Frontend Phase"
        ],
        "skills_required": []
      },
      {
        "role": "Database Specialist",
        "count": 1,
        "estimated_time_allocation": "100%",
        "phases": [
          "Database Phase"
        ],
        "skills_required": []
      },
      {
        "role": "Backend Developer",
        "count": 1,
        "estimated_time_allocation": "100%",
        "phases": [
          "Backend Phase"
        ],
        "skills_required": []
      },
      {
        "role": "Devops Engineer",
        "count": 1,
        "estimated_time_allocation": "100%",
        "phases": [
          "Devops_Engineer Phase"
        ],
        "skills_required": []
      }
    ],
    "deliverables": [
      "Completed FE-001",
      "Completed FE-002",
      "Completed FE-003",
      "Completed FE-004",
      "Completed FE-005",
      "Completed FE-006",
      "Completed FE-007",
      "Completed FE-008",
      "Completed BE-001",
      "Completed BE-003",
      "Completed BE-004",
      "Completed BE-005",
      "Completed BE-006",
      "Completed BE-007",
      "Completed SC-002",
      "Completed BE-002",
      "Completed DE-001",
      "Completed DE-002",
      "Completed SC-001"
    ],
    "dependencies": [],
    "raw_plan": "plan=ImplementationPlan(project_summary={'title': 'Generated Project Plan', 'description': 'Develop a simple web application for managing a list of tasks, including frontend and backend components, database integration, and basic security measures.', 'overall_complexity': 'Medium', 'estimated_duration': 'TBD', 'key_challenges': [], 'success_criteria': []}, phases=[{'name': 'Frontend Phase', 'description': 'Tasks related to frontend phase', 'deliverables': ['Completed FE-001', 'Completed FE-002', 'Completed FE-003', 'Completed FE-004', 'Completed FE-005', 'Completed FE-006', 'Completed FE-007', 'Completed FE-008'], 'estimated_duration_hours': 44.0, 'work_items': [{'id': 'FE-001', 'description': 'Set up React project with TypeScript.', 'dependencies': [], 'estimated_time': '4 hours', 'agent_role': 'frontend_developer', 'acceptance_criteria': ['React project is initialized using TypeScript.', 'Project structure is clean and organized.', 'Build process is configured correctly.'], 'status': 'pending', 'code_files': ['package.json', 'tsconfig.json', 'src/App.tsx', 'src/index.tsx']}, {'id': 'FE-002', 'description': 'Create basic UI for adding a task.', 'dependencies': ['FE-001'], 'estimated_time': '4 hours', 'agent_role': 'frontend_developer', 'acceptance_criteria': ['UI includes a text input field for task description.', 'UI includes a button to submit the task.', 'UI is visually appealing and user-friendly.'], 'status': 'pending', 'code_files': ['src/App.tsx', 'src/components/TaskForm.tsx']}, {'id': 'FE-003', 'description': 'Create basic UI for displaying the task list.', 'dependencies': ['FE-001'], 'estimated_time': '4 hours', 'agent_role': 'frontend_developer', 'acceptance_criteria': ['UI displays a list of tasks.', 'Each task displays its description.', 'UI handles empty task list gracefully.'], 'status': 'pending', 'code_files': ['src/App.tsx', 'src/components/TaskList.tsx']}, {'id': 'FE-004', 'description': 'Implement API calls to the backend for adding tasks.', 'dependencies': ['FE-002', 'BE-003'], 'estimated_time': '6 hours', 'agent_role': 'frontend_developer', 'acceptance_criteria': ['Frontend makes a POST request to /api/v1/tasks when the form is submitted.', 'Frontend sends the task description in the request body.', 'Frontend handles the success response (201) and updates the task list.', 'Frontend handles the error response (400) and displays an error message.'], 'status': 'pending', 'code_files': ['src/App.tsx', 'src/components/TaskForm.tsx', 'src/api.ts']}, {'id': 'FE-005', 'description': 'Implement API calls to the backend for fetching tasks.', 'dependencies': ['FE-003', 'BE-004'], 'estimated_time': '6 hours', 'agent_role': 'frontend_developer', 'acceptance_criteria': ['Frontend makes a GET request to /api/v1/tasks when the component mounts.', 'Frontend displays the retrieved tasks in the task list.', 'Frontend handles potential errors during the API call.'], 'status': 'pending', 'code_files': ['src/App.tsx', 'src/api.ts']}, {'id': 'FE-006', 'description': 'Implement basic input validation on the frontend.', 'dependencies': ['FE-002'], 'estimated_time': '4 hours', 'agent_role': 'frontend_developer', 'acceptance_criteria': [\"Input field is validated to ensure it's not empty.\", 'Error messages are displayed to the user if input is invalid.', 'Form submission is prevented if input is invalid.'], 'status': 'pending', 'code_files': ['src/components/TaskForm.tsx']}, {'id': 'FE-007', 'description': 'Write unit tests for frontend components.', 'dependencies': ['FE-001', 'FE-002', 'FE-003', 'FE-004', 'FE-005', 'FE-006'], 'estimated_time': '8 hours', 'agent_role': 'frontend_developer', 'acceptance_criteria': ['Unit tests cover the TaskForm component.', 'Unit tests cover the TaskList component.', 'Unit tests cover API call functions.', 'Tests use a testing framework (e.g., Jest, React Testing Library).', 'Tests achieve a reasonable level of code coverage.'], 'status': 'pending', 'code_files': ['src/components/TaskForm.test.tsx', 'src/components/TaskList.test.tsx', 'src/api.test.ts']}, {'id': 'FE-008', 'description': 'Improve the UI/UX.', 'dependencies': ['FE-002', 'FE-003', 'FE-004', 'FE-005'], 'estimated_time': '8 hours', 'agent_role': 'frontend_developer', 'acceptance_criteria': ['UI is visually appealing and user-friendly.', 'UI provides clear feedback to the user (e.g., loading indicators, success messages).', 'UI is responsive and works well on different screen sizes.', 'Consider adding visual cues for task completion (future).'], 'status': 'pending', 'code_files': ['src/App.tsx', 'src/components/TaskForm.tsx', 'src/components/TaskList.tsx', 'src/styles.css']}]}, {'name': 'Backend Phase', 'description': 'Tasks related to backend phase', 'deliverables': ['Completed BE-001', 'Completed BE-003', 'Completed BE-004', 'Completed BE-005', 'Completed BE-006', 'Completed BE-007', 'Completed SC-002'], 'estimated_duration_hours': 42.0, 'work_items': [{'id': 'BE-001', 'description': 'Set up FastAPI project.', 'dependencies': [], 'estimated_time': '4 hours', 'agent_role': 'backend_developer', 'acceptance_criteria': ['FastAPI project is initialized.', 'Project structure is clean and organized.', 'Dependencies (e.g., FastAPI, Uvicorn) are installed.', \"A basic 'Hello World' endpoint is working.\"], 'status': 'pending', 'code_files': ['main.py', 'requirements.txt']}, {'id': 'BE-003', 'description': 'Implement the /tasks POST endpoint.', 'dependencies': ['BE-001', 'BE-002'], 'estimated_time': '8 hours', 'agent_role': 'backend_developer', 'acceptance_criteria': ['Endpoint accepts a POST request to /tasks.', \"Endpoint validates the 'description' parameter.\", 'Endpoint saves the task to the database.', 'Endpoint returns a 201 Created status code on success with the task details (id, description, created_at).', 'Endpoint returns a 400 Bad Request status code on invalid input.'], 'status': 'pending', 'code_files': ['main.py', 'schemas.py']}, {'id': 'BE-004', 'description': 'Implement the /tasks GET endpoint.', 'dependencies': ['BE-001', 'BE-002'], 'estimated_time': '6 hours', 'agent_role': 'backend_developer', 'acceptance_criteria': ['Endpoint accepts a GET request to /tasks.', 'Endpoint retrieves all tasks from the database.', 'Endpoint returns a 200 OK status code with a JSON array of tasks.', 'Tasks are returned in the correct format (id, description, created_at).'], 'status': 'pending', 'code_files': ['main.py']}, {'id': 'BE-005', 'description': 'Implement input validation on the backend.', 'dependencies': ['BE-003'], 'estimated_time': '4 hours', 'agent_role': 'backend_developer', 'acceptance_criteria': [\"Backend validates the 'description' parameter to ensure it's not empty and meets any other defined criteria (e.g., length).\", 'Returns a 400 Bad Request with an informative error message if validation fails.'], 'status': 'pending', 'code_files': ['schemas.py', 'main.py']}, {'id': 'BE-006', 'description': 'Write unit tests for backend API endpoints.', 'dependencies': ['BE-001', 'BE-003', 'BE-004', 'BE-005'], 'estimated_time': '8 hours', 'agent_role': 'backend_developer', 'acceptance_criteria': ['Unit tests cover the /tasks POST endpoint.', 'Unit tests cover the /tasks GET endpoint.', 'Tests use a testing framework (e.g., pytest).', 'Tests mock database interactions.', 'Tests achieve a reasonable level of code coverage.'], 'status': 'pending', 'code_files': ['tests/test_main.py']}, {'id': 'BE-007', 'description': 'Write integration tests for API endpoints.', 'dependencies': ['BE-001', 'BE-003', 'BE-004', 'BE-005', 'BE-006'], 'estimated_time': '8 hours', 'agent_role': 'backend_developer', 'acceptance_criteria': ['Integration tests test the /tasks POST endpoint.', 'Integration tests test the /tasks GET endpoint.', 'Tests use a testing framework (e.g., pytest).', 'Tests interact with the database.', 'Tests verify the correct responses and data.'], 'status': 'pending', 'code_files': ['tests/integration_tests.py']}, {'id': 'SC-002', 'description': 'Implement basic security measures (input validation, output encoding).', 'dependencies': ['BE-005'], 'estimated_time': '4 hours', 'agent_role': 'backend_developer', 'acceptance_criteria': ['Input validation is implemented on the backend.', 'Output encoding is implemented to prevent XSS vulnerabilities.', 'Parameterized queries are used to prevent SQL injection.'], 'status': 'pending', 'code_files': ['main.py', 'schemas.py']}]}, {'name': 'Database Phase', 'description': 'Tasks related to database phase', 'deliverables': ['Completed BE-002'], 'estimated_duration_hours': 4.0, 'work_items': [{'id': 'BE-002', 'description': 'Design and implement the database schema (tasks table).', 'dependencies': ['BE-001'], 'estimated_time': '4 hours', 'agent_role': 'database_specialist', 'acceptance_criteria': ['Database connection is established.', 'Tasks table is created with id (UUID, PRIMARY KEY, DEFAULT gen_random_uuid()), description (VARCHAR(255), NOT NULL), and created_at (TIMESTAMP, NOT NULL, DEFAULT CURRENT_TIMESTAMP) columns.', 'ORM (e.g., SQLAlchemy) is configured (if used).'], 'status': 'pending', 'code_files': ['models.py', 'database.py']}]}, {'name': 'Devops_Engineer Phase', 'description': 'Tasks related to devops_engineer phase', 'deliverables': ['Completed DE-001', 'Completed DE-002', 'Completed SC-001'], 'estimated_duration_hours': 16.0, 'work_items': [{'id': 'DE-001', 'description': 'Deploy the frontend to a static site hosting service (e.g., Netlify, Vercel).', 'dependencies': ['FE-007', 'FE-008'], 'estimated_time': '4 hours', 'agent_role': 'devops_engineer', 'acceptance_criteria': ['Frontend is deployed to a static site hosting service.', 'Frontend is accessible via a public URL.', 'Deployment process is automated (e.g., using a CI/CD pipeline).'], 'status': 'pending', 'code_files': []}, {'id': 'DE-002', 'description': 'Deploy the backend to a cloud platform (e.g., AWS, Google Cloud, Azure).', 'dependencies': ['BE-006', 'BE-007'], 'estimated_time': '8 hours', 'agent_role': 'devops_engineer', 'acceptance_criteria': ['Backend API is deployed to a cloud platform.', 'Backend API is accessible via a public URL.', 'Database is deployed and accessible by the backend.', 'Deployment process is automated (e.g., using a CI/CD pipeline).'], 'status': 'pending', 'code_files': []}, {'id': 'SC-001', 'description': 'Configure HTTPS for the frontend and backend.', 'dependencies': ['DE-001', 'DE-002'], 'estimated_time': '4 hours', 'agent_role': 'devops_engineer', 'acceptance_criteria': ['HTTPS is enabled for the frontend.', 'HTTPS is enabled for the backend API.', 'SSL certificates are properly configured.'], 'status': 'pending', 'code_files': []}]}], resource_allocation=[{'role': 'Frontend Developer', 'count': 1, 'estimated_time_allocation': '100%', 'phases': ['Frontend Phase'], 'skills_required': []}, {'role': 'Database Specialist', 'count': 1, 'estimated_time_allocation': '100%', 'phases': ['Database Phase'], 'skills_required': []}, {'role': 'Backend Developer', 'count': 1, 'estimated_time_allocation': '100%', 'phases': ['Backend Phase'], 'skills_required': []}, {'role': 'Devops Engineer', 'count': 1, 'estimated_time_allocation': '100%', 'phases': ['Devops_Engineer Phase'], 'skills_required': []}], risks_and_mitigations=[], timeline={'start_date': '2025-07-08T22:33:05.871776', 'end_date': 'TBD', 'milestones': []}, tech_stack={}, metadata={'generated_at': '2025-07-08T22:33:05.871776', 'version': '1.0', 'author': 'Multi-AI Dev System', 'tags': [], 'notes': 'Converted from WorkItemBacklog. Original summary: Develop a simple web application for managing a list of tasks, including frontend and backend components, database integration, and basic security measures.'}) summary='Develop a simple web application for managing a list of tasks, including frontend and backend components, database integration, and basic security measures.' metadata=PlanMetadata(generated_at='2025-07-08T22:33:05.871776', version='1.0', author='Multi-AI Dev System', tags=[], notes='Converted from WorkItemBacklog. Original summary: Develop a simple web application for managing a list of tasks, including frontend and backend components, database integration, and basic security measures.')"
  },
  "workflow_state_snapshot": {
    "requirements_analysis": {
      "project_name": "Hello World Task List",
      "project_summary": "A simple web application to manage a list of tasks.",
      "project_goals": [
        "Allow a user to add a task",
        "Allow a user to see their list of tasks"
      ],
      "target_audience": [
        "Users who want to manage a list of tasks"
      ],
      "business_context": "This project aims to provide a basic task management tool.",
      "requirements": [
        {
          "id": "REQ-001",
          "description": "A user can create a new task with a text description.",
          "category": "functional",
          "priority": 1
        },
        {
          "id": "REQ-002",
          "description": "A user can see a list of all created tasks.",
          "category": "functional",
          "priority": 1
        },
        {
          "id": "REQ-003",
          "description": "The application must load quickly.",
          "category": "non_functional",
          "priority": 2
        },
        {
          "id": "REQ-004",
          "description": "The application must be secure.",
          "category": "non_functional",
          "priority": 2
        }
      ],
      "functional_requirements": [
        "A user can create a new task with a text description.",
        "A user can see a list of all created tasks."
      ],
      "non_functional_requirements": [
        "The application must load quickly.",
        "The application must be secure."
      ],
      "stakeholders": [
        "Users"
      ],
      "success_criteria": [
        "Users can successfully add tasks.",
        "Users can view their task list.",
        "The application loads quickly.",
        "The application is secure."
      ],
      "constraints": [],
      "assumptions": [],
      "risks": [],
      "domain_specific_details": {},
      "quality_assessment": {
        "clarity_score": 9.0,
        "completeness_score": 8.0,
        "consistency_score": 10.0,
        "recommendations": []
      },
      "gap_analysis": {
        "identified_gaps": [],
        "recommendations_for_completion": []
      }
    },
    "tech_stack_recommendation": {
      "frontend_options": [
        {
          "name": "React",
          "language": "TypeScript",
          "reasoning": "Default frontend framework.",
          "key_libraries": [],
          "pros": [],
          "cons": [],
          "selected": false
        }
      ],
      "backend_options": [
        {
          "name": "FastAPI",
          "language": "Python",
          "reasoning": "Default backend framework.",
          "key_libraries": [],
          "pros": [],
          "cons": [],
          "selected": false
        }
      ],
      "database_options": [
        {
          "name": "PostgreSQL",
          "language": null,
          "reasoning": "Default relational database.",
          "key_libraries": [],
          "pros": [],
          "cons": [],
          "selected": false
        }
      ],
      "cloud_options": [],
      "architecture_options": [
        {
          "pattern": "Microservices",
          "scalability_score": 7.0,
          "maintainability_score": 6.0,
          "development_speed_score": 5.0,
          "overall_score": 6.0,
          "reasoning": "Default architecture pattern with moderate complexity and good scalability."
        }
      ],
      "tool_options": [],
      "risks": [],
      "synthesis": {
        "backend": {},
        "frontend": {},
        "database": {},
        "architecture_pattern": "Microservices",
        "deployment_environment": {},
        "key_libraries_tools": [],
        "estimated_complexity": "Medium"
      },
      "selected_stack": null
    },
    "system_design": {
      "architecture": {
        "pattern": "Microservices",
        "justification": "Microservices architecture is chosen for its scalability and maintainability, even for a simple application. This allows for independent scaling of frontend and backend components and easier future feature additions.",
        "key_benefits": [
          "Scalability: Independent scaling of frontend and backend.",
          "Maintainability: Easier to maintain and update individual services.",
          "Flexibility: Allows for different technologies to be used in different services (though not applicable here).",
          "Testability: Easier to test individual services in isolation."
        ],
        "potential_drawbacks": [
          "Increased complexity: Introduces more moving parts.",
          "Communication overhead: Requires inter-service communication (e.g., API calls).",
          "Deployment complexity: Requires managing multiple services."
        ]
      },
      "components": [
        {
          "name": "Frontend",
          "description": "The user interface for interacting with the task list.",
          "category": "frontend",
          "technologies": [
            "React",
            "TypeScript",
            "HTML",
            "CSS"
          ],
          "dependencies": [
            "Backend API"
          ],
          "responsibilities": [
            "Displaying the task list.",
            "Allowing users to add new tasks.",
            "Handling user input.",
            "Making API calls to the backend."
          ],
          "design_patterns": [
            "Component-based architecture",
            "State management (e.g., React Context, Redux - potentially overkill for this simple app)"
          ]
        },
        {
          "name": "Backend API",
          "description": "The API that handles requests from the frontend and interacts with the database.",
          "category": "backend",
          "technologies": [
            "FastAPI",
            "Python",
            "PostgreSQL (ORM like SQLAlchemy)"
          ],
          "dependencies": [
            "PostgreSQL Database"
          ],
          "responsibilities": [
            "Exposing API endpoints for task creation and retrieval.",
            "Validating user input.",
            "Interacting with the database.",
            "Handling authentication and authorization (if implemented)."
          ],
          "design_patterns": [
            "RESTful API design",
            "Dependency Injection"
          ]
        },
        {
          "name": "PostgreSQL Database",
          "description": "The database to store the task data.",
          "category": "database",
          "technologies": [
            "PostgreSQL",
            "SQL"
          ],
          "dependencies": [],
          "responsibilities": [
            "Storing task data.",
            "Providing data access to the backend API."
          ],
          "design_patterns": [
            "Relational Database Design"
          ]
        }
      ],
      "data_model": {
        "schema_type": "Relational",
        "tables": [
          {
            "name": "tasks",
            "purpose": "Stores task information.",
            "fields": [
              {
                "name": "id",
                "type": "UUID",
                "constraints": [
                  "PRIMARY KEY",
                  "DEFAULT gen_random_uuid()"
                ],
                "description": "Unique identifier for the task."
              },
              {
                "name": "description",
                "type": "VARCHAR(255)",
                "constraints": [
                  "NOT NULL"
                ],
                "description": "Text description of the task."
              },
              {
                "name": "created_at",
                "type": "TIMESTAMP",
                "constraints": [
                  "NOT NULL",
                  "DEFAULT CURRENT_TIMESTAMP"
                ],
                "description": "Timestamp of when the task was created."
              }
            ],
            "relationships": []
          }
        ],
        "relationships": [],
        "justification": "Relational database is suitable for structured data and provides data integrity through constraints."
      },
      "api_endpoints": {
        "style": "REST",
        "base_url": "/api/v1",
        "authentication": "None (for simplicity, but JWT or API Key would be recommended for production)",
        "endpoints": [
          {
            "method": "POST",
            "path": "/tasks",
            "purpose": "Create a new task.",
            "parameters": [
              {
                "description": "The task description.",
                "type": "string",
                "name": "description"
              }
            ],
            "response": {
              "201": {
                "description": "Task created successfully.",
                "example": {
                  "id": "a1b2c3d4-e5f6-7890-1234-567890abcdef",
                  "description": "Grocery shopping",
                  "created_at": "2024-10-27T10:00:00Z"
                }
              },
              "400": {
                "description": "Bad Request - Invalid input."
              }
            },
            "authentication_required": false,
            "rate_limiting_applied": false
          },
          {
            "method": "GET",
            "path": "/tasks",
            "purpose": "Get a list of all tasks.",
            "parameters": [],
            "response": {
              "200": {
                "description": "List of tasks.",
                "example": [
                  {
                    "id": "a1b2c3d4-e5f6-7890-1234-567890abcdef",
                    "description": "Grocery shopping",
                    "created_at": "2024-10-27T10:00:00Z"
                  },
                  {
                    "id": "f1e2d3c4-b5a6-9087-4321-fedcba987654",
                    "description": "Book doctor appointment",
                    "created_at": "2024-10-27T10:05:00Z"
                  }
                ]
              }
            },
            "authentication_required": false,
            "rate_limiting_applied": false
          }
        ],
        "error_handling": "Standard HTTP status codes and JSON responses for errors.",
        "rate_limiting_strategy": null
      },
      "security": {
        "authentication_method": "None (for simplicity)",
        "authorization_strategy": "None (for simplicity)",
        "data_encryption": {
          "at_rest": "Not applicable (for simplicity).  Consider encrypting sensitive data if any.",
          "in_transit": "HTTPS (TLS/SSL) is recommended for all communication between the frontend and backend."
        },
        "security_measures": [
          {
            "category": "Input Validation",
            "implementation": "Validate all user input on the backend to prevent injection attacks.",
            "mitigation": "SQL Injection, Cross-Site Scripting (XSS)",
            "priority": "High"
          },
          {
            "category": "HTTPS",
            "implementation": "Enforce HTTPS for all communication.",
            "mitigation": "Man-in-the-middle attacks, data interception",
            "priority": "High"
          },
          {
            "category": "Authentication (Future)",
            "implementation": "Implement authentication (e.g., JWT) for production.",
            "mitigation": "Unauthorized access",
            "priority": "Medium"
          },
          {
            "category": "Authorization (Future)",
            "implementation": "Implement authorization to restrict access to resources based on user roles.",
            "mitigation": "Unauthorized access",
            "priority": "Medium"
          }
        ],
        "vulnerability_mitigation_strategies": [
          "Input validation",
          "Output encoding",
          "Using parameterized queries (for SQL)",
          "Regular security audits"
        ],
        "compliance_standards": []
      },
      "scalability_and_performance": {
        "caching": "Implement caching (e.g., Redis) for frequently accessed data to reduce database load.",
        "database_optimization": "Optimize database queries and indexes for performance.",
        "load_balancing": "Use load balancing to distribute traffic across multiple instances of the backend API (if needed).",
        "code_optimization": "Optimize frontend and backend code for performance."
      },
      "deployment_strategy": {
        "environment": "Cloud-based (e.g., AWS, Google Cloud, Azure).",
        "frontend_deployment": "Deploy the frontend as static files using a service like Netlify or Vercel.",
        "backend_deployment": "Deploy the backend API using a containerization technology like Docker and a container orchestration platform like Kubernetes or a serverless platform like AWS Lambda or Google Cloud Functions.",
        "database_deployment": "Deploy the PostgreSQL database using a managed database service (e.g., AWS RDS, Google Cloud SQL, Azure Database for PostgreSQL)."
      },
      "monitoring_and_logging": {
        "logging": "Implement logging for both frontend and backend components (e.g., using Winston or similar for the frontend and the built-in logging in FastAPI).",
        "monitoring": "Use monitoring tools (e.g., Prometheus, Grafana, CloudWatch) to monitor application performance, errors, and resource usage.",
        "error_tracking": "Integrate an error tracking service (e.g., Sentry, Bugsnag) to capture and track errors."
      },
      "error_handling_strategy": "Centralized error handling with appropriate HTTP status codes and informative error messages in JSON format.  Implement logging for all errors.",
      "development_phases_overview": [
        {
          "name": "Phase 1: Setup & Basic Functionality",
          "description": "Setting up the development environment, creating the basic frontend and backend structure, and implementing the core functionality (adding and listing tasks).",
          "priority": "High",
          "dependencies": [],
          "tasks": [
            "Set up React project with TypeScript.",
            "Set up FastAPI project.",
            "Design and implement the database schema.",
            "Implement the /tasks POST endpoint.",
            "Implement the /tasks GET endpoint.",
            "Create basic UI for adding and listing tasks."
          ],
          "estimated_duration": "1 week"
        },
        {
          "name": "Phase 2: Enhancements & Testing",
          "description": "Adding enhancements like input validation, improving the UI, and writing unit and integration tests.",
          "priority": "High",
          "dependencies": [
            "Phase 1: Setup & Basic Functionality"
          ],
          "tasks": [
            "Implement input validation on the backend.",
            "Improve the UI/UX.",
            "Write unit tests for backend and frontend components.",
            "Write integration tests for API endpoints."
          ],
          "estimated_duration": "1 week"
        },
        {
          "name": "Phase 3: Deployment & Security",
          "description": "Deploying the application and implementing basic security measures.",
          "priority": "Medium",
          "dependencies": [
            "Phase 2: Enhancements & Testing"
          ],
          "tasks": [
            "Deploy the frontend and backend to a cloud platform.",
            "Configure HTTPS.",
            "Implement basic security measures (e.g., input validation, output encoding)."
          ],
          "estimated_duration": "1 week"
        },
        {
          "name": "Phase 4: Future Enhancements",
          "description": "Adding features like user authentication, task editing, and more advanced features.",
          "priority": "Low",
          "dependencies": [
            "Phase 3: Deployment & Security"
          ],
          "tasks": [
            "Implement user authentication (e.g., JWT).",
            "Implement task editing and deletion.",
            "Add more advanced features as needed."
          ],
          "estimated_duration": "Ongoing"
        }
      ],
      "key_risks": [
        "Security vulnerabilities (e.g., XSS, SQL injection).",
        "Performance bottlenecks (e.g., slow database queries).",
        "Scalability issues (if the application grows significantly).",
        "Deployment issues."
      ],
      "design_justification": "The design prioritizes simplicity, maintainability, and scalability. The microservices architecture allows for independent scaling of the frontend and backend. The use of React and FastAPI provides a modern and efficient development experience. The relational database ensures data integrity. The security measures are implemented to protect the application from common vulnerabilities. The development phases are structured to deliver value incrementally and mitigate risks.",
      "data_flow": "1. User interacts with the Frontend (React). 2. User submits a task description. 3. Frontend sends a POST request to the Backend API (/tasks). 4. Backend API receives the request, validates the input, and saves the task to the PostgreSQL database. 5. Backend API returns a success response (201) with the task details. 6. Frontend displays the task in the task list. 7. When the user views the task list, the Frontend sends a GET request to the Backend API (/tasks). 8. Backend API retrieves tasks from the PostgreSQL database. 9. Backend API returns the list of tasks to the Frontend. 10. Frontend displays the list of tasks."
    },
    "implementation_plan": "plan=ImplementationPlan(project_summary={'title': 'Generated Project Plan', 'description': 'Develop a simple web application for managing a list of tasks, including frontend and backend components, database integration, and basic security measures.', 'overall_complexity': 'Medium', 'estimated_duration': 'TBD', 'key_challenges': [], 'success_criteria': []}, phases=[{'name': 'Frontend Phase', 'description': 'Tasks related to frontend phase', 'deliverables': ['Completed FE-001', 'Completed FE-002', 'Completed FE-003', 'Completed FE-004', 'Completed FE-005', 'Completed FE-006', 'Completed FE-007', 'Completed FE-008'], 'estimated_duration_hours': 44.0, 'work_items': [{'id': 'FE-001', 'description': 'Set up React project with TypeScript.', 'dependencies': [], 'estimated_time': '4 hours', 'agent_role': 'frontend_developer', 'acceptance_criteria': ['React project is initialized using TypeScript.', 'Project structure is clean and organized.', 'Build process is configured correctly.'], 'status': 'pending', 'code_files': ['package.json', 'tsconfig.json', 'src/App.tsx', 'src/index.tsx']}, {'id': 'FE-002', 'description': 'Create basic UI for adding a task.', 'dependencies': ['FE-001'], 'estimated_time': '4 hours', 'agent_role': 'frontend_developer', 'acceptance_criteria': ['UI includes a text input field for task description.', 'UI includes a button to submit the task.', 'UI is visually appealing and user-friendly.'], 'status': 'pending', 'code_files': ['src/App.tsx', 'src/components/TaskForm.tsx']}, {'id': 'FE-003', 'description': 'Create basic UI for displaying the task list.', 'dependencies': ['FE-001'], 'estimated_time': '4 hours', 'agent_role': 'frontend_developer', 'acceptance_criteria': ['UI displays a list of tasks.', 'Each task displays its description.', 'UI handles empty task list gracefully.'], 'status': 'pending', 'code_files': ['src/App.tsx', 'src/components/TaskList.tsx']}, {'id': 'FE-004', 'description': 'Implement API calls to the backend for adding tasks.', 'dependencies': ['FE-002', 'BE-003'], 'estimated_time': '6 hours', 'agent_role': 'frontend_developer', 'acceptance_criteria': ['Frontend makes a POST request to /api/v1/tasks when the form is submitted.', 'Frontend sends the task description in the request body.', 'Frontend handles the success response (201) and updates the task list.', 'Frontend handles the error response (400) and displays an error message.'], 'status': 'pending', 'code_files': ['src/App.tsx', 'src/components/TaskForm.tsx', 'src/api.ts']}, {'id': 'FE-005', 'description': 'Implement API calls to the backend for fetching tasks.', 'dependencies': ['FE-003', 'BE-004'], 'estimated_time': '6 hours', 'agent_role': 'frontend_developer', 'acceptance_criteria': ['Frontend makes a GET request to /api/v1/tasks when the component mounts.', 'Frontend displays the retrieved tasks in the task list.', 'Frontend handles potential errors during the API call.'], 'status': 'pending', 'code_files': ['src/App.tsx', 'src/api.ts']}, {'id': 'FE-006', 'description': 'Implement basic input validation on the frontend.', 'dependencies': ['FE-002'], 'estimated_time': '4 hours', 'agent_role': 'frontend_developer', 'acceptance_criteria': [\"Input field is validated to ensure it's not empty.\", 'Error messages are displayed to the user if input is invalid.', 'Form submission is prevented if input is invalid.'], 'status': 'pending', 'code_files': ['src/components/TaskForm.tsx']}, {'id': 'FE-007', 'description': 'Write unit tests for frontend components.', 'dependencies': ['FE-001', 'FE-002', 'FE-003', 'FE-004', 'FE-005', 'FE-006'], 'estimated_time': '8 hours', 'agent_role': 'frontend_developer', 'acceptance_criteria': ['Unit tests cover the TaskForm component.', 'Unit tests cover the TaskList component.', 'Unit tests cover API call functions.', 'Tests use a testing framework (e.g., Jest, React Testing Library).', 'Tests achieve a reasonable level of code coverage.'], 'status': 'pending', 'code_files': ['src/components/TaskForm.test.tsx', 'src/components/TaskList.test.tsx', 'src/api.test.ts']}, {'id': 'FE-008', 'description': 'Improve the UI/UX.', 'dependencies': ['FE-002', 'FE-003', 'FE-004', 'FE-005'], 'estimated_time': '8 hours', 'agent_role': 'frontend_developer', 'acceptance_criteria': ['UI is visually appealing and user-friendly.', 'UI provides clear feedback to the user (e.g., loading indicators, success messages).', 'UI is responsive and works well on different screen sizes.', 'Consider adding visual cues for task completion (future).'], 'status': 'pending', 'code_files': ['src/App.tsx', 'src/components/TaskForm.tsx', 'src/components/TaskList.tsx', 'src/styles.css']}]}, {'name': 'Backend Phase', 'description': 'Tasks related to backend phase', 'deliverables': ['Completed BE-001', 'Completed BE-003', 'Completed BE-004', 'Completed BE-005', 'Completed BE-006', 'Completed BE-007', 'Completed SC-002'], 'estimated_duration_hours': 42.0, 'work_items': [{'id': 'BE-001', 'description': 'Set up FastAPI project.', 'dependencies': [], 'estimated_time': '4 hours', 'agent_role': 'backend_developer', 'acceptance_criteria': ['FastAPI project is initialized.', 'Project structure is clean and organized.', 'Dependencies (e.g., FastAPI, Uvicorn) are installed.', \"A basic 'Hello World' endpoint is working.\"], 'status': 'pending', 'code_files': ['main.py', 'requirements.txt']}, {'id': 'BE-003', 'description': 'Implement the /tasks POST endpoint.', 'dependencies': ['BE-001', 'BE-002'], 'estimated_time': '8 hours', 'agent_role': 'backend_developer', 'acceptance_criteria': ['Endpoint accepts a POST request to /tasks.', \"Endpoint validates the 'description' parameter.\", 'Endpoint saves the task to the database.', 'Endpoint returns a 201 Created status code on success with the task details (id, description, created_at).', 'Endpoint returns a 400 Bad Request status code on invalid input.'], 'status': 'pending', 'code_files': ['main.py', 'schemas.py']}, {'id': 'BE-004', 'description': 'Implement the /tasks GET endpoint.', 'dependencies': ['BE-001', 'BE-002'], 'estimated_time': '6 hours', 'agent_role': 'backend_developer', 'acceptance_criteria': ['Endpoint accepts a GET request to /tasks.', 'Endpoint retrieves all tasks from the database.', 'Endpoint returns a 200 OK status code with a JSON array of tasks.', 'Tasks are returned in the correct format (id, description, created_at).'], 'status': 'pending', 'code_files': ['main.py']}, {'id': 'BE-005', 'description': 'Implement input validation on the backend.', 'dependencies': ['BE-003'], 'estimated_time': '4 hours', 'agent_role': 'backend_developer', 'acceptance_criteria': [\"Backend validates the 'description' parameter to ensure it's not empty and meets any other defined criteria (e.g., length).\", 'Returns a 400 Bad Request with an informative error message if validation fails.'], 'status': 'pending', 'code_files': ['schemas.py', 'main.py']}, {'id': 'BE-006', 'description': 'Write unit tests for backend API endpoints.', 'dependencies': ['BE-001', 'BE-003', 'BE-004', 'BE-005'], 'estimated_time': '8 hours', 'agent_role': 'backend_developer', 'acceptance_criteria': ['Unit tests cover the /tasks POST endpoint.', 'Unit tests cover the /tasks GET endpoint.', 'Tests use a testing framework (e.g., pytest).', 'Tests mock database interactions.', 'Tests achieve a reasonable level of code coverage.'], 'status': 'pending', 'code_files': ['tests/test_main.py']}, {'id': 'BE-007', 'description': 'Write integration tests for API endpoints.', 'dependencies': ['BE-001', 'BE-003', 'BE-004', 'BE-005', 'BE-006'], 'estimated_time': '8 hours', 'agent_role': 'backend_developer', 'acceptance_criteria': ['Integration tests test the /tasks POST endpoint.', 'Integration tests test the /tasks GET endpoint.', 'Tests use a testing framework (e.g., pytest).', 'Tests interact with the database.', 'Tests verify the correct responses and data.'], 'status': 'pending', 'code_files': ['tests/integration_tests.py']}, {'id': 'SC-002', 'description': 'Implement basic security measures (input validation, output encoding).', 'dependencies': ['BE-005'], 'estimated_time': '4 hours', 'agent_role': 'backend_developer', 'acceptance_criteria': ['Input validation is implemented on the backend.', 'Output encoding is implemented to prevent XSS vulnerabilities.', 'Parameterized queries are used to prevent SQL injection.'], 'status': 'pending', 'code_files': ['main.py', 'schemas.py']}]}, {'name': 'Database Phase', 'description': 'Tasks related to database phase', 'deliverables': ['Completed BE-002'], 'estimated_duration_hours': 4.0, 'work_items': [{'id': 'BE-002', 'description': 'Design and implement the database schema (tasks table).', 'dependencies': ['BE-001'], 'estimated_time': '4 hours', 'agent_role': 'database_specialist', 'acceptance_criteria': ['Database connection is established.', 'Tasks table is created with id (UUID, PRIMARY KEY, DEFAULT gen_random_uuid()), description (VARCHAR(255), NOT NULL), and created_at (TIMESTAMP, NOT NULL, DEFAULT CURRENT_TIMESTAMP) columns.', 'ORM (e.g., SQLAlchemy) is configured (if used).'], 'status': 'pending', 'code_files': ['models.py', 'database.py']}]}, {'name': 'Devops_Engineer Phase', 'description': 'Tasks related to devops_engineer phase', 'deliverables': ['Completed DE-001', 'Completed DE-002', 'Completed SC-001'], 'estimated_duration_hours': 16.0, 'work_items': [{'id': 'DE-001', 'description': 'Deploy the frontend to a static site hosting service (e.g., Netlify, Vercel).', 'dependencies': ['FE-007', 'FE-008'], 'estimated_time': '4 hours', 'agent_role': 'devops_engineer', 'acceptance_criteria': ['Frontend is deployed to a static site hosting service.', 'Frontend is accessible via a public URL.', 'Deployment process is automated (e.g., using a CI/CD pipeline).'], 'status': 'pending', 'code_files': []}, {'id': 'DE-002', 'description': 'Deploy the backend to a cloud platform (e.g., AWS, Google Cloud, Azure).', 'dependencies': ['BE-006', 'BE-007'], 'estimated_time': '8 hours', 'agent_role': 'devops_engineer', 'acceptance_criteria': ['Backend API is deployed to a cloud platform.', 'Backend API is accessible via a public URL.', 'Database is deployed and accessible by the backend.', 'Deployment process is automated (e.g., using a CI/CD pipeline).'], 'status': 'pending', 'code_files': []}, {'id': 'SC-001', 'description': 'Configure HTTPS for the frontend and backend.', 'dependencies': ['DE-001', 'DE-002'], 'estimated_time': '4 hours', 'agent_role': 'devops_engineer', 'acceptance_criteria': ['HTTPS is enabled for the frontend.', 'HTTPS is enabled for the backend API.', 'SSL certificates are properly configured.'], 'status': 'pending', 'code_files': []}]}], resource_allocation=[{'role': 'Frontend Developer', 'count': 1, 'estimated_time_allocation': '100%', 'phases': ['Frontend Phase'], 'skills_required': []}, {'role': 'Database Specialist', 'count': 1, 'estimated_time_allocation': '100%', 'phases': ['Database Phase'], 'skills_required': []}, {'role': 'Backend Developer', 'count': 1, 'estimated_time_allocation': '100%', 'phases': ['Backend Phase'], 'skills_required': []}, {'role': 'Devops Engineer', 'count': 1, 'estimated_time_allocation': '100%', 'phases': ['Devops_Engineer Phase'], 'skills_required': []}], risks_and_mitigations=[], timeline={'start_date': '2025-07-08T22:33:05.871776', 'end_date': 'TBD', 'milestones': []}, tech_stack={}, metadata={'generated_at': '2025-07-08T22:33:05.871776', 'version': '1.0', 'author': 'Multi-AI Dev System', 'tags': [], 'notes': 'Converted from WorkItemBacklog. Original summary: Develop a simple web application for managing a list of tasks, including frontend and backend components, database integration, and basic security measures.'}) summary='Develop a simple web application for managing a list of tasks, including frontend and backend components, database integration, and basic security measures.' metadata=PlanMetadata(generated_at='2025-07-08T22:33:05.871776', version='1.0', author='Multi-AI Dev System', tags=[], notes='Converted from WorkItemBacklog. Original summary: Develop a simple web application for managing a list of tasks, including frontend and backend components, database integration, and basic security measures.')"
  }
}