{
  "session_id": "session_0dcea0d9-6eaa-4a7e-a39c-638fa4e87094",
  "approval_type": "implementation_plan",
  "timestamp": 1751959039,
  "approval_data": {
    "type": "implementation_plan",
    "timestamp": 1751959039.77665,
    "project_overview": "Develop a web portal for V-KYC team leads and process managers to access and download V-KYC recordings for audit and other requirements. The portal will allow users to upload a CSV/TXT file containing LAN IDs, display results in a tabular format with pagination and search, and provide download functionality. The backend will be built using Node.js and Express, with a PostgreSQL database. The frontend will be built using React. The application will be deployed on AWS using a microservices architecture and a CI/CD pipeline.",
    "development_phases": [
      {
        "name": "Frontend Phase",
        "description": "Tasks related to frontend phase",
        "deliverables": [
          "Completed FE-001",
          "Completed FE-002",
          "Completed FE-003",
          "Completed FE-004",
          "Completed FE-005",
          "Completed FE-006",
          "Completed FE-007",
          "Completed FE-008",
          "Completed FE-009",
          "Completed FE-010",
          "Completed FE-011",
          "Completed FE-012",
          "Completed TEST-001"
        ],
        "estimated_duration_hours": 136.0,
        "work_items": [
          {
            "id": "FE-001",
            "description": "Set up React project with necessary dependencies (React Router, Axios, Material-UI/Ant Design).",
            "dependencies": [],
            "estimated_time": "1 day",
            "agent_role": "frontend_developer",
            "acceptance_criteria": [
              "Project initializes successfully.",
              "Dependencies are installed.",
              "Basic project structure is in place."
            ],
            "status": "pending",
            "code_files": [
              "package.json",
              "src/App.js",
              "src/index.js"
            ]
          },
          {
            "id": "FE-002",
            "description": "Implement user authentication and login form in React.",
            "dependencies": [
              "FE-001"
            ],
            "estimated_time": "2 days",
            "agent_role": "frontend_developer",
            "acceptance_criteria": [
              "Login form renders correctly.",
              "Username and password fields are present.",
              "Login button is functional.",
              "Form validation is implemented (client-side)."
            ],
            "status": "pending",
            "code_files": [
              "src/components/Login.js",
              "src/App.js",
              "src/services/authService.js"
            ]
          },
          {
            "id": "FE-003",
            "description": "Implement user registration form in React.",
            "dependencies": [
              "FE-001"
            ],
            "estimated_time": "2 days",
            "agent_role": "frontend_developer",
            "acceptance_criteria": [
              "Registration form renders correctly.",
              "Username and password fields are present.",
              "Registration button is functional.",
              "Form validation is implemented (client-side)."
            ],
            "status": "pending",
            "code_files": [
              "src/components/Register.js",
              "src/App.js",
              "src/services/authService.js"
            ]
          },
          {
            "id": "FE-004",
            "description": "Implement authentication service (API calls for login/register) using Axios.",
            "dependencies": [
              "FE-002",
              "FE-003"
            ],
            "estimated_time": "1 day",
            "agent_role": "frontend_developer",
            "acceptance_criteria": [
              "Login API call is made correctly.",
              "Registration API call is made correctly.",
              "Error handling for API calls is implemented.",
              "JWT token is stored securely (e.g., in HTTP-only cookie)."
            ],
            "status": "pending",
            "code_files": [
              "src/services/authService.js",
              "src/utils/api.js"
            ]
          },
          {
            "id": "FE-005",
            "description": "Implement protected routes and redirect unauthorized users.",
            "dependencies": [
              "FE-004"
            ],
            "estimated_time": "1 day",
            "agent_role": "frontend_developer",
            "acceptance_criteria": [
              "Protected routes are accessible only to authenticated users.",
              "Unauthorized users are redirected to the login page.",
              "User role-based access control is implemented."
            ],
            "status": "pending",
            "code_files": [
              "src/components/PrivateRoute.js",
              "src/App.js"
            ]
          },
          {
            "id": "FE-006",
            "description": "Create a file upload component.",
            "dependencies": [
              "FE-001"
            ],
            "estimated_time": "1 day",
            "agent_role": "frontend_developer",
            "acceptance_criteria": [
              "File upload component renders correctly.",
              "User can select a file.",
              "File type validation is implemented (CSV/TXT).",
              "File size validation is implemented."
            ],
            "status": "pending",
            "code_files": [
              "src/components/FileUpload.js"
            ]
          },
          {
            "id": "FE-007",
            "description": "Implement API call to upload file and display results.",
            "dependencies": [
              "FE-006",
              "FE-004"
            ],
            "estimated_time": "2 days",
            "agent_role": "frontend_developer",
            "acceptance_criteria": [
              "File upload API call is made correctly.",
              "Loading indicator is displayed during upload.",
              "Results are displayed in a tabular format.",
              "Error handling for API calls is implemented."
            ],
            "status": "pending",
            "code_files": [
              "src/components/FileUpload.js",
              "src/services/apiService.js"
            ]
          },
          {
            "id": "FE-008",
            "description": "Implement table pagination.",
            "dependencies": [
              "FE-007"
            ],
            "estimated_time": "1 day",
            "agent_role": "frontend_developer",
            "acceptance_criteria": [
              "Pagination controls are displayed.",
              "Records are displayed in pages of 10.",
              "Pagination works correctly (navigates between pages)."
            ],
            "status": "pending",
            "code_files": [
              "src/components/RecordingTable.js"
            ]
          },
          {
            "id": "FE-009",
            "description": "Implement search functionality by LAN ID.",
            "dependencies": [
              "FE-007"
            ],
            "estimated_time": "1 day",
            "agent_role": "frontend_developer",
            "acceptance_criteria": [
              "Search input field is displayed.",
              "Search results are filtered correctly based on LAN ID.",
              "Search results update dynamically."
            ],
            "status": "pending",
            "code_files": [
              "src/components/RecordingTable.js"
            ]
          },
          {
            "id": "FE-010",
            "description": "Implement download functionality for individual recordings.",
            "dependencies": [
              "FE-007"
            ],
            "estimated_time": "1 day",
            "agent_role": "frontend_developer",
            "acceptance_criteria": [
              "Download button is displayed for each recording.",
              "Download API call is made correctly.",
              "Recording is downloaded successfully."
            ],
            "status": "pending",
            "code_files": [
              "src/components/RecordingTable.js",
              "src/services/apiService.js"
            ]
          },
          {
            "id": "FE-011",
            "description": "Implement 'Download All' functionality.",
            "dependencies": [
              "FE-007"
            ],
            "estimated_time": "1 day",
            "agent_role": "frontend_developer",
            "acceptance_criteria": [
              "'Download All' button is displayed.",
              "Download API call is made correctly.",
              "All selected recordings are downloaded successfully (max 10).",
              "Loading indicator is displayed during download."
            ],
            "status": "pending",
            "code_files": [
              "src/components/RecordingTable.js",
              "src/services/apiService.js"
            ]
          },
          {
            "id": "FE-012",
            "description": "Implement date and month wise filtering.",
            "dependencies": [
              "FE-007"
            ],
            "estimated_time": "1 day",
            "agent_role": "frontend_developer",
            "acceptance_criteria": [
              "Date and month filter controls are displayed.",
              "Results are filtered correctly based on date and month.",
              "Filter results update dynamically."
            ],
            "status": "pending",
            "code_files": [
              "src/components/RecordingTable.js"
            ]
          },
          {
            "id": "TEST-001",
            "description": "Write unit tests for frontend components.",
            "dependencies": [
              "FE-001",
              "FE-002",
              "FE-006"
            ],
            "estimated_time": "2 days",
            "agent_role": "frontend_developer",
            "acceptance_criteria": [
              "Tests cover key functionality of components.",
              "Tests pass successfully.",
              "Test coverage meets the defined criteria."
            ],
            "status": "pending",
            "code_files": [
              "src/components/__tests__/Login.test.js",
              "src/components/__tests__/FileUpload.test.js"
            ]
          }
        ]
      },
      {
        "name": "Backend Phase",
        "description": "Tasks related to backend phase",
        "deliverables": [
          "Completed BE-001",
          "Completed BE-002",
          "Completed BE-003",
          "Completed BE-004",
          "Completed BE-005",
          "Completed BE-006",
          "Completed BE-007",
          "Completed BE-008",
          "Completed BE-009",
          "Completed BE-010",
          "Completed TEST-002",
          "Completed SEC-001",
          "Completed SEC-002",
          "Completed SEC-003",
          "Completed DOC-001"
        ],
        "estimated_duration_hours": 216.0,
        "work_items": [
          {
            "id": "BE-001",
            "description": "Set up Node.js project with Express and necessary dependencies (body-parser, jsonwebtoken).",
            "dependencies": [],
            "estimated_time": "1 day",
            "agent_role": "backend_developer",
            "acceptance_criteria": [
              "Project initializes successfully.",
              "Dependencies are installed.",
              "Basic project structure is in place.",
              "Express server starts successfully."
            ],
            "status": "pending",
            "code_files": [
              "package.json",
              "index.js",
              "routes/index.js"
            ]
          },
          {
            "id": "BE-002",
            "description": "Implement user authentication endpoints (login, register) using JWT.",
            "dependencies": [
              "BE-001"
            ],
            "estimated_time": "2 days",
            "agent_role": "backend_developer",
            "acceptance_criteria": [
              "Login endpoint authenticates users and returns a JWT.",
              "Register endpoint creates new users.",
              "Password hashing is implemented.",
              "Error handling for authentication is implemented."
            ],
            "status": "pending",
            "code_files": [
              "routes/auth.js",
              "controllers/authController.js",
              "models/user.js"
            ]
          },
          {
            "id": "BE-003",
            "description": "Implement JWT middleware for authentication.",
            "dependencies": [
              "BE-002"
            ],
            "estimated_time": "1 day",
            "agent_role": "backend_developer",
            "acceptance_criteria": [
              "JWT middleware verifies tokens.",
              "Protected routes require valid JWTs.",
              "Unauthorized requests are rejected."
            ],
            "status": "pending",
            "code_files": [
              "middleware/authMiddleware.js"
            ]
          },
          {
            "id": "BE-004",
            "description": "Implement API endpoint for file upload.",
            "dependencies": [
              "BE-003"
            ],
            "estimated_time": "2 days",
            "agent_role": "backend_developer",
            "acceptance_criteria": [
              "File upload endpoint receives the file.",
              "File type validation (CSV/TXT) is implemented.",
              "File size validation is implemented.",
              "File is saved temporarily (e.g., in a temp directory).",
              "Returns a job ID for tracking."
            ],
            "status": "pending",
            "code_files": [
              "routes/recordings.js",
              "controllers/recordingsController.js"
            ]
          },
          {
            "id": "BE-005",
            "description": "Implement file processing logic (parse CSV/TXT, extract LAN IDs).",
            "dependencies": [
              "BE-004"
            ],
            "estimated_time": "2 days",
            "agent_role": "backend_developer",
            "acceptance_criteria": [
              "File is parsed correctly.",
              "LAN IDs are extracted.",
              "Error handling for file parsing is implemented."
            ],
            "status": "pending",
            "code_files": [
              "services/fileProcessingService.js"
            ]
          },
          {
            "id": "BE-006",
            "description": "Implement API call to Recording Service to fetch recording details.",
            "dependencies": [
              "BE-005"
            ],
            "estimated_time": "2 days",
            "agent_role": "backend_developer",
            "acceptance_criteria": [
              "API call to Recording Service is made correctly.",
              "Recording details are retrieved based on LAN IDs.",
              "Error handling for API calls is implemented."
            ],
            "status": "pending",
            "code_files": [
              "services/recordingService.js"
            ]
          },
          {
            "id": "BE-007",
            "description": "Implement API endpoint to retrieve recording details (with pagination and search).",
            "dependencies": [
              "BE-006",
              "BE-003"
            ],
            "estimated_time": "3 days",
            "agent_role": "backend_developer",
            "acceptance_criteria": [
              "Endpoint retrieves recording details.",
              "Pagination is implemented.",
              "Search by LAN ID is implemented.",
              "Date and month filtering is implemented.",
              "Error handling is implemented."
            ],
            "status": "pending",
            "code_files": [
              "routes/recordings.js",
              "controllers/recordingsController.js"
            ]
          },
          {
            "id": "BE-008",
            "description": "Implement API endpoint to download recordings (zip file).",
            "dependencies": [
              "BE-007",
              "BE-003"
            ],
            "estimated_time": "3 days",
            "agent_role": "backend_developer",
            "acceptance_criteria": [
              "Endpoint receives a list of LAN IDs.",
              "Recordings are retrieved from AWS S3.",
              "Recordings are zipped.",
              "Zip file is streamed to the client.",
              "Error handling is implemented."
            ],
            "status": "pending",
            "code_files": [
              "routes/recordings.js",
              "controllers/recordingsController.js",
              "services/awsService.js"
            ]
          },
          {
            "id": "BE-009",
            "description": "Implement database connection and setup (PostgreSQL).",
            "dependencies": [],
            "estimated_time": "1 day",
            "agent_role": "backend_developer",
            "acceptance_criteria": [
              "Database connection is established.",
              "Database schema is defined (users, recordings).",
              "Database migrations are implemented (if applicable)."
            ],
            "status": "pending",
            "code_files": [
              "config/database.js",
              "models/user.js",
              "models/recording.js"
            ]
          },
          {
            "id": "BE-010",
            "description": "Implement data access layer for user and recording data.",
            "dependencies": [
              "BE-009"
            ],
            "estimated_time": "2 days",
            "agent_role": "backend_developer",
            "acceptance_criteria": [
              "User data can be saved and retrieved.",
              "Recording metadata can be saved and retrieved.",
              "Data access methods are implemented (CRUD operations)."
            ],
            "status": "pending",
            "code_files": [
              "repositories/userRepository.js",
              "repositories/recordingRepository.js"
            ]
          },
          {
            "id": "TEST-002",
            "description": "Write unit tests for backend API endpoints.",
            "dependencies": [
              "BE-001",
              "BE-002",
              "BE-004"
            ],
            "estimated_time": "3 days",
            "agent_role": "backend_developer",
            "acceptance_criteria": [
              "Tests cover key functionality of API endpoints.",
              "Tests pass successfully.",
              "Test coverage meets the defined criteria."
            ],
            "status": "pending",
            "code_files": [
              "tests/auth.test.js",
              "tests/recordings.test.js"
            ]
          },
          {
            "id": "SEC-001",
            "description": "Implement input validation and sanitization on the backend.",
            "dependencies": [
              "BE-004",
              "BE-007"
            ],
            "estimated_time": "1 day",
            "agent_role": "backend_developer",
            "acceptance_criteria": [
              "All user inputs are validated.",
              "Invalid inputs are rejected.",
              "Input sanitization is implemented to prevent injection attacks."
            ],
            "status": "pending",
            "code_files": [
              "controllers/recordingsController.js",
              "services/fileProcessingService.js"
            ]
          },
          {
            "id": "SEC-002",
            "description": "Implement output encoding on the backend.",
            "dependencies": [
              "BE-007"
            ],
            "estimated_time": "1 day",
            "agent_role": "backend_developer",
            "acceptance_criteria": [
              "All output data is encoded.",
              "XSS vulnerabilities are mitigated."
            ],
            "status": "pending",
            "code_files": [
              "controllers/recordingsController.js"
            ]
          },
          {
            "id": "SEC-003",
            "description": "Implement rate limiting on API endpoints.",
            "dependencies": [
              "BE-004",
              "BE-007"
            ],
            "estimated_time": "1 day",
            "agent_role": "backend_developer",
            "acceptance_criteria": [
              "Rate limiting is implemented on all authenticated endpoints.",
              "Brute-force attacks are prevented.",
              "API abuse is mitigated."
            ],
            "status": "pending",
            "code_files": [
              "middleware/rateLimitMiddleware.js"
            ]
          },
          {
            "id": "DOC-001",
            "description": "Create API documentation (e.g., using Swagger/OpenAPI).",
            "dependencies": [
              "BE-007"
            ],
            "estimated_time": "2 days",
            "agent_role": "backend_developer",
            "acceptance_criteria": [
              "API documentation is generated.",
              "Documentation is up-to-date.",
              "Documentation is accessible."
            ],
            "status": "pending",
            "code_files": [
              "swagger.yaml"
            ]
          }
        ]
      },
      {
        "name": "Database Phase",
        "description": "Tasks related to database phase",
        "deliverables": [
          "Completed DB-001"
        ],
        "estimated_duration_hours": 8.0,
        "work_items": [
          {
            "id": "DB-001",
            "description": "Create database schema for users and recordings tables in PostgreSQL.",
            "dependencies": [],
            "estimated_time": "1 day",
            "agent_role": "database_specialist",
            "acceptance_criteria": [
              "Users table created with required fields (id, username, password_hash, role).",
              "Recordings table created with required fields (id, lan_id, file_name, file_size, download_url, recording_date, recording_month, created_at).",
              "Indexes are created for optimized queries (e.g., lan_id, recording_date)."
            ],
            "status": "pending",
            "code_files": [
              "database/schema.sql"
            ]
          }
        ]
      },
      {
        "name": "Devops_Engineer Phase",
        "description": "Tasks related to devops_engineer phase",
        "deliverables": [
          "Completed INF-001",
          "Completed INF-002",
          "Completed INF-003",
          "Completed DEPLOY-001",
          "Completed DEPLOY-002"
        ],
        "estimated_duration_hours": 64.0,
        "work_items": [
          {
            "id": "INF-001",
            "description": "Set up AWS infrastructure (EC2 instance, database, S3 bucket).",
            "dependencies": [],
            "estimated_time": "2 days",
            "agent_role": "devops_engineer",
            "acceptance_criteria": [
              "EC2 instance is created and configured.",
              "PostgreSQL database is created and accessible.",
              "S3 bucket is created for storing recordings.",
              "Security groups are configured to allow necessary traffic."
            ],
            "status": "pending",
            "code_files": [
              "terraform/main.tf",
              "terraform/variables.tf"
            ]
          },
          {
            "id": "INF-002",
            "description": "Configure CI/CD pipeline (e.g., Jenkins, GitLab CI) for automated deployments.",
            "dependencies": [
              "INF-001",
              "BE-001",
              "FE-001"
            ],
            "estimated_time": "2 days",
            "agent_role": "devops_engineer",
            "acceptance_criteria": [
              "Pipeline is configured to build and deploy the frontend.",
              "Pipeline is configured to build and deploy the backend.",
              "Automated testing is integrated into the pipeline.",
              "Deployments are automated to the AWS environment."
            ],
            "status": "pending",
            "code_files": [
              ".gitlab-ci.yml",
              "Jenkinsfile"
            ]
          },
          {
            "id": "INF-003",
            "description": "Implement monitoring and logging (e.g., Prometheus, Grafana, ELK stack).",
            "dependencies": [
              "INF-001",
              "BE-001",
              "FE-001"
            ],
            "estimated_time": "2 days",
            "agent_role": "devops_engineer",
            "acceptance_criteria": [
              "Monitoring tools are set up and configured.",
              "Application metrics are collected.",
              "Logs are collected and aggregated.",
              "Alerts are configured for critical events."
            ],
            "status": "pending",
            "code_files": [
              "docker-compose.yml",
              "prometheus.yml",
              "grafana/dashboards"
            ]
          },
          {
            "id": "DEPLOY-001",
            "description": "Deploy the application to the AWS environment.",
            "dependencies": [
              "INF-002",
              "TEST-003"
            ],
            "estimated_time": "1 day",
            "agent_role": "devops_engineer",
            "acceptance_criteria": [
              "Frontend is deployed.",
              "Backend is deployed.",
              "Database is accessible.",
              "Application is accessible via a public URL."
            ],
            "status": "pending",
            "code_files": []
          },
          {
            "id": "DEPLOY-002",
            "description": "Configure monitoring and alerting.",
            "dependencies": [
              "INF-003",
              "DEPLOY-001"
            ],
            "estimated_time": "1 day",
            "agent_role": "devops_engineer",
            "acceptance_criteria": [
              "Monitoring dashboards are configured.",
              "Alerts are configured for critical events.",
              "Alerts are tested and working."
            ],
            "status": "pending",
            "code_files": []
          }
        ]
      },
      {
        "name": "Qa_Engineer Phase",
        "description": "Tasks related to qa_engineer phase",
        "deliverables": [
          "Completed TEST-003",
          "Completed TEST-004"
        ],
        "estimated_duration_hours": 40.0,
        "work_items": [
          {
            "id": "TEST-003",
            "description": "Perform integration tests for frontend and backend.",
            "dependencies": [
              "TEST-001",
              "TEST-002"
            ],
            "estimated_time": "3 days",
            "agent_role": "qa_engineer",
            "acceptance_criteria": [
              "Tests verify the interaction between frontend and backend.",
              "Tests cover key user flows.",
              "Tests pass successfully."
            ],
            "status": "pending",
            "code_files": [
              "integration_tests/login.spec.js",
              "integration_tests/upload.spec.js"
            ]
          },
          {
            "id": "TEST-004",
            "description": "Perform user acceptance testing (UAT).",
            "dependencies": [
              "TEST-003"
            ],
            "estimated_time": "2 days",
            "agent_role": "qa_engineer",
            "acceptance_criteria": [
              "Authorized users test the application.",
              "Feedback is collected.",
              "Issues are documented and addressed."
            ],
            "status": "pending",
            "code_files": []
          }
        ]
      }
    ],
    "timeline_estimation": {
      "start_date": "2025-07-08T12:47:19.391056",
      "end_date": "TBD",
      "milestones": []
    },
    "risk_assessment": [],
    "resource_requirements": [
      {
        "role": "Qa Engineer",
        "count": 1,
        "estimated_time_allocation": "100%",
        "phases": [
          "Qa_Engineer Phase"
        ],
        "skills_required": []
      },
      {
        "role": "Devops Engineer",
        "count": 1,
        "estimated_time_allocation": "100%",
        "phases": [
          "Devops_Engineer Phase"
        ],
        "skills_required": []
      },
      {
        "role": "Backend Developer",
        "count": 1,
        "estimated_time_allocation": "100%",
        "phases": [
          "Backend Phase"
        ],
        "skills_required": []
      },
      {
        "role": "Database Specialist",
        "count": 1,
        "estimated_time_allocation": "100%",
        "phases": [
          "Database Phase"
        ],
        "skills_required": []
      },
      {
        "role": "Frontend Developer",
        "count": 1,
        "estimated_time_allocation": "100%",
        "phases": [
          "Frontend Phase"
        ],
        "skills_required": []
      }
    ],
    "deliverables": [
      "Completed FE-001",
      "Completed FE-002",
      "Completed FE-003",
      "Completed FE-004",
      "Completed FE-005",
      "Completed FE-006",
      "Completed FE-007",
      "Completed FE-008",
      "Completed FE-009",
      "Completed FE-010",
      "Completed FE-011",
      "Completed FE-012",
      "Completed TEST-001",
      "Completed BE-001",
      "Completed BE-002",
      "Completed BE-003",
      "Completed BE-004",
      "Completed BE-005",
      "Completed BE-006",
      "Completed BE-007",
      "Completed BE-008",
      "Completed BE-009",
      "Completed BE-010",
      "Completed TEST-002",
      "Completed SEC-001",
      "Completed SEC-002",
      "Completed SEC-003",
      "Completed DOC-001",
      "Completed DB-001",
      "Completed INF-001",
      "Completed INF-002",
      "Completed INF-003",
      "Completed DEPLOY-001",
      "Completed DEPLOY-002",
      "Completed TEST-003",
      "Completed TEST-004"
    ],
    "dependencies": [],
    "raw_plan": "plan=ImplementationPlan(project_summary={'title': 'Generated Project Plan', 'description': 'Develop a web portal for V-KYC team leads and process managers to access and download V-KYC recordings for audit and other requirements. The portal will allow users to upload a CSV/TXT file containing LAN IDs, display results in a tabular format with pagination and search, and provide download functionality. The backend will be built using Node.js and Express, with a PostgreSQL database. The frontend will be built using React. The application will be deployed on AWS using a microservices architecture and a CI/CD pipeline.', 'overall_complexity': 'Medium', 'estimated_duration': 'TBD', 'key_challenges': [], 'success_criteria': []}, phases=[{'name': 'Frontend Phase', 'description': 'Tasks related to frontend phase', 'deliverables': ['Completed FE-001', 'Completed FE-002', 'Completed FE-003', 'Completed FE-004', 'Completed FE-005', 'Completed FE-006', 'Completed FE-007', 'Completed FE-008', 'Completed FE-009', 'Completed FE-010', 'Completed FE-011', 'Completed FE-012', 'Completed TEST-001'], 'estimated_duration_hours': 136.0, 'work_items': [{'id': 'FE-001', 'description': 'Set up React project with necessary dependencies (React Router, Axios, Material-UI/Ant Design).', 'dependencies': [], 'estimated_time': '1 day', 'agent_role': 'frontend_developer', 'acceptance_criteria': ['Project initializes successfully.', 'Dependencies are installed.', 'Basic project structure is in place.'], 'status': 'pending', 'code_files': ['package.json', 'src/App.js', 'src/index.js']}, {'id': 'FE-002', 'description': 'Implement user authentication and login form in React.', 'dependencies': ['FE-001'], 'estimated_time': '2 days', 'agent_role': 'frontend_developer', 'acceptance_criteria': ['Login form renders correctly.', 'Username and password fields are present.', 'Login button is functional.', 'Form validation is implemented (client-side).'], 'status': 'pending', 'code_files': ['src/components/Login.js', 'src/App.js', 'src/services/authService.js']}, {'id': 'FE-003', 'description': 'Implement user registration form in React.', 'dependencies': ['FE-001'], 'estimated_time': '2 days', 'agent_role': 'frontend_developer', 'acceptance_criteria': ['Registration form renders correctly.', 'Username and password fields are present.', 'Registration button is functional.', 'Form validation is implemented (client-side).'], 'status': 'pending', 'code_files': ['src/components/Register.js', 'src/App.js', 'src/services/authService.js']}, {'id': 'FE-004', 'description': 'Implement authentication service (API calls for login/register) using Axios.', 'dependencies': ['FE-002', 'FE-003'], 'estimated_time': '1 day', 'agent_role': 'frontend_developer', 'acceptance_criteria': ['Login API call is made correctly.', 'Registration API call is made correctly.', 'Error handling for API calls is implemented.', 'JWT token is stored securely (e.g., in HTTP-only cookie).'], 'status': 'pending', 'code_files': ['src/services/authService.js', 'src/utils/api.js']}, {'id': 'FE-005', 'description': 'Implement protected routes and redirect unauthorized users.', 'dependencies': ['FE-004'], 'estimated_time': '1 day', 'agent_role': 'frontend_developer', 'acceptance_criteria': ['Protected routes are accessible only to authenticated users.', 'Unauthorized users are redirected to the login page.', 'User role-based access control is implemented.'], 'status': 'pending', 'code_files': ['src/components/PrivateRoute.js', 'src/App.js']}, {'id': 'FE-006', 'description': 'Create a file upload component.', 'dependencies': ['FE-001'], 'estimated_time': '1 day', 'agent_role': 'frontend_developer', 'acceptance_criteria': ['File upload component renders correctly.', 'User can select a file.', 'File type validation is implemented (CSV/TXT).', 'File size validation is implemented.'], 'status': 'pending', 'code_files': ['src/components/FileUpload.js']}, {'id': 'FE-007', 'description': 'Implement API call to upload file and display results.', 'dependencies': ['FE-006', 'FE-004'], 'estimated_time': '2 days', 'agent_role': 'frontend_developer', 'acceptance_criteria': ['File upload API call is made correctly.', 'Loading indicator is displayed during upload.', 'Results are displayed in a tabular format.', 'Error handling for API calls is implemented.'], 'status': 'pending', 'code_files': ['src/components/FileUpload.js', 'src/services/apiService.js']}, {'id': 'FE-008', 'description': 'Implement table pagination.', 'dependencies': ['FE-007'], 'estimated_time': '1 day', 'agent_role': 'frontend_developer', 'acceptance_criteria': ['Pagination controls are displayed.', 'Records are displayed in pages of 10.', 'Pagination works correctly (navigates between pages).'], 'status': 'pending', 'code_files': ['src/components/RecordingTable.js']}, {'id': 'FE-009', 'description': 'Implement search functionality by LAN ID.', 'dependencies': ['FE-007'], 'estimated_time': '1 day', 'agent_role': 'frontend_developer', 'acceptance_criteria': ['Search input field is displayed.', 'Search results are filtered correctly based on LAN ID.', 'Search results update dynamically.'], 'status': 'pending', 'code_files': ['src/components/RecordingTable.js']}, {'id': 'FE-010', 'description': 'Implement download functionality for individual recordings.', 'dependencies': ['FE-007'], 'estimated_time': '1 day', 'agent_role': 'frontend_developer', 'acceptance_criteria': ['Download button is displayed for each recording.', 'Download API call is made correctly.', 'Recording is downloaded successfully.'], 'status': 'pending', 'code_files': ['src/components/RecordingTable.js', 'src/services/apiService.js']}, {'id': 'FE-011', 'description': \"Implement 'Download All' functionality.\", 'dependencies': ['FE-007'], 'estimated_time': '1 day', 'agent_role': 'frontend_developer', 'acceptance_criteria': [\"'Download All' button is displayed.\", 'Download API call is made correctly.', 'All selected recordings are downloaded successfully (max 10).', 'Loading indicator is displayed during download.'], 'status': 'pending', 'code_files': ['src/components/RecordingTable.js', 'src/services/apiService.js']}, {'id': 'FE-012', 'description': 'Implement date and month wise filtering.', 'dependencies': ['FE-007'], 'estimated_time': '1 day', 'agent_role': 'frontend_developer', 'acceptance_criteria': ['Date and month filter controls are displayed.', 'Results are filtered correctly based on date and month.', 'Filter results update dynamically.'], 'status': 'pending', 'code_files': ['src/components/RecordingTable.js']}, {'id': 'TEST-001', 'description': 'Write unit tests for frontend components.', 'dependencies': ['FE-001', 'FE-002', 'FE-006'], 'estimated_time': '2 days', 'agent_role': 'frontend_developer', 'acceptance_criteria': ['Tests cover key functionality of components.', 'Tests pass successfully.', 'Test coverage meets the defined criteria.'], 'status': 'pending', 'code_files': ['src/components/__tests__/Login.test.js', 'src/components/__tests__/FileUpload.test.js']}]}, {'name': 'Backend Phase', 'description': 'Tasks related to backend phase', 'deliverables': ['Completed BE-001', 'Completed BE-002', 'Completed BE-003', 'Completed BE-004', 'Completed BE-005', 'Completed BE-006', 'Completed BE-007', 'Completed BE-008', 'Completed BE-009', 'Completed BE-010', 'Completed TEST-002', 'Completed SEC-001', 'Completed SEC-002', 'Completed SEC-003', 'Completed DOC-001'], 'estimated_duration_hours': 216.0, 'work_items': [{'id': 'BE-001', 'description': 'Set up Node.js project with Express and necessary dependencies (body-parser, jsonwebtoken).', 'dependencies': [], 'estimated_time': '1 day', 'agent_role': 'backend_developer', 'acceptance_criteria': ['Project initializes successfully.', 'Dependencies are installed.', 'Basic project structure is in place.', 'Express server starts successfully.'], 'status': 'pending', 'code_files': ['package.json', 'index.js', 'routes/index.js']}, {'id': 'BE-002', 'description': 'Implement user authentication endpoints (login, register) using JWT.', 'dependencies': ['BE-001'], 'estimated_time': '2 days', 'agent_role': 'backend_developer', 'acceptance_criteria': ['Login endpoint authenticates users and returns a JWT.', 'Register endpoint creates new users.', 'Password hashing is implemented.', 'Error handling for authentication is implemented.'], 'status': 'pending', 'code_files': ['routes/auth.js', 'controllers/authController.js', 'models/user.js']}, {'id': 'BE-003', 'description': 'Implement JWT middleware for authentication.', 'dependencies': ['BE-002'], 'estimated_time': '1 day', 'agent_role': 'backend_developer', 'acceptance_criteria': ['JWT middleware verifies tokens.', 'Protected routes require valid JWTs.', 'Unauthorized requests are rejected.'], 'status': 'pending', 'code_files': ['middleware/authMiddleware.js']}, {'id': 'BE-004', 'description': 'Implement API endpoint for file upload.', 'dependencies': ['BE-003'], 'estimated_time': '2 days', 'agent_role': 'backend_developer', 'acceptance_criteria': ['File upload endpoint receives the file.', 'File type validation (CSV/TXT) is implemented.', 'File size validation is implemented.', 'File is saved temporarily (e.g., in a temp directory).', 'Returns a job ID for tracking.'], 'status': 'pending', 'code_files': ['routes/recordings.js', 'controllers/recordingsController.js']}, {'id': 'BE-005', 'description': 'Implement file processing logic (parse CSV/TXT, extract LAN IDs).', 'dependencies': ['BE-004'], 'estimated_time': '2 days', 'agent_role': 'backend_developer', 'acceptance_criteria': ['File is parsed correctly.', 'LAN IDs are extracted.', 'Error handling for file parsing is implemented.'], 'status': 'pending', 'code_files': ['services/fileProcessingService.js']}, {'id': 'BE-006', 'description': 'Implement API call to Recording Service to fetch recording details.', 'dependencies': ['BE-005'], 'estimated_time': '2 days', 'agent_role': 'backend_developer', 'acceptance_criteria': ['API call to Recording Service is made correctly.', 'Recording details are retrieved based on LAN IDs.', 'Error handling for API calls is implemented.'], 'status': 'pending', 'code_files': ['services/recordingService.js']}, {'id': 'BE-007', 'description': 'Implement API endpoint to retrieve recording details (with pagination and search).', 'dependencies': ['BE-006', 'BE-003'], 'estimated_time': '3 days', 'agent_role': 'backend_developer', 'acceptance_criteria': ['Endpoint retrieves recording details.', 'Pagination is implemented.', 'Search by LAN ID is implemented.', 'Date and month filtering is implemented.', 'Error handling is implemented.'], 'status': 'pending', 'code_files': ['routes/recordings.js', 'controllers/recordingsController.js']}, {'id': 'BE-008', 'description': 'Implement API endpoint to download recordings (zip file).', 'dependencies': ['BE-007', 'BE-003'], 'estimated_time': '3 days', 'agent_role': 'backend_developer', 'acceptance_criteria': ['Endpoint receives a list of LAN IDs.', 'Recordings are retrieved from AWS S3.', 'Recordings are zipped.', 'Zip file is streamed to the client.', 'Error handling is implemented.'], 'status': 'pending', 'code_files': ['routes/recordings.js', 'controllers/recordingsController.js', 'services/awsService.js']}, {'id': 'BE-009', 'description': 'Implement database connection and setup (PostgreSQL).', 'dependencies': [], 'estimated_time': '1 day', 'agent_role': 'backend_developer', 'acceptance_criteria': ['Database connection is established.', 'Database schema is defined (users, recordings).', 'Database migrations are implemented (if applicable).'], 'status': 'pending', 'code_files': ['config/database.js', 'models/user.js', 'models/recording.js']}, {'id': 'BE-010', 'description': 'Implement data access layer for user and recording data.', 'dependencies': ['BE-009'], 'estimated_time': '2 days', 'agent_role': 'backend_developer', 'acceptance_criteria': ['User data can be saved and retrieved.', 'Recording metadata can be saved and retrieved.', 'Data access methods are implemented (CRUD operations).'], 'status': 'pending', 'code_files': ['repositories/userRepository.js', 'repositories/recordingRepository.js']}, {'id': 'TEST-002', 'description': 'Write unit tests for backend API endpoints.', 'dependencies': ['BE-001', 'BE-002', 'BE-004'], 'estimated_time': '3 days', 'agent_role': 'backend_developer', 'acceptance_criteria': ['Tests cover key functionality of API endpoints.', 'Tests pass successfully.', 'Test coverage meets the defined criteria.'], 'status': 'pending', 'code_files': ['tests/auth.test.js', 'tests/recordings.test.js']}, {'id': 'SEC-001', 'description': 'Implement input validation and sanitization on the backend.', 'dependencies': ['BE-004', 'BE-007'], 'estimated_time': '1 day', 'agent_role': 'backend_developer', 'acceptance_criteria': ['All user inputs are validated.', 'Invalid inputs are rejected.', 'Input sanitization is implemented to prevent injection attacks.'], 'status': 'pending', 'code_files': ['controllers/recordingsController.js', 'services/fileProcessingService.js']}, {'id': 'SEC-002', 'description': 'Implement output encoding on the backend.', 'dependencies': ['BE-007'], 'estimated_time': '1 day', 'agent_role': 'backend_developer', 'acceptance_criteria': ['All output data is encoded.', 'XSS vulnerabilities are mitigated.'], 'status': 'pending', 'code_files': ['controllers/recordingsController.js']}, {'id': 'SEC-003', 'description': 'Implement rate limiting on API endpoints.', 'dependencies': ['BE-004', 'BE-007'], 'estimated_time': '1 day', 'agent_role': 'backend_developer', 'acceptance_criteria': ['Rate limiting is implemented on all authenticated endpoints.', 'Brute-force attacks are prevented.', 'API abuse is mitigated.'], 'status': 'pending', 'code_files': ['middleware/rateLimitMiddleware.js']}, {'id': 'DOC-001', 'description': 'Create API documentation (e.g., using Swagger/OpenAPI).', 'dependencies': ['BE-007'], 'estimated_time': '2 days', 'agent_role': 'backend_developer', 'acceptance_criteria': ['API documentation is generated.', 'Documentation is up-to-date.', 'Documentation is accessible.'], 'status': 'pending', 'code_files': ['swagger.yaml']}]}, {'name': 'Database Phase', 'description': 'Tasks related to database phase', 'deliverables': ['Completed DB-001'], 'estimated_duration_hours': 8.0, 'work_items': [{'id': 'DB-001', 'description': 'Create database schema for users and recordings tables in PostgreSQL.', 'dependencies': [], 'estimated_time': '1 day', 'agent_role': 'database_specialist', 'acceptance_criteria': ['Users table created with required fields (id, username, password_hash, role).', 'Recordings table created with required fields (id, lan_id, file_name, file_size, download_url, recording_date, recording_month, created_at).', 'Indexes are created for optimized queries (e.g., lan_id, recording_date).'], 'status': 'pending', 'code_files': ['database/schema.sql']}]}, {'name': 'Devops_Engineer Phase', 'description': 'Tasks related to devops_engineer phase', 'deliverables': ['Completed INF-001', 'Completed INF-002', 'Completed INF-003', 'Completed DEPLOY-001', 'Completed DEPLOY-002'], 'estimated_duration_hours': 64.0, 'work_items': [{'id': 'INF-001', 'description': 'Set up AWS infrastructure (EC2 instance, database, S3 bucket).', 'dependencies': [], 'estimated_time': '2 days', 'agent_role': 'devops_engineer', 'acceptance_criteria': ['EC2 instance is created and configured.', 'PostgreSQL database is created and accessible.', 'S3 bucket is created for storing recordings.', 'Security groups are configured to allow necessary traffic.'], 'status': 'pending', 'code_files': ['terraform/main.tf', 'terraform/variables.tf']}, {'id': 'INF-002', 'description': 'Configure CI/CD pipeline (e.g., Jenkins, GitLab CI) for automated deployments.', 'dependencies': ['INF-001', 'BE-001', 'FE-001'], 'estimated_time': '2 days', 'agent_role': 'devops_engineer', 'acceptance_criteria': ['Pipeline is configured to build and deploy the frontend.', 'Pipeline is configured to build and deploy the backend.', 'Automated testing is integrated into the pipeline.', 'Deployments are automated to the AWS environment.'], 'status': 'pending', 'code_files': ['.gitlab-ci.yml', 'Jenkinsfile']}, {'id': 'INF-003', 'description': 'Implement monitoring and logging (e.g., Prometheus, Grafana, ELK stack).', 'dependencies': ['INF-001', 'BE-001', 'FE-001'], 'estimated_time': '2 days', 'agent_role': 'devops_engineer', 'acceptance_criteria': ['Monitoring tools are set up and configured.', 'Application metrics are collected.', 'Logs are collected and aggregated.', 'Alerts are configured for critical events.'], 'status': 'pending', 'code_files': ['docker-compose.yml', 'prometheus.yml', 'grafana/dashboards']}, {'id': 'DEPLOY-001', 'description': 'Deploy the application to the AWS environment.', 'dependencies': ['INF-002', 'TEST-003'], 'estimated_time': '1 day', 'agent_role': 'devops_engineer', 'acceptance_criteria': ['Frontend is deployed.', 'Backend is deployed.', 'Database is accessible.', 'Application is accessible via a public URL.'], 'status': 'pending', 'code_files': []}, {'id': 'DEPLOY-002', 'description': 'Configure monitoring and alerting.', 'dependencies': ['INF-003', 'DEPLOY-001'], 'estimated_time': '1 day', 'agent_role': 'devops_engineer', 'acceptance_criteria': ['Monitoring dashboards are configured.', 'Alerts are configured for critical events.', 'Alerts are tested and working.'], 'status': 'pending', 'code_files': []}]}, {'name': 'Qa_Engineer Phase', 'description': 'Tasks related to qa_engineer phase', 'deliverables': ['Completed TEST-003', 'Completed TEST-004'], 'estimated_duration_hours': 40.0, 'work_items': [{'id': 'TEST-003', 'description': 'Perform integration tests for frontend and backend.', 'dependencies': ['TEST-001', 'TEST-002'], 'estimated_time': '3 days', 'agent_role': 'qa_engineer', 'acceptance_criteria': ['Tests verify the interaction between frontend and backend.', 'Tests cover key user flows.', 'Tests pass successfully.'], 'status': 'pending', 'code_files': ['integration_tests/login.spec.js', 'integration_tests/upload.spec.js']}, {'id': 'TEST-004', 'description': 'Perform user acceptance testing (UAT).', 'dependencies': ['TEST-003'], 'estimated_time': '2 days', 'agent_role': 'qa_engineer', 'acceptance_criteria': ['Authorized users test the application.', 'Feedback is collected.', 'Issues are documented and addressed.'], 'status': 'pending', 'code_files': []}]}], resource_allocation=[{'role': 'Qa Engineer', 'count': 1, 'estimated_time_allocation': '100%', 'phases': ['Qa_Engineer Phase'], 'skills_required': []}, {'role': 'Devops Engineer', 'count': 1, 'estimated_time_allocation': '100%', 'phases': ['Devops_Engineer Phase'], 'skills_required': []}, {'role': 'Backend Developer', 'count': 1, 'estimated_time_allocation': '100%', 'phases': ['Backend Phase'], 'skills_required': []}, {'role': 'Database Specialist', 'count': 1, 'estimated_time_allocation': '100%', 'phases': ['Database Phase'], 'skills_required': []}, {'role': 'Frontend Developer', 'count': 1, 'estimated_time_allocation': '100%', 'phases': ['Frontend Phase'], 'skills_required': []}], risks_and_mitigations=[], timeline={'start_date': '2025-07-08T12:47:19.391056', 'end_date': 'TBD', 'milestones': []}, tech_stack={}, metadata={'generated_at': '2025-07-08T12:47:19.391056', 'version': '1.0', 'author': 'Multi-AI Dev System', 'tags': [], 'notes': 'Converted from WorkItemBacklog. Original summary: Develop a web portal for V-KYC team leads and process managers to access and download V-KYC recordings for audit and other requirements. The portal will allow users to upload a CSV/TXT file containing LAN IDs, display results in a tabular format with pagination and search, and provide download functionality. The backend will be built using Node.js and Express, with a PostgreSQL database. The frontend will be built using React. The application will be deployed on AWS using a microservices architecture and a CI/CD pipeline.'}) summary='Develop a web portal for V-KYC team leads and process managers to access and download V-KYC recordings for audit and other requirements. The portal will allow users to upload a CSV/TXT file containing LAN IDs, display results in a tabular format with pagination and search, and provide download functionality. The backend will be built using Node.js and Express, with a PostgreSQL database. The frontend will be built using React. The application will be deployed on AWS using a microservices architecture and a CI/CD pipeline.' metadata=PlanMetadata(generated_at='2025-07-08T12:47:19.391056', version='1.0', author='Multi-AI Dev System', tags=[], notes='Converted from WorkItemBacklog. Original summary: Develop a web portal for V-KYC team leads and process managers to access and download V-KYC recordings for audit and other requirements. The portal will allow users to upload a CSV/TXT file containing LAN IDs, display results in a tabular format with pagination and search, and provide download functionality. The backend will be built using Node.js and Express, with a PostgreSQL database. The frontend will be built using React. The application will be deployed on AWS using a microservices architecture and a CI/CD pipeline.')"
  },
  "workflow_state_snapshot": {
    "requirements_analysis": {
      "project_name": "V-KYC recordings to be fetched for Audit requirements",
      "project_summary": "Develop a portal/dashboard for V-KYC team leads and process managers to access and download V-KYC recordings for audit and other requirements.",
      "project_goals": [
        "Provide easy access to V-KYC recordings for audit and internal requirements.",
        "Reduce dependency on IT data server team for retrieving recordings.",
        "Improve efficiency in accessing and downloading recordings."
      ],
      "target_audience": [
        "Team Leads (TL) of V-KYC process",
        "Process Managers of V-KYC process"
      ],
      "business_context": "The V-KYC team currently relies on the IT data server team to provide recordings, which are stored on the LTF AWS server. This process is manual and time-consuming. This project aims to streamline the process by providing a self-service portal.",
      "requirements": [
        {
          "id": "REQ-001",
          "description": "The system shall allow users to upload a CSV/TXT file containing up to 50 LAN IDs.",
          "category": "functional",
          "priority": 1
        },
        {
          "id": "REQ-002",
          "description": "The system shall trigger a backend API call to process the uploaded file.",
          "category": "functional",
          "priority": 1
        },
        {
          "id": "REQ-003",
          "description": "The system shall display the results in a tabular format with a 'Download All' option.",
          "category": "functional",
          "priority": 1
        },
        {
          "id": "REQ-004",
          "description": "The table shall have pagination to display 10 records at a time.",
          "category": "functional",
          "priority": 2
        },
        {
          "id": "REQ-005",
          "description": "The system shall allow downloading a maximum of 10 records at a time.",
          "category": "functional",
          "priority": 2
        },
        {
          "id": "REQ-006",
          "description": "The recordings shall be available date and month wise.",
          "category": "functional",
          "priority": 1
        },
        {
          "id": "REQ-007",
          "description": "The recordings shall be searchable by LAN ID.",
          "category": "functional",
          "priority": 1
        },
        {
          "id": "REQ-008",
          "description": "Access to the portal shall be restricted to Team Leads and Process Managers.",
          "category": "non_functional",
          "priority": 1
        }
      ],
      "functional_requirements": [
        "Upload CSV/TXT file with LAN IDs (max 50).",
        "Trigger backend API call to process the file.",
        "Display results in a tabular format.",
        "Provide a 'Download All' option.",
        "Implement table pagination (10 records per page).",
        "Allow downloading a maximum of 10 records at a time.",
        "Display recordings date and month wise.",
        "Enable search by LAN ID.",
        "Provide option for bulk video download."
      ],
      "non_functional_requirements": [
        "Access to the portal should be restricted to authorized users (Team Leads and Process Managers)."
      ],
      "stakeholders": [
        "Sankalp Shaswat (Prepared by)",
        "Mayur Takale (Reviewed By)",
        "Amir Khan (Reviewed By)",
        "Atul Kantak (Authorized By)",
        "Harsh Gangakhedkar (Authorized By)",
        "VKYC Team",
        "B. Ops – V-KYC Team"
      ],
      "success_criteria": [
        "V-KYC recordings are easily accessible to authorized users.",
        "Reduced dependency on the IT data server team.",
        "Improved efficiency in retrieving and downloading recordings.",
        "Compliance with audit requirements."
      ],
      "constraints": [
        "File upload limit of 50 LAN IDs.",
        "Maximum 10 records download at a time.",
        "File upload format: CSV/TXT"
      ],
      "assumptions": [
        "The backend API for processing the file upload is available.",
        "The LTF AWS server is accessible and recordings are stored correctly.",
        "The necessary infrastructure for the portal is available."
      ],
      "risks": [
        "Backend API failure.",
        "Issues with accessing the LTF AWS server.",
        "Security vulnerabilities in the portal.",
        "Performance issues with large data sets."
      ],
      "domain_specific_details": {},
      "quality_assessment": {
        "clarity_score": 7.0,
        "completeness_score": 8.0,
        "consistency_score": 8.0,
        "recommendations": [
          "Specify the backend API details (e.g., API endpoints, data formats).",
          "Define the security measures for the portal.",
          "Detail the error handling and logging mechanisms."
        ]
      },
      "gap_analysis": {
        "identified_gaps": [
          "Detailed API specifications are missing.",
          "Security requirements are not fully defined.",
          "Error handling and logging are not specified."
        ],
        "recommendations_for_completion": [
          "Provide detailed API documentation.",
          "Define security requirements (authentication, authorization, data encryption).",
          "Specify error handling and logging procedures."
        ]
      }
    },
    "tech_stack_recommendation": {
      "frontend_options": [
        {
          "name": "React",
          "language": "JavaScript",
          "reasoning": "React offers a component-based architecture, making it ideal for building interactive UIs. Its virtual DOM and efficient update mechanisms contribute to good performance.  It has a large community and extensive library support.",
          "key_libraries": [
            "React Router (for navigation)",
            "Axios (for API calls)",
            "Material-UI/Ant Design (for UI components)"
          ],
          "pros": [
            "Component-based architecture for reusability and maintainability.",
            "Large community and extensive ecosystem.",
            "Efficient updates via virtual DOM.",
            "Good performance."
          ],
          "cons": [
            "Requires understanding of JSX.",
            "Can have a steeper learning curve for beginners.",
            "Requires additional libraries for routing and state management."
          ],
          "selected": false
        },
        {
          "name": "Angular",
          "language": "TypeScript",
          "reasoning": "Angular provides a comprehensive framework with built-in features like routing, state management, and dependency injection. TypeScript offers strong typing, improving code quality and maintainability, especially for larger projects.",
          "key_libraries": [
            "Angular Material (for UI components)",
            "RxJS (for reactive programming)"
          ],
          "pros": [
            "Comprehensive framework with built-in features.",
            "Strong typing with TypeScript.",
            "Well-defined structure and organization.",
            "Good for large-scale applications."
          ],
          "cons": [
            "Steeper learning curve compared to React.",
            "Can be verbose.",
            "Larger bundle sizes."
          ],
          "selected": false
        },
        {
          "name": "Vue.js",
          "language": "JavaScript",
          "reasoning": "Vue.js is a progressive framework that's easy to learn and integrate into existing projects. It offers a flexible and performant solution for building user interfaces. It's known for its simplicity and excellent documentation.",
          "key_libraries": [
            "Vue Router (for navigation)",
            "Vuex/Pinia (for state management)",
            "Vuetify/Element UI (for UI components)"
          ],
          "pros": [
            "Easy to learn and use.",
            "Flexible and adaptable.",
            "Good performance.",
            "Excellent documentation."
          ],
          "cons": [
            "Smaller community compared to React and Angular.",
            "Ecosystem is not as mature as React or Angular."
          ],
          "selected": false
        }
      ],
      "backend_options": [
        {
          "name": "Node.js with Express",
          "language": "JavaScript",
          "reasoning": "Node.js with Express provides a lightweight, scalable, and efficient backend solution. JavaScript allows for full-stack development with a single language. Express simplifies API creation and routing.",
          "key_libraries": [
            "Express (web framework)",
            "Body-parser (for parsing request bodies)",
            "Axios (for making API calls to AWS S3)",
            "jsonwebtoken (for authentication)"
          ],
          "pros": [
            "JavaScript for full-stack development.",
            "Large community and extensive ecosystem.",
            "Fast development cycles.",
            "Good for building APIs."
          ],
          "cons": [
            "Callback hell can be an issue (can be mitigated with async/await).",
            "Requires careful error handling.",
            "Performance can be a concern for CPU-intensive tasks."
          ],
          "selected": false
        },
        {
          "name": "Python with Django/Flask",
          "language": "Python",
          "reasoning": "Python offers a clean and readable syntax. Django provides a full-featured framework for rapid development, while Flask offers more flexibility and control. Both have excellent libraries for various tasks.",
          "key_libraries": [
            "Django/Flask (web framework)",
            "Django REST Framework (for building APIs)",
            "Requests (for making API calls)",
            "psycopg2 (for PostgreSQL database interaction)"
          ],
          "pros": [
            "Clean and readable syntax.",
            "Large community and extensive libraries.",
            "Good for building APIs.",
            "Django provides a rapid development experience."
          ],
          "cons": [
            "Can be slower than Node.js for some tasks.",
            "Django can be overly opinionated.",
            "Requires understanding of Python."
          ],
          "selected": false
        },
        {
          "name": "Java with Spring Boot",
          "language": "Java",
          "reasoning": "Java is a robust and mature language. Spring Boot simplifies Java development and provides a production-ready framework. It offers excellent scalability and performance.",
          "key_libraries": [
            "Spring Boot (web framework)",
            "Spring Data JPA (for database interaction)",
            "Spring Security (for authentication and authorization)",
            "Jackson (for JSON serialization/deserialization)"
          ],
          "pros": [
            "Robust and mature language.",
            "Excellent scalability and performance.",
            "Large community and extensive libraries.",
            "Good for enterprise applications."
          ],
          "cons": [
            "Steeper learning curve.",
            "Can be verbose.",
            "Requires more resources than other options."
          ],
          "selected": false
        }
      ],
      "database_options": [
        {
          "name": "PostgreSQL",
          "language": null,
          "reasoning": "PostgreSQL is a robust, open-source relational database with excellent support for data integrity, scalability, and complex queries. It's a good choice for this project due to its reliability and ability to handle structured data.",
          "key_libraries": [
            "psycopg2 (for Python)",
            "pg (for Node.js)",
            "Spring Data JPA (for Java)"
          ],
          "pros": [
            "Robust and reliable.",
            "Supports complex queries.",
            "Good performance.",
            "Open-source and free to use."
          ],
          "cons": [
            "Can be more complex to set up and manage than simpler databases.",
            "Requires more resources than simpler databases."
          ],
          "selected": false
        },
        {
          "name": "MySQL",
          "language": null,
          "reasoning": "MySQL is a widely used relational database known for its ease of use and performance. It's a good option if simplicity and speed of development are priorities.",
          "key_libraries": [
            "mysql2 (for Node.js)",
            "mysql-connector-python (for Python)",
            "Spring Data JPA (for Java)"
          ],
          "pros": [
            "Easy to use and set up.",
            "Good performance.",
            "Large community and extensive documentation."
          ],
          "cons": [
            "Less feature-rich than PostgreSQL.",
            "Can have limitations with complex queries."
          ],
          "selected": false
        },
        {
          "name": "MongoDB",
          "language": null,
          "reasoning": "MongoDB is a NoSQL database that offers flexibility and scalability. It's suitable if the data structure is not strictly defined or if the application requires high write throughput. However, it might not be the best choice for complex relationships.",
          "key_libraries": [
            "mongoose (for Node.js)",
            "pymongo (for Python)",
            "spring-data-mongodb (for Java)"
          ],
          "pros": [
            "Flexible schema.",
            "Scalable.",
            "Good for handling unstructured data."
          ],
          "cons": [
            "Can be less performant for complex queries.",
            "Not ideal for applications with strict relational data requirements.",
            "Data consistency can be more challenging to manage."
          ],
          "selected": false
        }
      ],
      "cloud_options": [
        {
          "name": "AWS",
          "language": null,
          "reasoning": "AWS provides a comprehensive suite of services for building and deploying applications. It offers scalability, reliability, and a wide range of options for compute, storage, and databases. The existing infrastructure on LTF AWS server makes it a natural fit.",
          "key_libraries": [
            "AWS SDK (for interacting with AWS services)"
          ],
          "pros": [
            "Comprehensive services.",
            "Scalable and reliable.",
            "Mature ecosystem.",
            "Good documentation and support."
          ],
          "cons": [
            "Can be complex to manage.",
            "Cost can be a concern if not managed properly.",
            "Steeper learning curve."
          ],
          "selected": false
        },
        {
          "name": "Google Cloud Platform (GCP)",
          "language": null,
          "reasoning": "GCP offers a strong set of services with a focus on data analytics and machine learning. It's a good alternative to AWS, with competitive pricing and a user-friendly interface.",
          "key_libraries": [
            "Google Cloud Client Libraries"
          ],
          "pros": [
            "Competitive pricing.",
            "Strong in data analytics and machine learning.",
            "User-friendly interface.",
            "Good performance."
          ],
          "cons": [
            "Smaller market share than AWS.",
            "Ecosystem is not as mature as AWS.",
            "Can be complex to manage."
          ],
          "selected": false
        },
        {
          "name": "Microsoft Azure",
          "language": null,
          "reasoning": "Azure is a good choice if the organization already uses Microsoft products. It integrates well with other Microsoft services and offers a wide range of services.",
          "key_libraries": [
            "Azure SDKs"
          ],
          "pros": [
            "Good integration with Microsoft products.",
            "Wide range of services.",
            "Competitive pricing.",
            "Strong in hybrid cloud solutions."
          ],
          "cons": [
            "Can be complex to manage.",
            "Ecosystem is not as mature as AWS.",
            "Can be more expensive than AWS or GCP."
          ],
          "selected": false
        }
      ],
      "architecture_options": [
        {
          "pattern": "Microservices Architecture",
          "scalability_score": 9.0,
          "maintainability_score": 8.0,
          "development_speed_score": 7.0,
          "overall_score": 8.0,
          "reasoning": "Microservices architecture allows for independent scaling of different components, improving scalability. It also enhances maintainability by isolating concerns. Development speed can be slower initially due to the distributed nature, but it improves over time. This is a good fit for future growth and independent scaling of the portal's components."
        },
        {
          "pattern": "Monolithic Architecture",
          "scalability_score": 6.0,
          "maintainability_score": 6.0,
          "development_speed_score": 9.0,
          "overall_score": 7.0,
          "reasoning": "Monolithic architecture is faster to develop initially. However, it can become harder to scale and maintain as the application grows. This is a viable option if the project is expected to remain relatively small and the focus is on rapid development."
        },
        {
          "pattern": "Serverless Architecture",
          "scalability_score": 10.0,
          "maintainability_score": 7.0,
          "development_speed_score": 8.0,
          "overall_score": 8.0,
          "reasoning": "Serverless architecture offers excellent scalability and reduces operational overhead. It can improve maintainability by focusing on individual functions. Development speed can be fast, but debugging can be more challenging. This is a good option if the backend API can be broken down into independent functions."
        }
      ],
      "tool_options": [
        {
          "name": "Docker",
          "language": null,
          "reasoning": "Docker allows for containerization of the application, making it easier to deploy and manage. It ensures consistency across different environments.",
          "key_libraries": [
            "Docker CLI"
          ],
          "pros": [
            "Consistent deployments.",
            "Easy to manage dependencies.",
            "Scalable."
          ],
          "cons": [
            "Requires understanding of Docker.",
            "Can add complexity to the development process."
          ],
          "selected": false
        },
        {
          "name": "CI/CD Pipeline (e.g., Jenkins, GitLab CI)",
          "language": null,
          "reasoning": "A CI/CD pipeline automates the build, test, and deployment processes, improving efficiency and reducing errors.",
          "key_libraries": [
            "Jenkins, GitLab CI, or similar CI/CD tools"
          ],
          "pros": [
            "Automated builds and deployments.",
            "Faster release cycles.",
            "Reduced errors."
          ],
          "cons": [
            "Requires setup and configuration.",
            "Can be complex to manage."
          ],
          "selected": false
        },
        {
          "name": "Monitoring and Logging (e.g., Prometheus, Grafana, ELK stack)",
          "language": null,
          "reasoning": "Monitoring and logging tools are essential for tracking application performance, identifying issues, and debugging.",
          "key_libraries": [
            "Prometheus, Grafana, Elasticsearch, Logstash, Kibana (ELK stack)"
          ],
          "pros": [
            "Improved application visibility.",
            "Faster troubleshooting.",
            "Proactive issue detection."
          ],
          "cons": [
            "Requires setup and configuration.",
            "Can be complex to manage."
          ],
          "selected": false
        }
      ],
      "risks": [
        {
          "category": "Backend API Failure",
          "description": "The backend API, which is assumed to be available, may fail to process the uploaded file or retrieve recordings from the LTF AWS server.",
          "severity": "High",
          "likelihood": "Medium",
          "mitigation": "Implement robust error handling, logging, and monitoring for the backend API. Include retry mechanisms and circuit breakers to handle temporary failures. Ensure the API has proper authentication and authorization."
        },
        {
          "category": "LTF AWS Server Access Issues",
          "description": "The portal may encounter issues accessing the LTF AWS server where the recordings are stored. This could be due to network problems, incorrect credentials, or server downtime.",
          "severity": "High",
          "likelihood": "Medium",
          "mitigation": "Implement proper authentication and authorization to access the AWS server. Implement error handling and retry mechanisms. Monitor the connection to the AWS server and alert administrators of any issues. Ensure the application uses the correct AWS region and credentials."
        },
        {
          "category": "Security Vulnerabilities",
          "description": "The portal may be vulnerable to security threats, such as SQL injection, cross-site scripting (XSS), and unauthorized access.",
          "severity": "High",
          "likelihood": "Medium",
          "mitigation": "Implement robust security measures, including input validation, output encoding, and secure authentication and authorization. Use HTTPS for all communication. Regularly scan the application for vulnerabilities and apply security patches. Implement rate limiting to prevent brute-force attacks."
        },
        {
          "category": "Performance Issues",
          "description": "The portal may experience performance issues, especially when handling large files or a large number of recordings.",
          "severity": "Medium",
          "likelihood": "Medium",
          "mitigation": "Optimize database queries and use pagination to display results efficiently. Implement caching to reduce the load on the backend. Use asynchronous processing for file uploads and downloads. Monitor application performance and identify bottlenecks."
        },
        {
          "category": "Data Privacy Concerns",
          "description": "The portal needs to comply with data privacy regulations and ensure the security of the V-KYC recordings.",
          "severity": "High",
          "likelihood": "Medium",
          "mitigation": "Implement encryption for data at rest and in transit. Restrict access to recordings based on user roles and permissions. Implement audit trails to track access to recordings. Comply with relevant data privacy regulations (e.g., GDPR, CCPA)."
        }
      ],
      "synthesis": {
        "backend": {
          "language": "JavaScript",
          "framework": "Node.js with Express",
          "reasoning": "Node.js with Express provides a lightweight, scalable, and efficient backend solution. JavaScript allows for full-stack development with a single language. Express simplifies API creation and routing."
        },
        "frontend": {
          "language": "JavaScript",
          "framework": "React",
          "reasoning": "React is chosen for its component-based architecture, large community, and efficient update mechanisms. It's well-suited for building interactive UIs and offers good performance."
        },
        "database": {
          "type": "PostgreSQL",
          "reasoning": "PostgreSQL is a robust, open-source relational database with excellent support for data integrity, scalability, and complex queries. It's a good choice for this project due to its reliability and ability to handle structured data."
        },
        "architecture_pattern": "Microservices Architecture",
        "deployment_environment": {
          "cloud_platform": "AWS",
          "reasoning": "AWS provides a comprehensive suite of services for building and deploying applications. It offers scalability, reliability, and a wide range of options for compute, storage, and databases. The existing infrastructure on LTF AWS server makes it a natural fit."
        },
        "key_libraries_tools": [
          {
            "name": "React Router",
            "purpose": "For navigation in the React frontend."
          },
          {
            "name": "Axios",
            "purpose": "For making API calls from the frontend."
          },
          {
            "name": "Material-UI/Ant Design",
            "purpose": "For UI components in the React frontend."
          },
          {
            "name": "Express",
            "purpose": "For building the backend API with Node.js."
          },
          {
            "name": "Body-parser",
            "purpose": "For parsing request bodies in the Node.js backend."
          },
          {
            "name": "jsonwebtoken",
            "purpose": "For authentication in the Node.js backend."
          },
          {
            "name": "PostgreSQL",
            "purpose": "For storing data."
          },
          {
            "name": "AWS SDK",
            "purpose": "For interacting with AWS services."
          },
          {
            "name": "Docker",
            "purpose": "For containerizing the application."
          },
          {
            "name": "CI/CD Pipeline (e.g., Jenkins, GitLab CI)",
            "purpose": "For automating the build, test, and deployment processes."
          },
          {
            "name": "Monitoring and Logging (e.g., Prometheus, Grafana, ELK stack)",
            "purpose": "For tracking application performance, identifying issues, and debugging."
          }
        ],
        "estimated_complexity": "Medium"
      },
      "selected_stack": null
    },
    "system_design": {
      "architecture": {
        "pattern": "Microservices Architecture",
        "justification": "Microservices architecture allows for independent scaling of different components, improving scalability. It also enhances maintainability by isolating concerns. This is a good fit for future growth and independent scaling of the portal's components.",
        "key_benefits": [
          "Independent scaling of components.",
          "Improved maintainability.",
          "Technology diversity (if needed in the future).",
          "Faster development cycles for individual services."
        ],
        "potential_drawbacks": [
          "Increased complexity in initial setup and deployment.",
          "Requires more sophisticated inter-service communication.",
          "Distributed tracing and monitoring are essential."
        ]
      },
      "components": [
        {
          "name": "Frontend - V-KYC Portal",
          "description": "The user interface for uploading files, viewing results, and downloading recordings.",
          "category": "frontend",
          "technologies": [
            "React",
            "JavaScript",
            "React Router",
            "Axios",
            "Material-UI/Ant Design"
          ],
          "dependencies": [
            "Backend - API Gateway",
            "Authentication Service"
          ],
          "responsibilities": [
            "User authentication and authorization.",
            "File upload and validation.",
            "Displaying search results in a tabular format with pagination.",
            "Handling user interactions (e.g., download requests).",
            "Making API calls to the backend."
          ],
          "design_patterns": [
            "Component-based architecture",
            "Single Page Application (SPA)"
          ]
        },
        {
          "name": "Backend - API Gateway",
          "description": "The entry point for all API requests, responsible for routing, authentication, and authorization.",
          "category": "backend",
          "technologies": [
            "Node.js",
            "Express",
            "JavaScript",
            "Body-parser",
            "jsonwebtoken"
          ],
          "dependencies": [
            "Authentication Service",
            "Recording Service",
            "File Processing Service"
          ],
          "responsibilities": [
            "Routing API requests to the appropriate microservices.",
            "Authenticating and authorizing users.",
            "Handling file uploads and validation.",
            "Implementing rate limiting.",
            "Logging and error handling."
          ],
          "design_patterns": [
            "API Gateway pattern",
            "RESTful API design"
          ]
        },
        {
          "name": "Authentication Service",
          "description": "Handles user authentication and authorization.",
          "category": "backend",
          "technologies": [
            "Node.js",
            "Express",
            "JavaScript",
            "jsonwebtoken"
          ],
          "dependencies": [
            "Database - PostgreSQL"
          ],
          "responsibilities": [
            "User registration and login.",
            "Generating and validating JWT tokens.",
            "Managing user roles and permissions.",
            "Providing authentication endpoints."
          ],
          "design_patterns": [
            "JWT authentication"
          ]
        },
        {
          "name": "File Processing Service",
          "description": "Processes uploaded CSV/TXT files containing LAN IDs.",
          "category": "backend",
          "technologies": [
            "Node.js",
            "Express",
            "JavaScript"
          ],
          "dependencies": [
            "Recording Service",
            "API Gateway"
          ],
          "responsibilities": [
            "Validating the uploaded file format and content.",
            "Parsing the file and extracting LAN IDs.",
            "Calling the Recording Service to retrieve recording details.",
            "Returning the results to the API Gateway."
          ],
          "design_patterns": [
            "Asynchronous processing (e.g., using queues)"
          ]
        },
        {
          "name": "Recording Service",
          "description": "Retrieves recording details from the LTF AWS server.",
          "category": "backend",
          "technologies": [
            "Node.js",
            "Express",
            "JavaScript",
            "AWS SDK"
          ],
          "dependencies": [
            "Database - PostgreSQL",
            "File Processing Service"
          ],
          "responsibilities": [
            "Connecting to the LTF AWS server.",
            "Retrieving recording metadata based on LAN IDs and date/month.",
            "Storing recording metadata in the database (e.g., file name, size, download URL).",
            "Providing API endpoints for retrieving recording details."
          ],
          "design_patterns": [
            "Repository pattern (for data access)"
          ]
        },
        {
          "name": "Database - PostgreSQL",
          "description": "Stores user information, recording metadata, and other relevant data.",
          "category": "backend",
          "technologies": [
            "PostgreSQL"
          ],
          "dependencies": [],
          "responsibilities": [
            "Storing user credentials (hashed passwords).",
            "Storing recording metadata (file name, size, download URL, LAN ID, date, month).",
            "Providing efficient data retrieval and querying.",
            "Ensuring data integrity."
          ],
          "design_patterns": [
            "Relational database design"
          ]
        },
        {
          "name": "Deployment & Infrastructure",
          "description": "The infrastructure and processes for deploying and managing the application.",
          "category": "infrastructure",
          "technologies": [
            "AWS",
            "Docker",
            "CI/CD Pipeline (e.g., Jenkins, GitLab CI)",
            "Monitoring and Logging (e.g., Prometheus, Grafana, ELK stack)"
          ],
          "dependencies": [
            "All other components"
          ],
          "responsibilities": [
            "Deploying and managing the application on AWS.",
            "Containerizing the application using Docker.",
            "Automating the build, test, and deployment processes using a CI/CD pipeline.",
            "Monitoring application performance and health.",
            "Collecting and analyzing logs."
          ],
          "design_patterns": [
            "Infrastructure as Code (IaC)",
            "Containerization"
          ]
        }
      ],
      "data_model": {
        "schema_type": "relational",
        "tables": [
          {
            "name": "users",
            "purpose": "Stores user account information.",
            "fields": [
              {
                "name": "id",
                "type": "SERIAL",
                "constraints": [
                  "PRIMARY KEY"
                ],
                "description": "Unique user identifier."
              },
              {
                "name": "username",
                "type": "VARCHAR(255)",
                "constraints": [
                  "NOT NULL",
                  "UNIQUE"
                ],
                "description": "User's login username."
              },
              {
                "name": "password_hash",
                "type": "VARCHAR(255)",
                "constraints": [
                  "NOT NULL"
                ],
                "description": "Hashed user password."
              },
              {
                "name": "role",
                "type": "VARCHAR(50)",
                "constraints": [
                  "NOT NULL"
                ],
                "description": "User's role (e.g., 'team_lead', 'process_manager')."
              }
            ],
            "relationships": []
          },
          {
            "name": "recordings",
            "purpose": "Stores metadata about the V-KYC recordings.",
            "fields": [
              {
                "name": "id",
                "type": "SERIAL",
                "constraints": [
                  "PRIMARY KEY"
                ],
                "description": "Unique recording identifier."
              },
              {
                "name": "lan_id",
                "type": "VARCHAR(255)",
                "constraints": [
                  "NOT NULL"
                ],
                "description": "The LAN ID associated with the recording."
              },
              {
                "name": "file_name",
                "type": "VARCHAR(255)",
                "constraints": [
                  "NOT NULL"
                ],
                "description": "The name of the recording file on the AWS server."
              },
              {
                "name": "file_size",
                "type": "BIGINT",
                "constraints": [],
                "description": "The size of the recording file in bytes."
              },
              {
                "name": "download_url",
                "type": "VARCHAR(255)",
                "constraints": [
                  "NOT NULL"
                ],
                "description": "The URL to download the recording from the AWS server."
              },
              {
                "name": "recording_date",
                "type": "DATE",
                "constraints": [
                  "NOT NULL"
                ],
                "description": "The date of the recording."
              },
              {
                "name": "recording_month",
                "type": "INTEGER",
                "constraints": [
                  "NOT NULL"
                ],
                "description": "The month of the recording."
              },
              {
                "name": "created_at",
                "type": "TIMESTAMP",
                "constraints": [
                  "NOT NULL",
                  "DEFAULT CURRENT_TIMESTAMP"
                ],
                "description": "Timestamp of when the recording metadata was added."
              }
            ],
            "relationships": []
          }
        ],
        "relationships": [
          {
            "from_table": "users",
            "to_table": "recordings",
            "relationship_type": "one-to-many",
            "description": "A user can upload multiple files, each potentially containing multiple recordings."
          }
        ],
        "justification": "Relational database provides a structured and reliable way to store and manage user data and recording metadata. PostgreSQL is chosen for its robustness and support for complex queries."
      },
      "api_endpoints": {
        "style": "REST",
        "base_url": "/api/v1",
        "authentication": "JWT",
        "endpoints": [
          {
            "method": "POST",
            "path": "/auth/login",
            "purpose": "Authenticates a user and returns a JWT.",
            "parameters": [
              {
                "username": "string",
                "description": "User's username"
              },
              {
                "password": "string",
                "description": "User's password"
              }
            ],
            "response": {
              "token": "string",
              "description": "JWT for authentication"
            },
            "authentication_required": false,
            "rate_limiting_applied": true
          },
          {
            "method": "POST",
            "path": "/recordings/upload",
            "purpose": "Uploads a CSV/TXT file containing LAN IDs and triggers processing.",
            "parameters": [
              {
                "file": "file",
                "description": "CSV/TXT file containing LAN IDs (max 50)."
              }
            ],
            "response": {
              "status": "string",
              "message": "string",
              "job_id": "string",
              "description": "Job ID for tracking the file processing."
            },
            "authentication_required": true,
            "rate_limiting_applied": true
          },
          {
            "method": "GET",
            "path": "/recordings",
            "purpose": "Retrieves recording details based on search criteria.",
            "parameters": [
              {
                "lan_id": "string",
                "description": "LAN ID to search for."
              },
              {
                "page": "integer",
                "description": "Page number for pagination (default 1)."
              },
              {
                "page_size": "integer",
                "description": "Number of records per page (default 10)."
              },
              {
                "recording_date": "date",
                "description": "Date of the recording (YYYY-MM-DD)."
              },
              {
                "recording_month": "integer",
                "description": "Month of the recording (1-12)."
              }
            ],
            "response": {
              "total_records": "integer",
              "page": "integer",
              "page_size": "integer",
              "recordings": [
                {
                  "lan_id": "string",
                  "file_name": "string",
                  "file_size": "integer",
                  "download_url": "string",
                  "recording_date": "date"
                }
              ],
              "description": "List of recording details."
            },
            "authentication_required": true,
            "rate_limiting_applied": true
          },
          {
            "method": "GET",
            "path": "/recordings/download",
            "purpose": "Downloads recordings based on provided criteria.",
            "parameters": [
              {
                "lan_ids": "array of strings",
                "description": "List of LAN IDs to download recordings for (max 10)."
              }
            ],
            "response": {
              "file": "zip file",
              "description": "Zip file containing the recordings."
            },
            "authentication_required": true,
            "rate_limiting_applied": true
          }
        ],
        "error_handling": "Centralized error handling with consistent error responses including error codes, messages, and details.",
        "rate_limiting_strategy": "Token Bucket algorithm applied to all authenticated endpoints."
      },
      "security": {
        "authentication_method": "JWT",
        "authorization_strategy": "RBAC (Role-Based Access Control)",
        "data_encryption": {
          "at_rest": "AES-256 encryption for sensitive data in the database.",
          "in_transit": "HTTPS/TLS for all communication."
        },
        "security_measures": [
          {
            "category": "Authentication",
            "implementation": "Implement JWT authentication with secure token storage (e.g., HTTP-only cookies).",
            "mitigation": "Unauthorized access.",
            "priority": "High"
          },
          {
            "category": "Authorization",
            "implementation": "Implement RBAC to restrict access to resources based on user roles (Team Lead, Process Manager).",
            "mitigation": "Unauthorized access to sensitive data and functionality.",
            "priority": "High"
          },
          {
            "category": "Input Validation",
            "implementation": "Validate all user inputs (file uploads, search parameters) to prevent injection attacks.",
            "mitigation": "SQL injection, XSS, and other injection attacks.",
            "priority": "High"
          },
          {
            "category": "Output Encoding",
            "implementation": "Encode all output data to prevent XSS attacks.",
            "mitigation": "XSS attacks.",
            "priority": "High"
          },
          {
            "category": "Data Encryption",
            "implementation": "Encrypt sensitive data at rest (e.g., passwords, recording metadata) and in transit (HTTPS).",
            "mitigation": "Data breaches and unauthorized access to sensitive information.",
            "priority": "High"
          },
          {
            "category": "Rate Limiting",
            "implementation": "Implement rate limiting on API endpoints to prevent brute-force attacks and abuse.",
            "mitigation": "DoS attacks and abuse of the API.",
            "priority": "Medium"
          },
          {
            "category": "Logging and Monitoring",
            "implementation": "Implement comprehensive logging and monitoring to detect and respond to security incidents.",
            "mitigation": "Security breaches and unauthorized access.",
            "priority": "High"
          },
          {
            "category": "Vulnerability Scanning",
            "implementation": "Regularly scan the application for vulnerabilities and apply security patches.",
            "mitigation": "Security vulnerabilities.",
            "priority": "High"
          }
        ],
        "vulnerability_mitigation_strategies": [
          "Input validation and sanitization.",
          "Output encoding.",
          "Use of parameterized queries.",
          "Regular security audits and penetration testing.",
          "Keeping dependencies up-to-date."
        ],
        "compliance_standards": [
          "Data privacy regulations (e.g., GDPR, CCPA)."
        ]
      },
      "scalability_and_performance": {
        "database_optimization": "Use indexing on frequently queried columns (e.g., lan_id, recording_date).",
        "caching": "Implement caching for frequently accessed data (e.g., recording metadata).",
        "asynchronous_processing": "Use message queues (e.g., RabbitMQ, Kafka) for asynchronous file processing and downloads.",
        "load_balancing": "Use load balancing to distribute traffic across multiple instances of the backend API.",
        "horizontal_scaling": "Design the system to be horizontally scalable to handle increased load.",
        "cdn": "Consider using a CDN for serving static assets (e.g., frontend files)."
      },
      "deployment_strategy": {
        "environment": "AWS",
        "infrastructure_as_code": "Use tools like Terraform or AWS CloudFormation to define and manage the infrastructure.",
        "containerization": "Use Docker to containerize the application and deploy it to AWS ECS or EKS.",
        "ci_cd_pipeline": "Implement a CI/CD pipeline to automate the build, test, and deployment processes.",
        "monitoring_and_alerting": "Implement monitoring and alerting using AWS CloudWatch or a similar service.",
        "blue_green_deployment": "Consider using blue/green deployment strategy for zero-downtime deployments."
      },
      "monitoring_and_logging": {
        "logging_strategy": "Centralized logging using a logging aggregation service (e.g., ELK stack, Splunk).",
        "metrics": "Collect metrics on application performance, resource utilization, and error rates.",
        "monitoring_tools": "Use monitoring tools like Prometheus and Grafana to visualize metrics and set up alerts.",
        "health_checks": "Implement health checks for all services to monitor their availability."
      },
      "error_handling_strategy": "Centralized error handling with consistent error responses including error codes, messages, and details. Implement retry mechanisms and circuit breakers to handle temporary failures. Log all errors with relevant context.",
      "development_phases_overview": [
        {
          "name": "Phase 1: Requirements Gathering and Design",
          "description": "Finalize requirements, design the system architecture, and create the data model.",
          "priority": "High",
          "dependencies": [],
          "tasks": [
            "Refine the BRD and gather detailed requirements.",
            "Design the system architecture and component interactions.",
            "Design the database schema.",
            "Define API endpoints and data formats.",
            "Create a detailed project plan."
          ],
          "estimated_duration": "2 weeks"
        },
        {
          "name": "Phase 2: Frontend Development",
          "description": "Develop the user interface for the V-KYC portal.",
          "priority": "High",
          "dependencies": [
            "Phase 1: Requirements Gathering and Design"
          ],
          "tasks": [
            "Develop the React frontend.",
            "Implement user authentication and authorization.",
            "Implement file upload and validation.",
            "Implement search functionality and pagination.",
            "Implement the download functionality.",
            "Test the frontend thoroughly."
          ],
          "estimated_duration": "4 weeks"
        },
        {
          "name": "Phase 3: Backend Development and API Integration",
          "description": "Develop the backend API and integrate it with the frontend and AWS services.",
          "priority": "High",
          "dependencies": [
            "Phase 1: Requirements Gathering and Design"
          ],
          "tasks": [
            "Develop the Node.js backend with Express.",
            "Implement user authentication and authorization using JWT.",
            "Implement the file processing service.",
            "Implement the recording service to interact with AWS S3.",
            "Implement the database interactions.",
            "Develop the API endpoints.",
            "Test the backend thoroughly."
          ],
          "estimated_duration": "6 weeks"
        },
        {
          "name": "Phase 4: Database Setup and Integration",
          "description": "Set up the PostgreSQL database and integrate it with the backend.",
          "priority": "High",
          "dependencies": [
            "Phase 1: Requirements Gathering and Design",
            "Phase 3: Backend Development and API Integration"
          ],
          "tasks": [
            "Set up the PostgreSQL database.",
            "Create the database schema.",
            "Implement database interactions in the backend.",
            "Test database connectivity and functionality."
          ],
          "estimated_duration": "1 week"
        },
        {
          "name": "Phase 5: Deployment and Testing",
          "description": "Deploy the application to AWS and perform thorough testing.",
          "priority": "High",
          "dependencies": [
            "Phase 2: Frontend Development",
            "Phase 3: Backend Development and API Integration",
            "Phase 4: Database Setup and Integration"
          ],
          "tasks": [
            "Set up the AWS infrastructure (EC2 instances, database, etc.).",
            "Configure the CI/CD pipeline.",
            "Deploy the application to AWS.",
            "Perform integration testing.",
            "Perform user acceptance testing (UAT).",
            "Address any issues identified during testing."
          ],
          "estimated_duration": "3 weeks"
        },
        {
          "name": "Phase 6: Monitoring and Maintenance",
          "description": "Monitor the application, address any issues, and provide ongoing maintenance.",
          "priority": "High",
          "dependencies": [
            "Phase 5: Deployment and Testing"
          ],
          "tasks": [
            "Set up monitoring and logging.",
            "Monitor application performance and health.",
            "Address any issues or bugs.",
            "Provide ongoing maintenance and updates."
          ],
          "estimated_duration": "Ongoing"
        }
      ],
      "key_risks": [
        "Backend API Failure: The backend API, which is assumed to be available, may fail to process the uploaded file or retrieve recordings from the LTF AWS server.",
        "LTF AWS Server Access Issues: The portal may encounter issues accessing the LTF AWS server where the recordings are stored. This could be due to network problems, incorrect credentials, or server downtime.",
        "Security Vulnerabilities: The portal may be vulnerable to security threats, such as SQL injection, cross-site scripting (XSS), and unauthorized access.",
        "Performance Issues: The portal may experience performance issues, especially when handling large files or a large number of recordings.",
        "Data Privacy Concerns: The portal needs to comply with data privacy regulations and ensure the security of the V-KYC recordings."
      ],
      "design_justification": "The chosen design leverages a microservices architecture for scalability and maintainability. React is selected for the frontend due to its component-based architecture and large community support. Node.js with Express is chosen for the backend for its efficiency and ease of development. PostgreSQL is used for the database due to its robustness and support for complex queries. AWS is selected for deployment due to its comprehensive services and existing infrastructure. This design addresses the project goals by providing easy access to recordings, reducing dependency on the IT team, and improving efficiency. Security is a primary concern, and robust measures are implemented to protect sensitive data and prevent unauthorized access.",
      "data_flow": "1. User uploads a CSV/TXT file containing LAN IDs via the React frontend. 2. The frontend sends the file to the API Gateway. 3. The API Gateway authenticates and authorizes the user. 4. The API Gateway routes the request to the File Processing Service. 5. The File Processing Service validates and parses the file, extracting LAN IDs. 6. The File Processing Service calls the Recording Service, passing the LAN IDs. 7. The Recording Service retrieves recording metadata from the LTF AWS server. 8. The Recording Service stores recording metadata in the PostgreSQL database. 9. The Recording Service returns the recording details to the File Processing Service. 10. The File Processing Service returns the results to the API Gateway. 11. The API Gateway returns the results to the React frontend for display. 12. User can then download recordings via the frontend, which triggers a download request to the API Gateway. 13. The API Gateway calls the Recording Service to retrieve the recordings from AWS S3 and zips them. 14. The API Gateway streams the zip file to the user."
    },
    "implementation_plan": "plan=ImplementationPlan(project_summary={'title': 'Generated Project Plan', 'description': 'Develop a web portal for V-KYC team leads and process managers to access and download V-KYC recordings for audit and other requirements. The portal will allow users to upload a CSV/TXT file containing LAN IDs, display results in a tabular format with pagination and search, and provide download functionality. The backend will be built using Node.js and Express, with a PostgreSQL database. The frontend will be built using React. The application will be deployed on AWS using a microservices architecture and a CI/CD pipeline.', 'overall_complexity': 'Medium', 'estimated_duration': 'TBD', 'key_challenges': [], 'success_criteria': []}, phases=[{'name': 'Frontend Phase', 'description': 'Tasks related to frontend phase', 'deliverables': ['Completed FE-001', 'Completed FE-002', 'Completed FE-003', 'Completed FE-004', 'Completed FE-005', 'Completed FE-006', 'Completed FE-007', 'Completed FE-008', 'Completed FE-009', 'Completed FE-010', 'Completed FE-011', 'Completed FE-012', 'Completed TEST-001'], 'estimated_duration_hours': 136.0, 'work_items': [{'id': 'FE-001', 'description': 'Set up React project with necessary dependencies (React Router, Axios, Material-UI/Ant Design).', 'dependencies': [], 'estimated_time': '1 day', 'agent_role': 'frontend_developer', 'acceptance_criteria': ['Project initializes successfully.', 'Dependencies are installed.', 'Basic project structure is in place.'], 'status': 'pending', 'code_files': ['package.json', 'src/App.js', 'src/index.js']}, {'id': 'FE-002', 'description': 'Implement user authentication and login form in React.', 'dependencies': ['FE-001'], 'estimated_time': '2 days', 'agent_role': 'frontend_developer', 'acceptance_criteria': ['Login form renders correctly.', 'Username and password fields are present.', 'Login button is functional.', 'Form validation is implemented (client-side).'], 'status': 'pending', 'code_files': ['src/components/Login.js', 'src/App.js', 'src/services/authService.js']}, {'id': 'FE-003', 'description': 'Implement user registration form in React.', 'dependencies': ['FE-001'], 'estimated_time': '2 days', 'agent_role': 'frontend_developer', 'acceptance_criteria': ['Registration form renders correctly.', 'Username and password fields are present.', 'Registration button is functional.', 'Form validation is implemented (client-side).'], 'status': 'pending', 'code_files': ['src/components/Register.js', 'src/App.js', 'src/services/authService.js']}, {'id': 'FE-004', 'description': 'Implement authentication service (API calls for login/register) using Axios.', 'dependencies': ['FE-002', 'FE-003'], 'estimated_time': '1 day', 'agent_role': 'frontend_developer', 'acceptance_criteria': ['Login API call is made correctly.', 'Registration API call is made correctly.', 'Error handling for API calls is implemented.', 'JWT token is stored securely (e.g., in HTTP-only cookie).'], 'status': 'pending', 'code_files': ['src/services/authService.js', 'src/utils/api.js']}, {'id': 'FE-005', 'description': 'Implement protected routes and redirect unauthorized users.', 'dependencies': ['FE-004'], 'estimated_time': '1 day', 'agent_role': 'frontend_developer', 'acceptance_criteria': ['Protected routes are accessible only to authenticated users.', 'Unauthorized users are redirected to the login page.', 'User role-based access control is implemented.'], 'status': 'pending', 'code_files': ['src/components/PrivateRoute.js', 'src/App.js']}, {'id': 'FE-006', 'description': 'Create a file upload component.', 'dependencies': ['FE-001'], 'estimated_time': '1 day', 'agent_role': 'frontend_developer', 'acceptance_criteria': ['File upload component renders correctly.', 'User can select a file.', 'File type validation is implemented (CSV/TXT).', 'File size validation is implemented.'], 'status': 'pending', 'code_files': ['src/components/FileUpload.js']}, {'id': 'FE-007', 'description': 'Implement API call to upload file and display results.', 'dependencies': ['FE-006', 'FE-004'], 'estimated_time': '2 days', 'agent_role': 'frontend_developer', 'acceptance_criteria': ['File upload API call is made correctly.', 'Loading indicator is displayed during upload.', 'Results are displayed in a tabular format.', 'Error handling for API calls is implemented.'], 'status': 'pending', 'code_files': ['src/components/FileUpload.js', 'src/services/apiService.js']}, {'id': 'FE-008', 'description': 'Implement table pagination.', 'dependencies': ['FE-007'], 'estimated_time': '1 day', 'agent_role': 'frontend_developer', 'acceptance_criteria': ['Pagination controls are displayed.', 'Records are displayed in pages of 10.', 'Pagination works correctly (navigates between pages).'], 'status': 'pending', 'code_files': ['src/components/RecordingTable.js']}, {'id': 'FE-009', 'description': 'Implement search functionality by LAN ID.', 'dependencies': ['FE-007'], 'estimated_time': '1 day', 'agent_role': 'frontend_developer', 'acceptance_criteria': ['Search input field is displayed.', 'Search results are filtered correctly based on LAN ID.', 'Search results update dynamically.'], 'status': 'pending', 'code_files': ['src/components/RecordingTable.js']}, {'id': 'FE-010', 'description': 'Implement download functionality for individual recordings.', 'dependencies': ['FE-007'], 'estimated_time': '1 day', 'agent_role': 'frontend_developer', 'acceptance_criteria': ['Download button is displayed for each recording.', 'Download API call is made correctly.', 'Recording is downloaded successfully.'], 'status': 'pending', 'code_files': ['src/components/RecordingTable.js', 'src/services/apiService.js']}, {'id': 'FE-011', 'description': \"Implement 'Download All' functionality.\", 'dependencies': ['FE-007'], 'estimated_time': '1 day', 'agent_role': 'frontend_developer', 'acceptance_criteria': [\"'Download All' button is displayed.\", 'Download API call is made correctly.', 'All selected recordings are downloaded successfully (max 10).', 'Loading indicator is displayed during download.'], 'status': 'pending', 'code_files': ['src/components/RecordingTable.js', 'src/services/apiService.js']}, {'id': 'FE-012', 'description': 'Implement date and month wise filtering.', 'dependencies': ['FE-007'], 'estimated_time': '1 day', 'agent_role': 'frontend_developer', 'acceptance_criteria': ['Date and month filter controls are displayed.', 'Results are filtered correctly based on date and month.', 'Filter results update dynamically.'], 'status': 'pending', 'code_files': ['src/components/RecordingTable.js']}, {'id': 'TEST-001', 'description': 'Write unit tests for frontend components.', 'dependencies': ['FE-001', 'FE-002', 'FE-006'], 'estimated_time': '2 days', 'agent_role': 'frontend_developer', 'acceptance_criteria': ['Tests cover key functionality of components.', 'Tests pass successfully.', 'Test coverage meets the defined criteria.'], 'status': 'pending', 'code_files': ['src/components/__tests__/Login.test.js', 'src/components/__tests__/FileUpload.test.js']}]}, {'name': 'Backend Phase', 'description': 'Tasks related to backend phase', 'deliverables': ['Completed BE-001', 'Completed BE-002', 'Completed BE-003', 'Completed BE-004', 'Completed BE-005', 'Completed BE-006', 'Completed BE-007', 'Completed BE-008', 'Completed BE-009', 'Completed BE-010', 'Completed TEST-002', 'Completed SEC-001', 'Completed SEC-002', 'Completed SEC-003', 'Completed DOC-001'], 'estimated_duration_hours': 216.0, 'work_items': [{'id': 'BE-001', 'description': 'Set up Node.js project with Express and necessary dependencies (body-parser, jsonwebtoken).', 'dependencies': [], 'estimated_time': '1 day', 'agent_role': 'backend_developer', 'acceptance_criteria': ['Project initializes successfully.', 'Dependencies are installed.', 'Basic project structure is in place.', 'Express server starts successfully.'], 'status': 'pending', 'code_files': ['package.json', 'index.js', 'routes/index.js']}, {'id': 'BE-002', 'description': 'Implement user authentication endpoints (login, register) using JWT.', 'dependencies': ['BE-001'], 'estimated_time': '2 days', 'agent_role': 'backend_developer', 'acceptance_criteria': ['Login endpoint authenticates users and returns a JWT.', 'Register endpoint creates new users.', 'Password hashing is implemented.', 'Error handling for authentication is implemented.'], 'status': 'pending', 'code_files': ['routes/auth.js', 'controllers/authController.js', 'models/user.js']}, {'id': 'BE-003', 'description': 'Implement JWT middleware for authentication.', 'dependencies': ['BE-002'], 'estimated_time': '1 day', 'agent_role': 'backend_developer', 'acceptance_criteria': ['JWT middleware verifies tokens.', 'Protected routes require valid JWTs.', 'Unauthorized requests are rejected.'], 'status': 'pending', 'code_files': ['middleware/authMiddleware.js']}, {'id': 'BE-004', 'description': 'Implement API endpoint for file upload.', 'dependencies': ['BE-003'], 'estimated_time': '2 days', 'agent_role': 'backend_developer', 'acceptance_criteria': ['File upload endpoint receives the file.', 'File type validation (CSV/TXT) is implemented.', 'File size validation is implemented.', 'File is saved temporarily (e.g., in a temp directory).', 'Returns a job ID for tracking.'], 'status': 'pending', 'code_files': ['routes/recordings.js', 'controllers/recordingsController.js']}, {'id': 'BE-005', 'description': 'Implement file processing logic (parse CSV/TXT, extract LAN IDs).', 'dependencies': ['BE-004'], 'estimated_time': '2 days', 'agent_role': 'backend_developer', 'acceptance_criteria': ['File is parsed correctly.', 'LAN IDs are extracted.', 'Error handling for file parsing is implemented.'], 'status': 'pending', 'code_files': ['services/fileProcessingService.js']}, {'id': 'BE-006', 'description': 'Implement API call to Recording Service to fetch recording details.', 'dependencies': ['BE-005'], 'estimated_time': '2 days', 'agent_role': 'backend_developer', 'acceptance_criteria': ['API call to Recording Service is made correctly.', 'Recording details are retrieved based on LAN IDs.', 'Error handling for API calls is implemented.'], 'status': 'pending', 'code_files': ['services/recordingService.js']}, {'id': 'BE-007', 'description': 'Implement API endpoint to retrieve recording details (with pagination and search).', 'dependencies': ['BE-006', 'BE-003'], 'estimated_time': '3 days', 'agent_role': 'backend_developer', 'acceptance_criteria': ['Endpoint retrieves recording details.', 'Pagination is implemented.', 'Search by LAN ID is implemented.', 'Date and month filtering is implemented.', 'Error handling is implemented.'], 'status': 'pending', 'code_files': ['routes/recordings.js', 'controllers/recordingsController.js']}, {'id': 'BE-008', 'description': 'Implement API endpoint to download recordings (zip file).', 'dependencies': ['BE-007', 'BE-003'], 'estimated_time': '3 days', 'agent_role': 'backend_developer', 'acceptance_criteria': ['Endpoint receives a list of LAN IDs.', 'Recordings are retrieved from AWS S3.', 'Recordings are zipped.', 'Zip file is streamed to the client.', 'Error handling is implemented.'], 'status': 'pending', 'code_files': ['routes/recordings.js', 'controllers/recordingsController.js', 'services/awsService.js']}, {'id': 'BE-009', 'description': 'Implement database connection and setup (PostgreSQL).', 'dependencies': [], 'estimated_time': '1 day', 'agent_role': 'backend_developer', 'acceptance_criteria': ['Database connection is established.', 'Database schema is defined (users, recordings).', 'Database migrations are implemented (if applicable).'], 'status': 'pending', 'code_files': ['config/database.js', 'models/user.js', 'models/recording.js']}, {'id': 'BE-010', 'description': 'Implement data access layer for user and recording data.', 'dependencies': ['BE-009'], 'estimated_time': '2 days', 'agent_role': 'backend_developer', 'acceptance_criteria': ['User data can be saved and retrieved.', 'Recording metadata can be saved and retrieved.', 'Data access methods are implemented (CRUD operations).'], 'status': 'pending', 'code_files': ['repositories/userRepository.js', 'repositories/recordingRepository.js']}, {'id': 'TEST-002', 'description': 'Write unit tests for backend API endpoints.', 'dependencies': ['BE-001', 'BE-002', 'BE-004'], 'estimated_time': '3 days', 'agent_role': 'backend_developer', 'acceptance_criteria': ['Tests cover key functionality of API endpoints.', 'Tests pass successfully.', 'Test coverage meets the defined criteria.'], 'status': 'pending', 'code_files': ['tests/auth.test.js', 'tests/recordings.test.js']}, {'id': 'SEC-001', 'description': 'Implement input validation and sanitization on the backend.', 'dependencies': ['BE-004', 'BE-007'], 'estimated_time': '1 day', 'agent_role': 'backend_developer', 'acceptance_criteria': ['All user inputs are validated.', 'Invalid inputs are rejected.', 'Input sanitization is implemented to prevent injection attacks.'], 'status': 'pending', 'code_files': ['controllers/recordingsController.js', 'services/fileProcessingService.js']}, {'id': 'SEC-002', 'description': 'Implement output encoding on the backend.', 'dependencies': ['BE-007'], 'estimated_time': '1 day', 'agent_role': 'backend_developer', 'acceptance_criteria': ['All output data is encoded.', 'XSS vulnerabilities are mitigated.'], 'status': 'pending', 'code_files': ['controllers/recordingsController.js']}, {'id': 'SEC-003', 'description': 'Implement rate limiting on API endpoints.', 'dependencies': ['BE-004', 'BE-007'], 'estimated_time': '1 day', 'agent_role': 'backend_developer', 'acceptance_criteria': ['Rate limiting is implemented on all authenticated endpoints.', 'Brute-force attacks are prevented.', 'API abuse is mitigated.'], 'status': 'pending', 'code_files': ['middleware/rateLimitMiddleware.js']}, {'id': 'DOC-001', 'description': 'Create API documentation (e.g., using Swagger/OpenAPI).', 'dependencies': ['BE-007'], 'estimated_time': '2 days', 'agent_role': 'backend_developer', 'acceptance_criteria': ['API documentation is generated.', 'Documentation is up-to-date.', 'Documentation is accessible.'], 'status': 'pending', 'code_files': ['swagger.yaml']}]}, {'name': 'Database Phase', 'description': 'Tasks related to database phase', 'deliverables': ['Completed DB-001'], 'estimated_duration_hours': 8.0, 'work_items': [{'id': 'DB-001', 'description': 'Create database schema for users and recordings tables in PostgreSQL.', 'dependencies': [], 'estimated_time': '1 day', 'agent_role': 'database_specialist', 'acceptance_criteria': ['Users table created with required fields (id, username, password_hash, role).', 'Recordings table created with required fields (id, lan_id, file_name, file_size, download_url, recording_date, recording_month, created_at).', 'Indexes are created for optimized queries (e.g., lan_id, recording_date).'], 'status': 'pending', 'code_files': ['database/schema.sql']}]}, {'name': 'Devops_Engineer Phase', 'description': 'Tasks related to devops_engineer phase', 'deliverables': ['Completed INF-001', 'Completed INF-002', 'Completed INF-003', 'Completed DEPLOY-001', 'Completed DEPLOY-002'], 'estimated_duration_hours': 64.0, 'work_items': [{'id': 'INF-001', 'description': 'Set up AWS infrastructure (EC2 instance, database, S3 bucket).', 'dependencies': [], 'estimated_time': '2 days', 'agent_role': 'devops_engineer', 'acceptance_criteria': ['EC2 instance is created and configured.', 'PostgreSQL database is created and accessible.', 'S3 bucket is created for storing recordings.', 'Security groups are configured to allow necessary traffic.'], 'status': 'pending', 'code_files': ['terraform/main.tf', 'terraform/variables.tf']}, {'id': 'INF-002', 'description': 'Configure CI/CD pipeline (e.g., Jenkins, GitLab CI) for automated deployments.', 'dependencies': ['INF-001', 'BE-001', 'FE-001'], 'estimated_time': '2 days', 'agent_role': 'devops_engineer', 'acceptance_criteria': ['Pipeline is configured to build and deploy the frontend.', 'Pipeline is configured to build and deploy the backend.', 'Automated testing is integrated into the pipeline.', 'Deployments are automated to the AWS environment.'], 'status': 'pending', 'code_files': ['.gitlab-ci.yml', 'Jenkinsfile']}, {'id': 'INF-003', 'description': 'Implement monitoring and logging (e.g., Prometheus, Grafana, ELK stack).', 'dependencies': ['INF-001', 'BE-001', 'FE-001'], 'estimated_time': '2 days', 'agent_role': 'devops_engineer', 'acceptance_criteria': ['Monitoring tools are set up and configured.', 'Application metrics are collected.', 'Logs are collected and aggregated.', 'Alerts are configured for critical events.'], 'status': 'pending', 'code_files': ['docker-compose.yml', 'prometheus.yml', 'grafana/dashboards']}, {'id': 'DEPLOY-001', 'description': 'Deploy the application to the AWS environment.', 'dependencies': ['INF-002', 'TEST-003'], 'estimated_time': '1 day', 'agent_role': 'devops_engineer', 'acceptance_criteria': ['Frontend is deployed.', 'Backend is deployed.', 'Database is accessible.', 'Application is accessible via a public URL.'], 'status': 'pending', 'code_files': []}, {'id': 'DEPLOY-002', 'description': 'Configure monitoring and alerting.', 'dependencies': ['INF-003', 'DEPLOY-001'], 'estimated_time': '1 day', 'agent_role': 'devops_engineer', 'acceptance_criteria': ['Monitoring dashboards are configured.', 'Alerts are configured for critical events.', 'Alerts are tested and working.'], 'status': 'pending', 'code_files': []}]}, {'name': 'Qa_Engineer Phase', 'description': 'Tasks related to qa_engineer phase', 'deliverables': ['Completed TEST-003', 'Completed TEST-004'], 'estimated_duration_hours': 40.0, 'work_items': [{'id': 'TEST-003', 'description': 'Perform integration tests for frontend and backend.', 'dependencies': ['TEST-001', 'TEST-002'], 'estimated_time': '3 days', 'agent_role': 'qa_engineer', 'acceptance_criteria': ['Tests verify the interaction between frontend and backend.', 'Tests cover key user flows.', 'Tests pass successfully.'], 'status': 'pending', 'code_files': ['integration_tests/login.spec.js', 'integration_tests/upload.spec.js']}, {'id': 'TEST-004', 'description': 'Perform user acceptance testing (UAT).', 'dependencies': ['TEST-003'], 'estimated_time': '2 days', 'agent_role': 'qa_engineer', 'acceptance_criteria': ['Authorized users test the application.', 'Feedback is collected.', 'Issues are documented and addressed.'], 'status': 'pending', 'code_files': []}]}], resource_allocation=[{'role': 'Qa Engineer', 'count': 1, 'estimated_time_allocation': '100%', 'phases': ['Qa_Engineer Phase'], 'skills_required': []}, {'role': 'Devops Engineer', 'count': 1, 'estimated_time_allocation': '100%', 'phases': ['Devops_Engineer Phase'], 'skills_required': []}, {'role': 'Backend Developer', 'count': 1, 'estimated_time_allocation': '100%', 'phases': ['Backend Phase'], 'skills_required': []}, {'role': 'Database Specialist', 'count': 1, 'estimated_time_allocation': '100%', 'phases': ['Database Phase'], 'skills_required': []}, {'role': 'Frontend Developer', 'count': 1, 'estimated_time_allocation': '100%', 'phases': ['Frontend Phase'], 'skills_required': []}], risks_and_mitigations=[], timeline={'start_date': '2025-07-08T12:47:19.391056', 'end_date': 'TBD', 'milestones': []}, tech_stack={}, metadata={'generated_at': '2025-07-08T12:47:19.391056', 'version': '1.0', 'author': 'Multi-AI Dev System', 'tags': [], 'notes': 'Converted from WorkItemBacklog. Original summary: Develop a web portal for V-KYC team leads and process managers to access and download V-KYC recordings for audit and other requirements. The portal will allow users to upload a CSV/TXT file containing LAN IDs, display results in a tabular format with pagination and search, and provide download functionality. The backend will be built using Node.js and Express, with a PostgreSQL database. The frontend will be built using React. The application will be deployed on AWS using a microservices architecture and a CI/CD pipeline.'}) summary='Develop a web portal for V-KYC team leads and process managers to access and download V-KYC recordings for audit and other requirements. The portal will allow users to upload a CSV/TXT file containing LAN IDs, display results in a tabular format with pagination and search, and provide download functionality. The backend will be built using Node.js and Express, with a PostgreSQL database. The frontend will be built using React. The application will be deployed on AWS using a microservices architecture and a CI/CD pipeline.' metadata=PlanMetadata(generated_at='2025-07-08T12:47:19.391056', version='1.0', author='Multi-AI Dev System', tags=[], notes='Converted from WorkItemBacklog. Original summary: Develop a web portal for V-KYC team leads and process managers to access and download V-KYC recordings for audit and other requirements. The portal will allow users to upload a CSV/TXT file containing LAN IDs, display results in a tabular format with pagination and search, and provide download functionality. The backend will be built using Node.js and Express, with a PostgreSQL database. The frontend will be built using React. The application will be deployed on AWS using a microservices architecture and a CI/CD pipeline.')"
  }
}