{
  "session_id": "session_6f484374-d561-4aeb-a20f-59ef8b856ffe",
  "approval_type": "implementation_plan",
  "timestamp": 1751972484,
  "approval_data": {
    "type": "implementation_plan",
    "timestamp": 1751972484.2900283,
    "project_overview": "Develop a simple web application for managing a list of tasks, including adding and viewing tasks. The application will use React for the frontend, Node.js/Express for the backend, MongoDB for the database, and Heroku for deployment.",
    "development_phases": [
      {
        "name": "Frontend Phase",
        "description": "Tasks related to frontend phase",
        "deliverables": [
          "Completed FE-001",
          "Completed FE-002",
          "Completed FE-003",
          "Completed FE-004",
          "Completed FE-005",
          "Completed FE-006",
          "Completed FE-007",
          "Completed FE-008",
          "Completed FE-009",
          "Completed FE-010",
          "Completed TEST-001"
        ],
        "estimated_duration_hours": 58.0,
        "work_items": [
          {
            "id": "FE-001",
            "description": "Set up React project with Create React App.",
            "dependencies": [],
            "estimated_time": "4 hours",
            "agent_role": "frontend_developer",
            "acceptance_criteria": [
              "Project is initialized using Create React App.",
              "Project runs without errors.",
              "Basic project structure is in place."
            ],
            "status": "pending",
            "code_files": [
              "package.json",
              "src/App.js",
              "src/index.js"
            ]
          },
          {
            "id": "FE-002",
            "description": "Install and configure React Router for navigation.",
            "dependencies": [
              "FE-001"
            ],
            "estimated_time": "2 hours",
            "agent_role": "frontend_developer",
            "acceptance_criteria": [
              "React Router is installed.",
              "Basic routing setup is functional (e.g., a route for the task list).",
              "Navigation links are present."
            ],
            "status": "pending",
            "code_files": [
              "src/App.js"
            ]
          },
          {
            "id": "FE-003",
            "description": "Design and implement the UI for adding a new task (form).",
            "dependencies": [
              "FE-001"
            ],
            "estimated_time": "8 hours",
            "agent_role": "frontend_developer",
            "acceptance_criteria": [
              "A form is displayed for entering task description.",
              "Form includes a text input field for the task description.",
              "Form includes a submit button.",
              "UI is visually appealing and user-friendly (consider using a UI library like Material UI or Bootstrap)."
            ],
            "status": "pending",
            "code_files": [
              "src/components/TaskForm.js",
              "src/App.js"
            ]
          },
          {
            "id": "FE-004",
            "description": "Design and implement the UI for displaying the task list.",
            "dependencies": [
              "FE-001"
            ],
            "estimated_time": "8 hours",
            "agent_role": "frontend_developer",
            "acceptance_criteria": [
              "A list is displayed to show the tasks.",
              "Each task displays its description.",
              "UI is visually appealing and user-friendly (consider using a UI library like Material UI or Bootstrap)."
            ],
            "status": "pending",
            "code_files": [
              "src/components/TaskList.js",
              "src/App.js"
            ]
          },
          {
            "id": "FE-005",
            "description": "Implement the functionality to add a new task (frontend).",
            "dependencies": [
              "FE-003"
            ],
            "estimated_time": "8 hours",
            "agent_role": "frontend_developer",
            "acceptance_criteria": [
              "The form submits the task description.",
              "The task description is stored in the component's state (or a state management solution).",
              "The task list is updated to reflect the new task (without API calls yet)."
            ],
            "status": "pending",
            "code_files": [
              "src/components/TaskForm.js",
              "src/App.js"
            ]
          },
          {
            "id": "FE-006",
            "description": "Implement the functionality to display the list of tasks (frontend).",
            "dependencies": [
              "FE-004",
              "FE-005"
            ],
            "estimated_time": "4 hours",
            "agent_role": "frontend_developer",
            "acceptance_criteria": [
              "The task list displays the tasks stored in the component's state.",
              "Tasks are displayed in a clear and readable format."
            ],
            "status": "pending",
            "code_files": [
              "src/components/TaskList.js",
              "src/App.js"
            ]
          },
          {
            "id": "FE-007",
            "description": "Install Axios and configure API calls to the backend.",
            "dependencies": [
              "FE-001"
            ],
            "estimated_time": "4 hours",
            "agent_role": "frontend_developer",
            "acceptance_criteria": [
              "Axios is installed.",
              "Base URL for the API is configured.",
              "API calls are made to the backend for creating and retrieving tasks (using the correct HTTP methods and endpoints).",
              "Error handling for API calls is implemented (e.g., displaying error messages to the user)."
            ],
            "status": "pending",
            "code_files": [
              "src/App.js",
              "src/components/TaskForm.js",
              "src/components/TaskList.js"
            ]
          },
          {
            "id": "FE-008",
            "description": "Connect the frontend to the backend API for adding tasks.",
            "dependencies": [
              "FE-005",
              "FE-007",
              "BE-003"
            ],
            "estimated_time": "4 hours",
            "agent_role": "frontend_developer",
            "acceptance_criteria": [
              "The frontend sends a POST request to the /api/tasks endpoint when the form is submitted.",
              "The frontend receives a success response from the backend.",
              "The frontend updates the task list with the newly created task (after receiving the response from the backend)."
            ],
            "status": "pending",
            "code_files": [
              "src/components/TaskForm.js",
              "src/App.js"
            ]
          },
          {
            "id": "FE-009",
            "description": "Connect the frontend to the backend API for displaying tasks.",
            "dependencies": [
              "FE-006",
              "FE-007",
              "BE-004"
            ],
            "estimated_time": "4 hours",
            "agent_role": "frontend_developer",
            "acceptance_criteria": [
              "The frontend makes a GET request to the /api/tasks endpoint when the component mounts (or on a refresh).",
              "The frontend receives a list of tasks from the backend.",
              "The frontend displays the tasks in the task list."
            ],
            "status": "pending",
            "code_files": [
              "src/components/TaskList.js",
              "src/App.js"
            ]
          },
          {
            "id": "FE-010",
            "description": "Implement basic error handling on the frontend.",
            "dependencies": [
              "FE-007",
              "FE-008",
              "FE-009"
            ],
            "estimated_time": "4 hours",
            "agent_role": "frontend_developer",
            "acceptance_criteria": [
              "Error messages are displayed to the user if API calls fail.",
              "Error messages are clear and informative."
            ],
            "status": "pending",
            "code_files": [
              "src/App.js",
              "src/components/TaskForm.js",
              "src/components/TaskList.js"
            ]
          },
          {
            "id": "TEST-001",
            "description": "Write unit tests for the frontend components.",
            "dependencies": [
              "FE-001",
              "FE-003",
              "FE-004",
              "FE-005",
              "FE-006",
              "FE-007",
              "FE-008",
              "FE-009"
            ],
            "estimated_time": "8 hours",
            "agent_role": "frontend_developer",
            "acceptance_criteria": [
              "Unit tests are written for the TaskForm and TaskList components.",
              "Tests cover the key functionalities of the components (e.g., form submission, displaying tasks).",
              "Tests use a testing library (e.g., Jest, React Testing Library).",
              "Tests pass."
            ],
            "status": "pending",
            "code_files": [
              "src/components/TaskForm.test.js",
              "src/components/TaskList.test.js"
            ]
          }
        ]
      },
      {
        "name": "Backend Phase",
        "description": "Tasks related to backend phase",
        "deliverables": [
          "Completed BE-001",
          "Completed BE-002",
          "Completed BE-003",
          "Completed BE-004",
          "Completed BE-005",
          "Completed BE-006",
          "Completed BE-007",
          "Completed TEST-002",
          "Completed DEPLOY-001"
        ],
        "estimated_duration_hours": 52.0,
        "work_items": [
          {
            "id": "BE-001",
            "description": "Set up Node.js and Express project.",
            "dependencies": [],
            "estimated_time": "4 hours",
            "agent_role": "backend_developer",
            "acceptance_criteria": [
              "Project is initialized with npm (or yarn).",
              "Express is installed.",
              "Basic project structure is in place (e.g., server.js, routes folder).",
              "Server runs without errors and responds to a basic route (e.g., /)."
            ],
            "status": "pending",
            "code_files": [
              "package.json",
              "server.js",
              "routes/tasks.js"
            ]
          },
          {
            "id": "BE-002",
            "description": "Install and configure MongoDB and Mongoose.",
            "dependencies": [
              "BE-001"
            ],
            "estimated_time": "4 hours",
            "agent_role": "backend_developer",
            "acceptance_criteria": [
              "MongoDB is installed (or a cloud instance is accessible).",
              "Mongoose is installed.",
              "Connection to the MongoDB database is established.",
              "A basic schema for tasks is defined (description, created_at, completed)."
            ],
            "status": "pending",
            "code_files": [
              "server.js",
              "models/Task.js"
            ]
          },
          {
            "id": "BE-003",
            "description": "Implement API endpoint for creating a new task (POST /api/tasks).",
            "dependencies": [
              "BE-001",
              "BE-002"
            ],
            "estimated_time": "8 hours",
            "agent_role": "backend_developer",
            "acceptance_criteria": [
              "Endpoint handles POST requests to /api/tasks.",
              "Endpoint receives the task description from the request body.",
              "Endpoint validates the input (description is not empty).",
              "Endpoint saves the task to the database using Mongoose.",
              "Endpoint returns a 201 Created status code with the created task in the response.",
              "Endpoint returns a 400 Bad Request status code if input validation fails."
            ],
            "status": "pending",
            "code_files": [
              "routes/tasks.js",
              "models/Task.js"
            ]
          },
          {
            "id": "BE-004",
            "description": "Implement API endpoint for getting all tasks (GET /api/tasks).",
            "dependencies": [
              "BE-001",
              "BE-002"
            ],
            "estimated_time": "4 hours",
            "agent_role": "backend_developer",
            "acceptance_criteria": [
              "Endpoint handles GET requests to /api/tasks.",
              "Endpoint retrieves all tasks from the database using Mongoose.",
              "Endpoint returns a 200 OK status code with the list of tasks in the response."
            ],
            "status": "pending",
            "code_files": [
              "routes/tasks.js",
              "models/Task.js"
            ]
          },
          {
            "id": "BE-005",
            "description": "Implement API endpoint for getting a specific task by ID (GET /api/tasks/:id).",
            "dependencies": [
              "BE-001",
              "BE-002"
            ],
            "estimated_time": "4 hours",
            "agent_role": "backend_developer",
            "acceptance_criteria": [
              "Endpoint handles GET requests to /api/tasks/:id.",
              "Endpoint retrieves the task ID from the request parameters.",
              "Endpoint retrieves the task from the database using Mongoose.",
              "Endpoint returns a 200 OK status code with the task in the response if found.",
              "Endpoint returns a 404 Not Found status code if the task is not found."
            ],
            "status": "pending",
            "code_files": [
              "routes/tasks.js",
              "models/Task.js"
            ]
          },
          {
            "id": "BE-006",
            "description": "Implement API endpoint for updating a specific task by ID (PUT /api/tasks/:id).",
            "dependencies": [
              "BE-001",
              "BE-002"
            ],
            "estimated_time": "8 hours",
            "agent_role": "backend_developer",
            "acceptance_criteria": [
              "Endpoint handles PUT requests to /api/tasks/:id.",
              "Endpoint retrieves the task ID from the request parameters.",
              "Endpoint retrieves the updated task data from the request body (description, completed).",
              "Endpoint validates the input.",
              "Endpoint updates the task in the database using Mongoose.",
              "Endpoint returns a 200 OK status code with the updated task in the response if successful.",
              "Endpoint returns a 400 Bad Request status code if input validation fails.",
              "Endpoint returns a 404 Not Found status code if the task is not found."
            ],
            "status": "pending",
            "code_files": [
              "routes/tasks.js",
              "models/Task.js"
            ]
          },
          {
            "id": "BE-007",
            "description": "Implement API endpoint for deleting a specific task by ID (DELETE /api/tasks/:id).",
            "dependencies": [
              "BE-001",
              "BE-002"
            ],
            "estimated_time": "4 hours",
            "agent_role": "backend_developer",
            "acceptance_criteria": [
              "Endpoint handles DELETE requests to /api/tasks/:id.",
              "Endpoint retrieves the task ID from the request parameters.",
              "Endpoint deletes the task from the database using Mongoose.",
              "Endpoint returns a 200 OK status code if successful.",
              "Endpoint returns a 404 Not Found status code if the task is not found."
            ],
            "status": "pending",
            "code_files": [
              "routes/tasks.js",
              "models/Task.js"
            ]
          },
          {
            "id": "TEST-002",
            "description": "Write unit tests for the backend API endpoints.",
            "dependencies": [
              "BE-001",
              "BE-003",
              "BE-004",
              "BE-005",
              "BE-006",
              "BE-007"
            ],
            "estimated_time": "8 hours",
            "agent_role": "backend_developer",
            "acceptance_criteria": [
              "Unit tests are written for the API endpoints (POST, GET, PUT, DELETE).",
              "Tests cover the key functionalities of the endpoints (e.g., creating, retrieving, updating, and deleting tasks).",
              "Tests use a testing library (e.g., Jest, Mocha, Chai).",
              "Tests pass."
            ],
            "status": "pending",
            "code_files": [
              "tests/tasks.test.js"
            ]
          },
          {
            "id": "DEPLOY-001",
            "description": "Deploy the application to Heroku.",
            "dependencies": [
              "FE-001",
              "FE-002",
              "FE-003",
              "FE-004",
              "FE-005",
              "FE-006",
              "FE-007",
              "FE-008",
              "FE-009",
              "BE-001",
              "BE-002",
              "BE-003",
              "BE-004",
              "BE-005",
              "BE-006",
              "BE-007"
            ],
            "estimated_time": "8 hours",
            "agent_role": "backend_developer",
            "acceptance_criteria": [
              "A Heroku account is created.",
              "The Heroku CLI is installed.",
              "A Heroku app is created.",
              "The application is deployed to Heroku using Git.",
              "The MongoDB add-on is configured on Heroku.",
              "Environment variables (e.g., database connection string) are set on Heroku.",
              "The application is accessible via a Heroku URL."
            ],
            "status": "pending",
            "code_files": [
              "Procfile"
            ]
          }
        ]
      },
      {
        "name": "Stakeholder Phase",
        "description": "Tasks related to stakeholder phase",
        "deliverables": [
          "Completed POST-DEPLOY-001"
        ],
        "estimated_duration_hours": 4.0,
        "work_items": [
          {
            "id": "POST-DEPLOY-001",
            "description": "Perform User Acceptance Testing (UAT).",
            "dependencies": [
              "DEPLOY-001"
            ],
            "estimated_time": "4 hours",
            "agent_role": "stakeholder",
            "acceptance_criteria": [
              "Users can successfully add tasks.",
              "Users can successfully view their task list.",
              "The application loads quickly.",
              "The application is secure (HTTPS is enforced).",
              "All functional requirements are met."
            ],
            "status": "pending",
            "code_files": []
          }
        ]
      },
      {
        "name": "Developer Phase",
        "description": "Tasks related to developer phase",
        "deliverables": [
          "Completed POST-DEPLOY-002",
          "Completed POST-DEPLOY-003"
        ],
        "estimated_duration_hours": 16.0,
        "work_items": [
          {
            "id": "POST-DEPLOY-002",
            "description": "Address any bugs or issues found during testing.",
            "dependencies": [
              "POST-DEPLOY-001"
            ],
            "estimated_time": "8 hours",
            "agent_role": "developer",
            "acceptance_criteria": [
              "All identified bugs are fixed.",
              "The application functions as expected."
            ],
            "status": "pending",
            "code_files": [
              "src/*",
              "server.js",
              "routes/*",
              "models/*"
            ]
          },
          {
            "id": "POST-DEPLOY-003",
            "description": "Implement any requested improvements.",
            "dependencies": [
              "POST-DEPLOY-001"
            ],
            "estimated_time": "8 hours",
            "agent_role": "developer",
            "acceptance_criteria": [
              "All requested improvements are implemented.",
              "The application functions as expected."
            ],
            "status": "pending",
            "code_files": [
              "src/*",
              "server.js",
              "routes/*",
              "models/*"
            ]
          }
        ]
      }
    ],
    "timeline_estimation": {
      "start_date": "2025-07-08T16:31:23.238782",
      "end_date": "TBD",
      "milestones": []
    },
    "risk_assessment": [],
    "resource_requirements": [
      {
        "role": "Developer",
        "count": 1,
        "estimated_time_allocation": "100%",
        "phases": [
          "Developer Phase"
        ],
        "skills_required": []
      },
      {
        "role": "Frontend Developer",
        "count": 1,
        "estimated_time_allocation": "100%",
        "phases": [
          "Frontend Phase"
        ],
        "skills_required": []
      },
      {
        "role": "Backend Developer",
        "count": 1,
        "estimated_time_allocation": "100%",
        "phases": [
          "Backend Phase"
        ],
        "skills_required": []
      },
      {
        "role": "Stakeholder",
        "count": 1,
        "estimated_time_allocation": "100%",
        "phases": [
          "Stakeholder Phase"
        ],
        "skills_required": []
      }
    ],
    "deliverables": [
      "Completed FE-001",
      "Completed FE-002",
      "Completed FE-003",
      "Completed FE-004",
      "Completed FE-005",
      "Completed FE-006",
      "Completed FE-007",
      "Completed FE-008",
      "Completed FE-009",
      "Completed FE-010",
      "Completed TEST-001",
      "Completed BE-001",
      "Completed BE-002",
      "Completed BE-003",
      "Completed BE-004",
      "Completed BE-005",
      "Completed BE-006",
      "Completed BE-007",
      "Completed TEST-002",
      "Completed DEPLOY-001",
      "Completed POST-DEPLOY-001",
      "Completed POST-DEPLOY-002",
      "Completed POST-DEPLOY-003"
    ],
    "dependencies": [],
    "raw_plan": "plan=ImplementationPlan(project_summary={'title': 'Generated Project Plan', 'description': 'Develop a simple web application for managing a list of tasks, including adding and viewing tasks. The application will use React for the frontend, Node.js/Express for the backend, MongoDB for the database, and Heroku for deployment.', 'overall_complexity': 'Medium', 'estimated_duration': 'TBD', 'key_challenges': [], 'success_criteria': []}, phases=[{'name': 'Frontend Phase', 'description': 'Tasks related to frontend phase', 'deliverables': ['Completed FE-001', 'Completed FE-002', 'Completed FE-003', 'Completed FE-004', 'Completed FE-005', 'Completed FE-006', 'Completed FE-007', 'Completed FE-008', 'Completed FE-009', 'Completed FE-010', 'Completed TEST-001'], 'estimated_duration_hours': 58.0, 'work_items': [{'id': 'FE-001', 'description': 'Set up React project with Create React App.', 'dependencies': [], 'estimated_time': '4 hours', 'agent_role': 'frontend_developer', 'acceptance_criteria': ['Project is initialized using Create React App.', 'Project runs without errors.', 'Basic project structure is in place.'], 'status': 'pending', 'code_files': ['package.json', 'src/App.js', 'src/index.js']}, {'id': 'FE-002', 'description': 'Install and configure React Router for navigation.', 'dependencies': ['FE-001'], 'estimated_time': '2 hours', 'agent_role': 'frontend_developer', 'acceptance_criteria': ['React Router is installed.', 'Basic routing setup is functional (e.g., a route for the task list).', 'Navigation links are present.'], 'status': 'pending', 'code_files': ['src/App.js']}, {'id': 'FE-003', 'description': 'Design and implement the UI for adding a new task (form).', 'dependencies': ['FE-001'], 'estimated_time': '8 hours', 'agent_role': 'frontend_developer', 'acceptance_criteria': ['A form is displayed for entering task description.', 'Form includes a text input field for the task description.', 'Form includes a submit button.', 'UI is visually appealing and user-friendly (consider using a UI library like Material UI or Bootstrap).'], 'status': 'pending', 'code_files': ['src/components/TaskForm.js', 'src/App.js']}, {'id': 'FE-004', 'description': 'Design and implement the UI for displaying the task list.', 'dependencies': ['FE-001'], 'estimated_time': '8 hours', 'agent_role': 'frontend_developer', 'acceptance_criteria': ['A list is displayed to show the tasks.', 'Each task displays its description.', 'UI is visually appealing and user-friendly (consider using a UI library like Material UI or Bootstrap).'], 'status': 'pending', 'code_files': ['src/components/TaskList.js', 'src/App.js']}, {'id': 'FE-005', 'description': 'Implement the functionality to add a new task (frontend).', 'dependencies': ['FE-003'], 'estimated_time': '8 hours', 'agent_role': 'frontend_developer', 'acceptance_criteria': ['The form submits the task description.', \"The task description is stored in the component's state (or a state management solution).\", 'The task list is updated to reflect the new task (without API calls yet).'], 'status': 'pending', 'code_files': ['src/components/TaskForm.js', 'src/App.js']}, {'id': 'FE-006', 'description': 'Implement the functionality to display the list of tasks (frontend).', 'dependencies': ['FE-004', 'FE-005'], 'estimated_time': '4 hours', 'agent_role': 'frontend_developer', 'acceptance_criteria': [\"The task list displays the tasks stored in the component's state.\", 'Tasks are displayed in a clear and readable format.'], 'status': 'pending', 'code_files': ['src/components/TaskList.js', 'src/App.js']}, {'id': 'FE-007', 'description': 'Install Axios and configure API calls to the backend.', 'dependencies': ['FE-001'], 'estimated_time': '4 hours', 'agent_role': 'frontend_developer', 'acceptance_criteria': ['Axios is installed.', 'Base URL for the API is configured.', 'API calls are made to the backend for creating and retrieving tasks (using the correct HTTP methods and endpoints).', 'Error handling for API calls is implemented (e.g., displaying error messages to the user).'], 'status': 'pending', 'code_files': ['src/App.js', 'src/components/TaskForm.js', 'src/components/TaskList.js']}, {'id': 'FE-008', 'description': 'Connect the frontend to the backend API for adding tasks.', 'dependencies': ['FE-005', 'FE-007', 'BE-003'], 'estimated_time': '4 hours', 'agent_role': 'frontend_developer', 'acceptance_criteria': ['The frontend sends a POST request to the /api/tasks endpoint when the form is submitted.', 'The frontend receives a success response from the backend.', 'The frontend updates the task list with the newly created task (after receiving the response from the backend).'], 'status': 'pending', 'code_files': ['src/components/TaskForm.js', 'src/App.js']}, {'id': 'FE-009', 'description': 'Connect the frontend to the backend API for displaying tasks.', 'dependencies': ['FE-006', 'FE-007', 'BE-004'], 'estimated_time': '4 hours', 'agent_role': 'frontend_developer', 'acceptance_criteria': ['The frontend makes a GET request to the /api/tasks endpoint when the component mounts (or on a refresh).', 'The frontend receives a list of tasks from the backend.', 'The frontend displays the tasks in the task list.'], 'status': 'pending', 'code_files': ['src/components/TaskList.js', 'src/App.js']}, {'id': 'FE-010', 'description': 'Implement basic error handling on the frontend.', 'dependencies': ['FE-007', 'FE-008', 'FE-009'], 'estimated_time': '4 hours', 'agent_role': 'frontend_developer', 'acceptance_criteria': ['Error messages are displayed to the user if API calls fail.', 'Error messages are clear and informative.'], 'status': 'pending', 'code_files': ['src/App.js', 'src/components/TaskForm.js', 'src/components/TaskList.js']}, {'id': 'TEST-001', 'description': 'Write unit tests for the frontend components.', 'dependencies': ['FE-001', 'FE-003', 'FE-004', 'FE-005', 'FE-006', 'FE-007', 'FE-008', 'FE-009'], 'estimated_time': '8 hours', 'agent_role': 'frontend_developer', 'acceptance_criteria': ['Unit tests are written for the TaskForm and TaskList components.', 'Tests cover the key functionalities of the components (e.g., form submission, displaying tasks).', 'Tests use a testing library (e.g., Jest, React Testing Library).', 'Tests pass.'], 'status': 'pending', 'code_files': ['src/components/TaskForm.test.js', 'src/components/TaskList.test.js']}]}, {'name': 'Backend Phase', 'description': 'Tasks related to backend phase', 'deliverables': ['Completed BE-001', 'Completed BE-002', 'Completed BE-003', 'Completed BE-004', 'Completed BE-005', 'Completed BE-006', 'Completed BE-007', 'Completed TEST-002', 'Completed DEPLOY-001'], 'estimated_duration_hours': 52.0, 'work_items': [{'id': 'BE-001', 'description': 'Set up Node.js and Express project.', 'dependencies': [], 'estimated_time': '4 hours', 'agent_role': 'backend_developer', 'acceptance_criteria': ['Project is initialized with npm (or yarn).', 'Express is installed.', 'Basic project structure is in place (e.g., server.js, routes folder).', 'Server runs without errors and responds to a basic route (e.g., /).'], 'status': 'pending', 'code_files': ['package.json', 'server.js', 'routes/tasks.js']}, {'id': 'BE-002', 'description': 'Install and configure MongoDB and Mongoose.', 'dependencies': ['BE-001'], 'estimated_time': '4 hours', 'agent_role': 'backend_developer', 'acceptance_criteria': ['MongoDB is installed (or a cloud instance is accessible).', 'Mongoose is installed.', 'Connection to the MongoDB database is established.', 'A basic schema for tasks is defined (description, created_at, completed).'], 'status': 'pending', 'code_files': ['server.js', 'models/Task.js']}, {'id': 'BE-003', 'description': 'Implement API endpoint for creating a new task (POST /api/tasks).', 'dependencies': ['BE-001', 'BE-002'], 'estimated_time': '8 hours', 'agent_role': 'backend_developer', 'acceptance_criteria': ['Endpoint handles POST requests to /api/tasks.', 'Endpoint receives the task description from the request body.', 'Endpoint validates the input (description is not empty).', 'Endpoint saves the task to the database using Mongoose.', 'Endpoint returns a 201 Created status code with the created task in the response.', 'Endpoint returns a 400 Bad Request status code if input validation fails.'], 'status': 'pending', 'code_files': ['routes/tasks.js', 'models/Task.js']}, {'id': 'BE-004', 'description': 'Implement API endpoint for getting all tasks (GET /api/tasks).', 'dependencies': ['BE-001', 'BE-002'], 'estimated_time': '4 hours', 'agent_role': 'backend_developer', 'acceptance_criteria': ['Endpoint handles GET requests to /api/tasks.', 'Endpoint retrieves all tasks from the database using Mongoose.', 'Endpoint returns a 200 OK status code with the list of tasks in the response.'], 'status': 'pending', 'code_files': ['routes/tasks.js', 'models/Task.js']}, {'id': 'BE-005', 'description': 'Implement API endpoint for getting a specific task by ID (GET /api/tasks/:id).', 'dependencies': ['BE-001', 'BE-002'], 'estimated_time': '4 hours', 'agent_role': 'backend_developer', 'acceptance_criteria': ['Endpoint handles GET requests to /api/tasks/:id.', 'Endpoint retrieves the task ID from the request parameters.', 'Endpoint retrieves the task from the database using Mongoose.', 'Endpoint returns a 200 OK status code with the task in the response if found.', 'Endpoint returns a 404 Not Found status code if the task is not found.'], 'status': 'pending', 'code_files': ['routes/tasks.js', 'models/Task.js']}, {'id': 'BE-006', 'description': 'Implement API endpoint for updating a specific task by ID (PUT /api/tasks/:id).', 'dependencies': ['BE-001', 'BE-002'], 'estimated_time': '8 hours', 'agent_role': 'backend_developer', 'acceptance_criteria': ['Endpoint handles PUT requests to /api/tasks/:id.', 'Endpoint retrieves the task ID from the request parameters.', 'Endpoint retrieves the updated task data from the request body (description, completed).', 'Endpoint validates the input.', 'Endpoint updates the task in the database using Mongoose.', 'Endpoint returns a 200 OK status code with the updated task in the response if successful.', 'Endpoint returns a 400 Bad Request status code if input validation fails.', 'Endpoint returns a 404 Not Found status code if the task is not found.'], 'status': 'pending', 'code_files': ['routes/tasks.js', 'models/Task.js']}, {'id': 'BE-007', 'description': 'Implement API endpoint for deleting a specific task by ID (DELETE /api/tasks/:id).', 'dependencies': ['BE-001', 'BE-002'], 'estimated_time': '4 hours', 'agent_role': 'backend_developer', 'acceptance_criteria': ['Endpoint handles DELETE requests to /api/tasks/:id.', 'Endpoint retrieves the task ID from the request parameters.', 'Endpoint deletes the task from the database using Mongoose.', 'Endpoint returns a 200 OK status code if successful.', 'Endpoint returns a 404 Not Found status code if the task is not found.'], 'status': 'pending', 'code_files': ['routes/tasks.js', 'models/Task.js']}, {'id': 'TEST-002', 'description': 'Write unit tests for the backend API endpoints.', 'dependencies': ['BE-001', 'BE-003', 'BE-004', 'BE-005', 'BE-006', 'BE-007'], 'estimated_time': '8 hours', 'agent_role': 'backend_developer', 'acceptance_criteria': ['Unit tests are written for the API endpoints (POST, GET, PUT, DELETE).', 'Tests cover the key functionalities of the endpoints (e.g., creating, retrieving, updating, and deleting tasks).', 'Tests use a testing library (e.g., Jest, Mocha, Chai).', 'Tests pass.'], 'status': 'pending', 'code_files': ['tests/tasks.test.js']}, {'id': 'DEPLOY-001', 'description': 'Deploy the application to Heroku.', 'dependencies': ['FE-001', 'FE-002', 'FE-003', 'FE-004', 'FE-005', 'FE-006', 'FE-007', 'FE-008', 'FE-009', 'BE-001', 'BE-002', 'BE-003', 'BE-004', 'BE-005', 'BE-006', 'BE-007'], 'estimated_time': '8 hours', 'agent_role': 'backend_developer', 'acceptance_criteria': ['A Heroku account is created.', 'The Heroku CLI is installed.', 'A Heroku app is created.', 'The application is deployed to Heroku using Git.', 'The MongoDB add-on is configured on Heroku.', 'Environment variables (e.g., database connection string) are set on Heroku.', 'The application is accessible via a Heroku URL.'], 'status': 'pending', 'code_files': ['Procfile']}]}, {'name': 'Stakeholder Phase', 'description': 'Tasks related to stakeholder phase', 'deliverables': ['Completed POST-DEPLOY-001'], 'estimated_duration_hours': 4.0, 'work_items': [{'id': 'POST-DEPLOY-001', 'description': 'Perform User Acceptance Testing (UAT).', 'dependencies': ['DEPLOY-001'], 'estimated_time': '4 hours', 'agent_role': 'stakeholder', 'acceptance_criteria': ['Users can successfully add tasks.', 'Users can successfully view their task list.', 'The application loads quickly.', 'The application is secure (HTTPS is enforced).', 'All functional requirements are met.'], 'status': 'pending', 'code_files': []}]}, {'name': 'Developer Phase', 'description': 'Tasks related to developer phase', 'deliverables': ['Completed POST-DEPLOY-002', 'Completed POST-DEPLOY-003'], 'estimated_duration_hours': 16.0, 'work_items': [{'id': 'POST-DEPLOY-002', 'description': 'Address any bugs or issues found during testing.', 'dependencies': ['POST-DEPLOY-001'], 'estimated_time': '8 hours', 'agent_role': 'developer', 'acceptance_criteria': ['All identified bugs are fixed.', 'The application functions as expected.'], 'status': 'pending', 'code_files': ['src/*', 'server.js', 'routes/*', 'models/*']}, {'id': 'POST-DEPLOY-003', 'description': 'Implement any requested improvements.', 'dependencies': ['POST-DEPLOY-001'], 'estimated_time': '8 hours', 'agent_role': 'developer', 'acceptance_criteria': ['All requested improvements are implemented.', 'The application functions as expected.'], 'status': 'pending', 'code_files': ['src/*', 'server.js', 'routes/*', 'models/*']}]}], resource_allocation=[{'role': 'Developer', 'count': 1, 'estimated_time_allocation': '100%', 'phases': ['Developer Phase'], 'skills_required': []}, {'role': 'Frontend Developer', 'count': 1, 'estimated_time_allocation': '100%', 'phases': ['Frontend Phase'], 'skills_required': []}, {'role': 'Backend Developer', 'count': 1, 'estimated_time_allocation': '100%', 'phases': ['Backend Phase'], 'skills_required': []}, {'role': 'Stakeholder', 'count': 1, 'estimated_time_allocation': '100%', 'phases': ['Stakeholder Phase'], 'skills_required': []}], risks_and_mitigations=[], timeline={'start_date': '2025-07-08T16:31:23.238782', 'end_date': 'TBD', 'milestones': []}, tech_stack={}, metadata={'generated_at': '2025-07-08T16:31:23.238782', 'version': '1.0', 'author': 'Multi-AI Dev System', 'tags': [], 'notes': 'Converted from WorkItemBacklog. Original summary: Develop a simple web application for managing a list of tasks, including adding and viewing tasks. The application will use React for the frontend, Node.js/Express for the backend, MongoDB for the database, and Heroku for deployment.'}) summary='Develop a simple web application for managing a list of tasks, including adding and viewing tasks. The application will use React for the frontend, Node.js/Express for the backend, MongoDB for the database, and Heroku for deployment.' metadata=PlanMetadata(generated_at='2025-07-08T16:31:23.238782', version='1.0', author='Multi-AI Dev System', tags=[], notes='Converted from WorkItemBacklog. Original summary: Develop a simple web application for managing a list of tasks, including adding and viewing tasks. The application will use React for the frontend, Node.js/Express for the backend, MongoDB for the database, and Heroku for deployment.')"
  },
  "workflow_state_snapshot": {
    "requirements_analysis": {
      "project_name": "Hello World Task List",
      "project_summary": "A simple web application to manage a list of tasks.",
      "project_goals": [
        "Allow a user to add a task",
        "Allow a user to see their list of tasks"
      ],
      "target_audience": [
        "Users who want to manage a list of tasks"
      ],
      "business_context": "This project aims to provide a basic task management tool.",
      "requirements": [
        {
          "id": "REQ-001",
          "description": "A user can create a new task with a text description.",
          "category": "functional",
          "priority": 1
        },
        {
          "id": "REQ-002",
          "description": "A user can see a list of all created tasks.",
          "category": "functional",
          "priority": 1
        },
        {
          "id": "REQ-003",
          "description": "The application must load quickly.",
          "category": "non_functional",
          "priority": 2
        },
        {
          "id": "REQ-004",
          "description": "The application must be secure.",
          "category": "non_functional",
          "priority": 2
        }
      ],
      "functional_requirements": [
        "A user can create a new task with a text description.",
        "A user can see a list of all created tasks."
      ],
      "non_functional_requirements": [
        "The application must load quickly.",
        "The application must be secure."
      ],
      "stakeholders": [
        "Users"
      ],
      "success_criteria": [
        "Users can successfully add tasks.",
        "Users can successfully view their task list.",
        "The application loads quickly.",
        "The application is secure."
      ],
      "constraints": [],
      "assumptions": [],
      "risks": [],
      "domain_specific_details": {},
      "quality_assessment": {
        "clarity_score": 9.0,
        "completeness_score": 8.0,
        "consistency_score": 10.0,
        "recommendations": []
      },
      "gap_analysis": {
        "identified_gaps": [],
        "recommendations_for_completion": []
      }
    },
    "tech_stack_recommendation": {
      "frontend_options": [
        {
          "name": "React",
          "language": "JavaScript",
          "reasoning": "React offers a component-based architecture, making it easy to build and maintain the UI for the task list. Its virtual DOM and efficient update mechanisms contribute to fast loading times, satisfying the non-functional requirement. It has a large community and extensive libraries for various functionalities.",
          "key_libraries": [
            "React Router (for navigation)",
            "Axios (for API calls)",
            "Material UI or Bootstrap (for UI components)"
          ],
          "pros": [
            "Component-based architecture for reusability and maintainability.",
            "Large community and ecosystem.",
            "Fast performance due to virtual DOM.",
            "Good for single-page applications (SPAs)."
          ],
          "cons": [
            "Requires understanding of JavaScript and JSX.",
            "Can have a steeper learning curve initially.",
            "Requires additional libraries for routing and state management (though these are readily available)."
          ],
          "selected": false
        },
        {
          "name": "Vue.js",
          "language": "JavaScript",
          "reasoning": "Vue.js is a progressive framework that is easy to learn and integrate. It's well-suited for building interactive UIs and offers a good balance between performance and ease of use. It's a good choice for a simple application like this.",
          "key_libraries": [
            "Vue Router (for navigation)",
            "Axios (for API calls)",
            "Vuetify or Element UI (for UI components)"
          ],
          "pros": [
            "Easy to learn and use.",
            "Good performance.",
            "Progressive framework - can be integrated into existing projects.",
            "Detailed documentation."
          ],
          "cons": [
            "Smaller community compared to React.",
            "Ecosystem might not be as extensive as React's."
          ],
          "selected": false
        },
        {
          "name": "HTML, CSS, JavaScript (Vanilla)",
          "language": "JavaScript",
          "reasoning": "For a simple task list application, using vanilla JavaScript, HTML, and CSS can be a viable option. This approach minimizes dependencies and provides a lightweight solution, contributing to fast loading times. It's a good choice if the project's complexity is low and you want to avoid the overhead of a framework.",
          "key_libraries": [],
          "pros": [
            "No external dependencies.",
            "Lightweight and fast.",
            "Good for learning the fundamentals of web development.",
            "Full control over the code."
          ],
          "cons": [
            "More manual work for UI components and state management.",
            "Can become complex to manage as the application grows.",
            "Requires more boilerplate code."
          ],
          "selected": false
        }
      ],
      "backend_options": [
        {
          "name": "Node.js with Express",
          "language": "JavaScript",
          "reasoning": "Node.js with Express provides a lightweight and efficient backend solution. JavaScript is used on both the frontend and backend, which can streamline development. Express simplifies routing and middleware management, making it suitable for a simple API.",
          "key_libraries": [
            "Express (web framework)",
            "body-parser (for parsing request bodies)",
            "cors (for handling CORS)",
            "mongoose or Sequelize (for database interaction)"
          ],
          "pros": [
            "JavaScript on both frontend and backend (full-stack JavaScript).",
            "Large community and extensive libraries.",
            "Fast development with Express.",
            "Good performance with Node.js's event-driven, non-blocking I/O model."
          ],
          "cons": [
            "Callback hell can be an issue (though solved with async/await).",
            "Requires careful handling of asynchronous operations.",
            "Can be less performant than compiled languages for CPU-intensive tasks (not relevant for this project)."
          ],
          "selected": false
        },
        {
          "name": "Python with Flask",
          "language": "Python",
          "reasoning": "Flask is a microframework that's easy to learn and use, making it suitable for small projects. Python's readability and extensive libraries can speed up development. It's a good choice if you prefer Python for backend development.",
          "key_libraries": [
            "Flask (web framework)",
            "Flask-CORS (for handling CORS)",
            "SQLAlchemy or Peewee (for database interaction)"
          ],
          "pros": [
            "Easy to learn and use.",
            "Python's readability.",
            "Large community and extensive libraries.",
            "Good for rapid prototyping."
          ],
          "cons": [
            "Can be slower than Node.js for some tasks.",
            "Requires more setup than Node.js with Express.",
            "Not as widely used for full-stack JavaScript development."
          ],
          "selected": false
        },
        {
          "name": "Java with Spring Boot",
          "language": "Java",
          "reasoning": "Spring Boot provides a robust and scalable backend solution. While it has a steeper learning curve, it offers excellent features for building APIs and managing dependencies. It's a good choice if you have Java expertise or need a more enterprise-grade backend.",
          "key_libraries": [
            "Spring Boot (web framework)",
            "Spring Data JPA (for database interaction)",
            "Lombok (for boilerplate code reduction)"
          ],
          "pros": [
            "Robust and scalable.",
            "Large community and extensive libraries.",
            "Good for enterprise-level applications.",
            "Strong type safety."
          ],
          "cons": [
            "Steeper learning curve.",
            "More verbose code.",
            "Can be slower to develop than Node.js or Python."
          ],
          "selected": false
        }
      ],
      "database_options": [
        {
          "name": "MongoDB",
          "language": null,
          "reasoning": "MongoDB is a NoSQL database that is easy to set up and use. It's a good choice for this project because it doesn't require a rigid schema, which simplifies data modeling for a simple task list. It's also scalable and can handle a large number of tasks.",
          "key_libraries": [
            "Mongoose (for Node.js)",
            "PyMongo (for Python)"
          ],
          "pros": [
            "Flexible schema.",
            "Easy to scale.",
            "Good performance for read/write operations.",
            "Easy to set up and use."
          ],
          "cons": [
            "Can be less performant for complex queries.",
            "Data consistency can be an issue if not handled carefully.",
            "Not ideal for applications with complex relationships."
          ],
          "selected": false
        },
        {
          "name": "PostgreSQL",
          "language": null,
          "reasoning": "PostgreSQL is a robust and reliable relational database. It's a good choice if you need strong data consistency and ACID properties. It's also scalable and can handle a large number of tasks.",
          "key_libraries": [
            "pg (for Node.js)",
            "psycopg2 (for Python)"
          ],
          "pros": [
            "Strong data consistency.",
            "ACID properties.",
            "Good performance for complex queries.",
            "Mature and well-established."
          ],
          "cons": [
            "Requires a defined schema.",
            "Can be more complex to set up and manage than MongoDB.",
            "Can be slower for write-heavy operations."
          ],
          "selected": false
        },
        {
          "name": "SQLite",
          "language": null,
          "reasoning": "SQLite is a lightweight, file-based database that is easy to set up and use. It's a good choice for this project because it doesn't require a separate database server, which simplifies deployment. It's also suitable for small applications with limited data.",
          "key_libraries": [
            "sqlite3 (built-in for Python and Node.js)"
          ],
          "pros": [
            "Easy to set up and use.",
            "No separate database server required.",
            "Good for small applications.",
            "File-based, making it easy to back up and restore."
          ],
          "cons": [
            "Not suitable for large-scale applications.",
            "Limited concurrency.",
            "Can be slower than other databases for complex queries."
          ],
          "selected": false
        }
      ],
      "cloud_options": [
        {
          "name": "AWS",
          "language": null,
          "reasoning": "AWS offers a wide range of services for deploying and managing web applications. It provides scalability, security, and reliability. Services like EC2, S3, and RDS can be used to host the frontend, store static assets, and manage the database, respectively.",
          "key_libraries": [
            "AWS SDK (for interacting with AWS services)"
          ],
          "pros": [
            "Scalability and reliability.",
            "Wide range of services.",
            "Mature platform with a large community.",
            "Good security features."
          ],
          "cons": [
            "Can be complex to set up and manage.",
            "Can be expensive if not configured properly.",
            "Steeper learning curve."
          ],
          "selected": false
        },
        {
          "name": "Google Cloud Platform (GCP)",
          "language": null,
          "reasoning": "GCP provides a similar set of services to AWS, with a focus on data analytics and machine learning. It offers competitive pricing and a user-friendly interface. Services like Compute Engine, Cloud Storage, and Cloud SQL can be used to host the application.",
          "key_libraries": [
            "Google Cloud Client Libraries (for interacting with GCP services)"
          ],
          "pros": [
            "Competitive pricing.",
            "User-friendly interface.",
            "Strong in data analytics and machine learning.",
            "Good scalability and reliability."
          ],
          "cons": [
            "Can be complex to set up and manage.",
            "Smaller community than AWS.",
            "Service offerings may not be as extensive as AWS."
          ],
          "selected": false
        },
        {
          "name": "Heroku",
          "language": null,
          "reasoning": "Heroku is a platform-as-a-service (PaaS) that simplifies the deployment and management of web applications. It's a good choice for this project because it's easy to set up and use, and it handles the infrastructure for you. It supports various languages and frameworks.",
          "key_libraries": [],
          "pros": [
            "Easy to set up and use.",
            "Handles infrastructure for you.",
            "Supports various languages and frameworks.",
            "Good for rapid prototyping."
          ],
          "cons": [
            "Can be more expensive than other cloud platforms.",
            "Limited customization options.",
            "Not suitable for large-scale applications."
          ],
          "selected": false
        }
      ],
      "architecture_options": [
        {
          "pattern": "Monolithic Architecture",
          "scalability_score": 5.0,
          "maintainability_score": 6.0,
          "development_speed_score": 8.0,
          "overall_score": 7.0,
          "reasoning": "For a simple task list application, a monolithic architecture is a good choice. It's easy to develop and deploy, and it doesn't require complex infrastructure. All components (frontend, backend, database) are deployed as a single unit. This approach is suitable for small projects and allows for rapid development. Scalability can be achieved by scaling the entire application. Maintainability is good for a small application, but can become more difficult as the application grows."
        },
        {
          "pattern": "Microservices Architecture",
          "scalability_score": 8.0,
          "maintainability_score": 7.0,
          "development_speed_score": 5.0,
          "overall_score": 6.0,
          "reasoning": "While microservices offer excellent scalability and maintainability, they introduce complexity that is not necessary for this simple application. The overhead of managing multiple services, inter-service communication, and distributed data can slow down development. However, if the application were to grow significantly in the future, this architecture would be beneficial."
        },
        {
          "pattern": "Serverless Architecture",
          "scalability_score": 9.0,
          "maintainability_score": 7.0,
          "development_speed_score": 6.0,
          "overall_score": 6.5,
          "reasoning": "Serverless architecture can be a good choice for this project, especially if you want to focus on the application logic and minimize infrastructure management. It offers excellent scalability and pay-per-use pricing. However, it can introduce complexities in debugging and monitoring. It might be overkill for this simple application, but it's a viable option."
        }
      ],
      "tool_options": [
        {
          "name": "Git",
          "language": null,
          "reasoning": "Git is essential for version control, allowing developers to track changes, collaborate effectively, and revert to previous versions if needed. It's a standard tool for software development.",
          "key_libraries": [],
          "pros": [],
          "cons": [],
          "selected": false
        },
        {
          "name": "VS Code",
          "language": null,
          "reasoning": "VS Code is a popular and versatile code editor with excellent support for various languages and frameworks. It offers features like code completion, debugging, and integrated terminal, which can significantly improve developer productivity.",
          "key_libraries": [],
          "pros": [],
          "cons": [],
          "selected": false
        },
        {
          "name": "Postman",
          "language": null,
          "reasoning": "Postman is a valuable tool for testing APIs. It allows developers to send requests, inspect responses, and debug API interactions, which is crucial for backend development.",
          "key_libraries": [],
          "pros": [],
          "cons": [],
          "selected": false
        }
      ],
      "risks": [
        {
          "category": "Security",
          "description": "Vulnerabilities in dependencies could lead to security breaches.  This is especially true if using third-party libraries.",
          "severity": "Medium",
          "likelihood": "Medium",
          "mitigation": "Regularly update dependencies and use a vulnerability scanner (e.g., Snyk, OWASP Dependency-Check) to identify and address vulnerabilities."
        },
        {
          "category": "Performance",
          "description": "Poorly optimized code or inefficient database queries could lead to slow loading times, impacting user experience.",
          "severity": "Medium",
          "likelihood": "Medium",
          "mitigation": "Implement performance testing and monitoring. Optimize database queries and use caching where appropriate.  Use a CDN for static assets."
        },
        {
          "category": "Scalability",
          "description": "If the application becomes popular, the chosen architecture and infrastructure might not be able to handle the increased load.",
          "severity": "Low",
          "likelihood": "Low",
          "mitigation": "Design the application with scalability in mind. Choose a database and cloud platform that can scale easily. Monitor performance and be prepared to scale up resources if needed."
        }
      ],
      "synthesis": {
        "backend": {
          "language": "JavaScript",
          "framework": "Node.js with Express",
          "reasoning": "Node.js with Express provides a lightweight and efficient backend solution. JavaScript is used on both the frontend and backend, which can streamline development. Express simplifies routing and middleware management, making it suitable for a simple API."
        },
        "frontend": {
          "language": "JavaScript",
          "framework": "React",
          "reasoning": "React offers a component-based architecture, making it easy to build and maintain the UI for the task list. Its virtual DOM and efficient update mechanisms contribute to fast loading times, satisfying the non-functional requirement. It has a large community and extensive libraries for various functionalities."
        },
        "database": {
          "type": "MongoDB",
          "reasoning": "MongoDB is a NoSQL database that is easy to set up and use. It's a good choice for this project because it doesn't require a rigid schema, which simplifies data modeling for a simple task list. It's also scalable and can handle a large number of tasks."
        },
        "architecture_pattern": "Monolithic Architecture",
        "deployment_environment": {
          "cloud_platform": "Heroku",
          "reasoning": "Heroku is a platform-as-a-service (PaaS) that simplifies the deployment and management of web applications. It's a good choice for this project because it's easy to set up and use, and it handles the infrastructure for you. It supports various languages and frameworks."
        },
        "key_libraries_tools": [
          {
            "name": "React Router",
            "purpose": "For navigation in the React frontend."
          },
          {
            "name": "Axios",
            "purpose": "For making API calls from the frontend."
          },
          {
            "name": "Mongoose",
            "purpose": "For interacting with the MongoDB database in the backend."
          },
          {
            "name": "Git",
            "purpose": "For version control."
          },
          {
            "name": "VS Code",
            "purpose": "For code editing and development."
          },
          {
            "name": "Postman",
            "purpose": "For testing the API."
          }
        ],
        "estimated_complexity": "Low"
      },
      "selected_stack": null
    },
    "system_design": {
      "architecture": {
        "pattern": "Monolithic Architecture",
        "justification": "The monolithic architecture is suitable for this project due to its simplicity and the small scale of the application. It allows for rapid development and deployment, as all components are deployed as a single unit. This approach is efficient for a task list application with limited features and user base. It simplifies the initial setup and reduces operational overhead compared to more complex architectures like microservices.",
        "key_benefits": [
          "Faster development and deployment cycles.",
          "Simplified infrastructure management.",
          "Easier to debug and test.",
          "Suitable for small-scale applications."
        ],
        "potential_drawbacks": [
          "Scalability limitations if the application grows significantly.",
          "Tight coupling between components can make it harder to maintain.",
          "Deployment of the entire application is required for even small changes."
        ]
      },
      "components": [
        {
          "name": "Frontend",
          "description": "The user interface for interacting with the task list application.",
          "category": "frontend",
          "technologies": [
            "React",
            "JavaScript",
            "HTML",
            "CSS"
          ],
          "dependencies": [
            "Backend API"
          ],
          "responsibilities": [
            "Displaying the task list.",
            "Allowing users to add new tasks.",
            "Handling user interactions.",
            "Making API calls to the backend."
          ],
          "design_patterns": [
            "Component-based architecture"
          ]
        },
        {
          "name": "Backend API",
          "description": "The server-side component that handles requests from the frontend and interacts with the database.",
          "category": "backend",
          "technologies": [
            "Node.js",
            "Express",
            "JavaScript",
            "MongoDB"
          ],
          "dependencies": [
            "MongoDB"
          ],
          "responsibilities": [
            "Receiving requests from the frontend.",
            "Validating and processing requests.",
            "Interacting with the database to store and retrieve tasks.",
            "Returning responses to the frontend."
          ],
          "design_patterns": [
            "RESTful API"
          ]
        },
        {
          "name": "Database",
          "description": "Stores the task data.",
          "category": "backend",
          "technologies": [
            "MongoDB"
          ],
          "dependencies": [],
          "responsibilities": [
            "Storing task information.",
            "Providing data access to the backend API."
          ],
          "design_patterns": []
        }
      ],
      "data_model": {
        "schema_type": "Document-oriented (MongoDB)",
        "tables": [
          {
            "name": "tasks",
            "purpose": "Stores the tasks created by users.",
            "fields": [
              {
                "name": "_id",
                "type": "ObjectId",
                "constraints": [
                  "PRIMARY KEY"
                ],
                "description": "Unique identifier for the task."
              },
              {
                "name": "description",
                "type": "String",
                "constraints": [
                  "NOT NULL"
                ],
                "description": "The text description of the task."
              },
              {
                "name": "created_at",
                "type": "Date",
                "constraints": [],
                "description": "The date and time the task was created."
              },
              {
                "name": "completed",
                "type": "Boolean",
                "constraints": [],
                "description": "Whether the task is completed or not."
              }
            ],
            "relationships": []
          }
        ],
        "relationships": [],
        "justification": "MongoDB's flexible schema is well-suited for this project. It allows for easy storage and retrieval of task data without the need for a predefined schema, which simplifies development and allows for future expansion of task attributes if needed. The document-oriented nature of MongoDB aligns well with the simple data structure of a task list."
      },
      "api_endpoints": {
        "style": "REST",
        "base_url": "/api/tasks",
        "authentication": "None (for simplicity, consider adding authentication in a production environment)",
        "endpoints": [
          {
            "method": "POST",
            "path": "/",
            "purpose": "Create a new task.",
            "parameters": [
              {
                "description": "The task description",
                "type": "string",
                "name": "description"
              }
            ],
            "response": {
              "201": {
                "message": "Task created successfully",
                "task": {
                  "id": "string",
                  "description": "string",
                  "created_at": "datetime",
                  "completed": "boolean"
                }
              },
              "400": {
                "message": "Bad Request - Invalid input"
              }
            },
            "authentication_required": false,
            "rate_limiting_applied": false
          },
          {
            "method": "GET",
            "path": "/",
            "purpose": "Get all tasks.",
            "parameters": [],
            "response": {
              "200": {
                "tasks": [
                  {
                    "id": "string",
                    "description": "string",
                    "created_at": "datetime",
                    "completed": "boolean"
                  }
                ]
              }
            },
            "authentication_required": false,
            "rate_limiting_applied": false
          },
          {
            "method": "GET",
            "path": "/:id",
            "purpose": "Get a specific task by ID.",
            "parameters": [
              {
                "name": "id",
                "type": "string",
                "description": "The ID of the task to retrieve."
              }
            ],
            "response": {
              "200": {
                "task": {
                  "id": "string",
                  "description": "string",
                  "created_at": "datetime",
                  "completed": "boolean"
                }
              },
              "404": {
                "message": "Task not found"
              }
            },
            "authentication_required": false,
            "rate_limiting_applied": false
          },
          {
            "method": "PUT",
            "path": "/:id",
            "purpose": "Update a specific task by ID.",
            "parameters": [
              {
                "name": "id",
                "type": "string",
                "description": "The ID of the task to update."
              },
              {
                "name": "description",
                "type": "string",
                "description": "The new description for the task."
              },
              {
                "name": "completed",
                "type": "boolean",
                "description": "The new completion status for the task."
              }
            ],
            "response": {
              "200": {
                "message": "Task updated successfully",
                "task": {
                  "id": "string",
                  "description": "string",
                  "created_at": "datetime",
                  "completed": "boolean"
                }
              },
              "400": {
                "message": "Bad Request - Invalid input"
              },
              "404": {
                "message": "Task not found"
              }
            },
            "authentication_required": false,
            "rate_limiting_applied": false
          },
          {
            "method": "DELETE",
            "path": "/:id",
            "purpose": "Delete a specific task by ID.",
            "parameters": [
              {
                "name": "id",
                "type": "string",
                "description": "The ID of the task to delete."
              }
            ],
            "response": {
              "200": {
                "message": "Task deleted successfully"
              },
              "404": {
                "message": "Task not found"
              }
            },
            "authentication_required": false,
            "rate_limiting_applied": false
          }
        ],
        "error_handling": "Centralized error handling using middleware to catch and format errors consistently.",
        "rate_limiting_strategy": null
      },
      "security": {
        "authentication_method": "None (for simplicity, consider implementing JWT or similar in a production environment)",
        "authorization_strategy": "No authorization required (for simplicity).",
        "data_encryption": {
          "at_rest": "Data is stored in MongoDB without encryption (for simplicity). Consider enabling encryption at rest in a production environment.",
          "in_transit": "HTTPS is used to encrypt data in transit."
        },
        "security_measures": [
          {
            "category": "Input Validation",
            "implementation": "Validate all user inputs on both the frontend and backend to prevent injection attacks.",
            "mitigation": "SQL Injection, Cross-Site Scripting (XSS)",
            "priority": "High"
          },
          {
            "category": "HTTPS",
            "implementation": "Enforce HTTPS for all communication between the frontend and backend.",
            "mitigation": "Man-in-the-middle attacks, data interception",
            "priority": "High"
          },
          {
            "category": "Dependency Management",
            "implementation": "Regularly update dependencies to the latest versions to patch security vulnerabilities.",
            "mitigation": "Vulnerabilities in third-party libraries",
            "priority": "Medium"
          },
          {
            "category": "CORS",
            "implementation": "Configure CORS (Cross-Origin Resource Sharing) to restrict access to the API from unauthorized origins.",
            "mitigation": "Cross-Site Request Forgery (CSRF)",
            "priority": "Medium"
          }
        ],
        "vulnerability_mitigation_strategies": [
          "Input validation and sanitization.",
          "Regular dependency updates.",
          "Use of HTTPS.",
          "Proper CORS configuration."
        ],
        "compliance_standards": []
      },
      "scalability_and_performance": {
        "frontend_optimization": "Optimize images, minimize HTTP requests, and use code splitting to improve loading times.",
        "backend_optimization": "Use caching mechanisms (e.g., Redis) to cache frequently accessed data. Optimize database queries and use indexing.",
        "database_optimization": "Ensure appropriate indexing on database fields used in queries. Consider sharding if the data volume grows significantly."
      },
      "deployment_strategy": {
        "environment": "Heroku",
        "steps": [
          "Create a Heroku account and install the Heroku CLI.",
          "Initialize a Git repository in the project directory.",
          "Create a Heroku app using the Heroku CLI.",
          "Configure the Heroku app to use the correct buildpacks (Node.js and possibly others).",
          "Deploy the application using Git (e.g., `git push heroku main`).",
          "Configure environment variables (e.g., database connection string) on Heroku.",
          "Set up a domain name and SSL certificate (optional)."
        ],
        "database_setup": "Heroku provides add-ons for MongoDB. Configure a MongoDB add-on and obtain the connection string."
      },
      "monitoring_and_logging": {
        "logging": "Use a logging library (e.g., Winston or Morgan) to log application events, errors, and user actions. Log levels (e.g., info, warn, error) should be used to categorize log messages.",
        "monitoring": "Monitor application performance using Heroku's built-in monitoring tools or integrate with a third-party service (e.g., New Relic, Datadog) to track metrics such as response times, error rates, and resource usage."
      },
      "error_handling_strategy": "Implement centralized error handling using middleware in the backend API. This middleware will catch errors, log them, and return consistent error responses to the frontend.  Frontend will handle API errors and display appropriate messages to the user.",
      "development_phases_overview": [
        {
          "name": "Phase 1: Setup and Frontend Development",
          "description": "Setting up the development environment, building the frontend UI, and implementing the task creation and display features.",
          "priority": "High",
          "dependencies": [],
          "tasks": [
            "Set up React project with necessary libraries (React Router, Axios, UI library).",
            "Design and implement the UI for adding and displaying tasks.",
            "Implement the functionality to add new tasks (frontend).",
            "Implement the functionality to display the list of tasks (frontend)."
          ],
          "estimated_duration": "1 week"
        },
        {
          "name": "Phase 2: Backend API Development",
          "description": "Developing the backend API to handle requests from the frontend and interact with the database.",
          "priority": "High",
          "dependencies": [
            "Phase 1: Setup and Frontend Development"
          ],
          "tasks": [
            "Set up Node.js and Express project.",
            "Implement API endpoints for creating, reading, updating, and deleting tasks.",
            "Connect to the MongoDB database.",
            "Implement data validation and error handling in the API."
          ],
          "estimated_duration": "1 week"
        },
        {
          "name": "Phase 3: Integration and Testing",
          "description": "Integrating the frontend and backend, testing the application, and deploying to Heroku.",
          "priority": "High",
          "dependencies": [
            "Phase 1: Setup and Frontend Development",
            "Phase 2: Backend API Development"
          ],
          "tasks": [
            "Connect the frontend to the backend API using Axios.",
            "Test the application thoroughly (unit tests, integration tests).",
            "Deploy the application to Heroku.",
            "Perform user acceptance testing (UAT)."
          ],
          "estimated_duration": "1 week"
        },
        {
          "name": "Phase 4: Refinement and Deployment",
          "description": "Refining the application based on testing and user feedback, and deploying to production.",
          "priority": "Medium",
          "dependencies": [
            "Phase 3: Integration and Testing"
          ],
          "tasks": [
            "Address any bugs or issues found during testing.",
            "Implement any requested improvements.",
            "Deploy to production."
          ],
          "estimated_duration": "1 week"
        }
      ],
      "key_risks": [
        "Security vulnerabilities in dependencies.",
        "Performance issues due to inefficient code or database queries.",
        "Scalability limitations if the application becomes popular.",
        "Data loss or corruption due to database issues."
      ],
      "design_justification": "The design prioritizes simplicity and rapid development, aligning with the project's goals. The monolithic architecture, combined with the chosen technologies (React, Node.js/Express, MongoDB, and Heroku), provides a straightforward and efficient solution for building a basic task list application. The focus is on delivering core functionality quickly while ensuring a secure and user-friendly experience. The tech stack is well-suited for this project's scope and complexity, allowing for a quick development cycle and easy deployment.",
      "data_flow": "1. **User Interaction:** The user interacts with the React frontend, adding tasks through a form or viewing the task list. 2. **Frontend to Backend:** When a user adds a task, the frontend sends a POST request to the backend API (Express). This request includes the task description. 3. **Backend Processing:** The backend API receives the request, validates the input, and then interacts with the MongoDB database using Mongoose to save the new task. 4. **Database Interaction:** MongoDB stores the task data. 5. **Backend Response:** The backend API sends a success response (201 Created) back to the frontend, including the newly created task's details.  For retrieving tasks, the frontend sends a GET request to the backend API. The backend fetches the tasks from MongoDB and sends them back to the frontend. 6. **Frontend Display:** The frontend receives the task data from the backend and displays it to the user."
    },
    "implementation_plan": "plan=ImplementationPlan(project_summary={'title': 'Generated Project Plan', 'description': 'Develop a simple web application for managing a list of tasks, including adding and viewing tasks. The application will use React for the frontend, Node.js/Express for the backend, MongoDB for the database, and Heroku for deployment.', 'overall_complexity': 'Medium', 'estimated_duration': 'TBD', 'key_challenges': [], 'success_criteria': []}, phases=[{'name': 'Frontend Phase', 'description': 'Tasks related to frontend phase', 'deliverables': ['Completed FE-001', 'Completed FE-002', 'Completed FE-003', 'Completed FE-004', 'Completed FE-005', 'Completed FE-006', 'Completed FE-007', 'Completed FE-008', 'Completed FE-009', 'Completed FE-010', 'Completed TEST-001'], 'estimated_duration_hours': 58.0, 'work_items': [{'id': 'FE-001', 'description': 'Set up React project with Create React App.', 'dependencies': [], 'estimated_time': '4 hours', 'agent_role': 'frontend_developer', 'acceptance_criteria': ['Project is initialized using Create React App.', 'Project runs without errors.', 'Basic project structure is in place.'], 'status': 'pending', 'code_files': ['package.json', 'src/App.js', 'src/index.js']}, {'id': 'FE-002', 'description': 'Install and configure React Router for navigation.', 'dependencies': ['FE-001'], 'estimated_time': '2 hours', 'agent_role': 'frontend_developer', 'acceptance_criteria': ['React Router is installed.', 'Basic routing setup is functional (e.g., a route for the task list).', 'Navigation links are present.'], 'status': 'pending', 'code_files': ['src/App.js']}, {'id': 'FE-003', 'description': 'Design and implement the UI for adding a new task (form).', 'dependencies': ['FE-001'], 'estimated_time': '8 hours', 'agent_role': 'frontend_developer', 'acceptance_criteria': ['A form is displayed for entering task description.', 'Form includes a text input field for the task description.', 'Form includes a submit button.', 'UI is visually appealing and user-friendly (consider using a UI library like Material UI or Bootstrap).'], 'status': 'pending', 'code_files': ['src/components/TaskForm.js', 'src/App.js']}, {'id': 'FE-004', 'description': 'Design and implement the UI for displaying the task list.', 'dependencies': ['FE-001'], 'estimated_time': '8 hours', 'agent_role': 'frontend_developer', 'acceptance_criteria': ['A list is displayed to show the tasks.', 'Each task displays its description.', 'UI is visually appealing and user-friendly (consider using a UI library like Material UI or Bootstrap).'], 'status': 'pending', 'code_files': ['src/components/TaskList.js', 'src/App.js']}, {'id': 'FE-005', 'description': 'Implement the functionality to add a new task (frontend).', 'dependencies': ['FE-003'], 'estimated_time': '8 hours', 'agent_role': 'frontend_developer', 'acceptance_criteria': ['The form submits the task description.', \"The task description is stored in the component's state (or a state management solution).\", 'The task list is updated to reflect the new task (without API calls yet).'], 'status': 'pending', 'code_files': ['src/components/TaskForm.js', 'src/App.js']}, {'id': 'FE-006', 'description': 'Implement the functionality to display the list of tasks (frontend).', 'dependencies': ['FE-004', 'FE-005'], 'estimated_time': '4 hours', 'agent_role': 'frontend_developer', 'acceptance_criteria': [\"The task list displays the tasks stored in the component's state.\", 'Tasks are displayed in a clear and readable format.'], 'status': 'pending', 'code_files': ['src/components/TaskList.js', 'src/App.js']}, {'id': 'FE-007', 'description': 'Install Axios and configure API calls to the backend.', 'dependencies': ['FE-001'], 'estimated_time': '4 hours', 'agent_role': 'frontend_developer', 'acceptance_criteria': ['Axios is installed.', 'Base URL for the API is configured.', 'API calls are made to the backend for creating and retrieving tasks (using the correct HTTP methods and endpoints).', 'Error handling for API calls is implemented (e.g., displaying error messages to the user).'], 'status': 'pending', 'code_files': ['src/App.js', 'src/components/TaskForm.js', 'src/components/TaskList.js']}, {'id': 'FE-008', 'description': 'Connect the frontend to the backend API for adding tasks.', 'dependencies': ['FE-005', 'FE-007', 'BE-003'], 'estimated_time': '4 hours', 'agent_role': 'frontend_developer', 'acceptance_criteria': ['The frontend sends a POST request to the /api/tasks endpoint when the form is submitted.', 'The frontend receives a success response from the backend.', 'The frontend updates the task list with the newly created task (after receiving the response from the backend).'], 'status': 'pending', 'code_files': ['src/components/TaskForm.js', 'src/App.js']}, {'id': 'FE-009', 'description': 'Connect the frontend to the backend API for displaying tasks.', 'dependencies': ['FE-006', 'FE-007', 'BE-004'], 'estimated_time': '4 hours', 'agent_role': 'frontend_developer', 'acceptance_criteria': ['The frontend makes a GET request to the /api/tasks endpoint when the component mounts (or on a refresh).', 'The frontend receives a list of tasks from the backend.', 'The frontend displays the tasks in the task list.'], 'status': 'pending', 'code_files': ['src/components/TaskList.js', 'src/App.js']}, {'id': 'FE-010', 'description': 'Implement basic error handling on the frontend.', 'dependencies': ['FE-007', 'FE-008', 'FE-009'], 'estimated_time': '4 hours', 'agent_role': 'frontend_developer', 'acceptance_criteria': ['Error messages are displayed to the user if API calls fail.', 'Error messages are clear and informative.'], 'status': 'pending', 'code_files': ['src/App.js', 'src/components/TaskForm.js', 'src/components/TaskList.js']}, {'id': 'TEST-001', 'description': 'Write unit tests for the frontend components.', 'dependencies': ['FE-001', 'FE-003', 'FE-004', 'FE-005', 'FE-006', 'FE-007', 'FE-008', 'FE-009'], 'estimated_time': '8 hours', 'agent_role': 'frontend_developer', 'acceptance_criteria': ['Unit tests are written for the TaskForm and TaskList components.', 'Tests cover the key functionalities of the components (e.g., form submission, displaying tasks).', 'Tests use a testing library (e.g., Jest, React Testing Library).', 'Tests pass.'], 'status': 'pending', 'code_files': ['src/components/TaskForm.test.js', 'src/components/TaskList.test.js']}]}, {'name': 'Backend Phase', 'description': 'Tasks related to backend phase', 'deliverables': ['Completed BE-001', 'Completed BE-002', 'Completed BE-003', 'Completed BE-004', 'Completed BE-005', 'Completed BE-006', 'Completed BE-007', 'Completed TEST-002', 'Completed DEPLOY-001'], 'estimated_duration_hours': 52.0, 'work_items': [{'id': 'BE-001', 'description': 'Set up Node.js and Express project.', 'dependencies': [], 'estimated_time': '4 hours', 'agent_role': 'backend_developer', 'acceptance_criteria': ['Project is initialized with npm (or yarn).', 'Express is installed.', 'Basic project structure is in place (e.g., server.js, routes folder).', 'Server runs without errors and responds to a basic route (e.g., /).'], 'status': 'pending', 'code_files': ['package.json', 'server.js', 'routes/tasks.js']}, {'id': 'BE-002', 'description': 'Install and configure MongoDB and Mongoose.', 'dependencies': ['BE-001'], 'estimated_time': '4 hours', 'agent_role': 'backend_developer', 'acceptance_criteria': ['MongoDB is installed (or a cloud instance is accessible).', 'Mongoose is installed.', 'Connection to the MongoDB database is established.', 'A basic schema for tasks is defined (description, created_at, completed).'], 'status': 'pending', 'code_files': ['server.js', 'models/Task.js']}, {'id': 'BE-003', 'description': 'Implement API endpoint for creating a new task (POST /api/tasks).', 'dependencies': ['BE-001', 'BE-002'], 'estimated_time': '8 hours', 'agent_role': 'backend_developer', 'acceptance_criteria': ['Endpoint handles POST requests to /api/tasks.', 'Endpoint receives the task description from the request body.', 'Endpoint validates the input (description is not empty).', 'Endpoint saves the task to the database using Mongoose.', 'Endpoint returns a 201 Created status code with the created task in the response.', 'Endpoint returns a 400 Bad Request status code if input validation fails.'], 'status': 'pending', 'code_files': ['routes/tasks.js', 'models/Task.js']}, {'id': 'BE-004', 'description': 'Implement API endpoint for getting all tasks (GET /api/tasks).', 'dependencies': ['BE-001', 'BE-002'], 'estimated_time': '4 hours', 'agent_role': 'backend_developer', 'acceptance_criteria': ['Endpoint handles GET requests to /api/tasks.', 'Endpoint retrieves all tasks from the database using Mongoose.', 'Endpoint returns a 200 OK status code with the list of tasks in the response.'], 'status': 'pending', 'code_files': ['routes/tasks.js', 'models/Task.js']}, {'id': 'BE-005', 'description': 'Implement API endpoint for getting a specific task by ID (GET /api/tasks/:id).', 'dependencies': ['BE-001', 'BE-002'], 'estimated_time': '4 hours', 'agent_role': 'backend_developer', 'acceptance_criteria': ['Endpoint handles GET requests to /api/tasks/:id.', 'Endpoint retrieves the task ID from the request parameters.', 'Endpoint retrieves the task from the database using Mongoose.', 'Endpoint returns a 200 OK status code with the task in the response if found.', 'Endpoint returns a 404 Not Found status code if the task is not found.'], 'status': 'pending', 'code_files': ['routes/tasks.js', 'models/Task.js']}, {'id': 'BE-006', 'description': 'Implement API endpoint for updating a specific task by ID (PUT /api/tasks/:id).', 'dependencies': ['BE-001', 'BE-002'], 'estimated_time': '8 hours', 'agent_role': 'backend_developer', 'acceptance_criteria': ['Endpoint handles PUT requests to /api/tasks/:id.', 'Endpoint retrieves the task ID from the request parameters.', 'Endpoint retrieves the updated task data from the request body (description, completed).', 'Endpoint validates the input.', 'Endpoint updates the task in the database using Mongoose.', 'Endpoint returns a 200 OK status code with the updated task in the response if successful.', 'Endpoint returns a 400 Bad Request status code if input validation fails.', 'Endpoint returns a 404 Not Found status code if the task is not found.'], 'status': 'pending', 'code_files': ['routes/tasks.js', 'models/Task.js']}, {'id': 'BE-007', 'description': 'Implement API endpoint for deleting a specific task by ID (DELETE /api/tasks/:id).', 'dependencies': ['BE-001', 'BE-002'], 'estimated_time': '4 hours', 'agent_role': 'backend_developer', 'acceptance_criteria': ['Endpoint handles DELETE requests to /api/tasks/:id.', 'Endpoint retrieves the task ID from the request parameters.', 'Endpoint deletes the task from the database using Mongoose.', 'Endpoint returns a 200 OK status code if successful.', 'Endpoint returns a 404 Not Found status code if the task is not found.'], 'status': 'pending', 'code_files': ['routes/tasks.js', 'models/Task.js']}, {'id': 'TEST-002', 'description': 'Write unit tests for the backend API endpoints.', 'dependencies': ['BE-001', 'BE-003', 'BE-004', 'BE-005', 'BE-006', 'BE-007'], 'estimated_time': '8 hours', 'agent_role': 'backend_developer', 'acceptance_criteria': ['Unit tests are written for the API endpoints (POST, GET, PUT, DELETE).', 'Tests cover the key functionalities of the endpoints (e.g., creating, retrieving, updating, and deleting tasks).', 'Tests use a testing library (e.g., Jest, Mocha, Chai).', 'Tests pass.'], 'status': 'pending', 'code_files': ['tests/tasks.test.js']}, {'id': 'DEPLOY-001', 'description': 'Deploy the application to Heroku.', 'dependencies': ['FE-001', 'FE-002', 'FE-003', 'FE-004', 'FE-005', 'FE-006', 'FE-007', 'FE-008', 'FE-009', 'BE-001', 'BE-002', 'BE-003', 'BE-004', 'BE-005', 'BE-006', 'BE-007'], 'estimated_time': '8 hours', 'agent_role': 'backend_developer', 'acceptance_criteria': ['A Heroku account is created.', 'The Heroku CLI is installed.', 'A Heroku app is created.', 'The application is deployed to Heroku using Git.', 'The MongoDB add-on is configured on Heroku.', 'Environment variables (e.g., database connection string) are set on Heroku.', 'The application is accessible via a Heroku URL.'], 'status': 'pending', 'code_files': ['Procfile']}]}, {'name': 'Stakeholder Phase', 'description': 'Tasks related to stakeholder phase', 'deliverables': ['Completed POST-DEPLOY-001'], 'estimated_duration_hours': 4.0, 'work_items': [{'id': 'POST-DEPLOY-001', 'description': 'Perform User Acceptance Testing (UAT).', 'dependencies': ['DEPLOY-001'], 'estimated_time': '4 hours', 'agent_role': 'stakeholder', 'acceptance_criteria': ['Users can successfully add tasks.', 'Users can successfully view their task list.', 'The application loads quickly.', 'The application is secure (HTTPS is enforced).', 'All functional requirements are met.'], 'status': 'pending', 'code_files': []}]}, {'name': 'Developer Phase', 'description': 'Tasks related to developer phase', 'deliverables': ['Completed POST-DEPLOY-002', 'Completed POST-DEPLOY-003'], 'estimated_duration_hours': 16.0, 'work_items': [{'id': 'POST-DEPLOY-002', 'description': 'Address any bugs or issues found during testing.', 'dependencies': ['POST-DEPLOY-001'], 'estimated_time': '8 hours', 'agent_role': 'developer', 'acceptance_criteria': ['All identified bugs are fixed.', 'The application functions as expected.'], 'status': 'pending', 'code_files': ['src/*', 'server.js', 'routes/*', 'models/*']}, {'id': 'POST-DEPLOY-003', 'description': 'Implement any requested improvements.', 'dependencies': ['POST-DEPLOY-001'], 'estimated_time': '8 hours', 'agent_role': 'developer', 'acceptance_criteria': ['All requested improvements are implemented.', 'The application functions as expected.'], 'status': 'pending', 'code_files': ['src/*', 'server.js', 'routes/*', 'models/*']}]}], resource_allocation=[{'role': 'Developer', 'count': 1, 'estimated_time_allocation': '100%', 'phases': ['Developer Phase'], 'skills_required': []}, {'role': 'Frontend Developer', 'count': 1, 'estimated_time_allocation': '100%', 'phases': ['Frontend Phase'], 'skills_required': []}, {'role': 'Backend Developer', 'count': 1, 'estimated_time_allocation': '100%', 'phases': ['Backend Phase'], 'skills_required': []}, {'role': 'Stakeholder', 'count': 1, 'estimated_time_allocation': '100%', 'phases': ['Stakeholder Phase'], 'skills_required': []}], risks_and_mitigations=[], timeline={'start_date': '2025-07-08T16:31:23.238782', 'end_date': 'TBD', 'milestones': []}, tech_stack={}, metadata={'generated_at': '2025-07-08T16:31:23.238782', 'version': '1.0', 'author': 'Multi-AI Dev System', 'tags': [], 'notes': 'Converted from WorkItemBacklog. Original summary: Develop a simple web application for managing a list of tasks, including adding and viewing tasks. The application will use React for the frontend, Node.js/Express for the backend, MongoDB for the database, and Heroku for deployment.'}) summary='Develop a simple web application for managing a list of tasks, including adding and viewing tasks. The application will use React for the frontend, Node.js/Express for the backend, MongoDB for the database, and Heroku for deployment.' metadata=PlanMetadata(generated_at='2025-07-08T16:31:23.238782', version='1.0', author='Multi-AI Dev System', tags=[], notes='Converted from WorkItemBacklog. Original summary: Develop a simple web application for managing a list of tasks, including adding and viewing tasks. The application will use React for the frontend, Node.js/Express for the backend, MongoDB for the database, and Heroku for deployment.')"
  }
}