{
  "session_id": "session_edf1b790-3fbe-4489-af0e-e0412629756b",
  "approval_type": "implementation_plan",
  "timestamp": 1751979138,
  "approval_data": {
    "type": "implementation_plan",
    "timestamp": 1751979138.6300526,
    "project_overview": "Develop a simple web application for managing a list of tasks, including adding, viewing, updating, and deleting tasks. The application will use React for the frontend, Node.js/Express for the backend, and MongoDB for the database. The application will be deployed to Heroku.",
    "development_phases": [
      {
        "name": "Frontend Phase",
        "description": "Tasks related to frontend phase",
        "deliverables": [
          "Completed FE-001",
          "Completed FE-002",
          "Completed FE-003",
          "Completed FE-004",
          "Completed FE-005",
          "Completed FE-006",
          "Completed FE-007",
          "Completed FE-008",
          "Completed FE-009",
          "Completed FE-010",
          "Completed FE-011"
        ],
        "estimated_duration_hours": 72.0,
        "work_items": [
          {
            "id": "FE-001",
            "description": "Set up React project with Create React App.",
            "dependencies": [],
            "estimated_time": "4 hours",
            "agent_role": "frontend_developer",
            "acceptance_criteria": [
              "Project is initialized using Create React App.",
              "Basic project structure is in place.",
              "Project runs without errors."
            ],
            "status": "pending",
            "code_files": [
              "package.json",
              "src/App.js",
              "src/index.js"
            ]
          },
          {
            "id": "FE-002",
            "description": "Create a basic TaskList component to display tasks.",
            "dependencies": [
              "FE-001"
            ],
            "estimated_time": "4 hours",
            "agent_role": "frontend_developer",
            "acceptance_criteria": [
              "TaskList component renders.",
              "TaskList component accepts and displays a list of tasks (dummy data initially).",
              "Task items are displayed in a list format."
            ],
            "status": "pending",
            "code_files": [
              "src/components/TaskList.js"
            ]
          },
          {
            "id": "FE-003",
            "description": "Create a basic TaskForm component to add new tasks.",
            "dependencies": [
              "FE-001"
            ],
            "estimated_time": "4 hours",
            "agent_role": "frontend_developer",
            "acceptance_criteria": [
              "TaskForm component renders.",
              "TaskForm component includes an input field for task description.",
              "TaskForm component includes a button to submit the task."
            ],
            "status": "pending",
            "code_files": [
              "src/components/TaskForm.js"
            ]
          },
          {
            "id": "FE-004",
            "description": "Implement state management for tasks in App.js.",
            "dependencies": [
              "FE-002",
              "FE-003"
            ],
            "estimated_time": "4 hours",
            "agent_role": "frontend_developer",
            "acceptance_criteria": [
              "Tasks are stored in the component's state.",
              "TaskList component receives the task list from the state.",
              "TaskForm component updates the task list in the state when a new task is submitted (using dummy data for now)."
            ],
            "status": "pending",
            "code_files": [
              "src/App.js"
            ]
          },
          {
            "id": "FE-005",
            "description": "Connect frontend to backend API for creating tasks.",
            "dependencies": [
              "FE-003",
              "BE-003"
            ],
            "estimated_time": "8 hours",
            "agent_role": "frontend_developer",
            "acceptance_criteria": [
              "TaskForm component makes a POST request to /api/tasks when the form is submitted.",
              "The request includes the task description.",
              "The frontend receives the new task data from the backend.",
              "The task list in the frontend is updated with the new task.",
              "Error handling for API request failures (e.g., display an error message)."
            ],
            "status": "pending",
            "code_files": [
              "src/components/TaskForm.js",
              "src/App.js"
            ]
          },
          {
            "id": "FE-006",
            "description": "Connect frontend to backend API for retrieving tasks.",
            "dependencies": [
              "FE-002",
              "BE-004"
            ],
            "estimated_time": "8 hours",
            "agent_role": "frontend_developer",
            "acceptance_criteria": [
              "TaskList component makes a GET request to /api/tasks when the component mounts.",
              "The frontend receives the task list from the backend.",
              "The task list is displayed in the TaskList component.",
              "Error handling for API request failures (e.g., display an error message)."
            ],
            "status": "pending",
            "code_files": [
              "src/components/TaskList.js",
              "src/App.js"
            ]
          },
          {
            "id": "FE-007",
            "description": "Implement functionality to update a task in the frontend.",
            "dependencies": [
              "FE-002",
              "BE-006"
            ],
            "estimated_time": "8 hours",
            "agent_role": "frontend_developer",
            "acceptance_criteria": [
              "Each task in the TaskList has an 'Edit' button.",
              "Clicking 'Edit' allows the user to modify the task description and completion status.",
              "The frontend makes a PUT request to /api/tasks/:id when the user saves the changes.",
              "The frontend updates the task in the task list after a successful update.",
              "Error handling for API request failures."
            ],
            "status": "pending",
            "code_files": [
              "src/components/TaskList.js",
              "src/App.js"
            ]
          },
          {
            "id": "FE-008",
            "description": "Implement functionality to delete a task in the frontend.",
            "dependencies": [
              "FE-002",
              "BE-007"
            ],
            "estimated_time": "8 hours",
            "agent_role": "frontend_developer",
            "acceptance_criteria": [
              "Each task in the TaskList has a 'Delete' button.",
              "Clicking 'Delete' prompts the user for confirmation.",
              "The frontend makes a DELETE request to /api/tasks/:id when the user confirms deletion.",
              "The task is removed from the task list after a successful deletion.",
              "Error handling for API request failures."
            ],
            "status": "pending",
            "code_files": [
              "src/components/TaskList.js",
              "src/App.js"
            ]
          },
          {
            "id": "FE-009",
            "description": "Implement basic styling for the application.",
            "dependencies": [
              "FE-001",
              "FE-002",
              "FE-003",
              "FE-004",
              "FE-005",
              "FE-006",
              "FE-007",
              "FE-008"
            ],
            "estimated_time": "8 hours",
            "agent_role": "frontend_developer",
            "acceptance_criteria": [
              "The application has a consistent and visually appealing design.",
              "Tasks are displayed in a readable format.",
              "The form is styled appropriately.",
              "Use CSS or a UI library (e.g., Material UI, Bootstrap)."
            ],
            "status": "pending",
            "code_files": [
              "src/App.css",
              "src/components/TaskList.css",
              "src/components/TaskForm.css"
            ]
          },
          {
            "id": "FE-010",
            "description": "Implement unit tests for frontend components.",
            "dependencies": [
              "FE-002",
              "FE-003",
              "FE-004"
            ],
            "estimated_time": "8 hours",
            "agent_role": "frontend_developer",
            "acceptance_criteria": [
              "Write unit tests for TaskList, TaskForm, and App components.",
              "Tests cover component rendering, state updates, and event handling.",
              "Use a testing library like Jest or React Testing Library.",
              "Tests pass successfully."
            ],
            "status": "pending",
            "code_files": [
              "src/components/TaskList.test.js",
              "src/components/TaskForm.test.js",
              "src/App.test.js"
            ]
          },
          {
            "id": "FE-011",
            "description": "Refine the user interface and improve usability.",
            "dependencies": [
              "FE-009"
            ],
            "estimated_time": "8 hours",
            "agent_role": "frontend_developer",
            "acceptance_criteria": [
              "Improve the visual design of the application.",
              "Ensure the application is responsive and works well on different screen sizes.",
              "Improve the user experience (e.g., clear error messages, loading indicators).",
              "Test the application for usability."
            ],
            "status": "pending",
            "code_files": [
              "src/App.css",
              "src/components/TaskList.css",
              "src/components/TaskForm.css"
            ]
          }
        ]
      },
      {
        "name": "Backend Phase",
        "description": "Tasks related to backend phase",
        "deliverables": [
          "Completed BE-001",
          "Completed BE-002",
          "Completed BE-003",
          "Completed BE-004",
          "Completed BE-005",
          "Completed BE-006",
          "Completed BE-007",
          "Completed BE-008",
          "Completed BE-009",
          "Completed BE-010",
          "Completed BE-011"
        ],
        "estimated_duration_hours": 64.0,
        "work_items": [
          {
            "id": "BE-001",
            "description": "Set up Node.js/Express project.",
            "dependencies": [],
            "estimated_time": "4 hours",
            "agent_role": "backend_developer",
            "acceptance_criteria": [
              "Project is initialized with npm.",
              "Express is installed.",
              "Project runs without errors.",
              "Basic server setup (listening on a port)."
            ],
            "status": "pending",
            "code_files": [
              "package.json",
              "index.js"
            ]
          },
          {
            "id": "BE-002",
            "description": "Install and configure MongoDB and Mongoose.",
            "dependencies": [
              "BE-001"
            ],
            "estimated_time": "4 hours",
            "agent_role": "backend_developer",
            "acceptance_criteria": [
              "MongoDB is installed and running (locally or cloud).",
              "Mongoose is installed.",
              "Mongoose is connected to the MongoDB database.",
              "A basic schema for tasks is defined (id, description, completed, createdAt, updatedAt)."
            ],
            "status": "pending",
            "code_files": [
              "index.js",
              "models/Task.js"
            ]
          },
          {
            "id": "BE-003",
            "description": "Create API endpoint to create a new task (POST /api/tasks).",
            "dependencies": [
              "BE-001",
              "BE-002"
            ],
            "estimated_time": "8 hours",
            "agent_role": "backend_developer",
            "acceptance_criteria": [
              "Endpoint handles POST requests to /api/tasks.",
              "Endpoint receives a task description in the request body.",
              "Endpoint validates the input (description is not empty).",
              "Endpoint saves the task to the database.",
              "Endpoint returns a 201 Created status code with the new task data in the response.",
              "Error handling for invalid input and database errors."
            ],
            "status": "pending",
            "code_files": [
              "index.js",
              "routes/tasks.js"
            ]
          },
          {
            "id": "BE-004",
            "description": "Create API endpoint to get all tasks (GET /api/tasks).",
            "dependencies": [
              "BE-001",
              "BE-002"
            ],
            "estimated_time": "4 hours",
            "agent_role": "backend_developer",
            "acceptance_criteria": [
              "Endpoint handles GET requests to /api/tasks.",
              "Endpoint retrieves all tasks from the database.",
              "Endpoint returns a 200 OK status code with the task list in the response.",
              "Error handling for database errors."
            ],
            "status": "pending",
            "code_files": [
              "index.js",
              "routes/tasks.js"
            ]
          },
          {
            "id": "BE-005",
            "description": "Create API endpoint to get a specific task by ID (GET /api/tasks/:id).",
            "dependencies": [
              "BE-001",
              "BE-002"
            ],
            "estimated_time": "4 hours",
            "agent_role": "backend_developer",
            "acceptance_criteria": [
              "Endpoint handles GET requests to /api/tasks/:id.",
              "Endpoint retrieves a task from the database by ID.",
              "Endpoint returns a 200 OK status code with the task data in the response if found.",
              "Endpoint returns a 404 Not Found status code if the task is not found.",
              "Error handling for database errors."
            ],
            "status": "pending",
            "code_files": [
              "index.js",
              "routes/tasks.js"
            ]
          },
          {
            "id": "BE-006",
            "description": "Create API endpoint to update a task (PUT /api/tasks/:id).",
            "dependencies": [
              "BE-001",
              "BE-002"
            ],
            "estimated_time": "8 hours",
            "agent_role": "backend_developer",
            "acceptance_criteria": [
              "Endpoint handles PUT requests to /api/tasks/:id.",
              "Endpoint receives the task ID in the URL and updated data in the request body (description, completed).",
              "Endpoint validates the input.",
              "Endpoint updates the task in the database.",
              "Endpoint returns a 200 OK status code with the updated task data in the response.",
              "Endpoint returns a 404 Not Found status code if the task is not found.",
              "Error handling for invalid input and database errors."
            ],
            "status": "pending",
            "code_files": [
              "index.js",
              "routes/tasks.js"
            ]
          },
          {
            "id": "BE-007",
            "description": "Create API endpoint to delete a task (DELETE /api/tasks/:id).",
            "dependencies": [
              "BE-001",
              "BE-002"
            ],
            "estimated_time": "4 hours",
            "agent_role": "backend_developer",
            "acceptance_criteria": [
              "Endpoint handles DELETE requests to /api/tasks/:id.",
              "Endpoint receives the task ID in the URL.",
              "Endpoint deletes the task from the database.",
              "Endpoint returns a 204 No Content status code.",
              "Endpoint returns a 404 Not Found status code if the task is not found.",
              "Error handling for database errors."
            ],
            "status": "pending",
            "code_files": [
              "index.js",
              "routes/tasks.js"
            ]
          },
          {
            "id": "BE-008",
            "description": "Implement input validation on the backend.",
            "dependencies": [
              "BE-003",
              "BE-006"
            ],
            "estimated_time": "4 hours",
            "agent_role": "backend_developer",
            "acceptance_criteria": [
              "Validate task description (e.g., not empty, length constraints).",
              "Validate task ID (e.g., is a valid MongoDB ObjectId).",
              "Return 400 Bad Request with appropriate error messages for invalid input."
            ],
            "status": "pending",
            "code_files": [
              "routes/tasks.js",
              "models/Task.js"
            ]
          },
          {
            "id": "BE-009",
            "description": "Implement output encoding on the backend.",
            "dependencies": [
              "BE-003",
              "BE-004",
              "BE-005",
              "BE-006"
            ],
            "estimated_time": "4 hours",
            "agent_role": "backend_developer",
            "acceptance_criteria": [
              "Use a library or built-in functions to escape HTML characters in the task description before sending it to the frontend.",
              "Ensure that the output is safe from XSS vulnerabilities."
            ],
            "status": "pending",
            "code_files": [
              "routes/tasks.js"
            ]
          },
          {
            "id": "BE-010",
            "description": "Implement unit tests for backend API endpoints.",
            "dependencies": [
              "BE-003",
              "BE-004",
              "BE-005",
              "BE-006",
              "BE-007"
            ],
            "estimated_time": "12 hours",
            "agent_role": "backend_developer",
            "acceptance_criteria": [
              "Write unit tests for all API endpoints (POST, GET, PUT, DELETE).",
              "Tests cover request validation, database interactions, and response codes.",
              "Use a testing library like Jest or Mocha with Supertest.",
              "Tests pass successfully."
            ],
            "status": "pending",
            "code_files": [
              "tests/tasks.test.js"
            ]
          },
          {
            "id": "BE-011",
            "description": "Implement logging and error handling.",
            "dependencies": [
              "BE-001",
              "BE-003",
              "BE-004",
              "BE-005",
              "BE-006",
              "BE-007"
            ],
            "estimated_time": "8 hours",
            "agent_role": "backend_developer",
            "acceptance_criteria": [
              "Use a logging library (e.g., Winston) to log application events and errors.",
              "Log errors with appropriate severity levels (error, warn, info, debug).",
              "Implement centralized error handling middleware to catch and format errors consistently.",
              "Return appropriate HTTP status codes and error messages."
            ],
            "status": "pending",
            "code_files": [
              "index.js",
              "routes/tasks.js"
            ]
          }
        ]
      },
      {
        "name": "Deployment Phase",
        "description": "Tasks related to deployment phase",
        "deliverables": [
          "Completed DE-001"
        ],
        "estimated_duration_hours": 8.0,
        "work_items": [
          {
            "id": "DE-001",
            "description": "Deploy the application to Heroku.",
            "dependencies": [
              "FE-008",
              "BE-007"
            ],
            "estimated_time": "8 hours",
            "agent_role": "deployment_specialist",
            "acceptance_criteria": [
              "Create a Heroku account and set up the Heroku CLI.",
              "Configure the application for deployment (Procfile, build scripts).",
              "Deploy the frontend and backend to Heroku.",
              "Verify that the application is accessible and functional on Heroku.",
              "Configure MongoDB Atlas connection."
            ],
            "status": "pending",
            "code_files": [
              "Procfile",
              "package.json"
            ]
          }
        ]
      }
    ],
    "timeline_estimation": {
      "start_date": "2025-07-08T18:22:16.396144",
      "end_date": "TBD",
      "milestones": []
    },
    "risk_assessment": [],
    "resource_requirements": [
      {
        "role": "Deployment Specialist",
        "count": 1,
        "estimated_time_allocation": "100%",
        "phases": [
          "Deployment Phase"
        ],
        "skills_required": []
      },
      {
        "role": "Backend Developer",
        "count": 1,
        "estimated_time_allocation": "100%",
        "phases": [
          "Backend Phase"
        ],
        "skills_required": []
      },
      {
        "role": "Frontend Developer",
        "count": 1,
        "estimated_time_allocation": "100%",
        "phases": [
          "Frontend Phase"
        ],
        "skills_required": []
      }
    ],
    "deliverables": [
      "Completed FE-001",
      "Completed FE-002",
      "Completed FE-003",
      "Completed FE-004",
      "Completed FE-005",
      "Completed FE-006",
      "Completed FE-007",
      "Completed FE-008",
      "Completed FE-009",
      "Completed FE-010",
      "Completed FE-011",
      "Completed BE-001",
      "Completed BE-002",
      "Completed BE-003",
      "Completed BE-004",
      "Completed BE-005",
      "Completed BE-006",
      "Completed BE-007",
      "Completed BE-008",
      "Completed BE-009",
      "Completed BE-010",
      "Completed BE-011",
      "Completed DE-001"
    ],
    "dependencies": [],
    "raw_plan": "plan=ImplementationPlan(project_summary={'title': 'Generated Project Plan', 'description': 'Develop a simple web application for managing a list of tasks, including adding, viewing, updating, and deleting tasks. The application will use React for the frontend, Node.js/Express for the backend, and MongoDB for the database. The application will be deployed to Heroku.', 'overall_complexity': 'Medium', 'estimated_duration': 'TBD', 'key_challenges': [], 'success_criteria': []}, phases=[{'name': 'Frontend Phase', 'description': 'Tasks related to frontend phase', 'deliverables': ['Completed FE-001', 'Completed FE-002', 'Completed FE-003', 'Completed FE-004', 'Completed FE-005', 'Completed FE-006', 'Completed FE-007', 'Completed FE-008', 'Completed FE-009', 'Completed FE-010', 'Completed FE-011'], 'estimated_duration_hours': 72.0, 'work_items': [{'id': 'FE-001', 'description': 'Set up React project with Create React App.', 'dependencies': [], 'estimated_time': '4 hours', 'agent_role': 'frontend_developer', 'acceptance_criteria': ['Project is initialized using Create React App.', 'Basic project structure is in place.', 'Project runs without errors.'], 'status': 'pending', 'code_files': ['package.json', 'src/App.js', 'src/index.js']}, {'id': 'FE-002', 'description': 'Create a basic TaskList component to display tasks.', 'dependencies': ['FE-001'], 'estimated_time': '4 hours', 'agent_role': 'frontend_developer', 'acceptance_criteria': ['TaskList component renders.', 'TaskList component accepts and displays a list of tasks (dummy data initially).', 'Task items are displayed in a list format.'], 'status': 'pending', 'code_files': ['src/components/TaskList.js']}, {'id': 'FE-003', 'description': 'Create a basic TaskForm component to add new tasks.', 'dependencies': ['FE-001'], 'estimated_time': '4 hours', 'agent_role': 'frontend_developer', 'acceptance_criteria': ['TaskForm component renders.', 'TaskForm component includes an input field for task description.', 'TaskForm component includes a button to submit the task.'], 'status': 'pending', 'code_files': ['src/components/TaskForm.js']}, {'id': 'FE-004', 'description': 'Implement state management for tasks in App.js.', 'dependencies': ['FE-002', 'FE-003'], 'estimated_time': '4 hours', 'agent_role': 'frontend_developer', 'acceptance_criteria': [\"Tasks are stored in the component's state.\", 'TaskList component receives the task list from the state.', 'TaskForm component updates the task list in the state when a new task is submitted (using dummy data for now).'], 'status': 'pending', 'code_files': ['src/App.js']}, {'id': 'FE-005', 'description': 'Connect frontend to backend API for creating tasks.', 'dependencies': ['FE-003', 'BE-003'], 'estimated_time': '8 hours', 'agent_role': 'frontend_developer', 'acceptance_criteria': ['TaskForm component makes a POST request to /api/tasks when the form is submitted.', 'The request includes the task description.', 'The frontend receives the new task data from the backend.', 'The task list in the frontend is updated with the new task.', 'Error handling for API request failures (e.g., display an error message).'], 'status': 'pending', 'code_files': ['src/components/TaskForm.js', 'src/App.js']}, {'id': 'FE-006', 'description': 'Connect frontend to backend API for retrieving tasks.', 'dependencies': ['FE-002', 'BE-004'], 'estimated_time': '8 hours', 'agent_role': 'frontend_developer', 'acceptance_criteria': ['TaskList component makes a GET request to /api/tasks when the component mounts.', 'The frontend receives the task list from the backend.', 'The task list is displayed in the TaskList component.', 'Error handling for API request failures (e.g., display an error message).'], 'status': 'pending', 'code_files': ['src/components/TaskList.js', 'src/App.js']}, {'id': 'FE-007', 'description': 'Implement functionality to update a task in the frontend.', 'dependencies': ['FE-002', 'BE-006'], 'estimated_time': '8 hours', 'agent_role': 'frontend_developer', 'acceptance_criteria': [\"Each task in the TaskList has an 'Edit' button.\", \"Clicking 'Edit' allows the user to modify the task description and completion status.\", 'The frontend makes a PUT request to /api/tasks/:id when the user saves the changes.', 'The frontend updates the task in the task list after a successful update.', 'Error handling for API request failures.'], 'status': 'pending', 'code_files': ['src/components/TaskList.js', 'src/App.js']}, {'id': 'FE-008', 'description': 'Implement functionality to delete a task in the frontend.', 'dependencies': ['FE-002', 'BE-007'], 'estimated_time': '8 hours', 'agent_role': 'frontend_developer', 'acceptance_criteria': [\"Each task in the TaskList has a 'Delete' button.\", \"Clicking 'Delete' prompts the user for confirmation.\", 'The frontend makes a DELETE request to /api/tasks/:id when the user confirms deletion.', 'The task is removed from the task list after a successful deletion.', 'Error handling for API request failures.'], 'status': 'pending', 'code_files': ['src/components/TaskList.js', 'src/App.js']}, {'id': 'FE-009', 'description': 'Implement basic styling for the application.', 'dependencies': ['FE-001', 'FE-002', 'FE-003', 'FE-004', 'FE-005', 'FE-006', 'FE-007', 'FE-008'], 'estimated_time': '8 hours', 'agent_role': 'frontend_developer', 'acceptance_criteria': ['The application has a consistent and visually appealing design.', 'Tasks are displayed in a readable format.', 'The form is styled appropriately.', 'Use CSS or a UI library (e.g., Material UI, Bootstrap).'], 'status': 'pending', 'code_files': ['src/App.css', 'src/components/TaskList.css', 'src/components/TaskForm.css']}, {'id': 'FE-010', 'description': 'Implement unit tests for frontend components.', 'dependencies': ['FE-002', 'FE-003', 'FE-004'], 'estimated_time': '8 hours', 'agent_role': 'frontend_developer', 'acceptance_criteria': ['Write unit tests for TaskList, TaskForm, and App components.', 'Tests cover component rendering, state updates, and event handling.', 'Use a testing library like Jest or React Testing Library.', 'Tests pass successfully.'], 'status': 'pending', 'code_files': ['src/components/TaskList.test.js', 'src/components/TaskForm.test.js', 'src/App.test.js']}, {'id': 'FE-011', 'description': 'Refine the user interface and improve usability.', 'dependencies': ['FE-009'], 'estimated_time': '8 hours', 'agent_role': 'frontend_developer', 'acceptance_criteria': ['Improve the visual design of the application.', 'Ensure the application is responsive and works well on different screen sizes.', 'Improve the user experience (e.g., clear error messages, loading indicators).', 'Test the application for usability.'], 'status': 'pending', 'code_files': ['src/App.css', 'src/components/TaskList.css', 'src/components/TaskForm.css']}]}, {'name': 'Backend Phase', 'description': 'Tasks related to backend phase', 'deliverables': ['Completed BE-001', 'Completed BE-002', 'Completed BE-003', 'Completed BE-004', 'Completed BE-005', 'Completed BE-006', 'Completed BE-007', 'Completed BE-008', 'Completed BE-009', 'Completed BE-010', 'Completed BE-011'], 'estimated_duration_hours': 64.0, 'work_items': [{'id': 'BE-001', 'description': 'Set up Node.js/Express project.', 'dependencies': [], 'estimated_time': '4 hours', 'agent_role': 'backend_developer', 'acceptance_criteria': ['Project is initialized with npm.', 'Express is installed.', 'Project runs without errors.', 'Basic server setup (listening on a port).'], 'status': 'pending', 'code_files': ['package.json', 'index.js']}, {'id': 'BE-002', 'description': 'Install and configure MongoDB and Mongoose.', 'dependencies': ['BE-001'], 'estimated_time': '4 hours', 'agent_role': 'backend_developer', 'acceptance_criteria': ['MongoDB is installed and running (locally or cloud).', 'Mongoose is installed.', 'Mongoose is connected to the MongoDB database.', 'A basic schema for tasks is defined (id, description, completed, createdAt, updatedAt).'], 'status': 'pending', 'code_files': ['index.js', 'models/Task.js']}, {'id': 'BE-003', 'description': 'Create API endpoint to create a new task (POST /api/tasks).', 'dependencies': ['BE-001', 'BE-002'], 'estimated_time': '8 hours', 'agent_role': 'backend_developer', 'acceptance_criteria': ['Endpoint handles POST requests to /api/tasks.', 'Endpoint receives a task description in the request body.', 'Endpoint validates the input (description is not empty).', 'Endpoint saves the task to the database.', 'Endpoint returns a 201 Created status code with the new task data in the response.', 'Error handling for invalid input and database errors.'], 'status': 'pending', 'code_files': ['index.js', 'routes/tasks.js']}, {'id': 'BE-004', 'description': 'Create API endpoint to get all tasks (GET /api/tasks).', 'dependencies': ['BE-001', 'BE-002'], 'estimated_time': '4 hours', 'agent_role': 'backend_developer', 'acceptance_criteria': ['Endpoint handles GET requests to /api/tasks.', 'Endpoint retrieves all tasks from the database.', 'Endpoint returns a 200 OK status code with the task list in the response.', 'Error handling for database errors.'], 'status': 'pending', 'code_files': ['index.js', 'routes/tasks.js']}, {'id': 'BE-005', 'description': 'Create API endpoint to get a specific task by ID (GET /api/tasks/:id).', 'dependencies': ['BE-001', 'BE-002'], 'estimated_time': '4 hours', 'agent_role': 'backend_developer', 'acceptance_criteria': ['Endpoint handles GET requests to /api/tasks/:id.', 'Endpoint retrieves a task from the database by ID.', 'Endpoint returns a 200 OK status code with the task data in the response if found.', 'Endpoint returns a 404 Not Found status code if the task is not found.', 'Error handling for database errors.'], 'status': 'pending', 'code_files': ['index.js', 'routes/tasks.js']}, {'id': 'BE-006', 'description': 'Create API endpoint to update a task (PUT /api/tasks/:id).', 'dependencies': ['BE-001', 'BE-002'], 'estimated_time': '8 hours', 'agent_role': 'backend_developer', 'acceptance_criteria': ['Endpoint handles PUT requests to /api/tasks/:id.', 'Endpoint receives the task ID in the URL and updated data in the request body (description, completed).', 'Endpoint validates the input.', 'Endpoint updates the task in the database.', 'Endpoint returns a 200 OK status code with the updated task data in the response.', 'Endpoint returns a 404 Not Found status code if the task is not found.', 'Error handling for invalid input and database errors.'], 'status': 'pending', 'code_files': ['index.js', 'routes/tasks.js']}, {'id': 'BE-007', 'description': 'Create API endpoint to delete a task (DELETE /api/tasks/:id).', 'dependencies': ['BE-001', 'BE-002'], 'estimated_time': '4 hours', 'agent_role': 'backend_developer', 'acceptance_criteria': ['Endpoint handles DELETE requests to /api/tasks/:id.', 'Endpoint receives the task ID in the URL.', 'Endpoint deletes the task from the database.', 'Endpoint returns a 204 No Content status code.', 'Endpoint returns a 404 Not Found status code if the task is not found.', 'Error handling for database errors.'], 'status': 'pending', 'code_files': ['index.js', 'routes/tasks.js']}, {'id': 'BE-008', 'description': 'Implement input validation on the backend.', 'dependencies': ['BE-003', 'BE-006'], 'estimated_time': '4 hours', 'agent_role': 'backend_developer', 'acceptance_criteria': ['Validate task description (e.g., not empty, length constraints).', 'Validate task ID (e.g., is a valid MongoDB ObjectId).', 'Return 400 Bad Request with appropriate error messages for invalid input.'], 'status': 'pending', 'code_files': ['routes/tasks.js', 'models/Task.js']}, {'id': 'BE-009', 'description': 'Implement output encoding on the backend.', 'dependencies': ['BE-003', 'BE-004', 'BE-005', 'BE-006'], 'estimated_time': '4 hours', 'agent_role': 'backend_developer', 'acceptance_criteria': ['Use a library or built-in functions to escape HTML characters in the task description before sending it to the frontend.', 'Ensure that the output is safe from XSS vulnerabilities.'], 'status': 'pending', 'code_files': ['routes/tasks.js']}, {'id': 'BE-010', 'description': 'Implement unit tests for backend API endpoints.', 'dependencies': ['BE-003', 'BE-004', 'BE-005', 'BE-006', 'BE-007'], 'estimated_time': '12 hours', 'agent_role': 'backend_developer', 'acceptance_criteria': ['Write unit tests for all API endpoints (POST, GET, PUT, DELETE).', 'Tests cover request validation, database interactions, and response codes.', 'Use a testing library like Jest or Mocha with Supertest.', 'Tests pass successfully.'], 'status': 'pending', 'code_files': ['tests/tasks.test.js']}, {'id': 'BE-011', 'description': 'Implement logging and error handling.', 'dependencies': ['BE-001', 'BE-003', 'BE-004', 'BE-005', 'BE-006', 'BE-007'], 'estimated_time': '8 hours', 'agent_role': 'backend_developer', 'acceptance_criteria': ['Use a logging library (e.g., Winston) to log application events and errors.', 'Log errors with appropriate severity levels (error, warn, info, debug).', 'Implement centralized error handling middleware to catch and format errors consistently.', 'Return appropriate HTTP status codes and error messages.'], 'status': 'pending', 'code_files': ['index.js', 'routes/tasks.js']}]}, {'name': 'Deployment Phase', 'description': 'Tasks related to deployment phase', 'deliverables': ['Completed DE-001'], 'estimated_duration_hours': 8.0, 'work_items': [{'id': 'DE-001', 'description': 'Deploy the application to Heroku.', 'dependencies': ['FE-008', 'BE-007'], 'estimated_time': '8 hours', 'agent_role': 'deployment_specialist', 'acceptance_criteria': ['Create a Heroku account and set up the Heroku CLI.', 'Configure the application for deployment (Procfile, build scripts).', 'Deploy the frontend and backend to Heroku.', 'Verify that the application is accessible and functional on Heroku.', 'Configure MongoDB Atlas connection.'], 'status': 'pending', 'code_files': ['Procfile', 'package.json']}]}], resource_allocation=[{'role': 'Deployment Specialist', 'count': 1, 'estimated_time_allocation': '100%', 'phases': ['Deployment Phase'], 'skills_required': []}, {'role': 'Backend Developer', 'count': 1, 'estimated_time_allocation': '100%', 'phases': ['Backend Phase'], 'skills_required': []}, {'role': 'Frontend Developer', 'count': 1, 'estimated_time_allocation': '100%', 'phases': ['Frontend Phase'], 'skills_required': []}], risks_and_mitigations=[], timeline={'start_date': '2025-07-08T18:22:16.396144', 'end_date': 'TBD', 'milestones': []}, tech_stack={}, metadata={'generated_at': '2025-07-08T18:22:16.396144', 'version': '1.0', 'author': 'Multi-AI Dev System', 'tags': [], 'notes': 'Converted from WorkItemBacklog. Original summary: Develop a simple web application for managing a list of tasks, including adding, viewing, updating, and deleting tasks. The application will use React for the frontend, Node.js/Express for the backend, and MongoDB for the database. The application will be deployed to Heroku.'}) summary='Develop a simple web application for managing a list of tasks, including adding, viewing, updating, and deleting tasks. The application will use React for the frontend, Node.js/Express for the backend, and MongoDB for the database. The application will be deployed to Heroku.' metadata=PlanMetadata(generated_at='2025-07-08T18:22:16.396144', version='1.0', author='Multi-AI Dev System', tags=[], notes='Converted from WorkItemBacklog. Original summary: Develop a simple web application for managing a list of tasks, including adding, viewing, updating, and deleting tasks. The application will use React for the frontend, Node.js/Express for the backend, and MongoDB for the database. The application will be deployed to Heroku.')"
  },
  "workflow_state_snapshot": {
    "requirements_analysis": {
      "project_name": "Hello World Task List",
      "project_summary": "A simple web application to manage a list of tasks.",
      "project_goals": [
        "Allow a user to add a task",
        "Allow a user to see their list of tasks"
      ],
      "target_audience": [
        "Users who want to manage a list of tasks"
      ],
      "business_context": "This project provides a basic task management solution.",
      "requirements": [
        {
          "id": "REQ-001",
          "description": "A user can create a new task with a text description.",
          "category": "functional",
          "priority": 1
        },
        {
          "id": "REQ-002",
          "description": "A user can see a list of all created tasks.",
          "category": "functional",
          "priority": 1
        },
        {
          "id": "REQ-003",
          "description": "The application must load quickly.",
          "category": "non_functional",
          "priority": 2
        },
        {
          "id": "REQ-004",
          "description": "The application must be secure.",
          "category": "non_functional",
          "priority": 2
        }
      ],
      "functional_requirements": [
        "A user can create a new task with a text description.",
        "A user can see a list of all created tasks."
      ],
      "non_functional_requirements": [
        "The application must load quickly.",
        "The application must be secure."
      ],
      "stakeholders": [
        "Users"
      ],
      "success_criteria": [
        "Users can successfully add tasks.",
        "Users can successfully view their task list.",
        "The application loads quickly.",
        "The application is secure."
      ],
      "constraints": [],
      "assumptions": [],
      "risks": [],
      "domain_specific_details": {},
      "quality_assessment": {
        "clarity_score": 9.0,
        "completeness_score": 8.0,
        "consistency_score": 10.0,
        "recommendations": []
      },
      "gap_analysis": {
        "identified_gaps": [],
        "recommendations_for_completion": []
      }
    },
    "tech_stack_recommendation": {
      "frontend_options": [
        {
          "name": "React",
          "language": "JavaScript",
          "reasoning": "React is a popular and efficient library for building user interfaces. It offers a component-based architecture, making it easy to manage and update the UI. Its virtual DOM and efficient update mechanisms contribute to fast loading times, addressing a key non-functional requirement.",
          "key_libraries": [
            "React Router (for navigation)",
            "Axios or Fetch (for API calls)",
            "Material UI or Bootstrap (for UI components)"
          ],
          "pros": [
            "Large community and extensive documentation.",
            "Component-based architecture promotes reusability and maintainability.",
            "Virtual DOM for efficient updates.",
            "Excellent performance."
          ],
          "cons": [
            "Requires understanding of JSX.",
            "Can have a steeper learning curve for beginners."
          ],
          "selected": false
        },
        {
          "name": "Vue.js",
          "language": "JavaScript",
          "reasoning": "Vue.js is a progressive framework that's easy to learn and integrate. It's known for its simplicity and excellent documentation, making it a good choice for a small project. It also offers good performance and a reactive data binding system.",
          "key_libraries": [
            "Vue Router (for navigation)",
            "Axios or Fetch (for API calls)",
            "Vuetify or BootstrapVue (for UI components)"
          ],
          "pros": [
            "Easy to learn and use.",
            "Excellent documentation.",
            "Good performance.",
            "Progressive framework - can be integrated into existing projects."
          ],
          "cons": [
            "Smaller community compared to React.",
            "Ecosystem might not be as extensive as React's."
          ],
          "selected": false
        },
        {
          "name": "HTML, CSS, JavaScript (Vanilla)",
          "language": "JavaScript",
          "reasoning": "For a simple task list application, using vanilla JavaScript, HTML, and CSS can be a viable option. This approach minimizes dependencies and provides a lightweight solution, contributing to fast loading times. It's suitable for small projects where complexity is low.",
          "key_libraries": [],
          "pros": [
            "No external dependencies.",
            "Simple to understand and implement.",
            "Fast loading times."
          ],
          "cons": [
            "More manual DOM manipulation.",
            "Can become less manageable as the application grows.",
            "Requires more code for UI components."
          ],
          "selected": false
        }
      ],
      "backend_options": [
        {
          "name": "Node.js with Express",
          "language": "JavaScript",
          "reasoning": "Node.js with Express provides a lightweight and efficient backend solution. JavaScript is used on both the frontend and backend, which can streamline development. Express simplifies routing and middleware management, making it suitable for a simple API.",
          "key_libraries": [
            "Express (web framework)",
            "body-parser (for parsing request bodies)",
            "cors (for handling CORS)",
            "mongoose or Sequelize (for database interaction)"
          ],
          "pros": [
            "JavaScript on both frontend and backend (full-stack JavaScript).",
            "Large community and extensive documentation.",
            "Fast development with Express.",
            "Good performance with non-blocking I/O."
          ],
          "cons": [
            "Callback hell can be an issue (can be mitigated with async/await).",
            "Requires careful error handling."
          ],
          "selected": false
        },
        {
          "name": "Python with Flask",
          "language": "Python",
          "reasoning": "Flask is a microframework that's easy to learn and use. Python's readability and Flask's simplicity make it a good choice for rapid development. It's suitable for small to medium-sized projects.",
          "key_libraries": [
            "Flask (web framework)",
            "Flask-CORS (for handling CORS)",
            "SQLAlchemy or Flask-SQLAlchemy (for database interaction)"
          ],
          "pros": [
            "Easy to learn and use.",
            "Python's readability.",
            "Large community and extensive documentation.",
            "Good for rapid prototyping."
          ],
          "cons": [
            "Can require more boilerplate code than Node.js with Express for certain tasks.",
            "Performance might be slightly slower than Node.js in some cases."
          ],
          "selected": false
        },
        {
          "name": "Java with Spring Boot",
          "language": "Java",
          "reasoning": "Spring Boot provides a robust and scalable backend solution. While it has a steeper learning curve, it offers excellent features for building APIs and managing dependencies. It's a good choice if scalability and maintainability are important, even for a small project.",
          "key_libraries": [
            "Spring Boot (web framework)",
            "Spring Data JPA (for database interaction)",
            "Spring Security (for security)"
          ],
          "pros": [
            "Robust and scalable.",
            "Mature ecosystem and extensive documentation.",
            "Excellent for enterprise-level applications.",
            "Strong security features."
          ],
          "cons": [
            "Steeper learning curve.",
            "More verbose code compared to other options."
          ],
          "selected": false
        }
      ],
      "database_options": [
        {
          "name": "MongoDB",
          "language": null,
          "reasoning": "MongoDB is a NoSQL database that's easy to set up and use. Its flexible schema is well-suited for a task list application where the data structure might evolve. It's a good choice for rapid development and scalability.",
          "key_libraries": [
            "Mongoose (for Node.js)",
            "PyMongo (for Python)"
          ],
          "pros": [
            "Flexible schema.",
            "Easy to scale.",
            "Good performance for read/write operations.",
            "Easy to set up and use."
          ],
          "cons": [
            "Not ideal for complex relationships.",
            "Data consistency can be more challenging to manage."
          ],
          "selected": false
        },
        {
          "name": "PostgreSQL",
          "language": null,
          "reasoning": "PostgreSQL is a robust and reliable relational database. It offers strong data consistency and ACID properties, which are important for data integrity. It's a good choice if data consistency and complex queries are required.",
          "key_libraries": [
            "pg (for Node.js)",
            "psycopg2 (for Python)"
          ],
          "pros": [
            "Strong data consistency.",
            "ACID properties.",
            "Supports complex queries.",
            "Mature and reliable."
          ],
          "cons": [
            "Can be more complex to set up and manage than MongoDB.",
            "Schema changes require more planning."
          ],
          "selected": false
        },
        {
          "name": "SQLite",
          "language": null,
          "reasoning": "SQLite is a lightweight, file-based database that's easy to set up and use. It's a good choice for small projects or prototypes where a full-fledged database is not needed. It's suitable for local development and simple deployments.",
          "key_libraries": [
            "sqlite3 (built-in for Python and Node.js)"
          ],
          "pros": [
            "Easy to set up and use.",
            "File-based (no server required).",
            "Good for local development and simple deployments.",
            "Lightweight."
          ],
          "cons": [
            "Not suitable for high-traffic applications.",
            "Limited scalability.",
            "Not ideal for concurrent access."
          ],
          "selected": false
        }
      ],
      "cloud_options": [
        {
          "name": "AWS (Amazon Web Services)",
          "language": null,
          "reasoning": "AWS offers a wide range of services and is a mature cloud provider. It provides scalability, security, and a global infrastructure. It's a good choice for projects that might grow in the future.",
          "key_libraries": [
            "AWS SDK (for interacting with AWS services)"
          ],
          "pros": [
            "Wide range of services.",
            "Scalable and reliable.",
            "Mature ecosystem.",
            "Global infrastructure."
          ],
          "cons": [
            "Can be complex to manage.",
            "Cost can be higher than other options if not managed carefully."
          ],
          "selected": false
        },
        {
          "name": "Google Cloud Platform (GCP)",
          "language": null,
          "reasoning": "GCP offers competitive pricing and a strong focus on data analytics and machine learning. It's a good choice if these features are important. It also provides scalability and a global infrastructure.",
          "key_libraries": [
            "Google Cloud Client Libraries (for interacting with GCP services)"
          ],
          "pros": [
            "Competitive pricing.",
            "Strong focus on data analytics and machine learning.",
            "Scalable and reliable.",
            "Global infrastructure."
          ],
          "cons": [
            "Can be complex to manage.",
            "Ecosystem might not be as mature as AWS."
          ],
          "selected": false
        },
        {
          "name": "Heroku",
          "language": null,
          "reasoning": "Heroku is a Platform-as-a-Service (PaaS) that simplifies deployment and management. It's a good choice for small projects where ease of deployment is a priority. It abstracts away much of the infrastructure management.",
          "key_libraries": [],
          "pros": [
            "Easy to deploy and manage.",
            "Focus on developer experience.",
            "Good for small projects.",
            "Automated scaling."
          ],
          "cons": [
            "Limited control over infrastructure.",
            "Can be more expensive than other options for large-scale applications.",
            "Vendor lock-in."
          ],
          "selected": false
        }
      ],
      "architecture_options": [
        {
          "pattern": "Monolithic Architecture",
          "scalability_score": 5.0,
          "maintainability_score": 6.0,
          "development_speed_score": 8.0,
          "overall_score": 7.0,
          "reasoning": "For a simple task list application, a monolithic architecture is a good starting point. It allows for rapid development and deployment. All components (frontend, backend, database) are deployed as a single unit. While it may become harder to scale and maintain as the application grows, it's suitable for the initial scope."
        },
        {
          "pattern": "Microservices Architecture",
          "scalability_score": 8.0,
          "maintainability_score": 7.0,
          "development_speed_score": 4.0,
          "overall_score": 6.0,
          "reasoning": "Microservices architecture involves breaking down the application into smaller, independent services. While this architecture offers excellent scalability and maintainability, it introduces complexity in terms of development, deployment, and communication between services. This is likely overkill for the current project scope."
        },
        {
          "pattern": "Serverless Architecture",
          "scalability_score": 9.0,
          "maintainability_score": 7.0,
          "development_speed_score": 6.0,
          "overall_score": 7.0,
          "reasoning": "Serverless architecture involves using cloud services (e.g., AWS Lambda, Google Cloud Functions) to execute code without managing servers. This architecture offers excellent scalability and cost efficiency. However, it can introduce complexity in terms of debugging and monitoring. It might be a good option if the backend logic is simple and can be easily broken down into functions."
        }
      ],
      "tool_options": [
        {
          "name": "Git",
          "language": null,
          "reasoning": "Git is a version control system that's essential for managing code changes and collaborating with others. It allows for tracking changes, branching, and merging code.",
          "key_libraries": [],
          "pros": [],
          "cons": [],
          "selected": false
        },
        {
          "name": "VS Code",
          "language": null,
          "reasoning": "VS Code is a popular and versatile code editor with excellent support for various programming languages and frameworks. It offers features like code completion, debugging, and extensions.",
          "key_libraries": [],
          "pros": [],
          "cons": [],
          "selected": false
        },
        {
          "name": "Postman",
          "language": null,
          "reasoning": "Postman is a tool for testing and debugging APIs. It allows you to send HTTP requests and inspect the responses, making it easier to develop and test the backend.",
          "key_libraries": [],
          "pros": [],
          "cons": [],
          "selected": false
        }
      ],
      "risks": [
        {
          "category": "Security",
          "description": "The application could be vulnerable to cross-site scripting (XSS) attacks if user input is not properly sanitized.",
          "severity": "Medium",
          "likelihood": "Medium",
          "mitigation": "Implement input validation and output encoding to prevent XSS attacks. Use a Content Security Policy (CSP)."
        },
        {
          "category": "Performance",
          "description": "The application might experience slow loading times if the frontend code is not optimized or if the database queries are inefficient.",
          "severity": "Medium",
          "likelihood": "Medium",
          "mitigation": "Optimize frontend code (e.g., code splitting, lazy loading). Optimize database queries and use indexing."
        },
        {
          "category": "Scalability",
          "description": "The application might not scale well if the database or backend is not designed to handle a large number of users or tasks.",
          "severity": "Low",
          "likelihood": "Low",
          "mitigation": "Choose a scalable database (e.g., MongoDB, PostgreSQL) and design the backend to handle increased load. Consider using caching."
        },
        {
          "category": "Deployment",
          "description": "Deployment process might be complex and error-prone if not automated.",
          "severity": "Low",
          "likelihood": "Medium",
          "mitigation": "Automate the deployment process using tools like CI/CD pipelines."
        }
      ],
      "synthesis": {
        "backend": {
          "language": "JavaScript",
          "framework": "Node.js with Express",
          "reasoning": "Node.js with Express provides a lightweight and efficient backend solution. JavaScript is used on both the frontend and backend, which can streamline development. Express simplifies routing and middleware management, making it suitable for a simple API."
        },
        "frontend": {
          "language": "JavaScript",
          "framework": "React",
          "reasoning": "React offers a good balance of performance, maintainability, and a large community. It's well-suited for building interactive UIs. The component-based architecture promotes code reusability and maintainability. The virtual DOM helps with fast loading times."
        },
        "database": {
          "type": "MongoDB",
          "reasoning": "MongoDB's flexible schema is well-suited for a task list application where the data structure might evolve. It's a good choice for rapid development and scalability."
        },
        "architecture_pattern": "Monolithic Architecture",
        "deployment_environment": {
          "cloud_platform": "Heroku",
          "reasoning": "Heroku simplifies deployment and management, making it a good choice for a small project where ease of deployment is a priority."
        },
        "key_libraries_tools": [
          {
            "name": "React Router",
            "purpose": "For navigation in the React frontend."
          },
          {
            "name": "Axios",
            "purpose": "For making API calls from the frontend."
          },
          {
            "name": "Express",
            "purpose": "For building the backend API."
          },
          {
            "name": "Mongoose",
            "purpose": "For interacting with the MongoDB database."
          },
          {
            "name": "Git",
            "purpose": "For version control."
          },
          {
            "name": "VS Code",
            "purpose": "For code editing and development."
          },
          {
            "name": "Postman",
            "purpose": "For testing the API."
          }
        ],
        "estimated_complexity": "Low"
      },
      "selected_stack": null
    },
    "system_design": {
      "architecture": {
        "pattern": "Monolithic Architecture",
        "justification": "For a simple task list application, a monolithic architecture is a good starting point. It allows for rapid development and deployment. All components (frontend, backend, database) are deployed as a single unit. While it may become harder to scale and maintain as the application grows, it's suitable for the initial scope.",
        "key_benefits": [
          "Rapid development and deployment.",
          "Simpler to manage for a small application.",
          "All components deployed as a single unit."
        ],
        "potential_drawbacks": [
          "Can become harder to scale as the application grows.",
          "Maintenance can become more complex over time."
        ]
      },
      "components": [
        {
          "name": "Frontend",
          "description": "The user interface for the task list application.",
          "category": "frontend",
          "technologies": [
            "React",
            "JavaScript",
            "HTML",
            "CSS"
          ],
          "dependencies": [
            "Backend API"
          ],
          "responsibilities": [
            "Displaying the task list.",
            "Allowing users to add new tasks.",
            "Handling user interactions.",
            "Making API calls to the backend."
          ],
          "design_patterns": [
            "Component-based architecture"
          ]
        },
        {
          "name": "Backend API",
          "description": "The RESTful API that handles requests from the frontend and interacts with the database.",
          "category": "backend",
          "technologies": [
            "Node.js",
            "Express",
            "JavaScript"
          ],
          "dependencies": [
            "MongoDB"
          ],
          "responsibilities": [
            "Handling API requests.",
            "Validating data.",
            "Interacting with the database.",
            "Returning data to the frontend."
          ],
          "design_patterns": [
            "MVC (Model-View-Controller)"
          ]
        },
        {
          "name": "Database",
          "description": "Stores the task data.",
          "category": "database",
          "technologies": [
            "MongoDB"
          ],
          "dependencies": [],
          "responsibilities": [
            "Storing task data.",
            "Providing data access to the backend API."
          ],
          "design_patterns": []
        },
        {
          "name": "Deployment Environment",
          "description": "The platform where the application is deployed.",
          "category": "deployment",
          "technologies": [
            "Heroku"
          ],
          "dependencies": [
            "Frontend",
            "Backend API",
            "Database"
          ],
          "responsibilities": [
            "Hosting the application.",
            "Managing the application's resources.",
            "Providing a platform for deployment and scaling."
          ],
          "design_patterns": []
        }
      ],
      "data_model": {
        "schema_type": "Document",
        "tables": [
          {
            "name": "tasks",
            "purpose": "Stores task information.",
            "fields": [
              {
                "name": "id",
                "type": "String",
                "constraints": [
                  "PRIMARY KEY"
                ],
                "description": "Unique identifier for the task."
              },
              {
                "name": "description",
                "type": "String",
                "constraints": [
                  "NOT NULL"
                ],
                "description": "The text description of the task."
              },
              {
                "name": "completed",
                "type": "Boolean",
                "constraints": [],
                "description": "Indicates whether the task is completed."
              },
              {
                "name": "created_at",
                "type": "Date",
                "constraints": [],
                "description": "The date and time the task was created."
              },
              {
                "name": "updated_at",
                "type": "Date",
                "constraints": [],
                "description": "The date and time the task was last updated."
              }
            ],
            "relationships": []
          }
        ],
        "relationships": [],
        "justification": "MongoDB's flexible schema is well-suited for a task list application where the data structure might evolve. It's a good choice for rapid development and scalability."
      },
      "api_endpoints": {
        "style": "REST",
        "base_url": "/api/tasks",
        "authentication": "None",
        "endpoints": [
          {
            "method": "POST",
            "path": "/",
            "purpose": "Create a new task.",
            "parameters": [
              {
                "description": "The task description.",
                "type": "string",
                "name": "description"
              }
            ],
            "response": {
              "status": 201,
              "description": "Task created successfully.",
              "example": {
                "id": "task_id",
                "description": "Task description",
                "completed": false,
                "created_at": "2024-10-27T10:00:00.000Z",
                "updated_at": "2024-10-27T10:00:00.000Z"
              }
            },
            "authentication_required": false,
            "rate_limiting_applied": false
          },
          {
            "method": "GET",
            "path": "/",
            "purpose": "Get all tasks.",
            "parameters": [],
            "response": {
              "status": 200,
              "description": "List of tasks.",
              "example": [
                {
                  "id": "task_id_1",
                  "description": "Task description 1",
                  "completed": false,
                  "created_at": "2024-10-27T10:00:00.000Z",
                  "updated_at": "2024-10-27T10:00:00.000Z"
                },
                {
                  "id": "task_id_2",
                  "description": "Task description 2",
                  "completed": true,
                  "created_at": "2024-10-26T10:00:00.000Z",
                  "updated_at": "2024-10-27T10:00:00.000Z"
                }
              ]
            },
            "authentication_required": false,
            "rate_limiting_applied": false
          },
          {
            "method": "GET",
            "path": "/:id",
            "purpose": "Get a specific task by ID.",
            "parameters": [
              {
                "name": "id",
                "type": "string",
                "description": "The ID of the task."
              }
            ],
            "response": {
              "status": 200,
              "description": "Task details.",
              "example": {
                "id": "task_id",
                "description": "Task description",
                "completed": false,
                "created_at": "2024-10-27T10:00:00.000Z",
                "updated_at": "2024-10-27T10:00:00.000Z"
              }
            },
            "authentication_required": false,
            "rate_limiting_applied": false
          },
          {
            "method": "PUT",
            "path": "/:id",
            "purpose": "Update a specific task by ID.",
            "parameters": [
              {
                "name": "id",
                "type": "string",
                "description": "The ID of the task."
              },
              {
                "name": "description",
                "type": "string",
                "description": "The updated task description."
              },
              {
                "name": "completed",
                "type": "boolean",
                "description": "The completion status of the task."
              }
            ],
            "response": {
              "status": 200,
              "description": "Task updated successfully.",
              "example": {
                "id": "task_id",
                "description": "Updated task description",
                "completed": true,
                "created_at": "2024-10-27T10:00:00.000Z",
                "updated_at": "2024-10-27T11:00:00.000Z"
              }
            },
            "authentication_required": false,
            "rate_limiting_applied": false
          },
          {
            "method": "DELETE",
            "path": "/:id",
            "purpose": "Delete a specific task by ID.",
            "parameters": [
              {
                "name": "id",
                "type": "string",
                "description": "The ID of the task."
              }
            ],
            "response": {
              "status": 204,
              "description": "Task deleted successfully."
            },
            "authentication_required": false,
            "rate_limiting_applied": false
          }
        ],
        "error_handling": "Centralized error handling middleware in the backend to catch and format errors consistently."
      },
      "security": {
        "authentication_method": "None",
        "authorization_strategy": "None",
        "data_encryption": {
          "at_rest": "Not applicable for this simple application.",
          "in_transit": "HTTPS is enforced by Heroku."
        },
        "security_measures": [
          {
            "category": "Input Validation",
            "implementation": "Validate all user inputs on the backend to prevent XSS and SQL injection attacks.",
            "mitigation": "XSS, SQL Injection",
            "priority": "High"
          },
          {
            "category": "Output Encoding",
            "implementation": "Encode all output data to prevent XSS attacks.",
            "mitigation": "XSS",
            "priority": "High"
          },
          {
            "category": "HTTPS",
            "implementation": "Enforce HTTPS for all communication.",
            "mitigation": "Data in transit protection",
            "priority": "High"
          }
        ],
        "vulnerability_mitigation_strategies": [
          "Input validation",
          "Output encoding",
          "Using HTTPS"
        ],
        "compliance_standards": []
      },
      "scalability_and_performance": {
        "frontend_optimization": "Code splitting, lazy loading of components, and image optimization.",
        "backend_optimization": "Efficient database queries, caching (if needed), and asynchronous operations.",
        "database_optimization": "Indexing on frequently queried fields."
      },
      "deployment_strategy": {
        "platform": "Heroku",
        "process": "Automated deployment using Heroku's CLI or GitHub integration.",
        "environment": "Production and development environments."
      },
      "monitoring_and_logging": {
        "logging": "Use a logging library (e.g., Winston) to log application events and errors. Log levels: error, warn, info, debug.",
        "monitoring": "Heroku provides built-in monitoring tools for application performance and resource usage."
      },
      "error_handling_strategy": "Centralized error handling middleware in the backend to catch and format errors consistently.  Return appropriate HTTP status codes and error messages.",
      "development_phases_overview": [
        {
          "name": "Phase 1: Setup and Basic Functionality",
          "description": "Setting up the development environment, creating the basic frontend and backend structure, and implementing the core functionality of adding and viewing tasks.",
          "priority": "High",
          "dependencies": [],
          "tasks": [
            "Set up React frontend.",
            "Set up Node.js/Express backend.",
            "Set up MongoDB database.",
            "Implement API endpoints for creating and retrieving tasks.",
            "Implement frontend components for adding and displaying tasks.",
            "Connect frontend to backend."
          ],
          "estimated_duration": "1 week"
        },
        {
          "name": "Phase 2: Enhancements and Testing",
          "description": "Adding features like task updates and deletion, implementing thorough testing, and addressing security considerations.",
          "priority": "High",
          "dependencies": [
            "Phase 1: Setup and Basic Functionality"
          ],
          "tasks": [
            "Implement API endpoints for updating and deleting tasks.",
            "Implement frontend components for updating and deleting tasks.",
            "Implement input validation and output encoding.",
            "Write unit and integration tests.",
            "Address security vulnerabilities."
          ],
          "estimated_duration": "1 week"
        },
        {
          "name": "Phase 3: Deployment and Refinement",
          "description": "Deploying the application to Heroku, refining the user interface, and addressing any performance or usability issues.",
          "priority": "Medium",
          "dependencies": [
            "Phase 2: Enhancements and Testing"
          ],
          "tasks": [
            "Deploy the application to Heroku.",
            "Refine the user interface.",
            "Optimize frontend and backend performance.",
            "Implement logging and monitoring.",
            "Address any remaining bugs or issues."
          ],
          "estimated_duration": "1 week"
        }
      ],
      "key_risks": [
        "XSS vulnerabilities due to improper input validation and output encoding.",
        "Performance issues due to inefficient database queries or unoptimized frontend code.",
        "Deployment issues due to incorrect configuration or Heroku platform limitations."
      ],
      "design_justification": "The design prioritizes simplicity and rapid development, aligning with the project's goals and constraints. The monolithic architecture, combined with the chosen tech stack, allows for quick implementation and deployment. Security measures are incorporated to mitigate potential vulnerabilities. The use of Heroku simplifies deployment and management.",
      "data_flow": "1. User interacts with the React frontend (e.g., enters a task description). 2. Frontend sends a POST request to the backend API (Express). 3. Backend API validates the input. 4. Backend API interacts with the MongoDB database to store the task. 5. Backend API sends a success response (with the new task data) to the frontend. 6. Frontend displays the new task in the task list. 7. When the user views the task list, the frontend sends a GET request to the backend API. 8. Backend API retrieves tasks from MongoDB. 9. Backend API sends the task data to the frontend. 10. Frontend displays the task list."
    },
    "implementation_plan": "plan=ImplementationPlan(project_summary={'title': 'Generated Project Plan', 'description': 'Develop a simple web application for managing a list of tasks, including adding, viewing, updating, and deleting tasks. The application will use React for the frontend, Node.js/Express for the backend, and MongoDB for the database. The application will be deployed to Heroku.', 'overall_complexity': 'Medium', 'estimated_duration': 'TBD', 'key_challenges': [], 'success_criteria': []}, phases=[{'name': 'Frontend Phase', 'description': 'Tasks related to frontend phase', 'deliverables': ['Completed FE-001', 'Completed FE-002', 'Completed FE-003', 'Completed FE-004', 'Completed FE-005', 'Completed FE-006', 'Completed FE-007', 'Completed FE-008', 'Completed FE-009', 'Completed FE-010', 'Completed FE-011'], 'estimated_duration_hours': 72.0, 'work_items': [{'id': 'FE-001', 'description': 'Set up React project with Create React App.', 'dependencies': [], 'estimated_time': '4 hours', 'agent_role': 'frontend_developer', 'acceptance_criteria': ['Project is initialized using Create React App.', 'Basic project structure is in place.', 'Project runs without errors.'], 'status': 'pending', 'code_files': ['package.json', 'src/App.js', 'src/index.js']}, {'id': 'FE-002', 'description': 'Create a basic TaskList component to display tasks.', 'dependencies': ['FE-001'], 'estimated_time': '4 hours', 'agent_role': 'frontend_developer', 'acceptance_criteria': ['TaskList component renders.', 'TaskList component accepts and displays a list of tasks (dummy data initially).', 'Task items are displayed in a list format.'], 'status': 'pending', 'code_files': ['src/components/TaskList.js']}, {'id': 'FE-003', 'description': 'Create a basic TaskForm component to add new tasks.', 'dependencies': ['FE-001'], 'estimated_time': '4 hours', 'agent_role': 'frontend_developer', 'acceptance_criteria': ['TaskForm component renders.', 'TaskForm component includes an input field for task description.', 'TaskForm component includes a button to submit the task.'], 'status': 'pending', 'code_files': ['src/components/TaskForm.js']}, {'id': 'FE-004', 'description': 'Implement state management for tasks in App.js.', 'dependencies': ['FE-002', 'FE-003'], 'estimated_time': '4 hours', 'agent_role': 'frontend_developer', 'acceptance_criteria': [\"Tasks are stored in the component's state.\", 'TaskList component receives the task list from the state.', 'TaskForm component updates the task list in the state when a new task is submitted (using dummy data for now).'], 'status': 'pending', 'code_files': ['src/App.js']}, {'id': 'FE-005', 'description': 'Connect frontend to backend API for creating tasks.', 'dependencies': ['FE-003', 'BE-003'], 'estimated_time': '8 hours', 'agent_role': 'frontend_developer', 'acceptance_criteria': ['TaskForm component makes a POST request to /api/tasks when the form is submitted.', 'The request includes the task description.', 'The frontend receives the new task data from the backend.', 'The task list in the frontend is updated with the new task.', 'Error handling for API request failures (e.g., display an error message).'], 'status': 'pending', 'code_files': ['src/components/TaskForm.js', 'src/App.js']}, {'id': 'FE-006', 'description': 'Connect frontend to backend API for retrieving tasks.', 'dependencies': ['FE-002', 'BE-004'], 'estimated_time': '8 hours', 'agent_role': 'frontend_developer', 'acceptance_criteria': ['TaskList component makes a GET request to /api/tasks when the component mounts.', 'The frontend receives the task list from the backend.', 'The task list is displayed in the TaskList component.', 'Error handling for API request failures (e.g., display an error message).'], 'status': 'pending', 'code_files': ['src/components/TaskList.js', 'src/App.js']}, {'id': 'FE-007', 'description': 'Implement functionality to update a task in the frontend.', 'dependencies': ['FE-002', 'BE-006'], 'estimated_time': '8 hours', 'agent_role': 'frontend_developer', 'acceptance_criteria': [\"Each task in the TaskList has an 'Edit' button.\", \"Clicking 'Edit' allows the user to modify the task description and completion status.\", 'The frontend makes a PUT request to /api/tasks/:id when the user saves the changes.', 'The frontend updates the task in the task list after a successful update.', 'Error handling for API request failures.'], 'status': 'pending', 'code_files': ['src/components/TaskList.js', 'src/App.js']}, {'id': 'FE-008', 'description': 'Implement functionality to delete a task in the frontend.', 'dependencies': ['FE-002', 'BE-007'], 'estimated_time': '8 hours', 'agent_role': 'frontend_developer', 'acceptance_criteria': [\"Each task in the TaskList has a 'Delete' button.\", \"Clicking 'Delete' prompts the user for confirmation.\", 'The frontend makes a DELETE request to /api/tasks/:id when the user confirms deletion.', 'The task is removed from the task list after a successful deletion.', 'Error handling for API request failures.'], 'status': 'pending', 'code_files': ['src/components/TaskList.js', 'src/App.js']}, {'id': 'FE-009', 'description': 'Implement basic styling for the application.', 'dependencies': ['FE-001', 'FE-002', 'FE-003', 'FE-004', 'FE-005', 'FE-006', 'FE-007', 'FE-008'], 'estimated_time': '8 hours', 'agent_role': 'frontend_developer', 'acceptance_criteria': ['The application has a consistent and visually appealing design.', 'Tasks are displayed in a readable format.', 'The form is styled appropriately.', 'Use CSS or a UI library (e.g., Material UI, Bootstrap).'], 'status': 'pending', 'code_files': ['src/App.css', 'src/components/TaskList.css', 'src/components/TaskForm.css']}, {'id': 'FE-010', 'description': 'Implement unit tests for frontend components.', 'dependencies': ['FE-002', 'FE-003', 'FE-004'], 'estimated_time': '8 hours', 'agent_role': 'frontend_developer', 'acceptance_criteria': ['Write unit tests for TaskList, TaskForm, and App components.', 'Tests cover component rendering, state updates, and event handling.', 'Use a testing library like Jest or React Testing Library.', 'Tests pass successfully.'], 'status': 'pending', 'code_files': ['src/components/TaskList.test.js', 'src/components/TaskForm.test.js', 'src/App.test.js']}, {'id': 'FE-011', 'description': 'Refine the user interface and improve usability.', 'dependencies': ['FE-009'], 'estimated_time': '8 hours', 'agent_role': 'frontend_developer', 'acceptance_criteria': ['Improve the visual design of the application.', 'Ensure the application is responsive and works well on different screen sizes.', 'Improve the user experience (e.g., clear error messages, loading indicators).', 'Test the application for usability.'], 'status': 'pending', 'code_files': ['src/App.css', 'src/components/TaskList.css', 'src/components/TaskForm.css']}]}, {'name': 'Backend Phase', 'description': 'Tasks related to backend phase', 'deliverables': ['Completed BE-001', 'Completed BE-002', 'Completed BE-003', 'Completed BE-004', 'Completed BE-005', 'Completed BE-006', 'Completed BE-007', 'Completed BE-008', 'Completed BE-009', 'Completed BE-010', 'Completed BE-011'], 'estimated_duration_hours': 64.0, 'work_items': [{'id': 'BE-001', 'description': 'Set up Node.js/Express project.', 'dependencies': [], 'estimated_time': '4 hours', 'agent_role': 'backend_developer', 'acceptance_criteria': ['Project is initialized with npm.', 'Express is installed.', 'Project runs without errors.', 'Basic server setup (listening on a port).'], 'status': 'pending', 'code_files': ['package.json', 'index.js']}, {'id': 'BE-002', 'description': 'Install and configure MongoDB and Mongoose.', 'dependencies': ['BE-001'], 'estimated_time': '4 hours', 'agent_role': 'backend_developer', 'acceptance_criteria': ['MongoDB is installed and running (locally or cloud).', 'Mongoose is installed.', 'Mongoose is connected to the MongoDB database.', 'A basic schema for tasks is defined (id, description, completed, createdAt, updatedAt).'], 'status': 'pending', 'code_files': ['index.js', 'models/Task.js']}, {'id': 'BE-003', 'description': 'Create API endpoint to create a new task (POST /api/tasks).', 'dependencies': ['BE-001', 'BE-002'], 'estimated_time': '8 hours', 'agent_role': 'backend_developer', 'acceptance_criteria': ['Endpoint handles POST requests to /api/tasks.', 'Endpoint receives a task description in the request body.', 'Endpoint validates the input (description is not empty).', 'Endpoint saves the task to the database.', 'Endpoint returns a 201 Created status code with the new task data in the response.', 'Error handling for invalid input and database errors.'], 'status': 'pending', 'code_files': ['index.js', 'routes/tasks.js']}, {'id': 'BE-004', 'description': 'Create API endpoint to get all tasks (GET /api/tasks).', 'dependencies': ['BE-001', 'BE-002'], 'estimated_time': '4 hours', 'agent_role': 'backend_developer', 'acceptance_criteria': ['Endpoint handles GET requests to /api/tasks.', 'Endpoint retrieves all tasks from the database.', 'Endpoint returns a 200 OK status code with the task list in the response.', 'Error handling for database errors.'], 'status': 'pending', 'code_files': ['index.js', 'routes/tasks.js']}, {'id': 'BE-005', 'description': 'Create API endpoint to get a specific task by ID (GET /api/tasks/:id).', 'dependencies': ['BE-001', 'BE-002'], 'estimated_time': '4 hours', 'agent_role': 'backend_developer', 'acceptance_criteria': ['Endpoint handles GET requests to /api/tasks/:id.', 'Endpoint retrieves a task from the database by ID.', 'Endpoint returns a 200 OK status code with the task data in the response if found.', 'Endpoint returns a 404 Not Found status code if the task is not found.', 'Error handling for database errors.'], 'status': 'pending', 'code_files': ['index.js', 'routes/tasks.js']}, {'id': 'BE-006', 'description': 'Create API endpoint to update a task (PUT /api/tasks/:id).', 'dependencies': ['BE-001', 'BE-002'], 'estimated_time': '8 hours', 'agent_role': 'backend_developer', 'acceptance_criteria': ['Endpoint handles PUT requests to /api/tasks/:id.', 'Endpoint receives the task ID in the URL and updated data in the request body (description, completed).', 'Endpoint validates the input.', 'Endpoint updates the task in the database.', 'Endpoint returns a 200 OK status code with the updated task data in the response.', 'Endpoint returns a 404 Not Found status code if the task is not found.', 'Error handling for invalid input and database errors.'], 'status': 'pending', 'code_files': ['index.js', 'routes/tasks.js']}, {'id': 'BE-007', 'description': 'Create API endpoint to delete a task (DELETE /api/tasks/:id).', 'dependencies': ['BE-001', 'BE-002'], 'estimated_time': '4 hours', 'agent_role': 'backend_developer', 'acceptance_criteria': ['Endpoint handles DELETE requests to /api/tasks/:id.', 'Endpoint receives the task ID in the URL.', 'Endpoint deletes the task from the database.', 'Endpoint returns a 204 No Content status code.', 'Endpoint returns a 404 Not Found status code if the task is not found.', 'Error handling for database errors.'], 'status': 'pending', 'code_files': ['index.js', 'routes/tasks.js']}, {'id': 'BE-008', 'description': 'Implement input validation on the backend.', 'dependencies': ['BE-003', 'BE-006'], 'estimated_time': '4 hours', 'agent_role': 'backend_developer', 'acceptance_criteria': ['Validate task description (e.g., not empty, length constraints).', 'Validate task ID (e.g., is a valid MongoDB ObjectId).', 'Return 400 Bad Request with appropriate error messages for invalid input.'], 'status': 'pending', 'code_files': ['routes/tasks.js', 'models/Task.js']}, {'id': 'BE-009', 'description': 'Implement output encoding on the backend.', 'dependencies': ['BE-003', 'BE-004', 'BE-005', 'BE-006'], 'estimated_time': '4 hours', 'agent_role': 'backend_developer', 'acceptance_criteria': ['Use a library or built-in functions to escape HTML characters in the task description before sending it to the frontend.', 'Ensure that the output is safe from XSS vulnerabilities.'], 'status': 'pending', 'code_files': ['routes/tasks.js']}, {'id': 'BE-010', 'description': 'Implement unit tests for backend API endpoints.', 'dependencies': ['BE-003', 'BE-004', 'BE-005', 'BE-006', 'BE-007'], 'estimated_time': '12 hours', 'agent_role': 'backend_developer', 'acceptance_criteria': ['Write unit tests for all API endpoints (POST, GET, PUT, DELETE).', 'Tests cover request validation, database interactions, and response codes.', 'Use a testing library like Jest or Mocha with Supertest.', 'Tests pass successfully.'], 'status': 'pending', 'code_files': ['tests/tasks.test.js']}, {'id': 'BE-011', 'description': 'Implement logging and error handling.', 'dependencies': ['BE-001', 'BE-003', 'BE-004', 'BE-005', 'BE-006', 'BE-007'], 'estimated_time': '8 hours', 'agent_role': 'backend_developer', 'acceptance_criteria': ['Use a logging library (e.g., Winston) to log application events and errors.', 'Log errors with appropriate severity levels (error, warn, info, debug).', 'Implement centralized error handling middleware to catch and format errors consistently.', 'Return appropriate HTTP status codes and error messages.'], 'status': 'pending', 'code_files': ['index.js', 'routes/tasks.js']}]}, {'name': 'Deployment Phase', 'description': 'Tasks related to deployment phase', 'deliverables': ['Completed DE-001'], 'estimated_duration_hours': 8.0, 'work_items': [{'id': 'DE-001', 'description': 'Deploy the application to Heroku.', 'dependencies': ['FE-008', 'BE-007'], 'estimated_time': '8 hours', 'agent_role': 'deployment_specialist', 'acceptance_criteria': ['Create a Heroku account and set up the Heroku CLI.', 'Configure the application for deployment (Procfile, build scripts).', 'Deploy the frontend and backend to Heroku.', 'Verify that the application is accessible and functional on Heroku.', 'Configure MongoDB Atlas connection.'], 'status': 'pending', 'code_files': ['Procfile', 'package.json']}]}], resource_allocation=[{'role': 'Deployment Specialist', 'count': 1, 'estimated_time_allocation': '100%', 'phases': ['Deployment Phase'], 'skills_required': []}, {'role': 'Backend Developer', 'count': 1, 'estimated_time_allocation': '100%', 'phases': ['Backend Phase'], 'skills_required': []}, {'role': 'Frontend Developer', 'count': 1, 'estimated_time_allocation': '100%', 'phases': ['Frontend Phase'], 'skills_required': []}], risks_and_mitigations=[], timeline={'start_date': '2025-07-08T18:22:16.396144', 'end_date': 'TBD', 'milestones': []}, tech_stack={}, metadata={'generated_at': '2025-07-08T18:22:16.396144', 'version': '1.0', 'author': 'Multi-AI Dev System', 'tags': [], 'notes': 'Converted from WorkItemBacklog. Original summary: Develop a simple web application for managing a list of tasks, including adding, viewing, updating, and deleting tasks. The application will use React for the frontend, Node.js/Express for the backend, and MongoDB for the database. The application will be deployed to Heroku.'}) summary='Develop a simple web application for managing a list of tasks, including adding, viewing, updating, and deleting tasks. The application will use React for the frontend, Node.js/Express for the backend, and MongoDB for the database. The application will be deployed to Heroku.' metadata=PlanMetadata(generated_at='2025-07-08T18:22:16.396144', version='1.0', author='Multi-AI Dev System', tags=[], notes='Converted from WorkItemBacklog. Original summary: Develop a simple web application for managing a list of tasks, including adding, viewing, updating, and deleting tasks. The application will use React for the frontend, Node.js/Express for the backend, and MongoDB for the database. The application will be deployed to Heroku.')"
  }
}